unique_id,post_heading,link_url,post_url,publish_time,post_age,post_content,top_comments,upvotes,comments,timestamp,tag,upvotes_growth_rate,comments_growth_rate
1g4x3sn,Liam Lawsons High School ,https://i.redd.it/kmqacca3t3vd1.jpeg,https://www.reddit.com/r/formula1/comments/1g4x3sn/liam_lawsons_high_school/,2024-10-16,0 days,,"['To think his dream when he was like 5 was to race for ORACLE Red Bull Racing like he knew what the sponsor would be', 'Maybe they know something we don’t', 'What have I missed? When did he replace Max or Checo?\n\nIncoming message from Liam :\n\n“I understand that, without my agreement, Pukekohe High School have put out a press release late this afternoon that I am driving for Oracle Red Bull Racing F1 team this year. This is wrong and I have not signed a contract with Oracle Red Bull Racing F1 team for 2024. I will not be driving for Oracle Red Bull Racing F1 team this year.”', 'Although this is a mess of a well done, always cool to see a non private school on the grid. You gotta love schools with a 3 star Google review. School reviews are always worth a read and this has some funny ones.', 'almost', 'You’d think a school representative would know the difference between alumni and alumnus.', ""They didn't wanna put Vcarb.\n\nEdit, great name for a highschool."", 'Liam replacing Max confirmed.', 'Inb4 Perez’a camp releases a statement of denial', 'One alumnus, two (or more) alumni.']",11070,240,2024-10-17 07:21:54, Social Media,101,2
1g5027a,Valtteri Bottas: The Lone non-Champion to conquer Austin,https://www.reddit.com/gallery/1g5027a,https://www.reddit.com/r/formula1/comments/1g5027a/valtteri_bottas_the_lone_nonchampion_to_conquer/,2024-10-16,0 days,,"['His 2019 win was overshadowed by Hamilton wrapping up title #6. Super unfortunate, given he beat Hamilton at his own game there, on merit. His finest win, imo.', 'Non-Champion *yet*', 'So what track has the most races that have only been won by champions?', 'Valtteri was so comfortable with the car in that race, not a single error.', 'This was a great performance and win for Bottas, but it was too late as Hamilton win the title\n\nThe Ferrari was just bad in this track\n\nKvyat would made a driver error which would cost him point(He was crossing the line in 10th, but was given a 5 second penalty for collide with Perez)\n\nBad day for Vettel and Gasly.', 'Bottas still holding out for multi year deal?', 'I miss old version of bro', 'I was at this race. Great time, Lewis clinched that day', ""Instead he's the champion of our hearts.""]",2039,75,2024-10-17 07:21:55, Statistics,74,1
1g5aoki,Renault boss calls for F1 to abandon hybrid engine formula,https://speedcafe.com/renault-boss-calls-for-f1-to-abandon-hybrid-engine-formula/,https://www.reddit.com/r/formula1/comments/1g5aoki/renault_boss_calls_for_f1_to_abandon_hybrid/,2024-10-16,0 days,,"[""Couldn't make the engine they wanted so badly work.."", ""Not sure how he can complain that they're not seeing an impact in car sales from having an F1 team, when Renault currently offer zero performance vehicles in their portfolio.\n\nAlpine have the A110, a great little car, but relatively expensive for a small 4 cylinder coupe, and quite niche. There's a performance Alpine version of the new electric Renault 5 coming imminently.... And that's it.\n\nNoone will associate your performance cars with your F1 team if you don't make any performance cars in the first place!"", 'I’m fully behind anything that makes the cars lighter and smaller', ""Never liked the V6 turbo hybrids anyways. But still, didn't Renault campaign for that engine in the first place?"", ""It seems strange for someone to publish an article entirely based on an interview for another medium (L'équipe). They could at least put in a link to the original interview or something."", 'MY BROTHERS IN CHRIST, YOU ASKED FOR THE FUCKING HOOVERS', ""Well... You're leaving F1 as an engine manufacturer. Does your opinion really matter?"", 'These were the regs Renault shaped. Pretending to be shocked that F1 regs became too expensive for a global car brand is a fun amount of nonsence after decades of experience...', ' Bring back v10s!']",1685,269,2024-10-17 07:21:57, News,162,13
1g597f4,FIA acts for US GP on suspicions over front bib parc ferme trick,https://www.motorsport.com/f1/news/fia-acts-for-us-gp-on-suspicions-over-front-bib-parc-ferme-trick/10663272/,https://www.reddit.com/r/formula1/comments/1g597f4/fia_acts_for_us_gp_on_suspicions_over_front_bib/,2024-10-16,0 days,,"['Can\'t wait for one of the big 4 to drop massively in performance then say ""it has nothing to do with it""', ""The FIA doesn't act this quick on vague suspicions, usually.\n\nWell, at least this didn't come in the middle of the break."", ""From the article, I take it there's a known culprit. \n\nThey refer to the complaint coming from other teams who have inspected the car design documents which are open to all other teams to inspect. \n\nSo it's not a suspicion, its come direct from examining the documents. \n\nFurther, the FIA says they will place a seal over the area in concern (the internal cockpit adjusting device I guess, since ride height isn't really sealable) which makes it sound like the FIA know exactly what they're referring to and looking at.\n\nThe reference to 'no evidence it's been used' is a red Herring and usual language. The device is obviously able to and could be used in that way hence the fast action - they just don't care about trying to prove past infringement"", 'I wonder which team they suspect.', 'I’m going to make a prediction here. I think it’s Williams.\xa0\n\nMy logic is the Williams floor upgrade at zandvoort has done something interesting in the data. Their quali pace has gone up and their race pace has gone up but their strengths in race seem a bit different than practice data.\xa0', 'Plot twist; it’s Sauber and they get worse.', 'Goddammit Sauber, quit cheating!', '“Looks like cheating is back on the menu, boys!”']",1614,352,2024-10-17 07:21:59, News,93,15
1g52cdc,[@F1] This lap has its own fanbase,https://dubz.link/c/f15904,https://www.reddit.com/r/formula1/comments/1g52cdc/f1_this_lap_has_its_own_fanbase/,2024-10-16,0 days,,"['https://youtu.be/qI7Np7076B0', 'I liked the edit that goes from this to Verstappen at stormy Brazil Quali, perfect summation of 2022 and a little foreshadowing of 2023.', 'Such a proper racetrack. Absolutely beautiful scenery. It makes me hate street circuits even more. This is racing.', 'Funny how watching in the archive neither SKY nor F1tv commentary seemed interested in the lap. just a standard FP2 wrapping up. One talented fan with amazing montage and one year later this lap is considered one of the best visuals in f1 history\xa0', 'I’m one of the fans.', 'This and Verstappen Brazil 2023 lap complement each other very nicely.\n\nI think broadcast should be looking for more similar shots.', 'The with top gun music is better in my opinion. Great footage whatever soundtrack though', 'RAAAAHkets red glare bitches 🦅💥💥🇺🇸🇺🇸💥🇺🇸🦅🦅🦅💥🇺🇸🦅🦅', ""This lap and Max's storm lap in Brazil are just really excellent cinema.  So good. So beautiful."", 'Would have been perfect hearing the car and nothing else']",1079,67,2024-10-17 07:22:00, Video,39,0
1g4ufh8,"Amidst growing pressure on Sergio Perez, Christian Horner says Red Bull ""cannot afford"" huge gap between drivers in 2025",https://www.motorsport.com/f1/news/red-bull-cannot-afford-big-gap-between-drivers-in-2025-as-pressure-grows-on-perez/10662813/,https://www.reddit.com/r/formula1/comments/1g4ufh8/amidst_growing_pressure_on_sergio_perez_christian/,2024-10-16,0 days,,"['Another race week, another article about growing pressure on Perez. This cow should not have any more milk by now.', 'CH - ""I don\'t want a huge gap between drivers""\n\n\\*monkey\'s paw tightens\\*\n\nMax leaves immediately.', 'if horner keeps talking like this perez might just get another 10 year extension', ""It's still unfathomable that ~~RedBull~~ Horner, especially having just axed Danny Ric, can't find it within himself to let their poor performer go and be comfortable losing this years WCC.. just because car may have been shit for a few races but their driver has been shit as well.\n\nJust bizarre."", 'I guess every time Horner throws shade at Perez, Slim throws a million dollars at him.', ""$omehow I $en$e $ergio'$ $eat i$ $afe."", 'For once I agree with Horner. They should fire Verstappen and have two drivers at Perez’s level.', '...which is why red bull is pleased to announce a 10 year contract extension for Sergio Perez.', 'Miss the days when RBR was completely ruthless. Dietrich wouldn\'t have had this shit go on for this long, most likely.\n\n\n""Oh, but who could perform better?"" There\'s not many who could perform WORSE, and they wouldn\'t become a bottleneck blocking a seat from prospects that could be better.']",941,177,2024-10-17 07:22:01, News,14,3
1g4z8ir,Mick Schumacher as a ‘good joker’ in Audi's time game,https://lomazoma.com/mick-schumacher-als-guter-joker-im-zeitspiel-von-audi/,https://www.reddit.com/r/formula1/comments/1g4z8ir/mick_schumacher_as_a_good_joker_in_audis_time_game/,2024-10-16,0 days,,"['I think Mick Schumacher might have the most column inches relative to points scored in F1.', 'We cannot go 1 month without a Mich return article.', 'What a confusing title', ""I think ultimately Bottas will settle for a smaller fee to show what he can do vs Hulk in whatever shape Audi is, which, we can probably assume isn't great, for a chance at a different car later. However, also have to wonder how much he wants to keep racing with his new found hobbies over the years or if he and his gf get married and start a family.\n\nI'd love to see Bottas in Audi but would also love for Mick to get another shot. I'm not holding my breath though, even if Bottas doesn't agree to whatever fee I wouldn't be shocked if a pay driver came in and threw money at Audi for a year. So I don't think this is a realistic chance, unfortunately."", 'I DON’T CARE', ""> ‘An overpriced driver Bottas, who will certainly not be a winning driver\n\n* Toto Wolff is Mick Schumacher's manager\n* Toto Wolff gave a Mercedes drive to Bottas, who won 10 races\n* Toto Will did not give a Mercedes drive to Mick Schumacher\n\nDraw your own conclusions"", 'Mick snoozemacher next article please', 'For fuck\'s sake fucking stop it already. The media has made me hate the name ""Schumacher"".', ""I think Mick did well to make it to F1 without just relying on his name to get there, but obviously he couldn't prevent some special treatment no matter what.. \n\nHowever at this point it just seems to be all about his name because I can't think of a good reason why Mick should be seriously considered over any other driver or rookie, and whilst I don't think anyone would have shined in that Haas, there also weren't any real indications of there being a lot more in there.""]",930,146,2024-10-17 07:22:02, News,14,0
1g55ue0,[F1GuyDan] Lewis Hamilton & Max Verstappen in COTA,https://i.redd.it/x97jjv8jr5vd1.jpeg,https://www.reddit.com/r/formula1/comments/1g55ue0/f1guydan_lewis_hamilton_max_verstappen_in_cota/,2024-10-16,0 days,,"['2021 was an absolute nailbiter', '4th in a Toro Rosso is a great result.', 'Any more doubters on the best 2 drivers from the last 10 years? Speak now or forever hold your peace.', 'COTA has to be a top 3 Hamiltons track. His results are so consistent and he’s only been beaten by a teammate once (Bottas 2019). \n\nTo put it in perspective his teams mates results since 2012 have been (5,9,2,2,2,5,5,1,6,5,5). Amazing when you consider his teammates have been Button, Rosberg, Bottas and Russell.', 'Sensing a pattern with the last 3 seasons', '2015 COTA was quite the spectacle.', 'Oo', 'the goats', 'Top 5 or nothing']",933,100,2024-10-17 07:22:03, Statistics,45,5
1g4zmsh,First taste of success for F1's greatest drivers,https://i.redd.it/zpp7m9ieg4vd1.jpeg,https://www.reddit.com/r/formula1/comments/1g4zmsh/first_taste_of_success_for_f1s_greatest_drivers/,2024-10-16,0 days,A look at where F1's top drivers got their start and first taste of success ,"['vettel winning for toro rosso will forever be epic', 'Hamilton and Stewart the only two on this list to win on their debut years.', 'The JORDAN logo looks like the title/logo of a late 80s early 90s teen sitcom.', 'Christ Verstappen is on 61 wins already 😳.', 'It’s surprising to see Ferrari so underrepresented on this list - even in the first wins column.\n\nLotus are in there four times, McLaren are on there three times and even Renault and Toro Rosso are on there more times and with more drivers than Ferrari.\n\nThat’s despite Ferrari being in F1 for so much longer than any of those other teams. They’ve been on the grid for every single era that those other teams have been active, even though the likes of Lotus fell away decades ago and Toro Rosso were only about for a decade and a half.', 'To think that Senna almost won with that Toleman...', 'Gotta love prosts first win being in France, in a French car. \n\nNothing more special than winning your home race as your first win, doubly so in a car from the same nation.', 'Interesting to note is all of them got their first win within their first 3 seasons.', 'I wish Nico Rosberg would have raced for longer, he could have easily surpassed people like Ayrton Senna and Fernando Alonso. Dude was one hell of a driver.']",707,68,2024-10-17 07:22:04, Statistics,19,2
1g4tuaq,[Scuderia Ferrari] Wishing Charles Leclerc a massive happy birthday,https://i.redd.it/fkftpyv6n2vd1.jpeg,https://www.reddit.com/r/formula1/comments/1g4tuaq/scuderia_ferrari_wishing_charles_leclerc_a/,2024-10-16,0 days,,"['Hope he has a great birthday! Thinking of some of the amazing moments he had this year, like winning Monaco, and Monza for the second time, and hoping for many more joys to come. Such a skilled driver with lots of heart, and a genuinely kind person too.', 'We’ve had some incredible highs and incredible lows this year, but with Monaco and Monza locked in it’ll be a year to remember, I hope he enjoys his birthday!', 'He will bring us the 16th title', 'What is massive about the wish?', '27', '6 more hours and my first born would have shared a birthday, I’m not mad I’m just disappointed', '(Next year™)', 'The hopium']",435,10,2024-10-17 07:22:04, Social Media,8,1
1g4whml,Verstappen's Button slump parallel has a key difference,https://www.the-race.com/formula-1/max-verstappen-jenson-button-slump-parallel-key-difference/,https://www.reddit.com/r/formula1/comments/1g4whml/verstappens_button_slump_parallel_has_a_key/,2024-10-16,0 days,,"[""This a great read, but I'd recommend listening to the whole podcast that a lot of this is taken from.\n\n2009 was a weird year. Some of those quotes on Jenson are quite damning, and having just finished the Brawn GP documentary on Disney +, it did appear that a lot of his problems were psychological which sent him on a spiral.\n\nThe fact that he only finished on the podium once post-Turkey is quite the statistic.\n\nFor Max, he's been brilliant at maximising his opportunities. I do think his most impressive drive of the year was actually one he didn't win, which was Silverstone. Misses out on the win by a second or so despite driving the third fastest car. It was a masterclass from both team and driver."", 'i never went to look at the 2009 season but the quotes on jenson’s mental state is quite surprising was it really that bad?', 'Thank god the break is almost over.', 'They really are comparing Max to Button and Lando to Vettel 💀', 'Verstappen has a button in his car that parallel parks it?\n\n\nTook me a few seconds to parse what the heck it waa trying to say. What a cursed title. So confusing.', 'If Jenson was fighting Lando instead of Vettel he would have lost the title...', 'There’s a brawn GP doc on Disney?? How was it?', 'There is a hilarious bit in Ross Brawns book where he describes Button coming up to him just before the final race.\n\nButton tells him that he will give it his all in this race to win the championship and Brawn is thinking to himself why tf were you not giving it your 100% all this time lol.']",438,102,2024-10-17 07:22:05, News,21,1
1g503w3,Austin’s Ironmen: The Top 3 Drivers with the Most Laps at COTA (Lewis Hamilton with 100%),https://i.redd.it/auw7f2e6k4vd1.png,https://www.reddit.com/r/formula1/comments/1g503w3/austins_ironmen_the_top_3_drivers_with_the_most/,2024-10-16,0 days,,"[""Wonder how many Ric would have if his car didn't breakdown all the time.\n\nI ran into him at a bar after the 2018 USGP and he was super nice. He gave me a fist bump with his left hand because his right hand was all bruised up from, as he put it, being a bit upset from his car failure during the race. His reliability those years was atrocious."", ""Slightly off-topic, that picture is so easily identifiable as Monaco 2016 because it's literally the only scene where Ricciardo isn't smiling lmao"", 'W-w-hy is there an RB16B behind them?', 'Do we count his DSQ in this chart?', 'Riccardo was a very good looking man in his prime.', ""what's Alonso %? also thought Kimi would be there"", 'Without the 2017 and 2018 DNFs he would have been 1 lap shy of 100%.', 'just out of curiosity - what bar?', 'I did the research and his 2023 laps are considered as raced by statsf1 and f1db; he only lost the points from the placement.']",241,11,2024-10-17 07:22:05, Statistics,7,0
1g54mhm,"[@F1] Lewis has claimed the most pole positions at COTA, and only two other drivers have taken pole multiple times.",https://i.redd.it/ccn6cq2gi5vd1.jpeg,https://www.reddit.com/r/formula1/comments/1g54mhm/f1_lewis_has_claimed_the_most_pole_positions_at/,2024-10-16,0 days,https://x.com/F1/status/1846599486157606956?t=W46RKbpQGRKdIe7N4ouAog&s=19,"[""Mad to think he hasn't had a pole at COTA since 2018 and he's still got more poles and wins at the US GP than anyone else"", 'We will likely have a new pole position holder in cota this year. 50% Norris IMO. But I wont be surprise if Max magically pulls a surprise lap. Merc also did decently last year. Lewis/George may also have a chance(depends on the track temp)', 'Feels like he should have more than 3. Crazy how great he is at this track.', 'Monaco based Youtuber something something lol\n\nFor real tho, 2015 was a banger. Nico giving Lewis attitude was my only solace of hope as a Ferrari fan in those times lmao', 'Leclerc, Sainz, Max have fewer years than Lewis has had them, not a fair comparison imo', 'If their new floor upgrades work and bring them closer I think Lewis can snag another one', 'imo qualifying might be Mcl>>RBR>=Merc>Ferrari. But many of those will bring new upgrades here. So it could be completely wrong.', 'I think Ferrari will be up there with Rbr and Merc. Mcl will be in front of them by a 1-2 tenths', ""Yeah a lot of my thoughts on how it's gonna go are more or less banking on McLaren's relative inexperience being back at the front."", 'I doubt the qualifying of SF-24. Race pace may be paired with RBR and Merc, qualifying Not. Ferrari also doesn’t like high speed corners, those are supposed to be the strength of RBR.']",228,11,2024-10-17 07:22:05, Social Media,18,0
1g4u500,[Giuliano Duchessa] I think it is important for Ferrari to check on a severe track what the Monza package and the Singapore wing are giving. I do not expect significant new parts apart from minor adjustments (upper flap for downforce). I do not expect Serra on track for this triple header.,https://x.com/GiulyDuchessa/status/1846452178598121504,https://www.reddit.com/r/formula1/comments/1g4u500/giuliano_duchessa_i_think_it_is_important_for/,2024-10-16,0 days,,"[""What I'm getting from the tone of this tweet is that he doesn't know for sure yet. They're being more tight lipped than usual, Duchessa is usually pretty well informed"", 'Why would Serra be at track? I thought his job is more at factory side of things?', 'To be fair it would be quite surprising if Ferrari has anything major left to bring this season.\n\nIf you look at the timeline, the Imola package was quite significant. Then they brought a new floor which threw them off balance for a while.\n\nThen they had some temporary fixes inbetween while trying to understand the root cause and finally brought quite a significant change for Monza.\n\nIt might not have looked as such, but the underfloor was almost entirely different.\n\nAnd in Singapore they brought the more loaded front wing (but also more flexible, like McLaren), something they had been working on ever since asking FIA clarification regarding McLaren’s front wing flex.\n\nAfter all that, it’s unrealistic to expect another significant upgrade. The surface aero has remained relatively unchanged which shows they’re happy with it and as for the floor, more than 3 big changes in one season is a bit too much.\n\nThey’re also limited somewhat by their suspension (not confirmed, but there are words going around they are looking to change it for 2025), as well as the inherent problems with tire warmup that this platform was developed on.\n\nI would be very surprised if Ferrari manages to bring another huge upgrade this season, considering all what I said + budget cap and wind tunnel hours which at this point might be more usefully spent on trialing 2025 ideas.', 'In theory, for COTA and Mexico, Ferrari should bring the last big development package for the SF-24. I repeat, in theory.  \n\nThat said, Duchessa and its team have been incredibly unreliable this year.']",220,5,2024-10-17 07:22:05, News,1,0
1g5401t,"[F1] ‘It was just pure relief’ – Lawson on his ‘rollercoaster’ 2024, replacing ‘great guy’ Ricciardo and his Red Bull goal",https://www.formula1.com/en/latest/article.exclusive-it-was-just-pure-relief-lawson-on-his-rollercoaster-2024-replacing.5zBVZqcI6ahQJh6FBWE4Z.html,https://www.reddit.com/r/formula1/comments/1g5401t/f1_it_was_just_pure_relief_lawson_on_his/,2024-10-16,0 days,,"['Nice to see that Lawson and Ricciardo were still able to remain friendly despite the Red Bull shenanigans.', ""No reason to get angry with other because the car is a truck, what's there to fight over?"", 'Is there any actual animosity between drivers from those teams? Even with them fighting for the same seat and their fan bases coming at each other’s throats, Daniel and Checo seem to get along pretty well. They all also seem to like Yuki. Max and Daniel we already know. Liam hasn’t been there long but he seems like a nice guy so he’ll probably fit in as well.', 'It is, same as it was between Ric and Oscar, no trace of animosity, and actually quite a bit of support and respect. ANZAC coalition (koala-ition?)', ""I'm sure Daniel isn't someone to hold a grudge against a guy for just breathing."", 'There are El Caminos in F1?', ""Max and Carlos didn't have the healthiest relationship but they both seemed to have matured past it"", 'Last time we had any sort of tense conflict as far as I know would be Vettel-Webber.', 'I mean, there\'s the classic Hulkenberg and Magnusen ""suck my balls"", but they seem to have moved well past that. Maybe the closest we get now to driver beef are the snide remarks about Stroll (ala piastri in the post race interview)']",114,10,2024-10-17 07:22:06, News,5,0
1g5irjl,"[F1] Oscar Piastri’s race engineer, and olympic silver medalist, Tom Stallard is this week’s guest in Beyond the Grid",https://i.redd.it/pjno4vf6v8vd1.jpeg,https://www.reddit.com/r/formula1/comments/1g5irjl/f1_oscar_piastris_race_engineer_and_olympic/,2024-10-17,0 days,,"['Wait, Olympic medalist?', ""I want a Piastri championship so fucking badly\n\n(Yes, I'm aussie, why do you ask?)"", 'Sounds a lot like Michael back in the day. He too knew everyone by name and their birthdays and stuff', 'Bare minimum of being in a team is to know the names of the people you’re working with. It would be a surprise if any of these drivers didn’t know the names of the people they work with.', ""Yep, he's a silver medalist in rowing from the [2008 Olympics. ](https://olympics.com/en/olympic-games/beijing-2008/results/rowing/eight-with-coxswain-8-men)"", 'https://youtu.be/mFAgTTgfQ2M?si=euBUDfPahzS5CUMN', 'Are you Aussie? I ask because you want Piastri to win a championship so fucking bad', 'You must be ecstatic at work then when you get a birthday card and it’s signed by your manager.', 'The names of the people you\'re working with, yes. Best numbers I can find in a little bit of googling puts McLaren around 800 people.\n\nYou\'d expect a driver to know the team principal, the names of everyone on their pit crew, their race engineer, their media handler, etc.\n\nYou *wouldn\'t* expect a driver to know, say, the new junior aerodynamicist they have doing the grunt work correlating race data with CFD and wind tunnel results likes pineapple on their pizza, or that Alexander down in accounting prefers ""Lex"" to ""Al"", ""Alex"", or ""Xander"".\n\nThis quote strongly suggests that Piastri is more the sort to go the extra mile to know people on the team that he has no reason to know.', 'Engineer who rows are Olympic level. Must be a Cambridge graduate.']",118,12,2024-10-17 07:22:06, Social Media,50,5
