unique_id,post_heading,link_url,post_url,publish_time,post_age,post_content,top_comments,upvotes,comments,timestamp,tag,upvotes_growth_rate,comments_growth_rate
1gdfihs,Driven by Respect: The FIA sets new standards with the launch of their new Safeguarding Policy and Regulations which will come into effect in 2026,https://www.fia.com/news/driven-respect-fia-sets-new-standards-safeguarding,https://www.reddit.com/r/formula1/comments/1gdfihs/driven_by_respect_the_fia_sets_new_standards_with/,2024-10-27,0 days,,"['Driven by money.', 'Has there been some massive scandal where some little person was being punched down by a high level personality?', '*3 hours before a race is a great time to post about FIA regulations...*       \n\nI realise this is a few days old but I feel it is important to know about given the severity of what it deals with.\n\nAnyway, the scope of the Safeguarding policy is:\n\n>This Safeguarding Policy shall apply to all *Covered Persons* during *Covered Events.*\n\nFor those wondering what a *Covered Event* is:     \n\n* **Covered Event:** FIA World Championships, the FIA Motorsport Games, and any FIA-sanctioned or organised meetings (i.e., FIA Conference Week, FIA Congress, FIA Prize-giving Ceremony, etc.). \n\nAnd for those wondering who counts as a *Covered Person*:      \n\n* **Covered Person:** Any natural person(s) who participates in, assists in, is involved in a Covered Event, which includes any natural person(s) belonging to one of the following categories:        \n  - a) Driver, meaning any driver or passenger (including navigator and co-driver), as defined in Article ‘Definitions’ of the ISC, who participates in Competitions;        \n  - b) Driver Support personnel, meaning any coach, trainer, manager, agent, engineer, mechanics, team staff, official, medical, paramedical personnel, parent or any other person working with, treating or assisting a driver participating in or preparing for a Competition;        \n  - c) Official, as defined under Appendix V of the ISC;         \n  - d) Staff member of the FIA or of any ASN, or of any member or affiliate organisation of any ASN (including any clubs, teams, associations or leagues);         \n  - e) Member officials, meaning all members of the councils and/or executive bodies, committees and commissions who act, or are entitled to act, for or on behalf of the FIA or any ASN, or of any member or affiliate organisation of any ASN (including any clubs, teams, associations or leagues), including without limitation, staff, consultants, agents and advisors;        \n  - f) Volunteers of the FIA or of any ASN, or of any member or affiliate organisation of any ASN (including any clubs, teams, associations or leagues);         \n  - g) Any other person who is or has been accredited to attend or participate in Competitions.\n\nAnd what counts as a breach of the Safeguarding policy? \n\n> The following Prohibited Conducts constitute a breach of the Safeguarding Policy:\n\n* 1.1 Psychological abuse;\n\n* 1.2 Physical abuse;\n\n* 1.3 Sexual harassment;\n\n* 1.4 Sexual abuse;\n\n* 1.5 Neglect;\n\n* 1.6 Engaging, or attempting or threatening to engage, in conduct that directly harms the physical and/or mental welfare and/or safety of a Covered Person;\n\n* 1.7 Posing a risk of harm to the physical and/or mental welfare and/or safety of a Covered Person;\n\n* 1.8 Complicity by assisting, encouraging, aiding, abetting, conspiring to engage in or concealing any violation of the Safeguarding Policy;\n\n* 1.9 Retaliation in relation to actions, investigations or proceedings pursuant to the Safeguarding Policy; \n\n* 1.10 Failure to cooperate in relation to actions, investigation, or proceedings pursuant to the Safeguarding Policy.', ""They start in 2026 so it doesn't matter when they announce..."", ""So basically 'you-can't-say-fuck' times 11."", 'To be fair, that is just the title and what the FIA state in their article. The policy is in fact different.        \n\nFor Covered Events the Safeguarding Policy actually takes effect immediately upon its adoption and publication on the FIA website. So it does in fact cover the Mexican GP and the FIA Motorsport Games currently happening.\n\nThe 1st January 2026 start point is for other events referred to in the policy such as International & National Competitions which falls under the jurisdiction of individual ASNs.']",5,8,2024-10-27 17:20:20, News,5,8
1gde11u,Mexico want F1 ext. regardless of Perez future,https://www.espn.com/f1/story/_/id/42015665/mexico-want-f1-extension-regardless-sergio-perez-future%C2%A0,https://www.reddit.com/r/formula1/comments/1gde11u/mexico_want_f1_ext_regardless_of_perez_future/,2024-10-27,0 days,,"['I totally read that as *""Exit""*, not short form of *""Extension""*', 'Why are we abbreviating extension? I thought it said exit.', 'Worlds worst abbreviated title', 'The track is one of the best in terms of atmosphere, but since Mexico returned there hasn’t been a memorable race, they have been all mid.\n\nThe track itself doesn’t help, specially that hideous 3rd sector', ""Exit?? I'm so confused lol"", 'I like the Mexico GP. I’m American, but my entire family is from Mexico. It feels more like a home race to me than Miami, COTA, and Vegas.', 'COTA, Mexico, Brazil is my favorite part of the calendar.', '""Regardless of""\n\nSo something is going on', 'Lame klick bait']",0,40,2024-10-27 17:20:20, News,-2,12
1gcu65w,F1 has an unresolvable stewarding flaw,https://www.the-race.com/formula-1/mclaren-failed-review-exposes-unresolvable-f1-stewarding-flaw/,https://www.reddit.com/r/formula1/comments/1gcu65w/f1_has_an_unresolvable_stewarding_flaw/,2024-10-26,0 days,,"[""Personally, I think quick decisions should be the default. I don't want to have the real result 2 hours after the race.\n\nIs hearing the drivers and especially teams actually necessary? In many other sports you don't argue your case, it's the referee who decides.\n\nPersonally, I'm all for immediate decisions for most cases compared to having drivers and teams argue the penalties."", '>We’ve tried nothing and we’re out of ideas', 'This is actually a good piece. Not surprised it is by Edd Straw', '> it highlights a problem with the process: McLaren, both as a team and, in the form of Norris, as a driver, wasn’t in the room to argue its case.\n\nHow about we drop this silly idea that the players should argue with the referees over penalties?', ""In football, if you get a card, it's not going to be undone afterwards, regardless of whether you deserved it or not. I think it's a feature, not a flaw."", 'My lord the English F1 media sure are out in force aren’t they', ""You don't need to argue your case when the stewards have the evidence they need to make a decision.\n\nThis reeks of British media crying about Max coming out on top against a British driver. Nothing new, they did it with Fernando, they did it with Seb, they're doing it with Max.""]",0,28,2024-10-27 17:20:20, News,0,0
1gda73t,"Serious question, please ELI5, how does Checo have a seat?",https://www.reddit.com/r/formula1/comments/1gda73t/serious_question_please_eli5_how_does_checo_have/,https://www.reddit.com/r/formula1/comments/1gda73t/serious_question_please_eli5_how_does_checo_have/,2024-10-27,0 days,"I feel like I don’t even need to elaborate as to why I ask at this point. 
I know folks talk about sponsorships and merch because of Checo, and maybe some talk of a good number 2 who won’t cramp Max’s style. 
That being said. 
How does all this equate to making it worthwhile keeping him? Losing constructor championship is huge and completely on Checo. 


Edit: Thank you all for your thoughts and theories on this beyond “it’s just the money”. Helps me understand the complexity here. I appreciate it","['Money\xa0', 'In addition to all the great other points that were already raised there is also another important factor to consider: money.', 'He brings in a lof of sponsors and money. Enough to make losing the constructors’ worth it, I guess.', ""There's this thing called money"", ""I know there's been a variety of answers already, but I'd like to point out that it's also about money."", ""Serious answer. Dietrich Mateschitz's passing. Guy controlled the 49% of the Red Bull GmbH and was avid in his support for RBR and Motorsport. He wanted the team to win no matter the costs. After his passing, a power vacuum between his heirs and the Yoovidhya family of Thailand (51% ownership in RB GmbH) was created. Byproduct to that was the whole Horner/Marko fall out and RBR civil war that costed them Newey (among others). Apparently, the Thais aren't fond of F1 and intended on getting rid of RBR. So, (this one is an assumption) between Perez's sponsorship, Honda/Ford money, Oracle main deal and the rest, RBR has managed to become sustainable without major investment from Red Bull GmbH, leading to the Thais keeping the team around."", 'weraceasmoney', 'Money talks', ""Does Checo have ANY leverage on Christian via the Thai majority RedBull owners? Did his dinner with that family mean he has their support to stay? \n\nI know it's a wild theory.""]",0,102,2024-10-27 17:20:21, Discussion,0,4
