unique_id,post_heading,link_url,post_url,publish_time,post_age,post_content,top_comments,upvotes,comments,timestamp,tag,upvotes_growth_rate,comments_growth_rate
1gcw67p,Carlos Sainz takes pole position for the 2024 Mexico City Grand Prix,https://i.redd.it/t63sojpsb6xd1.png,https://www.reddit.com/r/formula1/comments/1gcw67p/carlos_sainz_takes_pole_position_for_the_2024/,2024-10-26,0 days,,"['Turn 1 is gonna be so spicy all over the grid.', ""Sainz would've been P1 and P2, man is on FIRE."", 'WHAT A FUCKING LAP\n\nSAINZ POLE AND CHARLES AT P4', ""Wait till he gets out the car and finds about the classico's result"", 'smooooth operator', 'Leclerc has them right where he wants them for tomorrow.', 'Sainz hooked that thing up. Max did quite well, too.', 'Two pole-worthy laps from Carlos, what a session!', 'Insane how he did two perfect laps in a row', 'In to the 1:15s, what a fucking lap']",12193,628,2024-10-27 17:19:34, Qualifying,102,2
1gd3o6d,"[The Race] Carlos Sainz admits to feeling ""bittersweet"" about Ferrari's strong recent F1 form because ""it gives me a feeling Ferrari might be in the fight for the world championship next year and I will not be there to use it.""",https://i.redd.it/cwro156we8xd1.jpeg,https://www.reddit.com/r/formula1/comments/1gd3o6d/the_race_carlos_sainz_admits_to_feeling/,2024-10-27,0 days,https://x.com/wearetherace/status/1850329865330823563,"['Sainz is not a generational talent but he is a consistently strong driver. He has also handled getting replaced at Ferrari very maturely. Feel bad for him. Hope he gets to drive for a top team again.', ""He even thinks next year will be the year. He's a true Ferrari man."", ""Don't worry, Carlos, You're getting p6 at Williams and we'd still be celebrating it like Grand Prix winner 🥲"", ""It is definitely a bummer that Carlos has had this kind of luck in his career, where he performs well and yet keeps getting the boot from his seat.\n\nObviously only two drivers could have gotten him out of his seat at Ferrari and unfortunately for him one of them decided to go there. \n\nIt's exciting either way to see Hamilton drive for Ferrari, but it's definitely sad to see Carlos performing so well, only to be headed to Williams next season. \n\nIt's so bizarre that a personal/family drama situation is why he won't be in that RedBull next season, he absolutely should be in that seat. \n\nMax and Carlos vs Leclerc and Lewis vs Lando and Oscar vs George and Kimi would have been a wild championship if all the cars were capable of fighting for wins next season. \n\nFeels like a waste to have him spend any time at Williams, despite their improvements this season.\n\nGlad the fans have showed the Smooth Operator the respect he deserves."", ""I know it's to much wishful thinking but i hope Williams also becomes a top runner."", 'Damn this made me sad', 'Bro deserved to be in the fight..quite an understandable feeling for him..quite sad but understandable that Ferrari would sign up LH when available, but still saddening from the perspective of performance that Sainz delivered with Ferrari!\n\nI’m still surprised that RB preferred to stick with Checo even when he was available! I don’t get the bullshit around Verstappens not liking Sainz and his entourage! In a competitive sport, performance should be rated higher and feelings can be managed if all parties act like adults!', 'he has had terrible luck being paired with golden boys of team ; verstappen norris and leclerc', 'And then he’s just going to… Williams.\n\nI truly hate this timeline.', 'Checos existence is a crime']",8217,594,2024-10-27 17:19:38, Social Media,379,19
1gcvrfi,Max Verstappen is the only driver to reach Q3 at every Grand Prix this season,https://i.redd.it/so6x6lca86xd1.jpeg,https://www.reddit.com/r/formula1/comments/1gcvrfi/max_verstappen_is_the_only_driver_to_reach_q3_at/,2024-10-26,0 days,,"['Consistency is key', '*Dutch national anthem intensifies*', ""I'm just happy both Haas are in Q3."", 'This is the same driver that is on a streak of 16 consecutive Top 6 finishes, and a run of 45 Top 6 finishes in the last 46 Grand Prix, and also 59 Top 7 finishes in the last 60 Grand Prix.\n\n\nMad Max is very consistent.', 'Just Max Verstappen things.', ""it's big considering he wasn't happy with the car most of the season"", 'Clockwork Oranje', 'Simply lovely.', 'Maximum Max.']",4252,114,2024-10-27 17:19:38, Statistics,77,0
1gcw9mf,Formula 1 | He's A Smooooooth Operator!!! Carlos Sainz Takes Pole In Mexico!!,https://i.redd.it/1nlybploc6xd1.jpeg,https://www.reddit.com/r/formula1/comments/1gcw9mf/formula_1_hes_a_smooooooth_operator_carlos_sainz/,2024-10-26,0 days,,"['Smooth 2 laps🤌🏻🤌🏻', 'Fifth pole sitter this year. Ferrari only team with both drivers getting pole.', 'I love Carlos so much. The “two, two laps” was so funny lol. \nI love when he does it that he’ll ask for recognition/ compliment for his work. And my god what amazing two laps. \nDenied people from calling it a “help” due to first lap getting tow from hulk. \n\nFerrari pls get podiums tomorrow and I’ll cry for you. Hopefully they can get a good start and do good strategy', ""Absolutely crazy performance from Sainz.\n2 beautiful clean laps🤌\n\nIt's sad to see that he's going to be in a Williams next season.\n\nRedbull should've taken action soon and given him a seat and sacked Checo."", 'First pole of the season! Hope he can take one more win for Ferrari before the end of the year, no better time for it than tomorrow!', '2 excellent laps there, both good enough for pole. \n\nRemind me why he’s going to Williams next year?', '2 LAPS!', 'qualifying so good, you had to post it twice 🙏\n\nedit: oh guess the other one got deleted 😭', 'That was smoooooth!', 'Another great weekend for the cabrón. Vamos for another podium tomorrow and hopefully even a victory.']",4145,81,2024-10-27 17:19:39, Social Media,67,0
1gd79ot,Oscar's impressive Q3 streak came to an end,https://i.redd.it/ilgb2jnmq9xd1.jpeg,https://www.reddit.com/r/formula1/comments/1gd79ot/oscars_impressive_q3_streak_came_to_an_end/,2024-10-27,0 days,,"[""If you call that impressive, then what would you call Bottas' 101 Q3 streak?"", 'Still on streak for all laps finished', ""Bottas would say there's still a room for an improvement."", 'Alpine must be so relieved they didn’t get stuck with such a shmuck of a driver! /s\n\nThe “you’re only as good as your last race” really holds true when it comes to driver commentary it seems lol.', ""He's no Valterri Bottas that's for sure.\xa0"", 'Verstappen is now the only driver that made it to Q3 this whole season.', 'The Pastry is crumbling towards the end of the year', 'He was fast yesterday too, his lap was very quick before he bottled it and went outside of track limits.', 'Do checo perez please']",3848,196,2024-10-27 17:19:40, Social Media,252,10
1gcv9sy,[Daniel Valente] Q1 eliminations this season: Yuki Tsunoda - 4 Sergio Perez - 5 Maybe Red Bull should give Yuki more than a test.,https://x.com/F1GuyDan/status/1850286012012118026?t=Vftnk5nFUPZcO41OEO6BUQ&s=19,https://www.reddit.com/r/formula1/comments/1gcv9sy/daniel_valente_q1_eliminations_this_season_yuki/,2024-10-26,0 days,,"['Embarrassing for checo', ""WCC, let's goooo!"", ""I don't even have the words to describe just how done I am with Perez driving for this team"", 'This aged brilliantly', 'Anyone else would do', 'At this point I feel like Checo’s father must have some serious dirt on Horner. I legitimately can’t think of any reason other  why Checo is still in that car.', ""Checo's holding that RB seat hostage. Get him gone."", ""Yuki could cure cancer, solve world hunger, and bring peace to the middle east and he wouldn't get that Red Bull seat. \n\nEdit: Rip my whole comment"", 'i think that’s why they don’t', 'That aged like milk']",3306,289,2024-10-27 17:19:42, Social Media,30,1
1gcr5sz,Ferrari mechanic falls down on pit,https://imgur.com/gallery/4D2RIuf,https://www.reddit.com/r/formula1/comments/1gcr5sz/ferrari_mechanic_falls_down_on_pit/,2024-10-26,0 days,,"[""Stupid sexy Ferrari man is flexible too? Is there anything this man can't do?!"", 'Smooth operator', 'Alessandro is too cool even when he falls over', 'He lost the rear', 'Honestly, that was an impressive back flip. Kudos to him. Glad to see he was laughing.', '“Bella Questa” 😂😂', 'What a recovery', 'How did he speed up while falling', 'Need you all to know that this is the mechanic with the Guido tattoo', ""That's quick! I barely missed it on the stream and was hoping someone got it. Glad to see he's ok.""]",2838,117,2024-10-27 17:19:42, Video,17,0
1gcx1ze,Charles Reacting to his final lap: Sh*t sh*t sh*t. F*cking sh*t lap F*cking sh*t lap,https://imgur.com/a/zNnotp3,https://www.reddit.com/r/formula1/comments/1gcx1ze/charles_reacting_to_his_final_lap_sht_sht_sht/,2024-10-26,0 days,,"['Charles just covered every required community service on the continent.', ""I think he isn't happy with his qualifying."", 'God he’s going to get 18 months of community service for that', 'Outdanked by Carlos Sainz Vázquez de Castro Cenamor Rincón Rebollo Virto Moreno de Aranda Don Per Urrielagoiria Pérez del Pulgar.', 'Community service sentence: run an anti-drug campaign in Sinaloa. \n\nGreetings from MBS', '*sympathy noises*\n\nThe sassy whatever sends me though.  😂', 'it’s ok Charles. Harness the power of p4', 'That’s 7 years in the mines I’m afraid, one for each curse', ""He cracks me up. In interviews he's like Mr. Wholesome Good Guy. On the radio when he's unhappy it's Darth Charles."", 'Make it up in the race']",2753,157,2024-10-27 17:19:43, Video,53,0
1gd219p,"Carlos about the unusual line he took in his lap: its just a Lando thing that he normally likes to do, i think it's from iracing or something, he likes doing short distance to the line and i said well i lose nothing maybe its faster [...] i remember from our Mclaren days he used to do it a lot ",https://imgur.com/8SjLkEt,https://www.reddit.com/r/formula1/comments/1gd219p/carlos_about_the_unusual_line_he_took_in_his_lap/,2024-10-27,0 days,,"['>I remember from our McLaren days he used to do it a lot and i was a bit puzzled\n\nI love that honesty, and he learnt this technique from Lando there.', "">reporter: can i ask you about hugging the pitwall at the end of the lap that seems to be an unusual line compared to your peers\n\n>Carlos: no, its just a lando thing that he normally likes to do, i think it's from iracing or something. He likes doing short distance to the line and i said well i lose nothing by maybe if its faster maybe cutting a bit the distance maybe give me a thousandth or two thousandths of a second, im gonna make sure this time i dont leave them out there. I remember from our McLaren days he used to do it a lot and i was a bit puzzled\n\nthis just reminds me of george saying he also tried lando's line back in s1 in spa 2021 and lead to him having a purple sector 1"", 'Carlando my beloved.', ""It's something a lot of us do in the in the F1 Arcade games, those are free tenths hehe"", 'That’s brilliant insight; I thought he was doing it for the Ferrari pit wall.', 'Some drivers have done it exiting Parabolica at Monza for ages now in qualifying', 'is this the same as the last corners in Canada, SPA and China? straight lining on exit', 'this reminds me of how in super gt and super formula, in order to get the fastest possible quali lap at suzuka, you see drivers staying on the right most edge of the track, hugging the pitlane wall after exiting the chicane so that they have the shortest possible run to the line', 'Especially in rainy qualifying, a bunch of drivers watch Norris’ lines and then copy them. When the track is wet, you can often see Norris’ onboard footage on the pitwall screens belonging to teams that aren’t McLaren.', ""Reminds of Senna at Magny-Cours allegedly working out that due to the timing line being so far back from the start-finish line the quickest way to drive a single lap was to stick it in the wall at the last corner (can't remember whether he ever confirmed it or not)""]",2442,82,2024-10-27 17:19:44, Video,131,3
1gcstt6,"Lewis Hamilton when asked whether he'll surpass Fernando Alonso for driving in the most Grand Prix in F1 History: ""Depends on how far he'll go.... I'm probably going to be here longer than him""",https://imgur.com/a/yI3A71U,https://www.reddit.com/r/formula1/comments/1gcstt6/lewis_hamilton_when_asked_whether_hell_surpass/,2024-10-26,0 days,,"['and alonso took that personally', '2040, and at the first edition of the Gibraltar GP, a 55 year old Lewis breaks Nando’s record and retires on the spot halfway through the season.', 'Alonso about to go till he is 70 so Lewis doesn’t beat his record.', 'When Lewis was younger he was all ""I\'m not gonna be racing until I\'m 40, I have other stuff I wanna do."", but then he organized his life around jet-setting, and it seems like he\'s found that he can do everything he wants *and* race in F1.\n\nUnless he settles down and has a family, I don\'t see that really changing for him. He could go until the wheels fall off.', 'Both will refuse to retire as long as the other is on the grid\n\xa0', ""1 year at ferrari and you'll be chained to the radiator in the marshmallow room"", ""Lewis will have Ferrari strategy and Nando will have GP2 Engine so it's a 50/50 on who retires first."", 'There was this old ad playing around when the two were racing for McLaren with the song ""Anything that you can do, I can do better..."". I\'m totally reminded of that right now. 🤣\n\nEdit:[https://youtu.be/vKU90BSHqHk?si=1lt82Nd1lX7Kf4fG](https://youtu.be/vKU90BSHqHk?si=1lt82Nd1lX7Kf4fG)', 'Lewis won’t retire until he breaks the tie with Schumi… Let’s see if Ferrari can be competitive for the next years ahead']",2175,150,2024-10-27 17:19:45, Video,31,2
1gd65zv,[F1] Checo Perez on Q1 exit,https://i.redd.it/4ahatlavb9xd1.jpeg,https://www.reddit.com/r/formula1/comments/1gd65zv/f1_checo_perez_on_q1_exit/,2024-10-27,0 days,,"['Nice of all the locals to dress as dead people to honour the rest of his career', 'No worries Checo, it happens almost everywhere you go after you go to Europe. Just makes this one all the more special compared to the others.', '""...for this to happen"" as if someone else brought it upon him.', 'This time last year he actually had a good run and was a tenth or something behind Max, and I remember feeling a bit sorry for him because he *still* managed to be outqualifed by Ricciardo in the Alpha Tauri.  I no longer feel sorry for him in the slightest.', '\xa0A spokesman said ""This is the one thing we didn\'t want to happen.""', 'Buxton-level insight.', 'People keep defending him as if he is a poor man. This is a dude that is a millionaire that holds one of the only 20 available seats in the sport. He is wealthier than all of us combined. \n\nNo he does not deserve that spot, I would rather put anyone else from the grid next to Max. \n\nJezus.', 'He is as much a racing driver as he is a wordsmith...', 'could not happen in a better place tbh', ""But hey, at least Sergio didn't caused red flag in Q1.""]",1684,299,2024-10-27 17:19:46, Social Media,157,15
1gd0tgp,Sergio Perez has more Q1 exits in 2024 season so far (5 Q1 exits) than Lance Stroll (4) and Franco Colapinto (3).,https://i.redd.it/gd3da6kqj7xd1.jpeg,https://www.reddit.com/r/formula1/comments/1gd0tgp/sergio_perez_has_more_q1_exits_in_2024_season_so/,2024-10-27,0 days,,"['The Colapinto stat is a little unfair lol.', 'I mean Colapinto’s only had 5 qualifying sessions total so not sure him having less off days is that impressive. \n\nBetter to list the drivers who’ve had more Q1 exits - they’re Ricciardo (6) Gasly (7) Magnussen (7) Ocon (8) Sargeant (10) Bottas (13) and Zhou (18).\n\nThe Alpines were the worst at the start of the year which is a chunk of their drivers exits. The Saubers are consistently terrible so it explains Bottas, though obviously Zhou could have done slightly better than he has.\n\nKMag is gone at the end of the year. Ricciardo and Sargeant are both already gone. Realistically, Perez should not be going through to 25 based on his results.', ""It's completely surprising that the most fucking ruthless teams of F1 which fires drivers mid season for underperformance is holding on to this dude who clearly costed them constructors championship, all for what sponser money.?, which they can acquire without that much struggle or problems"", 'honestly, rb should just leave him in mexico and save their travel budget', 'Why put Franco in this comparison? It makes no sense at all. He’s only been around for 5 races and he’s been out in Q1 in 3. He’s doing very well overall but nothing to compare here. \n\nStroll - in the other hand - is a good indicator. I fucking despise him even though I’m Canadian but out-qualifying Checo so far this year is pretty brutal.', 'Colapinto?  For fucks sakes he’s only been in 5 qualifying sessions ever.', ""If Lawson or someone else isn't in that car starting next year Red Bull is done for."", ""Never thought I'd see Perez's downfall to the point that we think Stroll shows better drive than him"", 'At this point I believe he holds some kinda key evidence against both horner and marko in a murder case or something, there’s no way they’d keep him otherwise, don’t tell any of the other red bull driver’s including danny ric wouldn’t do a better job']",1592,117,2024-10-27 17:19:47, Statistics,67,0
1gcv6os,"Zhou, Colapinto, Perez, Piastri & Ocon out of Q2",https://dubz.link/c/f17ea8,https://www.reddit.com/r/formula1/comments/1gcv6os/zhou_colapinto_perez_piastri_ocon_out_of_q2/,2024-10-26,0 days,,"['Disastri for Piastri', 'This is absolutely huge for Ferrari', 'Piastri did a Perez. Also Perez did a Perez.', 'checOUT when???', 'That is fucking embarrasing. In his home gp too.', 'The Perez show is back! \n\nlol seriously this can’t be real, beyond a joke now, just getting sad.', 'VALTTERI Q2 YEEES', 'BOTTAS Q2!!', 'The Mexican minister of disgrace', 'If this isn’t Chexit *this time*, we’re in a simulation']",1479,595,2024-10-27 17:19:50, Video,-2,0
1gcwe1b,"With the pole of Carlos Sainz in Mexico, Ferrari is the only team with both drivers having a pole this year",https://i.redd.it/c7laucjpd6xd1.png,https://www.reddit.com/r/formula1/comments/1gcwe1b/with_the_pole_of_carlos_sainz_in_mexico_ferrari/,2024-10-26,0 days,,"['Oscar not having pole in that McLaren is quite disappointing. His one lap pace especially since the summer break has gotten worse and worse.', ""It's a shame that they had a pretty dull summer period of races because they could just as easily be walking away with the Constructors as we speak. Those Monza upgrades have been incredible."", ""Kinda Surprised Oscar hasn't gotten a pole yet."", 'Lewis jumping ship at the perfect time again', ""NOR - 100% of team's poles\n\nVER - 100% of team's poles\n\nLEC - 75% of team's poles\n\nRUS - 100% of team's poles\n\nCharles clearly washed. With him and Hamilton in the team, Ferrari aren't even gonna make 100% of their own poles smh..."", 'Oscar without a pole this season in **the fastest car** 😮😲😱😳', 'The fact that Max still has the most poles this season is absolutely crazy', 'Lando and Verstappen carrying their poles alone', 'Wow, this is actually a wild stat for this season.']",1366,73,2024-10-27 17:19:50, Statistics,20,0
1gcwol3,Toto reacting to lewis hamilton's W14 sliding in Q3,https://i.imgur.com/h31p9B2.gifv,https://www.reddit.com/r/formula1/comments/1gcwol3/toto_reacting_to_lewis_hamiltons_w14_sliding_in_q3/,2024-10-26,0 days,,"['Honestly in general I like the passion Toto has and reacting like a fan.\n\nObvious a bummer for Lewis but it is what it is.', 'He went from 10 to 0 in ⅔ of a second.', ""I'm extremely shocked at how volatile this car is. It's almost like it's back to the early W13 days though for different reasons."", ""That thing is going to bunny hop into the barriers tomorrow, isn't it?"", 'Bugs Bunny car.', 'For past two weekends Mercedes cars and drivers can’t catch a break.', 'Is Hamilton still running the new upgrade?', 'W15?', 'That thing is dangerous', ""I was as disappointed as Toto was that he didn't hit the table. Come on Toto, where's the fire you used to have?""]",1222,111,2024-10-27 17:19:51, Video,17,2
1gcxfsb,(@F1GuyDan) Max Verstappen still has more front row starts than any other driver AND constructor this season,https://i.redd.it/25jrqxztm6xd1.jpeg,https://www.reddit.com/r/formula1/comments/1gcxfsb/f1guydan_max_verstappen_still_has_more_front_row/,2024-10-26,0 days,https://x.com/F1GuyDan/status/1850298847198900700,"['Consistency is why he will win the WDC. Consistently maximizing every single weekend.', 'Max having more front row starts than McLaren says a lot…', 'Definitely deserves the championship this year and hopefully he can do it.', 'How the hell did he beat Lando in qualifying today? Q1 and Q2 indicated Norris will get the pole hands down.', 'Max is a legend already', ""He's the real deal I think"", ""Funny thing is that if he wins the WDC with some races to spare, most people in a couple of years will have a hard time understanding how this season is a masterclass from Max. I'm wondering if it's the same thing with Schumi. I never thought much of how he won the titles with Benetton all by himself. Always thought it was because Jos was shit. Only changed my mind when reading Berger's book where he said that when he first drove Michael's Benneton, he couldn't believe that it was the same car that won the title."", 'Change the name to Verstappen Racing.', 'Max means business (only)']",1123,122,2024-10-27 17:19:51, Statistics,23,1
1gdcm9n,"F1's racing rules to change before end of year after drivers' ""productive meeting""",https://www.racefans.net/2024/10/27/f1s-racing-rules-to-change-before-end-of-season-after-productive-meeting/,https://www.reddit.com/r/formula1/comments/1gdcm9n/f1s_racing_rules_to_change_before_end_of_year/,2024-10-27,0 days,,"['Predicting that next season there will a lot of complaining that racing got neutered and that the stewards just should let them race.', 'i dont understand why the rules are so complicated.\n\nin sim sracing its straight up when someone is next to you, no matter how much, you have to leave space.\n\nthis also feels like the most racecraft-y and sportsmanship like.\nno need for apex rules, 50%, 75%, at-wheel, at-mirror or any of that unneccesary crap thats too useless for millisecond decisions anyway. If you would hit someone by closing distance to the white line you have to stay put and leave space.\n\n\njust do that pls. would also lead to exciting overtakes over a couple of corners.', 'That’s good, the sooner we can sort out the issue with drivers outbraking themselves to stay ahead at an apex the better', 'good', ""Man I hope we have 4 teams fighting for wins each weekend next year. F1 could be so back. It's already been amazing recently. It was definitely slow for the past little wild."", 'Well……only three years after it was exceedingly and painfully obvious such a change was needed.', ""Funny how people said it's only McL and Norris who had problem with that defending only for most drivers to agree it needs to be changed."", ""Many often comment the rules don't apply to Max, yet they keep changing them because of him. He's just great at finding/stretching the limit of what's allowed."", 'I would love to be a fly on the wall in those meetings. Wonder how many called out some of the questionable defending we’ve seen recently']",1013,193,2024-10-27 17:19:53, News,317,60
1gcwg4v,"[Williams Racing] A mega effort from Alex in qualifying, he will start P9 on the grid in Mexico. Franco will start from P16.",https://i.redd.it/xkc4prr7e6xd1.jpeg,https://www.reddit.com/r/formula1/comments/1gcwg4v/williams_racing_a_mega_effort_from_alex_in/,2024-10-26,0 days,,"[""The reports of Alex's death were greatly exaggerated"", 'Alex saw you all talking shit and decided to give you something relevant to talk about.', '**Reddit yesterday**: time to roast Alex for 2 bad weekends. He should be kicked out. \n\n**Reddit today**: Colapinto not far from Sargent. Not good. He was only lucky in 4 races etc.\n\nMaybe from now on can we just cheer that Williams is somewhat competitive with both drivers and move on.', 'Can we just be happy for Williams and their rather good pair of drivers?', ""But I was told he was washed, and franco is already better.\n\n Colapinto is obviously better than Sargeant but it's been such a small sample size I don't know how well we can judge his true talent. He probably does deserve a full-time seat, but the people wanting them to boot albon for him next year are a bit mental"", 'That was super important for Alex, nice to see him in q3, not too bad for a washed driver.', 'Albon: I never Left!', 'As an argentinian, I am really happy for Albon. Really.\n\n\nI want Franco to succeed, but not by taking something from his partner.\n\n\nThe hate against Albon was just awful, and undeserved. He just had bad luck.\n\n\nWish him a really good race tomorrow.', '**IT APPEARS REPORTS OF ALBON’S DEMISE WERE PREMATUE**', ""Albon heard y'all talking shit.""]",867,142,2024-10-27 17:19:54, Social Media,-6,0
