unique_id,post_heading,link_url,post_url,publish_time,post_age,post_content,top_comments,upvotes,comments,timestamp,tag,upvotes_growth_rate,comments_growth_rate
1gdd0xa,'I don’t think we have the pace' - Norris fearful of Ferrari in Mexico,https://racer.com/2024/10/27/i-dont-think-we-have-the-pace-norris-fearful-of-ferrari-in-mexico/,https://www.reddit.com/r/formula1/comments/1gdd0xa/i_dont_think_we_have_the_pace_norris_fearful_of/,2024-10-27,0 days,,"[""It's funny how expectations adjust that if you told me before the season that McLaren would come second I would have ripped your arm off - now I'm dreading it."", ""If Red Bull aren't quick then Ferrari 1-2s is exact what Max will need"", 'The McLaren top speed (344kph vs 349kph) is not good news for Lando to make any substantial overtakes. He is cooked. Best he can hope for is a P3 today ahead of Max.', 'Just start good and get ahead of them and drive faster to pull away from DRS.', ""2 races in a row now, their pace is gone. Well, not gone, but significantly reduced.\n\nIs it the wings they had to modify? Was it more significant than we thought? I honestly didn't think modifying the wings would have much of an impact but... Went from being 30 seconds ahead in Singapore to this.\n\nMaybe it's just track specific and it happens to have come with this timing... I guess the remaining few races will show it, if they go back to being obviously fastest, then it's nothing. If they don't, it could have been the wings..."", 'Mclaren should have been more than 80 points clear from Redbull right now but now they are in danger getting passed by Ferrari. A good lesson for next year.', 'After last week and this week I’m starting to think that wing nerf was more substantial that originally thought', 'Lando’s opportunity to seize the WDC has passed. If he had capitalised on having such a fast car earlier on in the season this wouldn’t be as big of a problem for his title hopes.', 'Fact: Leclerc is much more likely to beat Lando for P2 in WDC than lando to max! Mclarens need to get some priorities right!']",172,97,2024-10-27 17:20:10, News,59,25
1gcrwzi,Fastest sectors ranked by team for FP3 of the 2024 Mexican GP | via LightsOutBlog.com,https://i.redd.it/jdepvjkyb5xd1.jpeg,https://www.reddit.com/r/formula1/comments/1gcrwzi/fastest_sectors_ranked_by_team_for_fp3_of_the/,2024-10-26,0 days,,"['McLaren perhaps finally showing their hand – with Ferrari their closest rivals. Impressive from vcRB and Haas, should be an exciting fight for P6 in the WCC on the cards this weekend.\n\nThis comment will be updated with rankings by driver shortly.\n\nEdit – Top 10 sector times and ideal laps ranked by driver:\n\n||SECTOR 1||SECTOR 2||SECTOR 3||IDEAL LAP||\n|:-|:-|:-|:-|:-|:-|:-|:-|:-|\n|1|SAI|27.261|NOR|29.441|PIA|19.655|PIA|76.492|\n|2|HAM|\\+0.056|PIA|\\+0.057|NOR|\\+0.043|NOR|\\+0.059|\n|3|HUL|\\+0.058|VER|\\+0.114|SAI|\\+0.166|SAI|\\+0.340|\n|4|PIA|\\+0.078|LEC|\\+0.285|LEC|\\+0.257|VER|\\+0.383|\n|5|RUS|\\+0.080|HUL|\\+0.287|TSU|\\+0.259|LEC|\\+0.497|\n|6|LEC|\\+0.090|SAI|\\+0.309|VER|\\+0.271|HAM|\\+0.568|\n|7|MAG|\\+0.097|TSU|\\+0.317|HAM|\\+0.276|HUL|\\+0.659|\n|8|VER|\\+0.133|ALO|\\+0.331|ALB|\\+0.294|TSU|\\+0.732|\n|9|NOR|\\+0.151|ALB|\\+0.342|LAW|\\+0.340|RUS|\\+0.762|\n|10|BOT|\\+0.243|PER|\\+0.353|ALO|\\+0.375|MAG|\\+0.803|', 'Mercedes so slow in second sector...', 'Aston is just so brutal this year', 'Fucking hell Alpine', 'Race sure is going to be exciting', 'Haas with an upgrade program that worked.  What a time to be alive.', 'Ferrari needs to sacrifice some straight line speed for more stable in secor 2 + 3\n\nWith this sector 2 + 3 they will never be close to McLaren before the main straight to active DRS', ""I'm going to choose to not believe any of this"", 'If Haas figures out Sector 3 they have some good chances on points.']",131,32,2024-10-27 17:20:10, Statistics,1,0
1gd09od,"Drivers' Qualifying Performance - Round 20, Mexico City",https://i.redd.it/ert50g7td7xd1.png,https://www.reddit.com/r/formula1/comments/1gd09od/drivers_qualifying_performance_round_20_mexico/,2024-10-27,0 days,,"['How is Lawson/Tsunoda 1-0? They’ve been in the same team and done qualifying twice.\n\nHow has McLaren gone from 16-3 to 16-4 when Lando’s just beat him again?', 'Checo has more Q1 exits than Verstappen, Leclerc, Sainz, Norris, Piastri, Russell, and Hamilton combined.', 'of the full time drivers, only sainz lec and the alpine boys are close.', ""The gap of Lando and Oscar is quite big. It's funny how one gets lots of critisicsm and the other is praises."", 'Kudos to Ollie', 'Why McLaren and Ferrari have only 3 sprint h2h total  and the others 4? Did they miss some race?', 'George has dominated god damn. If not for the DNFs this would look like a terrible season for Lewis', 'Alpine is the only one that genuinely has competition.', 'ferrari had the best lineup']",115,29,2024-10-27 17:20:11, Statistics,2,0
1gcr4mn,[Luke Smith] PARKOUR,https://x.com/LukeSmithF1/status/1850237756988899443?t=ohzy04usWbyLeCH9v3fZ1g&s=19,https://www.reddit.com/r/formula1/comments/1gcr4mn/luke_smith_parkour/,2024-10-26,0 days,,"['This is like the cop slide for me lmao. How did he manage to gain so much momentum? 😭', 'Needs some cartoonish slipping-on-a-banana-peel type sound effects added.', '*I understood that reference*', 'Yawn']",112,5,2024-10-27 17:20:11, Social Media,-3,0
1gdefzw,"Marko: Perez's expected upturn ""didn't materialise"" after Mexico Q1 exit",https://www.autosport.com/f1/news/marko-perezs-expected-upturn-didnt-materialise-after-mexico-q1-exit/10667500/,https://www.reddit.com/r/formula1/comments/1gdefzw/marko_perezs_expected_upturn_didnt_materialise/,2024-10-27,0 days,,"['“In a context where Perez’s father Antonio…remains convinced Sergio will become a world champion eventually, Marko reacted on Sky Germany: “Well, I honour his father’s optimism, but…”\n\nLMAO', 'Could’ve asked us last year and we’d have told you the same… heck even during contract renewal… or this summer break.', ""I'm not sure who was expecting it? If you asked fans what is more likely a Q1 exit or Perez qualifying in the top 6 and having a decent race most would say Q1 exit."", '>In a context where Perez’s father Antonio has told Mexican sports newspaper Record that he remains convinced Sergio will become a world champion eventually, Marko reacted on Sky Germany: “Well, I honour his father’s optimism, but…”\n\nBrutal but true lol', 'I know Marko is a questionable person, but he’s surely one of the most entertaining people on the entire paddock, he provides content constantly', 'Checo’s dad believes Checo will be world champion?? The hopium is strong with this one.', 'I’ve been saying this for a while, but on top of Yuki’s Honda ties eliminating him from RBR, he still hasn’t been able to completely dismiss the narrative that he’s a risky choice. If Christian and Helmut think there’s even the slightest chance that he could get frustrated and either refuse team orders, or drive recklessly around Max like he did Daniel, putting Max’s race or car at risk, there’s no way they’ll ever give him the seat.\n\n>However, while his RB team-mate Yuki Tsunoda is keen to grab the second Red Bull drive himself, he is yet to convince the Anglo-Austrian squad bosses of his worth, and his Q2 accident at Autodromo Hermanos Rodriguez won’t do him any favours.\n\n>Marko called the incident “an unnecessary crash”, given Tsunoda risked damaging the VCARB 01’s new floor and being relegated to the back of the grid if parc ferme needed to be breached. \n\n>Asked if the Japanese driver was too unstable, Marko added: “Well, he had a spin in Austin and now this crash in qualifying. “We thought he had stabilised, but apparently now, when the pressure comes from Lawson, it’s noticeable.”', ""We're expecting since Miami 2023"", ""Important extract on Yuki Tsunoda:-\n\n> However, while his RB team-mate Yuki Tsunoda is keen to grab the second Red Bull drive himself, he is yet to convince the Anglo-Austrian squad bosses of his worth, and his Q2 accident at Autodromo Hermanos Rodriguez won’t do him any favours.\n\n>Marko called the incident “an unnecessary crash”, given Tsunoda risked damaging the VCARB 01’s new floor and being relegated to the back of the grid if parc ferme needed to be breached.\n\n>Asked if the Japanese driver was too unstable, Marko added: “Well, he had a spin in Austin and now this crash in qualifying.\n\n>**“We thought he had stabilised, but apparently now, when the pressure comes from Lawson, it's noticeable.”**""]",184,70,2024-10-27 17:20:11, News,184,70
1gcwb78,Max Verstappen Post Qualifying Interview,https://dubz.link/c/8e9026,https://www.reddit.com/r/formula1/comments/1gcwb78/max_verstappen_post_qualifying_interview/,2024-10-26,0 days,,"[""Man posts interviews while they're still ongoing."", 'After FP3 I did not expect a P2. Seems like Max neither. Really happy with this result!', 'For all the criticism that RBR have gotten this year (most of it rightly so) .. they really seem to have managed to turn the car development around ! They deserve some credit for it', 'King of consistency.', '😮\u200d💨😮\u200d💨he sounds so much chill... while I  was worried sick after that lap deletion.', 'The booing is crazy when your guy got knocked out 45 minutes ago', ""Imagine boo-ing a guy for not getting knocked out in Q1 like your guy and just doing what he's supposed to, again unlike your guy, who keeps getting knocked out in Q1 or Q2 on a good day."", 'I like James Hinchcliffe, but questions that start with ***how difficult is it…*** or with ***how important is it…*** are ALWAYS BAD QUESTIONS.\n\nYES, IT IS DIFFICULT.\n\nYES, IT IS IMPORTANT.\n\nF.F.S.', 'Maybe they for once have made the right last minute setup change.', 'Well a lot of this is also Max doing amazing work. Any other driver and RBR would be qualifying on 3rd row.']",109,29,2024-10-27 17:20:12, Video,-3,0
1gcwt05,[@F1TelemetryData] Mexico GP Quali Telemetry Recap (8 pics),https://twitter.com/F1TelemetryData,https://www.reddit.com/r/formula1/comments/1gcwt05/f1telemetrydata_mexico_gp_quali_telemetry_recap_8/,2024-10-26,0 days,,"['The Mclaren top speed being almost 5kph down on Ferrari and RBR, does not bode well for Norris if he has to do any overtaking.', 'That throttle usage percentage is interesting. Anyone know how to explain that? Generally more throttle usage means less power and less throttle = more power. Is that true for qualifying as well?', 'The field was quite close today. \n\n  \nthen theres zhou half a second down on ocon', 'Max out there driving for his life with no purple sectors', ""I'd say it will be more or less impossible"", ""It's often more a sign of cornering efficacy and downforce. A better car is able to get back to full throttle earlier after the brake and coasting phase of a corner, while on tracks like Jeddah you might see some cars be able to navigate high speed sections under full throttle, where lesser cars can't.\n\nHaving said that, I don't understand the huge discrepancies in '% time spent cornering'. No way are Max and Lando spending almost twice the amount of time cornering."", 'Throttle usage doesn’t mean much. Its just engine mapping']",112,6,2024-10-27 17:20:12, Statistics,3,0
1gcwcrf,Carlos Sainz Post Qualifying Interview,https://dubz.link/c/9170fa,https://www.reddit.com/r/formula1/comments/1gcwcrf/carlos_sainz_post_qualifying_interview/,2024-10-26,0 days,,"['This man is going to Williams ffs\n\nIf the rumours of his exit clause were true, that if a RedBull or Merc seat became available he could leave, Redbull would be insane to not take him over Perez. Drama between the two camps is better than qualifying p18.', ""I don't think Sainz Sr. is as involved as he was back then anymore. And honestly, if Sainz Sr. was the thing keeping Jr. from a good seat he would almost certainly take a step back. I can't believe so many people are so confident this is the actual reason they don't sign Sainz."", 'sigh if only jos and carlos sr put an end to their beef', 'Relax Williams is not **that** bad', 'Alex is P9. Carlos is (most likely) a way better driver than Albon. So regularly Q3 would be on the table', 'Maybe Jos will walk into the sea.']",104,7,2024-10-27 17:20:12, Video,-2,-1
1gcscxx,[@F1TelemetryData] Mexico GP FP3 Telemetry Recap (7 pics),https://twitter.com/F1TelemetryData,https://www.reddit.com/r/formula1/comments/1gcscxx/f1telemetrydata_mexico_gp_fp3_telemetry_recap_7/,2024-10-26,0 days,,"['Ferrari decides to go all in for top speed it seems\n\nThat turn 7 time lost from Sainz to the McLaren is very big', 'Sheesh that McLaren is rapid!', 'McLaren is definitely a step ahead on qualifying fuel levels but they’ll surely be looking over their shoulders to see where the Ferraris are in the race', ""Mexico to copy North Korea's human rights so Perez can win the race."", 'Williams really needs to improve the top speed', 'Looking at the laps section, full throttle, red bull seems to be running their classic lower power PU\xa0 mode? (Most time spent on full throttle, but least acceleration of top 5).\xa0\n\n\nSainz running similar throttle but less acceleration than Nor, so McLaren is a bit mighty here (presumably higher downforce setup).\xa0', 'Anyone has long run data?', 'can’t wait to see how vcarb mess up yuki and liam’s quali’s and races!', 'The time spent on throttle for RBR makes me believe that they have turned down the engine significantly. Won’t be surprised if Max is right there come quali. Also it makes sense for them to turn down the engine, given their torches this weekend']",79,16,2024-10-27 17:20:12, Statistics,2,0
1gcpyd4,2024 Mexican Grand Prix - Free Practice 3 Discussion,https://www.reddit.com/r/formula1/comments/1gcpyd4/2024_mexican_grand_prix_free_practice_3_discussion/,https://www.reddit.com/r/formula1/comments/1gcpyd4/2024_mexican_grand_prix_free_practice_3_discussion/,2024-10-26,1 days,Looking forward to those Quali sims!,"['The Oscar/Carlos beef is alive and well', 'Piastri-Sainz Conflict of 2024 revived', 'Solid 10/10 for that mechanic, beautiful work', ""With the reported cash injection they're getting I'm begging for Williams to buy James AEIOU a microphone that doesn't sound like he's eating it"", 'Despite being born in 2003 Doohan is somehow the most 90s driver in the paddock', '""Typical Carlos"" hahahah Oscar you never dissapoint.', 'The real success is that when I hear Bernie in relation toto F1, I now think Collins rather than Ecclestone.\n\nEdit: Toto is a typo but I’ll leave it given the indirect relevance.', 'He styled it out 😂', '10/10 flip', 'Stunning move from the Ferrari crew']",57,1119,2024-10-27 17:20:16, Free Practice,-2,-1
1gddukw,Race Simulation Pace per Matt Youson from formula1.com,https://i.redd.it/ra8tg064kbxd1.jpeg,https://www.reddit.com/r/formula1/comments/1gddukw/race_simulation_pace_per_matt_youson_from/,2024-10-27,0 days,,"['Haas has been quite fast lately. Bodes well for Ocon & Bearman next year, if they can keep it up.', 'Perez is in the RB bar', 'this has never been accurate this season but i bet you that red bull is not going to only be one tenth off in race pace if u look at their problems in austin', ""Post qualy Leclerc straight up said he has the best race pace. \n\nBuuuut he probably won't get to use it"", 'So Max and Checo average?\xa0', 'Ferrari dominance could bore fans', 'so, when we remove the 0.4s Checo penalty Red Bull is fastest? Yeah, I dont think so', 'Does this take into account Checo’s race pace? If so, does that mean Max will likely be faster?', 'These numbers are worthless. No team did any meaningful long run to make any sort of conclusion.']",62,34,2024-10-27 17:20:16, News,36,12
1gcwa89,Lando Norris Post Qualifying Interview,https://dubz.link/c/cdb2c4,https://www.reddit.com/r/formula1/comments/1gcwa89/lando_norris_post_qualifying_interview/,2024-10-26,0 days,,"['Lando Max turn 1 inchident to lock in the 1-2, we will be there', 'He’s given up on the championship. There’s no way you’re happy with third (behind Max) if you still think you have a chance.', 'Underwhelming performance to be honest...', 'Ferrari constructors championship coming', 'Please no', 'Max and Carlos turn 1 incident with Lando win', 'Lando sainz incident and max driving bye :)', 'Preferably DNFs for both and the second car out of points too Thanks.', 'Starting third is the best place here. You can get slipstream from first place for the long starting straight.', 'How so?']",52,18,2024-10-27 17:20:16, Video,4,0
1gdf1hg,"[George Russell] Congrats on 400 Nando, incredible achievement!!",https://twitter.com/georgerussell63/status/1850576693410312686,https://www.reddit.com/r/formula1/comments/1gdf1hg/george_russell_congrats_on_400_nando_incredible/,2024-10-27,0 days,,"['These two are the most unexpected bros on the grid', 'George goes from wholesome, slightly awkward posh bloke when his hair is out, to a mannequin from a horror movie staring unblinkingly into your soul whenever he wears a hat', 'Very nice of the best driver on the grid congratulating the elder statesman on an incredible achievement!', 'What did Max say? I missed it.', ""Max hasn't said anything. I said it's very nice of *the best* driver on the grid congratulating a fellow legend on a phenomenal achievement!"", 'What did Max say? I missed it.', ""Max hasn't said anything. He said it's very nice of the *best* driver on the grid congratulating a fellow legend on a phenomenal achievement!"", 'Oh, what did Hamilton say? I missed it.']",73,8,2024-10-27 17:20:17, Social Media,73,8
1gdagey,2024 Mexican Grand Prix - Pre Race Discussion,https://www.reddit.com/r/formula1/comments/1gdagey/2024_mexican_grand_prix_pre_race_discussion/,https://www.reddit.com/r/formula1/comments/1gdagey/2024_mexican_grand_prix_pre_race_discussion/,2024-10-27,0 days,It's nearly time! Who'll lead after turn 1? Will there be safety car?,"['“Nearly time”\n\nWhere lol', '>nearly time\n\n>7 hours before the Grand Prix', 'Only another 7 hours lol', 'Leclerc wipes out the entire front three at turn 1, Russell cruises to victory only to crash out himself and Hamilton on the second to last lap. Haas 1-2.', ""I'm starting to get worried about Leclerc starting P4... I went over the past decade of races in Mexico and the even side never really gains positions. Even P5 has had better launches than P4."", 'Got excited that the race is earlier than I thought. 6 hours to go lol. Races in the americas always throw me off', ""I'm so hype for the burrito I'm going to be eating during this race"", 'If Sainz survives T1 he should walk this, probably to another Ferrari 1-2', 'Bit early…..', 'people have been predicting lando and max to collide every race since austria give it up yall😭']",47,219,2024-10-27 17:20:18, Pre-Race,10,31
1gdd55b,When Franco Colapinto met Martin Brundle (again!),https://youtu.be/nRC60U2FHec?si=6DzZe6W6t7qOvEPn,https://www.reddit.com/r/formula1/comments/1gdd55b/when_franco_colapinto_met_martin_brundle_again/,2024-10-27,0 days,,"[""Set your VPN, if you have one, to the UK. \n\nBasically Franco apologizes because he is not used to doing media between the lap to the grid and the start, then Martin apologizes because Martin didn't introduce himself sooner to Franco. Actually quite a nice interaction but not really a story."", 'It should be against the rules to post country restricted content.', 'Thanks for posting a video nobody can watch 👍', 'Got to see the interview. Everything is cool between Franco and Martin after last week! He hopes he gets a seat next season but wants to prove himself in the next couple of races. \n\nSeriously, give this young man a seat already!', 'Blocking the video to Argentines might not be a smart thing. They wanna watch their driver... 😰', 'Thanks for the summary. Can’t watch here in Canada either. But that’s nice they got to talk.', 'Yes thanks for the summary, I have vpn, but im sitting at Church and cant have sound on', 'I just watched it.', 'Not just Argentina. Blocked here in the arse end of Africa too. Probably a Sky F1 clip - they region block everything on all platforms for some reason. Just another reason not to bother watching them.', 'He just called you a nobody. You really gonna take that?']",38,15,2024-10-27 17:20:18, Video,12,4
1gd9nag,Oscar Piastri explains skipping new tyre run amid Mexico Q1 exit,https://www.motorsportweek.com/2024/10/27/oscar-piastri-explains-skipping-new-tyre-run-amid-mexico-q1-exit/?feed_id=60498,https://www.reddit.com/r/formula1/comments/1gd9nag/oscar_piastri_explains_skipping_new_tyre_run_amid/,2024-10-27,0 days,,"['Hindsight is everything of course, although considering Piastri’s first two runs were both not good enough for him to be easily safe I feel McLaren should have pitted him to give him new softs. \n\nMaybe they felt there wasn’t enough time to make it, or maybe Piastri himself felt confident that he could still go through Q1 on a second attempt with the same softs. And if Piastri used another set of new softs to get out of Q1 it likely would have compromised him in Q2 or Q3. \n\nBut with Ferrari looking strong in Austin and now seemingly in Mexico too based off of practice data, McLaren need to be aware of Ferrari’s growing threat to their lead in the WCC. Ferrari could easily gain another 20 or so points on McLaren today, and then there would only around 20 ish points to overhaul with four rounds to go.', 'Would be painfull if McLaren ends up with empty hands having made a very strong car that arguably could have  gotten both championships.', '~~Next~~ Th-This year?!?!?!?', ""Only one championship was realistic, Max has won 7 races this season. As long as he was consistent he was never losing the WDC\n\nIf McLaren don't win the WCC then that's a huge fumble as Red bull have essentially 1 point scoring car""]",35,6,2024-10-27 17:20:19, News,2,1
1gdf5fh,Carlos's Qualifying @Mexico,https://i.redd.it/rmne3d1lubxd1.jpeg,https://www.reddit.com/r/formula1/comments/1gdf5fh/carloss_qualifying_mexico/,2024-10-27,0 days,Carlos Sainz qualifying at Mexico GP since his debut shows how he improved year on year ,"[""So next year he'll be P20 or won't be starting."", 'What happened in 2020? Sorry newish fan, was it a covid thing?', 'Weird choice to put Toro Rosso in Red.', 'He has peaked with Ferrari ..\nFrom Next year , he might start from middle of grid with that Williams', 'P20, but in Texas', 'Yes , in 2020 at the peak of COVID, there were few races only in mainland Europe.', 'Out of context, but please watch Monza 2020 and thank me later', 'well he still has to make up for 9 more spots']",49,9,2024-10-27 17:20:19, Statistics,49,9
1gdctpe,"Benetton B190 Start-Up and Revs, Nelson Piquet’s Car ",https://youtu.be/Fs36L8Q7cMA?feature=shared,https://www.reddit.com/r/formula1/comments/1gdctpe/benetton_b190_startup_and_revs_nelson_piquets_car/,2024-10-27,0 days,,"['Sweet.\n\nYou might like this clip from behind Jackie Stewart in his Tyrrel. Just phone cam I took at FoS in 2019 : https://www.youtube.com/watch?v=vdrpntwCIdE', 'I went to FoS that year, there was a great selection of F1 cars, including the Schumacher 50th birthday celebration cars.']",26,2,2024-10-27 17:20:19, Video,5,0
1gd68hh,Lifting the lid: Inside the tech fueling Formula One success,https://www.youtube.com/watch?v=lnxrAOhdNLs,https://www.reddit.com/r/formula1/comments/1gd68hh/lifting_the_lid_inside_the_tech_fueling_formula/,2024-10-27,0 days,,[],18,0,2024-10-27 17:20:19, Video,-1,0
1gdffva,[F1] The top three constructors all have a driver starting in the top 3 on the grid,https://i.redd.it/60o4r5zswbxd1.jpeg,https://www.reddit.com/r/formula1/comments/1gdffva/f1_the_top_three_constructors_all_have_a_driver/,2024-10-27,0 days,,"['Ferrari are moving moving to P2 in the constructors championship today no doubt,', ""one of these things is not like the others (bc it's better)"", '2 of them are not like the other', 'Come on Ferrari, just manage to keep your shit together for five minutes…', 'Wasn’t that also true in austin? This doesn’t seem that noteworthy.', 'What a useless statistic...', 'One of these teams only has one top driver though', ""When will Checo be dropped?Constructor's is at risk. Redbull doesn't need his money"", 'Almost like the top three in the WCC are also the three best teams? Who knew?', 'P4 on the grid, Charles is aiming for the win.']",39,15,2024-10-27 17:20:19, Social Media,39,15
1gdevyl,Inside Ferrari’s F1 Collection ,https://youtu.be/CpIquK8NQlw?feature=shared,https://www.reddit.com/r/formula1/comments/1gdevyl/inside_ferraris_f1_collection/,2024-10-27,0 days,,['Terrific video.  Could watch hours of them showing the collection.'],7,1,2024-10-27 17:20:19, Video,7,1
