unique_id,post_heading,link_url,post_url,publish_time,post_age,post_content,top_comments,upvotes,comments,timestamp,tag,upvotes_growth_rate,comments_growth_rate
1gdao8p,[Aston Martin] 400 Grands Prix,https://i.redd.it/9yuu7ybqtaxd1.jpeg,https://www.reddit.com/r/formula1/comments/1gdao8p/aston_martin_400_grands_prix/,2024-10-27,0 days,,"['The wheel of Sigmalonso', 'This would make a great playing card', 'mewing alonso.', 'Honestly it is an absolute travesty that this man has only two WDCs. And even with Honda and Newey joining Aston, I feel like it is a little too late for Alonso. By the time he drives a Newey machine will be when he has already turned 45 ! And already this year at times he has looked like he has lost some of his edge', 'In the largest photo he looks more like Javier Bardem than Fernando Alonso.', 'Hope Newey holds up his end of the bargain. Alonso showed loyalty to AM staying with them for another rebuild and being a mentor to Lance. Hopefully in a few years it’ll pay off.', ""It says 400 starts. Technically he hasn't started 400 races yet. He's only on 396."", 'Every Alonso Everywhere All At Once', 'The level he keeps driving at with this many GPs at his age is insane', ""I'm gonna tell my kids that he was the real GOAT. Not anyone else.""]",820,28,2024-10-27 17:19:54, Social Media,227,2
1gcrs9l,2024 Mexican Grand Prix - Free Practice 3 Classification,https://i.redd.it/897lxfcwa5xd1.jpeg,https://www.reddit.com/r/formula1/comments/1gcrs9l/2024_mexican_grand_prix_free_practice_3/,2024-10-26,0 days,,"['Perez COME ON. It’s your home race! You want to redeem yourself after 2023! YOUR DAD IS HERE. YOUR KIDS ARE WATCHING.', ""Ferrari and their 1 lap pace remains a thing... here's hoping they pull it together for quali. Race pace should be fine, but overtaking is not very easy here. McLaren looks rapid again.\n\nThat RB20 has turned into a bit of a shit car. This is one of Max his best tracks, even when the car was not the best, but the onboards just look terrible."", 'Honestly Perez might get outqualified by both AlphaTauris here which is gonna be the final nail in the coffin surely', 'I think VCARB needs to work hard to fumble Yuki strategy this race. That VCARB looks fast.', '""They\'re fucking quick"" - Lewis Hamilton\n\n**EDIT:** Turns out that Sky were a bit trigger-happy on the bleep button, but I propose we all ignore that and continue to pretend he said ""fucking"" to highlight how idiotic and counter-productive the censorship is.', 'First pole for Oscar or another pole for Lando?', 'That McLaren looked on rails in S2 twisty part', 'Checo underperforming at his home race. His poor dad might have another meltdown. \n\nYuki and Lawson on the rookie team still outpaced him.', 'I am tired of tuning in for Mercedes 6 and 7 every week man']",579,155,2024-10-27 17:19:55, Statistics,-4,0
1gd9z1l,Vettel won the Indian GP ,https://www.reddit.com/gallery/1gd9z1l,https://www.reddit.com/r/formula1/comments/1gd9z1l/vettel_won_the_indian_gp/,2024-10-27,0 days,"11 years ago on this day, Sebastian Vettel won the Indian GP at Buddh International Circuit, Noida. What a moment it was!! It was also the last time F1 raced in India.","['Vettel won *all the Indian GPs.', 'fuck UP govt of 2013 for taking away Indian GP from us\n\nhow much would i love to attend one', 'Nice one Seb, six wins in a row, will he make it to nine?\n\nThree more races and then this borefest of a season will finally come to an end, hopefully 2014 will be more exciting with new regulations coming in! /s', '2nd pic is as legendary as Senna mclaren down the eau rouge pic', 'I miss him.', ""didn't he win all three times too?\n\nALSO I LOVE THE SECOND PHOTO."", 'Bowing before the bull ❤️', ""It's been 84 years"", 'Two things about F1 I do miss']",516,33,2024-10-27 17:19:55, Throwback,118,5
1gcwde4,[@AlpineF1Team] YESSS Pierre GASLY. A storming drive in Qualifying to P8.,https://i.redd.it/7mozwcuid6xd1.jpeg,https://www.reddit.com/r/formula1/comments/1gcwde4/alpinef1team_yesss_pierre_gasly_a_storming_drive/,2024-10-26,0 days,,"['Impressive performance', 'Another Gasly mega quali performance, shame the team will screw his race tomorrow', 'He’s slowly starting to look like Littlefinger from Game of Thrones', 'Two banger qualis in a row.', 'Less than a second off isnt bad, just sucks that they fell behind so much compared to their ceiling in 2023', 'Gasly putting that shitbox in places it doesn’t deserve to be. Hoping he can convert it to a points finish tomorrow.', 'The tractor whisperer', 'Liked by Pierre Gasly', 'Give the man a good car, and watch him go!\nNO 6.9S PIT STOPS YEAH ALPINE😭😭🤣', ""Didn't even notice him since he was like 6th in Q1. Well done, happy for them.\n\nAlso, unlike Gasly, Ocon had no upgrades at COTA. Did he recieve them here?""]",431,38,2024-10-27 17:19:56, Social Media,2,0
1gcvniy,"Alonso, Stroll, Bottas, Tsunoda & Lawson out of Q3 (session red flagged as Tsunoda crashes into the barriers)",https://dubz.link/c/d2b67c,https://www.reddit.com/r/formula1/comments/1gcvniy/alonso_stroll_bottas_tsunoda_lawson_out_of_q3/,2024-10-26,0 days,,"['4 teams that had a driver out in Q1 also have a driver in Q3', 'Kept Liam behind him, tactical crash.', 'PIERRE GASLY!!!!', 'Komatsu has done wonders for Haas it’s honestly so impressive', 'Lawson and Alonso right behind him 👀👀👀\nPlease let this rivalry blow up lmao', 'yuki did his best to stay ahead of liam', 'Tsunoda outqualified Lawson with this', 'RIP ""maybe they reallyyyyy should put Yuki in the 2nd RB"" \n\n26 Oct Q1 - 26 Oct Q2', 'By the logic RBR is picking their drivers this should land Yuki right in the redbull', 'Fucking Alonso and Lawson are going to start next to each other again']",384,129,2024-10-27 17:19:56, Video,-8,0
1gcwok2,2024 Mexican Grand Prix - Qualifying Classification.,https://i.redd.it/3yr5dh89g6xd1.jpeg,https://www.reddit.com/r/formula1/comments/1gcwok2/2024_mexican_grand_prix_qualifying_classification/,2024-10-26,0 days,,"['Perez and Piastri getting smoked by my man Bottas 🐐', 'Former Toro Rosso driver: P1\n\nFormer RBR driver who shouldn\'t be named near Christian Horner: P8\n\nFormer RBR driver who drove for the team before Checo: P9\n\nDriver who was considered to drive for RBR but Checo was having better ""driver data"": P10\n\nCurrent Toro Rosso driver who shouldn\'t be named near Christian Horner: P11\n\nCurrent Toro Rosso driver who is still a ""rookie"": P12\n\nCheco Perez: P18', 'Leclerc committing to the P4 bit', 'Gasly and K-Mag continuing their phenomenal run of form from COTA, great laps from both of them and hopefully they can convert it into points finished tomorrow', 'Red Bull already typing the ""Great recovery drive"" press release', ""Rumours of Alex Albon's demise were greatly exaggerated"", 'Great job by Carlos. Also kudos to Alex after all the trash talk that’s been happening specially here. \n\nI feel bad for Checo. I wanted him to have an okay home race in case it’s the last one. \n\nFranco had a terrible session. Pulled a Logan but car is totally unbalanced and couldn’t control it. He was saying that since the end of FP3. Looks like they fixed nothing. Also not having his race engineer this weekend may have affected him a bit. \n\nSad weekend for LATAM.', 'Seems like another good weekend for Haas and absolute disaster for Checo.', 'I did not see Sainz pole coming but good on him. It just might be an interesting race tomorrow.']",368,120,2024-10-27 17:19:57, Statistics,3,0
1gcw6ca,"Sainz on pole, Verstappen P2, Norris P3",https://dubz.link/c/797b29,https://www.reddit.com/r/formula1/comments/1gcw6ca/sainz_on_pole_verstappen_p2_norris_p3/,2024-10-26,0 days,,"['Sainz to Williams I wanna end it all', ""What a couple of laps from Sainz, he did the 2 best laps if I'm not mistaken"", 'Leclerc P4 \n\nall according to plan', 'This is gonna be a REALLY interesting start', 'One of those weekends where Sainz is just LOCKED in', 'stellar job from carlos there! and max coming through with that one lap wonder', 'Did Max even have a new set of tires for that last lap? All the pressure to put in that lap and of course he does it.', 'Sainz is going to fight the hardest he ever has tomorrow. He knows that these last 5 races will most likely be his last opportunity to add another win to his career at Ferrari.', 'Charles loves his P4 starts anways. No worries. Especialy on this track he should have a good chance to challenge all 3 cars ahead.\n\nSainz absolutely mega though to get pole.', ""Can't believe Sainz is going to drive a Williams next year""]",348,111,2024-10-27 17:19:58, Video,0,0
1gczlzd,Perez’s confidence crisis hits new low at the worst time,https://www.the-race.com/formula-1/perezs-confidence-crisis-hits-new-low-at-the-worst-time/,https://www.reddit.com/r/formula1/comments/1gczlzd/perezs_confidence_crisis_hits_new_low_at_the/,2024-10-27,0 days,,"[""This is Perez every year.  The only difference is Red Bull doesn't have a rocket ship anymore so now instead of Perez getting 6th and 7th he's been falling completely out of the points."", 'It’s actually nuts he still has a seat mid-season. There’s not even any doubt anymore that either VCARB driver would outperform him in the RBR seat - they’re literally already doing it, in the VCARB car, while he’s in the RBR. You can’t un-math that math.', ""Apparently Tsunoda is running with a floor upgrade that Lawson doesn't have.\n\n>In Lawson’s favour is how close he seemed to be getting to Tsunoda’s pace despite lacking the team’s successful floor upgrade. He – and Red Bull – will know the worth of that development, which seems to be working well, and while Lawson doesn’t want to focus on his performance relative to having an upgrade or not, it is a relevant factor."", "">Man Who Thought He'd Lost All Hope Loses Last Additional Bit Of Hope He Didn't Even Know He Still Had"", 'I’m sorry, but they should have let him go after 2023. \n\nThe RB19 was one of the most dominant cars we have seen in a long time, and if he hadn’t had a few good races early in the season he would have come in 3rd place. \n\nI like the guy, but his struggles in Quali and race pace cant be ignored. Im sure the money is great, but Red Bull is shooting themselves in the foot.', 'How does this dude get paid like he does and shit the bed every week.  Its fucking mind blowing.', ""A new low?\n\nNope.\n\n\nHe's in a hole for more than a year and a half. Everything else is just plain denial by himself and those with a say at RB."", 'What if its not a confidence issue but a skill issue?', '*performance crisis\n\nFixed that for you']",321,115,2024-10-27 17:19:59, News,9,1
1gczbo0,"[Carlos Sainz] Super happy! I couldn’t imagine a better Qualifying. I enjoyed very much the last two laps of Q3, pushing in every corner and keeping it as clean as possible. I’ll do everything to defend pole at the start and fight to bring home a win!",https://twitter.com/Carlossainz55/status/1850314393831227788,https://www.reddit.com/r/formula1/comments/1gczbo0/carlos_sainz_super_happy_i_couldnt_imagine_a/,2024-10-27,0 days,,"['I believe in you Carlos.', 'Vintage Smooth Operator', 'Carlos was on fire today. I hope he has no reliability issues or incidents and he can convert this into a W. Also Checo sucks.', 'VAMOOOSSSSSS', 'Honestly I want to believe he can keep pole on the first lap, but honestly  what can he really do? Has anyone ever kept the lead into turn one here?', 'Chop Max and take the inside line. Will give him half a chance', ""That's the sort of thing max would know and pull back to be p2"", 'Max barely kept his lead in 2022 against the Merc duo']",304,16,2024-10-27 17:19:59, News,7,0
1gcuhcz,2024 Mexican Grand Prix - Qualifying Discussion,https://www.reddit.com/r/formula1/comments/1gcuhcz/2024_mexican_grand_prix_qualifying_discussion/,https://www.reddit.com/r/formula1/comments/1gcuhcz/2024_mexican_grand_prix_qualifying_discussion/,2024-10-26,0 days,Here we go! Who'll be on pole?,"['The 2 best cars just got out qualified by a fucking sauber', ""Once again disappointed we don't get the official mariachi F1 theme"", 'this is an oscar disastri', 'I wonder just how erect James Vowles was watching Carlos pull those two laps out', 'Lawson and Alonso being right next to each other on the grid is making chuckle haha', 'All that buildup and he’s slower than a Sauber 😂😂😂😂😂😂😂😂😂', '“Not the result we wanted in [insert city], but there’s plenty more weekend to come.” Calling it now', 'Glad RBR kept Perez on till Mexico so his own fanbase can see how much he sucks now in person.', 'If I told my friends Colapinto outqualified Perez, Ocon and Piastri, they would think he qualified P5/6', 'At this point, we are most definitely getting a safety car in the race tomorrow']",291,6124,2024-10-27 17:20:02, Qualifying,0,-4
1gcwt8q,"Sainz dominates Mexico qualifying after Piastri, Perez knocked out",https://racer.com/2024/10/26/sainz-dominates-mexico-qualifying-after-piastri-perez-knocked-out/,https://www.reddit.com/r/formula1/comments/1gcwt8q/sainz_dominates_mexico_qualifying_after_piastri/,2024-10-26,0 days,,"['Horner: Checo you have to get close to the McLaren’s for the constructors title come on.\n\nPerez: ok copy that', ""My boy Piastri is struggling the last couple of races.  What's going on with him?  He's usually rock solid with a strong pace that is consistent but generally slower than Norris' top pace.  \n  \nPerez is just being a good wingman and trying to make Max look even better to the fans.  Good Guy Perez"", ""What was Piastri's problem after all? Just messed up?"", 'I propose that Sainz has earned a nickname.\n\nCarlos ""Two Laps"" Sainz', 'If things don’t improve over at Williams in the next few years, I’m sure that Sainz will have no problem finding another top drive when the opportunity arises. He’s a WDC-caliber driver at this point in his career.', 'Awful title, it sounds like Sainz dominated because Piastri and Perez didn’t pass Q1…', 'Perez didnt want to leave Piastri alone. Perfect Host', 'His pace was fine but he made a mistake that cost him a second and then had to do another run on the soft tyres and by that point the tyres were old. If he did not make a mistake by going wide on that first run he easily would have gotten through. It was a bad mistake but these things happen.', ""It's easy to forget he's only in his second year of F1. He has huge potential but it doesn't take too much for him to be knocked out in Q1""]",246,47,2024-10-27 17:20:03, News,0,0
1gcr9fs,"[Williams Racing] Colapinto be cookin’, he puts the FW46 into P5",https://x.com/WilliamsRacing/status/1850239086285709435?s=19,https://www.reddit.com/r/formula1/comments/1gcr9fs/williams_racing_colapinto_be_cookin_he_puts_the/,2024-10-26,0 days,,"['In free practice?', 'Reads post title.  \nLooks at current leaderboard  \nReads title again  \nSays ""They\'re bragging about this in the middle of a practice session?""\n\nCloses reddit\n\nEdit: Sauber social media team needs to ensure one of their cars goes out first in quali, and as soon as their lap finishes tweet ""Bottas/Zhou be cookin’, P1 in quali!""', 'He’s 12th now', '... In practice', ""If he would've exited the pits first, then he could've been P1."", 'We talking about practice, not quali, not the sprint, not the race, but practice?', '""be cookin""', ""This wasn't even at the end of practice. It was in the middle lmao. The admin needs to go back to sleep or whatever."", 'For a minute there, I thought I missed quali.', 'Aged like milk']",239,29,2024-10-27 17:20:03, Social Media,5,0
1gd3faw,"Stella critical of McLaren's Mexico GP qualifying execution as Norris hits ""limit""",https://www.motorsport.com/f1/news/stella-critical-of-mclarens-mexico-gp-qualifying-execution-as-norris-hits-limit/10667257/,https://www.reddit.com/r/formula1/comments/1gd3faw/stella_critical_of_mclarens_mexico_gp_qualifying/,2024-10-27,0 days,,"[""Perfect storm for McLaren, seems to have hit the limit with a thin WCC lead while Ferrari have unlocked the true potential of the car and absolutely eating into their lead\n\n And upcoming tracks don't look favorable especially a cold Brazil and Las vegas"", 'Norris was absolutely pushing to the limits \nIdk what this guy expects from his drivers', '> But we have to say that the two laps in Q3, they weren’t great.\n\nStella doesn’t come across as a guy who focuses on the right things. Any good man manager would say that Q1 and Q2 showed the car has good potential and Lando can get a win. \n\nWhy focus on the mistake when the driver himself is self critical enough?', 'Wow..so Stella has now started criticising his driver who is in the hunt for WDC..just wow\n\nEven if you feel that it’s correct, at least have the smarts to not put more pressure on your own driver!', 'This headline makes it seem like he is just critical of Lando and he thinks Lando has hit his limit. Yet the article is Lando talking about the limit, and Andrea also talks about Oscar.\xa0\n\nGotta love the media going for their headlines.\xa0', 'Man I am not a fan of Lando ! But what are these comments ??', ""Sometimes, on some tracks, you don't want pole.\n\nThis is one of them, alongwith COTA where the run down to Turn 1 is just too much and more often than not Pole sitter isn't leading at the end of Lap 1.\n\nLando being P3 with potentially a double slipstream into T1 is actually so much better rather than defending from pole with Max and the two Ferraris behind him. Also reduces the pressure on him going to the start line as well since he knows he isn't starting on pole."", 'Maybe McKaren should focus more on other things than their drivers. Like why they told Norris he was in front of the apex instead of just telling the truth last race so he could have decided to return the place instead of taking a slam dunk 5 sec penalty.', 'I mean Stella could have been like Vasseur and used ‘he only started the weekend this morning, because he missed FP1 and FP2’ as an excuse. Norris could have said ‘it wasn’t the best start to the weekend I missed FP1 and FP2 I wasn’t comfortable with the car but this is not an excuse’ as an excuse. Credit to both of them for owning their issues and not looking for ways to shift blame.']",222,93,2024-10-27 17:20:04, News,6,3
1gcvoly,Replay of Tsunoda's crash,https://dubz.link/c/c59693,https://www.reddit.com/r/formula1/comments/1gcvoly/replay_of_tsunodas_crash/,2024-10-26,0 days,,"['“So sad for Lawson”, “Lawson is big winner here” the duality of man.', 'Right after the post saying Red Bull need to look at Yuki for the seat lol', 'lawson is big winner here\n\nperez and tsunoda bottled it', 'WHYYYY\n\nI knew i shouldn’t have gotten excited', 'What a dumb crash lol', 'So sad for Lawson', 'Always a shame when qualifying crashes happen :/', 'Checo with an exhale of relief', 'bruh you guys are so quick ! I watched it live like 2 mins back', ""Real dumb crash when it would have been so easy to impress  this weekend given Perez's form""]",213,81,2024-10-27 17:20:05, Video,-4,0
1gd9n6r,"McLaren's ""heavily revised"" new floor is only a ""tiny"" improvement - Norris",https://www.racefans.net/2024/10/27/mclarens-heavily-revised-new-floor-is-only-a-tiny-improvement-norris/,https://www.reddit.com/r/formula1/comments/1gd9n6r/mclarens_heavily_revised_new_floor_is_only_a_tiny/,2024-10-27,0 days,,"[""I suppose it's normal, we're almost at the end of this regulation cycle so these cars must be very close to their development limit.\n\nGood for them that it actually was an improvement and not a downgrade, the floor is a very sensitive part and sometimes what you think is going to be an upgrade turns out to gives problems instead, like bouncing or unpredictability.\n\nLook at how Ferrari lost direction for a few races after Monaco.\n\nOr Mercedes too."", 'The true test of seeing if the upgrades have worked will be how they fare against Ferrari on race fuel levels', 'I think the thin atmosphere is masking it performance a bit.', ""I never trust a driver or team when they talk about how good their own car or upgrades are. Nobody wants to look like they think they are the best. \n\nMust be hard when people say you have had the best car for most the season and you haven't capitalised on it, coupled with comments you made in the past about winning in the fastest car is easy. I would be trying to downplay the upgrades too, try and take some of that pressure off.\n\nI hope this year is a learning experience for some people about what it takes to be a WDC, and that often  it's more than just having the fasest car and making comments about these things and other drivers might come back to bite you."", 'Next year is going to be so good, especially if Mercedes can join the party more consistently', 'it is admirable how aston keeps finding ways to fuck it up more though', 'Mercedes - ""You guys have a direction?""', 'For sure. I know they really wanted pace improvement for Mexico. But we won\'t see results until Brazil. And even Brazil and Vegas are higher elevations.  And if there\'s even ""tiny"" noticable improvement in Mexico we\'ll see some real pace by qatar for sure. \n\nHopefully at least.', 'It might improve long-run performance.']",228,27,2024-10-27 17:20:05, News,63,2
1gcw6qj,2024 Mexican Grand Prix - Post Qualifying Discussion,https://www.reddit.com/r/formula1/comments/1gcw6qj/2024_mexican_grand_prix_post_qualifying_discussion/,https://www.reddit.com/r/formula1/comments/1gcw6qj/2024_mexican_grand_prix_post_qualifying_discussion/,2024-10-26,0 days,Bring on the turn 1 chaos tomorrow.,"['Max P2, Perez P18 ...in Mexico. \n\nWow.', 'Turns out putting the Toyota logo on the back of the Haas is the equivalent of putting flames on the side of your car, makes it faster', 'So Sainz starts on Pole with the longest straight to T1, with the three people who believe they have a shot at winning the WDC.. Merc’s could be 1-2 after Turn 3 lol', 'Hahaha ""2 laps, 2 laps""\n\n\nWhat a drive of Sainz, he is on good form. His sprint race last week and qualifying this week.', ""Checo just dropped a new stinker. This can't be defended anymore. Spicy front two rows tomorrow into turn 1. At least 1 one of them will have damage at the end of lap 1."", 'Perez on F1TV: There are 4  races to go and we have to get on top of it as a team\n\n 🥲', 'The competitiveness this season would have been so crazy if the championship started in May...\n\nMcLarens, Ferraris, & Redbulls are very close with Mercs slightly behind. So good to watch..', '""Thank you very much. Good stat.""\n\nSainz loved that one.', ""Qualifying 18th on your own home grand prix should be the final nail in the coffee for your future at Red Bull Racing\n\nEdit : *in the coffin but I'm not editing that autocorrect 😂"", 'They should drug test Carlos. Those two Q3 laps were insane and came out of nowhere. Massive stuff.']",193,985,2024-10-27 17:20:08, Post-Qualifying,-5,2
1gcwn9p,Perez puzzled by brake issues in Mexico F1 qualifying disaster,https://www.autosport.com/f1/news/perez-puzzled-by-brake-issues-in-mexico-f1-qualifying-disaster/10667215/,https://www.reddit.com/r/formula1/comments/1gcwn9p/perez_puzzled_by_brake_issues_in_mexico_f1/,2024-10-26,0 days,,"['Every weekend there’s some excuse of confusion or something odd happening. \n\nP18 when the car is proven capable of P2 is worse than embarrassing.', 'The issue lies between the seat and the steering wheel', 'For a top team, Red Bull has given Perez such a long run. Heck, Ferrari is breaking the best pair on the grid to make even stronger team. \n\nRed Bull fully deserve to be 3rd in WCC.', 'The issue: he just realized that it’s the pedal on the left.', ""He seems quite easy to confuse. It's been every weekend for 2 years"", 'Your teammate just qualified P2 and is leading the WDC\n\nThe issue is clearly skill my guy', ""Every race weekend he has some issue, he's really unlucky /s"", ' Funny when he had like one good weekend and max had one average he was like yeah now you see this is the issue I’ve been dealing with!\n\nWhere’s in reality the delta was less cause like Monza is a short track with little corners to make difference.', ""We're all puzzled by Perez pretty much every weekend for the last 3 years.""]",169,169,2024-10-27 17:20:09, News,-2,0
