unique_id,post_heading,link_url,post_url,publish_time,post_age,post_content,top_comments,upvotes,comments,timestamp,tag,upvotes_growth_rate,comments_growth_rate
1g4wt2g,Albon reflects on his path to 100 F1 race starts,https://www.formula1.com/en/latest/article/exclusive-my-journey-has-not-been-as-smooth-albon-reflects-on-the-ups-and.6wdY5n22UuddL0EbIKeP5C,https://www.reddit.com/r/formula1/comments/1g4wt2g/albon_reflects_on_his_path_to_100_f1_race_starts/,2024-10-16,0 days,,"[""Always love an Albon interview. Hoping he does well enough to enjoy at least another 100 races!\n\nSidenote: It's a real shame we didn't get to see the Gulf livery again this eyar..."", 'Did you guys saw his interview ok high performance podcast ? \nReally insightful, have some interesting parts about battling self doubt, regaining trust', ""Here's to a 100 more races, Albono ♡"", ""my favorite driver ever since his start in F1. There is just something about Alex what other drivers don't have (for me), his driving, his personality and knowledge and when he's a host as a commentator, it's always a delight. To many more races Alex, we love you ❤"", 'So, it all started after a dude blew a 70 points lead over a guy who has been fired from Haas and has been avoided by other teams like the plague. The domino effect is incredible', 'My favourite interview from him.', 'i just watched it, really great to have a better understanding of his experiences.', 'What do you mean?', 'They’re referring to Dan Ticktum losing the European F3 title in 2018 to Mick Schumacher when Ticktum was a Red Bull Junior. The story is that Marko wanted Ticktum in F1 for Toro Rosso in 2019, but he never got the required SL points so they chose Albon.']",90,10,2024-10-17 07:22:06, News,4,0
1g4zzhl,Tom Stallard: Piastri’s Olympic Silver-Medallist Race Engineer | F1 Beyond The Grid Podcast,https://youtu.be/SgS1UAcClkk?si=DAIC-jYONLhU71EZ,https://www.reddit.com/r/formula1/comments/1g4zzhl/tom_stallard_piastris_olympic_silvermedallist/,2024-10-16,0 days,"> Speaking to Tom Clarkson at McLaren’s headquarters, Stallard talks about his gruelling fitness regime as an Olympic rower, what a race engineer’s relationship with their driver is all about, working with the likes of Jenson Button, Daniel Ricciardo and Carlos Sainz, how Oscar Piastri is galvanising the team now, and much more.

* 07:28​: Will McLaren prioritise ’25 or ’26?
*14:23​: Was Stallard fitter than Piastri?
* 23:23​: Why he swapped rowing for F1
* 43:15​: Is Oscar a future World Champion?
* 51:38​: What Williams can expect from Sainz","['He was looking for a different kind of (front) row.', ""I hope you're well and excited for the next F1 race, at COTA. \nSharing this since Tom Stallard, in addition to being Oscar's race engineer is also Director of Human Performance at McLaren.\n\nIn the YT transcript it's at 12.05, if you'd like to hear about peak mental and physical fitness (in case this helps with trackside performance).\n\nI'm particularly hoping this team can (effectively) double-stack their pit stops, to enable peak performance from their drivers."", ""Oh is he an Olympic silver medalist? I've never heard that mentioned before."", ""i feel like Tom (Clarkson) was just throwing popular narratives on Stallard's face, and then him giving reasonable answers to them\n\n  \nedit: Clarkson"", '6/10', 'In fairness, he won it during the 2008 Summer Olympics, so quite a while back.', 'Bruh... stop making me feel old.']",82,7,2024-10-17 07:22:06, Video,5,0
1g5jqu7,How F1's top teams have evolved their brake solutions during 2024,https://www.motorsport.com/f1/news/how-f1s-top-teams-have-evolved-their-brake-solutions-during-2024/10663054/,https://www.reddit.com/r/formula1/comments/1g5jqu7/how_f1s_top_teams_have_evolved_their_brake/,2024-10-17,0 days,,[],17,1,2024-10-17 07:22:07, Technical,7,0
1g5fnbb,The talent spotters that moulded Piastri into an F1 winner,https://www.autosport.com/f1/news/the-talent-spotters-that-moulded-piastri-into-an-f1-winner/10663046/,https://www.reddit.com/r/formula1/comments/1g5fnbb/the_talent_spotters_that_moulded_piastri_into_an/,2024-10-17,0 days,,"['interesting article, terrible title\n\n> ""But Chris turned up in a shirt - I\'ve never seen him ever in a shirt!""\n\nI’m american and cannot figure out what ""shirt"" means in british lol', 'That was a nice article! Every time I learn a new thing about him I like him more. I honestly believe, except those involved in the Alpine drama, no one can dislike this guy.', 'It has buttons and collar']",14,5,2024-10-17 07:22:07, News,6,0
1g5konv,Colapinto on Merchandising,https://youtu.be/Z3drtcYfrbI?si=mePvd0RK4zpRFZO9,https://www.reddit.com/r/formula1/comments/1g5konv/colapinto_on_merchandising/,2024-10-17,0 days,"Basically roasting Williams for mechandising pricing. Translation: I hope people don’t go broke for buying this silly stuff. Williams put prices on this stuff that not even Cristiano Ronaldo can pay, people buy it anyways and then they have to eat rice for two month. Just buy the non official ones they are cheaper…”.","['He’s acutely aware of the economic crisis Argentina is experiencing and this is simply directed to his fans at home.', 'Speedrunning to be reddits sweetheart']",5,2,2024-10-17 07:22:07, Video,5,2
