unique_id,post_heading,URL,publish_time,post_age,upvotes,comments,timestamp,tag
1g1yz1l,[OT] Drivers among those to lose out as W Series reveals £17 million debts,https://formulascout.com/drivers-among-those-to-lose-out-as-w-series-reveals-17-million-debts/124732,2024-10-12 12:24:46,1:10:44.047522,33,24,2024-10-12 13:35:30,:post-off-topic: Off-Topic
1g1yytl,EU Parlimanent Member now calls for investigation into F1 owners: breach of competition law!,https://www.motorsport-magazin.com/formel1/news-290886-eu-abgeordneter-fordert-untersuchung-gegen-f1-eigentuemer-verstoss-gegen-wettbewerbsgesetze/,2024-10-12 12:24:27,1:11:03.047572,202,39,2024-10-12 13:35:30,:post-news: News
1g1yw41,Audi says Schumacher in frame for 2025 Sauber F1 seat,https://www.motorsport.com/f1/news/audi-says-schumacher-in-frame-for-2025-sauber-f1-seat/10662351/,2024-10-12 12:20:07,1:15:23.047584,252,69,2024-10-12 13:35:30,:post-news: News
1g1yscv,Lawson makes Red Bull test appearance ahead of F1 return,https://www.formula1.com/en/latest/article/lawson-makes-red-bull-test-appearance-ahead-of-f1-return-at-united-states-gp.6nRDS5nkdNCdpjDnyTgHyG,2024-10-12 12:13:54,1:21:36.047595,10,10,2024-10-12 13:35:30,:post-news: News
1g1w9jc,Newey voices concerns over F1 2026 regulations,https://www.pitinsider.com/newey-voices-concerns-over-f1-2026-regulations/,2024-10-12 09:15:48,4:19:42.047604,350,55,2024-10-12 13:35:30,:post-news: News
1g1ujcq,Ask r/Formula1 Anything - Daily Discussion Thread,https://www.reddit.com/r/formula1/comments/1g1ujcq/ask_rformula1_anything_daily_discussion_thread/,2024-10-12 07:00:50,6:34:40.047613,0,8,2024-10-12 13:35:30,:post-daily-discussion: Daily Discussion
1g1tsax,"On this day 10 years ago, the inaugural Russian Grand Prix was held in Sochi Autodrom. Lewis Hamilton was crowned the winner of the race.",https://i.redd.it/uw4ervx7l9ud1.jpeg,2024-10-12 06:04:18,7:31:12.047623,1067,107,2024-10-12 13:35:30,:post-throwback: Throwback
1g1qgq2,Life is a highway !,https://i.redd.it/gtkf5k6el8ud1.png,2024-10-12 02:32:27,11:03:03.047632,7748,84,2024-10-12 13:35:30,:post-photo: Photo
1g1lone,Max will be driving in the 23h race for mental health next month! ,https://i.redd.it/nyu7tfvhc7ud1.jpeg,2024-10-11 22:19:13,15:16:17.047641,4098,113,2024-10-12 13:35:30,:post-social-media: Social Media
1g1l1zc,Charles Leclerc responds to a quote taken out of context [via Instagram],https://www.reddit.com/gallery/1g1l1zc,2024-10-11 21:49:47,15:45:43.047651,5160,79,2024-10-12 13:35:30,:post-social-media: Social Media
1g1kw0g,Gary Anderson: Where Haas's big Toyota F1 deal could go wrong,https://www.the-race.com/formula-1/gary-anderson-where-haass-big-toyota-f1-deal-could-go-wrong/,2024-10-11 21:42:00,15:53:30.047660,0,10,2024-10-12 13:35:30,:post-news: News
1g1kt6y,"On this day in 2020 at Nürburgring, Lewis Hamilton equalled Michael Schumacher's record of 91 F1 Grand Prix victories.",https://i.redd.it/qqhag17357ud1.png,2024-10-11 21:38:24,15:57:06.047669,898,25,2024-10-12 13:35:30,:post-photo: Photo
1g1isza,"[@paddockpassion] WHICH TEAM HAS THE MOST PARTNERS? With Toyota returning to F1 with Haas as a technical partner, check out how many partners and sponsors each F1 team have onboard during the 2024 season & who's sponsoring which team",https://www.reddit.com/gallery/1g1isza,2024-10-11 20:06:39,17:28:51.047678,1155,137,2024-10-12 13:35:30,:post-social-media: Social Media
1g1h5u2,Williams Racing’s Vowles on F1 | Bloomberg The Pulse 10/11/24 (interview with James Vowles from 32:55),https://youtu.be/vPcSWZnJfB4?t=1975,2024-10-11 18:52:56,18:42:34.047690,13,0,2024-10-12 13:35:30,:post-video: Video
1g1bvbw,Nico Rosberg warns Aston Martin about becoming the ‘PSG’ of F1,https://www.motorsportweek.com/2024/10/11/nico-rosberg-warns-aston-martin-about-becoming-the-psg-of-f1/?feed_id=59668,2024-10-11 15:02:23,22:33:07.047699,4685,434,2024-10-12 13:35:30,:post-news: News
1g198d1,Toyota wants boosted F1 pipeline for Japanese drivers with Haas tie-up - Formula Scout,https://formulascout.com/toyota-wants-boosted-f1-pipeline-for-japanese-drivers-with-haas-tie-up/124745,2024-10-11 13:01:23,"1 day, 0:34:07.047708",621,84,2024-10-12 13:35:30,:post-news: News
1g18c5n,[Lando Norris on Instagram] World Mental Health Day:) just checking in on you,https://dubz.link/v/b447b6,2024-10-11 12:14:09,"1 day, 1:21:21.047718",536,37,2024-10-12 13:35:30,:post-video: Video
1g17keq,Brief Summary of an Evening with Guenther Steiner ,https://www.reddit.com/r/formula1/comments/1g17keq/brief_summary_of_an_evening_with_guenther_steiner/,2024-10-11 11:29:57,"1 day, 2:05:33.047728",284,36,2024-10-12 13:35:30,:post-discussion: Discussion
1g16kv4,Haas F1 Team | Sporting a new look on the VF-24. We can’t wait to get started and fulfil our combined ambitions.,https://www.reddit.com/gallery/1g16kv4,2024-10-11 10:24:57,"1 day, 3:10:33.047737",3553,200,2024-10-12 13:35:30,:post-photo: Photo
1g16jbz,[Motorsport.com] Toyota Insists “No Plan” For F1 Engine Or Works Team Return,https://www.motorsport.com/f1/news/toyota-insists-no-plan-for-f1-engine-or-works-team-return/10662087/,2024-10-11 10:21:53,"1 day, 3:13:37.047746",249,20,2024-10-12 13:35:30,:post-news: News
