unique_id,post_heading,post_url,publish_time,tag,post_content,top_comments,upvotes,comments,upvote_ratio,score,total_upvotes_comments,total_score_comments,upvotes_growth_rate,comments_growth_rate,upvote_ratio_growth_rate,score_growth_rate
1hfinpn,"F1's next female driver will need time to get there, says Pulling",https://www.reddit.com/r/formula1/comments/1hfinpn/f1s_next_female_driver_will_need_time_to_get/,2024-12-16, News,,"['With the current pool of drivers as well as the F2 talent, it seems like we are so far away from having a woman driving in F1 again. Like someone else said, it would be more or less impossible unless they’re incredibly rich.', 'Yup but I can guarantee it won’t be Sofia Flörsh', 'Her point is spot on about the money. The prize for the F1 academy winner being a fully funded sear in GB3 is a great start, but those junior categories should have something in place to mitigate the fact that people with more money can do a gigantic amount of testing. Maybe some collective tests for drivers without private testing programmes?', '>""It shouldn\'t be needed, but it is needed. That\'s the sad reality. I hope it stays around for a very long time and keeps giving opportunities to girls that are in my position and can\'t get through without it.""\n\nWell said. From my understanding, the idea of F1 Academy is to shine a spotlight on the sport so that women and younger girls are more encouraged to join. While I also share her sentiment that it will take a while to get to that point where a breakthrough will happen, the current series is a great stepping stone into making that reality possible', ""The biggest thing is for the media to not hype up every performing woman in motorsport as surely a F3 shoe-in. It puts unnecessary pressure on them and it doesn't just go for women. The amount of hype Kimi has gotten, I'm nervous with him being made to fill in Sir Lewis's seat after just 3 years of being in single-seaters."", 'So, all our hopes rely on Max and Kelly getting a daughter?', 'These things take generations to come to fruition. \n\nYou have the initial spark that gets a certain ""demographic"" interested in the sport. Then there are years of growth where more and more kids get involved. Then when the talent pool is big enough, there is another individual who can make it to an elite level.\n\nLewis made it to F1 in 2007. He is huge inspiration for black kids and other minority groups in the UK, and subsequently a lot more kids got into go-karting. This is continuing to grow year on year. But we still haven\'t seen another kid make it yet.\n\nThe F1 academy is a spark, but nowhere near as big as Lewis. At some point there will be a girl who really is able to compete at a competitive level in F2/F3. And this will be a further spark. \n\nThere is an element of athleticism in F1, but it isn\'t the be all and end all. We have drivers racing into their mid 40s. There is also Yuki and Lando... so yeah. Women can compete with that.', ""I mean this is kind of what Susie has been saying the whole time, but people just prefer not to listen and shit on F1A and their initiatives instead. The goal of F1A is to increase the number of women in the motorsport talent pool in all areas - that's why they have a karting series as well, that's why they have open days for little girls to try karting, and that's also why they're also spotlighting women working within the teams whether it be in media, PR, engineering etc.\xa0More women in motorsport isn't a bad thing even if it takes decades for women to reach F1.\xa0\n\nLewis has been in F1 for 17 (?) years and we still haven't had the second black F1 driver. These things take time especially in sports that are overwhelmingly white and male"", ""Why doesn't Formula 2 have power steering is my question? Surely such an obvious hurdle could be something they could address in the future? \n\nThis is an honest question so pls don't come for me.""]",284,228,0.86,284,219,219,20,16,0.0,20
1hfif41,[F1] Your favourite race of the 2024 season revealed,https://www.reddit.com/r/formula1/comments/1hfif41/f1_your_favourite_race_of_the_2024_season_revealed/,2024-12-16, News,,"['Monaco was a definitely a race that existed. I get being happy that Charles won, but the race itself was dreadfuly boring.', 'Surprised not to see Canada and Spa up there to be honest. I also kinda loved Hungary for the drama but it wasn’t for everyone haha.', 'Interlagos, Silverstone and Montreal for me 👍', 'It was Brazil. Of course it was.', ""Can't help but feel Canada is being overlooked here, definitely deserved top 3 imo."", 'I thought this season was full of great weekends.\n\n* Max’s Brazil drive with the Alpine podiums\n* Charles breaking his Monaco curse and taking Monza again\n* Lewis taking Silverstone\n* Lando stunning in Miami\n* Montreal’s wet shenanigans with Haas flying through the field in full wets for a minute\n* Russell’s tyre whispering (and disqualification) at Spa\n* The Austria beef with Max and Lando\n* Lewis and Charles charging through the field in Abu Dhabi\n\nAnd those are just the ones I remember', 'I’d argue Canada should be up there.', ""Not necessarily race, but as a drive Brazil, Interlagos felt like I was witnessing what will surely be a talk point in F1's history of drives."", 'Silverstone was pure chaos on track where about 6 drivers could all Ah e realistically won, and all made many silly errors.']",242,182,0.92,242,169,169,1,3,0.0,1
1hfqyq9,"Perez's future, Red Bull decision soon: Lawson in pole with Hadjar in VCARB",https://www.reddit.com/r/formula1/comments/1hfqyq9/perezs_future_red_bull_decision_soon_lawson_in/,2024-12-16, News,,"['Sergio: I’ll make Christian an offer he can’t refuse.', 'Sucks for Yuki, cause if he doesn‘t get the seat there is a good chance he will be out of F1 in 1 or 2 years.', ""Do you guys think promoting Lawson this early could be bad for his career or is just me?\nI don't know, I think it could be a curse for him like it ended up being for Albon and Gasly"", ""**Perez's future, Red Bull decision soon: Lawson in pole with Hadjar in VCARB**\n\nThe Monday after Abu Dhabi was very important in terms of the future for Red Bull as the board of the Austrian giant met to talk about what will be the 2025 line-ups of its two teams, i.e. not only the official team but also that of the Racing Bulls. Max Verstappen has always been clearly confirmed in this 2024, despite some of his hesitations in a certain part of the season, while Sergio Perez's position has never really been firm, not even after the new contract signed in the summer, which was intended to give serenity and stability to the Mexican driver. ‘I have a contract to race next year and unless something changes in the next few days, this will be the situation for next year,’ Perez had said in the Abu Dhabi post-race. ’We are talking to try to understand what is best going forward. We will discuss the situation on both sides and see if we are able to reach an agreement. If not, as I said, I have a contract for next year.’ Perez is mainly paying for a completely negative second half of the season where he collected only 34 points against 118 in the first 12 races, even less than Pierre Gasly with Alpine.\n\n**No surprise: even the Red Bull board would not want Checo Perez as Max Verstappen's team-mate**\n\nDuring the Abu Dhabi weekend, Helmut Marko had confirmed that an important meeting would be held on the day after the last GP of the season ‘to decide the future of both teams’. The Red Bull board, for the first time involved in a decision concerning a driver, expressed their willingness to terminate the relationship (as a driver) with Sergio Perez, while finding a solution that satisfies both parties. It is no coincidence that the Mexican driver was offered to become a brand ambassador, meanwhile maintaining the existing contract with the team signed last summer.\n\nA contract that has never really been a lifeline for the Mexican, even though it contained an important economic clause linked to the early termination of the relationship. 'We have heard rumours that there are around 16 million at stake. He at least wants his money, so he won't leave so easily. And I think there are some legal discussions going on at the moment,’ Nico Rosberg had made known during the Abu Dhabi weekend. The will expressed by the Red Bull board last Monday will or will not become the final decision if all agreements are made. Then it will move on to the official announcements, which, according to Helmut Marko, will take place this week. ‘In the next few days we will announce the news about the driver pair for next year,’ announced the Anglo-Austrian team's super-consultant in his column in Speedweek, admitting that negotiations are ongoing and that a decision will be made in a few hours.\n\n**Honda pushed for Tsunoda's test: the RB20 adapted very well to the Japanese's driving style**\n\nIt is Liam Lawson and Yuki Tsunoda who are vying for the second seat in the official Red Bull team, alongside Max Verstappen. The choice of Horner and Marko has already been made and it would be to bet on Liam Lawson, but the board of the Austrian brand (also at the request of Honda) did not want to rush the decision in the Monday after Abu Dhabi, wanting to wait for the test that Yuki Tsunoda has carried out in the Emirates on the Red Bull RB20. As confirmed by Helmut Marko, a final decision will be made in these very hours but the New Zealand driver would seem to be the clear favourite, with the Japanese driver consequently confirmed in Racing Bulls. In fact, the excellent performance offered by the Japanese driver in the 2025 tyre test in Abu Dhabi, who adapted quickly to the RB20 also due to a driving style very similar to that of Max Verstappen, is unlikely to be enough."", 'Honestly speaking, what the heck does Tsunoda have to do to get that 2nd seat? 💀', 'This must be one of the longest and most drawn out driver sagas in recent memory. All this conjecture just for Perez to be in that seat again next year.', ""I really think that Liam doesn't deserve that seat, RB has nothing to lose with Yuki who is improving seasson after seasson and has nothing but good comments from his team mates and boss."", ""Tsunoda needs to pull a Sainz if he doesn't get promoted.\n\n\nCadillac may be a good idea."", 'Why the **** did horner give him that contract in the first place']",269,121,0.94,269,115,115,148,55,0.019999999999999907,148
1hfi2s4,Formula 1 prize money 2024: How much did McLaren get for winning the championship?,https://www.reddit.com/r/formula1/comments/1hfi2s4/formula_1_prize_money_2024_how_much_did_mclaren/,2024-12-16, News,,"['https://preview.redd.it/4oqbld0si77e1.png?width=1080&format=pjpg&auto=webp&s=f54b7763f9f591d9b894087b4c9e700219dbb74d', 'In 2023 RedBull received an estimated 140 million U.S. dollars, so I´m guessing it would be somewhat close to that figure.', 'Getting what is effectively the budget cap size back in prize money is a fair reward for winning', ""Well, in this case, Red Bull will lose much more in Checo's sponsorship money next season compared to how much they would lose if they dropped from #1 to #3 with Checo onboard.\nSo, considering Helmut said they will make the announcement this week, it might turn out to be a very disappointing announcement."", 'All that hype at the top for a measly 9 million difference?Damn Checo makes twice of that', 'Lots of words to say very little.', 'So, this is wrong for 2 reasons. First off, prize money for this season is likely to be quite a bit more than in 2023, team payments are already $90M higher through 3 quarters and Las Vegas should be way more profitable than last year.\n\nSecond, prize money is paid out based on the previous seasons results, so Mclaren will receive their WCC winning payments next year from the 2025 FOM earnings.', 'More than they would have for coming second', 'Only 9 million difference between spots?  That doesn’t seem like that much..']",153,40,0.89,153,36,36,9,1,0.0,9
1hfmnn4,Red Bull: New RB21 F1 car needs wider operating window,https://www.reddit.com/r/formula1/comments/1hfmnn4/red_bull_new_rb21_f1_car_needs_wider_operating/,2024-12-16, News,,"['News in the off season are basically like: car needs to go fast to win races', 'Williams : We need undamaged cars after each race.', '""Car must improve to improve""', 'Mercedes has been singing this tune for years. They want an operating window as big as Olympus gates. Doesn’t mean they’ll get it. \n\nThese cars seem to have a very small window where you can make them comfortably fast.', 'It has to, otherwise they’re gonna continue operating with one driver only, they can fire Perez all they want, if they can’t improve the drivability whoever replaces him is gonna struggle bad too.', '>Marko said that it was obvious the team would be designing its RB21 around Verstappen’s driving style – so whoever slotted in alongside him would need to adapt to that.\n\nCue the conspiracy theories \n\nBut I highly doubt Yuki or Lawson would be able to adapt to it. Might actually make more sense keeping Perez.', 'In reality, the operating window of an f1 car is as wide as a peephole.', ""This seems accurate...When they nailed everything the car was great. On weekends where they couldn't, things didn't go as well. Some small setup changes will completely change the outlook of the weekend.\n\nReminds me of some of Mercedes previous issues except that the Red Bull is much faster.""]",148,56,0.92,148,53,53,24,8,0.010000000000000009,24
1hfd35y,2024 F1 Driver's Championship Visualized (second graph is drivers who scored less than 100 points),https://www.reddit.com/r/formula1/comments/1hfd35y/2024_f1_drivers_championship_visualized_second/,2024-12-16, Statistics,,"[""You can pinpoint the exact moment Red Bull stopped being the best car on Checo's line but when you look at Max it's unnoticeable"", 'Nice looking graph. Just needs Norris or Piastri to have a solid line as both of theirs are the same.', 'So why are some races in there twice? Once uppercase once lowercase?', ""Ah, if only Leclerc hadn't had that awful ministreak of pointless races mid-season; curious to know where he'd have ended up. A girl can only dream."", ""Why are there two Austrian Grands Prix?\n\nEdit: nevermind, it's the sprint results"", 'GASLLLYYYY', 'I like how Norris never really catches up ever', 'Sprintraces', 'I guess sprints', 'That hurt to see. Hopefully next year we get some juicy multi way WDC fight between Ferraris/McLarens/Mercedes and Max.']",94,18,0.94,94,12,12,0,0,0.0,0
1hf9mde,Alonso & Vandoorne Karting in the Streets of Montreal 2018 ,https://www.reddit.com/r/formula1/comments/1hf9mde/alonso_vandoorne_karting_in_the_streets_of/,2024-12-16, Throwback,"Looking through some old photos I took, during the week of the 2018 Canadian GP. McLaren did some kind of karting event beside Dorchester Square ",[],85,0,0.96,85,0,0,-3,0,-0.010000000000000009,-3
1hfe36m,How many W11 chassis have not been transformed into W12,https://www.reddit.com/r/formula1/comments/1hfe36m/how_many_w11_chassis_have_not_been_transformed/,2024-12-16, Discussion,"[https://www.flickr.com/photos/crackers250/52051248425/in/photostream/](https://www.flickr.com/photos/crackers250/52051248425/in/photostream/)

Someone visited the Brackley headquarter in September 2021 and there was a W11 chassis that was not transformed into W12. I also heard that LH's chassis in the 2020 British Grand Prix was not transformed into W12.

In the group photo taken at Brackley headquarter a few days ago, a W11 chassis also appeared.","['https://preview.redd.it/f3ihr9tl377e1.jpeg?width=5712&format=pjpg&auto=webp&s=1371d6581463dbc07acaf4bf2f7aab8bb95d2c3c\n\nI took this photo back in September on a tour of their HQ in Brackley. It’s the W11 that finished the British GP on 3 wheels. They have preserved it with the damage / dirt from the race. I imagine if there was a W11 at that event it wasn’t this one, unless they disassembled it and took it down a flight of stairs.', 'Somehow, the W11 returned.', 'How many W11 chassis were even made ?', ""When they said the cars were carried over from one year to the next they didn't mean the actual physical cars, they just meant the design. You can have as many copies of that design as the cost cap allows. For a new year with a new cost cap, I'd be surprised if any W12s started out as a W11."", 'Did they put the stickers on afterwards then? Because I think they ran the names that are all standing at the back in Abu Dhabi.', 'They preserved the dirt, but put new tyres on it? Steal the front left and make it accurate.', 'Extremely likely the same car was used during most of the season and all the museum work was done post season.', 'Nobody Can Stay Dead!', ""Considering the covid development tokens - both years crash structures would count as one chassis, while the aero package, specifically the rear of the floor had to be adapted by everyone from 2020 to 2021.  \nMeaning bar the mandatory floor adjustments, W11 and W12 were largely the same chassis and ground up new development for 2022 meant only a handful of mid season upgrades.  \nSimilarly we only started getting the car presentation documents in 2022, so we didn't get as much insight into kid season development, bar the engine experiments Mercedes ran.  \nhttps://www.formula1.com/en/latest/article/fia-approve-raft-of-f1-rule-changes-for-2020-and-2021.2FbZjY6Aa16fUs4a03PTh7"", 'The W11s were all literally converted into W12s, except for one.']",79,24,0.91,79,24,24,-1,1,0.0,-1
1hfkn9i,2024 World Championship Standings using the previously proposed points down to 12th place system,https://www.reddit.com/r/formula1/comments/1hfkn9i/2024_world_championship_standings_using_the/,2024-12-16, Statistics,"So this year there was a F1 points system change proposal for 2025 that was rejected as it was voted against by all teams in the F1 Comission meeting this past July. This proposed points sytem would have extended points down to 12th place finish, with no alteration to the sprint format. The changes would alter the points given from 8th place down, with the new proposal to also give points to 11th and 12th that would see a 25-18-15-12-10-8-6-5-4-3-2-1 breakdown.

Now, in theory, I'm also a defender of the current breakdown of points that only rewards the top 10. With that said, given the new entry of the 11th team (Cadillac) now approved for 2026 and with the prospect of a potential 12th entry in the coming 3 to 5 years, and with reliability being better then in previous decades (yes, we don't know how reliable the cars will be in 26' yet, so this might change), I think revisiting this idea again soon could be in the cards.

So, here are the alternative Drivers and Constructors standings for 2024 using this system: 

https://preview.redd.it/gsvncpck387e1.png?width=2160&format=png&auto=webp&s=05921731dca5a702ee7334ef5c7beb7d4bd403c1

https://preview.redd.it/ohcaw7wk387e1.png?width=1080&format=png&auto=webp&s=a0db825def3b57fd9a8e25beac26fac9ec8ff3c6

As you can see, this system mainly changes things in a significant way in the midfield, with the drivers/constructors at the top and at the bottom not benefitting as much (I know this is obvious, but just thought I'd mention it). For instance, Max would score the exact same amount of points, as he didn't finish a single time in the 8th to 12th range, and most other drivers in the top positions wouldn't add many points to their tally either.

Some of the biggest gainers for this season would be Hülkenberg (+27 points), Alonso (+21), Magnussen & Gasly (+15), Albon (+14) and Tsunoda (+13). Also Bottas and Sargeant would have scored points! (Bottas for P11 in Lusail, Sargeant got a P11 in Silverstone). These results would also put Haas above Alpine in the WCC.

So, do you guys think there is any merit to this points system? Or do you prefer the system in place currently (fastest laps points will stop being awarded from 2025 onwards as a side note)? ","[""It's interesting to think about how Alpine vs Haas shook out in the constructors this year. Haas was way more consistent throughout the year, but Alpine was more volatile and had a couple of very high finishes that put them over the top. Hard to say which should be rewarded more, but it's something worth thinking about."", ""If the goal is to actually assess which driver/teams had the better season, obvs the further down you score the better. I don't know if that is the goal though or if the priority should be creating more unique/sacred moments by making points more exclusionary."", ""I think especially since there's about to be 2 more cars on the grid, it makes sense to give out points to 2 more cars."", 'Logan with 2 points Yay!', 'Give points to halve the cars: 10x points for 20 cars, 11x points for 22 cars, 12x points for 24 cars, etc.', 'I just can\'t see how not expanding the points range almost all the way down the field isn\'t better for fans? Currently, we would see an incredible overtake for 15th place, wow what a move, and what? Nothing. Absolutely nothing meaningful has happened, that driver has gone from 0 points to 0 points.\n\n*""But you should do better if you want to earn points""* Ok, but not *everyone* who does better can score points under the current system? How does beating almost half the field (i.e. P11) warrant the same reward as finishing last, **or not even finishing at all**? How can that be logical?\n\n*""It means teams can get away with not trying and still reaping a reward""* Ok, well perhaps for a 22-car field we should give out points to P18? So you have to beat four cars to receive points and it would (probably) be 1 point so it\'s not a huge reward?\n\n*""It devalues the achievement of earning points""* I mean maybe it does yeah, but I think my first and second paragraphs are the justification and the paragraph above is the mitigation for this problem. Still have an achievement for getting points (not everyone gets them), but actually the (currently) non-scoring positions actually interesting.', 'Still Zhou beats Bottas lol', 'Nico loved those P11s', ""I support the most complete system. Points are a mark of prestige - they're a tool of classification, and the current system fails at that for half the grid. NASCAR does it right awarding points all the way down.""]",58,70,0.85,58,58,58,9,4,0.0,9
