unique_id,post_heading,post_url,publish_time,tag,post_content,top_comments,upvotes,comments,upvote_ratio,score,total_upvotes_comments,total_score_comments,upvotes_growth_rate,comments_growth_rate,upvote_ratio_growth_rate,score_growth_rate
1h7fzk7,[Lewis Hamilton via IG] First year. Last year. And all the memories in between.,https://www.reddit.com/r/formula1/comments/1h7fzk7/lewis_hamilton_via_ig_first_year_last_year_and/,2024-12-05, Social Media,,"['Lewis upgraded himself from mini boss to main boss. 😂', 'Sorry, I have to say it. He got hotter as the years went by.', 'Barely aged holy shit.', 'BlackBerry…blast from the past', 'I was really hoping on a special helmet. Maybe the 2014 design 😊', 'S+ pose. I know F1 fans since ""back in the day"" may have other racers they can point to as the best or their favorite but I legit never gave F1 the time of day EXCEPT if Lewis was on my TV. I never read an article about F1 unless it related to Lewis. Everything revolved around Lewis for my initial fandom. Every sport has an example of this where the greatest may be X....but the current generation owes all praise to Y, and that to me is Lewis', 'What an absolute legend. His time at Mercedes will be cemented as one of the greatest of all time.', 'All those sponsors on his racing suit added over the years largely because of him. I wonder how many jump ship in the offseason.', 'Hopefully he will be able to look back on these years as fondly as we all hold them.', 'They should’ve kept the white suits this weekend. Looked so badass']",1055,36,0.96,1055,952,952,2,0,0.0,2
1h80y7f,Red Bull admits handing Perez early contract “didn't work”,https://www.reddit.com/r/formula1/comments/1h80y7f/red_bull_admits_handing_perez_early_contract/,2024-12-06, News,,"['No shit....', ""Oof surely he's gone now right.... right?"", '>“But I think with Checo you have to look beyond this year for the contribution that he’s made to our team. He’s been a great team player. He’s a great person. He’s extremely popular within the team. He’s worked very hard over the four years that he’s been with us and he’s played a vital role in the constructors’ championships that we’ve won, the five grand prix victories that he had in our car.\n“It’s been the most successful pairing that we’ve ever had, finishing first and second in the drivers’ championship last year.”\n\nOh yeah, he’s staying.', ""The fuck up with Daniel's departure at VCARB and now this. Just make a clear statement. So if it's his last race he gets a proper send off."", '2nd time is the charm, i promise', 'This is extremely strange. If you read the article Horner makes it seem as if Perez was doing great when they extended his contract, which was definitely not the case. His performance had already fallen off a cliff by then, with crashes and Q1 exits etc. Now he’s trying to frame it as if they extended his contract on the back of good performance, while in reality at the time they said they did it to give him his confidence back - because he was in fact doing horribly. Horner is just trying to mask what is maybe the dumbest contract extension in the history of the sport to make himself look good', 'Get better or get fir .. umm re hired! \n\n**Checo** : Umm .. okay! *winky face*', ""Ngl, Checo's negotiation skills needs to be studied."", 'Imola: Qualified 11th, behind Tsunoda (7th) and Ricciardo (9th)\n\nMonaco: Qualified 16th, behind Tsunoda (8th) and Ricciardo (12th)\n\n**<Red Bull signs him for another 2 years>**\n\nCanada: Qualified 16th, behind Ricciardo (5th) and Tsunoda (8th)']",976,124,0.99,976,119,119,244,20,0.0,244
1h7xqpn,[F1] The Shanghai International Circuit will remain on the calendar through the 2030 season,https://www.reddit.com/r/formula1/comments/1h7xqpn/f1_the_shanghai_international_circuit_will_remain/,2024-12-06, News,https://x.com/f1/status/1864966957570601325?s=46,"[""Good, it's a great track that I worried we were going to lose after Covid."", 'Politics aside, the Chinese GP is usually always a fairly good race, so nice to see it on the calendar \n\nNow extend Silverstone, Spa, and Monza', ""Anything that isn't a street circuit night race in the Middle East is fine with me"", 'It’s a huge market so makes sense from a business pov which is the only pov that matters obviously.', 'Great news! Gonna try and make it for as many as I can', ""Lol do people actually have a problem with this? People really do be complaining about anything now huh? Or redditors to be exact.\n\nIt's a proper track, no street circuit bullshit. The only Chinese gp on the calender...I am sure they could have made a street circuit in Shanghai, but thank goodness they didnt. Better than 1 more ME track."", 'Problably the most affordable one for fans in asia region', 'No problem with this, imo a better track than zandvoort. Both should probably be on the calendar though over many others.', 'Fun track glad it stays']",789,111,0.96,789,104,104,46,6,0.0,46
1h7ygfa,Leclerc vs. Leclerc / Leclerc fastest,https://www.reddit.com/r/formula1/comments/1h7ygfa/leclerc_vs_leclerc_leclerc_fastest/,2024-12-06, Quotes,,"['I think Leclerc is so much better than Leclerc.', 'I like it ... they really think it through.', 'The power of AWS', 'Which one is the Leclerc in the Ferrari?', 'We have A. Leclerc and C. Leclerc. Where is B. Leclerc?', 'https://preview.redd.it/qv1rg2iol75e1.png?width=668&format=pjpg&auto=webp&s=d5d1161d61449f0623d678671bc2e0bfc51c346b', 'How do you get LEL from “Arthur Leclerc” anyway?', ""Somebody in the graphics department has been waiting for FP1 all week just cackling to themselves randomly, I'll bet."", ""I need both Arthur and Charles in F1 so we can have the modern era's version of Michael and Ralf""]",754,46,0.99,754,42,42,74,2,0.0,74
1h7yyy1,"[Williams Racing] Alex and Franco will each take a 5-place grid penalty in the Abu Dhabi Grand Prix due to the use of additional RNC gearbox components. It’s an unfortunate consequence of the incidents that occurred during last week’s Grand Prix which were beyond Alex and Franco’s, but... ",https://www.reddit.com/r/formula1/comments/1h7yyy1/williams_racing_alex_and_franco_will_each_take_a/,2024-12-06, Social Media,...we will give it our all to finish the season on a strong note.,"['The cars are held together with string and tape at this point.', 'Every time I hear news about this team it’s like im reading about another way jesus had to suffer for our sins. They is going through biblical level horrors', 'They should give those grid-penalties to the drivers (Stroll & Hulkenberg) that CAUSED the damage!', 'Just bring it home boys….just bring it home.', 'Just fuck me up, bring on 2025', 'Is there a table I can see of which team has the most damage costs over 5 years?', ""Apparently after Vegas , Mercedes gave them some parts from their heritage cars to help Williams out.  I hope they weren't expecting them back!  \n\nThe Williams mechanics really need that winter break."", "":')"", 'I’m just hoping both can finish the race. Specially Franco since it could be his last race in a while.']",601,25,0.99,601,25,25,57,-1,0.0,57
1h7xjt3,"6 years ago, Max Verstappen was still in “Free Practice”",https://www.reddit.com/r/formula1/comments/1h7xjt3/6_years_ago_max_verstappen_was_still_in_free/,2024-12-06, Video,,"[""It's kinda funny how he isn't participating in the first FP since the pregnancy announcement"", '15 championships there... wild', ""Don't you just hate it when you're doing free practice and accidentally win the championship"", 'Bring back the interview desk', '“It’s was done quickly”\n\nlmao Seb you legend.', 'I wonder if he called Vettel for advice', 'When I saw the photo I knew this will be here .... keep pushing ... legends\n\nwhere is the stat how many titles is between them when you need it?', '""keep pushing"" fucking floored me!', 'George would have ratted them out to the FIA/F1 claiming that they were talking about inappropriate things at the press conference.', '“You know it wasn’t long ago that you used to wait in the garage, and as far as I’m concerned you should still be there!”- every driver since']",599,57,0.96,599,54,54,40,1,0.0,40
1h829hz,[Erik van Haren] Red Bull is in talks with Sergio Pérez about terminating or adjusting his contract. There is a chance that he will be financially compensated and stay on as an ambassador. Max Verstappen will therefore have a new teammate next year.,https://www.reddit.com/r/formula1/comments/1h829hz/erik_van_haren_red_bull_is_in_talks_with_sergio/,2024-12-06, News,,"[""Dumbest move of the season was extending him when he was already performing poorly. I really wish I could see what they've seen to make them think he was the best option."", 'about as official as it can get with van Haren reporting. Glad to have this out of the way then.\n\nHoping for Yuki to get his shot next year.', ""Surely by Sunday this somehow gets confirmed.\n\nWhat is Perez gonna do pretend he's not aware of anything by saying he can't wait for the next season in the post race radio/interviews and then leave the sport unceremoniously next week through an online statement?\n\nJust thank Red Bull. Reflect on what has been a great career and do some freaking doughnuts on Sunday."", 'Yuki is doing the post-season test for Red Bull and Lawson is doing it for RB. Which surprises me given all indications are that Yuki isn’t in consideration by Red Bull. \n\nBut Checo’s interviews gave the game away. He refused to stay “they’ve decided to keep me”. It was always “I have a contract for next year that I’m going to continue with” ie “unless I’m paid out of it”.', 'Twist: in 2025 Perez drives for Red Bull Ampol Team in Australian Supercars. Perez Snr wins his bets.', 'I thought the Red Bull delivery to his dad was the compensation?', 'sad that he won’t get a proper send off but considering the comments horner made last week and how much perez keeps insisting he is staying, he probably doesn’t want admit it’s his last race till that contract is terminated', 'Thank fuck, if Erik is reporting it means it’s either a done deal, or at the very least it’s what Max wants to happen, which means it almost certainly will happen before too long.', 'Is it a translation issue or did Van Haren actually mean **""will""** as in he is certain that Perez is leaving?\n\nIf so I guess Van Haren\'s showing up on Papa Perez\'s naughty list come Monday!\n\ne: cheers for the answers', 'But his dad said...']",582,136,0.99,582,131,131,287,43,0.010000000000000009,287
1h7ig2l,"Franco Colapinto on what the future holds for him: ""How do I know that? It's impossible, it's very hard to know.""",https://www.reddit.com/r/formula1/comments/1h7ig2l/franco_colapinto_on_what_the_future_holds_for_him/,2024-12-05, Video,,"[""Don't do that Max, don't give me hope"", 'Putting my tinfoil hat on. They were sitting next to each other at the driver’s diner', 'It’s so interesting to me how his English pronunciation is really good but he still has that strong Argentinian cadence.', 'It’s been really lovely to see his country rally for him. I’m hoping he gets another shot.', '""I\'ve got balls and none of them are crystal""', 'Look, I don’t wish ill will on any of next year’s drivers, but if the need arises, I hope Franco will be the one to replace them.', ""He will almost certainly get another shot. Although he's lost the chance for the start of next year (maybe the VCARB seat will be there) he's bad enough positive performances where he will be a lot of teams go to guy. But just the last few races it's not gone all his own way and the hype has cooled. \n\nI mean it sounds like Doohan could easily be canned early if he's bad and they'd then go for Franco. But Id bet on him being on the grid at the start of 2026. Carlos could easily get a good offer and he steps into that Williams, could get an Andretti seat or maybe something else opens up. \n\n\nWhether he is the real deal yet, I don't think anyone knows. But he's clearly marketable and shown talent in actual F1 races and that will mean someone is willing to put him in an F1 car again"", 'He deserves a spot, he has the talent and has already shown glimpses that no other rookie from the past 5 years, except probably Piastri, has.\n\nI hope he stays at Williams as a reserve and, if opportunity arises, he ends up replacing another driver, or maybe even joining Cadillac in 2026.', 'I dont know if he has a future in F1. But with his personality and if he polishes his skill, dude is gonna go far in any category', 'Very hard, but not impossible!']",496,47,0.98,496,797,797,-1,0,0.0,-1
1h7g5hs,"Last race with Mercedes power: My favourite pictures of Lewis hamilton, one for each season.",https://www.reddit.com/r/formula1/comments/1h7g5hs/last_race_with_mercedes_power_my_favourite/,2024-12-05, Throwback,,"[""I'm a fan of this one from Turkey 2020 when he won his 7th championship.\n\nhttps://i.redd.it/0eezn4ttqgz51.jpg"", 'See i would have gone into the other direction with 2007. \n\nSomething like this:\n\nhttps://maxf1.net/wp-content/uploads/2017/04/Hamilton-Alonso-McLaren-podium-Indianapolis-USA-GP-F1-2007-Foto-Reuters.jpg\n\nAlternatively:\n\nhttps://preview.redd.it/8tm4jt0epwb61.jpg?width=620&auto=webp&s=8a4a252efbae155045c516ac19796e444ab007d0', ""What race was the photo of Lewis and Alonso? They look genuinely happy there so I'm going to assume very early in the season."", 'Alonso’s wet hair looking suspiciously long by 2007 Ron Dennis standards in the first pic.\xa0\n\nVery cool collage including quite a few I haven’t seen before. My personal 2023 favourite is him sat on the P1 box after Hungary qualifying', 'Oh man, I know I\'ve gone in too far into the F1 rabbit hole, but the fact that I can tell you used 2 photos from 2017 because Vettel\'s suit still has the old Ferrari logo for the ""2018"" one is kind of concerning on my end 😭', 'Lewis’ purple helmet may be a top 5 helmet all time', 'The W11 swimming through the wet like a shark', 'Ha! The one of him and Nico is gold, Jerry, gold!', 'What race is it where the car is absolutely filthy?']",478,26,0.94,478,321,321,3,0,0.0,3
1h7ynlr,2024 Abu Dhabi Grand Prix - Free Practice 1 Classification,https://www.reddit.com/r/formula1/comments/1h7ynlr/2024_abu_dhabi_grand_prix_free_practice_1/,2024-12-06, Statistics,,"['The only excitement left for this race is the George and Max beef. Ferrari is so over and Charles P2 hope is so over.', 'Charles gets a 10-place grid penalty. Crushing.', 'Imagine a Red Bull Perez/Hadjar line up next year. Full blown midfield team', 'Drugovich not getting a seat is one of the most depressing things of the last few years.', 'Dru-go-vich!', 'https://preview.redd.it/m3uxv2zlm75e1.jpeg?width=3072&format=pjpg&auto=webp&s=3e9afe90a27880ce96c6c3d8f6b36bf41269fcae\n\nGreat showing by Drugovich.', 'Im not going to ger hyped but FRANCOOOOO! Just hope for a clean and nice weekend to show the other teams what they are losing to not give him a seat and to those recency bias redditors with short term memory', 'Drugovich dragging it to 9th whilst Lance drags himself out of bed', 'We had a glorious Leclerc sandwich for a bit there. Bad for Arthur but good for the memes.']",471,117,0.99,471,114,114,20,1,0.0,20
1h7yak4,"[F1] ""Wheel clearance is bad. I'm struggling"": Isack Hadjar, who's in Max Verstappen's car for this session, hasn't been having much fun out there so far",https://www.reddit.com/r/formula1/comments/1h7yak4/f1_wheel_clearance_is_bad_im_struggling_isack/,2024-12-06, News,,"['Got some spicy radios already from him.', 'Hadjar: This thing won the championship?', 'Shades of Alesi and Berger jumping into Schumacher’s ‘95 Benetton.', 'Just use the lever under the steering wheel to lift it a bit up mate.', ""Hadjar is a good 15cm shorter than Max. So probably doesn't fit too good in the car"", ""What's wheel clearance?"", ""He's gonna fit right in the company's culture!"", 'He was bitching about something whole session.', 'well that car won the championship so you are either slow or picky.', 'Excellent job Helmut Marko.']",414,33,0.98,414,32,32,42,3,0.0,42
1h7g5kt,"Sergio Perez: ""I will be driving for Red Bull Next Year.""",https://www.reddit.com/r/formula1/comments/1h7g5kt/sergio_perez_i_will_be_driving_for_red_bull_next/,2024-12-05, Quotes,,"['RBR was ruthless, cutting people whenever they see fit. Then comes along Checo. Now Horner saying Checo has to decide his future. Seems like Checo has Horner by the balls. \n\nSergio Perez is the most ruthless driver on the grid it seems.', 'If he crashes with George this weekend, I believe he stays. \n\nOr Christian offers the seat next to Max to the first Red Bull driver who does.', '![gif](giphy|3ohhwvnHsxVzou0jYc|downsized)', 'Oh, for fuck’s sake!', ""He's starting to remind me of 'I AM A SURGEON'"", 'Pretty obvious what’s happening here: Perez is telling Red Bull that if they want him gone, they’ll have to pay him out and he won’t just gracefully retire and save them money. And that they’ll also have to deal with the impact on their marketability in Latin America being around him being sacked by Red Bull and not just retiring into an RB ambassadorship.\n\nWhether or not he actually does leave we don’t know but Checo is saying it won’t be a mutual decision if he is.', 'Lets revisit this in a week.', 'Full quote: ”I will be driving for Redbull next year.  They’ve given me a great patch. Only three supermarkets, with two pallets of cans each. Should be done by lunchtime.“', ""[Yeah I'm not changing my mind on this :')](https://www.reddit.com/r/formula1/s/sPCi7Zod6Q)""]",392,354,0.86,392,4389,4389,-1,-1,0.0,-1
1h7js9p,Former Marussia F1 Team boss Graeme Lowdon has been announced as the Team Principal of General Motors’ F1 project,https://www.reddit.com/r/formula1/comments/1h7js9p/former_marussia_f1_team_boss_graeme_lowdon_has/,2024-12-05, News,,"['I was genuinely expecting it to be Otmar', 'This is a partnership where both sides have experienced sad bankruptcy proceedings. Hope they find better success with this pairing.', 'Now I miss Manor again.', ""That's surprising to see him back.  Have spotted him a few times in the paddock this season though in the background.   Thought he would have been mentally finished with F1 after the Maria Da Vilotta and Bianchi crashes."", 'As a newer fan of F1 who started watching 3 years ago, can someone tell me if this is good? I wanna root for GMs success.', '*sad Otmar noises*', ""Interesting to note that he's been involved with Zhou's management."", 'I remember this guy made some great drawings. Like not technical ones, but art.', 'Had the pleasure of meeting Graeme at the filming of the Sky F1 Show in 2015, very nice bloke and he took a lot of his time speaking to people. Top guy.']",374,77,0.98,374,1151,1151,2,0,0.0,2
1h7zhce,Charles and Arthur return to the pits after making history in FP1 ,https://www.reddit.com/r/formula1/comments/1h7zhce/charles_and_arthur_return_to_the_pits_after/,2024-12-06, Video,,"['Their dad would be so proud! Definitely smiling from up there', 'That was really adorable. 🥺', 'Genuinely really touching moment.', 'This was really lovely.  😊', 'That is beautiful, but I don’t see Arthur in F1. Maybe I’m wrong.', ""Oh thats nice to see... Especially with Charles' radio message"", 'Charles had to dive bomb on him like a good older brother', 'Nepotism can be good', ""Those damn onion cutting ninja's again 🤧"", 'What history?']",378,22,0.97,378,19,19,30,3,0.0,30
1h825py,"[L'Equipe] Alpine boss Oliver Oakes slams Ocon after split: 'We’re not here to be nice.' Criticizes his recent performance, saying he 'scored few points and was often eliminated in Q1'",https://www.reddit.com/r/formula1/comments/1h825py/lequipe_alpine_boss_oliver_oakes_slams_ocon_after/,2024-12-06, News,,"['What is the point? Ocon didn’t say anything negative publicly, why burn that bridge?', 'What a deranged comment to make by a team principal. Ocon drove for them 5 years, won a race, multiple podiums and got over 300 points for the team.', 'Unnecessary, looks poorly on Oakes when OCOs gone already. Some decorum pls', 'A month ago he could have had an argument\n\nBut really, you blame his performance and lack of points after ***Interlagos***???', 'Bruh what is it with Alpine bosses being absolute bellends.', 'Wow alpine are really toxic', 'Yeah but did he consider he was driving a tractor for most of the year?', 'For people who said it is all Flávio Briatore and Oakes is in the dark, do you think Briatore pushed to him out to say this? Another Otmar is innocent claim?', 'Also scored you the highest placing of the year that massively helped you be 6th in the WCC in a year where you likely deserved 8-9th.\n\nBut whatever right?']",396,292,0.86,396,263,263,135,64,0.030000000000000027,135
1h84pf0,"[F1] It'll never work, they said...Six world championships later",https://www.reddit.com/r/formula1/comments/1h84pf0/f1_itll_never_work_they_saidsix_world/,2024-12-06, Social Media,https://x.com/F1/status/1865055694178714002?t=eR0gaj2xhE_urKDflceCKg&s=19,"[""The [original thread](https://www.reddit.com/r/formula1/comments/10lber/lewis_hamilton_to_join_mercedes_in_100m_move_from/) on reddit is amazing and I have gone back to read it many times over the years.  \n  \n[Archive link](https://web.archive.org/web/20121001020045/https://www.reddit.com/r/formula1/comments/10lber/lewis_hamilton_to_join_mercedes_in_100m_move_from/)  \n[Archive link 2](https://archive.ph/YhneY)  \n  \nIt was a very unpopular move to say the least. It'll be akin to Max moving to Alpine or Aston now."", 'Normal fan behaviour', 'Imagine if he had refused to join (took Niki to convince him) and they’d gone with Hulk instead ([who was second choice](https://www.reddit.com/r/formula1/s/ISNvT5RUkk))', ""Let's all pretend we all knew that going from a team that was getting second and third in the constructors to a team that was fighting the Saubers and the Force-India's for P5 was a brilliant move."", ""Crazy what Lewis achieved with Mercedes. It's sad that he leaves Mercedes but i think it's for the better"", ""I don't see how someone could think it was bad for Merc to get Lewis. The other way around was the standard, given both immediate and more historical context."", 'Something something Manchester United to West Ham\n\nAlthough that has become more debatable than in 2012', 'I like how half of them say Merc would be bad for Lewis while the other half day Lewis would be bad for Merc.', 'If his instincts to go to Merc when he did are any indication, we’re in for a wild 2026', 'It should not have been a surprise for those watching the 2012 season and the McLaren team performance …They built a fast car but a long list of operational errors, botched pit stops and terrible reliability convinced him they couldn’t win another WDC and he had to go elsewhere. \n\nI didn’t think he would have quite that much success at Mercedes but I believed it better than staying.\n\nMcLaren have only really started to look like a top team again in the last 2 years']",400,59,0.93,400,55,55,400,59,0.93,400
1h7xuge,[Sam Cooper] The question we all wanted answering of how would the timing screen look with two Leclercs on the track has been answered with...LEL?,https://www.reddit.com/r/formula1/comments/1h7xuge/sam_cooper_the_question_we_all_wanted_answering/,2024-12-06, Social Media,,"[""It makes sense I guess. Max used to have VES because Vergne had VER. So they just take the next letter of the name. Because LEC is taken it's LEL"", 'Le Leclerc', 'damn I was rooting for LEA :(', 'Top lel', 'lel', 'The gamer in me thinks it\'s a funny spelling of lol, but the chemist in me can only see ""Lower Explosive Limit"". What does that make LEC, I wonder..', 'This was already answered years ago when when Verstappen first joined and he had to be VES because Vergne already had VER.\n\nMax had to wait to 2017 to change to VER', 'Damn u/v21v, you called it [2 years ago](https://www.reddit.com/r/F1Technical/s/o7EhQLHI68).', 'LUL', 'Where does that even come from?']",308,84,0.96,308,83,83,16,2,0.010000000000000009,16
