unique_id,post_heading,post_url,publish_time,tag,post_content,top_comments,upvotes,comments,upvote_ratio,score,total_upvotes_comments,total_score_comments,upvotes_growth_rate,comments_growth_rate,upvote_ratio_growth_rate,score_growth_rate
1jgzjnz,Lewis Hamilton wins the Sprint of the 2025 Chinese Grand Prix,https://www.reddit.com/r/formula1/comments/1jgzjnz/lewis_hamilton_wins_the_sprint_of_the_2025/,2025-03-22, Sprint,,"['>PIA          +6.825\n\nhttps://preview.redd.it/l04m35lrv5qe1.jpeg?width=640&format=pjpg&auto=webp&s=424547e1e059513d56af106835bb1b11244478b8', 'Oscar fighting in a Ham Ver podium, my boys all grown up.', 'Yuki held off Antonelli for all 19 laps. Spectacular.', 'What pressing the K1 button does to a MF', 'Dont do that, dont give me hope', 'https://preview.redd.it/3k5b15glv5qe1.jpeg?width=1179&format=pjpg&auto=webp&s=4c281f752df879b7e76cab1eaea593ca26f7eca2', 'Imagine telling someone in 2021 when sprints started that Lewis Hamilton would deliver Ferrari their first sprint win. There would be a bit of confusion', 'Grazie to all the ragazzi at the factory.', 'THIS IS WHAT MY DREAMS LOOK LIKE\n\nhttps://preview.redd.it/7dzwg6azv5qe1.jpeg?width=415&format=pjpg&auto=webp&s=65907db370c881c659ccde53b661bd455b9ccfad', 'FORZAAAAA!!! HAMMER TIME!!!!!']",31544,1338,0.95,31544,93635,93635,598,7,0.0,598
1jh3jil,Oscar Piastri takes pole position for the 2025 Chinese Grand Prix,https://www.reddit.com/r/formula1/comments/1jh3jil/oscar_piastri_takes_pole_position_for_the_2025/,2025-03-22, Qualifying,,"['https://preview.redd.it/w0iafiidb7qe1.jpeg?width=1024&format=pjpg&auto=webp&s=621da1b350950a47994ca935361adbe1d7dc177a', '""The hairpin of my life"" 😭😭😭', 'Oscaaaar\n\nFirst pole for him. So happy for him', ""Red Bull can't even move Lawson to RB it'll be a promotion"", '**Horner:** Yuki, so we’ve decided to move you up to Red Bull Racing.\n\n**Yuki:** Yeah?\n\n**Horner:** Yeah. You’ve been driving phenomenally, and we think you’re ready.\n\n**Yuki:** What about Lawson?\n\n**Horner:** He will be your teammate.\n\n**Yuki:** Max?\n\n**Horner:** Max will be moving to Racing Bulls. It’s a complicated situation, but this is the best move for everyone.', 'Classic George Russell move of not being shown on broadcast and then sneaking a podium.', 'Impressive from Hadjar, bro has speed', 'Nice way to take your first pole. That lap from George was storming too', 'Fucking finally', 'Yellow sector 1 and 2\nPurple sector 3 and improves time\n\n\n\n\nThat on board lap is going to be incredible to watch']",13795,741,0.96,13795,462,462,604,14,0.0,604
1jh34il,Liam Lawson's last three qualifying results.,https://www.reddit.com/r/formula1/comments/1jh34il/liam_lawsons_last_three_qualifying_results/,2025-03-22, Statistics,,"['![gif](giphy|28Nev3k184A9PdSDCg)\n\nHorner trying to promote Tsunoda and Hadjar', 'He had better results in vcarb lol', 'Congrats to Liam on consecutive South Pole positions 😍🇦🇶', 'I REFUSE to believe that Gasly, Albon, Perez and Lawson are THIS bad. There is something seriously wrong going on.\n\nOr Max is simply an alien who has superpowers.', 'Worst qualy performances from each recent RB driver:\n\nGasly - P17 (Australia, error with the weigh bridge)\n\nAlbon - P19 (Sochi 19, crashed)\n\nPerez - P20 (Monaco 23, crashed)\n\nLawson’s doing this with zero caveats.', ""He's consistent at least"", ""Even though Perez was poor last year, I don't think even he had a set of consecutive qualifying sessions *this* bad. Certainly not bringing-up-the-rear-for-two-qualifying-sessions-in-a-row bad."", 'Imagine where Red Bull would be if Max left ... Possibly a car like Alpine or something ...', 'Yuki probably not upset about not getting that 2nd TractorBull21']",9468,1150,0.98,9468,499,499,567,41,0.0,567
1jgoeu6,[@f1] That was CLOSE! Let's compare the Sprint qualifying laps of Lewis Hamilton and Max Verstappen in Shanghai... but from above,https://www.reddit.com/r/formula1/comments/1jgoeu6/f1_that_was_close_lets_compare_the_sprint/,2025-03-21, Video,"Source with sound: https://www.instagram.com/reel/DHeMjKdMxQR/

People on the desktop, right click on the video and click ""show all controls""

Yes, the video is sped up because of imgur's over 1 minute restriction. ","['It’s amazing we live in a world where these sorts of graphics are possible.', 'How did they not touch? Good, clean driving from both', 'This rivalry been through it all. Sometimes Lewis is ahead, sometimes max is ahead, sometimes they’re side by side, sometimes they are on top of each other and now they’re inside each other.', 'I would love to hear Hamilton or Verstappen as they watch this', 'These dudes are amazing!', 'Please revive this rivalry. It was peak drama', ""I don't understand how max was slower when lewis was giving him a tow down the straight?\n\nI'm kidding I'm kidding"", 'official f1 is only catching up to these huh, these have been popular on other social medias for a while now', 'God I miss 2021', 'Did Lewis break that hard after crossing the line ?']",7663,326,0.99,7663,11787,11787,28,2,0.0,28
1jh4qp5,Bono accidentally calling Kimi “Lewis” in qualifying,https://www.reddit.com/r/formula1/comments/1jh4qp5/bono_accidentally_calling_kimi_lewis_in_qualifying/,2025-03-22, Video,,"[""That's equivalent to an ex driver pulling into their old teams pit box in their new car."", '""Take it as a compliment.""', ""😁, I'm quite surprised Lewis hasn't called his race engineer Bono, yet."", 'it had to happen.', 'Bono: “My Lewis is gone” \n\n🥲🥲🥲', 'Old habits die hard', 'I like Bono’s voice it’s so calming and all gdi', ""I know it's a nornal slip of the tongue but why is this making me so emotional lol"", 'Did i really go to tumblr to watch F1 clip in 2025?', ""Pretty sure Ricciardo's McLaren race engineer called him Carlos once as well.""]",6166,193,0.99,6166,186,186,426,5,0.0,426
1jgzlv1,[VCARB via Instagram] POINTS BABYYY!,https://www.reddit.com/r/formula1/comments/1jgzlv1/vcarb_via_instagram_points_babyyy/,2025-03-22, Social Media,,"['YOINTS! Hadjar had a great go at it as well, solid all around', 'Yuki can score points when vcarb are unable to make strategy calls.', 'Yuki is doing everything right to get himself a drive next year. He has to be on the Cadillac short list, could easily be other seats that open up too.', 'great defense. no pit stops to screw him over baby.', 'What a race, what a defense. You could see from the timings that Kimi got within 0.1-0.2 in drs a few times, but then Yuki kept opening the gap back to 0.8-1.0 after some great exits from some corners. Amazing drive', 'Yuki was fighting for his damn life there lol', 'Tsunoda finished 3 positions behind Max today. Lawson behind a VCARB.', ""I love that Yuki can get decent results when strategy doesn't have many opportunities to make his life harder."", 'tsunoda did really fucking great fending off kimi  \namazing', ""Hell yeah, Yuki! Being snubbed by Red Bull was a blessing. The attention from it has turned him into one of the most popular drivers on the grid, and he's able to drive hard without having to worry about the cursed second Red Bull seat. I hope Cadillac is watching because Yuki is showing that he's the type of experienced driver a new team would greatly benefit from having.""]",4904,192,0.99,4904,9384,9384,82,1,0.0,82
1jh4mmn,Oscar Piastri is the first Australian to take pole since Daniel Ricciardo six years ago,https://www.reddit.com/r/formula1/comments/1jh4mmn/oscar_piastri_is_the_first_australian_to_take/,2025-03-22, Statistics,From: https://www.instagram.com/p/DHfwwcFRyWP,"['I remember Max was furious about not getting pole when he got pipped by Danny Ric lol', 'And I reckon he’ll be the first Australian world champion since Alan Jones in 1980.', '>2018\n\n>2025\n\n>six years ago\n\nI mean, since the Mexican GP 2018 was held end of October it is closer to six than to seven years, but it still feels kinda wrong.\n\nEspecially since 2012 was just three years ago. ^^/s', 'I hope DR3 is watching and smiling from wherever he is.', 'Give Danny ric that Red Bull seat lol', 'how i miss the honey badger :(', 'ki ki ki ki raaaah', 'My GOATS! Remember in 2018 when we all throught Daniel could win WDC? Yeah, how time flies.', 'TIL he didn’t get pole until this race']",4795,106,0.99,4795,95,95,722,7,0.0,722
1jh00o7,"Lewis Hamilton post-sprint: interview: “I really do feel that a lot of people underestimated the steep climb it is to climb and get into a new team, to become acclimatized within the team. The amount of critics & people I’ve heard yapping along the way, clearly not understanding or are just unaware”",https://www.reddit.com/r/formula1/comments/1jh00o7/lewis_hamilton_postsprint_interview_i_really_do/,2025-03-22, Video,,"['Reminds me of the [Top Gear interview](https://youtu.be/knteY3kq3Ys) where they were making fun of him going to Mercedes. He loves to prove people wrong.', '>The amount of critics & people I’ve heard **YAPPING** along the way\n\nDAYUM!', 'Hamiltons real unfiltered thoughts:\n\nhttps://preview.redd.it/azi2eai216qe1.jpeg?width=640&format=pjpg&auto=webp&s=f9eb664e57ad5d4ef2a812d7000a9f0a51c21447', 'Confirmed: Hamilton heard them people talking shit and had to shut them the fuck up.   \n\n\nAwesome!', 'Lewis thrives off of proving people wrong and yet 18 years into his career, people are still yapping and he’s still proving them wrong. \n\nPeople actually suggested keeping Sainz would be better and were treated as serious people.', 'bro really said yapping XD', 'Add that to the words of wisdom', 'Talk that shit Lewis', ""This is something that everyone thought would only happen in F1 Manager 24's Ferrari Save or F1 24's Lewis Hamilton career mode!"", 'Silence the yappers']",4578,209,0.97,4578,11150,11150,92,0,0.0,92
1jh4ueh,"Ted Kravitz: “You didn’t pay off Checo for this, did you? The point was to replace Checo with a quicker driver. Is he (Lawson) just not a quicker driver?”

Christian Horner: “As I said, we’ll have a good look at it. Errr, we’ll do what we can tomorrow.”",https://www.reddit.com/r/formula1/comments/1jh4ueh/ted_kravitz_you_didnt_pay_off_checo_for_this_did/,2025-03-22, Video,,"['Holy shit. He did not pull any punches there haha', ""Verstappen is now the Márquez to Red Bull's Honda. They're going to be in huge trouble if they don't get on top of this, because this is the 7th season and the 4th driver who can't come even remotely close to Verstappen's speed across 2 generations of racecars, and at the going rate, Verstappen might not be averse to considering other options for his future."", '“Well have a good look at it” is what you say in a work meeting when someone asks you a question and you don’t have a fucking clue.', ""At least they are rude  with Horner, in 2019 they were rude against an inexperienced young F1 driver with Horner stirring up  the fire with rude comments on Gasly's driving abilities\n\nhttps://preview.redd.it/55gezzq8s7qe1.jpeg?width=1440&format=pjpg&auto=webp&s=ca9acf5976c14f6e9e70b6d25b17b92d85c9f876"", 'Lmao. This reads really rude by Ted but Horner is not even fighting the animosity of the question framing. \n\nHe really just said, errr 😂', ""I don't think anyone expected for Liam to beat Max but getting to Q3 shouldn't be this difficult in the RB."", 'Damn, Ted. Savage.', 'https://preview.redd.it/omluxuopp7qe1.jpeg?width=800&format=pjpg&auto=webp&s=fdc104e4fc32656e58acab5af19bd732f0c72d8e', ""I'm bored about having the same conversation over and over again; are we really suggesting that Kvyat, Gasly, Albon, Perez, and now Lawson are all just frauds and poor drivers, and Red Bull just need to simply hire someone good to be their second driver."", 'If I am honest at some point you gotta ask what the fuck is going on with that car? Like jokes aside we all know Lawson isn’t this slow.']",4348,753,0.99,4348,467,467,536,63,0.0,536
1jh3kbl,"Oscar Piastri has broken Lewis Hamilton's record for fastest lap ever at Shanghai. Piastri in Q3(2025) - 1:30.641, Hamilton in SQ3(2025) - 1:30.849",https://www.reddit.com/r/formula1/comments/1jh3kbl/oscar_piastri_has_broken_lewis_hamiltons_record/,2025-03-22, Statistics,,"['1/16 hometown hero! well done!', 'With two yellow sectors too, absolutely insane Third sector', 'This fact might cause Piastri to smile slightly.', 'P 🍑🌲', 'And Oscar goes mild\xa0', 'So close between the top 4 teams', 'what a redemption', ""I'm starting to feel like this Piastri dude has talent"", 'Is this the shortest fastest lap record reign? Less than 24 hours.']",3895,141,0.99,3895,133,133,202,3,0.0,202
1jh4833,"Sky: ""how do you win this race tomorrow?"" Max: ""if they all retire in front of me"" Sky: ""We know you're better than that, you don't need them to retire!"" Max: ""I do, we are not fast enough.""",https://www.reddit.com/r/formula1/comments/1jh4833/sky_how_do_you_win_this_race_tomorrow_max_if_they/,2025-03-22, Video,,"['looking at tire deg they also need to retire behind him', 'Most optimistic Max response', 'Two words for the interview guy. Tyre deg\n\nDid he not watch how Max fell off in the Sprint in just 19 laps?', ""Two stop race tomorrow? That way they don't have to spend so my h time managing tyres. Also more fun to watch."", 'We like Max because he don’t sugarcoat shit. And the car right now? Yeah.', 'Just as he said, with the tyre deg, his best bet is to chill like Russell did last week and see if he can blag a podium. Perhaps setup changes made after the sprint will make it less painful', 'That jump to Merc is looking likely.\n\nHe also said that there are two racing bulls in Q3 with close lap times to him and that already says a lot.', ""It's gotta be the tyre wear issue. I imagine he's expecting to go backwards tomorrow"", ""If Max knocked on Toto's office asking for a 2026 seat towards end of the year - who would be more concerned, Kimi or Russell?"", "">We know you're better than that!\n\n>I am but this turd box on wheels isn't!\n\n-Max Verstappen""]",3796,267,0.99,3796,255,255,356,8,0.0,356
1jgzq15,[Scuderia Ferrari via Instagram] Victory in the first Sprint Race of the year!!,https://www.reddit.com/r/formula1/comments/1jgzq15/scuderia_ferrari_via_instagram_victory_in_the/,2025-03-22, Social Media,,"['We are at the ""we are so back"" phase.', 'Grazie the razzie of my ragazii letsgooooooo', 'https://preview.redd.it/0pa6hz97z5qe1.png?width=1080&format=png&auto=webp&s=182c3a2d3e614f461e69123c7483e97da7d8115e\n\nWe are sooooo back', 'First sprint win for lewis. \n\nFirst sprint win for ferrari. \n\nWE ARE SO FUCKING BACK.', ""That's my GOAT"", ""Their pace looked terrifying at the end. Hoping for 1-2 in qualiflying for the race. Let's go"", 'House Hamilton sends their regards!', '![gif](giphy|acIy5aKe4nryg)\n\nMe right now', 'Fuck yeah\n\nhttps://preview.redd.it/5mtp9pgzx5qe1.jpeg?width=1200&format=pjpg&auto=webp&s=30d4f787d1fe2e93f27828262edc4971375ca0ab', 'Damn, Lewis got hands']",3553,125,0.99,3553,4619,4619,62,0,0.0,62
1jgzp96,"Lewis: ""Great job guys! Yes!""
Ricky: ""It was masterclass of tyre management.""",https://www.reddit.com/r/formula1/comments/1jgzp96/lewis_great_job_guys_yes_ricky_it_was_masterclass/,2025-03-22, Video,,"['The level of tyre deg is gonna make for some interesting race strategy tomorrow', ""The rumors of Lewis's demise were greatly exaggerated."", ""Man I'm so happy for Ricky and Lewis, there was a lot of doubt after last week about their chemistry and relationship moving forward.\n\nWhat a way to bounce back and prove the doubters wrong.\n\nSAN DIEGOOOO!"", 'The OG tyre whisperer showing the rest of the grid how it is done', 'Lewis has always been good on tyre management.', ""My man slowed down to put Max in Oscar's clutches and just drove away in the sunset. This might turn into our year lads. Let's go"", 'People probably don’t understand how big of an achievement it is to get into a completely different car after driving all your career in a different one and then acclimatizing yourself so quick. What a legend!', 'Tyre whisperer for a reason bby.', 'I hope Lewis knows how much this means to all Tifossi fans \U0001f979❤️', ""Bono: Get in there Lewis!\n\nKimi: I'm kimi, bono!\n\nBono: sorry my bad.""]",3400,146,0.98,3400,9186,9186,56,1,0.0,56
1jguqei,Lawson: Tsunoda 'had his time - I beat him in the junior series',https://www.reddit.com/r/formula1/comments/1jguqei/lawson_tsunoda_had_his_time_i_beat_him_in_the/,2025-03-21, News,,"['Just put the p20 in the bag bro', 'Haas is using square wheels and an upside down engine and you still qualified last.', 'Bold statement from someone who is *checks notes* dead last.', 'The junior series thing is a weird one, Yuki came over from Japan to the European series in 2019, whereas Lawson had come over a year earlier to do ADAC F4 and had already competed in F3 machinery with Asian F3. In that first season, both did 2 series together. Euroformula Open and FIA F3.\n\nYou can guess which series matters most in the F1 pipeline, and in FIA F3, Yuki finished 9th in a very weak Jenzer while Liam finished 11th in a stronger MP car. While in Euroformula open, Liam finished 28 points clear in 2nd vs Yuki in 4th.\n\nIn 2020 Yuki got the promotion to F2 which Liam missed out on and finished 3rd in the series, getting a very quick route to F1. Liam was still in F3, and finished 5th that year. They both did compete in Toyota racing series that year though, a series which Liam was current champion of the year before and thus had a year extra experience with the cars. Liam finished 2nd, ahead of Yuki in 4th again.\n\nAll in all, Liam is right that in some championships he outperformed a less experienced Yuki, but not by a huge gap and in the pivotal one Yuki was more impressive and earned his way to F1', ""I find it extra satisfying that Yuki hasn't said a single word about this. Hasn't shit talked Lawson, hasn't criticized Red Bull's decision up front. For how much shit he gets for being hot headed in the cockpit, he really does just put his head down and drive. That and Liam saying stuff like this makes me want to root for Yuki more and more."", 'This just seems  a dumb thing to say when you\'re struggling. I think he needs more slack than some are giving him but when the knives are out and lots of fans and media don\'t love you already, this sort of thing doesn\'t help. \n\n\nThis is a situation where you give boring PR answers. ""Yuki is a great driver, but I have faith in my abilities that I was the right man for the seat"" you don\'t need to bring up your junior career to try and put the other guy down.', ""Wasn't Yuki defending Liam for the past 2 years? I thought they had a really close friendship? Also didn't Yuki get 4th in EFormal in a fucking tractor. He also got 9th when Lawson got 11th in F3."", 'Insecurity is loud . Stop chatting, put your head down and drive .', 'Who is this guys PR manager?']",3263,1107,0.93,3263,50260,50260,21,7,0.0,21
1jh3mie,Hadjar's turnaround - via crashnetformula1 IG,https://www.reddit.com/r/formula1/comments/1jh3mie/hadjars_turnaround_via_crashnetformula1_ig/,2025-03-22, Social Media,,"['No need to jinx it, race is tomorrow', 'Isack’s got some serious speed, Sky commentary was spot on about him. His control and consistency is erratic but his pace is legit.', 'I am not holding out hope, VCARB strategy will sadly get them both at some point', ""He's cooking this weekend\xa0"", 'We still haven’t made it to the starting grid don’t jinx it', 'Support from Anthony Hamilton gave him a boost', 'no rain for tomorrow, he is gucci', 'You love to see it!\n\nI didn’t think I was going to like Hadjar based on what I saw from him in F2 but turns out he’s a sweet li’l guy who likes Sims Kardashian memes', ""hey there's still chance for crashing on the formation lap... don't rule it out just yet. \n\nJokes aside I'm really happy for Hadjar - must've been a really demoralising performance last race, glad to see him bounce back and fight with the big names in q3!"", 'HAD some HAM support']",2307,87,0.98,2307,84,84,211,2,0.0,211
1jh3lyk,[VCARB via Instagram]Double Q3 you loveeeee to see it,https://www.reddit.com/r/formula1/comments/1jh3lyk/vcarb_via_instagramdouble_q3_you_loveeeee_to_see/,2025-03-22, Social Media,,"['Meanwhile, Lawson in P20. Hello 2008?', 'White Red Bull > Pink Mercedes', 'I didn’t think Hadjar would be able to keep up with Yuki when they announced him for the VCARB seat. He’s been seriously impressive this weekend.', 'They have somehow built a really fast car for a midfield team.', 'YU HAD this!', 'Anyone know why Yuki aborted the last lap?', 'Hadjar looking good pal, Yuki got hands too.', 'hadjar is so fucking impressive!', 'Best RB team on the grid', ""Monstrous pace this weekend. Shame VCARB burnt Yuki's fresh softs in the previous sessions so they couldn't do double fresh runs given he only set a lap on the useds \n\nHadjar is quick, not hearing any excuses about the Red Bull or not knowing China when Isack is able to hit the ground running in an inferior car.""]",1777,127,0.99,1777,120,120,81,1,0.0,81
1jgxzdy,"Williams find €50,000 of which €40,000 are suspended for missing video",https://www.reddit.com/r/formula1/comments/1jgxzdy/williams_find_50000_of_which_40000_are_suspended/,2025-03-22, Technical,,"['To be fair, if I was handed a camera that must be used, I would have expected a properly formated card included by the FIA.', ""We've all forgotten the SD card for our camera at some point, so this may be the most relatable penalty I've ever seen.\n\nGlad to see no sporting penalty for it. Do fines like this come out of the cost cap?"", 'Wish I could find €50,000', 'To be fair… I’d expect the provided cameras would have provided storage too… what a strange thing to omit', 'This reminds me of that time an ISS crew (very) slowly realized they had forgotten to pack an SD card while they were in the middle of a space walk:\n\nhttps://youtu.be/3BA-ETbjOzo?si=eLbH7mJBtw7FixAf', ""Getting fined 50k or even 10k for not checking if there's SD cards is undeniably hilarious. It's such an innocent mistake that I'm kind of surprised they're the only ones that made it.\n\nThis is the sort of stuff I love in F1. You're questioning whether Williams have broken some technical regulations and are trying to hide an illegal wing. But it turns out they forget to send the intern to PC world to buy a £10 SD card."", ""that description is honestly kind of taking me out\n\n> The reason for the failure was apparently the team’s belief that the cameras would come fitted with SD cards supplied by the FIA. They did not check if they did.\n\n> They noticed during the middle of the session that there was a red flashing light in the cameras and reported that to the Technical Delegate. However, they did not know what the flashing light meant and in any event, it was too late to fit the SD card(s) by then.\n\nactual comedy. i'm glad my high school raspberry pi projects were more professional than a formula one team"", ""Teams are allowed to handle the SD cards???\n\nDoesn't that open up all sorts of potential tampering issues?\n\nYou'd have thought in this day and age the feed would be broadcast"", ""So basically - to sum it up - they've been fined because the FIA is too cheap to buy the SD cards to put in the cameras they mandated be carried in FP to check for wing flex.""]",1629,150,0.97,1629,5866,5866,27,1,0.0,27
1jh6ks0,George annoying Lando in the media pen post qualifying,https://www.reddit.com/r/formula1/comments/1jh6ks0/george_annoying_lando_in_the_media_pen_post/,2025-03-22, Video,,"['They touched, Martin, they touched.\xa0', 'The Intrusive thoughts overwhelmed Russell.', 'I feel like Russell is on a personal mission to fuck with McLaren and Norris just in case he finds himself in a title fight with them.', 'Russel awaiting his usual P3 finish with zero screentime.', 'Sounds like George has a meeting with HR now lol!', '>**george**: i’m trying to make you smile mate\n\n>**lando:** did you just go to the toilet?! you better have washed your hands that’s grim.. jesus!! i need some disinfectant\n\n>**george:** sorry mate that was pretty disgusting i do apologize\n\n>**lando**: im reporting you to HR\n\nfrom user ln4norris\n\nfor ppl on pc right click and click show all controls to hear audio, had to reupload cause i feel like the first one made both drivers look bad lol', '""I\'m reporting you to HR"" hahaha', 'Blimey…', ""That's non consensual, MBS rubbing his hands in giving George a $500,000,000 fine."", 'Sometimes you just gotta harass your buddy. It’s on the rulebook.']",1603,191,0.97,1603,167,167,345,15,0.0,345
1jgr9q2,Fernando Alonso signing autographs as a 17-year-old Formula Nissan driver in 1999,https://www.reddit.com/r/formula1/comments/1jgr9q2/fernando_alonso_signing_autographs_as_a_17yearold/,2025-03-21, Throwback,,"['The rookie before being a rookie', 'Fuck, I don’t FEEL old, but I always forget I’m the same age as him. \n\nReminds me though of how short an athlete’s career is, that in just about every sport anyone Alonso’s age is considered ancient.', 'I would have been two lol fun times', 'Actual rookie Alonso', ""Wdym 17 year old in 1999, he's still 17 in 2025"", 'https://preview.redd.it/zvgpkzl9r4qe1.jpeg?width=753&format=pjpg&auto=webp&s=4c430b0c4097066543278741c9d96ca58a61b3f1\n\nYoung Alonso fucked', ""Haven't aged a day."", 'Damn that’s wild, I can’t imagine being famous at that age. It’s absolutely a miracle someone like Max turned out normal despite his adolescence.', 'he looks so much like javier bardem in this photo its uncanny\xa0']",1476,23,0.99,1476,541,541,6,0,0.0,6
