unique_id,post_heading,post_url,publish_time,tag,post_content,top_comments,upvotes,comments,upvote_ratio,score,total_upvotes_comments,total_score_comments,upvotes_growth_rate,comments_growth_rate,upvote_ratio_growth_rate,score_growth_rate
1kucqeo,"Antonelli crashes & session is red flagged - Colapinto, Stroll, Gasly, Bearman and Bortoleto are out in Q1",https://www.reddit.com/r/formula1/comments/1kucqeo/antonelli_crashes_session_is_red_flagged/,2025-05-24, Video,,"['Tactical masterclass from Alpine wasting time on the mediums', 'Alpine out there braindead', 'absolutely diabolic gamble from Alpine lmao', ""We've all done that in the F1 games"", 'Kimi saying “I’m sorry” 4 times in a row just broke my heart', 'Alpine strategy was wack.', 'briatore masterclass', '""So how slow is the car in the slow corners?""\n\nAlpine: ""yes""', 'Here we meet again, discussing how ending a session should not be advantageous.', 'Brother how are you this fast']",381,119,0.98,381,2074,2074,-2,0,0.0,-2
1kua0ig,Sainz again urges F1 to adopt F2's Monaco qualifying format. But is it too unfair?,https://www.reddit.com/r/formula1/comments/1kua0ig/sainz_again_urges_f1_to_adopt_f2s_monaco/,2025-05-24, News,,"['Bring back the 2004 1 lap shootout but only for Monaco 😂', 'I don’t think they should change it, but if they do, they can just use the Indycar approach if you want to change anything. 1 car from each team in 2 separate 10 car sessions. Top 5 from each go through to a regular q3.', ""Monaco already runs its own race distance and now has its own tyre rules.            \n\nI don't think there would be anything wrong with giving it its own quali format to alleviate some of the traffic issues."", 'I prefer the idea of offsetting the timing line in qualifying to before the pit lane entrance.\n\nThat way you immediately cut the number of slow laps in half.', 'They should actually make the qualifying session longer given that the ""race"" in Monaco is essentially on saturday anyway.', 'Q1 Single lap qualifying in reverse grid where bottom 10 are knocked out. \n\nThen 10 minute q2 shoot out for those that made it through to determine top 10.', ""If you're going to adopt it then just do it for Q1 to get rid of the slowest 6 cars next season, one car from each team in two 8-minute sessions and the slowest 3 from each go out. Then back to 16 and 10 cars for Q2 and Q3 as before."", ""Do it like indycar. Have a Q1a and a Q1b session with 10 cars each. Advance the top 7 from each of those to Q2, then the top 10 to Q3. You can even have a Q1c session to determine the qualifying order for the eliminated drivers so that the Q1b session drivers don't have\xa0a track conditions advantage for their qualifying order. That session can be as short or even shorter than Q3 since it will only have 8 drivers.\xa0\n\n\nBut they really need to consider this with an eleventh team coming next year with talks of a twelfth. How would a Q1 look like with 22 or 24 of these big cars?"", 'Monaco qualifying is great as it is. It’s famously one of the most exciting days of the season. Why would we change it?']",345,120,0.97,345,1836,1836,0,0,0.0,0
1kugrm6,[McLaren via Instagram] Nothing but respect,https://www.reddit.com/r/formula1/comments/1kugrm6/mclaren_via_instagram_nothing_but_respect/,2025-05-24, Social Media,,"[""Maybe petty dramas drive fan engagement for the medias (legacy and social), but I truly value old school sportsmanlike conduct and congeniality between drivers. Of the same team or not. It's especially refreshing In this era of trash talking normalized by various sectors of internet culture."", 'Is not like they are going to force each other off the track just to pull a win ; )', 'Until 3pm tomorrow afternoon', 'Beautiful!', 'Big fan of Oscars helmet, definitely room for a papaya orange helmet on the grid on a full time basis', 'Nothing but respect from Oscar coming to congratulate Lando. \nLando happy because he was first. \nWhen Oscar is first, Lando is not happy and does not approach as quick to say congratulations to Oscar and looks sooky when he does so.....', '""old school sportsmanlike conduct""\n\n\nThis is literally the nicest F1 drivers have ever been to each other, certainly in my knowledge. Maybe they were perfect gentleman in the fifties, but I doubt it.\xa0', 'yeah, like Senna and Prost!', 'this is pure bs. just look at jeddah and china, lando was cheesing for oscar at both']",348,17,0.93,348,32,32,7,0,0.0,7
1kuh9me,Russell: Monaco GP is “over” for Mercedes after qualifying issue,https://www.reddit.com/r/formula1/comments/1kuh9me/russell_monaco_gp_is_over_for_mercedes_after/,2025-05-24, News,,"['Unfortunately he’s right. Weird things can happen, but even rain is no guarantee for a crazy race here.', 'Gotta hope for crashes, red flag, over/undercuts etc. can get low points still', ""Remarkable they didn't sort out the no power sensor issue from Imola.\xa0"", ""Inb4 some freak incident pulls them right back into it. We've seen it before like 2023"", 'Time to try an unusual strategy!', ""It's Mercover says Russell.\xa0"", 'In before P3', 'Mercedes having back to back awful weekends. Hope they can come back strong in Barcelona', 'Humour me. Why can’t they pit lap one for hards , put in qualifying laps while everyone else pits. Get to p1 then on the second mandatory pit stop go with the crowd. Out they pop p1 job done?']",341,95,0.97,341,93,93,6,0,0.0,6
1kue9o8,[Racing Bulls via IG] Let's Mona-Gooooo,https://www.reddit.com/r/formula1/comments/1kue9o8/racing_bulls_via_ig_lets_monagooooo/,2025-05-24, Social Media,,"['hadjar fuckin rocks', 'Hadjar rookie of the year so far', ""Mr Hadjar is cooking something here. I always knew he was crazy fast from his races in f2 even though he didn't win the championship."", ""Hadjar must be protected from Red Bull's second seat at all costs."", 'Hadjar is mighty fast', ""So far this season hadjar has been so good\n\nHope VCARB doesn't fuck up his race"", 'Hadjar is basically Prost without the team boss wife stuff.', 'Hadjar killing it this season', 'Lawsons had a lot of bad luck with battery units, drs issues and yellow flag in Qualis, good to see a clean session for him and what he can do, will do massive favours for his confidence.', '69 second pole. \nStarting 6 and 9. \nNice']",338,45,0.98,338,666,666,0,0,0.0,0
1kue58c,"[McLaren] A second-row seat in Monte Carlo for OP81! Let's go, Oscar!",https://www.reddit.com/r/formula1/comments/1kue58c/mclaren_a_secondrow_seat_in_monte_carlo_for_op81/,2025-05-24, Social Media,,"['This is such a gorgeous poster', 'He looks different', 'He did a great quali lap, but there was no way around Lando today.', 'Lando drove an absolute a monster of a lap. \n\nIf they finish the race in the positions they started (highly likely in Monaco) then Oscar will only be 3 points ahead in the WDC over Lando. \n\nI’m worried this might be the weekend he drops down from the lead.', 'Last year he flew around this track, this year he never seemed to be comfortable. It also looks like Norris can push to the limits again and that may become a bit of a problem for Oscar.', 'As he said like last year, quick enough to fight for pole, but more inconsistent than his competitors, especially in the middle sector. Still certainly not bad, and another podium around here is always good.', 'Not a bad position to be in. Great work in Q3. If anything happens with Leclerc and Norris, he is in prime position to pounce.', 'The hottest seat in F1 is the slower Mclaren....', 'I love the aesthetic they’re using this week.', 'Yeah, indeed! Cassino Royale vibes....  \nIf someone knows, please comment font name here.']",325,19,0.93,325,189,189,3,0,0.0,3
1kuaxh8,No Further Action on Carlos Sainz  for overtaking under red flags,https://www.reddit.com/r/formula1/comments/1kuaxh8/no_further_action_on_carlos_sainz_for_overtaking/,2025-05-24, News,,"['thanks icumcoffee', 'Oh hell yeah, Williams remontada continues 🔥', '“What you say Fuck Me for” Bearman', ""Thank fucking god. He's had such an unlucky year so far. Losing his ten year Monaco points streak (still NOT safe) to a grid drop penalty would've been a kick in the teeth."", ""[Here's the video](https://imgur.com/a/DCT3d92)\n\nNot even close to enough time, and he was passing Hamilton, who was the stopped car.\n\nEDIT: Actually the wrong video.  THought this was from FP3 since it was just showing up now. Figured stuff from FP2 would have been resolved yesterday\\\n\n[Fixed Video From FP2](https://imgur.com/a/D0zeziM)"", 'Ok good', 'Relief 🥳', 'Good for Carlos. Sucks to be Hass though.', ""now they should take away Oliver's 10 place penalty too.\n\nEdit: i'm not gonna answer every reply but i hope everyone does not think 10 place penalty is FINE. Sure, give them penalties but 10 place?? There should be mins and maxs (du du ddu du) for that. Bro is driving a Haas ffs.""]",316,37,0.95,316,559,559,-1,-1,0.0,-1
1kuckz0,"[Q1] Pierre Gasly on being impeded by Stroll: ""Oh my god, who is that? Shocking from Stroll""",https://www.reddit.com/r/formula1/comments/1kuckz0/q1_pierre_gasly_on_being_impeded_by_stroll_oh_my/,2025-05-24, Video,,"['Tbf it’s sunny which no one could’ve predicted', 'Gasly will remember him', 'Classic', 'Stroll moment', 'Funny that gasly still asks which Aston that was.', 'Stroll on fire this week', 'Stroll is just a menace on the racetrack', ""Alright I'm not defending Lance on that one clear penalty, as DJ Khaled once said: Another One"", 'Penalty incoming', 'So he was trying to block Leclerc?']",302,21,0.97,302,441,441,5,0,0.0,5
1kufaob,Frustrated Tsunoda refuses to elaborate after Q2 exit in Monaco,https://www.reddit.com/r/formula1/comments/1kufaob/frustrated_tsunoda_refuses_to_elaborate_after_q2/,2025-05-24, Video,,"['Exits Q2.  Refuses to elaborate.\n\nformula1.com leaning into the memes here', '>leaves', 'Yuki Tsunoda complained on the radio saying that ""It\'s so unfair honestly, I knew that was going to happen""\n\nThis is the first time after Mexico \'23 that I\'ve seen him so pissed in the media pen', ""Moving to Red Bull might unironically be the worst thing to ever happen to Tsunoda. Dude was legit much faster in the VCARB and the expectations were lower, now every time he gets a subpar result is less of a chance for a drive next season. I want to root for him for it's so hard"", ""Dr Marko: good man, never explain. Soon as you have to explain you've lost.\xa0\n\n\nProbably.\xa0"", ""Yuki's last 13 qualis:\n\nSession | Gap | Teammate\n--------|---------|---\nQatar SQ1     | +0.017  | Lawson\nQatar Q1      | -0.047  | Lawson\nAbu Dhabi Q3  | +0.053  | Lawson\nAustralia Q2  |\t-0.166  | Hadjar\nChina SQ2     | N/A     | Hadjar (no time)\nChina Q3      |\t+0.599  | Hadjar\nJapan Q2      | +0.498  | Verstappen\nBahrain Q3    | +0.880  | Verstappen\nJeddah Q3     | +0.910  | Verstappen\nMiami SQ1     | +1.293  | Verstappen\nMiami Q3      | +0.739  | Verstappen\nImola Q1      | Crashed | Verstappen\nMonaco Q2     | +0.540  | Verstappen"", 'Guess it’s something to do with tire strategy? No idea why he was fuming, he was off the pace from Q1 despite have a decent FP', ""I mean, it's not like he was setting fire times in Q1 or the rest of Q2 either tbh"", ""The race podcast, who travel with the circus, have strongly implied occasionally over the last few years that at least some teammate comparisons in F1 that we talk about, are nonsense because the two drivers didn't have a fair situation. Whether that's technical, sporting, better staff on one side or the other, I'm not sure - but they've certainly said once or twice over the years there are stories they can't legally expand on which completely up-end how a driver seemed to perform. \n\nI don't think RBR give two fucks how Tsunoda does, personally."", 'Piastri’s mom is fuming rn']",285,155,0.96,285,2547,2547,-1,2,0.0,-1
1kudi4r,"Antonelli, Russell, Hülkenberg, Tsunoda and Sainz are out in Q2",https://www.reddit.com/r/formula1/comments/1kudi4r/antonelli_russell_hülkenberg_tsunoda_and_sainz/,2025-05-24, Video,,"['Alonso : Woo Woo', 'Fernando sounds thrilled 🤣\n\nWOO WOO', 'Amazing from Ocon', ""It's Tsunover fellas"", 'Ocon is so good around Monaco', 'carlos :/', 'Tsunoda goddamn, especially with both VCARBs through', 'Both racing bulls to Q3', 'Welcome back Sergio Perez.', 'Ocon my man i love you']",271,246,0.98,271,2846,2846,-2,0,0.0,-2
1kue8m8,Lewis Hamilton report to the Stewards,https://www.reddit.com/r/formula1/comments/1kue8m8/lewis_hamilton_report_to_the_stewards/,2025-05-24, News,,"['If Adami kept his trap shut it would be much less of an issue but he had to speak', ""I don't get how Adami still has a job."", 'Can Hamilton ask for a new race engineer?', 'Keeping the potential penalty aside, good from Hamilton to be 3 tenths behind Mr. Monaco all things considered.', 'If only Adami wasn’t the worst race engineer on the grid', ""Hard to not say that wasn't impeding especially with the radios"", 'Where are those lip readers? Lewis and Max discussed the inchident a few moments ago when they got out of the car.', '5th place for Hadjar incoming.', 'Hamilton podium hopium don’t leave me please please']",263,138,0.96,263,1489,1489,0,0,0.0,0
1kue9la,[Charles Onboard] Fuck Noooooo,https://www.reddit.com/r/formula1/comments/1kue9la/charles_onboard_fuck_noooooo/,2025-05-24, Video,,"['Was complaining about only getting one lap in traffic in longer radio', 'When’s the last time P2 in quali won the race? I need more hopium in my veins rn', 'What did his engineer say?\n\nEdit: Thanks everyone, was outside and couldn’t hear a thing lol.', ""Sad\n\nReally wished he got a pole \n\nBut there's tomorrow"", 'What a mood </3', 'Watch Ferrari butcher the mandatory pit stops tomorrow for Charles to end in p10. At this point nothing surprises me anymore.', 'I had the exact same reaction', 'I said the same thing to my tv 😭', ""Sad as a ferrari fan. The lap looked really good. But usually ferrari pace is better in the race, so let's hope for the best. Norris isn't know for terrific starts even tho it's gotten better."", ':(']",256,58,0.97,256,1324,1324,-2,1,0.0,-2
1kugm29,"Lando: “It means a lot, not just because it’s been a while, but just because of how things have been, how things have gone over the last couple of months in qualifying [..] Today was that day, so it means a lot to me, to my whole team, because we've been working a lot for another moment like this.”",https://www.reddit.com/r/formula1/comments/1kugm29/lando_it_means_a_lot_not_just_because_its_been_a/,2025-05-24, Video,,"['Hope this gains him back the confidence to the car. Monaco is kind of unique so I don’t really know the pace he found here is applicable to next week in Spain.', 'First pole since Australia', 'Take the momentum Norris. Considering how poor his qualy has been, he is only 13 points back. If this result gives him the confidence to bring his qualy level back to his usual self his life is going to be so so much easier Sundays.', 'Really like how grateful Lando is for this pole and appreciates just how long the journey has been for him in qualifying and all the hard work it took to get back to this moment.', ""I didn't expect to be as happy for him as I was. I hope he's now starting to gel with the car."", 'Real happy seeing him get that pole after nailing that lap', ""plus lando also said: *even if i was pole in any other track, it probably would have been the pole that's meant the most to me.. more because of what's happened over the last couple of months. it may not seem like a lot, but for me, it's quite a big thing*"", '[me rn](https://imgur.com/PPuVNk3)', 'hope this means he’s finally more comfortable with the car', ""If you have 1 place where it's absolutely vital, it's here.""]",241,18,0.88,241,221,221,8,0,0.0,8
1kugb5x,"Q: Charles, a few years ago, there was a Ferrari P2 with two McLarens around him and at the end the Ferrari won on Sunday. How optmistic are you to repeat this? Charles: Let’s go, babyyyy (looking at both mclarens) that gives me a lot of confidence now. Idk that was quite few years ago.",https://www.reddit.com/r/formula1/comments/1kugb5x/q_charles_a_few_years_ago_there_was_a_ferrari_p2/,2025-05-24, Video,,"['Nah Charles himself is also fueled with hopium 😭', 'Even Leclerc is immune to Ferrari hopium now, look at him poor creature', 'Absolute cinema 😂', 'When was that? Like 1999ish?\nEdit: 1999 and 2001, i think he was talking about that', 'Hopium is strong with this one', 'Not me blushing at the way he said “Let’s go baby” lmfao', 'He should know better by now', ""Didn't Seb do it in one of his Ferrari years?"", 'It’s crazy that Seb is the only Ferrari winner in Monaco between Schumacher in 99/01 and Charles in 2024.', 'It made me feel funny inside.']",236,14,0.96,236,299,299,2,0,0.0,2
1kuecjo,[Daniel Valente] Lando Norris is now tied with Kimi Raikkonen for the 5th most poles in McLaren history. Ayrton Senna - 46 Mika Hakkinen - 26 Lewis Hamilton - 26 James Hunt - 14 Kimi Raikkonen - 11 Lando Norris - 11,https://www.reddit.com/r/formula1/comments/1kuecjo/daniel_valente_lando_norris_is_now_tied_with_kimi/,2025-05-24, Social Media,,"['Not a bad company to have!', 'Hakkinen my beloved. 1995 to 2000 was so exciting.', 'Prost won 3 drivers titles with McLaren (joint most with Senna) and has only 10 poles with McLaren. He had more poles in his final season with Williams (13 out of 16 races) than he did in his time with McLaren over 7 seasons.\xa0\n\nHe did not have the fastest cars when we won the championships or had a very fast teammate alongside him (Senna).\xa0', 'Ayrton Senna really was brilliant.', 'That senna number is mind blowing', 'Quite impressive that James Hunt is still in that list, given that his last pole with the team was in 1977!', '[Just want to leave this here.... ](https://www.reddit.com/r/formula1/comments/1kpr828/comment/mt0r07t/?utm_source=share&utm_medium=web3x&utm_name=web3xcss&utm_term=1&utm_content=share_button)', 'Alain Prost hmmm ?', 'Prost was also very well known for biasing his setup towards race pace.', ""It's well known Prost didn't care about qualifying, he only ever worked to perfect his race set up. So Senna may have smashed him 26-4 in poles, but it was only 14-11 in wins, with Prost actually scoring more points than Senna in both their seasons together.""]",234,15,0.91,234,215,215,1,0,0.0,1
1kui4r6,Lando Norris' Pole Lap | 2025 Monaco Grand Prix,https://www.reddit.com/r/formula1/comments/1kui4r6/lando_norris_pole_lap_2025_monaco_grand_prix/,2025-05-24, Video,,"['I root for leclerc every Monaco GP, but Jesus what a lap, can’t argue with that', 'He found a tenth on everyone, he did a great job.', 'This lap would have gone down as an all-timer if it was pulled out by Max. Just saying', ""Genuinely so happy for him, the only mistakes he's made this season is in qualifying or a slightly less clean attempt at overtaking Max in Miami compared to Oscar. Proves he has it in him and it finally came together on a record breaking lap, doesn't deserve any of this hate. Despite what people say the WDC is still close and not over just because Oscar had an amazing 4 races or because Max is Max."", ""Crazy that a record lap has a yellow sector. If he hadn't made that mistake at turn 15 it would had been even faster."", 'What a fucking lap, the precision is off the charts good', 'Its better for the sport if he can fight for the wdc so im happy', 'Everytime I doubt this guy he pulls shit like this and mess with me but then proceeds to completely bottle the race.', ""I hope he's improving from his mistakes."", 'Kinda bounced off the kerbs at 16, did he lose time there? Honestly I might be biased here but Charles’s lap looked cleaner. I think the McLarens traction/grip off the last corner into the pit straight made the most difference ultimately.']",236,82,0.84,236,74,74,7,1,0.0,7
1kue3so,[WilliamsRacing] This is how we line-up for the Monaco Grand Prix. Ready to give it everything in tomorrow's Race.,https://www.reddit.com/r/formula1/comments/1kue3so/williamsracing_this_is_how_we_lineup_for_the/,2025-05-24, Social Media,https://x.com/WilliamsRacing/status/1926297490782896174?t=dqH-ISYhrPp-3Z5nWfmGgA&s=19,"['They fucked up the strat right? The Mediums to Soft run plan didn’t work for Sainz in Q2 and didn’t work for Albon in Q3. What happened?', ""Okay but what went wrong on Alex's last lap"", 'bottle they were best of the rest', 'Alex Q2 time was good enough for P6. bruhhhhh', '☠️', 'What happened to Albion in Q3? Was it just the medium tyre?', 'disappointing, they seem to be struggling with the tire compound. hopefully they can conjure up something with the strategy', 'they should have done more. With both Mercs out in Q2, Sainz was still driving with mediums and Albons Q3 was completely fucked.', 'Man what happened to Alex at the end? Could have fighted for P6 in quali today', 'A bit disappointed by this, which is a good thing']",207,60,0.96,207,537,537,0,0,-0.010000000000000009,0
1kuphpg,MONACO GP 2025 Q: Norris vs. Leclerc - Fastest Lap Comparison with Live Telemetry [OC],https://www.reddit.com/r/formula1/comments/1kuphpg/monaco_gp_2025_q_norris_vs_leclerc_fastest_lap/,2025-05-25, Statistics,,"[""I thought that this could be an interesting visualization of how Lando and Charles behave slightly differently around the circuit. \n\nIt's also the first time that I try to plot something like this, so any feedback is welcome!"", 'This is cool but what madman puts the brake on the right and throttle on the left?', ""They're too smooth with the throttle... Imma practice this smoothness yo see if it translates into improved timings"", 'what in the undertale boss fight is this😭', 'McLaren when braking is just something else', 'Dumb question but where is this data coming from?', 'Op how did you make this? Really cool', 'This is so cool! Thank you 😁', 'incredibly cool. i would have thought leclerc would have won. there are momenta when norris brakes and leclerc doesnt. where did he gain time?']",200,21,0.95,200,20,20,38,6,0.0,38
1ku965z,Franco blocking Bearman,https://www.reddit.com/r/formula1/comments/1ku965z/franco_blocking_bearman/,2025-05-24, Video,,"['That is bloody awful from Franco, moves lanes twice and then just parks it in the middle, guaranteed penalty', 'You could make a mix tape of Franco blocking everyone this weekend', 'Colapinto again\n\nNo one is surprised', 'Briatore must be over the moon getting rid of Doohan.', ""it's always the ones you most expect huh"", 'This feels inevitable with a new driver, new race engineer, and new interim team principal all at the same time. Alpine is a mess.', ""It's a pity whoever gets his seat in 3 races will never be able to set foot in Argentina or access the Internet again."", 'Who is next in line for the Alpine sear? Aron? Doohan again?', 'All that blocking just to be half a second off his teammate lol']",191,116,0.91,191,1496,1496,4,0,0.0,4
1kucr2s,Antonelli crash replay,https://www.reddit.com/r/formula1/comments/1kucr2s/antonelli_crash_replay/,2025-05-24, Video,,"[""Why would you put watermarks on content that isn't even yours?"", 'Sounds like my little brother apologizing after breaking something that doesn’t belong to him :( i like all of these rookies', 'That must be so frustrating\xa0', ""Interesting way to get into Q2, he'll learn that's that what you do in Q3 lol"", 'Yeah clipping the barriers turning into the corner done it.', 'A little clip like that. Monaco is unforgiving.', ""That's so easy mistake to make, those margins are crazy small"", 'Classic Monaco’s rookie mistake (that and the piscine one).\n\nLearning process.', 'Such a small error with massive consequences. He will have a very tough day tomorrow from 15th']",169,46,0.86,169,548,548,-4,0,0.0,-4
1kukchm,Tyre sets available for the race.,https://www.reddit.com/r/formula1/comments/1kukchm/tyre_sets_available_for_the_race/,2025-05-24, Statistics,,"['Alpine not even bothering using tires for quali anymore, there must be a cash back program for unused sets', 'Does Max (and Yuki) really only have 2 sets of hard/medium for a guaranteed 2 pitstop race. Seems like a big disadvantage on strategy options.', 'Think Albon may be screwed, Alonso too but not as bad', 'Interesting that so many people have only one set of new softs—I would expect starting on shift to try to gain ground at the start and expecting to pit early would be popular. I wonder how many of those are just scrubbed?', 'Can someone clarify if they have to use 2 or 3 sets? I know they have to do 2 pitstops, but can they do Hard Hard Soft? or do they have to use at least 1 of each?', 'Why do some drivers have 7 sets and some only 6?', 'Tire strategy will be curious tomorrow especially for the Mercs.', 'Hamilton  😔', 'Alonso is cooked he sacrificed all his tyres']",160,65,0.94,160,63,63,5,1,-0.010000000000000009,5
1kudyu1,Lando Norris takes pole position for the 2025 Monaco Grand Prix,https://www.reddit.com/r/formula1/comments/1kudyu1/lando_norris_takes_pole_position_for_the_2025/,2025-05-24, Video,,"[""All that Leclerc edging for a McLaren pole, I'm ruined. All jokes aside WHAT A LAP FROM LANDO, 1:09s is CRAZY,  Hadjar and Lawson both fantastic, same for Ocon even getting into Q3"", 'Hats off to NOR. Clutch when needed!', 'Good shit, Lando. About time this guy had a good quali.', 'Unreal! McLaren choosing to do a banker lap in those circumstances???', 'Toughest qualifying of the year and he’s stepped up where he’s been weakest. Amazing job by Lando today.', 'Lando 69 seconds 🙂 brilliant drive, what a racer!', 'Incredible job Lando. WHAT A LAP', 'cinema', 'That was so close']",155,31,0.87,155,410,410,3,0,0.0,3
