unique_id,post_heading,post_url,publish_time,tag,post_content,top_comments,upvotes,comments,upvote_ratio,score,total_upvotes_comments,total_score_comments,upvotes_growth_rate,comments_growth_rate,upvote_ratio_growth_rate,score_growth_rate
1h7i4sw,Lando’s latest Instagram post lmao (read the caption),https://www.reddit.com/r/formula1/comments/1h7i4sw/landos_latest_instagram_post_lmao_read_the_caption/,2024-12-05, Social Media,Chaos? Chaos.,"['The other two you are thinking about, Yuki and Pierre, are obviously as close together as possible!', 'We have an insider, guys.', 'Lmao Max commented a beef emoji 🥩', '""Lando, since I\'m not talking to George, can you please ask him to pass the syrup?""', 'KMag, Hulk, Nando and Stroll AWOL', ""And we know the caption was 100% written by him since he used 'your' instead of 'you're' hahaha"", 'https://preview.redd.it/txm9xh9u635e1.jpeg?width=952&format=pjpg&auto=webp&s=60465e107f702585d75b469a798e89af6262b791\n\nMax comment', 'meanwhile max and esteban look like they have been bestfriends for years lmao', 'Lando’s having way too much fun with this', ""I like how all of them are using the same exact pic because that's what was sent out in the Whatsapp group""]",22255,774,0.94,22255,50804,50804,134,4,0.0,134
1h7vfab,Max Verstappen and Kelly Piquet Announce Pregnancy via Instagram,https://www.reddit.com/r/formula1/comments/1h7vfab/max_verstappen_and_kelly_piquet_announce/,2024-12-06, News,,"['These past two weeks have been peak soap opera.', 'Alonso has a new competitor for 2045.', 'Max will soon do a gender reveal by nudging off the track either a blue Willams or a pink Alpine.', 'Minimum Verstappen on the way', 'This weekend keeps on delivering', 'Can he still race next year if he’s pregnant?', 'Some more context behind his championship winning interview where he spoke about not wanting to miss family things. \n\nCongrats Max!', 'Max ""I\'ll make a 2nd driver myself""', ""Project Verstappen is on it's way!!!""]",19917,1485,0.89,19917,496,496,633,40,0.0,633
1h7idtn,Bottas paid the bill for the drivers dinner ,https://www.reddit.com/r/formula1/comments/1h7idtn/bottas_paid_the_bill_for_the_drivers_dinner/,2024-12-05, Social Media,,"['He made the get together a farewell dinner :(', 'Colapinto looks like a man that was not aware a photo was about to be taken', ""So that's why Perez thanked Bottas when he posted the pic. Saw that one and wondered why he was singled out"", ""I'm glad they all still do this each year. I know everything is wild with the Max/George madness, but it feels good that they know they're a small group of guys who do a very unique job and only they truly know how it all feels.\n\nHope they always continue doing this and remember that they've been given incredible opportunities to do great things, and all the hard work and media days are worth it."", 'Bottas seems like the guy who would slip his credit card to the server at the very start of the meal before anyone else even gets a chance to try and pay', 'Colapinto got vibes like\n\nhttps://preview.redd.it/qcqzrrd2d45e1.jpeg?width=2400&format=pjpg&auto=webp&s=c92961055a82db1bab14f036fab11d551e4168a2', ""......Bottas should have made Lewis pay, he's unemployed as of next week.\xa0"", 'Hopefully he used is Sauber credit card.', ""This is such a small thing, but part of me is kinda said that both KMag and Hulk doesn't seem to be part of the dinner... \n\nAnd they weren't last year either. Come on Haas let your drivers eat!"", 'Safe distance between Max and George']",8441,379,0.99,8441,26992,26992,77,0,0.0,77
1h7f5j2,[Carlos Sainz] Look who photobombed our team pic,https://www.reddit.com/r/formula1/comments/1h7f5j2/carlos_sainz_look_who_photobombed_our_team_pic/,2024-12-05, Social Media,,"['Gonna tell my grandkids this was Lewis Hamilton and Nico Rosberg', 'Hide your children, hide your wife', 'Not to be tacky but who would win in a fight: Brad or Jos Verstappen?', 'What a season Sonny has had!', 'Brad Pitt’s last race?', ""I feel like with what the budget of this movie must be with all the locations they're shooting and how long it's been in production, they could have just fielded an actual F1 team."", 'Is it me or is Pitt like extremely old to be playing a F1 racer? This is a sport where most guys are in their twenties to early thirties. People call Alonso old and he’s still much younger than Pitt', ""I don't fault Ferrari guys since F1 is doing business with him but I hope people read up on what piece of shit Pitt is (was) to his wife and kids."", 'Man is that wife and child abuser Brad Pitt!\n\n  \nNice', ""It's crazy how Brad Pitt treated his wife and kids and nobody seems to give a shit.""]",8062,323,0.97,8062,15164,15164,20,0,0.0,20
1h80j7y,"David Croft (Sky F1): There was a claim by George Russell, Max was swearing in the stewards room. Our indication is that there wasn't any swearing going on in the stewards room from Max Verstappen.",https://www.reddit.com/r/formula1/comments/1h80j7y/david_croft_sky_f1_there_was_a_claim_by_george/,2024-12-06, Social Media,,"['praying for a chaotic front row start from RUS and VER.', 'Waiting for Russell to claim Max has treatend Crofty.', '""your word against mine"" is cool only if there will be damning evidence in near future', 'Checking temperatures in Hell. No way David said that.', 'What does “our indication” mean? They talked to a steward that was present but can’t say that?', 'Holy shit. Crofty defending Max??? Yeah the script has gone too far now.', '“Crofty said that in fear of his life” -George, probably', 'George lied about the 19 drivers agree on rule change before which ocon and kmag come out said they did not agree on it lmao', 'Russell be like: Et tu Crofty?', ""Will Buxton was hinting Max wasn't lying either during the weekend warm up show. I wouldn't call Buxton a very reliable source and we weren't there in the room with George and Max to begin with, but things aren't looking good for George. Wonder if he starts to regret a thing or two, especially the reputation he build in recent years as one of the GPDA directors.""]",7477,1068,0.95,7477,498,498,752,77,0.0,752
1h7xe3l,"Max arrives in the paddock and is asked if he's excited to become a dad: ""Yeah I mean of course I'm already kind of a bonus dad, but I'm still very excited!""",https://www.reddit.com/r/formula1/comments/1h7xe3l/max_arrives_in_the_paddock_and_is_asked_if_hes/,2024-12-06, Video,,"['[Bonus video from Max talking about wanting kids earlier this year](https://imgur.com/a/aKoLKQ1) via [Tumblr](https://www.tumblr.com/tyrannosaurus-maxy)\n\n""I would like to, I would love to have kids. You know, naturally I am almost 27. Yeah it would be great but at the end of the day this is not something that you can decide. Sometimes this needs to happen. I don\'t know if there\'s any kind of god out there that decides for you. But it would be great, yes""', 'Very sweet how he immediately says he’s already a bonus dad to P', ""That kid's gonna have some crazy race genes\n\nEdit: Hmmmm maybe ‘racing’ would have been a better choice of words than ‘race’"", 'Anyone remembers the PK with Max, Lewis and Seb talking about this?\n\nSeems like Max is done with free practice', ""can't wait for Daniel/Danielle Verstappen"", 'I think Max will make a fantastic dad. He seems to be great with his step child, is great towards younger drivers and fans. Awesome for Max.', 'Dadstappen', 'Next 17 time F1 champ. Piquet and Verstappen blood that baby will be racing before walking.', '""of course""\n\n\nNow you know it\'s truly official ☺️', 'Bonus dad… that’s actually really sweet']",7191,350,0.97,7191,339,339,396,13,0.0,396
1h7ids6,Max comment under Lando’s dinner photo post ,https://www.reddit.com/r/formula1/comments/1h7ids6/max_comment_under_landos_dinner_photo_post/,2024-12-05, Social Media,,"['I just know everyone was making fun of them at that dinner', 'Colapinto just says anything lmao', ""What does Colapinto's comment mean? 😭"", ""Ok now I'm convinced this will all blow over sooner than later lol"", 'Beef 🥩', ""all of this seems like they're pulling a fast one on us"", 'Colapinto’s missed opportunity to repost the “hehehe” from Max in Singapore', '""Beef"" LMFAO', 'Verstappen is calling Norris “Dead meat”\n\nThis guy must be stopped ! /s', 'king of shitposting']",4830,216,0.98,4830,11658,11658,26,0,0.0,26
1h7ewnb,[@alpinef1team] Yeah we have no idea too,https://www.reddit.com/r/formula1/comments/1h7ewnb/alpinef1team_yeah_we_have_no_idea_too/,2024-12-05, Social Media,https://www.instagram.com/p/DDNDa1GCO5N/,"['The Grid is a better place with Fred on it.', 'He’s french, he’s gotta rep the french team', 'Fred really brings a “Dad” energy to the paddock.', 'I always forget that Fred is such a goofy dude cause he looks like the crankiest old guy ever.', '""Anyone have a *real* TP we can borrow for this photo shoot?""', 'Never change Fred', 'Drunk Fred celebrating with the wrong team after winning the WCC - 2024 colorized', 'I freaking love Fred. He brings so much personality to the grid.', 'Ferrari, your guy is out there stealing hearts again, please come and get him.', 'Max and George trying to kill each other. The Fred subplot:']",3765,119,0.99,3765,5797,5797,23,1,0.0,23
1h834sm,"[BBC Sport] “There were two seats left, both next to Verstappen, who waved, said ""Hi, George"" and indicated for him to sit down. Russell said hello but, in what must have been an awkward moment, then took one of the seats and moved it away to sit next to team-mate Lewis Hamilton”",https://www.reddit.com/r/formula1/comments/1h834sm/bbc_sport_there_were_two_seats_left_both_next_to/,2024-12-06, Quotes,,"['Lawson and Tsunoda were then seen fighting for the remaining seat next to Max.', '2 seats left? both next to Verstappen?\n\nThat was definitely intentional by the rest of the group lol.', 'Max:\n\nhttps://preview.redd.it/rkmce4h4y85e1.png?width=254&format=png&auto=webp&s=5021d2a51e7f60c6048b7bce7373ce54b51a16ef', 'This reads like fan fiction', 'First time Max leaves more than enough space this season and still people complain.', 'Arguably the most hilarious moment of the entire season', 'Max is also taking the piss now', 'This was 1000% intentional by the rest of the group and I absolutely love them for it lol', 'This is like a scene straight out of Real Housewives or something lmao. This stupid drama is honestly giving me so much life 😂']",3860,501,0.98,3860,448,448,1474,120,0.0,1474
1h7in3w,“One more pic!”,https://www.reddit.com/r/formula1/comments/1h7in3w/one_more_pic/,2024-12-05, Social Media,,"['the idea of Lewis editing this together really made me laugh (IDK if he did it himself but the thought tickled me)', 'I too can’t smile with my eyes open lando', 'Every family picture ever lmao', 'Lando getting roasted harder than the chicken he had for dinner', 'Hamilton basically the uncle of the grid. Alonso the other uncle', 'lmao that is both sweet and hilarious 😄', 'Lewis feels left out, he wants beef too', 'bro took 6 pics to fully open his eyes lol', 'Literally me in the family lunch', 'Lando *adorable* Norris.']",3353,50,0.99,3353,3551,3551,27,0,0.0,27
1h7heqz,"[CL16__Fanpage] ""I saw how hurt my father was when he had to tell Arthur that he had to stop racing (money). Knowing that tomorrow he will be with me in FP1 is a very special moment. He deserves it and I'm really happy for him."" (From Sky Sports)",https://www.reddit.com/r/formula1/comments/1h7heqz/cl16_fanpage_i_saw_how_hurt_my_father_was_when_he/,2024-12-05, Social Media,,"['Pretty sure Charles is happier than Arthur to see him in that car', 'I will not crash into my own brother\n\nI will not crash into my own brother\n\n.........', 'This should be the ""Ayao"" default picture for Charles going forward.', 'I had to stop karting at British championship level suddenly at the age of 13 due to funds, it really is shit.\n\nI can’t imagine how much more it would have sucked if I had an older brother who went on to be successful instead of me, but Arthur always seems supportive and humble.\n\nThose are some fucked up feelings most of us couldn’t comprehend.', 'Arthur beating Charles with 1.5 seconds incoming.', 'Their father and Jules would be so proud.', 'now this is some wholesome interviews', '[This](https://www.tiktok.com/@jb.racing/video/7444936980678429985) is the only footage I can find of this interview atm, if anyone has a better quality one feel free to post it.', 'Looking forward to see both Leclercs in red', 'That’s actually so sad, i never knew that about Arthur']",3155,105,0.99,3155,5262,5262,21,0,0.0,21
1h7yk54,[Luke Smith] Ferrari confirms Charles Leclerc will get a 10-place grid penalty after it had to change the battery pack on his car in FP1,https://www.reddit.com/r/formula1/comments/1h7yk54/luke_smith_ferrari_confirms_charles_leclerc_will/,2024-12-06, News,,"['There goes the WCC', ""Well that's ruined some of the fun, I know it was a long shot anyway but damn."", 'Yeah wcc gone. Next year(tm) it is then', 'Brazil was right there. Anyways the dream was good till it lasted. Bye Constructors. 👍🏼', 'For those saying why don’t they take a penalty before, an ES is not a wear and tear, it is more of an unexpected issue. Taking an engine penalty earlier will not prevent this from happening.', 'Just saw Matt from P1 fall to his knees at Tesco', '![gif](giphy|VS3zCR5S6frDW)\n\nChampionship over. AND IN FREE PRACTICE ONE OF ALL PLACES.', ""That's the most Ferrari way to end a WCC challenge."", 'I better see Charles commit some war crimes on Sunday. Take everyone out.', 'I hate this so much...']",2545,249,0.99,2545,241,241,191,6,0.0,191
1h7o6sm,"Alonso on Verstappen's Qatar Grand Prix qualifying penalty: ""Sometimes when they apply a rule or penalty to someone, then why we don’t follow that path? In the next race it is not applicable anymore, depending sometimes which nationality you are.""",https://www.reddit.com/r/formula1/comments/1h7o6sm/alonso_on_verstappens_qatar_grand_prix_qualifying/,2024-12-06, News,,"['Reporter: “How can we make this more spicy?”\nEditor: “Have you talked to Fernando yet?”', 'Alonso: it’s my TURN!', 'Fernando: Never let a crisis go to waste.', 'When shots have been fired all day, why not pull out the glock and let a few fly yourself', 'A thing happens\n\nAlonso: so anyway, like I was saying about Spanish oppression', 'https://i.redd.it/jrtulqaag45e1.gif', 'Alonso: I am playing both sides so I always come out on top', 'I can not believe stewards for such a high stakes sport, that has so much money flowing, are volunteers. \n\nHow do you hold them accountable to any standards when all they are doing is charity. \n\nHow can they not have paid stewards? Just how cheap can you get?', 'But how will these comments affect Lawson']",2005,272,0.95,2005,5903,5903,29,1,0.0,29
1h7gqyl,"[Erik van Haren] Lewis Hamilton organised a joint dinner with all the F1 drivers tonight, just like in previous years. I suspect Verstappen and Russell were not sitting next to each other. ",https://www.reddit.com/r/formula1/comments/1h7gqyl/erik_van_haren_lewis_hamilton_organised_a_joint/,2024-12-05, Social Media,,"['I feel like one accidental kick under the table from a stray leg could blow the whole thing up.', 'Alternatively it would be a whole lot funnier if they did sit next to each other. Give me Lando across from them to start up the conversation nicely. Maybe Alonso for some added spice.', 'They are still arguing about the menu.', 'Genuinely what’s the worst seating plan we could arrange?\n\nMax and George with Lando in the middle.\n\nOcon directly across from Gasly, who’s sat next to Briatore (he wasn’t invited he’s just there, as is Rosberg who’s plonked himself next to Lewis)\n\nLawson in the middle of the spanish speakers.', ""Norris must be wondering why didn't max and George do this at the start of the season."", 'Knowing lewis he’d probably make them sit next to each other', 'Why did Max get up with a steak knife in his back, then?', 'Doohan sitting in the middle feeling super awkward', ""Haven't been this anxious about a dinner since that Thanksgiving episode of The Bear"", 'Poor Albon, Leclerc or Norris in the middle of them like a messenger: ""could you tell George William to pass the salt?"", ""may you tell Max Emilian to pass the ice?"" (I don\'t know how rich people dinners go).']",1922,119,0.96,1922,3650,3650,3,0,0.0,3
1h7wk6g,Lewis Hamilton's Special Helmet for his final weekend at Mercedes [via @MercedesAMGF1],https://www.reddit.com/r/formula1/comments/1h7wk6g/lewis_hamiltons_special_helmet_for_his_final/,2024-12-06, Social Media,,"['Nice, he went to Mercedes due to Niki, and ends his time with Mercedes with a reminder of Niki.\n\nClass.', ""Without Niki there's a very solid chance Lewis never drives or doesn't drive as soon for Merc as he did. Niki went to bat for Lewis to join Mercedes through 2012 for the 2013 season. \n\nMakes sense to give a big nod to him in some way for Ham's final race with the team."", 'What a beautiful tribute to his mentor, Niki. 💜\n\nhttps://preview.redd.it/ydgi83s2q75e1.jpeg?width=846&format=pjpg&auto=webp&s=64d62e7a6367987f8d341cfdd1b9139e37aa2869', 'I was getting worried that he wasn’t going to have a special helmet this weekend. His helmets are always beautiful.', ""Almost feels like he's retiring from F1."", 'Back to the person who started it', ""I firmly believe that Lewis will do a Lauda '84 at Ferrari."", ""This is the Lewis I love. Class act and pays tribute to those who've helped him get to where he is.\n\nNow let's see these emotions turned into some hunger at Ferrari!"", ""I genuinely didn't expect helmet with Danke."", 'As I would expect from Lewis, classy as fuck.']",1902,52,0.99,1902,53,53,166,-1,0.010000000000000009,166
1h7tfbf,"[Antonio Pérez via IG] LYING JOURNALISTS ARE ALREADY LOOKING FOR ME @ F1 PROMISE THAT WHOEVER IS THE LIAR, THEM OR MYSELF, WILL PUBLICLY APOLOGIZE. ON MONDAY I WILL PUBLISH THE LIST OF LYING JOURNALISTS AND MEDIA",https://www.reddit.com/r/formula1/comments/1h7tfbf/antonio_pérez_via_ig_lying_journalists_are/,2024-12-06, Social Media,Poor Checo. ,"['To anyone not Mexican: this man is a politician and a bad one at that. Cringey speeches and passive aggressiveness against media is kind of the deal of the political class in Mexico.', 'He just makes things worse. He’s acting like pageant moms.', 'this is like watching your weird uncle figure out how to go live on facebook except like 1000x worse because he actually has a platform', 'his son is 34 years old\n\nwhy is this man representing checo like he’s a child', 'Wow the drama is incredible today', 'This is wild. Not a great look at all', ""At this point Checo probably has a template apology post ready for his dad's inevitable bs"", 'Checo’s dad is mad that Max vs George has taken the attention away from Checo.', 'What even is happening? We are not in post season yet!', 'He’s not doing checo any favors…']",1832,394,0.96,1832,8240,8240,47,5,0.0,47
1h7zhoq,"[Chris Medland] Christian Horner is asked about Toto Wolff's ""yappy little terrier"" comment, and talks about how he used to have terriers and they're great dogs. ""Is it so bad? Not afraid to have a go at the big dogs ... I'd rather be a terrier than a wolf maybe!""",https://www.reddit.com/r/formula1/comments/1h7zhoq/chris_medland_christian_horner_is_asked_about/,2024-12-06, News,,"['Fanfic writers: And then Christian said to Torger ""I\'m not afraid of a big dog"".', ""Guys let him have his warm-up!\n\nHe didn't bicker with Toto since '22, it's gonna take a while until he's fully back."", 'He had a whole day to come up with a comeback…', 'Redbull really aged by 100 years, this year.', 'Bro does NOT have that dawg in him anymore', ""Who tf would rather be a terrier than a wolf? \n\nHe's got better banter than that."", '>I rather be a terrier than a wolf maybe\n\nI guess that sounded cooler in his head.', 'That’s a lame ass response lol.', 'From my own experience it’s the smaller dogs who have the biggest fucking mouths so I’m more in agreement with Toto here', 'I’m disappointed in Christian. The Wizard of Oz jokes were RIGHT there for the taking, and you fumble it?!\n\n![gif](giphy|Rktoy16VSWwj8Xgrzl)']",1606,208,0.97,1606,201,201,141,16,0.010000000000000009,141
1h7z3sa,Bahrain 2023 vs Abu Dhabi 2024,https://www.reddit.com/r/formula1/comments/1h7z3sa/bahrain_2023_vs_abu_dhabi_2024/,2024-12-06, Throwback,,"['Aston and McLaren swapped.', 'Alonso at every team ever.', 'I mean, is it not true? The car is trash, they went from Top 3 to Worst 3.', '![gif](giphy|LpkBAUDg53FI8xLmg1|downsized)\n\nOh, dearest Fernando. Never change my friend.', 'What is old, is new again lol', ""It's the same car! (Aston Martin didn't update their car for more than two years, prank gone wrong)"", 'Alonso to Red Bull?', ""Shame he didn't end the message with 'zilly boys'"", 'Too hot headed over the radio for the Redbull seat.']",1577,94,0.99,1577,88,88,171,5,0.0,171
1h81isd,[scuderiaferrari] Taking a closer look at @carlossainz55's final Ferrari race suit,https://www.reddit.com/r/formula1/comments/1h81isd/scuderiaferrari_taking_a_closer_look_at/,2024-12-06, Social Media,,"['You can say what you want about Ferrari, but they handled leaving of a driver the greatest this year, of all teams.', 'Awww. Good luck Carlos. Please don’t crash the cursed Williams next year. Operate them smoothly just as you operate the Ferraris.', 'Bro taped his cv to his shirt', '2024 silverstone p2?????? lol', ""I get the point of it, but it really does look like he's wearing a list of races he didn't win"", 'Vamos Carlos!', ""I don't see the big deal here. Hulkenberg's race suits have also been showing all of his podiums for much longer than this one."", 'Hope our smooth operator smooth out Williams next year, no more crashes please 😭.', ""Grande Carlos!\n\nMake em' regret their decision, Vamos!"", 'Give em hell Carlos']",1277,38,0.99,1277,38,38,420,6,0.0,420
1h7mlfp,"Carlos about Lando: ""I see him as a very honest man, maybe a bit too much at times for the criticism he then receives for being honest. He tells the truth, he doesn't have any filters. If he isn't doing well mentally, he says so, but then they criticize him. """,https://www.reddit.com/r/formula1/comments/1h7mlfp/carlos_about_lando_i_see_him_as_a_very_honest_man/,2024-12-05, Video,,"["">You've been Lando's teammate. I don't know if you've seen some of his interviews in the media pen lately. Do you think he's different?\n\n>Carlos: No. Lando? I see him as a very honest man, maybe a bit too much at times for the criticism he then receives for being honest. He tells the truth, he doesn't have any filters. If he isn't doing well mentally, he says so, but then they criticize him.\n\n>When the whole world is pushing to have clarity, honesty (about) mental health, we don't speak with such an example. There's a guy who has done an incredible season – because Lando drove very well this year – and he's a bit honest, he shows his weaknesses a bit and gets criticized a lot.\n\n>All of us in press conferences put on a face, but we all have insecurities inside. All the drivers. And one of us who shows them, gets criticized a lot, so I feel a bit bad for him in that sense.\n\nfrom [@williamssainz](https://x.com/williamssainz/status/1864728106520428655)"", 'Carlos is always so thoughtful and well spoken. One hour on Beyond the Grid was not enough. \n\nAnd, of course, he always speaks out to defend Lando \U0001f979', 'I’ve grown more and more fond of Carlos these last few years. It really is such a shame he lost his seat at Ferrari. But as I’ve said before there’s only one or two drivers in the entire world that could have made him lose his seat. And unfortunately one of them was Lewis Hamilton.', 'Carlando ❤️❤️\n\nPeople shit on Lando so much for his honest interview until they got George vs Max. lol', 'Reminder that Lando went out for dinner with Sainz and his family in Mexico, and I am pretty sure they went out together before that too in Spain.\n\nBffs for life', 'Carlos is all class.', 'A bit off topic and it makes sense after 4 years at Ferrari… but goddamn Sainz’s Italian is good these days', ""And that's why he's my favorite driver. All around great person."", 'He’s just more real. It’s sad he gets so much hate for it.', ""Gained so much respect for Carlos in general these last two seasons, he's very talented, intelligent, and I like how he treats people.\n\nMeans a lot when a talented driver has integrity.""]",1107,51,0.97,1107,2191,2191,21,0,0.0,21
