unique_id,post_heading,post_url,publish_time,tag,post_content,top_comments,upvotes,comments,upvote_ratio,score,total_upvotes_comments,total_score_comments,upvotes_growth_rate,comments_growth_rate,upvote_ratio_growth_rate,score_growth_rate
1jj41r0,Haas' Surprise Double Points Haul! | 2025 Chinese Grand Prix,https://www.reddit.com/r/formula1/comments/1jj41r0/haas_surprise_double_points_haul_2025_chinese/,2025-03-24, Video,,"['F1 seems to be putting more effort into YouTube this year, looks like we will get more radio recaps and now things like single-team recaps for interesting developments. Love to see it!', 'What\'s interesting here is that *it was Bearman* who wanted to come in for the 1 stop.  And Ocon was like ""F it, that sounds good, let\'s go.""\n\nRookie calling his own shots already?  Veteran letting the youngster take the lead when he\'s got a good idea?  Sign me up.\n\nAlso once he gets some experience under himself, Ollie is gonna be a mega tire whisperer.  WHen he\'s been asked to keep a tire alive on a long stint, he\'s not only done it, but managed to overtake while doing so.  Kid\'s got some race management chops.', 'For all the misery delivered to Ferrari and their fans, these disqualifications made a number of Mid teams very very happy.  A fair trade.', 'I’m glad Ollie bounced back. Seriously rough first weekend. I think him and Kimi will be two really good drivers for a really long time.', 'Brilliant strategy works from the Haas team. This is what Ferrari and Raving Bulls should do and take notes on.', ""Unrelated but it's kinda soothing to hear Laura's voice on the radio."", 'they had good pace all weekend,hope they have an improvement after they fix the issues mentioned by Ayao.', 'Hmm... it seems I was wrong about their mullet car after Australia.', 'F1 has been more into socials since the switch to Liberty media. \n\nI doubt the old dinosaur management would even consider commissioning Netflix to make a DTS-like show or prioritise highlight clips and short form vids on TikTok/Youtube shorts shortly after a GP.', 'I’m glad haas got focused here, the backmarkers-midfield deserves more recognition.']",151,27,0.94,151,26,26,4,0,0.0,4
1jiull1,The Race - 2025 Chinese Grand Prix F1 driver rankings,https://www.reddit.com/r/formula1/comments/1jiull1/the_race_2025_chinese_grand_prix_f1_driver/,2025-03-24, News,,"['not bad, pretty agreeable actually - such a contrast to the drama that is power rankings', 'They’re gonna get clowned on but I actually agree with most of this. Only thing that stands out to me is that they put Hulkenburg below Doohan.\xa0', ""Pretty good article. It doesn't just parrot fan talking points that are based around popularity."", ""Hard to argue too much. Think you could have the top 3 in any order really they were all excellent.\n\nStroll at 9 with no one arguing it is quite funny, he's started the year superbly.\n\n\nThink the Alpine rankings might have more to do with the car than the drivers, especially if they're the team caught short with the mini DRS shenanigans but to be honest Doohan should probably be 19th just for the penalties alone even if he didn't look that off the pace otherwise."", ""I always appreciate Edd Straw's rankings. I usually don't 100% agree with them, but can at least figure out how the ranking came to be.\n\n\nI would rank Hulk quite a bit higher. Sprint quali was horrible, but Sprint was just tractor from pit lane, Qualifying was impressive. The race...well...I blame the car for the damage (and Bortoleto's spin). That tractor looked very difficult to handle on heavy fuel."", 'Wtf Antonelli with DOTD and gets ranked 13?! /s', 'https://preview.redd.it/z0tg20zh4oqe1.png?width=912&format=png&auto=webp&s=84400984d0edc7fa07e42df7372d97d035f3fe3c\n\nNice', 'Ocon didn’t undercut Antonelli, he passed him on the track/grass. A reporter also said the same thing during the post-race interview and Ocon corrected her.', 'https://preview.redd.it/80ezfpog3oqe1.jpeg?width=800&format=pjpg&auto=webp&s=97cd41a2abd232b6c000617361328c4ee9041604']",104,85,0.83,104,872,872,-3,0,0.010000000000000009,-3
1jivfwn,Full Ferrari Exchange & Fight For Top Spots | Radio Rewind | 2025 Chinese Grand Prix | Paramount+ - YouTube,https://www.reddit.com/r/formula1/comments/1jivfwn/full_ferrari_exchange_fight_for_top_spots_radio/,2025-03-24, Video,,"['Seems like this *has* replaced the usual ""Top Radio"" and ""Top Onboard"" videos from last year.', 'Yuki asking the reason for the front wing damage and his engineer just constantly repeating ""box for front wing damage"" every time is so representative of their team at the moment', 'Lmao the only reason this video is named what it is is because they got called out for their shitty behaviour. \n\nAs if this now makes it alright. The reach this video has over a live broadcast is minimal.\n\nFuck the FOM.', ""This doesn't actually have the full Ferrari exchange, nor the drivers and team arguing about the strategy. I understand it's a short video but I wish they'd shown more because the Ferrari radio chaos went way beyond what's shown here.\n\nAlso some of these are nearly impossible to understand without subtitles."", 'lol feeling the heat from Fred', 'Of course they would lmao', 'Ciao', 'I always like it when the drivers get a ‘that’s a good overtake good job’ on the radio. I think George’s engineer is especially good at that.', 'I have incorrectly read it as Ferrari radio exchange when they were fighting for the top spots and asked wait!? But at no point either led the race lol', 'I like this style, but only for a few ""Classic Races"" like last week i think was ok, this weekend for me It didn\'t seem necessary since the best part was the post race\n\nAnd I like It more with captions']",74,25,0.88,74,275,275,0,0,0.010000000000000009,0
1jjewpk,Red Bull axing Lawson would send Verstappen the wrong message,https://www.reddit.com/r/formula1/comments/1jjewpk/red_bull_axing_lawson_would_send_verstappen_the/,2025-03-25, News,,"['Title explanation: \n\n>If, and it remains an if for now, Lawson does get replaced soon, then it would send a bad message to Verstappen that Red Bull still has not realised how problematic its car is.\xa0', ""Meanwhile Verstappen probably doesn't care if Redbull runs with 1 car for the rest of the season."", ""Max: I don't care, I want WDC, give me a championship car or I'm gone"", "">If, and it remains an if for now, Lawson does get replaced soon, then it would send a bad message to Verstappen that Red Bull still has not realised how problematic its car is.\xa0\n\n  \nThis is the part that a lot of people seem to miss when they're saying the car is build for/around Max. Max also complained/complains about the car and the balance of the car. There are so many interviews last season with Max basically saying Perez having difficulties is due to the car being shit to drive. If anything this shows that Red Bull have just not been able to build a car with the feedback  of *both* their drivers."", 'IMO sending Lawson back to RB obviously doesn’t really solve the issues that Redbull is having but atleast Lawson would regain some confidence and get more experience in the RB, and with less pressure on him', ""I don't think Max cares who his teammate is to be honest. I highly doubt he's worried about anyone else on the grid jumping in that car and being anywhere near him."", ""You know, I can see why they never wanted Fernando(among other minor things) in the team where Max never minded. It's because Fernando would call them out over the car in public and they be forced to acknowledge it."", 'I honestly can’t think of another team mate outside of Riccardo who had a chance with Max too. Never cared for kyvat, but I’ve liked most other 2nd seat guys, it’s a shame they are being compared to max.\n\nI hope Yuki doesn’t get shafted either', ""Its very funny that Red Bull has two teams and still can't find a driver they have confidence in. All the other teams make do with the two seats they have""]",96,101,0.83,96,96,96,79,59,0.10999999999999999,79
1jjduro,"McLaren ""in a better situation"" with race starts compared to last year - Stella",https://www.reddit.com/r/formula1/comments/1jjduro/mclaren_in_a_better_situation_with_race_starts/,2025-03-25, News,,"[""Yeah F1 is all about fine margins, and I'm sure these better starts are contributing to the overall success so far, but really their car is just far more superior"", ""i dont exactly know about China but in Australia both Mclaren's had a good launch but verstappen caught up in the 2nd phase of Acceleration, which was a continuous problem last year when Lando had good reaction times and 1st phase but always lost out during the 2nd phase"", 'Noticible indeed.\xa0 Keep it up papayas!', 'The second phase of the start is still sluggish judging by the onboards', 'It could Not get worse tbh', 'It is better, but still probably not the best. The team probably knows this and will probably be working towards it.\n\nOne encouraging aspect would be that China has one of the longer stretches into the first corner. Only Baku is longer if I remember right. So holding positions or even gaining one in the race last weekend is quite positive.', ""Max's starts are monstrous - it is not the car, it is how the driver plays the car."", ""Stella says in the article, “We have done very well on reliability last year but this year in a couple of races we had a couple near-misses. So this definitely needs to be addressed.” Obviously Shanghai had Norris's brake issues but what else have I missed reliability-wise? Or have the other instances he's referring to gone under the media radar?"", 'Ferrari is fucked.']",79,17,0.96,79,15,15,28,6,0.010000000000000009,28
1jj1o4j,A Eulogy to Stand-Alone Post-Race Recaps,https://www.reddit.com/r/formula1/comments/1jj1o4j/a_eulogy_to_standalone_postrace_recaps/,2025-03-24, Discussion,"I’d consider myself a pretty avid Formula 1 fan — started at age 8 (1997) and have followed every single season, 2025 included.

Despite all the well-deserved criticism the F1TV app gets, I love watching old race recaps. The archive is a real treasure trove of long-forgotten F1 moments. I started with the 1989 season and, after many, many hours of watching, I’ve just begun the 2010 season.

There’s something so charming about those old recaps. They’re like a mini race documentary series. They featured insights about the circuit, weekend events so far, interviews, commentary on current rumors, the starting grid, and sometimes even more. They also provide important historical context.

Today’s race recaps, by comparison, feel so dull and cheaply made with the spliced up OG commentary. It genuinely hurts. Especially thinking ahead a few years, rewatching a season will give you just the race, instead of a holistic view of everything happening at the time: the drama, the fashion, the old tech, and so on.

Anybody else feel the same?","['I\'m wondering: Is it because we get SO MUCH information during the broadcast already, what is there to add in the post-race? \n\nMy family are new to F1, and the kids have been watching some world broadcasts out of curiosity, and we\'re like, ""What\'s going on? We just see cars going around in circles, lol."" Exaggerating, but you get the point...', 'What are these videos called in the service? I remember starting the 70s and they had a whole season review/recap. Once I got to the 80s everything seemed split up by race and there were sometimes a couple of options too. I got a bit lost!', 'I LOVE those. For those who don’t have F1TV, you can find most of them free on [YouTube](https://youtube.com/playlist?list=PLuTEMVou8i5HC2gq8K8yZ0tT4BzUMnl-I&si=cnva4h5YoI6GvLhp) and [Dailymotion](https://youtube.com/playlist?list=PLuTEMVou8i5HC2gq8K8yZ0tT4BzUMnl-I&si=cnva4h5YoI6GvLhp)!', ""For those who don't have the F1 app, Big Zeddie on YT uploads some of the BBC highlights from multiple seasons"", 'This is a good point! \nGoing back and watching older races for the first time, I’ve been finding myself feeling almost lost sometimes because there’s no timing tower, sometimes gaps aren’t shown on screen for what feels like five or ten minutes, etc. and I have no clue where anyone is until a commentator happens to mention it - if they do. It makes sense to me that having so much more information, both through commentary, graphics, and all the apps we have available now, would incidentally lead to less need to be told what happened after the fact for the regular fan.', 'Interesting. I\'ve been watching f1 since I was a kid until after I graduated uni when i took sabbatical from f1. When I started to watch f1 again in 2020, i felt like suddenly I understood races so much better to the point that i thought ""was my english that bad back then? Did i miss a lot of the things that the commentators said?"" This probably helps me partially understand why.']",58,9,0.83,58,9,9,-3,0,-0.020000000000000018,-3
1jisqi7,2025 Chinese Grand Prix - Day After Debrief,https://www.reddit.com/r/formula1/comments/1jisqi7/2025_chinese_grand_prix_day_after_debrief/,2025-03-24, Day after Debrief,"Welcome to the Day after Debrief discussion thread!

Now that the dust has settled in Shanghai, it's time to calmly discuss the events of the last race weekend. Hopefully, this will foster more detailed and thoughtful discussion than the immediate post-race thread now that people have had some time to digest and analyze the results.

Low-effort comments, such as memes, jokes, and complaints about broadcasters will be deleted. We also discourage superficial comments that contain no analysis or reasoning in this thread (e.g., 'Great race from X!', 'Another terrible weekend for Y!').","[""I think limping home to 2nd will do Lando's title bid a lot of good. When second is the best you can do, take it. Drivers like Lewis know this and it is why he is so successful.\n\nTitles aren't lost on weekends you finish 2nd, they are lost on the disastrous weekends you DNF."", ""I think (without the DSQ) Leclerc's Race in a weird way was hurt by his strong pace at the start of the last stint\n\nBecause he looked quick and everybody thought he could get George , so he pushed so hard , and that front Wing probably also didn't help with tire deg, destroyed his tires and Lost so much to George, meanwhile max was back there saving his tires and in the last 15 Laps he could push, you could see leclerc was limping home to the end while others were flying\nAnd George as well did his best lap while catching up to Lando ,\n\nOn the other hand i actually think Ferrari made the right call with Lewis , one of them was gonna finish in P6 so because Lewis had the pitstop gap to ocon behind it was worth the try"", ""Haas always gives me heart palpitations, man. But after seeing Ocon's clean drive yesterday and Bearman's pursuit to end in the points, I am absolutely optimistic for their prospects. I think it'll take a while for them to get their footing, considering there is work to be done on their qualifying but ultimately, they had a good one yesterday and I want more of that"", ""Red Bull have really got themselves into a pickle with this 2nd seat.\n\nAll they had to do was stick Yuki in it for his final season under contract, help them develop the car (which they knew they had issues with, fundamentally), and let LL have a season of confidence building in the RB.\n\nInstead, they've got this huge mess on their hands now with no real way to exit it without any collateral damage. It's been so badly handled and a real indictment of where that team is right now. \n\nI can't wait to see what happens next!"", ""I'm absolutely reeling from Williams already equalling their points haul from 2024. I'm so excited to see where they can get this year. P9 in the Constructors in '24 was brutal..."", 'I thought it interesting that Channel 4 (UK) coverage did an interview with Hadjar where they asked him what was so good about the Racing Bulls car this year. He answered simply “because it’s easy to drive” and almost looked at the camera with a look of “please don’t put me in the red bull”', ""It's weird seeing so many people wanting Lawson replaced after 2 races. \n\nYes he's had 2 shockers but I still think he deserves more time than this. He should get until at least Imola sorta time to be fully evaluated imo."", 'After the sprint race there was so much talk about possible 3 stop race. But then it was one stop race. What happened?', ""Pure conjecture on my behalf, but often with innovation can come some gremlins, and I do wonder if Lando's brake issue could be attributed to whatever magic McLaren have going on with their front axel? Stella's comments about not disclosing the reason due to IP concerns was interesting. Fingers crossed it doesn't show up too much moving forwards, I need this Lando or Oscar WDC as a long suffering fan!"", ""I think Mercedes, George specifically, is going to be in the fight for WDC.  Their strategists are better than Mclarens and their car isn't massively off pace.  Less than a tenth in quali and 2 tenths off in race pace over the 56 laps. One good Mercedes upgrade or bad mclaren upgrade can swap that into Mercedes favor.""]",57,155,0.91,57,1709,1709,1,4,-0.020000000000000018,1
1jiq4v8,F1 HOT or NOT - 2025 Chinese GP results,https://www.reddit.com/r/formula1/comments/1jiq4v8/f1_hot_or_not_2025_chinese_gp_results/,2025-03-24, Statistics,,"['VCARB strategist department should be sacked.', 'Lawson has more ""best"" votes than Gasly lmao', 'What’s colder than cold?  Liam Lawson', 'what did Alonso do to deserve -0.48 lol', 'Lawson is P20 even in these ratings. lol', 'I know these mean nothing but DAMN RIGHT Ocon is second!', 'How can anyone think Verstappen was bad or even worst in anything this season? You must really be blind to think that', ""I'm going to guess a lot of people voted on this before the DSQs came out?\n\nEdit: I meant this in reference to the team ratings, not the drivers."", ""Seems overly harsh on Lando, the qualifying gap was super small, he got back up to second immediately, held station in 2nd all race waiting to go on the attack and would have had his brake pedal not given up on life.\n\nOscar drove a better weekend, but the gap isn't as big as this result.""]",54,78,0.79,54,810,810,2,0,0.010000000000000009,2
1jivct1,11 things we learned from F1's Chinese GP weekend,https://www.reddit.com/r/formula1/comments/1jivct1/11_things_we_learned_from_f1s_chinese_gp_weekend/,2025-03-24, News,,"['Amateurs. I learned 12.', '>Norris’s default style is more to ‘U’ the corner, so keeping up the minimum speed but asking more of the car on turn-in, while Oscar Piastri is more a classic ‘V’ driver. Of course, both adapt and modify but this is a fascinating difference between the two that will have a role in the ebb and flow as they battle over the course of the year.\n\nInteresting', ""I got up at 5am for it, so I was half asleep. Definitely didn't learn 11 things."", ""Is one of the 11 things we learned that FOM radio messages can't be trusted?"", 'The only thing I learned is that we are doomed', ""I bet Ferrari didn't learn a thing."", ""So Norris's driving style is more of a problem in this McLaren than it is for Piastri. But just 3 years ago when everyone was pointing out the opposite for the Ricciardo and Norris pairing Norris also was claiming that McLaren didn't suit his style.\n\nThe question is, what car will suit Norris? Or is it just the fact he also has to claim he's having a problem if others are too. \n\nBut honestly, this is just who Norris is. Nothing can be perceived as being better for him to himself it seems."", 'Hah. Nerd.', 'tsk I learned 15']",38,32,0.82,38,255,255,2,0,-0.010000000000000009,2
1jjaoel,Gilles Villeneuve Driving Blind,https://www.reddit.com/r/formula1/comments/1jjaoel/gilles_villeneuve_driving_blind/,2025-03-25, Video,,"['When asked about the black flag that was nearly shown to him (the whole front fell off just in time), he replied, ""how was I supposed to see that black flag?""', 'Safety has come a long way in this sport and probably many others', ""Gilles was your favourite's driver favourite driver. Might not have been the best or fastest, but gods he was exciting to watch. Never held anything back on a lap. Taken from us much too soon."", 'And he got on the podium. P3 for him!']",31,6,0.86,31,4,4,3,0,0.0,3
1jixxdl,F1 Standings Race 2 but NASCARed,https://www.reddit.com/r/formula1/comments/1jixxdl/f1_standings_race_2_but_nascared/,2025-03-24, Statistics,,"['A knockout playoff system?! AHHHHHH NOOOO GET IT AWAY! GO AWAY!!!!', 'Now who will make it to the Walmart Sprint Knockout Playoffs round 3 presented by Kleenex?', ""Don't give them ideas"", 'God that system is so crap.', ""Rain in a Race, Hulkenberg gets a win, in the playoffs, in the First round other's engine fails, then in Abu Dhabi, max takes out both McLaren and himself, Hulk the champ"", 'I feel like this is actually, for the most part, pretty accurate in terms of whos performed. Again, for the most part.', 'Nevermind the playoffs, but the NASCAR season points system is the best IMO. It ranks everyone all the way down, rather than stop halfway for the sake of ""prestige"" and leave half the grid unranked.', 'Thank you for curing me from the gift of sight!', 'You get this cursed shit outta here']",32,52,0.65,32,292,292,8,0,0.030000000000000027,8
1jjfinl,Even the best driver on the grid needs a team mate to push them - Norris,https://www.reddit.com/r/formula1/comments/1jjfinl/even_the_best_driver_on_the_grid_needs_a_team/,2025-03-25, News,,"[""I mean, Max hasn't had a team mate that pushed him since 2018 at the latest. I think he's done just fine since then."", '>Even the best driver on the grid needs a team mate to push them - Norris\n\nGood of him to volunteer his services for Piastri, then.', 'Lando probably won’t think that once Piastri emerges at their #1\xa0', 'Some need a team mate. Others just a toxic home environment to perform at their best. I’d venture a guess that one of the options is better for mental health and longterm happiness.', 'Well he has done alright without one for the last 4 years', 'Norris is the epitome of the guy who ""re-discovers what has already been established"".  It genuinely feels like he thinks he\'s the only one who knows these things lmao ever since he\'d had a fast car, how often he makes such quotes.\n\nMax has been fine since 2018, regardless of his teammates. Having checo anywhere close to him only pissed him off into producing drives like Miami. If I was norris I\'d stay focused on myself and what I need to do, because he came close to gifting Max a win in the opening race, while Max is in what seems like the 4th best car on the grid. He was 0.8s away from an embarrassment in the opener.', ""He's obviously talking about pushing Oscar the best driver. It isn't gonna be  Max since he just needs luck as he has no talent, nor Lewis as he can only have the fastest car 7 years ago."", 'I think Lewis filled that role for him. If Max isn’t isn’t the lead then he’s going to push himself. The team mate is irrelevant', 'He\'s been ""pushed"" by Perez on a few very rare occasions and all it did was unleash an absolute menace in him. I don\'t think he\'s ever been as deeply pissed as he was after Baku when Checo beat him']",16,26,0.78,16,22,22,16,26,0.78,16
1jjfowh,Can a driver win the world championship in a season whilst driving for 2 different teams?,https://www.reddit.com/r/formula1/comments/1jjfowh/can_a_driver_win_the_world_championship_in_a/,2025-03-25, Discussion,"Yuki Tsunoda has already got some points for Racing Bulls. If he was to finish the season alongside Max at Red Bull and somehow unlock the performance of the car and become world champion can the points from both teams be used?

Alternatively if Yuki arrived at Red Bull and pointed out the car was actually crap. If Max switched to race in the junior team and was able to dominate with that car, could he also be world champion driving for different teams?","['Nice try, Max', ""Yes. Juan Manuel Fangio did exactly that in 1954, started the first two races with Maserati because the Mercedes W196 wasn't ready. Once it was good to go he raced with Mercedes."", 'Driver points are driver points, not tied to a constructor.\n\nSainz scored points for STR and Renault in 2017, and Vettel in 2007, BMW and STR, are the only ones in recent memory who have scored points for two different teams in the same season.\n\nEdit: Forgot Max at STR and RBR in 2016.', 'Yes you can. WDC and WCC are two separate championships. Just as you may collect points for different constructors, you can win the title while driving different cars. People aready pointed out that Fangio won the title like this in 1954.', ""Yes, his points would be combined. It's never come close to happening, but is feasibly possible."", 'Ollie Bearman last season with Ferrari and Haas', '>Forgot Max at STR and RBR in 2016.\n\nAnd Kvyat in reverse in the same season. And Gasly/Albon in 2019. And Perez/Stroll whichever year it was where Force India folded midway through', ""Fangio did it in 1954. He started the season with Maserati because the Mercedes wasn't ready for the first couple of races."", 'Fangio did it in 1954']",12,13,0.75,12,12,12,12,13,0.75,12
