unique_id,post_heading,post_url,publish_time,tag,post_content,top_comments,upvotes,comments,upvote_ratio,score,total_upvotes_comments,total_score_comments,upvotes_growth_rate,comments_growth_rate,upvote_ratio_growth_rate,score_growth_rate
1orrgnk,Lando Norris wins the Sprint of the 2025 São Paulo Grand Prix,https://www.reddit.com/r/formula1/comments/1orrgnk/lando_norris_wins_the_sprint_of_the_2025_são/,2025-11-08, Sprint,,"['Only like 3 overtakes all race and we missed them all. Classic', 'DOTD goes to the TV direction for showing us absolutely nothing', 'Thank you for that Leclerc overtake on Alonso and the Gasly move on Stroll, TV race direction! I never really wanted to see overtakes anyways /s', ""Let's go Kimiiii!!!\nAlso Lando is the first Sprint pole sitter in Brazil to win the sprint!"", 'And we saw nothing else because TV race direction, once again, sucked.', 'a big W for antonelli!', 'Rip oscar', ""- Dream sprint win for Lando with Oscar crashing out and Max having a muted race\n- Chaos all of a sudden after the sprint felt like it was slowly settling down after the first 4 laps\n- Antonelli made things interesting towards the end, but it felt like he hit a bit of a wall once he got into dirty air range. Cooked his tyres possibly.\n- Loved how racy veteran Alonso looked on the restart. Also was hoping he'd nail P5, but brilliant defending from a probably faster Ferrari behind for as long as he did\n- Great first start from Lewis\n- So sad for Bortoleto to crash out in his home race... Must be such a dampener"", 'Holy shit, that was a mega crash from Bortoleto…\n\nAlso wtf, that TV direction was genuinely among the most shit all season, kept looking at the useless not even battle between Antonelli and Norris, or Gasly and Stroll, missing an actual overtake on Alonso, and massive crash from Bortaleto and some of his battles before that', 'Very clean sprint by Lando which is what he needed given Oscar crashed out. Antonelli though…what a talent, I am such a fan of his. \n\nCharles I’ll take P5, but just can’t expect any fun from a Ferrari right now. Can’t wait for the next time he has a decent car.']",5272,392,0.95,5272,364,364,119,5,0.0,119
1orlalj,Max verstappen not happy.,https://www.reddit.com/r/formula1/comments/1orlalj/max_verstappen_not_happy/,2025-11-08, Quotes,,"[""“Let's look at this thing from a... um, from a standpoint of status. What do we got on the racecar that's good?”"", ""That's the title over with for Max then"", ""We went from it's over to we're back to it's over again. \n\nIs this how Ferrari fans feel?"", ""Max is gonna need a divine intervention this weekend or he's out of the title battle.\n\nIt was always crazy to me that some people started to think he was the favorite after those few wins. Even the betting sites went crazy for him. Meanwhile he needed a pretty much perfect run in and that was always unrealistic as already shown in Mexico."", 'Piastri vs Norris on the clean side can be a repeat of Austin. 3 cars pile-up and he gets 6 or 7 points in the sprint.', 'Last chance for max - mercedes al qaeda', 'Viva Yelistener', 'I wonder if the mexico floor upgrades did actually fuck up the car!', 'May be even unhappier next year if RBR and Ford fumble their PU.', 'Welcome back MV33.']",4514,215,0.96,4514,2937,2937,47,0,0.0,47
1orqpsf,"GP: ""We are gonna give you some recommendations-"" 

Max: ""Its wet, I have no grip-"" 

GP: ""Yes we are giving you recommendations so you avoid oversteering into the corner every lap, whether you take them or not its up to you.""",https://www.reddit.com/r/formula1/comments/1orqpsf/gp_we_are_gonna_give_you_some_recommendations_max/,2025-11-08, Video,,"['This is literally their dynamic. GP has talked about it and Max has said if GP stopped talking to him like this, he’d want a new engineer.', 'If he’s oversteering then try steering less', 'I would simply steer the right amount.', 'This why GP is perfect for Max', 'PER MY LAST EMAIL....vibes lol', 'Max learning how to gentle parent Lily from GP.', ""I really like their dynamic. Like [that time GP set him straight and completely silenced him](https://youtube.com/shorts/c-Tm1qPQ5fM?si=O-T5fVIv7n-FctBs) when on the SIM/F1 game.\n\n**Max:** It's the fastest way around this game\n\n**GP:** So just lock up front, doesn't matter..?\n\n**Max:** No, no, you don't lock. It's just, it's just...\n\n**GP:** Well, you do lock. I've got the data mate. You do lock.\n\n**Max:** ...  (*cheeky smile*)\n\nTheir banter is just great. So much trust between them."", 'I live for their radio messages lmao', 'Love me some Gianpiero Snarkase', ""GP being Max's second dad atp""]",3666,96,0.99,3666,95,95,188,4,0.0,188
1orqe1i,"Piastri, Hülkenberg and Colapinto crashes into the barriers - Safety Car called",https://www.reddit.com/r/formula1/comments/1orqe1i/piastri_hülkenberg_and_colapinto_crashes_into_the/,2025-11-08, Video,,"['Kimi saying Norris dropped a mario kart banana on the track', 'Absolute nightmare stretch since Baku', 'Piastri took so much water on the inside curb, felt inevitable that someone would do that', 'oscar is depressing to watch now man :(', 'Three unrelated crashes in one corner is nuts', ""Franco's was a hard one damn, Oscar is struggling badly the last couple weeks pressure is a horrible thing sometimes"", 'Norris with a bucket hauling water at the corner haha', 'Flashbacks to 2003', 'Oh my God man, what the hell. Same corner for all 3\n\nI feel bad for Oscar :(', 'Scary to see all those cars crash right next to each other. Could have been bad.']",3333,732,0.97,3333,433,433,68,8,0.0,68
1orqyjm,"Oscar Piastri recent results: DNF, P4, P5, DNF (Sprint), P5, DNF (Sprint) His last podium was over 2 months ago...",https://www.reddit.com/r/formula1/comments/1orqyjm/oscar_piastri_recent_results_dnf_p4_p5_dnf_sprint/,2025-11-08, Statistics,,"[""Oscar you didn't have to go full Mark Webber like this!"", 'To be honest, in the last part of the 2024 season Piastri also seemed to lose a lot of form, only difference was that last year he wasn\'t leading the championship. I don\'t know if it\'s something related to these specific last circuits that he doesn\'t like or feel comfortable in, if there\'s something around these dates that happens to him, or if it\'s just the fatigue. But it was """"expected"""" in a way', 'Absolute nightmare for the guy who had barely put a foot wrong before Baku.', 'He\'s doing exactly what everyone thought Norris would do ngl.\n\nThe suggestions of him being another ""Iceman"" seem to have come a bit too soon honestly.', 'The downfall of Oscar Piastri needs to be studied', ""my man is in a slump and i am not enjoying this :( first season i'm watching where i'm actually rooting for someone and it's ruining my watching experience, need to go back to my dgaf days"", 'To be honest from one perspective, you can say he’s lucky that two of the DNF’s were in sprints, because if one had been in the main races, it would basically be over', ""The good part is the ending of conspiracy theories. It's time to assume that Piastri is just not performing well."", 'The bottle job is on another level I must say', ""It's always difficult to predict what the next season will be like, but Piastri let the title slip away in a frightening way. This year there were two number 1 drivers. Next season, if Norris can make the most of his current standings, he could be different and start from a disadvantage he didn't have this year.""]",2324,302,0.97,2324,265,265,111,5,0.0,111
1orrioe,Bortoleto goes airborne and crashes into the barriers,https://www.reddit.com/r/formula1/comments/1orrioe/bortoleto_goes_airborne_and_crashes_into_the/,2025-11-08, Driver is okay,,"['Bortoleto said ""I\'m okay"" on the radio before getting out of the car. He has been taken to the medical center. There are no updates from the team at this point.\n\nUpdate 15:15 UTC - Stake F1 Team Kick Sauber on Twitter:\n\n>Following a crash at the end of the sprint race, Gabriel is ok and being taken to the circuit’s Medical Centre as a precaution\n\n>Gabriel está bem e está sendo levado para o Centro Médico do circuito por precaução\n\n  \nUpdate: 15:45 UTC\n\nBortoleto was cleared from the medical center and was shown running back to the team\'s garage', 'Impact so hard the steering column broke. Jesus.', ""Alex must've seen his life flash before his eyes, god damn"", 'Broke the steering column...', 'He got some serious air there, insane speed.', 'Amazing he’s ok. What a insane crash', 'His DRS was still open when he turned. Crazy shit', 'He was lucky he didn’t get T-boned… happy he’s okay damn', 'Holy shit, that’s a massive crash at full speed', 'Holy crap, is he ok?']",2204,375,0.98,2204,364,364,87,1,0.0,87
1orr8ei,"Gasly: ""Yeah that Ferrari needs to get past Alonso"" - Engineer: ""I'll be sure to let him know""",https://www.reddit.com/r/formula1/comments/1orr8ei/gasly_yeah_that_ferrari_needs_to_get_past_alonso/,2025-11-08, Video,,"[""Yeah that's good banter from the engineer 😂"", ""It doesn't hurt to ask!"", 'Love the snark from the engineer', '""You cannot be this much slower than Alonso, come on!!""', 'It worked.', 'What not being in last place does to a mofo', 'Unrelated but Gasly just made a point oh my god what a legend', 'Leclerc needed the encouragement because he did it after that LMAO', 'Engineer: ""They told me they are checking and will get back to us.""', ""Reminds me of trolling from last race “sorry I just have a fucking mclaren up my ass and I was wondering if you'd like me to let him pass?”\n\nOr whatever Russell said 🙃""]",1241,27,0.99,1241,27,27,43,1,0.0,43
1or8wh6,"São Paulo's weather service issues ""severe alert"" for bad conditions ""in the next few hours and all over saturday""",https://www.reddit.com/r/formula1/comments/1or8wh6/são_paulos_weather_service_issues_severe_alert/,2025-11-07, News,"""Civil Defense: Conditions are favorable for rain and strong wind gusts in the coming hours and throughout Saturday, the 8th. Avoid open areas and seek shelter if necessary.""

I live near Interlagos btw, me and everyone in the area received this alert on their phones.

Let's see what happens in the next few hours, not raining right now","['Great... red flag day then', 'So interlagos will just be one huge Lago?', 'Aston Martin chaotic 1-2 incoming', ""This is god's punishment for making it a sprint weekend."", 'Uh-oh.', 'There’s a severe storm coming from the northeast of Argentina that has already hit the south of brazil with winds of up to 130 km/h. I don’t think this storm will hit São Paulo with the same strength (I live here) but I think it’s going to have a lot of rain. Weather here is actually very weird right now. Warm night with no wind. Super quiet. This usually precedes rainy and colder weather.', ""Sometimes when I read Portugese my Hispanic brain comes on, then I get bamboozled before  I realize/remember it's Portuguese!"", 'The FIA is more hydrophobic than a rabies patient.', 'Y’all getting excited for a chaotic race, when in reality what’s probably gonna happen is that bullshit from last year\xa0', 'Really depends what type of storm is going to be. If it’s the classical tropical summer rain where it goes hard for 30 minutes then it stops I can see both sprint and quali happening, if it’s sustained then yeah we are in for a long day of waiting.']",1134,142,0.99,1134,2868,2868,8,0,0.0,8
1orqq40,Antonelli’s onboard shows Norris hitting the curb and spraying water,https://www.reddit.com/r/formula1/comments/1orqq40/antonellis_onboard_shows_norris_hitting_the_curb/,2025-11-08, Video,,"['Tactical water spray by Lando #ChampionsMentality', 'I am sure most of them have done that on one lap or another', ""Can't believe he'd do that on purpose /s"", 'Lando throwing a banana peel at his teammate so he’d crash- absolutely despicable behaviour/s', 'Lando is playing mario cart', '5D Chess obviously', 'They all sprayed water when hitting the curb so feels cumulative impact was the main factor', ""I'm here for insane people claiming that he did it on purpose."", 'This is gonna be the dumbest conspiracy', 'Lando got away with it there unlike his teammate, Antonelli doing the smart thing and staying off the kerb.']",705,148,0.96,705,131,131,2,1,-0.010000000000000009,2
1orqj2q,[Rory Mitchell] Colapinto might be in trouble as he crashed under the yellow flag. Hulkenberg just reached the zone as it turned yellow before he went to the scene of the accident.,https://www.reddit.com/r/formula1/comments/1orqj2q/rory_mitchell_colapinto_might_be_in_trouble_as_he/,2025-11-08, Speculation,,"['How can he crash? I specifically forbade it.\n\n- FIA (Brazilian Grand Prix Sprint, 2025)', 'I knew you could not overtake under yellows, but that you cant crash is first time', 'Nobody was lifting', 'Hulkenberg saw the yellow before he lost control too.', ""It'll be a slap on the wrist, he's already out lol"", 'There definitely was a yellow flag out on Hulkenbergs onboard', ""Shouldn't Hulkenberg be given a penalty? Dude drove the wrong direction while cars came his way."", 'wait what?', 'This has to be a joke', ""It's now illegal crashing under a yellow flag lol""]",501,113,0.94,501,106,106,-1,0,0.0,-1
1orrkhw,[AstonMartinF1] A strong Sprint in São Paulo.Fernando finishes in P6 and Lance in P9 at Interlagos.,https://www.reddit.com/r/formula1/comments/1orrkhw/astonmartinf1_a_strong_sprint_in_são/,2025-11-08, Social Media,,"['So close to a Stroint 🥲 needed a touch more dampness and to not fuck that start lol', 'Nice', ""Softs were the wrong choice after the restart. LiCo didn't help, great job defending though"", 'incredible shame about running softs after the restart. The rolling start invalidated a big advantage the softs might have had also and they clearly died in the last few laps compared to mediums', 'Excellent defence from Fernando as usual until the soft tires gave up.', ""Putting lance on 8 lap old used softs for that restart was not the correct decision there but maybe they just didn't wanna waste a new set of tyres on it."", 'Nice.', 'Does someone remember when was the last time Alonso scored in a sprint (Until now)? Seems like ages ago', 'Nice', ""Turns out medium were better, race restart didn't favour Aston, still a good job.""]",450,65,0.99,450,61,61,4,0,0.0,4
1ora3fi,[Team Gasly] Brazil padel crew 🎾,https://www.reddit.com/r/formula1/comments/1ora3fi/team_gasly_brazil_padel_crew/,2025-11-07, Social Media,,"['Toto probably put in Georges contract that he has to take Kimi everywhere.', 'Damn Kimi looks 15.', 'Gasly is also looking for new phone case.', ""There's a duo I rarely see together, George and Gasly. \n\nROFL at the Merc pair's matching stances and mini shorts 😂"", 'Who’s the guy I don’t know?', 'What has Kimi got ahold of?', ""I love how small Kimi looks in literally every single picture he's in"", 'Gasly looks like he is wearing a hair hat', 'thought the guy on the right was jonathan bailey for a sec', 'And the winner plays against Aston']",431,18,0.96,431,435,435,-1,0,0.0,-1
1orqvv4,"Lewis Hamilton's race start, he went from P11 to P8",https://www.reddit.com/r/formula1/comments/1orqvv4/lewis_hamiltons_race_start_he_went_from_p11_to_p8/,2025-11-08, Video,,"['Mega start by Lewis!', ""These last two season it feels like Lewis is like 'right, let me overtake every car until I get to my teammate'"", 'Was an excellent start, jumped Isack and Caught Lance napping while he was recovering his horror start', 'He still got it', 'Looks like Unc still has a couple of moves up his sleeve', 'Unc with a great start', 'Very effortlessly done, but takes insane skills to actually do - Ham has pretty good spatial awareness, if I could recall from some extracts.', 'Fantastic start.', 'Very nice, not as good but a bit like Max last year.', 'Wow an Ferrari overtook Lance and racing Bull.']",346,17,0.95,346,16,16,2,0,0.0,2
1orrlm1,Would be really nice to have split screen battles to not miss out on side by side battles.,https://www.reddit.com/r/formula1/comments/1orrlm1/would_be_really_nice_to_have_split_screen_battles/,2025-11-08, Discussion,"Norris fighting w/ Kimi while Charles is overtaking Alonso. Why are splitscreen display not a thing?

Another instance was when Bortoletto crashed while Kimi was chasing for P1. 

Would be nice not to miss out on live action.

 I play videogames, and for tournaments, we get to see 3 side by side splits during the early stages. So if some small studios are doing it, why is F1 not doing it? ","['Them cutting away from the alonso leclerc battle after hyping it for 10 laps was lame', 'The cut at the excact moment when Leclerc overtook Alonso was the absolute worst', 'It was much worse than usual', 'We got to see Bortoletto crash live on a split screen, though?', '\\>Another instance was when Bortoletto crashed while Kimi was chasing for P1.\n\nHuh? It was shown on the splitscreen, it was shown live.', '>\xa0Another instance was when Bortoletto crashed while Kimi was chasing for P1.\n\nWell they had absolutely no way of knowing that was coming, so I’m not sure how they can be expected to show that live\n\nThey didn’t show the replay immediately because Lando was coming up to the finish line and/or the impact force sensor probably triggered and so they didn’t want to show a crash that potentially resulted in a serious injury', 'Or just cut away from Norris/Kimi for the 3/4 of the lap where there won’t be an overtake.', ""F1TV used to do split screens when it first started, but they seem to have done away with it for some reason.\n\nEdit: [pulled a screencap of a side-by-side](https://i.imgur.com/UVy318t.jpeg) as a random example from 2022 (Miami).\n\nThere was a minibox for the Leclerc overtake, but it disappeared basically right as he got a nose ahead, which was a bit weird. Would have been nice to have a split screen of the live action with a replay of the overtake.\n\nBut for Bortoleto, I think it's generally good practice to not show replays of big crashes until there's confirmation the driver is ok."", ""It's not even a case of split screen. No one wants to see Antonelli chase Norris through a part of the track where he can't overtake anyway like the previous 5 laps while Leclerc is obviously close enough to Alonso to make an actual move. Just show us the overtakes.\n\nIt just comes across as if the TV direction has no feel for where actual action can take place on any of the tracks.""]",271,61,0.94,271,59,59,2,2,0.0,2
1orkxgf,"Alpine rehired Colapinto ""on talent"" and his backing is a ""happy accident"" - Nielsen",https://www.reddit.com/r/formula1/comments/1orkxgf/alpine_rehired_colapinto_on_talent_and_his/,2025-11-08, News,,"['Good. Hope Colapinto can match Gasly for p19.', 'What a way to say their academy drivers are shit and they can’t attract anyone to a disaster class of an organization', 'bullshit alert', 'You know what, I actually believe this to be true. I think he’s clearly got talent - we saw it a lot last year and in flashes this year, especially recently - and he deserves his place on the grid.', 'One just need to see his race pace versus Gasly over the past few races to see he really deserves it. Hope Alpine can make a step forward in the next cycle; the fanbase generally doesn’t appreciate talent if u are fighting for p15-p16', ""Anyone who has actually been paying attention since the summer break will know this to be true. \n\nHe's been matching Gasly but the car is so poor many people haven't noticed."", 'Aged like milk. He managed to go at full speed in the wall under yellow flag.', ""I think it's a smart move. Some teams are too quick to shuffle drivers out and Alpine is one of them, but let's see what happens three races into 2026."", ""I think it's a good choice. Their car is poor anyway so not like adding a new junior would help. Lets see how good he is when they finally make a car that's not super slow."", ""Alpine literally offered his seat for the final 3 races to Doohan for cash, until Colapinto's sponsors raised more money""]",215,71,0.89,215,525,525,5,1,0.0,5
1orq9zm,Sprint Race start - Bearman gets spun around by Lawson,https://www.reddit.com/r/formula1/comments/1orq9zm/sprint_race_start_bearman_gets_spun_around_by/,2025-11-08, Video,,"[""Bearman went too wide and almost pushed Lawson out but then Lawson can't spin him out like that, probably a racing incident. What a start by Lewis anyway"", 'Seems like a 1st lap racing incident to me', 'Really would have been great to see it live but youtubetv and Disney are stilllllll in their pissing match. Time to look at switching.', 'Bearman 5s for driving Lawson onto the grass, Lawson 5s for spinning Bearman.', ""Looked like Lawson had the corner. Won't stop people getting mad at Liam"", 'Lawson is just playing Pokémon Go, gotta catch em all.', ""Everybody calling for Lawson's head but that just bias talking.\n\nBearman pushes him in the straight, then get collected in a racing incident at the corner exit, having enough room but being a little bit too tight.\n\nNot sure what Lawson did bad here."", 'Excellent PIT maneuver from Lawson', 'Wish I was able to watch the US broadcast. I have YouTube TV and for some reason ESPN disappeared. Downloaded the espn app to join the broadcast on lap 6 in Spanish. Fuck espn and YouTube.']",180,54,0.97,180,52,52,4,0,0.0,4
1orr121,Sprint Race - Rolling restart,https://www.reddit.com/r/formula1/comments/1orr121/sprint_race_rolling_restart/,2025-11-08, Video,,"['Still can’t get over that decision, the track is no wetter than it was at the first start', 'Why would you do a rolling start', 'Could the rolling start be to save time? A red flag during a sprint is going to change the plans massively i imagine', ""Why though? Should've been a normal start."", 'Are F1 stewards allergic to common sense? It feels like every race they somehow manage to make the wrong decision.', 'mahn alonso!', 'It’s pretty clear that F1 wants to avoid race stoppages in a sprint by any means necessary.', 'Should have never been a rolling start', 'Also Russel took almost verstappen out', ""FIA you don't help yourself with the conspiracies with choices like this, rolling start was unnecessary""]",134,130,0.93,134,125,125,-3,3,0.0,-3
1orq0dh,2025 Brazilian GP - Sprint Discussion,https://www.reddit.com/r/formula1/comments/1orq0dh/2025_brazilian_gp_sprint_discussion/,2025-11-08, Sprint,"# ROUND 21 - BRAZIL

FORMULA 1 MSC CRUISES GRANDE PREMIO DE SAO PAULO

# 🕒 SESSION TIMES

|Day|Session|Time (UTC)|
|:-|:-|:-|
|~~FRI~~|~~Free Practice 1~~|~~14:30~~|
|~~FRI~~|~~Sprint Qualifying~~|~~18:30~~|
|SAT|Sprint|14:00|
|SAT|Qualifying|18:00|
|SUN|Race|17:00|

[Click here for start times in your area](http://f1calendar.com/)

# 🏁 RACE INFORMATION

* **Track**: Autódromo José Carlos Pace
* **Location**: Interlagos, Sao Paulo
* **Race laps**: 71
* **Lap length**: 4.309 kmkm
* **Race distance**: 305.879km
* **Lap Record**: 1:10.540, Valtteri Bottas (2018, Mercedes)

# ⏪ LAST TIME AROUND

* **Pole position**: 1:23.403, Lando Norris (Mclaren)
* **Race winner**: Max Verstappen (Red Bull Racing)
* **Fastest lap**: 1:20.472, Max Verstappen (Red Bull Racing)

# 📺 WHERE TO WATCH?

F1 is broadcast on F1TV and through several local broadcasters. [Click here](https://www.formula1.com/en/toolbar/content_schedule.html) to find out if F1TV is offered in your region. [Click here](https://www.formula1.com/en/toolbar/broadcast-information.html) to go to the full list of broadcasters. Streams and downloads are not welcome on r/Formula1. Requesting and sharing streams and/or downloads will be met with immediate bans.

# ❤️ GOOD CAUSES

* 🇺🇦 [Want to support Ukraine? Here's a list of charities.](https://www.reddit.com/r/ukraine/comments/s6g5un/want_to_support_ukraine_heres_a_list_of_charities/?utm_source=reddit&utm_medium=usertext&utm_name=ukraine&utm_content=t3_t5okbs)
* 🏳️‍🌈 [Support Stonewall to help improve the lives of LGBTQ+ people.](https://donorbox.org/support-stonewall)","[""GP hasn't learned that sometimes your girl doesn't want a solution, sometimes she just wants to vent."", 'verstappen side plot every race: “mate this car is fucking shit”', 'tactical water by norris', 'Holy shit Lando did actually banana peel them lmao', 'Lando with the banana peels lmaooo', 'At least they red flagged it instead of 15 and a half laps of SC', 'Interlagos is so above the other 23 circuits of the season that a single kerb on a Sprint race can be more exciting and important for the Championship at the same time than other 10 GPs combined', ""Not even gonna lie if Kimi really corrected when he saw the water spray from Lando I'd say that's some damn good driving"", 'Blaming Lando like it’s a fucking Mario Kart banana', 'All three took the same line and all 3 crashed!!  \n\n\n\n\nHoly hell']",113,6692,0.95,113,491,491,2,-1,0.0,2
1orp1mw,Final Sprint Starting Grid - 2025 Brazilian Grand Prix,https://www.reddit.com/r/formula1/comments/1orp1mw/final_sprint_starting_grid_2025_brazilian_grand/,2025-11-08, Statistics,,"['More Stroll points would feed families', ""*Maxxieee, I'm gonna launch a human torpedo for you.*"", 'Honestly can we just have Alonso in RB with Max next year? Maybe its a competitive car and Ferrari makes something competitive as well and we get Max/Alonso vs Leclerc/Hamilton', 'Stroints', 'I’d sell my soul for that', 'This would feed billions', 'Definitely needed, big chance for both the Aston boys', 'Need stroll to turn into senna this weekend. Genuine chance to lock down P6 win WCC (maybe even have a go at Williams in P5).', ""In these conditions as long as he doesn't bin it we know Lance is quick"", 'I feel like Williams is too far ahead, I don’t think they will be caught for P5. P6 however, that’s all to play for between the whole midfield.']",111,12,0.98,111,12,12,5,0,0.0,5
