unique_id,post_heading,post_url,publish_time,tag,post_content,top_comments,upvotes,comments,upvote_ratio,score,total_upvotes_comments,total_score_comments,upvotes_growth_rate,comments_growth_rate,upvote_ratio_growth_rate,score_growth_rate
1oel46m,'Not good enough' - Red Bull on Tsunoda ahead of key 2026 call,https://www.reddit.com/r/formula1/comments/1oel46m/not_good_enough_red_bull_on_tsunoda_ahead_of_key/,2025-10-24, News,,"['> When asked about Tsunoda\'s deficit to Verstappen in the race, Mekies said: ""We always want more. I\'m not going to tell you it\'s good enough because you are right in quoting your numbers.\n> \n> ""I\'m not going to tell you that it\'s good enough, nobody feels like that, Yuki doesn\'t feel like that.\n> \n> ""All I\'m saying is that it\'s two races in the points, it\'s two very good starts, it\'s two very good first laps, and it\'s a progression compared to what has been shown so far this year.\n> \n> ""Is it good enough? No, I would lie if I was telling you that - and more so Yuki would not be happy if I was telling you this is good enough.""', ""He seemed genuinely emotional (kind of a mix of high strung/sadness/anger) answering some of the questions at the press conference. I wouldn't be surprised if he already knows he's not going back to RB either."", 'Endless 2nd seat dance.', 'He got a fair shot and nobody here can say otherwise.', 'Just confirming what everyone already suspected. At least he got a legit shot at it.', 'Hes had 6 years other guys only get 6 races its unfortunate but the clear correct decision', 'This is confirmation that it’s well and truly Tsunover.', 'I’m of 2 minds about it. Yuki is starting to look on the up slightly, but I don’t see it being nearly enough to warrant the seat. I mean he’s now had 17 races, where Liam only got 2 before Red Bull dropped him (not mentioning things like experience as well).', 'I think Yuki should pursue a year as reserve and tester with Aston Martin since Drugovich is off to Formula E.  Put himself in the mix for 2027 at AM as one or both of their current drivers departs by then.', ""Yuki is doing a bit better now but his better days was literally the floor for both Albon and Gasly who were sacked.\n\nIt's just difficult to celebrate points finishes for Yuki when Max is literally contending for the WDC in the same car""]",580,205,0.9,580,4166,4166,29,4,-0.010000000000000009,29
1oerpk3,Aston Martin accepts procedural F1 cost cap breach over delayed signature,https://www.reddit.com/r/formula1/comments/1oerpk3/aston_martin_accepts_procedural_f1_cost_cap/,2025-10-24, News,,"[""> Motorsport.com understands at least two teams have been the subject of a potential breach, with it now understood that one of them is Aston Martin, which has agreed an Accepted Breach Settlement over missing the 31 March deadline.\n\n>Sources have indicated that while the Silverstone-based squad had prepared its documentation in time to hand over to the FIA, its auditor was unable to provide a crucial signature due to extenuating circumstances beyond the team's control.\n\n>It is understood that Aston Martin has otherwise complied with the 2024 cost cap itself, and as it acted in good faith the squad's penalty is limited to a fine covering the additional paperwork.\n\n[...]\n\n>With the FIA waiting to publish the full 2024 compliance data at once, Aston's minor breach doesn't fully explain the lengthy delay, with it understood at least one more unnamed team has been the subject of investigation."", 'Just as reference: Williams missed the deadline in 2022 and had to pay 25k. Aston Martin had a different procedural breach in 2022 and that cost them 450k', ""Gonna be spicy af if it's McLaren or Red Bull xD"", 'There have been a few procedural breaches by Aston Martin since 2022, right? Always something to do with the admin.', ""Will be interesting once it's published: https://api.fia.com/events/fia-formula-one-world-championship/season-2024/cost-cap-administration"", ""> its auditor was unable to provide a crucial signature due to extenuating circumstances beyond the team's control\n\nThat's fair imho. Probably needs just a slap on the wrist, and for Aston to have a stern word with the auditor. \n\nProbably find a new one, actually. At the end of the day deadlines exist for a reason; auditors [and financial consulting in general] always hammer home the importance of compliance, and it seems like Aston held up their end of the bargain. The auditors are at least professionally obliged to hold their end of the deal."", '> Aston Martin had a different procedural breach in 2022 and that cost them 450k  \n  \n12 procedural breaches:  \nhttps://api.fia.com/news/accepted-breach-agreement-between-amr-gp-limited-and-fia-breach-2021-fia-formula-1-financial', 'Other team is probably Williams with all the crashing last year', ""if it's redbull again the drama will be absolutely cataclysmic"", ""Hilarious if it's Cadillac.  Like... How?!? :P""]",500,34,0.98,500,33,33,80,1,0.0,80
1oegpne,"Sainz brands Mexican GP grid penalty ""completely disproportionate""",https://www.reddit.com/r/formula1/comments/1oegpne/sainz_brands_mexican_gp_grid_penalty_completely/,2025-10-23, News,,"[""It's the standard penalty of 10 seconds converted in the normal way to 5 places. So that's why they decided for it. Under the rules, it was clear that he was predominantly at fault, so there isn't really a reason why they should have given a different penalty."", 'Cmon brother, sometimes it’s better PR to just say yup, my bad', ""Sainz isn't the one who is known to own up to their mistakes."", 'Then don’t do stupid moves in future. Take some accountability pls', 'always the same guy :/', 'Sainz is always crying about something', 'I like Carlos but his excuses are getting ridiculous', 'He really likes to complain', 'Sainz, the only rookie sounding non-rookie in the conversation', 'Carlos Sainz try to take accountability for literally anything challenge: **IMPOSSIBLE**']",415,115,0.92,415,2814,2814,11,2,0.0,11
1oeu2lc,[RaceFans] F1 considered splitting US TV rights between Netflix and other platforms,https://www.reddit.com/r/formula1/comments/1oeu2lc/racefans_f1_considered_splitting_us_tv_rights/,2025-10-24, News,,"['splitting F1 TV rights sounds like an awful idea\n\nwhat you think of when you hear that is ""great! I can choose which platform to watch it on!"" but the reality is that they\'d divvy up the races and make you pay for 5 different platforms to watch the whole season', 'Horrendous deal for fans, just like Premier League in the UK where you need Amazon, Sky and TNT to watch it all legally', 'That’s how I stopped watching football altogether in Germany. Sky, DAZN, Telekom, Prime, whatever else existed since that started I just chose none instead.', 'Splitting any rights to a sport causes no end of issues and it will result in the decline of the sport. You already see this with football in the U.K. To watch all the games you can, you would need Sky, TNT and Amazon, with Sky and TNT costing at least £18pm each. I cannot remember the last time I watched a European match as I just cannot afford it. \n\nYou need to have young fans watching it, or you will have no fans in the future. The less and less that is available to everyone, means less and less people tuning in.', ""Just make F1TV available EVERYWHERE. I'd take a price hike even."", '""We considered doing the dumbest thing, but in the end we just took the most short term money. It was never about viewers, just the money. See? Everyone wins"".\xa0\n\n\n--F1', 'They really forget 🏴\u200d☠️ is an option', ""Splitting the rights 50/50 sounds like it'd be terrible for people trying to follow the sport. Go onto r/NASCAR and see how many people enjoy the Cup Series being spread over two broadcast networks, three cable channels, and Prime Video - especially considering how ratings have sunk this season.\n\nThe only split that makes sense for F1, IMO, is the one frequently made in other countries: the bulk of the races exclusive to a pay platform, but the country's home grand prix at minimum simulcast on a FTA network."", 'Why does kid didnt watch our race with 5 different subscription to watch them all ? \n\nDomenicali: race must be too long for those damn kid.', ""As much as I'm not a fan of the Apple TV deal, splitting the broadcast rights would've been an even worse idea.""]",345,118,0.96,345,114,114,104,22,0.010000000000000009,104
1oerfen,Tsunoda apologises for ‘very unnecessary’ Lawson comments,https://www.reddit.com/r/formula1/comments/1oerfen/tsunoda_apologises_for_very_unnecessary_lawson/,2025-10-24, News,,"['So he apologised to RB but not Lawson? Alright then', 'You don\'t see Bearman apologizing for his ""think about the kids"" comment', 'But he apologized to the team, not to Lawson, lmao.', 'Good on him for apologising at least. The way he complained over absolutely nothing was baffling.', 'Wasnt it Collapinto?', 'He knows he just lost his seat for next year lol', 'After about a week, and didn’t even directly apologise to the driver he was mouthing off about who had done nothing wrong. Had to wait for media to bring it up before doing so too.\n\nWouldn’t call it a sincere apology by any means.', 'well well well', 'What did he say', 'This is what Yuki said, make up your own mind. For me, Tsunoda has lost his.\n\n“Lawson is disturbing me on purpose, like, slowing down like hell in the corners.”\n\n\r“For Lawson it’s always usual story; it’s just always do something on purpose.”']",283,68,0.94,283,63,63,33,3,0.0,33
1oefodb,[Autosport] Sergio Perez will get behind the wheel of a Ferrari (SF-23) in Imola next month in preparation for his return to F1 in 2026,https://www.reddit.com/r/formula1/comments/1oefodb/autosport_sergio_perez_will_get_behind_the_wheel/,2025-10-23, Social Media,,"['Lift and coast Sergio.', 'The only man who has driven a Red Bull, Ferrari and Mercedes (albeit pink) in modern era.', 'LONG LIVE THE MEXICAN MINISTER OF DEFENSE', 'Will it be televised', 'Remember guys, Perez was in Ferrari Driver Academy, Sainz was from Red Bull Academy', 'Yay😃!', 'Source: [Autosport on Instagram](https://www.instagram.com/p/DQKo4o2Dbq8/?igsh=bjBzZjN2cjI2Y3gy)', 'Sergio ‘Lico’ Perez', 'The revolution will not be televised', 'probably not but there will definitely be lots of people taking videos there and posting them up on Youtube. there’s lot of Italian channels always filming at F1 test sessions in Monza Imola Mugello etc']",257,13,0.97,257,12,12,49,2,0.0,49
1oetfuq,‘Frightening’ – Hadjar on prospect of joining Red Bull,https://www.reddit.com/r/formula1/comments/1oetfuq/frightening_hadjar_on_prospect_of_joining_red_bull/,2025-10-24, News,,"[""Think it's pretty much sealed then. Don't believe they will give Lawson another go (even if he is preforming quite well), some miracle must happen for them to keep Yuki. \n\nBut also, it makes sense to be worried if he doesn't know how the car woud be next year. You don't want to be 1s second slower than Verstappen and ruin your career just at your 2nd year."", ""Post title far from the article's main point lol"", 'You’d have to think that joining after a regulation change would be the best time, given it’s basically a clean slate with Verstappen', 'Seems like the second Red Bull is 30+ seconds behind at the end of the race no matter who is driving it. Even when Checo was getting second place it was only because Red Bull was 30 seconds ahead of the rest of the field. Is Max just really that good or is there some pther explanation for the second car being so much slower?', 'I would love to see someone like Alonso take up the second RB seat.', ""Someones got to beat him eventually - I'd rather they go into it with some confidence."", 'Time to pull Ricciardo out of retirement', 'If I were Hadjar and RedBull Racing, I would sack the rest of the season to make the car with similar specs than Max in order to get used to the driving style now. Make use of the fact that you can try things out in racing conditions and adjust those specs little by little.', ""If the switch happens, I'm both excited and nervous for Hadjar.""]",243,69,0.94,243,67,67,85,11,0.009999999999999898,85
1oexy6h,"OnThisDay 24 October 2010, the Korean Grand Prix, the inaugural race in South Korea, took place in difficult wet conditions, with heavy rain causing a delayed start and a race full of incidents.",https://www.reddit.com/r/formula1/comments/1oexy6h/onthisday_24_october_2010_the_korean_grand_prix/,2025-10-24, Throwback,"Fernando Alonso with Ferrari won the race, followed by Lewis Hamilton in a McLaren in second place, and Alonso’s teammate Felipe Massa, in third.  Sebastian Vettel, who had been leading the race from pole suffered an engine failure in his Red Bull with just 10 laps to go, handing the win to Alonso. This result had a significant impact on the championship standings, as it allowed Alonso to take the lead in the title race.
","['The picture of filthy F1 cars under lights at the end of the race is so cool.', 'The day Mark Webber lost his only shot at a title', 'Team members had to stay in Love Hotels that weekend. Karun still mentions it from time to time.', 'I vaguely remember watching this race live. IIRC Adrian Sutil had one of the worst driving performances in F1 history.', 'The mark webber of before this race never really came back. Vettel germany 2018 vibes', 'I will forever love that photo of the Ferraris covered in shit. It was a proper old school mud fest on a barely finished race track. Naively thought Alonso had it in the bag after that race', 'Incredible race.\n\n\nAlonso was flawless. IIRC, he actually lost a place to Lewis during the safety car pits stops late on due to a mechanic making an error, but Lewis then went off at the restart giving Alonso P2, which became P1 when Seb retired.', ""Massa's soul has left his body"", 'My abiding memory of this circuit is that they designed the final sector as a street track and then never got round to building any of the streets.', 'This was one of the best tilke tracks I always loved the racing there']",182,32,0.96,182,30,30,182,32,0.96,182
1of1wwt,Oliver Bearman prepared to take further action over 'dangerous' Yuki Tsunoda move,https://www.reddit.com/r/formula1/comments/1of1wwt/oliver_bearman_prepared_to_take_further_action/,2025-10-24, clickbait title,,"[""The post will remain for now as there's some discussion in the comments, but racingnews365 earned themselves a spot for the end-of-season clickbait wall of shame"", '""Think about the kids""  \nthis is too much to bear man', 'He was asked if he would bring his feelings about it up at the driver’s meeting and he said “Maybe”. This has somehow been turned into the melodramatic “further action” as if he’s planning on taking some kind of dramatic stand about it to some higher body. They all gripe and moan about perceived injustices in drivers meetings and always have done. Nothing new.\n\neta: some of the best comedy we have been gifted as fans by this sport comes from back in the days when they used to record the driver meetings and make them public, precisely for this reason.', ""Why won't anyone think of the kids?!?! 😂 \n\nYou made an aggressive move that didnt work out for you, let it go lol"", ""This is all from someone who's two penalty points away from a race ban."", 'Bro just take the L and move on', 'Lol this is such a sensationalized headline. “Prepared to take further action” while he really says “I’m still looking at it the same way”. This is what passes for journalism these days, huh?', 'this kid is so dramatic', 'Ope. That’s certainly a choice.\n\nNot one I would make tho.', 'Not sure which bubble he lives in, but people only have to give way in that situation if you have a blue flag on your side. Fafo.']",179,81,0.81,179,73,73,179,81,0.81,179
1of27kf,"[The Athletic] Aston Martin in minor breach of F1 cost cap, as grid waits for FIA to publish 2024 results",https://www.reddit.com/r/formula1/comments/1of27kf/the_athletic_aston_martin_in_minor_breach_of_f1/,2025-10-24, News,,"['Why are the 2024 results not out till now? Takes them a year?', 'I expect every year to see someone do something like that... A small procedural issue. No intent to deceive, just the wrong box ticked or someone did something a few minutes later than allowed.', ""Newey's catering budget?"", '> This is because the procedural breach was a late finalization of Aston’s cost cap submission, which had it in compliance with the financial restrictions in place for 2024. The delay followed an auditor being unable to provide his signature by the deadline due to extenuating circumstances beyond the team’s control.', ""Hear me out here right. \n\nIf Mclaren are caught in a major breach, they could well lose points and therefore the championship, which means Ferrari wins.\n\nIf Ferrari's year is next year, it must be 2023 right now, which is why Verstappen is winning everything."", ""What's stopping every team from breaching the cost cap? FIA's penalties for breaching are just slap in the wrist at best."", ""From what we know, it's RedBull. If the cost cap breach exceeded 5 percent they might be disqualified from both Championship, which would be ideal"", ""Breach is a breach. \n\nWhat's with the minor tag in front?"", ""They wanted to release all of the teams together, and accounting takes time.\n\nPlus there's another team with an alleged breach, so that needs to be ironed out before they can release the figures.""]",108,27,0.94,108,27,27,108,27,0.94,108
1of03zx,Hot Wheels expands Formula 1® Collection to include Scuderia Ferrari HP and Aston Martin Aramco Formula One™ Team,https://www.reddit.com/r/formula1/comments/1of03zx/hot_wheels_expands_formula_1_collection_to/,2025-10-24, News,,"[""Ah, they decided they wanted in too. I don't know which side caved on the money, but it's worth it for both sides.\n\nIt just reminds me of how Ferrari and Mercedes turned down Netflix in year 1, and then in year 2, Lewis is basically the first person on the screen in DTS.\n\nObviously Ferrari wants kids with the Ferrari hot wheels car- (and adult collectors as well).\n\nI see simplified versions of driver helmets as well."", ""Need the Ferrari one (got Max and Lewis' Merc in the last round)....  of course, you won't be able to find it.  LOL."", 'I just wish BBurago had the licenses to make all the teams in 1/43 scale. Hot Wheels are a little too small for my liking.', 'I saw some hot wheels in a box store recently and was surprised that they were only like $1.50 each.\xa0 Terrible quality, but I expected them to be $15 like Legos or whatever.', 'So until now they had a formula 1 collection without the most important f1 team? And without ferrari?', 'Are they going to add more stock to the die cast cars released earlier this year that sold out in 10 minutes?', 'Yay, my toddler will be thrilled. He loves Charles Leclerc.', 'I’m not sure what was the deal with Aston Martin, but I believe Ferrari in general had an exclusive contract with a different company, but it recently ended. I thought this was already announced because Hot Wheels just released regular Ferraris for the first time in a while. They just released the Hypercar I’m still keeping an eye out for.', ""Same, I was buying those BBurago cars for my kid to play with and was disappointed to find I couldn't get the full set. They're a much nicer size, while still being relatively cheap enough that I don't mind him beating them up."", 'There are two versions. One super cheap that are basically toys for their race tracks and one from Hot Wheels Premium. Those are more expensive and  not all already available. They have much better quality and detail, still cheaper than MiniGT etc.']",90,13,0.92,90,13,13,90,13,0.92,90
1of1wer,Hadjar laughs at suggestion he already knows his 2026 F1 team,https://www.reddit.com/r/formula1/comments/1of1wer/hadjar_laughs_at_suggestion_he_already_knows_his/,2025-10-24, News,,"['Yuki can stay with redbull if he takes out couple of McLarens', 'So Red Bull in 2026 and Racing Bulls in 2027', 'I feel like whatever Red Bull decide to do people will think it was the wrong decision next year.', '""I laugh in your general direction""', 'He’s got to catch them first', 'Mexico 2025 crashgate 2.0', 'Or just straight up sent to the shadow realm', 'Oh boy', 'Nah its a new regulation. He will have 2years of ok results and fall off a cliff.', 'It’s the fickleness of the game. Damned if you do, damned if you don’t. Just look at the revisionism going on these days on Checo’s exit.']",67,15,0.96,67,15,15,67,15,0.96,67
1oetcdh,The epic three-way F1 title tussle at the Mexico Grand Prix … in 1964,https://www.reddit.com/r/formula1/comments/1oetcdh/the_epic_threeway_f1_title_tussle_at_the_mexico/,2025-10-24, Throwback,,[],58,0,0.94,58,0,0,9,0,0.0,9
1oegmwb,It's race week! The title fight intensifies! 🤯 40 points separate the top 3 as F1 heads to the high-altitude challenge of Mexico City.,https://www.reddit.com/r/formula1/comments/1oegmwb/its_race_week_the_title_fight_intensifies_40/,2025-10-23, News,"Here's everything you need to know:   
📍Autodromo Hermanos Rodriguez — 4.304 km, 17 corners  
🚩 Laps: 71 — Total distance: 305.584 km  
🚀 Lap record: 1:17.774 (Valtteri Bottas, 2021)  
⚡️ Track record: 1:14.758 (Max Verstappen, 2019)  
🚨 Safety Car probability: 43% (from the last seven races)  
☀️Weather: Sunny all weekend  
🗓️Practices: FP1 — Fri. 12:30 (local time), FP2 — Fri. 16:00, FP3 — Sat. 11:30  
⏱️Qualifying: Sat. 15:00  
🚦Race: Sun. 14:00",[],29,0,0.9,29,0,0,3,0,-0.010000000000000009,3
1oebbgz,A Week in the Life of an F1 Driver,https://www.reddit.com/r/formula1/comments/1oebbgz/a_week_in_the_life_of_an_f1_driver/,2025-10-23, Video,Power Players - Jason Kelly follows Pierre Gasly from Alpine Headquarters to a Paris photo shoot to get a firsthand look at how the business of being an F1 driver goes far beyond the track.,"['Liked by Pierre Gasly', 'Is it just him on social media', ""I didn't watch this.  But I guarantee his week is still better than mine.  LOL.""]",18,3,0.67,18,26,26,-3,0,-0.04999999999999993,-3
1oet6yo,Blog – Lessons from the Pit Lane: What Adrian Newey Can Teach Scientists,https://www.reddit.com/r/formula1/comments/1oet6yo/blog_lessons_from_the_pit_lane_what_adrian_newey/,2025-10-24, Quotes,"Hello,

  
I thought the sub might find this article interesting, from an interview with Adrian Newey recently at F1 Headquarters for the Race Against Dementia summit. ",[],13,1,0.79,13,0,0,4,0,-0.04999999999999993,4
