unique_id,post_heading,post_url,publish_time,tag,post_content,top_comments,upvotes,comments,upvote_ratio,score,total_upvotes_comments,total_score_comments,upvotes_growth_rate,comments_growth_rate,upvote_ratio_growth_rate,score_growth_rate
1giphwv,"Stroll damages his wing in the formation lap, out of the race as he is beached",https://www.reddit.com/r/formula1/comments/1giphwv/stroll_damages_his_wing_in_the_formation_lap_out/,2024-11-03, Video,,"['WHY DID HE DRIVE INTO THE GRAVEL', '??????????????????????????????????????????\n\nHe drove into the gravel. What is he doing?', 'That might be the worst attempt at a formation I’ve ever seen live', ""Can't make this shit up"", 'Said okay that was not really your fault.\n\nTHEN HE PROCEEDS TO GO THROUGH THE GRAVEL.\n\nCome on lmao', 'All the hard work of mechanics, gone in formation lap. LMAO', 'This guy has 8 years of F1 experience btw', 'He got strolled', 'And now he has his beachparty. lmao', 'This is peak Stroll. It cannot get Stroller than this.']",3069,530,0.99,3069,19357,19357,4,0,0.0,4
1gilguh,Lando Norris takes pole position for the 2024 São Paulo Grand Prix,https://www.reddit.com/r/formula1/comments/1gilguh/lando_norris_takes_pole_position_for_the_2024_são/,2024-11-03, Qualifying,,"['Second row of mistreated employees', 'Wow. That was one of the wildest quali sessions I’ve ever seen. Absolute chaos, non stop reds, and what a grid we have.\n\nSee you later lads!', 'GET IN THERE RACING BULLS\n\nTsunoda, Ocon, Lawson 3-5. Holy shit', 'RB masterclass', 'RB main team finished 3 and 5', 'TSUNODA LETS GO.', 'Yuki 🥳', 'YUKI P3 LETS GO', 'Dam\n\nOscar fumbled.\n\n\n\nBut holy shit yuki what a lap.', 'TSUNODA MY GOATTTTT']",5873,728,0.95,5873,23384,23384,6,0,0.0,6
1girmlz,Sainz: These are not new inters! Hello?,https://www.reddit.com/r/formula1/comments/1girmlz/sainz_these_are_not_new_inters_hello/,2024-11-03, Video,,"[""This is the funniest team radio I've heard in 23 years of watching this sport."", 'Lol haha. This race keeps giving', 'I laughed so hard at this message lmao', 'Sainz always has the best radios lmao', 'What the fuck is this race lmao', 'THIS IS THE FUNNIEST RACE IVE SEEN IN F1', 'Ricky: you’re dead to me Carlos', 'The hello at the end sent me', 'Ah yes, this was the one thing that this race was missing, Ferrari clownfuckery!', 'i love carlos']",2136,109,1.0,2136,7097,7097,2,0,0.0,2
1gilomc,Tsunoda Is starting from the highest position in his career! P3 FOR YUKI!!,https://www.reddit.com/r/formula1/comments/1gilomc/tsunoda_is_starting_from_the_highest_position_in/,2024-11-03, News,,"['He needed this after a bad weekend in Austin. Looking forward to VCARB strategy having Lawson finish in front of him and both of them out of the points somehow!', 'Helmut Marko to Yuki and Liam ""The one who does the best job at going bowling at turn 1 gets the Red Bull drive next year""', 'Yuki could win this race and Horner would still talk about Lawson promotion to RBR', 'If Yuki gets a podium I will be the happiest person on the planet', 'He was on it all morning. My man!', ""Horner's logic: Lawson fired for not beating Tsunoda, Hadjar in his car from Las Vegas, Checo extended for more 5 years.\n\nKeep cooking, Yuki"", 'Exciting to see how the strategy fucks him out of points later today', 'Yuki divebomb into turn 1 and takes the lead, im all here for it', 'Put Chef Yuki in a Red Bull!']",5227,124,0.99,5227,4535,4535,0,0,0.0,0
1girgty,"Brazillian fans chant ""Drugovich"" as Stroll gets stuck ",https://www.reddit.com/r/formula1/comments/1girgty/brazillian_fans_chant_drugovich_as_stroll_gets/,2024-11-03, Video,"Funniest shit ever

https://www.instagram.com/reel/DB6ptgvPOLA/?igsh=MXJzd3lpdGk2MTNn","['Oh my God, this is hilarious. Brazilian fans are brutal lmfao', 'They clearly believe in manifestation.', 'What was Stroll thinking? lmao.', ""It's the formation lap, he's recovered it on the tarmac run-off, but decides to re-join *via the sand trap*. WTAF?"", ""The Brazilian narrator even called him dumb. And frankly, can't blame him"", 'South American crowds and shithousery go hand in hand', 'The people have spoken', 'Not while Lawrence is around unfortunately guys', 'I love the Brazilian fans.', 'You have to visualize, and I suppose vocalize, what you want to see happen to make it happen.']",2071,95,0.98,2071,3979,3979,-2,0,0.0,-2
1gio7l6,[@WilliamsRacing] Team Statement ,https://www.reddit.com/r/formula1/comments/1gio7l6/williamsracing_team_statement/,2024-11-03, Social Media,,"['Albon has had a rather rough tripleheader.', 'No mechanic magic today but I know they tried their best.', 'Shame about Albon, he was doing such a great quali. At least Franco will get to compete, even if he doesnt score points, it could be a good experience to race in f1 for the first time in these weather conditions.', 'Noooooo, when will this streak end for Albon', 'Well the good news is, Williams have more faith in Franco than in Logan. Man gets to drive his own car at least.', 'Incredibly disappointing. I was so happy for Alex’s performance in Q3, but he was definitely shaken up and the car was just absolutely obliterated. I’m just glad he’s okay', 'Back to back Q3 appearances and not making to the end of lap 1.. horrible run for Alex', 'Franco looked in awe at the support he has on the track parade and given his Grandfather dying prior to the weekend that is nice', 'unfortunate, but not unexpected.', ""Damn, I was hoping they'd somehow miracle it back together""]",3287,147,0.99,3287,4440,4440,6,0,0.0,6
1gip7ld,2024 Brazilian Grand Prix - Race Discussion,https://www.reddit.com/r/formula1/comments/1gip7ld/2024_brazilian_grand_prix_race_discussion/,2024-11-03, Race,Welcome to everyone who has successfully figured out their timezones,"['Stroll just binned it on the formation lap.\n\nThis is going to be an epic day.', 'Kevin Magnusson foresaw this weekend and thought fuck it I’m out.', 'Real talk, Checo’s season has to be one of the worst of all time right? Considering his teammate will probably win the championship and he’s a distant 8th in points', 'Oh god Stroll. \n\nHow it must feel to be an Aston mechanic right now.', ""weekend status: 8k comments in the *race discussion thread* and the race hasn't even started yet"", 'This is the funniest fucking race of all time and it hasn’t even started yet', 'PETITION FOR INTERLAGOS TO HAVE A LIFETIME F1 CONTRACT\n\nALONG WITH SPA, SILVERSTONE AND SUZUKA\n\nFUCK STREET TRACKS', 'I can imagine KMAG in his hotel room ""well... this was a great weekend to call in sick""', 'If I were an AM engineer, I’d just leave the paddock and just go get hammered at this point', 'Russell: \n- “these are red flag conditions”\n- pits for inters']",2710,52098,0.92,2710,15831,15831,4,0,0.0,4
1gitonw,"Somewhere between the 1st pic and the 2nd, we all grew up alongside these 2!",https://www.reddit.com/r/formula1/comments/1gitonw/somewhere_between_the_1st_pic_and_the_2nd_we_all/,2024-11-03, Throwback,,"['Max showed more excitement about Ocon’s podium than Ocon’s engineer', ""I still remember Alphamaxnova's meme.\n\nOcon: Hey Max, do you remember me?\n\nMax: Ocon, is that you? Again?"", 'Look at them being all happy and chummy! Feels so wholesome', 'Would be nice if some in the fanbase grew up too', ""His uniforms make Ocon look like he's on the same team still"", 'masteban have been friendly in the last couple of years, the hate is super forced. i love to see them smiling!', 'Love how Bottas looks in the 2018 photo lmao', 'Back then, Max still felt like he had to prove himself without a championship. Ocon was racing for his career, which was not all that successful until then (he was a talent, but no podiums yet). Now that they are a champion and race winner, respectively, they have so much more calm.', 'In all honesty I was expecting a revisit of that today!']",1430,52,0.96,1430,1839,1839,7,0,0.0,7
1givw0n,Verstappen Breaks Winless Streak ,https://www.reddit.com/r/formula1/comments/1givw0n/verstappen_breaks_winless_streak/,2024-11-03, Statistics,,"['crazy how many different winners we’ve had this season compared to the previous seasons', 'in all that time lando only won 2 races, same as piastri, leclerc and hamilton. shows clearly that it isnt just the car.', 'Only 2 victories for Norris in this is shameful.', 'Sooo, another George win incoming next race ?!?!?', ""He also broke his DOTDless streak which spanned 30 races, which is pretty absurd considering he's been unquestionably the best driver during that period. \n\nBut I guess that's what happens when it's a popularity contest."", ""If Alonso ever wins again you're going to be in the photoshop mines for a while; he's gone just shy of 200 races without a win now."", 'Shows why Max is still in the lead even with the RB in such a dismal state. All the others are taking points off each other', ""**Max** : I'm so tired of winning. I will take a short break for 10 races, then come back and retake the WDC lead.\n\n10 races later.\n\n**Max** : Okay! I'm ready to start to retake the ... Oh."", 'Reminds me of the Brady Bunch for some reason.']",1045,87,0.97,1045,2304,2304,0,0,0.0,0
1giyn38,Laps led in 2024 (until now). Ocon is now 8th,https://www.reddit.com/r/formula1/comments/1giyn38/laps_led_in_2024_until_now_ocon_is_now_8th/,2024-11-03, Statistics,,"[""Somehow Perez's '1' is even worse than 0"", 'Sergio with the emotional support lap', 'My GOAT Perez.', 'Someone remind me when did Perez lead that 1 lap lmao?', 'How many times has this been removed 😭', ""I thought Checo's performance has been bad for a few years but 1 lap? Damn"", '504 laps, pff that red bull is dominant', 'Sergio Perez is like ""Max & I have combined for the lead of most laps led this season by a team!""', ""It's almost impressive that Lando (and Oscar) has so few laps led with that car.""]",713,48,0.98,713,1427,1427,-1,0,0.0,-1
1gjd239,What Max Verstappen needs to beat Lando Norris to F1 title in Las Vegas,https://www.reddit.com/r/formula1/comments/1gjd239/what_max_verstappen_needs_to_beat_lando_norris_to/,2024-11-04, News,,"[""tl;dr: If Norris doesn't outscore Max by at least 3 points in Vegas, Max wins the title there and then. If he does, Max wins the title in Qatar or Abu Dhabi."", 'All he needs is luck. He can leave his talent on the plane', 'Basically, it Max wins any of the remaining races, it\'s done. More specifically, he basically just needs to finish ahead of Lando in any one of the remaining three races, and it\'s done. This is now into the ""just a formality"" phase; Lando completely cooked his chances yesterday.', ""It's going to be decided in a sprint race again isn't it? Dude can't win a WDC in a normal way"", 'Max needs two 4th places in three races.', ""It's a done deal. Forget the math.\n\nMax would have to zero out for the rest of the season and Lando must win 2 races (50) and then win the one remaining sprint (8) 3 fastest laps (3) and place at least 9th or better in one other race. Or win all 3 races.\n\nThere's a lot of other scenarios but Lando winning two races is mandatory. And Max finishing barely in the points for all 3 races and the one remaining sprint.\n\nOn what planet is this happening? The idea of Max barely making any points is about as unfathomable as Lando winning at least 2 of the remaining 3 races plus additional points."", 'He should do it in style. Change the engine, change the clutch, change everything and start the race from 20th. Then tune the engine to the max and win the race! Then do a donut and let the engine explode!', 'He could take a weekend off and still win. Maybe they could give ricciardo another farewell race', 'Lolol max has this']",51,48,0.68,51,657,657,2,1,0.010000000000000009,2
1gj1jo9,Gasly and Ocon joint interview in the media pen,https://www.reddit.com/r/formula1/comments/1gj1jo9/gasly_and_ocon_joint_interview_in_the_media_pen/,2024-11-04, Video,,"['Very wholesome, love to see it!\n\nI also liked Pierre’s not so subtle reminder that we don’t know the details of their personal history and shouldn’t be constantly speculating on and shoving their relationship/rivalry in their face.', ""Very cute to see them enjoy together!\n\nHowever I must say, that interviewer mentioning their issues to their face... can you imagine being in their position and constantly being reminded and told that you don't get along ffs they have to deal with it every other week, how do you even respond"", 'But also people love to bring up their issues but as gasly mentioned their stuffs personal and it’s not for other people to make a narrative out of it or try to twist it into something to make it entertaining', 'This is pretty awesome. For whoever is interested in the back story:\n\n*The two French drivers both grew up in the same region of Normandy and were close childhood friends, travelling to races together and battling on the track throughout their younger years. However, after a particularly intense fight on the circuit, the trajectory of their friendship changed.*\n\n*Opening up about the incident during the latest season of Netflix’s Drive to Survive show, Gasly explained: “I had a fantastic race that day and on the last lap, I am fourth, Esteban is third. Both side-by-side to the line, and then I just like passed him, just literally in the last corner. The friendship we had… it just went downward from there.”*\n\n*Ocon had a different view of the incident that triggered the downfall of the friendship, adding: “It is true, this is what he did. Overtake on the last lap, but I can tell you that he wasn’t racing the way that he should have done.” Gasly then confirmed that he was disqualified from the race for his overtaking manoeuvre.*', 'I bet these two understand each other’s life paths to this point more than anyone from the outside can. Even if they’ve had a rivalry, sometimes your rival knows you better than everyone in the outside world combined.', 'Esteban was glowing in this interview, having an alpine 2-3 podium was such a pleasing surprise. I love when caos brings the unexpected', ""I'm sure its been mentioned already, but today was the first time this year that a driver not with RBR, Mclaren, Ferrari, or Mercedes made an appearance on the podium."", ""Honestly, a little sad as to how ocon and gasly have gone mostly unnoticed this season due to Alpine making a tractor. Glad to see them getting some spotlight and reminding what kind of animals they are.\n\nFelt like had Ocon managed to defend from Max at the last restart, he could have won the race. Max had the better speed overall but while stuck behind someone like ocon and leclerc, he couldn't really show it (probably to do with tyre temps not coming up due to stuck behind a car)."", 'Ugh them reminiscing together \U0001f979\U0001f979\U0001f979', 'Love to see it.\n\nI’ve always hated the constant reminder of “they used to not get on”. It was crazy how we had two teams, Alpine and Haas, who had similar situations like this. But very quickly last year the Haas situation was always talked about in a joking way.\n\nI do think over the last few years they got over their previous issues and especially this year have probably been more united given the situation at Alpine.']",458,35,0.97,458,1054,1054,-2,0,0.0,-2
1givf1b,Podium crowd singing Max Verstappen's song ,https://www.reddit.com/r/formula1/comments/1givf1b/podium_crowd_singing_max_verstappens_song/,2024-11-03, Video,,"['Brazil crowd has embraced Verstappen once again.\xa0', 'Golden. They adore Hamilton and love Colapinto, but its great to see them recognizing Max’ drive today as well.', 'Also, podium crowd chanting ""he\'s the champion""\n\nhttps://x.com/vanecomenta/status/1853158560680808871?t=BltuA56sSNHpUDPmnVF_EQ&s=19', 'TU TU TU TUUUUUU', 'Brazil F1 crowds always recognise greats.', 'They know and respect greatness when they see one', 'happy to say i was there singing it', ""Didn't they sing 'Senna!' to celebrate his skill back in 2016 when Max drove onto the podium from p16?"", 'I wondered what was going on in the background during the podium 😂 hard to tell on the feed', ""This is extra cool because that is not something that you would know about unless you're engaging with the online community""]",1040,44,0.96,1040,1901,1901,3,0,0.0,3
1gissxt,"Alonso: I will finish the race for the mechanics. They did a very good job today, but my back is hurting. Man, this bouncing is not normal",https://www.reddit.com/r/formula1/comments/1gissxt/alonso_i_will_finish_the_race_for_the_mechanics/,2024-11-03, Video,,"['You could hear he was in pain.\xa0', 'His poor back, hurting from the car and carrying the team', ""He really wasn't joking. https://twitter.com/ferranwest/status/1853134141673353436"", 'Wow he sounded like he was in a lot of pain there. With his infection earlier this weekend I hope he takes the break to rest up.', 'Aston are just a complete mess at the moment. \n\nNewey will have a lot of work to do.', 'It’s nice that he showed his appreciation for the mechanics like that.', ""Poor Nando man, dude's been in the wars, was ill and now destroying his back. \n\nMerc and Aston commiting elder abuse."", 'He sounded like he’s in constant pain.', 'That grunt of agony sounded really bad.', 'Not often you hear discomfort in his voice. Last time I remember was when he almost flew in 2022 COTA.']",1451,55,0.99,1451,2703,2703,-7,0,0.0,-7
1git4kp,"[Phillip Horton] Five of the top 10 finishers remain under investigation: Norris, Russell, Tsunoda, Lawson - Start infringement Russell, Hamilton - Tyre pressures",https://www.reddit.com/r/formula1/comments/1git4kp/phillip_horton_five_of_the_top_10_finishers/,2024-11-03, Social Media,,"['Gotta be a DSQ for both mercs right? Technical infringements are slam dunk.', 'Russell double DSQ incoming. /s', 'Its ridiculous that after such an epic race, we have to just keep refreshing to see what the actual fucking result is.', 'Who f5-gang here', 'NOTHING COMPARES TO INTERLAGOS PLEASE. I have work on monday for fucks sake 😭', ""Wonder what kind of penalty they'll recieve?"", 'Yea this race weekend is insane. George and Ham might be toast. Norris might lose more spots. Russel might get shot into the sun if he has to get a time penalty on top of a DSC.', ""Why only those 5? Didn't about half the grid leave while the lights were on?"", 'Investigation takes longer than Mcdonalds fixing their icecream machines', 'Everyone DSQ. Bottas leaves 23rd in the WDC. Give it to me. Come on.']",1392,190,0.99,1392,4998,4998,4,0,0.0,4
1gis0qw,"Safety Car Restart: Verstappen takes the lead, Norris drops to P7, Leclerc to P4",https://www.reddit.com/r/formula1/comments/1gis0qw/safety_car_restart_verstappen_takes_the_lead/,2024-11-03, Video,,"['Fun fact: some Brazilian fans brought a banner to Interlagos saying ""WE\'VE HAD 10 RACES WITHOUT HEARING THE DUTCH ANTHEM, OUR RECORD IS 10 RACES"".\n\nThat\'s a fucking jinx.', 'Absolute worse case for Lando lol', 'ABSOLUTE CINEMA', 'fucking hell Norris', 'If there was ever a race to show the absolute chasm between Max and Lando, this is the one', 'BRUH LANDO', ""I'm tired defending Norris and McLaren this year. I'm just gonna start posting whale facts til the end of the season. Hopefully the next year is gonna be less frustrating. \n\nDid you guys know that the layers of wax in a whale's ear can be analyzed to determine its age, diet, and exposure to pollutants. It's like a time capsule of the whale's life! Neat, huh?"", 'There are levels to this shit', 'What a race holy shit', '17->1 challenge SUCCESSFUL']",1600,448,0.98,1600,15159,15159,0,0,0.0,0
1gjbuyr,[motorsport] How Verstappen can seal a fourth F1 title in Las Vegas,https://www.reddit.com/r/formula1/comments/1gjbuyr/motorsport_how_verstappen_can_seal_a_fourth_f1/,2024-11-04, News,,"['It’s probably Qatar sprint again where max seal the deal, unless Lando just completely exploded and crumble again', '**Verstappen will be champion in Vegas if:**\n\n* Verstappen finishes ahead of Norris\n* Norris is second and Verstappen is third with the fastest lap\n* Norris is third and Verstappen is fourth with the fastest lap\n* Norris is fourth and Verstappen is fifth\n* Norris is fifth and Verstappen is sixth\n* Norris is sixth and Verstappen is seventh\n* Norris is seventh and Verstappen is eighth\xa0\n* Norris is eighth and Verstappen is ninth\n* Norris is ninth, 10th or fails to score', 'Short version: Norris needs to gain 3 point more than Max in Vegas', 'come on Max, finish it. just win', 'crazy that there is a chance that this ""tittle fight"" doesnt even make it to Abu dhabi this time\n\nNorris has just 1 more win than checo last season (yet)\n\n  \none was driving like he hadnt driven before and one has the fastest car', 'With his comments after the race about *luck, not skill* on the result at Brazil, be prepared for way too many dad/granddad quips about *Lando Luck* in Las Vegas.', ""Must say as a McLaren fan, I'm reasonably happy that they'll presumably now focus on the constructors 99%. \n\nVerstappen *obviously* deserves it anyway, so that's all fine/fair."", '""Show up""', 'Max will probably win it in some weird way, probably in the plane back from Vegas after a Norris DSQ.']",54,25,0.77,54,304,304,-2,0,-0.010000000000000009,-2
1gitc2f,[Aston Martin F1 News] Alonso has requested a medical car after racing with extreme bouncing,https://www.reddit.com/r/formula1/comments/1gitc2f/aston_martin_f1_news_alonso_has_requested_a/,2024-11-03, News,,"['Now I can actually believe that Stroll drove into the gravel intentionally lol, bro wanted to save his spine.', 'jesus, aston almost killed my man Fernando', 'Mad respect for Alonso to continue through the pain.', 'Aston… this was a catastrophe on top of a fiasco', ""Newey can't come soon enough."", 'That’s why Lance gave up before the race. Too many sweats.', 'Oh no. Good thing there is a break after this. He can get some help!', 'Dr. Ugovich recommends a 2 month rest']",1249,97,0.99,1249,4010,4010,-6,0,0.0,-6
1giutjl,"[Lewis hamilton] its like a plank of wood. no suspension. just bouncing on the tyres everywhere and cant get on the power anywhere. just the worst ride i think, the worst ride that we've definitely ever had particularly through corners",https://www.reddit.com/r/formula1/comments/1giutjl/lewis_hamilton_its_like_a_plank_of_wood_no/,2024-11-03, Video,,"['I will once again remind everyone that he almost begged Mercedes to change setups after qualifying and start from the pitlane.', ""He still managed to take Checo's point lmao"", 'I have to say, it was painful to watch his onboard.', 'The best part about these last few races for Lewis is that afterwards he can finally leave.', 'Merc exaggerates this effect but this reg cars are horrible to watch sometimes', ""His pace has been shocking recently, I don't know what's happening on his side of the garage but I don't think it's his fault honestly. There's no way he's just forgotten how to drive this quickly, I still have faith for 2025"", ""Lewis fighting for his life for 1 point and probably will get penalised after all that anyways, at least he gave the fans a good show even if the result wasn't at all great. Keep ya head up Lewis!!"", 'He did say F*** this Shit on the radio about the car so I don’t blame him', 'Lewis is probably thinking his move to Ferrari can’t come soon enough. His Mercedes has been awful as of late.', '“But hopefully we won’t have any more bumpy tracks. I think the last three aren’t so bumpy but I could happily go and take a holiday.”\n\nHis post-race radio was “If this is the last time that I get to perform (inaudible?)… its a shame it wasn’t great but…”']",1025,182,0.96,1025,4837,4837,0,0,0.0,0
1giuscn,[George Russell] We win and lose as a team. Proud to have led half of the race; the red flag was unfortunate and ultimately cost us a podium. Congrats to the top 3 for a great race and thank you Brazil for the amazing support,https://www.reddit.com/r/formula1/comments/1giuscn/george_russell_we_win_and_lose_as_a_team_proud_to/,2024-11-03, Social Media,,"['Russell drove a hell of a race for what it’s worth, we’ll see how screwed he is with Mercedes Tire Pressure inquiry.', ""Russell will do good next season if he gets good car, he's very very good this year"", 'Unpopular opinion: Russell is more ready for the WDC title than Lando is.', 'Russell has grown on me so much this year. I’ll be honest I had no reason to dislike him as much as I did before but his driving has been great and he’s kept very level headed while also seemingly loosening up a bit. I hope they give him a good car next year so that he can be competitive from the start', 'George is right, he probably wins this race. And that call to pit was entirely on Merc.', 'Lando, take notes.', ""ugh i hope next year's kinder to him"", 'Drove great all weekend, this team doesn’t deserve him. \n\nCba with what ANT is gonna have to go through next season.', 'Russel has really grown on me as a person and a driver.', 'Honestly an amazing weekend from him, including qualifying, where he was half a second clear of P3, and the race where he took and kept the lead without any mistakes.\n\nJust a massive shame that the pitwall of this team seems to always, \\*always\\* make the wrong decisions in key moments. When the VSC came out George called for the right strategy, and wanted to stay out... This could have been a race win, not just a podium, given how difficult it was to pass.']",1019,167,0.97,1019,2928,2928,0,0,0.0,0
