unique_id,post_heading,post_url,publish_time,tag,post_content,top_comments,upvotes,comments,upvote_ratio,score,total_upvotes_comments,total_score_comments,upvotes_growth_rate,comments_growth_rate,upvote_ratio_growth_rate,score_growth_rate
1jq9rzi,[Sky Sports F1] 'Something I wasn't expecting' Liam Lawson reflects on Red Bull demotion,https://www.reddit.com/r/formula1/comments/1jq9rzi/sky_sports_f1_something_i_wasnt_expecting_liam/,2025-04-03, Video,,"[""How? He literally said he expects to not be there if he doesn't perform just the other week."", 'He was expecting what after being P18-P20 in all sessions? \n\nRed Bull is in an urgent matter of recovering points for the WCC, they can’t be this patient after what they went through last year. The lesson was hard and Max needs the support up there more than ever.', 'The exact quote was “something I wasn’t expecting so early”', 'I think he probably meant that he wasn’t expecting that decision to be made after just 2 races.', 'The only other comment in this thread gives the full quote about not expecting it so early....', 'But after 2 races? That’s a complete fuck around, even for RB standards.', 'I listened the video, no need to read the other comment.', 'Well, desperate times call for desperate measures. Has RB ever respected their own standards? You tell me… never know what they’ll bring to the table.', 'That’s all they are. Desperate. And I hope they shit the bed this year and Max walks away.\n\nI understand that F1 is cutthroat, but at least pretend to have a fucking soul and compassion. It infuriates me that they’ve now put Yuki in this position too.\n\nWhat’s going to happen to him if he can’t handle the car like EVERYONE else? Left without a seat when he is someone who deserves it? Drop Hadjar to make room when he is someone who also deserves a seat? Drop Lawson *once again* to make room when he is another who deserves a seat? Nah, I honestly wish RB the worst.', ""The narrative that F1 is cutthroat is stupid and BS, every sport is, every job that pays so lucrative is, it's not F1 exclusive. Red Bull are just being utterly stupid with their decisions.\n\nIf you see in the past, almost every other team gave some time to their drivers or their staff, all besides Red Bull. Why? Because they literally have 2 teams in the grid and 4 drivers, one doesn't work? Let's get the other one. Every other team wouldn't do that/can't afford doing that.""]",37,11,0.86,37,11,11,9,1,0.020000000000000018,9
1jq000k,"HRC Launches Memorabilia Business to Share Historic Race Artifacts, Including Formula 1 Engines and Parts, with Customers",https://www.reddit.com/r/formula1/comments/1jq000k/hrc_launches_memorabilia_business_to_share/,2025-04-02, News,"* HRC plans to auction actual parts from Honda V10 engine used by Ayrton Senna to win 1990 F1 Championship
* First HRC memorabilia auction will take place during Monterey Car Week in August
* HRC currently selecting heritage machines from the IndyCar series and valuable race machines from motorcycles to be included in the future","['Moneys tight huh', ""I'd buy it if I could. How much is an MP4/5B front wong?""]",18,3,0.79,18,2,2,3,0,0.020000000000000018,3
1jqajwj,Looking forward to the updated TV broadcast intro,https://www.reddit.com/r/formula1/comments/1jqajwj/looking_forward_to_the_updated_tv_broadcast_intro/,2025-04-03, Discussion,"With Yuki swapping with Liam, I imagine they will need to update the F1TV intro with each driver wearing their new team's colors. Do they need to reshoot the scenes with updated race suits or will they just use special effects to superimpose the new colors onto their exiting poses? That's something that I'm interesting to find out. ","['I think I remember seeing they have already filmed the reserve drivers for the intro so Yuki would have already been filmed in the Red Bull gear as he was official reserve.', 'CGI', 'https://preview.redd.it/fq7jpevadkse1.png?width=1098&format=png&auto=webp&s=33b5700a84b8caab630e00dd050c2ce0c286cc1c\n\nImagine something like 2024 one.', ""Yuki (and Hadjar) have so different body type than all the other drivers that it's impossible without being painfully obvious\xa0"", ""One comment says they've already filmed reserves in their promoted team (which covers Tsunoda), you say CGI (with nothing to back that up so it's up to the reader to decide if you even have a leg to stand on). \n\nPretty conclusive then.""]",13,6,0.79,13,5,5,5,1,0.0,5
1jqau3h,Ask r/Formula1 Anything - Daily Discussion Thread,https://www.reddit.com/r/formula1/comments/1jqau3h/ask_rformula1_anything_daily_discussion_thread/,2025-04-03,,"# Welcome to the [r/formula1](https://www.reddit.com/r/formula1/) Daily Discussion / Q&A thread.

This thread is a hub for general discussion and questions about Formula 1, that don't need threads of their own.

Are you new to Formula 1? This is the place for you. Ever wondered why it's called a lollipop man? Why the cars don't refuel during pitstops? Or when Mika will be back from his sabbatical? Ask any question you might have here, and the community will answer.

Also make sure you check out our [guide for new fans](https://www.reddit.com/r/formula1/wiki/newtof1), and our [FAQ for new fans](https://www.reddit.com/r/formula1/wiki/faq).

Are you a veteran fan, longing for the days of lollipop men, refueling during pitstops, and Mika Häkkinen? This is the place to introduce new fans to your passion and knowledge of the sport.

Remember to keep it civil and welcoming! Gatekeeping within the Daily Discussion will subject users to disciplinary action.

Have a meta question about the subreddit? Please [direct these to the moderators](https://www.reddit.com/message/compose/?to=/r/formula1) instead.","['Just out of curiosity, does RB have a reserve driver?', 'Are the teams themselves considered sponsors?\n\nFor example: Is Ferrari considered a sponsor for their team? Is Haas considered a sponsor for their team?', 'When will Stroll win WDC?', ""RB had Liam as the reserve driver while he was in the VCARB seat last year, similar to Yuki who was the reserve driver this year for RB. With Ayumu being the VCARB reserve, it's most likely Issac or Liam who will step up with Ayumu filling the VCARB seat if needed."", 'They are considered owners.', 'No', 'Depends if and how they own the team.  \n  \nScuderia Ferrari is a department at Ferrari. Haas owns the team. Red Bull GmbH fully owns both teams & their parent companies (Red Bull Technologies is fully owned by Red Bull GmbH & it fully owns the Red Bull Racing company).  \n  \nAston Martin as a counter example is owned by Stroll Sr. & consortium, who also happen to own voting majority of Aston Martin Lagonda company, where Mercedes has a 20% stake in.  \n\nA grey zone is Mercedes AMG Grand Prix Limited is split to 33% ownership between Mercedes, Ineos & Toto Wolff (he was worth half a billion before he joined Williams and i think he still owns 5% of Williams, as the plans to sell fell through in 2016).  \n  \nAlpha Tauri (now CashGrab, previously Toro Rosso) was a prime example of a Red Bull subsidiary being the sponsorship namesake of the team - similarly to how the company is now named Racing Bulls - while Visa & Cash App on entry form are just title sponsors.', 'Stroll 25, Stroll 26, Stroll 27...', 'As soon as climate change hits hell.', 'Just whenever daddy can buy the title for him.']",1,10,0.67,1,10,10,1,3,0.17000000000000004,1
1jpo8np,How much does Red Bull depend on Max Verstappen - both now and for the future?,https://www.reddit.com/r/formula1/comments/1jpo8np/how_much_does_red_bull_depend_on_max_verstappen/,2025-04-02, News,,"['In future they may not have the option', 'Without Max? DTS: RB have intense rivalry with Haas and Sauber.', ""I think it's kinda clear they're going as far as Max will carry them and then will have to actually put the work in once they no longer have a transcendent talent in the #1 seat."", ""Lol, what Red Bull team?\n\nThe team is called Oracle Verstappen Racing. It's a one man show"", ""can't wait for Max to leave Red Bull and Red Bull becomes a midfield team again"", 'Max is to RBR what Marc Marquez was to Honda ! ( since mid 2024 )', ""They're in the exact position Honda was in MotoGP."", 'Max might as well ask for team equity at his next contract negotiations. 😂', 'If Max leaves and the 2026 engine is not good I can see them leave the sport. Or Ford take over.  Things at red bull racing have changed since the dead of Dietrich Mateschitz.\n\nIf the engine is good there will be plenty of drivers to choose from.']",0,35,0.48,0,177,177,0,0,0.02999999999999997,0
1jpugrp,Did Christian Horner just accidentally reveal they’ve resigned Yuki Tsunoda?,https://www.reddit.com/r/formula1/comments/1jpugrp/did_christian_horner_just_accidentally_reveal/,2025-04-02, Video,“Christian Horner ADMITS Red Bull asked 'too much' of Liam Lawson” on YouTube. Around 4:15 mark Christian is asked if yuki will get the seat long term if he does well and Christian states that yuki is under contract for many years to come but up until now it has only been reported that his contract expires at the end of this year,"['This has been done previously by them with Gasly - when he was promoted they reset the 5 year option so it ran until 2023 rather than the original 2022. \n\nMeans Yuki’s a bit fucked if they don’t want to keep him though. Unless another seat is still open after the notification deadline in the agreement (this appears to have been september previously) he’s going to need to be bought out.', ""Nope, it's the options. Red Bull has options on their junior program drivers for like 5 years or something where they get to decide if they want to extend or not. Max is a special case and he has mutual options. Checo was also a special case because he came from an external setting. I don't know for sure but Danny Ric's contracts after his 2014 season were probably also mutual options."", 'Even if Yuki does have a multiyear contract which is unlikely, it doesn’t matter. Red Bull will drop their drivers whenever they want and just pay off the contract.', 'Re-signed\\*', ""I've noticed Christian smartly talking around the Verstappen matter, but Max really was not amused. Just as he was not amused by sacking Checo, the internal war at Red Bull and the way they've ignored his complaints. They really should be careful from now on, because his loyalty isn't endless."", 'Any contract can be written to include clauses for releasing the driver based on a variety of conditions.', 'Australiur and Chinur', ""Hm.  Admitting that they moved to fast to Gasly then to Albon.  \n\nThey really were caught with their pants down when DR signed with Renault -- which tells me they really had no idea he was disgruntled.  It's an interesting admission on their lack of awareness of how their drivers are feeling.  Do they actually know how Verstappen is feeling now?"", 'In Red Bull a contract means absolutely nothing. \n\nCheco was set to be there for many years too. lol']",0,44,0.36,0,296,296,0,0,0.010000000000000009,0
