unique_id,post_heading,post_url,publish_time,tag,post_content,top_comments,upvotes,comments,upvote_ratio,score,total_upvotes_comments,total_score_comments,upvotes_growth_rate,comments_growth_rate,upvote_ratio_growth_rate,score_growth_rate
1lsc3ux,Max Verstappen takes pole position for the 2025 British Grand Prix,https://www.reddit.com/r/formula1/comments/1lsc3ux/max_verstappen_takes_pole_position_for_the_2025/,2025-07-05, Qualifying,,"['What the fuck was that ending holy shit!', 'Damn, for about 5 seconds I genuinely thought Lewis was gonna get pole', 'How does he fucking do this?', 'HOW', '""This car is so difficult"" = Pole', 'Jesus fucking Christ, Max what a driver', 'Oh my lord max', 'Impossible!', 'Wtf this dude is insane', 'He’s insane. It’s actually a joke.']",9133,1396,0.96,9133,497,497,1933,150,-0.010000000000000009,1933
1ls7yzw,"Verstappen watching Bearman crash in the pitlane: ""Oh my God? Someone just crashed in the pit entrance? Whoa—haha, what!?""",https://www.reddit.com/r/formula1/comments/1ls7yzw/verstappen_watching_bearman_crash_in_the_pitlane/,2025-07-05, Video,,"['Poor Ollie will be haunted in his sleep about this tonight', 'Like an iRacing lobby', 'max has the best radio of weekend so far', 'His little giggle sent me.  😂💀', 'I wonder when the last time someone crashed in the pit entrance was. Funnily enough I remember Max himself was close in Australia this year (epic save prevented it)', ""lol Max can't believe it"", 'Max has been great with providing radio entertainment this weekend. The giggle is the best part lmao', 'Max 😂\U0001faf5', 'not the giggles lol', 'Just reading  that I hear max right away']",5381,147,0.98,5381,139,139,359,2,0.010000000000000009,359
1lsc52l,Max Verstappen has tied Sebastian Vettel for most poles as a Red Bull driver!,https://www.reddit.com/r/formula1/comments/1lsc52l/max_verstappen_has_tied_sebastian_vettel_for_most/,2025-07-05, Statistics,,"[""It's amazing Seb got so many in so little time."", ""Actually insane that Vettel still had that record. Yes, he had those 4 super dominating years, but with the season having more races now and with how Max is never challenged by his teammates (compared to Webber actually taking some poles from Vettel), I wouldn't have been suprised if he was far ahead by now."", 'He is a demon. No words here necessary.', 'Honestly amazed it took this long', ""Wish people would give Seb the respect he deserves. Some are talking about him as if he's a Kovalainen level driver."", 'Max’s gonna destroy a lot more records', 'Vettel was arguably one of the best qualifiers this sport has ever seen. He was putting out poles in that Red Bull left right and centre, does anybody even remember Singapore 2013? That man was an insane qualifier I remember watching him in 2011,12,13 properly and once he got pole (which was almost always a given) #2 and #3 on the grid didn’t even dream of winning the race, they knew it was Sebs. His dominance was insane in those 4 years man.', 'INSANE LAP WTF!!!', 'Vettel: I’m speed.\n\nMax: I’m inevitable.']",3609,108,0.98,3609,101,101,1113,6,0.0,1113
1ls9a8w,Oliver Bearman handed a 10-place grid drop (and four penalty points) for red flag infringement in FP3,https://www.reddit.com/r/formula1/comments/1ls9a8w/oliver_bearman_handed_a_10place_grid_drop_and/,2025-07-05, Technical,,"[""That's a lot of penalty points, holy."", '‘To make matters worse’ is such a violation. The stewards were maaad', ""Isn't this his 2nd 10 place grid drop for a red flag infringement this year?"", '4 penalty points is a wild amount to get given in one go, but when you think about the fact that he increased his speed to 260kmh when he should’ve been slowing down, it’s an entirely reasonable penalty \n\nI guess in his mind it was the end of the session and he just…forgot it was a red flag…and simulated a race pit entry? Such a silly mistake.', ""Seems in line with Tsunoda's penalty from a few weeks back  \nedit:  \nDidn't see the 4 points, can't remember how many Yuki got"", 'This is his second failure to comply with red flag for 2025 season.\n\nIn Monaco, he received 10-place grid drop and 2 penalty points.', 'Fucked around in red flags AND lost control in the pit lane as a result of him breaches red flag rules \n\nHarsh but deserved pen', 'Is ollie colour blind or something? This is the second time this has happened with him.', 'when it comes to red flags the FIA does not play around, and rightly so.']",2857,365,0.99,2857,337,337,229,12,0.0,229
1ls2ekj,"OTD in 2020 , F1 hosted its first race back from lockdown at the Redbull Ring",https://www.reddit.com/r/formula1/comments/1ls2ekj/otd_in_2020_f1_hosted_its_first_race_back_from/,2025-07-05, Statistics,"It was the first race of the season, Bottas won ,with Leclerc 2nd and behind them Lewis collided with Albon leaving the door open for Lando Norris to take his first carrer podium! ""Scenario 7""","['This race was insane, 9 DNFs\n\nLeclerc miracle podium despite SF1000 was off the pace\n\nTough day for Russell as he had good race but his car fail on him\n\nOcon return race since Abu Dhabi 2018\n\nVettel disastrous race\n\nNorris first podium in F1', 'May we one day be able to again say “Bottas won”, amen 🙏', 'The podium ceremony at that race felt like one of those school internal sport competitions, where the only crowd present where those participating in the prior event. Truly a strange period in F1', 'Thanks, now Alex Albon is crying.', 'Does anyone remember the robots they used for handing out trophies?? Looked so silly\n\n Wild times lmao lol', 'The day Lewis yeeted Alex off, potentially costing him a win and altering the course of history.', 'This was such a strange time. F1 was the only live sport on TV then everyone got obsessed with the Bundesliga 😂', 'Forgotten Leclerc masterclass', 'This was the second strangest race after Indy 2005. No crowd and it was the first race of the season in July.']",1959,59,0.99,1959,57,57,20,0,0.0,20
1lsc5gf,"Gianpiero Lambiase: You went motor racing racing. That's pole position, great job!",https://www.reddit.com/r/formula1/comments/1lsc5gf/gianpiero_lambiase_you_went_motor_racing_racing/,2025-07-05, Video,,"['Max FP1: the car is shit!!!!! Undrivable!!  \nMax FP2: the car is shit!!!!! Undrivable!!  \nMax FP3: the car is shit!!!!! Undrivable!!  \nMax Q1: the car is shit!!!!! Undrivable!!  \nMax Q2: the car is shit!!!!! Undrivable!!  \nMax Q3: lets go combat racing', 'Cheeky GP commentary is back on the menu!', 'Twisting that knife', 'Way to stir up old memories GP', 'Insane q3, 3 big contenders and then max comes in with the steel chair\n\nCrazy', '44th pole for Max, in Silverstone.....the irony is big with this one', 'Quality shithousery', ""RB better give him everything he wants, otherwise they are properly f'ed"", 'You can tell they missed each other lol.', 'GP trying to bring back the Abu Dhabi 2021 vibes. On purpose I’m sure…']",1792,251,0.94,1792,178,178,319,23,0.0,319
1lsc9f4,"Charles Leclerc post-quali team radio (P6): ""F*. F***. F***. F*** THAT. So fing s I am. I am so fing s. That’s what I am.""",https://www.reddit.com/r/formula1/comments/1lsc9f4/charles_leclerc_postquali_team_radio_p6_f_f_f_f/,2025-07-05, Video,,"['Two types of Ferrari weekend\n\nAbsolute disaster, strategy goes to shit, qualifying is a mess, drivers have to recover \n\nEnd result: P5-P6 \n\nEverything looks good, car looks quick, both drivers seem to be able to challenge \n\nEnd result: P5-P6', 'Charles about the crack the whip on himself in his private quarters.', 'Everyone in that top 5 (except Max) gonna be replaying quali in their heads tonight cause it could have been any of them', 'what is this title? You are allowed to swear on Reddit', 'Charles just reminding everyone once again that he is the King of being hard on himself, not Norris.', ""It's funny how they press the radio button for these rants"", ""Could've been a front row for him and for Hamilton. Shame really."", 'Ah…we’re in the ‘it’s so over’ part of the Ferrari cycle.', ""Race is tomorrow. That being said, it'll be a long shot to jump back into podium territory, let alone contending for the win outright."", 'Didnt really pay full attention to him in Q3, what exactly happened?']",1702,241,0.98,1702,235,235,631,62,0.0,631
1ls7ys7,Silverstone FP3,https://www.reddit.com/r/formula1/comments/1ls7ys7/silverstone_fp3/,2025-07-05, News,,"['Packup everyone, redbull is good again', '\\*Clears throat\\* \n\nALL ABOARD THE FERRARI HYPE TRAIN', 'Red Bull somehow did something to make the car better 🤩🤩 (its gonna fall apart in quali again)', 'Lewis would have been in that picture if he finished the lap. Quali should be fun', 'Verstappen’s name in red for the inevitable move to Ferrari that nobody will expect \n\nBut there were signs', 'Quali will be amazing if noone crashes. Those margins are crazy between McLaren Ferrari and Max', 'This quali is gonna be pretty good. I expect a couple red flags from the rookies', 'Lewis’ lap was looking mighty…', 'It’s a family Top 3.']",1481,130,0.99,1481,121,121,52,1,0.0,52
1ls907w,[roscoelovescoco via IG] Back’s with’s dad’s at’s Silverstone’s,https://www.reddit.com/r/formula1/comments/1ls907w/roscoelovescoco_via_ig_backs_withs_dads_ats/,2025-07-05, Social Media,,"[""I would love to imagine that this is just Lewis writing about himself on Roscoe's account.\n\nRoscoe's such a good boy, and I hope we see him at Monza as well"", 'Roscoe is back and suddenly Lewis is much quicker?\n\nYet more evidence that Roscoe was the one in the car all along during those title wins.', 'God this dog is so fucking fly', 'Lewis getting the Roscoe +5 stat boosts', 'Loved his cameo appearance in the film, what a star', 'man roscoe is so humble to visit his biggest fan', 'Awe Kimi going to see Roscoe makes me feel for all the other Merc staff that miss him too. Hope that Lewis makes a walk over to see them or vice versa.', 'Kimi got to meet Roscoe!', 'Can I just say that I loved that Roscoe not only made an appearance in the F1 Movie, but was listed in the credits. He’s an essential part of the paddock.', ""Very's nice's!""]",1508,49,0.96,1508,42,42,213,1,0.0,213
1lsbe4m,Fernando Alonso outqualified Lance Stroll for the 50th time in Grand Prix qualifying as teammates!,https://www.reddit.com/r/formula1/comments/1lsbe4m/fernando_alonso_outqualified_lance_stroll_for_the/,2025-07-05, Statistics,,"['going through to Q2 (being P5!!) with just 1 attempt while your teammate is 18th with 3 attempts is pretty impressive, even knowing the teammate is stroll', ""Outqualifying your teammate 50 times would normally mean you'll no longer have that teammate"", ""I'm more surprised it didn't happen sooner. What is their overall tally? :D"", 'Nobody out qualifies Lance Stroll 51 times!\n\n- Lance Stroll next week probably', '24th consecutive time', 'To be fair, on pure talent,  you have one of the greatest formula 1 drivers of all time, vs. one of the worst.', 'A full year consecutively. The last time stroll out qualified Alonso was Silverstone last year', 'Yet, Stroll will outlast Alonso because Aston is not serious about competing.', ""If FP2 was the race I'm convinced we were looking at a WDC Stroll.""]",1395,91,0.99,1395,84,84,270,12,0.0,270
1ls8bhi,Every single Sauber number 2 driver since 2012 has had a crash at Silvertsone.,https://www.reddit.com/r/formula1/comments/1ls8bhi/every_single_sauber_number_2_driver_since_2012/,2025-07-05, Statistics,"""Number 2 driver"" meaning the driver behind in the championship standings. 

Sauber's number 2 drivers, 

2025 - Bortoleto - Crashes during FP3 at Silvertsone in 2025. 

2022-2024 - Zhou - Had a gigantic  upside down crash at turn 1 during the 2022 British Grand Prix where he ended up behind the barriers.

2019 - 2021 - Giovinazzi - Spun out of his first race at Silverstone and caused a safety car which changed the course of the race. 

2015-2018 - Ericsson - Had two huge shunts in his time as Sauber's second driver. In 2018 he spun off at Abbey during the race and in 2016 he had a big incident in practice but was cleared to race after checks. 

2013-2014 - Gutierrez - During the 2014 British Grand Prix he had a collision with Maldonado at vale which damaged his suspension causing him to go straight on into the gravel and out of the race at abbey.

2012 - Kobayashi - Less of a crash but just as serious. Crashed into his pit lane crew requiring trips to hospital. Everyone was okay.

A pretty bizarre trend.","['Big brain bortoleto got his destined crash out of the way in fp3.', 'the 2nd image is still a double take for me.', 'Poor Zhou, punted by a Gasly/russell combo through no fault of his own. Qualified p9 too ahead of Bottas. :( and his parents were there foe the first time. Dude had such bad luck throughout his career', ""Calling Bortoleto's a crash is exaggerating a bit for sure, he hit absolutely nothing"", 'Feeling for the people in GA at Chapel, it was a huge dust cloud!', 'At the time, Kobayashi was extremely dissatisfied with the team\'s strategy, which only favored Checo, and after the qualifying at Silverstone in 2012, he had said only to Japanese media reporters, ""I want to get revenge on the Sauber team, who are making the same strategic mistakes over and over again, by flipping their transporter upside down."" \nThis mentality led to the accident with that crew member.', 'Traditions ©', 'Will save this for next year', 'Something about 6 looks so funny']",1054,29,0.99,1054,28,28,94,0,0.010000000000000009,94
1lrp4m5,Christian Horner insists Max Verstappen ‘would like to finish his career in a Red Bull car’ amid Mercedes rumours,https://www.reddit.com/r/formula1/comments/1lrp4m5/christian_horner_insists_max_verstappen_would/,2025-07-04, News,,"['Hamilton said the same about Mercedes', 'I’m sure he would like to. That doesn’t mean he won’t leave instead of wasting his prime years on a borderline midfield team.', 'He would like to. Much as Charles would like to finish his at Ferrari and Lewis would’ve liked to finish his at Merc. Doesn’t always mean they feel they can', 'I mean he can keep the red bull livery on the GT3 car...', ""Oh he's getting desperate now ha"", ""I mean I'd LIKE to do a lot of things... lol"", 'I like his confidence', ""I love this for Christian. I'm sure he would like to. But he doesn't have to."", '*in a *fast* Red Bull car']",973,173,0.96,973,3314,3314,5,1,0.0,5
1ls7k44,Max Verstappen's thumb up  to Alpine cutting in front of him during his fast lap,https://www.reddit.com/r/formula1/comments/1ls7k44/max_verstappens_thumb_up_to_alpine_cutting_in/,2025-07-05, Video,,"['👍', '👍🏻', '👍🏻', '👍', '👍', '👍🏼', '👍', '👍', '👍', '👍']",923,126,0.97,923,105,105,36,3,0.0,36
1lrtom8,"[@f1] Say hello to the @mercedesamg Safety Car… in orange! To celebrate the launch of the Concept AMG GT XX, the Safety Car will be adorned in stunning Sunset Beam Orange all weekend long!",https://www.reddit.com/r/formula1/comments/1lrtom8/f1_say_hello_to_the_mercedesamg_safety_car_in/,2025-07-04, Social Media,"Video: [The safety car in action](https://dubz.link/c/0281f4)

([Via Instagram](https://www.instagram.com/p/DLsuwVhzfuj/?utm_source=ig_web_copy_link&igsh=MXFxM29oYWhrNHhmeg==))","['I thought crowdstrike usually sponsored ford mustang drivers.', 'The Vatican blows smoke for a new pope.. Merc paints everything orange after signing Max lmao', 'Verstappen to Mercedes confirmed!', 'Papaya could be running 1, 2 and 3 on Sunday, this is the sort of dominance that will bore fans', ""If you can't beat McLaren, join McLaren :P"", ""Man they're really manifesting Max to Mercedes 💀"", 'The AMG GT3 will always be the most beautiful GT3 there is. The roaring V8 and the aggressive wide nose just makes me melt.', 'Lando about to drive into the back of it thinking it’s Oscar', ""That's a good livery for the Dutch GP as well"", 'Yes…to celebrate the AMG GT Concept launch…not Max Verstappen becoming a Mercedes driver. That’s just a coincidence. /s']",815,62,0.99,815,960,960,3,0,0.0,3
1lsaseu,Colapinto spins and crashes into the barriers,https://www.reddit.com/r/formula1/comments/1lsaseu/colapinto_spins_and_crashes_into_the_barriers/,2025-07-05, Video,,"['Do not generalise fan groups and do not start or engage in fan wars. We have already had to hand out 25 bans in this thread alone', 'Bottas get ready to learn Alpine', 'Feels like both Alpines have been spinning quite a lot recently.', 'If im Bottas im not going to Alpine, this car is dogshit', ""He was fighting tf out of it before he even spun. It's still driver error but the onboard was fucking ridiculous."", 'Car is horrible to drive per Gasly’s FP radios, not surprised', 'That rear wing was shaking like crazy', 'I was told Doohan was the problem', ""So glad Doohan's F1 career is ruined for this"", ""I know the rumor is that Alpine will rebrand back to Renault. But I'd love it if Hyundai made true on all of their F1 hints and bought the Enstone team. It can't *possibly* get any worse.""]",819,411,0.98,819,240,240,63,23,0.0,63
1ls9u83,The Special One(s),https://www.reddit.com/r/formula1/comments/1ls9u83/the_special_ones/,2025-07-05, Social Media,,"['Never really made the link but Fernando is basically just Jose if he was an F1 and vice versa', 'They got him in the right garage this time around', 'Fernando never looked happier', 'Goat respecting Goat', 'This duo just makes sense', 'Who that?', 'Jose must be feeling such shock after Jota’s accident. \xa0', 'Also as a Madridista he is forever indebted to the Special One', 'I think he roots for Ferrari but Nando is his favourite driver so he had to pay a visit', ""Because that other answer was weirdly passive aggressive lol:\nIt's Jose Mourinho, one of the most well known football managers.\n\nHe famously won the champions league in 2004 with FC Porto and in 2010 with Inter Milan. \n\nHe also won the Portuguese league with Porto in 2003 and 2004, the Premier League in England with Chelsea in 2005, 2006 and 2015 and the italian league with Inter Milan in 2009 and 2010.\n\nHe's pretty well accomplished, which is why most football fans know him.""]",778,18,0.97,778,17,17,101,2,0.0,101
1ls7zu9,2025 British Grand Prix - FP3 Classification,https://www.reddit.com/r/formula1/comments/1ls7zu9/2025_british_grand_prix_fp3_classification/,2025-07-05, Statistics,,"['We are so back™️', 'Anyone who didnt watch fp3, hamilton couldnt complete his push lap due to a red flag, he was around 7 hundreths up on charles before the red flag', 'Damn, they actually fixed Max’s car during the night?', 'Anybody of McLaren, Ferrari,\xa0~~Red Bu~~\xa0Max has the chance to put it on pole today', 'Just went down to the storage to get my jars of hopium \n\nFerrari pole here we come!', 'Tsunoda Q3?', 'Pleasantly surprised to see that the Ferrari pace is also strong in cooler conditions. It looks like the new floor really got them some more margin to finally set up the car at lower ride heights to extract the potential of the car without risking to DSQ due to plank wear.\n\nBut all super tight, could be a 5 way battle for pole with the mercedes also not to be disregarded in those cooler conditions', 'Solid lap from Yuki, now the classic Sainz Tsunoda Stroll Ocon Alpine out in Q1 is going to be a surprise', ""Nah Hamilton's lap was absolutely ruined 😔😔""]",695,132,0.98,695,121,121,12,-1,0.0,12
1lrny8i,"Max Verstappen: Personally, quite a bad day today",https://www.reddit.com/r/formula1/comments/1lrny8i/max_verstappen_personally_quite_a_bad_day_today/,2025-07-04, Video,,"['“For me personally, it was quite a bad day,” Max said after the second free practice session in England. “The balance was very bad, and it was difficult from corner to corner. The wind has a big impact, but that’s not an excuse, because everybody has to deal with it. Our car seems quite sensitive to it. In general, it was not really an easy day. We’re lacking performance, and we’re looking at a few things to try and improve that.”', 'Alonso: This is the part where you burn the bridge.', 'Here because Why does Max have two heads? Is he Zaphod Beeblebrox now?', 'Mirror?', ""I'm at a point where I really want to see Max in the Racing Bull. It felt like a joke before, but I think the car might just be better now."", 'The car is a literal boat at times. \n\nRed Bull have been slowly sinking for the last 12+ months now.', 'Redbull missing aero-daddy Newey.', 'Incoming: Red Bull turning the car around for quali and race', 'Incoming pole tomorrow…', 'As someone at the track, the wind was fierce! Gabi and Pierre spun right in front of me!']",688,78,0.97,688,1643,1643,2,3,0.0,2
1lsd4fm,[@justformulacar] British GP Qualifying Gaps Visualized,https://www.reddit.com/r/formula1/comments/1lsd4fm/justformulacar_british_gp_qualifying_gaps/,2025-07-05, Social Media,[https://www.instagram.com/p/DLu1KsFtrPv/](https://www.instagram.com/p/DLu1KsFtrPv/),"['Remember the days when the gap from P1 - P10 was measured in seconds? It is crazy how slim the margins are now.', 'I hope they can stay that close in the race, maybe closer', 'Every car here is now built for combat. Alonso wins', 'A great performance from Russel ngl, overshadowed my Max, but still.', 'Very interested to see how Lando and Oscar treat the opening corners. Cannot let Max disappear into the distance.', 'Russell yet again pulling another mad lap to get that close to the Maccas. Max as usual being Max.', 'That is F1 we love', 'Shame George did not get any coverage on that lap. Poor tv direction considering this is his home race', 'woof thats a close one', 'Wonder what kind of setup changes RedBull did for Qualifying from FP1. The car seems to be more in control now.']",823,83,0.99,823,82,82,823,83,0.99,823
1lrq1x2,[Scuderia Ferrari via Instagram] : “Roscoe meets the team for the first time”,https://www.reddit.com/r/formula1/comments/1lrq1x2/scuderia_ferrari_via_instagram_roscoe_meets_the/,2025-07-04, Social Media,,"[""Aww, he's a senior dog. I'm sure he's having the best life ever."", 'I know roscoe is old and Lewis doesn’t see him all the time anymore, but when he passes it could really be a hard moment for him. \n\ntalking and being with roscoe I’ve only ever seen him as happy when he’s talking and driving cars.', 'Awww, love how they all just pose around where he flopped down. Truly is Roscoe’s world and they’re all living in it!\n\nI noticed he’s slowed down a bit too, but he recently had pneumonia so it’s to be expected I guess. Lewis seems thrilled to have him there.', ""Isn't 12 like 90 in bulldog years?"", 'Right? His home race is the first time he meets the team, guy isn’t traveling like he used to :(', 'How old is Roscoe?', 'Lewis talked about his first dog Coco for years after she passed away. He loves those dogs SO much.', 'Very true.', 'I wanna see Roscoe riding a horse']",616,21,0.96,616,679,679,2,0,0.0,2
1ls7rhz,Piastri & Leclerc are equal in high-speed corners in FP3,https://www.reddit.com/r/formula1/comments/1ls7rhz/piastri_leclerc_are_equal_in_highspeed_corners_in/,2025-07-05, Statistics,,"['I will not hope. I will not hope. I will not hope.', ""Oscar's signature look of superiority"", ""Have ferrari...?? No, let's not do that"", ""It will be hilarious if McLaren's wdc gets put in jeopardy due to the Ferrari being a few tenths quicker."", ""I will cry LH wins. Don't give me hope"", 'Like father like son', 'Just looking for a friendly discussion:\n\nWhy is Ferrari trying so hard? Can they carry over some of this development for 2026? \n\nSurely their bid at WDC and WCC is over, no? Seems like a waste when you can direct EVERYTHING at 26 instead. \n\nI’d just bring “fake” low-cost upgrades for the rest of the season to mess with the competition. “Completely revised floor”, *change 2 tiny bits*, no one can see it anyways. Then turn up the engine during FP a little more to fk with their heads and then blame low performance during the race on damage or strategy.', 'You will hope. You will hope. You will hope.', ""Don't lie to yourself. You WILL hope.""]",584,35,0.98,584,34,34,17,0,0.0,17
1lsc3lb,"Verstappen on pole, Piastri P2, Norris P3",https://www.reddit.com/r/formula1/comments/1lsc3lb/verstappen_on_pole_piastri_p2_norris_p3/,2025-07-05, Video,,"['How tf does he always do this shit bro', 'Where the fuck did Max come from', 'Max FP1: the car is shit!!!!! Undrivable!!  \nMax FP2: the car is shit!!!!! Undrivable!!  \nMax FP3: the car is shit!!!!! Undrivable!!  \nMax Q1: the car is shit!!!!! Undrivable!!  \nMax Q2: the car is shit!!!!! Undrivable!!  \nMax Q3: *casually wrecks the field and gets two purple sectors*', 'What the fuck Max', 'Wow Max is definitely in a different class lol\n\nPrice just doubled for Toto.', 'Max: Complains about the car all weekend\n\nAlso Max: Qualifies on pole\n\nHe really is inevitable 😭', 'Max is a fucking alien, what a lap', ""He's a machine"", 'What could’ve been for Hamilton.', 'Oh my god']",571,203,0.96,571,194,194,60,10,0.0,60
