unique_id,post_heading,post_url,publish_time,tag,post_content,top_comments,upvotes,comments,upvote_ratio,score,total_upvotes_comments,total_score_comments,upvotes_growth_rate,comments_growth_rate,upvote_ratio_growth_rate,score_growth_rate
1hjegfp,"If lance stroll had scored 0 points in the past 2 seasons, Aston Martin would still be 5th in each constructors. ",https://www.reddit.com/r/formula1/comments/1hjegfp/if_lance_stroll_had_scored_0_points_in_the_past_2/,2024-12-21, Statistics,"2024 Alonso - 70Pts, Stroll - 24 , 6th place Alpine with 65
2023 Alonso - 206Pts, Stroll - 74, 6th place alpine with 120","['Friendship ended with Perez stats, now Stroll Stats is my best friend.', 'The photo really sums everyone’s reaction to this stat', 'Perez out, now it’s time for Stroll stats!', 'With Perez gone we have returned to Lance stats', 'Lance ""Total Job Security"" Stroll.', 'https://preview.redd.it/fr6pxuqcm88e1.jpeg?width=736&format=pjpg&auto=webp&s=6c01877d065e174c685d550cbed336c6a0d54dbe', 'I love how his face is just 🙂', 'Stroll stats \n\nhttps://preview.redd.it/3ei6jncjk88e1.png?width=202&format=png&auto=webp&s=63b20820027d02f506e302a29325dd8d6ede00a6', 'Now that Checo is gone, we can finally return to what matters, Lance Stroll stats']",6612,229,0.95,6612,6965,6965,325,3,0.0,325
1hjdqwe,Coincidences between 2014 and 2025,https://www.reddit.com/r/formula1/comments/1hjdqwe/coincidences_between_2014_and_2025/,2024-12-21, Statistics,,"[""So what you're saying is that in about 10 years time Lawson would unceremoniously get dropped by VCARB and Red Bull?"", '> Magnussen ends his Journey in F1 \n\n😭', ""Not a good outlook for Hadjar if he follows in Kvyat's footsteps 👀"", 'So hadjar has to watch out for his first child being raised by an upcoming jr driver not yet signed by redbull…..', 'There is a typo! Ericsson was the GP2 driver, not Magnussen. My copypasta spun and hit the wall.', 'Isn’t Down under just Australia?\n\nEdit: Wording', 'So you’re saying that George Russell will start his dominance era?', 'Max better get ready for a lot of spinning', 'So you’re saying Max gets his ass kicked by Lawson, goes to Ferrari after Charles goes to Audi in ‘26 and beats Lewis every year whilst teammates, never wins WDC and gets his ass kicked by the next Ferrari prodigy /s?']",3158,227,0.97,3158,4713,4713,157,1,0.0,157
1hjalcc,Each driver's gained (or lost) positions in 2024,https://www.reddit.com/r/formula1/comments/1hjalcc/each_drivers_gained_or_lost_positions_in_2024/,2024-12-21, Statistics,,"['Max & Charles: 17 positions in one single race alone lol.', 'Alonso reaching Q3 with the Aston 🥲', ""Zhou Guanyu the GOAT. \n\nHonestly though, I find a stat like this kinda useless because all it shows is that Zhou was qualifying way behind what he should've been and then overtaking during the race whereas Alonso was pushing his car and placing it further than a more mediocre driver would have."", 'you can only gain positions from pZ0', ""It's probably one of the most pointless stats, but it's fun regardless.\n\nIt rewards poor qualifying, which is fitting to see Lewis up there this season, Perez of course.. but also a grid penalty, which is like 50% of Leclerc's total I assume.\n\nI suppose you could argue being close to 0 is ideal as it meant you get the most out of the car in the race and in the qualifying, which I think you can say about Nico this year, Max without Brazil would be around 0 as well.. Zhou is quite surprising relative to Bottas."", 'Zhou, the true GOAT!', 'Also shows how bad they qualified.', ""Can someone explain how the median is +17 and the mean is 19.4?\xa0\n\n\nThis doesn't make sense to me - both should be around zero."", 'Tsunoda and Alonso being at the bottom due to being great qualifiers']",1563,185,0.97,1563,4309,4309,62,1,0.010000000000000009,62
1hjdsp2,[Scuderia Ferrari via IG] One last lap around Fiorano with the whole family,https://www.reddit.com/r/formula1/comments/1hjdsp2/scuderia_ferrari_via_ig_one_last_lap_around/,2024-12-21, Social Media,,"['Race of Champions are missing out... could have a special category: \n\nAlonso Snr & Jnr -v- Sainz Snr & Jnr -v- Verstappen Snr & Jnr. -v- Montoya Snr & Jnr.\n\n\nWhat other father and son pairings could we add to the championship.  Throw them into a F2 car, and let loose. \n\nEdit:\n\nThe Alonsos\n\nThe Sainzs\n\nThe Verstappens\n\nThe Magnussens\n\nThe Brundles\n\nThe Rosbergs.', 'The Sainz family genes are incredible. The hair! The nose!', 'Success is temporary, class is permanent. Take notice Red Bull', ""I could honestly see Carlos back at Ferrari in four years. I can't see Hamilton driving well in to his forties, other older drivers like Schumacher, Raikkonen, Alonso all had time out from the sport.\n\nCarlos fits so neatly there, I could easily see him replacing Hamilton"", ""I am really impressed by what Ferrari are doing for Carlos.  And you can tell it was probably a tough decision.  Giving him car on the way out was one thing.  But inviting his family for a track day like this is something else.  But how do you say no to Lewis Hamilton. \n\nI'm really looking forward to what Sainz does with Williams.  I think Leclerc was the more talented driver, and could get the car around fastest in ideal conditions.  But I think Sainz was the better driver, who was able to understand the car a bit better, and adapt to issues better."", ""I have a feeling that Carlos departure from Ferrari is sad because it's so relatable. It's like that job interview you didn't crack, not because you weren't good enough but because the interviewers liked someone else. \n\nAnd so you are stuck in a job for which you are overqualified. Your colleagues can't keep up with you and your career won't grow much over here."", 'Carlos Sr looking at Charles: Sorry I already have an adopted son, Lando', 'Ferrari saying goodbye to Sainz was handled exponentially better than Mercedes saying goodbye to Lewis. Think about the impact both of them had on their teams and the farewell involved. Shame on Mercedes.', ""What a great send off for the Sainz boys.   Of all the money they have, also own a Garmin Epix like Sainz Snr, plus we're using the same watch face 😎"", 'To think that Sainz had a better farewell at Ferrari than Schumacher, Alonso, and Vettel...']",1526,75,0.98,1526,667,667,59,5,0.0,59
1hj95zj,Mario Miyakawa (Yuki Tsunoda’s Former Manager) Reveals Red Bull Seat Negotiations Were Impossible Months Ago,https://www.reddit.com/r/formula1/comments/1hj95zj/mario_miyakawa_yuki_tsunodas_former_manager/,2024-12-21, Social Media,,"[""There was an interview in F2 press conference where they were discussing future seats and he heavily hinted it's confirmed but he couldn't say it. So that testing with Yuki was more like a box ticking exercise to meet contract requirements than actually meaning anything.\xa0"", ""When Perez's seat was being debated after Spa, Yuki's name wasn't mentioned at all despite performing better than someone who has been in the sport for over a decade and Red Bull claimed was only a tenth off Verstappen. \n\nRed Bull for whatever reason do not want Yuki and will throw every reason they can find to not promote him."", 'I feel like Yuki and vcarb messed it up in Austin, that first race vs Liam this year. that race sealed the deal. \n\nLiam Lawson went from the back to p9 in his first race back while Yuki finished p14 with a bad strategy and a spin. Horner’s decision was made then. Yuki needed to get that p9 instead but he didn’t and lost to Liam. And eyebrows were raised and negotiations were starting at that point, negotiations which didn’t involve Yuki.', 'Since the race in Mexico, everyone at RedBull knew what was going to happen, but they love drama.\n\nThere Slim announced that he would stop sponsoring RB to make way for AT&T and from then on it was known that Checo would not continue.\n\nBut Horner and Marko love to make statements in the press and they prepared everything as if it were a suspense movie when everything was already arranged, just for more clics and publicity. RB is a marketing company after all.', ""Yuki always had zero chance. As long as he is involved with Honda. Honda put redbull in an awkward position they recovered and Ford is coming in to help. There is no room for a Honda driver.... It's not like Yuki is put driving the car and finishing top 8 every race with occasional podiums."", 'Free my boi Yuki', ""There was never a decision to place him in that seat, that's the joke.\n\nFirst they thought Ric isn't a complete failure, but he was, then they thought Perez might be tolerable if he gets his shit together, but he was a complete failure as well, then they decided to fuck it and get Lawson in that seat. \n\nIt's great that these illusions are dispersed now."", 'Yuki had a shot before Honda pulled out, maybe a slim chance after. However, when Honda announced its return but with AM, Yuki had no shot. \n\nYuki is a Honda (not RB) driver.', 'How does anyone think Yuki , being a ‘Honda driver’ can drive for the RedBull team when they have a new Engine supplier who will definitely have a conflict of interests is totally crazy.\nIt’s not about speed, reliability, technical knowledge , race.. it’s just about business.\nI doubt that unless anyone is Max, Lewis, Micheal or Senna 2.0, they won’t be considered.\nStop this sentimental crap.', 'Other than stealing away Vettel from BMW and Verstappen from Mercedes, Red Bull Junior’s biggest success is… Daniel Ricciardo.\n\nNot so long ago they had like 5 or 6 drivers in F2, if you count out the 3rd yearers, pay drivers, then that’s almost like half the potential F1 drivers, yet they haven’t manage to produce anyone available for Racing Bulls, and they had to sign Hartley, Perez, De Vries, or re-sign Kvyat or Ricciardo.\n\nThat’s an utter failure, and I would change the things up. First I wouldn’t sign more than 2 drivers for F2, and wouldn’t hold them for any longer than 2 years. Same for F3, and 1st and 2nd year driver pairing should be used in both series. None of the current crop will get good enough except for Lindblad, who had 3 bad weekends and went from almost P1 to P4 in F3.\n\nGoethe spent 3 years in F3 and never showed any consistency.\n\nMarti was great on the first weekend… and that’s it.\n\nTramnitz wasn’t doing well in F3 also.\n\nIwasa has underperformed in Super Formula and never was special in F2.\n\nNot sure what Tsolov did for his spot.\n\nF2 should be Lindblad and Goethe next year, and that is Goethe’s one and only chance after 3 F3 years.\n\nF3 should be Fornaroli, and this is a bit bold, Freddie Slater would sit in the other seat, guy needs to be fast tracked to F1, he is special.\n\nRacing Bulls would be Hadjar and Lawson, with Hadjar having 2 years to show he is capable of Red Bull seat and Lawson has one.\n\nTsunoda would get the RB seat for one year only.\n\n2025 would be a descision about Lawson vs Tsunoda vs Hadjar.\n\nIf Tsunoda seems to be the best, he stays, Hadjar stays and Lawson is let go.\n\nIf Lawson seems to be the best, he moves up to RB, Hadjar stays, Tsunoda is let go.\n\nIf Hadjar seems to be the best, he moves up to RB, Lawson stays at Racing Bulls and Tsunoda is let go.\n\nThe 4th seat is given to the guy who shows promise in F2 (TOP 3), or stays with the 4th guy.\n\nWhatever happens Goethe is either Racing Bulls or Bye, Lindblad is either Racing Bulls or F2.\n\nAnd so on and so on…\n\nObviously this system is not perfect because if everybody underperforms, than you stuck with the current crop, but it’s better than using Racing Bulls as a station for ex-Red Bull drivers (Gasly, Kvyat, Ricciardo) and almost-have-beens (Hartley/De Vries).']",1470,226,0.97,1470,2864,2864,98,2,0.0,98
1hjanz6,Helmut Marko tells Isack Hadjar to “keep his emotions under control” ahead of F1 debut,https://www.reddit.com/r/formula1/comments/1hjanz6/helmut_marko_tells_isack_hadjar_to_keep_his/,2024-12-21, News,,"['This dude is rude. Excited to see how people are gonna react to his radios vs. Yuki.', 'I think it’s something he clearly was told to work on and he seemed to get his emotions under control as the year went on. Don’t think he’s a world beater, but I think he will do well.', 'Obi Wan tells Anakin to ""keep his emotions under control"" ahead of Count Dooku battle.', 'I feel like the last thing you want to tell someone with regular angry outbursts is….\n\n“Calm down.”', 'He doesn\'t have to though. He could just win podiums & then it\'ll be relabelled as ""passionate"" or ""determined.""', ""This guy knows that if Lawson is eaten alive by Max, he is the next RBR driver,  it's gonna be so fun to watch."", '""Isack is fast but he has to keep his emotions under control and has to focus.""\xa0\n\n\nTo be honest the complete sentence of what he said is much more balanced than only what the headline here makes it sounds like. No need to rage about that statement imo.', ""Can't be fiery and replace Lawson when Yuki being fiery was allegedly one of the reasons he didn't get the seat..."", 'Hadjar is good but is allergic to titles so he probably will never be their next top team candidate(which is seemingly Lindblad)']",1232,203,0.98,1232,4322,4322,76,7,0.0,76
1hjlsmv,[Valtteri Bottas on Instagram] Good to be back Australia,https://www.reddit.com/r/formula1/comments/1hjlsmv/valtteri_bottas_on_instagram_good_to_be_back/,2024-12-21, Social Media,,"['Welcome back, our honorary Aussie.', ""A friend of mine is a pro cyclist who knows Valtteri through his partner. She says he's just as delightful in person as every F1 fan assumes. Was very glad to hear that!"", 'Welcome home, honorary bogan \U0001faf6🏼', 'https://preview.redd.it/1k0hm85yda8e1.png?width=224&format=png&auto=webp&s=4da0f085bcbe8cd37e288f85dadc2bc3349624eb', 'Nice to see him back in his home country.', 'Bet it’s nice for him to be home!  😃😂', 'The man was at the Wollombi gravel bike race yesterday - a buddy got a selfie with him.  He gets around\n\nLast pic will be from that - solid 90km ride with 1400m elevation', ""Coffee, cycling, that epic haircut and moustache. All that's missing to make it the ultimate Bottas-pic is his bare ass."", ""Where's the Vegemite?"", 'Skittle Lane coffee. Good taste! Welcome back to our honorary Aussie.']",1130,25,0.98,1130,24,24,155,2,0.0,155
1hje9wq,"Albon: Crashes shouldn't overshadow ""fantastic"" Colapinto's Williams F1 stint",https://www.reddit.com/r/formula1/comments/1hje9wq/albon_crashes_shouldnt_overshadow_fantastic/,2024-12-21, News,,"[""Very well put by Albon, in the article.\n\n>He's a fantastic driver. I feel like he's proved his worth in Formula 1. Definitely, when he joined, I underestimated just how quick he was going to be, and I believe we'll see him in Formula 1 at some point in the future."", ""I feel like it's definitely much harder to get faster than it is to get more consistent / crash less. Colapinto has the rare pace for F1, he just needs time in a seat to get more consistent."", 'So what is next for Colapinto? Does he sit on the sidelines for a while hoping a seat is suddenly open in F1, or does he go elsewhere?', 'If Sainz is unable to also not crash then we know for sure that williams is damn hard to drive fast.', ""I always found it quite unfair how quick some people were to label Franco as 'Crashpinto'. Like for real, give the guy a break. It's not like Williams weren't aware they were taking a big risk with someone as inexperienced as him when they brought him in as a last-minute replacement for Sargeant. You try driving around Interlagos in the wet conditions that were this year and see how you manage. Considering he'd never even driven around Interlagos, much less a wet race at that (and also considering the pitting issue), it would've been surprising if he didn't crash.\n\nEDIT: go ahead and downvote me if you like, it's just an opinion of mine."", 'I look forward to Colapinto having a full time drive.  The cars he had to drive were a collection of parts from the early season.  So his true speed was not always evident.', 'Dude took the opportunity with both hands and ran with it. Somehow i have more respect for him than F2 winners. He’s willing to push it\xa0', ""Rookies are crash happy but he was fast so that's more important"", 'So Logie bear was really the best one of all uhh']",839,99,0.97,839,468,468,35,1,0.0,35
1hj9a21,Team principals top 10 drivers of 2024,https://www.reddit.com/r/formula1/comments/1hj9a21/team_principals_top_10_drivers_of_2024/,2024-12-21, Statistics,,"['It would be spicier if they asked them to rank the bottom 10 drivers. Then get the drivers to rank the team principals.', 'Verstappen scoring 250 points means all team principals ranked him #1', 'Happy to see Hulk get ranked into the top 10 here. He and Kmag were a pleasure to watch this year, their teamwork was great.', ""They've all just had a look at the points standings and copied them down."", 'Am I doing the math wrong or is Landos rating mathematically impossible? If Max is on 250, he got 1st from all 10 TPs, 10 p2s is 180, difference between p2 and p3 is 3 points so Lando can only have 177?', ""Glad they recognized Hulk's super season"", 'They killed alonso🥲', ""It's a crime how Piastri keeps getting rated higher than Sainz in these lists, and I say that as a fan of both drivers."", 'How does Norris get 178? I assume 2nd place is 18 points, so 10x 2nd is 180, and 9x 2nd and 1x 3rd is 177']",793,302,0.95,793,6275,6275,14,12,0.0,14
1hj9e96,Charles Leclerc driving for Haas at the 2016 Brazilian Grand Prix during FP1,https://www.reddit.com/r/formula1/comments/1hj9e96/charles_leclerc_driving_for_haas_at_the_2016/,2024-12-21, Throwback,,"['Horrible rear wing.', 'He was testing with Haas? .-.', 'Looks odd with no Halo. It’s interesting how quickly we get used to these things.', 'There\'s that famous footage of him standing in Haas gear besides Hamilton when the Brazilian Grand Prix was red flagged in 2016\n\nhttps://youtu.be/Fdv-iosetsI\n\nGunther with the ""if you need anything just ask"", Charles wouldn\'t have even dreamt in his wildest dreams that Hamilton would be his teammate in the future', 'He drove in FP1 for Haas in Silverstone, Hungary, Hockenheim and Interlagos in 2016.', 'He was their development driver as part of the Ferrari academy', 'I love that video because he acts a little nervous that Lewis is right there. 😂.  Little did he know!', 'https://preview.redd.it/hgw9bchi3a8e1.png?width=563&format=png&auto=webp&s=9a1145b11624ef97db58ced25cfdaec415bac3b9\n\nHe looks so nervous and timid. 😊', 'Wow. He was in F3 at the time.']",306,15,0.96,306,258,258,6,0,0.0,6
1hjb0qm,Updated Team Principals' Top 10 Driver Ratings (2008 - 2024),https://www.reddit.com/r/formula1/comments/1hjb0qm/updated_team_principals_top_10_driver_ratings/,2024-12-21, Statistics,,"[""This year's top 7 is literally the same as the WDC standings."", 'Crazy how Max is always 2nd or 1st since after his rookie season', 'Since his 2nd season Max has been first or second every year. Pretty incredible', 'Verstappen not getting 250 points for 2023 is actual insanity.', 'Kinda funny how one TP saw Max break all those records last year and thought ""nah wasn\'t the best driver"".', 'First time a driver has been voted 1st by all 10 TPs!\n\nJust a couple of notes about how the rankings were determined:  \n\n* Autosport/Formula1 asked the F1 team bosses to pick their top 10 drivers of the year.  \n\n* They then assigned points using F1’s point structure that runs from 25 points for first down to 1 point for 10th. For the 2008 and 2009 editions of the TP rankings, the scores were assigned using the old system (10 points for 1st).\n\n* Autosport/Formula1 kept the individual results secret so the participants could answer honestly.', 'Lol at Nico coming in #3 when he won the WDC.', ""The streets remember 2010 and 2012.\n\nAlso, the fact that Verstappen hasn't been ranked lower than P2 since he moved into a top 3 car in 2016 says it all. Red bull wasn't even fast from 2016-2019 except for like 3 races a year (Monaco, Hungary, Mexico)."", 'Man, those Kubica rankings. Still hurts what could have been. Definitely was a top tier Button/Rosberg tier talent, maybe even more.']",294,158,0.95,294,1736,1736,10,0,0.0,10
1hj4dk5,Out of context Mark Webber quote from 2007,https://www.reddit.com/r/formula1/comments/1hj4dk5/out_of_context_mark_webber_quote_from_2007/,2024-12-21, Throwback,,"[""I remember at the time there was light - light! - criticism from some quarters that Williams had expected Webber to have even a hint of support for Rosberg as a rookie, and instead what they found was he was out to demolish him totally ruthlessly.\n\nA lot of Webber's dominance over Rosberg by the end of the season was psychological, they felt."", 'Someone give me the context', ""It's very interesting to find out some parts of the context from the comments' section. With his list of teammates giving him varying levels of psychological shakeups, it slightly elevates the context of him triumphing as the 2016 WDC for me, and elevates the context of him focusing on the psychological aspects of being a racer\n\nI respect his trajectory in Formula 1. Not just for sharpening his grit and skills when it all played out, but for providing more insight into this aspect. It is one that I am quite fascinated with, and I am glad he is shedding light onto that"", ""Ah, Mark Webber. The best driver you'd rather have in your title rival's team than your own."", 'Wait so was this criticism or praise. Incredibly confusing', 'Noone has ever overrated Mark Webber as much as Mark Webber', 'https://preview.redd.it/spxyak4no58e1.jpeg?width=723&format=pjpg&auto=webp&s=877c2845f69c988592decb2053287edae5ecd95f\n\nAlways trying to act like he’s cooking', 'Max Werstappen', ""He'll be champion but when? Which year.""]",286,54,0.95,286,1470,1470,6,0,0.0,6
1hje64s,"[Mclaren via IG] Yep, these photos go hard .( fire emoji) Content creators’ favourites from 2024, part one!",https://www.reddit.com/r/formula1/comments/1hje64s/mclaren_via_ig_yep_these_photos_go_hard_fire/,2024-12-21, Social Media,,"['Does she drive with those glasses on? Curious How they don’t fog up - I’m assuming it gets humid inside the helmet.', 'Close ups of eyeballs always freaks me out haha', 'Oh my god Oscar 😳', ""Where's the one of the guy giving Oscar the good luck money before he won?"", 'Why is he laying down with a blanket on to get a tattoo on his upper arm? I’ve literally only ever just sat in a chair with my arm on an armrest for those.', 'She does, Sebastian Bourdais used to in F1 as another example', 'Isn’t there ventilation in there? I swear I’ve heard drivers say like how there’s too much air coming in or smth..', 'I can’t tell who that is either.\xa0', 'Hopefully in part 2', 'Cause its cold?']",118,15,0.8,118,38,38,5,1,0.0,5
1hj9kog,F1 Secret Santa - who got who ,https://www.reddit.com/r/formula1/comments/1hj9kog/f1_secret_santa_who_got_who/,2024-12-21, Video,,"['The funniest one of these was when a lot of people gave really nice or really personal gifts, and then Alonso just gave somebody a piece of debris from one of his crashes. Christmas cheer is not part of El Plan.', 'when is the video dropping?', 'So no Haas, WDCs, or Checo this year?', 'Stroll and Gasly drew each other...the bizarre Ocon triangle.', 'Are champions exempted from it?', 'I was hoping for George getting Max tbh', 'It is a crime that Max didn’t get George or vice versa', 'Please tell me Lewis/Fernando are participating too', 'I hope they indeed did the gift exchange in Qatar already, otherwise the Ocon situation would be quite awkward', ""Where's Max? Fernando? I hope they join this year. He never missed it yet""]",95,25,0.91,95,345,345,1,1,0.0,1
1hjr6am,The overtake which earned Liam Lawson a contract for the Red Bull Junior Team. (2019 Toyota Racing Series),https://www.reddit.com/r/formula1/comments/1hjr6am/the_overtake_which_earned_liam_lawson_a_contract/,2024-12-22, Video,,"['He’s got skills, Albon and Gasly did too, if he can adapt and handle the car then he’s going to be an amazing competitor but I’m sure he’s well aware it could just grind him up and spit him out. Albon and Gasly both landed on their feet, I hope if it all falls apart next year there’s a team out there willing to give him a shot.', 'Liam talks about this move and his 2019 TRS season on Armstrong’s [podcast](https://youtu.be/3YWq1AJ3EzQ?si=z2Xql_atR9KW6B4i) (the guy he overtook in the first clip). Starts around 32min.', 'Liam is really good driver in wet too. This years Brazil and last year in Zandvoort showed he has skills in wet too.', 'Brother Liam has balls\xa0', 'Damn that was slick', 'The funny thing is regardless of how Lawson performs, it shows how broken RBR management is. \n\nIf he does well, why did they wait so long to put him in the car while they mess around with a declining Daniel and Yuki who they clearly have no confidence in? \n\nIf he doesn’t do well, here goes another premature promotion that ends in tears and destroying the confidence of a rookie.', 'Can someone link me to this? Just getting into the sport and would like to see what a top class overtake looks like.\n\nAlso more examples are appreciated!', 'I fricking love mechanical grip', 'He’s exceptional at overtaking, I cannot wait to see how he does next year', ""What a negative and defeatist view. I'm sure that even though he's aware, as you say, he's not thinking like that.""]",97,13,0.85,97,13,13,65,10,0.020000000000000018,65
