unique_id,post_heading,post_url,publish_time,tag,post_content,top_comments,upvotes,comments,upvote_ratio,score,total_upvotes_comments,total_score_comments,upvotes_growth_rate,comments_growth_rate,upvote_ratio_growth_rate,score_growth_rate
1lsv43h,Provisional Starting Grid,https://www.reddit.com/r/formula1/comments/1lsv43h/provisional_starting_grid/,2025-07-06, News,,"[""I wouldn't be surprised if Haas started Bearman in the pitlane. He is already on his 4th engine because he wrote one off in Australia FP1 and another died in the Miami GP. They might aswell eat the penalty here and take him out of the lap 1 melee. P18 or pit lane won't make much difference."", 'Somehow Yuk11 returned', ""Here's the grid slots of all F1 winners around Silverstone (including unique races such as the 70th anniversary):\n\nFrom P1: 37.29%\n\nFrom P2: 30.51%\n\nFrom P3: 13.56%\n\nFrom P4: 8.47%\n\nFrom P5: 5.08%\n\nFrom P6: 3.39%\n\nFrom P7: 1.69%"", 'Guess Yuki has a chance for points.', ""I am surprised how badly the racing bulls did, maybe they got the opposite of Merc's problem."", 'Max and Oscar to tangle turn 1.\n\nLando, George and Lewis to take the podium.', ""Well, this isn't what I wanted at all, fast cars get away, business as usual on the podium."", 'Wonder if Max will do his usual thing of a moment of genius followed by some dumb wheel to wheel racing move.', ""Yuki better gets some points man.C'mon"", 'someones gonna die in lap 1 of that I am sure']",112,16,0.98,112,117,117,-2,0,0.0,-2
1lt4duj,F1 progression Graph,https://www.reddit.com/r/formula1/comments/1lt4duj/f1_progression_graph/,2025-07-06, Statistics,,"['Russel doing his best not to trigger that exit clause', 'The uptick for Hulkenberg \U0001f979', 'Poor Kimi this is fourth DNF in six race\xa0', 'That consistency of Lewis, tho', 'Hulkenberg is single-handedly carrying Sauber into contention for best of the rest. If they had two experienced drivers they would be pretty close to Williams.\n\nAmazing how much the car has improved since Monaco. Also, idk if they feel they have a safe gap and have changed focus to next year, but Williams has plateaued so fucking hard for a bunch of races now.', 'Oof, Antonelli. He had such a strong first few races but with one exception Mercedes has been a one-car team since Imola. Then again, it’s a pretty notable exception. Hope he can shrug off the run of bad luck re: things out of his control, and find some more consistency in the things within his control.\xa0It’s absolutely wild that P2 in the WCC might slip out of Mercedes’ grasp given all of Ferrari’s problems.', 'What a wild year!', 'Nice recovery from max but things need to change very quickly for that gap to stay in reach. Penalty aside I still think Oscar is faster, but this is gonna be close down the stretch\xa0', 'HERE COMES NICO HULKENBERG', 'sauber might actually start to put pressure on williams']",109,16,0.96,109,15,15,1,1,0.0,1
1lt4nao,Race pace Silverstone GP 2025,https://www.reddit.com/r/formula1/comments/1lt4nao/race_pace_silverstone_gp_2025/,2025-07-06, Statistics,Raw:https://rakesh-i.github.io/stint-data/,"['Mclaren are rocketships. Mental pace.', 'Stroll once again going crazy on Inters how is this even possible, his rain driving vs his normal driving is worlds apart', 'Hamilton, Verstappen and Hulkenberg excluding McLarens and with their car’s ability in wet especially Ferrari and red bull. Hats off!!', 'Unsual stinker by leclerc', 'Gosh, Nico did it on MERIT', 'No one was even close to the McLarens sheesh. Lewis was 3rd and still almost a second a lap average behind', 'Thank you for doing this so quickly\n\nHulkenberg really brought his A game here with those lap times', 'Verstappen vs Tsunoda!\n\n💀💀💀', 'Ferrari is so bad in the wet. Takes like 10 laps to generate any tyre temp', 'Yeah, red bull was all over. \n\nGood for quali, horrible for the race. \n\nWhatever Merc was even thinking pitting them like that, on hards as well.']",104,35,0.96,104,32,32,1,0,0.0,1
1ltbh4a,British Grand Prix - Race Strategy & Performance Recap,https://www.reddit.com/r/formula1/comments/1ltbh4a/british_grand_prix_race_strategy_performance_recap/,2025-07-06, Statistics,,"[""Hulk having jumped everyone while doing basically the same tyre strategy is crazy.\n\nedit: should've been slightly more clear and added *tyre* *strategy.* They nailed the timing of their first stop, but they didn't have to gamble on different tyre compounds to achieve the result."", 'Could Stroll actually be a genius….?', 'Check out the interactive version of these graphics and more at my [strategy dashboard](https://armchair-strategist.dev/).\n\n**Warning**: Distribution plots are affected by small data size, as these plots only consider lap times no slower than 110% of the fastest lap to be representative.\n\nThe scatterplots are showing all lap times no slower than 130% of the fastest lap\n\nAston Martin uses all allocated tyres during free practice, causing them to show up as used.\n\nBy far the most popular request is for the position plot to incorporate the starting grid. I wrote a [post](https://www.reddit.com/user/FCBStar-of-the-South/comments/1jifcui/why_race_starting_positions_cannot_be_determined) to explain why this is not possible *at the moment*.\n\nWhat other graphics do you want to see and how can these existing graphics be improved, question.', 'This is such an amazing graphic, never seen it before. Nice one!', 'Ferrari put Hamilton on used softs instead of new mediums. What a team', ""I'm sorry, Ferrari put Hamilton and Leclerc on used softs?\n\nI assume it was their best choice at that point. Did they scrub them?\n\nSurprised Strolls tyres weren't scrubbed.\n\nDid Merc only have hards?!"", 'Thanks for the raw stats!', 'Pitting on lap 1 was a disaster for everyone.', 'Hulk strategist did an insane job today', 'Why does it show ver/pia/nor all dropping 2 places with no one in 1st or 2nd on lap 1?']",114,28,0.97,114,28,28,65,19,-0.020000000000000018,65
1lt96u1,When Nico Hulkenberg raced on an oval - The Ligier JS47 F3,https://www.reddit.com/r/formula1/comments/1lt96u1/when_nico_hulkenberg_raced_on_an_oval_the_ligier/,2025-07-06, Video,,"[""Didn't know Sam had a personal YT channel!  Fantastic!"", 'He was practicing for the Indy 500 he’ll partake in the year after he wins the Monaco GP for Audi, triple crown here we come.', 'I wish there still were any races on the Oval layout of the Lausitzring :(', 'Marcelo has a YT channel? Cool', 'The guy has been belting out these types of vids for about a couple of weeks now. Super interesting stuff imo', ""The oval would need a lot of work, replace tarmac, add SAFER barriers etc. and the owner don't want to invest that money, since there is basically no desire for proper oval racing in the EU.""]",87,8,0.9,87,6,6,13,0,0.0,13
1ltaj0q,Championship fight at halfway stage between the top three,https://www.reddit.com/r/formula1/comments/1ltaj0q/championship_fight_at_halfway_stage_between_the/,2025-07-06, Statistics,,"['I think it could be a little better if there were three seperate lines rather than Piastri’s gap to the others. Still a cool graph though!', 'I generally agree with the Race podcast on this, ages ago, that Norris/Piastri will ebb and flow for X months and then basically come down to who happens to be ahead in December.', 'Can we have Max in a McLaren for the second half of the season and see if he is able to claw back the points deficit?', 'The FIA cheated Oscar out of this win, they are clearly bias.', 'That is a fair assessment. Also, kudos to McLaren for letting them fight it out on the track. Makes for a good show', 'No thanks. Tell Christian to change his fu”$ng car.', 'If Redbull bring a decent update for the next few races, it could still get very spicy', 'Max is doing that 9pm/2am/7am baby shift. My man is straight up exhausted.', '7-8 races at max then back to an improved redbull if I was a racing god', 'I personally want to see the whole grid just drive the red bull against each other.']",81,20,0.85,81,16,16,24,6,0.0,24
1lsv6po,Met Office: Rain likely pre-race,https://www.reddit.com/r/formula1/comments/1lsv6po/met_office_rain_likely_prerace/,2025-07-06, Technical,"Summary as of the time of posting according to Met Office UK:

- Rain likely in morning (90% probability.)

- Possibility of wet start (40% probability.)

- Decreasing probability of rain thereafter (10-20%)

- Overcast conditions forecast throughout.

- Air temperature around 18-19 degrees celcius.","['F3 & F2 will be wet races guaranteed \n\nF1 could hopefully be like 2016 (excluding the massive rain)', ""Hope this doesn't mean a safety car start for 15 laps and then everyone puts on slicks."", 'Perfect scenario is a wet start but a drying track. Would give us a two or three stopper easily.', 'Max looking at the forecast with his Monza wing 💀💀💀', 'The best races usually start dry, and within 15 minutes of the race starting medium level showers start and stay for 10 minutes before stopping raining and the track drying out over the next 40 minutes or so.', ""It's raining now"", ""I'll wait for news from that upwind farmer."", ""The radar looks to be less rain from 2pm, one hour before start\n\nWe've been monitoring it religiously as we're in CopseD no roof 😢"", 'Imo this makes George a very strong threat for the win. Max will have to pull something special again, to keep the win with the setup. There’s a good chance that one Mclaren and one Ferrari botches the strategy by taking a big gamble', ""If temperatures remain low but it isn't wet i guess we might be forecasted a Russell win with Mercedes particuraly strong in that kind of weather.""]",73,42,0.93,73,275,275,-4,0,0.0,-4
1lt29u9,VSC deployed as Bortoleto stops on track,https://www.reddit.com/r/formula1/comments/1lt29u9/vsc_deployed_as_bortoleto_stops_on_track/,2025-07-06, Video,,"['Aaah Leclerc, Leclerc…', 'Anotha one\n\n\nSurely its not the last as we have cars on slicks and more rain incoming', 'thought he saved it there but nvm 😭', 'The only hope for Russell/Leclerc is for the track to dry very quickly and erase the gap. Otherwise they are f*cked.\n\nShame because the risk was strategic.', ""Feels like we're gonna see more VSCs soon"", ""Not his fault that the VSC got called after all. It looked like he could've driven the car back, but he had to stop because of safety regulations"", '2 concurrent races are going on at the same time. One on wets, one on slicks', '""Rain in 10 minutes."" Gonna be exciting now.', 'No excuse for dropping there. Find a place to pull off track.\xa0', 'Did he drive past the box to then retire the car on track? Or am I mistaken?']",70,10,0.95,70,10,10,3,0,0.019999999999999907,3
1lt1ra1,"[Rory Mitchell] Risk of rain is at 60% according to the live timing screen. Skies are clearing up, but it will be Intermediates for the start.",https://www.reddit.com/r/formula1/comments/1lt1ra1/rory_mitchell_risk_of_rain_is_at_60_according_to/,2025-07-06, Social Media,,"['So zero % then', ""The circuit is just over the trees in the distance from my garden and the sky looks clear but from the front of my house interestingly there's some dark clouds\n\nhttps://imgur.com/a/1XavP6r"", ""Pissing down in Oxford again, I reckon it's going to rain at the track again."", 'This is one weird race in terms of strategy. Bring it.', 'Usual F1 logic']",65,5,0.91,65,5,5,0,0,-0.010000000000000009,0
1lsr6so,A Couple Questions From a New Viewer,https://www.reddit.com/r/formula1/comments/1lsr6so/a_couple_questions_from_a_new_viewer/,2025-07-06, Discussion,"Recently got into watching F1 and had a few questions about the dynamic of the competition for a chance to learn about some implied truths I might be missing out on.

\-Is it just a given that some teams will have no chance at podium finish all year and that they're more focused on finishing as close as they can to top 10? What I'm picking up from the dialogue is that some cars just outclass others and no matter how good of a driver you are you're not beating the regular top finishers.

\-Leads me to my second question, is it just an known objective fact by everyone involved that McClaren has the best car right now? I don't know anything about the tech behind these cars. Is it normal to expect them to continue to be dominating or are the modifications teams make between races a big enough game changer for it to be back and forth.

\-Lastly, if the answers to the above are yes, question to you guys as fans but how do you stay engaged throughout the season if you're a fan of a backmarker team or driver? Not that that stops me from watching but it seems like it'd be disappointing to not get much coverage during a race of specific drivers if I'm a fan of drivers who are always finishing outside of top 10 or someone who might DNF early.

edit: forgot to say thank you for taking your time to read this at the end of post so doing it now. appreciate all the insightful comments!","[""* Yes. Other than the top 3-4 teams, others almost never make it onto the podium, barring external factors like rain or other yellow/red flags.\n* Yes, it is known. In any other seasons, other teams would still try to improve their cars to match or beat McLaren. However, since next year brings new regulations, most teams are shifting their focus there and are not spending more technical and financial resources on this year's car.\n* Not really. The truth is, more often than not, it's actually more fun following mid and lower-level teams from a championship perspective; they're usually fighting for a single point difference. And that can mean millions of dollars in price money."", 'Others will probably give you better answers but I’ll try to answer all 3 of these:\n\n1. Pretty much yes, for an Alpine or Sauber or Haas to finish on the podium this season it would require a minor miracle (although Alpine got one in Brazil last year and managed to finish with a double podium, but that was about as hectic a race as you’ll ever see in F1). Even if the slowest car on the grid was only 0.5 seconds per lap behind the fastest car, over the course of a 60 lap race that’s half a minute in time and literal miles behind. So small gaps in pace can become insurmountable over the course of a race distance.\n\n2. McLaren currently have the best car by a large margin, although there are some tracks that suit other cars better (such as Mercedes in Canada). They will probably continue dominating, but it is possible that other teams will upgrade their cars enough to close the gap or even surpass McLaren. We saw this last year when Red Bull dominated the first 8ish races then had the 3rd fastest car by the end of the season because McLaren and Ferrari made better upgrades.\n\n3. Like in many sports, if you’re a fan of a team/player that simply isn’t capable of competing for championships, you take the small wins. A double points finish for Haas is probably about as exciting for their fans as a double podium is for McLaren fans. What’s been nice about this season is that every team has been able to score points on several different occasions, as opposed to years past when teams like Sauber will go all year without even sniffing the top 10.', ""1) yes, mostly though last year alpine was probably the worst on average but did manage a 2nd and 3rd in a rain race with a lucky strategy and good wet pace\n\n2) on average McLaren does,  but there's been a few times they missed setup and legit may not have been faster. They can upgrade the cars throughout the season and the pecking order can change. Last season redbull was way ahead for 5 or 6 races then for the entire rest of the season McLaren was faster.\n\n\nFollow up q\n\nYou pick a driver or two to watch and see how they do how the strategy fall in place where they are. The entire show isn't who wins. F1 historically isn't very race exciting. It's the engineering and raw speed."", ""\\> Is it normal to expect them to continue to be dominating\n\nYes, but the summer break can be a huge turning point. it won't, but it can be.\n\n\\> how do you stay engaged throughout the season if you're a fan of a backmarker team or driver?\n\nDue to the nature of the sport, we basically have several races going on at the same time, so the midfield battles are as valid as top ones, and more often than not they are more fierce. Like multiclass in GT, but everyone is still a competitor. It also opens up a possibility to a genuine miracle (Alpine in Brazil 2024), and even if not, it's still very cool to see what really good drivers can do with the cards dealt to them."", 'Enough people have answered your first two so I don’t need to repeat. But for the enjoyment part, I’m an Oscar fan (being an Aussie) so it’s obviously easy following the pointy end of the drivers championship.\xa0\n\nIn saying that, what drew me to F1 recently was that I love following the storylines up and down the grid. Such as:\n\n-Watching with interest how Lewis does at Ferrari\n\n-The interactions between rookies & veterans this season has been really nice to watch\n\n-Antonelli’s first pole and podium\n\n-Bortoleto getting his first point last week & the on track battle with Alonso.\xa0\n\n-Following Williams’ progress to see if they can get back to competing, it’s been a rollercoaster so far.\xa0\n\n-Watching the dumpster fire that is currently Alpine and seeing where they go from here etc.\n\nAs much as I want Oscar to win it all, I’m a fan of the sport and appreciating every race weekend for what it is and whatever storylines it throws up each week.', ""First and foremost, it's an engineering competition."", 'I guess what makes this interesting as a post is you’re trying to get at what makes F1 interesting during a race.\n\nWhen it comes to on track action the level of interest ranks from most to least as follows: crashes/spins, overtaking, retirements, pit stops, lone cars lapping.\n\nIt’s not that I want crashes to happen but they are the most sensational part of racing, and they usually have an impact on the outcome of a race. If you talk about races from the past, crashes are often key to them being memorable.\n\nYour issue is if the driver you support is lapping on their own and down the leaderboard, then you’re not going to see them much. But isn’t it somewhat similar to a team ball sport where your player isn’t the key player so they’re playing support and not really in the action most of the time?\n\nI guess you’re lamenting that once a driver is in a team for the season, your fate is sealed as to what you can expect due to the car’s performance?\n\nAnd then I stop and wonder that even if I’m a fan of a driver, do I delight in just watching them lapping. There is a way I do but that’s not usually in the context of a race, it’s more for analysis afterwards.\xa0\n\nThe hard part of F1 is being able to understand the athleticism and skill as it’s the opposite of showy, like a great dunk or a bicycle kick, drivers are usually trying to be as clean as possible, more like a train. So just seeing a driver lapping on their own doesn’t do much for me during a race as what I want to see during a race is things that impact the outcome.\n\nThis is when you get into tyre/pit strategies and following that for all the drivers. So I don’t support one driver and vary my hopes from race to race,\xa0caring about them achieving their own goals.\n\nProbably motorsport’s biggest problem is that most of the time the most exciting and outcome variable moment of a race is the start. It’s the time that a crash is most likely and the chance for the most overtakes. So it’s often downhill from there for excitement and you’re relying on a big crash to cause a red flag for a standing restart or two drivers that are tight at the lead on the last lap to exceed the race start for tension.', 'I’ve been watching since 1984.  There have always been dominate teams and cars.  Watch long enough and dynasties will fall and others will rise.  Mid fielders like Williams have stories to tell from an era gone by, and they may still have a new winning era in front of them.  The current dominate team was becoming an afterthought not long ago, and we may soon see the end of the Red Bull era(s).  You battle for 10th until you can battle for 5th, then you’re knocking on the door again.', 'My take on it:\n\n1. Some teams do a better job than others. Driver can make a difference (see Verstappen vs his teammates), but the performance of the car has massive impact. Big regulation changes can sometimes change the order. And many teams, that have no chance to catch up, will switch to the next season and hope that they get the next car right.\n2. Pretty much yes. Not on every track, but in the grand scheme - Yes.\n3. On Sky for example, you can follow one driver, if you want. Overall, i think that it is reductive to focus only at the top 3. Other teams and drivers can still do a good job, relative to their ranking. And on occasion, luck can have a big impact.']",62,60,0.82,62,282,282,1,0,0.0,1
