unique_id,post_heading,post_url,publish_time,tag,post_content,top_comments,upvotes,comments,upvote_ratio,score,total_upvotes_comments,total_score_comments,upvotes_growth_rate,comments_growth_rate,upvote_ratio_growth_rate,score_growth_rate
1jjdi5k,Ask r/Formula1 Anything - Daily Discussion Thread,https://www.reddit.com/r/formula1/comments/1jjdi5k/ask_rformula1_anything_daily_discussion_thread/,2025-03-25,,"# Welcome to the [r/formula1](https://www.reddit.com/r/formula1/) Daily Discussion / Q&A thread.

This thread is a hub for general discussion and questions about Formula 1, that don't need threads of their own.

Are you new to Formula 1? This is the place for you. Ever wondered why it's called a lollipop man? Why the cars don't refuel during pitstops? Or when Mika will be back from his sabbatical? Ask any question you might have here, and the community will answer.

Also make sure you check out our [guide for new fans](https://www.reddit.com/r/formula1/wiki/newtof1), and our [FAQ for new fans](https://www.reddit.com/r/formula1/wiki/faq).

Are you a veteran fan, longing for the days of lollipop men, refueling during pitstops, and Mika Häkkinen? This is the place to introduce new fans to your passion and knowledge of the sport.

Remember to keep it civil and welcoming! Gatekeeping within the Daily Discussion will subject users to disciplinary action.

Have a meta question about the subreddit? Please [direct these to the moderators](https://www.reddit.com/message/compose/?to=/r/formula1) instead.","['https://preview.redd.it/oeyf5gnedsqe1.jpeg?width=532&format=pjpg&auto=webp&s=eb7ef1cf47abb3b77a47c9b78e6131c23056d1a6', ""F1TV's driver cam view didn't play the drivers' team radio for Chinese Grand Prix. If anyone's looking for drivers' full team radio like I was, here's the speech-to-text transcript: https://transcripts.recursiveprojects.cloud/archive"", ""If you're Yuki, do you WANT to be promoted to RBR right now? Or would you rather stay with VCARB for the moment?"", '\nWhat do you all think the pecking order will be of the teams at the start of 2026? Who will be fastest? How far clear will they be? Who will challenge for race wins? Who will be the biggest good surprise and the biggest flops? Who will be last?\xa0', 'Is Lawson making it to Suzuka?', 'Have Kimi ever met Kimi?', ""let's go 周 ！"", 'It did, but you have to change the settings like you do on the other channels. In the bottom right you can change audio settings from the various languages  to FX which is onboard sound and radio only', ""Ask any driver on the grid if they'd want to be promoted to RBR and the answer would be yes"", ""Stay with VCARB. It's too much of a risk. If he can't stay with VCARB in 2026, then he should be looking at Cadillac or see if Audi might be willing to cut Hulkenberg loose.""]",3,28,1.0,3,28,28,1,7,0.0,1
1jjft0v,"Hot take: the 2nd Red Bull seat isn't cursed, the car is terrible, swap Max and Yuki for 1 weekend",https://www.reddit.com/r/formula1/comments/1jjft0v/hot_take_the_2nd_red_bull_seat_isnt_cursed_the/,2025-03-25, Discussion,"I've seen lots and lots of news articles, opinion pieces, comments and discussions about how Liam Lawson is now performing next to Max and how Red Bull *again* is failing to deliver a good 2nd driver next to Max. However, to me the conclusion is simple and there is even a simple option to prove this.

Well, what is my conclusion? Based on the fact that for years now Max has been having not that many problems with the car but all his teammates bar Ricciardo have: Gasly, Albon, Perez, Lawson. All of them have had problems with the car, some more, some less. To me Perez initially did quite well, Albon wasn't too bad either.

Now, we can all continue arguing about the driver choices, but in my opinion that's completely irrelevant by now.

Apart from that, I've seen some journalists from both Britain and Germany stating that they think the Red Bull car is actually worse than the Racing Bulls car this year and that Max purely with his capabilities is putting the car in places where it doesn't belong.

Again, you can argue about those kinds of things, but why don't Red Bull as a whole simply put Max into the Racing Bulls for a weekend and Tsunoda into the Red Bull for a weekend together with Lawson. Simply put:

* Just like with any multiple world champion, you know what Max is capable of, if he is placed into the Racing Bulls and puts it on pole or close to it, then yes: that car is better than the RBR. If he outscores Hadjar by just a few tenths like you can expect with any great driver, then no the car isn't better.
* Tsunoda and Lawson at Red Bull for a weekend would put them up against each other like they did last year at Racing Bulls, you have a like-for-like comparison and you'll know both whether they are equally capable to drive the RB21 or whether one struggles much more than the other.
* At the same time if both struggle in the RB21, you know that swapping them for the rest of the year is not of any use.

The only downside to all this is that Max potentially loses points in the championship fight if he isn't able to put the Racing Bulls car on the grid where the RB21 would be. But let's be real: with McLaren clearly the fastest and already having no 2nd driver at Red Bull scoring any points, let alone significant points, at best you can expect Max to be 3rd. If he becomes like 6/7th in the Racing Bulls car, which is very much likely if they don't screw up their strategy every race, he'd lose just 7-9 points. Points are points and could be costly at the end of the year, but only if Red Bull will get a grip on their car and are able to become faster than McLaren during the 2nd half of the year (basically a reverse from last year). But that's not a given and I feel swapping the drivers around for a weekend is worth it by now.

Yuki knows Suzuki very well of course so for him there would be no excuses apart from getting to know the RB21, but he has quite some experience by now. And if Max is capable of putting the RB21 where he puts it, he should have no issues putting the Racing Bulls into the top 8 at the very least.

Because imho the conclusion is that the Red Bull car is actually terrible to drive and putting both Yuki and Liam in the RB21 for a weekend puts them head-to-head AND gives Max the ability to assess the Racing Bulls car and also where that is better than the RB21 because it is definitely better in some aspects when Yuki or even Hadjar is putting the car at times just 2-3 tenths behind Max in the RB21. Also: Max has not been in a different team/car ever since 2016, that's 9 years by now, so he knows nothing else and just like your own car that you have for a long time, eventually minor issues are taken for granted until you drive a better car and you suddenly notice what the heck is wrong with your own car. That same might apply when Max gets his taste of the Racing Bulls, because one thing seems for sure: that car is balanced very very well. Both drivers have no issue getting everything out of the car and they're fast. At the very least directly behind the top 4 teams but at times even faster. Yuki was P7/P8 in front of Antonelli until they pitted him a 2nd time, something Hamilton was screwed over by as well.

TL;DR: Don't swap Liam away, that won't solve anything. Instead swap Max and Yuki for one weekend and assess the issues and then have Red Bull come to the conclusion that it isn't their driver that's the issue, it's their car.","[""I'm tired, boss"", ""Even if this was the case which isn't, Swapping Max to the VCARB is going to be an PR disaster because sponsors like Oracle are not paying multi million dollars per year to have the RBR driven by Yuki Tsunoda and Liam Lawson\n\nthey are paying them to have their name associated with the Likes of Max verstappen"", 'Max isnt going faster in the junior teams car.\n\nThe Red Bull car is faster if max is behind the wheel.\n\nIf you think differently you are just wrong', ""The car isn't terrible, nor is there a curse. The quote below is Horner from an article posted earlier. We know what the issue is, and it's not exactly  the driver, but it kind of is the driver. But also it's the car. \n\n> “If I think back to the beginning of '22, we had quite a stable car with quite a bit of understeer in it, which obviously Max hates. But we had an upgrade in Spain where we put a lot more front into the car and Max made a big step forward, Checo [Sergio Perez] sort of nosedived from that point.\n> \n> “As a team, we don't set out to make a car driver-centric, you just work on the info that you have and the feedback you have to produce the fastest car that you can.\n> \n> “And that's obviously served us very well, with 122 victories.”\n\nRed Bull have backed themselves into a corner. It's pointless trying to blame anyone at this point. They need to work themselves out of it. Maybe next year will be the hard reset they need. Maybe Verstappen's requirements are so unique that it will always be a 1-driver team as long as he's there."", 'Absolutely not.', "">The only downside to all this is that Max potentially loses points in the championship fight if he isn't able to put the Racing Bulls car on the grid where the RB21 would be.\n\nThis is all you need to say to see why it's never going to happen in the real world. Max is never going to give up a car that might give him a podium, or even win on a good day, to satisfy everyone's curiosity.\n\nHe's only in it for him, and the Red Bull is almost certainly his best chance of performing well."", 'I wonder how difficult it would be to bring Suzuka forward by a week? \n\nSurely it would be worth it to stop this garage being posted every hour', ""Look, while Max is undoubtedly a great driver, it's simply not possible for a driver to be that much quicker that the gap gets explained. That's just not possible."", ""Dude, albon already explained it well: max wants a very pointy car, he likes to drive with a super responsive car, like when you play videogames with mouse sensitivity at 300%. So our guess is this car is like at 500% and not very balanced, and he's the only one that can do good lap times in this situation""]",0,23,0.29,0,19,19,0,23,0.29,0
1jj06c5,Debut Down Under: Liam Lawson's First Drive | Behind the Charge,https://www.reddit.com/r/formula1/comments/1jj06c5/debut_down_under_liam_lawsons_first_drive_behind/,2025-03-24, Video,"In 2023: Liam Lawson says his dad was never able to take him to Singapore GP so he will be taking him to the race instead

""My dad actually used to promise me every year that he would take me to the Singapore Grand Prix, and in the end, we never went, but he's going to be coming to the Grand Prix this weekend, so actually I'm taking him!""

https://www.motorsport.com/f1/news/liam-lawsons-rocky-road-to-f1-my-parents-sold-their-house-so-i-could-keep-racing/10658101/

But to get there in the first place, Lawson revealed his parents made a huge sacrifice. ""My parents and my whole family really gave a lot, especially in the early years through go-karts,"" Lawson told Red Bull's Talking Bull podcast. *""My parents sold their house so that I could keep racing. It's massive. They gave absolutely everything for me to be able to race, even just go-karts because it's so expensive.""*

Like McLaren's Oscar Piastri, who lived in boarding school in the UK as a teenager while trying to forge a racing career, Lawson's perseverance was severely tested while 11,000 miles from home. But that early sacrifice often proves a formative experience for the Australian and Kiwi drivers that do make it across and provides them with the steel and grit to survive in F1's often difficult environment.

""I didn't finish high school or anything,"" Lawson shared. ""Honestly, I was just excited to be able to go and chase my dream. And there are always hard parts about it, but there was never a question of whether it was too difficult and I wanted to go home.""

But while he showed promise by finishing second in his first season in Europe, Lawson didn't get picked up by an F1 junior academy right away, and he headed back home to New Zealand's famed Toyota Winter Series without a plan after that, and with his F1 dream on the verge of already being shattered at the age of 17.

""Being from New Zealand, trying to get the money to compete overseas is really, really hard,"" Lawson recalled. ""So, between a group of amazing people that have been behind me, sponsors and investors, we set up the structure to get enough money to go to Europe and do a season and try and get recognised by a junior team, because without it, there was no chance to get a Formula 1.

""I had a good season, but I didn't have any call-ups from any teams. And then I just did this championship in New Zealand's over the off-season, with no plan of what I was doing in 2019.""As a kid being into Formula 1, I would watch this series every single year and I dreamed of driving it. And to me, it was like the Formula 1 of racing at the time.""

Fortunately for Lawson, talent scouts were watching the opening round of the 2019 Toyota Racing Series. And not just any scout, but Red Bull's Helmut Marko, who was keeping tabs on Lawson's older team-mate Lucas Auer, who was part of the Red Bull junior programme at the time.

And even before he would go on to beat Auer, and fellow Kiwi Marcus Armstrong to the title, Lawson would get the news he dreamed of for so long.

""I guess Helmut was watching because of Lucas and I had a really good first weekend,"" he said. ""When I raced in F4 in Europe, Jack Doohan was a Red Bull junior at the time and we tested together somewhere. I remember seeing him walking around in his Red Bull suit and I remember thinking how cool it would be to be a Red Bull junior.

""And I got the call-up after that first weekend in New Zealand, I found out one or two days after the weekend. I was sitting in a cafe - I remember exactly where I was sitting. I got told and it was obviously pretty emotional. I basically got picked up at the perfect time and it saved my career. I had those four weeks left of that championship, and then I had no plan after that...""

Lawson then plied his trade in FIA F3 and F2, going head-to-head with Piastri, dovetailing his single-seater activities with a Red Bull-backed stint aboard a Ferrari GT3 car in the German DTM sportscar championship, that yielded him a runner-up spot.

Finishing third in the 2022 F2 championship landed him a Red Bull reserve role alongside a Japanese Super Formula campaign for 2023, and when Ricciardo broke his wrist in Dutch Grand Prix practice Lawson got the nod to deputise for the Australian for the next five rounds.

In typical Red Bull fashion, it was sink or swim for Lawson, but he kept his head cool and scored points in the extremely challenging Singapore Grand Prix.

Lawson's cameo performances complicated matters for Red Bull in the short term, with Yuki Tsunoda and Ricciardo still getting the nod over Lawson to start the 2024 season while Lawson returned to a reserve role.

But what Red Bull was really looking for in a driver for the renamed RB team is someone who could be a future Red Bull driver. And with it becoming clear Ricciardo isn't ticking all those boxes any more, it has handed Lawson the opportunity to battle Tsunoda for a Red Bull berth.

Following his family's sacrifice to give him a fighting chance, and Red Bull noticing him just when he was approaching a dead-end street, claiming a Red Bull seat would be the third miracle on Lawson's rocky road to the top.
","['![gif](giphy|1zSz5MVw4zKg0|downsized)', 'Bro is posting a 4 day old vid about the his horrendous Australia GP debut in the Red Bull. Wonder if they will make one for the China GP as well or maybe the farewell message comes first.', 'Behind the charge ..... to keep up with the Saubers', 'Im already done with this', '😬', 'He is down under alright.', 'Don’t care what ever sob story they come up with. Being able to make a career out of racing, and to do it at the most top level is privileged.', 'I this the beginning of the end ??', 'Huge copium', 'Damn, gonna be rough getting a job at McDonald’s without a high school degree.']",0,59,0.43,0,200,200,0,0,0.020000000000000018,0
1jjcr23,New Netflix show suggestion,https://www.reddit.com/r/formula1/comments/1jjcr23/new_netflix_show_suggestion/,2025-03-25, Discussion,"# The Problem:

With the support of the FIA, I think there should be a new show to complement *Drive to Survive*.

I don’t mind *Drive to Survive*, but it has become more of a drama series than an in-depth coverage of the sport. While it’s great for bringing in new fans, it has also led to a wave of social media discourse from people who don’t fully understand the complexities of F1.

Formula 1 is an incredibly intricate sport, with countless elements that make it fascinating—car design, engines, racecraft, team strategies, and so much more. Yet, a lot of new fans miss these aspects, leading to takes like this one from the past few days:

>

This kind of misunderstanding happens all the time, and it’s frustrating because these are fundamental parts of the sport that have existed for decades.

# The Idea:

A new show that dives into the technical and strategic side of F1—covering the rules, mechanics, racecraft, and innovations that define the sport.

Each episode could focus on a different aspect:

* **Engines** – The different suppliers, why some teams build their own while others rely on manufacturers, how engines are managed across a season, cooling systems, and FIA regulations.
* **Car Regulations & Innovation** – How teams design their cars within the rules, how they push boundaries, and the technical loopholes they exploit.
* **Racecraft & Strategy** – The tactical decisions made during a race, pit stop strategies, driver-team communications, and how they impact performance.
* **Behind the Scenes** – A day in the life of a pit crew member, engineers, and mechanics, showcasing their roles and contributions.

With engaging visuals, expert commentary, and perhaps even actors or F1-loving celebrities acting as the audience, asking the questions casual fans might have, this show could bridge the gap between hardcore fans and newcomers.

What do you think? Would you watch something like this?","['A lot of this is available on F1TV', 'Most of this is already done on F1TV - they have tons of content explaining the more technical aspects, strategy and history of the sport', ""I don't know if there would be the interest tbh, especially because it's a lot of rote information; a dramatization might work, but then you're getting into DtS area again."", '> Car Regulations & Innovation – How teams design their cars within the rules, how they push boundaries, and the technical loopholes they exploit.\n\nI hardly think you\'ll get an indepth insider giving you the scoop on how they exploit loop holes!\n\n""hey Binotto, can you give us the scoop on fuel flow limits""\n\n""Sure! Happy to go into it""\n\n> What do you think? Would you watch something like this?\n\nI think a lot of what you\'re after is provided on various sources in various formats.\n\nThe strategy stuff is absolutely covered by Ruth on F1TV during pre show, post show.\n\nBeyond the Grid has some surprising indepth interviews with various technical people that covers some of the behind the scenes stuff, and some of the regulations / innovation / car design stuff. \n\nSure it would be nice ot have everything in one package, but I am not sure there\'s enough for a 10 episode a year netflix package there.\n\nEspecially given how long engine regs last for and how little you\'ll actually getabout the spicy stuff.', 'The audience for this would be a tiny fraction of what Drive to Survive attracts. I doubt it would be commercially viable.', 'I thought this last season of DtS was actually pretty good. Not too much manufactured drama and some new episode show concepts like the self-filmed episode in Singapore. With a daughter in engineering school now, I’d like to see a future episode focusing on some of the women of F1 - the engineers, mechanics, strategists, etc. Some female representation outside of shots of driver girlfriends and loads of Ginger Spice would be nice to change things up!', 'No more Netflix pls', ""I like what you're describing and I recognize that the material or content you expect is mostly in books at the moment (thinking Adrian Newey and Ross Brawn at the moment) - maybe video if you count in Sam Collins and ChainBear F1.\n\nbut other than that, as the Sport goes through perhaps the biggest technical shift since new fans joined from Netflix and beyond, having something that breaks down all of these would be nice."", 'The BBC Sounds series “Back At Base” is a good start to stuff like this.']",0,34,0.34,0,31,31,0,1,-0.009999999999999953,0
1jis2zs,Can / Should Max try driving the Racing Bulls car?,https://www.reddit.com/r/formula1/comments/1jis2zs/can_should_max_try_driving_the_racing_bulls_car/,2025-03-24, Discussion,"Assuming the Racing Bulls car is easier to drive, could Max extract more out of it than Yuki / Hadjar? If they can swap Tsunoda / Lawson then surely they could swap Max? 

I know it won't happen as it would kill the RedBull brand if they're putting their main driver on the 'sister' car, but if the only goal is for Max to win the WDC, then surely that'd be something to consider?","['Red Bull is clearly a faster car that is more difficult to extract pace from, he is not going to be faster in the VRB.', ""Max doesn't need an easier car, he needs a faster car."", 'Max could be leading by half a minute and still get screwed over by VCARB strategy and end up P20.', 'Easier to drive will almost certainly have a lower ceiling.\n\nMax will be faster in the faster but harder to drive car, particularly when he has years of experience in cars with those traits.\n\nAn inexperienced rookie will almost certainly be faster in the easier to drive car.', ""It's extremely unlikely that the potential speed of the Racing Bulls car is good enough for Max to compete for the WDC in it. The second drivers are failing in the Red Bull because it's difficult to drive and they haven't put a top class driver in it apart from Max, that doesn't mean the car is slow."", 'One lap pace the RB might be OK compared to the RB, but in race pace the RB is better than the RB.', 'I bet Max has driven the VCARB in the Sim and Red Bull has the Data on how which driver performs on each car', 'I want him in a Sauber for a race so people can stop pretending the Red Bull is anywhere close to the worst car.', ""That's not how it works. The Racing Bulls car probably has less oversteer by nature and is closer to a balanced drive. Max by nature needs an oversteering car because that's how he naturally drives. He subscribes to the theory that less steering angle means more speed, so he wants a very oversteering car so that he can easily turn the car by releasing the brake too quick or getting on the gas too quickly. In other works, a balanced car like the Racing Bulls car would feel slower to turn than the Red Bull.\n\nIt's like giving a pro gamer a low sensitivity mouse. Sure there's more precision, but it takes longer to where you want to go, especially if you can use an ultra high sensitivity mouse fine. \n\nMax is just a freak bro.""]",0,92,0.35,0,563,563,0,0,-0.010000000000000009,0
1jinxin,"Why did Lando say ""multi 21 Seb""?",https://www.reddit.com/r/formula1/comments/1jinxin/why_did_lando_say_multi_21_seb/,2025-03-24, Discussion,"I'm guessing it was to do with seeing Lewis not letting Charles pass him straight away when asked to buy the team, but I'm not sure with Mark Webber being Oscar's manager if there was some deeper allusion or reference to Oscar needing to speed up so they could break away from the Ferraris?","[""They also mentioned the hat throwing no? \n\nIt's more likely about McLaren being 1-2 and them cracking jokes about previous intra-team championship fights than a reference to anything that happened in the race itself"", ""It's mental warfare to BREAK DOWN Oscar. Lando is doing such an amazing guerrilla campaign on his rivals mental health.\n\n\nOr you know, it could also just be a joke."", 'Oscar mentioned something about throwing his hat into the area where they put their helmets and stuff, and I think the reference to throwing a hat reminded them of Rosberg and Lewis, and then that moved on to Multi 21', 'It’s just some banter it’s not that deep. There is really no need to read too much into literally anything a driver says', 'There is no deeper meaning. It was just a joke between the two of them. Probably in part taking the piss out of the fact that the media and fans are already trying to turn their intra-team dynamics into a drama, just two races in.', ""Didn't know they had asked Hamilton to buy the team. Not sure if he's rich enough though.   \n\nAlso, it was Hamilton who suggested to let Charles pass first.."", 'He also said he’d stop in the pit lane and not let Oscar out in reference to 2007. \n\nIt’s this amazing new fangled thing called *a joke*. When you discover it, it’ll change your life. You might even find it funny.', 'Just to be clear, it was Lewis who suggested they swap cars. The FOM guys or whoever in charge of picking what to broadcast just showed parts of his radio to make up fake drama.', ""Can't someone just make a joke without it getting overanalyzed to bits""]",0,44,0.32,0,749,749,0,0,-0.020000000000000018,0
