unique_id,post_heading,post_url,publish_time,tag,post_content,top_comments,upvotes,comments,upvote_ratio,score,total_upvotes_comments,total_score_comments,upvotes_growth_rate,comments_growth_rate,upvote_ratio_growth_rate,score_growth_rate
1kue0tn,Lando Norris becomes the first driver to go under the 70 seconds at Monaco,https://www.reddit.com/r/formula1/comments/1kue0tn/lando_norris_becomes_the_first_driver_to_go_under/,2025-05-24, Statistics,,"['Hard to put into perspective just how fast that actually is around this track. Holy shit', '69 seconds for pole', 'That was one hell of a ride in Q3. Wonder how it would be if the Mercs were in the mix.', 'Can’t wait to see the ghost-car video for this one.', 'Glad we got to see it before the new regs next year. We missed out 2019-21, especially with no W11', 'This McLaren suit is clean', 'So...69 seconds?\n\nEDIT: 69.96', 'I’m so stoked we finally got the 1:09 in Monaco in real life. Not that it really matters but it’s been pretty close a few times and I was hoping it’d happen before the speeds get nerfed again next year.', 'Man, insane final sector from him. Credit where credit is due']",18611,495,0.96,18611,30348,30348,359,5,0.0,359
1kueaf1,[Autosport] Lewis apologised to Max for the impeding incident after Monaco GP qualifying,https://www.reddit.com/r/formula1/comments/1kueaf1/autosport_lewis_apologised_to_max_for_the/,2025-05-24, Social Media,[https://www.instagram.com/p/DKCpWAINdi7/](https://www.instagram.com/p/DKCpWAINdi7/),"['Max: “Ferrari comms?”\n\nLewis: “Ferrari comms.”', 'Lewis: ""I\'m really sorry about the impeding Max. It\'s just Ferrari...""\n\n\nMax: ""Say no more, you got my deepest sympathy""', 'No matter whatever happened between these two, I am really happy to see that there is respect. Thats what you call maturity', '""Ferrari?""\n""Ferrari :(""\nNods in pity.', 'Even Max feels bad about what Lewis has to put up with', 'Max is quite used to being the Emotional Support Rival to a Ferrari driver, might as well be so to the other one too', 'If Max was at Ferrari, he would’ve bought out his own contract and retired by now.', 'Ferrari communication as useless as ever man... Probably be the standard 3 place grid penalty and my hopium of lewis podium is officially dead', 'What was said on the radio?', '“Wait till you see the radio”']",16621,378,0.98,16621,40479,40479,300,7,0.0,300
1kudz1u,Lando Norris takes pole position for the 2025 Monaco Grand Prix,https://www.reddit.com/r/formula1/comments/1kudz1u/lando_norris_takes_pole_position_for_the_2025/,2025-05-24, Qualifying,,"['It’s Norris\n\nIt’s Leclerc\n\nIt’s Norris\n\nIt’s Leclerc\n\nIt’s Norris', 'Monaco qualifying.\n\nNothing like it.', 'We got 78 laps of delicious Ferrari strategy ahead of us to get that double podium', 'Qualifying has been mental this year. What an ending. So close for Charles but Lando was just absolutely on it there. Oscar too, fine margins once again.', 'My heart', 'Hadjar 6th in Vcarb. He is the most underrated driver on the grid at the moment.', '....Hadjar right behind Max \n\nmost impressive rookie by a huge margin', 'Clutch stuff by both LEC and NOR', 'Q3 was one of the best quali sessions in a long time.', 'Holy shit, fair play Lando, that was amazing \n\nAbsolutely stunning quali']",10982,1162,0.95,10982,36009,36009,114,1,0.0,114
1ku9ghv,For The First Time Since The 2023 Mexican GP The Same Driver Has Topped All 3 Practice Sessions,https://www.reddit.com/r/formula1/comments/1ku9ghv/for_the_first_time_since_the_2023_mexican_gp_the/,2025-05-24, Statistics,It's been 574 days since we have seen the same driver top all 3 Practice sessions in the same weekend when Max Verstappen topped all the practice session of the Mexican GP in 2023. He went onto qualify 3rd and the win the race ,"['Sharl, please don’t do that, don’t give me hope', 'I have never been less convinced a driver will get pole.', 'Can you overdose on Hopium ?', 'ready for heartbreak in around 3,5 hours', 'So does he get screwed out of a win by traffic in quali or strategy in the race? Place your bets', ""It's the hope.. it is as sweet as it is painful.."", ""Stop Charles the foreplay can only be so good, ffs please don't let this be a mirage"", 'Mexico 2023 for reference:  \nPractice sessions:  \n\\- P1: **Leclerc**  \n\\- P2: **Leclerc**  \n\\- P3: **Leclerc**\n\nQualifying:  \n\\- Q1: **Verstappen** (Leclerc +0.302)  \n\\- Q2: **Leclerc**  \n\\- Q3: **Leclerc** (Pole)\n\nRace: **Verstappen**  \nLap 1: ""On the first turn of the first lap,\xa0Sergio Perez\xa0turned into Leclerc, resulting in Pérez\'s retirement and damage to Leclerc\'s endplate.""  \nLap 5: ""On lap 5 Leclerc\'s endplate came off at turn 1 which led to a short\xa0virtual safety car\xa0(VSC) period in order to allow for the marshals to remove the debris from the circuit safely.""  \nLap 71: Leclerc finished in 3rd.\n\nPost-race:  \n""After the lap-one crash between Pérez and Leclerc, a fan started an altercation between other fans. The instigator was ejected from the venue and given a **lifetime ban**.""', 'I have faith in Charles, I do not have faith in Ferrari pulling off two pit stops.']",9919,206,0.97,9919,10673,10673,43,0,0.0,43
1kugkgv,Lewis Hamilton penalized with a 3-grid position,https://www.reddit.com/r/formula1/comments/1kugkgv/lewis_hamilton_penalized_with_a_3grid_position/,2025-05-24, News,,"['""Verstappen pushing behind, 3 seconds""\n\n""Sorry, he\'s slowing down now, watch the mirrors"" \n\nWildly conflicting messages one after the other.\n\nLiterally all Adami had to do was leave it at the first message and let Lewis handle it, he said what he needed to say, all the second message did was confuse Lewis. \n\nMonaco of all places you don\'t want to be fucked about with traffic.', 'Two radio blunders in three years of Monaco \U0001fae0', 'Really unfortunate for Lewis, poor way to lose 3 positions at a track like this.', 'Absolutely ruined any chances of Ferrari being able to do anything strategy wise for Charles… how they look at their radio communications this year and don’t see about a million issues is beyond me.', 'Unfortunate.\n\nThat moves Verstappen up to the second row.  \nNorris-Leclerc  \nPiastri-Verstappen\n\nCould be an interesting start tomorrow (there will not be)', 'The Ferrari pit lane curse has caught up to Lewis. Forza Ferrari backwards!', 'I think I’m about to apply to be his engineer, their standards don’t seem higher than what I could do. \n\n“Lewis move over, Max coming up fast.”\n\n\nThe end. \n\nLewis wasn’t on a push lap, if you had the even the slightest idea that Max was on one, which he clearly was, why even tell him “wait he’s going slow.” Just let it play out the way you first called it, and if you’re wrong at least you waited a couple seconds to see the situation through.', 'One normal day of Scuderia Ferrari…impossible', 'Fuck sake.']",5919,682,0.98,5919,15978,15978,166,10,0.0,166
1ku6rg1,I don’t think this is how the Tecpro is supposed to work?,https://www.reddit.com/r/formula1/comments/1ku6rg1/i_dont_think_this_is_how_the_tecpro_is_supposed/,2025-05-24, Technical,Monaco Porsche Supercup qualy accident,"['Thought that was the safety car 🤣', ""That's a strange one. He really got it right in there.\n\nhttps://i.imgur.com/PVD8lSD.png"", 'Thought Bernd Maylander had a stinker for a sec there 😂', 'Well..... It stopped the car.', 'This actually happened to me when I was karting, I took too much speed going down a hill into a left turn and crashed into the tyre wall, which wrapped around me sort of like this lol', 'Oh man, forgot about the Supercup.', 'is that coolant or fuel leaking?', 'Tecamateur.', 'is that an aramco car kissing an aramco barrier?']",4326,112,0.98,4326,6609,6609,27,1,0.0,27
1kueipr,[Autosport via IG] Isack Hadjar's P6 is his best qualifying result so far in F1,https://www.reddit.com/r/formula1/comments/1kueipr/autosport_via_ig_isack_hadjars_p6_is_his_best/,2025-05-24, Social Media,,"['He just keeps getting better and better as this season wears on. His pace and ability to get the max out of this car as a rookie says allot about him as a driver.', 'Presumably starting P5', 'Best rookie so far', 'Boy is a talent. Makes me wonder will he be the one to break that curse next year?', 'Amazing results. Rookie of the year so far!', ""That's my ROTY right there"", 'he’s a rookie to look out for, I wonder if he’ll stay until he’s the number 1 driver for the senior team or move to alpine (hopefully not). They seem to not be taking him for granted atleast right now.', 'Hadjar the Goat', 'And at the track where it matters a lot. Well done, Isack.', 'Le petit Prost does it again']",4183,185,0.99,4183,4920,4920,99,3,0.0,99
1kudyyu,Lewis Hamilton has outqualified Carlos Sainz for the first time in 5 races,https://www.reddit.com/r/formula1/comments/1kudyyu/lewis_hamilton_has_outqualified_carlos_sainz_for/,2025-05-24, Statistics,,"['Are we gonna do this now for the rest of the season?', 'Are we getting Lewis and Sainz comparison till end of season?', 'Everytime this stat gets updated, the jpeg gets worse lmao', 'So I guess Sainz will finish the race ahead of Lewis for the first time in 5 races? Lol', ""I'm enjoying this banter hahaha"", 'this whole tit for tat posting is getting real annoying lol', 'Lol people only got sick of this bit when Sainz ended up on the receiving end of it', 'Lmao is this going to be a thing for the whole season?', 'Oh, so now people are tired of these posts']",3825,119,0.95,3825,4551,4551,67,0,0.0,67
1kug12z,"Q: “Would you be ready to sacrifice yourself to help your teammate to win?” | Oscar to LN: How much are you gonna pay me?” | Lando: ""Charles just told me he would help Lewis get the win""",https://www.reddit.com/r/formula1/comments/1kug12z/q_would_you_be_ready_to_sacrifice_yourself_to/,2025-05-24, Video,,"['The forced laugh by Oscar for 10 seconds to think what to answer 🤣', 'Like starting softs to get a jump on Charles and then hold him up? That’s what Charles did for Carlos a couple of years ago.', ""One of the more dumb questions I've heard for a while, they're the two main contenders they are NOT sacrificing a.race.to help lmao"", 'such a dumb question btw', '""Of course, I will create a DRS train and give Lando free pit stops.""\n\n Is this what the reporter expected the **championship leader** to say? Dumb.', 'The F1 media desperately wants a soap opera.', ""This is such a bad question and I low key think it's disrespectful since Oscar's still leading the championship??? Why would he sacrifice his race for Lando to jump ahead of him right now?"", 'They’re competing for wdc, wtf is this question, it’s like asking a competitor to let his opponent win', 'What kind of a idiotic question is this..?', 'Absolutely diabolical question lmfao.']",2697,118,0.99,2697,5346,5346,88,2,0.0,88
1kui08c,Starting grid after the penalties,https://www.reddit.com/r/formula1/comments/1kui08c/starting_grid_after_the_penalties/,2025-05-24, Statistics,,"['Hadjar is going to have a tough time where he is, 2 world champs behind him and a world champ and current leader in front of him, talk about pressure!', 'Hadjar P5 is WILD', 'They really dropped the ball with Alex - huge missed opportunity', 'Really wanted to see Max and Hamilton side by side tho', 'Hadjar looks set to be rookie of the year', ""Four very highly competetive drivers on the front rows, it's gonna be interesting to see what happens in turn one."", 'Despite the grid penalties Stroll remains in the exact same place he qualified in. Not even grid penalties can stop the legend', 'Seen enough, throw Hadjar into the Red bull', 'Lewis is caught in some kind of Final Destination relationship with P7. No matter what, he is always there.']",2489,229,0.99,2489,216,216,144,5,0.0,144
1kudibg,"For the first time since Imola 2022, neither Mercedes has reached Q3",https://www.reddit.com/r/formula1/comments/1kudibg/for_the_first_time_since_imola_2022_neither/,2025-05-24, Statistics,,"['What a track to do it on 😂😂', 'Engine issues are so rare nowadays', 'I like that you waited after Q2 ended to post this, just in case the 2 dead Mercs had a chance to make it', 'This tripple Header is cursed and i want it to end asap/s \n\nAt Lears the weeyums and hadjar are performing good, so I take that at least….', 'I can picture the DTS ep about their woes already.', 'Surely this is the lowest point of the season and Mercedes will be back fighting for podiums after the Spain upgrades/TD', ""They could almost drop to 4th in the constructors? This is a huge disappointment. Sucks for Russell he's been so consistent."", 'Thanks Crofty.', 'That Imola was crazy… Max lapping Lewis after all the drama in 2021. Disaster from Merc']",2424,41,0.99,2424,1398,1398,58,0,0.0,58
1kuefj6,(CrashNetFormula1 IG) - Norris gets first McLaren pole in Monaco since Alonso in 2007,https://www.reddit.com/r/formula1/comments/1kuefj6/crashnetformula1_ig_norris_gets_first_mclaren/,2025-05-24, Social Media,,"['McLarens finished 1-2 in that race and by the time they came round to the finish line on lap 78, everyone was lapped except Massa in 3rd, who was driving up the hill to Massenet at the time.\n\nTotal domination.', 'The fact that both Hamilton and Alonso are still on the grid is wild.', '2 McLarens and a Ferrari as well', 'Amazing lap. Norris really has great speed.', 'LeClerc is going to push him hard. Will be a good race.', 'Ah, my favorite driver, Puma F. Massa', 'I almost forgot alonso was married... the ring...', 'Der vettel Finger', 'Possible lando win in monaco tmrw after this long ass drought and fraud allegations on his ass…I will be there.', ""I would not want LeClerc behind me in Monaco lol. Especially if I had a habit of losing the pole advantage before turn 1. \n\nIt was a great fucking lap. Let's hope he can do something with it tomorrow.""]",2001,55,0.97,2001,1284,1284,51,0,0.0,51
1ku3x6v,[BBC Sport] Adrian Newey says Aston Martin's F1 ambitions will be hampered by 'weak tools',https://www.reddit.com/r/formula1/comments/1ku3x6v/bbc_sport_adrian_newey_says_aston_martins_f1/,2025-05-24, News,,"[""Newey:\n>\tIt's fair to say that some of our tools are weak. Particularly the driver-in-the-loop simulator needs a lot of work because it's not correlating at all at the moment, which is a fundamental research tool. Aston Martin would need to sort out a plan to get it where it needs to be, but that's probably a two-year project in truth"", 'I love how political Newey is without lying:\n\n“I think Lance is much better than people who\'ve been very poor.""', '2 year project 💀 Feel bad for Alonso, probably means he’s gonna be stuck with a midfield car for the next couple years.', 'That’s a rude way to describe Lance Stroll', ""Ooof airing out this publicly means either there is a plan to resolve it, or more likely he's saying some part of the team aren't taking it seriously, until boss Stroll senior sees it in the media.\xa0\n\n\nIf Stroll sr gives backing to Adrian - those people reluctant / complacent / underperforming will be pushed to adjust posture or be sent overboard & simulator gets a big budget adjustment.\xa0"", 'Is he taking about the people or the equipment lol /s', ""Oh boy... If they don't nail the car and Honda doesn't nail the PU next year, this should be it for the Strolls"", 'He could’ve been at Ferrari figuring out what’s wrong with their process rn damn', '*""When I get into a period of intense concentration I tend to not see left and right. All my processing power is going into the one area, which is trying to work with everybody to design a fast racing car.""*\n\nHe is locked in though']",1827,214,0.98,1827,8251,8251,3,0,0.0,3
1kuf15f,2025 Monaco GP Qualifying Gaps Visualized [via justformulacar],https://www.reddit.com/r/formula1/comments/1kuf15f/2025_monaco_gp_qualifying_gaps_visualized_via/,2025-05-24, Technical,,"['Ultimately I still feel like I have zero clue how anyone’s going to place with the pit stop shenanigans', 'Leclerc being disappointed is absolutely valid...but he did a great job splitting the McLarens and got his best qualifying position this season. He can be proud of being so consistently good on this track.', ""Monaco is slow as hell so big gaps don't look as huge as they do at other tracks. +.428 is 38.0 metres @ 320 km/h vs 29.7 metres @ 250 km/h for example."", 'Max: 🔭', 'Never thought we have much big gap between P3 and P4, then P4 to P5 so on actually this year, especially in Monaco.\n\nOkay, it probably due to Merc which completely shit their pants this weekend, Max is saved by it. Otherwise, he might be P7 or something cuz he didn’t run his second try properly.', ""I wish they'd flip the overhead shot by 180 degrees to have the 1st place car at the top. Seeing the winner on top makes more sense. Not sure when this change started but that used to be the norm from what I recall. Yes, I'm an older F1 fan..."", 'Can anyone explain how to calculate the distance between the gaps shown here?', 'Lewis’s quali pace is bad man, I was hoping/wishing he’d be a 0.1 behind Leclerc. His sector 3 was bad.', 'Now the Hadjar-Alonso gap']",1588,55,0.99,1588,1377,1377,51,1,0.0,51
1kulsef,"With Russell out in Q2, There only three drivers with 100% attendance in Q3 this season",https://www.reddit.com/r/formula1/comments/1kulsef/with_russell_out_in_q2_there_only_three_drivers/,2025-05-24, Statistics,https://www.instagram.com/p/DKDGmofycfu/?igsh=YzljYTk1ODg3Zg==,"['Why is it, when something happens, it is always you three?', 'Was confused by the Portuguese for a second there...', ""You can't escape PIANORVER"", 'lewis was out in miami, charles last week and george today… who’s next?', ""I'm still impressed that bottas did 100+ Q3 in a row."", '“Does he have brown hair?”', 'Can someone Photoshop in the black marker pen of death here? Only then will I believe it..', 'Technically the truth, but it’s harsh to blame George for today’s engine failure', 'Shows how consistent Bottas was']",1588,42,0.99,1588,37,37,188,0,0.0,188
1kue1pn,[Scuderia Ferrari via IG] Front row in Monaco! What a lap by @charles_leclerc,https://www.reddit.com/r/formula1/comments/1kue1pn/scuderia_ferrari_via_ig_front_row_in_monaco_what/,2025-05-24, Social Media,,"['He gave everything. Such a shame but great lap from Lando.', 'Charles in Monaco goes to another level, even as a elite qualifier he already is', 'This gets filed with Sakhir 2020 in the folder of stunning Charles Leclerc non-pole laps', 'All planned for the undercut on Lando tomorrow', 'Very strong session for both considering the pace of that car this year, could get a huge haul of points', 'So close to pole. Let’s hope the two stopper can bring anything. Although Ferrari attempting to build a strategy around it scares me.', ""Pipped one of the rocketships, can't really ask for more. 1 tenth off."", 'Prince of Monaco drove like crazy', 'Did everything perfect tbh.', 'Come on Charles!']",1497,122,0.98,1497,2127,2127,13,0,0.0,13
1ku9wgs,Charles Leclerc has led 7 of the last 7 sessions in Monaco: • 2024 FP2 - Leclerc •2024 FP3 - Leclerc • 2024 Quali - Leclerc • 2024 Race - Leclerc • 2025 FP1 - Leclerc • 2025 FP2 - Leclerc • 2025 FP3 - Leclerc,https://www.reddit.com/r/formula1/comments/1ku9wgs/charles_leclerc_has_led_7_of_the_last_7_sessions/,2025-05-24, Statistics,,"['I know I’m setting myself up for heartbreak but I BELIEVE', ""It's like he grew up there"", 'Stop it, I’m inhaling too much hopium', 'p11 gonna hit like crack', 'Those pit stops are gonna hit like a meteor', 'Does he run these streets?', '# Leclerc', 'Great. You just HAD to jinx it by pulling up the stats.', ""I think Ferrari always kind of parties through the first half of the season and they are like 'Eureka' and then we see Ferrari topping the charts with wins and podiums. This looks like a similar sign. But most of all, I hope this guy can produce an impressive quali.""]",1447,55,0.98,1447,1091,1091,7,0,0.0,7
1kucten,Verstappen on being impeded by Hamilton,https://www.reddit.com/r/formula1/comments/1kucten/verstappen_on_being_impeded_by_hamilton/,2025-05-24, Video,,"[""Hamilton's engineer told him on the radio that Max was slowing down. 😂"", 'Ferrari masterclass', 'Engineer fucked him', 'Peak Ferrari communication', 'Seriously Ferrari? Just pay a fk ton of money and hire Peter Bonnington!', 'That Ferrari radio though. Sigh', 'Ferrari moment', 'ferrari are such clowns its unbelievable', ""Mistake by Hamilton's race engineer"", 'Can’t really see how Hamilton avoids that one. Bad luck\n\nEdit: lol just heard the team radio, his engineer is fucking useless']",1418,332,0.96,1418,10636,10636,20,0,0.0,20
1kueays,Here's how the grid will line up tomorrow for the Grand Prix,https://www.reddit.com/r/formula1/comments/1kueays/heres_how_the_grid_will_line_up_tomorrow_for_the/,2025-05-24, Statistics,,"['Ocon at p8? \n\n\\*what da hell is a polar bear doing in arlington texas\\*', 'BREAKING\xa0\nMonaco GP raceresults LEAKED one day before the race.', 'hopefully yuki does not touch sainz again', 'Greatest Merc quali disaster in the history of qualies, maybe ever.', ""All McLaren and Ferrari front two rows. We're back to 2007!"", 'Hadjar along with Max is funny for some reason lol', 'Racing Bulls really cashed in their chance. Williams would feel this was a big miss.', 'Also, great result for Liam! Must give a big confidence boost.', 'I wonder what Aston Martin will do to get Alonso out of the points this time.']",1415,200,0.92,1415,4189,4189,28,2,0.0,28
1kufzsi,"Alonso happy on radio after Q3: ""I love driving""",https://www.reddit.com/r/formula1/comments/1kufzsi/alonso_happy_on_radio_after_q3_i_love_driving/,2025-05-24, Video,,"[""If Nando doesn't get points tomorrow ... I'm going to eat an extremely delicious sammich ... to make me feel better."", 'please keep the old man happy tomorrow too, strategy team', ""We're so back. We love to see a happy Fernando"", ""Only happy radio exchange I've heard from Nando's radio all weekend."", 'Imola: This is gonna be a torture\n\n(6 days later)\n\nMonaco: I love driving!', 'Right F1 gods, give him his third WDC so we can all watch him retire with a smile on his face', 'Happy Alonso best Alonso', 'Fabulous job by him and Aston today', 'My man is never going to retire!', 'Watch Aston give him an awful strategy tomorrow, followed by people banging on about Stroll being better becuase they were dying to see anything negative happen to Alonso\xa0']",1362,61,0.99,1362,2114,2114,39,0,0.0,39
1kufz61,"Max on if he thinks Lewis will get a penalty or not: ""If you look at the history of things yes, but again you know its more the team's fault but unfortunately in quailyfing ofc normally they are quiet strict on these things""",https://www.reddit.com/r/formula1/comments/1kufz61/max_on_if_he_thinks_lewis_will_get_a_penalty_or/,2025-05-24, Video,,"['I mean, Adami gave terrible instructions, however this is always punished like this so it is pretty slam dunk penalty', 'Well rules are rules. Max may sympathize with Lewis but the grid drop seems inevitable.', '""No, but definitely yes.""', 'While max sympathizes with Lewis personally in it not being Lewis fault, technically F1 is a constructors competition with a side driver competition for fun. (All the prize money is in the WCC) \n\nIt’s a team effort and the team as whole needs to be penalized else teams could use “forgetting” or “accidentally” sharing incorrect info in qualy to force impeding incidents.', 'In fairness, you can’t withhold a penalty because the team messed up and not the driver. At the end of the day, they’re one in the same and it unfortunately is the driver’s responsibility to take the penalty even with bad radio direction', 'Ferrari doing usual Ferrari things', 'That might be one of the most verstappen quotes I’ve heard in a long time. Love how it comes across perfectly through text', ""Hamilton was close enough to the demon Leclerc in Monaco he just needs to keep learning the car and hopefully keep closing in\n\nhonestly didn't expect him to be doing that well relatively, who knows how much more is possible as the season goes on"", 'Most impeding mistakes are the mistake of a race engineer anyway, aren’t they?', 'Can the FIA hurry up a bit, my F5 key is overheating.']",1174,69,0.98,1174,1824,1824,49,0,0.0,49
1ku9pn3,FP3 Classification - Monaco Grand Prix 2025,https://www.reddit.com/r/formula1/comments/1ku9pn3/fp3_classification_monaco_grand_prix_2025/,2025-05-24, Statistics,,"['will verstappen use medium if he gets to q3?', ""I'm ready to get hurt again"", 'Everyone gonna say something like ‘P7 has never looked so good’ so I’m gonna buck the trend\n\nCHARLES 2025 WDC CHARGE STARTS HERE', 'What happened to the Astons? Imola quali looked like they fixed the car.', 'Say it quietly but Lawson has been quick all weekend', 'All medium quali LETS GO LADS. The C6 tyres are garbage!', ""McLaren's not dominating practice at all is definitely interesting. It's normally what they do is gap the field by 0.4 secs in practice and then it's closer in quali. Maybe they'll really struggle here. Which I'm surprised by because I thought it'd play to the McLaren strengths. \n\nQuali is also gonna have someone getting screwed from traffic or a red flag. Which will obviously suck for them, but the chaos will be fun."", ""Praying that Lewis didn't damage gearbox,but I saw somewhere that there isn't penalty for gearbox change (although I don't believe in that)\xa0"", 'Colapinto getting more on terms with other cars is a good sign. Red flag infringement is not though…']",1144,160,0.99,1144,2690,2690,-2,1,0.0,-2
