unique_id,post_heading,post_url,publish_time,tag,post_content,top_comments,upvotes,comments,upvote_ratio,score,total_upvotes_comments,total_score_comments,upvotes_growth_rate,comments_growth_rate,upvote_ratio_growth_rate,score_growth_rate
1kud1rn,George Russell has lost power - session red flagged,https://www.reddit.com/r/formula1/comments/1kud1rn/george_russell_has_lost_power_session_red_flagged/,2025-05-24, Video,,"['2 PU related issues in back to back races for Merc for probably the first time in the hybrid era.\n\nEdit: Imola was throttle issue for Kimi.', 'The worst race to have a qualifying like this', 'Bad day for Merc', 'Mercedes is cooked this weekend already. Not even race day yet.', 'Huge opportunity for the midfield teams to qualify high with 2 mercs out', 'What a disaster Saturday for Mercedes', 'Mercedes wtf has happened in two races', 'What a weekend for Merc', ""p14 p15. their worst, and it's in monaco"", ""What a disaster for Mercedes, they'll need a miracle to even score points tomorrow""]",996,141,0.99,996,2754,2754,8,0,0.0,8
1kuahsz,Franco Colapinto risks major penalty after Lewis Hamilton red flag,https://www.reddit.com/r/formula1/comments/1kuahsz/franco_colapinto_risks_major_penalty_after_lewis/,2025-05-24, News,,"['Remember when McLaren got a 200+ grid penalty one time', 'Damn this weekend has more penalties before even Quali', ""Where's he gonna start from? Nice?"", ""What's a 10-grid penalty when you're starting 20th anyway?"", 'I’ve seen enough, bring back Latifi.', 'Damn the people who avoid penalties will start from P10 as It seems', 'No further action.\n\n>The\xa0Stewards\xa0reviewed\xa0positioning/marshalling\xa0system\xa0data,\xa0telemetry,\xa0video,\xa0timing, team\xa0radio\xa0and\xa0in-car\xa0video\xa0evidence\xa0and\xa0determined\xa0that\xa0Car\xa043\xa0overtook\xa0Car\xa018 after\xa0Turn\xa011\xa0after\xa0the\xa0session\xa0was\xa0red\xa0flagged.   \nWhen\xa0the\xa0overtake\xa0happened\xa0after\xa0the\xa0red\xa0flag\xa0signal\xa0was\xa0given\xa0for\xa0the\xa0session,\xa0the marshall’s\xa0post\xa0to\xa0the\xa0right\xa0of\xa0Car\xa043\xa0was\xa0still\xa0showing\xa0a\xa0blue\xa0flag\xa0and\xa0the\xa0light\xa0panel had\xa0displayed\xa0a\xa0blue\xa0signal\xa0and\xa0only\xa0subsequently\xa0switched\xa0to\xa0red.   \nWhen\xa0the\xa0red\xa0flag\xa0was\xa0ultimately\xa0shown\xa0on\xa0the\xa0panel,\xa0Car\xa043\xa0took\xa0immediate\xa0steps\xa0to slow\xa0down\xa0significantly\xa0and\xa0proceeded\xa0slowly\xa0back\xa0to\xa0its\xa0pit\xa0as\xa0required\xa0under\xa0Article [2.5.4.1](http://2.5.4.1)\xa0b).\xa0This\xa0was\xa0clearly\xa0reflected\xa0in\xa0the\xa0telemetry\xa0as\xa0well.   \nAt\xa0the\xa0time\xa0that\xa0the\xa0light\xa0panel\xa0went\xa0red,\xa0the\xa0distance\xa0between\xa0the\xa0two\xa0cars\xa0was\xa0only 30\xa0metres\xa0and\xa0there\xa0was\xa0a\xa0considerable\xa0speed\xa0delta\xa0between\xa0the\xa0two\xa0cars.   \nWhile\xa0it\xa0is\xa0correct\xa0that\xa0Car\xa043\xa0overtook\xa0Car\xa018\xa0after\xa0the\xa0red\xa0flag\xa0signal\xa0was\xa0shown,\xa0it is\xa0clear\xa0that\xa0this\xa0was\xa0due\xa0to\xa0the\xa0momentum\xa0of\xa0the\xa0car\xa0and\xa0the\xa0relative\xa0distance.\xa0  \nCar 43\xa0took\xa0all\xa0reasonable\xa0steps\xa0to\xa0slow\xa0down\xa0immediately\xa0and\xa0appropriately\xa0when\xa0the\xa0red flag\xa0was\xa0in\xa0fact\xa0displayed.   \nIn\xa0the\xa0light\xa0of\xa0the\xa0above\xa0clear\xa0evidence\xa0of\xa0the\xa0steps\xa0taken\xa0by\xa0the\xa0driver\xa0of\xa0Car\xa043\xa0to slow\xa0down,\xa0we\xa0did\xa0not\xa0consider\xa0it\xa0necessary\xa0to\xa0summon\xa0the\xa0driver\xa0and\xa0we\xa0accordingly took\xa0no\xa0further\xa0action.', ""Bortoleto also got in Max's way yesterday; he even asked the team to warn him beforehand about drivers coming on fast laps. Idk if it's a coicidence that rookies are having these problems, they already race at monaco on F3 aand F2."", ""What's he at penalty points wise? Any more than the 2 from Mexico last year?""]",891,168,0.93,891,3367,3367,3,3,0.0,3
1kug6e4,[Mclrean]must be something in the white suits,https://www.reddit.com/r/formula1/comments/1kug6e4/mclreanmust_be_something_in_the_white_suits/,2025-05-24, Social Media,https://www.threads.com/@mclaren/post/DKCudbOiA75?xmt=AQF0l1PdoWhlUYY4tbQggOoLSHkDy9ZSsq-trgwzKPKr8Q,"['1000 yard Ferrari stare', 'Must be the suits', ""Charles can't force a smile"", 'Horner already calling for an investigation of the white suits', 'I want that blue ferrari hat 😩', 'must have been chomping at the bit to post this while misspelling McLaren that badly', '😑🙂😀\n\nCharles aint happy', ""The white suits are a very nice look for all three, especially the Leclerc's."", 'That Mclrean team is pretty good', 'Mclrean getting pole as a new team on the grid is nothing short of incredible.']",887,35,0.97,887,980,980,22,0,0.0,22
1kuecqh,Fernando Alonso has now outqualified Lance Stroll for the 20th time in a row,https://www.reddit.com/r/formula1/comments/1kuecqh/fernando_alonso_has_now_outqualified_lance_stroll/,2025-05-24, Statistics,"This stat does not include sprint qualifying, only saturday qualifying","[""Surprised its only been 20\n\nDid he have a mechanical issue 21 quali's a go?"", 'Somehow Stroll will finish P9 as Alonso has a DNF.', 'They will mess up the pit stops, like always. ☹️', 'Still no points this season. Life is unfair.', 'How many points has he got though? /s', ""If it were the other way around I'd be worried."", ""So you're telling me that Lance is due?\n\nI'm off to the bookies"", 'Nature is restoring?\xa0\n\n\nOr Stroll 2026, 2027, 2028 WDC?', 'I wish my dad could buy me an F1 team.']",886,77,0.97,886,941,941,17,0,0.0,17
1kuaws5,No Further Action on Franco Colapinto for overtaking under red flags,https://www.reddit.com/r/formula1/comments/1kuaws5/no_further_action_on_franco_colapinto_for/,2025-05-24, News,,"['Reading this thread and the Sainz thread is hilarious.', 'For anyone who has seen the video of the infringment it should have been obvious\n\nI fully expected them to fuck it up though and maintain it though. Two ""no punishments"" under red flags is unusual. \n\nReading this thread and then the Sainz thread is funny though', 'Why does the FIA not like Bearman? /s\n\nEdit: added the /s', ""A lot of people in this comment section didn't saw the video."", '[Video of situation](https://imgur.com/a/QURMOIx)', 'The hate for colapinto is real. Holy shit', ""Redditors angry that the British driver that chose to not slow down under a red flag got penalized and the Argentinian one that did slow down didn't."", 'FIA afraid of death threats lol', 'Clearly the FIA favours Argentina over the UK!']",814,132,0.95,814,2140,2140,6,0,-0.010000000000000009,6
1kueb2t,[@HaasF1Team] A HUGE Qualifying from Esteban at a track where it matters most,https://www.reddit.com/r/formula1/comments/1kueb2t/haasf1team_a_huge_qualifying_from_esteban_at_a/,2025-05-24, Social Media,,"['He and his engineer were absolutely giddy on the radio. Love to see it', 'Estie bestie is different class at monaco', 'Him laughing through Q2 was fucking awesome lmao', 'All these comments, and not a single one with a Haas tag😤😤', 'Haasterclass!', 'The Haas is the most inconsistent car on the grid. It looked like a Q1 exit all weekend.', 'ESTIE BESTIE!!!!!!!!!!!', 'ESTENBA STRIKES AGAIN', 'So glad to see him getting more performance in quali, especially at Monaco where confidence in the car is key!', 'That was excellent work by Ocon and the team. Showed great pace.']",777,50,0.97,777,932,932,8,0,0.0,8
1kuqzkv,Isack Hadjar will be the first driver to start in the top 5 in Monaco during his first season since his idol Lewis Hamilton did in 2007,https://www.reddit.com/r/formula1/comments/1kuqzkv/isack_hadjar_will_be_the_first_driver_to_start_in/,2025-05-25, Statistics,,"['All the more reason I hope he delays his opportunity at the Red Bull senior team as long as possible. \n\nHe’s so good at the moment, I’d hope he firmly establishes himself in the grid before going into the pressure and challenges that Red Bull puts on the second seat.', 'He doesn’t get enough love. He’s really great.', 'Isack is fast becoming a favourite of mine on the grid if not for the fact he fan boys over Lewis (much like myself) but he’s actually doing a stellar job behind the wheel. And he’s sticking it to the old fart Helmut too after his disgusting comments the first weekend of the season.', 'Kimi gets all the hype but Hadjar has been a better rookie than Kimi', 'Best rookie this season', 'With some shenanigans he could win. 🤞', ""Man, I'll be the first to admin I didn't like this guy at first, and I have the post history to prove it.  His F2 monaco outing last year really rubbed me the wrong way, but that was my only experience with him until F1. \n\n  \nAfter seeing him passionately fight this season, and seeing his results... I'm really enjoying this kid."", 'Poor Lawson\xa0', 'how do guys even come up with these hyperspecific ""stats""?']",889,26,0.98,889,24,24,343,3,0.0,343
1kueeb8,"If McLaren wins tomorrow, it will be their first victory in Monaco since 2008",https://www.reddit.com/r/formula1/comments/1kueeb8/if_mclaren_wins_tomorrow_it_will_be_their_first/,2025-05-24, Statistics,,"['The chrome Mclarens are so unbelievably sexy', 'The MP4-23 looks so fucking good', ""God the 2008 cars still look so incredibly futuristic af, ultramodern and advanced. Hamilton's McLaren there looks like something out of a space faring science fiction series. Just oozes cool."", 'These are still the most futuristic looking racing cars ever made. 2007-2008 was incredible.', 'Leclerc victory it is then.', 'Don’t jinx the lad', 'MP4-23 MY BELOVED <3', ""That 2008 rookie at McLaren was quite good. Anyone know if he's managed to get his first pole yet?"", 'If Lando can execute the start and execute the race strategy, its there for them to take. Adding that second stop will be fascinating to see play out.']",761,61,0.95,761,619,619,23,1,0.0,23
1ku78pe,"Newey on Aston Martin F1 attracting Verstappen: ""There's no point in pipe-dreaming""",https://www.reddit.com/r/formula1/comments/1ku78pe/newey_on_aston_martin_f1_attracting_verstappen/,2025-05-24, News,,"['Newey knows he needs to get the car to some level first.', 'Newey knows he won’t go to Aston unless the car is good enough. Newey knows Aston are too far away from being able to make a car that is good enough to attract Max.', 'Verstappen isn’t going anywhere. It’s very obvious apart from the media hype', ""Max is there to win. Until Aston gets their shit together, there's no point bringing these things up.\n\nMax has a higher chance of moving to Mercedes, than AM."", 'Based on what Max actually says, I think his next move, whenever that is, will be to a different series or other area of racing. Marko plays an important role, too.', 'Max will leave F1 after 2028 and will focus on family, WEC and redline.', ""I'm pretty sure, if the car is looking good or has potential for being up there, he will tell max himself and max might consider it. nothing else"", ""After Adrian cooks up a 2026 masterpiece: Max and GP seen walking around in Silverstone begging for for Adrian's address.\xa0""]",704,113,0.98,704,1387,1387,3,-2,0.0,3
1kubjer,"[Andrew Benson] Ferrari say that after Lewis Hamilton's crash at the end of practice they changed the nose, front wing and right front suspension, and replaced the entire rear end, including gearbox, because this is a quicker procedure than simply changing the damaged right rear suspension.",https://www.reddit.com/r/formula1/comments/1kubjer/andrew_benson_ferrari_say_that_after_lewis/,2025-05-24, News,,"['Yeah better building a new one than forgetting to check something…', 'I beg them not to have changed the set up, asuming parts are like for like', 'they rebuilt the car like redbull did for tsunoda last weekend ?', ""Just when he looks like he'll be competitive in Monaco for the first time in years 🥀"", ""Good. Leclerc binned in Q3 and the driveshaft was damaged on the opposite corner. IIRC when Verstappen crashed in FP3 in 2018, they actually repaired the car and then found out the gearbox was toast when they fired the car up so he couldn't even run at all. Completely changing the whole rear end should rule out any drivetrain issues."", 'Hamilton pole incoming, since the Ferrari sometimes gets faster after damage.\n\nActually, I take that back, when Ferrari repairs it, like for Charles in Miami it doesn’t get faster. They should’ve just let Hamilton go with the damage.\n\nStill like 50-50 they’ve done something accidentally genius in the repair and the Ferrari will be a rocketship', ""Like a big lego toy. I'd do the same lol."", 'look at him struggle now. was actually looking good here in whole of ground effect cars', 'If they got everything finished before Q1, that’s incredible.']",656,38,0.98,656,918,918,3,0,-0.010000000000000009,3
1kugpyt,"What was the most memorable moment in your career? - max : the race in Brazil with the rain, very important race at the time..- Ocon : I wish you not there. - max :yea I know man sorry",https://www.reddit.com/r/formula1/comments/1kugpyt/what_was_the_most_memorable_moment_in_your_career/,2025-05-24, Video,,"['That fairy tale of a race. Gasly and Ocon put the shit Alpines on podium together', 'The Ocon and Verstappen relationship evolution is one of the fun narratives in this driver generation.', 'I thought he was talking about 2016 race and so I was a bit confused lol', ""In a bizarre timeline where Max Verstappen didn't exist we would have had an Alpine 1-2!"", 'It is crazy, that the question ""which one exactly"" is completely legit', 'Max should’ve said “I wish you weren’t there in 2018”', 'At first I was like Ocon talking the piss bc it didn’t rain in 2018', 'Ocon and Max in Brazil 2018 too', 'And then Max asking after the race where all of the English press were was the chefs kiss', 'He was talking about 2016 no?\n\nAs impressive as 2024 was as well']",661,27,0.97,661,129,129,19,0,0.0,19
1kua38v,[FIA] Car 55 - Alleged failure to comply with red flag in P2,https://www.reddit.com/r/formula1/comments/1kua38v/fia_car_55_alleged_failure_to_comply_with_red/,2025-05-24, Social Media,,"['Investigating it a whole day later lmfao the stewards are taking the piss', ""Somebody snitched on Carlos. He overtook Colapinto under red flag yesterday in FP2, and the footage was going around on social media. He wasn't even investigated for it, so I guess they had to do this after the penalty for Bearman, and the Colapinto summon for the same."", 'From YESTERDAY? Which racing god did he piss off? Carlos…Carlos please….the Williams double points streak.', 'This was on the straight after T1 which if he slowed down he will hit the car in front, but very similar to Bearman situation so I would not be surprised they said no mitigating circumstances again…', 'Someone had to have narked for them to issue this P2 violation effectively a day later, right? Or is it just a typo', 'What do they mean by Appendix, he doesnt have one', '""Do you know who my father is?""\n\n\n""Who do you think reported it to us?""\n\n\n💀', ""He pulled an Ollie after being Oille'd himself, just a different part of the track."", 'It’s gonna be a dog fight in the back between Bearman Colapinto and Sainz.  😈', 'A possible 10 place grid penalty']",639,86,0.98,639,1638,1638,-3,0,0.0,-3
1kuerz2,Ever since Tsunoda went to Red Bull his H2H with Lawson in qualifying is 3-3! When they were teammates the H2H was 10-1 advantage Tsunoda!,https://www.reddit.com/r/formula1/comments/1kuerz2/ever_since_tsunoda_went_to_red_bull_his_h2h_with/,2025-05-24, Statistics,"Obviously there is the context that Lawson was a mid season substitute in 2023, a mid season switch in 2024, and both were a mid season switch in 2025! But still... a horrible look on the Red Bull second seat!","['At this point, the second red bull shouldn’t even race. Just do five free practice sessions.', 'Are you sure that is yuki ? Looks taller 😅', ""That Red Bull doesn't even have a window.\n\nIf they keep this development policy and lose Max, they'll quickly turn into the last 10 years of Williams."", 'is this gonna be the new sainz vs hamilton stat', 'Standard 2nd red bull shenanigans, that car is eternally cursed, more impressed day by day Checo got wins in it lmao', 'What is this picture? Lawson looks like a baby, Yuki looks about twenty years older than he does now.', 'Both Yuki and Liam are faster in the junion team car than in the Red Bull so far.\n\nThat Red Bull is something else.', 'Besides cursing the defense against the dark arts teacher spot, did Tom Riddle also curse the second RB seat?', 'What about the actual races?']",548,161,0.92,548,1792,1792,16,2,0.0,16
1kugt7f,"According to the AirCargoItaly website, last week RedBull used a boeing 767 for shipping just 30 kilos worth of components, presumably urgently needed after Tsunoda's crash in Q1. The aircraft made 3 flights and had in total 5 hours of flight time to deliver those items in Imola",https://www.reddit.com/r/formula1/comments/1kugt7f/according_to_the_aircargoitaly_website_last_week/,2025-05-24, Technical,,"['Beyond the environment impact I can’t imagine the cost of using a plane that big for 30 kg worth of cargo', 'im assuming some carrier logistics people would have organized that and SkyTaxi was already carrying cargo for other destinations.', 'NETZERO', ""I can only assume (or hope) that there were other things on this flight too and they didn't use a 767 to only move 30kg of parts."", 'To anyone thinking they flew an entire plane with only 30kg of cargo, they didn’t. The plane would heave been flying anyway with other cargo on board.', 'I’m reusing my Starbucks cup while they casually fly in a small child’s worth of parts on a plane that fits over 200 passengers.', ""That's absolutely ridiculous."", 'There is no way Yuki has only 2.5 million in damages this year\xa0', 'So is this part of their catering budget?']",527,113,0.94,527,102,102,13,2,0.0,13
1ku9j5y,[FP3] Lewis Hamilton hit the barriers at Massenet,https://www.reddit.com/r/formula1/comments/1ku9j5y/fp3_lewis_hamilton_hit_the_barriers_at_massenet/,2025-05-24, Video,,"['Find it funny one of the biggest posters on here is called ""icumcoffee""', ""I don't see how you get out of crashing when you suddenly encounter cars going slow there. Braking is naturally going to make the rear swing out."", 'Ham going at fast pace, he reacted to slower cars ahead on a low-visibility bend (proactively avoids rear ending Kimi), which indirectly put him in dirty air. Lost grip, clipped the barrier. Better it happened in practice than\xa0in the race.', ""Ngl I don't see a situation where he's getting out of this either he hits kimi or the wall."", ""Can't really blame him. better to hit the wall than the other 2 cars there"", 'The stewards really should look into impeding here, that was incredibly dangerous...', 'was that a snap of oversteer or did he panic when he saw the cars ahead?', ""Looks like he tried to correct his trajectory to go around the slow cars ahead of him but was disturbed by their wake turbulence and lost control. I think he was either hitting the back of an F1 car, or the barrier. Damn if you do, damned if you don't."", 'He got out to check the gearbox immediately…oh god I hope it’ll be right for quali.', 'Yeah... reacted to the cars ahead of him.']",520,119,0.97,520,2530,2530,-1,0,0.0,-1
1kuh6b7,"Q: ""How much confidence did you have?"" | Lando: ""A reasonable amount, never gonna be full of it when Charles has been quickest in every session [..] it's Charles, Oscar. Max has been fast. Lewis has been quick. it's a good grid and competition from everyone so it always makes that little bit better”",https://www.reddit.com/r/formula1/comments/1kuh6b7/q_how_much_confidence_did_you_have_lando_a/,2025-05-24, Video,,"['Really great summery of the grid by Lando. Should make for an interesting race especially with the two pit stops.', "">**Lando:** A reasonable amount. I mean, never gonna be full of it when Charles has been quick in every session but i think we were always there or thereabouts. Always knew that i could push more in a few places and gain some lap time but I definitely think going into qualifying, I started to just unlock more and more and i was gaining more confidence through quali. \n\n>That's exactly what you want around here, is an improved confidence through the session especially in Q3 when I've just done two strong laps, obviously a good banker just give you that reassurance that you could then go a little bit more in the next one but it's not just these two. it's Charles, Oscar. Max has been fast. Lewis has been quick. it's a good grid and competition from everyone so it always makes that little bit better” \n\nvid from user ln4norris"", 'Such a shame the grid penalty has taken Lewis out of the picture', ""He's become so humble and measured. It's great to see. He obviously still has a lot of self doubt and emotional regulation issues, but it's nice to see him in his element."", 'Is not far, there is Nando too. And Hadjar have a pretty special connexion with Monaco.', 'He hasn\'t ""become"" humble, in a sense that he always was. I don\'t agree with the narrative that he was arrogant, it seems to be a biased argument against him. \n\nHe was always quite self critical. Seems like everything he says gets twisted against him, though.', 'Basically Isack’s home race']",454,7,0.96,454,7,7,12,0,0.0,12
1kuhamb,"[Adam Cooper] Max Verstappen in P5 says pole was not on the cards today: ""No, absolutely not. I think already in FP3, we had some limitations, then in qualifying I think it was quite clear that Sector 2 was just very poor, we just couldn't ride the kerbs and all the compressions.""",https://www.reddit.com/r/formula1/comments/1kuhamb/adam_cooper_max_verstappen_in_p5_says_pole_was/,2025-05-24, Social Media,,"['I saw that sector 2 times, and I knew it was over.', 'Better than last year, at least.', 'Starting P4 is a good result all things considered, realistically the best he could hope for without a god lap. And the McLarens are in the right order to mitigate the deficit to the championship leader and keep him in touch.\n\nAnd who knows, tomorrow he might gain a position on strategy. Hadjar and Tsunoda could help out too.', 'Redbull had the same kerb riding issues last year. At least better position this time', 'Based off watching quali yeah pole was never on. \n\nSeems P4 was probably the best possible result and luckily he got that with the Hamilton penalty', ""Podium should still be possible. It's Ferrari vs Red Bull strategy department."", 'Tbh he sad the same thing last week. Though I was expecting some max magic, very bittersweet quali. Onto Spain, where max has said it should be more like imola.', 'He’ll get a podium. If Norris does the usual Monaco trick of 50% pace, Piastri will definitely lose out at least one of the stops', 'adam cooper using internet explorer huh.', 'The most he could\'ve done was 4 and he did anyway with the Lewis penalty.\n\nMontecarlo isn\'t one of his ""god track"". He can pull off miracles in tracks he likes like Suzuka, Imola, Zandvoort, Spa, but Montecarlo has never been his favorite track, so I was expecting this kind of result.\n\nThey can still improve tomorrow with good strategy and racecraft.']",427,43,0.96,427,43,43,4,0,0.0,4
1kufnvz,[FIA] Stroll 3 place grid penalty,https://www.reddit.com/r/formula1/comments/1kufnvz/fia_stroll_3_place_grid_penalty/,2025-05-24, Technical,,"['How many people want to start P20 😂 Bearman, Stroll and Colapinto fighting it out', ""Doesn't bode well for Ham."", 'Has a 4 place grid drop... still starts P19. \nIconic from Lance', 'Lap 1 - 2 pit stops it is.', 'Lets see how many penalties he can get', 'Not a good omen for Hamilton....', 'They accepted Lance’s explanation but imposed the same penalty xd does it count as accepting the explanation lol', 'Oh so that car was not even Charles 😬 I heard Bryan radio telling him Gasly on a push, and then said stroll blocked Gasly lol', 'Bro will start from Nice']",428,66,0.99,428,960,960,4,0,0.0,4
1kue5c3,[Aston Martin Aramco F1 Team] A textbook drive from Fernando puts him P7 in the Principality.,https://www.reddit.com/r/formula1/comments/1kue5c3/aston_martin_aramco_f1_team_a_textbook_drive_from/,2025-05-24, Social Media,,"['Watch Stroll somehow finish in the points with Alonso P11', 'I think he was in P7 when he said ""there\'s nothing more I can do here"" at the end of Q2, so he nailed it', '1 thousandth behind Hadjar\n\nincredible job from both Alonso and Hadjar tbh', 'Fully expecting Lance to pit on lap 1 and then lap 2 tomorrow and the alternate strategy gets him into the points while Alonso has an engine failure on the last lap.\xa0', 'Alonso has outqualified Stroll for the 20th time in a row!', 'SURELY he gets points tomorrow. PLEASE.', 'Just 0.001 behind Hadjar, fuck. Still a great job today, he was amazing', 'Watch AM somehow fuck it up tomorrow.', ""Aston don't fck this up tomorrow."", 'Okay Aston can we not have shit pitsops and/or strategy mess ups tomorrow yeah?']",400,67,0.97,400,1180,1180,7,0,0.0,7
