unique_id,post_heading,post_url,publish_time,tag,post_content,top_comments,upvotes,comments,upvote_ratio,score,total_upvotes_comments,total_score_comments,upvotes_growth_rate,comments_growth_rate,upvote_ratio_growth_rate,score_growth_rate
1oeodio,"Lewis Hamilton was asked 'what advice could you give to Oscar and Lando as they chase their first [wdc] up against somebody of the likes of Max Verstappen?' 
""It's not their first championship. Obviously, they've won other championships in other categories. """,https://www.reddit.com/r/formula1/comments/1oeodio/lewis_hamilton_was_asked_what_advice_could_you/,2025-10-24, Video,,"['Lewis Hamilton asked \'What advice could you give to Oscar and Lando as they chase their first \\[wdc\\] up against somebody of the likes of Max Verstappen?\' ""It\'s not their first championship. Obviously, they\'ve won other championships in other categories. So, you know, it\'s not something... I mean, I don\'t... I\'m not one to really want to advise them."" \n\n""But, I mean, in that scenario, it\'s challenging when you\'re in the team. The pressure is high. It\'s definitely a time where you really have to put your blinkers up. You have to block absolutely everything from the outside. There\'s so much coming in, positive and negative."" \n\n""You have to be... You really have to be cutthroat. That\'s what Max is, you know. He\'s gonna take this from them if they don\'t do the same, you know. They\'ve got to be pushing. And you\'ve got to dig deep to be able to... firstly, to be able to hold on \\[to\\] someone like Max and in the car that he\'s in at the moment. But also, for either of them to come out ahead, you know, consistency is key. And you\'ve seen that from Max in the last few races."" -', 'Max is going to do what he does and put in consistent results regardless of who is in front of him. \n\nOscar and Lando have to go and take it. And that means they have to take it from one another too. There is no more team for the rest of this season if I’m either of the McLarens. How bad do you want it?', 'They need to extract everything out of that car. Oscar left so much on the table last weekend.', 'I found this comment from Twitter\n\nThe only guy on the grid who has gone blow for blow with Max over a whole season, and his advice is spot on. Max is the kind of driver who’s willing to send you to hell to win so you either have to be prepared to take him there yourself if you’re not outright better', ""Its funny because by far the best parralel we have of this title fight is 2007 with the 2 Mclarens (rookie Lewis and 2 time champ Alonso) fighting against eachother and making mistakes that lets Kimi sneak in and take it in the last 2 races.\n\nThey should know what to do. Not throw away any points to stupid mistakes or being unsure of yourself. Because Max now sees a path to the title and he's the great white shark from Jaws. and Mclarens boat is starting to take on water."", ""Imagine having to deal with papaya rules and a Max who has nothing to lose. If you're the guy trying to be tough with Max and you get taken out your teammate becomes WDC. lmao!"", ""If it really comes down to it, part of me does wonder if the papaya boys quite have enough of that uncompromising ruthlessness to beat Max when he's on the warpath. They're great drivers, no doubt about that, but when Max is fighting for a title he's throwing every trick in the book and a few pages that aren't, and it takes more than just good quality driving to fend that off.\n\nThe last few races of 2021 were some of the ugliest, most vicious racing I have ever seen in 25 years of watching the sport, exciting maybe but frankly uncomfortable to watch, and I'm just not quite sure if they can bring that level of intensity. We'll see, and I'm looking forward to finding out, but y'know neither of them are Lewis and he's the only one who's ever risen to the challenge so far."", ""Not an expert, but I'd say the biggest problem is that both of the McLarens are in a position to win the championship, with fast cars to do so. It would be easier if there was a large difference so they didn't have to race each other and one could try and keep Max at bay. \n\nVery interesting season"", 'Perfect advice; I just hope for the sake of them two that its not too late!\n\nMclaren were quite complacent about not letting them fight with each other as they thought Max wont be a factor. How fast times change!', 'Alonso, Rosberg, and Verstappen. Hamilton is probably the biggest expert when it comes to having cut throat title fights rn.']",3955,389,0.98,3955,7052,7052,367,15,0.0,367
1oed8dt,McLaren drops Norris 'consequences' after Piastri clash review,https://www.reddit.com/r/formula1/comments/1oed8dt/mclaren_drops_norris_consequences_after_piastri/,2025-10-23, News,,"['McLaren; ""lets stir some shit like Horner and Toto used to do.""\n\n*""Sir, you are stirring in the wrong pot, that one is ours""*', ""McLaren needs to get a grip. Every week there's something about team orders and it's causing people to root against them.\n\nIt must also be very distracting for the drivers as they get asked about it endlessly."", 'McLaren seems like a poor reality TV show. No week goes by without drama or controversy.', ""The fact that there were 'repurcussions' in the first place was deeply unserious."", ""This whole thing just feels so bizarre. The fact that they're ordering their drivers to be so open and public about these weird power games and punishments..."", 'we can all sleep easily now', 'Jesus, McLaren…make up your fucking mind. Talk about a company that can’t stop punching itself in the face.', ""Reads like they're releasing a song\n\n***McLaren - Consequences (ft. Norris)***"", 'takes a lot of the fun out of the competition when all this stuff in manufactured behind the scenes....McLaren really needs to just let them race and stay out of these types of things as much as possible', 'They can’t blame Oscar publicly but by removing the ‘repercussions’ from Norris, they’ve admitted Oscar was at fault for that crash at COTA. Not that the repercussions should have existed in the first place.']",2634,732,0.95,2634,17858,17858,26,3,0.0,26
1oej9ie,McLaren must be ready for 'cut-throat' Verstappen - Hamilton,https://www.reddit.com/r/formula1/comments/1oej9ie/mclaren_must_be_ready_for_cutthroat_verstappen/,2025-10-24, News,,"['>Hamilton, who fought an intense and bitter championship battle with Verstappen in 2021, said: ""In that scenario it\'s challenging, the pressure is high. It is a time when you have to put your blinkers up and block everything from the outside.\n\n>""You have to be cut-throat and that is what Max is, he is going to take this from them if they don\'t do the same. You have to dig deep to hold off someone like Max and the car he is in. But also for either of them to come out ahead, consistency is key, and you\'ve seen that from Max in the last few races.""\n\n>""You have three incredibly talented drivers and I can\'t predict how they\'re going to behave,"" added Hamilton.\n\n>""Max has won it four times so he knows what it\'s like and being the hunter is much easier than being the defender. When you\'re in the lead and someone is chopping away at your lead, that plays on you more than if you\'re chasing and you have nothing to lose. In the lead you have everything to lose.""', 'High praise coming from an arch rival tbh', '[https://en.wikipedia.org/wiki/Mexican_Grand_Prix](https://en.wikipedia.org/wiki/Mexican_Grand_Prix)\n\nYes, it does have to do with the PU and the aero efficiency of the car. The Honda/now Red Bull PU has always dealt with the altitude better.', 'They’re not even ready to be cut throat to each other, they’ve given Verstappen a sniff and he’s probably going to run them both down unfortunately.', ""the championship is playing out so nicely because lando and Oscar are close enough for either of them to win, and thus McLaren can't become a one-driver team right now. \n\nAnd that's exactly what max needs from McLaren. But they're far enough ahead that if either of the McLaren drivers is able to win half the races from here on out they'll win, so it's not a cake walk for max. \n\nAdditionally, you'll have Mercedes being competitive out of nowhere so that puts the uncertainty of George winning a race. \n\nThe only thing missing is a goatifi/mazespin to really bring it home."", 'Max doesn’t need to be cut throat. Currently it’s looking like a leisurely Sunday stroll through the park.\xa0', 'Narrator: ""They were, in fact, not ready.""', 'Nothing will ever beat the 21 calls to the race director', 'The fall of Papaya dream', 'Tbh the best way to beat Verstappen is to actually piss him off. He kinda loses his head when he is pissed.']",2344,263,0.98,2344,7496,7496,62,2,0.0,62
1oefnf8,"[Thomas Maher] Aston Martin has been found to have committed a minor procedural breach of the 2024 F1 cost cap, while a rival team is understood to have committed a substantial breach.",https://www.reddit.com/r/formula1/comments/1oefnf8/thomas_maher_aston_martin_has_been_found_to_have/,2025-10-23, News,,"[""We're all set for the Speculate On Who Failed The Cost Cap Grand Prix...\n\nIt's lights out and away we go!"", ""Williams in Brazil wrote off 3 cars, honestly wouldn't be surprised if it was them."", ""No penalty for Aston according to their info:\n\n>[PlanetF1.com](http://PlanetF1.com) understands Aston Martin’s breach was a matter of administration and a result of extenuating circumstances.\n\n>However, as it was not in full compliance with the regulations, it is still considered a breach, though there is no fine or penalty associated with it.\n\nRegarding the potential breach:\n\n>More notable are allegations of a ‘substantial’ breach for one of its rivals, with multiple sources suggesting to PlanetF1.com that one team exceeded last year’s cap.\n\n>Sources have told PlanetF1.com that the team in question is challenging the breach.\n\n>However, the team at the heart of the allegations highlighted to PlanetF1.com that there is a defined process which must be followed for any breach (potential or actual), which is not taking place.\n\n>It has also been pointed out that, as the Cost Cap Adjudication panel operates confidentially, it’s possible there are processes ongoing that the team is not privy to.\n\nThere will only be an FIA statement once the assessment of all teams and PUMs has concluded\n\nEdit: continued, on Aston's procedural breach:\n\n>its accounts auditor was unable to sign off until after the deadline. All accounts were submitted ahead of the deadline. There are no penalties or sanctions beyond administrative fees to the CCA."", 'Ok guys who blew the budget on catering this time?', 'ok, williams had a ton of crashes, so maybe them.\n\nalso, Toto last year said that the team came ""very close"" to exceeding the cost cap, so maybe they did actually go  over it.', 'Watch it come out that Alpine has massively overspent to produce the greatest shit box of all time.', 'Here we go again...', 'Alpine on garlic bulbs.', 'If it is Williams I assume a lot of teams will be complaining as they’ve made a decent jump up the standings this year.', 'I’d love it if it’s Alpine. Just to rain even more on Flavio.']",2192,351,0.99,2192,11382,11382,30,3,0.0,30
1oegxok,COTA/USGP “Richard Mille watches worth ‘hundreds of thousands of dollars’ stolen during f1 weekend,https://www.reddit.com/r/formula1/comments/1oegxok/cotausgp_richard_mille_watches_worth_hundreds_of/,2025-10-23, News,,"['I was going to joke “so, three watches?” Then I read the article and saw it was two.', 'So they stole two?', 'I feel like Richard Mille goes around stealing his own watches to raise the profile.', 'Always thought these looked like they melted a g-shock over a car engine.', 'Someone has a great taste in watches and wanted to rid the world of the RM watch aesthetic and the type of people who like/wear them when not forced by sponsors.', '""worth""', ""Gaslighting rich douchebags into thinking these look cool.\n\nActually, on second thought, rich douchebags are exactly who these watches are for. They're gaslighting US into thinking they're cool."", 'As a watch guy, I do not like Richard Mille watches at all.', 'Charles Leclerc: ""Relatable""', 'A true crime against douchebagery.']",1475,248,0.96,1475,7220,7220,22,2,-0.010000000000000009,22
1of2e7n,Verstappen to benefit from four-part Red Bull car upgrade at Mexican GP,https://www.reddit.com/r/formula1/comments/1of2e7n/verstappen_to_benefit_from_fourpart_red_bull_car/,2025-10-24, News,,"[""Mclaren like a long distance runner who's gassed after pulling a big lead. Now Max closing on them very quickly.\xa0"", '[Here are the upgrades](https://pbs.twimg.com/media/G4CcQhsXsAAjBJN?format=jpg&name=large)  \n  \n- Front corner  \n- Engine Cover  \n- Floor Body  \n- Edge Wing', ""Redbull is giving tsunoda latest front wing as well, they believe it will put him within three tenths from max\n\nYuki said he gonna try to do better so he can help max in the championship 🔥\n\n\nI'm really excited for the wdc battle"", ""And then they suddenly don't work and they waste fp2 with max to know that while Lindblad is driving in fp1"", '<Jaws music intensifies>', 'Need Merc to help with McLarens.', 'Yeah I don’t know man, this is not looking good for the Mcchuckle brothers', ""Red Bull really don't want Max to leave do they? Hope they don't mess up the next gen too much going all in so late in the season"", 'If McLaren don’t win a WDC (either driver) they will be the biggest bottlejobs in history. Big lead and two drivers against one guy.', 'ITS HAPPENING']",1082,373,0.98,1082,361,361,1082,373,0.98,1082
1oeteir,Leclerc will be “very surprised” if Verstappen wins 2025 F1 title,https://www.reddit.com/r/formula1/comments/1oeteir/leclerc_will_be_very_surprised_if_verstappen_wins/,2025-10-24, News,,"['Yes, because if he does, he would set the record for coming back from the furthest point deficit. The current record ALSO belongs to Max and this is not even funny, against Leclerc himself. Let the man have a POV of the thing that only Leclerc had the misfortune to deal with!', 'Leclerc knows the Mclarens are still a rocketship especially after the last race so it makes sense that he’ll be surprised. I think RB is just as quick though which should make things really interesting till the end', ""I still can't quite believe that we're actually seriously discussing Verstappen's title chances. What an unreal season from him. Yes the car has improved but remember McLaren's superiority in the first half of the season. The narrative didn't even entertain the idea of a non-McLaren driver winning the championship. This is like if, say, in 2019 Verstappen had somehow managed to enter WDC talk. Even if Max doesn't pull it off this year, it's a hell of an achievement to even be in the fight right now."", ""I will be too. But at the same time, will I really be surprised? It's Max afterall, guy's insane."", ""Me too. It's funny to see some people (including bookies) act as if though Verstappen is now the favorite. He's 3rd favorite to win, which is impressive because not long ago it was still considered a two horse race."", ""Max needs to win pretty much everything AND he needs both Lando and Oscar to mess up at least once or twice and lose a bigger amount of points compared to him. I don't see him taking every racewin either by the way, but we could have Russell or Leclerc in the mix to steal some points (from any of the top 3 drivers) as well."", 'Preparing my Pikachu memes over here, in any case...', 'Me too. Nice story so far. But in a race or two, Oscar will have good one, victory or two, and it will be done.', 'I’m trying to not jinx Max - would be one of the coolest wins ever', 'True but boy the entire f1 family will be on fire if Max pulls another 15+ points on Oscar this weekend.']",1071,174,0.98,1071,169,169,387,33,0.0,387
1oehs7z,"How McLaren taunted Red Bull with ""better luck next time"" message on grid marker tape",https://www.reddit.com/r/formula1/comments/1oehs7z/how_mclaren_taunted_red_bull_with_better_luck/,2025-10-23, News,,"['>*""It was known that a certain level of gamesmanship had been in progress between the two teams and that this was not the first time Red Bull had attempted to interfere with Norris’s markers.*\n\n>*Autosport understands that McLaren had taken a number of steps to counteract the sabotage, the latest of which was to use tape impregnated with material which would leave a mark even when the tape was removed. In Singapore it had left a mark\xa0under\xa0the tape, along with the words “****better luck next time****”.*', '>use tape impregnated with material which would leave a mark even when the tape was removed. In Singapore it had left a mark\xa0under\xa0the tape, along with the words “better luck next time”.\n\nwhy peel it off. red bull should just put a bunch of their own next to it to confuse Lando.\n\nlol at Carlos saying *""I do know if I was the Red Bull team principal what I would do for someone who tried to do that…”*\n\nEdit: Russell too\n\n*""If I saw a piece of double tape on the side of a nicely straight painted wall, I would probably take it off as well.""*', 'Is there a rule against it? Otherwise I almost always love legal fuckery between teams regardless of the sport.  This stuff is fun.', 'Next time RBR need to just add several identical strips around McLaren’s marker.', 'I would put 20 pieces all over the place', ""I assumed it was just gonna be running a knife over so it can't be peeled off in one easy move.\n\nTheir solution is way better."", ""IMO the fact that there's no rule either way is fine and this is kind of a fun way F1 teams can mess with eachother.\n\nFor what it's worth I think that if the FIA were to make a rule, it's more likely to ban the tape than ban other teams from messing with it."", 'lmfao this is hilarious, good for them', 'Just a bit of banter', 'Red Bull should resort to placing identical looking tape all around it.']",1049,114,0.95,1049,3624,3624,23,0,0.0,23
1oeqii0,On this day: James Hunt wins the 1976 world championship after finishing P3 at the Japanese GP,https://www.reddit.com/r/formula1/comments/1oeqii0/on_this_day_james_hunt_wins_the_1976_world/,2025-10-24, Throwback,,"['Why I am seeing Chris Hemsworth instead of Hunt, James Hunt', ""To this day, his win was the largest comeback in F1 history (from 97 points back, normalized to today's system).\n\nAfter Zandvoort, Verstappen was 104 points behind Piastri. If he secures the title, he will take the record from Hunt."", 'He seems thrilled', 'Remember watching the race live  . Pissed  down and during the race  cars aquaplaned off .\nNever forgot the efforts of James and Niki during that season. \nPity photo from the film', 'Absolute Cinema', 'The photo is from the British Grand Prix.', 'Legend', 'Watching video after the Japanese GP, I love that no one knew if Hunt won the championship or not. There was mass confusion and it took a while before he even knew he was the champ.\n\nThe coke was flowing like wine that night and the wine was flowing like water!', 'IF max manages to win I REALLY hope he lights up a smoke on the podium\xa0', ""This photo is from the 1977 British GP BTW. I'm not sure why people are saying it's from *Rush*.\n\nThat's Gunnar Nilsson next to Hunt, and Niki with his faced obscured by the person pouring the champers""]",988,47,0.99,988,45,45,282,7,0.0,282
1oer70n,Verstappen's gain 'not a huge surprise' with Red Bull 'throwing parts' at car - Piastri,https://www.reddit.com/r/formula1/comments/1oer70n/verstappens_gain_not_a_huge_surprise_with_red/,2025-10-24, News,,"[""I went to read the article but got distracted by them using a photo that looks like Max is about to pinch Oscar's ass"", 'Nothing controversial in anything he says in the full article. Even the headline is a bit of a misquote.\n\n>“There were flashes of that kind of performance at certain points earlier in the season, but there were also some pretty big dips,” Piastri continued. “So for him to now be consistent – that has been a bit of a surprise.”\n\n>“We know they’ve still been throwing a lot of things at their car, trying to improve it, so in some ways, it’s not a huge surprise,” he said. “But I think for everyone he’s probably come into the fight quicker than I expected.”', 'Wow, okay, once again the statement is incredibly reasonable compared to the actual title.', 'Red Bull with the 10000 IQ strategy of.... working on their car...', '""We thought we could get away with not upgrading our car, but looks like they\'ve caught up with us""', ""He's not wrong. Shame McLaren have stopped developing the car after getting their WCC."", 'Oscar said this so everyone’s rushing to read the article instead of sensationalising the headline', 'he dont have to worry, just one good weekend for him and max is never catching up. just heads up.', ""Dude is already trying to justify the single biggest fumble in F1 history and he hasn't even officially lost the title yet.""]",770,122,0.89,770,113,113,73,3,0.010000000000000009,73
1oehttv,[George Russell] Instagram story,https://www.reddit.com/r/formula1/comments/1oehttv/george_russell_instagram_story/,2025-10-23, Social Media,,"['I think Fernando loves George. Bro has Georges nudes', 'Why. Just why? hahahahahahaha I need to know', 'Most random bromance ever', 'Any rookie needs a hero like george is for the young fernando.', 'LMAOO I wanna know why so bad', 'I wanna know the lore behind this😭.', 'This is so funny hahaha I really wanna know why this is a thing', ""Wdym that's his son *Jorge Rosales*"", 'charm for protection against british press', 'I’m not 100% sure but isn’t George’s gf a Spaniard? Could be that’s how they connected beyond their bromance lol']",606,29,0.98,606,29,29,138,5,0.0,138
1oel9rh,Max Verstappen rejects Helmut Marko’s claim he lost interest in Formula 1,https://www.reddit.com/r/formula1/comments/1oel9rh/max_verstappen_rejects_helmut_markos_claim_he/,2025-10-24, News,,"['Old man ragebaited his own driver😭', 'Darth Sidious out here playing mind games', 'Would hate to see if he got interested', ""Cna't even have hobbies nowadays !"", 'Marko misses the shit stirring with others so much he started to ragebait his own drivers :D', ""Can't believe Marko said something untrue, has to be fake news"", ""The day Max looses interest in F1, he will quit. It's simple as that. We don't need Marko telling us anything."", 'Can’t believe I’m defending Helmut Marko of all people but I guess that’s what clickbait F1 media headlines do to everyone eventually. He didn’t actually say Max had lost interest in F1, he just said Max’s interest waned somewhat when Red Bull were in their slump. Which is quite possibly true. Especially given Max is a new father so has other things going on his life these days.', ""Max's performative disinterest is very clearly a way to take pressure off himself. In the run up to his first title he said he'd be happy with one and that he might leave F1. It's a clever psychological tactic but this guy is desperate to break all the records and get to 7/8, and it will happen if he gets another good car (after the reg changes) at some point in his career."", ""He's the ultimate competitor""]",594,76,0.96,594,2055,2055,30,2,0.0,30
1oeu6ap,Oscar Piastri explains the ramifications of the incident that ended McLaren's Austin Sprint,https://www.reddit.com/r/formula1/comments/1oeu6ap/oscar_piastri_explains_the_ramifications_of_the/,2025-10-24, Video,,"[""We'll be learning new shit about these papaya rules for years to come."", 'Papaya rules are now part of the culture and lore.  Zak trying to define the tone and his legacy.', 'This team is going to be a fucking case study in over complicating everything in some utopian desire for equality and fairness. Absolute shit show.\xa0', 'So Lando’s repercussions were that Oscar was allowed one free hit, and he used it up,', ""Everyone's heaping criticism on McLaren but when was the last time two top tier drivers in a championship car actually got along? This seems to be the single best example I can think of.\n\nHamilton-Alonso, Prost-Mansell, Prost-Senna, Ricciardo-Vettel, Vettel-Webber, Hamilton-Rosberg....all ended in tears and acrimony much sooner than this experiment."", 'So Lando gets 1 week of repercussions while Oscar gets nothing in return? Surely a week each would’ve been in accordance with ‘Papaya Rules’.', 'We moved from repercussions to clean slate to ramifications.', 'This is pretty much everything you shouldn’t do as a parent of two children.\xa0', 'Fair play for actually taking some responsibility.', 'The only reason those repercussions have disappeared is because of Oscar not performing well. McLaren could not justify continuing to punish Norris if Oscar wasn’t benefitting from it. Instead Max is benefiting from it. Oscar’s poor form is why those repercussions no longer exist.']",593,186,0.96,593,174,174,205,37,0.0,205
