unique_id,post_heading,post_url,publish_time,tag,post_content,top_comments,upvotes,comments,upvote_ratio,score,total_upvotes_comments,total_score_comments,upvotes_growth_rate,comments_growth_rate,upvote_ratio_growth_rate,score_growth_rate
1gtfldn,[OC] 32 drivers suffered fatal accidents during F1 World Championship events. Many former F1 drivers also died racing in other series while a handful of people passed away in F1 machinery without ever competing in Formula 1. This is a map of all 151 F1-related fatal accidents.,https://www.reddit.com/r/formula1/comments/1gtfldn/oc_32_drivers_suffered_fatal_accidents_during_f1/,2024-11-17, Statistics,,"[""Amazing work. It's way more complete than I was expecting at first. Just hope that we don't add any more names to this list."", 'I cannot imagine what it was like being a fan of the sport prior to the 90s.', 'Apologies for the map being quite finicky to use on mobile devices. I hope it can still provide an interesting pastime on this race-free Sunday. Feel free to point out any mistakes I made, this was quite a lot of history to dig through.\n\nBy the way, ""only"" 8 people from the list died in this century.', ""When you read about Pryce's accident, it just sends chills down your spine. It's barely believable.\n\nBTW, stellar work on the map"", 'Im so glad you included Maria de Villota! I was quite mad wenn I found out that she was not on the Wikipedia list', 'I’ve been watching since ‘87.\n\nI won’t include Imola ‘94 or Suzuka ‘14 as we all know what happened, but outside of those accidents we have had some very near misses.\n\nBerger at Imola in about ‘90/‘91, and Piquet a couple of years earlier had massive accidents. The Berger one was similar to Grosjean in some ways. Fireball and the like.\n\nWendlinger and Perez both had real big impacts at the chicane in Monaco. Wendlinger’s one ended his F1 career.\n\nLuciano Burto had two big crashes. The first at Hockenheim, and then at Spa when the worst very nearly happened.\n\nMassa in Hungary, Kubica in Canada.\n\nThere was Sato running into someone (I forget who off the top of my head) in Austria and a massive impact. Ralph Firman lost the rear wing from his Jordan in Hungary one year and had a very big impact.\n\nPedro Lamy almost lost his life in a testing accident for Lotus at Silverstone.\n\nMartin Donnelly as well.\n\nThere have been all of these and so many more in the time I’ve been watching, and down to fabulous car and circuit safety, medical intervention and I’m sure a very generous amount of luck, all of those mentioned above saw another day.', 'I actually made a tribute to them - https://youtu.be/lZ7Qu0CVgs4?si=e4z0RFcZksX3DlmB\n\nNot sure how many I forgot.\n\nIt’s insane that so many legends (Ascari, Clark, Rindt, Villeneuve, Peterson, Senna) all died in F1 accidents.\n\nEdit: not F1 accidents. I meant so many F1 legends died in racing accidents.', 'When the Paletti accident happened in 1982, the start line in Montreal was after the hairpin.', 'This is genuinely insane, incredible detail. I “love” that you can zoom in and see the corner where each accident occurred. I say this while also acknowledging that I hope we never have to add anymore names to this list.']",3552,166,0.98,3552,4659,4659,37,0,0.0,37
1gtpnj8,Liam Lawson's dad told him off after pulling the finger,https://www.reddit.com/r/formula1/comments/1gtpnj8/liam_lawsons_dad_told_him_off_after_pulling_the/,2024-11-17, News,,"['Damn, my dad just laughed and farted when I pulled his', 'A good answer from him about who is the fastest would’ve been “oh, Igor Fraga” who won the Toyota Racing Series (now Formula Regional) vs Liam, Franco and Yuki. Cheeky but smart to get away with the question. His answer though was good too.', 'I am the Law… son.', 'Bro has done more podcasts than Joe Rogan', 'It’s so funny seeing Paddy on mainstream international subs like this. Dude is an NZ treasure', 'Good to have someone that can keep you grounded', ""I thought it was great, the only thing you don't want to be in f1 is forgettable imo"", ""He's lucky that's the quote pulled from the interview and not his pace comments being taken out of context lol (when saying everyone in F1 believes they can win the WDC or they're screwed)."", 'Liam Lawfather was not happy.']",2570,98,0.97,2570,4136,4136,67,1,0.0,67
1gtkr3i,[Thomas Maher] The unused livery from the US Grand Prix is being showcased by Red Bull on chassis 003 at the Galway Showrun this evening.,https://www.reddit.com/r/formula1/comments/1gtkr3i/thomas_maher_the_unused_livery_from_the_us_grand/,2024-11-17, Social Media,,"['A nice retro-inspired livery. Shame they chose not to use it.', 'The dark, matte, look was cool for a while but it’s so drab. After almost ten years of it, they could use a change. This looks so much brighter and vibrant.', 'I really like the brighter looking blue rather than the super dark navy that they use now.', ""I knew about Singapore but I didn't realise there was also an abandoned US Livery too.\n\nI like this one, it reminds me of some older Red Bull liveries.\n\nNow, all it needs is Infiniti Purple .."", ""The first time in years that they really make a good livery, they don't even use it."", 'toro rosso/old red bull kinda colours\n\ni like it', 'I love that bolder, brighter shade of blue. Wish this was the permanent look.\n\n\nAlso love the curvy stripes that run along the side of the car.', 'Beauty', 'Should keep it as the regular livery honestly. Hopefully next year they can use it at the US GP', 'Was it a weight issue?']",1756,52,0.98,1756,2730,2730,37,1,0.0,37
1gtmdnl,Ollie Bearman on instagram : “The crossover you didn't know you needed today”,https://www.reddit.com/r/formula1/comments/1gtmdnl/ollie_bearman_on_instagram_the_crossover_you/,2024-11-17, Social Media,,"[""The fact that I didn't even recognize Ollie in the ceremony lmao"", 'They look like background characters in a film about a boy getting bullied at a British private school in the 80s', 'Who is next to him?', 'Sinner could be Ollie’s big brother', 'twins', ""I still didn't know."", 'Sid the Sloth', '🥦🥦', 'Sinner is in such a good shape this year, that he could get in a F1 car and easily beat half of the grid']",997,56,0.92,997,1085,1085,26,1,0.0,26
1gu48k1,"[Chris Medland] F1 has announced the Canadian Grand Prix will move date to May from 2026 onwards, to help with calendar regionalisation. That should allow it to be aligned with Miami as a North American pairing.",https://www.reddit.com/r/formula1/comments/1gu48k1/chris_medland_f1_has_announced_the_canadian_grand/,2024-11-18, News,,"['F1 making sense?\n\nMake it make sense.', ""Hopefully they've lucked into the one week a year where they are both have acceptable weather"", ""Weather is going to be touch and go in late May. Won't get super hot weekends like we occassionally get - more than likely we get some wetter and colder weekends. Not complaining though!"", 'May is slightly cooler on average but should be fine.  June weekends can be proper wet and cold too.  Not gonna be much different than some euro rounds that can be cold at times.  Gonna look slightly worse due the vegetation not being fully in bloom yet, but let’s not pretend that May is going to be a horror show.\n\nSource : I live near Montreal lol', 'Montreal in May is very hit and miss with temperature. I get the schedule rational - but this could be painful for attending fans.', ""Montreal is probably the most variable condition GP F1 has... even with the current existing slot... it's never sure what weather you're going to get..."", 'Definitely gonna increase the likelihood of rain lol.', 'third or fourth weekend, after Miami. Given that miami is often the first weekend I wonder whether both will be stand-alone or if they (can) move Miami accordingly.', 'Isn’t Montreal a bit cold for F1 in May?']",1232,140,0.99,1232,135,135,1232,140,0.99,1232
1gu1gyq,Sauber have revealed a special livery for the Las Vegas Grand Prix,https://www.reddit.com/r/formula1/comments/1gu1gyq/sauber_have_revealed_a_special_livery_for_the_las/,2024-11-18, News,,"[""this looks like something i would've made on Need for Speed Underground 2 when i was 5 years old"", 'wicked promo is getting out of hand', 'Why do teams do this special liveries which look so much better than the normal one ? Ferrari should have just adopted last years Las Vegas livery everywhere and same is true here', 'I actually really like it.', 'I miss the 2022 Alfa Romeo.', 'It’s the Monster Energy livery', 'Once again, the graphic designer is doing the best work at Sauber.', 'All this to be at the back of the grid once again', 'That looks awesome!', 'Those green flames will add like 10 horsepower']",896,117,0.95,896,112,112,120,7,-0.010000000000000009,120
1gtl5d6,"Q1, Q2 and Q3 appearances - corrected version ",https://www.reddit.com/r/formula1/comments/1gtl5d6/q1_q2_and_q3_appearances_corrected_version/,2024-11-17, Statistics,"As you guys pointed out there were some mistakes reagarding Q2 exits for Ferrari boys (they both made it to Q3 in Singapore but where Charles DNFed and Carlos DNS) and Liam Lawson. So there is a new verson, hopefully with no significant mistakes this time.
","['Look at George quietly being consistent as blimey, he is having his best season, despite the odd bout of bad luck.', 'crikey', ""Chego has been knocked out I'm Q1 more than Albon and Tsunoda. Jesus Christ Checo"", ""Yuki once again proving himself the champion of the Best Of The Rest (and the Rest includes Lance Stroll) Championship. And he's made it to Q2 more frequently than Perez. LMAO. LOL. ROFL, IF I MAY."", 'Bottas getting q3 in that broken tractor is impressive', 'Fuck, another edit: Lewis should have one more Q2 exit. So Q3 - 76.1% (16) , Q2 - 9.5% (2), Q1 - 14.2% (3). Please upvote', 'Leclerc and Russell have had such an underrated season.  Easily the two consistently strong performance drivers along with Max.', 'Lewis has more Q1 exits than Q2. An anomaly.', 'George has quietly been having a great year that’s been largely cast in the shadows because of a few unlucky events \n\nQuite possibly the second best performing driver of the year (Lando might be 4th behind Charles or 5th behind Carlos)\n\nEven more impressive how easily he’s been able to put Lewis down']",790,127,0.97,790,1881,1881,17,4,0.0,17
1gtkna3,Williams rebuild for Albon and Colapinto’s cars ,https://www.reddit.com/r/formula1/comments/1gtkna3/williams_rebuild_for_albon_and_colapintos_cars/,2024-11-17, Video,,"['This was super interesting to watch. These guys are just amazing. The two cars were in pretty bad condition. Glad they are in good shape for the next race and with spare parts just in case.', ""really cool video. i wish there would be more content focused on mechanics building the car, how they approach it, etc and less about drivers doing some boring ''challenges'' but i get it because that's what the public wants."", 'That was like an episode of scrapheap challenge!\n\nSeriously these guys do some work. Always amazed when a car gets wrecked during a weekend session and it’s ready to go at the next session looking like nothing happened.', 'The guys in the background with the hydraulic lines xD Classic team banter.', ""I wish we could see more of this stuff from the other teams. The cost cap has introduced an entirely new level of salvage we've never heard of or seen in F1. As fans we just see the cars show up all shiny and ready to go without a clue to most of us what goes into the prep for each race weekend. Mega respect to team Williams!!"", 'With all the talking about carbon fibre, I am surprised that mechanics pick up those damaged pieces without gloves….', 'That was super cool to watch, and what an effort they did getting everything ready. Call me bias but Williams have the best social media team in F1 in what they do and show.', 'Absolutely incredible work and super interesting to see what the work back at the factory actually entails.', 'I work for a composite supplier so I find it super interesting to see what the actual composite department of a team looks like. I even saw one of my old coworkers in the background lol', ""They better get a nice bonus after the season for all the crap they've had to deal with.""]",731,72,0.99,731,1015,1015,12,4,0.0,12
1gu3m8l,Could new Liberty boss open F1 door for Andretti?,https://www.reddit.com/r/formula1/comments/1gu3m8l/could_new_liberty_boss_open_f1_door_for_andretti/,2024-11-18, News,,"['I don\'t know what\'s worse between the ""Mick is in contention for this seat"" and ""Andretti still has an open door into F1"".\n\n\nIf I was a shitty journalist I would write articles about Andretti joining F1 with Mick as their main driver, would generate so many clicks', 'I thought the problem was the teams, not Liberty that is stopping a new team from joining?', '>European rivals Mercedes, McLaren, Honda, Audi, and even Toyota\xa0\n\nGreat article', 'This guy lost his money through a crypto sponsor scam, if anything I’d like to see Cadillac/GM on the grid but not with Andretti.', 'Look for some announcement perhaps this Thursday in Vegas. I quite honestly don’t see Micheal involved going forward. If there is any deal for a 2026 entry I believe it’s only going to be with GM and Dan Towriss behind their group. Mario *might* still be a hired spokesperson but Micheal… he was negotiated out the door along with Maffi and Domenicali.', ""Given Andretti's recent financial shenanigans any Andretti entry is probably going to be in name only and not really associated with Andretti racing."", 'PLEAAAAASEEEEE BRING ANDRETTI PLEAAAASEEEE', 'It might be Andretti in name only but I think Dan Towriss and his group could have a decent chance at being admitted', 'Err, no.']",175,34,0.85,175,31,31,134,15,0.09999999999999998,134
1gu2efk,[@GiulyDuchessa] From today formu1a.uno expands and becomes autoracer.it,https://www.reddit.com/r/formula1/comments/1gu2efk/giulyduchessa_from_today_formu1auno_expands_and/,2024-11-18, News,,"[""I'm posting this here because Duchessa, Donadoni and formu1a.uno are a reliable source for news, especially when it comes to Ferrari, so suddenly seeing the new name could have been confusing for those who missed this change."", ""> *Exactly five years ago with Piergiuseppe Donadoni I founded Formu1a.uno. In that period our only aim was to be able to write completely free and passionate analyses.*\n\n> *Day after day, readers have rewarded us in an incredibly unexpected way. Despite the resources not comparable to the historic top media, we have achieved a decent place in the front ranks of the web and, more importantly, the respect of many readers and many good colleagues. This was possible thanks to great sacrifices, not only ours, but of all those who contributed and continue to contribute today to making things work.  I mention Rosario Giuliana who is part of the board of directors and the chief editor Paolo D'Alessandro for his enormous and precious commitment. But it is the editorial staff as a whole, prepared, also made up of young, intelligent and punctual guys, to whom our and my personal thanks go. The same goes for those who have passed or will pass here to lend us a hand.*\n\n> *We think that now the time is more ripe for a turning point that broadens the field, without compromising the basic principles that have characterized us, nor our identity. This is one of the reasons why Formu1a.uno renews itself to expand its range of action by changing its name to Autoracer.it with immediate effect.*\n\n> *It is something that has been planned for some time and which will gradually lead us to experience greater coverage of motorsport. We will try to do it with the same quality and freedom in information that we believe we have shown up to now, logically keeping Formula 1 as the central fulcrum, wanting to offer our future voice also on other categories and sectors no less important and loved by fans.*\n\n> *We hope to live up to expectations.*"", ""It's a superior name regardless of anything else"", ""Duchessa is quite hit or miss with Ferrari as of recently, I'm not quite familiar with Donadoni too. Though it's nice.""]",124,5,0.92,124,4,4,29,0,-0.019999999999999907,29
1gth10k,INSIDE STORY: Alpine’s Magnificent Double Podium | 2024 Sao Paulo Grand Prix | Lenovo,https://www.reddit.com/r/formula1/comments/1gth10k/inside_story_alpines_magnificent_double_podium/,2024-11-17, Video,,"['What is clear from this video is that everyone was calling for red flag.\nEven drivers who would lose out like Norris and Russell.\n\n\nI understand why Russell pitted. Going against your team in wet conditions could have made him look stupid.\nBut his instincts were good. It was clearly going to be red flagged.\n\nIf Mercedes listened to him they could have been fighting for a win with Max.', 'Hearing all the drivers panic about the drivability before the safety car sounds scary and i’m surprised norris post race said it shouldn’t have been a red flag when even he said it needs to stop and being unable to see after pitting.\n\nalso merc seriously fucked over george. The guy was so confident on the radio about the red flag and ended up being completely right. he even asked for the extremes when they made him pit which would’ve at least given him the advantage for those few laps and they put on inters instead.', 'Mercedes really took over from Ferrari in terms of fucking the strategy at every available opportunity', "" Hearing the mess of the aborted start I still don't get how Norris and/or Russell didn't get any real penalty"", 'I’m just very upset about George man. He’s going to be your team leader next year so please trust the guy Mercedes!', ""4:21 - Wow, hadn't seen that swapper from Alonso before..."", 'I died when I saw that long ass team radio essay from Will Joseph to Lando', 'Contrary to Norris comments, this vid shows very well that it was not only luck that gave them this podium', ""GP's or maybe actually Jonathan Wheatley's reaction to the failure at the front made me laugh. Just absolutely dumbfounded lol"", 'Well I was wondering what happened with Alonso once I seen Gasly pulling a gap around that lap what was odd given he was close to Alonso for some laps.\n\nNow I know the answer.']",107,10,0.87,107,153,153,3,1,0.0,3
1gu3jww,Vasseur outlines plan for Hamilton’s Ferrari arrival,https://www.reddit.com/r/formula1/comments/1gu3jww/vasseur_outlines_plan_for_hamiltons_ferrari/,2024-11-18, News,,"['Ironically, Ferrari does have a shot at the title. It is only 30 points behind.', 'Build car. Put goat in car. Win stuff.\n\nThat’s the plan.', '""Vasseur added that while Ferrari are working to finalise a programme for Hamilton, he is focused on the remainder of the 2024 season as his team attempt to overhaul McLaren for what would be a first constructors’ title since 2008.""\n\nWhat?', 'If Piastri continues ghosting, Ferrari will have it firmly in the bag', 'It means beat McLaren in WCC', ""they are only 30 points behind it's not impossible"", 'Exceptionally British use of the word “overhaul” there.', ""It's tough to say for sure. Even if piastri has a bad race or two, as long as one of the cars finishes first or second, they will get the championship but one thing it is for sure. Tjey are way closer this time than in 2022."", 'How is Piastri ghosting? It’s his second season in F1 and he’s doing reasonably well for it \n\nNot everyone can he Hamilton and challenge for the title right off the bat']",41,13,0.84,41,12,12,19,8,0.0,19
1gu4rbi,Exclusive: Ferrari in Las Vegas with a new wing and an experimental floor,https://www.reddit.com/r/formula1/comments/1gu4rbi/exclusive_ferrari_in_las_vegas_with_a_new_wing/,2024-11-18, News,,"['Experimental…. Is it armoured against man hole covers?', ""Translation \n\n\nWith three races to go, McLaren must defend a 36-point lead over Ferrari and 49 over Red Bull , Mercedes had recovered many points in the summer but the threat has quickly deflated. It can be a lot or a few, depending on your perspective. After the start of the season, it was unpredictable to see a Red Bull suffering for 10 races. However, the internal war between Horner and the Austro-Dutch faction had undermined its stability and perhaps its technical clarity . Huge figures such as Newey and Wheatly have left or will gradually leave the team. Some experienced designers and specialist engineers have moved to Ferrari , the recruitment campaign for the 2026 engine was good but did not take away big figures from the competition. Verstappen, Marko and Horner have signed an indefinite truce to at least secure the drivers' title.\n\n\nMcLaren found itself stronger than observers (and even itself) had predicted . Despite several errors of maturity (but it was not the only one this year) it can return to success after 27 years. After Interlagos the team could see the pressure on Lando Norris eased, now with very low chances of bothering Verstappen, which on the one hand cannot be considered positive but on the other it could prove useful to better express its important speed. Red Bull has shown signs of improvement but the Woking car starts as a contender for victory in two out of three races. The task of Ferrari, who finds itself the first pursuer, is not easy and it is not impossible . Not to mention variables out of control such as temperatures and complex conditions, competitiveness in races such as Abu Dhabi and Lusail will fundamentally depend on the position in qualifying. The SF-24 overall was not able to do well on a single lap or at low track temperatures . The situation has improved a lot with the changes in Monza, but it could not be resolved in every condition.\n\n\nExclusive: In Las Vegas, Ferrari will test an experimental chassis useful for the 677 project.\n\n\n\n“If we find something (in the tunnel) we will try it,” Vasseur had said. In fact, the most important updates have been completed, however Ferrari will have a specific experimental underlay available for Friday’s free practice, useful for correlating the new 2025 car . For budget cap reasons, being a component useful only for testing, in America there will be only one underlay that, according to the plans, both drivers will have the opportunity to try for a run. It is certainly a way to verify some steps forward in the implementation of the basic underlay of the 677 model , which will also have a much more advanced design than the current one. Nonetheless, no one is confident that they have definitively stifled the hopping, the engineers want to make sure they continue development with a good anti-porpoising metric (thanks to the Monza spec) in the most sensitive areas.\n\n\nThe real novelty in Las Vegas will be the availability of a front wing that is lighter than the Monza specification (which will be present) that can be used if the track offers satisfactory levels of grip. On the rear, however, the technicians will choose the best option between the SPA and Monza specifications. Ferrari does not have a PU change in its starting program on Leclerc's no. 16. In Brazil, qualifying and the wet race, exceptionally performed on the same day, allowed the Monegasque's freshest unit to be saved stress and km of degradation. The technicians plan to continue the rotations within the elements of the available pool.  This year there will not be a full white and red livery as happened on the SF-23, we will see a small distinctive note. The drivers' and mechanics' uniforms will also feature a logo to commemorate the launch of 'Gladiator II' . The Maranello team knows that the very fast Las Vegas track represents the best opportunity of the three remaining to close the gap on McLaren."", 'If the wing is lighter than the upgrade brought in Monza, I can only hope it works for a track like Las Vegas, which I am still trying to discern whether it could *(and probably, so does the team, given that it will be tested for a bit to assess their chances)*. \n\nStill, I am optimistic for their chances! They were relatively good in Las Vegas, so I hope to see a repeat of that this time around', 'I’m not sure about the experimental floor. We have seen these years with ground effect how critical it could be.', 'The manhole covers of Vegas yearn for the experimental floor', 'Oh boy', 'Lettin Sainz doin some test drive for Sir Lewis is a clever move 😘🤌', 'It’s a giant magnet 🧲 pulls the cover for the car behind', 'Yo let’s let Fred cook, it’s been pretty obvious for a while that the Italian cuisine has needed a touch of French technique!']",50,11,0.95,50,10,10,50,11,0.95,50
