unique_id,post_heading,post_url,publish_time,tag,post_content,top_comments,upvotes,comments,upvote_ratio,score,total_upvotes_comments,total_score_comments,upvotes_growth_rate,comments_growth_rate,upvote_ratio_growth_rate,score_growth_rate
1n0iqp7,Valtteri Bottas on Instagram,https://www.reddit.com/r/formula1/comments/1n0iqp7/valtteri_bottas_on_instagram/,2025-08-26, Social Media,,"['Premilinary Bottas and Perez Cadillac flairs are up, get yours now from the flair menu!', 'Most subtle Valtteri Bottas post', 'What? No more Australian posing?', 'Valtteri is too wild, I hope the Bottass calendar will be back next year.', ""He's wearing more clothes than I would have expected."", ""This isn't even an AI image. This is how he sailed into the beach outside Zandvoort."", 'Hahahahah that son of a bitch', ""That's America's Ass"", 'Its F5 day boys.', 'So that settles one of the seats']",13229,302,0.96,13229,267,267,2743,44,-0.010000000000000009,2743
1n0jb5f,"[Thomas Maher] CONFIRMED: Sergio Perez and Valtteri Bottas will drive for Cadillac in the F1 2026 season, forming a line-up of over 500 Grands Prix experience between them.",https://www.reddit.com/r/formula1/comments/1n0jb5f/thomas_maher_confirmed_sergio_perez_and_valtteri/,2025-08-26, News,,"['Preliminary Bottas and Perez Cadillac flairs are available from the flair menu, get yours now!', 'this is probably the best way to enter this sport \n\ngetting two very expieriened drivers that also have a high frustration tolerance.', 'See’s Valtteri post on instagram. \n\nRUNS TO REDDIT TO CONFIRM. \nLETS GOOOOO 🇺🇸', 'I\'m just happy this is finally official so we can stop with the daily ""about to be official"" posts', 'We are about to get the answer to a lot of questions over the past few years, thanks Cadillac', 'Best possible lineup for new team. Smart move', 'First driver paring of debut teams:\n\nCadillac: Perez and Bottas\n\nHaas: Grosjean and Gutierrez\n\nLotus (Caterham): Trulli and Kovalainen\n\nHRT: Chandhock and Bruno Senna\n\nVirgin: Glock and Di Grassi\n\nI think Cadillac has a damn solid line up for a team starting from scratch.', 'Great line up.', 'Sensible move to start the team, despite being possibly perceived as boring.', ""After a year of sitting on the sidelines guess it's time to root for a new team :)""]",5131,397,0.98,5131,370,370,809,26,0.0,809
1n0jev6,Perez and Bottas to make F1 returns in 2026 with Cadillac,https://www.reddit.com/r/formula1/comments/1n0jev6/perez_and_bottas_to_make_f1_returns_in_2026_with/,2025-08-26, News,,"['Freshly delivered by bald eagle; preliminary Cadillac flairs for Valtteri Bottas and Sergio Pérez. Get yours now from the flair menu!', ""I can finally be at peace knowing I won't see 10 million articles on the rumours anymore."", 'BOTTAS BROS WE’RE SO FUCKING BACK', 'Will be interesting to see who’s faster. I have absolutely no idea', 'Fun fact, this is the first time in history an F1 team has had two number 2 drivers.', ""I know people's memories don't go beyond 2021 and his Red Bull stint but if Cadillac can muster even a half decent midfield car I'm gonna be so pumped for Checo (AND Bottas), he'll be in his element"", 'Very happy for Bottas. Seeing him as third Mercedes driver was a bit sad.', 'Not often you have a team where the younger driver is 36!\n\nScratching my brain here, I think the last team to have this would be Williams in 1992! (Mansell 39, Patrese 38) McLaren in 2016 came close (Button was 36 but Alonso was 35), HRT the same in 2012 (De La Rosa 41, Karthikeyan was 35).', 'To all the people asking for a rookie, are you so bloody ignorant? They need experienced drivers who know how to set up a car and the simulator, know wha to say to the mechanics and the engineers. You take a rookie driver in when you have an experienced team to support them. You take experienced drivers when you have a new team so that they can support it and develop it.', 'I am absolutely flabbergasted. Never would I have thought this would happen. /s']",1464,267,0.99,1464,220,220,224,31,0.0,224
1n0345i,Started my first week at Williams and GF made this!!,https://www.reddit.com/r/formula1/comments/1n0345i/started_my_first_week_at_williams_and_gf_made_this/,2025-08-25, Discussion,,"['Do you have a ring picked out?', ""Congratulations, you've got a cool job and a genuinely great girlfriend."", 'Congrats on the new job!', 'This is incredible! \n\nMy brother started working for a team a few months back, and I’m very much looking forward to crafting him some gifts once their 2026 car design is launched', 'Congrats! No doubt the result of years of hard work. Go weeyums!', 'Marry her', 'Go Weeyums!', ""I'd better be the flower boy at the wedding"", 'Go you and your coworkers!!!!']",1286,35,0.97,1286,32,32,71,1,0.0,71
1n0jzk6,"[Chris Medland] Cadillac F1 Team and TWG Motorsports CEO Dan Towriss admits there were questions for Perez given how his Red Bull stint ended, but that Checo answered them emphatically in meetings, adding: ""Clearly none of the other (Red Bull) drivers have fared well in that second seat""",https://www.reddit.com/r/formula1/comments/1n0jzk6/chris_medland_cadillac_f1_team_and_twg/,2025-08-26, News,,"['And he is not wrong with that, which is why he will have eyes on his stint in Cadillac to see how much of it was on Perez, exactly', 'Checo is one of the exceptionally rare cases of a driver whose stock increased after he was out of F1.\n\nBoth Lawson and Yuki doing even worse this year than him in the second half of 2024 showed once and for all that the problem is primarily the car.', 'In addition, \n\n""We feel very good about Checo, his desire to be in Formula 1, to make a statement, to show the performance that he has and kind of put that last season or so from Red Bull in the rear view mirror.""\n\nhttps://bsky.app/profile/chrismedlandf1.bsky.social/post/3lxchjp6vsc22', 'Checo was a midfield monster before his Red bull stint, let’s hope he regains his form', 'People can mock Checo for his 2024 season and write him off before he’s turned a wheel for Cadillac, but there isn’t an available driver on the market with a better track record of getting results out of midfield and worse cars. He made a career out of getting podiums in cars that had no right to be there before Red Bull signed him, and there’s no evidence to suggest he can’t deliver again when he’s back in a car that isn’t also being driven by Max Verstappen and that isn’t going to be fighting for wins and podiums every weekend.', 'Realistically Caddie is gonna be a low to mid tier team their first season out. The drivers can only work with the car they have. Feel like it will be 2-3 years to really determine how good/bad this team they put together is.', 'Checo simply waved his arm at an enormous pile of sponsorship cash', 'I want Checo to go out and prove people wrong,  but would not be surprised if he still stinks.  😂☠️', ""Can't blame him saying that, lawson's and tsunoda's performances are a great excuse for him. I really doubt if one of those two was on par with Max's perfomance his reputation wouldn't be damaged. It could indeed be something wrong with RB.\n\nAlso we can't ignore he still has a good following and of course sponsor money."", 'Even if he’s not super quick, he’s still bringing years of experience to the team. That, at this stage in Cadillac’s development, will be an invaluable resource.']",847,114,0.98,847,109,109,294,33,0.0,294
1n0jbid,Cadillac Formula 1 Team: Two paths. One call of destiny. The Cadillac Formula 1 Team's future begins with them.,https://www.reddit.com/r/formula1/comments/1n0jbid/cadillac_formula_1_team_two_paths_one_call_of/,2025-08-26, Video,,"[""It's finally confirmed officially! \nThe most surprising part of this announcement was the Keanu Reeves cameo 😂"", 'Finally we’re free from the post every 2 business days saying an announcement is coming 😭 \n\n(but also yay!! Not a surprise but very exciting!!)', 'Keanu Reeves being in the video was the bigger surprise', 'Signing Keanu as TP and Daft Punk as drivers was an interesting twist!', 'My Mexican-American friend who I got into F1 in 2021 has never been able to root for a team this hard.', ""But I thought they didn't sign Checo because he damanded 100 billion dollars and the blood of every first born of Egypt if he won the championship."", 'I was here', 'I had a stupid big grin when I was watching this video. 😀😅', 'We\'re free of the countless ""expected to be announcedc articles at last!', 'Bring on the merch!']",658,72,0.99,658,70,70,66,1,0.0,66
1mzyj2s,F1 | ZANDVOORT: FIA Increases Speed Limit IN Pit Lane to “Liven Up” the GP,https://www.reddit.com/r/formula1/comments/1mzyj2s/f1_zandvoort_fia_increases_speed_limit_in_pit/,2025-08-25, News,,"[""Increase here means to no longer decrease it from the normal 80kph to 60kph\n\n>according to Pirelli's estimates, the improvement\\[in pit stop time loss\\] would be contained between two and three seconds.\n\nPirelli will also be bringing one step softer compounds (c2-c4) to further help with strategy. However, simulations still suggest it will be one-stop (if its dry)\n\n>According to simulations provided by the teams, the one-stop is still quickest, partly because overtaking is notoriously difficult at Zandvoort"", 'Goes from 60 to 80', 'I really wish that Pirelli would create another Bahrain 2025 moment where the strategist are in figuring out whats the best tyre strategy. It was really fun.', 'Idk if it ever happened in F1 when they had no speed limits, but I know a few examples in Nascar of tire guys getting killed because they were crushed by another car. \n\nThe pitlane shouldn\'t be the place to ""liven up"" the race.', 'Ehhhh. Unsure how to feel about this. The speed limit was lower because the pits at Zandvoort are so tight and compact. Raising it doesn\'t sound safe, nor should there be a need for things to be ""livelier"" in the pits', 'guys I have an idea for Monaco', 'Why don’t we just stick a 10ft ramp right before a 20 yard crocodile pit at the end of the pitlane ? That’d liven it up too.', ""Their pits are so crammed together that I don't think that's a good idea. Certainly not safer."", ""[here's what happened in the DTM at Zandvoort ](https://youtube.com/shorts/habbktlGHtg?si=tP_opy7AelDqcIbD)\n\nYikes, I think there's a reason for 60kph in Zandvoort"", ""It wasn't safe but the insanity of barreling down the pitlane over 100 mph was part of what made F1 so much fun in the 1980s.""]",656,134,0.97,656,1839,1839,8,0,0.010000000000000009,8
1n0jm40,Cadillac’s lineup of Perez and Bottas would have the third most overall F1 starts against the current grid,https://www.reddit.com/r/formula1/comments/1n0jm40/cadillacs_lineup_of_perez_and_bottas_would_have/,2025-08-26, Statistics,,"['Stats, more stats and even more stats.', 'Hell yeah new stats! I’m so hyped for 11 teams you have no idea.', 'Crazy how Lance have almost 200 starts, yet he still being called bad. Money is above everything.', ""I think if Danny wanted to be in F1, he would've tried to put himself into the consideration"", 'The irony of a lot of people hailing an 11th team to welcome younger drivers into the sport, only for both spots to be taken by two of the most experienced drivers of all time 😂', 'For a brand new team to pick 2 race winning drivers with such a wealth of experience between them is objectively the best decision they could’ve made. Definitely a promising sign that the project is being well managed.', 'Insane partnership, they both partnered Verstappen and Hamilton when both were in their prime dominant years.', ""It's the perfect lineup imo they don't need elite drivers rn they just need solid top mid table drivers and both Checo and Bottas are that"", 'Please get me Jak Crawford into a reserve role.', 'Charles and Max are same age but crazy they have nearly 3 seasons worth of difference in experience']",590,51,0.99,590,50,50,136,0,0.0,136
1n0jdyh,"‘F1: The Movie’ Crosses $600M At Box Office, Becomes Highest-Grossing Original Film Of 2025.",https://www.reddit.com/r/formula1/comments/1n0jdyh/f1_the_movie_crosses_600m_at_box_office_becomes/,2025-08-26, News,,"['This really has been an unexpected success and a candidate for movie of the summer. Propelled by the popularity of the sport as well as quality of the film encouraging positive word of mouth.', ""I'm impressed. Given how crowded this summer has been in movies with Jurassic World, Superman, Fantastic Four, Mission Impossible and a host of other stuff, it's done pretty well"", 'I recently bought the movie on release and watched it the same night. It’s a fun and enjoyable movie. But it’s real cheesy and not some of Brad Pitts best acting. The action scenes were really great, even if they were significantly dumbed down. \n\nWithout spoiling too much I could have done without the forced romance plot and I wished they would have leaned into the “love of motorsports” a little bit more than they did. \n\nWith that said it’s a good movie to add to the collection', ""I enjoyed. Just going in with the mindset that it is a 'hollywood' movie, not a documentary really made it fun to watch. The visuals are amazing!"", ""Given how the story ended already with APXGP given a new lease of life and with Joshua now being the team lead all while Sonny goes on his own again, I feel like it closed any possibility of a sequel with the same characters. \n\nThough it would be interesting how F1 and FOM might begin to consider another F1-related movie, not necessarily linked or related to the first one (so either set in the current, past, or future era), given the success of F1: The Movie.\n\nI mean the story itself is plain (to put it lightly), but if the money is there, it's not out of the question that a sequel or another movie could be considered regardless of what the story is as long as it still delivers what whoever audience they are catering to wants."", ""*whispers* I still haven't got around to seeing it..."", '\\> Original\n\n\\> Have the most prestigious motosport competition as the title', 'Best movie of 2025 for me', 'Am I the only one who thought it was mediocre at best?  Maybe if I knew nothing about f1 it would have been better? I was literally groaning when they did some.of thst dumb shit.. oh well it got my money though', 'Hands down this is the worst movie I have seen in theater. Watched it yesterday & it was money wasted. Only to ppl not following f1, it would be a good watch.\n\nThe very first race wherein he wastes 15 sec or so as he wanted softs was a huge turn-off. And the absolute contempt for the rules with no repurscussions was laughable.']",434,91,0.95,434,88,88,93,26,-0.010000000000000009,93
1n0j33v,[Cadillac F1 Team] Radio check. Do you copy?,https://www.reddit.com/r/formula1/comments/1n0j33v/cadillac_f1_team_radio_check_do_you_copy/,2025-08-26, Video,,"['Valtteri just posted himself surfing holding an American flag. Maybe we finally get something official today. Maybe we get three more unconfirmed Checo pieces.', ""Great. No response, so their radio isn't working already. Good start!"", 'Absolutely no idea who their drivers could possibly be. I wish there had been some articles that gave some hints', 'Perez posted too, that he’s back', ""Everyone stay calm it's happening"", ""It's gonna be Bottas and Checo, just a matter of time before it gets announced. There will be people saying it's boring and underwhelming but imo they're the best 2 drivers that are currently available."", 'Checo posted as well. We are here boys', 'El Rey de Midfield se vuelve.\n\n  \nWelcome back, Checo!', 'Cadillac just announced Checo and Bottas, refresh refresh', 'official announcement just dropped']",316,28,0.97,316,27,27,31,0,0.0,31
1n0k167,[CarlosSainz55] Summer dump | lifestyle edition,https://www.reddit.com/r/formula1/comments/1n0k167/carlossainz55_summer_dump_lifestyle_edition/,2025-08-26, Social Media,,"['Stupid sexy Carlos…', 'wtf is that white opening, jesus.', 'Poor guy can only afford 1 shirt on his new Williams salary.\xa0\n\nThey must be paying him what they used to pay George.', ""No respect in the way I'm looking, sorry Carlos"", 'Imagine looking that good', 'Bold opening choice by white', 'Carlos so patriotic he’s turning himself the color of the Spanish flag', 'i am ovulating as a man', ""Dude is just a hunka hunka burnin' love"", '*liked by Lando Norris']",240,38,0.9,240,38,38,76,8,0.010000000000000009,76
1n0k0xh,[@schecoperez] Do you remember I told you we will see each other again? #WeAreBack #SP11,https://www.reddit.com/r/formula1/comments/1n0k0xh/schecoperez_do_you_remember_i_told_you_we_will/,2025-08-26, Social Media,,"[""Man Checo's popularity in the NA region is about to go to another level"", 'I really hope this man can get a redeeming podium at some point at least', 'My boy is back \U0001fae1', 'We are so Cadillback', 'I know Checo has a gigantic fanbase but do keep your expectations in check\n\nCadillac is a team built from scratch, yes they hired/are hiring veterans but it’s really not like someone purchasing lotus or force india, it’s really from scratch\xa0\n\nSo it will take years for them to be competitive, they are also using a « temporary » setups with parts from Ferrari before switching to a GM engine in 2028 or so.\n\nThey hired veterans drivers to help them build a car and a team, not win championships for now imho\xa0', ""It's no longer Checover! We are fucking back 🤩🤩🤩\n\nI missed him so much."", 'ChecOn!', ""You know what? I'm glad. Perez and Bottas are a good lineup for entry F1 team."", ""Man, after seeing Bottas' post I was kinda hoping to see Checo at the gun range, hitting bullseyes with a beer in one hand and a bald eagle on his shoulder."", ""r/formula1's villain is back""]",235,43,0.96,235,42,42,50,9,0.010000000000000009,50
1n0mc6b,[@f1] Checo and Valtteri react to @cadillacf1's driver announcements... you'll never guess who it was?!,https://www.reddit.com/r/formula1/comments/1n0mc6b/f1_checo_and_valtteri_react_to_cadillacf1s_driver/,2025-08-26, Social Media,,"[""While I still think they'll be last next year this is the perfect pairing to pick up points when others falter, with brand new regs too there should be higher unreliability"", 'This is gonna be such a fun lineup for the vibes. I think Checo will be way more relaxed without all the outside noise and politics of Red Bull, and Valtteri is Valtteri.', 'Not sure how competitive the car Cadillac puts out year one is going to be able to be, but this driver line up has the makings to be one of the most popular with the fans from the get go.', '[source](https://www.instagram.com/reel/DN0cBYCXHxi/)\n\nValtteri is sorted for Tequila', 'omg I am smiling so hard just looking at their happy faces, I missed them both so much \U0001f979', 'Checo really had the last laugh with Horner didn’t he.', 'I told my wife I felt like my spirit animal Valtteri was just revived. He just seems like a dad that likes beer, oh but he can drive too', ""Now this.... this should've been the plot to the F1 movie."", '""Keanu Reeves!?""', ""Never would have expected it but I'm low-key happier than expected""]",227,34,0.98,227,34,34,164,19,0.0,164
1n0h7la,Aston Martin can't help but wonder – what could Adrian Newey have done to its 2025 F1 car?,https://www.reddit.com/r/formula1/comments/1n0h7la/aston_martin_cant_help_but_wonder_what_could/,2025-08-26, News,,"['The choice was the right one. Whatever he could have done, by the time he joined it was too late to bother trying. 100% 2026 push.', 'It\'s not reasonable to place demands or What If questions over Adrian Newey who needs a reasonable amount of time to understand the car and where it can be iterated.\n\nIt\'s not as simple as ""he\'ll make it just like the 2023 Red Bull!"". Newey is not infallible. There is some possibility (but only some) that Newey was heading down the same road as Pierre Wache.\n\nYes. Obviously he would not admit it and he has the benefit of saying he wasn\'t involved with the 2024 and the 2025 project. But those familiar with Newey and his career also can see that he has not always ended a rules cycle on top.\n\nWith Aston Martin, again, you cannot ask a team of tens or more designers and engineers to just throw away everything for 2025 and ""listen to the rock star"". You could try that. But it would just result in a LOT of risk on the new ""first model"" of the new car.\n\nAlso you\'re paying Newey the big bucks.... Why should he spend his time fixing other people\'s homework for 2025?\n\nThe reason Newey can and should only work on the 2026 car is that it is the best use of his time and energy and best adaptation period for him and the team.\n\n2025 is useless to look at in terms of Newey\'s interventions.', ""Then perhaps they would have been more consistently in the upper midfield and would end up finishing 5th instead of 6th or 7th where they will likely end up. This isn't a very big what if at all and I doubt Lawrence Stroll overly cares. \n\nThe big what if for Aston Martin is what if they could have actually developed their 2023 car at a similar rate to that of McLaren, Ferrari or Mercedes. If they'd done that then there's a good chance they'd have gotten a race win in 2024."", 'I really hate how F1 fandom takes individual skill and contribution to the extreme. Newey is obviously extremely knowledgeable and being more ""old school"" probably helped them set a good direction in the cost cap era. But he isn\'t coming in at the 11th hour and making any impact to this years car.', '""Now, pay attention, Double-Oh Fourteen: here are the buttons for the engine mode, ERS, DRS and the radio. And this, I am *particularly* proud of: the ejector seat for the other car ...""', 'Every Formula 1 team has the same thought', '> ""There\'s a dozen other people that have joined in leadership roles and tools that have improved. If all of that had been focused on \'25 car development, where would we be compared with now? Now, our opponents would have improved as well, but I feel like with the horsepower of Adrian and the other equipment that is better than it was six months ago, we would be further up the grid and collecting more points over the second half of the season.""\n\n\n(Fifth)', ""Why should they care they know full well this is a throwaway year to focus on what I and they hope is a title tilt next year and in the future with Newey \n\nNewey is the goat designer by a mile but is getting on and who knows how long he's got until retirement so have to go for it asap"", ""I liked the story that, informally, if folk even discuss the 2025 car he'll go and sit at the other end of the table. He'll go back to his office."", 'Throw it in the trash bin?']",215,21,0.92,215,20,20,21,2,0.0,21
1n0kqmg,Cadillac Sign Valtteri Bottas and Sergio Perez For 2026!,https://www.reddit.com/r/formula1/comments/1n0kqmg/cadillac_sign_valtteri_bottas_and_sergio_perez/,2025-08-26, Video,,"[""Well,\xa0 it's finally final.\xa0"", 'this is most likely the only ""silly season"" moment of 2025 but it\'s good news - tbh it makes sense for a newbie team to have two experienced drivers since they can have a better understanding of eventual issues with the car, among other stuff', ""Well, thankfully it didn't drag out like the rumor of Max going to Mercedes"", 'Finally my man Checo gets his return to the grid! Now I want to see the team deliver them to the Circuit of the Americas next season in a classic Cadillac convertible.', 'so eh, who do they make first driver?', ""how many champions, rookies, careers, alphas and omegas haven't had a chance to shine because Ham and Alo lmao!"", 'How final is this?', '26 seasons of experience, with 16 wins between them. Pretty good choices for a brand new team, their experience will be very valuable.', 'Is it though', 'Did we already forget the horny sacking?']",178,15,0.98,178,12,12,46,5,0.0,46
1n0jo25,Cadillac firmly rules out Horner F1 approach,https://www.reddit.com/r/formula1/comments/1n0jo25/cadillac_firmly_rules_out_horner_f1_approach/,2025-08-26, News,,"['Good. It was always a silly notion. \n\nGraeme has a good head on his shoulders and a good approach to team building.', ""Good. You want a fresh start and Horner has too much baggage. Personally I'm pumped to see this team primarily because we will get Checo and Bottas back.\n\n\nIn my worthless opinion Cadillac should go after Komatsu hard, he's absolutely killing it with Haas."", 'Checo breathes a sigh of relief.', 'Happy to hear that', 'Would have spicen up things a little(a lot).', ""Horner going to Cadillac was always a ridiculous suggestion. You don't replace your management that's spent years building a team a few short months before the season starts."", 'Thank you. Well done Cadillac. You are already becoming my fav team.', ""Would've been a great addition tbh"", 'Return of Guenther?', 'A ridiculous rumor started by an unreliable source (clickbait website).']",135,31,0.97,135,30,30,43,2,0.010000000000000009,43
