unique_id,post_heading,post_url,publish_time,tag,post_content,top_comments,upvotes,comments,upvote_ratio,score,total_upvotes_comments,total_score_comments,upvotes_growth_rate,comments_growth_rate,upvote_ratio_growth_rate,score_growth_rate
1kgt5h4,Doohan's F1 career is over [german comment],https://www.reddit.com/r/formula1/comments/1kgt5h4/doohans_f1_career_is_over_german_comment/,2025-05-07, News,,"['Did someone say career over?\n\nhttps://preview.redd.it/3gro0zqg2cze1.jpeg?width=589&format=pjpg&auto=webp&s=369fbb31630782beae9d84a51ba3d3bc3a78928b', ""At this point Alpine have just become the Temu version of Red Bull. All the drama without any of the performance.\n\nThey're binning off engine manufacturing, alienating drivers, firing staff, and the team is in total disarray in terms of direction and performance. \n\nIt just feels like Renault should sell the team off to someone who actually wants the two grid slots."", ""Now if only they could understand that Mick Schumacher's F1 career is also over."", 'Excited to see him in Indycar/WEC/WRC/Nascar/Reserve Driver/Commentator/Podcaster/Youtuber or whatever career he chooses in the world of washed out formula 1 drivers!', ""* **Jack Doohan's Formula 1 career is effectively over**: Due to poor performance and lack of development, he was removed from his Alpine seat by Flavio Briatore — even though Briatore was his own manager.\n\n* **Flavio Briatore is taking tough action at Alpine**: Amid chaotic conditions and heavy pressure from Renault, Briatore is trying to save the team with radical decisions, including sacking team boss Oliver Oakes and replacing Doohan with Franco Colapinto.\n\n* **Colapinto is under enormous pressure**: He must prove himself within just five races, or he too risks being quickly dropped — highlighting the extremely tough situation rookies face in today's Formula 1."", 'Anyone else think he bears a strong resemblance to a Minecraft villager?', 'Has Renault ever stopped and thought, maybe trusting the cheating thug is part of the problem? Do they really think creating a toxic environment with a hated advisor and placing immense pressure on their drivers will bring out the best talent?\n\nWho would want to join their driver academy in this state. I’m new to F1 so apologies if im mistaken, but weren’t they shit the last time Flávio was there too? Before he told a driver to crash of-course.\n\nEdit: Okay I was wrong, they have deeper problems than Flávio. But if they’re picking cheaters like him to run their team, well I think we’ve pinpointed at least one problem with their management style…', 'Doohan proved me wrong. He was much better than i expeted he was going to be', 'Over?? Backwards step. Colipinto will likely crash several times in his 5 race contract. \n\nWith a new team added next year he may still snag a seat. He was improving rapidly.  Some time as a test driver may be in his benefit.']",54,60,0.77,54,57,57,29,16,0.020000000000000018,29
1kgu4kg,ANALYSIS: Why Alpine chose to promote Colapinto and bench Doohan – concluding a dramatic 12 hours after Oakes' resignation,https://www.reddit.com/r/formula1/comments/1kgu4kg/analysis_why_alpine_chose_to_promote_colapinto/,2025-05-07, News,,"['https://preview.redd.it/qow4r1s4acze1.jpeg?width=1080&format=pjpg&auto=webp&s=ada60aea879c03a097ab0daa6664b9e4faccbda6', 'Joke of a team.', ""The sad thing is, I don't have anything against Colapinto personally, but if he struggles in that car, I'm not going to be able to help myself from enjoying the schadenfreude.\n\nThat's not the kind of F1 'fan' I want to be. But at this point, I want to see Alpine's leadership actively fail given how they've acted over the last five years."", 'Imagine your last ever race in F1 and your last action was being taken out by Lawson.\xa0', 'Alpine junior program somehow became even more useless.', 'The 100 race plan eats its young', 'Somehow everybody is betting on Franco to fail either because of his fanbase (not his fault) or hate towards Alpine / Flavio. Not a good way to start your second F1 journey. \n\nBut Hadjar last year was mocked as well because of his temperament and radio messages and people were hoping to see him fail to hear his outbursts. Luckily, he’s doing really well. \n\nThis is the type of thing I don’t get as a fan, honestly.', 'Because what was once a historic power house (Renault) in the sport 4 years ago is now just a money machine without any passion?', "">It remains unclear why Oakes left the team, with Briatore now taking on full responsibility for the racing outfit.\n\nReading between the lines a bit, it sounds like Oakes quit in protest over the dropping of Doohan. Maybe not because he supported Doohan and wanted to keep him in the seat, though -- probably because Briatore wields a lot of influence behind the scenes. Oakes always felt like a temporary figure in the team, especially given the talk that Renault are looking to sell it. Given that he aligned himself with the Mazepins, I don't think Oakes is some paragon of moral virtue; rather, I think he's playing Pilate and washing his hands of it. It's generally believed that ten teams is the minimum number that the sport could compete with, so Cadillac's entry means that the sport is less dependent on Alpine. My guess is that this either ends in the sale or the closure of the Enstone team.""]",29,38,0.85,29,36,36,21,29,0.15000000000000002,21
1kgq89v,Ask r/Formula1 Anything - Daily Discussion Thread,https://www.reddit.com/r/formula1/comments/1kgq89v/ask_rformula1_anything_daily_discussion_thread/,2025-05-07,,"# Welcome to the [r/formula1](https://www.reddit.com/r/formula1/) Daily Discussion / Q&A thread.

This thread is a hub for general discussion and questions about Formula 1, that don't need threads of their own.

Are you new to Formula 1? This is the place for you. Ever wondered why it's called a lollipop man? Why the cars don't refuel during pitstops? Or when Mika will be back from his sabbatical? Ask any question you might have here, and the community will answer.

Also make sure you check out our [guide for new fans](https://www.reddit.com/r/formula1/wiki/newtof1), and our [FAQ for new fans](https://www.reddit.com/r/formula1/wiki/faq).

Are you a veteran fan, longing for the days of lollipop men, refueling during pitstops, and Mika Häkkinen? This is the place to introduce new fans to your passion and knowledge of the sport.

Remember to keep it civil and welcoming! Gatekeeping within the Daily Discussion will subject users to disciplinary action.

Have a meta question about the subreddit? Please [direct these to the moderators](https://www.reddit.com/message/compose/?to=/r/formula1) instead.","['OMG! TIL Flavio is Doohan’s Manager!!!!! I just can’t believe it!', 'For anyone interested in learning more about Flavio and crashgate the latest episode of this podcast was all about crashgate (very conveniently!)\n\nhttps://open.spotify.com/episode/0n6yWRGYOzKTDgpHrzwY5O?si=ylI2D0MYQtGP42z8zdb1OA', 'What do you think is the most underrated individual season of all time from a driver?', 'Explain to me like I’m 5 why is Flavio back and allowed to be in a high ranking Alpine position? I thought he was banned for life?', 'Liam Lawson had a 5 race stint in 2023 and a 6 race stint in 2024. If Jack Doohan returns to F1 in a different year do we discard his 1+6 races and call him a rookie then, like how we discard Liam Lawson’s 5+6 races before to call him a rookie this season?\xa0\n\nIs Franco Colapinto counted a rookie from the next race, discarding his 9 races last season? If he stays on for just the 5 races lined up and started f1 from round 1 next year just like Lawson has do we call him a rookie then?', 'Cuando esta the grand prix man\n\nMamma mia 😡', 'Alpine is suffering with incompetent leaders and their non-accountabilities.', ""Briatore arrives. The car has some mystery results, and shenanigans occur.\n\n\nWow it's almost like we've seen this before.\xa0"", ""Jean Behra in 1956 comes to mind.\n\nHe was leading the championship for the first three rounds (becoming the only non-Grand-Prix winner to lead the Driver's Championship), scored five podiums in seven starts (being hampered by mechanical problems in the other two races) and was still in contention for the Driver's Championship in the final race of the season."", 'I’ll give some of my ones I think are underrated:\n\nLauda 1978 - People talk about Lauda’s Ferrari years as his peak, but his 1978 at Brabham was just as good, easily beating Watson, one of the best drivers of the late 1970s and early 1980s.\n\nLaffite 1981 - Scored all of his teams points and fought for the championship until the final race in a Ligier.\n\nDe Angelis 1984 - Incredibly consistent results, easily beat Mansell and took 3rd in the WDC despite only driving the 4th/5th best car.\n\nSenna 1985 - When people talk about Senna’s career, they usually mention Monaco 1984 and then just skip straight to his McLaren years. They usually ignore his Lotus years which really put him on the map. He easily beat De Angelis and would have challenged for the title with better reliability.\n\nRosberg 1985 - Rosberg is frequently referred to as the worst champion ever, something I cannot get my head around. 1985 was him at his best, thrashing Mansell and similarly to Senna would have fought for the title with better reliability.\n\nSchumacher 1993 - Senna is frequently praised for his heroics in 1993, but I think Schumacher was almost as good. He thrashed Patrese by a far greater margin than Mansell or Piquet could and finished on the podium every race he finished despite driving the third best car.']",4,24,0.64,4,21,21,1,8,0.0,1
1kgrnbb,Our verdʻīct on Alpine's team boss exit and driver swap mess,https://www.reddit.com/r/formula1/comments/1kgrnbb/our_verdʻīct_on_alpines_team_boss_exit_and_driver/,2025-05-07, News,,"['Someone buy them a fucking thesaurus\xa0', 'Why have you written verdict in such a strange way? I noticed you did it the other day as well. Is the word verdict banned?', ""It's part of their brand at this point"", 'It should be banned, at least that’s my verdict', ""Only in the-race's articles, yes."", 'I like it, mostly just because of how triggered people get by it', ""I do think it's hilarious that they try to position themselves as an authority on every subject, even when 95% of the time their take is the same as everyone else's."", ""That's strange"", ""Do they? Don't they just position themselves as another F1 outlet? Personally I like them but I don't get the impression that you do from them""]",4,13,0.55,4,12,12,3,1,0.040000000000000036,3
1kgvg5b,MercadoLibre Colapinto announcement,https://www.reddit.com/r/formula1/comments/1kgvg5b/mercadolibre_colapinto_announcement/,2025-05-07, Video,,"['Well colour me shocked /s', 'Seems like the date was decided a while ago if they had an ad ready saying ""See you at Imola""\n\n(Or perhaps they filmed multiple endings?)', 'Yellow + blue Alpine incoming?', 'Need to buy me some Mild Sevens if they are still going.', 'Oh... Whoa whoa... A legacy libery to that Renault could be insane!']",7,6,0.65,7,5,5,7,6,0.65,7
1kg7ds4,Candidate with a Formula 1 newcomer - Will Schumacher get another chance?,https://www.reddit.com/r/formula1/comments/1kg7ds4/candidate_with_a_formula_1_newcomer_will/,2025-05-06, News,,"['Mom says it’s my turn to write a Schumacher-returns article', 'I read the title and asked myself ""Who TF is Will Schumacher?"" hahaha', 'How is he doing in other series?', "">\xa0Two drivers with Formula 1 experience will be entering the premier class.\n\n\nIs this a contradiction/translation issue or are Drugovich and O'Ward considered drivers with F1 experience simply for having done FP sessions and simulation sessions?\n\n\n> The following names are being traded: Sergio Perez, Valtteri Bottas, Guanyu Zhou, Felipe Drugovich, Patricio O'Ward.\n\n\nAll in all, I think it's a decent line-up for a first time entry team if any of these get picked.\xa0Though I'd say Zhou is probably the least inspiring name in there. At least Schumacher had the H2H on his side versus KMag.\xa0\n\n\nI'd rather they go for drivers that haven't done basically pretty much a whole career already, but I understand that as a new team they need at least one experienced driver.\n\n\nThey could do like Audi and pair one veteran with a rookie or they could put two veterans in there and decide which of them is better suited for the long run.\xa0\n\n\nAs for Mick Schumacher specifically, I wouldn't mind either way. I think he didn't really get a fair shot the first time around (HAAS truly was a mess in his rookie season on pretty much all fronts),\xa0but I also think that we're three years on from when he left and his time might have simply just past.\xa0\n\n\nI guess no matter how many seats there are in F1 someone will still miss out."", ""He's doing pretty well in WEC, he should just sta there and focus on that."", 'If they pick both Checo and Mick, you know they are here for the marketing.', ""People keep downvoting the Schumacher articles like it's baseless speculation, it's not, reliable sources are saying he's holding talks.\n\nImo though, if Cadillac want safe, experienced drivers then it's very obvious you should put Checo and Valtteri in the car, you get good feedback from two very experienced drivers and their skillsets mean you'll know exactly how good the car is on it's tyres and in qualifying respectively because they're both very strong in those areas. But I'm guessing they don't want two older dropped drivers, it might give off a retirement home vibe."", 'Shumacher to Cadillac, Doohan takes his spot in WEC, \n\nUnlikely but hey, it’s something', ""Surely this is the last possible year where Schumacher has a halfway viable shot at a seat, right?\n\nHe'll have been out of F1 for 3 full seasons going into 2026. At some point, the gap (combined with his age and his performance in F1) is not going to worth it for teams, especially since he's been passed over multiple times already. \n\nWhy pick him when Bottas or Pérez are available? I like him a lot, but I just can't see what the upside would be.""]",0,77,0.34,0,573,573,0,0,0.0,0
