unique_id,post_heading,post_url,publish_time,tag,post_content,top_comments,upvotes,comments,upvote_ratio,score,total_upvotes_comments,total_score_comments,upvotes_growth_rate,comments_growth_rate,upvote_ratio_growth_rate,score_growth_rate
1h7qb2v,Kick Sauber‘s China Social Media Published a Emotional Farewell Video for Zhou and Bottas.,https://www.reddit.com/r/formula1/comments/1h7qb2v/kick_saubers_china_social_media_published_a/,2024-12-06, Video,,"[""Felt like I'm watching a low budget kdrama lol. Really cute though."", 'I’ve been a fan of bottas since 2013. Since then, he’s been my 3rd favourite been Lewis and Danny Ric. And now Danny Ric is gone, bottas is gone after this race, and Lewis is 40.\n\nMy 4th and 5th fav were Seb and Webber and they’ve gone too 😭.\n\nIm starting to feel like an old man. The f1 drivers I grew up with are all going or gone.\n\nI’m gonna miss bottas, idk why but I instantly took a liking to him. Maybe it’s because he was my teammate in f1 2013. And he’s just a chill guy', 'This is really just a massive meme in the Chinese Social Media originated from a Japanese Anime called “MyGO”. No one there will see this video and that background music with a straight face. It’s not even emotional…it’s a joke', ""Sauber's car usually performs poorly in a hot climate. Most likely they will have mediocre performance for the last racing weekend. But I guess that it won't take long till we see them back on track, those freshmen next year may suffer lots of car damage and be replaced after mid-season."", ""I didn't see most of the posters, but they are so cool damn"", ""What are the odds of me finishing watching MyGO!!!!! like literally yesterday and today Kick randomly chooses their (most important) song for a Kick farewell video?? It's not even in chinese. Video hit much harder knowing the song though"", 'It gives me more of a knockoff karaoke vibe, but I can see kdrama', 'You mean cdrama?', ""Oh you mean fucking Bandori, bruh that's funny, still a good tribute though""]",298,12,0.96,298,184,184,6,0,0.0,6
1h7z1cq,[Chris Medland] Sauber confirms its 2025 driver line-up of Hulkenberg and Bortoleto will take part in the post-season test on Tuesday,https://www.reddit.com/r/formula1/comments/1h7z1cq/chris_medland_sauber_confirms_its_2025_driver/,2024-12-06, News,,"['Good. Bortoleto really needs some seat time in F1. He’ll be by far the least prepared rookie next year. If the car is just as bad next year that shouldn’t matter too much as he won’t be able to get good results anyway', 'So Ocon and Bearman will do the test for Haas?', ""I'm surprised how many drivers get to drive for their next teams in this year's test. Usually they'd have to wait until the new year for contract and sponsorship reasons. That said, I wonder if we'll get to see some blank suits/helmets or even cars."", ""Wasn't this post-season test meant *only* for rookies/driver academy drivers of each team?"", ""Idk about that, with how much money they've had to spend this year alone, I dont think Williams will be doing very well either. There is also Alpine having had their relationship with Renault ended after shit results, having to get Mercedes engines now, and having a rookie who might also have the extra pressure of needing to perform well in an early number of races otherwise his contract wont get extended for the rest of that year.\n\nI dont think Sauber will be blitzing throw P10s and P9s, but I doubt their situation next year will be as bad as this year"", 'Their car is already looking much better ...', ""ocon was released early only because of that and whatever meaningless animosity they have for him. bearman is a rookie so it's a given."", ""There are 2 tests. One is only for rookies, the other is a Pirelli Tire Test for next year's compounds."", 'Yeah I really hope they can keep momentum.', ""They scored points in a crazy race they also scored points at last year. Let's not get ahead of ourselves. It's still a tractor.""]",299,23,0.98,299,21,21,23,1,0.0,23
1h7hmqm,[Chris Medland] GM has announced Graeme Lowdon will be team principal of the Cadillac F1 team as it prepares for its planned entry in 2026,https://www.reddit.com/r/formula1/comments/1h7hmqm/chris_medland_gm_has_announced_graeme_lowdon_will/,2024-12-05, News,,"['And he is Zhou’s manager…', '![gif](giphy|VMgcrwq9imGHu)', 'Got a lot of time and respect for Graeme. He did his best with marussia on a budget that was basically week to week. Managed to talk to him on Monaco, before and after their point, and the difference that point made to the team was phenomenal. Be nice to see him back.', 'Manor Marussia, is that you?', ""That's a name I haven't heard in a while. Bit random - thought he'd basically left motorsport"", 'I thought Otmar was getting it without a doubt, did not expect this name to come back damn', 'I\'ll accept it but it should have been Tim Cindric or Chad Knaus or some other freedom™ loving American® racing man. Someone who embodies ""rubbing is racing""™®.', 'American team for Americans in America with a Chinese driver would be the funniest.', '**DID NOT SEE THAT ONE COMING.**']",248,54,0.95,248,687,687,0,0,0.0,0
1h83soz,"Lewis Hamilton: The car felt better today. “From arriving to seeing the engineers, and just taking moments and really capturing them as much as I can"" I’ve really enjoyed the day, I’ve really enjoyed driving the car today",https://www.reddit.com/r/formula1/comments/1h83soz/lewis_hamilton_the_car_felt_better_today_from/,2024-12-06, Video,,"[""Yep he's screwed tomorrow"", '“\\[The car\\] felt better today\n\nEngineer *""anyway so we made some setup changes from yesterday""*', 'Full quote:\n\n“[The car] felt better today. It’s not been such a bad day. Very surreal, and I’ve tried to be as present as I can be today and enjoy every moment.”\n\n“From arriving to seeing the engineers, and just taking moments and really capturing them as much as I can. And then getting ready and getting in the car.”\n\n“I’ve really enjoyed the day, I’ve really enjoyed driving the car today and working with the guys in the garage. We’ve got done work to do, the McLarens are still  so fast as is Ferrari. We’re in the mix kinda but we’ve got to find some time.”', 'Did they give him a shitty car the whole second half of the year and give him the good one for the last race?  lol.', 'P7 incoming just to crush our last weekend hopes 🥲', 'The Practice Champion this year', ""Toto 'no George, today i'm not hitting the -14% power button on Lew's car' giving Lewis a proper end."", ""Would be weird if he's suddenly beating George again this weekend."", 'His race pace is on par with Mclaren, i really hope he qualifies well cause he could get a podium here', 'It might have been a shitbox but at least it is/was his shitbox \U0001f979']",263,34,0.96,263,33,33,100,5,-0.010000000000000009,100
1h7ex8g,"[@MercedesAMGF1 on X.com] Imagine…Thank You, Lewis",https://www.reddit.com/r/formula1/comments/1h7ex8g/mercedesamgf1_on_xcom_imaginethank_you_lewis/,2024-12-05, News,This has moved me to tears,"['Lewis and the W11 = God-like', 'All Esteban Ocon got was a photo! Hahaha Alpine. What legends. Fair well Lewis, onto the next chapter.', ""Partnership that will always be remembered, and you don't want to ever end..."", 'https://preview.redd.it/ht89brutq25e1.jpeg?width=719&format=pjpg&auto=webp&s=9d8216daccadd0229abca1afad85f8c3e7f1b815', 'People have been complaining about Mercedes  just writing “thank you Lewis” across the different posts as though it’s not enough but from the repetition it seems Merc want that to be picked up by fans and trending', '![gif](giphy|Q81xU9aRthmJEFn6bZ|downsized)', 'Too bad George and Toto had to hijack the narrative this weekend. Instead of shining the spotlight on Lewis they’re still crying about stuff that was addressed earlier in the week and last weekend.', '![gif](giphy|xUOxfmpXV1c3bmuEzm)', 'I’ve been avoiding watching this video to not cry… but man 😭😭😭 I’m a mess! What a beautiful tribute ❤️', 'Every team deserves a team. \n\nThank you Lewis. \n\n\nWHaT']",233,16,0.91,233,143,143,-4,0,0.0,-4
1h7sy0e,Kimi Antonelli and Ollie Bearman to participate in the Super Formula pre-season test at Suzuka on December 11-13,https://www.reddit.com/r/formula1/comments/1h7sy0e/kimi_antonelli_and_ollie_bearman_to_participate/,2024-12-06, News,,"['That’s random. Why?', ""Did not see this coming at all. Usually when a former F2 driver participates in the SF post-season test, it meant they'll be in the series the following year (see: Lawson, Iwasa, Pourchaire before the Arrow McLaren saga)\n\nBearman makes sense given the Haas-Toyota partnership, but Kimi? Where did that come from?\n\nIt's to probably get these two some mileage in a track neither has any experience in ahead of next year. But, part of me thinks Prema might consider expanding its efforts to the series soon.\n\n*Edit: Kimi won the FIA F4 Cup in 2022, which ran KCMG chassis, and has that in his F2 race suit. He'll probably be testing for them during those three days.*"", 'I guess any single seater experience helps!', ""Easy track time at an F1 circuit that isn't part of the main feeder series calendar. Not sure if either driver has had a race there before."", 'I think Mercedes has seen their driver struggle not being able to adapt to these cars and they want to make sure their new driver has driven different types of cars to learn how to be an adaptable driver', 'Chance to bring some media attention to SF, and always good to get extra seat time in high downforce cars. If I had to guess.', ""I've seen a lot of other drivers announced as well who I would be shocked to see in Super Formula seats. I would guess that they need to give spots to rookies, and they talked to some F1 teams/drivers. It is a very good opportunity for these drivers to drive a different kind of car, one that allegedly is a good bridge between F2 and F1."", ""More laps in cars he's allowed to and probably as close to F1 as you can get."", 'Suzuka is only the third race next season. I expect this is so that Bearman and Antonelli can gain some experience in a high-downforce car on a notoriously difficult track neither of them have driven before.']",224,15,0.96,224,278,278,-1,0,0.0,-1
1h8265g,2024 Abu Dhabi Grand Prix - Free Practice 2 Classification,https://www.reddit.com/r/formula1/comments/1h8265g/2024_abu_dhabi_grand_prix_free_practice_2/,2024-12-06, Statistics,,"['Gonna be an anti-climax of a race, won’t it?', 'THE HULK PODIUM DREAMS ARE ALIVE.', 'Ferrari and McLaren at the front and Russell and Max at the back…maybe that’s the best of both worlds for the storyline.', 'Hulk podium, this is not a drill.', 'STOP THE COUNT', ""I want to believe in Williams... But I know they will find a dead mouse in Alex's engine and a hair of Charles dog will get stuck on Colapinto's exhaust."", 'Give Hulk that podium plssss', 'HUUUULK', 'Checo ahead of Max, clearly deserves to race for them in 2025, even beyond.']",227,86,0.99,227,80,80,24,4,0.0,24
1h7ztte,Stewards document regarding alleged Impeding of Car 4 (Norris) by Lewis Hamilton. With the decision : 'No further Action' ,https://www.reddit.com/r/formula1/comments/1h7ztte/stewards_document_regarding_alleged_impeding_of/,2024-12-06, News,,"['""kind of a misunderstanding"" - that\'s interesting terminology', ""Duh, it's FP, there's never grid penalties, at most a reprimande I think."", 'Lewis and Lando should start some pretend beef over this and act like they are really mad at each other', ""Not that crazy right? Can't even remember the last time they gave a penalty for impeding during practice"", 'It’s the correct decision. Funny wording but correct. \n\nIf the FIA wasn’t such a joke we wouldn’t have to talk about the rare times they get it right. lol.', ""Are people ITT really expecting a penalty for this? In practice?\n\nI understand some of you want to points score but that doesn't mean you switch your brains off."", 'The guys in the comments clearly watching their first ever race.', ""\\*Allen Iverson voice\\* We're talkin about PRACTICE."", 'This post will be fun.']",201,105,0.94,201,93,93,18,0,0.009999999999999898,18
1h82yzi,[Alex Jacques] This will be my final year as the Formula 2 commentator,https://www.reddit.com/r/formula1/comments/1h82yzi/alex_jacques_this_will_be_my_final_year_as_the/,2024-12-06, Social Media,,"[""a genuine tragedy for F2\n\nas long as we don't lose him for F1"", ""Always loved how it's clear he genuinely loves racing. Even when there's a battle for 26th, he treated it no different than for 1st. Need more truly unbiased input like his and Hinch around."", ""I can imagine it's a bit much for him and his voice to do all of it. As long as he stays in F1. I like him and Palmer (plus Hinch) so much better than Crofty and Brundle together. Nothing against Brundle, I just don't like them as a duo personally."", 'A massive loss for the F2 broadcast. Like no jokes this is a massive hit.\n\nF3 is already so much worse off once he left.', 'Who can tell me about the driver from Barbados now :(', 'Murray Walker of F2', 'he is an amazing commentator, glad we get him in f1', 'please not mccarthy pleast not mccarthy please not mccarthy', 'Sheesh i was worried for a sec this was abt f1', 'As long as he ain’t giving up F1, bless the maker']",210,25,0.98,210,25,25,65,9,0.0,65
1h7ebgf,[F1] The state of play as we head into the final round,https://www.reddit.com/r/formula1/comments/1h7ebgf/f1_the_state_of_play_as_we_head_into_the_final/,2024-12-05, Social Media,https://x.com/F1/status/1864718628144197932?t=uHttyRmCIlz7bx_QKQR18Q&s=19,"[""> constructors pie\n\nI don't think people cut pies like that, F1."", 'Am I the only one who thinks this graphic isn’t ideal to represent a pie chart?', 'I hope Haas overtakes Alpine.', ""You go, Sauber! I was convinced they'd end up with zero, good for them"", ""Hmm while this is a good graphic, it kinda implies McLaren has won the title? They could just add the maximum points and leave a lil bit space cause\n\nIT'S NOT OVER YET!!!\n\n(Ferrari hopium has been strong this year)"", 'It still feels strange to see Sauber with points lol', 'Damn was Alpine ever lucky.\n\n\nStill mind blowingly pitiful for a constructor, but that double podium sure pulled them up and made them look...\n\n\nnot *completely* incompetent.', ""This chart is unpleasant to look at.\n\nI don't like being promised pie and being deceived instead."", 'I actually have a feeling everything graphically in F1 from from F1/FIA has to be round, no matter the logic behind it', 'The only Williams driver who can score points\n\nhttps://preview.redd.it/71hkuvyde25e1.png?width=697&format=png&auto=webp&s=4b62fbb939496b3b57c4f12bd2bea1bf26aaf015']",162,41,0.91,162,466,466,1,0,0.0,1
1h7f3t1,"Lewis Hamilton Drives the Mercedes W04, W05 & W09 For Final Time in Farewell Tour! | F1 2024",https://www.reddit.com/r/formula1/comments/1h7f3t1/lewis_hamilton_drives_the_mercedes_w04_w05_w09/,2024-12-05, Video,,"['This video looks like it was cobbled together or ripped from an actual legitimate video, I believe Sky Sports F1 is going to be releasing something...', '![gif](giphy|xUOxfahI5hczGwhShi|downsized)', '![gif](giphy|26Ff2GWGL3lo1PI0o)', 'Is Lewis the one you can hear kind of screaming at 2:25?', 'Meanwhile, Romain Grosjean is still waiting for his chance. \n\nIYKYK', 'This is how you send a driver off. Take note Red Bull.', 'Toto knows how to gift. Best gift a driver can get is racing F1 cars, for sure!', 'INB4 he puts all three into the wall out of spite', 'Seems that way, but a nice gesture by Mercedes nonetheless.', 'That’s because it is. This is unedited B-Roll clips, supplied to media by Mercedes. Similar to how you can find clips on Red Bull content pool that end up on The Race, Sky News or elsewhere.']",141,15,0.91,141,103,103,2,0,0.0,2
1h809sb,"According to NOW, Neapolitan nativity scene makers made this Hamilton in Ferrari attire",https://www.reddit.com/r/formula1/comments/1h809sb/according_to_now_neapolitan_nativity_scene_makers/,2024-12-06, Social Media,"Naples (Via San Gregorio Armeno in particular) is well known for its nativity scene makers, which have included for years contemporary VIPs such as politicians, sports people, etc. Source for the pic is their official Instagram account: https://www.instagram.com/p/DDPAGJDolKB/?igsh=MWR4OWY5cWV4Y2hqaQ== ","['That’s…. unsettling', 'That’s a Neapolitan Hamilton LOL \n\nLuigi D’Emilio', 'He looks like Morph', 'Who the fuck is wearing Charles’ suit in this? I don’t know that man.', 'They are from the future. This is how Lewis will look like after one season with Ferrari.', 'Luis Hamilton', 'I thought his ""puma"" logo was a hammer and sickle for a sec lol', 'Why does Leclerc look depressed?', 'Leclerc looking like Josh o’connor', 'That’s Charles after another 10 years at Ferrari - he spend the last decade getting drunk']",140,34,0.88,140,33,33,11,1,0.010000000000000009,11
1h7zd8l,"[Daniel Moxon] Christian Horner here for the team principals’ press conference. After what Toto Wolff had to say about him yesterday, should be a quiet one…",https://www.reddit.com/r/formula1/comments/1h7zd8l/daniel_moxon_christian_horner_here_for_the_team/,2024-12-06, Social Media,,"['He shouldve bought a terrier', 'My popcorn budget is running low', 'Anyone else want to see Horner with a list of all the times a Mercedes team member swore on the radio and read them out while making snippiy comments INSTEAD of race commentary in Abu Dhabi?', 'Mattia! blast from the past.', 'Missed it what did he say?', 'He should just call toto hysterical too', 'Then Toto strolls in with a literal wolf', 'He should show up wearing a terrier ear headband.', 'We’re gonna need to start buying in bulk, guys 🍿', 'Seems like Mercedes is competing with words since 2021 season, always pleading with the stewards. He’s sooo ‘dangerous’']",137,15,0.92,137,15,15,4,0,0.010000000000000009,4
1h7yvyd,Zhou runs over a bird in FP1,https://www.reddit.com/r/formula1/comments/1h7yvyd/zhou_runs_over_a_bird_in_fp1/,2024-12-06, Video,,"['Is it dead?', 'NOO BIRDY NOO', 'RIP 💀', 'see you f\\*cking later bird', 'What is it with sauber drivers and running over things?', 'Randy Johnson’ed the damn thing', 'Vettel would never', 'Modern day hunting.', 'The Four Pests campaign never ended :(', 'Zhou not braking for animals smh']",138,43,0.95,138,40,40,9,2,0.0,9
1h81khe,[SkySportsF1] One last dance for Lewis and Bono,https://www.reddit.com/r/formula1/comments/1h81khe/skysportsf1_one_last_dance_for_lewis_and_bono/,2024-12-06, Video,,"['“It’s hammer time” to “Retire the car, mate” this relationship has seen many ups and downs. \n\nMostly ups though. There won’t be second Bono to Lewis.', '😭 I understand everyone will still be around but…it won’t be the same without Bono’s soothing voice on the radio', 'I will miss the “Get in there Lewis”', ""That's a wide back"", ""I'm not crying, you are 😢"", 'Bono, my hammer is gone.', 'Bono is an absolute unit', ""and most people are oblivious to the fact that Bono's almost 50. He looks so much younger.""]",142,8,0.93,142,8,8,23,2,0.010000000000000009,23
1h7h1mo,George Russell’s EXPLOSIVE pre-race interview! | Abu Dhabi Grand Prix 2024 ,https://www.reddit.com/r/formula1/comments/1h7h1mo/george_russells_explosive_prerace_interview_abu/,2024-12-05, Video,Full interview of Russell. ,"['![gif](giphy|qKV8U3Gl3bWVi)', 'This saga is more entertaining than the race weekends on some F1 tracks on the calendar.', 'These 2 just need to bone', ""I do wonder whether this is a conscious shift from George or not? In terms of engaging in a more heated back and forth. I'd like it if it was, it'd be entertaining for next year, but it's equally likely that he prepared a response and then got a little carried away, as he looked pretty mad and brought up all sorts of things."", 'This is insane. I have no dog in this fight but man this is some fantastic entertainment.\n\nPS shout out to Carlos for telling Max that he (Max) would have done the same thing. Smooth Operator spitting facts.', '""don\'t bring me into this"" -Carlos', 'We really need the both of them in the same room for the post-quali press conference and hopefully on the same row for the race on Sunday.', 'I was done with this season a few races ago, feels like it has been going on for about 37 years, but this has drawn me right back in lol', 'At the end they ask him about his remark of people having been bullied for years by Max and then he just very vaguely talks about him having the best car.\n\nWhen you call someone a bully you better back it up a bit better than that.', ""I see they're keeping the theme with r/therussell""]",127,343,0.68,127,2604,2604,-2,0,0.0,-2
1h7vfi2,Max Verstappen on the Verge of Doubling Sergio Pérez’s Total Points Over Four Seasons—with One Race to Go. Here's the breakdown of points:,https://www.reddit.com/r/formula1/comments/1h7vfi2/max_verstappen_on_the_verge_of_doubling_sergio/,2024-12-06, Statistics,"Max Verstappen has scored **921.5** points more than Pérez so far. Currently, Verstappen has scored **1.99** times Pérez's points.

If Verstappen outscores Pérez by at least **11** points in the final race, his total will be exactly **2.0** times Pérez's total.

**Year-by-Year Points Analysis:**

|**Year**|**Verstappen Points**|**Pérez Points**|**Points Difference**	|**Verstappen % of Total Points**	|**Pérez % of Total Points**|
|:-|:-|:-|:-|:-|:-|
|2021| 395.5 | 190 | 205.5 | 67.5 | 32.5% |
|2022| 454 | 305 | 149 | 59.8% | 40.2% |
|2023| 575 | 285 | 290 | 66.9% | 33.1% |
|2024\*| 429 | 152 | 277 | 73.8% | 26.2% |
|**Total**|**1853.5**|**932**|**921.5**|**N/A**	|**N/A** |

 💡 **Fun Facts**

* Verstappen has scored approximately **66.5**% of Red Bull's points since 2021, while Pérez contributed just **33.5**%.
* Verstappen’s **575** points in 2023 alone are **62%** of Pérez’s total points over all four years.","['We keep finding entirely new ways to beat up on the guy lol', 'u/just_holdme, You just made the [list](https://www.reddit.com/r/formula1/s/2KirTyUn8B).', ""Fun fact: If Perez finishes 6th or lower this weekend, he will have scored less points in 2024 than Fernando Alonso did in 2014. With 5 less races. And no sprints. And the F14t.\n\nThought I'd share."", 'Basically he has to score double the points of Perez in Abu Dhabi + another 10.5.\n\n&nbsp;\n\nSince half points are more or less ruled out, this means:\n\nPER | VER\n---|---\n20~11 | 5th + fastest lap\n10th | 4th + fastest lap\n9th | 3rd\n8th | 2nd + fastest lap\n7th | 1st\n6~1 | Not possible\n\n&nbsp;\n\nhttps://old.reddit.com/r/formula1/comments/1h4ycrm/verstappen_is_105_points_away_from_having_scored/', ""I don't disagree with your conclusion - that Max is flogging Checo. That is utterly undeniable, and the fact that it could be **exactly** 2 x Checo is just perfect numbers. \n\nBut overall I am quite opposed to using % of total team points to display how much one driver beats another driver.\n\nSimply because the points distribution is not linear a driver pairing P1-P2 vs P10-P11 (and so forth) will have drastically different percentage spreads, despite being line astern in the finishing order.\n\nLike yeah it's a fun fact that Verstappen is 66.5 vs 33.5% checo, but 2019 Russell was 0% to Kubica 100%, for an exaggerated example."", ""These are the stats I'm here for."", 'Perez on podium and dotd confirmed', 'Yeah, we know from the last time this was posted\n\n\nhttps://www.reddit.com/r/formula1/comments/1h4ycrm/verstappen_is_105_points_away_from_having_scored/', ""After the announcement today, it's obvious he's driving for 2.""]",123,18,0.82,123,15,15,1,0,-0.010000000000000009,1
1h7zw12,Fastest sectors ranked by team and driver for FP1 of the 2024 Abu Dhabi GP | via LightsOutBlog.com,https://www.reddit.com/r/formula1/comments/1h7zw12/fastest_sectors_ranked_by_team_and_driver_for_fp1/,2024-12-06, Statistics,,"['A shame Leclerc has the grid penalty otherwise the constructors was truly on', ""So this is what happens when you put two Perez's in the car instead of a Verstappen \\s"", 'Sauber, Williams, and Aston Martin faster than Max-less Red Bull lmao', 'Williams going full brrrr brrr in the fast and then ""lol corners? What are those?""', 'I was so baffled about the red bull data, then realized there are 2 rookies in it currently.', 'That Williams really hates corners huh', 'Makes me wonder how good the pink mercs were. Man I’d have love to see Alonso or Max in it just to see how good those pink merc cars were.', 'vcarb destroying the chances of our yearly yuki masterclass...', ""Don't do that, don't give me hope""]",111,15,0.95,111,14,14,8,0,0.0,8
1h7x7f6,Hamilton “massively underestimated” how hard final Mercedes season would be,https://www.reddit.com/r/formula1/comments/1h7x7f6/hamilton_massively_underestimated_how_hard_final/,2024-12-06, News,,"['He is just slightly fatigued at Mercedes, I hope Ferrari challenge rejuvenates him', ""It's hard work maintaining championship level performance for 8 years running. Matter of fact his whole career he's had to perform at that level and stay there year on year.\n\nFinding out it's just as hard but worse in every way trying to keep that level with a car that's running lower in the standings must've been a bit of a shock."", 'The kind of ""challenges"" Ferrari provides sound like they will age you faster though', '>I hope Ferrari challenge rejuvenates him\n\nThere will be massive pressure on Ferrari to repeat a 1-2 finish in Australia, in the season opener.', 'He’d best be asking his buddy Seb for all the details of how Charles operates or he could be in for a rude surprise.', 'He’ll have his 2007 hairline back by April.']",103,7,0.9,103,6,6,2,0,0.0,2
