unique_id,post_heading,post_url,publish_time,tag,post_content,top_comments,upvotes,comments,upvote_ratio,score,total_upvotes_comments,total_score_comments,upvotes_growth_rate,comments_growth_rate,upvote_ratio_growth_rate,score_growth_rate
1n42dh2,Oscar Piastri takes pole position for the 2025 Dutch Grand Prix,https://www.reddit.com/r/formula1/comments/1n42dh2/oscar_piastri_takes_pole_position_for_the_2025/,2025-08-30, Qualifying,,"['Hadjar!!!\n\nAlso Aston sold us lies again.', ""That's about as close as you're gunna see, Hadjar P4!!!! HES RIDICULOUS"", 'Well done Hadjar!', 'Happy for Carlos starting in P9. First Q3 finish since Imola.', 'This might’ve earned Hadjar the seat that could ruin his career lmfao', 'Insane effort from Hadjar', ""Hadjar needs to be careful. You don't want to get demoted to Red Bull."", 'Ham bot ver', 'Alonso said he could fight with the top teams...', 'What a fucking lap Hadjar. These rookies are something else this year']",11451,721,0.96,11451,20113,20113,94,0,0.0,94
1n42g5i,[@visacashapprb] Absolute cinema!!!,https://www.reddit.com/r/formula1/comments/1n42g5i/visacashapprb_absolute_cinema/,2025-08-30, Social Media,,"['Hadjar is probably one of the least hyped RBR in a while and yet he has completely over performed based on expectations', ""[source](https://www.instagram.com/p/DN-1j1xDFNn/)\n\nA reminder, Lando, Oscar, Max, George, Charles and Isack are the only drivers who haven't been eliminated in Q1"", 'Absolute brilliance for Isack, and Lawson did well too.', ""Props to Isack, but I'm impressed that Liam has managed to turn this around. After that catastrophic RB stint, he's doing a solid job rebuilding his career. Even if RB decides to promote Lindblad next year, I'm sure he could find a place on the grid elsewhere."", 'Best rookie', 'Does VCARB have more double Q3 appearances than redbull? Genuine question lol.', 'I beg you RedBull, please do not promote him, Please!', 'Marko must be really happy for backing him after his disaster F2 rookie season. This guy has a ton of resilience and speed. Just had to put it together.', 'Rookie of the year! Who would’ve thought after Australia!', ""Isack Hadjar you are ridiculous, 9th Q3 already and 2nd row. Sorry Yuki but I think it's over""]",6349,147,0.99,6349,5437,5437,66,2,0.0,66
1n42izh,"Oscar Piastri sets a new lap record around Zandvoort, beating the previous time of 1:08.855 set by Verstappen in 2021",https://www.reddit.com/r/formula1/comments/1n42izh/oscar_piastri_sets_a_new_lap_record_around/,2025-08-30, Statistics,,"[""2021 saw a good battle in quali and a titanic one in the race, when Max and Lewis lapped everyone except Bottas in third. They properly pushed each other to the limit there.\n\nLet's see if tomorrow can get close to that, if it does it would be an epic race."", 'Anyone know how many track records has McLaren broken so far this season?', 'Verstappen time was 0.885\n\nPiastri is faster by 0.223 second', 'The fox narrowly missed out', 'Piastri broke the record set by Norris like 5 minutes earlier. \n\nNorris broke the record set by Verstappen in 2021.', 'As an Aussie F1 fan on a few beers, I have a big throbbing purple sector.', 'First the lap record at Belgium, now the Netherlands. Piastri be storming the low countries this season.', ""It's impressive how Oscar can be 2-3 tenths off during the build-up, then just slap a time down that's equal or better than Norris when it really matters. Hopefully an exciting race tomorrow."", ""And this ladies and gentlemen is why I am concerned with the new regulations. The current generation of cars is the fastest ever at many tracks and I believe that is part of why they don't race well. And now from reports, it sounds like the 2026 cars are only going to be 2 seconds slower at the start. I am almost certain that within 2-3 years, the 2026 cars will become faster than the current cars, and the racing will get much worse than it already is."", 'Should we expect to happen with the 2026 regs? Say after 1-2 years, they will become faster and faster?']",4345,152,0.99,4345,4275,4275,58,0,0.0,58
1n42npw,David Coulthard is hysterical,https://www.reddit.com/r/formula1/comments/1n42npw/david_coulthard_is_hysterical/,2025-08-30, Discussion,"I love David Coulthard’s color commentary from the first words in his accent and analysis of the racing, but today I had to replay his gems…

Taller drivers are sitting on the floor directly and Yuki Tsunoda is on a booster seat…

Lando Norris has come down to find his sun lounger only to find Oscar’s towel on it already!!!

These are the fun thoughts running through his mind while analyzing an F1 qualifying session…

God I love that guy!!!","['Few years ago, he was talking about Gasly or Ocon being sandwiched in the race and then corrected himself by saying “or should it be baguetted because they’re French”\n\nLost it immediately', 'There was also that time in Canada when Alex was FIGHTING THE CAR SO HARD and DC just was like “Alex was my tenant in Monaco 😊. He was great! Left it better than when I gave it to him 😃. He’s a good lad. 👍”', 'When Marko was on screen he said something like: Here is dr. helmut marko, his eye on the screen.', '+His chirp about having a “keep off the grass” sign during Q1 and strolls shenanigans.', 'All the drivers can take his jokes on the chin', '*After this crash Lance is gonna have a difficult talk with the person in charge, in this case the team owner.*', '‘By jolly- it is a fox!!’\n\nHim + Palmer + Alex Jacques is an excellent trio', 'F1TV crew is honestly a generational one and i hope more people can see that and appreciate it', 'He also commented that Lance would be getting a stern talking-to in the headmasters office\n\nWhich was clearly said tongue-in-cheek as he knows there is literally nothing Lance could do to get fired']",2535,171,0.96,2535,7614,7614,31,2,0.0,31
1n4d4tv,"Mercedes’ Toto Wolff aware of celebrity status, AI ‘Deepfake Porn’ in his likeness",https://www.reddit.com/r/formula1/comments/1n4d4tv/mercedes_toto_wolff_aware_of_celebrity_status_ai/,2025-08-30, News,,"['Some humorous quotes from him:\n\nhe added this doesn’t bother him, joking, “as long as it’s a good-looking body and I perform well in the scenes.”\n\n“I’ve learned not to take it too personally. At one point I asked Bradley, our Head of Communications, to just show me the worst examples at the end of each day. And if he wanted to flatter me, maybe the best ones too. Eventually he stopped showing me the best ones. Either there aren’t any good ones left — or he thinks I shouldn’t get too full of myself,”\n\n“I’d rather have someone posting deepfake porn about me than nobody caring at all. Because there was a time when nobody cared about us — and I remember that very well.”', 'I genuinely thought this was a joke article at first cause wtf did I just read lmao', 'Never did I ever think I would see that type of title here on r/formula1 but as the great Murray Walker said, anything can happen in F1 and it usually does.', ""Okay Toto, I'm starting to warm to you a bit because these are some incredibly based quotes."", ""Most ridiculous F1-related article title I've read in a while"", ""Huh. I wasn't"", 'Did the AI misinterpret people\'s requests for ""Toto banging the table""?...', 'What the actual f*ck.', 'As a woman deep fake porn scares the shit out of me tbh', 'He was aware. I, however, was not aware. And I wish it had stayed that way.']",2450,198,0.97,2450,7586,7586,96,4,0.0,96
1n41738,"Stroll spins out and crashes into the barriers, damaged front wing",https://www.reddit.com/r/formula1/comments/1n41738/stroll_spins_out_and_crashes_into_the_barriers/,2025-08-30, Video,,"['Karun talking about how Aston is showing confidence to get through qualy with 4 new sets of softs then Stroll does that 2 mins later', 'Ahh regularly scheduled programming after a good start to the season', 'We are so back baby', 'I feel bad for his mechanics', 'Stroll’s level of errors seem to correlate directly to how competitive Aston is. He beats Fernando to P13 and everyone says he’s getting level with him and then when there’s actual points on the line, this happens.', ""Even if they had the best car, Aston won't be a top team until after dad has to take a tough decision. \n\nSo many high potential drivers with far fewer opportunities have come and gone in the near decade Lance has been in a car."", 'Might still be able to go out again but standard Lance, have a good weekend and good FP1 and looks like improvement is coming, then drops a stinker', 'Jesus Christ, classic Stroll brainfart.', 'Impressive the car just bounced back and keept on driving. So he will drive sunday and we gonna enjoy an early safety car', '""That\'s not a mistake a racing driver should be making... explain that...""  \n""So what\'s happened is he wants to open the track up...""\n\nMy guy I don\'t think DC of all people meant he needed the actual mechanics of racing explained to him.....']",1660,216,0.99,1660,5866,5866,10,0,0.0,10
1n3zmlc,"George Russell has been warned, and Mercedes has been fined €7,500, for his ""dangerous situation"" with Fernando Alonso in FP3",https://www.reddit.com/r/formula1/comments/1n3zmlc/george_russell_has_been_warned_and_mercedes_has/,2025-08-30, Technical,,"['A lot of shenenigans this weekend so far. Seems like teams and drivers need to get into their groove again after the summer break.', 'Basically what I expected to Happen.', ""Just once I'd like to see one of the punishments being 10 hours of community service in racing sim multiclass pub lobbies to learn why your mirrors exist."", 'waiting for more drama during quali and race.', 'What happened? I slept through', 'Can’t say they’re not being consistent', ""George should have gotten a penalty. Oscar should've gotten a penalty yesterday. You can't excuse unsafe driving just because it is Free Practice. I said what I said."", 'Qatar last year, 1 place grid drop and penalty points.  \nNow, a stern talking to.\n\nI think this one was ten times worse then Qatar.', ""Remember when Fernando got a penalty for George crashing in his wake at Melbourne? How this didn't result in a grid penalty is beyond me 🙄"", ""Where is Russell?\n\n\nHe's been penalized\xa0\n\n\nBah, Karma!""]",1585,159,0.98,1585,2418,2418,12,0,0.0,12
1n43ts6,Piastri got pole today with help from a Lawson slipstream,https://www.reddit.com/r/formula1/comments/1n43ts6/piastri_got_pole_today_with_help_from_a_lawson/,2025-08-30, Discussion,,"['Feel free to discuss the effects slipstream, dirty air, etc. might have had on the laps, but please keep it civil. This is not the place for fan wars or for blind hatred towards drivers.', ""That's Hadjar not Lawson."", ""That's Hadjar."", ""The graph shows that Oscar's exit speed was faster than Lando's coming out of T13 the whole time. Slipstream has nothing to do with that."", 'and being a Kiwi he would secretly hate that he helped out the Australian like that.', 'GP Tempo(F1 Tempo) now has direct linking. So, for those who want to check their telemetry.\n\n[Here](https://www.gp-tempo.com/app?year=2025&roundnumber=15&session=4&drivers=%5B%22PIA%22%2C%22NOR%22%5D&laps=%5B%7B%22y%22%3A2025%2C%22r%22%3A15%2C%22s%22%3A4%2C%22d%22%3A%22NOR%22%2C%22l%22%3A14%2C%22c%22%3A%22%23F47600%22%7D%2C%7B%22y%22%3A2025%2C%22r%22%3A15%2C%22s%22%3A4%2C%22d%22%3A%22PIA%22%2C%22l%22%3A14%2C%22c%22%3A%22%23E2E2E2%22%7D%5D&tab=telemetry)', 'Or he just did a slightly more perfect lap to lando', ""That telemetry doesn't show anything. Very limited effect."", 'Looks more like a better exit than a tow.', 'British copium']",1372,167,0.83,1372,4710,4710,35,0,0.010000000000000009,35
1n42ifs,[@scuderiaferrari] A tricky Quali in Zandvoort,https://www.reddit.com/r/formula1/comments/1n42ifs/scuderiaferrari_a_tricky_quali_in_zandvoort/,2025-08-30, Social Media,,"['This is actually more than I was expecting and that’s what hurts the most', 'It’s a double Q3 instead of a Q1 exit I’LL TAKE IT.', 'when will I ever find happiness as a ferrari fan', ""Look i expected worse after those FP sessions and Q1. I guess thats a win?\n\nAt least we didn't get worse. Looks at Aston."", ""Lewis has been pretty close to Charles this weekend, sometimes even ahead. Let's hope it's not a one-off."", 'Best the drivers could do, man if Ferrari didn’t have them they would be so dog\n\nLewis looked faster today too so I’m hopeful', ""I'm loving how close these 2 were, it's exactly what I want to see"", 'Surprised it went this ""well"" to be honest', 'I was expecting a Q2 exit…. This is much much better.', '😐 \n\nNext year is our year, yes?']",1003,103,0.99,1003,2848,2848,11,1,0.0,11
1n45ide,"[Adam Cooper] Hamilton in an upbeat mood today after securing P7 on the Zandvoort grid: I tried to have a slight different approach into the weekend. I'm not going to go into details of what that is, but some tweaks before I even got here, and then through the weekend, and it's been a lot smoother.",https://www.reddit.com/r/formula1/comments/1n45ide/adam_cooper_hamilton_in_an_upbeat_mood_today/,2025-08-30, Social Media,,"[""Man regains hope he thought he's never going to regain"", ""A slightly upbeat Lewis is better than completely miserable Lewis. Here's hoping things stay this way"", ""The difference in mood between Ferrari drivers tho\n\nLeclerc P6: I've been very poor  \nHamilton P7: Happy about his performance"", ""I mean, nobody's really bothered about this season now. McLaren has both championships in the bag, might aswell put full focus to 26"", ""Isn't this also Lewis best result here in Zandvoort in the last three years?"", ""I really don't understand Charles, given their weekend up until now I thought there was a chance that at least one of them would have flubbed and missed  Q2, let alone Q3."", 'Hamilton in upbeat mood after first qualifying in a country with legal cannabis', 'Happy Lewis is so wholesome.', 'Edibles.', 'Hamilton happy about P7, looks like the routine Ferrari soulbreaking process is almost complete. Soon Hamilton will be an empty husk of his former self, where ""We need to learn from today so we can do better next time haha"" almost comes automatically.']",936,56,0.98,936,2261,2261,13,0,0.0,13
1n44hc6,Average qualifying differences between teammates (sprints included),https://www.reddit.com/r/formula1/comments/1n44hc6/average_qualifying_differences_between_teammates/,2025-08-30, Statistics,"To mitigate the differences between track lengths (2 tenths off in Monaco is worse than in Spa!), I’ve switched to percentages. 

The times from the highest session reached by both drivers has been used - so for example if Max reached Q3 but Yuki went out Q1, I’ve used the Q1 times for both. This is to try and control for track evolution the best I can.

If a driver couldn’t set a time in the highest session both reached its been excluded completely to try and make it fair. An example of why is Saudi with the McLarens - Lando crashed and didn’t set a Q3 time, but if I used Q2 instead it has him faster than Oscar, which doesn’t seem representative.

Sprints have been included because I don’t see why not :)","['Thanks for this!\n\nVery tight fight for rookie of the year between Hadjar and Bortoleto!', ""Great presentation! Mild constructive criticism, I'd add a black border around the white text to improve contrast and readability. But def a cool clean way to show this data."", 'Percentage difference is the only correct way to discuss relative driver pace. I appreciate it in no small amount.', ""Amazingly the way of measuring this could actually be helping Max's teammates a little because often times he wont run another new set at the end in Q1/Q2 because he's already safe with his first run, so his teammate can improve on new at the end of that session to close the gap a little but they still may go out."", 'Funny how there is so much criticism about some rookies but Kimi remains untouched by both the media and fans.', 'Colapinto improved a lot in the last rounds, shame Alpine has the worst car', 'Carlos and alex are so close \n\n\nCant say the same for yuki', 'Perez was right in that interview a couple days back, he was 0.44% slower than Max by the summer break last season.', '0.12 comes haunting after 0.012', ""There's no denying that Hadjar, Bortoleto and Bearman are the best rookies this year, what a year all 3 are having""]",918,159,0.97,918,2042,2042,20,3,0.0,20
1n3zmxp,"Wolff: Strange to not have ""great enemy"" Horner in F1",https://www.reddit.com/r/formula1/comments/1n3zmxp/wolff_strange_to_not_have_great_enemy_horner_in_f1/,2025-08-30, News,,"[""Press conferences *have* been noticeably less funny in recent weeks without the two of them doing their ritualistic catfighting.\n\n> What I said is that every movie needs the good, the bad and the ugly. Now the bad is gone, it's only Fred and I left...\n\nOkay, I would like to retract my previous comment."", 'He already misses him! Awwww', 'Those two were besties after all, they love each other so much', 'Every good Story needs a villian. \n\nHorner was the one for F1.', 'Every Joker needs his Batman', 'no more shitstirring for a while :c\n\nthe other tp are either not as good, or arent interested in doing so', '>""He said to me: \'What are you doing now, because you love to hate me and I\'m gone!’,""', 'horner will be back. if flavio can comeback, horner could definitely find a way back in', 'ultimately i think hed be a great get for any of the lower end teams. a shit tonne of experience, built red bull from nothing to one of the most successful teams of the past two decades. even in the bad times they never stayed down for too long. ik rbr and horner have become easy targets for the fans but genuinely think he was one of the best tps', 'I just hope if Horner comes back it’s not with Cadillac.']",875,56,0.98,875,2701,2701,1,0,0.0,1
1n44baf,no further action for max,https://www.reddit.com/r/formula1/comments/1n44baf/no_further_action_for_max/,2025-08-30, News,,"[""I can't believe they actually summoned him for a slow inlap. Even better because Max was slowing down for yellow flags. Which is exactly what you want a driver to do lmao"", 'Pinged for driving slowly because he was under a yellow flag. \nGenuinely so dumb.', 'Maybe the dutch stewards just wanted to meet him and hopefully get a selfie', ""Shouldn't have even been investigated for it when you throw a yellow flag."", 'Why did they summon him for that?? It was his inlap after the checkered flag, with a yellow flag shown. Did they immediately forgot there was a flag?', 'Since when do they even investigate maximum delta time?', 'If im Verstappen id fine the stewards for making me lose time. They need to change this slow in lap thingy, happens often and it never matters.', 'This should never have been a summon. I can only hope that the stewards know about a yellow flag in the race that they are supposed to monitor?', 'Why was there a Yellow flag?', 'Pretty wild that *race control* couldn’t figure out this one themselves.']",666,49,0.97,666,1596,1596,-1,0,0.0,-1
1n45186,“I've been very poor” - Charles Leclerc's damning assessment of his qualifying performance,https://www.reddit.com/r/formula1/comments/1n45186/ive_been_very_poor_charles_leclercs_damning/,2025-08-30, News,,"['I saw this headline and thought Chuck was opening up about his humble roots.', ""You know Reddit experts, the fact that the car is terrible doesn't mean a driver can't have a bad quali too. It happened already with Hamilton more than once, sometimes it can happen with Charles too."", ""Lots of high speed going on, curves and wind. This car just can't handle it well compared to the competition. Less downforce because of the ride height, car sliding around, tyres degrading faster as a result... We're somewhat lucky that RB and Merc only have 1 car in the top 10"", 'nah Charles, that car is very poor when that fucking team changed the whole car on the last year of this regulation', 'The guy that got pole last week when the Ferrari finally gave him something, says he sucks when the Ferrari doest give him what he needs. Idk man i dont think he should be too critical', 'Completely understand, I can’t even afford eggs', 'he is kinda close to hamilton so there was porbably more in the car for him', 'Leclerc: “I’ve been very poor”.\n\nReddit: “He won’t win anything if he stays with Ferrari.”\n\nI guess many people don’t understand what he’s actually saying. At this point, the ‘anti-Ferrari’ argument is simply used to drive upvotes. Jesus…\n\nEDIT: I’m not saying Ferrari doesn’t have any responsibility in the situation. In this particular case, Leclerc said his poor performance was down to him and his mistakes. Drivers have ups-and-downs, it’s okay if your driver isn’t perfect all the time, the fact that he’s consistently performing well is telling on how much he cares.', ""He needs to change teams if he wants to win. The hypothetical Leclerc is a 9 time champion so it's time to show something."", 'Still beat his team mate…']",640,146,0.98,640,1920,1920,6,1,0.0,6
1n44izb,"Dutch GP qualifying star Isack Hadjar hails ""best lap"" of his F1 career[Motorsport]",https://www.reddit.com/r/formula1/comments/1n44izb/dutch_gp_qualifying_star_isack_hadjar_hails_best/,2025-08-30, News,,"['Best lap *yet*! I have high hopes for you Isack.', 'Better enjoy these laps this season before he gets the second Red Bull seat next year', ""Great job for Isack. He is only five points away from the top ten in the standings. If VCARB doesn't blow the strategy, he could move up. Not bad for a rook."", 'unfortunately his job tomorrow will be rolling road block or train driver.', 'He’s <3 tenths off Max in what is supposed to be an intentionally inferior car. Would Max be faster in the Racing Bulls than the RB at this point?', ' My man is about to be promoted 😢', 'MY MAN. Such a shame he got zero screentime in the official broadcast :(', ""Tomorrow won't be easy, but should be a solid top 10."", ""So nervous that those power unit issues from fp1 & 2 are going to find their way back tomorrow. The man deserves a podium for his insane driving,  but given how unlucky my faves have been this year, I can't get my hopes up."", ""Great job but will see tomorrow how far he'll end up at the standings.""]",615,30,0.99,615,734,734,3,0,0.0,3
1n42dt5,"Piastri on pole, Norris P2, Verstappen P3",https://www.reddit.com/r/formula1/comments/1n42dt5/piastri_on_pole_norris_p2_verstappen_p3/,2025-08-30, Video,,"['All that FP hype Aston. All that for this?', 'Dutch GP loves underdog P4 drives in Quali', 'Hadjar is a beast', 'Hadjar I am speechless', 'Damn that was close between the Mclarens', 'Max with some lap  at the end, nice try.', 'Hadjar is the best rookie this season no debate', 'The Aston Martins tricking us….', 'Hadjar deserves the promotion to the 2nd Red Bull seat!', 'Hadjar P4!']",519,82,0.96,519,1328,1328,-4,0,0.0,-4
1n4qqbc,"Red Bull gives Yuki Tsunoda until ""around Mexico"" to prove himself",https://www.reddit.com/r/formula1/comments/1n4qqbc/red_bull_gives_yuki_tsunoda_until_around_mexico/,2025-08-31, News,,"['Hadjar is selling his phone today. \n\nCannot promote him if he never gets the call. \n\n4D chess.', 'Around Mexico so he has Italy, Baku, Singapore and USA to show something', '“So should we destroy Hadjar’s career next, or destroy Lawson’s again?”', '*Ah shit, here we go again*', ""Hadjar's streak of not being eliminated in Q1 is in real danger if he gets thrown into the RB21 post Mexico"", 'The 2nd driver changes will continue until morale improves', 'I have to say I doubt they are putting anyone else in that seat. They know it is cursed by now and nobody can make it work, especially within less than half a season. All they will do is kill their confidence.\n\nYuki is there to die essentially. He is the lamb slaughtered at the alter of their shitty car that only Max, the chosen one, can drive.\n\nAfter this season they can then boot Yuki and feel good about it, which was always the plan anyways once the Honda partnership ends.', 'Anyone who has Hadjar best interests at heart would make sure he doesn’t go anywhere near that Rebull Car', 'He’ll finish the season and then he gone.', ""Welp there we go. It's Tsunodone""]",606,256,0.98,606,250,250,499,176,0.04999999999999993,499
1n43two,Verstappen under investigation for driving too slowly at end of qualifying,https://www.reddit.com/r/formula1/comments/1n43two/verstappen_under_investigation_for_driving_too/,2025-08-30, News,,"['No further action \n\n>The driver of Car 1 showed us telemetry that proved that he would have been within the delta time but for the yellow flag being shown towards the end of the lap - he had to slow significantly to comply with the yellow flag rules. This is what led to his delta time reflecting an infringement in the system.\n\n>We accepted his rationale for slowing down and accordingly took no further action.', 'The last time he was penalized for driving too slowly, he won the race. Qatar 2024', 'Nothing burger, probably just fine and that’s it.', 'Plot twist: He was full throttle, the cars just shit.', ""Out of the dozens of times this has come up over the years only Max got punished for it (from what I can remember) \n\nAs long as Russel wasn't involved it'll be a slap on the wrist"", 'Oh no another warning what are they going to do at RedBull', 'That shitbox of a car and FIA.. Max desperately needs a break', '""You slowed down! Explain yourself!""\n\n""The rules say I have to slow down.""\n\n""Right you are. Carry on.""', 'How many times has he been summoned for this exact infringement? I feel like I see ‘Max Verstappen’ and ‘driving unnecessarily slowly’ a lot these days.']",470,48,0.93,470,1444,1444,3,1,0.0,3
