unique_id,post_heading,post_url,publish_time,tag,post_content,top_comments,upvotes,comments,upvote_ratio,score,total_upvotes_comments,total_score_comments,upvotes_growth_rate,comments_growth_rate,upvote_ratio_growth_rate,score_growth_rate
1nijnfv,Lewis Hamilton Via Instagram,https://www.reddit.com/r/formula1/comments/1nijnfv/lewis_hamilton_via_instagram/,2025-09-16, News,,"[""A pre-emptive reminder about the rules:\n\n* If a driver makes a statement or gesture in support of social issues, do not make comments attempting to attack or silence the personality or message in question. Do not post messages suggesting that drivers should shut up and drive or that politics should be kept out of sports.\n* **Users are expected to engage constructively with social issues and supply intelligent contributions**. Do not concern troll or derail these discussions. Do not post whataboutist rhetoric. Bad faith, lazy, and/or driveby destructive commentary in response to such posts will be met with bans.\n* **Do not weaponise one driver's activism against another's in order to elevate your preferred individual**\n* Do not use **racist or xenophobic language or make generalisations based on people's ethnicity/nationality**\n* This subreddit has members from all over the world. Keep in mind that not everyone may be familiar with the issues being discussed, as coverage in the news can vary from country-to-country. Instead of downvoting questions use this opportunity to help others learn about these issues\n\nPlease report any comments that break these rules, so we can get to them as quickly as possible. This post may be locked for short periods of time if the volume of rule-breaking comments gets too large or if there is evidence of brigading."", ""there’s a second story he posted: \n\n\n“It's hard not to feel powerless in the face of so much tragedy, but we can't stand by and do nothing.\nThere are some incredible organisations doing great work to help the people of Palestine, and they need funds to be able to do so.\nI have donated to three organisations that are working tirelessly to help those who need it:\n©palestineredcrescent\n@doctorswithoutborders @savechildrenuk\nIf you feel you have anything to spare, I would be grateful if you could join me”"", ""It's absolutely unacceptable and it should not be controversial to say that."", 'Lewis has got to be one of if not *the* biggest athletes in the world to speak publicly about this right?', 'Lewis will always be the goat to me. People used to say hes too media trained, but the guy speaks his mind for great causes.', 'Wonder if the FIA will fine him for taking a “political stance” here even though saying “we shouldn’t allow genocide” isn’t really a political stance.', 'I may be a Verstappen fan but I love Lewis Hamilton.', 'Lewis might be liked or disliked, but we have to admit he’s usually (or maybe always?) on the right side of things where it matters.', ""I'm Israeli and I 100% agree with this. Really fucking sucks to know that your tax money goes into this.""]",40604,976,0.86,40604,33194,33194,782,15,0.0,782
1niemkk,"With Baku coming up next, Nico Rosberg describes how scary it is to go down the pit straight at over 300kph in case something goes wrong. Stroll and Verstappen both had tyre failures in the same region in 2021, before the pit lane entry was slightly amended.",https://www.reddit.com/r/formula1/comments/1niemkk/with_baku_coming_up_next_nico_rosberg_describes/,2025-09-16, Video,,"[""People always mention Abu Dhabi in 2021 but i think it's outrageous that there were two tyre failures on the long straight and it still took over 1m30s for a red flag to be called while Max was out on track and cars were going past.\n\nIt also had major implications for his championship battle that year. Then there was the Spa 2 lap farce"", 'Mandatory post: https://youtu.be/QKTrxILXJI0?si=cMzwl4U-MvWE-Laa', '>""So if something breaks, you\'re in that wall. It\'s the end; there\'s no more you.""\n\nSaying that with such a straight face too. The wildest part is that he indirectly predicted what would happen there, to Verstappen, 2 days after the video was posted.', ""That won't be changed until someone dies.  It might not be at this track but it'll be from a similar pit entry."", 'I love how he instinctively tilts his head to prepare it for the G-forces. True racing driver :)', 'Why dont you just put at 350 kph in the title likes Rosberg says twice\n\nAnyway\nWas there ever a investigation to the tyre failures? To long of a straight with that speed or something?', ""It's unbelievable how unlucky Max was in 2021, both this crash and the Silverstone one were really scary"", ""I honestly think if/when there's another fatality in F1, it's most likely either going to be in Baku or Jeddah, and there's going to anger in hindsight as to why we raced at the track in the first place"", ""I never forget the terrified radio message of Stroll, who quite rightly called for a red flag. \n\nThat's when Masi should have been fired, for so blatantly ignoring driver and marshall safety for the umpteenth time."", 'Max held that pretty well, surprisingly calm crash as well for the speeds they were going, and it slows down pretty fast.']",3414,174,0.99,3414,4726,4726,105,3,0.0,105
1nif4m3,Matt Bishop: Alonso & Stroll are about to make mind-boggling F1 history [first teammate pairing to have raced in 600 F1 GPs],https://www.reddit.com/r/formula1/comments/1nif4m3/matt_bishop_alonso_stroll_are_about_to_make/,2025-09-16, News,,"['2 championships between them\n\n32 wins etc etc', 'Imagine if Stroll is driving till his 40s! Dude is bound to break some records by then!!', ""Stroll is top 30 most experienced drivers ever and he's 26 he will be FAR higher once he's done"", ""Feels like the Gretzky record of 'most points by a sibling pair in the NHL'\n\nWayne has 2,857. His brother has... 4. [https://en.wikipedia.org/wiki/Brent\\_Gretzky](https://en.wikipedia.org/wiki/Brent_Gretzky)"", 'It is my eye or the image?  \nwhy colour is so different than regular Aston colour', 'crazy to think just how much experience stroll has in f1 considering how under the radar all his performances are', 'Also 32 wins and 2 wdc between them.', 'Kwame Brown and Kobe Bryant', ""It's wild to think that between them, they have over 600 starts. Stroll is quietly building a historic F1 resume while still being so young."", ""I'm somewhat boggled.""]",2333,200,0.97,2333,8453,8453,26,3,0.0,26
1nii73r,"The largest fine is sports history is the $100 million fine given to the McLaren F1 team in 2007, for stealing confidential Ferrari documents",https://www.reddit.com/r/formula1/comments/1nii73r/the_largest_fine_is_sports_history_is_the_100/,2025-09-16, Throwback,,"[""Not saying it's meaningful, but fun fact: Fernando Alonso was GPDA director during both spygate and crashgate."", 'Rumor has it that Max Moseley said that it was 5mil for the teams actions and an additional 95mil for Ron Dennis being a c\\*nt.', 'My favourite story about this is how Max Mosley initially was so furious, specifically with Ron Dennis (of which the two of them had some sort of beef), that he wanted McLaren disqualified from 2008 entirely, which would have bankrupted them with no sponsors willing to stay. Bernie Ecclestone then managed to have Mosley \'lower\' it to a 100 million pound fine, and to quote Bernie, ""It was 1 million for the actual infringement, and 99 for Ron being a (certain c word)"", all because Mosley found Ron \\*that\\* annoying. FIA used to be extremely corrupt', 'The LA Clippers are about to smash this', 'oh look at these tiny karts', 'The best looking Ferrari (when it was dark red) and the best looking McLaren in F1 history.', 'This was back when Ferrari had something worth stealing.', 'Technically the blueprints weren’t stolen, they were given to McLaren. Renault’s nonsense was more blatant but they got away with it because Mosley liked Briatore more than he liked Dennis.', ""Was this paid in full? I thought a lot of it ended up being docked prize money. Though I heard Mercedes weren't happy at having to pay some of it and it's part of what lead them to owning their own team instead"", ""I think they were sent tp McLaren and used. Rather than 'stolen'. Technically.""]",1885,147,0.98,1885,3234,3234,62,13,0.0,62
1nicfb3,2026 F1 Sprint Calendar,https://www.reddit.com/r/formula1/comments/1nicfb3/2026_f1_sprint_calendar/,2025-09-16, News,,"['Sprint in Singapore is hilarious. Can’t wait for nothing to happen. Good thing we have Silverstone back to make up for it.', 'Sprint in Singapore is nasty work', 'Singapore is an utterly diabolical pick for a sprint', 'Confirmation that the Canadian Grand Prix will start after the Indy 500 is typically due to finish, too, which is mint', 'Dude Singapore sprint? Are they trying to give everyone heatstroke before gp quali?', 'The guy who suggested the idea of Singapore and Dutch Sprint needs to be fired ASAP', ""Well, at least having the Sprint at Singapore means we'll have a competitive session there during daytime.\n\nNot that it will be very competitive, considering it's both a Sprint and in Singapore."", 'Taking out Brazil, one of the few places with memorable sprint races, its certainly a choice.', 'Even Bernie wouldn’t have be dumb enough to put a sprint race in Singapore.', 'The Singapore race should be soo bad it hopefully kills sprints entirely']",1856,265,0.97,1856,6064,6064,25,1,0.0,25
1nilzpr,[Chris Medland] It's understood F1 will discuss ideas such as reverse grid Sprints from 2027 (and maybe expand to 12) with teams and drivers.,https://www.reddit.com/r/formula1/comments/1nilzpr/chris_medland_its_understood_f1_will_discuss/,2025-09-16, News,,"['Would it even be worthwhile in F1? I get the other series because they’re on equal machinery for the most part, but in my head Lando, Oscar and Max start P5-8 and still end up 1-3 by the end of it.', ""Reverse grids only works if you aren't racing for points. The only guarantee in sprints is that passing is basically impossible, rewarding someone with a not insignificant amount of points for 10th place is completely antithetical to competition"", 'This has Domenicali written all over it. God, this guy just cannot stop with his bs ideas.', 'What if we expand to 0 sprints?', 'Million dollar idea:\n\n2 free practise sessions on friday\n\n1 free practise session on saturday\n\nA qualifying session on saturday\n\nA race on sunday', 'What viewers want to see: car overtake car\n\nWhat FIA thinks people want: reverse grid boost button street circuit shorter races family members sprints celebrities forced pit stops', ""They really want Max out of the sport don't they?"", ""Short races + cars that really struggle to pass means that reverse grids are a DOA concept.\n\nWe love them in F4 sim racing, but only when there is a reasonable amount of time to gain places back.\n\nSprint races are fine as-is, although I'd prefer that teams also had an additional FP session before the sprint."", 'Just have it as a separate championship already', 'One of these sprints will be in Singapore by all accounts in 2027 so how does the reverse grid work there? The fastest cars will qualify badly to start at the front, knowing that if they qualify too well they’ll be stuck because of the track and not because of their performance?']",921,441,0.95,921,4571,4571,28,3,0.0,28
1nict5e,Aston Martin reveals cause of Alonso's abrupt suspension failure,https://www.reddit.com/r/formula1/comments/1nict5e/aston_martin_reveals_cause_of_alonsos_abrupt/,2025-09-16, News,,"['> On lap 1, Lando Norris ran wide and onto the grass, which threw gravel and stones back onto the track.  \n> • One of these struck Alonso’s Aston Martin, damaging several areas including the front-right suspension.  \n> • The damage wasn’t initially noticed, but under race loads — especially through Ascari’s kerbs — the suspension eventually gave way.  \n> • Aston Martin confirmed internally that the car had suffered an impact from debris early on, rather than a structural fault or excessive kerb use.\n\n\nLOL. This man is cursed\n\nEdit: A photographer captured the hole in the suspension, it’s circulating on Twitter. I don’t know how to post it. It’s crazy', ""Gravel causing that kind of damage is pretty crazy.\n\nI don't recall that ever happening before."", 'Gravel on lap 1 (probably from Norris) hit the front suspension.\n\nThe front right pushrod eventually failed.', "">Witch's curse.\n\nWasn't expecting that but it tracks with Fernando's luck for the last 15 or so years."", 'This season gravel-2 alonso-0 .', 'Aston made their suspension from italian noodles.', 'Some gravel hit it......', 'It is crazy that a stone can do so much damage but if we go back in time we find that a piece of foam insulation striking a wing of the space shuttle also did massive damage as well.', 'Nuh uh, I read from experts that going deep on kerbs once or twice means the suspension is expected to break!', 'Funny how people were adamant on blaming Alonso for this before knowing what caused it.']",646,90,0.98,646,1927,1927,8,2,0.0,8
1nicw2n,2026 F1 Start Times - Canada will start later to avoid clash with the Indy500,https://www.reddit.com/r/formula1/comments/1nicw2n/2026_f1_start_times_canada_will_start_later_to/,2025-09-16, News,,"['I swear to God the choice of sprint venues is worse than the first year... wtf do they think is gonna happen in the Singapore or Zandvoort sprints?', ""They could've afforded Barcelona the same courtesy and pushed the start of that back to avoid clashing with the end of Le Mans, but I suppose why show no respect to one of the world's great motor races when you can do it to two instead?"", 'Sprint race around a well known slower track like Singapore is an absolutely crazy decision', 'Why the fuck are they having a Sprint race in Singapore? A track where overtaking is virtually impossible and with no tyre stops is guaranteed to be a procession.  \n\nMight as well have a sprint race in Monaco if they’re going Singapore.', 'Holy shit the summer break is a whole extra week.  5 weeks in between races now', 'Wait when did Zandvoort change dates? And 31st is a Monday too.\n\nEdit: possible typo? Forgot to change it from the 2025 calendar maybe', '4pm, in May, in Montreal?  Hope they have the track heaters in!', 'Singapore sprint during daylight hours, those poor guys will be hallucinating by the end it', 'Honestly, the best news as an American on the East Coast is that the Vegas GP no longer starts at 1 AM.', 'At least they’re making the effort. Just need to hope that Indy isn’t delayed or red flagged otherwise that’ll be the lowest viewing figures for any F1 race that year']",555,128,0.97,555,1430,1430,11,3,0.0,11
1ninqcx,What could happen to Fornaroli if he wins F2?,https://www.reddit.com/r/formula1/comments/1ninqcx/what_could_happen_to_fornaroli_if_he_wins_f2/,2025-09-16, Discussion,"So even though there seems to be quite a close title fight for the f2 title, it seems none of the contenders will land an F1 seat if they come out as winners. With Williams having the two drivers on multi-year contracts, Browning for sure has no chance of making the grid next year. Jak Crawford, Aston Martin's academy driver would no doubt miss out on a seat next season, given Stroll's place in the team. Verschoor I doubt will win but is unsigned. But most of all the most upsetting and uncertain situation is Fornaroli's who is not part of any driver academy and is on-course to win back to back F3 and F2 titles. What do you think will happen to him IF he ends up taking the F2 title in his first season? Feels like a prodigy might go unsigned and disappear into the chaotic world of motorsport.","[""The thing is, everyone who watches F3 and F2 knows that Trident F3 and Invicta F2 are the best teams by far. I can go on about this point for a while.\n\nFornaroli and Bortoleto were rookies in F3 Trident together. Bortoleto was the F3 winner, Fornaroli was 11th place in the same team.\n\nIf points were only given away in features, not in reverse grid races, Browning would be leading the championship, not Fornaroli. Fornaroli's gotten a bunch of reverse grid points, which F1 teams don't favor as highly for good reason.\n\nIf Fornaroli does win this year, I think he might get an F1 seat, but I think he might have to sit out a year first, and that wouldn't be anything unusual. Oscar sat out a year even after going back to back rookie champions, which Fornaroli is not."", ""No disrespect to Fornaroli but he's not a prodigy in the F1 sense. He had one win in his entire single seater career prior to entering F2, won F3 without a  win, and is now driving for the best team on the grid. And even then, as others have mentioned, he's ahead because of reverse grid wins. It's great that he's a consistent driver but F1 teams value raw pace much more. Plus anyway it's difficult for him to get a seat, the only options are Alpine and RB, and both have Aron and Lindblad respectively waiting in the wings"", ""The current grid is pretty much locked in after the new rookies this year. \n\nThe regular driver churn is Baby Bulls or Alpine. Marko wants to use his driver pipeline. If he is making exceptions it's for the next multi WDC potential. Fornaroli doesn't have that pace. Alpine has Aron if they want to do some change. I don't really think Fornaroli is better than Aron. \n\nCadillac is committed to Herta. Things have to go really bad for a seat to open there. \n\nLawrence wants a WDC + Lance at Aston. So that seat isn't really going for a rookie."", '>\xa0Feels like a prodigy might go unsigned and disappear into the chaotic world of motorsport.\n\n\nI\'d wait before labelling him a prodigy.\n\n\n*How* you win F2/F3 is just as if not more important than winning it.\n\n\nHis F3 season was great but he won no races. He has 3 sprint race wins and 1 Feature race in F2 but this is not a commanding, dominating victory. Oscar had 4 Feature race wins and won by 60 points.\xa0\n\n\nIt\'s a close fight and he\'s doing very well but I don\'t think he is standing out as the next Piastri quite as much as you think.\n\n\nHe\'s doing great don\'t get me wrong. But sans and academy you have to shine REALLY bright to make the move to F1 straight Away, and being heavy on winning reverse grid sprint races is shining but not ""omg this guy\'s the best"".', 'Prodigy???', 'Fornaroli is a decent driver but he isn‘t F1 level. I think he can get a seat in Indy Car or at least Formula E or WEC.', "">the most upsetting and uncertain situation is Fornaroli's who is not part of any driver academy and is on-course to win back to back F3 and F2 titles\n\nAfter he won the Formula 3 title, Fornaroli's management apparently approached several Formula 1 teams. None of them were interested. He just was not that impressive."", 'Neither Fornarolli nor Lindblad impressed me enough to get a chance in F1. The only rookie who has been rising through the lower categories who has been impressing me is Rafael Camara. He has been winning everything. The championships he lost were to Antonelli. I believe Ferrari will let him do some free practice next year as preparation, because after Bearman, he is the most likely to get a place at Ferrari.', 'Not a first driver that would just ""disappear""', ""I guess Ferrari academy would have been an obvious fit if they didn't have Oli Bearman in the system. I'm sure someone will give him a test at the end of season young drivers session, if not an FP1 before that.""]",295,138,0.93,295,1451,1451,18,2,0.010000000000000009,18
1nibgv4,Rare rear view of the Ferrari F2003 with lighting (PC prefered) - engineering and aerodynamics unleashed.,https://www.reddit.com/r/formula1/comments/1nibgv4/rare_rear_view_of_the_ferrari_f2003_with_lighting/,2025-09-16, Technical,"To see the level of detail on aero  and innovation, just on exiting airflow is missed, and beautiful. ","['I always adored those exhausts. Very distinct. I think ferrari were the first to implement this type of guided exhausts an with shark fin covers.', ""The wild Aero era of the 2000's made some of the coolest looking cars with the best proportions"", 'I absolutely love these early 00s era cars. Especially around 04-08.', 'I came into the comments to say the same. The loss of the dual outlets overall is a shame.', ""It's just the sweet spot, regulations open enough for distinct shapes, CFD and manufacturing not advanced enough yet to produce the crazy shapes like the bargeboards we had in the late 2010s so they still looked visually pleasing..."", ""The late 2010's/early 2020's cars proportions were completely wrong in my opinion. For example, the AlphaTauri AT01 looked so weirdly long and tall, but with tiny wheels. \n\nFerrari's F2008 on the other hand looked like a missile. Absolutely stunning, besides the strange narrow front wings of the era.""]",220,6,0.94,220,88,88,5,0,0.0,5
1nipwxf,I built an interactive chart showing F1 points gaps between multiple drivers & teams,https://www.reddit.com/r/formula1/comments/1nipwxf/i_built_an_interactive_chart_showing_f1_points/,2025-09-16, Discussion,"I noticed most sites only show standings, but I wanted a way to actually *see how the gaps evolve race by race*. The old app I used for this shut down, so I built my own version.

Here’s a preview — curious what you all think!","['Using blue for McLaren and orange for redbull is diabolic 😂', 'I would change the colours to match the teams, so for example Piastri and Norris would be different oranges and  McLaren would be Papaya, Mercedes light blue and so on\n\nOther than that this is a cool tool!', ""Generally it looks pretty clean.  \nOdd choice for the driver/team colors, and I don't get what the y-axis is telling me.  \nPoints Difference to what/whom?  \nAh, to the average I guess, but why?  \njust the points would lead to a very similar chart, or Points difference to the one who has the most points, would be more intuitive."", "">what you all think!\n\nIt's unintuitive and the colours are confusing"", ""I don't get why this graph goes into the negative, you need to multiply the graph value by 2 to get the actual point difference, if it was purely absolute values it would be more readable"", 'As some other people commented, it\'s very confusing to see things go into the negative, it\'s entirely unclear what 0 represents.\n\nYou say you want to see how the gaps evolve - I would argue that\'s actually more intuitive to read from a plain chart of points standings. The evolving gaps are visible from how the lines of different teams grow apart or come together.\n\nWhat you did here is basically that same chart, but with some kind of average value subtracted from all values for every race. The upside is that it looks flatter, but the downside is the Y axis makes no sense.\n\nIf you want to keep this style, I suggest you make it so that the ""baseline"" is one of the teams (either the first selected one or customizable). That way the Y-axis would represent e.g. ""Points difference to Ferrari"" and it would be clear what the values mean.', 'What is the zero value in these charts? Is it the average of the selection?', 'Curse you for not using their actual team colours', 'r/dataisnotbeautiful']",151,24,0.86,151,279,279,14,1,0.0,14
