unique_id,post_heading,post_url,publish_time,tag,post_content,top_comments,upvotes,comments,upvote_ratio,score,total_upvotes_comments,total_score_comments,upvotes_growth_rate,comments_growth_rate,upvote_ratio_growth_rate,score_growth_rate
1gtcojc,Mick Sumacher's Instagram Post ,https://www.reddit.com/r/formula1/comments/1gtcojc/mick_sumachers_instagram_post/,2024-11-17, Social Media,Is this f1 related? ,"['Bottas confirmed as Merc reserve driver and Schumacher out of F1?', 'So I guess today’s big stories are\n\n• Bottas back to Merc\n\n• Franco dating a mother of 3', 'Mick, girl, did you just leak VB being a reserve driver for Mercedes lol?', 'He included about 5 different cliches in there.', 'What happend? He lost his reserve driver seat now?', 'Sometimes, the son is destined to be a once a generation talent, and the father just a mediocre also-ran, like the Verstappens. Sometimes, it is the other way around, like the Schumachers.', 'I’m guessing he missed out on Glastonbury tickets then', 'It almost feels like he copied and pasted 3 or 4 motivational clichés and posted them as a parody.', 'Not gonna lie, when I saw the little preview with the black background I got a bit scared, for an instant I thought that it could have been something else.', 'I really wish he would let F1 go and build a racing career somewhere else. Most racing drivers who dream of F1 never get a chance and with his 2 years at Haas he already achieve more than 99.9% of drivers ever will.']",7281,532,0.94,7281,436,436,405,19,0.0,405
1gtfldn,[OC] 32 drivers suffered fatal accidents during F1 World Championship events. Many former F1 drivers also died racing in other series while a handful of people passed away in F1 machinery without ever competing in Formula 1. This is a map of all 151 F1-related fatal accidents.,https://www.reddit.com/r/formula1/comments/1gtfldn/oc_32_drivers_suffered_fatal_accidents_during_f1/,2024-11-17, Statistics,,"[""Amazing work. It's way more complete than I was expecting at first. Just hope that we don't add any more names to this list."", 'I cannot imagine what it was like being a fan of the sport prior to the 90s.', 'Apologies for the map being quite finicky to use on mobile devices. I hope it can still provide an interesting pastime on this race-free Sunday. Feel free to point out any mistakes I made, this was quite a lot of history to dig through.\n\nBy the way, ""only"" 8 people from the list died in this century.', 'I actually made a tribute to them - https://youtu.be/lZ7Qu0CVgs4?si=e4z0RFcZksX3DlmB\n\nNot sure how many I forgot.\n\nIt’s insane that so many legends (Ascari, Clark, Rindt, Villeneuve, Peterson, Senna) all died in F1 accidents.\n\nEdit: not F1 accidents. I meant so many F1 legends died in racing accidents.', ""When you read about Pryce's accident, it just sends chills down your spine. It's barely believable.\n\nBTW, stellar work on the map"", 'Im so glad you included Maria de Villota! I was quite mad wenn I found out that she was not on the Wikipedia list', 'I’ve been watching since ‘87.\n\nI won’t include Imola ‘94 or Suzuka ‘14 as we all know what happened, but outside of those accidents we have had some very near misses.\n\nBerger at Imola in about ‘90/‘91, and Piquet a couple of years earlier had massive accidents. The Berger one was similar to Grosjean in some ways. Fireball and the like.\n\nWendlinger and Perez both had real big impacts at the chicane in Monaco. Wendlinger’s one ended his F1 career.\n\nLuciano Burto had two big crashes. The first at Hockenheim, and then at Spa when the worst very nearly happened.\n\nMassa in Hungary, Kubica in Canada.\n\nThere was Sato running into someone (I forget who off the top of my head) in Austria and a massive impact. Ralph Firman lost the rear wing from his Jordan in Hungary one year and had a very big impact.\n\nPedro Lamy almost lost his life in a testing accident for Lotus at Silverstone.\n\nMartin Donnelly as well.\n\nThere have been all of these and so many more in the time I’ve been watching, and down to fabulous car and circuit safety, medical intervention and I’m sure a very generous amount of luck, all of those mentioned above saw another day.', 'When the Paletti accident happened in 1982, the start line in Montreal was after the hairpin.', ""Wow Watkins Glenn didn't care. \n\nCauses of death: Severed in half and Decapitation""]",1952,107,0.98,1952,103,103,284,9,0.0,284
1gte27n,"[Scott Mitchell-Malm] No plan for Stefano Domenicali to leave F1 leadership role and switch to MotoGP, I’m told. It is possible Domenicali will offer advice and support once MotoGP is part of the Liberty fold, which may be where the misunderstanding emerged.",https://www.reddit.com/r/formula1/comments/1gte27n/scott_mitchellmalm_no_plan_for_stefano_domenicali/,2024-11-17, News,,"['Jack plooj is always someone who cooks something up for attention only to be proven wrong in less than 24H', 'You mean Jack Plooj isn’t an ironclad source? 🤯', 'Jack Plooij talking out of his ass as usual.', 'I knew it was a far-fetched rumour in the first place, but you have to wonder how Plooj interpreted *""Certified MotoGP CEO""* from Mafei\'s departure because Andretti is siding with Republicans. \n\nLike, the reach there is something else', 'Ofcourse the dentist is lying again', 'Plooij talking utter nonsense? Who would have ever thought?!', 'Don’t mind me, just upvoting because it’s Bluesky instead of twitter', ""The person also mentioned in [another tweet(?)](https://bsky.app/profile/scottmitchellmalm.bsky.social/post/3lb4ucxdyuk2t) that he was told Zhou isn't on Ferrari's list for reserve btw."", 'Yeah this news greatly confused me and seemed predicated on or by literally nothing', 'ah crap, lol, it sounded too good to be true.']",1260,43,0.98,1260,40,40,46,0,0.0,46
1gtbf8c,F2 star Hadjar on potential F1 debut in 2025: “My chances are alive”,https://www.reddit.com/r/formula1/comments/1gtbf8c/f2_star_hadjar_on_potential_f1_debut_in_2025_my/,2024-11-17, News,,"['the day checo finally gets kicked out of his seat is the day the entire red bull junior team can finally start being alive again', 'I actually wonder what is Yuki next step instead, Hadjar gonna replace him in like 2026', 'He has been a little unlucky in some rounds in F2. He has done really well this year.', 'I am very excited for the next gen of Red bull juniors\n\nLawson is here, hadjar, linblad in f2 next season', 'Red Bull’s contracts obviously allow for midseason firings and given they’ve used that option twice in two years then I’d say yeah, his chances are indeed alive.', 'https://preview.redd.it/hdtkpgdz8g1e1.jpeg?width=792&format=pjpg&auto=webp&s=a57e9ea9e682dceca14396727e75851f1c5c01c6', ""If hadjar isn't in that RB next season he better be praying on Arvids downfall"", 'Marko’s a big fan of Hadjar so I think it’s fair to say he has a shot at VCARB in 2026 if Yuki moves on. However if Lindblad hits the ground running and impresses in his rookie F2 year then that chance might fly right out of the window.', ""If they sack Perez or maybe if Tsunoda magically finds a spot somewhere else, other than that, I don't see it happening for Hadjar in 2025, not counting mid-season changes of course.""]",1251,115,0.96,1251,107,107,30,3,0.010000000000000009,30
1gt4z99,Overtakes at the 2023 Las Vegas Grand Prix,https://www.reddit.com/r/formula1/comments/1gt4z99/overtakes_at_the_2023_las_vegas_grand_prix/,2024-11-17, Statistics,,"['Not a single comment about the actual information in the post', 'Honestly can F1 just own it and show it the right way for once! I wanna stop having to turn my head', 'For anyone wanting to relive the action to get ready for this weekend, the Formula 1 youtube channel just uploaded the full race replay to their channel [here](https://www.youtube.com/watch?v=nqq0AmnGwqI).', 'Why is the pig upside down and so tall?', 'This would work better as a heat map or just an actual counter at each turn. It looks like there were only 4 over takes at T14? Find that hard to be true. And that’s how many out of T12..?', 'Most underrated track on the grid', 'Las Vegas Grand Pig', '[Las Vegas Intro](https://gifdb.com/images/file/simpsons-spider-pig-4dpxajz95bv4ewa2.gif)', ""That was way more than I thought leading up to the first race. I know I wasn't the only one doubting the quality of racing the track could bring. Happy to be wrong about that!""]",1160,55,0.98,1160,1346,1346,27,0,0.0,27
1gtavlr,[Scuderia Ferrari] The Las Vegas Strip is calling,https://www.reddit.com/r/formula1/comments/1gtavlr/scuderia_ferrari_the_las_vegas_strip_is_calling/,2024-11-17, Social Media,,"['Who ever designed this years calendar should not be allowed anywhere near the schedule ever again.\n\n3 summer breaks in the 2nd part of the year is beyond stupid.', ""It's going to take some getting used to when we start seeing Hamilton on these race promo posts"", 'just 3 races to go........\n\ni am not ready', ""It's always nice to see photos of Sainz where he doesn't look shellshocked."", ""Rawe 'not yet' ceek"", ""Let's hope the Las Vegas drainage covers stay away this time"", 'chippendales promo poster', 'Idk why but these two in this picture look badass', ""You've got a whole lot of money that's ready to burn so get those manhole covers closed this time Vegas"", 'Fallout has utterly cooked my brain, “Las Vegas” will never sound natural to me as opposed to “New Vegas”.']",818,41,0.98,818,38,38,26,0,0.0,26
1gt7bkn,Exclusive: Behind the scenes of the “critical” 150-minute test facing F1 mechanics every race,https://www.reddit.com/r/formula1/comments/1gt7bkn/exclusive_behind_the_scenes_of_the_critical/,2024-11-17, News,,"['also known as Williams mechanics build any car challenge any % speedrun', 'Great article, ik ppl like to shit on Haas for being incompetent but it speaks volumes about how even the most memed about team in F1 is still pretty competent.', 'Actual quote from the article: ""A short while later, a third FIA scrutineer arrives. This one prods and pokes Magnussen’s beam wing vigorously, at one stage shoving a whole finger into a hole.""\n\nConsider my interest peaked.', ""“A recent one that they’ve started doing is putting stickers on the skids at the end of qualifying and they come check before the race. Because, I assume, some other teams have been changing the skids. You can't do that…”\n\nHilarious if true."", 'Lol, those Williams mechanics are going to get poached by Ferrari/McLaren/RedBull soon, they are getting insane practice sessions in record time.', 'Im just imagening the lego building sound to like 50 mechanics all building the car', ""Williams usually is 100%, Aston with Alonso's car in Brazil was any%"", 'I would hope it would be 100% not any % lol', ""Most of the criticims leverage against teams is their strategy calls or car designers, since it's far easier for us fans to spot a mistake in strategy or see the car isn't developing as quickly as others. The times the whole team is criticises for something by fans is mostly when there's something clearly not working (e.g. Ferrari in 2022, or Aston Martin right now)""]",756,22,0.98,756,960,960,10,0,0.0,10
1gt403f,Was Schumacher Really Pushed Out At Ferrari?,https://www.reddit.com/r/formula1/comments/1gt403f/was_schumacher_really_pushed_out_at_ferrari/,2024-11-17, Discussion,"Alright. I'm sure the vast amount of readers here knows the story. As reported by a BusinessF1 article, that [Schumacher was prematurely pushed out at Ferrari](https://www.reddit.com/r/formula1/comments/51sn70/interesting_read_on_how_schumis_first_retirement/?rdt=33460) because good ol' Montezemolo got power hungry.

There appears to be but one problem. BusinessF1 is the one and only (AFAIK) source of the story, and we know that rag is as good as [diarrhea soaked toilet paper](https://www.reddit.com/r/formula1/comments/18cxbwy/i_think_we_should_all_be_aware_that_buisnessf1/). 

To my knowledge, this story has **never** been corroborated by *any* reputable media outlets, nor have there been any actual insider statements. 

This is not one of those paddock open secrets where there has been enough confirmation with sources that a reputable outlet like the BBC would report on it with qualifying statements such as ""...understands that..."", ""...reportedly..."" ala Alonso's 2009 Ferrari move.

On the contrary, [Ross Brawn himself states that Michael didn't have it in him at the end of 2006 for the commitment required to gun for another WDC](https://youtu.be/t15tKnsUJrk?t=2335), and additionally Todt said had the rest of the dream team stayed on, [Todt would have quit himself](https://www.autosport.com/f1/news/todt-reveals-he-planned-to-quit-ferrari-4406126/4406126/).

So, in the interest of getting to the bottom of this as a lifelong Schumacher fan, I was wondering if anyone has ever managed to track down a reputable source/report that was remotely contemporaneous to the events? Or is this story complete bullshit as is typical from BusinessF1?


EDIT: Thanks to u/prancing_moose for the tip that James Allen's book covers this topic! Key takeaways found [here](https://www.reddit.com/r/formula1/comments/1gt403f/was_schumacher_really_pushed_out_at_ferrari/lxkkshm/). If James Allen (an actual trustworthy source) is to be believed, **Schumacher was not forced out and that whole story is indeed a work of fiction typical of BusinessF1.**","['BusinessF1 is the MBS of Motorsport publications.\n\nIn the words of Paul Gualtieri: https://youtu.be/qRufBEFq34c?si=2B4PMWCkKXJ--lnf', 'There were plenty of stories around even then about the LdM vs Todt conflict. It’s why Rossi wasn’t able to get his shot and how Kimi got the gig. \nThe power struggle stories abounded and seem to make sense as well. MS was collateral damage.', 'In “Michael Schumacher: The Edge of Greatness”, James Allen very much describes the power struggle within Ferrari and that Schumacher’s retirement announcement was practically forced by Ferrari. \n\nIt’s always hard to say if that was true or not, a lot of stuff happens behind the scenes of F1 that we’re not privy to, but James Allen makes a pretty convincing case for it in his book.  Assuming he has much better direct sources than I have, I have no reason to doubt that what he wrote is true.', 'Mercedes is doing what Ferrari did back then', 'The number one thing that throws cold water over the ""he was pushed out"" was he stayed in the Ferrari universe years after the fact despite being able to sign for other teams if he wanted to. The reason he left was that he got bit by the racing bug again after prepping to be a potential replacement for Massa in 2009 (while Massa was in a coma from being hit by debris), but given that Ferrari already had 3 drivers contracted for 2010, there was simply no room for a return. \n\nAlso its an open secret that he lobbied for Ferrari to sign Kimi. Not the kind of thing you do if you were expecting to keep driving.', ""I remember that kind of being the thinking at the time. They had just signed the highest-rated young talent (Raikkonen) and already had their young star that they'd developed in-house (Massa). Something had to give.\n\nThere's two lines of thinking around the whole thing:\n\nThe first is that Ferrari planned to have Schumacher team up with Raikkonen, with a view to the future and Raikkonen eventually replacing Schumacher as 'the man' at Ferrari. But Schumacher chose to back away, seemingly not wanting to race alongside an equal. Thus Massa – who was probably going to be the reserve in 2007 – got a reprieve.\n\nThe second is that Ferrari signed Raikkonen as a direct replacement for Schumacher, with Schumacher ageing and out of contract at the end of 2006.\n\nBoth theories are credible, and there was plenty of material around both ideas at the time (and since), but we'll never know the exact truth.\n\nPersonally I don't think he was explicitly forced out, but I do believe he jumped before Ferrari had a chance to sort of push him."", 'Wasn’t BusinessF1 the “journalist” that said Suzie Wolff was feeding info to Toto?  I wouldn’t even wipe my booty hole with their articles.', 'I was really scared to click the ""diarrhea soaked toilet paper"" link, ngl.', ""It's a complicated situation. Ferrari's choice of 2007-2009 lineup was a good one. Massa won 11 races between 2006-2008, an extremely impressive feat, and of course he fought for the title in 2008. Raikkonen remains the last champion for the Scuderia.\n\nI believe that Michael didn't really want to retire, but he had a great relationship with Felipe, so he decided to leave so as not to leave his friend without a seat for 2007. And of course, if Schumacher had stayed until the end of 2009, he would have had the potential to fight for title in 2007 and 2008.""]",541,163,0.9,541,1820,1820,10,1,0.0,10
1gtkr3i,[Thomas Maher] The unused livery from the US Grand Prix is being showcased by Red Bull on chassis 003 at the Galway Showrun this evening.,https://www.reddit.com/r/formula1/comments/1gtkr3i/thomas_maher_the_unused_livery_from_the_us_grand/,2024-11-17, Social Media,,"['A nice retro-inspired livery. Shame they chose not to use it.', 'The dark, matte, look was cool for a while but it’s so drab. After almost ten years of it, they could use a change. This looks so much brighter and vibrant.', 'I really like the brighter looking blue rather than the super dark navy that they use now.', 'Beauty', ""I knew about Singapore but I didn't realise there was also an abandoned US Livery too.\n\nI like this one, it reminds me of some older Red Bull liveries.\n\nNow, all it needs is Infiniti Purple .."", 'toro rosso/old red bull kinda colours\n\ni like it', 'Was it a weight issue?', 'I love that bolder, brighter shade of blue. Wish this was the permanent look.\n\n\nAlso love the curvy stripes that run along the side of the car.', 'Should keep it as the regular livery honestly. Hopefully next year they can use it at the US GP', 'Bring back gloss.']",538,41,0.97,538,38,38,232,5,0.010000000000000009,232
1gtcesd,Brazilian GP had 43 Overtakes. Plus Data for Every Race Since Italy. Full Data in Post.,https://www.reddit.com/r/formula1/comments/1gtcesd/brazilian_gp_had_43_overtakes_plus_data_for_every/,2024-11-17, Statistics,,"[""It’s been a while since I last posted unfortunately been very busy with work and house renovations so I’ve just not had the time to be doing this for the past couple months and it’s taken a bit of work to get caught back up. Below are spreadsheets for this season as it's gonna take a while to update the database on the site.\n\n[2024 Overtakes](https://docs.google.com/spreadsheets/d/155eUZ_LyYfYGbr2J_PX8SDogsMWL2yIS7AlXzG8-F-s/edit?usp=sharing)\n\n[2024 Overtakes by Driver](https://docs.google.com/spreadsheets/d/1bph6RfaYbx-nkSuhn4tGGQiquJX8sjCNEoKaaFs9YZE/edit?gid=0#gid=0)\n\n[Race Totals](https://docs.google.com/spreadsheets/d/1XueNI7ZawEX0RLDq5dAGVqsEb1-DBOK2kUWGwM1OMKs/edit?gid=0#gid=0)"", ""Spain having the must overtakes just confirms that we're living in the weirdest timeline. I mean, that circuit is traditionally a snoozer. \n\nAlso, Lewis was out if position a lot this season. He's one of the greatest overtakers in the sport's history, but that is a high number of overtakes for him. It means he's had to recover in most races."", 'does passing someone at the start count as an overtake? just asking cause i think max passed 8 in brazil instead of 6', 'Return of the King, thank you man', 'It feels like this number is fairly low, but I think part of it is the attrition during and before the race. Less cars on track = less overtakes. Still a very exciting GP.', 'So net 6 overtakes by max and zero by norris in brazil. Definitely luck than talent for norris.', 'Thanks for sharing, it certainly changes my fantasy teams going into the final block of the season!', 'Thanks you for taking all the time to get us those results.     \nHope work is taking less time now and the house a sparkle of joy']",348,25,0.96,348,24,24,2,0,0.0,2
1gtkna3,Williams rebuild for Albon and Colapinto’s cars ,https://www.reddit.com/r/formula1/comments/1gtkna3/williams_rebuild_for_albon_and_colapintos_cars/,2024-11-17, Video,,"['This was super interesting to watch. These guys are just amazing. The two cars were in pretty bad condition. Glad they are in good shape for the next race and with spare parts just in case.', 'That was like an episode of scrapheap challenge!\n\nSeriously these guys do some work. Always amazed when a car gets wrecked during a weekend session and it’s ready to go at the next session looking like nothing happened.', ""really cool video. i wish there would be more content focused on mechanics building the car, how they approach it, etc and less about drivers doing some boring ''challenges'' but i get it because that's what the public wants."", 'The guys in the background with the hydraulic lines xD Classic team banter.', 'With all the talking about carbon fibre, I am surprised that mechanics pick up those damaged pieces without gloves….', 'i hope these guys have good therapists, can get rough in Williams', 'Absolutely incredible work and super interesting to see what the work back at the factory actually entails.', ""I wish we could see more of this stuff from the other teams. The cost cap has introduced an entirely new level of salvage we've never heard of or seen in F1. As fans we just see the cars show up all shiny and ready to go without a clue to most of us what goes into the prep for each race weekend. Mega respect to team Williams!!"", 'That was super cool to watch, and what an effort they did getting everything ready. Call me bias but Williams have the best social media team in F1 in what they do and show.', ""These guys have earned a bonus this season, hope they're treated like the damn heroes they have been keeping Williams going this season.\n\nI joked that Ferrari/McLaren/RedBull would be poaching them after seeing how talented they've been this season, but that video shows that's a talented group of chaps.""]",211,38,0.98,211,38,38,84,14,0.0,84
1gtmdnl,Ollie Bearman on instagram : “The crossover you didn't know you needed today”,https://www.reddit.com/r/formula1/comments/1gtmdnl/ollie_bearman_on_instagram_the_crossover_you/,2024-11-17, Social Media,,"['Who is next to him?', ""The fact that I didn't even recognize Ollie in the ceremony lmao"", 'Cute couple\xa0', 'It\\`s a pitty that he tooked a photo with a dopped sportsman.', 'Jannik Sinner, current world number one tennis player', 'Thanks for answering. I don’t follow tennis or football (soccer) and I’d assume it’s one of those sports.', 'what’s happened to alcaraz ?', 'Thanks', 'Sinner basically, the two of them shared the slams between them but Sinner had a stronger season, just won the ATP finals today', 'Alcaraz peaked at the French Open/Wimbledon but had a quiet season besides that']",114,10,0.86,114,10,10,66,2,-0.010000000000000009,66
1gtl5d6,"Q1, Q2 and Q3 appearances - corrected version ",https://www.reddit.com/r/formula1/comments/1gtl5d6/q1_q2_and_q3_appearances_corrected_version/,2024-11-17, Statistics,"As you guys pointed out there were some mistakes reagarding Q2 exits for Ferrari boys (they both made it to Q3 in Singapore but where Charles DNFed and Carlos DNS) and Liam Lawson. So there is a new verson, hopefully with no significant mistakes this time.
","['Look at George quietly being consistent as blimey, he is having his best season, despite the odd bout of bad luck.', 'crikey', ""Chego has been knocked out I'm Q1 more than Albon and Tsunoda. Jesus Christ Checo"", 'George has quietly been having a great year that’s been largely cast in the shadows because of a few unlucky events \n\nQuite possibly the second best performing driver of the year (Lando might be 4th behind Charles or 5th behind Carlos)\n\nEven more impressive how easily he’s been able to put Lewis down', 'Lewis has more Q1 exits than Q2. An anomaly.', 'Fuck, another edit: Lewis should have one more Q2 exit. So Q3 - 76.1% (16) , Q2 - 9.5% (2), Q1 - 14.2% (3). Please upvote', ""I don't get what everyone is on about. Logan has better q2 percentage than Colapinto. Clearly he was the better driver /s"", ""Stroll having more Q3 entries than Q1 exits based on his qualifying past and the car's performance is... surprising but in a good way. Atleast something positive this season"", 'mr saturday has never been so back']",111,45,0.93,111,44,44,52,17,-0.019999999999999907,52
