unique_id,post_heading,post_url,publish_time,tag,post_content,top_comments,upvotes,comments,upvote_ratio,score,total_upvotes_comments,total_score_comments,upvotes_growth_rate,comments_growth_rate,upvote_ratio_growth_rate,score_growth_rate
1jpquoo,[AMuS] Does Cadillac have a wind tunnel advantage?,https://www.reddit.com/r/formula1/comments/1jpquoo/amus_does_cadillac_have_a_wind_tunnel_advantage/,2025-04-02, News,,"['Translation and full article:\n\n\n> Cadillac has been an official member of the 2026 Formula 1 field since March 7. The US racing team now has eleven months to assemble a team and a car. Does Cadillac benefit from a wind tunnel advantage?\n\n> This Formula 1 project has never had an easy time. What began with Andretti Global\'s application in February 2023 took two years to final approval. During that time, the applicant vacillated between hope and fear. At the beginning of 2024, Formula 1 management mockingly recommended that Andretti try again in 2028.\n\n> By then, the company had already been declared a General Motors factory under the Cadillac flag. But it took Andretti\'s complaint to the U.S. Congress alleging antitrust violations that broke the ice. A face-saving compromise was reached. Suddenly, everyone was thrilled with General Motors\' commitment to Formula 1. On March 7, the FIA \u200b\u200bgave its final blessing.\n\n> The two years underground were not wasted. Since the fall of 2023, an ever-growing group of engineers, model builders, financial experts, and managers have been doing preparatory work for a team and a car scheduled to debut in 2026. For a long time, it was a journey to nowhere, as board member Mario Andretti explains: ""As long as we didn\'t have the commitment, we were only driven by the belief that everything would turn out well. Now everyone knows they\'re working on something that will be on the starting grid in 2026.""\n\n> Audi as a competitor on the labor market. The Cadillac Formula 1 team is spread across four locations. Its headquarters are in Fishers near Indianapolis, where a state-of-the-art race factory is currently being built. At the European branch in Silverstone, engineers are developing the American automaker\'s first Formula 1 car. Their wind tunnel is located at Toyota in Cologne. General Motors\' engine division is located in Charlotte, where it plans to eventually design and build its own Formula 1 engine.\n\n> Since its registration, Cadillac has been subject to the budget cap and all the regulations of the 2026 regulations. Now the rookies also have to pay their $450 million entry fee. One team member says: ""If there\'s no problem anywhere, it\'s with money. We\'re well financed."" The two major investors, Mark Walter and Dan Towriss, are absolute heavyweights with their companies.\n\n> Currently, around 300 people are working on building the team and developing the 2026 car. By the end of the year, the workforce is expected to grow to 650 employees. In theory, Cadillac has a good chance of recruiting new talent. They have plenty of open positions and room for improvement in their budget. But now, with Audi, they suddenly have a competitor on the English job market. The Ingolstadt-based company has opened a technology center just around the corner in Bicester.\n\n> Job advertisements only since the beginning of March. Cadillac\'s technical advisor Pat Symonds warns against underestimating the growth process: ""We were only able to issue detailed job advertisements once our approval was secured at the beginning of March. Before that, we had asked the non-binding question in the advertisements: Would you like to participate in an exciting project?""\n\n> Employees Cadillac recruits from other teams now can\'t start work immediately. Most are on leave until the end of the year. This means they won\'t be available until the next car. The newcomer also doesn\'t have unlimited flexibility within the budget cap. It all depends on how much you want to build yourself or outsource.\n\n> The plan is for Cadillac to do as much as possible itself. But that requires production facilities, know-how, and people. All of this is a time constraint. Unlike Audi, the Americans are essentially starting from scratch. Audi at least found a functioning infrastructure and a well-coordinated team at Sauber in Hinwil. And yet, Formula 1 boss Mattia Binotto has respect for the task: ""The transformation into a top team doesn\'t happen overnight. It takes up to five years.""\n\n> Building the car and integrating new employees is one thing. At least equally challenging are seemingly simple tasks such as logistics, establishing an IT department and a supplier network, liaising between development and production, and purchasing trucks and a motorhome. Cadillac essentially didn\'t get the ball rolling on these until the second week of March.\n\n(1/2)', 'Toyota F1 had the largest budget and most technologically advanced wind tunnel at the time. They ended up 0 wins, 3 poles, and 13 podiums in 140 starts.', ""They're going to be 11th, they have some advantages sure but it's of little benefit when they're drastically disadvantaged in other areas."", ""They have an advantage, sure, but it doesn't automatically translate to performance."", 'Did Haas when they had unlimited development before they joined?', 'Interesting they are not buying mechanical components like suspension from Ferrari. I would think they would buy as most as possible so they can build out the most needed team like aero and gradually build out the rest of the team. \n\nWhile it is a different regulation, I still think actual track time with current team is better than the wind tunnel advantage. Cadillac has very limited correlation data for now.', 'From what I am reading, it is most likely hearsay until we get more concrete information about their wind tunnel advantage. It is hard to calculate a result when nothing much has been properly tested just yet', '""Any headline that ends in a question mark can be answered by the word no.""\nI have an inkling that applies here.', 'Probably not']",174,40,0.9,174,486,486,2,0,0.0,2
1jqbf9e,"Max about whether he still stands behind the instagram post he liked, calling Redbull's driver swap “bullying” and a “panic move”: “I liked the post, so that says enough, right? it wasn't a mistake. that sometimes happens when you click on something.”",https://www.reddit.com/r/formula1/comments/1jqbf9e/max_about_whether_he_still_stands_behind_the/,2025-04-03, News,,"['Did I stutter?', 'Max:\n\n![gif](giphy|y41Txh2pbwqLNNubOo)', 'Could call it red bullying', ""Dude doesn't hedge anything. What you see is what you get. Comes across as very comfortable with who he is and never a thought of pretending otherwise. I admire that."", ""I always love his honest and clear answers. He shouldn't go into politics though"", 'Bold', ""One thing about max is that he's quick to defend whoever is sat on the opposite side of the garage"", '![gif](giphy|pSauCNBp1DcOY)', ""I love how he's so unapologetic about what he says/does""]",392,42,0.97,392,37,37,392,42,0.97,392
1jpjny3,"[Honda Racing Global] To commemorate the start of their memorabilia business, Honda Racing Corp. is auctioning off parts from the RA100E engine from the 1990 F1 Season",https://www.reddit.com/r/formula1/comments/1jpjny3/honda_racing_global_to_commemorate_the_start_of/,2025-04-02, Video,,"['someone buy every single part and then make high quality 3d scans so we can 3d print V10s', ""That'll be $10k for a screw. Quite a steal really."", 'Love how the engine was well stored. And love how we get to see the parts and details in the video. I hope other power unit suppliers would do such video to show us some of those iconic F1 engine taking apart.', 'Honda Memorabilia is such an easy money print', 'Two words: 3D Print.', ""This is hopefully an April Fools given it was yesterday.\n\nThese things aren't replaceable and really if true then they should sell it to McLaren to allow them to continue to demo the old cars."", 'Quite a satisfying video watching them dismantle an engine.', ""They built multiple engines back in the day and have plenty of spares.\n\nThis is extra stock they don't need to continue the historic program"", 'Everything fails eventually.', 'yes but honda have the blueprints and the manufacturing facilities if they ever need to make more. Pretty sure they know what they are doing since they maintain everything.']",121,10,0.96,121,92,92,-1,0,0.0,-1
1jpzyag,"Verstappen vs Teammates (Places ahead, Podium finishes, Race wins, Finished ahead, DNFs)",https://www.reddit.com/r/formula1/comments/1jpzyag/verstappen_vs_teammates_places_ahead_podium/,2025-04-02, Statistics,,"['Daniel is the true GOAT, confirmed', ""Where's Lawson?"", ""I'm here pleading, screaming, begging for a Red Bull Max v. teammate stat to be presented in a consistent way.\n\n(though genuinely I do see the amount of time that goes into this visual, as well as the fact there are X and Y axes, I appreciate you.)"", 'For anyone who wants a SUPER detailed look at this, Peter Brook just out out a great video on this.', ""That last one.. Man, check really got desperate at a point. The number of DNF's is WILD!"", 'Very cool! Kinda wild you can clearly see the inflection point in the finished-ahead graph, presumably circa Monaco 2018, where the slope suddenly increases around race ~75 and is maintained for 100+ races.', ""Are the graphs blurry for anyone else? They're readable, but for basic info I should have to read blurry graphs."", 'Just goes to show how much of an opportunity Dan Ricciardo threw away when he had a car that was built specifically for him. At his peak, he was fearless, one of the great passers.', ""A few things I thought were interesting to see:\n\n\\- Sainz and Ricciardo actually finished more places ahead of Verstappen, even though it's closely matched over these stints.  \n\\- Ricciardo actually had quite a bit more podium finishes until his DNF streak started.  \n\\- From roughly between the 55th GP and the 145th GP, Verstappen had about 5x as many podium finishes as his teammates (\\~50 vs \\~10).""]",104,38,0.82,104,37,37,1,1,0.0,1
1jq9e3p,"[Sky Sports F1] 'If I get the call, I would say I'm ready!' Isack Hadjar is adamant he'd move from junior team Racing Bulls to Red Bull if he was presented with the opportunity in the future",https://www.reddit.com/r/formula1/comments/1jq9e3p/sky_sports_f1_if_i_get_the_call_i_would_say_im/,2025-04-03, Video,,"['isack please don’t give marko any more ideas', ""these questions are so dumb. What kind of F1 driver will EVER say 'oooo idk if i want to drive for the most successful team from the last 5 years... im just a widdle baby.... im so scared :('"", ""Of course he couldn't say anything else, but I'm also sure he means it. Just because Liam didn't drive that car well for three qualis, 2 GPs and a sprint doesn't mean that no one else can drive that car. Of course Isack believes that he can."", '![gif](giphy|48gaakXV8sEPT5X57o)', 'See you in Saudi my friend', 'Sushi belt seat', 'I don\'t think the honest answer of ""fuck no, I don\'t want to be treated like a number 2 in both senses of the term, and that car is a fucking disaster"" would aid his F1 career.', '""Future"" as in two months', 'that’s not wise but you can’t refuse the opportunity', 'Give it two races']",93,36,0.9,93,34,34,28,9,0.0,28
1jqb2n5,"[Julianne Cerasoli] Japanese journalist asks Max about this being his last race with Honda in Japan. There is silence, Max laughs. ""You're putting words in my mouth!"" Max jokes. Of course, because Honda will equip Aston Martin from next year.",https://www.reddit.com/r/formula1/comments/1jqb2n5/julianne_cerasoli_japanese_journalist_asks_max/,2025-04-03, News,,"['i don’t get it, what did the journalist mean?', 'He said that maybe he could reunite with Honda in the future. \n\nhttps://www.espn.in/f1/story/_/id/44503301/red-bull-max-verstappen-says-goodbye-now-honda', ""because it won't be my last race with Honda in Japan \\*wink wink\\*\n\n\\- Max"", 'If he says “it’s sad not to be racing with Honda at Japan anymore” then he’s saying he’s not going to Aston.\nBecause he didn’t say that, he’s basically admitting he’s going to Aston.\nThe question is brilliant', ""This doesn't make much sense without what she specifically asked, since he responds by saying she puts word in his mouth. \n\nDoes anyone have the interview?"", ""Don't say FOR NOW yesterday and than be surprised if people have questions\xa0"", 'Yes, let’s all read into this seven levels too deep.', ""Red Bull won't be Honda powered next year. This is the team's last race in Japan as a Honda customer."", 'The same thing they all mean “Max when are you leaving”']",108,21,0.94,108,20,20,108,21,0.94,108
1jq3dmz,Equipe Ligier: The Ups and Downs of the first ever French Team to win a Grand Prix,https://www.reddit.com/r/formula1/comments/1jq3dmz/equipe_ligier_the_ups_and_downs_of_the_first_ever/,2025-04-02, Throwback,"This story begins with two friends, Guy Ligier and Jo Schlesser, both of them were avid race car drivers who had a dream, the dream od creating their own car brand and sports team, but those dreams seemed to shatter when Jo Schlessee perished on the 1968 French Grand Prix while driving the infamous Honda RA302, which John Surtees deemed a deathtrap, when his car lost control and the magnesium chassis burnt into flames. Guy decided that nothing would stop him from making his and Jo's dream come true, so he created Ligier Automotive, and as a tribute to his late friend, every car the team built had the initial JS as a tribute to his late friend.

Ligier jumped into the thriving world of F1 in 1976, which seemed a risky decision, but he signed a promising driver named Jacques Laffite to take the wheel of their first ever F1 car, the JS5, and also signed an exclusivity deal with Matra, after taking their F1 team assets, things seemed to go on a very good way, they got their first pole at the Italian Grand Prix and they also got three podiums finishing a respectable 6th ppace in the Constructors Championship with 20 points, even though 1977 went a bit more sour, they got their first ever win, and the first for an all French team in F1 history at the Swedish Grand Prix.

1978 was another solid year with podiums but no wins, but there came the ground effect, and with that, their best car, the JS11, they started the season with 2 straight wins of Laffite in Argentina and Brazil, and after signing a second driver in Patrick Depailler, winning the Spanish Grand Prix and leading the championship after Monaco, Ligier was looking to get it all, but Depailler broke his legs in a gliding accident and had to retire from the season. Reliability also killed all chances from getting a championship, as did Depailler replacement, Jacky Ickx, who wasn't able toget the grips on the car. Ligier finished that year 3rd in Constructors, with Laffite 4th and Depailler 6th even after missing half of the season.

By 1980, they signed Didiee Pironi as Ickx's replacement, and even though Laffite didn't like having a teammate, the car was solid and they garnered 2 wins and a 2nd place in Constructors (P.S. by 1979 they swapped to Ford after Matra gave poor results). In 1981 even though Laffite was the only competitive driver, he had a small chance of getting the championship at the last round in Las Vegas, and he ended up just 6 points behind champion Nelson Piquet. 

But suddenly, from 1982 to 1984, Ligier suffered a deep downward dive in performance, going pointless in 1983, only scoring a few podiums in 1982 and also losing their star driver Laffite, but in 1985 the team had new Renault engines that were powerful enough to make that car fight for points and podiums again, and in 1986 everything seemed to be going right into place, Laffite returned in 1985 and Rene Arnoux signed also for them, the duo looked strong and were consistent points and podiums contenders, but in the British GP in Brands Hatch, a massive crash ensued and Laffite broke both of his legs, ending his long career in F1 and leaving Ligier devastated, as they had lost their top driver. From 1987 to 1992 nothing seemed to work on the small French team, their performance was worse and worse as the seasons went on, they even weren't able to qualify in certain races. 

The morale was on the floor, but suddenly, in 1993, they were able to make a car solid enough and with good drivers such as Martin Brundle and Mark Blundell, they were able to finish on the podium a few times, and get enough points to get the team up to 5th in the Constructors Championship, and they were also the best team with a passive suspension that year, compared to the top teams who used an active suspension. 

By 1995, Ligier was able to sign a deal with Mugen Honda as their engine suppliers, but of course, with that came Aguri Suzuki as their driver along with Olivier Panis. During the season Brundle and Suzuki swapped seats for certain races, with Brundle even scoring a podium, the team put another solid season and finished 5th in Constructors again. In 1996, things seemed grim for the team as they were going to shut down after that season, but they were able to leave with a last hurrah with the miraculous win of Olivier Panis on the crazy Monaco GP where he got the first win for Ligier in 15 years, and of course the team's top driver, Jacques Laffite was there for the celebration aswell. At last, they closed the season with a respectable 6th place in the Constructors Championship with 15 points. And so ends the tale of the Equipe Ligier with 9 wins, 50 podiums and 9 poles, a remarkable tale that begun with two friends wanting to create a car brand and ended up with one of the most beloved teams in F1 history.","[""I'm surprised you totally skipped over the whole reunion with Renault that both caused their brief upswing in 1993 and the vulture-like Briatore by-out, as well as the constant failed negotiations with Prost that started as far back as his Ferrari days as those were what really sealed the team's fate. The team's brief spell as a Lambourghini customer was an interesting chapter too."", 'That was a great read mate. Thank you for putting the effort and not just posting a ""here is my Ligier livery if they were in F1"" type stuff.', 'My favorite Ligier story was how the JS11 had way too much downforce from its ground effect that it needed to ""cheat"" with a series of flaps (dubbed the *clapet*, french for ""valve"") in both its venturi tunnels that would open at a certain pressure. The team went to great efforts to hide this that their actions raised the suspicions of Giorgio Piola. Luckily for the latter, a chance to see what was going on opened up when one of the cars crashed at the final race of the 1980 season at Watkins Glen. Back then, the garages were some distance from the pits, so when the car was brought there, Piola ran as fast as he could to snap photos of the venturis before the team, most of whom were coming from trackside, could cover them up with towels. On the way back, Piola saw Ligier designer Gerard Ducarouge and gave a thumbs up at him, indicating that he caught what they were doing. According to Piola, Ducarouge apparently hated his guts after this.\n\nPiola talks about this in this video with Autosport. https://www.youtube.com/watch?v=Z8zVD34wK-Q', 'I know the cars were built by Ken Tyrrel. But surely the Matra team count as a French team and were the first to win a race?\n\nThat was a great read, thanks. I always had a soft spot for Ligier.', ""I'm sorry, I wrote this at 1AM, I know I skipped some details, so I'll try to do better next time."", 'Now that you mention it though, a modern take on the Parmalat/Gauloises or Gitanes liveries sounds kinda sexy.', ""Actually, Ken Tyrrell's Matra team ran under a British flag, Matra International was it's name. The French counterpart, Matra Sports never won a race under a French flag."", 'Nah, this was great. Thanks for writing it. Lots of stuff I didn’t know.']",78,10,0.93,78,8,8,4,1,0.0,4
1jpo96i,[Motorsport.com]ASMRAn experienced mechanic disassembles a Honda F1 V10 engine!,https://www.reddit.com/r/formula1/comments/1jpo96i/motorsportcomasmran_experienced_mechanic/,2025-04-02, Video,,"['For those wondering, the engine is the 1990 RA100E.', 'The only thing that would have made that better is had they reassembled it and got it running.', 'Are they hinting at something?', 'If F1 ever returns to V10 in 2029 like AMuS speculated, they should do something slightly different like allowing additive manufacturing and oblong/oval pistons heads', 'Honda missed an opportunity to do a crossover with James May considering he did an entire documentary of assembling a Honda Z50 Monkey bike...', 'I want that hat', 'Nope. Engine is likely getting parted out and sold as memorabilia.', 'Most likely just promotion for their new business selling old F1 engine parts as memorabilia.']",77,8,0.89,77,24,24,2,0,0.010000000000000009,2
1jqbb98,Pierre Gasly reached out to Yuki Tsunoda after his Red Bull move to offer him some advice [Autosport on IG],https://www.reddit.com/r/formula1/comments/1jqbb98/pierre_gasly_reached_out_to_yuki_tsunoda_after/,2025-04-03, Social Media,,"['The bromance continues.\n\nIt was just a short affairs with Hadjar', 'The whole F1 world is behind him.\n\nEven I want to give him a call and share a couple of ideas on how to deal with a difficult working environment.', 'If Yuki spins Max in turn 1 we know who to blame.', 'His idea: ‘Drive fast! As fast as you can!’', '""don\'t fuck it up""', '""if there\'s a drive elsewhere, take it Yuki""', 'Was Pierre also offering to take him out clubbing to decompress after?', 'Yuki WDC 2025', ""Yuki said that he hasn't even spoken with Marko which he found weird. He said normally Marko always calls and doesn't know why not in this case."", '""Whatever you do, don\'t ever let Max lap you during a GP""']",116,17,1.0,116,17,17,116,17,1.0,116
1jq0jap,'Complete tear-up' - Inside Mercedes' 2026 F1 engine project,https://www.reddit.com/r/formula1/comments/1jq0jap/complete_tearup_inside_mercedes_2026_f1_engine/,2025-04-02, News,,"['It\'s a ""tear up"" compared to the current generation of power units, they\'re not suddenly starting over on the 2026 power unit.\xa0', ""Curious to see how they handle that new fuel in particular. Among the big 3 engine manufacturers, HPP is the one who struggled the most with the switch to E10 in 2022, and that's one of the main reasons why their engine isn't the best anymore. The estimates are that they're down between 5 to 10 HP on Honda and Ferrari, with Ferrari allegedly having the best output currently.\n\nAlso for what it's worth Otmar Szafnauer (who used to work at Honda) said his prediction was that Mercedes will come out with the best engine in 2026 but by the end of those regulations it will be Honda at the top, as they have a history of improving quicker than everybody else. He mentioned the early 2000's when Honda had the best V10 from 2004 onwards (lightest and most powerful) and we can add 2021 as well, when they made enough gains to match Mercedes and once again ended a cycle with the best engine overall. Their ERS has been the class of the field eversince and that will be even more important in 2026"", 'Of course everyone but Ferrari will have to do this considering split turbo being not allowed', 'These engines are gonna sound wimpy AF aren’t they', 'Interesting insights, engine are among the most carefully guarded parts of a F1 car. Any morsel of news is kinda gold.', 'clickbaity as hell', 'Idts Honda would be as competitive without the engine freeze. I feel that has flattered them a lot.', ""Honda lost a lot of staff, tech and secrets to RBPT and general firings/repostings/resignations with their out-again-in-again strategy and their success was in no small part to make up for a failure deemed too catastrophic to not redress.  I don't think it's at all a given that they'll have the same strengths again."", 'Although it’s all speculation… what are the current estimates of engine performance going into 26?']",47,24,0.74,47,23,23,4,0,-0.010000000000000009,4
1jpm6ti,The minuscule tweak that could transform Doohan's F1 prospects,https://www.reddit.com/r/formula1/comments/1jpm6ti/the_minuscule_tweak_that_could_transform_doohans/,2025-04-02, Technical,,"['It should be noted that Gasly’s radio at the end of the last race said that he thinks Alpine has a significant problem with the differential, that it’s a bigger problem than they think, and that it’s been ongoing since Melbourne. \n\nHe’s not been happy with handling throughout the past 2 races, so if he’s right and that problem is replicated on Jack’s car, it’s possible that tweaking the rear geometry may only add to his problems…', '“The change that was made was to the rear suspension geometry, understood to be a tiny increase in toe-out. “', 'The fact that they’re running Hirakawa in his car rather than giving him the time in the car and using Gasly suggests that it’ll need much more than that to change his prospects', 'He could finish on the podium and it won’t matter.', ""They deleted Argentina's access to the Internet?"", ""They already tweaked the rear geometry on Jack's car after preseason testing and before the first race. It seems to have made an improvement at least."", 'I thought it was a good article worth reading. Short and sweet.', 'The two are entirely unrelated - the rookie test was planned before the season started.', 'Gasly finished on the podium and even won yet there were still zero chances back in the RB.\nThat first impression is crucial in this sport more than in any other.']",40,23,0.82,40,204,204,1,0,0.009999999999999898,1
