unique_id,post_heading,post_url,publish_time,tag,post_content,top_comments,upvotes,comments,upvote_ratio,score,total_upvotes_comments,total_score_comments,upvotes_growth_rate,comments_growth_rate,upvote_ratio_growth_rate,score_growth_rate
1o7k9wj,"[News] A new salary in the region of £30m-a-year will make Russell the third-highest earner on the grid, behind only Red Bull’s Verstappen and Hamilton at Ferrari.",https://www.reddit.com/r/formula1/comments/1o7k9wj/news_a_new_salary_in_the_region_of_30mayear_will/,2025-10-15, News,,"['So end of the year drivers dinner on George this year.', 'good for him, since iirc he was the poorest paid of the top team drivers in recent years', ""well, now he's going to be able to afford the PowerPoint license upgrade."", 'I’ve made a George joke or two, but good for him. One of the better drivers on the grid, interested to see what he can do if Merc can give him a more consistent car.', 'it actually looks like he got everything he wanted. \n\nallegedly he got 30 mill AND a multi year deal, if he also got less sponsortime he actually got it all.', ""Good on him for getting the bag. Holding out doesn't always get you more money, as another George found out."", 'Well deserved :)', ""He deserves it. He's showing talent on their level, but without the car to back it up. When George gets a championship car, I think he's going to turn a lot of heads with how good he is."", ""Dinner's on you, George. On the next GaLex date."", 'Blimey']",3215,268,0.98,3215,8093,8093,84,1,0.0,84
1o7oxcw,Williams Unveils Iconic 2002 Look to Celebrate Atlassian Partnership,https://www.reddit.com/r/formula1/comments/1o7oxcw/williams_unveils_iconic_2002_look_to_celebrate/,2025-10-15, News,,"[""Now put Montoya back behind the wheel please'n'thanks."", 'Oh the nostalgia! I love!', 'This is quite easily my favourite livery of the year, other than maybe the Monza Ferrari. They should just stick with this for next year tbh.', 'Instant W if it’s the classic BMW Williams livery!🤘🏻', ""Best special livery so far, Astons and McLaren's were too boring and VCARBs was just disgusting"", ""Which is ironic, because Atlassian software always feels like it's running on a server from 2002.\xa0"", 'With a V10 and reserve driver Number Jaun Pablo Montoya\xa0', 'I’m bricked up.', 'Stop! I can only be aroused so much!!', ""There's a few bits of the implementation that I'd change (I'd like more of a connection between the white on the nose and that on the rear), but largely I'm a big fan.\n\nI've been calling for Williams to incorporate some more white into their livery for a while now, both for added contrast and for historic reasons (blue and white is the team's historical scheme after all, going back all the way to Frank's original Brabham BT26A in 1969). This goes some way towards that, and is a significant improvement on their typical livery as a result IMO.""]",1099,134,0.98,1099,1864,1864,14,0,0.0,14
1o7gqt2,Racing Bulls reveals special livery for United States Grand Prix,https://www.reddit.com/r/formula1/comments/1o7gqt2/racing_bulls_reveals_special_livery_for_united/,2025-10-15, News,,"[""Well....that's certainly something."", 'It was really expensive because the pattern is so complicated', 'What is that pattern? A pile of leaves???', 'Did Joe Exotic design it?', 'It looks like burnt nachos and melted cheddar', 'You know how sometimes when you first learn how to design something with Photoshop and you go completely overboard. It’s like that, but worse', 'Rare vcarb L. They usually have banger special liveries.', ""...what's it supposed to be?"", 'MY EYES!!', 'Atrociously ugly imo but at the very least not half-assed unlike some other teams this year.']",982,278,0.95,982,3686,3686,-2,0,0.0,-2
1o7g1cg,George Russell | Passenger Princess | F1 drivers teach me to drive,https://www.reddit.com/r/formula1/comments/1o7g1cg/george_russell_passenger_princess_f1_drivers/,2025-10-15, Video,"F1 and Amelia Dimoldenberg have teamed up for a new YouTube series, Passenger Princess, featuring F1 drivers George Russell, Oscar Piastri, Ollie Bearman, and Carlos Sainz. The first episode launched today. Amelia has previously had Lando on an episode of her series [Chicken Shop Date](https://youtu.be/063FqEfBTns?si=sSO_B8ym05sMZS6H)","[""Completely matched Amelia's deadpan energy. Sibling coded tbh. Eight minutes of classic British bickering"", 'George has the skills, charisma and willingness to do press stuff to become a megastar. All he needs now is Merc not to fuck up the next regs again and deliver a piece of shit car.', 'Lol great time to release this with all the GR news lately 🤣🤣🤣', 'Glad he is leaning on his nickname. That’s the way to go about it.', 'Love Amelia and her content so super happy she’s able to branch out and do content like this. Thought this was actually really good and they were both super funny imo, excited to see the next part next week.\n\nHere’s her date with Lando if you haven’t watched it yet: https://youtu.be/063FqEfBTns?si=1Yz9zoJA_eAOwmiw (Just noticed the date was linked in the post lol)', ""It's funny how many butts he clenches when he's really just George lol look at this! He's so likeable."", 'love amelia and love this, her chicken shop date with lando was so fun', 'This was a great watch!', ""We'd both need helmets if you told me I was going to be driving around spa with George Russell lol"", 'Lovely stuff. Amelia is so quick with her thinking while interviewing.']",771,53,0.9,771,1965,1965,7,0,0.0,7
1o7bbb0,Want to see some weird and cool forgotten aero ?,https://www.reddit.com/r/formula1/comments/1o7bbb0/want_to_see_some_weird_and_cool_forgotten_aero/,2025-10-15, Technical,"These are aero tests both performed at Monza from 1990 ( Mclaren ) and 1997 ( Williams ), these have both been posted here but was quite a long time ago and a lot of people didn’t see them. Enjoy these really strange but interesting and cool experimental designs. Post pictures in the comments of similar forgotten tests and or race run designs that are interesting in your opinion ","['Remember Villeneuve testing that Williams car, gave it a few laps and said ""nope"" and they replaced it. Apparently it was so unstable in turns you would basically be praying that the brakes wouldn\'t overheat into braking zones, and then pray the front wouldn\'t understeer to the point it was borderline just not turning at all', ""There's a great story from F3 in 2009 - one team realised that the only mandatory part of the rear wing was actually the championship stickers, so they chopped the rear wing down to get the bare minimum amount to fit the stickers on (by folding the stickers over they could halve the area) https://www.racecar-engineering.com/wp-content/uploads/2011/09/upDallara-f3.jpg"", 'Monza ""low wing"" setup taken to the extreme.', 'Williams 9X8', 'The Stadium Car in TrackMania Turbo has a wing similar to the Williams one', 'Ferrari and their front wing constructed with Legos:https://www.reddit.com/media?url=https%3A%2F%2Fi.redd.it%2Fcuatmcuy6yw21.png', 'https://media.gettyimages.com/id/1605083365/photo/f1-grand-prix-of-brazil.jpg?s=612x612&w=gi&k=20&c=Ar4Y2kpZGWEHqw8c6fCSAkhvT3b6Da2mTBHwIPpVnHQ=', 'No x-wing? Come on', 'The little wings they used for the 2001 Monaco qualifying comes to mind', 'Was this something that Williams were just trying out on their own or was or was the FIA testing out ideas for possible future regulations?']",671,51,0.98,671,524,524,4,0,0.0,4
1o7vey1,"Toto Wolff: George Russell ""was always underrated"" in Lewis Hamilton comparison",https://www.reddit.com/r/formula1/comments/1o7vey1/toto_wolff_george_russell_was_always_underrated/,2025-10-16, News,,"['He would give him a 6 month contract if it was possible.', 'Same person that wanted to give him a lap by lap contract btw', 'Toto, who was ready to give up on George to get Max a few months ago...', 'Itt people acting like they know how the negotiations went on between Russell and Toto.', '""I mean if George would have bought into the fashion style of Lewis, maybe it would have given him more photos, but that\'s not how he is""\n\nI don\'t know, this sticks out like being offensive for both of them.', 'People are not ready for this conversation yet, but Toto is one of the  slimiest guys in the paddock.\n\nThe stuff dates back to when he essentially forced Ross Brawn out of the team right at the moment they started dominating ( and they knew they would with the new regs) so he could take all the credit.\n\nHe is no better than Horner, Horner at least never acted like the ""nice guy"" and would then stab you in the back.', ""Both Lewis & George got underrated by their time as teammates. Every time teammates are close people act like they must both suck, rather than considering that they're both elite and pretty much at the peak of the car every week"", 'Yup, so underrated he re-signed him so fckn late. \U0001fae9', 'The biggest slap by Wolff was, as his manager, signing Russell to Williams on a three-year contract and instead running Bottas in the second seat.', '""I\'ll sign this contract, but only if you tell them I was better than Lewis. And tell the whole world""']",391,108,0.91,391,99,99,31,11,0.010000000000000009,31
1o7bqcl,Red Bull ‘asking the right questions’ to chase down McLaren - Verstappen,https://www.reddit.com/r/formula1/comments/1o7bqcl/red_bull_asking_the_right_questions_to_chase_down/,2025-10-15, News,,"['We need a Barcelona Special to get Max back into this thing.', ""I'd love to see it, but I just can't see how Max is going to claw back that many points in so few races... especially with George occasionally popping in great results as well.\n\nWould make for an incredible rest of season though if say the 2 McLaren's both retire in COTA and Max wins the race."", ""I'm not expecting a miracle, but being that strong at Singapore is ominous\xa0"", 'If only they asked them a few races sooner', ""yeah idk why everyone's so optimistic about Max still having a chance at the WDC. As a Max fan, it will be great, but its seriously unrealistic"", ""Max winning the WDC would require an epic meltdown at McLaren, e.g. numerous DNFs, crashes, etc.\n\nThe outcome would be less about his prowess and more about McLaren's failures. \n\nMax really can't be more world class than he is and overcome McLaren's lead. McLaren would need to fail."", ""'FIA, are we allowed to cool our tires with water?'"", 'Redbull is strong only in 3/6 tracks left- Mexico, Brazil and Vegas whereas McLaren are strong in 5/6 tracks except Vegas and with Merc also having a strong pace it will be a miracle if Max is able to be in contention till Abu Dhabi, winning is very far.', 'It’s going to take more than one race where the MCL’s take each other out. Not very likely to say the least.', ""It's Mclaren/Piastri/Norris' WDC to lose. Max winning WDC requires a lot of failure on their part. Even if Max wins every race, he needs Piastri and Norris to place poorly.""]",373,83,0.94,373,1327,1327,5,0,0.0,5
1o7vc5v,"Apple vice president responds to F1 broadcasting rights rumours: ""We do love F1""",https://www.reddit.com/r/formula1/comments/1o7vc5v/apple_vice_president_responds_to_f1_broadcasting/,2025-10-16, News,,"['We know. Tim Apple was so excited to wave the flag that time he could barely move.', ""If I lose the F1TV Archive because of this I'm going to be so depressed"", 'As long as we keep F1TV in the US, I don’t care if Apple has the broadcasting rights.', 'They misspelled money', 'Fuck Apple. They own enough. F1 TV is almost perfect and if they touch it I’ll just stop watching.', 'please stop loving F1 then', 'F1 would lose a bunch of goodwill after creating F1TV if someone can just backup a big truck full of money and take it away from people just because they want to broadcast F1. I hate how we the consumer get absolutely no say in this.', 'Can any MLS fans weigh in on their coverage?', 'Subtext: we do love money', 'And I hate Apple.']",294,76,0.96,294,72,72,13,1,-0.010000000000000009,13
1o82iyc,Alpine becomes sixth F1 team to change livery for United States Grand Prix,https://www.reddit.com/r/formula1/comments/1o82iyc/alpine_becomes_sixth_f1_team_to_change_livery_for/,2025-10-16, News,,"['Assuming this means Colapinto stays for 26.', 'So Renault is back? /s', ""Alpine has the opportunity to partnership with MeLi and make a livery of the 2005 Renault with Alpine's blue and MeLi's yellow..."", 'I’m sure people will hate this, but I love it. Something about the clashing loud colors reminds me of the obnoxious late 90s NASCAR t-shirts I grew up around.', 'It sort of annoys me to a perhaps unreasonable extent that everyone thinks they need a special livery for every US race.', ""Special liveries for every race, this isn't even a milestone race for COTA it's been here 13 years lmao"", 'It’s so Alpine to be the worst change yet lol.', 'The video announcement they released as part of this is pretty nuts\n\n[https://xcancel.com/AlpineF1Team/status/1978762845056544950](https://xcancel.com/AlpineF1Team/status/1978762845056544950)', ""Imagine there's no BWT and it being replaced by the yellow of Mercado Libre. It would be the closest we could get to the mythical Mild seven livery."", 'Maybe im old fashioned but im not a fan of half the grid bringing ""special"" liveries to so many races per year without much meaning \n\nSpecial liveries used to be just that, special, a rare thing teams would do to commemorate something \n\nThey\'re not special one-off\'s anymore, its just ""Livery of the week"". This trend thats cropped up over the last 3 - 4 years ain\'t it for me']",264,73,0.97,264,71,71,60,13,-0.010000000000000009,60
1o7p9xk,McLaren unveils Google Gemini livery enhancement for United States and Mexico City Grands Prix,https://www.reddit.com/r/formula1/comments/1o7p9xk/mclaren_unveils_google_gemini_livery_enhancement/,2025-10-15, News,,"['So that makes half the grid doing something with their livery this weekend\n\nMcLaren, Aston, VCARB, Haas, Williams\n\nedit: and now Alpine too lmao', ""As if I wasn't tired enough of AI being stuffed down my throat everywhere else, now I can watch it invade my enjoyment of F1 as the camera zooms and pans in on this logo for far too many minutes.  Sigh"", ""Meh. They've done this look better"", 'Is this enhancement in the room with us?', 'Boring', 'Buried lead. \n\nWhite suit. You know what that means boys!', 'We gotta stop with AI', 'It’s nice, it’s nothing special. It’s just a rehash of some of their others with a more boring theme', '*“McLaren Racing are excited to reveal an iridescent livery enhancement, created in collaboration with Google Gemini, that will be run on our Formula 1 challenger at the 2025 United States and Mexico City Grands Prix.\u202f \nIn addition to featuring on the MCL39 across the United States and Mexico City Grands Prix weekends, the unique Google Gemini-inspired livery will also be represented on both drivers’ overalls and boots.\u202f“*\n\n*“The iridescent livery is inspired by the sparkle of Gemini’s colour palette and aims to highlight Gemini’s role as a personal, proactive and powerful assistant to unlock creativity and to inspire and guide its users in everyday lives.\u202fThe livery and fan experience make up a part of McLaren’s Never Stop Racing campaign, and look to channel the feeling of being ‘In the Zone’.*\n\n*McLaren has previously run livery enhancements with Google Chrome at the British Grand Prix in 2023 and 2025 and the US Grand Prix in 2024. “*\n\nPersonally, I prefer the “Google Chrome”-sponsored chrome look from Silverstone, but I suppose it could certainly be worse.', ""The commentators missed Norris getting fully alongside Verstappen late in the race at Singapore because the cameras were so zoomed in to the google Gemini logos on Norris' car lol""]",192,120,0.81,192,1017,1017,5,0,0.0,5
1o7gaxz,"Kimi's last-ever Grand Prix win 🇺🇸 Kimi Räikkönen took victory at the 2013 Australian Grand Prix and returned to the top step at the 2018 #USGP, one of the longest gaps between Grand Prix wins (2,044 days) The record belongs to Riccardo Patrese, with 2,405 days between wins in 1983 and 1990.",https://www.reddit.com/r/formula1/comments/1o7gaxz/kimis_lastever_grand_prix_win_kimi_räikkönen_took/,2025-10-15, Discussion,,"['Fernando trying to break that record I’m sure', '""f*cking finally, thank you guys""', ""I remember that race. I literally did not sit down the entire race. I didn't even do that for the Abu Dhabi 2021 finale! COTA 2018 was simply a race I couldn't sit down for, I was pacing around the living room the whole time!"", 'It was my first F1 race and to see my favorite driver win was super special. Even more special was a kind Redditor mailing me the copy of a local newspaper from Finland all the way to states! One of my cherished treasures!  \n  \nShoutout to u/MikeNorris (profile is no longer active) but here’s the post I made back then https://www.reddit.com/r/formula1/s/unCeW493pa', 'Crazy how he long he spent at the team during his 2nd stint, and he only ever won one race', 'He knew he was number 2 and bwoah he didn’t care. 26 podiums with a win in 100 races (counting the shitty 2014 season aswell).', 'they knew it as well but its not like he didnt care to win, given the chance these guys will take it. might look like it but he cares, he didnt he wouldnt be in the car. \n\nbut there was a mutual understanding by the team and the driver about whats really expected of both.', 'And a mediocre 2016 car that didn’t get a win at all']",139,8,0.97,139,103,103,6,1,0.0,6
1o7pyav,Haas F1 Is Hoping for a Home Run With Austin Upgrades,https://www.reddit.com/r/formula1/comments/1o7pyav/haas_f1_is_hoping_for_a_home_run_with_austin/,2025-10-15, News,,"['that late in the season? good luck Haas, given the track record of their mid-season upgrades...', 'Probably be a bunt', 'Lol I read autism upgrades. Gave drivers some tylenol', 'Their last big Austin upgrade package was such a fiasco that Guenther got shit canned over it.  They have a much better track record with upgrades the last two years since Ayao took over.', ""Too bad, I was hoping for a 'touchdown'."", ""Let's hope it's as good as their 2016 Austin updates package, maybe with less parts flying off in practise too"", 'A Home Run is when you go around the track/bases and return to were you started.   \nI surely hope that the new upgrades allow them to do just that.   \nLike, several times. Maybe 56 times. Could add one homerun for warm-up and one for cool down.', 'Here’s the 0-2 aaaaaaaand swung on and missed strike 3!\xa0', 'To be fair, they only started actually bringing them last season and almost finished 6th in the standings, so I’m hopeful!', ""it's running on Tylenol!""]",107,12,0.96,107,83,83,-1,0,0.0,-1
1o7ytsq,The final overtake secured Sato’s only F1 podium in his career – USGP 2004,https://www.reddit.com/r/formula1/comments/1o7ytsq/the_final_overtake_secured_satos_only_f1_podium/,2025-10-16, Video,,"['Sato was a very fun driver to watch. He made a lot of errors but also had a lot of bad luck, particularly in 2005. \n\nHim (in a Super Aguri) overtaking Alonso (in a McLaren) at the 2007 Canadian Grand Prix was awesome.', 'Kinda fitting that he got his only podium here, seeing he has won it twice the other way around', 'great race by taku back than. iirc he overtook barichello at the beginning of the race.   \nanyway, contact with barichello denied him best ever japanese f1 finish - second place at nurburgring.', 'Yuki, when?', 'That Canadian GP will always be an all time classic because of Super Aguri.', 'Might have gotten one by now, more than one maybe, if he was still with racing bulls. What are the odds 😔']",84,6,0.96,84,6,6,9,1,-0.010000000000000009,9
1o81j2h,The Crazy Logistics Of Formula 1 Catering | Kym Illman,https://www.reddit.com/r/formula1/comments/1o81j2h/the_crazy_logistics_of_formula_1_catering_kym/,2025-10-16, Video,,"['And Red Bull paid for it all.', 'Very informative video. \nI thought everyone would bring their own “lunch” lol.', 'The Stig is a cook too!', 'Does he know?', ""This one always amused me. I always thought it was the sporting bodies moving goalposts after the submission, in which case it was ridiculous. But *also* I wouldn't put it past every team to be trying to fudge the numbers and see if you can fritter away some extra development cost into a seemingly benign cost category.""]",0,5,0.49,0,5,5,0,2,0.08999999999999997,0
