unique_id,post_heading,post_url,publish_time,tag,post_content,top_comments,upvotes,comments,upvote_ratio,score,total_upvotes_comments,total_score_comments,upvotes_growth_rate,comments_growth_rate,upvote_ratio_growth_rate,score_growth_rate
1k0dedx,Ask r/Formula1 Anything - Daily Discussion Thread,https://www.reddit.com/r/formula1/comments/1k0dedx/ask_rformula1_anything_daily_discussion_thread/,2025-04-16,,"# Welcome to the [r/formula1](https://www.reddit.com/r/formula1/) Daily Discussion / Q&A thread.

This thread is a hub for general discussion and questions about Formula 1, that don't need threads of their own.

Are you new to Formula 1? This is the place for you. Ever wondered why it's called a lollipop man? Why the cars don't refuel during pitstops? Or when Mika will be back from his sabbatical? Ask any question you might have here, and the community will answer.

Also make sure you check out our [guide for new fans](https://www.reddit.com/r/formula1/wiki/newtof1), and our [FAQ for new fans](https://www.reddit.com/r/formula1/wiki/faq).

Are you a veteran fan, longing for the days of lollipop men, refueling during pitstops, and Mika Häkkinen? This is the place to introduce new fans to your passion and knowledge of the sport.

Remember to keep it civil and welcoming! Gatekeeping within the Daily Discussion will subject users to disciplinary action.

Have a meta question about the subreddit? Please [direct these to the moderators](https://www.reddit.com/message/compose/?to=/r/formula1) instead.","['off grid- the duo of Isack and Liam as a pair cracks me up.  its like classic vaudeville double act. they are both pretty funny guys in their own right but the way they balance and contrast is perfect. I am glad the VCARB social media team is seeing the potential.', 'Do you guys think that if Max moved to Mercedes with George, he would immediately start beating him? Or do you think George would be able to fight back better than most people assume? I know Max is a generational talent and one of the best drivers in history, but George is an established part of the Mercedes structure and a very skilled driver in his own right. I could see George really bothering Max during the first months of their partnership.', 'Can someone fact check me real quick about the teams and power units, especially for 2026?\n\n\\-Honda wanted to withdraw after 2021, so RBR tried everything to get a solution. Honda wouldn\'t sell their IP, but RBR was able to negotiate an engine freeze, which meant Honda could significantly reduce development, and almost pull out, while still supplying engines. RBR already created RBPT, but instead of building the Honda engines with their IP, they essentially kept buying the engines, and worked with Honda like before, just that most of the development on it stopped. So essentially RBPT is more or less a shell, gearing up for the point when they do have to create their own engine, and all the secrets are still with Honda, who supply RBPT with their engine, who then license it in their name.\n\n\\-That same Honda already commited to re-enter in 2026 for the new PU regs, this time partnering with Aston Martin. Honda still have their own engine as mentioned before, so the new one will probably be based off of that, which is why they limit their access to the engine that much with RBPT, and didn\'t want to sell their IP\n\n\\-Aston Martin invested heavily into building their own engine, but I assume have since backpedalled to just support and work with Honda in their development, in a kind of ""we\'re not the same but we\'re working a lot closer than a customer"" deal that RB previously had with Renault before Renault re-entered, and then with Honda later on\n\n\\-Renault will stop their engine program alltogether, and Alpine will become Mercedes customer number 200 or something, probably hindering their progress even more, since independece was the only thing they had going for them\n\n\\-Audi is building their own engine from scratch, and use it on their own team that used to be Sauber / Kick\n\n\\-GM is working on their own engine as well, but isn\'t going to be ready in time. Instead they will enter as an 11th team, but use Ferrari engines for the first 2 year and become fully operational in 2028 (100 race plan?!)\n\n\\-the ICE will remain the same, but fuel will be measured differently and reduced, so just a toned down version of the current V6, the MGU-H will be gone entirely, and to compensate the battery and MGU-K will be increased significantly, more or less similar overall power, just less conventional and more electric\n\n\\-chassis will be smaller and lighter, less ground effect and a tiny bit more complex aero again (so worse racing again? 2022 worked pretty well in terms of following each other compared to 2021)', ""If Max moves to another team with a top driver who's been there for years (e.g. Max to Ferrari after Lewis leaves, with Charles as his teammate) who do you think comes out on top in their first year?\n\n\nIf it were someone else going to Red Bull, I'd think Max would easily come on top, but going to a team where the car isn't necessarily moulded around his driving style /more drivable for the other driver, it would be more of a question."", 'It’s still early and purely speculative. But who could be Hamilton’s potential replacement starting in 2027?\n\nIn my opinion, there are two options: Oliver Bearman. If he keeps performing at HAAS the way he is now and continues to grow, I can see it happening. The downside is that he would still be “only” 22 years old by then.\n\nPiastri: if McLaren hypothetically chooses Norris over time as their number 1 driver, then I could see Piastri going to Ferrari for that reason. And to be honest, I’m also just a fan of Piastri and would love to see him drive for Ferrari.', 'Any good places to watch the race in Manchester this weekend?', 'It’s done!!!! The much speculated decision regarding the contract has been made. Expected official announcement, at the earliest, this weekend!!!', ""What do you think the 2026 F1 calendar will look like?\n\nSome things to consider:\n\n* Ramadan next year will be from mid-February to mid-March; a reason why Bahrain and Jeddah are relatively late this year is because Ramadan largely coincided with the whole of March.\n* Imola likely won't be on the calendar.\n* We'll have two Spanish races, with the Spanish Grand Prix moving to Madrid and Barcelona still contracted for a race next year as well.\n* Las Vegas doesn't have a contract for next year yet, though I think it's likely they'll be extended.\n\nMy prediction:\n\n* Australia, Bahrain, Saudi Arabia to start the season. \n* Japan and China as the next leg.\n* Miami, then Montreal as the next two races. With Imola out, it's possible we finally get a brief North American two-parter instead of the Canadian GP interrupting the European leg.\n* Monaco to open the European section of the calendar, then some permutation of Madrid/Barcelona/Spielberg/Silverstone/Hungary/Spa up to the summer break.\n* Zandvoort sings its swan song before the calendar goes to Monza, to wrap up the European leg.\n* The last eight or so races are roughly in the same order as 2024 and 2025 - that is, Baku, Singapore, Austin, Mexico City, Sao Paulo, Las Vegas, Qatar, Abu Dhabi.\n\nThis is all assuming no circuits get dropped besides Imola, and no circuits get added besides Madrid."", 'Are individual F1 teams allowed to release/license their own games? For example, could Ferrari make a game just about Ferrari drivers?', 'What happens if a driver makes a pit stop but changes his mind and continues on? Or if he stops and then just leaves without changing anything? Will there be any fines for this? Or should he wait until the team makes a pit stop? Like this incident [https://www.instagram.com/reel/DIXDb4OvxsO/?igsh=cGplcWE0Y2Nic2sx](https://www.instagram.com/reel/DIXDb4OvxsO/?igsh=cGplcWE0Y2Nic2sx)']",7,84,0.68,7,140,140,-1,0,-0.019999999999999907,-1
1k0j6j0,Red bull have won 75% of all Saudi Arabian Grands Prix [F1 via IG],https://www.reddit.com/r/formula1/comments/1k0j6j0/red_bull_have_won_75_of_all_saudi_arabian_grands/,2025-04-16, Statistics,https://www.instagram.com/p/DIgdIvONtYT/?igsh=MW15YnVkdmxhMHhkcg==,"['60% soon', 'So. 3 of them. Some great math here.', '4 races do NOT make up very relevant statistics tbh', '75%? That sure sounds more impressive than 3', 'And this number will only start descending.', 'Slow news day?\n\nHow about they post some interesting stats. We heard all weekend how the Bahrain track surface was older than some of the rookies. How about a deep dive into the stats of the Bahrain GP since its first race in 2004?', 'Damn that start for 2023 was special. First four race Ver -2 wins Checo -2 wins. There were talks of Per vs Ver championship fight. After Azerbaijan Max anhilated Checo.', 'Did they finally clone Max? There are 2 of them', 'Max Verstappen has impregnated 50% of Nelson Piquet’s daughters.']",0,40,0.45,0,402,402,0,0,-0.010000000000000009,0
1k0kdyl,Do you think Lawson will last the season?,https://www.reddit.com/r/formula1/comments/1k0kdyl/do_you_think_lawson_will_last_the_season/,2025-04-16, Discussion,"Since being dropped by Red Bull, he is performing far worse than he was last year. I’m concerned for him, he’s been terrible in every race this year.

In Japan, he qualified P14 against Hadjar’s P7, and in the race finished 50 seconds behind Hadjar, P8 vs P17. This weekend, he qualified 0.5 seconds behind Hadjar and caused two crashes. 

Do you guys see Lawson lasting the season? Or will they drop him before the summer to throw in another Red Bull Rookie?","['He’ll last the year, but if he doesn’t improve it’ll be his only year.', 'Yeah I think so. Might even get a 2nd unless they\'re all in Lindblad.\n\nHe\'s started the season badly. But hes been thrown into 2 new cars with poor prep and then had the media, fans and his own team knock him.\n\nI mean people used anything to criticise him even ""I\'m not here to make friends"" which is such a milquetoast statement that almost every driver has said. People bringing that up just feels like they\'re looking for reasons to hate him after he replaced some very popular drivers.\n\nHe was damn good last year though with basically no prep, he had some excellent race craft and even though he was inconsistent, he did put together really good laps. Q1 in his first race last season he put in an excellent lap that got the 8th or 9th fastest car on the grid p9 but then had the engine penalty so had to give Yuki a tow in Q2.\n\nIt\'d be an unbelievably cruel and unfair career to continue to demote him without ever giving him a decent amount of time. Even Logan got a season and a half in the same team. \n\nMaybe he doesn\'t have it. But I think we should judge him at season\'s end not from these 4 weekends. He hasn\'t hooked it up yet but he\'s talented and I think it would be understandable if he needs a couple of weeks to reset.\n\nHe might just be bad, but the circumstances haven\'t given him a fair crack of the whip', ""He'll be safe this season, unless he gets completely dominated by Hadjar.  \n\nIf he loses against Hadjar then he might be out of F1 for 2026"", ""It depends on how desperately they want to rush Lindblad in.\n\nTo be fair, this could really all go against Liam's odds even if he performs good enough. If he doesn't outright beat Hadjar for all races by making some miracles in the VCARB, he's at an inherent double disadvantage for his upwards mobility again into an RBR seat by 2026/2027.\n\nI rate Liam really well and I know that he's got a lot more in him, considering how well he performed when he was called up in 2023 and 2024 to the Alpha Tauri/VCARB. I rated him higher than Ollie. He's a versatile driver and I think, given some time, he'll be a good midfield topper as well. The only issue is, I'm sure Horner doesn't want to make any more mistakes. He's not going to miss out on developing Lindblad before it's too late as well.\n\nHe should have put Liam into the AT in 2023 for a full seat if he expected to get him into an RBR after Checo. That's two whole years of full development instead of 11 intermittent races. They wasted so much time. I understand that we weren't exactly expecting both DeVries and DR to just be straight up non-contenders by the end (I was really rooting for Nyck because I was excited after that Williams P9, + Danny is, well, Danny), but no matter how close they deemed Liam to be when compared to Yuki's pace, they should have never allowed Liam to be their primary choice for the RBR seat in 2025 given the conditions that had passed. If they wanted him, they should have developed him. If they didn't develop him, they should have put Yuki in if they couldn't put Danny in and if they wanted Checo out. Now they've left Liam with a lot of pain and a beat confidence.\n\nRealistically, I just don't see a situation where Horner isn't going to try to put Lindblad in immediately. He can't move Hadjar up to the RBR seat too early lest he make the same damn mistake again with Liam. They have Yuki for free for the rest of the year to iron out the second-driver setup, and he can score points; something they need to be desperate for.\n\nBut they need to make space for Lindblad. So? They gut the driver that they don't see themselves putting back into the RBR seat so that Lindblad's getting instant learning time by the mid-season when he's 18. Just so that by 2026 or definitely by 2027; they have a backup plan who's a liiiittle more prepared (though I genuinely don't think they'll get rid of Yuki by 2026. They have no choice. Even if Hadjar or Liam win a race in the VCARB, it will be a hard foolish risk to try again, when no risk has to be taken at all. Yuki is going to say yes to another year, unless the AMR suddenly looks fucking banging by the end of the season, and he's okay with being a reserve. But RBR would much rather the continuity of driver lineups at RBR as they sort fundamental things out with the new cars for 2026, thus I can see Yuki staying, and VCARB being Hadjar + Lindblad).\n\nEdit: But imo, if Horner were reasonable, he'd just maintain the Max+Yuki, Hadjar+Liam lineup all the way through 2026. Full contracts. No ifs and buts. Lindblad gets a guaranteed contract by 2027 in the VCARB so that he can rest easy. No need to do him like Antonelli. What RBR needs is continuity through the new regulations era and a willingness to iron out each and every aspect. Yuki and Max are their most experienced drivers in their entire lineup now, and it's clear that Yuki is good enough at technical feedback and drives fast enough to warrant continuity, even if they think they see more pace in Hadjar by 2026. They can just develop Hadjar and Liam, where Liam is a backup plan, and Lindblad can spend a year gritting his teeth in Super Formula or something. They listen to Yuki and Max and hear them out on the development of the '26 car, and by 27, Hadjar is ready to take up the mantle in one of the RBR seats (if Max leaves, or if Yuki goes)."", 'He did well when he had to replace Ricciardo during 2023. Last year he did well against Yuki for the final races, which was pretty good.\n\nObviously the demotion affected him. He showed he has character he should be able to be at the same level that showed during 2023 and 2024.\n\nWill that be enough to keep his seat for 2026? We can speculate, Max will remain for 2026, probably Yuki will leave the team at the end of 2025. Hadjar has surprised a lot of people. If he continues to impress he may be a candidate for RBR second seat. That will leave place for Linblad and Lawson at RB.\n\nIf Max leaves RBR the will likely may bring a experienced driver like Albon, Sainz, Gasly, Rusell to bridge until the next Max is ready. \n\nLawson should also explore for available seats elsewhere: Cadillac, Sauber, Alpine.', 'Yes.', 'Only if Red Bull have an immediate junior prospect and are willing to pay a break fee for it.', 'Lawsover', 'Of course.']",0,172,0.43,0,665,665,0,1,0.0,0
1k0fb2d,Norris ‘unmasked’ as secret WRC tester in F1 pundit’s surprise reveal,https://www.reddit.com/r/formula1/comments/1k0fb2d/norris_unmasked_as_secret_wrc_tester_in_f1/,2025-04-16, News,,"[""Maybe if he wins the WDC he'll pull a Kimi and move over to Rally 😅"", ""Can't we just ban planetf1?"", 'Explains why he drove onto the grass in Japan', ""Peter Windsor seems incredibly knowledgeable, but also a fairly dodgy and unreliable character, a bit like Joe Saward but more of a fan than a journalist.\n\nNot sure if he's making this up or not, he seems to promote anything that throws him some money, I've no doubt that the channel he said this on (CameronCC) is paying him to come on and maybe saying juicy things like this sweetens the deal. Not sure if it's legit or not."", '""...and he\'s unbelievably good"" THATS MY GOAT RIGHT THERE\n\nedit: the fact that im getting downvoted fills me with joy. like hell yea, let him being talented as shit ruin ur day', ""Some say he doesnt want to lead after lap 1. All we know is: He's called the Stig!"", 'Or become a monaco-based youtuber like rosberg.', 'Yes please...', ""That's not fair\n\nThey do the crticially important and meaningful journalism of writing articles about what F1 figures say on other people's podcasts or YouTube channels""]",0,21,0.37,0,252,252,0,0,0.010000000000000009,0
