unique_id,post_heading,post_url,publish_time,tag,post_content,top_comments,upvotes,comments,upvote_ratio,score,total_upvotes_comments,total_score_comments,upvotes_growth_rate,comments_growth_rate,upvote_ratio_growth_rate,score_growth_rate
1kfsx69,Secret conversations between Mick and Cadillac,https://www.reddit.com/r/formula1/comments/1kfsx69/secret_conversations_between_mick_and_cadillac/,2025-05-06, News,,"['cadillac is telling him they’re not interested in him but the meeting is taking place in a dark alley', 'u/formulagymbro your time has come', 'I know people are sceptical  but he was photographed at the Cadillac event with his manager and was around the paddock too this weekend.', 'Mick is never getting back on the grid.', 'Secret conversations?  Whats that mean, are they using carrier pigeons or something?', 'Once a month Mick articles connecting to him back to F1. Leave the man alone, he’s not getting a seat no matter how hard his family try.', '.de tells me all I need to know. Total bs', ""If Cadillac signs Mick then they are just showing they aren't taking the first few years seriously and are happy to languish at the back of the grid"", ""Mick said yes to Cadillac, unfortunately Cadillac hadn't asked him anything.""]",0,46,0.46,0,425,425,0,1,0.0,0
1kgi4y1,Flavio Briatore's Crazy Plan for Alpine 2026,https://www.reddit.com/r/formula1/comments/1kgi4y1/flavio_briatores_crazy_plan_for_alpine_2026/,2025-05-06, Discussion,"With the recent announcement of Colapinto being signed for **only 6 races**, i think I know whats happening in Alpine

First off, **I think Alpine/Flavio are confident about 2026**, with merc engine and the work they've done that even led **Gasly to saying that he can be a WDC next year**, this is what mainly makes me they think they're gonna be VERY competitive next year, and a competitive year needs 2 competitive Drivers

**Flavio is using this year for a (in the worst case) 6-6-6-6 Split to test out drivers.**


It is no coincidence that **Doohan and Colapinto both only get 6 races in a 24-race-season**, obvioulsy if Colapinto is great after the 6 races I dont think he will go through with it, but in case Colapinto is also not to Flavios liking I think they want to have another 2 Splits, for **Aron and Schumacher,** they would stop when they see enough potential in someone and it could be as early as with Franco, though if push comes to shove and he uses all 4 this season, he would be able to pick the best, or go for someone completely different if theres a promising prospect from F2

What do you guys think, **is Flavio Crazy enough for this to be his Plan?**","['They wouldn’t be able to do 6-6-6-6 plus Gasly for 24, that would be 5 drivers and a team is only allowed to use 4 total in one season.', 'Can’t do a 4x 6 split, they’re allowed 4 drivers maximum in a season. Gasly, Doohan, and Colapinto will be 3.\n\nAron likely would be the 4th if it comes to it. I suspect that unless Colapinto is actually worse than Doohan, he’ll be kept until the end of the season. If he’s similar, Briatore will try and save face and sponsor money by keeping him and saying it’s adjustment.', ""You can really create some batshit theories when you don't know anything about the sport"", '""With the recent announcement of Colapinto...""\n\nWhat are you talking about?! There\'s no such thing as an announcement. HAHA', ""You're not allowed to have more than 4 drivers per season."", ""Flavio is a convicted criminal. He was linked to 3 cheating scandals with being kicked out in the third case.  \n\nThat says it all for me, I am pissed they even let him in enter the circuits.  What message does this send.    If need be, I'd rather sink Alpine than see him here, let alone running a team again."", 'Flavio did you write this?', 'The Yzerplan has made its way to F1', ""I think we're reading too much into the 6 races contract. It could also be a way for Alpine to protect themselves from backlash by saying they gave both Jack and Franco 6 races to show potential. I doubt they signed Colapinto for 5 years to burn his future in 6 races unless he underperforms horribly. But, we're talking about Alpine after all and everything is on the table - I guess.""]",0,87,0.31,0,79,79,0,39,-0.04999999999999999,0
1kg7ds4,Candidate with a Formula 1 newcomer - Will Schumacher get another chance?,https://www.reddit.com/r/formula1/comments/1kg7ds4/candidate_with_a_formula_1_newcomer_will/,2025-05-06, News,,"['Mom says it’s my turn to write a Schumacher-returns article', 'I read the title and asked myself ""Who TF is Will Schumacher?"" hahaha', 'How is he doing in other series?', "">\xa0Two drivers with Formula 1 experience will be entering the premier class.\n\n\nIs this a contradiction/translation issue or are Drugovich and O'Ward considered drivers with F1 experience simply for having done FP sessions and simulation sessions?\n\n\n> The following names are being traded: Sergio Perez, Valtteri Bottas, Guanyu Zhou, Felipe Drugovich, Patricio O'Ward.\n\n\nAll in all, I think it's a decent line-up for a first time entry team if any of these get picked.\xa0Though I'd say Zhou is probably the least inspiring name in there. At least Schumacher had the H2H on his side versus KMag.\xa0\n\n\nI'd rather they go for drivers that haven't done basically pretty much a whole career already, but I understand that as a new team they need at least one experienced driver.\n\n\nThey could do like Audi and pair one veteran with a rookie or they could put two veterans in there and decide which of them is better suited for the long run.\xa0\n\n\nAs for Mick Schumacher specifically, I wouldn't mind either way. I think he didn't really get a fair shot the first time around (HAAS truly was a mess in his rookie season on pretty much all fronts),\xa0but I also think that we're three years on from when he left and his time might have simply just past.\xa0\n\n\nI guess no matter how many seats there are in F1 someone will still miss out."", 'If they pick both Checo and Mick, you know they are here for the marketing.', ""He's doing pretty well in WEC, he should just sta there and focus on that."", 'Shumacher to Cadillac, Doohan takes his spot in WEC, \n\nUnlikely but hey, it’s something', ""People keep downvoting the Schumacher articles like it's baseless speculation, it's not, reliable sources are saying he's holding talks.\n\nImo though, if Cadillac want safe, experienced drivers then it's very obvious you should put Checo and Valtteri in the car, you get good feedback from two very experienced drivers and their skillsets mean you'll know exactly how good the car is on it's tyres and in qualifying respectively because they're both very strong in those areas. But I'm guessing they don't want two older dropped drivers, it might give off a retirement home vibe."", ""Surely this is the last possible year where Schumacher has a halfway viable shot at a seat, right?\n\nHe'll have been out of F1 for 3 full seasons going into 2026. At some point, the gap (combined with his age and his performance in F1) is not going to worth it for teams, especially since he's been passed over multiple times already. \n\nWhy pick him when Bottas or Pérez are available? I like him a lot, but I just can't see what the upside would be.""]",0,76,0.33,0,73,73,0,1,0.010000000000000009,0
1kghv7h,"Hear me out, why isn’t there a tyre championship in F1?",https://www.reddit.com/r/formula1/comments/1kghv7h/hear_me_out_why_isnt_there_a_tyre_championship_in/,2025-05-06, Technical,"We’ve got the Constructors’, we’ve got the Drivers’, but tyres? Nothing. Imagine if teams could choose their tyre supplier at the start of the season one choice, locked in. Suddenly it’s not just about aero and engines now tyre innovation becomes a real battlefield.

Teams would have to work with their chosen supplier to tailor performance, and manufacturers would be forced to push boundaries instead of just supplying a spec compound. You’d get strategic variety, real innovation, and another layer of competition.

Seems like a no-brainer, no?","[""we had this in the 2000s and it didn't end well"", 'Those who don’t study history are doomed to repeat its failures.', 'We had this, it didn’t go well.', 'Welcome back 2005 United States Grand Prix', ""doesn't work.  One tyre ends up better than the other and then all the teams on the bad tyre have disadvantage they can't overcome.\n\nIt's been don't several times in the history of the sport and it always ends up making the sport look bad."", 'https://www.quora.com/In-F1-Racing-why-is-there-only-one-tyre-manufacturer\n\nhttps://www.reddit.com/r/formula1/comments/1ypuzv/why_dont_they_let_the_teams_pick_their_own_tires/\n\nhttps://www.reddit.com/r/formula1/comments/1ypuzv/comment/cfmom19/?utm_source=share&utm_medium=mweb3x&utm_name=mweb3xcss&utm_term=1&utm_content=share_button', 'There used to be multiple tire manufacturers. \nLook up the 2005 US Grand Prix as to one of the reasons that’s a bad idea.\nBut the big driver is cost.\nIt’s very expensive to engineer F1 tires and with the cost cap around F1 it would be directly contradictory to that.\n\nPlus, if a tire manufacturer is going to spend all that money they are going to want to be the “Official tire of F1”', ""F1 used to have this. It was terrible.\n\nTyres are just so overwhelmingly important that a team being locked in to a single supplier basically renders everything else null and void. If their Michelins give more grip than your Bridgestones, it simply doesn't matter whether or not you have the best engine or the best chassis or the best aero or the best driver, the tyres will dictate the result. And as a team there is absolutely nothing you can do about it, you're just a victim of the contract you have in place.\n\nAnd competition between tyre manufacturers means a greater tendency to push the limits, resulting in more safety issues too, as tyres are once again an incredibly essential component that can be catastrophic if they fail."", 'We’ve found Bernie’s burner account - just wait a few months and they’ll be suggesting sprinklers being installed at all tracks on the F1 calendar']",0,37,0.14,0,36,36,0,13,-0.009999999999999981,0
