unique_id,post_heading,post_url,publish_time,tag,post_content,top_comments,upvotes,comments,upvote_ratio,score,total_upvotes_comments,total_score_comments,upvotes_growth_rate,comments_growth_rate,upvote_ratio_growth_rate,score_growth_rate
1k0yqbd,Explanation of Aerodynamics in F1 Cars,https://www.reddit.com/r/formula1/comments/1k0yqbd/explanation_of_aerodynamics_in_f1_cars/,2025-04-16, Discussion,"Hi - I am an aerospace engineer with almost 2 decades of experience in rocket engines, missile systems, and aircraft. I have never worked on formula 1 cars, or any car for that matter. However, I know aerodynamics and the core principles remain the same across applications.

In these first few weeks of the season, I have seen a lot of talk about the Red Bull car in particular. In a lot of these discussions (including articles from journalists...) people seem to falsely equate how hard the car is to drive with it's speed. What I hope people take away from this post is that a car that is hard to drive can still be very fast. In fact, a worse ""window"" can actually make a car faster when inside that window (speaking purely in terms of aerodynamics).

As a side note, this is not about drivers. There is no question that Max is amazing. There is also no debate that the McLaren is fast, but I do think that some people are underestimating how fast the Red Bull actually is just because it is hard to drive.

So into the explanation (trying to make it ELI5):

Let's start with airfoils - airfoils are one of the main ways to create aerodynamic structures. Airfoils are a 2D shape that look like a tear drop - if you look at an aircraft wing, it is an airfoil that is extruded to 3D. 

Camber is the degree to which the airfoil is bent. Typically, if you camber an airfoil more the lift/downforce will increase, but so will the drag. Think about holding your hand out of the window while driving - a flat hand has no camber and a cupped hand is more cambered. You can also do a lot with how ""sensitive"" an airfoil is - meaning, there are some airfoils that are ""twitchy"" when it hits a gust of air (colloquially referred to as turbulence). In something like a commercial jet, they design their airfoils to be very stable - this makes them easier to fly safely, less prone to ""turbulence"", etc. The downside is that these more stable airfoils are very slow for maneuvering by design. So in contrast, they design combat aircraft (e.g. F-15)) with much more unstable, but also much more responsive aero surfaces. Engineers put a lot of time into optimizing these aero surfaces to be both responsive and stable, but it is always a trade off on some level.

The other important concept for people to understand is stall. Ideally you want air to ""stick"" to your airfoil, so you generate maximum lift with minimal drag - however when you angle the airfoil (say turn an F1 car) you increase the amount of flow that starts to separate - which if it gets bad enough is called ""stall"" and the surface loses most of it's lift (or downforce in F1 terms). Similar to the camber, some airfoil designs can be more sensitive to stall, but typically these have the lowest drag in ideal conditions.

In an F1 car you have literally thousands of individual aerodynamics surfaces. Not all of them are airfoils, but  they all follow the same principles. Engineers need to balance drag, downforce, responsiveness, and risk of stall on each surface in a variety of speeds, turns, temperatures, winds, etc.  Not to mention how suspension, stiffness, dirty air, etc. can also impact aerodynamic performance. Unfortunately, if you increase downforce (all else being equal) you also increase drag. If you lower drag to go faster you can cause some surfaces to stall in a corner. If you are quickest in clean air, it's possible you are compromising your speed in dirty air (think the McLaren in Japan).

I think if you read this far, the issues with Red Bull's car are pretty obvious. It has a very narrow window of conditions where it has optimal aerodynamics. They clearly have gotten ""spoiled"" by having a driver like Max who can consistently keep it in the proper window for peak performance - and thus have gradually opted for a faster car rather than a car that is easy to drive. Unfortunately, even if Max drives perfectly there are things outside of his control like temperatures, track layout, wind, etc. I do think that when the Red Bull is in the window, it is probably faster than the McLaren, but that window is a lot smaller than McLaren's so you rarely if ever get to see it. 

Of course McLaren could have discovered some kind of black magic that allows them to be the fastest, most responsive, and easiest to drive all in one package. It is possible, but in my opinion based on the races so far, it is more likely that they just struck a better balance between those various factors that provides better performance across the all of the tracks. And I would wager that, that McLaren is also quite hard to drive even if it is not as bad as the Red Bull.","['r/F1technical would probably enjoy this write-up as well', 'I was thinking about a lot of this myself, but it’s nice to hear a more professional perspective on the matter. And indeed there is overlap between a hard to drive car, and a fast car. One does not exclude the other.\n\nOn your end conclusion though… I mean, we’ll see how it turns out, but I do not believe Red Bull are in this without significant (and correct, can’t be understated) upgrades, either for the actual speed of the car, or the capability of setting it up correctly. In that regard they are behind and/or too dependent on outside conditions, which is also part of the game. Can’t build a car that only works when it’s rainbows amd sunshine.\n\nGreat technical insight though, loved the read!', ""Your point about stability in clean air vs. dirty air is a really good one, and of the things that is overlooked the most in my opinion. Everyone knows that dirty air is a thing, but it's often underestimated how important it is and how the magnitude of the impact varies with the car design.\n\nIt's one of the things that irked me about all the Lando vs. Oscar comparisons last year. Was Lando really so much faster in Zandvoort and Singapore, or was it just the benefit of clean air? Was Oscar really faster in Spa and Hungary? The McLaren seems particularly sensitive in this regard. I remember in one of the last races in the year (I forget which one), Lando had great pace, until he reached the backmarkers and commented on how much harder it was in dirty air.\n\nIt makes it very difficult to get an honest gauge comparative pace sometimes. It's all part of the fun, but the engineer in me desperately wants every driver to drive every car at every track in every condition, purely so I can scratch the itch of having a proper dataset."", 'so basically people misconstrued speed and cornering', 'Can one infer from this that F1 drivers would do great flying combat aircraft?', 'I’m having a hard time following the discussion of a “stable airfoil”.  While there are angular moments resulting from lift generation this pales in comparison the resulting moments from other primary control surfaces (horizontal tail/canards, etc) in creating stable responses to disturbances. A key difference being that these are purely aerodynamic effects in airplanes but are tied more to physical structure (how the wing is connected to the body, suspension, and eventually the ground) of automobiles.  Any change in this relationship is solely due to aero elasticity.   The F-15 is also a remarkably stable aircraft it just has tons of pitch authority due to absolute units on a horizontal stab.  The wing has camber optimized for an elliptical lift profile at a wide variety of angles of attack while also being remarkably efficient at area ruling for supersonic flight.  Not bad for 1960s slide rule toting engineers!', ""[*...this bit here is what Adrian Newey sees in his mind's eye when he's on the drawing board...*](https://www.youtube.com/watch?v=ZlDnd3B1rhs&ab_channel=wickedender)"", 'Great post OP. I’m curious if you might be able to clarify something though?\n\nWhen a driver says the car has a narrow window, like Lawson said about the Red Bull, and he’s having trouble getting the car in that operating window, I feel like a driver saying this perhaps doesn’t line up exactly with what you describe as the operating window for aerodynamics.\n\nWould a driver talking about getting a car “in the optimal window” be referencing something different like tire and break temperatures, for example. Something they have some control over?\n\nI feel like what you describe isn’t something a driver can actively influence that much aside from trying to create distance to a car in front to control the amount of dirty air.', 'This is a good write up, but I\'m going to debate two comments.\n\n  \n1) The comment about Redbull being faster in the window is speculative hogwash. First, look at the qualifying results to date, and it\'s not close. Only in Japan was it comparable and Max only pulled it out by a hundredth. In that race, even in dirty air, McLaren was always right there to pounce on any errors. In addition, the huge deg indicates an inherent flaw in balance that\'s not simply offset by ""being in the window"". Furthermore, if it were just ""a window thing"", Redbull could easily parse the data and expand the window. My take would be that there is no window, and the Japan race masked their balance issues via a smooth track and extremely low temps.\n\n2) Again, it\'s speculation that it\'s ""quite hard to drive"". We definitely can\'t discredit the quality of their drivers, but McLaren is significantly ahead in both Quali and Race pace vs all other cars (given the finishing positions of BOTH drivers), so I would make the argument to the contrary (it\'s not difficult to drive). Now this is speculation on my behalf as well, but statistics would appear to be on my side.\n\nAnyway, take care and good discussion.']",121,15,0.9,121,12,12,42,5,0.020000000000000018,42
1k0kybt,Ricardo Zonta's reaction to being hit in the head by a recovery crane at the 2000 Austrian GP,https://www.reddit.com/r/formula1/comments/1k0kybt/ricardo_zontas_reaction_to_being_hit_in_the_head/,2025-04-16, Video,,"[""I don't want to overshadow his career and what he accomplished, but I will always know Zonta for being the cheese in a Schumacher-Hakkinen sandwich:\n\n[https://www.youtube.com/watch?v=hyW1aT2utc0](https://www.youtube.com/watch?v=hyW1aT2utc0)"", 'Unlucky strike', 'What a legacy this guy has, known for being sandwiched between arguably the greatest overtake battle in the sport and for being whacked in the head by a crane and giving it the finger. The likes of Nando, Lewis and Max can only dream of the legacy Zonta has.', ""Don't forget making a bet with Jacques Villeneuve in 1999 to try and take Eau Rouge flat out and both subsequently crashing after attempting it."", ""He also has the most racecar drivers name you've ever heard. \n\nDude sounds like an Italian supercar brand."", 'May I introduce you to Max Venturi, Lamborghini test driver?', 'I mean, we have Pagani Zondas...\n\nAlthough, can he compete with guys like Scott Speed or Will Power?\n\nOr basicaly whole 1996 Indy 500 grid which tbh felt like random NPC names in an unlicensed racing game', '96 Indy did feature a guy with the name ""Slick"" Racin Gardner"" which can only be matched by Sting Ray Robb \n\nBut also featured my personal favorite type of racing driver name. ""Wonderfully latin"" Elesio Salazar is just fantastic. It\'s up there with Lorenzo Bandini and Antonio Giovinazzi', '>96 Indy did feature a guy with the name ""Slick"" Racin Gardner"" which can only be matched by Sting Ray Robb\n\nApparently Sting Ray Robb is named for the Corvette Stingray. With a name like that, I think you\'re legally required to be racing driver.']",92,10,0.85,92,101,101,-1,0,0.0,-1
1k0jkhq,Pitlane Championship Round 4: Bahrain - Norris back on top.,https://www.reddit.com/r/formula1/comments/1k0jkhq/pitlane_championship_round_4_bahrain_norris_back/,2025-04-16, Statistics,"Bearman with the win after just missing out on P10 last week in Suzuka by 0.06 to Stroll,  Norris regaining the overall lead as one of two drivers to have scored every weekend so far, along with Stroll.  And Tsunoda and Alonso still looking for their first points.

Gap between fastest and slowest around 9 tenths this week, in Suzuka this was 8 tenths, 6 tenths in China and 2 seconds in Australia, in the wet.","[""We are now 4 races in and Norris is consistently quick down the lane, his teammate Piastri however is closer to the other end of the standings, so it seems their choice of pitbox as WCC winner isn't what is making the difference.\n\nAlbon and Sainz both looking strong in the Williams in P2 and P3, and a perhaps surprising number of rookies in the top 10, suggesting it's not about experience here.\n\nVerstappen still scoring a point despite the RBR pit struggles with a 21.797 in lap 26, his other lane time in lap 10 was only 0.001 was slower for a 21.798.\n\nHis slowest overall time of 28.067 (21.797 lane + 6.27s stop ) is only 1.755s faster than Norris his 29.822 ( 22.072 + 7.75s stop) who had a 5 second time penalty, which would have been even smaller if Max didn't make up 0.275 on Norris in the lane, so Red Bull will be looking to not have that happen again."", 'Yuki WDC (Im not on copium, you are!)', 'I do like looking at total pitlane time. Of course, sometimes a driver is held outside of their control, messing that up', 'Does Norris get bonus points for cutting the grass in Suzuka?\xa0', 'Is this just the full time in the pit lane to recreate the standard F1 pit stop championship graphic (that just does stationary time)??', ""He might lack some confidence coming into the box is what I'm assuming, his highest position was P13 in Autralia, out of 16 total, followed by 18th, 20th and 20th.\n\nBut here's to hoping!"", ""Yeah, the total is still interesting, but I do want to have the added information of the stop time to see if that makes the difference.\n\nFastest stop doesn't mean the fastest total time at least, which I do think is an interesting insight as the stop time is usually the only thing considered, yet here we see Bortoleto with a faster stop, still lose time to Norris, even if just slightly.\n\nHamilton actually had the fastest stop of the weekend with 2.16s, but spend 22.220 down the lane for a total of 24.350.. his earlier stop was a 2.28s but 22.060 down the lane for a 24.340, so 0.010 faster despite losing a bit of time in the stop, but still losing 3 tenths to Norris who had a slower stop."", ""It would have been outside of the official pitlane, so I don't think that would count.  \n\n\nhttps://preview.redd.it/xcqbpuioi7ve1.png?width=917&format=png&auto=webp&s=6d6a147bda596980e11bf34b89545d6bed541a66"", ""This is only the time spent in the actual lane, minus the time spent in the stop. \n\nBearman for example spent a total of 24.895 in the pitlane, but his stop was 3.57, so his pitlane time was 21.325 which was faster than anyone else.\n\nThe second image has the data sorted by total time, Bearman is down in 14th for total time because his stop was slow and added to his average, with Norris on top, despite the 2nd fastest lane time and a stop that wasn't in the top 3, but the combined was faster than what anyone else did.""]",70,13,0.86,70,42,42,8,0,0.010000000000000009,8
1k0o4g6,Esteban Ocon: Feeling At Home With Haas,https://www.reddit.com/r/formula1/comments/1k0o4g6/esteban_ocon_feeling_at_home_with_haas/,2025-04-16, Video,Esteban Ocon: Feeling At Home With Haas,"['Haas I think has a really good team atmosphere in general since Ayao took over', 'He definitely seems to have settled in well and it’s nice to see him, imo, more upbeat than at Alpine. Doesn’t hurt that Haas continues to be on the upswing.', 'It was that way even under Gunther. In one of the interviews for DTS (I don’t remember which season), Buxton said Haas had the smallest year over year turnover of any team.\xa0', ""It's always nice to get away from Alpine 😅"", ""Yeah it doesn't get much attention, but Haas has always had a lot of internal loyalty. It doesn't hurt that small underdog outfits tend to be a lot more tight-knit than bigger teams that are a bit more impersonal."", 'Yeah, I mean the footage of K Mag getting pole position in 2022 was amazing. You can see how tight knit they all are, almost like a family. It is part of why Haas is one of the teams I root for, especially if you compare it to certain other teams (\\*cough\\* Red Bull \\*cough\\*). I would also love to see their reaction to a podium.', ""That Qualy was pure cinema. Magnussen on pole, Charles ruining his and Checo's lap, the sky darkening as the session came to a close...\n\n\nPretty great television."", 'It truly was.']",61,11,0.86,61,8,8,-3,0,-0.010000000000000009,-3
1k0ongk,2025 Bahrain GP F1 Race Debrief - Mercedes-AMG F1,https://www.reddit.com/r/formula1/comments/1k0ongk/2025_bahrain_gp_f1_race_debrief_mercedesamg_f1/,2025-04-16, Video,,"[""Hi everyone! Sharing our latest Race Debrief for Bahrain, hopefully you all find it insightful. It's a long episode this week but plenty of info in there.""]",49,2,0.82,49,1,1,0,0,0.0,0
1k0kotg,"Domenicali exclusive: Catch-up mechanism ""crucial"" for 2026 F1 engine rules",https://www.reddit.com/r/formula1/comments/1k0kotg/domenicali_exclusive_catchup_mechanism_crucial/,2025-04-16, News,,"['> “Someone tried to push for an extension of the current regulations - that would have been totally wrong,” he added.\n\nI\'ll take that as ""Corporate speak"" for ""Fuck MBS"".', 'Mmm. When an engine manufacturer had an FIA confirmed deficit during this freeze, they weren’t permitted to catch up.\n\nI’ll believe it when I see it.', 'I truly hope I’m wrong, but I believe Formula 1 and the FIA have made a huge mistake by going down the 50-50 ICE-EV route—likely just to please Audi and entice them into the sport.\n\nFormula 1 has always been the fastest, most technologically advanced, and most innovative series on the planet. And while the 2026 power unit regulations are undoubtedly technical and forward-thinking, I fear they’ll ultimately hurt the heart and soul of F1.\n\nIn a few years, this solution could lead to a sort of spec series, where most of the car’s components are supplied by a single manufacturer. That’s not what Formula 1 should be.\n\nInstead, the FIA should focus on providing a clear framework—rules that define the boundaries—and let the teams innovate within them. For example, impose a minimum miles-per-gallon target and allow teams to choose how to meet it: whether through electric assistance, a V6, V8, V10, or even something no one has imagined yet.\n\nAs it stands, the current direction demands massive investment. And if one manufacturer gets it right early, the rest will have to spend even more just to catch up. I’m afraid we may be witnessing the beginning of the end of Formula 1 as we know it. The name might stay the same, but a new formula is taking shape—one that might appeal to newcomers, but not to the sport’s core followers.', '> One of the conclusions from the Bahrain meeting was that electrification and sustainable fuels would remain ""imperative""       \n> The Italian agreed with the FIA president that cutting costs is key to protect the series against economic fluctuations and avoid 2009\'s mass exodus, when Toyota, BMW and Honda all walked\n\nBut then if you are always gonna have some form of electrification, my question is: which is cheaper, making a brand new V8/V10 from scratch as well as a new hybrid system to go with it.        \nOr sticking roughly with the 2026 regs but heavily tweaking them and potentially making bits spec?      \n\nEspecially if there is to be any economic shitstorm, it is likely hitting within the next 4 years.', 'Trying to be peak mosotrsport and be economically sound and environmental friendly is impossible without sacrificing the racing aspect.', ""Next year might be totally shit, but could also be good if the engines are super unreliable and you don't know what's going to happen"", 'I don’t understand the new engine regs. I thought they froze the current engine regs because Redbull throw a fuss saying they will be out if the engine development is not frozen because Honda is quitting. \n\nWhat is preventing the manufacturers from developing the engines like how teams develop the cars throughout the season? I thought we have a separate cost cap to control cost on engine development.\n\nThe no. Of PU for a season is capped anyway. They only need to make sure customer team can access to upgrades at the same time as the works teams? \n\nWhat is the rules preventing teams from catching up?', ""Despite what we all think about MBS he's right about this. The new regulations are gonna be dreadful as it stands"", 'The next regulations already have a catchup mechanism build into it whilst the last one was along the lines of having an agreement to have good faith discussions.\n\nFrom next year, any manufacturer that is more than 3% down on power across the first five races will get additional Upgrade opportunities for the following year per the regulations.']",44,43,0.8,44,312,312,3,1,0.010000000000000009,3
1k0ef5o,What will F1's next engine look like in 2029 (or later)?,https://www.reddit.com/r/formula1/comments/1k0ef5o/what_will_f1s_next_engine_look_like_in_2029_or/,2025-04-16, News,,"[""It's about the engine\xa0\n\n\nThe engine? What is it?\xa0\n\n\nIt's a source of power that makes cars go fast, but that's not important right now"", '500cc V12 restricted to 30,000rpm and producing circa 1,200hp.\n\nSaves you a click.', 'Any discussion at this point is irrelevant. This is the most pointless timing - too late to save 2026 from imminent disaster, too late to justify the changes now and neglect all the investments made thus far.', '![gif](giphy|vf5TjQrio0TBK)', ""My best bet is a v8 with a simpler hybrid system like KERS similar to what WEC is using, running on the new fuel being developed.\n\nthough honestly i would love if the engine regs weren't closed on engine type. give the teams a max/min dimensions for weight, length etc to make it fair, then let the teams figure out the rest."", 'Exactly like the 2026 gen but with minor changes to battery system, e-fuel percentage and compression ratio.\n\nManufacturers like low cost and greenwashing, so this is what we get.', ""I'm thinking moving parts probably.\n\nProbably pistons.\n\nAnd something with combustion."", ""Something exciting.\n\n*Please.*\n\nBut really, I've given up on this."", 'Whatever gets agreed the trouble still is that we will have to sit through three years of the 2026 clusterfuck first.']",25,62,0.67,25,303,303,-2,1,-0.010000000000000009,-2
