unique_id,post_heading,post_url,publish_time,tag,post_content,top_comments,upvotes,comments,upvote_ratio,score,total_upvotes_comments,total_score_comments,upvotes_growth_rate,comments_growth_rate,upvote_ratio_growth_rate,score_growth_rate
1jpj4zy,"Yuki: ""Everyone is being really considerate and trying not to put pressure on me, which is really kind of them. But honestly, please have high expectations and put all the pressure on me. I can't guarantee that I'll live up to those expectations, but I'll do my absolute best.""",https://www.reddit.com/r/formula1/comments/1jpj4zy/yuki_everyone_is_being_really_considerate_and/,2025-04-02, Video,"With sound: https://i.imgur.com/Y7IU2Df.mp4

People on the desktop, right click on the video and click ""show all controls""","[""That's a good attitude to take on the challenge ahead. Whether the result is good or bad, he seems to be living in the moment and embracing the pressure, which is quite impressive. Go fight hard, little chef! The stage is yours\\~ have fun. Hopefully, all the rookies, including Lawson, enjoy every race. It's just the beginning of their careers, so they should cherish the moments."", ""What he said makes more sense in his native language, its kinda their thing to say others are being considerate and that they'll try their best when they speak to the crowd"", 'Hoping that Yuki finally hacked the RB treadmill of insanity. Be a relatable underdog, spend a few years in the shadows growing your fanbase, and then walk into the main team waving a white flag instead of being cocky.', 'I can’t explain it but this is aura', ""Are we all secretly hoping Yuki gets a podium this weekend not just because it's his home race but because he's been treated like shit and we love an underdog?"", 'Does anyone expect him to be within 5 tenths of Verstappen?', 'https://preview.redd.it/8s9xei9v1ese1.jpeg?width=828&format=pjpg&auto=webp&s=661cb8a04e42b32fced6fbe4417a94f91d882068', ""I have never been so nervous about a driver. Yuki has the potential and experience to do this, but my god is red Bull and their car the biggest pile of shit. Best thing from this is that nobody will blame him if he can't get out of Q1"", 'Go Yuki!!\n\n(Pray for Yuki)', 'https://preview.redd.it/lil08ur3ydse1.jpeg?width=2560&format=pjpg&auto=webp&s=436872db0df4f99f713f441417bc889bdd28934c\n\nReady bitches']",24968,615,0.97,24968,18251,18251,104,0,0.0,104
1jpk04x,Alex Albon meets with the PM of Thailand to show support for an F1 race in Bangkok & was greeted by many fans.,https://www.reddit.com/r/formula1/comments/1jpk04x/alex_albon_meets_with_the_pm_of_thailand_to_show/,2025-04-02, Social Media,"Link to article: https://www.autosport.com/f1/news/albon-meets-thai-pm-to-show-support-for-f1-race-in-bangkok/10709020/

Link to video of the fan meet: https://www.youtube.com/live/hgvcaLoOisw?si=0-aSIRnGwju9i_Gy","['This is kinda off the point of the post but i googled for curiosity because she looked so young to be pm and sounds kinda wild that the PMs dad and aunt both were prime ministers and their brother-in-law was also pm. That sounds very odd to say the least.', 'Jack Doohan on the left there too', 'Pic 3. Alex: So Paetongtarn, this is how Max can drive a car that other drivers cannot. Imagine you try to move and click on a mouse that is adjusted to the highest sensitivity.', ""Why Bangkok bruh just use Buriram it's already FIA Grade 1"", 'Does he speak Thai?', 'Alex Albon showing up to meet Thai officials without a suit? Man took one look at Zelenskyy’s Oval Office dress code and said, “Business casual is diplomacy now.”\xa0', 'Is Alex fluent in Thai?', ""It's great to see Albon is performing well this season even though it's only been 2 races. Keep rocking Williams! And Sainz, you'll get pace back, I believe in you!"", 'Manager, you can be in the picture, but leave some space so we can cut you out later...', 'We’ve had three prime ministers over the past 3 years and he’s met all three of them']",6445,132,0.99,6445,5784,5784,48,1,0.0,48
1jpxzss,[@skysportsf1] Did part of Yuki think he'd never get a Red Bull drive ?,https://www.reddit.com/r/formula1/comments/1jpxzss/skysportsf1_did_part_of_yuki_think_hed_never_get/,2025-04-02, Video,"Source with sound: https://www.instagram.com/reel/DH82bE_oIwn/

People on the desktop, right click on the video and click ""show all controls""","['Honestly, as bad as I feel for Lawson, and the way they all handled this. I’m buzzing for yuki. I hope he has a really good result this weekend at home. A podium would be incredible.', ""As unfortunate as the whole situation is, this is really Yuki's lucky break. I genuinely hope he succeeds."", 'To be fair, we all thought that', 'I see this as Yuki doing a Bottas: He knows who he is, and he knows that his opportunities may not actually demonstrate his ability at its best, but he\'s going to relax about it and enjoy the privilege of getting up in the morning and going to work as a Formula 1 driver.\n\nI mean hell, even if it all blows up in his face, you know the guy\'s gonna open up some kind of fusion restaurant when he hangs up the helmet. I don\'t know how it would read in Japan, but in the US, I\'m sure a place called ""Yuki\'s"" would do well.', 'I feel his entire personality changed once he joined RBR.', ""They bring Danny Ric back to try and get him a seat in a Bull. They keep Checo despite him struggling. They put Lawson in despite his lack of experience, Yuki beating him and mainly having average performances. No wonder Yuki did not think he would get the shot. Now it's time for him to prove he deserves to keep the seat."", ""Man, I hope he delivers. He's been treated like shit."", 'So much mature than DTS early seasons, so proud of Yuki!', 'Although I miss the completely unhinged Yuki radio messages, I am happy to see him mature as a racer and person.', 'Please Yuki, please stunt on these hoes']",6125,159,0.97,6125,146,146,231,5,0.0,231
1jpnrve,Helmut Marko claims that Adrian Newey was part of the reason Red Bull didn't promote Tsunoda last season,https://www.reddit.com/r/formula1/comments/1jpnrve/helmut_marko_claims_that_adrian_newey_was_part_of/,2025-04-02, News,,"['It was the fault of the guy who no longer works here. Classic. Used it myself.', ""I knew it was someone else's fault after all... Pfew!"", '> Die angesprochene Diskrepanz war im Vorjahr teilweise sehr irritierend, daran haben wir gearbeitet. Wo genau der Übersetzungsfehler liegt, wissen wir aber nicht.\n\nThey have a discrepancy between wind tunnel and real life, which was very irritating last year. And this year, they still dont know where its coming from. That does not sound like a good sign at all', 'Only thing i presume he meant was when Silverstone 2022 and Yukis incident with Gasly that ruined it for Max car, but i dont know what Marko coming with claiming that it was because of Newey that Yuki was denied this years seat.', 'That man has never met a bus he’s not willing to shove someone else under, as long as it means he’s not the one to take responsibility for fuckups', 'I know everyone will say he’s lying but could he just straight up lie like that? Can’t there be a seed of truth? Genuine question, I also think it’s bs but it’s weird to just straight up lie', 'Relevent part. Seems a bit excessive if this had any influence\n\n> Yuki long had the image of not delivering consistent performances and occasionally making stupid mistakes. That happened, for example, last year in Mexico, when the decision-making phase began for us. With Lawson, it was initially the complete opposite: he came in and delivered immediately, no matter how much pressure there was. In hindsight, however, it wasn’t the right decision.\n\n> Generally, a lot of it can be traced back to a single incident. In Silverstone, Tsunoda once drove into Pierre Gasly’s car, and parts from the cars on the track ended up damaging the floor of Verstappen’s car, which caused him to lose the race. Adrian Newey was absolutely furious back then. From that point on, Yuki was a red flag for him. But now Newey is gone, and Yuki has really worked on himself.', 'Wasn’t the incident he’s talking about two years ago? How would that have affected their decision in 2024? This smells like bullshit. They sound like they’re preparing for a load of  questions being thrown their way when Yuki takes to the track this weekend.', ""> Yuki had the image of not performing consistently and making silly mistakes here and there. That's what happened last year in Mexico, where the decisive phase for us began. With Lawson, it was the exact opposite at first: he came on and delivered straight away, no matter how great the pressure was. In retrospect, however, it wasn't the right decision. In general, however, a lot can be traced back to a single incident. At Silverstone, Tsunoda once drove into Pierre Gasly's car, and parts of the cars on the track damaged the underbody of Verstappen's car, which cost him the race. Adrian Newey was furious at the time. From that point on, Yuki was a red rag to him. But now Newey is gone, and Yuki has worked hard on himself.\n\nIn fairness I believe this. Slightly insane but if I'm honest Newey seems to have a light touch of madness.""]",4373,447,0.97,4373,21028,21028,28,0,0.0,28
1jq96d0,"[Erik van Haren] Tsunoda says he received a message from Sergio Perez following his promotion within Red Bull. Pierre Gasly also contacted him. ""To share some experiences he had in 2019 and what he could have done better. I thought that was very nice of him.""",https://www.reddit.com/r/formula1/comments/1jq96d0/erik_van_haren_tsunoda_says_he_received_a_message/,2025-04-03, News,,"['https://preview.redd.it/9f9sbqhbtjse1.png?width=333&format=png&auto=webp&s=e9e8d7b3a8b80ff91758a2d06b5da6078ebf22fb', 'Pierre Gasly’s message to Yuki was reportedly, “Learn from my mistakes. Run over Helmut if you get the chance.”', 'Gosh I would have loved to listen to that phone call between yuki and Pierre 😂', 'It’s nice to see some driver solidarity on the grid. Everyone’s rooting for Yuki.', 'All we need is Carlos and Alex to send their regards', 'It’s like past Avatars giving advice to Aang. I really hope Yuki does well.', ""Looks like Checo's paying back by paying it forward, he too got advice from the driver before him (Alex) when he got into that seat."", 'Checo and Pierre are good humans. I would expect nothing less from them.', ""Big bros looking after li'l bro""]",4220,170,0.98,4220,163,163,1160,38,-0.010000000000000009,1160
1jpjw75,"[@f1] Japan's home hero @haasf1team's Team Principal, Ayao Komatsu has had a remarkable journey on his way to Formula 1",https://www.reddit.com/r/formula1/comments/1jpjw75/f1_japans_home_hero_haasf1teams_team_principal/,2025-04-02, Social Media,https://www.instagram.com/p/DH71__1KiZY/,"['nice, i knew komatsu was a race engineer at lotus/renault, but i wasnt aware of the exact path he took to get into f1.\n\nalso, i think the most disappointing thing about my life is the fact that i will never be as cool as norick abe. RIP\n\nhttps://preview.redd.it/0qevsaqf1ese1.jpeg?width=700&format=pjpg&auto=webp&s=c1dacd9073e182102d9716b80a0c09f1d3b4dc4c', 'He studied at Loughborough University, which I go to now, and you bet that they in the random roundups and news they send around that there’s always a small section about Ayao, and how proud the uni are that he’s made it to his position\n\nEdit: cause people seem to like it, here is a bit they wrote back in May: https://www.lboro.ac.uk/alumni/news/2024/may/ayao-komatsu-haas-team-principal/?utm_source=newsletter&utm_medium=email&utm_campaign=student-newsletter-07-06-2024&utm_content=ayao-komatsu-haas-team-principal', 'https://preview.redd.it/hzd2gbn7ydse1.png?width=638&format=png&auto=webp&s=3fd260a38d425ba959a63a1d0e93417a20d0f520', 'His Beyond the Grid interview just after being made TP is a great insight into the man. He\'s really been a ""head down, get shit done"" kind of a guy his whole life. And he does all of that with great humility and clarity. \n\nAlso, have to appreciate his supporting role in the foksmash incident. Always makes me laugh hearing him swear at K-Mag.', 'I didnt realize he has a PhD. He should start using use the title doctor. It would be a powerplay\n\n""And in today\'s press conference we are joined by Christian Horner, Toto Wolff and Dr. Ayao Komatsu""', 'Too bad they used the wrong picture', 'a true example of competency and hard work leading to his rise to the top without the need to be loud, well connected or obnoxious.', 'why dont we refer to him as Dr Komatsu the way the media refers to Dr Helmut Marko?', 'Deciding to study THAT degree at 14?! Bro I was writing GTA cheat codes down for me to use at that age 😭', 'And to think that Horner called him a Vanilla Engineer in DTS. The disrespect!']",3663,102,0.99,3663,5314,5314,11,1,0.0,11
1jps1pq,'Concerned' engineers drove Red Bull driver swap,https://www.reddit.com/r/formula1/comments/1jps1pq/concerned_engineers_drove_red_bull_driver_swap/,2025-04-02, News,,"['According to Marko and Horner, everyone but them drove the initial early promotion and the later swap. Funny, that.', 'I think it was the same thing with Daniel at McLaren. Some engineers pointed out that he was unable to carry speed through corners their car was capable of.', 'The only way I can see this being true is if Lawsons feedback on the car was truly non existent. I can understand wanting more experience in a driver to provide better feedback to get things going in the right direction but they made such a mess out of this.', 'What next, blame it on the catering department?', 'File76 was an engineers thumb', 'So first Marko says that was Neweys fault that Yuki hasn’t been promoted and right now Horner is saying that engineers were concerned about Liam’s performance and that’s why they decided to make switch now \n\nSo I guess that neither Marko or Horner wanted to kick Liam but everyone around forced them do it and they really have not other way \n\nWhat a bullshit, honestly', ""> He also revealed a key mistake he now felt Red Bull made: expecting too much too soon from a driver who had such little experience prior to stepping up to the senior team\n\nYes. Putting a completely new driver who didn't have testing and has never driven the car, in at his home race, is definitely going to correct that decision."", 'So it took them engineers to drive the swap? Lawson’s promotion made no sense at the time given his inexperience and it’s on management for this mishap.', 'If the car is on the ragged edge and a driver doesn’t have the confidence to push it to the limit, then of course the engineers are gonna see a problem when compared with Max who is  literally struggle-fucking that car around sector to sector']",2990,256,0.98,2990,11871,11871,34,1,0.0,34
1jpxjfc,[@skysportsf1] is Liam relieved not to be in the Red Bull?,https://www.reddit.com/r/formula1/comments/1jpxjfc/skysportsf1_is_liam_relieved_not_to_be_in_the_red/,2025-04-02, Video,"Source with sound: https://www.instagram.com/reel/DH9CzY_Bs2v/

People on the desktop, right click on the video and click ""show all controls""","[""I'll just say, he's taking the situation with huge dignity."", ""Man Liam looks like he hasn't slept in 2 weeks. His eyes"", 'Liam is/was very clearly not ready for the Red Bull drive but it’s not his fault. This weekend is only his 14th race weekend yet it will be with a 4th different car over 3 different calendar years. He just needs a complete season with the same car and team where he can actually develop instead of being plugged in as Red Bull’s fireman driver.', ""Liam looks like he hasn't sleep well and has aged pretty quickly since he joined RB"", ""Would have liked to see him have a go in Japan tho, the first track of the season he is familiar with, the first normal weekend, assuming it won't rain.. that would have a been a more fair assessment of where he is at."", ""The way Liam actually talks and acts compared to the way some people say he talks and acts are different. He seems pretty grounded and is taking this all pretty maturely considering he's had his dreams built up and almost dashed in months.\n\nI hope he drives his arse off in the RB, think he's a good person for F1 and it'd be a great story if he can have a great season and great career."", 'Dude is definitely in a much better head space in the VCARB he sounded so desperate and lost on the radio for both races in the RB. He’s glad he’s out of the hot seat but can’t say that or else Red Bull won’t ever think of promoting the dude', 'what a dumb question LMFAO', 'He genuinely looked stressed in the RB which probably had a feedback loop on his entire demeanor. Hopefully the best move for everyone', ""I just hope he gets to find his joy in racing again. You're a rookie, no need to pressure yourself like this. Go out and have fun!""]",2884,303,0.97,2884,275,275,125,5,0.0,125
1jpr1wn,Red Bull’s 2nd drivers have scored the fewest points out of any team over the last 10 GPs,https://www.reddit.com/r/formula1/comments/1jpr1wn/red_bulls_2nd_drivers_have_scored_the_fewest/,2025-04-02, Statistics,,"['That is so far from ok', ""Wait, so, RBR (1 driver) vs. all other teams (2 drivers)? \n\nI mean, it's still pretty fricking bad. But looks less bad if you compare to the second/lower points getter for each team rather than to all drivers."", 'The problem with data is that you need to be able to use it. \nThis is exactly how NOT to use it.', 'The horse is already dead.', 'To make the comparison fair they should multiply the points by two, I guess, to reflect two drivers. Still only end up 8th…', 'The man is carrying a whole damn team and their no longer free lunches on his back.', 'Wtf is this chart? What are we seeing?', 'Why 10 GPs only? Very specific number that can drive the narrative. If you say last 2 GPs which is this year, they would be tied with half of the grid probably.', 'Close enough, welcome back Alonso-Massa 2012']",2368,146,0.91,2368,3946,3946,63,2,0.0,63
1jpmu4q,Lando's very graceful entrance at the Quadrant x Liberty Walk event today,https://www.reddit.com/r/formula1/comments/1jpmu4q/landos_very_graceful_entrance_at_the_quadrant_x/,2025-04-02, Video,,"[""I would've got back in the car and left for England."", ""Thank God he's not a professional walker."", 'Bottas very close to driving in Japan.', 'I mean at least he caught himself from falling', 'he was attempting to make another blood sacrifice to secure another win.', ""He's got that stoner vibe goin today, in dress and motion. Just need a little animated scooby doo added to the video peeking out of the car."", 'This is the sort of fumble that wakes me up at 2 am 5 years later lol', ""He's just like me fr"", '![gif](giphy|ccVj8XH7idWSgcxpCT)', 'Intimidating the grid with peak reaction time']",1816,101,0.96,1816,2516,2516,11,0,0.0,11
