unique_id,post_heading,post_url,publish_time,tag,post_content,top_comments,upvotes,comments,upvote_ratio,score,total_upvotes_comments,total_score_comments,upvotes_growth_rate,comments_growth_rate,upvote_ratio_growth_rate,score_growth_rate
1kgcryc,[Chris Medland] BREAKING: Ollie Oakes has resigned as Alpine team principal with immediate effect. Flavio Briatore will take over his responsibilities,https://www.reddit.com/r/formula1/comments/1kgcryc/chris_medland_breaking_ollie_oakes_has_resigned/,2025-05-06, News,,"[""Can't wait for Gasly to inexplicably crash at just the right time for Alonso to win from nowhere"", 'certified alpine moment once again', 'How is it 2025 and Flavio Briatore is a team principal again?', ""I remember when Briatore was permanently banned from the sport for fixing a race result by organising a planned crash. Man is like herpes, can't get rid of him"", 'Fuck is going on at Alpine?', 'I praise the Lord every day Carlos Sainz did not go to Alpine.', 'What? This confirms Colapinto for Imola then imo', ""The Alpine circus continues...\n\nIn all seriousness, from what I've seen of him I thought he seemed pretty good. Shame to see him leave"", 'This team is just so toxic']",7398,1073,0.97,7398,497,497,978,71,0.0,978
1kg14wg,All drivers that have raced for alpine have all DNF in their last race with the team,https://www.reddit.com/r/formula1/comments/1kg14wg/all_drivers_that_have_raced_for_alpine_have_all/,2025-05-06, Statistics,,"[""This isn't even a case of the body still being warm, the body is still hot and breathing jesus fucking christ"", ""Atleast wait till he's gone man"", 'I know one guy who avoided that trap (this stat is old btw)\n\nhttps://preview.redd.it/md6gmaeag5ze1.png?width=819&format=png&auto=webp&s=0ded5fd17cbcdf4357dafa22dd25281ac85325de', 'You couldn’t have waited like 5 days? LOL', 'Alonso at Alpine is an underrated time in his career', ""Nothing's official yet? Or am I missing something?"", 'dude chill tf', 'This is how I find out Doohan is gone!?', 'seems like just a toxic toxic team to be in.']",5141,97,0.98,5141,5847,5847,289,1,0.0,289
1kfznbp,George Russell is still the only driver this season who has a top 5 result in every competitive session,https://www.reddit.com/r/formula1/comments/1kfznbp/george_russell_is_still_the_only_driver_this/,2025-05-06, Statistics,,"['Mr Saturday becomes Mr Consistency.', 'One major update by merc and boom , he’s a serious WDC contender', 'How mad are Charles and George seeing Oscar go straight into a championship team', 'https://preview.redd.it/evvqscmtr4ze1.jpeg?width=266&format=pjpg&auto=webp&s=a2e938b2fff6162cedb6d80333b9bef225fdc8d5\n\nGeorge Russell 2019', 'Dude’s been lowkey this year. Couple of races where it’s like “wait dafuq did he get there” 😂', 'And to think I had him as my WDC prediction at the start of this season and had my post removed due to accusations of it being rage bait.', 'https://preview.redd.it/wb1iej02q4ze1.png?width=1169&format=png&auto=webp&s=896e06d5822e5ec2d977277191ca6a9ecf1bd4e5', 'I wouldn’t be surprised to see him nab the championship tbh. He’s massively consistent, he’s always there waiting when something goes wrong from the McLarens or Max. \n\nKeke run where he wins one race and takes it just through big consistent point hauls.', 'This man is in an absolute roll. Greatly done.\xa0']",4611,256,0.96,4611,7512,7512,132,4,0.0,132
1kft90b,Is Muhammad Bin Sulayem the ultimate third wheel?,https://www.reddit.com/r/formula1/comments/1kft90b/is_muhammad_bin_sulayem_the_ultimate_third_wheel/,2025-05-06, Discussion,"Seriously, what's with MBS lately? It feels like every podium ceremony, he's right there in the thick of it, acting like he's one of the boys. We get it, you're the head of the FIA, but do you really need to be all up in Lewis's grill or photobombing Oscar's celebration with his team?

It's like he's trying to be everyone's bestie. We're here to see the drivers and the teams celebrate their hard-fought victories, not watch the president of the FIA try to get some face time.

Anyone else getting this? Is it just me, or is he inserting himself a bit too much into these moments?","['My F1 buddies sent me this. It couldn’t be more accurate here. Forgive me if it was already posted. 😂\n\nhttps://preview.redd.it/p8aty9ov83ze1.jpeg?width=1125&format=pjpg&auto=webp&s=ce5cc0b6df0296927bc085ca1fa8d6d3e871edd1', 'It’s not just you. He’s a weirdo. It certainly seems like he’s desperate for people to like him. He invented an entire medal for himself to give out. \n\nThe only up side of him always being in the way is that he can hear the boos.', 'Also like does he understand he is FIA president, and FIA governs other things as well and not just F1. Clout chasing mf', '[Your post is perfect in order for me to remind everyone that MBS crashed a Renault F1 in Dubaï in the stupidest way possible.](https://www.youtube.com/watch?v=PUAnq4LnkbY)', 'There’s a bit in Drive to Survive where MBS calls Toto Wolff at the  Merc factory while the cameras are rolling.\n\n“Ja! Mohammed, I’m just getting into the car. Can’t talk now. Bye!”\n\nTotal lie of course. I bet he gets that a lot. The rumour is the team bosses are sick and tired of him.', ""Wasn't he always like this ? I don't think it's the first time he pushes himself into people's faces.\n\nTo me it seems as narcissistic, that's the vibe i'm getting from him."", 'And the drivers, team principals all ignore him. MBS just can’t take a hint.', ""He's that dude that everyone has to be nice to, to their face.  But nobody actually likes and they all talk about behind his back."", ""I've said it before but I'm expecting a yellow flag cause he's running on track to be on TV""]",3894,316,0.97,3894,16581,16581,101,2,0.0,101
1kg9f3g,From 1 win in 11 years to 11 wins in 1 year,https://www.reddit.com/r/formula1/comments/1kg9f3g/from_1_win_in_11_years_to_11_wins_in_1_year/,2025-05-06, Statistics,"From @canalplusf1, since Miami 2024 McLaren as won 11 times, but only once before that in 11 years","['Criminal to leave Alonso out of this driver lineup picture', 'Fun fact people don’t expect: In Jensons whole time at McLaren he only ever got 1 pole position \n\nEven though he was 2nd in the championship in 2011', 'They did the man who gave McLaren that one victory dirty with that picture.', 'They really put Perez there but not Alonso', ""And let's not forget who got them that 1 win \U0001f979\n\nAlso I'll never get over how Kmag got 2nd on his debut and then just proceeded to never get a podium ever again"", ""Shouldn't Lando be in both pictures? He participated in more races in those 11 years than any of the other guys included in the top picture"", 'This sort of post annoys me because it completely misses the point that F1 is a team sport.  The drivers are the most visible and have the responsibility to get it over the line, but  everyone involved in designing, building, running the car and team is collectively more important to be in a place to fight for wins.', ""I know Lando is in the bottom photo, but it's a bit disingenuous to not have him in the top one since he was apart of that 1 squad too."", ""The pic of Danny lol makes it seem like he wasn't the only driver to get them a win in 11 years lol""]",3931,87,0.98,3931,84,84,420,5,0.010000000000000009,420
1kg27rn,"""If he passes now that's illegal"": Unheard radio from Verstappen vs the McLarens",https://www.reddit.com/r/formula1/comments/1kg27rn/if_he_passes_now_thats_illegal_unheard_radio_from/,2025-05-06, News,,"['“Plan is to edge Antonelli”', '> **Joseph:** Lando, every move Oscar made, Max just covered the inside line and pushed him wide. Max complaining about his brakes. **Try and force him to fuck up his braking.**\n\nThe only radio that I found interesting in the article.', 'I find it interesting and funny how the one they used for the title was really just nothing.', 'If the McLarens are gonna finish races 30 seconds ahead, they may as well just overtake off track and take the 10 second penalty...', 'https://preview.redd.it/lxzf42ong5ze1.jpeg?width=828&format=pjpg&auto=webp&s=9702a0b45097748bbbb985c12e258e9c33ceff4b', 'When giving a place back, you cannot overtake on the same corner, or group of corners if they are one after the other. You can prepare for an overtake later on though.', ""All the fighting was fair by the current ruleset. That's just how it is. \n\nEnd of the day Max did amazing to hold them up for as long as he did. The pace difference was insane due to the difference in tyre deg.\n\nAt least Max makes it interesting even in a car that can't compete for the win."", 'Love all the blank space for the McLaren radio because they weren’t saying anything while GP was giving Max horse race commentary.', 'Kinda sad no race side by side anymore, should not make the rule so boring']",3439,488,0.96,3439,14597,14597,158,11,0.0,158
1kfzox0,Lewis Hamilton on feisty radio comments: ‘I won’t apologize for being a fighter’,https://www.reddit.com/r/formula1/comments/1kfzox0/lewis_hamilton_on_feisty_radio_comments_i_wont/,2025-05-06, News,,"[""It's the most feisty I think I've ever heard him on the radio"", 'The quote from Vasseur is really the issue. He is basically saying ""it tooks us a bit over a lap to make the decision""\n\nWhich is exactly the issue, why had the decision not been taken by the time Hamilton was within DRS?! He had been pushing for laps. Plenty of time to see it coming.\n\nThey are always reactive, and don\'t seem to think this is wrong.', 'Do people expect him to apologize?\n\nSurely someone needs to tell those clowns that this is Formula 1, not Sunday league U14 participation trophy racing.', ""It's great for us fans to be able to hear the communication between drivers and their teams, but I feel sorry for them as well. Everything they say in the heat of the moment is broadcast and put under scrutiny by the press (and the FIA now). It's not something they should be thinking about during a race."", ""There's nothing to apologize for. He was 100% right. Both drivers were left frustrated by Ferrari's terrible decision making, as usual, and to add insult to injury the performance was terrible as well."", 'As far as being harsh, he was sooooper soft. He was completely on point and the Ferrari wall needs to get their shit together and do stuff better and faster. If not, get out of the way and put competent people. That’s Vasseur’s job to push for better decisions.', ""Don't apologize for that, Ferrari definitely needs a driver who calls their bullshit (especially when their engineers have zero reactivity)\n\n\nThe post race briefing at Ferrari this last race was probably very spicy lol"", 'It was pretty light compared to some comments others make. It was also very entertaining']",2861,279,0.97,2861,5411,5411,182,8,0.0,182
1kgcst2,"Oliver Oakes has resigned as Alpine TP, his duties will now be handled by Flavio Briatore",https://www.reddit.com/r/formula1/comments/1kgcst2/oliver_oakes_has_resigned_as_alpine_tp_his_duties/,2025-05-06, News,,"['![gif](giphy|wmfcU5GfePQAg)', 'The bus Alpine are throwing everyone under is probably faster than their car...', ""I don't want to be rude but... was Oakes really the Team Principal this whole time? Did he really have full control over everything?\n\nAnd don't get me started on media appearances where half the world doesn't even know his face but everybody knows Briatore's.\n\nStill, whoa."", 'This whole brand is a joke lol', 'I think Oakes was the one who wanted Doohan to stay longer, no? I bet that this was another thing that made him quit, not just the performance.', 'The gigantic bullet Piastri dodged, wow...', 'I work for a person very much like Flavio Briatore. They are cruel, vindictive, like to sow angst in the people around them because it makes them feel like they’re in control, they behave like the law is a vague set of guidelines, and that common decency is for the people beneath them. He had no right to be back in this sport, not after what he did.', 'Alpine winning Singapore this year ?', 'Oakes always felt like a placeholder TP while they reintroduced Flavio back into the paddock.']",2316,468,0.99,2316,441,441,223,22,0.0,223
1kg6alr,FIA clears McLaren brake design after intensive investigation,https://www.reddit.com/r/formula1/comments/1kg6alr/fia_clears_mclaren_brake_design_after_intensive/,2025-05-06, News,,"[""I'm guessing that figuring out what that innovation is will be crucial for 2026 as well"", 'How long till the design leaks? Asking 44 a friend', ""> Sources have suggested that after McLaren secured a 1-2 in the Miami GP, a more thorough inspection of the braking system, ducts and drums was conducted by FIA personnel on Sunday night in a bid to finally put the matter to bed. \n\nJust seems like a genius solution that the other teams haven't got any idea how to replicate - I don't think there was any serious suggestion that it was illegal tbh. \n\nOne of my favourite parts about F1 is the technical expertise and innovation - you'd just get rid of that if every single that conferred a significant advantage on a car was made illegal. So it might not be the best for great racing between teams, but it's part and parcel of having engineering brilliance pushing the limits of what's possible imo"", ""So this solution helps them at tracks where overheating is an issue, like Miami.\n\n\nDoes this solution also help on high deg tracks or is there no obvious advantage in that regard?\xa0\n\n\nAlso would there be any downsides, like during qualifying or is this something that's a neutral thing at worst and helpful in all other cases?"", 'To think McLaren went from having the worst brakes a couple years ago to it being investigated to be too good. Maybe this innovation was the solution to their problems.', 'Will the remaining 18 drivers draw straws now to decide who will impale a front and rear brake each on his nose to deliver to the mechanics?', ""Of course the brake design is fine, it's the tyre water.\n\nhttps://preview.redd.it/1dtfuwjbg6ze1.jpeg?width=903&format=pjpg&auto=webp&s=d6695728eb4827631606d85e443d6d04eaaa9f34"", 'Would this brake advantage/tire temp management advantage also be expected to help McLaren in qualifying?', ""Do we know more details about what these tophat drum items are?  Copper linings?  Stainless?  Something more exotic?  Tuneable by width / thickness / material?  Has anyone seen the devices with the tophats removed or anything?  Now that other teams are going to need to learn and copy..  curiosity piqued.  Reminds me of mclaren's beryllium pistons for some reason.""]",2138,245,0.98,2138,238,238,197,8,0.0,197
1kg26wl,Miami GP Power Rankings,https://www.reddit.com/r/formula1/comments/1kg26wl/miami_gp_power_rankings/,2025-05-06, News,,"['PROUD CITIZEN OF ALBONIA! RISE FELLOW ALBONERS', 'Alex Albon you god among men.\n\nhttps://preview.redd.it/t821j75qe5ze1.jpeg?width=1007&format=pjpg&auto=webp&s=27b0965a373335edce315ff8ed6b361d9cc44cec', 'Can someone explain what ""Power Rankings"" mean?', ""Probably one of the better power rankings I've seen in a long time"", 'Sainz on 5 is pretty wild', 'I was thinking it was going to be a drama post race after Albon passed Sainz against team orders but looking at the radio transcripts seems more like there was a difference in communication between the two drivers and their engineers. Regardless Albon took that place and showed that either way he should’ve been ahead. Incredible drive from him.\n\nThe battle between Verstappen and Piastri was epic though. First 20 laps of this race were tremendous.', 'After that divebomb and after being caught sleeping at the last re-start, Sainz should not even be in the top 10', ""Everytime i see albon doing well it makes me smile. All that hate he got at RB back in the day, people sying he wasn't good enough to be in F1,  yeah well eat on this lol.  Hes killing it, actually doing great against Sainz, if anything its made him better."", 'Does the sprint not count? Because if it does Stroll should be in top ten surely.\n\nAlso Sainz is too high.']",2099,240,0.95,2099,4957,4957,95,6,0.0,95
1kggqqp,"[Canal+] Colapinto set to replace Doohan, he is to be given a contract for the next 6 races.",https://www.reddit.com/r/formula1/comments/1kggqqp/canal_colapinto_set_to_replace_doohan_he_is_to_be/,2025-05-06, News,Source : [https://www.instagram.com/p/DJU5UIatG1B/](https://www.instagram.com/p/DJU5UIatG1B/),"['Lewis: ""I\'ve joined the most chaotically run team in F1""\n\n\nPierre: ""Wanna swap?""', 'ANOTHER 6 race contract? \n\nLooks like Flavio will be driving the thing by Baku', ""6 races? who's next lol"", 'I know it is coming, but Franco also getting 6 race contract himself is wild.\n\n\nDoohan really died for this.', ""OK I laughed out loud, if this is true that's the funniest option possible. They have what, four reserves? Go through the whole roster over a season, I dare you!\n\n\n[#mood](https://substackcdn.com/image/fetch/f_auto,q_auto:good,fl_progressive:steep/https%3A%2F%2Fbucketeer-e05bbc84-baa3-437e-9518-adb32be77984.s3.amazonaws.com%2Fpublic%2Fimages%2F611a840d-ac3e-43da-aa76-53a13c6e077b_704x448.gif)"", 'Alpine’s genuinely the funniest team in the world. Never a dull moment supporting them to be honest.\n\nAll you other fans are saying wow it’s so crazy that team orders are given blah blah. I’m here finding out that Pierre might be HR Lead, team principal, and beating a third rookie in 12 months after Silverstone.', '6 races per reserve driver to figure out who to keep for next year!', 'Aron next six?', ""I can't get my head around Flavio being Jack's manager in this situation.""]",2178,434,0.97,2178,406,406,894,113,-0.010000000000000009,894
1kftzwp,"Jenson on Lando's Miami Lap 1: ""That gap was so big that Max left, that how do you not go for it? You don’t sit back and just say oh it’s ok.. because Antonelli would’ve gone for it on Lando and it could’ve been a shunt. if you try to sit still behind someone, all hell breaks loose behind""",https://www.reddit.com/r/formula1/comments/1kftzwp/jenson_on_landos_miami_lap_1_that_gap_was_so_big/,2025-05-06, Video,,"['Less buttons, more? \n\nAlways more Button!', ""Yeah I think what happened has been really misrepresented. Lando didn't go for ab ambitious overtake, Max made a mistake and locked up he naturally found himself alongside until Maxs slide in T2. The view from Antonellis car really shows how weird it is to blame Lando for making the move."", 'https://preview.redd.it/ys67szqfr2ze1.jpeg?width=1196&format=pjpg&auto=webp&s=5dea43d92dd2507529b077087f82835273f83e04', 'I hate how drivers now have to justify themselves for.. driving', 'What is wrong with people, they complain about boring races and when driver actual duel they complain about it.\n\nHow would max know if it will rain, or lando ends up bottling it. Fast car bro don’t race me.\n\nLike the goat Seb “the finger” Vettel said: “I have 2 balls but none of them are crystal”', ""same thing could be said for any one asking why Max defended so hard against both McLarens...hedidn't know what was going to happen 20 laps in the future"", 'I wonder what it would be like here, if the McLarens were switched. Would people be over reacting to this then?', 'It’s easy to judge because he lost a few positions. No racing driver would see that gap and think it wasn’t there. I don’t think max even meant to close the door like that. From his onboard he was still loose from turn 1 and was correcting his line when Lando came alongside', 'Every single driver on the grid would have went for that gap.\n\nOnly Lando would get all this abuse for it.', 'also this is genuinely one of the few times where the ""If Gap, Car"" line from Senna actually applies and isn\'t an excuse for dangerous driving.']",1813,210,0.96,1813,5431,5431,38,1,0.0,38
1kghds4,"Red Bull filming at my local petrol station, it was supposedly Lindblad.",https://www.reddit.com/r/formula1/comments/1kghds4/red_bull_filming_at_my_local_petrol_station_it/,2025-05-06, News,,"['I am rooting for his arrival in F1 ever since I heard his ducks radio [f2 instagram](https://www.instagram.com/formula2/reel/DHjhvmWKfJE/)', ""He's ready, put him in VCARB /jk"", 'Tesco on the front wing lmao', 'Max is going in the Alpine in 6 races then.', 'Given the crew’s performance so far this season they probably put diesel in it.', 'I love how it’s always the v8 ones doing promos. Kind of false advertisement for F1', 'Now someone photoshop baby max standing in the background\n\nEdit: and make sure to post on r/forumuladank \n\n\n👁️👄👁️', ""Bah God Jerry, that's Lindblad's music . He's cashing money in the bank for the 2nd RB seat at Backlash."", 'Maybe for one of those “Race Across [insert country]” videos that Red Bull put out on YouTube.']",952,16,0.98,952,14,14,557,5,0.0,557
1kfzsqu,DHL Fastest Pit Stop Award - Miami 2025,https://www.reddit.com/r/formula1/comments/1kfzsqu/dhl_fastest_pit_stop_award_miami_2025/,2025-05-06, Statistics,Sauber went from pit stop circus in 2024 to achieving the fastest pit stop in Miami 2025 after Jonathan Wheatley joined them from Red Bull. Meanwhile Red Bull's pitstops have been riddled with problems this year. Coincidence?,"['Updated Fastest Pit Stop Standings\n\nhttps://preview.redd.it/svm5dfd6n4ze1.png?width=960&format=png&auto=webp&s=98eeeb2748f83547bffb27257e7135154c3c97b4', ""Is this the first time Ferrari aren't first this season?"", 'Wow, even Red Bull had fast pit stops!\n\n2023 was only 2 years ago', 'remember when red bull had consistently fast pit stops? yeah.', 'Jonathan Wheatley is cooking', ""They could've used a different color for Alpine, I was wondering why Gasly is in the Williams."", 'McLarens double stack was crazy good', '![gif](giphy|51UdTLvbyReqNK3Bic)', 'Ferrari dropped the ball so hard even the pit crew got demoralised']",817,44,0.98,817,1148,1148,39,1,0.0,39
1kg0mld,F1 journal - Miami :),https://www.reddit.com/r/formula1/comments/1kg0mld/f1_journal_miami/,2025-05-06, Statistics,,"['Your Ferrari race note is poetry.', 'There is something into the human ""imperfections"" that make this perfect and amazing!\n\nWonderful Job OP!', '""Ferrari mess, team orders, and Hamilton annoyed""\n\n\nYeah I hear ya', 'Look forward to these every race weekend, awesome work!', 'I always enjoy those journal posts', 'Oh, Leichturm 1917, very nice! I own these notebooks myself. Good choice. Also: very nicely made race notes.', 'Great work!  I love the attention to detail.', 'The Norris note is interesting lol', 'Amazing']",784,22,0.92,784,171,171,38,2,0.0,38
1kfz024,Doohan's and Gasly's race results so far this season,https://www.reddit.com/r/formula1/comments/1kfz024/doohans_and_gaslys_race_results_so_far_this_season/,2025-05-06, Statistics,@romanianf1 on IG,"['Sprint results:\nChina: Gasly P12, Doohan P20\nMiami: Gasly P8, Doohan P16', ""Being teammate with Pierre in a midfield car has to be one of the toughest challenge in f1 rn \n\nHe's underrated despite being excellent, and results can easily get skewed by race events, so unless you're matching him straight away people will see you as slow.\n\nAt least people have gotten used to Max dominating his teammates they can blame the car lol"", 'Gasly is proven', 'Aus - Gasly got a Q3 and was on for points and battling with Ferraris until his team fucked up the tyre strat. Doohan binned it lap 1. \n\nChina - Gasly had an insane tyre strat that had him lose over double the weight from his tyres that he should have leading to DSQ. Even with this, he was faster in race pace than Doohan. \n\nJapan - Car was shit. Gasly was half a second faster than Doohan in race pace. The infamous ‘let’s leave the DRS open into turn 1’.\n\nBahrain - Gasly qualified P5, started P4, was battling with Verstappen until the last lap. Doohan slipped back and back and back.\n\nSaudi - Gasly Q3, Doohan Q1. Tsunoda took Gasly out lap 1, race pace graphics had Alpine pegged as the slowest because of Doohan’s poor pace.\n\nMiami - In the sprint Gasly got a point. Doohan managed to not be last thanks to Verstappen’s penalty. In the race Doohan got Lawsoned.\n\n\nI like Doohan, but he’s just not that good.', 'Need a bit more than 6 races in f1 to prove yourself', 'Pierre Gasly is French.', ""Excluding DNF, Gasly's lowest finish is Doohan's highest"", 'lol. Alpine is trash', ""don't need to say so far...""]",671,192,0.96,671,2830,2830,43,11,0.0,43
