unique_id,post_heading,post_url,publish_time,tag,post_content,top_comments,upvotes,comments,upvote_ratio,score,total_upvotes_comments,total_score_comments,upvotes_growth_rate,comments_growth_rate,upvote_ratio_growth_rate,score_growth_rate
1jpp49k,Liam Lawson reveals 'shock' at Red Bull demotion as Christian Horner explains decision ahead of Japanese GP,https://www.reddit.com/r/formula1/comments/1jpp49k/liam_lawson_reveals_shock_at_red_bull_demotion_as/,2025-04-02, News,,"['Liam:\n\n>""The discussions we were having as well, I think, weren\'t really leaning in this direction, so it was definitely not something that I sort of expected.""\n\n>""And I felt like with more time, especially going to places that I\'d been before… it was a tough start. We had a rocky testing. We had a rocky first weekend in Melbourne with practice. And then obviously China was a Sprint.\n\n>""I think going to places that I\'d been before with the way the car was quite tricky, I think that would have helped and I would have loved that opportunity. But obviously, it\'s not my decision, so I\'m here to make the most of this one.""\n\nHorner:\n\n >""Of course, it\'s horrible because you\'re taking away someone\'s dreams and aspirations, but sometimes you\'ve got to be cruel to be kind, and I think that in this instance, this is not the end for Liam.\n\n>""I was very clear with him, is that it\'s a sample of two races. I think that we\'ve asked too much of you too soon.""\n\n>""We have to accept, I think we were asking too much of him too soon. And so this is for him to, again, nurture that talent that we know that he has, back in the Racing Bulls seat, whilst giving Yuki the opportunity and looking to make use of the experience that he has.""\n\nRed Bull\'s car has appeared extremely difficult to drive in the opening stages of the season, with Verstappen having scrapped his way to second in Australia and fourth in China.\n\nHorner says that an acceptance within the team that they need to quickly develop the RB21 was a major consideration in promoting the more experienced Tsunoda, who has completed four seasons in F1.\n\n>""We\'ve got work to do with the car,"" Horner said. ""We need to improve the car. We need to draw on the experience that Yuki has.\n\n>""And in the meantime, you (Lawson) need to go and rebuild yourself in the Racing Bulls, in an environment that you know and is perhaps slightly less pressured than Red Bull Racing.""\n\nPressed on what convinced him to make the decision, Horner said that both himself and engineers were ""concerned"" over the degree to which Lawson was mentally struggling with the situation.\n\n>He said: ""I think with everything that we saw in Australia and China, you could see that it was really affecting Liam quite badly.\n\n>""We could have left it, and I think that Liam is a driver with talent. Maybe within half a season he would have got there, but we just don\'t have that amount of time.\n\n>""It was something that was very clear to the engineering side within the team, just how much Liam was struggling with it all, and you could see that weight upon his shoulders.\n\n> ""The engineers were coming to me very concerned about it, and at the end of the day, I think it was the logical thing to do.""\n\nLawson:\n\nLawson is adamant that there is nothing about his driving style that made the RB21 particularly challenging for him, but that he simply needed more time to adjust.\n\n>""For me, it\'s really neither,"" Lawson said. ""The car is hard to drive. But we were going through a process of making that adjustment.\n\n>""For me, it\'s honestly time. But the way that the weekend went, in Formula 1, in a pre-season test, you\'re driving all day and you have loads of time to adjust and things like that. So honestly, a lack of time in the car is really the biggest thing for me that made it hard to adjust.\n\n>""Each session we were going out, we were sort of adjusting or getting used to something that was a little bit unknown. It\'s not so much a driving style or something like that. It\'s just literally adjusting. And for me, I just didn\'t have the time to do that.""\n\n>“I’m really looking forward to be racing in Japan this weekend,” he said. “Suzuka is one of my favourite tracks on the calendar.\n\n>“It’s cool to drive and very high speed, which makes it great fun in a Formula 1 car.\n\n>“This weekend is a big opportunity for me as I rejoin Visa Cash App Racing Bulls and I’m very excited to work with this team again.\n\n>“As always, I’ll be giving it everything I have.“\n\nHorner:\n\nThere had been speculation that Verstappen was unimpressed by the saga as a result of an Instagram post that contained criticism of Red Bull being liked by his official account.\n\nThere are already murmurings over the Dutchman\'s future with the team amid long-standing interest from Mercedes and Aston Martin, but Horner played down the decision\'s impact on Verstappen.\n\n>""I think he was surprised at the speed. But he could also see how much Liam was struggling,"" Horner said.\n\n>""He knows where we need to improve on the car. He\'s been working really hard with the engineering team.\n\n>""We had a very good session with him last week where he\'s just very focused on improving the car, finding those final few tenths to get us really on terms with the McLarens ahead.""\n\nVerstappen will have the opportunity to share his thoughts on the situation when he fulfils his media obligations on Thursday ahead of the Japanese Grand Prix.', ""Liam looks like he's aged 3 years in the past 4 months."", 'Had Liam gone into Suzuka and failed to deliver, it would have been dismal and could have further damaged his confidence and abilities. The swap has been harsh, but it might be a blessing in disguise, as Liam will now have more time and a lot less pressure to perform and regain his confidence. Time will tell.', '1) If Yuki does well it makes rbr look like fools for choosing Liam in the first place.\n\n2) If Yuki does badly it makes rbr look like fools for thinking it is a problem with its drivers and not its cars.\n\nIf Liam does well it reinforces point 2, if he does badly then it reinforces 1.\n\nIn any case rbr looks dumb', 'Do you guys think if the Japanese GP was say 5th round of the season, Lawson would have got 4 races in the RedBull?\n\nThat is, since they took the decision to replace Lawson with Tsunoda anyways, they did it at the 3rd race because it is the home race of Tsunoda?', 'Almost as if promoting a rookie into a car with known issues for a team that\'s known to be extremely toxic with its non-Verstappen drivers was a mistake.\n\nThey should have given Yuki the spot from the get-go, and Horner\'s talk about needing ""experienced drivers"" makes me question why Liam was given the nod in the first place.', ""Horner just seems like a horrible people manager \n\nI can't think of anything he's done to win a driver over besides his #1 man"", 'It should have always been Yuki and this  corrected the timeline.', ""I would have hoped that they had a better talk with Lawson and that he himself also figured that moving back was the better approach because he didn't see himself figuring the car out.\n\nSadly that's not the case and it's just RBR making that call for him.\n\nMaybe it is the right call, but missing sessions in Australia, super tricky conditions in the wet, and then a sprint weekend in China as your only experience is very rough, especially when they are both unknown tracks to him.""]",1631,174,0.96,1631,4379,4379,18,1,0.0,18
1jpu0hs,[FIA via Instagram] The best results by Japanese drivers in Formula 1,https://www.reddit.com/r/formula1/comments/1jpu0hs/fia_via_instagram_the_best_results_by_japanese/,2025-04-02, Social Media,,"['I still remember how excited the crowd was for that Kobayashi podium.', 'Both he and Max have beaten their last 4 teammates. Now only one will continue their streak.', 'That Yuki 4th was the biggest moment from Abu Dhabi ‘21', ""it would be nice to net a podium even if it is too high of an expectation at present. If Yuki gets the car into the points at the race, I'd say that's a win for him."", ""They're gonna have to update this with Yuki P1 come Monday."", 'Nothing beats a result of getting hit by a medical car', 'I still remember Kobayashi in 2012, that was pretty amazing and emotional', 'I don’t think I even remembered Yuki got 4th in ‘21. Kind of strange, it seems that good a result got overshadowed by something', ""You know, I've never seen another Japanese person with the names Kamui or Aguri. I wonder if the kinds of parents who are open-minded about their kids becoming race car drivers also have a more unusual naming sense than your average Japanese parent.""]",1601,118,0.99,1601,3007,3007,42,4,0.0,42
1jq7lfg,Liam Lawson receives a heartfelt welcome back by VCARB team,https://www.reddit.com/r/formula1/comments/1jq7lfg/liam_lawson_receives_a_heartfelt_welcome_back_by/,2025-04-03, Video,,"['The few times in life when getting demoted is a promotion.', 'This is pretty wholesome content right here. More positivity isnt a bad thing!', 'I hope he does well in the VCARB. It seems more manageable than the Red Bull, so hopefully he can score some points and get some of his confidence back.', 'He instantly de-aged a few years lol.', 'Toro Rosso does look to be an infinitely better place mentally for a driver than whatever the hell is going on at Red Bull. I hope he does well in a familiar seat and recovers his confidence.', 'Hope both Liam and Yuki do well at Suzuka.', 'I could see him doing really well and then going elsewhere like Gasly or Albon\n\nOr who knows maybe he’ll be back at RBR in three races', 'positive post about liam : less comment and upvote\n\npost trashing liam : 99k upvote hundred comments\n\npeak of motorsport...', 'He looks so relieved', 'I hope he inherits better pit strategy than what was given to Yuki']",1312,89,0.98,1312,82,82,137,7,0.0,137
1jppw1k,[Sky Sports F1] Christian Horner admits Red Bull asked 'too much' of Liam Lawson,https://www.reddit.com/r/formula1/comments/1jppw1k/sky_sports_f1_christian_horner_admits_red_bull/,2025-04-02, Video,,"['""You\'re not at fault. It was my fault for expecting too much from you.""', 'Horner should count his blessings, the moment Max leaves Red Bull will drop to the bottom half of the constructors championship.', 'what they asked for ""can you go to Q2 pls""', 'Horner and Marko making the worst decisions possible:\n\nhttps://preview.redd.it/8w36w1yxnfse1.jpeg?width=736&format=pjpg&auto=webp&s=e26f7c2f39a78005eedcf16eb40f99d8f7032bb2', 'Same expectations for Yuki?', 'https://preview.redd.it/52nyt3x51gse1.jpeg?width=686&format=pjpg&auto=webp&s=81c5e728f271eec8199a635739ae411226411143', 'Bro sneak dissing', 'His promotion made no sense to begin with. He hadn’t raced a full F1 season, and you had another driver who has raced MULTIPLE and has shown bigger flashes of talent. They’ve realized their mistake too late at Lawson’s cost.', 'This whole situation says more about Horner and Markos management skills than Liams talent as a driver.\n\nIt is disgusting and i hope that it falls back on them somehow', 'Begging Max on my knees to leave tbh']",1123,90,0.96,1123,2679,2679,15,0,0.0,15
1jpvyqs,"[@stakef1team] Welcoming our new Team Principal, Jonathan Wheatley, to Hinwil",https://www.reddit.com/r/formula1/comments/1jpvyqs/stakef1team_welcoming_our_new_team_principal/,2025-04-02, Social Media,,"['I think he arrived in an Audi Quattro, as mentioned by other commenters as well.', 'arriving in an Audi Quattro, man with a great taste', 'Pic 6: so many happy employees…', '""where is everyone?  Japan was this week?!""', '“It’s called motor racing” Wheatley in his speech to the team, probably', ""That looks more like a grimace than a smile\n\nBe interesting if he has to go against Horner over something, given how they worked at Red Bull for so long\n\nOf course he'll put Stake's issues first though, just to be clear"", 'what podcast was he listening to as he pulled in to the parking lot??', ""Let's go motorracing"", 'Hoping the smile lasts', 'Binotto Jump Scare']",974,45,0.99,974,935,935,27,0,0.0,27
1jq08xx,Lenovo Japanese GP weather forecast,https://www.reddit.com/r/formula1/comments/1jq08xx/lenovo_japanese_gp_weather_forecast/,2025-04-02, News,"Easing rains, wet track. Appears volume of rain in the forecast has decreased over the past couple of days. ","['https://preview.redd.it/ziiyaa7nohse1.png?width=231&format=png&auto=webp&s=2b7991cf970d483a4a3b27947188afe22391421b', 'Quali may be pretty wet, but 2.7mm of rain isn’t really a lot on Sunday.', ""I'm braced for more disappointment. If Australia was anything to go by, this may be another bad weekend for Ferrari..."", ""The FIA forecast for Sunday from this morning was this:\n\n>Cloudy with a cold front expected to cross the area in the second part of the night (2-10mm overall). Showers likely in the morning, then improvement expected in the afternoon. Slight chance of showers for the race.  \n**Chance of rain:**\xa0\\[for the day\\] 80%\n\n[also](https://x.com/Rodolfoar07/status/1907419070082814070)\n\n>Sunday currently has low confidence in the forecast due to divergence in the timing of the frontal system's advance between models."", 'Too late on Sat and too early on Sunday for it to be a factor\xa0', 'Wet start but dry by the end maybe?', ""Well... Rain and Japan doesn't bring back good memories."", 'Map so zoomed in i thought i was looking at north Iran.', 'Ferrari are going to be an absolute nightmare in this cold weather']",929,120,0.98,929,110,110,59,4,0.0,59
1jq9vpv,[Sky Sports F1] 'I can feel the instability of Red Bull car' Yuki Tsunoda acknowledges Red Bull swap could initially prove difficult after simulator testing,https://www.reddit.com/r/formula1/comments/1jq9vpv/sky_sports_f1_i_can_feel_the_instability_of_red/,2025-04-03, Video,,"['![gif](giphy|RX3vhj311HKLe)\n\nRB21 to Yuki', '![gif](giphy|3P0oEX5oTmrkY)', 'lol just how bad is that car', 'https://i.redd.it/ilw07n6o5kse1.gif\n\nYuki after fp1', '> ... after simulator testing \n\nHorner will blame Nvidia drivers.', 'Horner: fix your fucking car', 'I think this is the first time a driver has acknowledged that they can feel the instability in the sim. Maybe this will help him feel better prepared when he has to drive the actual car.', ""Nah, I don't believe it, Reddit made me think that the fault was Checo and Liam"", 'Part of me is impressed that they can build in the unpredictability of the car into a simulator so that it is so unpredictable it is predictable.', 'This is the hardest I’ve ever rooted for a Red Bull driver to succeed']",846,78,0.99,846,72,72,448,38,0.0,448
1jq8x19,[Luke Smith] First press conference appearance in Red Bull colours for Yuki Tsunoda. Calls it the “best situation ever” to be making his debut for the team at his home race,https://www.reddit.com/r/formula1/comments/1jq8x19/luke_smith_first_press_conference_appearance_in/,2025-04-03, News,,"['Really hoping he does well man just get into the points 🥺', ""Red bull earnings on merchandise will cover his AND Lawson's contract. Smart swap."", 'GO YUKI GO, GO YUKI GO', 'Yuki must be the most loved racer on the grid at the moment', 'LFG Yuki!!!!!!', 'The Red Bull navy suits him well.', 'He looks great, speaking positively and giving confidence not arrogance. I sincerely hope he succeeds this weekend,  he deserves it. YUKISON', 'Wearing that dark blue now probably feels amazing', ""Okay guys we get it, now please don't jinx by overdoing this.""]",558,34,0.99,558,33,33,138,7,0.0,138
1jqb7wr,"It was really crowded in front of Red Bull, and there was a loudspeaker warning people not to stop here",https://www.reddit.com/r/formula1/comments/1jqb7wr/it_was_really_crowded_in_front_of_red_bull_and/,2025-04-03, Video,"Source with sound: https://i.imgur.com/uSxGTdL.mp4

People on the desktop, right click on the video and click ""show all controls","['wow....imagine podium for yuki... merchandise sales going stonk up from Japanese', ""Hopefully Yuki has an amazing weekend this week picking up some strong points! Let's go Yuki!"", 'Win or lose, this will definitely be one of the most memorable races for Yuki! A move to Redbull and his first race in front of his home crowd! What a moment for him!', 'Imagine if yuki is leading the race tmr with max in p2 and they are asked to switch positions. these fans will fucking riot.', ""Yuki fever's running Wild!"", '![gif](giphy|xUStFKHmuFPYk)', 'Money well spent Honda', ""So much interest for someone who will qualify P19. /s\n\n\n\nDon't worry, I root for Yuki to get into Q3 :)"", '![gif](giphy|ji6zzUZwNIuLS)\n\nMcLaren, Ferrari & Mercedes be like:', ""Really really so excited for Yuki, but please RB21 don't anything stupid""]",844,29,0.99,844,28,28,844,29,0.99,844
1jpvp32,"‘It can’t get crazier than this’ – Tsunoda on his Red Bull promotion, new team mate Verstappen and the ‘complete unknown’ he faces at Suzuka",https://www.reddit.com/r/formula1/comments/1jpvp32/it_cant_get_crazier_than_this_tsunoda_on_his_red/,2025-04-02, News,,"[""I just fucking hope he does well. I can't see him suffer, I love him too much for that."", 'It can Yuki 🤭 podium 😏', '*Undertaker theme starts playing, Checo comes out of the RB hospitality lounge in full gear*', 'Fuck podium a win would be epic', ""Everyone talking about the Max/Yuki rivalry, I'm right over here waiting to see the Maki Yux bromance blossom."", '>Asked about that particular sequence, and how their rapport is developing, Tsunoda joked: “Yeah, he can be a really good Uber driver! I gave him five stars, obviously, after the ride.\n\n![gif](giphy|6nWhy3ulBL7GSCvKw6)', 'God I hope he kills it.', 'It can get a lot crazier Yuki', ""If he can get into Q3, he'll be fine for the rest of the season""]",352,30,0.97,352,409,409,8,0,0.0,8
1jpoobl,Honda won’t “interfere” with Tsunoda’s F1 future amid Red Bull split,https://www.reddit.com/r/formula1/comments/1jpoobl/honda_wont_interfere_with_tsunodas_f1_future_amid/,2025-04-02, News,,"['I mean, what can they do?\n\nThe only seats open for next year are the one he’s in, the VCARB seats, the Merc (far more likely Russell is renewed), Doohan’s (Colapinto is already in it), and Cadillac.\n\nOnly real ‘interference’ they’d be able to do is encouraging Japanese sponsors to back him.', ""I wish they would imo, half the grid has sponsor backers interfering so I don't understand why with Yuki it's suddenly a problem"", ""Yuki's only option to stay in a top car is to absolutely dominate Lawson now. Come in and immediately score points. If he manages to land on a podium, that will just cement his RBR placement. If he barely scores points though, he's 100% out at the end of the season. All top seats are taken too."", ""You know Yuki has survived in an environment where the goal was clearly to let him drive for a year and then replace him as Red Bull keeps its promises to Honda. It's pretty clear that Helmut never intended for Yuki to drive at rbr. 5 years later, they still can't find a driver that convincingly beats him. \n\nI don't think we've ever given him enough credit for that. It sucks that he had to wait for the car to be complete shit to get the chance to drive it."", 'I think bigger part for Honda and yuki breaking up was redbull could have better and clear prospect in him, unlike you know if redbull kept thinking Honda stabbed us a bit here so we are going to screw them by screwing yuki.', 'Sounds like they’re denying the rumor of them helping Yuki get the seat at RBR and now stepping back and letting him “work” to keep his seat or a VCARB seat next year.', 'They are paying 10 million to get him the RBR seat. Of course they won’t do anything to hurt his future at RBR.', 'With Ford entering the picture for RBR in 2026, the best thing Honda can do is find a safe space for Yuki to grow outside that organization', 'What is Honda? Like are they bene gesserit or something?']",322,53,0.95,322,748,748,1,0,0.0,1
1jpmzo8,Yuki Tsunoda speaks ahead of his Red Bull debut in Japan!,https://www.reddit.com/r/formula1/comments/1jpmzo8/yuki_tsunoda_speaks_ahead_of_his_red_bull_debut/,2025-04-02, Video,,"['I’m glad he seems excited at the chance to see what he can do in the main team. The car may be harder to extract the best from, but at least the Red Bull strategy team won’t screw him the way Torro Rosso would if he does well on track. I really hope he has a great home race and gets good points', 'God Castore is so bad, those seams on his shirt are so awful.', ""Haven't seen so much hype since Lewis joined Ferrari, but it's good. Only one more day to see him on track!"", 'rooting for him to break the RB second seat curse!! Its unlikely but uhhhhhhh it’s either that or we have four RB drivers within four races this season :)', 'Kinda reminding me of Lawson in that he seems to be setting quite high goals for himself.\xa0\n\nI know F1 drivers always back them self but he might lose his confidence if he’s not as high up the order as he thinks he can be.\xa0\n\nHopefully Im wrong and he does well.', 'Omg the autotranslated audio is terrible', 'I love Yuki\'s little ""yeah"" when they asked him if he thought it was never gonna happen. He\'s adorable', ""He has a genuine confidence to him that's cool to see. It may not work out, but he's committing and confident in his abilities. Part of that is probably that he's got no way to really lose - he even says he figured the opportunity wouldn't happen for him, here, so may as well back yourself to do as well as you can."", ""> but at least the Red Bull strategy team won’t screw him the way Torro Rosso would if he does well on track.\n\nare you sure about that? RB has always displayed favouritism when they had two competitive drivers. It's why Dany Ric left and we had the Multi 21 situation before that."", 'You and I are paying attention to very different things during this video, lol.']",217,28,0.92,217,322,322,5,0,0.0,5
1jpxs9j,[@MercedesAMGF1] ‘I Slept Under the Grandstand to Watch the Grand Prix’ Suzuka Stories: Katsuhide Kuwahara,https://www.reddit.com/r/formula1/comments/1jpxs9j/mercedesamgf1_i_slept_under_the_grandstand_to/,2025-04-02, News,,"[""In 2005, Katsuhide Kuwahara slept under the Turn One grandstand at Suzuka to be able to watch the JapaneseGP. Twenty years later, he's back home for another weekend as George Russell's Performance Engineer.\n\nLink to Merc page with the whole story: [https://www.mercedesamgf1.com/news/suzuka-stories-i-slept-under-the-grandstand-to-watch-the-grand-prix](https://www.mercedesamgf1.com/news/suzuka-stories-i-slept-under-the-grandstand-to-watch-the-grand-prix)"", 'Love such stories - especially one that goes from a stand to the paddock.', 'Really like reading about the staff beind the scenes in F1.', 'Funny how reaction to this is so positive (rightly so imo)but everyone on here seems to hate the way that guy on YouTube snuck into the Aussie Grand Prix..', 'The 2005 Japanese GP? He witnessed a classic. Definitely worth sleeping under the grandstand to see one of, if not the best F1 race of all time.', 'I hope that he paid the price of the ticket when he can afford to /s', 'Garage/Pit wall you mean?', 'I think people view it differently when someone sneaks in and films it for online clout versus doing it to watch the race', 'Difference is this guy paid for tickets but didn’t have accommodation so he slept there from after quali to the race, he didn’t sneak in. The guy on YouTube didn’t even have tickets lmao']",210,17,0.95,210,16,16,4,0,0.0,4
