unique_id,post_heading,post_url,publish_time,tag,post_content,top_comments,upvotes,comments,upvote_ratio,score,total_upvotes_comments,total_score_comments,upvotes_growth_rate,comments_growth_rate,upvote_ratio_growth_rate,score_growth_rate
1kkaeo0,[Bottas on Instagram] Reunited with @mercedesamgf1 W11,https://www.reddit.com/r/formula1/comments/1kkaeo0/bottas_on_instagram_reunited_with_mercedesamgf1/,2025-05-11, Social Media,https://www.instagram.com/p/DJhh3v8is2t/?igsh=dWZwbG9pN3JhaWdy,"[""In original Livery too, that's rare."", 'The most intimidating F1 car of all time.', 'George Russell pulls out of Imola due to sickness, Bottas steps in. Mercedes unveil an upgraded package. Bottas wins at Imola. World peace quickly ensues.', 'That car is always stunning', 'This car + purple helmet Hamilton truly was something. It’s a great shame it never raced in front of a crowd.', 'Might not have been a super competitive era of F1 but those cars were insane, with this being the magnum opus.', 'W11, you bow to no one', ""So they do have a W11 that's not been W12'd?  It's not the one that Lewis won with three wheels, right?"", 'https://preview.redd.it/fseutomiq70f1.png?width=600&format=png&auto=webp&s=0cf6123924da61f96c2100a2c3404054b9f2f186', 'Man, the peak of f1 engineering!']",5030,159,0.99,5030,7773,7773,41,0,0.0,41
1kkr2e5,Court documents appear to confirm Peter de Putron is Williams' real owner,https://www.reddit.com/r/formula1/comments/1kkr2e5/court_documents_appear_to_confirm_peter_de_putron/,2025-05-12, Discussion,"A few years ago, the F1 journalist Joe Saward wrote [an article](https://joesaward.wordpress.com/2022/05/31/green-notebook-from-solarium-beach/) in which he identified Peter de Putron, an extremely reclusive financier and investor, as the ultimate owner of the Williams F1 team. Saward wrote:

>Back in the summer of 2020, when the Williams team was sold to Dorilton Capital, there was much interest and speculation about who was behind the mysterious investment firm. It was based in New York, but was clearly not an American firm. It was identified only as being a private investment office for an unidentified high worth family.

>I got a tip that the buyer was a Jersey-based entrepreneur called Peter de Putron, but no-one in the team would talk about whether these stories were true. De Putron is so reclusive that there does not seem to be a single photograph of him on the Internet, which makes it quite hard to identify him. …

>Anyway, to cut a long story short I am certain that de Putron is the man behind Dorilton – and I’ll not post any pictures of him because he does not want to be famous.

Saward is a divisive character and it seems some people were suspicious as the source of his 'tip', but I recently came across a [court transcript](https://law.justia.com/cases/new-york/other-courts/2025/2025-ny-slip-op-30605-u.html) which does appear to prove him right. These court documents relate to an [ongoing lawsuit](https://archive.is/97mXe) brought by Williams' former marketing director, Claudia Schwartz, against [James Matthews](https://www.williamsf1.com/team/james-matthews), another financier and Williams board member (and Pippa Middleton's husband, if you're interested in that sort of thing).

Schwartz's lawyers (based on, among things, testimony from Jost Capito, Williams' former team principal), reveal that:

* de Putron approves (or at least approved) all budgets for Williams Grand Prix Engineering
* Capito was told never to use de Putron's name in discussions about Williams, being informed by the board that ""Peter De Putron is in the background and doesn’t want to be known or seen that he’s the owner of Williams""
* Despite this, de Putron is referred to as ""ODL"" (Our Dear Leader) internally
* de Putron is publicly the owner of another Williams-related company, Williams IP Holdings LLC
* The plaintiffs (Dorilton and Williams) tried to prevent de Putron's name being revealed by arguing he is merely “an outside investor” and not the owner

They further conclude that de Putron makes ""all significant decisions” for both Dorilton Capital Management and Williams Grand Prix Engineering.

The court documents are [freely available](https://law.justia.com/cases/new-york/other-courts/2025/2025-ny-slip-op-30605-u.html) if you want to dive in further.

De Putron himself seems like an interesting and well-connected character with all kinds of links to politicians and various high-flyers. He is the brother in law of Andrea Leadsom, the former UK health minister, and was at Wharton business school with Matthew Savage, the founder of Dorilton.

It should be noted that Dorilton denies de Putron being involved with Williams in any way, despite Jost Capito's testimony.","[""It's been a minute since we've had a genuine mystery man in F1 at such a high level. Very interesting stuff."", 'Now do Hitech', 'He’s put money in and invested in the right people and stayed clear and let them do their work. Look at how Williams are now.', 'I love a good mystery man just hiding in the shadows and manipulating the masses with an adorable little hamster.', '>Our Dear Leader \n\nThis stuck out to me', 'With ""ODL"" and ""board"" I just imagine that Capito\'s communication with him looks like The Severance haha', 'Imagine if Sainz was taken to ODL & based on the conversation there, he probably agreed to the switch. Strange, reclusive man gives you a vision for a team to become top tier again, injecting money, moving away from Microsoft excel, Sainz’s like I’M IN!', 'So reclusive that you can barely find a photo of him on the internet. Crazy really.', ""Peter de Putron sounds like the name of a villain in a French children's book.""]",4458,340,0.97,4458,315,315,202,8,0.0,202
1kkniww,'Fingers crossed': Mick Schumacher named top choice for Cadillac seat by F1 champion Sebastian Vettel,https://www.reddit.com/r/formula1/comments/1kkniww/fingers_crossed_mick_schumacher_named_top_choice/,2025-05-12, News,,"[""Alternate title: Sebastian Vettel says a German driver which he's friends with deserves a seat in F1."", ""Ah were back to the mick back to F1 news cycle. I'm assuming next week were back to Checo."", ""I'm pretty sure Mick Schumacher has been named as a candidate for *every* seat at this point."", 'Nice try Seb.', 'With all due respect Seb, leave Mick in WEC. I know he may still have F1 in his heart but he is doing well in that Alpine. He nearly won Spa last weekend in it.', '![gif](giphy|7XoTE46IZsSY0GVlxZ)', ""Lmao. Stop this, for Mick's sake..."", ""There's better around, Checo or Bottas for security, Palou and Herta if they want an American name in the team, there's more too"", ""Mick's my favorite driver but we have to stop with these man 😭😭""]",3136,418,0.93,3136,388,388,100,9,0.0,100
1kkqyd4,Fernando Alonso’s points total after 6 races in every season with Aston Martin since 2023.,https://www.reddit.com/r/formula1/comments/1kkqyd4/fernando_alonsos_points_total_after_6_races_in/,2025-05-12, Statistics,,"[""In 2015, during his wretched early McHonda days, it would take him 9 races to score his first point (P10, 2015 British GP), following DNFs for 4 races in a row.\n\nLet's see..."", 'so by approximation he should have 33 points next year', ""Please be better than 2015 & 2017. That's where the expectations are now, this Aston is dire."", 'By 2026 Alonso won’t need a helmet, just a therapist. Aston Martin really out here running a social experiment on how far optimism can stretch', 'What a high 2023 was with Alonso, it was fun seeing him happy again to be at the podium', 'On April 9th 2024 Alonso said he wasn’t interested in joining Mercedes in 2025 since they were slower than Aston Martin. What a difference a year makes. Maybe he’ll be getting race wins a year from now lol.', ""He's weirdly positive/nonaggressive these days in interviews vs how it would be with a non-competitive car in the past. I doubt it's because the fire is gone.\n\nRocketship for 2026 confirmed? (I am inhaling massive amounts of copium)"", 'Monaco 2023 was painful', 'Bro got outscored by Stroll']",3027,114,0.99,3027,106,106,198,8,0.0,198
1kk8pzy,[AMUS] Is this the explanation for the McLaren mystery?,https://www.reddit.com/r/formula1/comments/1kk8pzy/amus_is_this_the_explanation_for_the_mclaren/,2025-05-11, News,,"['One thing teams do to fuck with other teams is hide bits to throw off teams and steer them away from what they’re doing. It’s part of the fun and games', 'For those not quite completing how a material can have a “stop sign” at a specific temperature, here’s an example:\n\nYou can’t heat water hotter than 100°C (at atmospheric pressure), because the moment it hits 100°C it turns to water vapor via boiling. \n\nMcLaren may be using a solid that melts at a target temp to do the same thing. The solid inside the brake drum liner stops the tire receiving excess heat from the rim because it’s made of/coated in whatever material they’ve designed to melt instead of heating up beyond the target level. \n\nThere are lots of other technical difficulties to overcome, but maybe this comment simplifies some of the main scientific ideas from the article above.', ""Translation:\n\n> **Everyone is puzzling over the McLaren trick. A student may have found the key to the secret with his doctoral thesis. We explain this ingenious idea that could be used to cool tires.**\n\n> Formula 1 has rarely been so confused. The McLaren MCL39 is a fast racing car, but it's not far behind Red Bull and Mercedes in setting a fast lap. Yet it harbors a secret. It's already apparent during the qualifying laps, especially on tracks that put a lot of strain on the tires. The McLarens don't degrade over the lap because the tires stay within the temperature range.\n\n> In races, the Papaya racers are usually in a different league. They can conserve their tires and thus their lap times at a high level. When the tire temperatures of their rivals begin to rise, Oscar Piastri and Lando Norris disappear into the distance with a lead of more than a second per lap. Regardless of the tire type. Here, too, the more the track layout, the asphalt, or the external conditions stress the tires, the greater the McLaren advantage.\n\n> This is a completely new quality of superiority. In the past, the competition searched for the key to why the fastest car was so fast. Now they have to figure out why this McLaren has so much endurance. One thing is clear to everyone after the Miami GP. More downforce and stable car balance may be ingredients in the cocktail, but the real secret lies elsewhere.\n\n> **Everyone looks at the brake ventilation.**\nMcLaren's opponents now know where to look. Photos of the brake ventilation systems are piled up on their desks. Sometimes closed, sometimes open. But they reveal nothing. Things only get interesting when the mechanics work on the extremely complex cooling system. But that's exactly when McLaren employees line up in front of the car like footballers at the free-kick wall, and you can't see anything.\n\n> The question of all questions is why mechanics always behave so suspiciously. That might be the answer. The solution might only be found if one could see what the mechanics are changing, adjusting, replacing, or checking. The regulations regarding brake ventilation are relatively clear. The so-called drum, which encloses the entire assembly and is located directly under the rim, is subject to strict regulations regarding its dimensions. However, the air flow inside and the materials used are free.\n\n> A small clue to solving the mystery may have emerged. It could, but doesn't have to, be the key. Eight years ago, a student researched the use of phase-change materials for his doctoral thesis at McLaren. Martin Buchan is now an aerodynamics engineer. He has now shared his knowledge in a\xa0YouTube video\xa0and drawn his own conclusions.\n\n> **Brakes hot and tires cool.**\nBrake vents have two functions. They are designed to cool the brakes, but keep them hot enough for optimal deceleration. They are also designed to quickly heat the tires via the rims, but then keep them within this temperature window for as long as possible. The challenge lies in balancing these two mutual requirements.\n\n> Even with the most skillful approach, the heat radiated by the brakes and the car will transfer to the tires. Especially during a race. Last year, Red Bull suspected that McLaren was filling its tires with water to keep them cool. The FIA \u200b\u200brefuted the suspicion. McLaren was subjected to several thorough inspections. The result was the same every time: This car is legal.\n\n> So there had to be some ingenious trick keeping the brakes hot and the tires cool. A trick that works without sensors, electronics, actuators, or the use of coolant. In other words, a process that runs passively and follows the laws of physics and chemistry. Presumably, McLaren's brake ducts aren't all that different mechanically from those of competitors.\n\n> **The miraculous heat storage.**\nInside the drum-shaped brake linings, there is usually a second sleeve with fins attached that influence the airflow. A channel runs between the two walls, which determines the temperature that the outer casing radiates onto the wheel rim. This is the case with all cars.\n\n> One could now imagine McLaren shielding this channel towards the inner panel with a very special material. A so-called phase-change material, which is also used in batteries, for example, as a heat storage device. The same requirements apply there as for tires. The temperature should rise quickly, but not exceed a certain target.\n\n> In the case of tires, it would work like this: The dissipated braking heat heats up the tire. According to this theory, McLaren would interrupt this process by having the insulating material change its state of matter, for example, from solid to liquid. During this transition, the temperature remains constant despite further external heat input.\n\n> The temperature in the outer drum triggers the phase change. The material used depends on the temperature at which the stop sign must be set. The amount of phase-change material used determines how long the heat is maintained at the desired level. A clever air distribution system can reverse the cooling direction. The brakes are then cooled to a point where the material has resolidified.\n\n> **Evidence for two-phase theory.**\nAdmittedly, this all sounds a bit otherworldly, but it's at least plausible. There's some evidence to support this. For example, Red Bull's disruptive maneuver with water in the tires. Team employees insist they saw moisture on the inside of McLaren's rims on several occasions. But the likely source wasn't the tire, but the brake drum. Perhaps fluid was sweating out during the phase transition.\n\n> It's also interesting to note that Red Bull complained at last year's Austrian GP that McLaren had been driving with temperature sensors on the brake drums. This is only permitted during free practice. According to Red Bull, McLaren did it at least once during the rest of the weekend. If this is true, it could be interpreted as the engineers trying to find out more about the temperatures inside the fairing during a race.\n\n> It's also noticeable that McLaren often performs aggressive long runs in the third free practice session, leaving the competition far behind. Perhaps they're trying to find out under extreme conditions whether everything is working as planned.\n\n> It's obviously no easy task to get this process working. A lot of development and testing goes into it. It looks like McLaren already tried out a precursor to the system after the 2024 summer break. Starting with the Dutch GP, Lando Norris and Oscar Piastri have excelled, especially in the second half of the races. The competition was already wondering how the two kept their tires in such good condition.\n\n> Even if rivals already know exactly what McLaren is doing, it's not that easy to copy the trick. Red Bull may already have a theory pointing in this direction. Recently, Max Verstappen has been complaining more and more frequently about mysterious braking problems. When asked whether this was related to tire cooling, team boss Christian Horner gave only monosyllabic answers."", 'This is the cool engineering shit that makes AP Calc worth it.', 'It’s an interesting theory—slush definitely is a useful temperature buffer. I’m somewhat skeptical of the practicalities, however. This is all unsprung weight, and making it heavy should meaningfully impact traction. Can they afford enough buffet material not to saturate over the course of a race?', 'So... Is a heatpipe (Like the ones you see in PC coolers) but at a competitive, fast and more secret level?', ""Interesting read! Very ingeneous. We might never really know if this is the trick to McLaren's success. I hope we will find out someday"", 'Good read! More information provided! It’s more and more likely phase-changing material is the trick. Let’s see how the whole thing develops. Fun time for the F1 tech world! 😄', "">It's also interesting to note that Red Bull complained at last year's Austrian GP that McLaren had been driving with temperature sensors on the brake drums. This is only permitted during free practice. According to Red Bull, McLaren did it at least once during the rest of the weekend. If this is true, it could be interpreted as the engineers trying to find out more about the temperatures inside the fairing during a race.\n\nThis has me a bit puzzled, if this is truly not allowed and they actually did it, how didn't a massive DSQ and sporting penalties follow. Just creating your own testing sessions is easily the biggest advantage you can have in a test deprived time like we are in now?\n\nEither the FIA took a massive shit on integrity or it's not true imo""]",1493,264,0.97,1493,5978,5978,17,5,0.0,17
1kkqcxp,McLaren might have to back Oscar Piastri or Lando Norris earlier in F1 title race says Martin Brundle | F1 News,https://www.reddit.com/r/formula1/comments/1kkqcxp/mclaren_might_have_to_back_oscar_piastri_or_lando/,2025-05-12, News,,"['For people that don’t want to read the article, Brundle says Mclaren won’t have to think about it until the summer break at least.', 'TL/DR if Max is still in contention, If RB get an upgrade to equalize the cars, if the flexwing change hurts McLaren. If not, for the love of god and an entertaining championship let them race.', 'Having listened to Brundles comments directly and in full, this headline is the opposite of his sentiments.', 'Zak said that there will be no team orders unless it is mathematically impossible for one to get the championship and it is after race 20 in a recent interview. Til then, they are free to race. It’s only 16 points difference and there has been only 6 races. It’s going to be a long season if the media keeps running with these stories. McLaren are 1 & 2 atm! We will see if the rest catch up with the new regulations as that may make them change their strategies', ""They just put 35+ seconds on the rest of the field in Miami. They don't have to worry about anyone."", 'Championship leading team must decide who will win title?', ""No they don't. Let them battle it out like in 2016."", 'I don’t think across the season anyone will be close enough for them to have to make a choice.', ""Why? They are so far clear of Max and George. The championship is basically coming down to which McLaren driver won't trip over Max and George and lose less time.""]",708,101,0.93,708,94,94,37,1,0.010000000000000009,37
1kkw8u0,2024 vs. 2025 | Top ten in the driver standings after six rounds,https://www.reddit.com/r/formula1/comments/1kkw8u0/2024_vs_2025_top_ten_in_the_driver_standings/,2025-05-12, Statistics,Source: https://www.instagram.com/p/DJjy01_MRZv,"['Wow merc were worse than I remember in 2024. Crazy that hamilton is placed higher despite a slightly slow start and a dsq at ferrari', ""Don't talk about Lance Don't talk about Lance Don't talk about Lance: hey Lance is the goat look at my guy"", 'Stroll dominance may bore fans', 'Perez need sto pickup some points soon. Last year was brutal for him and he still got some points.', ""I know if if if....but if Albon's P4 in the Miami Sprint hadn't been taken away, he would have more points than Alonso last year"", 'Wow this really puts things into perspective.\n\nDespite all the negativity and the rumours that Hamilton might leave Ferrari at the end of the season, he is doing relatively well compared to last year. He is only 12 points behind Leclerc, which is impressive given that he is adjusting to a new team for the first time in over a decade. Plus, Hamilton tends to perform at his best during the summer season with his best tracks like Barcelona, Montreal, Silverstone, Spa, and the Hungaroring coming up so I expect him to hit get in stride soon.', 'Ferrari you will not see heaven!!', 'Albon in the standings will always put a smile on my face.', 'man...']",654,87,0.99,654,81,81,142,12,0.0,142
1kknqw0,The clues emerging from McLaren's 'clever' brake design,https://www.reddit.com/r/formula1/comments/1kknqw0/the_clues_emerging_from_mclarens_clever_brake/,2025-05-12, News,,"[""What's interesting to me, over and above this, is that there seem to be two almost independent things:\n\n1. McLaren have just about the fastest car on one lap (approximately).\n\n2. The brake stuff discussed here which contributes to tyre wear which lets them win by 30 seconds on a hot day. \n\n*Are the two very correlated?*\n\nIf they didn't have the clever brake design, and the car was the same otherwise, would they still be fighting for poles and very very quick - just that their deg wouldn't be that great?"", 'What are the chances The Race has 0.01% of an idea of what is going on inside McLaren’s brakes?', ""> In curing those [2022] problems, McLaren’s understanding of the dynamics at play inside the drum will have been well advanced – and it may well have laid the groundwork for it being so far in front of the opposition right now.\n\nIt's all very much from the playbook in Newey's book: have one damned good fundamental idea that you dig into with time, and ideally one noone can easily see."", 'Putting „clever“ in quotation marks while you can‘t even grasp what McLaren is doing. Hilarious.\xa0', '> As Red Bull chief engineer Paul Monaghan explained about his team’s challenge in closing up that tyre deficit to McLaren: “It’s incremental. It’s not Harry Potter time. It’s not touching it with the magic wand and all of a sudden we’re away and gone. It’s diligent engineering, thorough engineering, with clever people - and we’ll chip away.”  \n\nHorner: illegal cheating scumbags, got it.', 'A lot of words to say ‘we don’t know what they’re doing’. It’s excellent engineering.', ""Love this. I've heard competing theories about what's happening but whatever's happening its good old fashioned F1 sneaky genius."", 'So there is no ""tyre water"" or ""phase change brakes"" just clever engineering.', 'They actually have a tiny person inside the car blowing on the brakes']",419,116,0.89,419,111,111,13,0,0.0,13
1kkryqb,F1 — Official Trailer 2 | Apple TV+,https://www.reddit.com/r/formula1/comments/1kkryqb/f1_official_trailer_2_apple_tv/,2025-05-12, Video,,"[""I don't really feel any particular way about the movie, but at least it's cool how it's set alongside the real F1 and the drivers and not an entirely fictional grid with cars and tracks that are an approximation."", ""How many indignities must Carlos suffer? First dropped by Ferrari, now the old guy overtakes him on track?\n\nI will be there on opening day to see it. It will be full of silly stuff, Hollywood formulaic (ha) tropes, but still, a movie about my favorite sport? I'm there with low expectations.\n\nEdit: typo"", 'Oh god are they doing an AD21 with the ‘three laps is a lifetime’ while they are waiting under red flag.', ""Looks like the Apx headquarters are probably McLaren's Technology Center\n\nAlso noticed there will be at least 3 or 4 crashes involving Sonny, including both hima nd Joshua making contact in Silverstone.\n\nOh, and a Through Goes Hamilton moment on the Ferrari (which will probably lead to the win in Abu Dhabi we saw them shooting)"", 'i feel like i have seen the team principal somewhere \n\nis she Stacey Ehrmantraut from BCS?', 'The plot is going to be absolutely daft, but the action scenes will be amazing in Imax.\n\nAlso looking forward to seeing Brands Hatch on the big screen 👌\n\nhttps://www.reddit.com/r/formula1/s/yoKvofgLVd', ""Saw Pitt battling with Checo more than any other driver lol, guess they'll be racing for p10. Even included Checo's hail mary send in Mexico."", ""Although it's a cheesy movie they've definitely got ferraris strategy perfect"", 'Brad Pitt was 17 when Alonso was born.', 'Was that a clip of Checo’s turn one crash in Mexico 2023 at 2:11 in the trailer?']",414,297,0.89,414,270,270,32,19,0.010000000000000009,32
