unique_id,post_heading,post_url,publish_time,tag,post_content,top_comments,upvotes,comments,upvote_ratio,score,total_upvotes_comments,total_score_comments,upvotes_growth_rate,comments_growth_rate,upvote_ratio_growth_rate,score_growth_rate
1lsc54d,Lando Norris earned his first F1 podium on this day 5 years ago at the Austrian Grand Prix,https://www.reddit.com/r/formula1/comments/1lsc54d/lando_norris_earned_his_first_f1_podium_on_this/,2025-07-05, Throwback,,"['I refuse to accept this was 5 years ago.', 'Last lap lando!', 'Scenario 7', 'And it was the first race of the season... in July... man, what a year.', 'Sainz did recover well, to add McLaren great day even more\n\nAfter the third safety car, Sainz was running at 9th but able to get the move on Gasly and Ocon quickly, able to get free place on Albon\n\nHe would finish within 5s of Perez(who had 5s penalty) and get 5th', 'That last lap was Lando’s best in F1 imo.', 'And he commemorated it by getting 3rd in quali', '""Scenario 7...give it everything""']",569,14,0.9,569,378,378,2,0,0.0,2
1lsi5a8,How much winning does it take to win?,https://www.reddit.com/r/formula1/comments/1lsi5a8/how_much_winning_does_it_take_to_win/,2025-07-05, Statistics,,"[""Don't forget our boy Keke Rosberg. Won the title in 1982 having won only 1 race out of 16. A win percent of 6.25%"", '2009 is a fun one.\n\n\nYou can clearly see when Brawns lack of funding and upgrades caught up with them.', 'If anyone else was wondering, Alonso finished 2012 with a 15% win percentage', ""If it does nothing else, this illustrates how insane winning 86% of all races is.    \nThat's lunatic shit."", 'I totally forgot that Max had a 9-race win streak after his 10-race win streak. Crazy to think that it could have been a 20-race win streak if it wasn’t for Singapur', ""I have already forgotten how absurd of a season Max had in 2023. Even with a dominant car that's impressive. You would a DNF/crash/mistake here or there, but he was actually almost flawless."", '2012 is... not right. first 7 races had 7 different winners, and vettel only won 5, not 6, I believe', 'that 2023 is nuts compared to the rest', 'Hamilton in the mid/later part 2018 was genuinely on another level, after that Vettel crash he absolutely savaged him. The drives in Germany, Silverstone, Italy, Singapore are all easily some of his best ever.']",524,70,0.95,524,1764,1764,-6,0,0.0,-6
1lscg69,[Scuderia Ferrari]An incredibly tight Quali. LewisHamilton leads the way for us on the third row,https://www.reddit.com/r/formula1/comments/1lscg69/scuderia_ferrarian_incredibly_tight_quali/,2025-07-05, Social Media,[https://www.instagram.com/p/DLuxKaBI-eY/](https://www.instagram.com/p/DLuxKaBI-eY/),"[""Charles's message at the end made me feel sad"", 'The absolute gut punch i felt when lewis messed up the last chicane', ""Both drivers lost it in the final corner when they had the pace for at least one of them to be on the front row. Gutted for Lewis but you always feel something bad will happen in Q3, that's what 4 years of pain does to your confidence."", 'I think the car had the pace today. Both of them fucked it on the last lap. TBF, so did Piastri and Lando.', ""Ahhhhh that's disappointing considering it could've been pole, but hopefully there's pace\n\nEDIT: tbf this was more on the drivers than the team"", 'Every driver made mistakes expect Russell and Verstappen', 'Lewis could have got front row 😔', 'At least one front row was possible.  But both of them made mistakes.\n\nCharles’ radio after was 😭😭', 'Lol. Back to square fucking one. Why am I even watching.', 'Sad to see Lewis have a miss in the last sector. But this is Silverstone. Lewis has powers here.']",511,134,0.96,511,2156,2156,-1,0,0.0,-1
1lsw2nr,Track diagram of Silverstone Grand Prix Circuit in the UK showing evolution from 1949 to present.,https://www.reddit.com/r/formula1/comments/1lsw2nr/track_diagram_of_silverstone_grand_prix_circuit/,2025-07-06, Technical,"Made to scale from aerial photographs.

Credit to Wiki user McKayF1 (Tom McKay)","[""I still can't get used to not having the S/F line before Copse despite it's a long time ago it was adjusted."", ""It's interesting that it's sort of the same but actually none of the corners are the same as the original layout."", '1948 with just a few straw bales in the middle of the X', 'Bridge was a fearsome corner.', 'I prefer the 1997 version, trough Bridge', ""The pre-2010 layout was more exciting over one lap but I have to say, the new layout is much better for racing.\n\nEspecially now that Abbey and Copse are flat. It's pretty easy to follow around here now."", 'I miss Bridge', ""Dear people who criticize 'airfield tracks'... Well here's what you can do with airfield tracks."", 'For me 91 was peak. Still not sold on the new 2010 parts or the start/finish not being after Woodcote.', 'r/MapPorn/']",449,34,0.98,449,34,34,23,1,0.0,23
1lt2nwk,Leclerc complaining about water coming inside his visor,https://www.reddit.com/r/formula1/comments/1lt2nwk/leclerc_complaining_about_water_coming_inside_his/,2025-07-06, Video,,"['Him driving just straight on was so funny', 'Say the line, ~~Bart~~ Bryan!', ""Charles' drink is broken, so Ferrari told him to drive over some water to get a drink"", 'Obligatory ""Must be the water"" comment', 'They write themselves', 'Must be the water', 'Ferrari\n\nYou keep ruining my weekends', 'fuck track rules, charles is coming through!', 'Bryan chickened out.', ""Pretty sure that's the line I used to also use cut across to cheese some of the Gran Turismo challenges.""]",443,48,0.98,443,43,43,443,48,0.98,443
1lsqsdg,2025 British Grand Prix: Constructor & Driver Track Dominance Breakdown,https://www.reddit.com/r/formula1/comments/1lsqsdg/2025_british_grand_prix_constructor_driver_track/,2025-07-06, Statistics,"https://preview.redd.it/xpfbj50r26bf1.png?width=1200&format=png&auto=webp&s=31bbfef214e72067ec4b586cb88779b2a417cafb

https://preview.redd.it/gihe560r26bf1.png?width=1200&format=png&auto=webp&s=489904a7862cbf336d0d499498e50d5d0f5e6a2a

**Image 1: Constructor Dominance**

This first graphic shows which constructor was the fastest in each mini-sector of the Silverstone circuit.

* **Red Bull Racing:** Unsurprisingly, they were absolutely dominant on the straights. The dark blue lines show their top-speed advantage on the Hangar and Wellington straights.
* **McLaren:** The papaya orange shows up strong in the high-speed cornering sections, owning large chunks of the Maggotts, Becketts, and Chapel complex.

  
**Image 2: Track Dominance - Piastri vs. Verstappen**

This second graphic drills down into the individual performances of Oscar Piastri and Max Verstappen, showing who was faster and where.

* It's a classic trade-off: Verstappen leverages the Red Bull's incredible straight-line speed, while Piastri's McLaren appears to have the edge in cornering performance.

Please let me know if you like these every race or how I can improve my code :)

  
","['Love it! Please keep this up!', 'will the lower downforce setup for verstappen disadvantage him during the race?', 'Looks like Red Bull have them beat on the straights. McLaren’s shot is battling in the turns. They need to build their car for combat.', ""Depends on the conditions. If the conditions create a situation where his tire wear is lower than anticipated, he should be strong. Having a lower downforce setup will accelerate tire wear due to scrubbing compared to those with higher downforce. Should the temperature be very high, or conversely it being a majority inter race due to rain, he would be at a disadvantage. Dry, cold conditions will help him for the race. \n\n\nVs the McLarens he'll be vulnerable entering the hangar straight if they have DRS so he'd need to run at a pace that keeps them out of it, but controlled enough to keep the tires sweet throughout the stint. It's not going to be a very straightforward race for him, that's for sure. They have 2 cars they can play strategy games with against him too."", 'Not if he maintains the lead', ""Yes, He will be extremely vulnerable to undercutting/overcutting.\n\nThe track will be green tomorrow as its going to rain pre race. He's going to be sliding around a lot."", 'No (assuming the track is dry) if their new floor generates enough rear downforce which lets him run a skinnier rear wing\n\nClean air will be key, though rain and changing conditions can cause issues', 'It will make him harder to pass and colder weather will help his tyres. He will lose some pace to McLaren in more technical sections like luffield though, which could give them drs to counter his setup. That being said, with such low downforce drs vs him will be much weaker. Red Bull have been quite smart with setup this week, Ferrari went a lot harder on downforce after free practice and it looks like it sent them the wrong way.', 'Agreed on everything except for the last point. McL have two drivers against Max, but they will not be playing a team game and RedBull know it.\n\nProbably was Horner, or someone else from the RB camp that said something along those lines in a previous GP, that McL will not split strategies for the sake of one of them possibly being able to get the win from Max, they will try to be as fair as possible to their drivers at the cost of the win.']",378,12,0.98,378,91,91,-1,0,0.0,-1
1lswb57,The amount of helicopters going to and from silverstone on race day always make me chuckle,https://www.reddit.com/r/formula1/comments/1lswb57/the_amount_of_helicopters_going_to_and_from/,2025-07-06, Discussion,,"[""It's OK because I'm drinking from a paper straw."", ""My first reaction was it can't be that funny but I decided to go on Flightradar 24 myself and actually did laugh when I zoomed out to see the wider air traffic in the country; [you don't even need to know where Silverstone is on the map too find out where it is based solely on that concentration of helicopters.](https://i.imgur.com/zIWxLgt.jpeg)"", '£1600 to park and fly if you fancy it\n\nhttps://www.silverstone.co.uk/events/formula-1-british-grand-prix/getting-here', ""Don't forget to switch off the lights whenever possible and to feel guilty every time you start your 1.4 litre car engine!"", 'Just remember who the real problem is with regards to climate change', ""Many years ago I heard the claim that on race day Silverstone becomes the busiest airport in the world.\n\nI've never verified that and it was a long time ago."", 'Mating season', 'I live in an area south of Silverstone and judging by the multiple helicopters I heard blaring away at 8-9am this morning, checks out', 'Yeah but let’s switch the engines to 50% electric for the environment…', ""Yeah the helicopter noise is pretty full on. Even sitting at Stowe. They're constantly coming and going through all of the races. Not sure who still needs to arrive within the last 10 laps of the GP... well from last year's experience""]",378,62,0.97,378,62,62,70,2,0.0,70
1lszamv,"[Chris Medland] Weather forecast says rain for the next hour, so the current spell stopping around 90 mins before the race. But it's not warm or that windy, so how quickly it dries will be interesting",https://www.reddit.com/r/formula1/comments/1lszamv/chris_medland_weather_forecast_says_rain_for_the/,2025-07-06, News,,"['We should be able to race with a bit of standing water right?', 'Rookies gonna be crashing left and right', 'Rain’s getting worse again. George seems upbeat. The sweeper trucks are coming round now.', 'I want rain during the grand prix, not before, not after', 'Changing conditions races are the best.', 'The classic cars are going round at the moment in the rain. Spray is pretty bad. Rain not as heavy as it was earlier.', 'Inter start going to slicks by around 15-20 laps in I reckon', 'Fingers crossed for a wet start on a drying track and a light shower halfway through. Maximum fun.\xa0', 'Max will be lucky to finish p5 with the lack of rear wing, Ill be surprised if he can keep the car on track', 'I’m calling it now: Lewis Hamilton wins the British Grand Prix.']",364,57,0.98,364,57,57,29,0,0.0,29
1lsi3hf,'Qualifying used to be my strength but I'm not doing the job this year' - Leclerc,https://www.reddit.com/r/formula1/comments/1lsi3hf/qualifying_used_to_be_my_strength_but_im_not/,2025-07-05, News,,"['Thought this was a quote from Lando lol', 'He has been a bit off on Saturdays but his Sunday performances have been excellent. And got nearly everything out of the car.', 'My god what has Ferrari done to our boys', "">“The issues are very specific,” he explained. “It’s not a balance issue, it’s not a grip issue. I don’t want to go into the detail but it’s just something very weird that we’ve got to fight in the car, especially when there are high-speed [corners] it makes it even more difficult.\n\nThat stands out to me. My only best guess / speculation *(and I acknowledge it as such in the hopes that someone more in the know than me can comment)* is that the issue is related to the drag *(considering how low the car is set to be)*, which sets off the intent to LiCo, considering that this has been my understanding of the philosophy of the SF-25. \n\nAt the same time, it seems to inherit the flaws of the SF-23, with tyre wear being a lot worse off in this scenario. But I'll love to hear other opinions, in the fears that I am getting it wrong\n\nLeclerc has always been one of, if not the strongest qualifiers on the grid. And I think a good portion of us can agree that without the ability to trust how the car is going to respond to your inputs as you drive / brake, it is going to affect your lap, especially in qualifying where it is heavily relied on this season"", ""You can't really qualify properly without confidence in the car."", ""It wouldn't even matter if he still was getting first and second in pole consistently \n\nThe car would get run over after a few laps anyways and he would drop to 4th and 5th pretty normally"", 'What Ferrari does to a man...', ""A big part of this is that Ferrari used to heat the tires better to the right window for qualifying, but ever since 2024 the car doesn't heat the tires better! That was the trade off for race pace at the expense of qualifying!"", 'Man, Ferrari rips the soul of everyone']",347,64,0.98,347,1248,1248,7,0,0.0,7
1lscbwp,[Aston Martin Aramco F1 Team] Qualifying in front of our home crowd complete.,https://www.reddit.com/r/formula1/comments/1lscbwp/aston_martin_aramco_f1_team_qualifying_in_front/,2025-07-05, Social Media,,"['Gonna be P7 with the grid penalties', ""From Silverstone to Silverstone is insane to not outqualify you teammate once.  Honestly, I really hope Alonso doesn't get booted out for Russell because that would just be stupid."", 'Mega drive from Padre!', 'It was mentioned on commentary that this race last year was the last time Stroll out qualified Alonso in GP qualifying. The streak continues then', 'Alonso fighting in the points again is great. For Stroll more pain.', 'is Alonso starting P7 after the pens?', ""How do AM post this with a straight face every race weekend, I can't comprehend.\n\n  \nAlonso goated drive as usual."", 'We were baited in Q1', 'No improvement in q3 and not the first time this year i think . Weird they can´t find a bit more speed like most of the others do.', 'That position delta is a meme at this point.']",326,56,0.99,326,979,979,-6,0,0.0,-6
1lt33q7,Verstappen slides massively on restart and drops to P9,https://www.reddit.com/r/formula1/comments/1lt33q7/verstappen_slides_massively_on_restart_and_drops/,2025-07-06, Video,,"['Stroll p3 lmao', 'HULKENBERG IN P4, THE HOPIUM IS REAL', 'HULK YOU KNOW WHAT TO DO', 'NO FUCKING WAY', ""Piastri cooked max's tyres"", 'Low DF setup absolutely fucked him with these conditions.', ""So unnecessary for Piastri to do that. Verstappen was not a problem this race anyway. Now he's probably going to get a penalty for it.\n\nEdit: Yup, 10 seconds penalty. And for what? Such a stupid move."", 'Got massively fucked by piastri slowing I think', 'As an Australian that should be a penalty', 'Borderline break testing by Piastri']",680,233,0.99,680,213,213,680,233,0.99,680
1lstlmv,Silverstone track 1963 vs 2025,https://www.reddit.com/r/formula1/comments/1lstlmv/silverstone_track_1963_vs_2025/,2025-07-06, Throwback,"Found an old Grand Prix car book in the garage of a property my parents bought. The title is 'Grand Prix Cars: Post-war to present', someone kindly hand wrote the publication year of 1963 on the cover to make 'present' less vague.

The book details car specs across all the constructors at the time. It has several pages with track maps and I decided to compare it to modern-day Silverstone. A lot more turns in the current iteration!

Track distance in 1963 was 4.667km, now in 2025 it's 5.891km.  
Jim Clark won pole in '63 qualifying with a time of 1:34.6 on a much shorter track than we have now.","[""On thing those images can't show are the safety measures.  When I used to go to Silverstone in the early 70s, the only safety measures at Copse were a scaffold rail about a metre off the ground, and a few, wonderfully flammable hay bales...\n\nWoodcote was fierce - I remember seeing so many cars slam into the walls on the pit lane after misjudging it, one time an F3 car cartwheeled down the start finish straight, the driver got out kicked it a few times then fell over when he realised he'd got a broken ankle.\n\nJim Clarke's 1:34 would have been a white knuckle, inches from oblivion run given the car had no downforce, thin all weather tyres, and no driver aids."", 'I gotta say, og Silverstone is quite fun to hot lap in Assetto Corsa', 'It’s something to think about when you realise that Silverstone’s layout from 1950-1990 was just the perimeter roads of the air base. And even now, you can still see obvious parts of the old layout.', '[https://www.racingcircuits.info/europe/united-kingdom/silverstone.html](https://www.racingcircuits.info/europe/united-kingdom/silverstone.html)', ""The missing bits still exist\n\nCurrent circuit map https://en.wikipedia.org/wiki/Silverstone_Circuit#/media/File:Silverstone_Circuit_2020.png\n\nAerial view: https://upload.wikimedia.org/wikipedia/commons/8/8d/Silverstone_Circuit%2C_July_2%2C_2018_SkySat_%28cropped%29.jpg\n\nEvery Circuit in one map: https://oversteer48.com/wp-content/uploads/2023/02/SIlverstone-circuit-configurations-2.jpg\n\n- The Arena Circuit is the F1 Grand Prix Circuit - MotoGP, F1, World Endurance, British Endurance Championship, F4 and more.\n\n- [The National Circuit](https://oversteer48.com/silverstone-circuit-configurations/) - 1.640 miles (2.639 km), Touring Cars, Formula Ford, Ginettas, Super bikes, and more\n\n- [International Circuit](https://oversteer48.com/silverstone-circuit-configurations/) - 1.851 miles (2.979 km) - Ma5da MX5, Mini's, Caterhams, Thunder Saloons.\n\n- [Stowe Circuit](https://oversteer48.com/silverstone-circuit-configurations/)/RX - 1.080 miles (1.738 km) short straights and tight corners - driving experience days, magazine car tests and vehicle development, and formerly World Rallycross\n\nMartin Brundle and James Allen talking about it in 2010 https://www.youtube.com/watch?v=dMKc2hGcJCI&t=133s in a two-seater F1 car."", 'It was the best track in Grand Prix Legends!', 'OG temple of speed. How they have massacred it - simple pain.', ""The only thing one can add to Silverstone is undulations like Portimao, otherwise it's the greatest flat circuit in the world.\n\nYes, I know it has serious elevation change between Stowe going into Vale; and Montreal, Yas Marina, Singapore, Mexico, Albert Park, even Shanghai have lesser elevation change, but to me Silverstone is a flat circuit."", '100% - so much fun in the OG lotus! \n\nAlthough, it gets very spicy doing it in a LMP1 too', 'In rFactor OG Silverstone was one of my favorite tracks in Group C or early 90s F1 cars.']",326,21,0.96,326,20,20,4,0,0.0,4
1lt0w0q,[Autoracer IT] Ferrari CEO Benedetto Vigna has told Sky Sports that the team is in contract renewal talks with Team Principal Fred Vassuer,https://www.reddit.com/r/formula1/comments/1lt0w0q/autoracer_it_ferrari_ceo_benedetto_vigna_has_told/,2025-07-06, News,,"['Just keep him. He’s not the problem. Others need scrutiny like Togninalli.', 'So they are swapping Vasseur with his evil brother', '[Fred hearing that he was under threat](https://www.youtube.com/watch?v=u536v8QppTI)', ""I'm sure Hamilton wants Fred to stay"", ""Won't be surprised if there is a repeat of Todt 1996 situation. Charles and Lewis may have told we leave if Fred leaves and Ferrari backed down. But Fred needs to improve communication from the team and be more open even if team makes mistakes."", 'Binotto had 4 meh seasons with cherry on top being 2022. Vasseur brought better results in three. It would have been wild to get rid of him.', ""Original article is in Italian. And headline doesn't comes to the point after translation. Tried to keep it brief, as much as I could"", 'Good. \n\nFred is not the issue. I really appreciate how hard charles & lewis backed him, and I imagine that made a difference.', 'I only trust this when the contract has been finalized.', 'How the things have changed, about one moth ago que was about to get fired']",339,28,0.99,339,27,27,57,0,0.0,57
1lsfl7y,The impressive stats about Lewis in Silverstone... nobody has half his podium finishes in the F1 history on the british track!,https://www.reddit.com/r/formula1/comments/1lsfl7y/the_impressive_stats_about_lewis_in_silverstone/,2025-07-05, Statistics,,"['Why is Mansell included on 5 but not others who are on 5 like Vettel, Verstappen or Bottas?\n\nReally cool stat though!\xa0', 'The average F1 career is probably half the amount of podiums he has.', ""This reads like the UK's Second Places at Eurovision. Impressive."", 'Lewis Hamilton has never raced at Silverstone with a car not capable of a podium finish on pace', 'Tbf it does help when you are always in a car that is capable of a podium and reliability is bullet proof?', ""Stats like this are pointless now that there's more races in a year, of course he's got more podiums at Silverstone."", 'Henis the first tomdo it 5 times in this list', 'First to do it? Like qualifying']",290,136,0.83,290,552,552,7,0,0.0,7
1lt36sr,[Chris Medland] PENALTY: 10-second time penalty for Piastri for a Safety Car infringement,https://www.reddit.com/r/formula1/comments/1lt36sr/chris_medland_penalty_10second_time_penalty_for/,2025-07-06, News,,"['HULK PODIUM IS REAL', ""Cant say I'm shocked. Understand the attempt by Piastri but with visibility it was silly."", 'Absolutely dominating pace in hard conditions only to throw it away with a silly move under SC...\n\nOR well, long race ahead.', 'Justified in my opinion. Very dangerous in the wet.', ""Why is Piastri playing stupid games when he has a car that's 2-3 seconds PER LAP faster than Max?  He didn't need to do any of that.\n\nIt's so unnecessary.  Literally congrats, you played yourself."", 'Stupid from Piastri', 'Good. Way too dangerous of a move, especially in the wet with low visibility.', 'F1TV commentators don’t seem to agree. Really strange how you don’t see something wrong with it. It was way too sudden', ""I want Oscar to win but that's fair enough"", 'Lance Stroll dominance could bore fans']",637,347,0.98,637,318,318,637,347,0.98,637
1lsd0ok,[f1visualized] Qualifying gaps visualized - British GP 2025,https://www.reddit.com/r/formula1/comments/1lsd0ok/f1visualized_qualifying_gaps_visualized_british/,2025-07-05, Social Media,,"['George was nowhere in Q1 and Q2. He really pulled that lap out of nowhere. Big props to Max too. I knew he was definitely in contention as soon as he topped Q1 on a single set of Softs. Well done boys!', 'Holy fuck, I can’t remember the last time I saw Ferrari improve a ton between Q2 and Q3.\n\nJust absolutely horrible.\n\nThankfully their race pace is better, expect to see them finish 4-5 if not 3-4.', 'The top 6 are covered by a blanket. Should be a fun race as Silverstone always is.', 'Damn, 6 cars in like 1 tenth', 'George very nearly had both McLaren despite being this weekend the 4th fastest car and clearly.\n\nMonster monster lap.', 'Antonelli is being conquered by George', 'that massive gap between max and mclaren', 'Max an absolute beast\xa0', 'Visualising the gap between Max & Oscar being the same as the gap between Oscar and Charles is insane. Max truly is a mad man.', 'Both Ferrari drivers mistakes costed them dearly and no, their tyres are not dead.']",267,34,0.97,267,450,450,1,0,0.0,1
