unique_id,post_heading,post_url,publish_time,tag,post_content,top_comments,upvotes,comments,upvote_ratio,score,total_upvotes_comments,total_score_comments,upvotes_growth_rate,comments_growth_rate,upvote_ratio_growth_rate,score_growth_rate
1hjbkhr,[F1] Every Grill The Grid Of The 2024 Season!,https://www.reddit.com/r/formula1/comments/1hjbkhr/f1_every_grill_the_grid_of_the_2024_season/,2024-12-21, Video,,"['I just want to know when they post the gift exchange...', 'Yuki just randomly saying english names every time there is an A-Z Challenge will never not be hilarious.', ""Everyone else is excited to see how all the rookies next year do on the track, I'm excited to see how they do on Grill on the Grid!\n\nThere's usually some kind of 'personal information' round, like driver heights or ages right? Everyone will get so stuck on the rookies"", 'Ding! I hear that Ding! you like the Ding! so we Ding! your Ding! with some Ding!. Ding!\n\nDing! Ding! Ding!\n\nDing!\n\n  \n2 minutes and i had enough of Ding!.', ""That's fair, I'm really looking forward to that too"", '""Well... at the beginning of the year, my gift was for Logan Sargeant. So I suppose I can give it to Daniel Ricci... no wait, I can give it to Esteba... no... hmm... Colapinto!!! It\'s a calendar. I marked every F1 weekend we will... race... hmmm. Maybe I give the gift to Lawson.""', 'Yeah, I’m sure there is an art to it that my regular ass doesn’t understand, but the editing drives me crazy in these, I stopped watching them this year when there’s enough good other driver content out there.']",60,7,0.9,60,70,70,4,0,0.010000000000000009,4
1hj6lwe,What makes a race exciting?,https://www.reddit.com/r/formula1/comments/1hj6lwe/what_makes_a_race_exciting/,2024-12-21, Discussion,"Hey guys, for a little personal data science project I'm trying to determine, based entirely on statistics, which races are the most exciting of all time. 

I'm doing this by assigning scores to things such as number of overtakes, number of safety cars, number of DNFs etc. and ranking them based on these scores. 

So my question to the F1 community is: What do you feel makes for an exciting, interesting race? 

It should be something that can be quantified like the stats I mentioned, so stuff like the atmosphere at the track or the celebrities present don't make for great data. Let me know what you think!","['Jeopardy. It doesn’t matter if the eventual victor started on pole and lead every lap. What matters is how they get to the chequered flag first. If they scoot up the road by 30s and there’s no chance of them losing, there’s no excitement. If however they are under pressure lap after lap, then you have jeopardy. I’m not sure how you measure that.', 'Rain', 'safety cars for sure. also number of accidents/pileups in the opening corner/lap\n\npunctures/engine failures/bad pitstops', 'as FOM are now noticing, ""excitement"" isn\'t something that can be just measured with quantifiable factors. They tried the ""as many overtakes as possible"" angle then the overtakes got boring, then the ""super fucking quick cars"" and the races got even more boring\n\n  \nhow exciting a race is is based on vibes and vibes alone', ""Needs to be a sense that the win, specifically, is up in the air. Max driving 45 seconds off into the distance is of course an absolute driving clinic but it does not make for exciting races.\n\nGood battles over 5th are fine imo, but really the win needs to be contested, whether that's on track or through strategy calls"", 'I think in General, unexpected Changes have the biggest influence. Nowadays Teams can calculate very precisely how fast the car will Go and so on, but it gets chaotic when unexpected Events Happen. This can bei weather Changes (rain, drying track etc) but also safety Cars from Crashes.', ""when a driver who's usually in q3 is out in q1 and has a chance to show their overtaking skills"", 'Last minute strategy', 'Another variable I\'d add is some way of measuring the ""upset"". I.e if different people win, it\'s automatically more interesting.\n\nAlso an easy one to statistically generate I\'d assume, is one I\'d recommend adding: total time the difference on track between 1st and 2nd is under 2s.\n\nId also add something like ""is 1st currently not the fastest on track"", as that ""hunt"" from someone behind is often exciting.\n\nAlso, I did a project very similar to this (just a different sport and obiective) back when I was at uni, so if you want any help feel free to DM me. Was a lot of fun tbh, but the major issue I can see you have is that you don\'t have ""true values"" for how interesting the races objectively were, so build models around. Will be fascinating to see how you solve that!']",56,138,0.75,56,824,824,1,1,0.0,1
1hjapvm,Mark Hughes: The dramatic rise and fall of Sergio Perez's F1 career,https://www.reddit.com/r/formula1/comments/1hjapvm/mark_hughes_the_dramatic_rise_and_fall_of_sergio/,2024-12-21, News,,"['Sergio is a bad ass. Always will be. I LOVED watching him come from behind and make big ballzy passes. That was so exciting.', 'There was no rise.', 'I\'ll always remember ""Checo is a legend""..... And the win from last place. Good shit right there.', 'The smugness of people who say this after only watching the sport for the last 2 years will never not astound me.', 'That’s not true at all', 'Perez was a quality driver. He was just not top tier but a long time second tier imo. His abilities in tire management carried force India to some really good results. \n\nBut now he is past his peak, but had his impact on f1', ""How was there no rise? This isn't Magnussen who started with a podium"", ""He managed to get the RBR seat through a surprise win. He hasn't always sucked."", ""The maintained flat line of Sergio Perez' F1 career""]",24,22,0.65,24,64,64,0,0,0.0,0
1hj9655,Alpine set to reignite interest in Franco Colapinto for F1 2026,https://www.reddit.com/r/formula1/comments/1hj9655/alpine_set_to_reignite_interest_in_franco/,2024-12-21, News,,"[""Looks like this is just based on the amus [interview](https://www.reddit.com/r/formula1/comments/1hg9sh5/flavio_briatore_i_am_a_democratic_dictator/) from a few days ago, no new info.\n\n**You are also interested in Franco Colapinto. Why is that? You already have a young driver in Jack Doohan.**\n\n>Briatore: I'm interested in any driver who is fast. Colapinto surprised everyone. But we have contracts with Gasly, Doohan and Aron for next season. If there was an opportunity to get Colapinto for 2026, you have to think about it. Nevertheless, you always have to be careful when assessing drivers. In this sport, you quickly get hyped up after a good race. Then the price rises and suddenly we're talking about 20 or 30 million dollars. The choice today is much greater than it used to be. Today, there are six to seven promising drivers in Formula 2 and Formula 3. We want to concentrate on the good ones in our academy and no longer run around with a watering can. It will probably come down to three drivers. Aron, Mini and Martins."", 'The journalist that I\'ve been following in the whole Checo saga (was super on point on almost everything), said that regardless of who is in the ""shadows"" (Colapinto or Aron), Doohan is the one in danger, that Briatore was not impressed with his data after all the private testing he has done and that all this: ""hur, hur, we have academy, who cares about that Colapinto guy"" is more like a: ""Jamie, please lower the price tag"".', ""he has to pray for Aron's downfall before Doohan's downfall\n\n  \nAron is looking really promising and wont be a surprised if they Swap Him in for Doohan if Jack is underperforming"", 'a lot can happen in a year of F1. And this sport has a very short memory.', 'i know this has been a rumor and is probably still just a rumor, but for discussion’s sake: alpine can express interest all the want, but wouldn’t it be more telling if the focus was on how open williams would be to let him go? they seem set on keeping him within the team, and based on the quote below, he wouldn’t even be a first pick since briatore would rather assess their current juniors first', 'What about Gabriele Mini?\xa0 Seems promising\xa0', ""So yuki is genuinely screwed if he's let go from RB next year. Not a single seat available.\n\nAnd no, Cadillac isn't gonna take him."", 'Alpine seem like they are on a downward path, is colapinto going there even a good idea for his career? And briatore controlling things doesnt add any confidence to the matter imo.', 'Here comes another Franco RUMOR. JUST RUMOR. Do Argentians really keep making these kinds of articles? \n\nHe’s not a bad driver, but Argentians shouldn’t act as if he’s some kind of exceptional athlete or as though he already has a guaranteed spot reserved. When they disparage other athletes without reason and make disrespectful comments about the sport while waving their country’s flag, they need to understand that this behavior tarnishes both the athlete’s and the country’s image.\n\nThey’re increasingly crossing the line, and more and more people are feeling repelled by it. Personally, I don’t want to see people like that in the future.']",13,40,0.6,13,141,141,0,0,0.0,0
1hj4i96,Ask r/Formula1 Anything - Daily Discussion Thread,https://www.reddit.com/r/formula1/comments/1hj4i96/ask_rformula1_anything_daily_discussion_thread/,2024-12-21,,"# Welcome to the [r/formula1](https://www.reddit.com/r/formula1/) Daily Discussion / Q&A thread.

This thread is a hub for general discussion and questions about Formula 1, that don't need threads of their own.

Are you new to Formula 1? This is the place for you. Ever wondered why it's called a lollipop man? Why the cars don't refuel during pitstops? Or when Mika will be back from his sabbatical? Ask any question you might have here, and the community will answer.

Also make sure you check out our [guide for new fans](https://www.reddit.com/r/formula1/wiki/newtof1), and our [FAQ for new fans](https://www.reddit.com/r/formula1/wiki/faq).

Are you a veteran fan, longing for the days of lollipop men, refueling during pitstops, and Mika Häkkinen? This is the place to introduce new fans to your passion and knowledge of the sport.

Remember to keep it civil and welcoming! Gatekeeping within the Daily Discussion will subject users to disciplinary action.

Have a meta question about the subreddit? Please [direct these to the moderators](https://www.reddit.com/message/compose/?to=/r/formula1) instead.","[""Some happy news which might not be worth a full post but I thought would be nice to share - [Gina Schumacher has announced she's pregnant](https://www.instagram.com/p/DD1bTjmxDN1/?hl=en&img_index=1), so Michael will be a grandfather soon (and Mick an uncle)"", 'How do sprints work in tie breakers? We all know if drivers are equal on points they look at number of first places, second places etc all the way down to last places, but do sprint results count for that too? Or are they the next tie breaker if all race positions stay equal? I couldn’t find anything about it in the rules.', 'I was recently rewatching the highlights of the 2019 Singapore Grand Prix, and after Vettel was able to undercut Leclerc I was a little confused by who came on the radio to Charles after he complained about it?\n\nIt’s definitely not Binotto, and it didn’t really sound like Xavi either as it sounded French, although I might be wrong. Any ideas?', ""Does Red Bull seek Max's opinion/input on who the second driver should be?"", ' Bruhh where is the f1 secret santa for this user?', 'What are your thoughts on Robert Kubica? Was he a top driver at any point?', ""Does anyone know what year this is from? Can't find anything anywhere\n\nhttps://preview.redd.it/wi4cs5fbt58e1.jpeg?width=1080&format=pjpg&auto=webp&s=27b8328d627caaee6d7de058078233e9739ae9ee"", 'Will adrian neweys leaving affect the second seat curse? Or am I being thick and its more of a set up thing?', ""So a friend of mine won a signed red bull racing hat, but we are having issues identifying who's signature it is, anybody here who can identify it? https://imgur.com/a/LiTDG2D"", 'Anyone here follow F2 and below? Just wondering how good Alex Dunne is? Love to see an Irish lad on the grid.']",8,72,0.66,8,116,116,0,0,0.0,0
1hj73j6,"Exclusive Christian Horner interview: Max Never Gives Up “Like A TERRIER On Your Ankle” + Perez, Lawson, Hamilton, Wolff",https://www.reddit.com/r/formula1/comments/1hj73j6/exclusive_christian_horner_interview_max_never/,2024-12-21, Video,,"[""He's trying so hard to make the terrier thing happen lol."", 'I think this is the first straight up admission from Horner, that Max is their number 1 priority and the second driver is only there to back Max up. And is not expected to beat Max but just be close to him', 'Simon Jordan’s a very interesting person to say the least 😅', 'What is this little terrier yapping about', 'Ughh he tries so hard to make fetch happen. It’s never gonna happen. We will always have only one operator and he is very smooth.', 'If redbull was really only looming for a 2nd driver thats fast enough to get points, I think they would have explored a bottas option but I think they are worried that max might actually choose to leave soon.', 'The comments in that video are just what I expected lol', 'Anything to get people to forget the coco pops.', 'Yes, I was also surprised to hear him say that publicly.', 'Toto Wolff said Horner was yapping like a little terrier when Max and Russel had beef.']",0,12,0.4,0,77,77,0,0,0.0,0
