unique_id,post_heading,post_url,publish_time,tag,post_content,top_comments,upvotes,comments,upvote_ratio,score,total_upvotes_comments,total_score_comments,upvotes_growth_rate,comments_growth_rate,upvote_ratio_growth_rate,score_growth_rate
1kgcryc,[Chris Medland] BREAKING: Ollie Oakes has resigned as Alpine team principal with immediate effect. Flavio Briatore will take over his responsibilities,https://www.reddit.com/r/formula1/comments/1kgcryc/chris_medland_breaking_ollie_oakes_has_resigned/,2025-05-06, News,,"[""Can't wait for Gasly to inexplicably crash at just the right time for Alonso to win from nowhere"", 'certified alpine moment once again', 'How is it 2025 and Flavio Briatore is a team principal again?', 'I praise the Lord every day Carlos Sainz did not go to Alpine.', ""I remember when Briatore was permanently banned from the sport for fixing a race result by organising a planned crash. Man is like herpes, can't get rid of him"", 'Fuck is going on at Alpine?', 'What? This confirms Colapinto for Imola then imo', ""The Alpine circus continues...\n\nIn all seriousness, from what I've seen of him I thought he seemed pretty good. Shame to see him leave"", '![gif](giphy|kJWYrH269RK8M)']",9373,1164,0.96,9373,49064,49064,107,4,0.0,107
1kgr4a5,BREAKING: Franco Colapinto to race at least the next five races for Alpine in place of Jack Doohan,https://www.reddit.com/r/formula1/comments/1kgr4a5/breaking_franco_colapinto_to_race_at_least_the/,2025-05-07, Social Media,,"['*5 race* contract is diabolical behaviour when you’ve just sacked the last guy after 6', ""Colapinto: I only get 5 races?\n\nFlavio: I am altering the deal, pray I don't alter it any further"", ""Jack's manager is Flavio fuck me he's been hard done by here"", '5 races is diabolical\n\nwhats next? doohan back in? paul aron 4 race contract starting from the british GP?', 'jesus christ, alpine is a genuine joke and disgrace, thank god oscar escaped this shit hole', 'And so what happens if Franco doesn’t perform better? Do they swap them back? Do they call up Aron? Do they have Gasly drive both cars simultaneously?\n\nETA: Apparently they plan to *rotate* the seat between drivers.', ""I will never forget how Alpine tried to bash Oscar's character on the way out. I can't even imagine what it would've been like if he stayed there.\n\nFeel for Jack, feel for Franco, but not even Red Bull is this extreme"", 'Move over, Red Bull, the new rookie crushing machine is in town', ""https://preview.redd.it/gvvi8cyo6bze1.jpeg?width=1170&format=pjpg&auto=webp&s=26fc6d6c22357c93e76bc1c76912875e64cafa78\n\n(I'm bumblebee)"", 'https://preview.redd.it/char7svz9bze1.jpeg?width=1080&format=pjpg&auto=webp&s=9317f514bb2ba796990f095222c3fb41750d388e\n\n**The obligatory MBS photobomb**']",7171,767,0.96,7171,480,480,1488,90,-0.010000000000000009,1488
1kg9f3g,From 1 win in 11 years to 11 wins in 1 year,https://www.reddit.com/r/formula1/comments/1kg9f3g/from_1_win_in_11_years_to_11_wins_in_1_year/,2025-05-06, Statistics,"From @canalplusf1, since Miami 2024 McLaren as won 11 times, but only once before that in 11 years","['Fun fact people don’t expect: In Jensons whole time at McLaren he only ever got 1 pole position \n\nEven though he was 2nd in the championship in 2011', 'Criminal to leave Alonso out of this driver lineup picture', 'They did the man who gave McLaren that one victory dirty with that picture.', 'They really put Perez there but not Alonso', ""And let's not forget who got them that 1 win \U0001f979\n\nAlso I'll never get over how Kmag got 2nd on his debut and then just proceeded to never get a podium ever again"", ""Shouldn't Lando be in both pictures? He participated in more races in those 11 years than any of the other guys included in the top picture"", 'This sort of post annoys me because it completely misses the point that F1 is a team sport.  The drivers are the most visible and have the responsibility to get it over the line, but  everyone involved in designing, building, running the car and team is collectively more important to be in a place to fight for wins.', ""The pic of Danny lol makes it seem like he wasn't the only driver to get them a win in 11 years lol"", 'Damn, I totally forgot Perez drove for McLaren !']",5342,100,0.98,5342,5708,5708,89,0,0.0,89
1kggqqp,"[Canal+] Colapinto set to replace Doohan, he is to be given a contract for the next 6 races.",https://www.reddit.com/r/formula1/comments/1kggqqp/canal_colapinto_set_to_replace_doohan_he_is_to_be/,2025-05-06, News,Source : [https://www.instagram.com/p/DJU5UIatG1B/](https://www.instagram.com/p/DJU5UIatG1B/),"['ANOTHER 6 race contract? \n\nLooks like Flavio will be driving the thing by Baku', 'Lewis: ""I\'ve joined the most chaotically run team in F1""\n\n\nPierre: ""Wanna swap?""', ""6 races? who's next lol"", 'I know it is coming, but Franco also getting 6 race contract himself is wild.\n\n\nDoohan really died for this.', ""OK I laughed out loud, if this is true that's the funniest option possible. They have what, four reserves? Go through the whole roster over a season, I dare you!\n\n\n[#mood](https://substackcdn.com/image/fetch/f_auto,q_auto:good,fl_progressive:steep/https%3A%2F%2Fbucketeer-e05bbc84-baa3-437e-9518-adb32be77984.s3.amazonaws.com%2Fpublic%2Fimages%2F611a840d-ac3e-43da-aa76-53a13c6e077b_704x448.gif)"", 'Alpine’s genuinely the funniest team in the world. Never a dull moment supporting them to be honest.\n\nAll you other fans are saying wow it’s so crazy that team orders are given blah blah. I’m here finding out that Pierre might be HR Lead, team principal, and beating a third rookie in 12 months after Silverstone.', '6 races per reserve driver to figure out who to keep for next year!', ""I can't get my head around Flavio being Jack's manager in this situation."", 'Reports saying Flavio has me next in line.']",3844,549,0.97,3844,18011,18011,61,6,-0.010000000000000009,61
1kgrqbq,I don’t think the Aussies are happy,https://www.reddit.com/r/formula1/comments/1kgrqbq/i_dont_think_the_aussies_are_happy/,2025-05-07, News,"This, all of this is amazing. ","['I really dont understand why teams do this, hire one of their junior drivers and dump them after a few races destroying their career.', ""I'm happy that Oscar left that shitshow of a team and is leading the WDC."", ""Speaking pure facts, Briatore has had great success in F1 but he shouldn't be allowed anywhere near the paddock let alone being a fucking team principal"", 'rightfully so? 5 races? diabolical is what this is!', 'News.com.au farms clickbait from reddit and Twitter.\nNot surprised to see tbh, their reporters are paid with robux.', 'Did they complain about the convicted criminal being his manager?', ""It's [News.com.au](http://News.com.au), an absolute clickbait rag, digital toilet paper."", 'Understandably, alpine have been a mess and oakes finally got them looking a little bit stable and pulling in the right direction, he probably got pushed out too by a criminal', ""I would really like to hear two peoples honest opinions on this. \n\nOne is Mark Webber (Aussie, honest and previously managed by Briatore) and the other is Michael Schumacher... who named his son after Jack's Dad and knew the full measure of Briatore.""]",3225,188,0.98,3225,170,170,609,17,0.0,609
1kgcst2,"Oliver Oakes has resigned as Alpine TP, his duties will now be handled by Flavio Briatore",https://www.reddit.com/r/formula1/comments/1kgcst2/oliver_oakes_has_resigned_as_alpine_tp_his_duties/,2025-05-06, News,,"['![gif](giphy|wmfcU5GfePQAg)', 'The bus Alpine are throwing everyone under is probably faster than their car...', ""I don't want to be rude but... was Oakes really the Team Principal this whole time? Did he really have full control over everything?\n\nAnd don't get me started on media appearances where half the world doesn't even know his face but everybody knows Briatore's.\n\nStill, whoa."", 'The gigantic bullet Piastri dodged, wow...', 'This whole brand is a joke lol', 'I work for a person very much like Flavio Briatore. They are cruel, vindictive, like to sow angst in the people around them because it makes them feel like they’re in control, they behave like the law is a vague set of guidelines, and that common decency is for the people beneath them. He had no right to be back in this sport, not after what he did.', 'I think Oakes was the one who wanted Doohan to stay longer, no? I bet that this was another thing that made him quit, not just the performance.', 'Oakes always felt like a placeholder TP while they reintroduced Flavio back into the paddock.', 'Alpine winning Singapore this year ?']",2809,496,0.99,2809,14090,14090,32,1,0.0,32
1kg6alr,FIA clears McLaren brake design after intensive investigation,https://www.reddit.com/r/formula1/comments/1kg6alr/fia_clears_mclaren_brake_design_after_intensive/,2025-05-06, News,,"[""I'm guessing that figuring out what that innovation is will be crucial for 2026 as well"", 'How long till the design leaks? Asking 44 a friend', ""> Sources have suggested that after McLaren secured a 1-2 in the Miami GP, a more thorough inspection of the braking system, ducts and drums was conducted by FIA personnel on Sunday night in a bid to finally put the matter to bed. \n\nJust seems like a genius solution that the other teams haven't got any idea how to replicate - I don't think there was any serious suggestion that it was illegal tbh. \n\nOne of my favourite parts about F1 is the technical expertise and innovation - you'd just get rid of that if every single that conferred a significant advantage on a car was made illegal. So it might not be the best for great racing between teams, but it's part and parcel of having engineering brilliance pushing the limits of what's possible imo"", ""So this solution helps them at tracks where overheating is an issue, like Miami.\n\n\nDoes this solution also help on high deg tracks or is there no obvious advantage in that regard?\xa0\n\n\nAlso would there be any downsides, like during qualifying or is this something that's a neutral thing at worst and helpful in all other cases?"", 'To think McLaren went from having the worst brakes a couple years ago to it being investigated to be too good. Maybe this innovation was the solution to their problems.', ""Of course the brake design is fine, it's the tyre water.\n\nhttps://preview.redd.it/1dtfuwjbg6ze1.jpeg?width=903&format=pjpg&auto=webp&s=d6695728eb4827631606d85e443d6d04eaaa9f34"", 'Will the remaining 18 drivers draw straws now to decide who will impale a front and rear brake each on his nose to deliver to the mechanics?', ""That's Green Light for other teams to come up with similar designs."", 'So McLaren\'s braking is going to be this season\'s ""Double Diffuser"" that everybody will have worked out by the end of the season?']",2547,263,0.98,2547,8325,8325,12,5,0.0,12
1kghds4,"Red Bull filming at my local petrol station, it was supposedly Lindblad.",https://www.reddit.com/r/formula1/comments/1kghds4/red_bull_filming_at_my_local_petrol_station_it/,2025-05-06, News,,"['I am rooting for his arrival in F1 ever since I heard his ducks radio [f2 instagram](https://www.instagram.com/formula2/reel/DHjhvmWKfJE/)', 'Tesco on the front wing lmao', 'Max is going in the Alpine in 6 races then.', ""He's ready, put him in VCARB /jk"", ""Bah God Jerry, that's Lindblad's music . He's cashing money in the bank for the 2nd RB seat at Backlash."", 'Maybe for one of those “Race Across [insert country]” videos that Red Bull put out on YouTube.', 'Given the crew’s performance so far this season they probably put diesel in it.', 'I love how it’s always the v8 ones doing promos. Kind of false advertisement for F1', 'They finally brought back refuelling']",2379,35,0.99,2379,525,525,88,1,0.0,88
1kgop0k,The convicted cheat at the middle of messy Doohan saga,https://www.reddit.com/r/formula1/comments/1kgop0k/the_convicted_cheat_at_the_middle_of_messy_doohan/,2025-05-07, News,,"['_That’s_ how you do a Briatore headline.', ""I love how articles go wild when it's the nation of the driver. As an Aussie, I got a good laugh. They aren't wrong."", ""> Assuming it's confirmed, Doohan's six races (and a career tally of seven) would make his the third-shortest F1 career (not including substitutes) this century.\n\n> And it would be barely his fault, set up on a path to failure by several decisions of a team in severe financial stress with a senior management as structurally stable as an igloo on Uluru.\n\nshots fired..."", 'Wow Piastri must be glad he’s at McLaren', 'Fair bit of salt here from Australian media… but I’m all for it', ""F1 isn't complete without a shady italian, and briatore specialises in that"", ""Searching 'Briatore' in the Epstein subreddit is a wild ride"", 'I want to be patriotic, but I think Doohan is better suited in Super Formula.', 'Classic cursed Enstone under De Meo ruling.\xa0\n\n\nRenault F1 was running at least decently under french and Abitboul management.\n\xa0Then in 2020 came De Meo at the head of Renault group. They fired Abitboul and some others, others quit. They rebranded the team as Alpine (a brand with no F1 history).\xa0\n\n\nThings start to go south from there ( Brivio, Rossi, Szafnauer, Famin interim, Alonso/Piastri saga, and finally... Briatore, the end of Renault F1 PU program, Oakes bringing Aaron and Briatore Colapinto as their champions and so on).\n\n\nDe Meo toying with his F1 team until the unavoidable end.']",2083,204,0.97,2083,169,169,235,5,0.0,235
1kgsydm,So we've just lost the youngest team principal of the grid (and his replacement will be the oldest one at 75 years old),https://www.reddit.com/r/formula1/comments/1kgsydm/so_weve_just_lost_the_youngest_team_principal_of/,2025-05-07, Statistics,,"['Horner was 31 when he was TP in 2005. Blimey', ""TIL about the existence of Alessandro Bravi. Proof nobody ever talks about Sauber and they're basically never on TV. I don't even remember seeing them during the Lego parade."", 'Friendly reminder that this is Horners 20th year as RB team principal.', 'Naming your kid mike when your surname is krack has to be child abuse', 'Mike Krack\n\nhehehehehe', ""Sauber's current TP is Jonathan Wheatley and Aston's current TP is Andy Cowell (they are 57 and 56 respectively)"", 'Stella is 53!? That man has good genetics and skincare.', ""Can't believe Komatsu is 48, he looks 35"", 'Records after records being broken lads']",1461,124,0.99,1461,116,116,545,24,0.0,545
1kgv671,Exclusive: Carlos Sainz Sr considering run for FIA president,https://www.reddit.com/r/formula1/comments/1kgv671/exclusive_carlos_sainz_sr_considering_run_for_fia/,2025-05-07, News,,"['He was an actual rally driver too!', ""I wouldn't get too carried away. The article only says that he's considering it, and to beat ben Sulayem, he needs to break ben Sulayem's wall of support -- most of which is built out of smaller national federations who don't really care much about motorsport."", 'Unrelated: Car 55 will now have ""random"" scrutineering checks after every session', 'As a WRC fan when he was around I kinda love this, get Luis Moya as his second in command', 'MBS: I was a rally driver. Sainz: hold my beer', ""Full support to him, but wouldn't there be some conflict of interest"", ""Wouldn't it be good to have someone like him in charge?\n\nSadly  doubt he has greased enough palms to make it worht the voting committee putting him in over MBS."", 'Money going into MBS ""President\'s fund"" has quadrupled', 'Drivers would actually want to take pictures with him']",3625,252,0.99,3625,233,233,3625,252,0.99,3625
1kg7pcq,Toto Wolff backs McLaren as Red Bull points fingers at F1 rival,https://www.reddit.com/r/formula1/comments/1kg7pcq/toto_wolff_backs_mclaren_as_red_bull_points/,2025-05-06, News,,"[""Merc having no doubt that it's legal makes me wonder if they have something in the pipeline, they aren't that far off and with the wing testing from Spain onwards who knows what the order could look like in the 2nd half."", 'I have a feeling Williams is having their version of this brakes as of now', ""Whatever Mclaren is doing is genius and I love out the box technology. I also think there's something dodgy about it, which makes it even more F1."", '[https://tenor.com/iurB6niVzGi.gif](https://tenor.com/iurB6niVzGi.gif)', ""FIA also wasn't able to outsmart Ferrari, they also consistently get outplayed on wing flexing, so I'm not convinced in their expertise that they can rule out anything.\n\nPlus with Mclaren as a customer team I don't see Toto being unbiased in this either."", ""Funny, brakes first and now tyre management.\xa0 What's next?"", 'I would rather see McLaren win than a team with people like Helmut Marko and Christian Horner.', 'I think that Mercedes have got a superstar in there team with Kimiwhether he can win a race this season we will have to wait and see but the future looks good for both him and Mercedes.', 'RB complaining? Color me surprised']",839,229,0.95,839,3825,3825,2,3,0.0,2
1kg93p1,Black vs Yellow T-Cam 2025 Championship: Standings after round 6 (Miami),https://www.reddit.com/r/formula1/comments/1kg93p1/black_vs_yellow_tcam_2025_championship_standings/,2025-05-06, Statistics,"Now, to answer common questions:

The T-cam is the camera on top of each driver's rollhoop. It is yellow for one car of each team and black for the other, to help differentiate each team's car.

Score is the head-to-head between the cars of each team, counting only the races each driver has done for each team (So in Red Bull is Verstappen on 99 vs Lawson (Australia and China) + Tsunoda (the rest of the races).","['Jesus Christ Yellow team.', 'Wow, black has exactly double the points of yellow.\xa0', 'Damn, so black is #1 driver on the team', 'A bigger beatdown than what McLaren are handing to the rest of the grid. Not a single yellow outscoring his black counterpart is one heck of a coincidence.', 'Total domination from team black tcam.', 'So basically, yellow = cursed', 'The real championship \n\n(Also wtf team yellow)', 'Stroll demolishing Alonso is funny to see.', ""stroll showing why he's the lead driver""]",738,91,0.96,738,2183,2183,9,1,0.0,9
1kglrq5,4 Team Principals in under 5 years for Alpine F1 team,https://www.reddit.com/r/formula1/comments/1kglrq5/4_team_principals_in_under_5_years_for_alpine_f1/,2025-05-07, Statistics,"Otmar's departure was announced on 28 July but his last day of work was 31 July 2023.

This should be more or less right I hope. Their questionable management style dosen't stop at team principals but also extends to their drivers and all other team members","['I’m pretty sure in 2021 Marcin Budowski was considered the team principal', 'Somehow less stable than the Red Bull second seat, which has had six drivers from the 2016 Spanish GP onward', ""You show this to someone in 2019 and they'll ask what you're smoking"", ""Otmar is the best one out of this list. Still remembered his story on how he paid the salaries of the Alpine F1 pit crew on some podcast. Wish he was back in F1 but I guess he's happy where he is now."", 'seems like Oli jumped before he was pushed', 'It’s getting shorter soon we will have the “team principal of the day” they will raffle it off', 'Lol pretty sure a lot of people called that Oakes hardly had any power with Briatore as ""advisor"". I don\'t think many are surprised by this development. \n\nHell of a farce that he was even allowed back on the grid to begin with, and now he is *officially* leading the team from top to bottom again, lmao.', 'That team principal grill the grid is now so funny in hindsight.\n\n""Make it to Spa"" really means the writing on the wall was there', 'In less than 2 years really, from May 7 2023-May 7 2025, they had 4 principals']",692,52,0.99,692,50,50,40,0,0.0,40
1kgsy67,"Max replying to a question asking about his previous comments on Oscar: Oscar is doing a great job, and I don't feel like you need to try and hide that. It's not a weakness... It's not going to change how I approach my race weekend anyway, right? You can hand out credits when it's due",https://www.reddit.com/r/formula1/comments/1kgsy67/max_replying_to_a_question_asking_about_his/,2025-05-07, Video,,"['Max: What I said is a factual description of events. No reason to speculate.', ""Source: [Max Verstappen on becoming a dad after the birth of his daughter: 'It's very special!' \U0001f979 | ESPN F1](https://www.youtube.com/watch?v=zoTdZ2pZeTk)\n\n---\n\nTranscript:\n\nQ: I was really impressed with the comments you made about Oscar two weeks ago, and the way he's handling being the leader in the standings. How important is it for you to let those young guys know how you feel about it?\n\nMax: No, I mean, I'm more about, you know, when people ask me questions and I want to answer it, I'm going to answer it in my own way. And I'm always honest and open and quite direct, I guess. But that's just how I am, you know. And I have a lot of respect for the young guys that also came into the sport, and Oscar is doing a great job, and I don't feel like you need to try and hide that. It's not a weakness. And also for me, like, it doesn't matter if you talk positive or negative about a guy, like, it's not going to change how I approach my race weekend anyway, right? But you know, you can hand out credits when it's due.\n\nQ: And as a young racer, you remember who was good to you when you were young, right? \n\nMax: Yeah. But you know, a lot of drivers that still are in the paddock or are around the paddock... I think it's nice. You know, when you build up a good relationship between the drivers."", ""It's amazing how they are so desperately trying to make Max out to be a guy who's playing some kind of mindgames. He just says what he thinks and means it, always has"", 'Did I stutter?', 'Media trying really hard', 'I admire how Max deals with the press. He’s not triggered by it, he controls it.', 'Whatever the issues anyone has with Max he is an inherently honest person, now will he say shit that we think is bs? Yes but thats because he probably believes it himself.', 'Max every single weekend : yes I said and I meant what I said. No reason to twist or speculate now can we please go back to racing.', 'It might be just me, but I would love to see Max and Oscar on the same team.', 'All right, time to hyper analyse this comment some more and speculate!']",850,52,0.98,850,49,49,391,24,0.010000000000000009,391
1kgr4f1,Alpine replace Jack Doohan with Franco Colapinto on five-race deal starting from Emilia Romagna GP [Sky News],https://www.reddit.com/r/formula1/comments/1kgr4f1/alpine_replace_jack_doohan_with_franco_colapinto/,2025-05-07, News,,"['Drive to survive (real life edition)', 'Was expecting the swap but not the outward admission of a five race deal… Aron could be driving by Silverstone', ""So let's say Colapinto has an unsatisfactory 5 races. Then what? Pivot back to Doohan? Continue on with Franco?\n\n\nI don't understand what Alpine/Flavio is thinking...."", 'Damn, reading the comments on IG, Colapinto’s fans are being absolute dicks to Doohan lol, I wonder how they’ll be if Colapinto fails to perform', 'Colapinto stepped in to replace sergeant in monza too, this guy has a knack for replacing drivers in Italian races.', ""Doohan wasn't setting the world on fire but this was always on the cards from the start. Do feel for him."", ""Hoping Franco does well. Despite his crashes, I felt he really kept up with Albon last season. My dislike for Flavio won't make me not want to see Franco succeed\xa0"", 'Doohan never got the chance to perform…what a shame.']",565,125,0.97,565,117,117,66,14,0.0,66
1kgrzi2,[Franco Colapinto on X] buen día,https://www.reddit.com/r/formula1/comments/1kgrzi2/franco_colapinto_on_x_buen_día/,2025-05-07, Social Media,,"['https://preview.redd.it/pl3rkjr9kbze1.jpeg?width=1178&format=pjpg&auto=webp&s=50532529cbed14a383310cf23c401a4ca79636a3\n\nSomehow, he managed to photobomb that too.', ""Doohan wasn't the best, but he got screwed."", 'Argentine fans are expecting him to channel the spirit of Fangio, no pressure Franco', 'Well he better hit the floor running now then, no pressure.', ""I guess I hope he does well cos I don't want to see anyone else get screwed.\n\n\nBut this Batsignal image implying he's some kind of superhero to save them does not ingratiate himself with me."", 'As if the race discussion threads arent toxic enough', ""Yeah that's a bit corny imo considering he is currently on a 5 race contract or something like that. If he doesn't hit the ground running like Verstappen he may as well be sacked too"", 'Corny asf', 'I have absolutely nothing against Colapinto but for how Doohan has been treated from the start, I hope this blows up in Alpines face like everything else they do.', ""Well Franco was an absolute treat to watch in the paddock last year so I don't expect much has changed lmao""]",598,86,0.9,598,79,79,168,20,0.010000000000000009,168
