unique_id,post_heading,post_url,publish_time,tag,post_content,top_comments,upvotes,comments,upvote_ratio,score,total_upvotes_comments,total_score_comments,upvotes_growth_rate,comments_growth_rate,upvote_ratio_growth_rate,score_growth_rate
1jgiafp,"Since the introduction of Sprints in 2021, only Red Bull (12), Mercedes (3) and McLaren (3) have won a Sprint Race. Will Ferrari finally win their first with Hamilton starting on pole for the sprint in China?",https://www.reddit.com/r/formula1/comments/1jgiafp/since_the_introduction_of_sprints_in_2021_only/,2025-03-21, Discussion,"Since 2021, neither Ferrari, Hamilton nor Leclerc have won a Sprint. Ferrari's best result was a double podium in Austria 2022, with Leclerc in P2 and Sainz in P3. 

Hamilton and Leclerc have both scored multiple podiums but have never ended on the top step in this format. This will be Hamilton's second time starting a Sprint from pole, after Britain 2021 (finished P2 behind Verstappen). Leclerc also has one Sprint pole to his name, in Azerbaijan 2023 (finished P2 behind Perez).

Sprint Races wins:

11 - Verstappen (Britain 2021. Imola, Austria 2022. Austria, Belgium, COTA, Brazil 2023. China, Miami, Austria, COTA 2024). 

2 - Bottas (Monza, Brazil 2021), Piastri (Qatar 2023 & 2024). 

1 - Russell (Brazil 2022), Perez (Azerbaijan 2023), Norris (Brazil 2024).

In your opinion, can the Scuderia do it, and if not this weekend, later on in the season?

[Reminder - 2025 Sprint Calendar: China, Miami, Belgium, USA (COTA), Brazil, Qatar] 
 
","[""Last year with the shorter DRS zone, I'd say pole position would make you the favorite. With the re-extended DRS zone, it will depend on the drive Lewis gets out of turn 13. If he can break the 1 sec barrier for a few laps until everyone goes into tire management mode, I'd say he has a great shot."", ""It's lights out and away we go, and Verstappen takes the lead into the first corner...."", ""i goddamn hope so, but being a realist i know they won't.\n\nit's Ferrari we're talking about. the source of my joy and sadness"", 'It’s a good question.\xa0\n\nUnfortunately I don’t think he will with Piastri coming through in that McLaren car. If Oscar has a clean race I think he will win.\xa0\n\nTheres also the matter of Max Verstappen who always has a good start. Tell me the last time Max had a bad start. (Btw I mean like reaction time so Abu Dhabi last year doenst count as bad).\xa0\n\nWith the nature of turn 1 in China I think that if Lewis doenst manage to cover Max off before the first turn, Max will dive into the lead and Lewis will have to choose between settling for second or trying to hang it around the outside knowing what happened to Lando in the sprint last year.\xa0\n\nAs for the other sprints this year, I’m going to predict Ferrari win a grand total of 0.', ""Oscar should be the favorite to win, but Lewis definitely has a shot, I'd love that for him"", ""Piastri is 3rd, I don't see how he can bottle this unless he has disastrous start or incident."", 'Piastri winning this. Ham and Max will fight and burn their tyres out too early. Piastri will become the second most successful sprint driver of all time!', 'Please! I need to hear him thank the crowd and guys and girls back at the factory again.', ""Hamilton got a good start in Melbourne till he was almost driven off by Leclerc, so that at least is less of a worry. Just remains to be seen what the car's race pace is like.""]",257,72,0.93,257,670,670,4,0,0.0,4
1jgzslh,Lawson overtake on Doohan,https://www.reddit.com/r/formula1/comments/1jgzslh/lawson_overtake_on_doohan/,2025-03-22, Video,,"['""More of a mugging than an overtake""', 'If gap, car - Lawson, 2025', 'Not really a good way of making yourself popular in the paddock if you overtake like that.', ""Lawson can't make contact twice in the same corner and get away with it. He did the same to Bortoleto."", 'When he said he was learning from Max he wasn’t kidding.', 'Why wasn’t that a penalty? It seems he literally pushed Doohan off track. He then did the same thing to Bortoleto.', '""Bonk""\n\n\\+1 place', 'Stop playing bumper cars with the back markers dude', ""That's how I overtake on the PS5"", 'Lawson makes a huge overtake to gain P14']",250,179,0.92,250,164,164,2,1,0.0,2
1jgx69t,Nico Hülkenberg must start from pit-lane due to suspension set-up changes,https://www.reddit.com/r/formula1/comments/1jgx69t/nico_hülkenberg_must_start_from_pitlane_due_to/,2025-03-22, Technical,,"[""Sprints are basically glorified practice for teams down the grid anyway so there's no real problem changing stuff now"", 'https://preview.redd.it/cz1btxmib5qe1.jpeg?width=1382&format=pjpg&auto=webp&s=d8b86455d273b5185dcfcdac3e37c347861b0767', 'Was P19 otherwise.', 'I’m here before he finishes ahead of Lawson', 'Race ruined.  Poor guy.', 'Does this count for the race or the sprint race? I would assume sprint race but the document just says ‘race’.', 'God fucking dammit\n\nThere goes my bingo', 'Lawson starting 19th, massive.', 'Things are looking up for Lawson already lol']",249,28,0.97,249,27,27,-1,0,0.0,-1
1jh3j3k,Oscar Piastri takes pole position for the 2025 Chinese Grand Prix,https://www.reddit.com/r/formula1/comments/1jh3j3k/oscar_piastri_takes_pole_position_for_the_2025/,2025-03-22, Video,,"['https://preview.redd.it/9ru6xita77qe1.jpeg?width=474&format=pjpg&auto=webp&s=6e841cb1455b7a6d5778466abf32055c54760df7', '""Just had a scream in my helmet... so I didn\'t burst your eardrums"" \n\nSo considerate from Oscar.', 'P1astri', 'INSANE third sector from the lad wow', 'Finally. It was about time he got pole on a proper race. Deserved.\n\nYellow sectors 1 and 2 and still improved. That must have been a monster of a sector 3.', 'COME ON OSCAR!!! \n\n1-3 BABY \n\nCOME ON!!!', 'Fantastic improvement from McLaren compared to the sprint. Also lol George just split them.', 'Oscar!!!', 'YESSSS!!!!!! OSCARRRR!!!!!\n\nBeautiful!!!', 'Finally! Papaya on top!']",248,47,0.97,248,44,44,5,0,0.0,5
1jgk15l,Lewis Hamilton's Sprint Pole Lap Onboard - 2025 Chinese Grand Prix,https://www.reddit.com/r/formula1/comments/1jgk15l/lewis_hamiltons_sprint_pole_lap_onboard_2025/,2025-03-21, Video,,"['The way he was easing that car with guided force from apex to apex was simply lovely.', 'I’ve been watching his onboard during practice and quali the past two weeks and it’s a night and day difference between Australia and China. I don’t think he got a single clean lap in at Melbourne (maybe a bit of a hyperbole). Whereas most laps at Shanghai have looked good except for braking too deep into the hairpin at the end of the long back straight.', 'Halfway thru the first corner that car looked dialed the fuck in.', 'I wonder what ""San Diego"" means. Because p1 is the ""Anchor Man""?', 'Seeing Lewis in Red is still so odd to me IDK why. But amazing lap!', ""Such a beautiful lap can't get over it just looks so nice to drive"", '🥲 this is what we were all hoping for! Let’s just pretend Melbourne never happened', 'I haven’t seen Hamilton that smooth on a qualifying lap since 2021 Abu Dhabi', 'If thats a mercedes of the past few years that bump in the middle of 1/2 would have sent him back to melbourne', ""Hamilton finds time, it's astounding.""]",232,35,0.92,232,493,493,-1,0,0.0,-1
1jh2b35,Drivers' Championship after Sprint,https://www.reddit.com/r/formula1/comments/1jh2b35/drivers_championship_after_sprint/,2025-03-22, Statistics,,"['Russell dark horse for WDC.', 'Kimi 4th 😭😭🙏🏽', 'Stroll above Leclerc, as is to be expected', 'How is Max 2 points behind in a shopping trolley', 'Max is the best driver.. no question about that. always MAXimises what he has', ""Crazy how Verstappen is competing for the WDC with what's looking like the 4th best car."", 'Albon is currently higher in the WDC than he finished at Red Bull.\n\nI don’t think it’ll hold, but surely with his performances at Williams to date, he’s earned himself a long-term seat, yeah? TommoF1 must be pleased.', 'Max is going to drag that tractor to another championship isnt he', 'Aston Martin would be so great if they could find a 2nd driver SMDH. \n\n  \n/s']",235,52,0.99,235,50,50,5,1,0.0,5
1jh3vlu,"Lando when asked if the car is tricky to drive: “I've said that plenty of times, it is. It's still quick enough. we never doubted it was the quickest car, it can just be a bit feisty at times. Today it’s not so much that, it was just mistakes from my side that’s all”",https://www.reddit.com/r/formula1/comments/1jh3vlu/lando_when_asked_if_the_car_is_tricky_to_drive/,2025-03-22, Video,,"['It was big for Oscar to finally get his first pole after trailing Lando for the majority of their quali sessions so far. Great bounce back from last weekend and hopefully this willl be the start of a great championship battle.', 'i have a brilliant idea, let’s put lando in the red bull!', 'People were hating on him for saying that the car is a bit difficult to drive. But it can be tricky AND fast these are not mutually exclusive things 😭', 'He learned to answer what the fans want to hear', 'Bro needs to lock the fuck in for tomorrow. Hope the setup changes have helped', ""he also said that he's obviously disappointed not being on pole but oscar deserved it and he looks genuinely happy for him"", 'Watch him still get hate for this comment lol', 'Watch people hop in and jump him up for a mere statement', 'Lando can win tomorrow, hopefully he learned how to not start a race today.\n\nThe track looks tricky to overtake but I expect him to clear George and challenge for the win. Let’s see how Oscar behaves tomorrow, tyre management seems to be key', ""I think Lando is fast and might be faster than Oscar at the moment but he's a bit lacking in his mentality and toughness. I think he's also affected too much by outside comments about him. He should just focus on his driving and prove everything on the track.""]",243,64,0.92,243,60,60,26,1,0.0,26
1jgjm7m,"Sainz admits he's ""still not feeling at home"" in Williams",https://www.reddit.com/r/formula1/comments/1jgjm7m/sainz_admits_hes_still_not_feeling_at_home_in/,2025-03-21, News,,"[""Idk how much of an admission this is. It was obvious he wasn't comfortable when he started his crusade against the simulators and wanted more testing after the Bahrain test."", 'Well yeah no shit, whose expecting the newest employee to immediately fit in?', 'Still\n\nAfter one whole complete weekend? \n\nCrazy. \n\ns', 'My guy is washed 😔\n\nNah, it’s most likely like 2022, he just needs 4-5 races to properly get used to the car. Just with less pressure and expectations.', 'I am actually very curious as to how this albon vs sainz battle is going to go. The outcome could raise some interesting questions.', 'Understandable. His home is Spain with similar climate to Italy.\n\nBritain on the other hand does not have a similar climate to Italy.\xa0', 'He said he still wasn’t comfortable in the CAR. This headline is a bit misleading.', 'I’m curious to see what kind of performance he’ll show. Since he has just transferred teams, his results aren’t a serious issue yet. However, if he continues to underperform compared to Albon—or worse, lose to him—he won’t be called up to the top-tier teams he’s aiming for. \n\nAs we’ve seen with Checo, a decline in form can happen at any time, no matter how well someone has done in the past. He’s not exactly young anymore, and in an environment where younger drivers are breaking through, he needs to get it together and prove his skills without fail.', ""Have yet to see him demolish Albon as we've been foretold.""]",221,97,0.95,221,1386,1386,3,0,0.0,3
1jh4dkz,Lando and Oscar after the Chinese GP Qualifying,https://www.reddit.com/r/formula1/comments/1jh4dkz/lando_and_oscar_after_the_chinese_gp_qualifying/,2025-03-22, Video,,"['DTS; Norris clearly is provoking agression by keeping eye contact and showing teeth as is with most primates.', 'u/FailedAccessMemory told me Lando was sulking 🤔', 'they clearly despise each other', 'https://preview.redd.it/7s4wm1ari7qe1.jpeg?width=1169&format=pjpg&auto=webp&s=964df0315b55d2871ce3da199e840a285c66f901\n\n/j obviously', 'Norris genuinely looks happy for Piastri. How can you hate the guy', 'bro is cheesing😭🧡 so glad to see oscar get his first pole and lando bounce back from his sprint mood', 'Giggling hopefully about how they’ll gap the field by 30+ seconds on Sunday.', ""Everyone is all like it's going to be Hamilton and Rosberg v2, but it's more like Tom and Jerry. A bit of squabbling, then cuddles!"", ""He's doing a bit of Landsplaining"", 'Somehow DTS will make it look like the most vile team mate battle of all times']",230,55,0.95,230,53,53,31,4,0.0,31
1jh34qd,(F1) Out in Q1,https://www.reddit.com/r/formula1/comments/1jh34qd/f1_out_in_q1/,2025-03-22, News,,"['Lawson is a dead man driving', ""How do Alpine regress so badly. They had a decent car at the end of last year and Gasly was getting fantastic results in it. Seems like it's back to being a shitbox."", 'Meanwhile Yuki and Isack on VCARB 2nd and 3rd respectively.', 'Checo instagram has Liam comments all over it', 'Worse than Sauber and Haas lolol', 'they done my boy Bortoleto dirty, bro couldn’t open the last lap', 'So Checo was just a symptom and not the problem?', 'Another Liam Law20n banger.', 'Checo is Liam father']",211,38,0.97,211,35,35,3,0,0.0,3
1jh0fti,Chinese GP Sprint Race: Average Driver Pace. Strong performance by Hamilton and Piastri,https://www.reddit.com/r/formula1/comments/1jh0fti/chinese_gp_sprint_race_average_driver_pace_strong/,2025-03-22, Statistics,,"['S T R O L L 1 8', 'Sains race pace: 😃\nHe made a pit stop: 💀', 'https://preview.redd.it/4nvgryyh76qe1.png?width=1840&format=png&auto=webp&s=9fe3352788354bd4bb8fa1caafc6ea5d497137f9\n\nTeam Average Pace comps highlighted here as well!', ""Yuki best of the rest I'm loving it."", 'Disappointed in Doohan, looked decent in quali and hope he learns what went wrong in the race', ""> Antonelli: Dirty air played an important role today, it's good learning to take.\n\nThis kid is going places."", 'Chat are we back?', ""I think Piastri's tyres were done by the time he passed Verstappen. Would be interesting to see how he would have gone against Hamilton if he was in second instead of third after the first lap."", 'Clean air is king, but Ferrari have definitely unlocked a level of aero efficiency here. Qualifying has never been more important for McLaren']",210,57,0.96,210,56,56,4,0,0.0,4
1jh2aql,Jack Doohan handed 10-second penalty after Turn 14 collision with Bortoleto in Sprint,https://www.reddit.com/r/formula1/comments/1jh2aql/jack_doohan_handed_10second_penalty_after_turn_14/,2025-03-22, News,,"['Flavio: Well, Colapinto time!', '**Decision:**\n\n* 10\xa0second\xa0time\xa0penalty\xa0imposed\xa0after\xa0the\xa0Sprint.\n* 2\xa0penalty\xa0points\xa0(total\xa0of\xa02\xa0for\xa0the\xa012\xa0month\xa0period).\n\n[https://www.fia.com/system/files/decision-document/2025\\_chinese\\_grand\\_prix\\_-\\_infringement\\_-\\_car\\_7\\_-\\_incident\\_with\\_car\\_5.pdf](https://www.fia.com/system/files/decision-document/2025_chinese_grand_prix_-_infringement_-_car_7_-_incident_with_car_5.pdf)', '![gif](giphy|oaZk0WNSO7fXi)', 'Thats a bit harsh', ""Lawson did the same thing twice and didn't even get a penalty. Seems like the result matters more than the action itself."", ""Damn, one of the stewards was Pedro Lamy. Glad to see he's still kicking around."", ""Oh that's harsh"", 'Saving my bingo card for the weekend 🥳', ""Flavio can already smell Colapinto's bag of money. 4 more race and it's going to be his.""]",208,35,0.99,208,32,32,9,-1,0.0,9
1jghkb9,Ferrari backing? F1's V10 engine return gathers momentum,https://www.reddit.com/r/formula1/comments/1jghkb9/ferrari_backing_f1s_v10_engine_return_gathers/,2025-03-21, News,,"['Crazy that this is being considered after a several year run up to new regs\n\nIf it did happen I presume we’d stick on these regs for 2 more seasons or something then swap in 28 or so', 'This is gaining too much traction for it to simply be tabloid news articles trying to get clicks. I think there is a lot of talk going on in the background however I think it is still extremely unlikely to cancel 2026 regs.\xa0', 'ditching 2026 regs is an insane idea\n\nit would would completely screw over Audi and RBPT-ford because Ford is reported to bring expertise in the electrical unit\n\nnot to mention the billions of dollars already spent in developing those engines', ""They don't really have to ditch the entire hybrid thing, just the turbos.\n\nLook at Cadillac in WEC."", 'The guys from the Bring Back V10s podcast: 🥳', ""> From Mercedes' perspective, while it is not against an earlier reintroduction of V10s in principle, there is no way it can change plans for next year. So a V10 move could only come in 2029 or 2030 at the earliest.\n\nThere are 3 manufacturers that are against ditching the planned 2026-2030 ruleset:  Honda, Audi and Merc. But it looks like 2030 onwards could be a good time for V10s to come back with sustainable fuels. \n\nDefinitely a bit more than a pipe dream now!"", 'going back to v10’s is the dream, but all this tells me is that the next set of engines ARE TERRIBLE 😂', 'The key is that they need to be able to rev past 15000rpm. It was the pitch frequency of the noise that made the 2000s cars sound great. A 8000 rpm v10 sounds will sound worse than the current engines', 'Just an excuse to cart out the F2004 in a modern aero frock.']",203,79,0.89,203,902,902,1,0,0.0,1
1jh06ig,Doohan incident with Bortoleto.,https://www.reddit.com/r/formula1/comments/1jh06ig/doohan_incident_with_bortoleto/,2025-03-22, Video,,"['I control your every millimeter.', 'This is just silly. \xa0Last lap, pointless overtake, punts himself into p20', 'How Carlos caught them after pitting? That shows you how slow everybody was running because of the tires. And Carlos was at normal pace', 'Clumsy move', ""It's an exciting incident for Argentines."", 'That was clumsy.', '**Alex**: *Doohan just divebombed, what he doing?*', 'Carlos was scrambling for crumbs', 'I know he lost some front wing but did Hulk let Gabriel finish ahead of him because it looks like from the replays he gets past the incident before Bortoleto corrects the car?', 'Bro thought he was Liam Lawson']",195,59,0.95,195,56,56,-1,0,0.0,-1
1jh326h,[Q1] Gasly sneaks past Lawson in the queue to start their final hot lap,https://www.reddit.com/r/formula1/comments/1jh326h/q1_gasly_sneaks_past_lawson_in_the_queue_to_start/,2025-03-22, Video,,"['They’re all smelling blood.', 'Gasly ""Enjoying that Red Bull second seat?""', 'I thought he wasn’t there to make friends?', ""Pierre says if I'm going out in Q1, I'm taking you out with me Liam lmaooo"", ""well to be fair its a gentleman's agreement with the drivers not to do that but by this time next week will lawson be a driver?"", 'Lawson absolutely dawdling there, Gasly was practically parked before he overtook', 'Gasly’s been caught before with someone dawdling in front of him meaning he doesn’t make the line. \n\nSeeeee ya Liam', 'They swallow Liam whole atm.', ""F1Twt's been having a field day with his interviews and radios.\n\nThis would feed them for the next month lol"", ""Lawson can't take what he dishes out.""]",195,67,0.98,195,60,60,9,1,0.0,9
1jgztpb,Race pace* Sprint China 2025,https://www.reddit.com/r/formula1/comments/1jgztpb/race_pace_sprint_china_2025/,2025-03-22, Statistics,\*API doesn't have first 2-3 laps and last lap for some. ,"[""AM have a good car this week. Having nearly the same race pace as the Vcarb's while nursing an issue"", 'First lap was clutch from Lewis. Solidified it. That angle in the box and the jump off the start got him the line on the corner and then clean air. Perfect', 'tf happened to Norris', ""Crazy to think that if Antonelli hadn't had Yuki's DRS the entire race. Stroll would have passed a Mercedes."", 'Lance having a great start of the season', 'Raw : [https://rakesh-i.github.io/stint-data/](https://rakesh-i.github.io/stint-data/)\n\nimgur : [https://imgur.com/a/bbfx9oG](https://imgur.com/a/bbfx9oG)\n\nbox chart sorted by median.', 'Pretty tidy sprint by lance. Good to see', 'Somehow Sainz pitted in a sprint and not end up last is an achievement itself', '1 whole second per lap slower for Lando compared to Oscar. That was tough to watch.']",171,58,0.96,171,57,57,-4,1,0.0,-4
1jgzjka,2025 Chinese Grand Prix - Post-Sprint Discussion,https://www.reddit.com/r/formula1/comments/1jgzjka/2025_chinese_grand_prix_postsprint_discussion/,2025-03-22, Post-Sprint,"# ROUND 2 - CHINA

FORMULA 1 HEINEKEN CHINESE GRAND PRIX 2025

# 🕒 SESSION TIMES

|Day|Session|Time (UTC)|
|:-|:-|:-|
|FRI|Free Practice 1|03:30|
|FRI|Sprint Qualifying|07:30|
|SAT|Sprint|03:00|
|SAT|Qualifying|07:00|
|SUN|Race|07:00|

[Click here for start times in your area](http://f1calendar.com/)

# 🏁 RACE INFORMATION

* **Track**: Shanghai International Circuit
* **Location**: Shanghai, China
* **Race laps**: 56
* **Lap length**: 5.451km
* **Race distance**: 305.066km
* **Lap Record**: 1:32.238, Michael Schumacher (Ferrari), 2004

# ⏪ LAST TIME AROUND

* **Pole position**: 1:33.660, Max Verstappen (Red Bull Racing)
* **Race winner**: Max Verstappen (Red Bull Racing)
* **Fastest lap**: 1:37.810, Fernando Alonso (Aston Martin)

# 📺 WHERE TO WATCH?

F1 is broadcast on F1TV and through several local broadcasters. [Click here](https://www.formula1.com/en/toolbar/content_schedule.html) to find out of F1TV is offered in your region. [Click here](https://www.formula1.com/en/toolbar/broadcast-information.html) to go to the full list of broadcasters. Streams and downloads are not welcome on r/Formula1. Requesting and sharing streams and/or downloads will be met with immediate bans.

# ❤️ GOOD CAUSES

* 🇺🇦 [Want to support Ukraine? Here's a list of charities.](https://www.reddit.com/r/ukraine/comments/s6g5un/want_to_support_ukraine_heres_a_list_of_charities/?utm_source=reddit&utm_medium=usertext&utm_name=ukraine&utm_content=t3_t5okbs)
* 🏳️‍🌈 [Support Stonewall to help improve the lives of LGBTQ+ people.](https://donorbox.org/support-stonewall)","['Unlike last week, I did not pass out this time and posted the post-sprint thread in time. Please clap', 'https://preview.redd.it/60u28oj8w5qe1.jpeg?width=3072&format=pjpg&auto=webp&s=7351daf60fc17582f93c1c4b68675bedd75c7c3b\n\nSpotted on TV', 'Ah fuck guess I’m fully strapped into the Ferrari rollercoaster now', 'Ferrari are sooo good when they have no opportunity to mess up the strategy.', 'https://preview.redd.it/9z85wzwmv5qe1.jpeg?width=1001&format=pjpg&auto=webp&s=457cd4a162c4167e6c1b7390f6cb2321f3947224\n\nAmazing.', 'They fucking love Lewis, woah. What a wonderful feeling that must be.', ""No Zac Brown? No Christian Horner? Lots of Fred Vasseur? That's what I like to see"", 'Yuki had a great race', 'Dude won by 7 sec In a sprint lol', 'https://preview.redd.it/rpjqseahw5qe1.png?width=1080&format=png&auto=webp&s=ba2123ceca96773ef5654070d554f38c0da85b6a']",171,1371,0.94,171,496,496,3,1,0.0,3
1jh39x8,"Sainz, Stroll, Alonso, Hülkenberg and Ocon are out in Q2",https://www.reddit.com/r/formula1/comments/1jh39x8/sainz_stroll_alonso_hülkenberg_and_ocon_are_out/,2025-03-22, Video,,"['Hadjar and Tsunoda again. Amazing job from them. I want what they eat', 'Hulk is truly the shitbox whisperer, P12 is hella impressive in that thing', 'What is in that VCARB?', 'Much better qualy showing from Hulk this time', 'Great work by Albon!', 'Albon doing it again, incredible.', '3/4 Red Bulls in top 5, hmm', ""ALBON BELIEVERS WHERE Y'ALL AT 🗣️🗣️🗣️"", 'hadjar and tsunoda are flying', 'You know what credit to Ocon for nearly getting Q3 in a HAAS!']",162,109,0.97,162,104,104,1,0,0.0,1
1jh6ks0,George annoying Lando in the media pen post qualifying,https://www.reddit.com/r/formula1/comments/1jh6ks0/george_annoying_lando_in_the_media_pen_post/,2025-03-22, Video,,"['The Intrusive thoughts overwhelmed Russell.', 'They touched, Martin, they touched.\xa0', 'Sounds like George has a meeting with HR now lol!', '>**george**: i’m trying to make you smile mate\n\n>**lando:** did you just go to the toilet?! you better have washed your hands that’s grim.. jesus!! i need some disinfectant\n\n>**george:** sorry mate that was pretty disgusting i do apologize\n\n>**lando**: im reporting you to HR\n\nfrom user ln4norris\n\nfor ppl on pc right click and click show all controls to hear audio, had to reupload cause i feel like the first one made both drivers look bad lol', 'I feel like Russell is on a personal mission to fuck with McLaren and Norris just in case he finds himself in a title fight with them.', 'Russel awaiting his usual P3 finish with zero screentime.', 'George is the kind of guy that laughs the hardest over his own jokes', ""That's non consensual, MBS rubbing his hands in giving George a $500,000,000 fine."", 'Blimey…', 'Sometimes you just gotta harass your buddy. It’s on the rulebook.']",193,55,0.94,193,51,51,87,21,-0.020000000000000018,87
