unique_id,post_heading,post_url,publish_time,tag,post_content,top_comments,upvotes,comments,upvote_ratio,score,total_upvotes_comments,total_score_comments,upvotes_growth_rate,comments_growth_rate,upvote_ratio_growth_rate,score_growth_rate
1jsnsn6,[VCARB via IG] First points in F1 for Isack . A strong drive from LL30 in his first weekend in the VCARB 02,https://www.reddit.com/r/formula1/comments/1jsnsn6/vcarb_via_ig_first_points_in_f1_for_isack_a/,2025-04-06, Social Media,,"['Absolutely solid drive from Hadjar. I think he’s blown away everyones expectations this season so far', ""So happy the strategy didn't fuck Hadjar up, good job!"", 'Really encouraging drive by Hadjar. Huge confidence boost to pull off a points finish.', 'I mean Lawson did finish above his average....', 'Hadjar and Kimi are going to be greats.', 'Strong drive is certainly a way to put it', ""I mean yea, Lawson wasn't fast but what the hell was this strategy? - Why did he have to be undercut by that many cars? \n\nYou could maybe explain the ones in Australia and China with a failed strategy, but here you can't even make a point for it to make sense at their position"", 'Great job from Isack. Bright future', 'Fantastic weekend for Hadjar. Looking like a real talent.', ""I'm turning into a Hadjar fan after completely disliking the guy in F2.""]",664,188,0.99,664,179,179,25,4,0.0,25
1jsr00i,[Redbullracing] the calm before the chaos,https://www.reddit.com/r/formula1/comments/1jsr00i/redbullracing_the_calm_before_the_chaos/,2025-04-06, Social Media,,"['I would have loved it if RBR let one of the HRC/Honda guys get the constructors trophy, as that would be an amazing send off.', ""Curious. Does red bull supply versions with water within the red bull cans? It's very on brand everyone holding the energy drink. I'm just curious if it's really red bull inside?\n\n\nI like energy drink as much as the next guy though sometimes can't have it all day, if you want to sleep. 😅"", 'Yuki had a decent outing till his mistake in Q2.\n\nHe will come back stronger!!', 'Yuki and Christian 😂', 'At least Yuki had a celebration like this! I don’t think he ever had this', 'Well atleast yuki brought some good luck charm to the team haha', 'Honda, The Power of Dreams.', 'Foreshadowing\xa0', 'Curious. Where do you reckon Checo would have finished today, if he was allowed to stay?', 'Man Yuki looks hyped af xD']",668,46,0.96,668,46,46,125,5,0.0,125
1jsntc1,[Haas via IG] Ollie picks up a point! Our Brit holds his ground and secures his second top 10 finish of the season,https://www.reddit.com/r/formula1/comments/1jsntc1/haas_via_ig_ollie_picks_up_a_point_our_brit_holds/,2025-04-06, Social Media,[https://www.instagram.com/p/DIGFPv\_seEW/](https://www.instagram.com/p/DIGFPv_seEW/),"['This kid is legit.', 'https://preview.redd.it/1iu0kidms5te1.jpeg?width=392&format=pjpg&auto=webp&s=3acfc21fd97f992d5f903f20ac6d24188c05b1e1', 'Points again...Ciao', 'Proper proper talent, further evidence that F2 is not fit for purpose', 'Congrats Ollie 👏🏼 🎉🌸', 'Love this graphic', ""Really solid race.\n\nGot a bit lucky / unlucky at the start, as had a mega start, but went for the gap between Hamilton / Albon which was quickly closed, meaning he had to back out - Might have got them both had he focused on the outside.\n\nTyres seemingly fell off towards the end, as he really dropped off Albon, but again I think he was focusing on ensuring that he didn't lose out to Alonso rather than keeping up for the sake of it."", ""Good on him. This is exactly what a quality rookie season needs a memorable stand out performance. Sprinkle in another here and there with a mostly clean season and he'll be on his way up"", ""He's a solid driver, glad he's in F1."", ""Can't really complain about walking away with a point after the season's start. It's a shame Ocon couldn't make the car work this weekend.""]",553,40,0.98,553,37,37,20,1,0.010000000000000009,20
1jsplas,"Carlos Sainz is fined €20,000 of which €10,000 is suspended for a period of 12 months, for being late to the national anthem",https://www.reddit.com/r/formula1/comments/1jsplas/carlos_sainz_is_fined_20000_of_which_10000_is/,2025-04-06, News,,"['As a doctor myself this is ridiculous. He even had an official F1-partnered doctor vouching for him but apparently he needed to ""consider every eventuality"" in planning which means I guess the FIA wants him to be able to turn off his symptoms and just bear with it for a 2 hour race instead of getting medical care. The way the FIA has shown time and again it wants drivers to prioritise PR instead of their own health in every aspect continues to disgust me.', 'Why is the fine for this 20x higher than the one he got for speeding in the pitlane which could be a safety issue??', ""Carlos became the gpda director and now he's the no.1 enemy of fia"", ""Fuck me that's ridiculous."", 'So he had the shits and it cost him 10 grand? Seems totally fair…', 'Not a great week for Carlos', ""That's crazy amount for such petty issue tbh"", 'Bro got fined for pooping💀', ""I will never not be astounded by the insanity of some of these fines. It's also just funny to me that speeding in the pitlane is like €100 and being late or even worse saying a bad word leads to €10.000+ types of fines.""]",567,106,0.99,567,102,102,136,9,0.0,136
1jsqx4n,"There won't be much talk about what Bearman did, but he really raced well this entire weekend.",https://www.reddit.com/r/formula1/comments/1jsqx4n/there_wont_be_much_talk_about_what_bearman_did/,2025-04-06, Discussion,"Beat his teammate very handily, handled the new spec extremely well, got to Q3 and held his ground in the midpack to bring home a point for Haas.  Considering that Haas isn't the fastest car and no one ahead of him really made any mistakes to capitalize on, Bearman had his work cut out for him to save his point, and he did.

In a race where there just wasn't a lot of overtaking, that qualifying effort on Saturday was massive.  Put him in a position where all he really had to do on Sunday was hold serve, and he accomplished that despite some cars behind him that were faster on paper.

Super proud of Ollie for the work he put in and the result he accomplished.  It's only 1 point, but it's the only point Haas managed this weekend and the fight in the midpack should be pretty intense, so that 1 point may really matter at the end of the year.  

Either way, it shows that the kid is learning.  Last year he needed other drivers around him to make big mistakes in order to steal points for Haas.  The reason this is significant is no one really made any mistakes at all, or at least no big ones, and he was still able to hang with the big boys, defend his place and look completely comfortable winning points in Formula 1.    Well done kid.","['https://preview.redd.it/sy327yr0z6te1.png?width=1080&format=png&auto=webp&s=50f88480e4df43c2caa6047f7a57283ab5ae5b1e', 'Can all the naysayers finally admit that Prema was shit last year and Kimi and Bearman deserved the promotion?', 'Even as one of the leading voices on the Bearman hype trail, I didn’t expect him to come in and match the vastly more experienced and solid Ocon immediately, but that’s exactly what he’s done', 'He’s the dark horse of these rookies in my opinion. I think Ferrari actually knew what they were doing when they signed him. He could be devastatingly good by about 2027/28', 'I never understood why people doubted him even after his stint at Jeddah last year.\n\nGot a late call by Ferrari, got only FP3, qualified P11 and finished P7 at...Jeddah. Not Austria, not Spain, not any other easier/familiar track. Dude is the real deal.', 'in 2 years he will drive for Ferrari', 'Of the six full season rookies. We have seen Bearman do well. Boroletto have a difficult race but show promise. Antonelli doing really well. Hadjar doing exceptionally well. Doohan very middling. Alonso some great racing.', ""Bro literally out qualified hulkenberg who's known to be a qualy king."", 'Bet he sold quite a few iRacing subscriptions this week.']",537,58,0.96,537,56,56,153,13,0.010000000000000009,153
1jsnxjb,Rookie Championship after Japan,https://www.reddit.com/r/formula1/comments/1jsnxjb/rookie_championship_after_japan/,2025-04-06, Statistics,Removed Alonso because the mods removed after China because Alonso was in it.,"['bearman has been super impressive', 'Hadjar absolutely delivering. I am really excited for his future', ""Bearman is going to be an absolute beast in a Ferrari\n\nIf he doesn't get snapped up elsewhere first tbh"", 'Bearman + Antonelli are brilliant, I bet if they’d been in the same team in F2 they’d have been unstoppable… right?', 'I wanna see Hadjar in a faster car. He’s got pace.', 'Amazing what happens when VCARB has an actual strategy', 'Bearman is making Ocon look bad. He haas really surprised me this year', ""Prema had the best lineup last season but they didn't had the car for it"", 'Haas ahead of the VCARB. Impressive!']",496,117,0.94,496,108,108,12,1,0.0,12
1jsns76,WDC and WCC changes after Suzuka,https://www.reddit.com/r/formula1/comments/1jsns76/wdc_and_wcc_changes_after_suzuka/,2025-04-06, Statistics,,"['Max 61\nRedBull 61', 'Red bull racing = Verstappen Racing.com', '1 point\n\nWe might actually have a battle on our hands', 'Maybe if Ferrari tries really hard they can match Verstappen for constructors.', ""Max just needs Red Bull's first Europe upgrade to work and he's right in it.\n\nHe's clearly so much better even in a worse car. Especialy since Mclaren still can't help themself with their calls."", 'McLaren threw this race by pitting Lando at the same time as Max', 'Awwww Williams dropped down.', 'What a shitshow again for Ferrari. \n\nVerstappen Racing delivered once again', 'Max is gonna win it with 100% of team points']",447,89,0.98,447,83,83,18,4,0.0,18
1jsqdwr,"[Alex Albon via IG] 3 for 3 in the points. Thank you very much, Japan! Another amazing result, big effort @WilliamsRacing!",https://www.reddit.com/r/formula1/comments/1jsqdwr/alex_albon_via_ig_3_for_3_in_the_points_thank_you/,2025-04-06, Social Media,,"['Never heard him so angry on the radio before, anyone know what they did to piss him off so much?', ""All's well that ends well 💙"", 'HE BROKE THE JAPAN CURSE! NO DNF!', "" I genuinly think that this season he'll average better results in the Williams then what he had in 2020 in the RedBull..."", 'In James we trust. 2024 was a blip, but their off-season pain was always going to pay off in the long run. Williams is showing some upward mobility for the first time in ages.', ""Gotta say I'm impressed with Alex. Thought Sainz would show him there are levels to this, am intrigued to be proven wrong so far."", 'The Sainz hype\n\nhttps://preview.redd.it/suc9d2qoe7te1.jpeg?width=489&format=pjpg&auto=webp&s=893d30ab3d374e77c4427505c03ec93e8671223e', ""Can someone tell me why he was angry in the radio didn't see the full race"", 'lol angry alex was something to behold.', 'He needs to chill on the radio a bit']",439,51,0.98,439,49,49,64,4,-0.010000000000000009,64
1jsnyx0,Japanese GP Cooldown Room,https://www.reddit.com/r/formula1/comments/1jsnyx0/japanese_gp_cooldown_room/,2025-04-06, Video,,"['"" That\'s all the highlights?"" - Oscar is us', 'Comfy chairs, good mic quality….is the Suzuka cooldown room the GOAT?', 'Lmao Oscar', 'Piastri: «Was that all the highlights?»', 'One expensive lawnmower', 'Oscar said what we were all thinking out loud', 'Max’s podcasts are always more talkative than the other pods, even after the most boring race.', 'Oscar on the money - ""nothing happened.""', 'The Race: Verstappen labels McLaren an expensive lawnmower', 'Oscar calling it how it is. Love it.']",420,72,0.98,420,72,72,17,0,0.0,17
1js9ay2,Japanese Grand Prix qualifying time comparison between Max Verstappen and Lando Norris,https://www.reddit.com/r/formula1/comments/1js9ay2/japanese_grand_prix_qualifying_time_comparison/,2025-04-05, Video,Source: https://www.instagram.com/reel/DIEOZVPiAZq/,"['THAT last Chicane\n\n![gif](giphy|ckB5razpgN2rd4qTfe)', ""Such a fun and interesting lap. This is why qualifying is so fucking cool and honestly I actually prefer it to the race on several tracks, including this one.\n\nIn a race, going as hot into the final chicane as Max did would be a terrible strategy because you can see how compromised the exit is and how much quicker the McLaren was coming down the straight even with less overall straight line speed than Max's red bull has this weekend...but it was literally perfect with the context of exactly where the finish line is.\n\nGod tier lap, absolutely elite track awareness, a legend of the sport for a good reason."", 'damn they finished inside each other whoa', 'So max set a new track record - would Lando’s lap have been a new lap record on its own? Or did max beat it by less than 0.012?', 'No real life ghosting vid like with Ham?\n\nF1 going backwards with technology again?', 'Insane car control.', ""That's hella cool"", ""McLaren has the edge on the straight, but Max is better at attacking fast corners as seen in Lusail a few months ago. Max's technical skill made the difference in that chicane."", 'Has there been an explanation of why Piastris first sector was so bad? The fact he significantly closed the gap in the last two sectors made me think he could have been on pole here by a couple of tenths. That takes nothing away from Verstappen being epic, but I felt like Piastri made a mistake in sector one, and without that, he would have had a comfortable pole.', 'Piastri was way closer to Max aside from the first sector.']",402,27,0.96,402,570,570,1,0,0.0,1
1jsp7eg,[Oscar Piastri via IG] Was after a bigger present but it was a birthday podium and cupcake. Thanks for all the messages,https://www.reddit.com/r/formula1/comments/1jsp7eg/oscar_piastri_via_ig_was_after_a_bigger_present/,2025-04-06, Social Media,[https://www.instagram.com/p/DIGQiQiimgT/](https://www.instagram.com/p/DIGQiQiimgT/),"['He seemed happier about the tiny cupcake', 'That’s a muffin', 'Why does this look kinda sad? 😂', 'Lmao this looks like a photo shoot from a three-year-olds birthday', 'That’s a muffin not a cupcake.', 'That\'s a McLaren sorting hat, ""oscar Piastri, you\'re an undeclared No.2 driver""', 'True, but it’s a birthday muffin', ""That's his happy face, actually"", 'I would look sad if I had to do this for my birthday', 'Yep, if Oscar was in 2nd and Lando 3rd they would have 100% asked Oscar to let Lando past to have a go at Max.']",380,10,0.98,380,10,10,37,1,0.0,37
1jsrq21,By achieving lap time of 1:30.965 Andrea Kimi Antonelli became the youngest race lap record owner in F1 history,https://www.reddit.com/r/formula1/comments/1jsrq21/by_achieving_lap_time_of_130965_andrea_kimi/,2025-04-06, Statistics,He broke the Lewis Hamilton's record from 2019 Japanese Grand Prix by 0.018 seconds.,"['Mercedes has been very smart in signing him up. Expect another dynasty in a few years.', 'Fair to play to Kimi because he’s gotten into the car every weekend and scored solid points.\n\nHe’s got raw talent and Mercedes want him to grow into that. If he’d had another year in f2 and a year in a back marker, his debut season in mercedes would probably be way better than however this season will be.\n\nBut in 2 years time, he’ll be far better if he has  2 years experience in mercedes  under his belt, rather than f2 and back markers. He’ll know the team, know how to fight up front and know the car. \n\nThe only downside to putting him the car now would be what if he can’t handle the mercedes immediately and hurts the team points which is not what’s happening. He’s basically getting as good points as ‘the safe option’ of a second driver like Bottas would', ""Last year I was skeptical, but the more I see the more I start to understand and like Antonelli. He's one that stays for sure."", ""A promising young man. Merc is a good and nurturing environment. Maybe we'll see greatness here.\xa0\n\nThink remember reading a mechanic's book the other Kimi (Raikkonen) was also fast, young, and promising - but arguably liked the fun side much (drinking /partying) and arguably didn't develop as much into the driver he could have been. He's still the last Ferrari champion still.\xa0\n\nHopefully with Toto and more structured approach, this Kimi might be the next Max.\xa0\n\n\nYou do feel for Russell. Marketed as a young and promising kid that won the youth category. Gets left in Williams by Toto (for too long arguably) like an orphanage. When finally comes to the works Merc team the car was mediocre in 2022-24; finally broken free of Ham's shadow - and now the next young & promising kid is already in your rear view mirror getting 2/3 of your points by race 3 & Toto has his yearning for the Max that got away (all the time) whilst negotiating your contract.\xa0"", 'George must be so pissed about all this. They put Kimi straight to the gp-winning car, while he was forced to ride shitboxes for four freaking years. And when he finally has been promoted the car was also a shitbox.', ""Antonelli is really, really impressive - it's his debut season and he's already scoring points left and right. I'm pretty confident he's going to be one of the title contenders in a few years. Hell, he might even compete for the title this year if he manages to improve his pace over the season."", 'Good lad', 'Impressive talent. He will be the star of the future and championships to come.', 'Toto truly recreated the Max arc. Kimi has the chance of starting in a possible race winning car, but without the pressure of a championship car. Second time that he had a slow start of the weekend but showed clear flashes of talent on Sunday.']",383,17,0.96,383,15,15,111,4,0.010000000000000009,111
1jspe9a,"Andrea Stella: ""It takes about 0.8s to even be in condition to attack the car ahead [...] It’s fair that Oscar makes the comment and gives input to the pit wall but i think today was simply not possible to overtake, he got close cause Lando was managing his tyres, trying to give it a go to Max""",https://www.reddit.com/r/formula1/comments/1jspe9a/andrea_stella_it_takes_about_08s_to_even_be_in/,2025-04-06, Video,,"['I’d like him to comment on why they decided to pit Norris same time as Verstappen instead 5 laps later\n\nCan’t believe they needed to cover off their own strategy for second car', 'Idk..Maybe either driver should stay longer and put pressure on Verstappen..Mate you have the fastest car on the grid and you can do different strategies too', 'Why was he managing his tires for ?', 'saving the tires for next race really smart from norris there, max is never gonna see it coming', 'We will have this discussion at least every other race this season, wont we?', ""What was he saving the tyres for? To defend against Piastri? \n\nWhy didn't you go long with 1 of the 2 cars? Again, so that there was no danger that they accidentally swap positions, even if you could be Max this way? \n\nIs McLaren's no.1 priority not to have Norris grumpy and complaining instead of getting the wins?"", 'Ultimately it isn’t Oscar or Lando’s fault they didn’t win today, it’s the strategy.\n\nYou have the fastest car on the grid. Max pulled a worldie and finished 0.018 ahead of Lando in Q3, but that was not sustainable for a race.\n\nWith the pace advantage the McLaren has, you were completely unable to give Lando a single lap where he had clean air. The entirety of the race Lando was between 1 and 2.7 seconds behind Max.\n\nOscar was similar but at least had one lap since he pitted earlier. You have to engineer clean air when you have the best car and you’re behind a top-3 all time driver, because you can’t count on him making a mistake.\n\nLando should have either pitted first or gone long.\n\nThese are the actions of a team that wants to win the constructors but doesn’t make WDC a priority.', ""I agree it wasn't possible to overtake, but Lando wasn't managing at the end. Certainly not in the last 10 laps."", 'If Norris was managing his tyres, why didn\'t they just say so to Piastri instead of telling him ""this is his pace"", heavily implying Lando was pushing at ten tenths.', ""I totally don't understand why Pirelli brings tires which are optimal for 1 stop strategy, especially on tracks like this where overtaking is impossible.\n\n2 or 3 pitstops would have made this race 10x more interesting, Mclaren could have offset the strategy and have 1+ sec advantage at the end, or have 2/3 chances of undercutting. Max only won this race because he started from first and Mclaren fucked up the undercut, I'm 100% sure Mclarens had a lot of extra pace, but couldn't use it""]",349,150,0.92,349,138,138,66,9,0.0,66
1jsnw51,[Williams Racing via IG] “Chequered flag on race one of the triple header. Points for Alex and some great moves from Carlos. Time to debrief and prepare for the next two.”,https://www.reddit.com/r/formula1/comments/1jsnw51/williams_racing_via_ig_chequered_flag_on_race_one/,2025-04-06, Social Media,,"['Albon slowly getting feistier and getting points more often', 'Great drive from Albon again', 'Alex letting that Thai spice come out more this year. I like it.', 'I can get used to Albono getting points', 'Maybe Alex is just heaps better than his Red Bull stint made him look, yeah?', 'Sainz is still struggling to bring out the best from his car. Hope he find the confidence and bring in the result soon!', 'Yep, Albon is proving us something', 'https://preview.redd.it/emxmhcf7u5te1.jpeg?width=1080&format=pjpg&auto=webp&s=815fbc40f3c3f917ce606727f81dd752acd79ac0', 'So happy for Alex and Williams, driving really well to start the season', 'Carlos my boy 😐']",336,84,0.99,336,80,80,9,5,0.0,9
1jsnugh,This is only the 4th time the top 6 finish the race like they started.,https://www.reddit.com/r/formula1/comments/1jsnugh/this_is_only_the_4th_time_the_top_6_finish_the/,2025-04-06, Statistics,It happened twice at Monaco before and once at Singapore.,"['Oh my goodness me we’re comparing Suzuka to Monaco and Singapore. That’s how bad this race was.', ""I know Suzuka is a stunning track, a hotlapping Mecca, but it's also always been an average-to-straight-up-bad race track under the past few F1 regs."", 'Don’t forget the only difference in the entire top 10 was Hamilton and hadjaar swapping', 'I don’t think this is just a DRS issue.\n\nThis is Suzuka. There is no reason for it to be a faster Monaco. They somehow need to make the racing better and I hope the new regulations help', ""This race is one of the most boring I have ever watched. I can't even tell you what happened, I don't remember seeing a single pass. I feel like I watched the start, then nothing."", ""This whole race could've been an email"", 'Worse than Monaco 2024', 'To paraphrase Piastri: For a race that was flatout most of the way, there were not many highlights.', 'What a snoozefest']",327,59,0.99,327,56,56,15,0,0.0,15
1jsmcpy,2025 Japanese GP - Race Discussion,https://www.reddit.com/r/formula1/comments/1jsmcpy/2025_japanese_gp_race_discussion/,2025-04-06, Race,"ROUND 3 - JAPAN

Start time - 5AM UTC / 6AM BST / 2PM Local

# 📺 WHERE TO WATCH?

F1 is broadcast on F1TV and through several local broadcasters. [Click here](https://www.formula1.com/en/toolbar/content_schedule.html) to find out of F1TV is offered in your region. [Click here](https://www.formula1.com/en/toolbar/broadcast-information.html) to go to the full list of broadcasters. Streams and downloads are not welcome on [r/Formula1](https://www.reddit.com/r/Formula1/). Requesting and sharing streams and/or downloads will be met with immediate bans.","['https://preview.redd.it/qengp6efn5te1.jpeg?width=750&format=pjpg&auto=webp&s=589b9ed254449926e9658a2cd6745074df8f000d\n\nMay as well break this one out early', '“Tell me where I’m slow mate”\n\n“Turn 8, 9, 13, 14, 17, mother fuckin whole track Lewis”', 'You know you fucked up when you made Albon that mad', 'two fucking cars side by side out of the pits.... lets watch Leclerc in the pits, what the fuck', ""What a race. Passing impossible, undercuts don't help, overcuts don't help, no car trouble, no safety car, even tyre choice is irrelevant. \n\nFfs we even had just enough rain to prevent any grass fire red flags, but not enough for wet racing."", 'Max leading and complaining about upshifts. We are back to normal routine', 'Feels like so many races on the calendar now are just 80% tyre management, 20% racing, boring.', '""That\'s all that happened in that race? Nothing happened""\n\nPiastri says the quiet part out loud', 'Max literally did nothing and just laughed lmao', ""It's Oscar's birthday\n\nIt's my birthday\n\nI'm at Suzuka\n\nLet's fucking get it lads""]",313,15502,0.94,313,496,496,3,-18,0.0,3
