unique_id,post_heading,post_url,publish_time,tag,post_content,top_comments,upvotes,comments,upvote_ratio,score,total_upvotes_comments,total_score_comments,upvotes_growth_rate,comments_growth_rate,upvote_ratio_growth_rate,score_growth_rate
1lpoa81,Ask r/Formula1 Anything - Daily Discussion Thread,https://www.reddit.com/r/formula1/comments/1lpoa81/ask_rformula1_anything_daily_discussion_thread/,2025-07-02,,"# Welcome to the [r/formula1](https://www.reddit.com/r/formula1/) Daily Discussion / Q&A thread.

This thread is a hub for general discussion and questions about Formula 1, that don't need threads of their own.

Are you new to Formula 1? This is the place for you. Ever wondered why it's called a lollipop man? Why the cars don't refuel during pitstops? Or when Mika will be back from his sabbatical? Ask any question you might have here, and the community will answer.

Also make sure you check out our [guide for new fans](https://www.reddit.com/r/formula1/wiki/newtof1), and our [FAQ for new fans](https://www.reddit.com/r/formula1/wiki/faq).

Are you a veteran fan, longing for the days of lollipop men, refueling during pitstops, and Mika Häkkinen? This is the place to introduce new fans to your passion and knowledge of the sport.

Remember to keep it civil and welcoming! Gatekeeping within the Daily Discussion will subject users to disciplinary action.

Have a meta question about the subreddit? Please [direct these to the moderators](https://www.reddit.com/message/compose/?to=/r/formula1) instead.","[""So Spa's coming up after Silverstone. It's interesting because it's a sprint weekend with a novel tire allocation - C1/C3/C4. Given that the hard is two steps harder than the medium, what do you think the strategies will be for the sprint and race?"", 'If Verstappen goes to Mercedes for 2026, is Russell the best choice to replace him?', 'I think everyone is going to be disappointed very soon. Max will stay at RB, George will stay at Merc.', 'Okay so I do not currently see the post about Sky Italy’s news piece. Has the news been since debunked?', 'Who do you think had the best car in 2003?', ""Just watching the 2020 British GP highlights, when Bottas, Hamilton and Sainz had tyre failure on the last 2 laps.\n\nHow did Hamilton not get a black flag?\n\nI know he'd just passed the pits, and it was the last lap, but how did he not get any penalty for carrying on?"", ""So according to Duchessa the speculation that Vasseur was away at Austria wasn't because of a loss family member."", ""If there were even 1% authenticity to that rumor, it would have already been reposted all over F1 media. I'm calling BS on this one.\n\nNo suprises there considering it comes from Italian media"", ""Fans of 44 complaining that Ferrari robbed him of podium because they pitted him with 18 laps to go is funny. I can't wait for their reaction when Leclerc finishes ahead of their idol at Silverstone."", 'You just taught me this, I didn’t realize they were putting an extra step between compounds. What I’m expecting is for easier battling on track between soft/medium users against hard users. So maybe we’ll be able to see strategies open up as overtaking will be more possible. Maybe an aggressive strategy like Max used in Spain, with more stops on softer tires. And of course I just wanna see more on track action. I definitely don’t expect anyone to start on the hard tires, though. If someone does, they’ll be who I watch at the start for an incident.']",11,59,0.79,11,52,52,5,1,0.12,5
1lpv5of,The most interesting and diverse F1 seasons based on the number of winning drivers and teams for the last 25 years (includes 2025 season up to Austrian GP),https://www.reddit.com/r/formula1/comments/1lpv5of/the_most_interesting_and_diverse_f1_seasons_based/,2025-07-02, Statistics,,['Interesting way look at seasons!\nThank you!'],21,2,0.96,21,1,1,21,2,0.96,21
1lpv968,Leclerc confident of Ferrari gains,https://www.reddit.com/r/formula1/comments/1lpv968/leclerc_confident_of_ferrari_gains/,2025-07-02, News,,"['Charles, Charles please...', 'Yessir Charles! I really believe a championship will hapoen in the next 10 years', 'Oh charles', 'Oh honey.', 'While Lewis asks to focus on 2026. I understand he wants to compete for every race but with what happened in Austria... Secure Ferrari as #2 in the WCC and there will be nothing to be ashamed of.', 'Leclerc has to be a masochist at this point right?']",15,9,0.8,15,6,6,15,9,0.8,15
1lpqum9,"Verstappen, Russell, Antonelli - Motorsport.com predicts Mercedes' 2026 lineup",https://www.reddit.com/r/formula1/comments/1lpqum9/verstappen_russell_antonelli_motorsportcom/,2025-07-02, News,,"['In short... on the fence.', 'Please racing god let us have at least one season of Max and George in the same car', 'I just hope that Russell joins either RB or the Aston Martin 2026 car spearheaded by Newey\n\nHe deserves a top spot, it would be heartbreaking to see him miss a year or two', ""Flashback from when Checo was to be sacked...\xa0 Every website and 'expert' talking about it."", 'It won’t happen, accept it', ""I wouldn't be surprised if they announce max as a driver before announcing who they are replacing"", ""It's still wild to me that they (might)be considering giving up on George. Yes, Max is Max, but George is capable of giving you the title with good car and Kimi is probably the best young driver on the grid. Merc have a great pair locked in, they need a better car.\n\nIf George and Kimi were in McLaren, I think they could've been at the top too. Especially George."", ""It's 100% going to be Russell-Antonelli, these talks are just your average shenanigans to get better deals when renewing your contract""]",0,95,0.48,0,88,88,0,5,0.010000000000000009,0
1lp44aa,Power Rankings after the Austrian Grand Prix,https://www.reddit.com/r/formula1/comments/1lp44aa/power_rankings_after_the_austrian_grand_prix/,2025-07-01, Social Media,,"['People know these rankings are absolute bollocks yet get upset about it every time.', 'My boy second on the power ranking in also his second ever appearance in it.\n\nBeautiful', 'Leclerc to Mclaren confirmed.', 'Welcome to McLaren Leclerc!', 'Bortoleto + 1000%', ""Liam was only beaten by the top teams in both quali and the race. He also totally outperformed his teammate. Can't see how he could have done any better. I think he deserves to be rated higher"", ""Didn't know Leclerc went to Mclaren and it's red."", 'Not REALLY sure what Leclerc did better than Piastri. But sure I guess', 'Fair play. This ranking makes sense. Bortoleto was great getting  points in that Sauber.', 'Leclerc benefitted greatly from quali yellow flag and then immediately lost his position on race day. Not sure why he is 4']",0,133,0.48,0,1121,1121,0,0,0.0,0
1lp98ze,Why Alpine's considering another bombshell F1 driver swap,https://www.reddit.com/r/formula1/comments/1lp98ze/why_alpines_considering_another_bombshell_f1/,2025-07-01, News,,"[""ah The Race yes. the ones that said that doohan was safe until the summer brake. then said that colapinto was safe for the rest of the year and now a day latter hes getting replaced by bottas. most unreliable source i've seen in my life"", 'Flavio is just throwing anything at the wall to see what sticks?', ""The Race seems to have a certain animosity toward Colapinto though it's unclear where it is coming from. There have been numerous articles defending why Doohan should not be dropped (I agree with them though) but the coverage around Colapinto feels disproportionately critical. They repeatedly bring up his sponsor’s missing payments, last year’s poor performances and crashes, and even connect him to Oakes’ rumored departure after the driver swap with Jack. They also reported a supposed meeting between Perez and Alpine involving Colapinto's exit after 2 or 3 races, which never actually happened (Checo's manager said so). Now the Bottas rumors are added to the mix. I don't recall any other driver facing this level of scrutiny from the race, not even now Yuki or before Liam in RBR."", 'Dont do it Valterri! Dont do it!!', 'Poor Colapinto.\xa0He’s been better than Doohan was. His performance in Canada is better than anything Doohan did. He’s had way less crashes and was less prepared.', 'wellp, the swap is not for franco....\n\ngasly is not confortable, you can pay attention to the interviews since de meo left the company. \n\nFranco is briatore\\`s projekt, and if hes not seat - secured, he can return to williams. THEY want franco for 2027 and beyond . \n\nBottas will replace gasly. Franco drops tons of money on the team with Mercado Libre, Claro, YPF (/ENI). Problem with media is they dont want to talk about his dear russell and how mercedes is about to shit on him (for max) so they need to reflect the attention.', ""They're just reporting the rumours in the paddock and rumours can change quickly"", 'by your standard, this source should also be considered unreliable\n\n[https://www.formula1.com/en/latest/article/driver-market-why-alpine-have-enquired-about-bottas-availability.1mpN417LziUqSuQzrP1dmK](https://www.formula1.com/en/latest/article/driver-market-why-alpine-have-enquired-about-bottas-availability.1mpN417LziUqSuQzrP1dmK)', 'In fairness, Flavio is exceptional at directing things into the wall', ""Meh- both Doohan and Liam had a TON of media pressure and weekly 'will he stay or go' coverage. Tbh I think Colapinto has gotten off rather lightly so far in comparison. But the hard reality is that he's now had as many races as Doohan and not shown a lot (imo less)- so of course there's going to be media outlets reporting change rumours.""]",0,41,0.4,0,272,272,0,2,0.020000000000000018,0
