unique_id,post_heading,post_url,publish_time,tag,post_content,top_comments,upvotes,comments,upvote_ratio,score,total_upvotes_comments,total_score_comments,upvotes_growth_rate,comments_growth_rate,upvote_ratio_growth_rate,score_growth_rate
1gir4zs,"Replay of Piastri / Lawson contact, Piastri received 10s penalty for causing a collision",https://www.reddit.com/r/formula1/comments/1gir4zs/replay_of_piastri_lawson_contact_piastri_received/,2024-11-03, Video,,"['Piastri went over to apologize.', 'Yeah that was clumsy by Oscar, long time since Oscar has made a racing craft mistake.', 'dumb move unfortunately. fair penalty', 'Slam Dunk unfortunately. As a Kiwi Oscar & Liam supporter, this is a painful watch.', 'not since German Grand Prix of 2019 have we seen such glorious chaos and drama.  \n\n\\*\\*Max for the win yet again.', 'Fair penalty', 'Verstappen to be the only driver without a penalty at the end of this race.', 'So the same penalty as forcing someone of the track\n\nMight as well spin them then.\n\nBring back the drive through for fuck sake', 'Man thought he was Max Verstappen.', ""Might be a penalty under the current rules, but a couple decades ago people would have said that was either a racing incident or maybe even Lawson's fault.\n\n\nPiastri got his nose in and had the car under control. Lawson didn't see him (obviously didn't expect him) and turned in as normal.\n\n\nPart of the issue must be that the braking distances seem to vary a lot between cars. It might have something to do with energy harvesting, but actually I think it is because the drivers are nursing tires during the races. They *can* brake quite a bit later occasionally, but doing so takes a lot of life out of the tires. So on the average lap they lift/brake a lot earlier than someone *can* when attempting an overtake.\n\n\nThat means we see more overtakes than usual that seem like dive bombs based on how far back the attacking car comes from, but that end up being nip and tuck by the time the two cars make the apex. (Think about Piastri's overtake for the lead at Baku, as a similar example.)\n\n\nI wonder if part of the inconsistency with stewarding is that we have a lot of stewards who drove during the refueling era and who were therefore used to driving GPs with every lap closer to the limit rather than driving to a delta that is often 5 seconds off the one-lap qualifying pace on the same compound of tires.""]",247,42,0.99,247,606,606,-1,0,0.0,-1
1giqdui,Colapinto overtakes Lewis Hamilton  ,https://www.reddit.com/r/formula1/comments/1giqdui/colapinto_overtakes_lewis_hamilton/,2024-11-03, Video,,"['Imagine being told that would happen at the beginning of this season', 'The roar from the stands was really audible lol', 'That was a pretty sweet pass. Good for Colapinto.', 'As someone who likes both these drivers I simultaniously love it for Colapinto and hate it for Hamilton lmao', ""Did i hear that right? Brazilian's cheering for an Argentine?"", ""Just retire the car at this point Lewis, it's dogshit and there's no where near enough pace for any points lol."", 'Toss that Mercedes off, like yesterday', ""U know he's gonna replay that for a long time\xa0"", 'Does lewis still have the terrible updated floor that George rather destroyed  ?', 'Regression in Qualy i can understand (we’ve seen it in other GPs) but racecraft too? Nah this car is dogshit']",272,56,0.95,272,733,733,0,0,0.0,0
1girbo5,First black flag in a Formula 1 race since Canada 2007 for both Massa and Fisichella,https://www.reddit.com/r/formula1/comments/1girbo5/first_black_flag_in_a_formula_1_race_since_canada/,2024-11-03, Statistics,They got the penalty for exiting the pitlane with the red light on,"['Is it just me, or has this been the MOST CHAOTIC race ever?', 'Russel and Hamilton are next. They changed tyre pressure on the grid after the 10 minute mark.', 'Levels to this 😳', ""Crofty browsing Reddit, as he's just mentioned that fact"", 'More like most chaotic race weekend', 'Zandvort last year was wild too', 'Spa 1998 and Monaco 82 would probably beat it', 'I was gonna say, should be a slam dunk DQ for violating a technical directive…right?', 'black flags, possible dsq, ... in zandvort? This is more chaotic']",237,14,0.98,237,180,180,0,0,0.0,0
1giovld,"[Alex Albon] Today is a tough one to swallow when qualifying was coming along nicely. We don’t know what caused the crash but we’ll look into it, apologies to everyone in the garage, this was a race where anything could happen and I felt we could have done something great.",https://www.reddit.com/r/formula1/comments/1giovld/alex_albon_today_is_a_tough_one_to_swallow_when/,2024-11-03, News,,"['Just finished quali and it looked like he just touched the white line and slipped no?', 'He sounded so confident through the session today on these conditions, he was asking for Max onboard when he came p2 and max was p1 after q1. Asking for better lines from his engineer - felt more like eyeing for pole', 'Looked like he drifted onto the painted side under braking and snapped. Difficult to tell if it was caused by some failure or he just reacted too late.', 'A small error with big consequences.', 'Feel bad for the guy. Has had a string of unfortunate incidents. Hope his luck turns around.', 'pretty surprised still that williams won’t give franco’s car to alex. if the thinking was always to maximize points, alex’s p7 grid start looks much more promising for a points haul. unless james is angry with alex for binning it.', 'Mate, you said ‘i can go faster’ and pushed harder onto the white line and crashed the car like a donut. Shouldn’t have gotten too big for your boots', 'Alex ""Logan Sargeant"" Albon', 'Erm, you caused the crash']",329,22,0.97,329,204,204,6,0,0.0,6
1gilk8h,Motorsportcom: First McLaren driver with 7 pole in a single season since Hamilton in 2012!,https://www.reddit.com/r/formula1/comments/1gilk8h/motorsportcom_first_mclaren_driver_with_7_pole_in/,2024-11-03, Statistics,,"['In 2012, Brazil was the 20th and last race of the season. This is the 21st race of the season - and it is possible for Lando to get at least 1 more on Lewis.', 'This man delivered on qualifying tbh. Very consistent qualifying performance even Piastri struggle to match', 'Damn, at least lando’s more lucky than Hamilton in 2012, so many lost wins due to strategy or reliability', 'And in 2012 they won neither chanpionship, so watch out', ""You can say whatever you want about lando but you can't say that dude doesn't have pace.  He is fast."", 'Lando is on fire 🔥', 'And surely the first driver to lose 6 of them in the first lap.', 'McLaren is back baby', 'Catastrophic how little he utilized such an advantage']",522,43,0.9,522,558,558,2,0,0.0,2
1gir6yn,The relevant regulation for an aborted start,https://www.reddit.com/r/formula1/comments/1gir6yn/the_relevant_regulation_for_an_aborted_start/,2024-11-03, Technical,"This is the relevant regulation that the cars under investigation have allegedly breached during the race start. I can't seem to find a penalty attached to this though, that's probably why this will be investigated after the race
","[""Oh yeah that decision is still coming too, joke that they can't just talk to the teams during the race tbh"", 'Max knowing regs to the teeth is incredible', 'So both Merc will get disqualified and all top 4 will get 5/10 sec penalty?', 'So that might be a penalty for the ones that drove away like Norris, and a penalty for Russell and Hamilton for changing the tyre pressures.', ""Drivers have got 10 second stop go penalties for similar things iirc. With the field being closed up this isn't looking very good for Lando's championship."", 'They did all return to the grid to be fair...', 'So when mercedes changed tyre pressure on the grid after the 10 minute mark, they should be disqualified right?', 'Its just weird… cause norris engineer told him to turn off the engine and wait and Lando just took off', 'Linked to that bottom paragraph is changing the tyre pressure counted as “tyre changing” cause if so it’s gonna be pretty slam dunk (and probably disqualification) for Hamilton and Russell. Almost no point in them doing the rest of the race']",225,177,0.93,225,1689,1689,1,0,0.0,1
1gilv8f,"[Chris Medland] Speaking to F1 after the session, Albon says's he's out for the race",https://www.reddit.com/r/formula1/comments/1gilv8f/chris_medland_speaking_to_f1_after_the_session/,2024-11-03, Social Media,,"['Yeah no surprise there, that car is fucked', 'that was kinda expected ngl, he also seemed to be injured by the wrist?', 'Suspect he won’t be the only one. Alonso and Sainz seem unlikely too.', 'Albon just confirmed it on the F1TV post-qualy show.', 'My poor fantasy team', ""Yeah there's no chance his car is getting fixed. For Aston Martin either they get both fixed or one of them starts in the pitlane while the other starts as usual."", ' back of his car was absolutely mangled', ""That's very clear. Williams are only getting the cars now. That's like 2.5 hours before pit lane closes for the grid. It's not happening, unfortunately..."", 'And Verstappen goes past Alex Albon!', 'This grid will have more holes in it than a block of swiss cheese']",469,66,0.98,469,1125,1125,6,0,0.0,6
1gimp0i,[Chris Medland] Williams suggesting Albon may have jumped the gun and it’s assessing the damage - says it will have an update soon,https://www.reddit.com/r/formula1/comments/1gimp0i/chris_medland_williams_suggesting_albon_may_have/,2024-11-03, News,,"[""Don't do that. Don't give me hope"", 'Williams mechanics in for some wizardry?', 'how????  that car looked like a nacho chip from one angle', ""I'm crashing out bro..."", ""perhaps they realized that Franco's car isnt all that bad and they will probably be able to finish the job"", 'A big chance for Williams in the constructors since Alpine is right behind them and Ocon is also starting P4.', ""Don't give us hope"", 'I looked like mashed potatoes. No way its getting ready.', 'All the Sargeant training…']",401,42,0.97,401,918,918,0,0,0.0,0
1gipk1e,[Chris Medland] Race aborted start,https://www.reddit.com/r/formula1/comments/1gipk1e/chris_medland_race_aborted_start/,2024-11-03, News,,"['Instantly a meme race', 'Norris can’t just drive of like that right?', 'What is going on', 'Are we sure about that?', 'Aborted start doesn’t mean another formation lap does it?\n\nEdit: autocorrect changed aborted to another \n\nWhat I meant was that Lando shouldn’t have gone for another formation lap', 'wtf are they doing half of them going for it, and half of them just waiting and stopped…', ""He's really struggling in a car with no windows"", 'No matter which side you’re on, F1 is currently a real mess.', 'Let the chaos begin!']",270,136,0.97,270,1885,1885,6,0,0.0,6
1girbpb,While we wait rewatch Verstappen's Brazil 2016 masterclass,https://www.reddit.com/r/formula1/comments/1girbpb/while_we_wait_rewatch_verstappens_brazil_2016/,2024-11-03, Video,,"['Max really said “watch me do it again”', 'We can see it live.', '""While we take a break from the Verstappen show, please enjoy the Verstappen show""', 'Deja vu', ""I was thinking about this since the start of the race. We're gonna get another max masterclass."", 'THIS MADE ME FEEL OLD... how was this 8 years ago', ""I mean, that overtake on Piastri today, *chef's kiss*."", 'Im enjoying Verstappen’s Brazil 2024 masterclass at the moment.', 'I randomly turned on a tv one Sunday morning and this was the race that was on. I’ve been hooked ever since', '2.0 is here mate. GEt on with the times']",213,27,0.79,213,610,610,-1,0,0.0,-1
1gilvy6,"[Giuliano Duchessa] Sainz's Ferrari to start from pit lane, will have new gearbox and Power Unit",https://www.reddit.com/r/formula1/comments/1gilvy6/giuliano_duchessa_sainzs_ferrari_to_start_from/,2024-11-03, News,,"['That promotes Max to p15, as of now', 'Verstappens charge through the field starts 3 hours before the race', 'Lewis has asked for a pit lane start in his press conference', 'I still wonder if taking an ICE or something for Leclerc would be beneficial here. Grid is all mixed up anyway and it would help for Vegas.', 'At this rate max gonna start p10 lol.', 'With how wet and crazy quali was, I imagine he will be happy to avoid the turn 1 clusterfuck that’s going to happen', 'Good choice to take the new engine instead of having to do this lift and coast nonsense for the final three races\n\nVegas and even Abu Dhabi should suit Ferrari, hopefully he can get one final win there', 'Max getting places for free already.', 'Take note, Red Bull.']",446,64,0.99,446,1008,1008,3,0,0.0,3
1gio7ey,Sainz to start from the pitlane,https://www.reddit.com/r/formula1/comments/1gio7ey/sainz_to_start_from_the_pitlane/,2024-11-03, Discussion,,"['At least he can start', 'Max 15? Where will he stary with al.these changes?', 'Hell of a lot of work for the mechanics but happy he’ll at least run', 'One of many people I’d imagine', ""Gotta love 'em pixels"", ""Let's hope Blando DNFs!"", 'AM are also from pitlane. He may start on 13th', ""Looks like it for the moment, there still isn't a final starting grid available"", ""17th still.\n\nThe way they do penalties now is to remove all penalised drivers, shuffle the rest up, then put them back in at their penalised positions. So Sainz going to the pitlane doesn't move Max up. However Albon withdrawing means there will be an empty grid slot so effective 16th.""]",303,21,0.99,303,170,170,0,0,0.0,0
1git3w2,[Mercedes-AMG Petronas F1 Team] George and Lewis finish P4 and P10 in a weather-affected São Paulo GP ,https://www.reddit.com/r/formula1/comments/1git3w2/mercedesamg_petronas_f1_team_george_and_lewis/,2024-11-03, Social Media,,"['Lol! Just you wait...', 'That was embarrassing from Mercedes today.', ""Honestly great drive nevertheless for George, probs the max that Merc could have asked for, even with his looming penalties/DSQ.\n\nAt the same time, while I wouldn't call it a great drive for Lewis, it was a good effort to recover to the top 10 and keep it out of the walls. That car looked genuinely shocking and I'm surprised they didn't do a set up change before the race."", 'For now', 'Double DSQ incoming', 'Lewis needs to grab a pickaxe and smash the ""upgrades"" off his car, it genuinely looked undrivable today. Decent drive by Russell tho. Also both drivers might be DSQ so it may be all for nought anyway\xa0', ""A weekend to forget for Lewis, sadly. Genuinely one of the worst race weekends he's ever had. He was so far off the pace relative to Russell."", '""weather-affected"" is THE understatement of the day lmao', 'Mercedes having low key disasterclasses one after another. Strategy stunk all weekend.', 'Absolutely disgraceful all weekend. And it could get worse and will when the disqualifications happen. Their incompetence is absolutely stunning. Lewis called it a “disgrace” and was right. \n\nGeorge deserves better. Lewis thankfully will get better. A team with a champion’s arrogance and a backmarker’s car and strategy.']",154,95,0.92,154,961,961,3,0,0.0,3
1gimi8h,"[Adam Cooper] : Looks like @AstonMartinF1 will have both AMR24s ready - but @alo_oficial, who has heavier damage, may end up starting from the pitlane.",https://www.reddit.com/r/formula1/comments/1gimi8h/adam_cooper_looks_like_astonmartinf1_will_have/,2024-11-03, Social Media,,"['I had a glimmer of hope with how Aston were doing and then ""Sir a 2nd Aston has hit the barriers"" happened', 'Question: if you start from the pitlane are you allowed to make setup changes?', 'Little by little, Max will be in range to divebomb Lando into T1', 'impressive work by the mechanics then', 'Understandable. Fix the car first you know can get ready for the grid and take more time with the second one', ""Wow i thought Alonso's wasnt that bad by eye lol. I guess i missed some of the damage"", 'salute to AM engineers and mechanics', 'Daddy Stroll was throwing bonus money up in the air of the garages as incentives', 'Hopefully we still get P8 and P9 start for AM', 'Oh what I thought lance’s crash was worse?']",370,43,0.99,370,856,856,7,0,0.0,7
1gi51id,"Lewis to Stefano Domenicali after qualifying got delayed: ""You should've sent us out! This is ridiculous, we should go out! I wanna go out! If you give us better wet tyres or blankets we'd be able to run in this! I'm putting you on the spot!""",https://www.reddit.com/r/formula1/comments/1gi51id/lewis_to_stefano_domenicali_after_qualifying_got/,2024-11-02, Video,,"[""He was joking but actually he wasn't. Love this lol"", 'fair enough', ""Lewis was having a good laugh when he said this to Domenicali. He was clever and caught him mid interview with Sky.\n\nAnyway, he's right. There's no point in having Wets anymore, they never get to use them."", 'Said in a joking way to be clear. As just the text makes it sound accusatory.', 'Well I’m glad I’m not the only one wondering why we bother with wet tires. That’s the point, F1 races in weather as long as it’s not a Malaysian monsoon', 'i miss full wet races so much man', 'based lewis', 'Lewis makes a solid point and well done for calling out this bull shut', 'Hamilton a real one for that', 'Preach Lewis']",11022,497,0.96,11022,24333,24333,5,0,0.0,5
1gixh15,"F1 HOT or NOT - rate drivers, teams and the race for the 2024 São Paulo GP!",https://www.reddit.com/r/formula1/comments/1gixh15/f1_hot_or_not_rate_drivers_teams_and_the_race_for/,2024-11-03, Statistics,,"['Ice cold: Sainz, Colapinto, and Stroll who managed the impressive feat of crashing both in Qualifying *and* the race.', 'HOT: Max, Gasly, Ocon, Russell\n\nNOT: Norris, Aston Martin, Stroll', 'Rating the Red Bull Team was so hard, the weekend went in so many different directions and the two drivers had completely different results as well\n\nEdit: had instead of hat :D', 'HOT: Williams mechanics\n\nNOT: Williams drivers', 'The top 5 for the drivers should be the same top 5 drivers that finished. Verstappen, Ocon, Gasly, Russell, and Leclerc were all hot today.', 'I think this was an incredibly good drive from Charles that went under the radar. The car was absolutely shit but he manages to hold off Verstappen for many laps with some brilliant defending and did the same with Norris too. Both in faster cars', 'Hot: Verstappen and  both Alpine drivers \nCold: Lando, Check and Astin Martin massage chair', 'Hard to rate merc without knowing how badly that tyre pressure issue is going to hurt them.', 'Stroll driver of the day']",80,51,0.82,80,707,707,-2,0,0.009999999999999898,-2
1girc99,"[ChrisMedlandF1] FIA: ""Teams have been informed by Race Control the restart will be a rolling start, but the weather conditions still need to improve at the moment.""",https://www.reddit.com/r/formula1/comments/1girc99/chrismedlandf1_fia_teams_have_been_informed_by/,2024-11-03, News,,"[""I'm so angry at Mercedes and Mclaren for pitting while the guys in the back didn't. They had nothing to lose but went proactive either way."", 'Why a rolling start?', 'Guess there’s no chance we get the full race distance. Even 5 more gets us beyond 50%', 'f5', 'So what are the criteria for them picking rolling start over full restart? It never seems to be consistent', 'If only there was a tyre designed for such conditions', 'Rolling start! Rolling start! Do-do. Do-do. Aah-ah, ah-aah. Aah-ah. Aah-ah, ah-aah', 'They would have to make that decision before the guys at the back though.', 'It made sense to pit during the VSC. But when it was ending they should have immediately stayed out and unfortunately both the teams are not good in these quick situations.']",180,21,0.97,180,184,184,2,0,0.0,2
1gin239,"[Erik van Haren] Many suggestions that Verstappen could now possibly change even more engine parts, because it hurts less. Not gonna happen. It remains to be seen from which position he will start exactly.",https://www.reddit.com/r/formula1/comments/1gin239/erik_van_haren_many_suggestions_that_verstappen/,2024-11-03, Social Media,,"['He could be close to the top 10 in a few hours', 'Yeah honestly car seem good but his luck not so much.', ""At this rate, we'll see half the grid in the pitlane."", 'Yeah there’s no point changing anything, he’s probably gonna start P13', 'Red Bull : Checo, Let Max pass \n\nCheco: ""I told you already last summer, you guys don’t ask that again to me, ok? Are we clear about that? I gave my reasons(2022 Brazil flashback), and I stand by it."" \n\n""How the turntables...""', ""If he has to take more penalties this season, might as well take them now, I don't think he's going to be moving up that many positions from damaged cars like people are expecting."", 'PLOT TWIST: Redbull owns every team on the grid except for McLaren and everyone takes new components and start from pit lane. Grid now is Nor, Pía, Ver in 3rd. Rest of grid in the pit lane.', 'And if the race is cancelled set penalties will be followed into the next round', ""He can't take another ICE but could possibly take another engine parts. But probably no point.\n\nP5-P6 should be possible for Max."", ""Stay calm, it's racing""]",314,45,0.96,314,724,724,-4,0,0.0,-4
1gil0f2,[Q3] Alonso in the barriers - session red flagged,https://www.reddit.com/r/formula1/comments/1gil0f2/q3_alonso_in_the_barriers_session_red_flagged/,2024-11-03, Video,,"['Sir, a second Aston Martin has hit the barriers', 'lol everyone Is going off, can’t wait for the race, if there is enough starters.', 'AM mechanics on suicide watch', 'Everything’s coming up Lando', 'That qualy had more red flags than my ex', ""There's going to be 18 cars starting the race, 12 finishing it and Max is going to win it, write it down\n\nEdit: Sauber don't count as real F1 cars right?"", 'That was a fast red flag', 'Crashton Martin.', 'Pretty quick this one', 'Albono, the dream is possible!']",456,310,0.97,456,3979,3979,0,0,0.0,0
1gincor,"[Erik v Haren] An hour before the race the final starting grid will be announced. If there are any drivers who drop out after that, that place on the grid will remain open.",https://www.reddit.com/r/formula1/comments/1gincor/erik_v_haren_an_hour_before_the_race_the_final/,2024-11-03, Social Media,,"['*Will remain open until that one driver forgets and starts in the wrong grid slot', 'Does a team have any incentive to be honest about that', 'Why would you even announce that?', 'There we go, that post about from the Indianapolis gp 2005 now seems more relevant than ever', 'Assuming we get a grid start and not a SC start (given the weather)', 'PLOT TWIST: Redbull owns every team on the grid except for McLaren and everyone takes new components and start from pit lane. Grid now is Nor, Pía, Ver in 3rd. Rest of grid in the pit lane.', ""Alonso, Albon and Sainz are already confirmed pitlane, so that leaves only Stroll at the front who's very unlikely to need a pitlane start."", 'is the race still starting at 12? got confused with all the chaos', 'When is 1 hour before start? When is the start?', 'Race control working harder for Lando than Lando himself.']",297,52,0.98,297,834,834,2,0,0.0,2
1gitfy7,[@F1TelemetryData] São Paulo GP Race Telemetry Recap (7 pics),https://www.reddit.com/r/formula1/comments/1gitfy7/f1telemetrydata_são_paulo_gp_race_telemetry_recap/,2024-11-03, Statistics,,"['Alpine with no pit stops', ""So Max purposefully missed Q3 to have fresh inters all race. He's playing 5d chess!"", ""Total lack of pace from Norris on a day he needed a statement drive. A total disappointment from start to finish. In contrast Verstappen showing he's a class above all and one of the finest wet weather drivers ever, flawless."", 'Cannot wait for the day when George gets a competent strategy team... All his good drives go out of the window because the people on the pitwall are hopeless.', 'Ferrari had an opportunity to give Sainz a full wet weather setup and look at his pace and top speed. No wonder why he crashed', 'Ocon is amazing in these tricky conditions', 'Why do I see used tires after pit stops (2 stops?)for Norris and some other drivers can someone please explain . And did Norris pit twice. Why?\n\nEdit: \xa0 Oh did they just purposefully use used tires after pit stop\xa0', 'Verstappen starting from 12?', ""The pit crew couldn't even have a shot to screw it up lol""]",129,18,0.96,129,113,113,-1,0,0.0,-1
1gikbsp,"Zhou, Hülkenberg, Colapinto, Bearman and Hamilton are out in Q1",https://www.reddit.com/r/formula1/comments/1gikbsp/zhou_hülkenberg_colapinto_bearman_and_hamilton/,2024-11-03, Video,,"['Absolute nightmare weekend for Lewis, god damn\n\nAlso Zhou is absolutely nowhere, terrible this season', 'Lando was no where those last few laps. Got so lucky.', 'That almost got disastrous for Norris, hot damn.\n\nAlso, wtf is up with Albon.', 'Well that was a butt clencher for Norris', 'My disappointment is immeasurable and my day is ruined \n\nThe onboard was tough to watch', 'Lewis on sector 2 was driving on ice, the car was sliding like crazy.', 'Norris fucking lucky', '"" i don\'t think we could get any worse"". Famous last words Lewis', ""Car just wouldn't stick for Hamilton in the middle sector. Sliding everywhere"", 'That was almost out of script']",496,277,0.97,496,3828,3828,0,0,0.0,0
1gilcmx,"The last and only time an F1 quali had 5 red flags - Imola 2022, this was the final grid",https://www.reddit.com/r/formula1/comments/1gilcmx/the_last_and_only_time_an_f1_quali_had_5_red/,2024-11-03, Statistics,,"['Lando and Charles being the only ""survivors"" so far who can make it to both ends of Q3', 'Max casually 8 tenths up', 'This quali is like squid games ffs', 'Shoutout to Seb dragging that shitbox A-spec AMR-22 into Q3.', 'This was a crazy qualifying!!', 'I see Seb’s name, I upvote', 'I forgot how bad Merc were', 'Would have loved to see Kmag in these conditions', 'Slightly better start for Yuki this time around']",398,16,0.97,398,180,180,-8,0,0.0,-8
