unique_id,post_heading,post_url,publish_time,tag,post_content,top_comments,upvotes,comments,upvote_ratio,score,total_upvotes_comments,total_score_comments,upvotes_growth_rate,comments_growth_rate,upvote_ratio_growth_rate,score_growth_rate
1jj5c3p,Max Verstappen deliberately driving over mud or grass after the Chinese Grand Prix probably to add extra weight,https://www.reddit.com/r/formula1/comments/1jj5c3p/max_verstappen_deliberately_driving_over_mud_or/,2025-03-24, Video,"With sound: https://i.imgur.com/7ItXeQn.mp4

People on the desktop, right click on the video and click ""show all controls""
","['Kimi also did this on the back straight\n\nCharles did it too lol.', '~~Oscar~~ Lando went briefly off track at on the cooldown lap, wondering if it was for the same reason\n\nhttps://preview.redd.it/iubpc4ci5qqe1.png?width=547&format=png&auto=webp&s=271312305d0bf7aba967749fd0eadd327b8fe3c7', 'How much weight would this potentially add to the car? This or marbles for example.', ""It's smart by Max to do this and 99% chance he's legal anyway. But it's another reason why having tyre weights for the overall weight is silly to me. \n\nIts obviously more convenient to weigh cars with the tyres on but the fact that Deg and picking up marbles/mud can be the difference between DSQ and being legal doesn't feel like it's the intention of the rules."", 'This is normal. Drivers are always trying to collect tire debris on their cooldown. Mud is a good substitute.', 'Ferrari would have had to put all 4 tires', 'Realistically, how much weight can that represent?\xa0', 'I know a racing driver (not F1) and even at his level he says they drive over the extra rubber on the cooldown lap for this reason.', 'It\'s not some secret move, listen to team radio, they always say ""good race, maximum pickup"" reminding them to drive off the race line to pickup stuff in the tires.', 'Dumb rules demand dumb solutions']",10325,868,0.95,10325,454,454,561,27,0.0,561
1jiobym,Red Bull warn Liam Lawson: 'We can't compete one-legged',https://www.reddit.com/r/formula1/comments/1jiobym/red_bull_warn_liam_lawson_we_cant_compete/,2025-03-24, News,,"['I’m starting to think Toto actually had it printed out', ""If Yuki gets in the seat and has the same struggles then that's the final nail in the coffin and the only thing left for them to do is either fix their car or clone Verstappen in a lab. What will they do with such a sensitive car when Verstappen leaves? Have two drivers in p20 instead of one?"", 'Yuki should stop performing well at RB , if he doesn’t want to be demoted to RBR.', '""You\'ve got a problem, change the \\*\\*\\*\\*\\*\\* car!!""', 'He ain’t here to score points or something', 'The car sucks and is very famously hard to drive which made the decision to put him in the seat even more confusing… now we get the chance to see Yuki struggle with the car yay', 'Sounds like he’s not getting yeeted before Japan then', ""RBR are stuck, they cannot develop the car to be more drivable without making it slower and they can't do that so they have to press on with the design philosophy they have and hope someone comes along that can handle it other than max"", 'This is like the embodiment of that meme of the guy putting a stick into his own bicycle wheel. If Red Bull don’t want to compete “one-legged” then they need to start by building a nurturing environment for their rookie, rather than throwing him to the wolves when he inevitably struggles in a car that only one driver out of their last five has consistently been able to perform in.']",9437,1234,0.96,9437,46938,46938,48,5,0.0,48
1jixy7u,Question: How long are you prepared to give the team if this car is tricky much longer. Will you stay and help them through it?,https://www.reddit.com/r/formula1/comments/1jixy7u/question_how_long_are_you_prepared_to_give_the/,2025-03-24, Video,"With sound: https://i.imgur.com/w9C1FU2.mp4

People on the desktop, right click on the video and click ""show all controls""
","['Max: ""unbothered. moisturized. happy. in my lane. focused. flourishing.""', 'Philosopher Max in the media pen.', ""1) they're paying him a shit load of money 2) he's already a 4 time wdc 3) he was in this position for years with them, got his head down and maximised (no pun intended) his results."", ""This is probably the most relaxed I've seen Max since 2021. I can either see him driving in F1 another 5 years or leave after the season and at this point neither would surprise me."", 'He’s so ingrained in Red Bull family, it’s definitely possible he just runs with Red Bull until he wants to leave F1. He has a kid on the way, makes a bunch of money, and is a 4x world champion. Everything else is just extra at this point.', 'Horner: ""Max is working harder than i\'ve ever seen him, he\'s more integrated into the engineering group than i\'ve ever seen. He seems to be enjoying that aspect.""', 'Max 2018: ""I get tired of the questions. If I get a few more, I might headbutt someone"".\xa0\n\nMax 2025: (laughing at the absurdity of repeated questions about staying with RBR, giving a thoughtful response)\n\nBoth are fine, but he\'s matured (of course) and now knows to just laugh at being asked the same questions over and over.', 'Max: ""As long as I\'m being paid 50M+ a year, all good man""', ""He's a multimillionaire,  has 4 f1 world titles he can milk for the rest of his life. Will soon become a dad, and has a supportive wife.\n\n\nSo yeah.. offcourse he's happy"", 'When you have 4 F1 chips and your first child incoming you do not give a single fuck about the car - you’re just enjoying your life \n\nI like how this guy matured for all these years']",7599,545,0.97,7599,18951,18951,123,7,0.0,123
1jiskye,"Max Verstappen on Instagram: ""Working on something special.""",https://www.reddit.com/r/formula1/comments/1jiskye/max_verstappen_on_instagram_working_on_something/,2025-03-24, Social Media,,"['He’s going to drive his car while remotely driving Liam’s with his brain', 'Cloning himself for the second seat', 'Probably a helmet tribute to Honda', 'White RBR livery. This way it blends in with the RB car and nobody will know who drives what.', 'Verstappen to Torro Rosso and Yuki to Red Bull', '… is HE pregnant??', 'https://preview.redd.it/bq76j8iiknqe1.png?width=954&format=png&auto=webp&s=c75faae0a19feddffacec07e14c47979ae034620\n\nReveal on Thursday', 'He will drive in a waifu cosplay', 'Putting his kid in the second RB seat', ""He's developing the RB22.""]",6847,372,0.96,6847,24136,24136,55,6,0.0,55
1jj8uvs,Why is Dr. Helmut Marko not being held accountable for failing to deliver a viable second Red Bull driver through their Academy program?,https://www.reddit.com/r/formula1/comments/1jj8uvs/why_is_dr_helmut_marko_not_being_held_accountable/,2025-03-25, Discussion,"Why is Dr. Helmut Marko not being held accountable for failing to deliver a viable second Red Bull driver through their Academy program? In the same time period, Mercedes has developed two formidable prospects in Russell and Antonelli.

Of course everyone will answer that he “found” Max Verstappen, but he certainly did not actually develop Mac Verstappen, who technically did not make it up through the ranks with the Red Bull Academy. 

It is exhausting to constantly hear him crowing and belittling the Red Bull/Racing Bulls drivers for their lack of performance, but perhaps he should choose not to cast a blind eye on his own shortcomings. 

","['Because Max wants him there and Max is the only thing holding this team together', 'When your driver wins 4 years in a row, your more likely to bat an eye on some of the shortcomings', 'Getting Max and Seb probably cuts him some slack', 'Verstappen, Vettel, Gasly, Sainz, Albon, Ricciardo, Tsunoda, Vergne, Bourdais, Buemi, Hartley… all successful drivers with great driving careers. I get that he’s an IRL Bond villain but the program is the best there has ever been.', 'Because it is quite obvious for anyone paying even a smudge of attention that the problem with Red Bull is the car and not the drivers. No one would be performing well on that Red Bull. And Liam would probably be doing much better on another team.', 'How exactly do you want him to be held accountable?\n\nHe’s doing his job, it’s the car that’s at fault. Eight drivers on the current F1 grid come from the Red Bull junior program, and they have a potential new star Lindblad in F2. There are only so many champion-level drivers, and it’s not like other teams’ programs are constantly bringing in top tier talents.\n\nI dislike Marko as a person but he is extremely talented at what he does. And to your point about Max- Marko was the one who convinced him to sign with Red Bull, by convincing Christian to give him a seat in F1 for 2015. That’s a crazy gutsy move that obviously paid off. And then he was also the one pushing for Max to move to RBR. So he was definitely still instrumental in developing Max’s early career.', 'Because he did ? Gasly, albon, sainz. He is still good in bringing in talent, as much of an ass he is.', ""The Red Bull junior driving program has identified alot of good racers, and (as they like to point out) given opportunities to drivers that might not otherwise have had a chance of making it into F1. As others have pointed out, there are real examples that have turned into championships.\n\nThe real problem is how Red Bull treat drivers once they're given an opportunity, and just cycle through them far too quickly. The fact that ex drivers go onto having successful stints at other teams proves theyre good enough.. the problem is that RB racing teams don't create an environment for them to flourish, and dispose of them early."", ""lmao what are you talking about. A third of the grid are drivers who went through the academy, including the current x4 champion. I'd say that classifies as a pass....""]",5052,606,0.9,5052,454,454,571,41,0.0,571
1jippk0,[ESPN]: ''Sources have told ESPN Colapinto is still likely to replace Jack Doohan at Alpine before the European leg of the season.'',https://www.reddit.com/r/formula1/comments/1jippk0/espn_sources_have_told_espn_colapinto_is_still/,2025-03-24, News,,"['Colapinto going to be driving both the Alpine and the Racing Bull at the same time.', 'silly season is suffering the effects of global warming', 'Have the Dodgers also looked into signing Colapinto?', 'What the fuck did these teams expect when signing on so many rookies? 30% of the field is new, you all weren’t going to get Vettels or Verstappens right out the gate.\xa0', 'So Franco Colapinto to XYZ is the new Mick Schumacher to XYZ now?', 'I hope Cadillac signs Colapinto and Schumacher just so we don’t have to hear about it ever again.', 'Colapinto to replace \n\nHamilton at Ferrari\n\nLawson at red bull\n\nPiastri at McLaren\n\nRussell at merc\n\nNando at Aston\n\nAlbon at Williams\n\nOcon at haas\n\nGabi at sauber\n\nDoohan at alpine\n\nHadjar at racing bulls\n\nAll at once', 'Meanwhile, Theo Pourchaire and Felipe Drugovitch, both F2 champions have no full time drives', ""Ah yes, 'reports' and 'sources' ... A deadly combination.""]",3855,527,0.97,3855,18999,18999,35,3,0.0,35
1jipxxs,"F1 responds after Ferrari calls broadcast of Hamilton's Chinese Grand Prix radio messages a ""joke""",https://www.reddit.com/r/formula1/comments/1jipxxs/f1_responds_after_ferrari_calls_broadcast_of/,2025-03-24, News,,"['>“There was absolutely no intention of presenting a misleading narrative regarding the Ferrari team radio,” they said. “Due to other situations developing during the race the message from Lewis was not played but this was not intentional.”\n\nYeah, right.', 'They’re so shitty with their excuses. They’ve become more and more reliant on using team radio to drum up bullshit drama when messages of better context go ignored and they do it regularly.', 'I didn’t watch the F1TV broadcast but Martin or Crofty did clarify that Lewis wanted the swap and mentioned it a couple times so they had at least heard the message at some point', ""This is just more of the same absolutely diabolical TV direction.\nMisleading viewers with inaccurate radio transmission replays, not showing timing gaps at critical moments, not even showing on track action at critical moments, ineffective use of picture on picture, showing the crowd celebrating while the pass for position was still being contested. \n\nF1TV, FOM and whoever else is responsible needs to go to broadcasting school, it's absolutely appalling lack of skill or talent in the TV direction."", 'I knew something was off, they were playing it like Hamilton was intentionally being argumentative, even more so when they played Leclerc\'s, ""What a shame.""\n\nFOM knew what they were doing.', '![gif](giphy|6JB4v4xPTAQFi)', 'https://preview.redd.it/akp8o3gx0nqe1.png?width=1026&format=png&auto=webp&s=4156e7456369abee420826435fe378eebc051c0d', "">“There was absolutely no intention of presenting a misleading narrative regarding the Ferrari team radio,” they said. “Due to other situations developing during the race the message from Lewis was not played but this was not intentional.”\n\nHAHA. Yeah and if you believe that, I have a bridge to sell you.\n\nThis happens EVERY year, most the time its around DTS, it's about about clicks and narrative, not the truth. I really wish the drivers just refused to be part of it until they fixed it."", 'A joke indeed']",3612,249,0.99,3612,13987,13987,29,2,0.0,29
1jj3g1q,"[Isack Hadjar via IG] Was running comfortably in the points until we weren’t. Finally my first race in Formula 1 and lots of positive to take away from it, we are fast! Japan next!",https://www.reddit.com/r/formula1/comments/1jj3g1q/isack_hadjar_via_ig_was_running_comfortably_in/,2025-03-24, Social Media,,"['What a fucking line ""Was running comfortably in the points until we weren\'t""', 'Subtle shade', ""What is interesting.... And somewhat overshadowed by Liam's struggles is that Racing Bulls' technical team right now is headed by Tim Goss who was part of McLaren's championship winning team in 1990 and was one of the minds behind the development of F1's first seamless shift gearbox in the early 2000's.\n\nClearly Racing Bulls have built something of a pliable car that helps drivers like Hadjar find confidence.\n\nHere is Tim in 2011 talking about their approach to car development, design, and strategy against a dominant Red Bull team:\n\n[https://www.youtube.com/watch?v=7\\_L8d\\_p\\_p04](https://www.youtube.com/watch?v=7_L8d_p_p04)"", ""One of those guys you want to see succeed. \n\nGod damn those RB's look good."", 'Rooting for him to do well. He had some really bad luck in F2 last year.', ""Starting a prayer circle that Red Bull don't get any stupid ideas about ruining his career soon"", 'This guy is matching Tsunoda speed instantly. You can tell he’s fast. Curious to see how he evolves, but he has clearly some potential.', 'This guys raw pace for effectively is first f1 race was quiete impressive. Looking forward to see how he goes on with it', ""Look how RB did my Shayla's dirty this week 😭"", ""I like how he gets along with Yuki. He's not a bad person. I have no idea why people kept saying he's unhinged.""]",3623,96,0.99,3623,2786,2786,200,3,0.0,200
1jiyvy2,Safety measures in current generation of Formula 1 cars,https://www.reddit.com/r/formula1/comments/1jiyvy2/safety_measures_in_current_generation_of_formula/,2025-03-24, Video,Source: https://www.instagram.com/reel/C_p5WrtC-nW/,"[""Very informative, however it would've been more realistic to use one of the 2nd Red Bull drivers as example."", ""That is so interesting. \n\nAnd I can't help but feel thankful all those were in place when Grosjean went into the wall in that big fireball."", 'This is so cool \n\nLegitimately, thanks for sharing this', ""Hard not to think of Senna, and others, watching this.  I know it's crashes like his that advance safety measures, but damn.."", ""I didn't know they had they're feet on the high lol."", 'And these are only the ones directly protecting the driver, there are so so many more measures in place to make the cars and sport as a whole safer. The wheel tethers and fuel bladder to name just two.', 'I, for one, am so glad the cars (and various other aspects of F1) are as safe as they are today. I’d find it difficult to keep watching a sport where the ‘stars’ kept dying to grievous injury every so often!', 'I have a curious question, say if Senna had crashed in 2025 the way he had, , would these  safety features have kept him alive?', 'Going 200 mph scary enough at least there’s proper safety precautions now', 'I really love videos like this']",3450,104,0.99,3450,2682,2682,124,1,0.0,124
1jiudvb,"Lewis Hamilton is on the cover of F1 25 ”Iconic Edition”, the game is set to be revealed on March 26.",https://www.reddit.com/r/formula1/comments/1jiudvb/lewis_hamilton_is_on_the_cover_of_f1_25_iconic/,2025-03-24, News,,"[""with EA I feel like the year on year upgrades have lost their charm. They made this into another FIFA where the incentive to buy the next year one is little to none.\n\nI'd rather wait out till 2026 considering the cars are different and team performance could be much different + 11 teams and Audi instead of Kick.\n\nEdit: also it's a shame we won't get F1 manager likely this year"", 'Man’s been trying to fix that collar for ages.', 'Iconic Edition as in new menus order and some new costmetics?', 'Just print the cover out, wrap it around your F1 ‘23 or ‘24 game and you got F1 ‘25 early. Or change the icon in your game files', 'Game will probably be a buggy piece of shit again...carrying bugs from F1 2020...and making all new ones.', ""Looking forward to buying this in 2026 when it's 95% off."", 'K1 button probably in DLC.', 'This game peaked in 2018 with classic cars and short circuits', 'DSQ Edition']",2848,233,0.95,2848,3311,3311,37,3,0.0,37
1jipn44,[ESPN] Red Bull considering replacing Liam Lawson with Yuki Tsunoda for Japanese GP - sources,https://www.reddit.com/r/formula1/comments/1jipn44/espn_red_bull_considering_replacing_liam_lawson/,2025-03-24, News,,"['2024 🤝2025\n\nEdging the second driver replacement', '![gif](giphy|ghBwzGWw2zQvwhTRfm)', 'Must be a new record', 'Starting to see a lot of smoke', ""Does anyone know what the original source of this rumour is? I can't find the original outlet that posted this and all of the ones I have seen just seem to report that other 'reports' are suggesting Red Bull are considering replacing Liam.\n\nOr is it based on vibes (like Horny not shutting it down completely when asked)?"", 'Really starting to look like the main team is actually the Sugar Free Red Bull', 'I have no idea if Yuki can perform better or is the answer, but the guy has been dedicated and pushed through a lot so give him the chance. From a points perspective it can’t be worse. Last season Yuki outperformed him head to head as well. Of course Yuki had the advantage, but also the pressure bc if Lawson did well he’d look terrible. Almost like nothing to win, but everything to lose situation. I think it’s time for Yuki to get a shot.', 'Imagine if they do the swap and Lawson outperforms Tsunoda....', ""As great as this would be for Yuki. This makes no sense even by Red Bull's nonsensical standards. I love Yuki, but you'd be utterly insane to not give Liam at least 5 races to adapt.""]",1836,285,0.96,1836,6364,6364,19,2,0.0,19
1jiy12h,[Motorsport.com] Lewis Hamilton sets sights on designing Ferrari road car: The F44,https://www.reddit.com/r/formula1/comments/1jiy12h/motorsportcom_lewis_hamilton_sets_sights_on/,2025-03-24, News,,"['Tbf this was pretty much expected. Elkann had to do more than just fork over a shitload of money to get Lewis to leave Merc', 'I hope he surprises all of us and produces the first Ferrari mini van in tribute to the SF-25', 'Please be a V12 with a manual gearbox. \n\nHe did order his Pagani with a manual gearbox so maybe...', 'https://preview.redd.it/ky55k7tgmoqe1.jpeg?width=1078&format=pjpg&auto=webp&s=055050597df28d8d8d8e7b8f5f04d8cbb5bf31d9', 'https://i.redd.it/r33n99m8soqe1.gif', ""It'll be a one off like the Omologata or very very small run like the Venice, I don't think they'd do a run like their Icona series.\n\nI'd love to see the design Lewis and Ferrari can come up with."", 'This makes so much sense with the rumors that Mercedes denied him an ambassadorship. Ferrari was down to have him involved in the brand outside of F1, Mercedes wasn’t.', 'I hate you but nevertheless i love you 😠\n\nhttps://preview.redd.it/htnpuaa9yoqe1.jpeg?width=1169&format=pjpg&auto=webp&s=62d17a31fbb3069efe833ee0c85e549c898b0d41', 'Charles:\n\n![gif](giphy|mte9xixVe2SpOammjH)']",1720,202,0.97,1720,4584,4584,28,3,0.0,28
1jiys1h,McLaren | A moment to remember.,https://www.reddit.com/r/formula1/comments/1jiys1h/mclaren_a_moment_to_remember/,2025-03-24, Social Media,,"['Random ass Zak in the corner is sending me', ""It was the performance everyone know he could deliver, but hadn't so far. All the points in the bag, completely dominant in the race, not a single mistake, and bouncing back from the mistake in Australia. If anyone had doubts, Piastri is the real deal"", '100% win from pole rate. Something to think about.', '![gif](giphy|SVH9y2LQUVVCRcqD7o)', 'He’s even starting to kinda look like Kimi in that top right photo', 'Now I really need a Chinese communist propaganda poster of glorious leader Oscar Piastri leading the proletariat to revolution.', 'Where can I buy this poster?', 'Where lando ?', 'He’s lookin scrumptious up there', 'Man I wish he was my dad 😔']",1384,23,0.97,1384,382,382,64,0,0.0,64
1jjdsqv,Useless stat: Piastri now has the highest win % of all the non-WDC's on the grid,https://www.reddit.com/r/formula1/comments/1jjdsqv/useless_stat_piastri_now_has_the_highest_win_of/,2025-03-25, Statistics,"Basically the title. With his 3rd win in 48 GP's, his win percentage is 6.25%. While this is lower that the win percentages of Max (29.86), Lewis (29.33) and Fernando (7.94) respectively, it is the highest of all the non WDC on the grid:



|No.|Driver|GP's|Wins|Win pecentage|
|:-|:-|:-|:-|:-|
|1|Piastri|48|3|6.25|
|2|Leclerc|149|8|5.37|
|3|Norris|130|5|3.85|
|4|Russell|130|3|2.31|
|5|Sainz|208|4|1.92|
|6|Gasly|155|1|0.65|
|7|Ocon|158|1|0.63|

","[""Probably an obvious comment but Fernando's still being that high feels insane to me. Motherfucker has been in 1/3 of all grands prix ever."", 'Just wait until Hadjar wins Suzuka', 'Max and Lewis have won 15% of all Formula 1 grands prix in history by the way', ""Do y'all think Antonelli will win a race this year?"", 'He was gonna go to Alpine. Lord', ""not surprising as he probably also has the highest percentage of races in a car that could win of the non WDC's"", ""That's actually a cool stat. So he'll likely increase beyond Alonso this year, and perhaps join the WDC's at the end of the year."", 'I’m not surprised. He was in a backmarker for a grand total of 9 races. The others in that list had entire seasons in midfield, some of them haven’t had a car good enough to escape it and probably never will. \n\nFor 2 races in 2019, Leclerc had a very high % win rate. Shows how little stock you can put into stats like this if it’s not Max or Lewis.', 'He joined at the perfect time.']",1246,141,0.97,1246,133,133,346,19,0.0,346
1jiu0ub,Norris: 'Unacceptable' leak caused brake failure,https://www.reddit.com/r/formula1/comments/1jiu0ub/norris_unacceptable_leak_caused_brake_failure/,2025-03-24, News,,"['Such shit journalism this. \n\nAndrea Stella was the one that called it ""unacceptable"" and revealed that it was a leak, Norris didn\'t say either of those things.\n\nThe first paragraph reveals the actual truth:\n\n>Norris described the final ten laps of the race as ""one of his worst nightmares"" due to a problem that extended the brake pedal\'s travel. According to Andrea Stella, the failure, defined as unacceptable, was caused by a leak in the system.', 'Why does this headline make it sound like Norris is the one being quoted?', 'Andrea Stella: ""We had a failure on Lando’s car with the brake pedal that we had to manage over the last 20 laps. Lando and the team did a great job in managing the situation and adapting the driving style to the problem, which then got worse to the point where it put the result at risk, which is unacceptable from a reliability point of view, we need to do better.""\n\n""The pedal travel was getting longer and we had to avoid peaking, so he had to apply less and less pressure to the point where in the last few passes he was coasting on the accelerator, using as little pressure as possible on the brake to stop the car and go through the corner. This was to avoid the leak becoming too fast.""\n\nStella: ""We know the cause of the problem, which I don’t want to reveal for IP reasons, but there was a leak in the system.', 'Eh, he made it to the finish line. Colin Chapman would approve.', 'Are there acceptable leaks?', 'Meh, he’s not had any mechanical issues since 2022. He’s got his one near miss every 2 years out of the way. Just his obligatory annual DNF to get done now. Reliability has been solid on his cars. This is just an anomaly and they know the cause so they can make sure it doesn’t happen again.', 'Y’all are so unfunny', 'I reckon he would have chased piastri if not for the brake issue.', 'Leakage of what!?']",656,88,0.8,656,2968,2968,6,0,0.0,6
