unique_id,post_heading,post_url,publish_time,tag,post_content,top_comments,upvotes,comments,upvote_ratio,score,total_upvotes_comments,total_score_comments,upvotes_growth_rate,comments_growth_rate,upvote_ratio_growth_rate,score_growth_rate
1jsp9cm,Mildly fun fact: For the first time in F1 history the first 3 races (and first 4 racing sessions) of the season have all been won from pole by different drivers,https://www.reddit.com/r/formula1/comments/1jsp9cm/mildly_fun_fact_for_the_first_time_in_f1_history/,2025-04-06, Statistics,"Makes sense tbh because the first 3 races being won by different drivers is rare as it is.

Last time 3 races occurred in a row in this fashion at any point was 2021/22, with Hamilton, Verstappen and Leclerc taking poles and wins.

4 was 2007, with Massa, Alonso, Räikkönen and Hamilton. 

And since I was curious, 5 was 2003, with Ralf Schumacher, Barrichello, Montoya, Alonso and Michael Schumacher.","[""My conclusion is that this year's cars are pretty much impossible to overtake if they have similar life in their tires to the pursuers. (not counting huge performance deficits like sauber vs mercedes). So I think we can pretty much expect pole sitters to win the races unless reliability issues or SC luck."", 'Last year we had 7 different winners from 4 teams and now we have the points split evenly as well, let’s hope this is a true 2010/2012 kind of season', ""Why don't they always just try to get pole position then? Are they stupid?"", 'Never forget that 2012 had 7 different winners in the first 7 races.', ""People are slaying McLaren for strategy and whatnot but in reality, the race was lost yesterday. The field is so tight this year that overtaking got significantly more difficult, so you really need to have a good Saturday. And this is what McLaren's drivers need to work on, except Australia they did too many mistakes in their final runs."", ""Hamilton's sprint win feels like a lifetime ago"", ""So you're saying 2025 just watch qualy then check out..."", ""While winning from pole isn't very exciting I am liking the different winners, I'd be happy with McLaren winning it all, bit of F1 heritage (why do people despise Lando I don't get it)"", 'Okay, so we need something _very_ topsy-turvy to happen in Bahrain next weekend for Alonso to be able t to join in with equalling his own fun stat!']",320,34,0.96,320,31,31,32,1,0.0,32
1jstrf4,"[Isack Hadjar via IG] My first points in F1 !!!! On my favourite track, P8! Race was perfectly executed, big thanks to the team.",https://www.reddit.com/r/formula1/comments/1jstrf4/isack_hadjar_via_ig_my_first_points_in_f1_on_my/,2025-04-06, Social Media,,"[""I love what he's doing so far. Very fun to watch him in that car"", ""He's something special, I am ashamed to say that I honestly did not rate him at all before this season. He's a future star."", 'After having something of personal significance crushed during quali this is one hell of a result.', ""Best of the rest. He's in a nice spot at Faenza (well, minus team's strat, mechanical or balls crushing shenanigans) to develop and he is doing well.\xa0\n\n\nWe'll see. Funny to observe some people realizing that he his more than just some explosive junior series radio. Very few was expecting him while Bearman and Antonelli was so much hyped everywhere (and they do very well too btw).\xa0"", 'Get ready to go to Red Bull', 'Rare VCARB strategy W', 'Feel so good for him after the start to the season. Kid clearly belongs.', 'Poor Isack. Instead of a Red Bull promotion he got Red Balls.\xa0', 'Isack’s got the minerals for this sport.', 'Yuki back to Racing Bulls in Bahrain. Isack to Redbull!!']",427,15,0.99,427,15,15,427,15,0.99,427
1jspr9r,"Russell: Pirelli needs to supply softer tires, the hard ones last forever.",https://www.reddit.com/r/formula1/comments/1jspr9r/russell_pirelli_needs_to_supply_softer_tires_the/,2025-04-06, News,,"['The Russell vs. Pirelli beef from last season continues.', 'There was an early radio message that said something like *No graining, overheating the rears is the only danger*\n\nI went back to bed.', 'I miss the season when we had 3-4 pitstops in a race. That was fun. \n\nNow there’s 0 play on strategy anymore.', ""It's just a shame that this keeps being a problem. A hard tire that lasts forever has killed an insane amount of races. But this wasn't the only problem at Suzuka. The race track just didint provide overtaking opportunities."", 'Totally agree with Russ. Tyres need to be shit for the race to be better.', ""I love how people here often bash Pirelli for making shitty tyres, yet now the narrative has shifted and the tyres are too good lmao.\n\nJokes aside, something has to be done about tyres. F1 as it is right now IMO has the worst racing in motorsport and half the fun is off track drama. In every other series (ie WEC, IMSA) you never know what to expect.\n\nF1 got me into motorsport and simracing and I'm glad it did, but man is it a snooze nowadays. It's all about saving tyres"", ""Make them softer and bring back the 2012 cliff tires for maximum randomess.\n\nOne lap your good the next your barelly keeping it on the track.\n\nBut jokes asside tires do seem a bit shit this year so far not allowing for much creativity. China was predicted to be a 2 stop hard on the tire race and ended up being a 1 stop snoozefest.\n\n1 stop isn't even bad if there is a point where tires actually start dropping away and tyre conservation is a thing. Not when you can be pulling 50%+ of the race stints on mediums."", ""I think Pirelli is in a hard spot here, because there is little tire testing, they need to select the tires well I'm advance and can't reliably predict the track temperature."", ""Make it mandatory to race in all 3 compounds.. then it'll be fun to watch..""]",309,99,0.96,309,92,92,51,8,0.010000000000000009,51
1jsfzjm,Rear view onboard of Jack Doohan’s crash,https://www.reddit.com/r/formula1/comments/1jsfzjm/rear_view_onboard_of_jack_doohans_crash/,2025-04-05, Video,,"[""First the DRS was open. Then it was closed. Then it didn't exist."", 'There’s been a lot of blame towards Doohan not closing the wing with the button and relying on the simulator which showed he could brake instead, but shouldn’t the engineers have also told him this isn’t a reliable way to close the wing? They would have seen he was doing this in the sim, and should have let him know if this isn’t the correct way to do it.', 'The team should have warned him forhand. Alpine is burning Doohan.', 'I‘m not really sure, but I think he crashed😂', 'Whoopsie', ""I hate to say it but I love how the cars literally explode when they crash, there something beautiful and extremely scary about it. Glad he's okay!"", 'My guess is that Doohan is crazy brave gambling to try and save his job.', ""That'll do it everytime"", 'My neck hurts watching this.', ""Aren't corners non DRS zones? Even if he thought he could do it, is that even allowed?""]",267,71,0.97,267,685,685,1,0,0.0,1
1jsnrk7,2025 Japanese GP - Post Race Discussion,https://www.reddit.com/r/formula1/comments/1jsnrk7/2025_japanese_gp_post_race_discussion/,2025-04-06, Post-Race,"Suzuka, it's been a pleasure. 

What did everyone think of the race? How did your favourite driver do?","['“Tell me where I’m slow mate” - Lewis \n\n“Turn 8, 9, 13, 14, 17, mother fuckin whole track Lewis”', '""That\'s all the highlights?"" Oscar is like us today lol', 'We know who you are, Sazuka.\n\nhttps://preview.redd.it/yimqva1tr5te1.jpeg?width=492&format=pjpg&auto=webp&s=a489240cff4368806d9bd56037564515fa4b9c48', 'Max is incredible but that was the most boring race where the podium was separated by 3 seconds of all time.', 'My condolences to the interns who need to find 10 mins of highlights for the YouTube video', 'I have zero words. Just an unbelievably boring race. I spent most of it just looking at Lando’s interval to Max bounce between 1.1 and 1.5 seconds for 20+ laps.', 'I should have stayed in bed.', 'Max spent half the race thinking up that lawnmower joke, didn’t he? 🤣', 'Lmao tsunoda wins dotd over Antonelli and Verstappen', 'Yes Oscar, that is all that happened.']",256,3102,0.93,256,494,494,9,38,0.0,9
1jsoxhv,Verstappen's pit stop delay was due to Red Bull using reserve crew - Horner,https://www.reddit.com/r/formula1/comments/1jsoxhv/verstappens_pit_stop_delay_was_due_to_red_bull/,2025-04-06, News,,"[""It just shows how vital everyone is tbh. I didn't even know they had twins in the pit stop crew. I hope their dad is going to be okay."", 'Because two key crew members, who are twins, had to go home for personal reasons. Saved you a click', 'https://preview.redd.it/uwa74kt0d6te1.jpeg?width=1200&format=pjpg&auto=webp&s=c84e2f8606b9f0fb45e31219f5f77a1e310d9f51\n\nMatt and Jon Caller, RBR #1 mechanics and pit stop gunmen', 'Wondering how i never noticed the team had twins. Hope the dad pulls through.', 'Thank god it was just quick enough to let him stay ahead! And this explains GP’s message:\n\n>Not only was Verstappen’s pit stop delayed, the team also failed to complete a planned change in front wing flap angle. That meant his car’s balance did not change as Verstappen intended it to during his second stint.\n\n>”At the first pit stop, we didn’t get the front wing adjustment that we wanted into the car and so that compromised his second stint with a bit more understeer than he would have probably liked,” said Horner. \n\n>”But again, playing with the tools, working with his engineering team to help him with his diff[erential] settings and so on to help that balance, it was a phenomenal team performance to extract every ounce of performance from the car this weekend.”', ""It happens, delays and missed flap configuration. They'll use this as a lesson and get better at it, just shows that you can't leave one stone unturned and he almost lost the P1.\n\nRB mechanics are really amazing but they can't be amazing without training.\n\nIf they used the reserve team it's also for training purpose, after all."", 'Imagine running a team, and if you lose two people that could be difference in success', 'Rule #1: Never employ twins\n\n/s', 'Way to boost their confidence']",242,36,0.95,242,33,33,20,2,0.0,20
1jsntjq,"[MercedesAMGF1] A good haul of points in Suzuka 

P5 and P6 for George and Kimi at the Japanese GP",https://www.reddit.com/r/formula1/comments/1jsntjq/mercedesamgf1_a_good_haul_of_points_in_suzuka_p5/,2025-04-06, Social Media,,"['Super job Kimi!!', 'Russell looked much faster than Leclerc but no one was passing on this track and he cooked the tyres.', 'The Mercedes got faster on that hard tyre as they burned off more fuel. It was kind of insane.\n\nUnfortunate that George was released into traffic during the pit stop.', 'George again barely shown and has had a decent race', 'Impressive drive from Antonelli, broke 2 records, youngest driver to lead a GP, youngest driver to win fastest lap. Held off Hamilton, was 1s from George at one point', 'Grande Kimi!', 'They really had to pit George early when cars were barely 2s apart huh', ""Great race by Kimi, Can't believe he's only 18"", 'The GR special:\n\nQualify well\n\nDo not show up on screen during the race\n\nPick up solid points\n\nLeave\n\nRepeat', ""Kimi was just insane!!! I'd loved to have seen a few more laps to see a battle with George \n\nTough for George today. Couldn't get past Charles and undercut didn't work out. Didn't lose points to Ferrari so all good""]",241,50,0.98,241,48,48,5,0,0.0,5
1jsnx02,[McLaren] It’s a back-to-back double podium for team papaya,https://www.reddit.com/r/formula1/comments/1jsnx02/mclaren_its_a_backtoback_double_podium_for_team/,2025-04-06, Social Media,,"['Just two dudes standing tip-to-tip for this photo', 'This photo makes Piastri look like he really needs to return some videotapes.', 'they really edited them tip to tip', 'This has gotta be the most mid double podium ever. Don’t fight, don’t challenge, just settle for p2.', 'Not the ""tip to tip in japan"" i was looking for', 'Now kith', 'McLaren made the race boring by not keeping lando out .looks like they wanna win the wcc again', ""It's astounding how everyone is a master strategist in the comment section. This race has been a nightmare for the whole field in terms of following, except two or three genuine overtakes there were only those enabled by significant tyre advantage, which was not the case of Max vs. McLarens. The race has been effectively conserved since the lap one. The gaps between the teams are surprisingly small, McLaren doesn't have a rocketship everyone was talking about, it's all very competitive and tight. There wasn't much to do strategically in the front, virtually zero benefit in overcuts/undercuts. The track position was simply decisive."", 'I wish they tried something different somewehere to attack max apart from pushing and hoping to make an on-track overtake in Suzuka', 'One of the driver should stay longer on the track and other should be pitted early..Seems like McLaren too scared to gamble eventhough they have upper hand..']",239,185,0.88,239,170,170,11,1,0.0,11
1jsnrxh,"Verstappen wins the Japanese GP, Norris P2, Piastri P3",https://www.reddit.com/r/formula1/comments/1jsnrxh/verstappen_wins_the_japanese_gp_norris_p2_piastri/,2025-04-06, Video,,"['Too bad max is only going to get 8.3 on the power rankings', 'Congrats to Max on winning   ̶M̶o̶n̶a̶c̶o̶ ̶ Suzuka 4 times in a row!', 'According to Sky, Norris is still saving tires to challenge Verstappen', 'No Tsunodium 😞', 'that was one of the races of all time', ""An absolute all-timer for most boring race. \n\nTop 6 didn't even change position. Nothing interesting in the pitstops. \n\nAbsolutely dull."", 'They need to add a drs zone right before 130R.', 'How is dirty air killing tyres still a problem? We didn’t even get DRS trains, just boring 2 second gaps everywhere.', 'Boring race but just glad to see Max convert the pole to a win. McLaren looked out of their wits figuring out what to do about it', 'What a waste of 2 hours']",226,92,0.94,226,84,84,5,0,0.0,5
1jso5tw,Carlos Sainz summoned to the stewards for being late to the National Anthem,https://www.reddit.com/r/formula1/comments/1jso5tw/carlos_sainz_summoned_to_the_stewards_for_being/,2025-04-06, News,,"[""Carlos really can't catch a break at Williams 💀"", 'Has Carlos just given up lol? He’s breaking such a random assortment of rules this weekend', 'Carlos to the stewards right now:\n\n""I was taking a shit"" 🗿', 'Dsq from formula 1. Also jail time should work', 'RIP', ""Pity they're still so hung up about this.\n\nThe FIA never cared about this until the first (modern) Russian GP in 2014, when they suddenly issued a directive lambasting the drivers' and teams' supposed lack of respect, ordering drivers to stand at attention for the anthem. Why didn't they care about this disrespect at any of the hundreds of races prior to Russia '14? Must've been a total coincidence Putin chose to attend that race, of course.\n\nRussia's not even on the calendar anymore, and won't be for a long while (unless things get crazier), but they've still left us this gift."", 'The man has spent more of the weekend with the stewards than with his own team...', 'Here is a link to what his teammate said about that in the previous episode of driver promotion videos: [https://youtu.be/IPmTZsAVeAY?t=545](https://youtu.be/IPmTZsAVeAY?t=545)', 'I was having a shit.\n\n- Carlos Sainz, 2025']",212,64,0.97,212,61,61,10,1,0.0,10
1jso7pn,Gaps Between Teammates at The End Of The 2025 Japanese GP,https://www.reddit.com/r/formula1/comments/1jso7pn/gaps_between_teammates_at_the_end_of_the_2025/,2025-04-06, Statistics,,"['Antonelli continues to impress and this has been Bearman’s best performance so far. For the teo drivers that have been hyped before the season started, they have done well to measure up to their hype.', 'Alex “statpadding against slower teammates” Albon', 'Verstappen-Tsunoda being bigger than Alonso-Stroll', 'He really needed that Q3 in quali.\n\nIt was hard to overtake so no chance to get into top 10.', 'Ultimately this was more about qualifying, no one was overtaking so Yuki kinda lost it yesterday already.', 'Driver of the day...', '![gif](giphy|8NJzU4RTuq2D1IZIEd)', 'Another year, another Verstappen and Alonso outperform their teammates the most', 'Red Bull fighting with one arm behind their back for the constructors']",193,76,0.95,193,70,70,1,1,0.0,1
1jso53j,2025 JapaneseGP Race Results Visualized [via F1Visualized],https://www.reddit.com/r/formula1/comments/1jso53j/2025_japanesegp_race_results_visualized_via/,2025-04-06, Statistics,,"['All I see is LecRusAnt 🥐', 'Stroll staying true to his name today lol', 'It’s insane how close in gaps this was to being… a race', 'stroll being stroll hey', 'Group 1A\n\nGroup 1B\n\nGroup 2\n\nGroup 3\n\nGroup 4\n\nGroup 5\n\nStroll', 'Excellent result for Hadjar!', 'stroll in a league of his own', 'Stroll got so bored of this race he began lagging back falling asleep.', 'Stroll just chilling']",174,32,0.96,174,28,28,4,3,0.0,4
1jsorru,"Drivers' and Constructors' Standings - Round 3, Japan",https://www.reddit.com/r/formula1/comments/1jsorru/drivers_and_constructors_standings_round_3_japan/,2025-04-06, Statistics,,"['Max has all of Red Bull’s points 💀', 'The Verstappen racing team being 3rd in the constructors is not bad for a team with a single driver.', 'Wow Alex is cooking!! I’m so glad he didn’t get immediately destroyed by Carlos like some people thought he would', 'Congrats Hadjar! First points 3 races in!', 'Padre is on the standings at last!!', 'What do Max Verstappen and Lance Stroll have in common? \n\nThey both have fathers that live their racing fantasies vicariously through them, and they both have 100% of their respective team’s points so far this season.', 'I know Max is more interested in GT racing in terms of managing a team and F1 is also too expensive now but imagine a world where in 30 years we had Verstappen F1 team. \n\nThat would be epic since we basically already have it haha', 'Sainz needs to get a grip fr, but Hamilton in-between Albon and Ocon/Stroll is funny', ""Max having every point for Red Bull. It's actually hilarious how fucking good this guy is""]",174,44,0.98,174,41,41,9,0,0.0,9
1jspixl,Jacques Villeneueve and Crofty,https://www.reddit.com/r/formula1/comments/1jspixl/jacques_villeneueve_and_crofty/,2025-04-06, Discussion,"Everytime Crofty came on comms with a take that frankly, gave away he was a little lost since the race was mostly quali + pitstop strategy based and less on-track action/drama, Jacques goes ""yeahhh...."" then refutes his take with something more practical, less exciting and with a tone that might appear pretentious to some viewers. It was hilarious. Its like Jacques is trying to actively not tweak in his seat listening to Crofty's takes.

Although Villeneueve seems like he's a little stuck in the days he used to race in F1, I find his takes very insightful race craft wise (wdc afterall...), more than Crofty at least. And his opinion refreshing. I may not agree with him on some but it's refreshing to see a clash of opinions.

One instance during the last few laps: Crofty was like ""what are mclaren doing, let piastry pass lando to challenge max so we can finally have some racing"" and Villeneueve was like ""yeahh.... no he shouldn't, I wouldn't have lol. Every point counts individually, its champion mentality""


My conclusion is while Crofty's comms are more race focused with special attention to the viewers' entertainment, Villeneueve is more driver focused paired with his personal bias and opinions. I loved hearing both.","[""Crofty is taking the corporate line to breathe any life into a boring race...\n\n'Ooh lando has taken a few tenths off max'\n\nVery common, unfortunately for enfranchised viewers who know the race is dead it's a painful listen - but it's filling the air."", 'Jacques did shut down Crofty’s BS but usually then chriped in with his own BS which was worse because it was not even aimed at creating excitement', 'I think the only combo that would’ve been worse would’ve been if they had Danica commentating\n\nPair of them made me want to cut my ears off', 'Villeneuve might be fine for standalone analysis pieces before and after like Lazenby, but he is a woeful full race commentator.', ""I'd just have Button and Brundle with Rosberg chimming in with his brilliant tyre analysis. Which is weirdly interesting to listen to. Potentially the only person in the world that could waffle about the inner workings of a tyre for an hour and still be fascinating. \n\nSee if it works. If they need a play by play commentator, then I guess Crofty is a must. I find Crofty to biased and irritating. Anyone who has heard Villeneueve talk, surely knew he was going to be this bad"", 'Honestly I dont think JV was that bad they just have absolutely zero chemistry as a duo. It crossed from being painful to actually being funny at times.', '>""Villeneueve""\n\nWas he on Sky this weekend? I\'ve switched off the Sky feed after Alex Jacques came back to F1TV and haven\'t looked back since. \n\nDoesn\'t seem like i\'m missing anything worthwhile.\n\nI think besides Brundle there is no redeeming quality on the Sky feed over the F1TV feed. And i don\'t think Burdle sways the scale nearly enough to make Sky even remotely appealing. And if he\'s not there then there\'s literally no discusion.', ""Jacques Villeneueve is not an entertainer. He will give his  purely logical take in spite of how boring it might come across. \n\nCrofty's job is to amp up the excitement and keep viewers engaged. He gets a lot of flak for this, but I think he's very talented at his job."", 'Crofty tried to pin that pitlane debacle on Max, and Jacques was like huh? But other than that Jacques was reaching on a lot of things related to Max and the team today. Which I understand cause they have some stupid beef between them 😭\n\nI feel like Rosberg was a better driver pundit.']",172,142,0.81,172,131,131,29,24,0.0,29
1jso2kk,2025 Japanese Grand Prix - Race Classification.,https://www.reddit.com/r/formula1/comments/1jso2kk/2025_japanese_grand_prix_race_classification/,2025-04-06, Statistics,,"[""Let's hope Ferrari doesn't get disqualified, this would be their biggest points haul so far lol"", 'Fair play to Antonelli for bagging that fastest lap. Dude’s been impressive so far.\n\nHuge fumble from McLaren though. That said, Max is an alien.', 'Felt like free practice 4.', 'Feels like the first race in a while with no penalties!', 'Very very boring', 'Was hoping more for Yuki, but no one was really progressing.', 'This is a huge choke from McLaren. When you have the best car you have to win all the races like Max did at the start of last year. If RedBull bring an update that improves the car then McLaren are fucked if they keep doing shit like this.', 'Keep up the good work Albon 💪', 'Hadjar and Antonelli ripping it up.\xa0']",168,56,0.98,168,50,50,7,1,0.0,7
1jsts5m,"Lando: ""I don’t need anyone to tell me what max is capable of doing, [...] I know how good he’s been since we shook hands back in 2015 or something and i was half the height i am now [...] so i would say nothing is a surprise anymore but i still believe we're gonna have some good races",https://www.reddit.com/r/formula1/comments/1jsts5m/lando_i_dont_need_anyone_to_tell_me_what_max_is/,2025-04-06, Video,,"[""Max showing us Lando's height at the time is hilarious.\n\nhttps://preview.redd.it/c25o0i5tx7te1.jpeg?width=1447&format=pjpg&auto=webp&s=34a1df692578028867b05d9150069fc1dbdf8d9d"", 'Some people seem to forget that Lando openly supported Max against Mercedes in 2019-2021, including calling him a legend for winning the 70th Anniversary GP and straight-up saying he wants him to win 2021.', '**Lando:** ""I get a lot of questions like ‘Are you surprised of Max when he does a day like yesterday or a race like today’ and people except me to say yes but I don’t think there is a reason to be, I don\'t think i ever have. like you said, I\'ve always had a lot of respect for max. but there are those moments when you’re in the car and driving, you know what is good and what is not. I don’t need anyone to tell me what Max is capable of doing, whether I should think this or that, of course I’ve always got my own opinions but I’m always gonna have the respect.\n\nI know how good he’s been since we shook hands back in 2015 or something and I was half the height I am now so yea i don\'t need people to tell me these things, people seem shocked when I\'m not surprised and stuff like that but yeah i know how good he is and i know what he\'s capable of doing so I would say nothing is a surprise anymore but I still believe we\'re gonna have some good races and we can go toe to toe and some days he\'ll come out on top and in others i will.""\n\nhttps://preview.redd.it/4wlyz7qfs7te1.jpeg?width=2048&format=pjpg&auto=webp&s=96a501b77827830b6ed28c021b66348aa36b3100\n\nthe pic btw', 'Stupid question, very reasonable answer.', 'https://preview.redd.it/93102e7ms7te1.jpeg?width=620&format=pjpg&auto=webp&s=b881fa53abafd1bb82e0c2eb4863f10a9c06c3ae', 'X  xxxxx people', 'Some good races? In the best car? He obviously lacks confidence for winning the title.', 'Tbf Lando is definitely underperforming despite his podium run. When Lando won the Australian Grand Prix, I thought that this was the new Lando and that we would see him dominate the beginning of the championship like Max did last year, the fact he hasn’t won anything since in that car is astounding', 'What does he want max to do? Open the door and let him past? Max was always ahead in the pit lane and lando was running out of road, he was always going to have to back out']",191,77,0.95,191,70,70,191,77,0.95,191
