unique_id,post_heading,post_url,publish_time,tag,post_content,top_comments,upvotes,comments,upvote_ratio,score,total_upvotes_comments,total_score_comments,upvotes_growth_rate,comments_growth_rate,upvote_ratio_growth_rate,score_growth_rate
1mcy58b,Oscar Piastri has now scored the most race wins ever by an Australian driver in a single season,https://www.reddit.com/r/formula1/comments/1mcy58b/oscar_piastri_has_now_scored_the_most_race_wins/,2025-07-30, Statistics,,"['If Oscar wins the title this year he’ll be the first from a non-European country to win the WDC since Jacques Villeneuve in 1997.', ""Statistically he'll end up being the most successful Australian F1 driver by the end of his career in all likelihood. Though I still think Jack Brabham is the Aussie GOAT in F1 simply because he won the WDC in his own car."", 'Strewth', 'Hard to imagine he was almost going to drive for Alpine.', 'The most race wins ever by an Australian in a single season..... so far.', 'I think that Aussies in F1 have a pretty good success ratio given how few of them raced. 19 drivers, 4 WDC (won by 2 drivers), 51 wins, 151 podiums, 39 poles. And Jack Brabham did the coolest thing ever winning a championship in his own car.', 'Webber had 4 (the most) at the summer break in 2010. Moral of the story for Australians here is dont count your chickens yet.', 'Does this mean his 0.375 wins make it the most race wins by a Chinese driver in a season?', '“Oh” \n~Oscar Piastri', 'Oscar is doing everything that Ricciardo and Mark Webber wanted to do']",3768,206,0.97,3768,176,176,360,25,0.0,360
1mcii00,"On this day 52 years ago, Roger Williamson lost his life at Zandvoort. He lost control of his March and hit a barrier, rupturing his fuel tank and causing a huge fire. Fellow driver David Purley desperately tried to help his friend, but it was in vain. He received the George Medal for his efforts.",https://www.reddit.com/r/formula1/comments/1mcii00/on_this_day_52_years_ago_roger_williamson_lost/,2025-07-29, Throwback,"[https://www.asag.sk/bio/williamson.htm](https://www.asag.sk/bio/williamson.htm)

[https://www.youtube.com/watch?v=YIahysTJM\_8](https://www.youtube.com/watch?v=YIahysTJM_8)","[""Man I've never seen the image of Williamson in the cockpit post the fire being put out if that's what I think I'm looking at. Hard to grasp how deadly F1 was prior to massive safety regulations implemented on tracks and cars alike."", ""It's crazy how unsafe F1 was back there... it was quite common to have multiple deaths per year, something quite rare now."", 'The video of this is hearthbreaking.\n\nhttps://www.youtube.com/watch?v=b8Q_po7hLRs\n\nIts a tragic story all around. Williamson was not seriously injured from the crash. He was just stuck in an upside down car that caught fire.\n\nYou can see Purley desperately pulling over and running to the car trying to flip it and urging others to help but to no avail. The flames were too strong and nobody besides Purley had any fire protection. The marshals were severly untrained and underequipped in literal shirts and coats that offered no protection at all. There was also literally 1 fire extinguisher on the scene.\n\nHell they didn\'t even know there was a man still in the car initialy and neither did the race control who didn\'t stop the race for quite some time. They only realized once David Purley stopped his F1 car and franticly tried to help Roger by trying to flip the car\n\nRoger passed out due to the smoke and then sufocated and burned up in the car right there infront of them and Purley walked of head dejected. Purley later recalled he could hear the screams. Imagine going through that.\n\n> Purley: ""I can see why a lot of people wouldn\'t come to help me, but I think we could have done something more for Roger.""\n\nThe fire truck would ultimately not arive for 8 minutes after the situation became clear. At that point it was already way to late.\n\nAnd another grim fact. You would imagine that kind of event would cancel the race right? Or like at least they would have removed the car and body before racing on? Nope. The wreck of the car was simply covered by a blanket on the side of the road with Williamson still inside and the race was then restarted and finished.', '25 year old man right there. Damn..', 'Video link is [here](https://www.youtube.com/watch?v=1CdpJsm-mIE).\n\n  \nWhat an absolute tragedy.', 'Imo the hardest to watch crash in f1 history', '> The race was not suspended - and they just covered the car with the body in it until the end of the race.', ""Sometimes they don't get out."", 'Williamson was talked about in the F1 documentary “1”. The footage of this was one of the most heartbreaking things I’ve ever seen in the sport.', ""Tom Wheatcroft was a hard man. He owned Donington for a long time and brought the Grand Prix there in 1993. The morning of that famous race he suffered a heart attack, but still demonstrated a car that day afterwards. \n\nAll of that is to say what sort of a man he was. He was also Roger's financial backer and close friend. \n\nHe was utterly devastated by Roger's death and never quite got over it. He was known to shed a tear about that even nearly 40 years later.""]",2778,124,0.99,2778,3250,3250,43,1,0.0,43
1mcb4v2,George Russell: Mercedes closing in on agreeing multi-year contract extension with British driver amid Max Verstappen interest - Sky Sports,https://www.reddit.com/r/formula1/comments/1mcb4v2/george_russell_mercedes_closing_in_on_agreeing/,2025-07-29, News,,"['Kimi better get ready for the 1+1s', 'I am guessing Kimi gets a one year extension', 'So kimi is getting the 1 year contract.', 'Everything else would be silly. Russel is performing on a very high level this year and is dominating Kimi so far. I guess Kimi will get a 1 year extension to keep the door open for Max in 2027. \n\nI would LOVE to see George and Max in the same car!', ""Smashing.\n\nHe's carried the team this season and despite Verstappen obviously being an excellent driver, it would feel a bit rude to dump Russell for him."", ""Kimi's starting to feel like a bit too much of a project to be on a big 4 team. I don't mean that as shade or casting doubt on his potential, but Merc surely see the contrast against an experienced and polished guy like George."", 'There was actually no reason to replace Russell lol', 'I’m just glad I don’t have to replace my George merch now 😅', ""Jesus what did George do to some of you lol he's literally just a lad"", 'They literally can’t have a headline without “verstappen” in it no matter what it’s scout.']",2726,402,0.98,2726,8093,8093,19,1,0.0,19
1mcimym,The Hungarian GP has been on the F1 calendar every year since 1986. Since then only 3 drivers has won around the Hungaroring more than twice,https://www.reddit.com/r/formula1/comments/1mcimym/the_hungarian_gp_has_been_on_the_f1_calendar/,2025-07-29, Statistics,,"['1986 is 39 years ago, so it is indeed impressive that except for the 15 Hamilton/Schumacher/Senna victories, the rest are spread out between a lot of drivers.', 'So either Hamilton or Verstappen wins again this time around, or we get the craziest podium of all time.\n\n**ALL ABOARD THE ALBONO HYPETRAIN**', ""What's weird to me is that in my relative youth, Hungary was the beginning of the final run-in, and it's gradually become basically the middle."", 'Correct me if I\'m wrong but is Hungary also the track where there\'s most ""new winners"" or ""new pole sitters"", aka the track with the most first win or pole?\n\nOn the current grid there\'s Alonso, Ocon, Verstappen, Russell, Piastri. There\'s also at the very minimum that i remember, Kovalainen and Hill. \n\nAnyone else?', '8 wins is insane.', 'It would be funny if the next name to go on this list was Esteban Ocon.', '*8 times you’ve heard it before. Here’s a 9th for ya!*', 'Michael man, his presence transcends generations.', ""It's often a place for first wins. \n\nI'm putting my money on Yuki."", 'Damon Hill surely is the unluckiest person not to be on this list. That 1997 race is one of the most incredible turnaround in fortunes in F1 history, and it would have been incredible if he won.']",2571,113,0.98,2571,3308,3308,62,1,0.0,62
1mcaq99,[F1] A new-look Hungaroring is waiting for us in Round 14…,https://www.reddit.com/r/formula1/comments/1mcaq99/f1_a_newlook_hungaroring_is_waiting_for_us_in/,2025-07-29, Social Media,"[https://www.instagram.com/p/DMsO7bAvY9h/?utm\_source=ig\_web\_copy\_link&igsh=MzRlODBiNWFlZA==https://www.instagram.com/p/DMsO7bAvY9h/?utm\_source=ig\_web\_copy\_link&igsh=MzRlODBiNWFlZA==https://www.instagram.com/p/DMsO7bAvY9h/?utm\_source=ig\_web\_copy\_link&igsh=MzRlODBiNWFlZA==https://www.instagram.com/p/DMsO7bAvY9h/?utm\_source=ig\_web\_copy\_link&igsh=MzRlODBiNWFlZA==https://www.instagram.com/p/DMsO7bAvY9h/?utm\_source=ig\_web\_copy\_link&igsh=MzRlODBiNWFlZA==](https://www.instagram.com/p/DMsO7bAvY9h/?utm_source=ig_web_copy_link&igsh=MzRlODBiNWFlZA==https://www.instagram.com/p/DMsO7bAvY9h/?utm_source=ig_web_copy_link&igsh=MzRlODBiNWFlZA==https://www.instagram.com/p/DMsO7bAvY9h/?utm_source=ig_web_copy_link&igsh=MzRlODBiNWFlZA==https://www.instagram.com/p/DMsO7bAvY9h/?utm_source=ig_web_copy_link&igsh=MzRlODBiNWFlZA==https://www.instagram.com/p/DMsO7bAvY9h/?utm_source=ig_web_copy_link&igsh=MzRlODBiNWFlZA==)

[https://www.instagram.com/p/DMsO7bAvY9h/?utm\_source=ig\_web\_copy\_link&igsh=MzRlODBiNWFlZA==](https://www.instagram.com/p/DMsO7bAvY9h/?utm_source=ig_web_copy_link&igsh=MzRlODBiNWFlZA==)","['Always had a soft spot for the Hungaroring. I just wish the on track action was a little better. It definitely feels like one of those ""drivers tracks""; fun to drive, but not so fun to race, at least in the current regs.', '100% taxpayer money btw 🙃', 'What do those weird zigzag lines represent in paddock??', ""The real track finally matches the F1 game track. 😂\n\nThey've been using the new grandstands for a while now."", ""Our country's hospitals and schools are collapsing, we barely have any teachers or doctors anymore and our government just implemented a Chinese facial recognition system to monitor our people but I'm glad my tax money went for this new-look"", 'This track has been the biggest DRS success story by a wide margin. Wonder what the future holds with the switch to active aero starting next year.', 'Any actual track changes?', ""Oh that's where Orban puts the money he blackmails from the EU by vetoing everything."", ""Can't wait to see all the overtaking not happening during the race"", ""It's interesting to see people crying about the costs of the renovations when pretty much nothing has changed around the track since 1986. I think an investment into an economically significant cultural event is pretty low on the list of the sins of the Orbán government.""]",2056,186,0.99,2056,4245,4245,14,3,0.0,14
1mcnvxk,"Fun Fact: Pierre Gasly holds the record for the highest career points per race in Formula E history, having scored P7 and P4 in his only appearance at the 2017 New York City ePrix.",https://www.reddit.com/r/formula1/comments/1mcnvxk/fun_fact_pierre_gasly_holds_the_record_for_the/,2025-07-29, Statistics,"In the photo, Gasly is with Alain Prost, who was the team owner of e.dams Renault at the time. Gasly’s teammate was Nico Prost, Alain’s son. 

Pierre beat Nico Prost in both races on his debut.

Gasly shares this record with former F1 driver Franck Montagny, who also scored 18 points in two races. However, Montagny’s career ended abruptly after he tested positive for benzoylecgonine (a cocaine derivative) following the 2014 Putrajaya ePrix. He was banned for two years and disqualified from his final Formula E race.","['Little did he know the Red Bull and Renault logos in this outfit were both hints at his future', 'he looks like a weird mannequin of himself.', 'Kinda weird no one ever beat that, that’d be an average of 9 points per race. Verstappen has 14.6, hamilton has 13.5, you’d think there would be at least 1 short term driver with a decent career who would get an average finish higher than 6th across his career no?', 'i\'m too stupid to understand what that means, or my english isnt good enough at the moment.. ""the highest career points per race"".. as the average between the 2 races?\n\nor that they run 2 races in a single circuit, and none has manage to do better than p7 and p4?', ""What a fun factoid! I only learned about Pierre's brief stint in Formula E a few months ago and therefore feel obligated to share [this clip](https://youtu.be/gObZ8nTWcWU?t=541) of Pierre crossing the finish line (I think this is the race he finished P4) with a fucked up tire after running into/being ran into the wall by Nick Heidfeld...and then hitting the opposite wall and fucking up another tire after the finish line. Crashes aside though (which weren't necessarily his fault to be fair), it's very impressive for his only weekend in FE!"", 'The guy he replaced lost the championship because he missed these 2 races.', 'Now we understand why statistics culls the outsiders.', 'I suddenly wondered if drug testing happens in F1.\n\nCan anyone give me an idea  about it?', 'That nose on Prost is an absolute unit']",1422,44,0.98,1422,1134,1134,47,0,0.0,47
1mcbkbb,Power Rankings after the Belgian Grand Prix,https://www.reddit.com/r/formula1/comments/1mcbkbb/power_rankings_after_the_belgian_grand_prix/,2025-07-29, Social Media,,"['The weekly rage bait has arrived.', 'Power rankings exist for no reason other than to piss everyone off.', 'Leclerc not even a 9 after absolutely maximizing the weekend.Lol.these rankings are really a joke.', 'What could/should Leclerc have done better this entire weekend lol', 'Where is Ocon ?? He qualified well in both qualifying sessions. He was 5th in the sprint ! And if it wasn’t for the huge strategy fuck up by Haas (pitted 2 laps to late loosing him like 15 seconds and put on old mediums instead of new ones), he would also have gotten points in the main race. Also his defense against Antonnelli was great', 'Yay! Time to argue pointlessly over placements!', ""Lawson getting some love. It's good to see him settling into a groove after the start he had to the year.\xa0"", 'Imo Charles is 9 at least, Max should get 8.8 or higher cuz he won sprint but his tiny mistake in quali cost his podium so understandable. George should be a solid 8 but Merc is a piece of trash this weekend lol.', 'Leclerc underrated in these as always. I don’t see what more he could have done this weekend.', 'Where is Ocon ? Even if the race didn’t go his way because of the strategy, he was 5th in the sprint.']",1237,257,0.86,1237,6100,6100,14,0,0.0,14
1mc9k1v,"""I'm down to try"": How Hamilton changed his mind about crucial Spa pit stop",https://www.reddit.com/r/formula1/comments/1mc9k1v/im_down_to_try_how_hamilton_changed_his_mind/,2025-07-29, News,,"['Hold on... \n\nSo, the perfectly timed pitstop was initially suggested by the Ferrari Pitwall?', 'Maybe the communication gremlins between Lewis and Adami in the first half of the season were just that: gremlins to be ironed out.', 'This was the only right call for the pit-lane starters, sad the others missed out', 'maximized his race. Unfortunate about track limits in quali, I would have loved to see the direct video footage of the tires going over the line. From the perspectives shown, it was unclear. Lewis definitely had more to give in that quali', 'Rare Ferrari strategy W', 'At least something positive for the Lewis side of Ferrari to talk about from this weekend.', 'See racefans continues to be an absolute garbage experience on mobile.', 'They’ve been pretty decent this year; the pit stops have been 🔥\n\nStill have the odd error but Red Bull are more error prone than Ferrari this year it seems. Watch them come out with 3 tires at Hungary for Lewis now.', ""That day we weren't the clowns.""]",1064,72,0.98,1064,3079,3079,3,1,0.0,3
1mc8qqz,[Motorsport.com] “Turkey prepared to step in for 2026 F1 calendar if other circuits cancel”,https://www.reddit.com/r/formula1/comments/1mc8qqz/motorsportcom_turkey_prepared_to_step_in_for_2026/,2025-07-29, News,,"['The Covid seasons are proof enough of the fact that there are several circuits willing and able to step in at short notice if needed.', ""I mean.... It's not a bad idea to have a circuit or two as an option in case the poop hits the fan..."", 'Begging that the Madring isn’t ready for its debut on the calendar for September next year and that Istanbul can take its place instead.', 'Turkey is most sadly destined to stay this way. Street tracks are venue money printers. And rest of the actual tracks all trip over each other to stay afloat. Reminder turkey doesnt even have the 200 million plus dollars to pay for a normal calendar entry.', ""Just give this circuit a few years to prove its worth. There hasn't been a single bad Turkish Grand Prix. 2005 was fun, 2010 was action packed and 2020 was a modern classic."", 'Can we just have a list of countries who ARE NOT prepared for a GP? At this point I’m waiting for the “NASA confirms Moon is in talks with F1 about Lunar GP in 2029”', '>\xa0if other circuits cancel\n\nUnderstand as Madrid\xa0', 'The Italian Automobile Club (aka the Italian FIA member association and race promoter) has said during the press conference where they unveiled the official 2025 Monza poster that Imola will have the ""reserve circuit"" role for 2026 and 2027.\n\nSo, that\'s a no for Turkey, only wishful thinking.', 'Madrid, do your thing!', 'My Dream Calendar\xa0🙏\n\n01 Australia - Mebourne\n\n02 South Africa - Kyalami\n\n03 Bahrain - Sakhir\n\n04 Turkey - Istanbul Park\n\n05 Europe - Imola/Baku\n\n06 Spain - Barcelona\n\n07 France - Magny-Cours\n\n08 Monaco - Monte-Carlo\n\n09 Canada - Circuit Gilles Villeneuve\n\n10 East United States - Indianapolis\n\n11 Great Britain - Silverstone\n\n12 Netherlands - Zandvoort\n\n13 Belgium - Spa-Francorchamps\n\n14 Germany - Hockenheim/Nürburgring\n\n15 Austria - Red Bull Ring\n\n16 Hungary - Hungaroring\n\n17 Italy - Monza\n\n18 Singapore - Marina Bay\n\n19 Malaysia - Sepang\n\n20 China - Shanghai\n\n21 Japan - Suzuka\n\n22 United States - Austin\n\n23 Mexico - Mexico City\n\n24 Brazil - São Paulo']",937,112,0.98,937,2743,2743,4,1,0.0,4
1md1r0p,Oscar Piastri is currently on the 3rd longest point scoring streak in F1 history. He needs 10 more consecutive point scoring race to take the #1 spot!,https://www.reddit.com/r/formula1/comments/1md1r0p/oscar_piastri_is_currently_on_the_3rd_longest/,2025-07-30, Statistics,,"['that determination to reverse out in australia comming in clutch', ""He didn't score in the Miami 2024 race, he scored in the sprint, but then that's a different stat."", ""Very possible with the way he's driving and the car he has. But it only takes one mistake or one torpedo to end it."", ""Fair play to Schumacher doing it in the early 2000s, wonder who's the highest here from the unreliable 80s and 90s lol"", 'The fact Lewis is on this board 4 times is incredible', 'Reliability is impressive, car is a rocket this is doable', 'Didn’t Lando dnf in Austria 2024 ?', 'You just jinxed him now', 'Kimi in the Lotus was magic wasn’t it.', ""Max DNF'd in Australia 2024 (the race after Saudi Arabia) due to brake issues. Sainz went on to win the race, after coming back from an appendix Operation.\n\nLando crashed out in Canada this year, trying to overtake Piastri.""]",979,80,0.97,979,77,77,400,17,0.0,400
1mcyzpk,[audisport via IG] The next step towards 2026: @revolutapp becomes the title partner of the future Audi F1 Team,https://www.reddit.com/r/formula1/comments/1mcyzpk/audisport_via_ig_the_next_step_towards_2026/,2025-07-30, Social Media,,"['Thats crazy. I dont know about other countries, but in Germany there are so many Revolut product placements on YouTube, they are pushing for advertisement in the last couple of months. :O', 'Thank goodness Stake is gone. I always found it slightly harder to support Sauber while car while they had such a dreadful company (both Stake & KICK) all over their car.', 'Any idea what their brand colours are? trying to picture if their branding will clash with the typical Audi livery design.', '[https://www.instagram.com/p/DMuKKRiNXr-/](https://www.instagram.com/p/DMuKKRiNXr-/)\n\nThe Post btw', ""Finally, something I use on a daily basis becomes an F1 sponsor.\n\nWell Hell sponsored Williams in 2010-11, but back then I was only 4-5, so hopefully I didn't drink energy drinks lmao"", '**R**evolut **A**udi **F**1 **T**eam... RAFT?', ""I might do some currency conversions during the weekend to support Hülkenberg's team with a couple cents."", 'Next step -> Trading 212 Cadillac F1 and NordVPN Porsche F1 team', 'That’s a good sponsor', 'Revolut is actually useful, so not a bad sponsor.']",848,92,0.99,848,89,89,62,3,0.0,62
