unique_id,post_heading,post_url,publish_time,tag,post_content,top_comments,upvotes,comments,upvote_ratio,score,total_upvotes_comments,total_score_comments,upvotes_growth_rate,comments_growth_rate,upvote_ratio_growth_rate,score_growth_rate
1mcckj6,My experience at the Spa GP.,https://www.reddit.com/r/formula1/comments/1mcckj6/my_experience_at_the_spa_gp/,2025-07-29, Discussion,"Hi guys,


I want to share a story from after the race that myself and my family experienced at the Spa GP. I want to preface it by saying that we all had a great overall time at Spa (it was my second visit and the others first) and we will definitely be back, however:  



Myself and my group were in the Gold 3 stand (weekend tickets) and luckily as we were leaving we saw a disabled person pushing another disabled person in a wheel chair just to the rear of the grandstand walking towards where the your tickets were scanned. This is obviously a very steep hill, as such if the person had carried on pushing the wheel chair this would have ended up in a huge accident as they could not have gotten them down the hill. With thousands of other fans leaving at the same time this would have caused some serious injury to both of the men and other fans.

 

Luckily for the 2 men, myself and my family noticed this and offered to help them. After wheeling them down the hill we realised we obviously had no idea where to take them as surely the organiser would be responsible for getting these people too their grandstand and from their vehicle. Unfortunately both gentleman had issues with speech (as well as being French and we are British) so communication was incredibly hard. We eventually managed to figure out that they had been transported from the Les combes car park park and ride area (about a 45 minute walk) by the red cross. So we found some security guards in the hopes they could point us towards the red cross who we would have assumed had a vehicle capable of transporting them.



 

After spending 15 minutes talking with the red cross the outcome was that we could wait 90 minutes and there would be a chance they could take them (they implied it wasn't likely) or they would have to find their own way back to their vehicle. This was obviously not acceptable as at this point it was already 6pm and us not knowing when the park and ride finished we couldn't risk getting there and then having no idea where the gentleman's car was. So we opted to push the wheel chair and assist the gentleman in walking back, even though the walk would obviously tire the man out beyond what's acceptable for him to then drive home.

 

On the walk back we passed 2 red cross medic areas, the first one, the only help they offered was some foil blankets (which I had to request) as the gentleman in the wheel chair was clearly visibly very very cold, they did not have a wheel chair or anything useful to help us get the other man back (who could walk but had leg braces and struggled). The 2nd red cross medic area recognised the man, so they were clearly the ones who helped him get to Gold 3 to begin with, however when we questioned them on why they had not thought about the obvious fact they'd need to get home they stopped engaging with us in English and refused to help any further, claiming 10 of them needed to man the station at all times, they also did not have a wheel chair we could use.

 

So we carried on walking them back to the park and ride, luckily getting one of the final busses of the evening, so had we waited for the potential help from red cross and it not come, they would not have been able to get back to the car park. By the end of the walk we were having to carry the man who could walk because he was exhausted, overall it took 2 hours to get them back. The only positive interaction we had with any staff member from Spa was one of the shuttle bus stewards who was very helpful in getting them on the bus and then ensuring that people on the bus would help them on the other side, as we could not board the bus, since we were staying in green camping.

Overall myself and my family are appalled at the level of accessibility at the track and have never encountered a worse situation. Had we not been there at the right time to help these 2 men out, they at worse would have had a huge incident leaving Gold 3 and at best just never got back to their car. Out of the 15-20 staff members we spoke to (who were mostly polite just not helpful) only 1 was any real help. We were even refused to push them back on the track to green camping (which would have been much smoother and quieter making the walk a lot easier).

I have posted this for some visibility at the issue, while having also emailed Spa.","['Also was there, and had an overall amazing experience. \n\nBut agreed - the majority of security/staff were bloody useless. On the Friday we asked for best directions to get to Silver 5, the first told us to go past Eau Rouge and round Combes (35k+ steps that day…) and everyone after that didn’t even have Silver 5 on their maps!', ""as a disabled person who's been on the 3 sides of your story - thank you so much from the bottom of my heart."", 'This hasn’t changed. We were there in 2013. Shameful. \nOurs was similar to yours.', 'I was there in 2015 and found a lot of the staff at the track back then were just plain fucking rude. Whenever we asked a question, like ""excuse me, we\'re just looking for...."" we\'d be interrupted with a loud ""Non!"" while their face would be all scrunched up like they\'d just encountered a walking talking dog turd, and all the while they\'d be wafting their hand at us which also told us to go away. Rude bastards. We even came away with a catchphrase, whenever we asked each other a question one of us would petulantly shout ""Non!""\n\nI can see why OP had such a bad time asking these people for actual help. Bad service is like a culture for them there. \n\nThat said, Spa should never leave the calendar but they could do with nicer staff.', 'Thank you for bringing awareness to the lack of accessibility issue and for helping the two men.', 'I already posted this to a other post: I loved the experience at Spa. I love the racetrack, the energy of the crowd, the excitement…\nBut the organization around the track was a living hell. \nIt took us 4 hours to get off the parking area to reach the highway. \nWhen we forgot to bring sun screen on Friday, we really had to beg the medics to give me and my wife some sunscreen. \nThe fresh-water situation was quite bad. \nThe coordination of the police guiding us to the parking areas and away from it was a living nightmare.', 'Yeah, that’s Belgium for ya. Luckily we know how to navigate it and we were home within 2,5 hrs of race finish, but indeed access is abysmal. On Saturday, we couldn’t even access Gold 1 directly, the road was blocked for an unknown reason. We had to walk all the way around to the fanzone. Then when we came to the entrance of Gold 1, the road was opened again, so we basically nearly missed the sprint for nothing. Glad we were on time though.\n\nIt’s not just this event either. We went to Werchter Boutique a couple of weeks ago and had to wait (standing dead still) on the parking lot for 2 hours before traffic even started moving and we could leave the parking lot.', 'I agree logistics are a nightmare at Spa. I’m convinced that the main reason for the traffic congestion is because everyone wants to park as close to the circuit as possible. Because there’s only one main road, this means the shuttle busses are stuck in the same traffic jam as all the cars and the people on foot. There’s enough possibilities for tarmac parking further away and organise continuous shuttle busses. This would be way more efficient. \n\nBtw, we went by bike. It was awesome, with beautiful sights and should really be promoted more.', 'Thank you for your efforts dedication and persistence. Rare proof of humanity. Your group probably saved two lives. I really hope this has consequences and will change something.']",663,103,0.93,663,1204,1204,12,3,0.0,12
1mcegdr,[williamsracing] An excellent season so far for Albono!,https://www.reddit.com/r/formula1/comments/1mcegdr/williamsracing_an_excellent_season_so_far_for/,2025-07-29, Social Media,,"['Fun fact: Every team has atleast one Top 6 finish this year', 'JV is doing a great job at Williams', 'Last time a Williams driver had 4+ Top 6 finishes? Valtteri Bottas in 2016, with 6:\n\n- 4th in Sochi\n- 5th in Spain\n- 3rd in Canada \n- 6th in Baku\n- 6th at Monza\n- 5th in Malaysia', ""Soooo... when is he going to start getting stomped by Sainz again?\n\nJoking aside I'm so glad that he's getting the respect he deserves. And it looks like Carlos is starting to figure things out so once both of them are performing at 100 percent we're going to be in a pretty great place I think. Definitely the best driver lineup in the midfield."", 'As a Williams fan ,,Williams on 5th” is  something I wanted to hear for past 8 years', 'vowles is cookin', 'Albon is my favourite driver after Hamilton 🙂', ""He's been proving a lot of people wrong this season. It's been good to see."", 'My GOAT.', 'Top 5 performer this year, making Sainz look relatively average']",595,39,0.97,595,817,817,9,0,0.0,9
1mcyflf,"OTD 25 years ago, Rubens Barrichello won his first race in F1 at Hockeinhem",https://www.reddit.com/r/formula1/comments/1mcyflf/otd_25_years_ago_rubens_barrichello_won_his_first/,2025-07-30, Throwback,"The brazilian born in São Paulo on May 23, 1972, had to wait 8 seasons and 123 races before he climbed the highest place on the podium. 

Many people say that Rubens was one of the best F1 drivers not to win a title. 

Barrichello was in F1 for 19 seasons, raced in 326 GP's, won 11 races, finished 68 in the podium and have two vice championship's for Ferrari (02 and 04). ","['What a day, starting 18th, the chaos with the man on track during the race, and at the end staying out on dry tyres in the rain to snatch his first victory.\n\nAnd then crying into the Brazilian flag on the podium.', ""This was the race where a recently sacked Mercedes employee went for a trackside walk as a protest and probably helped convince FOM to ditch Hockenheim's forest straights right?\n\n\n(If those weren't already on the way out that is)"", '""You are watching a sensational drive being completed with Rubens Barrichello from Sao Paulo, Brazil winning for Ferrari and he\'s done it! Superb!""', 'That was an all-time race, it had it all. People often mention how emotional Barrichello was on the podium but you also gotta give props to Mika Hakkinen and David Coulthard for recognizing his first victory.', ""Good thing Schumacher wasn't running P2 in that race"", 'One of the interesting things about old Hockenheim was that because it was so long as a track, there were wet conditions at one half of the track and dry conditions at the other. Rubens kept the dry tires and was faster in S3 but Mika was a lot faster in the wet long straights.', 'That was the race that had a split weather going on at the end of it?', 'His reaction on the podium that day was amazing. One F1 hill that I’m prepared to die on is that he is hugely underrated as a driver by people these days because  he spent so long playing Schumacher’s wingman at Ferrari.', 'The best and most unfortunate rear gunner to ever grace F1.', 'Still so grateful that I was there as a 16 year old kid. Covered in Mika merch with a big horn in my hand surrounded by Germans while Schumacher was hit at the start. Pretty sure many people would have killed me if I wasn’t a kid.\n\nOnly later I found out the significance of this classic race, but I’ll never forget Barrichello’s tears and the guy blocking the circuit. Even my mother called to say how good it was - she hates F1.']",546,46,0.99,546,44,44,49,1,0.0,49
1mcsd07,Verstappen and Hamilton collided in Hungary 2024 – a memorable chapter in their rivalry.,https://www.reddit.com/r/formula1/comments/1mcsd07/verstappen_and_hamilton_collided_in_hungary_2024/,2025-07-30, Video,,"['This situation was so odd because Lewis defended Max in the stewards room and said it was a racing incident. Max said it wasnt and Lewis was at fault. Stewards wrote both were at fault in the document and Lewis said he was surprised by it and would talk to whoever typed it up about it later.', 'Last year Hungary melted everyone’s brain lol. EVERY SINGLE ONE was mad.', 'That and the hostage scenario at McLaren, I’d like to forget Hungary last year', 'It was the day Max had a meltdown with both strategic errors and car performance too', 'Slightly suboptimal.', ""It's still insane that neither of them got any significant damage, especially when Verstappen slammed his floor to the ground."", 'I remember laughing my ass of at how furious Max was at the car on the radio.  It felt so nice seeing Mad Max being reborn.', 'collided in the same way a torpedo collides with a submarine', 'He’s through! OHH! Out goes- out goes Max Verstappen!\n\nThat didn’t work Max, you hit the wrong part of him my friend! I don’t think that will cause Hamilton a problem!', 'I had completely forgotten this happened. Think there was something more dramatic that race.']",516,146,0.92,516,135,135,28,22,0.0,28
1mce0q5,What Mercedes think is behind Antonelli's recent F1 2025 struggles,https://www.reddit.com/r/formula1/comments/1mce0q5/what_mercedes_think_is_behind_antonellis_recent/,2025-07-29, News,,"[""George said it best. Antonelli's relative pace isn't worse the car overall is worse."", 'If his time at Williams taught us anything, George is good at hauling a shitbox.\n\n\nKimi skipped seasons of F2 to get dropped straight in the deep end.', 'The cars gotten worse, and Antonelli lacks the experience to drive around it to the extent George and previously Lewis were able to, which is reflected with his struggles the last few races.', 'Almost 4 years in and Merc still can’t produce a decent car with this set of regulations.', ""He came into a quote/unquote 'top team' too early, as said in the article he has zilch experience when driving difficult cars, re George in a Williams. \n\nI really hope that in the time it takes to get the car more 'stable' it doesn't eff up his confidence too much."", ""Toto said it'd take three years for Kimi to develop so on that basis he's fine."", 'He’s a rookie, in a car that isn’t the best\n\nHe’ be fine, this year was always meant to be a training year for Kimi before the new Regs anyway', 'Guys Kimi is a multimillionaire kid living his dream. You don’t need to coddle him. He will be okay', 'The car + he’s a rookie, it’s not that complicated. He didn’t suddenly lose his talent. Like almost every other rookie he’s gonna take time to develop.', 'Kimi should still be in F2, the jump was a couple of years too early\n\nnot every talent will be like Max']",227,107,0.94,227,1445,1445,0,3,0.0,0
1md2ms5,McLaren are already in the top 20 of most constructor points scored in a season in a little over halfway through 2025!,https://www.reddit.com/r/formula1/comments/1md2ms5/mclaren_are_already_in_the_top_20_of_most/,2025-07-30, Statistics,,"[""Man we need this with old seasons adjusted for modern points, I know there's more races now so none likely still get in but would be interesting"", 'If it continues like this they’re definitely breaking the all time record', 'Mclaren are gonna break the all time record easily. They are so far in front and every other team abandoned development. They also have two very good drivers, which neither Red Bull nor Mercedes (post Rosberg) had.', ""As per usual with these stats: pointless (no pun intended) because more races and different points system. If they had the 25-18...-1 system in 2004 and 24 instead of 18 Grands Prix, Ferrari would've hit 850 points for example."", 'How did 2021 give out a half point? Spa?', 'Bruh that 2023 season lmao. I don’t want to hear anything about McLaren being more dominant.', 'One of the most useless stats ever.', 'This is really a non sensical statistic. 2024 is on there 3 times!\n\nReally only says: More points given since 2010 and more races every year', 'Just a fake stat since you will never see 2000-2004 Ferrari on here', 'As someone else said, the points system changes have made any season before 2010 makes this not a very good comparison. Secondly, there are more races (and sprints) these days compared to even 10 years back. The best statistic would be an equalized points system and then checking points per race for each team. The unreliability of yesteryears would be equalized by the need for modern team to sustain peaks over longer seasons.\xa0']",256,88,0.9,256,84,84,256,88,0.9,256
1mcgo2u,Inside Piastri's Decisive Overtake On Norris In Belgium | Jolyon Palmer’s F1 TV Analysis,https://www.reddit.com/r/formula1/comments/1mcgo2u/inside_piastris_decisive_overtake_on_norris_in/,2025-07-29, Video,,"['Excellent analysis, love looking at the data for things like this. The pass was a combination of:\n\n\\- A better start for Oscar to allow a lift and help recharging to give him a battery delta.  \n\\- Poor mistakes at the chicane and turn 1 exits by Lando to keep the gap close.  \n\\- Utterly masssive gonads on Oscar to follow that close through Eau Rouge in the wet.', ""I like these analysis vids by Jolyon Palmer, it really explains some things I don't understand."", 'Wish Sky would go looking for analysis like this when Oscar does mega shit like this.\n\nThey always just focus on what Lando did wrong/What problem Lando had.', 'Oscar is really impressing me this year. He’s calculated and decisive. He makes decisions in a way where he avoids risky conflicts with drivers (notably when racing Max at a few times this year). Through it all he’s just a chill guy.\xa0', 'I wonder how much the slipstream helped with energy usage for piastri, allowing for higher charge later.\xa0', 'JP is auditioning for the cast of Tropic Thunder II', 'I remember watching Lando accelerating and thinking it was a weird place for Oscar to attack. Then as they crossed the line I realized Lando did it too early.', 'This is the guy that said Piastri wouldnt even get a podium', 'Did Lando just reference ""2Pac - Changes"" when he said/sang ""That\'s just the way It Is"" at the very end of the video? LMAO', '⅔ of the pole sitters lose their lead at Spa on Lap 1. It would have been strange if Oscar didn’t get the lead.']",151,69,0.87,151,560,560,3,7,0.0,3
1md0e8e,The Circuit of Spa-Francorchamp is Honoured to Launch An Official 2-Euro Commemorative Coin,https://www.reddit.com/r/formula1/comments/1md0e8e/the_circuit_of_spafrancorchamp_is_honoured_to/,2025-07-30, News,,"['Thanks for sharing, I just got 2', '11€ for a 2€ piece? Is it just me who thinks it is wrong?', 'i want one but itd cost me 35 dollars', 'Cost 11 euro for each?', 'A lot of historical landmarks have commemorative euro coins, but the price depends on the place, technically it is worth 2 euros.\nI bought one at a tank museum which is the same type of coin, but was sold for 2 euros', ""I mean... it's memorabilia, you don't really buy it for the official value as currency. What's the value of a poster of the track, or a keychain?"", ""You must be new to collector coins (which is completely fine). Here's a Canadian Dollar being sold for $85 CAD: https://www.mint.ca/en/shop/coins/2025/special-edition-proof-silver-dollar-50th-anniversary-of-the-beaver-as-an-official-symbol"", 'It depends on the quality of the coin.', '+ delivery yep', 'If it would be sold for 3€ or even maybe 5€ I would consider it but 11€ is a bit over the top for me personally. But maybe not for someone else :-)']",136,18,0.97,136,16,16,18,4,0.0,18
1md362x,F1: The Movie Passes $500 Million worldwide,https://www.reddit.com/r/formula1/comments/1md362x/f1_the_movie_passes_500_million_worldwide/,2025-07-30, Discussion,"With the F1 movie now passing the $500 Million worldwide box office barrier and given it is an apple TV+ product making box office revenue a less important part of the revenue streams do we think the movie has been a success? and regardless will it be good for the sport?

Given the product placement sponsorship within the movie its self and the reported low marketing budget ratio compared to traditional box office releases I would be surprised if Apple considers it anything other than a success from their perspective and that's what is important as far as getting future racing movies.

[https://www.boxofficemojo.com/release/rl2507374593/?ref\_=bo\_hm\_rd](https://www.boxofficemojo.com/release/rl2507374593/?ref_=bo_hm_rd)","[""All profits go to Alpine's wind tunnel"", ""It's doubled the next biggest grossing F1 or motorsport movie. \n\nIf this isn't success, what is?"", ""When the BOX OFFICE subreddit is giving the $500m props, but uninformed Reddit doomers are saying it's bad in this thread - you have to laugh"", ""I'm of the personal opinion that the movie has been a success, I think it has shown that racing movies done right (even with their sprinkle of Hollywood logic) can absolutely make money for the studios behind them and I'm happy about that. I want more good racing movies and if this had tanked it would have been to racing movies what cutthroat island was to pirate movies and sank the whole genre.\n\nAs for good for the sport, I don't think it can be bad, for years to come on streaming its going to have people watching it and some of those people will become interested and become fans."", 'Financially yes\n\nThe Gross budgets was reported to be $300 Million\n\nbut the Net Budget (when you remove the UK Tax Rebate, The Abu Dhabi Rebate and add in the sponsorship & tie-ins) is reported to be $200 million\n\nAs a quick rule of thumb to estimate the break even point at the box office you multiply the production budget by 2.5\n\nthis covers the distribution costs, the cinemas cut and marketing.\n\nso $200 million x 2.5 is $500 million. Its current Box office is $510 Million so its near or near abouts its break even point.\n\nFor most films the threshold for a successful film is to break even at the Box Office so that any money made from, streaming, digital and Physical sales is practically pure profit.\n\nF1 is still pulling in millions at the box office each week and is due to have an Imax expansion in August, so will probably start making a profit in the Theatrical window still.\n\nThis is a big success for Apple', ""yes, it has been a success.\n\nwhen my coworker, after 3 years of me telling him how awesome f1 was, and to start watching drive to survive at least to get familiar didn't work, the F1 Movie definitely worked. Now he hit me up about COTA tickets and and he killed season 1 of DTS in 2 days.\n\nSo yeah, it did what it was meant to do: get more people interested in the movie.\n\nIt met the financial goal, at least from what I can tell atm.\n\nThe lasting effects of this movie are positive."", 'Should continue to have legs as it does have worldwide appeal. Definitely a success.', 'It all depends on cost to make it but 500 is definitely not a flaw', 'The Budget is around 300million and marketing is probably around 150-200million, so they have only just entered profit at 511million. \n\nI rekcon it will top out at 650million,']",280,70,0.92,280,65,65,280,70,0.92,280
1mcbhqx,[Le Figaro]: Renault names François Provost as de Meo replacement,https://www.reddit.com/r/formula1/comments/1mcbhqx/le_figaro_renault_names_françois_provost_as_de/,2025-07-29, News,"
According to le Figaro, Renault names its current head of procurement, international development and partnerships as Luca de Meo's successor. 

I do not know his stance on F1, but he seems like a de Meo ally and as head of partnerships and international development, it would seem strange if he decides to drastically change course.","[""One french site recently speculated that the team may return to using the Renault nameplate, i don't remember the site or the link but it was posted here"", 'Waiting to see how I should feel about this. \n\nHe once called motorsports ""the next frontier"" but talk is cheap...', 'Almost like the pope', 'Bring back the 2016 Renault livery.', 'Sell the team - end the torture for the family and everyone else.', ""Ahh, you've given me mouses eyes. I'm afraid of cats."", ""Searching around, seems to be mostly a bean counter. Google indicates some links have been removed with the EU privacy law that's only every used to hide stuff for famous people and politicians so something* is being scrubbed."", 'Another day another Alpine leadership change', ""That'd be very odd considering Renault no longer sells performance cars (5 Turbo 3E aside, but that's a limited run), while the Alpine brand is growing."", 'And the 100 race plan can reset once again']",114,31,0.95,114,249,249,-4,0,0.0,-4
1mcdxxy,Williams hands crucial role to ex-Sauber COO with ‘unfinished business’,https://www.reddit.com/r/formula1/comments/1mcdxxy/williams_hands_crucial_role_to_exsauber_coo_with/,2025-07-29, News,,"[""It's Axel Kruse. The 'unfinished business' is when Williams was affiliated with BMW and finished runner up in the WCC. At the time, Kruse was with BMW."", 'So the guy they hired from Bombardier is no longer working from them. Interesting change.', 'Tough name', 'The old Honda special.', 'Well his family isn’t with him, so it must be difficult to be away from them so often. He even says he wants to return home.', ""It's the perfect 90s action hero name"", 'Starring in Kruse Control', 'Axel Kruise stars in the new smash hit ‘Unfinished Business’. Guest starring Dolph Lundgren as Toto Wolff']",69,8,0.94,69,55,55,1,0,0.0,1
