unique_id,post_heading,post_url,publish_time,tag,post_content,top_comments,upvotes,comments,upvote_ratio,score,total_upvotes_comments,total_score_comments,upvotes_growth_rate,comments_growth_rate,upvote_ratio_growth_rate,score_growth_rate
1gtcojc,Mick Sumacher's Instagram Post ,https://www.reddit.com/r/formula1/comments/1gtcojc/mick_sumachers_instagram_post/,2024-11-17, Social Media,Is this f1 related? ,"['Bottas confirmed as Merc reserve driver and Schumacher out of F1?', 'So I guess today’s big stories are\n\n• Bottas back to Merc\n\n• Franco dating a mother of 3', 'I’m guessing he missed out on Glastonbury tickets then', 'Mick, girl, did you just leak VB being a reserve driver for Mercedes lol?', 'He included about 5 different cliches in there.', 'Sometimes, the son is destined to be a once a generation talent, and the father just a mediocre also-ran, like the Verstappens. Sometimes, it is the other way around, like the Schumachers.', 'What happend? He lost his reserve driver seat now?', 'I really wish he would let F1 go and build a racing career somewhere else. Most racing drivers who dream of F1 never get a chance and with his 2 years at Haas he already achieve more than 99.9% of drivers ever will.', 'It almost feels like he copied and pasted 3 or 4 motivational clichés and posted them as a parody.', 'Not gonna lie, when I saw the little preview with the black background I got a bit scared, for an instant I thought that it could have been something else.']",9222,598,0.94,9222,29113,29113,99,4,0.0,99
1gtfldn,[OC] 32 drivers suffered fatal accidents during F1 World Championship events. Many former F1 drivers also died racing in other series while a handful of people passed away in F1 machinery without ever competing in Formula 1. This is a map of all 151 F1-related fatal accidents.,https://www.reddit.com/r/formula1/comments/1gtfldn/oc_32_drivers_suffered_fatal_accidents_during_f1/,2024-11-17, Statistics,,"[""Amazing work. It's way more complete than I was expecting at first. Just hope that we don't add any more names to this list."", 'I cannot imagine what it was like being a fan of the sport prior to the 90s.', 'Apologies for the map being quite finicky to use on mobile devices. I hope it can still provide an interesting pastime on this race-free Sunday. Feel free to point out any mistakes I made, this was quite a lot of history to dig through.\n\nBy the way, ""only"" 8 people from the list died in this century.', ""When you read about Pryce's accident, it just sends chills down your spine. It's barely believable.\n\nBTW, stellar work on the map"", 'Im so glad you included Maria de Villota! I was quite mad wenn I found out that she was not on the Wikipedia list', 'I actually made a tribute to them - https://youtu.be/lZ7Qu0CVgs4?si=e4z0RFcZksX3DlmB\n\nNot sure how many I forgot.\n\nIt’s insane that so many legends (Ascari, Clark, Rindt, Villeneuve, Peterson, Senna) all died in F1 accidents.\n\nEdit: not F1 accidents. I meant so many F1 legends died in racing accidents.', 'I’ve been watching since ‘87.\n\nI won’t include Imola ‘94 or Suzuka ‘14 as we all know what happened, but outside of those accidents we have had some very near misses.\n\nBerger at Imola in about ‘90/‘91, and Piquet a couple of years earlier had massive accidents. The Berger one was similar to Grosjean in some ways. Fireball and the like.\n\nWendlinger and Perez both had real big impacts at the chicane in Monaco. Wendlinger’s one ended his F1 career.\n\nLuciano Burto had two big crashes. The first at Hockenheim, and then at Spa when the worst very nearly happened.\n\nMassa in Hungary, Kubica in Canada.\n\nThere was Sato running into someone (I forget who off the top of my head) in Austria and a massive impact. Ralph Firman lost the rear wing from his Jordan in Hungary one year and had a very big impact.\n\nPedro Lamy almost lost his life in a testing accident for Lotus at Silverstone.\n\nMartin Donnelly as well.\n\nThere have been all of these and so many more in the time I’ve been watching, and down to fabulous car and circuit safety, medical intervention and I’m sure a very generous amount of luck, all of those mentioned above saw another day.', 'When the Paletti accident happened in 1982, the start line in Montreal was after the hairpin.', 'This is genuinely insane, incredible detail. I “love” that you can zoom in and see the corner where each accident occurred. I say this while also acknowledging that I hope we never have to add anymore names to this list.']",3466,165,0.98,3466,4580,4580,82,1,0.0,82
1gtpnj8,Liam Lawson's dad told him off after pulling the finger,https://www.reddit.com/r/formula1/comments/1gtpnj8/liam_lawsons_dad_told_him_off_after_pulling_the/,2024-11-17, News,,"['Damn, my dad just laughed and farted when I pulled his', 'A good answer from him about who is the fastest would’ve been “oh, Igor Fraga” who won the Toyota Racing Series (now Formula Regional) vs Liam, Franco and Yuki. Cheeky but smart to get away with the question. His answer though was good too.', 'I am the Law… son.', 'Bro has done more podcasts than Joe Rogan', 'It’s so funny seeing Paddy on mainstream international subs like this. Dude is an NZ treasure', 'Good to have someone that can keep you grounded', ""I thought it was great, the only thing you don't want to be in f1 is forgettable imo"", ""He's lucky that's the quote pulled from the interview and not his pace comments being taken out of context lol (when saying everyone in F1 believes they can win the WDC or they're screwed)."", ""Lawson has had some terrible luck of other drivers making mountains out of molehills and it feeding the public opinion. This is about the only edgy thing he's done and he's already #1 most hated""]",2433,96,0.97,2433,3744,3744,105,3,0.0,105
1gtkr3i,[Thomas Maher] The unused livery from the US Grand Prix is being showcased by Red Bull on chassis 003 at the Galway Showrun this evening.,https://www.reddit.com/r/formula1/comments/1gtkr3i/thomas_maher_the_unused_livery_from_the_us_grand/,2024-11-17, Social Media,,"['A nice retro-inspired livery. Shame they chose not to use it.', 'The dark, matte, look was cool for a while but it’s so drab. After almost ten years of it, they could use a change. This looks so much brighter and vibrant.', 'I really like the brighter looking blue rather than the super dark navy that they use now.', ""I knew about Singapore but I didn't realise there was also an abandoned US Livery too.\n\nI like this one, it reminds me of some older Red Bull liveries.\n\nNow, all it needs is Infiniti Purple .."", 'toro rosso/old red bull kinda colours\n\ni like it', ""The first time in years that they really make a good livery, they don't even use it."", 'I love that bolder, brighter shade of blue. Wish this was the permanent look.\n\n\nAlso love the curvy stripes that run along the side of the car.', 'Beauty', 'Should keep it as the regular livery honestly. Hopefully next year they can use it at the US GP', 'Was it a weight issue?']",1691,51,0.98,1691,2625,2625,51,0,0.0,51
1gte27n,"[Scott Mitchell-Malm] No plan for Stefano Domenicali to leave F1 leadership role and switch to MotoGP, I’m told. It is possible Domenicali will offer advice and support once MotoGP is part of the Liberty fold, which may be where the misunderstanding emerged.",https://www.reddit.com/r/formula1/comments/1gte27n/scott_mitchellmalm_no_plan_for_stefano_domenicali/,2024-11-17, News,,"['Jack plooj is always someone who cooks something up for attention only to be proven wrong in less than 24H', 'You mean Jack Plooj isn’t an ironclad source? 🤯', 'Jack Plooij talking out of his ass as usual.', 'I knew it was a far-fetched rumour in the first place, but you have to wonder how Plooj interpreted *""Certified MotoGP CEO""* from Mafei\'s departure because Andretti is siding with Republicans. \n\nLike, the reach there is something else', 'Plooij talking utter nonsense? Who would have ever thought?!', 'Ofcourse the dentist is lying again', 'Don’t mind me, just upvoting because it’s Bluesky instead of twitter', ""The person also mentioned in [another tweet(?)](https://bsky.app/profile/scottmitchellmalm.bsky.social/post/3lb4ucxdyuk2t) that he was told Zhou isn't on Ferrari's list for reserve btw."", 'Yeah this news greatly confused me and seemed predicated on or by literally nothing', 'ah crap, lol, it sounded too good to be true.']",1553,44,0.98,1553,1217,1217,14,0,0.0,14
1gtmdnl,Ollie Bearman on instagram : “The crossover you didn't know you needed today”,https://www.reddit.com/r/formula1/comments/1gtmdnl/ollie_bearman_on_instagram_the_crossover_you/,2024-11-17, Social Media,,"[""The fact that I didn't even recognize Ollie in the ceremony lmao"", 'They look like background characters in a film about a boy getting bullied at a British private school in the 80s', 'Who is next to him?', 'Sinner could be Ollie’s big brother', 'twins', 'Sid the Sloth', '🥦🥦', ""I still didn't know."", 'I didnt know I needed it, em yeah because I didnt need it.']",932,51,0.92,932,973,973,45,1,0.010000000000000009,45
1gtl5d6,"Q1, Q2 and Q3 appearances - corrected version ",https://www.reddit.com/r/formula1/comments/1gtl5d6/q1_q2_and_q3_appearances_corrected_version/,2024-11-17, Statistics,"As you guys pointed out there were some mistakes reagarding Q2 exits for Ferrari boys (they both made it to Q3 in Singapore but where Charles DNFed and Carlos DNS) and Liam Lawson. So there is a new verson, hopefully with no significant mistakes this time.
","['Look at George quietly being consistent as blimey, he is having his best season, despite the odd bout of bad luck.', 'crikey', ""Chego has been knocked out I'm Q1 more than Albon and Tsunoda. Jesus Christ Checo"", ""Yuki once again proving himself the champion of the Best Of The Rest (and the Rest includes Lance Stroll) Championship. And he's made it to Q2 more frequently than Perez. LMAO. LOL. ROFL, IF I MAY."", 'Bottas getting q3 in that broken tractor is impressive', 'Fuck, another edit: Lewis should have one more Q2 exit. So Q3 - 76.1% (16) , Q2 - 9.5% (2), Q1 - 14.2% (3). Please upvote', 'Leclerc and Russell have had such an underrated season.  Easily the two consistently strong performance drivers along with Max.', 'Lewis has more Q1 exits than Q2. An anomaly.', 'George has quietly been having a great year that’s been largely cast in the shadows because of a few unlucky events \n\nQuite possibly the second best performing driver of the year (Lando might be 4th behind Charles or 5th behind Carlos)\n\nEven more impressive how easily he’s been able to put Lewis down']",743,120,0.97,743,1755,1755,29,6,0.0,29
1gtkna3,Williams rebuild for Albon and Colapinto’s cars ,https://www.reddit.com/r/formula1/comments/1gtkna3/williams_rebuild_for_albon_and_colapintos_cars/,2024-11-17, Video,,"['This was super interesting to watch. These guys are just amazing. The two cars were in pretty bad condition. Glad they are in good shape for the next race and with spare parts just in case.', ""really cool video. i wish there would be more content focused on mechanics building the car, how they approach it, etc and less about drivers doing some boring ''challenges'' but i get it because that's what the public wants."", 'That was like an episode of scrapheap challenge!\n\nSeriously these guys do some work. Always amazed when a car gets wrecked during a weekend session and it’s ready to go at the next session looking like nothing happened.', 'The guys in the background with the hydraulic lines xD Classic team banter.', ""I wish we could see more of this stuff from the other teams. The cost cap has introduced an entirely new level of salvage we've never heard of or seen in F1. As fans we just see the cars show up all shiny and ready to go without a clue to most of us what goes into the prep for each race weekend. Mega respect to team Williams!!"", 'With all the talking about carbon fibre, I am surprised that mechanics pick up those damaged pieces without gloves….', 'That was super cool to watch, and what an effort they did getting everything ready. Call me bias but Williams have the best social media team in F1 in what they do and show.', 'Absolutely incredible work and super interesting to see what the work back at the factory actually entails.', 'I work for a composite supplier so I find it super interesting to see what the actual composite department of a team looks like. I even saw one of my old coworkers in the background lol', ""They better get a nice bonus after the season for all the crap they've had to deal with.""]",711,64,0.99,711,943,943,28,2,0.0,28
1gu1gyq,Sauber have revealed a special livery for the Las Vegas Grand Prix,https://www.reddit.com/r/formula1/comments/1gu1gyq/sauber_have_revealed_a_special_livery_for_the_las/,2024-11-18, Social Media,,"[""this looks like something i would've made on Need for Speed Underground 2 when i was 5 years old"", 'wicked promo is getting out of hand', 'I actually really like it.', 'Why do teams do this special liveries which look so much better than the normal one ? Ferrari should have just adopted last years Las Vegas livery everywhere and same is true here', 'I miss the 2022 Alfa Romeo.', 'It’s the Monster Energy livery', 'Once again, the graphic designer is doing the best work at Sauber.', 'All this to be at the back of the grid once again', 'That looks awesome!', 'Those green flames will add like 10 horsepower']",620,92,0.96,620,90,90,339,31,0.010000000000000009,339
1gtcesd,Brazilian GP had 43 Overtakes. Plus Data for Every Race Since Italy. Full Data in Post.,https://www.reddit.com/r/formula1/comments/1gtcesd/brazilian_gp_had_43_overtakes_plus_data_for_every/,2024-11-17, Statistics,,"[""It’s been a while since I last posted unfortunately been very busy with work and house renovations so I’ve just not had the time to be doing this for the past couple months and it’s taken a bit of work to get caught back up. Below are spreadsheets for this season as it's gonna take a while to update the database on the site.\n\n[2024 Overtakes](https://docs.google.com/spreadsheets/d/155eUZ_LyYfYGbr2J_PX8SDogsMWL2yIS7AlXzG8-F-s/edit?usp=sharing)\n\n[2024 Overtakes by Driver](https://docs.google.com/spreadsheets/d/1bph6RfaYbx-nkSuhn4tGGQiquJX8sjCNEoKaaFs9YZE/edit?gid=0#gid=0)\n\n[Race Totals](https://docs.google.com/spreadsheets/d/1XueNI7ZawEX0RLDq5dAGVqsEb1-DBOK2kUWGwM1OMKs/edit?gid=0#gid=0)"", ""Spain having the must overtakes just confirms that we're living in the weirdest timeline. I mean, that circuit is traditionally a snoozer. \n\nAlso, Lewis was out if position a lot this season. He's one of the greatest overtakers in the sport's history, but that is a high number of overtakes for him. It means he's had to recover in most races."", 'does passing someone at the start count as an overtake? just asking cause i think max passed 8 in brazil instead of 6', 'Return of the King, thank you man', 'It feels like this number is fairly low, but I think part of it is the attrition during and before the race. Less cars on track = less overtakes. Still a very exciting GP.', 'So net 6 overtakes by max and zero by norris in brazil. Definitely luck than talent for norris.', 'Thanks you for taking all the time to get us those results.     \nHope work is taking less time now and the house a sparkle of joy', 'Thanks for sharing, it certainly changes my fantasy teams going into the final block of the season!']",506,28,0.97,506,342,342,8,0,0.0,8
1gu2sm0,"[@highperformance] Toto on THAT crash. Whenever Hamilton and Verstappen come to blows, things get heated. Revealing hidden regrets about his original reaction, Toto Wolff unpacks what he did wrong and how he missed a a chance to offer team Red Bull an olive branch.",https://www.reddit.com/r/formula1/comments/1gu2sm0/highperformance_toto_on_that_crash_whenever/,2024-11-18, Video,,"['Bro trying to score points with Verstappen', ""somebody needs to cut these toto videos into a love island mash up or something it's so obviously toto trying to get max out on a date."", 'Toto is really doing everything he can to get Max', ""God, I am so sick of this one-word-at-a-time subtitle nonsense. Are people's attention spans so comprehensively fucked that they need to have it delivered this way?"", '[with sound](https://i.imgur.com/qj3O412.mp4)\n\nPeople on the desktop, right click on the video and click ""show all controls""\n\n[source](https://www.instagram.com/reel/DCeub5_IFwk/)\n\n[youtube video](https://youtu.be/z5Yxk6s971E?si=ClE21urJhY7ezvd4)', ""While props to him for talking about what he could have done better, even if it feels a little bit like he's still gunning for Max (not saying it's not genuine, I just find it funny), what a drought have we entered to be bringing 2021 back yet again. What's next, we gonna talk about crashgate? Schumacher crashing into Villeneuve? Prost and Senna coming together?\n\nThe fact that the ad for downloading comes right after and isn't clipped makes this worse."", 'Throwing Hamilton under the bus now that hes going to Ferrari? :O\n\nJokes aside, props to him for saying that, really shows the maturity of a true CEO/TP', ""Key context here is perhaps that he's very good friends with Jos."", 'This whole podcast is just Toto trying to sign Max 😂', 'Bro is not over the 5 stages of grief since Hamilton announced he was leaving']",805,115,0.95,805,104,104,805,115,0.95,805
1gth10k,INSIDE STORY: Alpine’s Magnificent Double Podium | 2024 Sao Paulo Grand Prix | Lenovo,https://www.reddit.com/r/formula1/comments/1gth10k/inside_story_alpines_magnificent_double_podium/,2024-11-17, Video,,"['What is clear from this video is that everyone was calling for red flag.\nEven drivers who would lose out like Norris and Russell.\n\n\nI understand why Russell pitted. Going against your team in wet conditions could have made him look stupid.\nBut his instincts were good. It was clearly going to be red flagged.\n\nIf Mercedes listened to him they could have been fighting for a win with Max.', 'Hearing all the drivers panic about the drivability before the safety car sounds scary and i’m surprised norris post race said it shouldn’t have been a red flag when even he said it needs to stop and being unable to see after pitting.\n\nalso merc seriously fucked over george. The guy was so confident on the radio about the red flag and ended up being completely right. he even asked for the extremes when they made him pit which would’ve at least given him the advantage for those few laps and they put on inters instead.', 'Mercedes really took over from Ferrari in terms of fucking the strategy at every available opportunity', "" Hearing the mess of the aborted start I still don't get how Norris and/or Russell didn't get any real penalty"", ""4:21 - Wow, hadn't seen that swapper from Alonso before..."", 'I’m just very upset about George man. He’s going to be your team leader next year so please trust the guy Mercedes!', 'I died when I saw that long ass team radio essay from Will Joseph to Lando', ""GP's or maybe actually Jonathan Wheatley's reaction to the failure at the front made me laugh. Just absolutely dumbfounded lol"", 'Well I was wondering what happened with Alonso once I seen Gasly pulling a gap around that lap what was odd given he was close to Alonso for some laps.\n\nNow I know the answer.']",98,9,0.86,98,148,148,2,0,0.0,2
1gu2efk,[@GiulyDuchessa] From today formu1a.uno expands and becomes autoracer.it,https://www.reddit.com/r/formula1/comments/1gu2efk/giulyduchessa_from_today_formu1auno_expands_and/,2024-11-18, News,,"[""I'm posting this here because Duchessa, Donadoni and formu1a.uno are a reliable source for news, especially when it comes to Ferrari, so suddenly seeing the new name could have been confusing for those who missed this change."", ""> *Exactly five years ago with Piergiuseppe Donadoni I founded Formu1a.uno. In that period our only aim was to be able to write completely free and passionate analyses.*\n\n> *Day after day, readers have rewarded us in an incredibly unexpected way. Despite the resources not comparable to the historic top media, we have achieved a decent place in the front ranks of the web and, more importantly, the respect of many readers and many good colleagues. This was possible thanks to great sacrifices, not only ours, but of all those who contributed and continue to contribute today to making things work.  I mention Rosario Giuliana who is part of the board of directors and the chief editor Paolo D'Alessandro for his enormous and precious commitment. But it is the editorial staff as a whole, prepared, also made up of young, intelligent and punctual guys, to whom our and my personal thanks go. The same goes for those who have passed or will pass here to lend us a hand.*\n\n> *We think that now the time is more ripe for a turning point that broadens the field, without compromising the basic principles that have characterized us, nor our identity. This is one of the reasons why Formu1a.uno renews itself to expand its range of action by changing its name to Autoracer.it with immediate effect.*\n\n> *It is something that has been planned for some time and which will gradually lead us to experience greater coverage of motorsport. We will try to do it with the same quality and freedom in information that we believe we have shown up to now, logically keeping Formula 1 as the central fulcrum, wanting to offer our future voice also on other categories and sectors no less important and loved by fans.*\n\n> *We hope to live up to expectations.*""]",62,3,0.89,62,2,2,62,3,0.89,62
1gtz2si,MONDAY TRASH TALK THREAD,https://www.reddit.com/r/formula1/comments/1gtz2si/monday_trash_talk_thread/,2024-11-18, Discussion,"TRASH TALK 101 FOR ANYONE NEW HERE - BEACAUSE. TRASH. TALK. IS. A. GENERATIONAL. THREAD.

&#x200B;

STEP ONE: LURK ON THE SUB VERY REGULARLY, MAKING SURE TO SORT BY “NEW”.

&#x200B;

STEP TWO: GET INSPIRED BY WHATEVER MAD NARRATIVE OR TREND GRIPS THE SUB THAT PARTICULAR DAY / WEEK. OFF SEASON IS QUITE SLOW BUT RACE WEEKS / WEEKENDS SHOULD YIELD A LOT OF SUBJECT MATTER. THE MORE INSANE AND UNREALISTIC, THE BETTER QUALITY SUBJECT MATTER IT IS. WATCH PEOPLES' OBSESSIVE BEHAVIOUR VERY CLOSELY - IT WILL YIELD SOME FASCINATING INSIGHT.

&#x200B;

STEP THREE: AT THIS STAGE YOU MAY BE FEELING SICK WITH THE AMOUNT OF NONSENSE YOU HAVE FORCED YOURSELF TO VIEW. FEEL FREE TO STEP OVER INTO r/f1circlejerk AND MAKE YOURSELF FEEL BETTER BY POSTING A MOCKING IMITATION OF THE NONSENSE.

&#x200B;

HOWEVER AS YOU BUILD YOUR TOLERANCE, YOU WILL FIND YOURSELF ABLE TO WAIT FOR MONDAY, THE HOLIEST OF DAYS. PEOPLE WILL TELL YOU RACE DAY SUNDAY IS THE BEST DAY, BUT THOSE PEOPLE ARE UNENLIGHTENED SAVAGES.

&#x200B;

STEP FOUR:

&#x200B;

(A) AS SOON AS THE TRASH TALK THREAD IS POSTED, UPVOTE IT. THIS IS IMPORTANT.

&#x200B;

(B) \[REDACTED\]

&#x200B;

(C) THEN - UNLOAD YOUR MOCKERY AND SCORN OF ALL THE VILE RUBBISH YOU HAVE WITNESSED FROM SUB USERS AND ""RESPECTED"" ""JOURNALISTS"".

&#x200B;

(D) SIT BACK AND WATCH THE UPVOTES GATHER. CLEVER PHOTOSHOPS AND META REFERENCES WILL YIELD MORE UPVOTES.

&#x200B;

STEP FIVE: REALISE THAT TRUTH AND SENSE ONLY EXIST IN THIS THREAD AND MAKE IT YOUR WEEKLY MISSION TO POST HERE.

&#x200B;

AND REMEMBER: FLAIR UP AND SMASH THAT CAPS LOCK! AAAAAAAAAAAAA!

&#x200B;

GOOD LUCK AND MAY THE TRASH TALK BE EVER IN YOUR FAVOUR.

&#x200B;

\----

&#x200B;

/r/FORMULA1 \[POSTING GUIDELINES\](/r/formula1/wiki/userguide#wiki\_posting\_guidelines) STILL APPLY.","['I OPEN REDDIT EVERY MORNING SCROLLING THROUGH F1 MEMES THAT ARE DONE TO DEATH, READING F1 STATS THAT DO NOT REALLY MATTER. THEN I GO TO WORK TO A JOB FOR WHICH I GET PAID TOO LITTLE.\n\nBUT ON RAWE CEEK....WELL, I LIKE RAWE CEEK.', 'SEEEEEERGGGGGGIIIIOOOOOOOOOOOO PEEEEERRRREEEEEEEEEEEEEEEEZZZZZZ\n\n![gif](giphy|jcxtvm2bsZDH2)', '4TH MAX CHAMPIONSHIP AT A TRACK HE HATES I HAVE SEEN THE SCRIPT', 'RACEEEEEEEEEEEEEEEEEEEEEEEEEEEEEEEEEEEEEEEEEEEEEEEEE\n\nWEEKKKKKKKKKKKKKKKKKKKKKKKKKKKKKKKKKKKKKKKKKK', 'WEEK WEEK THIRTY-EIGHT OF THE FORMULA ONE SEASON AND WE ARE BACK RACING IN THE PIG LIKE TRACK KNOWN AS THE LAS VEGAS GRAND PRIX \n\n# RAWE CEEEKE', 'ROASTING A PIG THIS WEEKEND', 'LAS VEGAS WAS THE ONLY RACE I DID NOT WATCH LAST YEAR AND I WILL NOT WATCH THIS YEAR. I HAVE ABSOLUTELY NO INTEREST IN TACKY AMERICAN BLACKPOOL AND I FUCKING HATE BLACKPOOL. SEE YOU IN ABU DHABI.', 'CUE MAX HITS THE JACKPOT AND OTHER GAMBLING RELATED PUNS', ""WHAT'S UP WITH MICK SCHUMACHER CRIBBING ON INSTAGRAM, ITS DUE TIME HE FINDS OUT HIS F1 CAREER IS OVER!""]",15,36,0.63,15,31,31,3,2,0.020000000000000018,3
1gu2rf8,How F1 Champion Nico Rosberg Scored $100 Million For A New VC Fund,https://www.reddit.com/r/formula1/comments/1gu2rf8/how_f1_champion_nico_rosberg_scored_100_million/,2024-11-18, Video,,['Something something same car.'],0,2,0.28,0,1,1,0,2,0.28,0
