unique_id,post_heading,post_url,publish_time,tag,post_content,top_comments,upvotes,comments,upvote_ratio,score,total_upvotes_comments,total_score_comments,upvotes_growth_rate,comments_growth_rate,upvote_ratio_growth_rate,score_growth_rate
1h7fg7j,"Leclerc says younger brother Arthur ""deserves"" to realise F1 dream",https://www.reddit.com/r/formula1/comments/1h7fg7j/leclerc_says_younger_brother_arthur_deserves_to/,2024-12-05, News,,"[""The title is trying its hardest to spin this.\n\nLeclerc just says he's happy Arthur gets to drive in an F1 weekend because his family prioritized him over Arthur due to money when it came to their careers. Family will also be there to see it making it even more special.\n\nThis has nothing to do with Arthur in F1 or anything like that."", 'Must feel shit in a way that although it has worked out completely and was the right decision, Arthur’s karting had to stop so Charles’ could be funded.\n\nI’m sure this is going to be very special for both of them.', 'Waiting for the stupid comment beginning “no one deserves…” or “why should he deserve…” that always comes when someone throws their support behind a friend/sibling/third driver to get a seat', 'What else would anyone expect him to say?', 'And I deserve to lay in my bed and watch the race covered in Cheeto dust. So between Arthur and I, at least one of us will get what we deserve this weekend.', '![gif](giphy|kc0kqKNFu7v35gPkwB)', 'Shocker that [racefans.net](http://racefans.net) had a disingenuous/clickbaity/misleading title...', ""It works if we assume Arthur's dream is to drive an FP1 session."", 'Arthur likely has a future in WEC.']",89,13,0.76,89,277,277,-5,0,-0.010000000000000009,-5
1h82bbk,Fastest sectors ranked by team and driver for FP2 of the 2024 Abu Dhabi GP | via LightsOutBlog.com,https://www.reddit.com/r/formula1/comments/1h82bbk/fastest_sectors_ranked_by_team_and_driver_for_fp2/,2024-12-06, Statistics,,"[""Sauber 4th fastest team, Red bull 8th fastest\n\nsomething tells me that FP results are not to be taken at face value\n\nthis or Max's Pregnancy is adding unnecessary weight to the car /s"", 'I want my Nico podium.', ""Crazy to see what Franco was able to get from the car on sectors 1 and 2. So sad he went wide and had issues with the floor's car.\n\nHopefully tomorrow he'll do good on fp3 and qualys 🤞🤞"", ""Holy fucking shit if we're about to get a goddamn Nico Goatenberg podium I will suck his balls mate"", 'What the Haas\n\nSauber also quicker than Red Bull 3/4 times...', 'Give me Kmag win and Hulk podium tyvm.', ""I really need to see Colapinto with experience. If it wasn't for the rookie mistakes he would be flying."", ""Ferrari is definitely hiding some pace, there's no way Haas and Sauber's are faster"", ""Mini Verstappen is definitely adding weight to Max's car""]",91,42,0.96,91,38,38,13,1,0.0,13
1h7wkyu,[Alfa Romeo]The 33 Club | Introducing Valtteri Bottas​,https://www.reddit.com/r/formula1/comments/1h7wkyu/alfa_romeothe_33_club_introducing_valtteri_bottas/,2024-12-06, Video,,"['So this is how he paid for dinner last night.', 'Damn that car looks insane. Too bad there will only be so few of them.', 'The design department of Alfa Romeo really never misses.', 'Okay the copper colored rims are sick', 'I am reading the comments and I am probably the only one who does not like it. Its okay looking, something is missing. It does not have the big balls design.', 'And even fewer will be left a couple years down the road.', 'Not sure how reliable they are these days but they used to have a built in feature that forced you to get out and admire your car on most trips. Must be why they are so beautiful.', 'Ahaha I can relate to this. I remember that white smoke in the front during our summer trips to south Italy, with my dad telling us that we had to stop to make our Alfa 75 Quadrifoglio cool down', 'Obviously you never owned one. I have several vintage Alfas. When maintained correctly they are better than most.']",80,10,0.93,80,9,9,2,0,0.0,2
1h828vg,"[Rory Mitchell] Long run times from Abu Dhabi GP FP2. McLaren looks solid, Hamilton in the Mercedes is not far off their times. Red Bull and Ferrari with some work to do.",https://www.reddit.com/r/formula1/comments/1h828vg/rory_mitchell_long_run_times_from_abu_dhabi_gp/,2024-12-06, Social Media,,"['Desperately trying to manifest a podium for Lewis in his last Mercedes race but I know deep down it’ll be a P7-8 quali with good race pace getting him up to P4/5 by the end', ""It's going to be an easy 1-2 for McLaren and the WCC will end with a whimper"", 'Honestly a miracle win by Lewis on his last Mercedes race would be beautiful.', 'Wasn’t able to watch. Any (non conspiracy theory) reason George had such a big gap to Lewis?', 'Verstappen pole then?', 'Not if KMag goes bowling', 'With the grid penalty for Charles it is pretty over regardless.', 'Speak for yourself a 1-2 to win the WCC would be so cool. A dominant display to win.', 'good', 'Yes']",86,11,0.95,86,11,11,14,1,0.0,14
1h7z4uf,[@F1TelemetryData] Abu Dhabi GP FP1 Telemetry Recap (9 pics),https://www.reddit.com/r/formula1/comments/1h7z4uf/f1telemetrydata_abu_dhabi_gp_fp1_telemetry_recap/,2024-12-06, Statistics,,"['When will Aston drop Stroll and give the freaking seat to Drugo!?', 'Men want only one thing and it’s these top three on the podium', 'The day this happens I will ascend to heaven', 'When one Stroll stops forcing the other Stroll to race in F1. Or when the one forces Nando to retirement.']",58,4,0.97,58,4,4,0,0,0.0,0
1h7xtzz,2024 Abu Dhabi Grand Prix - Free Practice 1 Discussion Thread,https://www.reddit.com/r/formula1/comments/1h7xtzz/2024_abu_dhabi_grand_prix_free_practice_1/,2024-12-06, Free Practice,Share your thoughts,"['BRO HAD GAS is now possible', 'Hadjar still reminds me of a raging kid in a Call of Duty lobby', 'https://preview.redd.it/cbpnh05eb75e1.jpeg?width=3024&format=pjpg&auto=webp&s=6f8d25442b247f504f19ab3598561c432d147f34\n\nReporting for FP1 today.', 'That red star on Lewis helmet. Lauda was the man that convinced him. He must forever be in Lewis heart.', 'Hadjar is losing it my word', 'Luke has literally only just moved up to F2 from F3 like 2 races ago so not surprised if it’s extremely overwhelming for him', 'God Hadjar is an absolute bellend', '9 points vs 126 points in last seven races. Perez is honestly a generational racing tractor', 'Wow. Drugovich impresses in every opportunity he gets in the car.', 'Arthur sounds exactly like Charles which is rather hilarious\n\nOne of things that stood out about Charles when he first came on to the scene was his rather unique accent']",58,1043,0.91,58,496,496,1,1,-0.010000000000000009,1
1h7gjwl,Wolff shows rare support for FIA president in F1 swearing row,https://www.reddit.com/r/formula1/comments/1h7gjwl/wolff_shows_rare_support_for_fia_president_in_f1/,2024-12-05, News,,"['Toto last week your own driver was swearing on the radio.', ""After Vegas last year something like this from Toto doesn't surprise me at all."", 'What a bunch of weasels my goodness.\n\nToto was ofcourse very composed and caln while smashing his headphones in the garage and screaming FUUUUUCK and didn\'t at all say and i quote: ""the car is fucked, i have it printed out"".\n\nWhat a slime.', 'Toto himself has said “[fuck them all](https://x.com/cowboyjayt/status/1459618269137182732)” on the radio', '> “I said, where did you hear that from? ‘From the drivers’. So, you know, I have my conflicts with Mohammed ... I disagree with many of the other things that he came up with. But on that one, I think, you know ... it’s pretty rude.\n\nSaying a car was fucked = rude\n\nSaying fuck them all = inspirational', 'such a two face man', 'Why is every athlete expected to be a role model? If you don’t want to be a role model - don’t be one. \n\nI don’t understand the expectation.', ""honestly what even is this. wasn't george raking in all the praise for standing up against MBS?\n\nor is this just an addition to try and start a smear campaign against max at the most pointless time?"", ""That doesn't even make sense, Wolff and Russell are upset that Max was using swear words in a private conversation with Russell, and that was only made public by George who is complaining about the words used that no one would have ever heard if not for him and Toto making it public?\n\nSo now even in private drivers aren't allowed to swear anymore?""]",44,91,0.66,44,1457,1457,-2,0,0.0,-2
1h8551v,Compilation of all Mercedes F1 Team helmet designs of Lewis Hamilton since 2013,https://www.reddit.com/r/formula1/comments/1h8551v/compilation_of_all_mercedes_f1_team_helmet/,2024-12-06, Throwback,,"['2020 black/purple (still) hits hard', ""Them not being all in the same orientation makes me mad... i can't look at this."", 'Kinda can’t wait to see his Ferrari helmets.', 'I always thought the original yellow one was the best', 'I like that red one with the Union Jack on', 'I never liked Lewis\' helmets. Must be the black ""headband"". I feel it only suits the 2021 full coloured ones.', 'His McLaren helmets >', 'There were actually three different variant of the rainbow 2021 helmet for the last three race . They were all so cool', ""Ah yes. The 2022 Monaco special helmet. \n\nOtherwise known as the special helmet design that didn't make it to the end of the race.""]",54,22,0.89,54,21,21,54,22,0.89,54
1h828gp,FP2 Race simulation AD24,https://www.reddit.com/r/formula1/comments/1h828gp/fp2_race_simulation_ad24/,2024-12-06, Statistics,,"[""Lewis please don't fuck up quali man. Podium could be on here. McLaren look really good though."", ""Lewis pls the dream ending is possible. \n\nI'm not expecting pole but a nice 2nd row would be fine and sets him up nicely for a podium"", 'Lewis looks solid', ""If Max has worse race pace than Sergio you know there's a lot more coming tomorrow from Red Bull."", 'Yes, hulk once again faster than red... everyone. Nothing to see here.\xa0', 'Lewis plz get T3-4 in quali behind leclerc and we might have a chance🤞', ""Hulk's run on the soft seems decent? Importantly, very little degradation too."", 'Where are the Williams? Both Colapinto and Albon were in the top 10 in the medium stint.', 'goodbye wcc, next year will certainly be our year tho.']",40,23,0.88,40,21,21,4,1,-0.010000000000000009,4
1h801kq,F2 Qualifying Highlights | 2024 Abu Dhabi Grand Prix,https://www.reddit.com/r/formula1/comments/1h801kq/f2_qualifying_highlights_2024_abu_dhabi_grand_prix/,2024-12-06, Video,,"['Borteletto p2, Aron p3, Hadjar p4 \n\nThe fight is on', ""Side note: this will also be Alex Jacques's last time commentating on F2"", 'If Hadjar chokes, oh the radio message might be in the top 5 of all times', 'Another solid qualifying from Dino Beganovic in just his second F2 race weekend, too bad for him he is never making it to F1 unless Bearman completely shits the bed.', 'Aron wins the championship Seb style. While top 2 are fighting their own fights.\xa0', 'Shame Bortoleto couldn’t hook up that final sector, a fraction away from two crucial points', 'Bring back Valsechi', 'Will the new commentator be the guy that just dropped in at the end of FP2?', ""Oh I always liked him where's he going and who's his replacement?"", 'Up there with Ocon in Mexico last year ""tell Hulkenberg I\'m going to send it""']",33,20,0.87,33,19,19,4,0,0.030000000000000027,4
1h82n8t,F1 Bingo Round 24- Abu Dhabi- Prediction Competition Game Link in Comments,https://www.reddit.com/r/formula1/comments/1h82n8t/f1_bingo_round_24_abu_dhabi_prediction/,2024-12-06, Statistics,,"[""Can't find: Perez out in Q1"", 'Final push\n\nBet I can still make it on the podium', 'The seconds one on the bottom won’t happen if Verstappen gets remotely close to him during Qualy', 'Middle horizontal line is almost guaranteed to happen', '[here is the link to the prediction competition game](https://docs.google.com/forms/d/e/1FAIpQLSfbC6zuKf8eTzV9MR-9fxHC11DPEYja3v2BGXFpW3k2_q3lkg/viewform?usp=sf_link)\n\nResults for Abu Dhabi and Qatar will be out right after the race!\n\nMake sure to get submissions in before qualifying!', ""Who other than Perez won't make Q3?"", 'hey can you please share the link for the bingo results gsheet']",33,8,0.87,33,7,7,8,1,0.030000000000000027,8
1h85if6,Longest Back-to-back podiums and longest podium droughts by driver and by constructor,https://www.reddit.com/r/formula1/comments/1h85if6/longest_backtoback_podiums_and_longest_podium/,2024-12-06, Statistics,,"['I wasn’t conscious of McLaren’s 14 podium run, that’s an impressive stat', 'Sigh\n\nAnother embarrassing check stat', 'why Russell - in second pic? surely if he had oner there must be tracks???\n\nunless 1 means not number of back to back podiums but max podium streak?', 'good callout! yes, max podium streak actually. He did not have any back-to-back.']",39,5,0.87,39,4,4,39,5,0.87,39
1h82kmj,[@F1TelemetryData] Abu Dhabi GP FP2 Telemetry Recap (10 pics),https://www.reddit.com/r/formula1/comments/1h82kmj/f1telemetrydata_abu_dhabi_gp_fp2_telemetry_recap/,2024-12-06, Statistics,,"['McLaren stronger here than anticipated, have to wait and see if Ferrari are sandbagging', 'Man I hope McLaren get 1-2 with chaos all the way behind', 'Haas is looking very promising. Fingers crossed that Nico can get a podium in their final race together', ""Downvote inducer but I genuinely believe Schumacher Jnr would have been a better pick over Doohan. He looked more competitive than Magnussen toward the end, is a shame he couldn't get comfortable in the car. Haas screwed him with an offset seat that was never fixed and piled the pressure on him to overcompensate"", 'Alpine is a difficult car and a difficult environnement for a driver,  exactly what Mick doesnt need']",26,5,0.92,26,5,5,11,1,-0.029999999999999916,11
1h830dh,F1 meets NASCAR in the Neon City | Ford Performance,https://www.reddit.com/r/formula1/comments/1h830dh/f1_meets_nascar_in_the_neon_city_ford_performance/,2024-12-06, Video,,"['When you sign up to film a promo but then sack your driver, and have to send the understudy', 'That guy totally voted for Trump. Just sayin’', 'Noah Gragson has a bit of a frat boy reputation']",17,4,0.71,17,3,3,8,1,0.05999999999999994,8
1h84y8u,Drones vs choppers?,https://www.reddit.com/r/formula1/comments/1h84y8u/drones_vs_choppers/,2024-12-06, Technical,"I’ve been trying to notice the split between number of drones vs helicopters used at f1. 

For me it’s hard believe that we don’t have the tech available to fully transition to drones. 

I’ve seen drones here and there, but looks like they’re only used for media shots and not racing really. 

It doesn’t look like they’re only use drones for races. 

If anybody has more information on this, please share?

Sounds ironical in today’s emission issues for a firm like F1 has choppers flying all around for hours and hours. ","[""Aren't drones - especially camera ones - pretty slow compared to a F1 car? I remember Red Bull had to make a special one for their video to be able to keep up and it barely did.\n\nMeanwhile a guy with a proper lens (that's also a few kilos of glass, so way above what can be mounted on a drone doing 300km/h on a straight) on a helicopter doesn't have to be as close as a drone to get a good shot."", ""I heard in a media podcast by one of the F1 team they can't have drones fly over the track at all during a race so it heavily limits their use"", ""Have you seen the camera equipment on those helicopters? You need a vehicle the size of a helicopter just to haul that stuff around. I'd imagine military grade stuff is out of the question, so it's cheaper to just use a helicopter instead of developing a drone that can carry the equipment and is fast enough to keep up with the cars."", 'drones dont have the performance to carry TV broadcast cameras at the speeds required for F1 coverage\n\nthey can (and probably do) use them for short tracking shots around slower parts of the track, but if you want to actually capture a car going down an entire straight you need the power of an actual helo\n\nalso i suspect that its just straight cheaper to have one camera mounted on a helicopter than a bunch of cameras mounted on drones to achieve the same coverage. broadcast quality cameras and lenses are *hilariously* expensive (100-200k USD), and buying and insuring a bunch more of them for drone use, plus paying for a bunch of drone operators (who arent exactly cheap either) probably just costs as much as renting that helicopter, and you get less cinematic shots', "">  I’ve seen drones here and there, but looks like they’re only used for media shots and not racing really.   \n  \nHelicopters can stay in the air for 2 hours and fly around at 250kph and has enough spare power to power the camera and transmission signals.  \n  \nA drone battery may last 30 minutes, it's unpredictable, unstable in the wind, has transmission delays and hasn't been certified to fly over large crowds.  \n  \nTo be as stable as a helicopter and stay in the air as long you may just use a helicopter instead of a military grade UAV, to avoid the issues and have 2 people operating different aspects of it for safety reasons."", 'Honestly I don’t think either are great for f1, drones aren’t fast enough yet to keep up with the cars and helicopters aren’t manoeuvrable enough around a track where as in a situation like the WRC they are great as follow cameras. I do think it would be cool to embrace more alternative camera angles as well rather than the static ones now, maybe higher up. The camera on lines over the pit in some tracks is great for this.', 'Also not directly related,  but the person who flew the chopper at COTA was a bad ass.', ""The drone shots used recently in the broadcast have been pretty bad, particularly how the drone rolls when turning. It's basically a dealbreaker. \n\nBattery life is also poor. \n\nI'm sure these problems can be solved, but until they are we'll be stuck with old-school solutions."", 'Probably more to do with being able to transmit live footage in a high quality from a drone.', 'Not directly related to your question but,\n\nIf they truly cared about emissions, they would not be flying to Rwanda, Africa for the 2024 FIA Awards']",0,21,0.35,0,20,20,0,21,0.35,0
1h7fxeo,Eddie Jordan tells Ferrari to “close the book” on Lewis Hamilton following Qatar admission,https://www.reddit.com/r/formula1/comments/1h7fxeo/eddie_jordan_tells_ferrari_to_close_the_book_on/,2024-12-05, News,,"['This is just pure trolling from him, how can you say something like this and expect to be taken seriously?\n\nFor F1, this is one of the biggest moves ever, I cannot even imagine how articulate a deal like this is (the contract must be full of clauses, bonuses, details even of the smallest size, not to mention sponsors and - last but not least - the economical aspect...)\n\nAnd for sure he knows something about this since he just moved Newey to Aston.\n\nHow can you expect them both (Ferrari and Lewis) to randomly cancel everything?\n\nCome on Eddie! 😂', 'Eddie Jordan is talking shite', 'The amount of flip-flopping takes Eddie and other commentators have had concerning Lewis and Ferrari is unreal. Just shows how reactionary commentary on this sport has become. Not a single original thought.', ""Eddie is right. It's been almost two weeks since Hamilton has had a good race. He's done."", 'Clearly Eddie is trying to rage bait as usual \n\nSometimes he is good sometimes he is way off \n\nSure Hamilton hasn’t been setting the world on fire this year but it doesn’t mean he still doesn’t have all the experience and potential to be better in a car designed around him', ""Did anyone ask for Jordan's opinion? I sure as hell didn't."", 'Eddie Jordan should close his own book and stop making stupid statements in the media instead.', 'Wtf does close the book even mean', 'If lewis revives himself in ferrari, all these pundits and know it alls are gonna backtrack soooo fast. Everyone’s gonna be like “well he’s the goat lewis hamilton, of course he’s good”']",0,61,0.41,0,422,422,0,0,0.0,0
1h7w9a9,2025 might be Max Verstappen’s last year in F1,https://www.reddit.com/r/formula1/comments/1h7w9a9/2025_might_be_max_verstappens_last_year_in_f1/,2024-12-06, Discussion,"- Losing patience with RBR, who are unlikely to be competitive next year
- New regs aren't his favourite, and RBPT-Ford is a massive unknown
- Beefing with Russell, head of the GPDA
- Having a kid

A lot of these, I feel, suggest that he knows he won't be around for the new regs. Thoughts?","['""Beef"" with Russell is absolutely no reason, but having a kid should be the number 1 concern.', 'Mate..... We have got one more race still. Create these fanfictions during the winter break.', 'Okay, we can say the rest of 3 could potentially make sense(minimal). But dude, what’s the f**k is beefing with Russell a reason?! Are u drunk?!', 'Thanks for the insight, you should consider throwing CV’s around Motorsport publications', 'Imagine thinking Verstappen would sacrifice 60 Million a year because of “beef” with George Fucking Russell lmao', ""I think its more likely he'll see how red bull do in the new regs and then make a decision"", 'all i can think of is alonso and his “i knew he would hit the breaks”', 'Beef with Russell is a nonissue and it’s certainly not something to retire over.', 'Let this grand prix finish and you can spam all your L takes for the next 3 months.']",0,59,0.19,0,54,54,0,0,0.010000000000000009,0
