unique_id,post_heading,post_url,publish_time,tag,post_content,top_comments,upvotes,comments,upvote_ratio,score,total_upvotes_comments,total_score_comments,upvotes_growth_rate,comments_growth_rate,upvote_ratio_growth_rate,score_growth_rate
1n05u6b,Memorable moments from F1 team radio messages this season,https://www.reddit.com/r/formula1/comments/1n05u6b/memorable_moments_from_f1_team_radio_messages/,2025-08-25, Video,,"['George saying “I prefer not to speak” because it’s Alex who’s giving him a hard time at Monaco lol\n\nMy favorite would probably be Hamilton’s “Have a tea break while you’re at it.” PEAK BRIT ANNOYANCE', 'Love Albon channeling Kimi with the increasingly agitated “for what?”', '""no more radio for the rest of the race"" - Fernando Alonso', ""i like Leclerc's essay from hungary"", 'Oscar’s Alpine radio has to be my favourite one. The timing, the deadpan, the delivery… absolute gold!', '*are you upset at me or something* Sir Hamilton never nonchalant', '""Have a tea break while you\'re at it!"" is my absolute favourite this year.', '""I prefer not to speak"" - Jorge Mourinho', 'K1 available, when you can', '“Must be the water”']",104,19,0.93,104,166,166,3,0,0.0,3
1n0gwl2,"Looking at mid-season ratings, do you still think that results from 2024 F2 are not representative of rookies performance?",https://www.reddit.com/r/formula1/comments/1n0gwl2/looking_at_midseason_ratings_do_you_still_think/,2025-08-26, Discussion,"I will preface by saying that I know it has been just 14 races and things could change in the future. At the same time however, it is enough to draw some conslusions.

In 2024 there were many discussions about how we shouldn't look to much into 2024 F2 results. This notion applied almost exclusively  to Prema, because both of its overhyped drivers had underwhelming rusults. (in comparison to expactations). Also both of their drivers were set to join F1 basically from the beginning of that year. So it seemed easier to blame the team than to acknowledge that the Prema boys might have been underperformimg. Meanwhile rookies like Bortoleto and Hadjar were barely talked about. 

As for now, after 14 races it seems that the F2 2024 standings generally reflect the order, in which rookies are rated on F1 grid. Moreover I still kinda don't understand, how some people are surprised that Bortoleto (literally F3 and F2 back to back champion) is doing that well. ","[""Your first mistake is assuming that people know Bortoleto was a back to back champion. Most people watching F1 turn the TV on just before the race starts, and maybe just before qualifying starts and that's it, and that extends to people posting on here"", 'It’s way too soon to say. I think you can’t really judge the quality of a F2 grid until 5 years later when you see what they all went to achieve elsewhere. \n\nHadjar is actually a good example of F2 results not always being representative of talent. He finished P14 in his rookie F2 season behind his teammate who was also a rookie. At the time many people questioned why Red Bull didn’t drop him, especially since his teammate was also a RB driver and he did get dropped. He changes teams and there’s a new car and suddenly he challenges for the title. Now he’s doing a great job in F1 and those same people who questioned him are now applauding him.\n\nOllie and Kimi were also not the only favourites underperforming last year. Victor Martins was a F3 champion and had a good rookie year, yet last year he was absolutely nowhere. Taylor Barnard was highly rated and yet got comprehensively beaten by his teammate who people didn’t rate that highly. He left to go do FE and did an amazing job there.\n\nSo the flaws of the F2 championship were somewhat exaggerated last year because favourites weren’t doing well, but that doesn’t mean those flaws don’t exist. The truth is that there is no objective way to judge junior drivers against each other, so it often comes down to right place right time. I don’t think any of the rookies are drowning right now, so I don’t think there are any that shouldn’t be there. Of course you can question how someone else would be doing in their shoes, but those what-ifs have always been there and will always be there.', 'look at how the status of the 2018 F2 title challengers in during the mid season break in 2019\n\nF2 champion Russell: languishing in the back in a Williams\n\nF2 Runner up Norris: showing strong potential in a Mclaren against Carlos Sainz\n\nF2 3rd place Albon: Promoted to Red Bull Racing\n\nmaybe its still too early to know, all three drivers have done well but the pecking order between them is more clear now 5 years later', ""Yes and no. Bortoleto and Hadjar, were top two last year, and are arguably the two best rookies this season so far, so in that regard, this was extremely representative. But I can't sit here and pretend that Bearman was only the 12th best driver, especially after his performances at Haas and even his sole outing for Ferrari. It's a bit frustrating, really, how inconclusive that championship often is."", ""I do think people really underestimate how representative F2 can be, especially last year. In general because it was a new car we didnt really have a best team, some teams figured out the car quicker but it was peaky from many. So that aspect did make it hard to truly understand the order, though I think people did over blow it just because the pre-season favourites in Kimi and Bearman struggled.\n\nI think generally the top drivers in any given season are the top drivers for a reason. Many can say its car and team setup, but you still need to be good enough to make sure you maximise that chance. This is the same in every category, its naive to think everywhere is completely equal. For sure that can make it easy to dismiss certain results, but its unfair to really downplay a driver when they are performing in my opinion.\n\nWhat Hadjar and Bortoleto have shown this season is there's a good reason why they were the ones that fought for the title. So yeah, I do think it adds some weight to the championship when they are performing."", ""Yeah it was unrepresentative imo. Anyone who was convinced Bortoleto would fail wasn't paying attention, but that's not really an argument for F2 being representative. He's 1 driver, you can easily make the opposite argument with Bearman. Bearman finished 12th in F2 last year, he was nowhere near the 12th best driver on that grid. He's currently very close to Ocon and last year as well had strong performances in F1 while to some extent floundering in F2"", 'Yes, I still think the results were unrepresentative, with Bearman as a prime example. He has been quietly excellent this year; his points tally is mediocre because he keeps finishing 11th but he has been matching the far more experienced Ocon on pace. \n\nBear in mind that Bearman was regularly getting poles and wins in his debut F2 year in 2023, and was probably the fastest driver on the grid in terms of qualifying pace, but then was suddenly nowhere in 2024 despite staying at the same team. This makes no sense from a driver perspective; I find it impossible to believe he just got way slower for no reason in the space of a few months. The issue was clearly with the team.\n\nNone of this is to say that I am surprised by Bortoleto, by the way. He absolutely deserved the championship last year and has been fantastic so far this year.', ""Watching f2 last year, it was so clear to me that Bortoleto was the best driver. Kimi might have more potential because tbh, I don't know how to judge that without access to data etc, but Bortoleto was definitely the stand out. \n\nI'm ready for that audi to be good next year"", 'Antonelli sadly  is driving exactly like in F2, incredible inconsistent.']",96,62,0.85,96,54,54,3,1,-0.010000000000000009,3
1mzwdxm,How Formula 1 Cars Are Made,https://www.reddit.com/r/formula1/comments/1mzwdxm/how_formula_1_cars_are_made/,2025-08-25, Video,,"['Obviously, some of the astronomic costs are due to the development divided by the number of produced units and not purely manufacturing itself. Anyways, really cool.', 'Scott Mansell really is a fantastic creator, I’m only about 20 minutes through this so far but It’s a great video. Very consumable without entirely dropping the technical content', 'Thats class, thanks for sharing', 'Someone should send this to Ferrari.', 'If you want more, this video is basically a compilation of an entire series he did.', 'Yeah I noticed a couple sections seemed familiar but in the larger context with ones I hadn’t seen it didn’t bother me']",86,6,0.85,86,16,16,4,0,0.010000000000000009,4
1n0ku40,F1 driver market: Six seats yet to be filled for 2026,https://www.reddit.com/r/formula1/comments/1n0ku40/f1_driver_market_six_seats_yet_to_be_filled_for/,2025-08-26, News,,"['2 Mercedes seats, 2 VCARB seats, a Red Bull seat, and an Alpine seat.\n\nOf those, Mercedes is likely to renew both, Lindblad is likely to get promoted from F2 to one of the three Red Bull family seats, and one of Hadjar, Lawson, and Tsunoda is getting the axe (likely Tsunoda at the moment, but the winds can change).\n\nAlpine is a little strange. If Colapinto gets cut, do they promote Aron? Do they try and snag whoever wins F2 (or Dunne)? Do they try and grab whoever Red Bull cuts?', 'Alpine is in a tricky spot right now lol two of their potential replacements for colapinto snagged by one team. Maybe they’ll put Aron in the car but he will be yet another rookie. Maybe steal whoever gets kicked out of Red Bull?', ""Norris, Piastri \n\nVerstappen, Hadjar \n\nLeclerc, Hamilton \n\nRussell, Antonelli\n\nAlonso, Stroll \n\nSainz, Albon\n\nHulk, Bortoleto \n\nLawson, Lindblad \n\nCheco, Bottas ofc \n\nOcon, Bearman\n\nGasly, ? I'll say Franco for now but also Aron"", 'In before Redbull make no changes and waits till max makes his decision at summer 2026', ""And likely won't be filled anytime soon. Red Bull usually fucks around with its non-Verstappen drivers as they see fit, Mercedes delays contract talks with everyone until it's insanely late and the Alpine seat depends on the seats already mentioned."", 'I really want someone to take a chance on Dunne. The kid is super aggressive, that driving style would be fun to watch if not catastrophic.', 'Mercedes will keep both their drivers. Alpine keep Colapinto,\xa0Hadjar to Red Bull, Lawson & Lindblad at Racing Bulls.\xa0', 'So the takeaway is... Mick Schumacher linked to Mercedes, VCARB, RB, and Alpine?', ""So it is not really six seats after all. Unless something catastrophic happens, Mercedes will keep Russell and Antonelli. The Red Bull and VCARB seats will be filled by whichever combination of drivers Helmut Marko's astrologer tells him sign this week, and nobody in their right mind wants to go near the Alpine. They could have filled it a month ago and there is a fair chance that none of us would have noticed. The only potentially interesting choice is Red Bull drafting Alex Palou in from Indycar, but the suggestion is so far out of left field and there is such a poor historical precedent for Indycar drivers replicating their success in Formula 1 -- especially since everyone has stopped talking about Lindblad as a potential VCARB driver -- that it really just indicates to me that they have no idea."", 'Yuki probably makes the most sense for Alpine. Though would love them to do something a bit out there and try and lure Palou to the project.']",79,62,0.96,79,57,57,28,20,0.020000000000000018,28
1n08rpw,[Off-Topic]Around The World in 8 Days I The CONCEPT AMG GT XX[Mercedes-AMG],https://www.reddit.com/r/formula1/comments/1n08rpw/offtopicaround_the_world_in_8_days_i_the_concept/,2025-08-26, Video,,"['TL:DR\n\nThe car was driving the equivalent distance  of circumnavigating the globe at Nardo, with 12 drivers taking two-hour shifts, including George Russell.', 'Just casually Breaking 25 Long distance records', 'Like fast tracking 😄', ""What a strange looking car\n\nIt's like a mutated Ferrari but narrower and with an additional set of rear lights"", ""It's supposed to be an homage to the [C111 experimental cars](https://en.m.wikipedia.org/wiki/Mercedes-Benz_C111) from the 70s. But the lighted grille just makes it look like a catfish.""]",50,7,0.87,50,28,28,-3,1,-0.020000000000000018,-3
1n0l39b,Zandvoort 2023 – Record number of overtakes at the Dutch GP,https://www.reddit.com/r/formula1/comments/1n0l39b/zandvoort_2023_record_number_of_overtakes_at_the/,2025-08-26, Video,,"[""Probably Alonso's best race of the year, absolute machine that day."", '*\\* due to varying weather conditions*', 'Still not enough', 'Checo had such a lead in that with the early stop, he was in the lead with a 13 second gap over Max in lap 6, after starting in P7.. by lap 13 Max was already in the lead.', ""And all it took was two separate rain periods (with one so close to the start that some cars stopped on the first lap), one Safety Car and one damp red flag restart on Intermediate tyres.\n\nIf I'm remembering correctly, the majority of those overtakes happened in the first 15 laps or so during the dry-wet-dry period."", 'A huge bulk of the overtakes took place in dry conditions.', 'Over 50 overtakes happened in the dry portion of the GP.\n\n\nLap 3 alone (when we had a mixture of slick and inter runners) had over 60 overtakes.']",27,7,0.85,27,7,7,16,1,0.05999999999999994,16
1n0jzoy,Video from Valteri's Facebook,https://www.reddit.com/r/formula1/comments/1n0jzoy/video_from_valteris_facebook/,2025-08-26, News,,"['I think we need a Wick-Cadilllac tie up.', ""Facebook - is this 2012? It's been a while since I've read this name, lol""]",21,2,0.92,21,2,2,11,0,0.10000000000000009,11
1mzwyrx,Simulation lap of the 2028 Qiddiya Speed Park track! looks absolutely insane,https://www.reddit.com/r/formula1/comments/1mzwyrx/simulation_lap_of_the_2028_qiddiya_speed_park/,2025-08-25, Video,,"['On one hand I wanna hate it for being so gimmicky but on the other hand I like that they went completely crazy and actually built something this insane', ""It's just ludicrously long... what is the track length as a 2 minute plus hot lap makes Spa look like Monaco!    \n    \nThe whole squiggly street track section is not needed at all."", 'Corners are too close together, which may hamper overtaking opportunities', 'When are they adding the loop and the corkscrew to the circuit...', 'Demo lap with Alonso. Wise choice. He will be hot off his 4th championship in 2028 and ready for another.\xa0', 'This is everything I hate about F1', 'what is find more impressive from this lap would be Fernando still driving by 2028', ""Some parts of it are clunky but this seems like a fun & challenging track. Don't love all the bullshit behind it but I think it would allow for some good racing / overtaking."", 'A totally safe and reasonable track!', 'Bunch of straights followed by bunch of tight, close corners.  \n\nMeh']",0,85,0.49,0,530,530,0,0,0.020000000000000018,0
1n0kkhe,Will a Spanish high-flyer become Verstappen's new teammate? | F1-Insider.com,https://www.reddit.com/r/formula1/comments/1n0kkhe/will_a_spanish_highflyer_become_verstappens_new/,2025-08-26, News,,"['This rumour is so weird it must be fed to the media by an interested party.', 'Alex Palou\n\nThe answer is absolutely no.', 'The possiblility of him joining rbr is a Lot higher than him joining any backmarker or midfielder. \n\nAnd I would still think that they are slim at best.', 'Alonso', 'I think Carlos is fine at williams tbh', 'Red Bull going for a luchadore strategy? Risky.', 'Another yearly rookie sacrifice for Red Bull lol', 'Yeah no, but Max and Alex have been somewhat teammates before in sim racing with Team Redline.', ""Will a Spanish high-flyer become Verstappen's new teammate? | [F1-Insider.com](http://F1-Insider.com)\n\nF1 Insider | 26 August 2025, 1:20 p.m.\n\nWill Álex Palou become Max Verstappen's teammate? Red Bull denies interest in the superstar. Will Briatore now make his move?\n\nThere is intense speculation in the USA that IndyCar superstar Álex Palou could join Max Verstappen at Red Bull Racing in 2026. With four titles and a victory at the Indy 500, the Spaniard has achieved everything in motorsport. The only thing missing is the premier class.\n\nThere, Palou's F1 dream seemed to have been dashed for the time being. In 2022, he wanted to join McLaren and even tested for the British team in Austin. But in the end, he stayed with Chip Ganassi Racing and created legal chaos by signing several contracts. McLaren is still demanding compensation.\n\nPalou dominates US Formula 1 – will he now become Verstappen's teammate?\n\nOne thing is certain: for five years, Palou has been the benchmark in ‘American Formula 1’. He won the title in 2021, 2023, 2024 and 2025, and this year he added the long-awaited victory at the Indy 500. He has long been a superstar in America. In Formula 1, however, he has been left out in the cold – until now.\n\n**According to IndyStar, a newspaper based in Indianapolis, Red Bull is seriously interested. Sources report that Palou could join the team alongside Verstappen in 2026.**\n\n**However, this time there is no fire where there is smoke.** [**F1-Insider.com**](http://F1-Insider.com) **has learned that Red Bull has no interest in the Spaniard and that the rumours are coming from Palou's busy manager, former Ferrari team boss Daniele Audetto.**\n\nPalou wants victories and titles\n\nPalou himself is also playing down the rumours. After his Indy 500 triumph, he said: ‘Why should I waste three or four years with a team that can't win? I want victories and championships.’\n\nHowever, he was referring primarily to F1 newcomer Cadillac. He did not mention a top team like Red Bull. And his contract with Ganassi contains an exit clause.\n\nInterest from Alpine?\n\nThe Alpine team, led by cult team boss Flavio Briatore, is genuinely interested. The Italian is looking for a driver to replace Argentine Franco Colapinto in 2026, whom Briatore wants to get rid of after mediocre performances. The two ‘oldies’ Valtteri Bottas and Sergio Perez have declined, both having signed with newcomer Cadillac.\n\nAnother factor in Palou's favour is that Briatore works closely with F1 superstar Fernando Alonso, who in turn is a mentor to his compatriot Palou.\n\nOne argument in favour of Alpine is that the French team will be ditching the underperforming Renault engine in 2026 and will be racing with the supposedly more powerful Mercedes power units. That could at least give the four-time IndyCar champion pause for thought. In any case, he is unlikely to become Verstappen's teammate.\n\nAuthors: Bianca Garloff, Ralf Bach\n\n*Translated with* [*DeepL.com*](https://www.deepl.com/?utm_campaign=product&utm_source=web_translator&utm_medium=web&utm_content=copy_free_translation) *(free version)*"", 'I thought they’d be talking about Marti instead of Palou, but I don’t see why they’d do it, when they have Lindblad right there']",0,23,0.37,0,23,23,0,7,-0.020000000000000018,0
