unique_id,post_heading,post_url,publish_time,tag,post_content,top_comments,upvotes,comments,upvote_ratio,score,total_upvotes_comments,total_score_comments,upvotes_growth_rate,comments_growth_rate,upvote_ratio_growth_rate,score_growth_rate
1lsc3ux,Max Verstappen takes pole position for the 2025 British Grand Prix,https://www.reddit.com/r/formula1/comments/1lsc3ux/max_verstappen_takes_pole_position_for_the_2025/,2025-07-05, Qualifying,,"['What the fuck was that ending holy shit!', 'Damn, for about 5 seconds I genuinely thought Lewis was gonna get pole', 'How does he fucking do this?', 'HOW', '""This car is so difficult"" = Pole', '0.2s between the top 5. \n\nInsanely close for one of the longest tracks in F1.', 'Oh my lord max', 'Impossible!', 'Jesus fucking Christ, Max what a driver', 'Wtf this dude is insane']",16950,1785,0.94,16950,60644,60644,27,1,0.0,27
1lsf3xa,[sebastianvettel] Instagram story,https://www.reddit.com/r/formula1/comments/1lsf3xa/sebastianvettel_instagram_story/,2025-07-05, Social Media,,"[""That poster is dope! Seb's shadow, God I miss him🥲"", 'Vettel really is one of the coolest ex-world champions.', 'Weird how it feels as if Seb actually had way more poles than that, considering the 2010-2013 dominance.', 'Good to see Seb post it too , my favorite driver ❤️', 'Love seeing this, it’s definitely a testament to Seb that he held the team record for so long. And he’s always encouraged Max to break his records, like with the wins in a row. I think he and Max are closer than people realize, last year Max said that he and Seb talk/message after almost every race.', 'this poster goes hard', 'so max to Ferrari then', 'The finger!', ""I love how Max and Seb have grown closer over the years  up to the point they text each other all of the time. In a way it's understandable as Max was a teenager in his early F1 career and Seb already had kids then. And now they're both dads and Red Bull champs :')"", 'Christian Horny and his 2 golden boys']",12097,163,0.97,12097,12157,12157,105,0,0.0,105
1lsc52l,Max Verstappen has tied Sebastian Vettel for most poles as a Red Bull driver!,https://www.reddit.com/r/formula1/comments/1lsc52l/max_verstappen_has_tied_sebastian_vettel_for_most/,2025-07-05, Statistics,,"[""It's amazing Seb got so many in so little time."", ""Actually insane that Vettel still had that record. Yes, he had those 4 super dominating years, but with the season having more races now and with how Max is never challenged by his teammates (compared to Webber actually taking some poles from Vettel), I wouldn't have been suprised if he was far ahead by now."", ""Wish people would give Seb the respect he deserves. Some are talking about him as if he's a Kovalainen level driver."", 'He is a demon. No words here necessary.', 'Honestly amazed it took this long', 'Vettel: I’m speed.\n\nMax: I’m inevitable.', 'People forget how race weekends would pretty often be summed up with Seb gets pole, Seb leads into turn 1, Seb gaps the field, Seb wins, repeat\n\nI still remember Singapore 2013 in which he takes pole with just 1 run, dude literally climbed out of the car after 1 run and watched from the garage as nobody beat him to pole, gaps the field by 2 seconds in lap 1, leading by 15s in lap 25, safety car, slight hope of a battle for the lead, nope 2s gap by the end of the first lap after restart, Seb gaps the field by 30s in 30 laps, setting fastest laps while his engineers were stressing just wanting him to bring the car home and wins', 'Vettel was arguably one of the best qualifiers this sport has ever seen. He was putting out poles in that Red Bull left right and centre, does anybody even remember Singapore 2013? That man was an insane qualifier I remember watching him in 2011,12,13 properly and once he got pole (which was almost always a given) #2 and #3 on the grid didn’t even dream of winning the race, they knew it was Sebs. His dominance was insane in those 4 years man.', 'It’s actually surprising that Vettel still had the record lol man had an insanely early peak']",11519,176,0.98,11519,10420,10420,29,0,0.0,29
1lsd4fm,[@justformulacar] British GP Qualifying Gaps Visualized,https://www.reddit.com/r/formula1/comments/1lsd4fm/justformulacar_british_gp_qualifying_gaps/,2025-07-05, Social Media,[https://www.instagram.com/p/DLu1KsFtrPv/](https://www.instagram.com/p/DLu1KsFtrPv/),"['Remember the days when the gap from P1 - P10 was measured in seconds? It is crazy how slim the margins are now.', 'Very interested to see how Lando and Oscar treat the opening corners. Cannot let Max disappear into the distance.', 'Every car here is now built for combat. Alonso wins', 'I hope they can stay that close in the race, maybe closer', 'That is F1 we love', 'Honestly totally forgot that Russel was p4.', 'A great performance from Russel ngl, overshadowed my Max, but still.', 'Russell yet again pulling another mad lap to get that close to the Maccas. Max as usual being Max.', 'Wonder what kind of setup changes RedBull did for Qualifying from FP1. The car seems to be more in control now.', 'Verstappen being really quick through maggots and Becketts and being the fastest man on the straights (I think 8kph faster than McLaren), could make it really difficult for McLaren if they can go faster.\n\nRed Bulls long run pace was impressive yesterday as well.']",5946,247,0.99,5946,10198,10198,21,1,0.0,21
1lsc9f4,"Charles Leclerc post-quali team radio (P6): ""F*. F***. F***. F*** THAT. So fing s I am. I am so fing s. That’s what I am.""",https://www.reddit.com/r/formula1/comments/1lsc9f4/charles_leclerc_postquali_team_radio_p6_f_f_f_f/,2025-07-05, Video,,"['Two types of Ferrari weekend\n\nAbsolute disaster, strategy goes to shit, qualifying is a mess, drivers have to recover \n\nEnd result: P5-P6 \n\nEverything looks good, car looks quick, both drivers seem to be able to challenge \n\nEnd result: P5-P6', 'Everyone in that top 5 (except Max) gonna be replaying quali in their heads tonight cause it could have been any of them', ""It's funny how they press the radio button for these rants"", 'Charles about the crack the whip on himself in his private quarters.', 'what is this title? You are allowed to swear on Reddit', ""Could've been a front row for him and for Hamilton. Shame really."", 'Charles just reminding everyone once again that he is the King of being hard on himself, not Norris.', 'Didnt really pay full attention to him in Q3, what exactly happened?', 'My exact reaction after having so much hope coming into Q3.', 'Ah…we’re in the ‘it’s so over’ part of the Ferrari cycle.']",4947,455,0.97,4947,27663,27663,11,1,0.0,11
1lsf7la,"Horner: ""Purple, Purple, White."" Max: ""Yeah, you want to know something? I saw how much I was up, I saw the gaps! I think I took it a bit easy through the last sector."" GP: ""Better than Purple, Purple, Stop."" Max: ""Yeah, we all know about that.""",https://www.reddit.com/r/formula1/comments/1lsf7la/horner_purple_purple_white_max_yeah_you_want_to/,2025-07-05, Video,"Credit to u/Rohail_FleetwoodMac for transcript
","['Going easy may have prevented him from making the errors Oscar/ Lewis/ Charles made', 'Singapore 2022 and Jeddah 2021 comes to mind', 'Jeddah 2021', 'Can you imagine going flat out through Copse with a low-downforce rear wing', 'Where does he see the gaps? The wheel or?', 'Looking at the others, taking S3 easy was actually the key to pole today.', 'GP just full of sass today!', 'What is white? On the tv they show either purple, green or yellow', 'Quote at the end is incorrect, he says: *""yeah we know all about that.""* \n\nSmall differences but very different meaning, for me at least.', ""Idt that's Horner. Just GP on both""]",4741,151,0.98,4741,11189,11189,20,0,0.0,20
1lsc5gf,"Gianpiero Lambiase: You went motor racing racing. That's pole position, great job!",https://www.reddit.com/r/formula1/comments/1lsc5gf/gianpiero_lambiase_you_went_motor_racing_racing/,2025-07-05, Video,,"['Max FP1: the car is shit!!!!! Undrivable!!  \nMax FP2: the car is shit!!!!! Undrivable!!  \nMax FP3: the car is shit!!!!! Undrivable!!  \nMax Q1: the car is shit!!!!! Undrivable!!  \nMax Q2: the car is shit!!!!! Undrivable!!  \nMax Q3: lets go combat racing', 'Insane q3, 3 big contenders and then max comes in with the steel chair\n\nCrazy', 'Way to stir up old memories GP', 'Cheeky GP commentary is back on the menu!', 'Twisting that knife', '44th pole for Max, in Silverstone.....the irony is big with this one', 'Quality shithousery', 'You can tell they missed each other lol.', ""RB better give him everything he wants, otherwise they are properly f'ed"", 'GP trying to bring back the Abu Dhabi 2021 vibes. On purpose I’m sure…']",3173,326,0.94,3173,9962,9962,-3,0,0.0,-3
1lsyehh,"[Kymillman] Magnificent Appearance, 
A welcome return to the paddock for Kevin Magnussen. This is the first race he's attended since he left the sport at the end of last year. Despite leaving the sport, he still works with Haas as the team's test driver.",https://www.reddit.com/r/formula1/comments/1lsyehh/kymillman_magnificent_appearance_a_welcome_return/,2025-07-06, Social Media,[https://www.instagram.com/p/DLw1nnPgg1h/?utm\_source=ig\_web\_copy\_link](https://www.instagram.com/p/DLw1nnPgg1h/?utm_source=ig_web_copy_link),"['Oh God, imagine if Ollie gets 12 pen points', 'I miss this combat racer', 'My king 😭', ""He's here for payback to sonny hayes' plan c"", 'The first and real combat driver', ""I didn't know he was associated with Haas still."", 'Dude probably inspired 90% of Pitt’s racing in the F1 movie. Let the creator cook is what I say', 'He is still racing in WEC in Hypercars. And he raced at the 24 hours of Spa. Both in a BMW with WRT.', 'No fok smash doors please', 'The Bringer of Chaos has arrived! I feel so hyped for the race now.']",2560,68,0.98,2560,67,67,404,3,0.0,404
1lshc6q,[@JPEIR0] Adrian Newey leaving the track,https://www.reddit.com/r/formula1/comments/1lshc6q/jpeir0_adrian_newey_leaving_the_track/,2025-07-05, Social Media,,"['Doesn’t look very aerodynamic', ""He's now sitting in his office, redesigning the aero on that scooter."", ""That's just Newey casually putting a faster time on the board than Stroll"", 'On his way to Clarkson’s farm to have him double check his math.', '..and gaining an advantage', 'Lando Norris to Aston Martin confirmed.', 'Faster than the AMR25', '“Ok, I’ve seen everything that I needed to see today. See you guys tomorrow!”', 'A satchel of notebooks with designs of strange objects not seen before....:)', 'This image is Pure']",1438,58,0.98,1438,1663,1663,3,0,0.0,3
1lsfv6d,DC's reaction to Max getting Pole,https://www.reddit.com/r/formula1/comments/1lsfv6d/dcs_reaction_to_max_getting_pole/,2025-07-05, Video,,"[""That has to be one of the worst video/audio syncronization I've ever seen"", 'DC\'s mic wasn\'t live in this clip. He whimpered ""I don\'t know"" in a kind of falsetto. He was definitely having a moment of utter incredulousness. You can only hear it quite faintly here.', 'Even after all these years, he somehow left me shocked with a pole. Insane lap', 'Even in my house we went ""oh my god!!!!"" When we saw that -200 tenths in the 2nd sector\n\nEdit: -.200 haha but you get it', 'always love seeing commentators do big moments, in every sport out there\n\nwe can put a voice to the name, see them less, but the passion most put in is great to see', ""Here are some other reactions from drivers to max pole's;\n\n[Monaco pole](https://youtu.be/eCxvOiNLBSo) (2023 I believe)\n\n[suzuka pole](https://youtu.be/VgsqS-vzxiQ) (this year)\n\nEdit: By popular demand Alonso's reaction to [Saudi almost pole](https://youtu.be/GebvHDuconw)"", 'Can you imagine going flat out through Copse with a low-downforce rear wing?', 'That’s a man who knows he just saw one of the most incredible laps of recent f1 history.', 'The addition of DC on a permanent basis has injected the other two with a bit of naughty schoolboys vibe and I love it 🤣🤣', 'This is fun to see, would like to see more reactions from these guys.\n\nOff topic, but it was great to see Billy Monger doing trackside commentary in free practice.']",1403,165,0.94,1403,5083,5083,3,1,0.0,3
1lscms2,[F1] The starting grid for the 2025 British Grand Prix,https://www.reddit.com/r/formula1/comments/1lscms2/f1_the_starting_grid_for_the_2025_british_grand/,2025-07-05, Social Media,,"['A Haas not starting on the last row after a 10 place grid penalty is pretty impressive honestly.', 'Alonso just quietly doing his Q3 things again!', 'Antonelli has a +3 grid penalty from Austria and Bearman a +10 grid penalty for crashing under red flag in FP3.', 'Verstappen for sure is driving for combat.', 'The top three might kill each other by Copse ngl', 'Those two penalties really helped Alonso, Gasly, and Sainz.', 'Ollie whyyyy we could have been P8', 'My prediction is Max moves to cut Oscar off, Lando sees his chance and  rejoins in 18th.', 'Vamos Carlos.', ""Ollie could've gotten some important points this weekend, stupid mistake. Hope he learns from it.""]",1187,163,0.99,1187,4511,4511,-3,0,0.0,-3
1lscc48,Full Onboard: Max Verstappen’s Pole Lap at Silverstone (2025),https://www.reddit.com/r/formula1/comments/1lscc48/full_onboard_max_verstappens_pole_lap_at/,2025-07-05, Video,,"['It really is a pleasure watching Max in his element- despite everything, he always does his best to extract the car’s maximum potential. Such a great driver!', 'I fully expected a Piastri or Hamilton pole then I saw Max with two purple sectors holy shit', ""Poetry in motion. Definitely one of Verstappen's best laps."", 'His ability to execute is incredible, metronomic precision when he has the tool to do what he wants.', 'He is too good', 'That car is in god’s hands', ""It's interesting how wide he went on that fourth turn and still maintained speed."", 'Did the car understeer in turn 4 or is that the preferred line?', 'Snatched pole lap on race setup', 'Any team would save a spot for Verstappen even the Mclaren.']",1125,274,0.95,1125,5463,5463,-1,0,0.0,-1
1lsz9tq,"[Thomas Maher] Northamptonshire Police has confirmed that the theft of a steering wheel from a classic #F1 car at Silverstone was reported to them and is currently being investigated. The incident occurred at 2:30pm on Friday, being stolen from a car in the classic display area. #BritishGP",https://www.reddit.com/r/formula1/comments/1lsz9tq/thomas_maher_northamptonshire_police_has/,2025-07-06, News,,"['Some people are absolute arseholes.\nThe only places where robust security and barriers aren’t put up to stop this and people feel the need to do this? Genuinely some people feel there are no consequences', ""In other, completely unrelated news: I'm selling a vintage F1 steering wheel if anyone is interested\xa0"", 'some livestreamer streamed themselves cracking the side pod of the 2019 racing point that was on display by copse too :/', 'Briatore too desperate for an upgrade', 'What would steer someone to do this', 'Did Jesus take it?', 'It amazes me that people can be brazen enough to do things like this in full view of hundreds of other people.', 'Imagine being bold enough to even attempt that.', 'Did anyone check the British Museum?']",1051,86,0.99,1051,75,75,125,1,0.0,125
1lsffvi,"Alex, Jolyon, and DC are so god damn good",https://www.reddit.com/r/formula1/comments/1lsffvi/alex_jolyon_and_dc_are_so_god_damn_good/,2025-07-05, Discussion,"This is my first season since, like, 2016 where I'm paying attention to every race weekend of the F1 season and man, these boys are so good at commentary. DC and Jolyon offer so much insight and Alex is so good at leading the commentary and keeping things exciting as well as corralling the other two. 

Everyone is jovial and jabby and seemingly having a good time. It's great. The day this trio is broken up in some way I will be pretty sad about it. IndyCar has made strides in their commentary since going to Fox but I can only dream of when it's this good for them too.","[""Jolyon is the true successor to Brundle imo, He's brilliant as a commentator."", ""F1 TV is so good. It's not just the commentary but even the hosts and trackside reporters who just seem a cut above what Sky farts out. Forget the lack of obvious bias, it's just a win to have a commentary team that doesn't frequently mis identify drivers in the action."", 'The British GP is the only time I can really listen to them over a full race weekend as Channel 4 will get to share full rights with Sky and I really enjoy them. \n\nTBH I prefer Channel 4’s coverage overall to Sky’s.', ""Alex Jacques genuinely impresses me! I think his voice has a melodic quality to it that I really like, and he's able to use cadence well for emphasis, unlike Crofty's near-singular tool of volume. \n\nCoupled with his clear enthusiasm for the sport and the drivers (and I think he has a soft sport for a lot of the drivers he covered in F2), and his sometimes lyrical refrains (the whole Monaco 24 win speech), and he makes it an easy decision for me to stick with the F1TV commentary.\n\nBonus when Hinch is around and joins too!"", ""The f1tv crew are my favourites and it's not even close. I sometimes rewatch races with different languages and that's when you really notice the difference that good commentators make."", ""Couldn't agree more! \n\nThey really give off a vibe that it's just three extremely knowledgeable buddies watching the race together \n\nLoved the bit where they tried to name the Silverstone winners Hahaha"", ""Those three keep me subscribed to F1TV indefintely. I even listen to them sometimes at work when I can't even watch the action visually. Still entertained."", 'Totally agree! DC is my fav. Add Ruth to the mix with her strategy perspective and this F1 crew is amazing.', 'I can’t live without jolyon on the mike. I like DC as well.\n\n\nSo much better than the main two guys.']",1013,145,0.94,1013,2489,2489,3,-1,0.0,3
1lsea3b,"[Max Verstappen via ig] That’s just simply lovely! Let’s go @redbullracing, excited for the race",https://www.reddit.com/r/formula1/comments/1lsea3b/max_verstappen_via_ig_thats_just_simply_lovely/,2025-07-05, Social Media,,"['Death, taxes and that damn Dutchman. What lap.', 'He seemed genuinely excited on radio, hoping for an entertaining race tomorrow', 'this kinda has the vibes of Anakin murdering every remaining Sith and becoming Jedi master the day after palpatine  offers him to be his apprentice', 'Pole AND a Jose Mourinho pic!? Top weekend!', 'Toto not happy today lol', 'Can you imagine going flat out through Copse with a low-downforce rear wing', 'McLaren, and probably even Ferrari, should have a better race pace, but damn..this man is unstoppable', ""As much as I would love to see Max in a Merc cause that just sounds too weird to be true, I wish he stays and RBR cleans up their mess.\n\nWhen I started watching I was/am a McLaren fan but omfg if Max is the ones that beats the McLarens I don't care. \n\nMy GOAT"", 'Go Max, you will win the GP tomorrow', 'Great bounce back from Austria, even though it wasn’t even his fault 😂']",976,19,0.94,976,440,440,4,0,0.0,4
1lsc3lb,"Verstappen on pole, Piastri P2, Norris P3",https://www.reddit.com/r/formula1/comments/1lsc3lb/verstappen_on_pole_piastri_p2_norris_p3/,2025-07-05, Video,,"['Max FP1: the car is shit!!!!! Undrivable!!  \nMax FP2: the car is shit!!!!! Undrivable!!  \nMax FP3: the car is shit!!!!! Undrivable!!  \nMax Q1: the car is shit!!!!! Undrivable!!  \nMax Q2: the car is shit!!!!! Undrivable!!  \nMax Q3: *casually wrecks the field and gets two purple sectors*', 'How tf does he always do this shit bro', 'Where the fuck did Max come from', 'What the fuck Max', 'Wow Max is definitely in a different class lol\n\nPrice just doubled for Toto.', 'Max: Complains about the car all weekend\n\nAlso Max: Qualifies on pole\n\nHe really is inevitable 😭', ""He's a machine"", 'Max is a fucking alien, what a lap', 'What could’ve been for Hamilton.', 'Oh my god']",769,224,0.95,769,4934,4934,-3,0,0.0,-3
1lsxk1q,Sky is starting to clear up!,https://www.reddit.com/r/formula1/comments/1lsxk1q/sky_is_starting_to_clear_up/,2025-07-06, News,,"['Classic Silverstone, hope you packed suncream', 'Literally every weather app has it different. Google has it raining till 4. BBC till 5. Met until 2. Gotta love the British weather.\n\nMax and RB will be praying for dry', ""I'm an hour from Silverstone and there's currently thunder and lightning here. God it's good weather for a GP"", 'There is only one thing more unpredictable than silverstone   weather right now and it’s Ferrari’s strategy for it', 'Yeah but what about F1TV?', ""I'm in the next town over... Lightning and more rain on the way"", 'Fans are in for a treat today!', 'What are those for vehicles on the track?', 'Come on it’s Silverstone and rain is the equalizer in races. Been soaked there several times in the \n90s . There is always a race winner whatever the conditions.  \nWas at a WEC race at Silverstone and snow stopped practice !!!', 'More rain incoming']",758,61,0.98,758,55,55,30,0,0.0,30
1lt09ry,"[Chris Medland] More rain now expected at 14:20, so as the pit lane opens and 40 minutes before lights out. Almost guaranteed to be a wet start",https://www.reddit.com/r/formula1/comments/1lt09ry/chris_medland_more_rain_now_expected_at_1420_so/,2025-07-06, News,,"['Max said yesterday that new low downforce wing won’t do well in rain. RIP.', 'A wet start should be exciting, but for some reason I dread it', 'For a race to have a wet start, there *has* to be rain. - will buxton', 'Five lap safety car parade, rolling start, Stroll shunts it, red flag.', 'lewis vs stroll vs verstappen vs alonso', 'Hopefully standing start', 'I think ( and hope) the Saubers may do well. They were incredibly slow on top speed yesterday and that may indicate a high downforce setup', ""wet to dry silverstone let's gooooo \n\nLH lock in"", ""Max's skill vs a car that's proven very finicky to drive with a setup not quite optimized for the conditions, he either pulls an all-time great race or he loses his pole advantage."", 'So will Chuck’s seat be full of water? Like FULL of water?']",746,138,0.99,746,130,130,52,3,0.0,52
1lsktvd,[@f1] GHOST CAR! Watch how Max Verstappen pulled away to claim pole!,https://www.reddit.com/r/formula1/comments/1lsktvd/f1_ghost_car_watch_how_max_verstappen_pulled_away/,2025-07-05, Video,,"[""Oscar won't be able to utilize the cornering speed that much behind Verstappen, because aero wash, and he needs to slow down because theres a car in front of him. Verstappen on the other hand can pull away easily on straights, and because of the low drag setup overtaking with DRS wont be easy either. \n\nWe are in for a banger of a race, can't wait!"", 'Max this season ;\n\nAustralia : Championship on\xa0\n\nChina : Championship off\n\nJapan :\xa0Championship on\xa0\n\nBahrain :\xa0Championship off\n\nSaudi :\xa0Championship on\xa0\n\nMiami :\xa0Championship off\n\nImola :\xa0Championship on\xa0\n\nMonaco :\xa0Championship off\n\nSpain :\xa0Championship off\n\nCanada :\xa0Championship on\xa0\n\nAustria :\xa0Championship off\n\nBritain :\xa0Championship on\xa0', 'The fact he gained through Copse, Maggots and Becketts despite running a lower downforce wing is incredible', 'I love these ghost cars.\n\n\nSo enjoyable', 'Red Bull cooked with that low DF setup.', ""Hm. Oscar didn't come up to him in the Maggots Becketts S-es, did he? In the dirty air, that will be even harder."", 'If it rains Max is cooked otherwise he should have this in the bag with the clean air and low df wing which makes overtaking harder', ""Red Bull made things interesting with a low drag rear wing. If Red Bull's tyres can hold on, Max should be in the mix for the win"", 'Plan C for COMBAT', 'just alot faster in the higher speed corners and the straights, red bull car is no slouch. they really need to sort out the second car. Max was complaining all practice how it was handling, they tweaked their setup to make the fastest car. Meanwhile on the other side of the garage........']",665,139,0.93,665,2220,2220,-1,1,0.0,-1
1lsc9d8,2025 British Grand Prix Qualifying Classification,https://www.reddit.com/r/formula1/comments/1lsc9d8/2025_british_grand_prix_qualifying_classification/,2025-07-05, Statistics,,"['Gasly went really under the radar that whole session.', 'Tomorrow will be one of the best races of the season.', 'I hope and pray for a good start for Ferrari. Hope that good race pace can kick in early.', 'Super lap by George!! Was hoping to see him next to Max but P4 is cool\n\nWhat more can he do...', 'Russell also pulled one out there would have been hilarious if Max and him were 1-2', '2 tenths lost, so close. Sigh', '5th and 6th in q3 after topping q2, man... at least this track has a lot of overtakes, but I cant stop thinking of what couldve been', 'George jumping over both Ferraris is being slept on', 'Looks set to be a good race. If McLaren get a 2023 style start they have the car to actually defend it this time too.\n\nRussell performing too.\n\nAlso, Hamilton may get a podium after all.']",632,141,0.98,632,2609,2609,-3,0,0.0,-3
