unique_id,post_heading,post_url,publish_time,tag,post_content,top_comments,upvotes,comments,upvote_ratio,score,total_upvotes_comments,total_score_comments,upvotes_growth_rate,comments_growth_rate,upvote_ratio_growth_rate,score_growth_rate
1hc7fxa,Pit stop holding the cables out of the way question,https://www.reddit.com/r/formula1/comments/1hc7fxa/pit_stop_holding_the_cables_out_of_the_way/,2024-12-11, Discussion,"Has there ever been a case of cars getting caught up in other team's cables after they take off from their pit stop? It seems strange that after all this time the teams still need to hold those away for each other, with the cars peeling out and drivers desperate to get back on the track, it seems like one of those legacy things that gets eliminated as too dangerous.","['2021 was wild. Red bull and Mercedes would not even move them and have the pit guys stand beside them', 'They don’t have to hold them, it’s more of a gentlemen’s agreement to make it easier to leave the pit stop. The drivers are able to go around the cables just fine, when there are multiple teams boxing at the same time, the pit crew is standing where the cables are hanging and they just drive around them.', ""They've been run over before, I think Checo did it last season at some point. Broke the wheel gun, whoever and whenever it was.\n\nIt's purely a sportsmanship thing though, they're not obliged to move them. Imagine at worst the cable detatch before doing harm to the car but genuinely no idea."", 'It’s not really making room for the driver…it’s protecting your own cables just in case..', 'hell sometimes in a title fight it’s used as a tactic against the rival team especially if their pitbox if close to eachother lol straight up putting their staff in danger just to fuck with the other guy', 'All the teams have been allocated enough space to rejoin the pitlane even if the hoses stay in place.\n\nHolding the hoses is a courtesy thing because it allows other drivers to rejoin with a less sharp trajectory. (safer and faster i guess)\n\nThe teams are not obligated to hold them. There is enough space.', 'In just about every other motorsport category with pitstops it is in the regulations to hang your guns and lines up on the gantry to clear the pitlane when not using it. Not sure why F1 has avoided implementing this quite basic safety rule for so many years.', 'Dunno, but I vividly remember that in 1979 or 1980, Renault driver Jean-Pierre Jabouille bent his own (I think it was right) front wing in the cable of his own team. Did that happen to anyone else, ever?', 'Partly as a courtesy, partly as it’s in a team’s interest to prevent a rival from ripping out their pit gantry during a race.']",72,35,0.87,72,938,938,4,0,0.010000000000000009,4
1hclh3c,‘The biggest winner will be F1’ – Christian Horner reveals plans to avenge constructors’ defeat as he predicts ‘massively close’ 2025 | Formula 1®,https://www.reddit.com/r/formula1/comments/1hclh3c/the_biggest_winner_will_be_f1_christian_horner/,2024-12-12, News,,"['By signing Checo to a new 3 year extension.', 'It’s Thursday. Meeting was Monday. They are still negotiating, means there’s a chance Perez stays one more year. looool. \n\nThe fact that they didn’t cut Checo yet already a flag that he’s staying.', 'Can\'t really ""avenge"" something that you caused yourself', 'Can you get vengeance against yourself?', 'Aaand does the plan for 2025 not involve Perez?', 'All I ask for is a 6 driver fight for the title from 4 teams. Is that really too much to want?', 'the fact that there isn’t news about checo leaving the seat already has me fearing for my life. another year with perez stats oh god….', ""Its almost like championships/races actually become more fun at the end of the specs.\n\nWhy don't we, I don't know, just freeze the specs for longer instead of constantly switching as soon as it becomes fun?"", '2025 is going to be an interesting year for Red Bull after losing Adrian Newey and Jonathan Wheatley.']",62,38,0.83,62,35,35,37,8,0.08999999999999997,37
1hcilup,"Max Verstappen and Jeff Dodds decide outcome of $250,000 wager!",https://www.reddit.com/r/formula1/comments/1hcilup/max_verstappen_and_jeff_dodds_decide_outcome_of/,2024-12-12, Video,,"['Well, now we know what they were talking about the other day.', 'MBS to Max - "" I can make those penalty points go away, if you know what I mean.""\n\n*tries to wink, fails.*', 'Giving a lot of money (even tho it is not a lot for them, it still is a lot) to good causes is always nice.', ""Can't watch the vid here at work. What was that wager (and who won)?\n\nEdit: nvm, found a transcript. TLDR: Jeff bet that Max would win the championship. If he lost, he would donate 250K to a good cause. He lost, but now bot Max and him both donated half.\n\nNice!"", 'Great', 'I really had to google who Jeff Dodds is..', ""[Jeff Dodds (Formula E CEO): The F1 title is 99% done. Max can put the trophy in his cabinet right now. If he doesn't win it, we'll give $250k to the driver who does - to a charity of their choice](https://old.reddit.com/r/formula1/comments/1awd2k0/jeff_dodds_formula_e_ceo_the_f1_title_is_99_done/)"", 'easy tax write off', '>\xa0Jeff bet that Max would win the championship. If he lost, he would donate 250K to a good cause. He lost [...]\n\n\nBut Max did win the championship?', ""Dodds didn't lose, and just to be clear, they are giving away the original quarter million. Verstappen chose a destination for half, but he didn't pay anything.""]",49,28,0.73,49,28,28,2,0,0.0,2
1hbyduj,Regulatory updates across multiple categories confirmed during the World Motor Sport Council held today in Rwanda,https://www.reddit.com/r/formula1/comments/1hbyduj/regulatory_updates_across_multiple_categories/,2024-12-11, News,,"['In relation to F1:\n\n> **FIA Formula One World Championship**\n\n> The FIA President, together with the President and CEO of FOM, Stefano Domenicali, reflected on a hugely successful season in 2024, which was the longest in the history of the sport. The productivity of the single-seater pyramid, which stretches from Karting through to Formula 1, was highlighted, with no fewer than four drivers stepping up from the FIA Formula 2 Championship into Formula 1 in 2025.\n\n> Minor updates to the 2025 Sporting and Technical Regulations were approved by the World Council, including the finalisation of ‘Heat Hazard’ regulations which mandates the use of a driver cooling kit under certain, extreme weather conditions. This device was developed in collaboration between the FIA and the F1 teams over the past year.\n\n> A number of updates to the 2025 and 2026 Financial Regulations were approved to include an expanded definition of ‘Sustainability Initiatives’ that are excluded from the cost cap to encourage the continued push towards greater environmental sustainability.\n\n> Updates to the 2026 Sporting Regulations were updated to reflect changes already approved for 2025, in addition to the adoption of gender-neutral language throughout.\n\n> The 2026 Technical Regulations have also been refined, ahead of teams being able to work on the aerodynamics for the first time beginning on 1 January 2025.\n\n> A new section of regulations is being created for 2026 called Operational Regulations, aiming to regulate certain F1 Team activities that take place away from the race weekend. For this initial version of these regulations, certain elements that have historically been included in the Sporting Regulations have been transferred, such as limitations to aerodynamic testing, power unit testing and mandatory shutdown periods.', 'Does anyone know why the duck this is in Rwanda? I’m assuming for $trat€gic reasons', ""And what I'm sure is *simply lovely* news for Verstappen in terms of wanting to get away from FIA influence...\n\n>**Esports**\n\n> Another significant step in the development of Esports competitions has come today, as the World Council approved the creation of an FIA Esports Code (Appendix E) – the first such framework created by a global sporting federation.\n\n> All real-world motor sport competitions are ultimately governed by the International Sporting Code, and as virtual racing continues to grow rapidly, the FIA Esports Code will regulate Esports racing competitions, providing the ASNs with the necessary legal framework to conduct such events at the national level.\n\n> After sanctioning two Esports competitions during the 2024 FIA Motorsport Games, it is anticipated that many more events will be sanctioned in the coming years. There are fundamental elements that have always existed within the ISC, such as the definition of an automobile or a driver, that have had to be changed within the Esports Code so that they make sense within this new frontier of racing."", ""> A new section of regulations is being created for 2026 called Operational Regulations, aiming to regulate certain F1 Team activities that take place away from the race weekend. \n\nFIA-mandated pissing break for all teams' personnel when?"", 'Yes. The prize giving gala will also be held there.', 'Max: man fuck this game\n\n*Virtual MBS appears*', 'MBS doesn’t allow his employees to take pisses', 'Yeah but why']",46,10,0.83,46,79,79,-7,0,-0.020000000000000018,-7
1hbz4sz,[Sky Sports F1] Zak Brown reflects on McLaren's first Constructors' title in 26 YEARS,https://www.reddit.com/r/formula1/comments/1hbz4sz/sky_sports_f1_zak_brown_reflects_on_mclarens/,2024-12-11, Video,,"['Hats off to McLaren, for shaking the proverbial monkey off its back, that customer teams cannot win championship', 'slightly OT but has Zak lost weight? He seems lot leaner nowadays', 'What and where is he getting tattooed this time??', ""Yep.\n\nI remember even in 2020, Seidl saying you wouldn't notice McLaren's financial problems soon, but the 2022 car might be hurt.\n\nFair called that one!\n\nHis beyond the grid in 2020 is really good where he talks about the key thing as a manager is being given time - at least five years - for your efforts to manifest. And other than the odd blip with explanations, McLaren have been linear since then.\n\nAhead of expectation, as they said towards the end of 2024."", '26?? Thanks for making me feel old, I watched that 1998 season.', ""New regs will always hurt customer teams, i don't expect McLaren to be as competitive as Mercedes in 2026\n\nIt's not only about aero, but also integration and deep insight into the PU, factory teams will always play their cards close to their chest"", ""I thought the same, he's still carrying more heft than Toto or Christian, but he's definitely dropped some pounds since the Fernando years."", 'Every rich American is on Ozempic. No shade, just incredibly likely', ""Seidl,Wheatley and Binotto were fantastic signings for the Audi team \n\nBut Key as technical director doesn't inspire hope"", 'Part of McLaren  re-signing with Mercedes included a seat at the table during all stages of engine development. They’re now in there from the ground up. Stella and Wolff revealed that last year during the announcement.']",42,14,0.7,42,101,101,1,0,0.010000000000000009,1
1hc0bl9,Abu Dhabi GP Race Debrief - Mercedes-AMGF1,https://www.reddit.com/r/formula1/comments/1hc0bl9/abu_dhabi_gp_race_debrief_mercedesamgf1/,2024-12-11, Video,,"[""One last Race Debrief for 2024! Hope you've enjoyed this series throughout the season and enjoy the insight in our Abu Dhabi episode"", ""Oh I'm gonna miss these.""]",39,2,0.85,39,17,17,3,0,0.020000000000000018,3
1hby5h0,Brawn F1 documentary ,https://www.reddit.com/r/formula1/comments/1hby5h0/brawn_f1_documentary/,2024-12-11, Discussion,"I have just watched the documentary today whilst commuting.  Blimey it brought back memories of that championship.  

Remembering Jenson clinching the title actually brought back tears and I had to look out the window whilst I got my face back into order.  

My god but isn't this just why we love F1?","['I watched 2009 live as well and I was supporting Vettel. While Yenson had a dip in form in the 2nd half, he still collected the points he needed in typical Yenson fashion.\n\nThink his best drive/win was in Bahrain, where he brilliantly passed Hamilton (KERS powered car) early in the race, allowing him to attack the Toyotas immediately, while Vettel got stuck behind Hamilton for the whole of the first stint.\n\nDeserved WDC.', 'I loved how this year really just shattered so many perceptions of F1. \n\nInterest in the sport in Britain absolutely shot up during Lewis’ rookie year and it was so difficult to explain to newer fans that Lewis, while obviously great, was as dependent as anyone on a great car. The early races of 2009 were simply unfathomable to these people.\n\nI really wish we had a year like 2009 once every generation, just to remind everyone how deep the talent pool in the sport can be. I was sure from 2004 - and convinced from 2006 - that Jenson was among the upper echelon of drivers. I wasn’t sure he had a WDC in him but he was definitely someone that could win consistently in the right car, and the only prior year he had one that was consistently good was in a year the Ferrari was miles ahead of anything else.', ""Not seen the documentary but I watched the season more intently than most, back when BBC had the license here. Jenson had in his career up to this point had the full confidence in his teams that he was world champion material but never got the opportunity to show it. In typical Jenson form he complained about no grip during testing in 2009 and had low expectations, until it was clear that everyone had those issues and Brawn were ahead of the competition.\n\nToyota I remember being good too, but Brawn had the best driver lineup of the competitive cars and Jenson made the most of it. It was an interesting season because just as Ferrari and Mclaren started to get on top of things and Red Bull were getting into their stride, Jenson's performances took a dive and Rubens was on top, right to the end it looked like it could go 3 ways. Spa showed the value of KERS, with Force India having the fastest car and being unable to pass Kimi due to his strong defense. \n\nThat Spa drive to 2nd got Fisichella his dream drive at Ferrari, but he would soon see the car was near undrivable and Kimi was doing literal miracles with it."", 'We do. The unexpected wins are the most beautiful. Like Jones in ‘77, or Maldonado in ‘12. Panis in ‘96. Max Brazil 2024.', 'So totally agree with this comment.  +1 \n\n+10 if I could have!', 'The BBC had amazing coverage of those seasons as well. Obviously it got more and more popular so Sky stepped in and bought it, so I stopped watching for years.\n\nOnly recently got back into it, still not paying for Sky though.', 'I feel like Brazil 24 is massively out of place with the others you named. Obviously it was unlikely and it was beautiful to watch, but I would not call the best driver on the grid and a literal rain god winning in wet conditions unexpected, no matter how far back he started.', 'Hill 99 and Gasly 2020 or Perez 2020 might fit better here. Ocon 2021 didn’t really feel the same imo.', 'Fair enough']",37,10,0.78,37,67,67,4,0,0.010000000000000009,4
1hc5da8,Gifting ideas for an f1 fan,https://www.reddit.com/r/formula1/comments/1hc5da8/gifting_ideas_for_an_f1_fan/,2024-12-11, Discussion,"It’s the holiday season, and I saw a post on r/yoga of a guy asking what he should buy his yoga-loving wife full of great suggestions. 

I’m the f1 loving one in my family, but in case my loved ones venture on here to look for suggestions, I’m setting up this post to save them the effort (and maybe inspire myself along the way).","['Lego F1 set, every F1 fan I know also likes Lego. Plus they have sets at a variety of price ranges.', 'https://gpcars4sale.com/car/f1-leyton-house-cg891-02-running-car/', 'F1 tv subscription. I am guessing it depends on where in the world you live, so you might want to include your location.', 'I definitely agree on the lego sets, maybe general merch from drivers/teams that one likes. there are some really cool posters in some online stores one could get. a friend of mine collects little tyres for key chains, and I like to crochet, so I made driver-inspired decoration for my car and my key :)', 'Track outline 3D prints are cool stocking stuffers. I got Gilles-Villeneuve last year and keep it on my desk at work. Great conversation started.', 'Lego F1 sets are a way to go. Also, if you know the persons favourite team or driver, getting their merch or something along those lines is a great gift for them.', ""I've got a couple of prints from F1 tracks I've been to, and one of these [Tintin F1 posters.](https://www.ebay.co.uk/itm/264978714590?mkcid=16&mkevt=1&mkrid=711-127632-2357-0&ssspo=lqp3DNBTTd6&sssrc=4429486&ssuid=1AQTJuU-RHG&var=&widget_ver=artemis&media=COPY) If you know if they've been to any races then this might be a good shout."", 'Tickets', 'Just a general caution to all the very well meaning and sweet people here: It might seem like the obvious route but buying someone something related to their interests is a risky proposition. I say this as person with intense interests who has gotten plenty of well meaning but terrible gifts relating to those interests. If you are asking about it on the internet, consider that you might not have the familiarity needed to buy someone something related to their interest. Maybe consider something more generic like chocolate or money.']",25,38,0.73,25,188,188,-2,2,-0.030000000000000027,-2
1hcktqn,How Formula One plans to transition to '100% sustainable fuel',https://www.reddit.com/r/formula1/comments/1hcktqn/how_formula_one_plans_to_transition_to_100/,2024-12-12, Technical,"An article in ChemistryWorld that I happened to come across today. No amazing new insights or groundbreaking news in there, but I thought it was an interesting read nonetheless ","['Damn, I hope they announce allinol already', 'Here is the actual article instead of the picture of the paper version. MIght be easier to read:\n\n[https://www.chemistryworld.com/news/how-f1-plans-to-transition-to-100-sustainable-fuel/4020167.article](https://www.chemistryworld.com/news/how-f1-plans-to-transition-to-100-sustainable-fuel/4020167.article)', ""[Here's a link to the article](https://www.youtube.com/watch?v=dQw4w9WgXcQ)\n\n[Mirror](https://www.chemistryworld.com/news/how-f1-plans-to-transition-to-100-sustainable-fuel/4020167.article)"", 'Those 20 cars going around the track is dwarfed by the amount of fuel the transport of all the people and equipment costs', 'By burning the corpses of RedBull potentials?', 'We developed the car while we still used horses. I think we should be optimistic about the process here.', ""I was figuring we'd just be using refined bullshit straight from MBS as the fuel."", 'So we can have the V10s back, right?\n\nRight?', 'Focusing on fuel for sustainability is like worrying about mouse manure when you’re up to your ears in elephant sh*t. \n\nHow about creating a schedule that makes travel more efficient? That’s the main culprit at 45%+ of the carbon footprint. Or improve the factories since they’re nearly 20% of emissions. Even events account for more emissions—7.3% to be exact. \n\nOh, but wait! F1’s goal of net zero by 2030 perfectly aligns with the UAE, Saudi Arabia, and others’ goals (and investments) in the renewable fuels space. And I’m sure that’s just a coincidence, absolutely nothing to do with FIA prez Mohammed Ben Sulayem, right?']",26,74,0.66,26,68,68,8,6,0.020000000000000018,8
