unique_id,post_heading,post_url,publish_time,tag,post_content,top_comments,upvotes,comments,upvote_ratio,score,total_upvotes_comments,total_score_comments,upvotes_growth_rate,comments_growth_rate,upvote_ratio_growth_rate,score_growth_rate
1oake54,[Autosport] Zak Brown regrets calling Nico Hulkenberg's driving amateurish during the US GP Sprint,https://www.reddit.com/r/formula1/comments/1oake54/autosport_zak_brown_regrets_calling_nico/,2025-10-19, Social Media,,"['It was stupid to blame nico but at least he acknowledges his mistake', 'Will there be repercussions for himself?', ""Good on him. I thought he is going a bit too far with that, but it's understandable in a heat of a moment."", 'Not a Zac Brown fan, but seeing new evidence and changing your opinion, then publicly acknowledging you were wrong and apologising are signs of a decent person.', 'I like that he acknowledged his mistake\xa0', 'More worrying for me was Andrea Stella, after the fog of war faded, criticising Hulkenburg and supposedly Alonso too. That sort of divisive bollocks you’d expect from Brown, who to his credit apologised, not Stella.', 'I wonder who he blames for it then', 'Sky knew exactly what they were doing, once I heard them say they were going to go to the wall for an instant reaction I knew ZB was going to put his foot in it.', 'I think we all knew that when he said that it was in the heat of the moment. Kudos to him for looking at it and admitting he was wrong.']",9712,480,0.98,9712,21587,21587,36,1,0.0,36
1oaklnp,Stroll suffers 30th consecutive grand prix qualifying defeat to Alonso: Qualifying data,https://www.reddit.com/r/formula1/comments/1oaklnp/stroll_suffers_30th_consecutive_grand_prix/,2025-10-19, Statistics,,"[""Stroll obviously isn't Ayrton Senna, but 30-0 for a 44-years old is crazy. That means no off weekends, no deleted laps for track limits, very strong banker laps against flags or worsening track conditions, etc. Insane focus and consistency about 10 years later after the average driver starts to falter.\n\nF1 has been taking Alonso for granted after 13+ years of average to shitty cars, but he's still scary. We talk about his theoretical peak pace dropping with age, which I'm sure it has done, but his pace relative to Stroll hasn't dropped at all in 3 years. And regardless of that, if he'd had a McLaren this year we know he would've bottled very very few of his chances unlike Lando and Oscar. Give this man a top car again."", 'Also bear in mind Alonso is the only driver he hasnt outqualified in these 30 races, so no, its not just because its Stroll, literally only Alonso has done this.', 'But only a gap of 4pts in the WDC so... Stroll goat race craft confirmed? /s', 'People sometimes underrate Alonso due to the amount of mid cars he’s had since 2014 but he’s not an ordinary midfielder', ""Because Alonso is Alonso. World title holder with pure talent. Stroll is a billionaire's son who would have never been in F1 if it was not for his father money. I think this is obvious to anyone."", 'In the last 30 races Stroll has outqalified Verstappen, Norris, Piastri, Leclerc, Russell, Hamilton, Sainz and so on but not Alonso. Crazy', ""My theory:\n\n1. Stroll is generally a couple of tenths slower than Alonso in qualifying.  With the maturity of the rules and teams focusing on 2026 the field has closed up in qualifying and now that gap mean Alonso goes to Q2 or Q3 while Stroll is out in Q1 or Q2.\n\n2. Stroll is inconsistent.  Sometimes he'll put in a great lap seemingly out of nowhere.  But since he keeps getting eliminated early he has had a lot fewer chances for those kinds of laps.\n\n3. As we have seen in races with Alonso, luck is a factor. You'd think at  least once he'd run into traffic when Stroll didn't, or get caught out by a red or yellow flag when he needed a lap, and so on.  Instead his bad luck seems to hit him during the race instead."", 'Alonso is a scary driver ngl', 'Alonso is 44, alien.', 'I do wonder what the long term planning is at Aston. Alonso probably retires at the end of next season having had a year in a Newey designed car , Stroll would be better off going to WEC. They\'ve not really invested in an academy either. \n\nI know they\'ll try and blank cheque another "" name"" driver but everyone is under long contracts now and is the shiny new factory, works Honda power and Newey enough to attract anyone? \n\nUltimately does this end up with Lance leaving the sport and Lawrence selling the team to PIF/Aramco? I feel like I even have more of a fix on Alpines future than trying to figure out Aston.']",962,103,0.98,962,2247,2247,7,0,0.0,7
1oak2a8,Verstappen could become World Champion with Red Bull being in 4th place in the Constructors Championship.,https://www.reddit.com/r/formula1/comments/1oak2a8/verstappen_could_become_world_champion_with_red/,2025-10-19, Discussion,"Isn’t this crazy? The last 6 races are going to be epic! Has this ever happened in the past that the team of the world champion finished 4th or worse?

Verstappen has nothing to lose and is performing phenomenally. While Piastri and Norris seem to crumble under the stress. 

Let’s hope we have a battle between these 3 in the very last race. 
","['Williams was 4th in the constructors in 1982 when Keke Rosberg won.', ""Despite Tsunoda's best efforts, I don't think Red Bull will finish 4th in the constructors if Max wins the championship!"", 'if Max can steal the WDC, it will be his most impressive championship ever', 'Well thats what happens when your teammates is stinking up the gaff. 22 points from Tsunoda this year is just inexcusably bad.\n\nAlbon broke 100 in 2020 in just 17 races and that was considered a poor season that lost him the seat.\n\nBut if Max scores enough points to win the title Red Bull will probably end up 3rd in the WCC. Ferrari have no consistency at all at the moment.', 'If Max wins the title then they’ll overtake Ferrari and Mercedes purely based on the points taken from Verstappen’s victories given he has to win at least 5 of the 6 realistically', 'Imagine if 2nd rb driver was in the mix taking points away from McLarens? One can only dream lol', 'It’s crazy how locked in Max is at the moment. As a driver, he seems head and shoulders above anyone else out there. \n\nEven as good as he is, in the first half of the season nobody could’ve imagined that any car other than a McLaren would even be in the championship fight. What a turnaround.', 'I have a theory that almost every question about weird results in F1 can be answered by saying ""1982"".\n\nAnd lo, Williams were fourth in the Constructors\' Championship in 1982, even though Keke Rosberg won the Drivers\' Championship.', ""Mf just won me over this season. Dude is just on absolute mission with checking sidequests left and right. I was ready for new champ and that would be refreshing(before Mclaren decided to play their %\\^&\\*@! game), but now I'm all on the hype train. Let's hope.""]",862,179,0.88,862,3543,3543,0,0,0.0,0
1oakwm3,Stroll gets F1 grid drop for needless sprint race clash,https://www.reddit.com/r/formula1/comments/1oakwm3/stroll_gets_f1_grid_drop_for_needless_sprint_race/,2025-10-19, News,,"['So where does he start now? At turn 11?', 'So now he has more targets to choose from. Great', 'Expected and entirely deserved. He absolutely torpedoed Ocon.', ""This essentially forces him into gambling on his race strategy. He's gonna be either strolling into the points or racing with the Alpines at the back at the chequered flag."", ""Fully deserved. If I had made that move on iRacing I would have been so ashamed I wouldn't touch the sim for at least a week."", 'Stroll doing Stroll things 😂', ""'If you no longer go for a gap...'\n\nStroll is so good he doesn't even need a gap to go for it"", ""Should've gotten a big penalty for trying to continue with clearly visible damage\xa0"", 'Strolledo', 'not even that bad. just hard racing like max. champion mentality right there.']",170,34,0.96,170,343,343,0,0,0.0,0
1oak6c0,US Grand Prix Global Race Start Time,https://www.reddit.com/r/formula1/comments/1oak6c0/us_grand_prix_global_race_start_time/,2025-10-19, News,,"['Nice graphic, can’t help but feel it would be more useful to have things ordered by time zone instead of alphabetical cities', 'Shoutout to F1calendar.com', ""That's such a confusing graphic"", ""One of the worst times for me, but it's fine since tomorrow is a holiday.\n\nThe Mexican GP is at a very bad time."", 'Am I being stupid, but in what time zone is this based?\n\nEdit: am stupid', 'nooo please amsterdam is in my timezone', 'Is there a pre race? Nothing is showing up on my to record list.', 'All the times in that graph are local times. For example Amsterdam is in CET (Central European Time) or UCT +1 or GMT+2 (currently summer time). \n\nFeeling it for Asian countries and people in Oceania (i.e. Australia and New Zealand). F1 times often favors Europeans, except for races like Las Vegas GP (5 am CET).', 'Oh god I am being stupid! I thought it was times for the entire calendar, not just Austin. Yeah ignore me, I’m just a little hungover.']",57,9,0.88,57,52,52,-3,0,-0.010000000000000009,-3
1oaj7qy,"I analyzed Carlos Sainz's ""impossible"" 50-lap Singapore stint using Python & data! Here's the secret to his smooth operation.",https://www.reddit.com/r/formula1/comments/1oaj7qy/i_analyzed_carlos_sainzs_impossible_50lap/,2025-10-19, Technical,"Like many F1 fans, I was amazed by Sainz's 50-lap opening stint in Singapore. Everyone's calling him the Smooth Operator, but I wanted to understand *how* he actually managed it with data.

I dove into the lap times using Python (FastF1 library) to compare his tyre degradation against the rest of the field and even projected what an average driver's stint might have looked like. Turns out, he was neutralizing degradation (\~0.084s/lap loss for others!) in a way almost no one else could.

I wrote up my findings and visualizations in my first Medium post – would love for you to check it out and let me know what you think!

[https://medium.com/@shreyagantayat03/analysis-of-carlos-sainz-really-pulled-off-his-impossible-50-lap-stint-0ed573a7d8d8](https://medium.com/@shreyagantayat03/analysis-of-carlos-sainz-really-pulled-off-his-impossible-50-lap-stint-0ed573a7d8d8)

This was my first F1 data project, so any feedback is super helpful. Are you interested in seeing more analyses like this (e.g., Safety Car impacts, undercut vs. overcut, other Grand Prix analysis, Drama factor analysis)? Let me know your suggestions!","['I\'ve got to commend you for creating something, but I\'m actually annoyed I wasted my time reading that article. ZERO answer is given, I\'ve learned absolutely nothing new about how he was able to go 50 laps, and had to read through lots of waffle to get to the end. You start with ""here\'s the secret"", then go into some pointless Python which is never used to reveal the ""secret"", and then end with a fluff piece ""He wasn’t just managing the tyres; he was operating on a different level, neutralizing the degradation that was impacting the rest of the field"". You also go on to write ""a driver with the unique, data-proven skill to defy the normal laws of tyre wear"". This isn\'t an answer, it\'s PR and marketing.\n\nSo you\'ve started with the question - how was Sainz able to go 50 laps? You then do data analysis of his tyre wear and that of others, and say that using this data we can see his tire wear was less. The issue is: going 50 laps was proof of that itself. Him having better tire wear than others was obvious and self evident - it was they why and how that is interesting, and what I thought this article would answer. Instead, it fails to answer the question it set out for itself, and reads like a fan piece about Sainz with some pointless data analysis thrown in to make it seem more legit.\n\nHarsh feedback I know, but I\'ve gotta be honest.\n\nEdit: I\'ve got an example that might help get my point across better. Imagine there\'s a pizza eating contest and a Mr. Yamamoto eats 50 pizzas in an hour versus the 20 or 30 that his competitors eat. I then say I will use data and Python to reveal his secret of how he was able to eat more. I put together a Python script which shows that Mr. Yamamoto ate more pizza per minute than his competitors. I then conclude that he was better at eating pizza than his competitors. All I\'ve done is proven what was in the question - he ate more. My data is self evident due to the end outcome, and I\'ve given zero reason how he was able to eat more.', '""*It’s about physics, strategy, and a level of precision that can only be uncovered by looking at the data*."" but the article didn\'t really touch on any of this, other than the conclusion that Sainz was somehow neutralising a 0.084s/lap degradation. I was hoping for some suggestion on how this was possible based on the data.', 'Great article, here are a few notes, just my opinion:\n\n\\- Maybe open with a short factual basis? Who, when, what - before going into the social media buzz and whatnot. People forget fast, a bit of grounding helps. Maybe even a link for people who need more context.\n\n\\- Data cleaning: The outlap and inlap will be obvious outliers in this dataset, consider excluding them. Especially when you start calculating averages, it\'s quite bad if you average in inlaps with the normal laps.\n\n\\- Know your audience: I\'d assume most people reading a data breakdown are not there for the methodology, not there to read Python code. I think it\'s fine to link to source code but I wouldn\'t put the Python code in the article.\n\n\\- Balance of the article: To me, for a data focused article, it\'s a bit light on metrics calculated and explained, and a bit heavy on storytelling. ""an average driver was losing 0.084 seconds per lap to tyre wear"" - this is cool, but I don\'t necessarily need three sentences about you deciding to calculate this and I\'d love to hear more about what exactly this means, and what\'s this metric for Sainz specifically in comparison.', 'The article is ChatGPT-written slop.', 'As soon as somebody says ""using Python and data"" you have to know it\'s not worth reading lol', 'Thanks for the insight. Do you not understand Python?', 'That line is so obviously chatgpt', 'Thanks for the insight. Did you not find the plots and the comparison analysis understandable ? Since I’ve tagged this post as technical and I’ve been getting a bit of negative criticism from the people who probably do not understand Python and call it useless in some recent comments , I’m a bit confused as per what to do to generalise it more. I’m a person from a completely technical background , but I want to create content that makes sense to people who aren’t very technical as well. This is my first blog, but I’ll try to generalise it better next time!', 'Totally agree with you here.  Whilst the article is interesting, the author should decide if the article is just a column or a full blown data research paper. This one is neither. \n\nAuthor described plotting lap times in detail (even included python script) but when it came to explaning ""modeling performance of other drivers"", we only got a short sentence with no explanation, and a meaningless number of 0.084s.  Without actually seeing the method and numbers, this approach is basically voodoo math. Calculating this ""powerful benchmark"" is nearly impossible - if it was this simple then no F1 teams would pay millions for their own strategy departments (either way, Ferrari would still get it wrong) \n\n There are tens or even thousands of siginificant factors that are difficult to accurately or even semi-accurately account for. Proclaming that Sainz P18-P10 is solely due to his smooth operation (or magically ignoring the tire wear) is misleading at best, and incorrect at worst.  I agree that Sainz drove a beautiful race. Instead of comparing Sainz to the whole field, it would perhaps be more accurate to compare him to Albon or Lawson as they both started on mediums and drove quite long stints in sort of similar environment. \n\nAgain, i applaud the author for writing this, and my comment is not a negative ""shut down"" in any way or form.', 'That’s such an amazing feedback, thank you so much! I would love to improve on my upcoming posts, meanwhile, since you mentioned you’re data centric, would you like to checkout this project on github? [SingaporeGP’25](https://github.com/gantayat03/SingaporeGP-25)']",0,44,0.48,0,157,157,0,0,-0.010000000000000009,0
