unique_id,post_heading,post_url,publish_time,tag,post_content,top_comments,upvotes,comments,upvote_ratio,score,total_upvotes_comments,total_score_comments,upvotes_growth_rate,comments_growth_rate,upvote_ratio_growth_rate,score_growth_rate
1k2qzq2,"Andrew Benson on BBC Chequered Flag: One of the most intriguing stories around Max is that he could take a sabbatical next year, just see how the rules go, then pick a team almost for 2027. That's an idea that was mentioned to me, without me even asking, by someone quite close to Max.",https://www.reddit.com/r/formula1/comments/1k2qzq2/andrew_benson_on_bbc_chequered_flag_one_of_the/,2025-04-19, News,,"['The year is 2042 an Verstappen sabbatical memes have finally replaced Hakkinen sabbatical memes on reddit', 'Max: i am relaxed and focused on improving the Car\n\nliterally everone else:- yeah he gone', 'The Kimi Raikkonen way.', 'With a child just on the way, I really could see this happen. Endurance calender is also way shorter than F1. ;)', 'Makes sense since hes also becoming a father. Can imagine he wants to spend time with the baby.', 'I mean. IMO this makes the most sense. Max doesn’t strike me as someone who wants to keep going just to break records. He’d much rather do sports cars racing, endurance races. I can totally see him taking a year off, doing other series for a year, and maybe come back in 2027 for a couple of years once he knows what teams are dominant.', ""Transcript from around 23 minutes in:\n\nAndrew Benson: One of the most intriguing stories around Verstappen at the moment is that he could maybe take a sabbatical next year, just see how the rules go, and then pick a team almost for 2027. And that's an idea that was mentioned to me without me even asking by someone quite close to Max Verstappen. So I wouldn't rule that out as an idea either.\n\nI don't know whether they're just playing games, of course, just to sort of stir the pot a bit. But why not? He's talked about wanting to, as Abbi said, Le Mans is the one that he's really interested in."", 'People are theorizing too much and hope one of them sticks and gonna be like ""I KNEW IT"" 😭😭\n\n\n- max to alpine\n- 300 mio contract to aston martin\n- no news about george contract extension cause toto waiting for max\n- retirement\n- sabbatical leave\n\n\nWhat next?\xa0', ""Would it be that surprising if he just calls it a career?  It would be unfortunate for fans, but he hasn't exactly been coy about the fact he doesn't want do this forever.""]",3809,381,0.95,3809,360,360,145,6,0.0,145
1k2c1qu,Lance Stroll spins,https://www.reddit.com/r/formula1/comments/1k2c1qu/lance_stroll_spins/,2025-04-18, Video,,"['Looks like the rears just locked up the moment he even looked at the brake pedal', 'That’s a weird one. Accidentally put too much rear brake bias?', 'Mama mia indeed', 'lucky, he made a mistake in one of the few places on jeddah where you can actually make a mistake', 'Stylish 360', ""Honestly, the slow-mo shot of him drifting backwards through the corner looks dope as fuck if you ignore the fact that he wasn't supposed to be doing that."", ""I know we like to crap on the guy, but that's not on him."", 'He got a call from Mattia', ""Can't seem to blame Lance for this one, totally atypical behaviour from the car there"", 'These comments are downright embarrassing. Who looks at this clip and thinks: ""Wow, what a terrible driver""? If this were anybody else, you\'d all be blaming the car.']",3520,178,0.99,3520,5437,5437,32,1,0.0,32
1k2bqy1,2025 Saudi Arabian Grand Prix - Free Practice 2 Classification.,https://www.reddit.com/r/formula1/comments/1k2bqy1/2025_saudi_arabian_grand_prix_free_practice_2/,2025-04-18, Statistics,,"['Charles out there doing his best', ""Carlos forgot he's in a Williams, love to see him getting the most out of that thing."", ""The nice thing is, if I see Alex or Carlos post a good time, I know theoretically the other ought to be able to match (even if they don't).\n\njust have to remind myself: it's just practice"", 'Unlucky for Gabi, missing the most representative session on a street track.', 'Lewis bro we need to do something', ""I think someone needs to bring Hadjar's dad on to explain the quantum entanglement between Lewis and Alex."", 'Carlos in 5th as we all expected', 'Carlos always gives me hope in the practice, let’s see if this time it translates to a good race', 'Ah yes the two Ferraris side by side']",2485,345,0.99,2485,9804,9804,2,0,0.0,2
1k2xvj3,2025 Saudi Arabian Grand Prix - FP3 Classification,https://www.reddit.com/r/formula1/comments/1k2xvj3/2025_saudi_arabian_grand_prix_fp3_classification/,2025-04-19, Statistics,,"['ANT HAD HAM again', 'https://preview.redd.it/qzbbg8or1tve1.jpeg?width=1290&format=pjpg&auto=webp&s=29727b95800e601e9025fdaa5ed024fa8f77cb13', 'are mclarens doing like actual perfect quali runs with low fuel and such because this is twice in a row of fp3 they are miles ahead of the rest', 'Another McLaren and Russel Podium they just keep rotating spots every gp from now on', '6 tenths. Jesus.', 'Williams is slowly becoming a top team again, I hope the new regulations don’t waste it’s potential', 'And to think, Williams isn’t developing ‘25 any more', ""I think it's very clear this season is going to be a whole lot of: \n\n- McLaren \n\n-----------------------\n\n- George / Max\n\n-----------------------\n\n - Ferrari / Antonelli"", 'Congrats George Russell on yet another podium with zero screen time']",1654,270,0.98,1654,258,258,163,10,-0.010000000000000009,163
1k2q3g6,"Hamilton about the Saudi weekend: ""I'm just seeing if I can get in the top 10 at the moment """,https://www.reddit.com/r/formula1/comments/1k2q3g6/hamilton_about_the_saudi_weekend_im_just_seeing/,2025-04-19, News,,"[""On pure pace in quali, this was never going to be a great one for Lewis. \n\nHe basically has no chance of out qualifying Charles unless Charles makes a big mistake, which tbf is still possible\n\nCharles seems to be very positive about the car this week but i’m also pretty sure he said this on thursday ‘the car might be a bit less predictable going into a corner…but it's something that i like, weirdly’\nSo Charles being happy doesn’t necessarily mean the car will be able to put a lap together when it matters. But Charles is really good around here\n\nTaking into account the fact that Lewis will hopefully improve over the season, I think the only other track with such a big quali pace difference between them will be Baku"", ""By far his worst track under these new regulations which is hardly shocking when it's the one track you need to trust the car the most"", 'How is George the most positive of the three (established) British drivers? Bros just vibing collecting good points driving his car. Ollie having fun too', 'Lewis has never gone well here with the new regs.', 'If you didn’t watch this season and just read the comments you’d think Hamilton was qualifying back of the grid every race', 'Lewis is already winning Depression at Ferrari Championship bc how is he already come to terms with being out in q2', 'Celtics Shaq', 'Bearman finished P7 in his first race at Jeddah in a Ferrari. Hopefully he can at least match that.', 'Lewis depressed, this means either a Q2 exit or front row lol. Nothing in between']",1458,299,0.98,1458,278,278,60,6,0.0,60
1k2kf9y,"Oscar on his rivalry with Lando: I think each rivalry and each teammate pairing has a very different feeling to it. I think, we're still working together very very well and that won't change and we still get on well. We basically played each other at padel for the last 3 days.",https://www.reddit.com/r/formula1/comments/1k2kf9y/oscar_on_his_rivalry_with_lando_i_think_each/,2025-04-19, Video,,"['I think he gave a very good answer to a difficult question.', ""they seem to have a very healthy partnership and taking steps so it won't deteriorate over this season"", 'When people talk about Senna and Prost, it was somewhat iconic because you had two very established drivers going head to head at the same team.\n\nWith 4 and 5 wins respectively Piastri and Norris aren\'t really \'established\', their ascension has occurred together so you don\'t really have that two new team mates butting heads effect.\n\nThey don\'t really strike me as the type either, Norris no doubt will complain on the radio and say he can\'t drive the car or he\'s terrible, Piastri will just probably respond with \'Ok"". I can\'t see much all out warfare.', "">Piastri: (we don't want to) drag the team down with it\n\nAlonso v Hamilton McLaren PTSD intensifies"", '**q:** Oscar, a lot of people see the potential in you and lando being a new iconic drivers pairing. When you hear names like senna/prost, hamilton/rosberg, how special is that and do you see the potential too?\n\n**op81:** ""*It\'s a nice comparison to have definitely I\'ll take it. I think each rivalry and each teammate pairing has a very different feeling to it and i think you know, where we\'re still working together very very well and that won\'t change and we still get on well and we basically played each other at padel for the last 3 days.*\n\n*""So I think it\'s quite a different dynamic certainly to the two rivalries you mentioned, but yeah obviously we\'re both here to try and fight for a world championship so we both wanna beat each other but it think it\'s very important for us that we don\'t want to just try and fight for it this year, we wanna fight for it the whole time that we\'re in McLaren and we\'re both on long contracts together so we wanna make sure that we\'re fighting for this for the foreseeable future, not just this year and kind of drag the team down with it. It\'s trying to secure the success for a very long time.""*', 'basically not every rivalry is webber and seb or lewis and nico', "">We basically played each other in paddle for the last 3 days\n\nYEAH BUT WHO WON? DID THEY BOTH HAVE EQUAL EQUIPMENT?\n\n(/s in case anyone thinks I'm being serious).\n\nI know F1 history is littered with driver pairings who started off getting along and then devolved into all out war once they got a WDC capable car, but Norris and Piastri is the most unusual driver pairing I've seen in a car fighting for the WDC.\n\nPiastri is so calm in and out of the car, and Lando can be really self deprecating while also quick to acknowledge his mistakes when not doing what the team asks (like taking too long to let Piastri overtake him last year in Hungary).\n\nI love seeing fireworks between teammates on the track but less so out of it. I really hope these guys fight tooth and nail all year but still remain friendly once the race is over."", 'Christ. Give it a few seasons to cook first. Silly question.', 'This WDC battle is a song of ice and fire you could say… 👀', 'Let‘s see how well they get along if they are just separated by a few points after 20 races or so.']",1328,82,0.98,1328,2437,2437,27,1,0.0,27
1k2btz6,[F1]Top fastest 3 FP2,https://www.reddit.com/r/formula1/comments/1k2btz6/f1top_fastest_3_fp2/,2025-04-18, Social Media,,"['https://preview.redd.it/15ovglc5bnve1.jpeg?width=800&format=pjpg&auto=webp&s=d19ad477203f77485080a8fb47b48a48ef970c92', 'https://preview.redd.it/fw8hkenoymve1.jpeg?width=1125&format=pjpg&auto=webp&s=8ee6679126a6fba84a2456c7ad5b17336018392b\n\nThey reunite again', 'Welcome back HAM-VER-BOT I guess?', 'I see, we got the 2025 edition of HAM-VER-BOT again...', 'Ahhh the classic NOR PIA VER', 'Well its gonna be between max and charles for final podium it seems', 'Papaya 1-2 with Max or George 3rd. Pretty much feels like the story of this season to be perfectly honest.', ""doesn't have quite the same ring as HAMBOTVER"", 'NORR1S  \nPIA2TRI  \nV3RSTAPP3N', 'NOR PIA VER….the new HAM VER BOT']",916,59,0.97,916,3630,3630,8,0,0.0,8
1k31p2w,Lance Stroll is now the record holder for the most Q1 eliminations,https://www.reddit.com/r/formula1/comments/1k31p2w/lance_stroll_is_now_the_record_holder_for_the/,2025-04-19, Statistics,"Since the qualifying format's introduction in 2006, Lance Stroll has been eliminated in Q1 75 times, one more than the previous record holder, Kevin Magnussen.","['https://preview.redd.it/p0783593vtve1.jpeg?width=303&format=pjpg&auto=webp&s=bc316155baec1996017fa715c0d26ffa6829182e', 'Every time I think Lance Stroll has Lance Strolled his way to peak Lance Strolldom he Lance Strolls on by to a new level.', 'Lance Stroll doesn’t do what Lance Stroll does for Lance Stroll. Lance Stroll does what Lance Stroll does because Lance Stroll *is* Lance Stroll.', ""Now it's time to sit back with a cold drink and wait for what will almost certainly be a very civilised discussion.  \n  \nEdit: 7 minutes since this comment was made, and already one comment has been nuked. My expectations were low but holy fuck."", 'How did they decide the grid order before ‘06?', 'This stat is like a summary of Lance’s career. He’s far from the worst driver in F1, one of the better pay drivers even, but the fact that he’s been able to sustain his career so long with mediocre results overall is what sets him apart from other pay/sponsor drivers.', 'How shit is the AM team, to regress like this every year', 'How many of you have ever been eliminated from Q1 75 times? Didn’t think so, sit down and enjoy greatness.', 'Best pay driver of all time']",1063,85,0.98,1063,80,80,1063,85,0.98,1063
1k2wwof,Tsunoda will do extra Red Bull testing before Miami Grand Prix,https://www.reddit.com/r/formula1/comments/1k2wwof/tsunoda_will_do_extra_red_bull_testing_before/,2025-04-19, News,,"['Allegedly Honda covers the cost of testing days when Yuki is there so they tend to happen, so I’m not surprised. I wonder if another driver will be there too.\xa0', 'its good to see that theyre backing yuki. tbf they dont really have a choice but yukis shown some good pace so far at least', '""see how great our car could be, yuki? now you know what you\'re missing""', ""This is absolutely the right thing to do.\n\nThis also begs the question why they didn't do runs with older cars on actual tracks with Lawson, since Mercedes did it with Antonelli too and he greatly profited from that."", 'Hopefully Horny boy and Uncle Helmut will extend my guy contract by the end of this year.', 'Yuki will have more days of private in-season testing than Lawson had practices sessions LMAO', 'For a company that claims that Yuki is on his own, Honda seem to support him quite a bit', ""They don't really have any choice anymore"", 'I mean he’s been in that supposed three tenths window they want him in thus far. The cars are just so damn close three tenths covers several places.']",766,27,0.98,766,25,25,154,0,0.0,154
1k324gf,Session red flagged as Norris crashes into the wall,https://www.reddit.com/r/formula1/comments/1k324gf/session_red_flagged_as_norris_crashes_into_the/,2025-04-19, Video,,"['Lando has already received 18 missed calls from Seb.', 'That’s not gonna be good for his confidence.', ""Holy shit, that's so massive for the whole weekend.\n\n\nWDC leader pretty much eliminating himself from battle for the win 2nd time in 7 days."", 'https://preview.redd.it/hlo094vhytve1.jpeg?width=1290&format=pjpg&auto=webp&s=d63b4ea22b37808235383c6a141f2fef4ce6446f', ""Worst possible outcome given the scrutiny he's been facing"", ""The radio was pretty gutting, not going to lie. Glad to see he's okay."", 'Mistakes were made', ""I'm sure the comments will be calm and civil."", 'That was sad tbh', 'Norris would be the last person I expected to crash in qualifying.']",1343,321,0.99,1343,302,302,1343,321,0.99,1343
1k2s4pe,Williams thought to be first F1 team to make crucial 2026 step,https://www.reddit.com/r/formula1/comments/1k2s4pe/williams_thought_to_be_first_f1_team_to_make/,2025-04-19, News,,"['Makes sense, I imagine 2025 is already way above their expectations, fighting for 5th.', 'I am perfectly ok with being bored by Alex dominance.', ""Kind of surprised Sauber/Audi wasn't the first.  That car is a tractor."", ""I'm surprised nobody turned off development on day 1 and put everything towards 2026, that's what Aston should have done."", 'unsurprising, james vowles has mentioned a lot previously that most of his engineers are already fully focusing on 2026, hopefully they can cook some shit in 2026', 'Inb4 they pull a 2009 Sauber', 'Crazy to think that 1 year ago Williams had the car barely ready for the start of the season and now they are the first organization to switch their entire aero development team to the 2026 car.', 'The only thing that matters today is correlation between wind tunnel vs CFD sim vs track feedback. If those three match to some degree you don’t need wind tunnell at all.\xa0\n\nSo switching to 2026 car development in wind tunnel does not mean no development on 2025 car', 'Weeyums for the W']",715,53,0.97,715,51,51,36,2,0.0,36
1k2hk7c,Sainz believes ‘little steps’ beginning to add up as he continues Williams adaptation in Jeddah,https://www.reddit.com/r/formula1/comments/1k2hk7c/sainz_believes_little_steps_beginning_to_add_up/,2025-04-18, News,,"[""Seems like he's finding a groove with the car, at least over one lap. Will probably still need more time to find his true pace on Sundays. Either way, there's definitely been improvement over the last 4 races."", ""He's building confidence with the team. Williams has the pace but these adjustments take time. Good to see him finding his rhythm already."", 'Its quite tiring that the media do not seem to acknowledge that drivers need time to adapt. These are insanely complex machines. Its not even about driving them, its about knowing the extremely small adjustments to get into the window, understanding all the functions on the wheel, understand how to prep the tyres into the working window and then using that to actually find the limit of the car.\n\nThis sort of stuff does not happen overnight. While some drivers can drive a bit more outside their comfort window than others, all need time to adapt.\n\nExpecting rookies to be on the level of seasoned drivers, or expecting drivers to be up to speed within 1 race of changing teams is just outright unreasonable. Experience still counts for a lot.', 'Rooting for him. And I believe in him.', 'Sainz is a great driver and I hope he will get a competitive car so we can enjoy his incredible talent', 'It’s amazing how little there was to say about Sainz until his Renault campaign. Just another nepo driver with some good results at Toro Rosso.\n\nAnd then there was the McLaren stint, and then the Ferrari stint, and now Williams… Love to see him developing into a very well-rounded driver with character every year.', 'He’s getting there, Williams is cooking. Williams double podium incoming this year.', 'Goes in line with the time he took to adapt to Ferrari. People tend to forget it took a while too', 'Oh boy I feel this is gonna be a big jinx.']",631,28,0.99,631,727,727,5,0,0.0,5
1k2wozj,[FIA] New PU taken by both Ferrari drivers,https://www.reddit.com/r/formula1/comments/1k2wozj/fia_new_pu_taken_by_both_ferrari_drivers/,2025-04-19, Technical,,"[""Each driver gets 4 PUs for the 24 races. So average 6 races per PU. Saudi is the 5th race. Makes sense to introduce a new one this race as it's a power track"", 'Probably saving those old engines for Monaco', 'This Race ^TM', 'N00b here: is it normal to do this before quali? If they do it after quali it’s a penalty correct?', 'When you swap engines can you refurb/repair them and put them back in the car?', 'PU = poop unit', 'everyone is getting a new engine except mercedes powered car, interesting', ""I don't get how F1 teams manage this, tbh.\n\nIn F1 Manager, I just unwrap all the engines at the start of the season - one on each session - just so that I can throw another one in and get the penalty when one of my drivers has a bad quali and is at the back anyway."", 'Yep, and it doesn’t necessarily mean the engine that came out isn’t okay to use anymore']",579,47,0.99,579,46,46,63,0,0.010000000000000009,63
1k2vopi,2025 F1 Academy Jeddah Race 1 winner,https://www.reddit.com/r/formula1/comments/1k2vopi/2025_f1_academy_jeddah_race_1_winner/,2025-04-19, News,,"[""She drove a great race.\n\nAlso, I'm pleased to see a Welsh sports person actually winning something for once."", ""Doriane's charge is extremely fun to watch\n\nBut the wildcard driver being 90 seconds behind Ella is really something to behold"", 'Tiny McLaren, Ferrari, Red Bull and Mercedes battling each other at the end there', ""McLaren P1\n\nFerrari P2\n\nRed Bull P3\n\nMercedes P4\n\nThat's the 2024 F1 Constructors' standings as well!\n\nAlso, Ella was so chill on the radio, it's something about new McLaren drivers celebrating in the most stoic way possible lol"", 'Lmao, that blur really helps hide her team', 'Ellya:\n\nhttps://preview.redd.it/69bb5u9njsve1.jpeg?width=213&format=pjpg&auto=webp&s=29682b94a834ccee8c4860bed7199235da81795a', ""First time tuning in and I loved it. I'm hooked! So much passing and close racing. We really need to bring back smaller cars for F1. Lloyd did a great job but I was cheering for Pin in the end!"", 'Some people around here really missunderstand the goal of this series.\n\nNone of these will reach f1, the whole goal is to make motorsport more popular for women so that in time the recruitment pool gets larger and the chances to discover a proper f1 level talent are higher\n\nYou cant just push someone to f1, even the worst modern f1 drivers have successfull junior careers, regardless how memed they are', ""Doriane needed one more lap there.\n\nReally liked Maya's race""]",491,68,0.93,491,66,66,23,0,0.0,23
1k2gkxq,Saudi Arabia Qualifying and Race Simulation Pace - formula1.com,https://www.reddit.com/r/formula1/comments/1k2gkxq/saudi_arabia_qualifying_and_race_simulation_pace/,2025-04-18, Statistics,,"['Sauber 7th in Quali pace!?\xa0\n\nAlso wtf is happening to Racing Bulls?\xa0\n\nIn the first few races they looked to me like they were fourth fastest and then they dropped a stinker in Bahrain and this has them in last place in race pace.\xa0', 'No one really got a race simulation laps in FP2 due to the red flag- so can’t really rely on these numbers.', 'I can see the Mclaren 1-2 in Monaco from here', 'Chart 3 gap to ideal lap. Is that saying Norris theoretically has another 0.4 secs to play with?', 'yuki 400/1 for pole, got it', 'Really wonder what Mclaren found to have a car that is better in every category including tire management.', ""Congrats George Russell on another podium. Maybe his transponder will fail and he'll get some TV time again."", ""This data hints that Russell can win if he's around T1 in P1...but he's got to hit a perfect lap in qualifying to get onto the front row. Otherwise McLaren double podium looks likely."", 'Not sure how you can watch Merc and their times today and extrapolate to that but here’s to hoping I guess']",310,86,0.93,310,1140,1140,6,0,0.0,6
1k2yhds,"[RaceFans] For the second day in a row a driver has received a formal warning for crossing the painted area before the pit entrance, in violation of the race director's instructions, followed by a reprimand for doing the same on a later lap. Today it's Jack Doohan, yesterday it was Liam Lawson.",https://www.reddit.com/r/formula1/comments/1k2yhds/racefans_for_the_second_day_in_a_row_a_driver_has/,2025-04-19, Social Media,,"['Meanwhile Hadjar was getting waterboarded', 'Has someone told Doohan and Lawson that they are to fight for championship points and not penalty points?', 'Three demerits, and you’ll receive a citation. Five citations, and you’re looking at a violation. Four of those, and you’ll receive a verbal warning. Keep it up, and you’re looking at a written warning. Two of those, that will land you in a world of hurt, in the form of a disciplinary review, written up by me, and placed on the desk of my immediate superior.', ""At this point Jack is gonna get replaced by one of the reserves not by Alpine's choice but because he'll gather enough penalty points for a race ban"", ""Didn't see Lawson 1 but saw the Doohan 1s, and I actually don't get it, 2 wheels across the line everywhere else and that's legal but here it's not, can't see how it's even to do with safety either as pit in has a majorly wide area and the braking into pits doesn't start until ur way round the corner?"", 'oook.', 'must be the water.', ""Liam's response would be that points are points man."", ""Ah so that's what he's here for instead of making friends"", ""I don't get it either. Breaking the rule is so inconsequential yet they take it as a punishable offence. Makes no sense to me""]",292,10,0.99,292,10,10,68,0,0.0,68
1k2y54l,[LightsOutBlog] Top 10 Best Sector Times and Ideal laps from 2025 Saudi Arabian GP FP3,https://www.reddit.com/r/formula1/comments/1k2y54l/lightsoutblog_top_10_best_sector_times_and_ideal/,2025-04-19, Statistics,,"['There is something really satisfying about Max being 4th fastest in all sectors to end up with the 4th fastest time', 'Jesus throw whatever track at that McLaren, they are fast', 'McLaren 1-2 every sector, talk about total domination', ""Well I'll take 6&7 as a decent result.\n\n(but it's just practice)"", '7 tenths faster than third is just outrageous', ""Something visually pleasing about Alex and Carlos' converging times"", 'tsunoda extra slow in s3', 'Bearman was very fast in S2, faster than the two Ferraris, hopefully he can find the magic in S1 S3 during quali.', 'Besides the usual teams, the williams and alpine look quick this week']",218,65,0.97,218,59,59,30,2,0.0,30
