unique_id,post_heading,post_url,publish_time,tag,post_content,top_comments,upvotes,comments,upvote_ratio,score,total_upvotes_comments,total_score_comments,upvotes_growth_rate,comments_growth_rate,upvote_ratio_growth_rate,score_growth_rate
1ijykfj,Returns to Netflix on 7 March 2025,https://www.reddit.com/r/formula1/comments/1ijykfj/returns_to_netflix_on_7_march_2025/,2025-02-07, News,,"['*wheelgun noises*', 'I wish Netflix would release it in February when everyone is bored so I don’t have to binge watch it before the season starts. Once the season starts I have no interest in the show.', 'In Mexico, the poster has Checo looking at a Sauber and a Racing Bull.', 'this poster is hard af lol', 'Sainz and Piastri? What the hell, sure!', ""I don't get the point of releasing it just when the next season has begun. Like give it in the winter break when we don't have any F1 action. Kills the interest for me."", 'Sorry to say that I’ve been mentally preparing for the Danny Ric retirement episode. Sad time ahead i think', 'Normally I don’t really care, but for some reason I’m really excited for this DtS season', 'This season is going to be magical.\n\nRed Bull sexting scandal. Newey leaves.\nMax domination and struggles.\nDanny being pushed out.\nDTS without Danny and Gunther.\nLewis 2x wins. Home turf wins.\nLewis departure.\nLando wins. Lando struggles.\nOscar wins. First win is miserable.\nGeorge wins.\nMax goes Ultra Instinct in Brazil and does a historic drive.\n\nReally excited for this.\n\nEdit: CHARLES WINS MONACO. CHARLES WINS MONZA. FORZA FERRARI. (somehow it got lost in the list of crazy facts)']",8185,559,0.95,8185,15182,15182,157,5,0.0,157
1ijtvau,[Max Verstappen via Instagram] Back at work,https://www.reddit.com/r/formula1/comments/1ijtvau/max_verstappen_via_instagram_back_at_work/,2025-02-07, Social Media,,"['wait is he allowed to wear anything other than rb gear?', 'the internet: ""omg, white red bull livery confirmed!""', 'It seems so weird seeing him in anything but the red bull shirt 😭', 'I am pretty sure there are no imagine of Max without a RB in his hands.', 'Did he get that on loan from one the of the 1996 Liverpool squad?', ""Could be a good look but apparently the people who grabbed this outfit don't know what size he is."", 'Looks like he has finally saved up enough to buy a second suit. His total is now 4 outfits, and one pair of sport shorts for padel.', 'Bad fit poor guy', 'Need to get that dieworkwear guy from twitter to comment on this lol', 'If only it fit better.  😫']",2366,104,0.94,2366,2873,2873,33,0,0.0,33
1ijqcil,"I'm not the ""really angry guy"" I sound like on the radio - Hadjar",https://www.reddit.com/r/formula1/comments/1ijqcil/im_not_the_really_angry_guy_i_sound_like_on_the/,2025-02-07, News,,"['Yuki is also very sweet outside the car.', 'That picture makes me feel like they wanted to tag on ""I\'M WORSE"" to the end of that headline, lmao. Don\'t do Hadjar like that, Racefans!!', ""big question - I haven't heard Hadjar on the radio.  Is he up there with Yuki?  Does he blow Yuki away with the outrage?  Or is Yuki still the King of the Radio?"", 'Could they not pick a better picture of the frenchman', 'The guy is talented. But I can’t wait to hear his interview after being strolled for the first time.', '>I\'m not the ""really angry guy""\n\nYeah, and Yuki Tsunoda is taller than George Russell', 'Isack Hadjar is definitely a calm and reasonable person.', 'Oh I hope you are.  That would be far more entertaining.', ""Personally as long as he's not attacking anyone or aiming anger towards anyone like Gasly does then it's all good, emotions get high and some people are better by letting it all out to calm down. \n\nDoesn't make them angry. I'm sure anyone thats done any amount of sim racing understands the frustration racing can bring.""]",1101,94,0.96,1101,3187,3187,11,1,0.0,11
1ijym0s,[lnfour via instagram] Lando’s 2025 Helmet,https://www.reddit.com/r/formula1/comments/1ijym0s/lnfour_via_instagram_landos_2025_helmet/,2025-02-07, News,,"[""It's very much the same one. Just the blobs are done differently.\n\nIf it ain't broke (and to be fair, he won 3 of his 4 race wins with the base helmet), don't fix it I guess."", ""Why does it look like it's been placed on a coffin?"", 'They took this picture at the ministry of magic', 'I really love this style. I’m glad he brought back!', 'It’s a beautiful helmet imo so I’m glad he’s keeping it.', ""If it ain't broke"", 'I like it. \n\nCan’t wait to see what the McLaren lads can achieve this year. \n\nOne of my favourite driver pairs', 'The blobs look better', '![gif](giphy|C6JQPEUsZUyVq|downsized)']",842,65,0.93,842,1225,1225,10,0,0.0,10
1ik4u7q,Tyrrell 6 wheeler on display at the NZ GP.,https://www.reddit.com/r/formula1/comments/1ik4u7q/tyrrell_6_wheeler_on_display_at_the_nz_gp/,2025-02-07, Throwback,,"[""The first time I saw the 6 wheel Tyrrell, I thought it was a joke \n\nNow it's one of my favorite car designs, it's so weird, I love it"", ""I honestly wish F1 would open up its regulations a bit more to allow for weird innovations such as these. Especially now that we have a budget cap, I don't really see why F1 can't move away from the highly prescriptive design philosophy. Keep the power unit regulations (as to not disadvantage the customer teams) and safety requirements (for obvious reasons) and let the teams go wild with the rest."", '1: have to less grip \n2: add more wheels for more grip\n3: ???\n4: profit', 'Fellow NZ resident!\n\n![gif](giphy|l0K4dELlG3hXA38m4|downsized)', 'Less frontal area, less drag.', 'Can anyone explain the advantage of having six wheels?', 'somebody tried to make a vacuum cleaner out of a lego car set\n\nI', 'Kids will think its AI', 'I know you need regs for safety etc, but what about having a series where the only limit is top speed, they could change this depending on the course and otherwise let the teams run wild with downforce power etc.']",684,27,0.99,684,24,24,39,1,0.0,39
1ijrlew,Haas to give Ocon and Bearman “rules of engagement” before 2025 F1 season,https://www.reddit.com/r/formula1/comments/1ijrlew/haas_to_give_ocon_and_bearman_rules_of_engagement/,2025-02-07, News,,"[""Rule 1, don't.\n\nRule 2, don't crash the car. \n\nRule 3, don't crash the car into each other."", 'I know this article is only released because of Ocon but still, every single team and driver have “rules of engagement” like this follow - where are the articles for them?', 'Papaya rules Haas edition', ""Don't foksmash"", 'Dusting off Guenther\'s ""Not Fuck Smash Door"" page of rule.', 'Oh look another post that dumps specifically on Ocon 👀', ""which team doesn't do this? such a transparent hate bait"", '""and Bearman"" doing the heavy lifting in this sentence.', ""That's some asbestos free cereal news. (As in advertising your cereal does not contain asbestos does not mean everybody else does)""]",561,109,0.96,561,2051,2051,4,2,0.0,4
1ik1mlj,Juan Pablo Montoya runs across the track to get into his spare car at the 2004 US GP,https://www.reddit.com/r/formula1/comments/1ik1mlj/juan_pablo_montoya_runs_across_the_track_to_get/,2025-02-07, Video,Totally not sharing this historical clip for certain  reasons ,"['It then only took the stewards 56 laps to disqualify Montoya for changing cars too late on the grid.', 'MONTOYA POR FAVOR', 'I miss Montoya. But I think in modern social media he would be roasted to death.', ""Jesus. Back then, drivers had a spare car waiting in the wings. Nowadays, there's only one for each driver."", 'On hearing about the, now infamous, meme, my mind went straight to Juan Pablo, and this very incident.\n\nMONTOYA POR FAVOR! SERAS DESCALIFICADO!', 'I was at this race, my first real experience with F1.\n\nOn Friday morning my brother and I were sitting at the end of pit lane, a couple rows off the bottom of the grandstand.  Schumi rolled down the pits and did a practice start right in front of us.  The world shook… I was instantly hooked.', 'I can’t believe the F1 twitter posted this clip this morning', 'Hide yo jet driers', 'What a bizarre sequence 😆😆', ' Montoya please!!!']",134,36,0.92,134,307,307,10,0,0.0,10
1ik2b36,A New F1 Season Begins | SF-25 Fire Up,https://www.reddit.com/r/formula1/comments/1ik2b36/a_new_f1_season_begins_sf25_fire_up/,2025-02-07, Video,,"['Please be fast (and reliable), please be fast (and reliable), please be fast (and reliable)', 'Well, I guess it was time to change my pants today, after all.', 'That sounds more evil than in seasons past, or am I hearing wrong.', 'Guys, does that mean Hamilton 2025 WDC?', 'Music to my ears!', 'This sound could seriously be from the fans of the wind tunnel alone...\n\nF1 engines have gotten inmensely boring.', ""*Monkeys paw finger curls* it's fast and reliable\n\nBut lewis and leclerc develop a fierce rivalry and take each other out of multiple races."", 'Ends with a mclaren driver 1 point ahead of them whilst lewis and Charles tie for points', 'Reverse 2007', ""Hope everyone's tuned in for Hungary 2025""]",122,11,0.91,122,116,116,5,0,0.0,5
1ik146t,How F1 Exploded - Wendover Productions,https://www.reddit.com/r/formula1/comments/1ik146t/how_f1_exploded_wendover_productions/,2025-02-07, Video,,"['Ben or his writers must be F1 fans. This is what his 4th video on F1? He did ""The Logistics of F1"", ""How Live TV Works"" (which FOM made them take down because it used some of their footage), his other channel Half as Interesting recently covered Crashgate, and now this one.', ""Very interesting video.  I'm 50 and I watched F1 when I was a kid but then didn't care much for 30 years. There marketing team really did a bang on job. The Netflix show is what drew me back to the sport and I can't get enough of F1 now - I'm doing my third season of the F1 video game despite my hate for EA. I also happily paid $100 for the streaming app subscription."", 'Hey my favorite YouTube channel covering my favorite sport, what is this, my Birthday?', 'Curious if now MotoGp owned by liberty media can get the same success', 'Wendover is always SO great.', 'I got into f1 because race highlights popped up on my youtube recommended. decided to watch the next race live, which was baku 2018, and was hooked', 'I tuned in expecting it to be about mid race refuelling...', 'Good explanation why F1 is dying.', ""Sam, and yes he's a big F1 fan.""]",113,25,0.85,113,71,71,9,0,0.0,9
1ikgg0z,Arvid Lindblad is your 2025 Formula Regional Oceania Champion with 2 races to spare (tgr_nz instagram),https://www.reddit.com/r/formula1/comments/1ikgg0z/arvid_lindblad_is_your_2025_formula_regional/,2025-02-08, Social Media,"Job done, Dr Marko","['He well and truly did the job Helmut Marko sent him to do. Champion with 2 races to spare. Super license points acquired. If he wins the NZ Grand Prix tomorrow, he will be the first driver ever to win all 5 feature races in a season. Not even Lawson, Stroll or Norris achieved that in their title winning seasons', '![gif](giphy|J01jn4NYzMAT7BVCMP|downsized)', 'Super Licence secured. Wouldn’t be surprised to see him in a F1 car at some point this year\xa0', 'so does not that mean he can get enough points to have a super license?', 'Nervous for yuki now. Are there any contracts expiring this year?', ""Have to hand it to RedBull, they continue to find young talent and bring them into the sport at a fairly decent rate.\n\nWouldn't surprise me if Lindblad is at RB in the next few years."", ""Oh, it's so on. The RB driver machine is well and fully oiled."", 'Lawson, Stroll and Norris were all competing against substantially tougher competition.\n\nThat said, Lindblad did an impressive job in this series, looking forward to see what he does in F2.', 'Not even stroll!?!?', 'My guess is FP1s for Red Bull/RB and then replace Tsunoda next year']",106,27,0.95,106,27,27,72,16,-0.020000000000000018,72
1ik5k3j,A look into the Internal software the FIA uses for it's Circuit Safety Analysis System including comparing the CSAS with real world crash examples of Leclerc at Monza 2020 and Max's crash at Silverstone 2021,https://www.reddit.com/r/formula1/comments/1ik5k3j/a_look_into_the_internal_software_the_fia_uses/,2025-02-07, Video,,"['Sadly I had to clip out Leclerc footage as FOM said no but it let the Max footage stay while muted.\n\nThis is a smallish clip from a larger Circuit Safety Seminar on Circuit Homologation.     \nIf that interests you, [you can see the full video here,](https://www.youtube.com/watch?v=jcrqZZqpKzI) where it additionally goes over:      \n\n* Circuit Licence Grades & Circuit Homologation Process       \n* Circuit Guidelines - Latest Updates         \n* Circuit Equipment Homologation Process']",60,2,0.92,60,1,1,-1,0,0.0,-1
1ijukvv,2025 Driver/Race Engineer pairings?,https://www.reddit.com/r/formula1/comments/1ijukvv/2025_driverrace_engineer_pairings/,2025-02-07, Discussion,"Do we have a confirmed list of Driver/Race Engineer pairings for 2025? This is what I could gather so far, but I don't think everyone's been confirmed. In some of them (mainly AM and VCARB) I assume that there's no switch, but it hasn't been confirmed whether there's a switch or not. Sauber I can't find a thing on. I'll update the table if there are any confirmations I missed.

(And don't overthink the 1/2 designations, lol)

|Team|Race Engineer 1 (Driver)|Race Engineer 2 (Driver)|
|:-|:-|:-|
|McLaren|Tom Stallard (Oscar Piastri)|William Joseph (Lando Norris)|
|Ferrari|Brian Bozzi (Charles Leclerc)|Ricky Adami (Lewis Hamilton)|
|Red Bull|GP (Max Verstappen)|Richard Wood (Liam Lawson)|
|Mercedes|Bono (Kimi Antonelli)|Marcus Dudley (George Russell)|
|Aston Martin|Gary Gannon? (Lance Stroll)|Chris Cronin? (Fernando Alonso)|
|Alpine|Josh Peckett? (Jack Doohan)|John Howard (Pierre Gasly)|
|Haas|Laura Mueller (Esteban Ocon)|Ronan O'Hare (Oliver Bearman)|
|VCARB|Pierre Hamelin? (Isack Hadjar)|Ernesto Desiderio? (Yuki Tsunoda)|
|Williams|James Urwin (Alex Albon)|Gaetan Jego (Carlos Sainz)|
|Sauber|??? (Nico Hulkenberg)|??? (Gabriel Bortoleto)|","['Pierre and Isack? Prepare for French on French violence on the VCARB radio', 'Jego had been working with Sainz during all his testing so I think you can consider that confirmed', 'I thought Bono got a promotion and wasn’t gonna be working as a race engineer anymore? Idk though could definitely be wrong', 'One that I think may shift is Alpine. Peckett is better than Howard from what we see, and Gasly has experienced issues with communication with Howard. If I’m him I’m bagsying Peckett now he’s free.\n\nSimilarly with Tsunoda, though he might lack the sway needed to pull Hamelin over to his side of the garage.', 'For some reason I could have sworn Tom Stallard was leaving this year, did I just make that up??', 'Great job!', 'Gary Gannon moving to Aston Martin?? when did that happen?', 'A woman race engineer, this has to be the first time right? Interesting. And Gary Gannon is in Aston now? I wonder how his ASMR will work with Lance?', ""Playing the Manager games, Pierre became my favorite race engineer\n\nI pray for him, it's pick your poison when it comes to Isack or Yuki 😜""]",31,17,0.78,31,85,85,5,1,0.040000000000000036,5
1ik4ahk,How F1 Exploded,https://www.reddit.com/r/formula1/comments/1ik4ahk/how_f1_exploded/,2025-02-07, Video,,"[""I'm glad Sam started doing F1 video because he such a big fan of F1 and his video are always top tier."", ""I get all of that but F1 exploded as they had what any sport needs a GOAT, and a young upstart meant to supplant the legend coupled with an investment into social media but again while it's all well and good it doesn't mean anything without those 2 coming about at a perfect intersection. Just imagine DTS if you take out Max or Lewis lmao\n\nWhile all the media issues and F1's evolving are true, there still isn't an explosion without Lewis being the champ and Max gunning for him, especially how Max drives the articles. \n\nI think this is more about the boneheaded way F1 dealt business in the past"", 'This video gets so much wrong about the sport it is as if he knows nothing about the sport.', 'Its boring video, I ended in the middle…', 'Idk who this Sam is, but sounds he has his own semi-educational semi-satirical YouTube channel and his own travel based reality competiton, both running on a streaming platform co-owned by him', 'Actually, the common denominator is just having competitive seasons where multiple drivers are competing for the championship.  Ideally, you want to keep the viewers guessing who will win each race and take it to the very last race of the season.  And ideally, as many drivers as possible is vying for it -- not just two drivers.  THAT is what will make F1 successful.', ""The only way F1 goes down In the near future Is If 2026 regulations are complete disaster. I really can't see how F1 can fall off right now In popularity, It's like they have the golden formula for growth"", ""Lewis doesn't interact with DTS, and Max barely does himself. The point doesn't stand."", ""I don't know If his conclusions are right and his worries justified but the facts he Is basing his opinions upon sound mostly right. \n\nMaybe you could do some nitpicking but I didn't hear something tragically off, he seemed to me that he knows and watches F1 and didn't just read a few articles, maybe It's just me"", 'Care to elaborate on what it gets wrong?']",23,12,0.64,23,11,11,4,1,0.020000000000000018,4
1ike0c4,Who gave best returns if you had bet 24$ on any of 7 winning drivers in 2024?,https://www.reddit.com/r/formula1/comments/1ike0c4/who_gave_best_returns_if_you_had_bet_24_on_any_of/,2025-02-08, Statistics,"Max           22.03
Lando	     11.3	
Charcles   34.5	
Oscar        19
Carlos	     42
Lewis 	     34	
George      45

Who would you bet on this year?

Odds as taken from F1 articles.
If you bet $1 each for each race on Max you got back $22.03 overall for the season.
Pls don't gamble.","[""I don't understand betting, so please explain: If you bet 24 dollars on Max, you win 22? Or it was so expected for him to win that you end up losing 2?"", ""What's with today & betting in F1.."", 'Carlos has lower returns than George??\n\nEdit: wrong term', 'Interesting post. Do you know at what moment of the weekend this bet was done? Before quali I assume', 'Never doubted my boy GR', 'It would be a “bad” bet cause you don’t even get to double your money imo', ""The numbers in the columns are the return on $1 from each race. In the first half of the season it was basically expected that Max was going to win, so the odds were correspondingly short - for Bahrain, for example, you got a return of $1.35 for each dollar bet.\n\n\nMax didn't win every race, so on any race you bet the dollar on him that he didn't win, you lost a dollar. If you bet one dollar on Max every race, you ended up with a return of $22 for a total loss of $2.\n\n\nLike most sports, when there's an overwhelming favourite, it's generally not worth betting on them unless you're doing some matched bet shenanigans. I don't bet on F1 so I have no idea what other markets are available."", 'No you would win 46 dollars, make a profit of 22', '$26 for geoge in las vegas is crazy. wasnt he the hot favourite for that?']",20,14,0.71,20,13,13,2,1,-0.020000000000000018,2
1ik04we,Opinions on the two Nigel Mansell autobiographies?,https://www.reddit.com/r/formula1/comments/1ik04we/opinions_on_the_two_nigel_mansell_autobiographies/,2025-02-07, Throwback,Read the 90’s one years ago and I see there’s now that one available but also a much newer one on the kindle store called ‘Staying on track’ - which would be the one to go for? Thanks,[],16,2,0.86,16,0,0,3,0,0.06999999999999995,3
1ikhihp,Ask r/Formula1 Anything - Daily Discussion Thread,https://www.reddit.com/r/formula1/comments/1ikhihp/ask_rformula1_anything_daily_discussion_thread/,2025-02-08,,"# Welcome to the [r/formula1](https://www.reddit.com/r/formula1/) Daily Discussion / Q&A thread.

This thread is a hub for general discussion and questions about Formula 1, that don't need threads of their own.

Are you new to Formula 1? This is the place for you. Ever wondered why it's called a lollipop man? Why the cars don't refuel during pitstops? Or when Mika will be back from his sabbatical? Ask any question you might have here, and the community will answer.

Also make sure you check out our [guide for new fans](https://www.reddit.com/r/formula1/wiki/newtof1), and our [FAQ for new fans](https://www.reddit.com/r/formula1/wiki/faq).

Are you a veteran fan, longing for the days of lollipop men, refueling during pitstops, and Mika Häkkinen? This is the place to introduce new fans to your passion and knowledge of the sport.

Remember to keep it civil and welcoming! Gatekeeping within the Daily Discussion will subject users to disciplinary action.

Have a meta question about the subreddit? Please [direct these to the moderators](https://www.reddit.com/message/compose/?to=/r/formula1) instead.",[],0,0,0.5,0,0,0,0,0,0.5,0
1ikdc98,Over Under on Teammates Head to Results in 2025,https://www.reddit.com/r/formula1/comments/1ikdc98/over_under_on_teammates_head_to_results_in_2025/,2025-02-08, Discussion,"What is your predictions on the following over/under numbers?

Qualifying

Nico over Gabriel  24.5


Carlos over Alexander 15.0


Esteban over Oliver 20.5


Yuki over Isack 16


Pierre over Jack 16.5


Fernando over Lance 17


George over Andrea 23.5


Max over Liam 24.5


Charles over Lewis 13.5


Lando over Oscar 15.5



Race Finish

Carlos over Alexander 13.5


Esteban over Oliver 19


Yuki over Isack 16.5


Pierre over Jack 18.5


Fernando over Lance 15.5


George over Andrea 24


Max over Liam 23


Charles over Lewis 14.5


Lando over Oscar 16.5
","[""As someone who doesn't bet, I have no idea what these numbers mean.\n\nAlso, suggestion, format them with one pairing per line, it's really hard to read in this format."", ""These must be percentages, not race points. I don't know how they work, but I think Max will be about double Liam. I think all of the rookies will lose to their veterans, because rookies almost always do. I think Carlos will be more over Alex than 13% if that's how those numbers work. I think Fernando will be way way more than 15% over Lance.\n\nDo these numbers come from a betting app, or did you make them up?\n\nIf I understand correctly, I'm going to take the overs on all of them. I think the gaps will be wider than those percentages. I could pick a couple to be the unders, but eh, I don't want to."", 'I think people are really underestimating albon while I do think carlos would win the h2h given how well he has done against some pretty strong teammates i think alex is going to surprise quite a few ppl with his performance against carlos.', 'What the hell are these numbers OP', 'In my original post, it showed up as being on individual lines.   I will try to edit.', 'I would say under for Hulk and Bortoleto, Hulk has been a bit overrated lately and Bortoleto in an unknown. Under for Russell because Kimi is a massive talent that could surprise and Russell always lacked race pace. He beat comfortably Hamilton but I think Hamilton had pretty awful 2024', 'It would help if there was an explanation on what the numbers mean.', ""Looks good now. I'm still not sure I understand the over/under, is that projected better quali finish by the over? If so, I don't understand how Max could be 24.5 over if there are only 24 races. Wouldn't it be 23.5 over (otherwise the over is impossible)? Same with Nico over Gabriel."", 'This is quite strange yes, it seems everyone is confused at OP lol']",0,13,0.41,0,11,11,0,3,-0.06,0
