unique_id,post_heading,post_url,publish_time,tag,post_content,top_comments,upvotes,comments,upvote_ratio,score,total_upvotes_comments,total_score_comments,upvotes_growth_rate,comments_growth_rate,upvote_ratio_growth_rate,score_growth_rate
1jgzjnz,Lewis Hamilton wins the Sprint of the 2025 Chinese Grand Prix,https://www.reddit.com/r/formula1/comments/1jgzjnz/lewis_hamilton_wins_the_sprint_of_the_2025/,2025-03-22, Sprint,,"['>PIA          +6.825\n\nhttps://preview.redd.it/l04m35lrv5qe1.jpeg?width=640&format=pjpg&auto=webp&s=424547e1e059513d56af106835bb1b11244478b8', 'Oscar fighting in a Ham Ver podium, my boys all grown up.', 'Yuki held off Antonelli for all 19 laps. Spectacular.', 'What pressing the K1 button does to a MF', 'Dont do that, dont give me hope', 'https://preview.redd.it/3k5b15glv5qe1.jpeg?width=1179&format=pjpg&auto=webp&s=4c281f752df879b7e76cab1eaea593ca26f7eca2', 'Imagine telling someone in 2021 when sprints started that Lewis Hamilton would deliver Ferrari their first sprint win. There would be a bit of confusion', 'Grazie to all the ragazzi at the factory.', 'THIS IS WHAT MY DREAMS LOOK LIKE\n\nhttps://preview.redd.it/7dzwg6azv5qe1.jpeg?width=415&format=pjpg&auto=webp&s=65907db370c881c659ccde53b661bd455b9ccfad', 'FORZAAAAA!!! HAMMER TIME!!!!!']",27925,1292,0.95,27925,500,500,890,11,0.0,890
1jh3jil,Oscar Piastri takes pole position for the 2025 Chinese Grand Prix,https://www.reddit.com/r/formula1/comments/1jh3jil/oscar_piastri_takes_pole_position_for_the_2025/,2025-03-22, Qualifying,,"['https://preview.redd.it/w0iafiidb7qe1.jpeg?width=1024&format=pjpg&auto=webp&s=621da1b350950a47994ca935361adbe1d7dc177a', 'Oscaaaar\n\nFirst pole for him. So happy for him', '**Horner:** Yuki, so we’ve decided to move you up to Red Bull Racing.\n\n**Yuki:** Yeah?\n\n**Horner:** Yeah. You’ve been driving phenomenally, and we think you’re ready.\n\n**Yuki:** What about Lawson?\n\n**Horner:** He will be your teammate.\n\n**Yuki:** Max?\n\n**Horner:** Max will be moving to Racing Bulls. It’s a complicated situation, but this is the best move for everyone.', '""The hairpin of my life"" 😭😭😭', ""Red Bull can't even move Lawson to RB it'll be a promotion"", 'Classic George Russell move of not being shown on broadcast and then sneaking a podium.', 'Impressive from Hadjar, bro has speed', 'Fucking finally', 'Yellow sector 1 and 2\nPurple sector 3 and improves time\n\n\n\n\nThat on board lap is going to be incredible to watch', 'P1ASTR1 WTFF\n\nHis 1/16th Chinese ancestry giving him the Shanghai buff 💪']",9546,603,0.97,9546,442,442,892,33,0.0,892
1jgoeu6,[@f1] That was CLOSE! Let's compare the Sprint qualifying laps of Lewis Hamilton and Max Verstappen in Shanghai... but from above,https://www.reddit.com/r/formula1/comments/1jgoeu6/f1_that_was_close_lets_compare_the_sprint/,2025-03-21, Video,"Source with sound: https://www.instagram.com/reel/DHeMjKdMxQR/

People on the desktop, right click on the video and click ""show all controls""

Yes, the video is sped up because of imgur's over 1 minute restriction. ","['It’s amazing we live in a world where these sorts of graphics are possible.', 'How did they not touch? Good, clean driving from both', 'This rivalry been through it all. Sometimes Lewis is ahead, sometimes max is ahead, sometimes they’re side by side, sometimes they are on top of each other and now they’re inside each other.', 'I would love to hear Hamilton or Verstappen as they watch this', 'These dudes are amazing!', 'Please revive this rivalry. It was peak drama', ""I don't understand how max was slower when lewis was giving him a tow down the straight?\n\nI'm kidding I'm kidding"", 'official f1 is only catching up to these huh, these have been popular on other social medias for a while now', 'God I miss 2021', 'Did Lewis break that hard after crossing the line ?']",7471,320,0.99,7471,11515,11515,28,0,0.0,28
1jggx4b,Fun Fact: Both of these poles are with team boss Fred Vasseur,https://www.reddit.com/r/formula1/comments/1jggx4b/fun_fact_both_of_these_poles_are_with_team_boss/,2025-03-21, Social Media,,"['🙏\n\nhttps://preview.redd.it/nnzn92pqs1qe1.jpeg?width=1000&format=pjpg&auto=webp&s=883c09dd0c9b8f56bbbb40c207fc167bd80eb59e', 'Lewis in the second pic is getting pretty close in age to Anthony in the first pic.', ""I can't decide which is more cursed:\n\nRenault-Hamilton or Marlboro-Hamilton"", ""Anthony Hamilton doesn't age it seems like"", 'Almost 20 years jesus', 'Dude... Hamilton Sr. Sleeps in a freezer, is a vampire, or something like that!', 'Does Anthony age?', 'Was Anthony a teen when he had Lewis cuz that man barely looks like he could be a dad of a 25 year old, much less it being a man turning 40 this year? Lewis looks like his little brother.', 'Why these 2 random races', ""What's truly #Blessed is how these two barely aged over 20 years""]",6426,79,0.98,6426,3646,3646,13,0,0.0,13
1jh34il,Liam Lawson's last three qualifying results.,https://www.reddit.com/r/formula1/comments/1jh34il/liam_lawsons_last_three_qualifying_results/,2025-03-22, Statistics,,"['![gif](giphy|28Nev3k184A9PdSDCg)\n\nHorner trying to promote Tsunoda and Hadjar', 'He had better results in vcarb lol', ""He's consistent at least"", 'I REFUSE to believe that Gasly, Albon, Perez and Lawson are THIS bad. There is something seriously wrong going on.\n\nOr Max is simply an alien who has superpowers.', ""Even though Perez was poor last year, I don't think even he had a set of consecutive qualifying sessions *this* bad. Certainly not bringing-up-the-rear-for-two-qualifying-sessions-in-a-row bad."", 'Imagine where Red Bull would be if Max left ... Possibly a car like Alpine or something ...', 'Worst qualy performances from each recent RB driver:\n\nGasly - P17 (Australia, error with the weigh bridge)\n\nAlbon - P19 (Sochi 19, crashed)\n\nPerez - P20 (Monaco 23, crashed)\n\nLawson’s doing this with zero caveats.', 'Congrats to Liam on consecutive South Pole positions 😍🇦🇶', 'In theory… give max rhe varcb and he will do miracles']",5960,812,0.99,5960,471,471,623,73,0.0,623
1jgzlv1,[VCARB via Instagram] POINTS BABYYY!,https://www.reddit.com/r/formula1/comments/1jgzlv1/vcarb_via_instagram_points_babyyy/,2025-03-22, Social Media,,"['YOINTS! Hadjar had a great go at it as well, solid all around', 'Yuki can score points when vcarb are unable to make strategy calls.', 'Yuki is doing everything right to get himself a drive next year. He has to be on the Cadillac short list, could easily be other seats that open up too.', 'great defense. no pit stops to screw him over baby.', 'What a race, what a defense. You could see from the timings that Kimi got within 0.1-0.2 in drs a few times, but then Yuki kept opening the gap back to 0.8-1.0 after some great exits from some corners. Amazing drive', 'Yuki was fighting for his damn life there lol', 'Tsunoda finished 3 positions behind Max today. Lawson behind a VCARB.', ""I love that Yuki can get decent results when strategy doesn't have many opportunities to make his life harder."", 'tsunoda did really fucking great fending off kimi  \namazing', ""Hell yeah, Yuki! Being snubbed by Red Bull was a blessing. The attention from it has turned him into one of the most popular drivers on the grid, and he's able to drive hard without having to worry about the cursed second Red Bull seat. I hope Cadillac is watching because Yuki is showing that he's the type of experienced driver a new team would greatly benefit from having.""]",4406,185,0.99,4406,173,173,113,0,0.0,113
1jgj85x,"[max verstappen with sky sports] I don't even think we should have been on the front row, so I'm very happy to be second.",https://www.reddit.com/r/formula1/comments/1jgj85x/max_verstappen_with_sky_sports_i_dont_even_think/,2025-03-21, Social Media,https://www.instagram.com/p/DHdzPpahmdz/?igsh=ZThocDRyMXUyd3Bq,"['This will be a reoccurring theme this season', 'I still do not understand how he got it. The onboard looks terrible, fighting the car the whole time. I thought maybe RB is faster on the straights, but the ghost car video on the F1 you tube channel shows Ferrari slightly faster on straights too.\n\nMax is a magical sometimes', 'Spicy Lewis vs Max opening lap battle incoming?', 'RBR: ‘Our car is so bad, but luckily we will get more air tunnel time for next year.’\n\nMax: _keeps performing anyway_\n\nRBR: ‘Damn you, Max!’', ""It's only the start of the season but I've been super impressed with Max' mindset and attitude of accepting the car isn't where he wants it to be and maximising on his results in clutch situations. Max with a cool head is probably the biggest danger to mclaren this season if Oscar and Lando keep sucking each other off at the front."", 'This guy is out of this world. He was absolutely not comfortable with that car but somehow managed to get 2nd. Crazy stuff', ""\n\nI don't even think we should have been on the front row <-- You Are Here\n\nI don't even think we should have been pole \n\nI don't even think we should have won sprint\n\nI don't even think we should have won the grand prix\n\nI don't even think we should be leading the wdc\n\nI don't even think we should have won the wdc"", ""Not to defend Lawson because I haven't really focused on him, but apparently the car is a bit of a tractor and not ideal to start your first full season, specially compared to Max's out of this world talent (edit: and experience)"", ""You put more or less any other driver in that car* and it's P4-5 _at best_.\n\n*In part because MV understands an RB, in part because he's just that fucking good."", 'Max entering his Schumi 97/98+ Alonso 2012  era\n\n\nBy far the best driver on the grid vs  the superior machinery.']",4299,236,0.98,4299,10010,10010,4,0,0.0,4
1jgi037,[@jackdoohan] via Instagram,https://www.reddit.com/r/formula1/comments/1jgi037/jackdoohan_via_instagram/,2025-03-21, Social Media,,"['\\+0.3% chances of keeping his seat for 1 extra race. Bit by bit.', ""We just going to live in fear of what Alpine is going to do to this man aren't we?"", 'Jees the black background white text made me think it was a Colapinto replacing him announcement.', ""He's Doohan alright. Good lad."", ""he's one of the drivers that's grown on me - shame on the ones in the paddock that put him down for no reason. Marko especially being caustic with calling him a C grade driver."", 'I had it on my bingo card for him to out qualify Gasly lets fricken go', ""NGL the rookies (except Lawson) are performing up to par as per the car they're given. Hope all of them will get points."", ""this guy doesn't deserve what will happen to him"", 'PU issues after just one race? Damn…', ""i like these new rookies. except lawson. he's kind of a tool.""]",4025,68,0.99,4025,3699,3699,6,0,0.0,6
1jh00o7,"Lewis Hamilton post-sprint: interview: “I really do feel that a lot of people underestimated the steep climb it is to climb and get into a new team, to become acclimatized within the team. The amount of critics & people I’ve heard yapping along the way, clearly not understanding or are just unaware”",https://www.reddit.com/r/formula1/comments/1jh00o7/lewis_hamilton_postsprint_interview_i_really_do/,2025-03-22, Video,,"['>The amount of critics & people I’ve heard **YAPPING** along the way\n\nDAYUM!', 'Reminds me of the [Top Gear interview](https://youtu.be/knteY3kq3Ys) where they were making fun of him going to Mercedes. He loves to prove people wrong.', 'Hamiltons real unfiltered thoughts:\n\nhttps://preview.redd.it/azi2eai216qe1.jpeg?width=640&format=pjpg&auto=webp&s=f9eb664e57ad5d4ef2a812d7000a9f0a51c21447', 'Confirmed: Hamilton heard them people talking shit and had to shut them the fuck up.   \n\n\nAwesome!', 'Lewis thrives off of proving people wrong and yet 18 years into his career, people are still yapping and he’s still proving them wrong. \n\nPeople actually suggested keeping Sainz would be better and were treated as serious people.', 'bro really said yapping XD', 'Silence the yappers', 'Add that to the words of wisdom', 'Talk that shit Lewis', 'Lewis said yapping on live TV.']",3891,192,0.97,3891,170,170,187,3,0.0,187
1jgzq15,[Scuderia Ferrari via Instagram] Victory in the first Sprint Race of the year!!,https://www.reddit.com/r/formula1/comments/1jgzq15/scuderia_ferrari_via_instagram_victory_in_the/,2025-03-22, Social Media,,"['We are at the ""we are so back"" phase.', 'https://preview.redd.it/0pa6hz97z5qe1.png?width=1080&format=png&auto=webp&s=182c3a2d3e614f461e69123c7483e97da7d8115e\n\nWe are sooooo back', 'Grazie the razzie of my ragazii letsgooooooo', 'First sprint win for lewis. \n\nFirst sprint win for ferrari. \n\nWE ARE SO FUCKING BACK.', ""That's my GOAT"", ""Their pace looked terrifying at the end. Hoping for 1-2 in qualiflying for the race. Let's go"", 'House Hamilton sends their regards!', '![gif](giphy|acIy5aKe4nryg)\n\nMe right now', 'Fuck yeah\n\nhttps://preview.redd.it/5mtp9pgzx5qe1.jpeg?width=1200&format=pjpg&auto=webp&s=30d4f787d1fe2e93f27828262edc4971375ca0ab', 'Damn, Lewis got hands']",3212,125,0.99,3212,113,113,93,0,0.0,93
1jgzp96,"Lewis: ""Great job guys! Yes!""
Ricky: ""It was masterclass of tyre management.""",https://www.reddit.com/r/formula1/comments/1jgzp96/lewis_great_job_guys_yes_ricky_it_was_masterclass/,2025-03-22, Video,,"['The level of tyre deg is gonna make for some interesting race strategy tomorrow', ""The rumors of Lewis's demise were greatly exaggerated."", ""Man I'm so happy for Ricky and Lewis, there was a lot of doubt after last week about their chemistry and relationship moving forward.\n\nWhat a way to bounce back and prove the doubters wrong.\n\nSAN DIEGOOOO!"", 'The OG tyre whisperer showing the rest of the grid how it is done', 'Lewis has always been good on tyre management.', ""My man slowed down to put Max in Oscar's clutches and just drove away in the sunset. This might turn into our year lads. Let's go"", 'People probably don’t understand how big of an achievement it is to get into a completely different car after driving all your career in a different one and then acclimatizing yourself so quick. What a legend!', 'Tyre whisperer for a reason bby.', 'We love you Lewis \U0001f979\n\nForza K1 ❤️🤍', 'Clinical.']",3053,140,0.98,3053,122,122,76,2,0.0,76
1jguqei,Lawson: Tsunoda 'had his time - I beat him in the junior series',https://www.reddit.com/r/formula1/comments/1jguqei/lawson_tsunoda_had_his_time_i_beat_him_in_the/,2025-03-21, News,,"['Just put the p20 in the bag bro', 'Haas is using square wheels and an upside down engine and you still qualified last.', 'The junior series thing is a weird one, Yuki came over from Japan to the European series in 2019, whereas Lawson had come over a year earlier to do ADAC F4 and had already competed in F3 machinery with Asian F3. In that first season, both did 2 series together. Euroformula Open and FIA F3.\n\nYou can guess which series matters most in the F1 pipeline, and in FIA F3, Yuki finished 9th in a very weak Jenzer while Liam finished 11th in a stronger MP car. While in Euroformula open, Liam finished 28 points clear in 2nd vs Yuki in 4th.\n\nIn 2020 Yuki got the promotion to F2 which Liam missed out on and finished 3rd in the series, getting a very quick route to F1. Liam was still in F3, and finished 5th that year. They both did compete in Toyota racing series that year though, a series which Liam was current champion of the year before and thus had a year extra experience with the cars. Liam finished 2nd, ahead of Yuki in 4th again.\n\nAll in all, Liam is right that in some championships he outperformed a less experienced Yuki, but not by a huge gap and in the pivotal one Yuki was more impressive and earned his way to F1', ""I find it extra satisfying that Yuki hasn't said a single word about this. Hasn't shit talked Lawson, hasn't criticized Red Bull's decision up front. For how much shit he gets for being hot headed in the cockpit, he really does just put his head down and drive. That and Liam saying stuff like this makes me want to root for Yuki more and more."", 'Bold statement from someone who is *checks notes* dead last.', 'Insecurity is loud . Stop chatting, put your head down and drive .', 'This just seems  a dumb thing to say when you\'re struggling. I think he needs more slack than some are giving him but when the knives are out and lots of fans and media don\'t love you already, this sort of thing doesn\'t help. \n\n\nThis is a situation where you give boring PR answers. ""Yuki is a great driver, but I have faith in my abilities that I was the right man for the seat"" you don\'t need to bring up your junior career to try and put the other guy down.', ""Wasn't Yuki defending Liam for the past 2 years? I thought they had a really close friendship? Also didn't Yuki get 4th in EFormal in a fucking tractor. He also got 9th when Lawson got 11th in F3."", 'Who is this guys PR manager?']",3038,1063,0.93,3038,37866,37866,58,15,0.0,58
1jh4qp5,Bono accidentally calling Kimi “Lewis” in qualifying,https://www.reddit.com/r/formula1/comments/1jh4qp5/bono_accidentally_calling_kimi_lewis_in_qualifying/,2025-03-22, Video,,"[""That's equivalent to an ex driver pulling into their old teams pit box in their new car."", ""😁, I'm quite surprised Lewis hasn't called his race engineer Bono, yet."", 'it had to happen.', '""Take it as a compliment.""', 'I like Bono’s voice it’s so calming and all gdi', 'Bono: “My Lewis is gone” \n\n🥲🥲🥲', 'Old habits die hard', 'Did i really go to tumblr to watch F1 clip in 2025?', ""I know it's a nornal slip of the tongue but why is this making me so emotional lol"", ""Pretty sure Ricciardo's McLaren race engineer called him Carlos once as well.""]",3035,128,0.99,3035,122,122,822,15,0.0,822
1jh3kbl,"Oscar Piastri has broken Lewis Hamilton's record for fastest lap ever at Shanghai. Piastri in Q3(2025) - 1:30.641, Hamilton in SQ3(2025) - 1:30.849",https://www.reddit.com/r/formula1/comments/1jh3kbl/oscar_piastri_has_broken_lewis_hamiltons_record/,2025-03-22, Statistics,,"['1/16 hometown hero! well done!', 'With two yellow sectors too, absolutely insane Third sector', 'This fact might cause Piastri to smile slightly.', 'P 🍑🌲', 'And Oscar goes mild\xa0', 'So close between the top 4 teams', ""I'm starting to feel like this Piastri dude has talent"", 'what a redemption', 'Russell, Norris, and Verstappen also beat Hamilton’s lap record. Hamilton now has the 5th fastest lap in Shanghai history']",2651,129,0.99,2651,121,121,264,6,0.0,264
1jglmca,Lewis Hamilton receives rare praise from Red Bull’s Helmut Marko,https://www.reddit.com/r/formula1/comments/1jglmca/lewis_hamilton_receives_rare_praise_from_red/,2025-03-21, News,,"['""Unbelievable achievement"", wow, never thought I\'d see the day.', 'Sprint race cancelled through safety concerns after low-flying pigs spotted over the circuit.', 'Marko congratulating Hamilton - are we in the Twilight Zone?', ""-Marko sacks Lawson before the European season\n\n-Marko puts Hamilton in the second Red Bull\n\n-Even he can't drive it\n\n-Gets demoted to Toro Rosso"", ""If he starts wishing goodwill to South America we're in a Christmas Carol situation"", 'The law of averages tells me he’ll call Lewis a slur next week', '>Charles Leclerc is good in qualifying but makes a lot of mistakes in the races.\n\nThis reads like something a redditor would say insteas of the advisor of a top F1 team', ""The enemy of my enemy is my friend. He's praising Hamilton and Ferrari as an indirect jab at McLaren. I doubt he'd be saying this if Piastri and Norris lined up directly behind him (Hamilton)."", 'Is HM ok?']",1724,306,0.96,1724,6793,6793,8,0,0.0,8
1jghj4v,Eddie Jordan with his cars,https://www.reddit.com/r/formula1/comments/1jghj4v/eddie_jordan_with_his_cars/,2025-03-21, Social Media,,"['The 191 and 198 are pieces of art. The 198 is still one of my favourite cars for nostalgia reasons but the 191 is one of the best looking cars in history', 'Somebody please do a yellow/black tribute livery this season.', 'I have a real soft spot for liveries that are a single bright colour or pair or colours. Jordan yellow, the late 2010s Orange and Blue McLaren, the BWT sponsored pink and blue cars, and of course Ferrari Red. The Kick Sauber green even. \n\n  \nColours that get that an F1 car is on a race track not an Instagram page.', 'This pic goes unexpectedly hard', 'Love the 7up Jordan of course, but the one back centre is equally gorgeous as a livery', 'The moment that got me hooked on F1 as a child was Martin Brundle totaling his 196 at Melbourne. I still have a vivid memory of it.', 'The 2001 shark livery was my favorite', 'So many iconic liveries', 'I have a soft spot for the gold liveried 196 back there.']",1554,35,0.99,1554,393,393,6,0,0.0,6
1jgxzdy,"Williams find €50,000 of which €40,000 are suspended for missing video",https://www.reddit.com/r/formula1/comments/1jgxzdy/williams_find_50000_of_which_40000_are_suspended/,2025-03-22, Technical,,"['To be fair, if I was handed a camera that must be used, I would have expected a properly formated card included by the FIA.', ""We've all forgotten the SD card for our camera at some point, so this may be the most relatable penalty I've ever seen.\n\nGlad to see no sporting penalty for it. Do fines like this come out of the cost cap?"", 'Wish I could find €50,000', 'To be fair… I’d expect the provided cameras would have provided storage too… what a strange thing to omit', 'This reminds me of that time an ISS crew (very) slowly realized they had forgotten to pack an SD card while they were in the middle of a space walk:\n\nhttps://youtu.be/3BA-ETbjOzo?si=eLbH7mJBtw7FixAf', ""Getting fined 50k or even 10k for not checking if there's SD cards is undeniably hilarious. It's such an innocent mistake that I'm kind of surprised they're the only ones that made it.\n\nThis is the sort of stuff I love in F1. You're questioning whether Williams have broken some technical regulations and are trying to hide an illegal wing. But it turns out they forget to send the intern to PC world to buy a £10 SD card."", ""that description is honestly kind of taking me out\n\n> The reason for the failure was apparently the team’s belief that the cameras would come fitted with SD cards supplied by the FIA. They did not check if they did.\n\n> They noticed during the middle of the session that there was a red flashing light in the cameras and reported that to the Technical Delegate. However, they did not know what the flashing light meant and in any event, it was too late to fit the SD card(s) by then.\n\nactual comedy. i'm glad my high school raspberry pi projects were more professional than a formula one team"", ""Teams are allowed to handle the SD cards???\n\nDoesn't that open up all sorts of potential tampering issues?\n\nYou'd have thought in this day and age the feed would be broadcast"", ""So basically - to sum it up - they've been fined because the FIA is too cheap to buy the SD cards to put in the cameras they mandated be carried in FP to check for wing flex.""]",1502,144,0.97,1502,136,136,34,2,0.0,34
1jgr9q2,Fernando Alonso signing autographs as a 17-year-old Formula Nissan driver in 1999,https://www.reddit.com/r/formula1/comments/1jgr9q2/fernando_alonso_signing_autographs_as_a_17yearold/,2025-03-21, Throwback,,"['The rookie before being a rookie', 'Fuck, I don’t FEEL old, but I always forget I’m the same age as him. \n\nReminds me though of how short an athlete’s career is, that in just about every sport anyone Alonso’s age is considered ancient.', 'https://preview.redd.it/zvgpkzl9r4qe1.jpeg?width=753&format=pjpg&auto=webp&s=4c430b0c4097066543278741c9d96ca58a61b3f1\n\nYoung Alonso fucked', 'I would have been two lol fun times', 'Actual rookie Alonso', ""Wdym 17 year old in 1999, he's still 17 in 2025"", ""Haven't aged a day."", 'Damn that’s wild, I can’t imagine being famous at that age. It’s absolutely a miracle someone like Max turned out normal despite his adolescence.', 'he looks so much like javier bardem in this photo its uncanny\xa0']",1440,22,0.99,1440,521,521,7,0,0.0,7
1jh4833,"Sky: ""how do you win this race tomorrow?"" Max: ""if they all retire in front of me"" Sky: ""We know you're better than that, you don't need them to retire!"" Max: ""I do, we are not fast enough.""",https://www.reddit.com/r/formula1/comments/1jh4833/sky_how_do_you_win_this_race_tomorrow_max_if_they/,2025-03-22, Video,,"['Two words for the interview guy. Tyre deg\n\nDid he not watch how Max fell off in the Sprint in just 19 laps?', 'Most optimistic Max response', 'looking at tire deg they also need to retire behind him', ""Two stop race tomorrow? That way they don't have to spend so my h time managing tyres. Also more fun to watch."", 'We like Max because he don’t sugarcoat shit. And the car right now? Yeah.', 'That jump to Merc is looking likely.\n\nHe also said that there are two racing bulls in Q3 with close lap times to him and that already says a lot.', ""It's gotta be the tyre wear issue. I imagine he's expecting to go backwards tomorrow"", ""If Max knocked on Toto's office asking for a 2026 seat towards end of the year - who would be more concerned, Kimi or Russell?"", 'Just as he said, with the tyre deg, his best bet is to chill like Russell did last week and see if he can blag a podium. Perhaps setup changes made after the sprint will make it less painful', "">We know you're better than that!\n\n>I am but this turd box on wheels isn't!\n\n-Max Verstappen""]",1575,186,0.98,1575,181,181,421,22,0.0,421
