unique_id,post_heading,post_url,publish_time,tag,post_content,top_comments,upvotes,comments,upvote_ratio,score,total_upvotes_comments,total_score_comments,upvotes_growth_rate,comments_growth_rate,upvote_ratio_growth_rate,score_growth_rate
1lp5aps,"""I need some pace, please help"": Full transcript of Norris and Piastri's Austrian GP battle",https://www.reddit.com/r/formula1/comments/1lp5aps/i_need_some_pace_please_help_full_transcript_of/,2025-07-01, News,,"['""However when Piastri left the pit he encountered Sergio Perez and Franco Colapinto fighting for position ahead of him.""\n\nPerez is coming for Redull vengeace! Made for COMBAAAAT!', ""Fascinating. I did wonder why Tom randomly told Oscar that it was Lap 20. I didn't make the connection that that was likely Lando's target lap. I suppose whichever McLaren would be ahead by Lap 20 gets first pit."", ""I'm (always) surprised at how much coaching goes on during the race.  I get it, they have like 100 engineers looking at the telemetry.  But still."", ""I enjoy when I can see it's not just the driver and engineers working for championships. Will Joseph's comms are improving a lot. Much less waffle but still in the style Lando is used to.\n\nWould have liked to hear what the pit wall said about Oscar's lock up, I would imagine a beep or two if such a thing was broadcast!"", 'Smh he didn’t he try pressing the pedal harder smh my head', 'I do think Oscar had a bit better race pace, but he definitely made a few mistakes. Props to lando he had a flawless weekend and race.', 'How many times did Norris get reminded to drink? Sounds like me talking to my kids...', 'Has he tried downshifting and kicking the pedal harder?', '> If we’re going to get passed by Oscar we would pit before him\n\n\nThis suggest, no matter the order, Lando was going to pit first during the first stint.\xa0']",197,85,0.9,197,1282,1282,3,1,0.0,3
1lp7lxk,Lando Norris & Oscar Piastri play Sonic Racing: CrossWorlds,https://www.reddit.com/r/formula1/comments/1lp7lxk/lando_norris_oscar_piastri_play_sonic_racing/,2025-07-01, Video,,"['""Give me a tow!"" ""No, you didn\'t give me one in Barcelona.""', 'These two together are in the championship battle of their lives but still can get genuinly along. Very cool to see. \xa0', '[The McLaren intern who put Sonic fans and Landoscar shippers in the same comment section](https://i.imgflip.com/7j6h3e.png?a486336)', ""They're going to be in the game eventually, aren't they"", '90s Williams: ""Am I a joke to you?""', 'Finally. Been waiting for gameplay content from them for so long.', 'i want Lando and Oscar DLC and to see them race against Hatsune Miku, Steve Minecraft, Spongebob and Ichiban', ""PLEASE put them in the game as either playable characters or have the '25 or '26 car be drivable."", ""Oscar: I can't win the championship now but I can help you win.\n\nThen wins a race.\n\n2024 Baku all over again."", 'Night and day from the Mario Kart video with Danny Ric a few years ago. They obviously both know how to play here.']",196,31,0.89,196,560,560,-4,0,0.0,-4
1lpegqp,"Pointless fact - if Piastri wins the WDC this season, the Hungaroring will overtake monza as the track at which the most world champions took their first victory",https://www.reddit.com/r/formula1/comments/1lpegqp/pointless_fact_if_piastri_wins_the_wdc_this/,2025-07-01, Statistics,"The current list being - 
Hungary with 3 (Alonso, Button, Damon Hill) 
Monza with 3 (Phill Hill, Vettel and Stewart) 

Monaco, zandvoort, Dijon, Watkins glen and the Nurburgring with 2

And Reims, estoril, Shanghai, Jerez, jarama, Barcelona, Montreal, sepang, spa, long beach, österreichring, andestorp, kyalami and sliverstone with one each.

Edit - spa has 2 (Schumacher, Clark) 
And the Nürburgring has 3 (ascari, surtees, villeneuve) and brands hatch has 1 (mansell)

","['the alonso and button races are burned into my mind', 'How do you come up with these statistics', 'For a track that doenst look great for racing,\xa0the Hungaroring has given us some absolute bangers.\xa0', 'Brands Hatch', 'Spa has at least 2.', ""Gasly has to win a championship to bump Monza's stats up. Come on Alpine."", 'This will also happen if he will win WDC next year?', 'jenson button in the rain was always a treat', 'And even if it is a boring race, I’ll take a boring Hungaroring race over a boring Miami race. Its a good track.']",174,18,0.93,174,16,16,10,2,-0.019999999999999907,10
1lptwvt,Keanu Reeves to star in new Cadillac F1 team documentary,https://www.reddit.com/r/formula1/comments/1lptwvt/keanu_reeves_to_star_in_new_cadillac_f1_team/,2025-07-02, News,,"['He was very very good in the Brawn one so hopefully this one is the same', ""Why do they need a documentary they haven't even started yet its like Kimmi getting one"", 'Wouldn’t mind him talking more MotoGP considering his enthusiasm as a biker.', 'There aren’t many sports documentaries about a team that is truly awful, which Cadillac will be for a bit, so if it’s not all put through a garbage PR filter it could be interesting. Like a “Sunderland Til I Die” for F1.\n\nEdit: I am assuming this will also cover the first season and not just the creation of the team leading up to it - the latter would be boring as fuck.', 'John ""race"" Week', 'Now his entry in the GR Cup in the states makes more sense', ""This was to be expected. A new American entry into the F1 sport is exciting content and there's definitely demand for a behind-the-scenes look. So a petrolhead like Keanu Reeves, just coming from a successful Brawn GP documentary, jumping straight on the occasion, was only a matter of time."", ""Some people here are really missing the point, this is rare getting a full team from scratch along with becoming an engine manufacturer in a couple years time. Something like this deserves a documentary for just the team getting fans and the sport itself getting to see the whole process of starting completely from the ground up, this isn't like Audi taking over Sauber who's already on the grid as an example."", 'What exactly is there to document?']",175,33,0.93,175,31,31,98,16,0.010000000000000009,98
1lpp7n7,Will anyone still challenge Ben Sulayem for FIA presidency?,https://www.reddit.com/r/formula1/comments/1lpp7n7/will_anyone_still_challenge_ben_sulayem_for_fia/,2025-07-02, News,,"['Would be funny if George Russell launched a campaign.', 'Someone will, but it will take a long time working quietly behind the scenes to do back room deals to sure up votes within the various motorsports bodies around the world. MBS has many locked down with deals for votes.', ""It's not a great political move, unless they have a big base to bring with them.\n\nBen Sulayem is the incumbent (and the incumbent has never lost an FIA election) and has a strong power base inside the FIA and the national motorsport associations.\n\nFor most people wanting the job, it's almost certainly more prudent to wait until the end of Ben Sulayem's term."", ""Fuck it, I'll do it"", ""Could Infantino hold the presidency concurrently with that of FIFA? There's only one letter separating FIA and FIFA after all"", ""I reckon it's anyway too late now for anyone to have any chance. It's a steep uphill battle. Ben has a significant amount of member clubs in his pocket and it takes a long time to win them over.\xa0You'd need to out-bribe Ben and additionally rely on him to get involved in some scandals or something. Clearly Sainz Sr has realized it's a futile effort."", 'Vamos papá Carlos!', 'Fuck it.\n\n\\*raises hand\\*', ""I'll do it.""]",111,40,0.87,111,35,35,13,2,0.020000000000000018,13
1lpbsq3,F1 Opening Titles but with Hans Zimmer's F1 Movie Soundtrack,https://www.reddit.com/r/formula1/comments/1lpbsq3/f1_opening_titles_but_with_hans_zimmers_f1_movie/,2025-07-01, Video,,"['Naah, I like the original one, may be my brain used to that only.', 'loved it, this was great', ""It's not bad but it's surprisingly forgettable for something from Zimmer. I'll stick with the real thing."", 'Does not really match it, I best music for the intro would be the formula e theme', 'Doesn’t hold a candle to this masterpiece:\xa0https://youtu.be/ChxX3tR4mD0?feature=shared', 'It feels even more daytime soap opera than it is already, lmao', 'I actually kind of love it', ""I like Sky's better."", ""I don't find Zimmers music particularly melodic"", 'Original Link (If Blocked): \nhttps://youtu.be/Ng5zViLdvaA?si=17Fu1o26ESDABtx4']",103,44,0.82,103,250,250,4,0,0.0,4
1lpnggo,Pit Stop Effectiveness - Laps required to recover from pit lane time,https://www.reddit.com/r/formula1/comments/1lpnggo/pit_stop_effectiveness_laps_required_to_recover/,2025-07-02, Statistics,"I was trying to come up with a metric to show how effective each pit stop is, so I did the following calculation.

1. Calculated the lap time for the 3 laps before the pit stop lap as a baseline
2. Calculated the delta (how much faster / slower) each lap after the pit stop was compared to the baseline
3. Calculated how many laps it took to recover the time spent in the pit lane

Drivers that do not show all stints didn't recover the pit lane time during the entire stint.

Of course there are some caveats to this calculation. For example, COL show a quick recovery because his 3 laps before his first pit stop were longer than his average for his first stint.

","['Feel like this analysis becomes sort of meaningless when you consider that performance on the used tyres would have kept degrading had they stayed out. But if someone were to fit a regression line onto their lap times... that would be some juicy data indeed.', 'I see what you are saying. I may try that, thanks for the the feedback.', 'Also fuel load', 'How big is the dataset? only this season ?', 'Yeah I would use the previous 5-10 laps before the pit stop to plot a (likely declining) linear regression. Then use the line as ""predictions"" for the next N laps.']",77,6,0.92,77,5,5,1,1,0.0,1
1lp8f3b,Formula1.com: Norris & Piastri’s Intense Battle For Top Spot,https://www.reddit.com/r/formula1/comments/1lp8f3b/formula1com_norris_piastris_intense_battle_for/,2025-07-01, Video,,"[""Really smart from Norris, closing his DRS to stay alongside Piastri. Completely missed that on the main broadcast.\n\nPalmer's post-race videos are becoming must-watch viewing. He's such a good pundit, and commentator too."", ""Moment I saw Piastri give the DRS to Norris is when I knew he messed up, we've had so many examples of that over the years that I found it weird that any driver still makes that mistake.\n\nWe had Perez in the past repeatedly make that mistake until his engineer came on the radio to tell him to stop doing that essentially."", ""Great analysis but Palmer got the pit call wrong. That came from Lando's side of the garage almost instantly in response to the flat spot. That kept Piastri out there longer and prevented the undercut. Really good strategy on their part that wasn't covered during the broadcast."", ""In hindsight Oscar should've sent it into T1\n\nGood analysis from Palmer"", 'Fantastic analysis by Palmer', 'Torpedo lol', ""That last interview with Stella, the team environment seems very healthy in McLaren. Easier for that to be the case when they're dominating and have no competition from the other teams but it's still nice to see."", 'Raaaaah I love it when wheel-to-wheel battles for the win are explained by a guy who crashed more often than he scored points', 'F1TV commentators are in general pretty fantastic in my opinion, but Palmer and his analysis videos are some of my absolute favorite f1 content.', ""Agreed, which is why it's worth sharing! F1TV with Jolyon's analysis shows Lando's racecraft, which I think he's been lacking in some other notable battles he's had. \n\nKeeping his head, knowing he's at the DRS detection point and about to get DRS activation, was a patient move.""]",72,30,0.83,72,425,425,3,0,0.0,3
1lp871d,[Williams] Can two of the best F1 drivers pass Freddie Flintoff's cricket test?,https://www.reddit.com/r/formula1/comments/1lp871d/williams_can_two_of_the_best_f1_drivers_pass/,2025-07-01, Video,Enjoyed this one despite knowing nothing about cricket. The Carlos Sainz effect claims another victim. ,"['Carlos playing cricket?\n\ngood enough, welcome to RCB', ""Flintoff's Scars from the top gear crash years ago are scary"", 'Happy to see Flintoff doing better !', 'Do I suddenly have a thing for cricket shin pads, or is it The Carlos Sainz Effect?', 'I love Williams Racing social media content ❤️', 'That was way more fun than i expected.', 'Reckon Oscar would be a decent player.', 'He’s soo competitive, fun to watch!!!!', ""Ironically 2025 is the first season that joke won't fly!"", ""Yup, this is actually the first time i've seen him since. I saw some pics, so his face is much better now.""]",50,15,0.83,50,76,76,1,0,0.0,1
1lpegz9,What's in the box?! w/ Lando and Oscar,https://www.reddit.com/r/formula1/comments/1lpegz9/whats_in_the_box_w_lando_and_oscar/,2025-07-01, Video,,"['F1 🤝 Brad Pitt', 'Making Lando play this game again after he was traumatised by it in 2020 seems a bit cruel, lol. Made me laugh how Lando was not happy about Oscar touching all the gummy bears and how Oscar offered the plate to him.', '🎶One - cut a hole in a box…🎶', 'Gwyneths noggin', 'I love seeing Oscar and Lando have fun like this. Can tell they truly enjoy being around each other.', 'Kind of funny how much Lando hates sushi and helicopters.', '""[gonna give you something so you know what\'s on my mind](https://youtu.be/Rt0spqQtMKg?si=yUMdGOtJUwAgmPZR)""', 'All of this just makes me miss Carlando :/ \n\nLandoscar is friendly enought but Carlando was special', 'Nice', 'I wonder how long ago this was filmed. Their hair are so short']",37,17,0.7,37,131,131,1,0,0.0,1
1lpo9zw,"Where would Super Formula, Indycar, and Indy NXT compare to F1 junior series?",https://www.reddit.com/r/formula1/comments/1lpo9zw/where_would_super_formula_indycar_and_indy_nxt/,2025-07-02, Technical,"I think Super Formula is the fastest of the 3 stated, but is it faster than F2? Is Indy NXT faster or slower than F4? Just wanna see how other open-wheel series compare to the junior formulas we are familiar too. How come we dont see any drivers from those series come and have a shot in F1 and F2? It feels like there is a lot of potential in those series that will never be able to shine on the international stage imo.","[""Super Formula races Suzuka. Indy has raced at COTA. Just compare the times\n\n2019 when Indy was at COTA the lap time was 1:49. F1 lap time was 1:32. F2 is about 15-20 seconds slower than F1. So Indycar and F2 are pretty comparable.\n\nF1 at Suzuka record: 1:30 \n\nSuper Formula: 1:37\n\nSuper Formula is in between F1 and F2. Indy is slightly slower than F2. But they're built for different specs. F1 isn't a spec series like the rest of them too."", ""Yes, SF is faster than F2. There's also an SF champion currently racing in F2, although most SF drivers will be happy racing in the prime racing series of Japan. People in Indy NXT aim for Indy, and/or lack the budget for F2, but the only single-seater series an IndyCar driver would want to go to is F1, and that's not a given (I'm sure people in the F1 paddock have called Palou). There's also the factor of IndyCar giving too few SL points for its level; just ask Colton Herta.\n\nRealistically, the pipeline mostly goes the other way. Look at how many IndyCar drivers started their careers in the feeder series ladder over in Europe, and then there are the ex-F1 drivers."", ""Bringing in a driver from Indycar is difficult. Deliberately so. \n\nMcLaren Indycar driver Pato O'Ward would need 40 super licence points to drive in F1, but his last 3 seasons in Indycar were 5th (8pts), 4th (10pts), and 7th (4pts) giving him a total of just 22 of the 40 points required. Had he got the same results in F2 they would have been 5th (20pts), 4th (30pts), and 7th (8pts) for a total of 58 points and a super licence. Fuck, he'd have got more points getting those results in F3, 5th (12pts), 4th (15pts), and 7th (7pts) for a total of 34 points. \n\nThe FIAs crappy assessment of Indycar results is near mirrored by their view of Superformula.\n\nThe FIA wants drivers to come up through their ranks."", 'IndyCar on Roads is quite similar to F2 in speed. Indy has more HP, but little less down force currently. On Ovals IndyCar reach 240 MPH. \n\nCurrently a good chunk of drivers from F2 move to Indy. There is no movement from Indy to anything but potentially F1 and that is pretty dead due to a lot of factors. \n\nSF is a bit faster than F2. There is some movement from F2 to SF and one SF champion is currently driving F2, with not much to show for after 1 1/2 seasons. \n\nIndy NXT is plenty fast for a feeder series. It has 450 HP (+50HP for P2P) and decent down force for what it is. It has 70 HP more than F3 and I would say comparable downforce. IndyNXT should be as fast or faster than F3. \n\nF4 is miles away from F3 and Indy NXT.', ""There's multiple reasons why drivers from non F-eeder classes aren't getting the same amount of shots as ones that are in the system.\n\n1: Points. Drivers in the other classes don't get the same amount of points as say, being a top 4 driver in F3 and/or F2 for a few seasons. A recent example being Colton Herta who just missed out on a superlicense despite having very impressive Indycar results.\n\n1.5: To add to that, Indycar (and most series with Americanized point systems) are inherently harder to succeed in. With a much bigger part of the grid getting points, as well as the points differentials being lower between winners and the rest of the top 5, as well as racing being much less prone to success monopoly (rd. one team/driver winning a majority of races due to superior equipment), it's much harder to consistently finish the season in high enough positions to accrue good license points, further exasperated by the lower license points.\n\n2: Feeder bias. The paddock is a small world, and being at the same race weekends as F1 teams has a significant effect on in-paddock perception of drivers and their talent. They're more scouted, there's more attention for them simply by being around major teams all the time. More often than not, many feeder drivers are also part of a young driver programme for one of the F1 teams (As well as often sharing sports agents that are 'in' with F1 teams), so F1 teams have a greater incentive to focus on their own youth than look to drivers outside of their own programmes.\n\n2.5: Also politically speaking, Liberty and the FIA want to prefer the feeder series because they are literally built to feed into F1. Teams structurally ignoring drivers from feeder series would hurt the prestige of the series, make it less marketeable, make young drivers less likely to go through the feeder series, and generally be seen as not being THE way to get into F1. There's a lot of money and corporate stakes at play who want the feeder series to keep its advantages.\n\n3: Level of competition. I won't claim F2 is a superior racing class with superior drivers to Indycar and Super Formula. But generally speaking they have a broader field of international talent, and there's definitely an inherent bias from teams and media towards Feeder series drivers as being better. Localized series with a heavy contingent of local drivers (for example, Super Formula only has 4 non-Japanese drivers this year) feeds the idea that there's less true talent, and thus drivers who don't utterly dominate are seen as inferior than drivers who have reasonable success in F2/F3. It's kinda unfair, but it's a pervasive bias that has existed for a long time.\n\n4: Car/track experience. Whilst Indycar and Super Formula have comparable open-wheel cars, they are very much their own class of cars with their own quirks and limitations. F2 and F3 have specifically been designed around being a ladder towards F1, with rulesets and cars (where reasonable) built around F1 specs. They also race on the same tracks (see point 2) as the F1 teams, so drivers have more track know-how, even though simulator work has become more prevalent, teams appreciate practical experience. It also leans into some of the earlier biases, but a top 4 F2 driver is seen as more F1-Ready than someone coming in from Indycar (where there's also a lot more oval racing that isn't present in F1)\n\nHonestly I agree with you that I would love to see F1 pull in more talent from outside their usual feeder series bubble, but F1 is nothing if not a world of politics and looking inward. The FIA and Liberty would love to see an American driver, but they want 'their' American driver, one they can in some form or fashion can mold as an F1 star and not necessarily one that cut their teeth in Indycar or elsewhere."", 'It is not necessarily speed that you use to measure the differences between races. For example, Indycar races on ovals and success there requires a skill set that is not developed in circuit racing.', 'Super Formula is typically considered a top-tier racing series, despite some teams treating it as a feeder for F1', 'If you want to adapt to go to F1, Super Formula is definitely the right way, for the championship IndyCar is definitely the right one', ""If we talk about the quality of the drivers/difficulty to win the title and not the speed of the car, I'd say Indy car is a clear 1st. \n\nSo Indycar, then Super Formula, then F2, then a bit far back Indy NXT and F3 being last in terms of quality of the drivers.""]",37,53,0.77,37,52,52,3,1,0.010000000000000009,3
1lpt6n0,Kimi Antonelli vs Valtteri Bottas: Who Wins the F1 Cost Cap Challenge?,https://www.reddit.com/r/formula1/comments/1lpt6n0/kimi_antonelli_vs_valtteri_bottas_who_wins_the_f1/,2025-07-02, Video,,[],24,0,0.96,24,0,0,6,0,0.039999999999999925,6
1lpuqa8,Do you guys support individual drivers first or teams?,https://www.reddit.com/r/formula1/comments/1lpuqa8/do_you_guys_support_individual_drivers_first_or/,2025-07-02, Discussion,"I started following F1 during the Hamilton/Mercedes era where Max/RB were the underdog fighting to change the status quo. As it so happened in other sports for me I ended up supporting the underdogs and became their fan. 

It's been quite rewarding as it turned out obviously. Have been on team Red Bull and Max Verstappen since then. But now with Max potentially leaving the team I am wondering if I support the team more or the driver? Kind of an interesting situation that is unique to F1. This does happen of course in other sports where your favourite player leaves your favourite team but F1 is still unique in the sense that a driver becomes a bigger part of a team's identity than an individual player in traditional team sports. Even Messi leaving Barcelona doesn't feel the same as Max leaving Red Bull. ","['Individual driver', 'Honestly I can’t decide on a single team or driver. \xa0I guess I just support the sport? \xa0 The drivers and teams are all people - most of which just want to win. \xa0Behind the scenes we get to see how most of the get along well. \xa0Rooting for one driver or one team might make you miss the incredible experiences elsewhere on the grid. \xa0', 'I support drivers and root against teams', ""I have some drivers I prefer and some I'm not a fan of, same with the teams but at the end of the day I just enjoy the racing."", ""I'm a team guy. I will always want my team to be leading both championships."", 'It makes sense for teams if you support Ferrari, McLaren or Williams due to their legacy.', 'Well Lewis now drives for Ferrari so I guess I support the team and driver at the same time', 'Williams to the core.', 'Team - drivers come and go']",39,154,0.76,39,129,129,39,154,0.76,39
1lpso57,Austrian GP Race Debrief - Mercedes-AMG F1,https://www.reddit.com/r/formula1/comments/1lpso57/austrian_gp_race_debrief_mercedesamg_f1/,2025-07-02, Video,,"['Hey Team! Our Race Debrief with Shov from Austria is now online, hope you find it insightful 😁', 'Kimi needs just 2 more active champions to complete his hattrick.', 'Resign George and Kimi!', 'Extend George’s contract, verdammt!', 'Tell us if your Boss Toto is willing to throw George under the bus to get Max', 'Re-sign', 'Claire Williams would have.', 'No! Sign Max and send George to ~~the shadow realm~~ Red Bull.', 'No need. We all know the answer.', 'The poster knew what he did...']",9,13,0.66,9,13,13,3,0,0.050000000000000044,3
