unique_id,post_heading,post_url,publish_time,tag,post_content,top_comments,upvotes,comments,upvote_ratio,score,total_upvotes_comments,total_score_comments,upvotes_growth_rate,comments_growth_rate,upvote_ratio_growth_rate,score_growth_rate
1hfk4ou,"Max on Lando's comments in Brazil: “They immediately interviewed him after a race where he got a mental blow. I know Lando, at the moment he's very disappointed with himself and then immediately gets such a question. He should,ve just not had a camera infront of him and i know Lando's a good person”",https://www.reddit.com/r/formula1/comments/1hfk4ou/max_on_landos_comments_in_brazil_they_immediately/,2024-12-16, Video,,"['On the interview he gave a dig to Ferrari by saying despite having some discussions with GP on the radio, he prefers him to be totally honest rather than a guy who only says “copy” or “we are checking in the radio” every time', 'Just to remind everyone, this was the interview question that Lando was responding to:\n\n“Maybe we can start with the VSC fairly early in the race and pitting under that. The red flag that followed of course. Can we get your take on that?”', 'Plus, he was not talking about Max’s drive, he was talking about the red flag strategy.', ""Max has the ultimate duality of any sports man I know. He's genuinely a nice person but takes absolutely zero prisoners while out on track. He will gladly squeeze Lando and anyone else while racing and then turn around and invite you to his  home just after."", '##Drive to survive-\n""Nope that did not happen, they hate each others gut. MAx is a KILLER on loose""', ""It's a nice sentiment from Max but wasn't Lando's comment about being able to change tyres under a red and nothing to do with Max's driving ability?"", ""I know I said it back then that the words itself, when taken literally, are not the best representation of the point he is trying to convey, but I am a bigger believer that the blowback from Norris's interview has been insane, and he didn't deserve that vitriol. Tell me we can all finally put this to bed now"", ""Media still not over it? Like come on it's been 2 months"", 'Bros before Sky Media', 'Problem is when something like this blows up when taken out of context the amount of people who will then afterwards read ""the truth"" about it or the proper context which shows Landos comment wasnt bad at all are so much less then the people who will watch the funny insta reel or read the blow up comment section here on reddit.']",9435,327,0.96,9435,286,286,472,16,0.0,472
1hf4ico,#Throwback - Seb and Kimi at the 2018 FIA Prize-Giving Gala,https://www.reddit.com/r/formula1/comments/1hf4ico/throwback_seb_and_kimi_at_the_2018_fia/,2024-12-15, Throwback,,"['https://preview.redd.it/ttgyba00d37e1.jpeg?width=312&format=pjpg&auto=webp&s=029d0a0221a17f5f1fad144285541edc5efbe612', 'https://preview.redd.it/s8fnj2iid47e1.jpeg?width=600&format=pjpg&auto=webp&s=7f80e77a1eb7c33247ee3cd26d2d4f4791f0b019', 'Most sober Kimi moment', 'https://preview.redd.it/25cy8n56i37e1.jpeg?width=368&format=pjpg&auto=webp&s=1abb398283ee47bd6da5d482c26cd6c896b22512', 'He must have been fully drunk that day. 😂\n\nHe didn’t really wanted to end P3 in the championship and be there as a consequence, if I remember correctly he even said this in an interview.\n\nI guess that showing up drunk was his solution!', 'Honestly my favorite part is how chill Seb is with a drunk Kimi. I want him to be my wingman when I start browning out.', 'I remember a 2018 small video where Kimi tries to speak in Russian after Gala.', 'They let Kimi have the drink', 'KIMI, you WILL have the drink']",5998,77,0.99,5998,8685,8685,71,1,0.0,71
1hf38pm,[Zak Brown] Lucky for all of us that Lando's a better driver than he is a cameraman! ,https://www.reddit.com/r/formula1/comments/1hf38pm/zak_brown_lucky_for_all_of_us_that_landos_a/,2024-12-15, Social Media,"What a great way to finish off an amazing season, celebrating success with the awesome men and women of McLaren Racing and their families.Lucky for all of us that Lando's a better driver than he is a cameraman!
","['Lmaoo he took the pic like a little toddler that stole your phone, why is this guy so unintentionally funny sometimes', 'MBS was standing right next to him so he had to crop him out.', 'I actually like that he framed it the way he did. It ensures that he actually got everyone in the crowd, too.', '![gif](giphy|KMcZ9XZeQIks8)', ""Surprised MBS didn't jump in front of Piastri as he is of course, the most important person who contributed the most to Mclaren's success /s"", 'Speak for yourself, I always wanted to see up his nostrils.', 'The framing gives us such a clear view up his nostrils', 'He did his turn 1 strat where he got out the way for everyone else to be in the picture', ""Did Zak borrow one of Donald's suits? Andrea needs to see a tailor as well. Sheesh"", 'What a weird way to say he’s short.']",4411,40,0.98,4411,1877,1877,34,0,0.0,34
1hffws3,"Yuki Tsunoda thinks he ""impressed"" Red Bull at Abu Dhabi post-season test as 2025 driver decision looms",https://www.reddit.com/r/formula1/comments/1hffws3/yuki_tsunoda_thinks_he_impressed_red_bull_at_abu/,2024-12-16, News,,"['Get ready for a 5th season in Toro Rosso, buddy\n\nhttps://preview.redd.it/a5m9jclgs67e1.png?width=2160&format=pjpg&auto=webp&s=3503bdc4db7efe1f370b56bd6b3181f54397c6cc', ""If 2024 taught us anything, it's that you don't need to be the fastest to hold a Red Bull seat"", 'https://preview.redd.it/9a9vzbsyt67e1.png?width=640&format=png&auto=webp&s=816d0caf2961b142447f0b6d86840907e49ca0a1\n\nYuki: I think I impressed at the post season.', 'Red Bull in few days: Sergio Perez really impressed us with his performance and feedback about car, so we decided to extend his contract for another year.', '>""During the post-season tests, Yuki was allowed to take to the track in the RB20 and the team was happy with his technical feedback. In this respect, he is far better than people give him credit for.""\n\nHelmut Marko confirmed it in his Speedweek article.\n\nhttps://www.speedweek.com/formel1/news/230809/Dr-Helmut-Marko-Wir-wissen-was-zu-tun-ist.html', 'If only', 'This will be the rejection that probably sees him leaving for another team after next season.', 'I dont think its possible to impress Horner', 'Horner to Yuki:\n\n![gif](giphy|78xs6hYdlu6lDFeVee)\n\nBut no!']",4236,344,0.96,4236,330,330,103,5,0.0,103
1hfmi4q,"Unpopular Opinion: I’m a Carlos Sainz fan, and I don’t think Ferrari did him dirty.",https://www.reddit.com/r/formula1/comments/1hfmi4q/unpopular_opinion_im_a_carlos_sainz_fan_and_i/,2024-12-16, Discussion,"All this talk about “Ferrari doesn’t deserve him” is getting tiring sometimes. Is he a very good driver who deserves to be in a top team? Of course. 

But these people are acting like Ferrari didn’t appreciate him at all and just fired him for the first guy that wanted to drive for them. It’s Lewis Hamilton. I think Lewis and Max are the only 2 drivers on the grid that can get any team to fire one of their drivers immediately in order to sign them. 

I get that Carlos felt betrayed because he was supposed to renew his contract but the only reason he was “fired out of nowhere” is because Lewis made one of the biggest moves in the sport’s history. 

For Carlos to be a Ferrari driver for 4 years and have such good moments and wins with them is incredible and no one in Ferrari had any doubts that he’s been amazing at that team. 

They all love him, they never made him feel like a second driver, they always let him race Charles and were happy for him when he won races, in his last year they gave him the same upgrades as Charles and never prioritized one of them, they let him test with Williams in Abu Dhabi, they gave him one of the best send offs I’ve seen, even tomorrow he’s going to Fiorano and both him and his dad are gonna do a final lap in the F1-75 around the factory. 

Say what you want about Ferrari but I don’t think there’s another team on the grid that would do all of that. Ferrari treated him with all the respect and I see him coming back there in the future.","['I mean he mentioned that if it was another person replacing him he would feel insulted. But since is Lewis he can’t complain.', ""I think both sides of this handled the parting well. No one was mad at the end, just sucks Carlos couldn't get a better seat."", ""This isn't an unpopular Opinion lol."", 'I totally agree with your opinion. \n\nFerrari and McLaren have been giving warm send offs to their drivers. On the other hand is Red Bull with a ""💙"" to their drivers', 'Ironically, this post is the first time I’ve heard anyone mention Ferrari did him dirty lol', 'Even Carlos understands and bears no grudge against Ferrari. Hamilton is an icon, so the enticement of having Lewis win a Championship at Ferrari is a big on. Sainz is loved and respected at Ferrari, if he continues to up his game I can see him being at Ferrari again in the future.', 'Carlos didn’t feel betrayed. He expressed the exact same opinion you are sharing in this post.\n\nHe said something along the lines of “if I’m going to be replaced by someone, it’s an honor for it to be Lewis. I totally get it.” He’s also been very open about his love for Ferrari, and that there are no hard feelings.\n\nThe only people who are angry are people on the internet and attention seeking tabloids.', ""Wait people genuinely think that?\n\nI was kinda sad at the beginning but cmon lads, It's SIR LEWIS HAMILTON, he can have not the best of seasons and still his signing would be worth it for Ferrari\n\nAs carlos said, if it was anyone else he would have been angry, but its Lewis a 7x wdc"", 'This is unpopular?', ""If sainz got the red bull or Mercedes seat we wouldnt be saying he got done dirty. It's only because he went to Williams that people feel sorry for him. Williams are obviously punching above their weight in signing him but that's not Ferrari's fault. Ferrari would be the first to say he deserves a better seat""]",2759,285,0.89,2759,249,249,293,20,0.0,293
1hfiizk,[F1] Stroll vs Alonso in 2024,https://www.reddit.com/r/formula1/comments/1hfiizk/f1_stroll_vs_alonso_in_2024/,2024-12-16, Social Media,,"['Yet another subpar season for lance', 'It\'s probably just a coincidence but Alonso started completely dominating as he usually does after Stroll refused to swap positions back in Hungary.\n\nThere was also the infamous ""I\'m 4-4 vs him in qualifying"" quote by Stroll after he hit his annual ""acceptable form"" phase.', 'His heart just doesn’t seem to be in it. Just my perception due to the attitude and mannerisms he presents during interviews and media appearances.', 'A stroll stat in a  sea of perez stats.', 'Just from eye test. Lance seems to have more bars than Perez.', 'Having stats like this are great..... Until you get to a ""negative"" stat where less is better .... But breaks the stat. \n\nThankfully, best starting position has been displayed correctly (lower position shown as a better stat. But Instead of DNFs, it should be races completed.', 'Wait when was stroll 6th ?', 'https://preview.redd.it/u8rkdc2m587e1.jpeg?width=1440&format=pjpg&auto=webp&s=06c6fb4717e06c9cd449ebd1cac3dec346afdd30', 'I’m curious to see the average pace difference in race and quali', 'LETS GOOO STROLL BEAL ALONSO IN DNF']",1649,183,0.98,1649,168,168,57,3,0.0,57
1hfqjc4,"[Autosport] Mike Krack on Stroll and Alonso: ""I think that, in general, there is not that much difference between the two."" ",https://www.reddit.com/r/formula1/comments/1hfqjc4/autosport_mike_krack_on_stroll_and_alonso_i_think/,2024-12-16, Social Media,,"[""Indeed, they both have 2 arms and 2 legs.  They're nearly identical."", '„I‘d like to keep my job thanks“', ""If Daddy Stroll signed my checks,  I'd dare to say that Lance is actually better than Alonso , and perhaps Max if there is enough zeros"", 'https://preview.redd.it/f5i78tvfh97e1.jpeg?width=1920&format=pjpg&auto=webp&s=75921207851a7c199a4b788d78e2b5a6e288989e', ""They're both racing drivers for AM, wear helmets and drive sometimes fast cars. That's for sure"", ""I'd be so offended if I was Fernando."", 'The humiliating kissing of the ring you must do in order to keep your job at Aston Martin.', 'I mean, on average, they both have 1 WDC each between them. So they are quite equal.', 'Blink twice if you need help, Mike.', 'He’s talking out of Mike Krack.']",1722,512,0.94,1722,450,450,799,149,0.009999999999999898,799
1hfhvh3,Mekies hails ‘outstanding’ season for Tsunoda,https://www.reddit.com/r/formula1/comments/1hfhvh3/mekies_hails_outstanding_season_for_tsunoda/,2024-12-16, News,,"['red bull: i don’t care for tsunoda', 'Horner: ""Who""ki Tsunoda?', '“So Yuki, you really did a great job *standing out* this season. Unfortunately the regulations require drivers to be seated at all times so you’re out.”', 'even the F1 admins are getting desparate lol', 'Plot twist: Mekies wants to get rid of Yuki too, trying to offload him to Red Bull.', ""Man official F1 media is in on it now. Let's get some momentum going. I don't see the downside - Liam isn't going anywhere if you give him a drive in the VCARB. Why not see what you've got before Honda moves to AM?"", 'I think I sense a Yuki push here. Might we get an announcement today?', '![gif](giphy|UqZ4imFIoljlr5O2sM)', 'Apart from the points he scored and the way he outperformed RIC and LAW and even PER to an extent he also presented himself as very mature. People will cite the divebomb against RIC in Bahrain but apart from that he delivered some great racing for example in the Austin Sprint or in Abu Dhabi without standing out as dirty, unfair or hot headed. I think he deserves his chance. Maybe he is not good enough but he is not worse than Perez. And if he fails Lawson can always jump in.']",1271,130,0.98,1271,118,118,26,1,0.0,26
1hfisvy,"Sergio Pérez scored only 34.78% of the points tally Max Verstappen achieved in 2024. This is the lowest percentage of points that the teammate of a WDC has scored since 1994, when Michael Schumacher's three teammates combined to score a points tally that amounted to 11.96% of Schumacher's total.",https://www.reddit.com/r/formula1/comments/1hfisvy/sergio_pérez_scored_only_3478_of_the_points_tally/,2024-12-16, Statistics,,"['That makes him better than (a) Verstappen.', ""Wake up,\ncheck Reddit,\nsee a Checo fact on r/formula1\n\nIt's a routine at this point"", ' No worries there’s always next season', ""Good lord, how many different ways are we going to quantify Checo's suck?"", 'Babe wake up, your daly Checo roast post just dropped\xa0', 'This is factual proof hes better than Verstappen.', ""Bebe wake up it's time for the daily depressing Pérez stats"", 'https://preview.redd.it/u3ndvjuet77e1.png?width=277&format=png&auto=webp&s=b724b3f1d8aca8689b1f946f0739f4cfeaf24ce7\n\nSo give me my 16 million', 'Give the poor man some break and some tequila', 'Posting negative Checo stats is now like a coping mechanism for Reddit. The bad man is staying for another year at least.']",1042,144,0.87,1042,126,126,75,1,0.0,75
1hfeu9i,Mark Hughes: F1's former genius innovator is leaving on a whimper,https://www.reddit.com/r/formula1/comments/1hfeu9i/mark_hughes_f1s_former_genius_innovator_is/,2024-12-16, News,,"[""It's sad, but there's something fascinating to me about how they were they biggest proponents of the hybrid engines, and then they got them and it actually made them spend more money and made their performance worse for the most part."", 'In his interview with Motorsport Magazine, Adrian Newey lamented that Renault, in his time with them at Red Bull, never once asserted the same desire to win as the rest of the team.\n\nRenault were supposedly so lackadaisical that Newey found their presence ""demoralising"" to the extent he considered just quitting and retiring permanently.', 'The 2022 engine freeze is what truly killed Viry. It locked in underperformance, and unlike what was promised when the freeze was proposed, they were not permitted to equalise at any point over the seasons.\n\nIt’s simply unsustainable for a team to pay 200-300 million a year for locked in underperformance. Better to not take the gamble that this happens again.\n\nI really hope F1 remembers this the next time a freeze is proposed.', ' Viry screwed themselves 2013 to 2019', 'This is a very good article. Renault failed because they were not willing to do what it took to succeed in the hybrid era, but they have a history to be very proud of', 'Any cost cap and engine freeze are just an insult to this sport tbh', 'They left F1 in 1996/1997. The current Renault is partially Mechachrome.', 'Without a whimper? What about the last 10 years', 'Renault please sell this team']",982,137,0.99,982,1405,1405,15,0,0.0,15
1hfkb3m,"Verstappen has the best average points per race in Red Bull history at 15.92, the second is Vettel at 13.96, and the third is Perez with 10.36. ",https://www.reddit.com/r/formula1/comments/1hfkb3m/verstappen_has_the_best_average_points_per_race/,2024-12-16, Statistics,"After Perez, the best averages belong to Ricciardo ar 9.56, Webber at 7.59, Albon at 6.69, Kyviat at 5.25 and Gasly at 5.25. 

**Addendum: I'm not making this up, go and see it for yourself at [F1 Stats](https://www.statsf1.com/en/red-bull/pilote.aspx).**","[""Didn't expect a positive Perez stat today"", 'Is this adjusted for different point systems? Seb and Webber drove for RBR before they switched to the current 25 pt system', 'Perez at 10 is crazy given this year where he scored an average of 6.x', 'I’ve seen enough, extend Checo 4 more seasons', 'Damn Webber brother.', '8 WDC titles among these 3 legends.', 'Babe wake up the next bad Pérez stat is… WAIT?', ""I'm sorry but this statistic is pretty useless and just wrong. You can only compare the drivers who drove the same car during the same time (like VER and PER 2021-2024 or VET and WEB 2009-2013 for example).\n\nI'm pretty sure if you look at BOT and RUS (at Mercedes) BOT has a higher average just because he drove during a way more Merc-dominant era and consistently scored second or third places resulting in higher points accumulated. But RUS outqualified and outscored HAM way more often than BOT but not in podium positions, moreoften in Top 10 positions with lower points. So this average points scored does not validate anything."", ""Only 4 Red Bull drivers have driven WDC winning cars, so I guess this is trying to make Perez look better than Webber by including Webber's points from 2007-09 when 38% of today's points were awarded? If we ignore those seasons, which conveniently puts Webber and Perez at 4 seasons all in WDC winning cars and the same points system:\n\nVerstappen average points per race 2021-24 (no sprints or FL points): **19.24**\n\nVettel average points per race 2010-13: **17.22**\n\nWebber average points per race 2010-13: **11.40**\n\nPerez average points per race 2021-24 (no sprints or FL points): **9.71**""]",910,59,0.94,910,52,52,93,2,0.009999999999999898,93
1hfk81v,Of all the WDCs that moved to Ferrari only Fangio and Schumacher managed to win it again with the Scuderia,https://www.reddit.com/r/formula1/comments/1hfk81v/of_all_the_wdcs_that_moved_to_ferrari_only_fangio/,2024-12-16, Statistics,"https://preview.redd.it/pbk12l9nz77e1.jpg?width=1600&format=pjpg&auto=webp&s=6963b50afa9e4aff6d131c0e36a6705bf5af5db7

","['And other way around? Drivers who won the WDC with other team, but after winning it with Ferrari? Only Lauda comes to mind', ""I don't understand. How does this relate to Sergio Perez?"", ""I mean, Hamilton is by far the most successful driver Ferrari have ever signed, but he's probably also the oldest since Fangio? This could go either way"", 'Ferrari has collected quite a few WDC winners who were already past their prime, because they fit into the prestige of Ferrari.', 'Ferrari to end Hamilton like it has so many great champions before him', 'I think this will be like late Vettel. Charles is about to completely obliterate Hamilton in qualifying, unless there was some giant sandbagging going on.', ""Well if anyone can do it again, it's Lewis"", 'Vettel had the best chance to break that, but he was not mentally strong for it.\n\nAlonso never had the car (or the team).\n\nHopefully Hamilton has a better chance.', 'Hamilton has the charisma to inspire the team to give their best. That matters a lot.\n\nNo matter have good Charles and Carlos are, they’re not coming in with the history that Lewis has']",837,148,0.98,837,134,134,64,6,0.0,64
1hfj6jb,"[Kunal Shah] Helmut Marko: ""This is the first time share holders are involved (in a driver decision). Negotiations are ongoing."" Decision and Announcement this week. ",https://www.reddit.com/r/formula1/comments/1hfj6jb/kunal_shah_helmut_marko_this_is_the_first_time/,2024-12-16, News,,"[""Lmao all this fanfare then they will announce that they are extending Checo's contract till the heat death of the universe\xa0"", 'He’s staying then', ""If shareholders are involved, that confirms Perez is staying, I guess.\n\nCan't imagine they wouldn't like those sponsorship money and/or want to hurt themselves paying the contract termination fee."", 'That team is so fucked since the death of Mateschitz', 'Makes you wonder if they are as financially stable as is thought.  Or just greedy.  \n\nShareholders probably assume Verstappen will always be there winning.', 'I need that Checo extension for the chaos alone.', 'I bought once a Red Bull. Am I qualified to get involved too?', 'Hmm, gain $40 mil to have someone perform poorly, or spend $20 mil to get rid of that guy and have someone we also don’t have confidence in…\n\nWonder what the shareholders are gonna go for.', 'What a mess. Just get the guy out for gods sake.', ""In most other businesses, Horner's head would roll for this. He pushed to renew Pérez on these terms, and it cost them in the WCC standing prize money and (seemingly) termination fees. Then add in that the power struggle meant Newey left...\n\nHe's lucky the org has backed him too far to cut him loose now.""]",723,226,0.98,723,216,216,159,30,0.010000000000000009,159
