unique_id,post_heading,post_url,publish_time,tag,post_content,top_comments,upvotes,comments,upvote_ratio,score,total_upvotes_comments,total_score_comments,upvotes_growth_rate,comments_growth_rate,upvote_ratio_growth_rate,score_growth_rate
1jipjgq,Ferrari in China hit rock bottom while the enigma of the SF-25 is revealed,https://www.reddit.com/r/formula1/comments/1jipjgq/ferrari_in_china_hit_rock_bottom_while_the_enigma/,2025-03-24, News,,"['Focus on 2026 with immediate effect', 'Not the start of the season I expected, not the momentum being carried from 2024 that I too expected.\n\nThat seems like something that may not be fixed easily,...I don\'t know at the very least they must have a compliant car for the races (by that I mean a design that doesn\'t degrade the plank too much or the tyres) and that cannot wait as it would make them lose a lot of championship points and thus money AND hurt Ferrari\'s image like hell.\n\nI don\'t know how fast they can fix the rear design, depending on that complex answer, for sure, they would need to choose between an ""all in"" on 2026 or fixing their season if they believe a P2 or P3 in championship is reachable', 'If it’s truly the rear suspension design being inherently too soft and/or the new gear casing being too brittle to take the loads if the suspension is set to being harder, then Ferrari is completely done for the season, as neither change is something you can do fast, or even do at all without a chassis redesign.\n\nBy the way, article is signed by the three big names: Giuliano Duchessa, Piergiuseppe Donadoni, Rosario Giuliana - pretty much the closest we’ll get to an open admission bar a full-on statement by a team member.\n\nEdit: really the only hope is that with more kilometres racked up they might be able to find a setup that “clicks”, and that’s where Serra’s experience will be huge, but man it’s not looking good if they still got caught out by it on a super smooth track like China after the resurfacing.', 'Translation:\n\nMcLaren put the weekend back in place by dominating the Shanghai Grand Prix, while Ferrari got lost after a promising start, closing with a sensational double disqualification. Oscar Piastri and Lando Norris were able to easily control the pace of the pursuers, no one had the pace to create great concerns. The degradation was under control on each compound, Andrea Stella confirmed that by monitoring the Stroll pace (departed with the hard) “we realized that a stop was the option to perform”. Haas also benefited from a winning strategy, diversifying and adapting to the conditions.\n\nVerstappen had an ineffective start but at least he was able to return to the distance, the RB21 seems a distant relative of the previous cars. Russell tried to stay around the cars of Woking with a good texture.\n\nThe Ferraris went close to disaster at the first corner, Leclerc fought well with a broken wing, despite a balance damage quantified in 2/3 tenths. For a long phase he could have been better than the seven-time English champion, which shows how well Hamilton’s settings had gone out of the window with high load.\n\nYet the worst was yet to come. The SF-25 remains a car with unknown reactions in terms of long run. From the sprint stars to the stables of the Fia sentence an hour and a half after the race. The inspectors of the Federation measured the cars and found them non-compliant. Leclerc’s SF-25 was disqualified for less than one net weight, Lewis Hamilton’s number 44 for excessive shoe wear that protects the bottom. As well as the Alpine of Gasly the riders have been removed from the standings. The rules in terms of compliance are not questionable and it has already happened that an auto-Venturi was found with excessive consumption of the underbody however suffering a double disqualification is an unacceptable episode for any team. In both cases, Ferrari cannot have benefited in terms of performance, they are both serious but venial errors, the adjustments are simply not working in the long race, unlike the sprint. This could not go unnoticed on a smooth track as the Chinese one is currently.\n\nTHE TECHNICIANS HAVE DISCOVERED THE ENIGMA THAT FOR THE OBSERVERS STARTED BY THE BAHRAIN TESTS.\nAS FAR AS I LEARNED, THE PROBLEM HAS NOTHING TO DO WITH THE NEW DESIGN OF THE FRONT PULL ROD SUSPENSION, MUCH LESS WITH THE AERODYNAMICS IN THE STRICT SENSE SINCE IT IS COMPLYING WITH THE STABILITY REQUIREMENTS.\n\nThe extra consumption of the plank is not a cause but a consequence. The structure of the rear air does not allow the expected stiffness, which obliges you to increase the height in a closed park to protect yourself with 100kg on board. The main clue is the rear suspension, approved in July last year, together with the new gearbox.\nThe Haas shares the mechanical parts and worked well after the Australian disaster, however it does not have the performance loading platform or the sophisticated Ferrari aerodynamics. In other words, the SF-25 struggles with the excessive softness that is compromising its operation. It looks like something already seen, for example, on the old Mercedes last year. The Red in the right conditions can generate much more load than the previous car, the sprint showed what the car could do with 35 kg of gasoline. The qualification after three hours canceled expectations again, less downforce in the curve and greater instability of the rear.\n\nLoic Serra arrived in October so relatively late on project 677. The French DT has returned to Maranello and is intervening to correct its effectiveness and reliability but clearly it is premature to formulate a solution or its timing. The problem is not easy to solve, the engineers are also working on some update areas that should be introduced new parts from Bahrain.', ""Season is cooked. A situation where you can't even run the car properly without consequence is a fatal flaw. Impossible to fight for a championship like this."", 'Knew it had to be the rear since haas didnt switch to the same front layout but they do get the rear end from ferrari.', 'How do you end up in this kind of mess at the last year of regulation?', ""I will give Ferrari credit for taking a risk by bringing a new car for the last season of a regulation change. It is easy to criticize them, but they must have thought their previous car had reach it's celling.\n\nI am not going to write things off completely this season. This had been the weirdest regulation cycle. Red Bull went from all conquering to 4th fastest in literally the same season. One upgrade can make a difference."", 'From what I\'ve observed is that whenever Ferrari hit ""rock bottom"", they can _always_ go lower.']",561,141,0.97,561,2046,2046,2,0,0.0,2
1jir3j9,Red Bull not ‘defeatist’ about 2025 F1 title despite planned meeting over McLaren gap,https://www.reddit.com/r/formula1/comments/1jir3j9/red_bull_not_defeatist_about_2025_f1_title/,2025-03-24, News,,"['At the moment, it looks like McLaren is the clear top dog. The next 3 teams look close. If McLaren are hit when the inseason changes arrive, we could have four relatively equal teams.\n\nWhile the likes of Max and George are finishing in and around the podium places, they will stay in the mix. If the pecking order changes, then they will both absolutely have an outside shot at the title.', '>”Max is working harder than I’ve ever seen him. He’s more integrated into the engineering group than I’ve ever seen. As he said, he seems to be enjoying that aspect.“\n\nMy man is their only driver and also leading engineering, with a whole zoo at home and baby on the way 😭 their upgrades and driver swap better work to give his back a break', 'Dawg when you got Verstappen you in a title fight whether you want it or not lol', ""3rd in the championship with a car that needs work, their lead driver second in the championship. \nStill 22 rounds to go.\n\nPanicking now isn't required, just hard work, identifying the deficiencies and correcting them.  The season is still attainable for them, as it is for McLaren, Mercedes or Ferrari, with just minor improvements.\n\nA single diget percentage improvement in performance for any of these teams could take them all the way to the championship.\nGoing down the wrong development path, or stopping developed too soon to switch to the 2026 car, and they all can kiss the championship goodbye."", 'the wcc is impossible but for wdc honestly it seems like they just need upgrades that gives them two tenths on mcl and max would be close enough but considering rbr’s current trajectory who knows if they can even manage that', 'Last year everyone was sure it would be 2023 pt2 after the first races. If these few races end up being the ""weak period"" for Max then he\'s absolutely gonna be in the mix.', ""Why would planning a meeting be synonymous to being defeatist? Seems like it's exactly the opposite."", 'This team is insane. I wish somebody would make Succession instead of DTS with Red Bull. At least we got fanfic for that.', 'The reason for optimism…\n\nMax Verstappen.']",517,145,0.96,517,2501,2501,1,1,0.010000000000000009,1
1jjeprc,Red Bull will ‘burn’ Yuki Tsunoda in ‘pure chaos’ move warning,https://www.reddit.com/r/formula1/comments/1jjeprc/red_bull_will_burn_yuki_tsunoda_in_pure_chaos/,2025-03-25, News,,"[""If he turns down the Red Bull offer there is a pretty good chance that his career is over regardless.\n\nSo might as well give it a try. It is what he has been building towards for 5 years after all. As long as he does better than Lawson I don't think he'll be burned too bad. Nobody expects him to match Max."", ""My issue is that I don't want the switch to happen for Suzuka. Jumping into a brand new car with little to no prep for his home crowd will be depressing should he not be able to handle it as quickly. \n\nAnd I still think they should at least give Liam the triple header to turn things around. He knows those tracks, especially Suzuka and Bahrain."", ""He's probably the best-prepared Red Bull junior ever, him and Ricciardo who also got 4 seasons or so to get ready. As others have said he's likely gone anyway unless he gets into the senior team and produces some heroics."", ""At this point he's fucked if he does and fucked if he doesn't. If he does, the chances of him struggling to control that Frankenstein of a car are very high, and he probably won't do much better than all his previous predecessors of the 2nd Red Bull seat. If he doesn't, well, his career is essentially over at this point. He's got no contract for '26, and his options are dismal. Either way, things are going to majorly suck for him. Poor guy."", 'Don’t really wish this on Yuki\n\nSounds like the Redbull is a nightmare for anyone not used to it / designed for it.', 'This is his chance. It might be chaotic, but they have essentially already confirmed there is no point keeping him in Racing Bulls beyond this year.\n\nMax is not the bar. Lawson is the minimum, and Perez is the target.', 'It reminds me of Fisichella getting his dream seat at Ferrari in 2009 second half of year, bit that being a downgrade for him and he didn’t score any points and left F1 at the end of the year.\xa0', ""Its way too early for talks about sacking Lawson. RBR should let him do the triple header and evaluate him after that.\n\nYuki will be better than Lawson but he to will struggle at RBR. He struggles without a stable rear end, which the RBR doesn't have.\n\nRBR are paying the price for not giving two shits about the feedback of the 2nd driver."", ""For times like these I wish they'd let teams have test days, where drivers can rake in more mileage and teams can prepare drivers better. In the era of budget cap, I am sure teams could police themselves.""]",549,177,0.97,549,168,168,399,95,0.039999999999999925,399
1jitcgf,"Are F1 drivers tested for performance-enhancing drugs—specifically central nervous system (CNS) stimulants like amphetamines or dextroamphetamine compounds that enhance cognitive function, reaction time, and sustained alertness?",https://www.reddit.com/r/formula1/comments/1jitcgf/are_f1_drivers_tested_for_performanceenhancing/,2025-03-24, Discussion,"I’ve always found it remarkable how F1 drivers maintain extreme levels of neuromotor precision and cognitive flexibility throughout a race weekend—across sprint sessions, qualifying, and full race distances. The consistency with which they adapt to ever-changing track conditions, car balance, and tire strategies is almost superhuman, especially for drivers with highly sensitive setup preferences.

Given the massive financial stakes involved—tens of millions for teams and potentially billions in sponsorships and branding—it’s hard not to wonder just how rigorous the FIA’s anti-doping protocols truly are. Are they genuinely strict, or is there a level of willful ignorance when it comes to substances that boost cognitive endurance and reaction times?

Also, a physiological observation: post-race footage often shows drivers with injected, bloodshot sclerae and facial flushing—classic signs of heightened sympathetic nervous system activity, catecholamine surges, or even potential stimulant use. Of course, this could just be from adrenaline and dehydration… but could it be something more pharmacological?

Curious to hear others’ thoughts—especially from those with a background in sports medicine, neuroscience, or motorsport governance.","[""In GP3 or F2 (I can't remember which) there was a rumor they drug tested Leclerc more than any other driver because they thought his performance was impossible lol.\n\nI'm pretty sure every staff member and driver gets tested. It's incredibly controlled."", 'F1 drivers are drug tested. This has been shown on documentaries in the past and I thought DTS as well. \n\nhttps://en.wikipedia.org/wiki/Doping_in_auto_racing', 'Max told a story on a Team Redline broadcast last year that he was woken up very early one morning at one of the European races by doping control to drug test.  He didn\'t seem happy about it.  LOL.  It was around the time of the great ""I\'m going to sim race all night"" scandal.\n\nEdited because someone already mentioned the Charles story.  :D', ""Yes, they undergo random drug testing like majority of athletes. And the reason they look like that after the race is because of dehydration, exhaustion and the insane heat inside the car. The reason they keep a bag of dry ice inside the car right until the formation lap is because on hot race days, the interior temperature could hit 50C. Their suits protect them, but it's still hot af. They lose weight during each race, and their drink systems malfunction often. Checo's water stopped working on formation lap in Austin 2021, man looked like a wet sponge after the race.\n\n[https://www.fia.com/anti-doping](https://www.fia.com/anti-doping)"", 'Good question. Yes, they are: https://www.fia.com/anti-doping', 'Better question, when was the last time someone at the F1 level got caught?', 'Yes. Good article on it: [https://www.motorsport.com/f1/news/analysis-why-f1-doesn-t-have-doping-scandals-666534/666534/](https://www.motorsport.com/f1/news/analysis-why-f1-doesn-t-have-doping-scandals-666534/666534/)', 'Too add this, can you get a waiver if you have a diagnosed condition. Like I have ADHD, would I be allowed to still take Adderall if I got an F1 drive?', 'I think F1 drivers are just wired differently. \n\nOn Top Gear they had F1 drivers drive a basic commuter car around a track. They looked so bored. They were adjusting the radio and looking out the window and were still making great times. \n\nWhen civilian celebrities drove the same car on the same track they were concentrating so hard and look stressed but set very slow times. Some celebrities set pretty impressive times (Matt LeBlanc) but he also concentrated.']",330,206,0.87,330,3320,3320,8,1,0.010000000000000009,8
1jj20oz,Any q's for the pundits?,https://www.reddit.com/r/formula1/comments/1jj20oz/any_qs_for_the_pundits/,2025-03-24, Social Media,,"['To Ferrari: how?', 'What do the drivers taste like? \n\nSince what do the drivers smell like was asked last week, this feels like the next question to ask.', ""Why does Sky not have a service package that includes F1 only? I don't care about football or any other sports you have. I just want to watch F1 and I don't want to overpay."", ""Is it harder to commentate on a boring race where nothing is going so therefore there's not much to talk about, or on a chaotic race where there's so much happening that you can barely keep up?"", 'When is it actually going to be the year of Ferrari?', 'Over the years we have seen many former f1 drivers become race commentators, either as guests or even as a full time job. Wich one of the current drivers would make the best commentator?', 'How does the knight move?', 'Grill the Grid: Commentator Edition when?', 'Does George Russel have a genuine shot at the driver championship if Mercedes bring the right upgrades?', 'What do Sky Sports pundits think of the idea that the Racing Bull could be faster than the Red Bull.\n\nIn Australia Yuki qualified one tenth off of Max. However many would say Max is expected to be more than one tenth quicker than Yuki so was that made up time the Racing Bulls faster car?\xa0\nIn qualifying in China Hadjar was two tenths off Max. Most people would say that in an equal car Max would be a lot more than two tenths ahead of Hadjar.\xa0\nAlso last season, for the six races Yuki and Liam were team mates Yuki was better but it was close. This year there is a chasm between them.\xa0\n\nOn top of that the general consensus Ive seen on here is that Lawson might perform better in the Racing Bulls car, but yet they still say Red Bull is faster.\xa0\n\nSo take a fast driver that is not Max. Let’s\xa0\xa0say Leclerc. Put Leclerc in the Red Bull and then the Racing Bull, which does he perform better in? I actually think it would be the Racing Bull.\xa0\n\nI think the only argument that Red Bull is better is that it is set up for Max and that if he were in a Racing Bulls he would not be as fast. Unfortunately it is hard to tell weather this is true or not as Max has spent practically his whole career in Red Bull. Personally I think that Max’s set up is a factor but perhaps not to the same degree that some people argue.\xa0\nI also think for example that Verstappen would have likely put more than two tenths on Hadjar Im China qualifying if both were in Racing Bulls. Thus Max would have set a faster time in the Racing Bull.\xa0\n\nThere is also the argument to consider that Verstappen could also make set up changes to suit him on the Racing Bull which would make it faster for him. \xa0\nSo overall I would say that in qualifying pace Max would set faster times were he in the Racing Bull. Race pace is harder to say because there is usually a bigger gap between Max and the Racing Bulls. In fact race pace has been Red Bull’s big strength since the new ground effect era began in 2022.\xa0\nEither way it would be so interesting to see and it would be very telling about the performance of the two cars and Max himself’s talents (Were he to jump into the Racing Bull and put a huge gap on Yuki and Hadjar, people could no longer argue Max is only good because he sets up his car so his team mate can’t drive it.\xa0']",259,229,0.86,259,2215,2215,16,3,0.0,16
1jjf7fs,"Carlos Sainz post-race interview: ""One of the strangest swings of performance that I've had in my career. From naturally and super quick in Bahrain and Abu Dhabi, begining of Australia, and then suddenly the pace has just seemed to fall away from me.""",https://www.reddit.com/r/formula1/comments/1jjf7fs/carlos_sainz_postrace_interview_one_of_the/,2025-03-25, Video,,"[""He'll get there, taking a few races to adjust, no worries."", ""I think it might just be the fact the Williams has been known to be very inconsistent in terms of balance across different conditions and sessions in the past. Usually things like wind direction could throw it off massively. \n\nI remember a lot of times since 2022 where Alex would look fast in practice and then end up having a terrible qualifying, or the reverse and they'd look off it all weekend and suddenly he's in Q3."", 'He heard there is a chance for that RB second seat and thought that if his performances are subpar he’ll snatch that seat.', 'I hope he finds his pace back with the car and the team figures out the best car set up for him.', 'I just think Albon is much better than people realise, and Carlos is still adjusting. They’re pretty close in terms of quality I’d say.', 'Carlos is so real. He just says what’s happening. Is there a chance that he has a cracked chassis because that is hard to detect and can hold back a cars pace.', ""Could it be that it wasn't clear to him that he was off the pace until Albon switched on for the season, and shown Sainz what the Williams could actually do?"", 'Hope carlos gets his smooth operator back, If anyone can do it he can!', ""Hope for his sake it ain't a Ricciardo moment."", ""No one doubts this guy at all. It's just orientation, I'm sure we will see mega performances soon.\n\nScoring points in 5 different teams makes him one of the most consistent and best F1 drivers out there.""]",360,44,0.99,360,44,44,360,44,0.99,360
1jj2lv4,How V10s are becoming F1’s main political battleground,https://www.reddit.com/r/formula1/comments/1jj2lv4/how_v10s_are_becoming_f1s_main_political/,2025-03-24, News,,"["">There’s at least one outspoken V10 fan: [Max Verstappen](https://www.motorsport.com/driver/max-verstappen/17529/). Asked in Shanghai whether he might stay in F1 longer if the sport went that way, he replied: “Maybe. Yeah. It's definitely more exciting than what we have currently.”\n\nYou best believe Red bull have even more reason to push for this"", 'Give me smaller car and v8 engines.', '“Hey, so we’re going to freeze the engines for 4 seasons so you guys can prep for the 2026 engine regulations that will run for 5 seasons. Never mind the way this leads to a manufacturer being stuck with an FIA confirmed deficit that they can’t fix, we need to do this early so that Red Bull can prepare for Honda leaving. Anyway, all our new teams need to show they bring value to the support so we’re going to insist they bring a committed engine partner with them, sorry Mr Andretti but you need to get someone on board. Actually, let’s change it now you’ve invested all that money and development time - I need to say something the public likes about V10 noises and I hear some of you did a shit job on the engine regs. So like… 3 years maybe? Idk if we’ll freeze it and lock in your shit job though.”', ""Ultimately I'd love to go back to smaller, lighter, cheaper engines, but to do so half way through the current regs would be a spit in the eye to all the current manufacturers and teams who have invested time and money in what they were told the regs were going to be.\n\n\nEnd of the current engine regs, I'd say go back to high-revving IC engines with sustainable fuels, and if the major engine manufacturers aren't willing to play with that, Ilmor or Mecachrome will happily build a racing engine for anyone who contracts them to."", 'Pivoting to a V10 engine so quickly after putting in new engines regs that manufacturers have sunk hundreds of millions of dollars and tens of thousands of hours into is not going to create and foster an environment for growth for the sport. It’s a sure fire way to piss off a lot of people who are keeping this sport afloat. This just comes across as MBS doing whatever he can to gain popularity to retain his position.', ""It's stupid. The regs were decided a long time ago, teams joined because of that, teams have designed engines. Too late."", ""My honest opinion:\n\n* New engines will stay until 2029 or 2030 (not before like 2028).\n* Then, they will switch to V8 NA with ERS and sustainable fuels as a compromise between manufacturers who want some sort of road relevance (Audi, Mercedes & Honda) and those who don't care it so much (RBPT-Ford, Ferrari & Cadillac).\n\nPD: As far as I know, Mercedes is open to discuss that and I think Honda too. Audi is the only one that has been against that at least in public."", ""When I listen to the old V10 era cars it awakens something primal in me, from a time when I still got genuinely excited about F1 racing. I've been watching for 30 years, since I was a boy, and the sound of the cars was everything about F1, when the 2014 cars came along I was quite deflated at how they sounded.\n\nF1 is still awesome, but they need to bring back the cars sounding special, Bernie was right about that one even if the 2014 engines seemed like the right business move to keep the manufacturers happy. With that said, can't see manufacturers being thrilled about this V10 talk, I doubt it happens."", ""If sustainable fuel production became a reality for consumers then a pivot to ICE engines would make more sense, particularly for auto manufacturers as it keeps their messaging consistent.\n\nIt does sound like we should wait a few years for projects like [Porsche's eFuel project in Chile ](https://www.topspeed.com/porsche-synthetic-fuel-gamechanger/)to scale up, then completely rewrite the regulation rulebook to remove hybridisation and greatly reduce the car's physical footprint through aero changes. \n\nLet's get back to small F1 cars.""]",227,131,0.92,227,863,863,6,4,0.0,6
