unique_id,post_heading,post_url,publish_time,tag,post_content,top_comments,upvotes,comments,upvote_ratio,score,total_upvotes_comments,total_score_comments,upvotes_growth_rate,comments_growth_rate,upvote_ratio_growth_rate,score_growth_rate
1jh4f0f,Do people genuinely think Racing Bulls are faster than Red Bull?,https://www.reddit.com/r/formula1/comments/1jh4f0f/do_people_genuinely_think_racing_bulls_are_faster/,2025-03-22, Discussion,"It started as a joke but I genuinely see so many people taking it seriously and calling Red Bull a tractor and that is 5th best and its only because of Max it's high.

Is it just because of Lawson underperforming? Would everyone still say the same if it was Lawson in P7 instead of Hadjar? 

Isn't a car being harder to adapt to or drive not the same as being a tractor or slow?","['faster? nah probably not.   \n\ninfinitely easier to drive? 100% if max is struggling to drive the dam thing lawson has no chance.', 'It seems like a much more “benign” car. Neither Liam or even Max are having a fun time driving the RB right now, you can tell the difference when comparing Hadjar and Yuki’s onboards to Max', ""Faster? Not necessarily.\n\nEasier to drive? Definitely. Both Hadjar (except for the outlying Australian GP) and Tsunoda seems to be very comfortable in their car while we've seen Verstappen struggle with his and only outdriving it with his skills.\n\nRed Bull losing so many of their technical staff and a inability/refusal to accept that their car isn't easy to drive for anyone else except Max (and even he's struggling) tells more about the picture than anything.\n\nRed Bull lost alot with their power-vacuum struggle and I'll believe they'll continute to struggle unless Horner/Marko and perhaps the Thai-ownership will step away."", 'I think Red Bull has more peak pace, but it is very very hard to drive it.', ""Liam was closer to Yuki in a RB than in a Red Bull.\n\nThe Racing Bull probably doesn't have the sensitivity that Max likes the car to have, but he probably wouldn't qualify much worse. The race may be a different story though."", 'I think Red Bull is just a lot of harder to drive', 'I just want max and yuki to swap seats for one weekend so we can see how fast Max can go with that vcarb and how yuki compare to Lawson in the top team', ""I think if both Red Bull drivers did qualifying twice with the two cars each, then the order would be Max in Red Bull> Max in Vcarb> Liam in Vcarb> Liam in Red Bull. There's absolutely no way the VCARBS are faster in pure pace than Red Bull, but they possibly might be easier to drive and extract pace from. I think most people are basically implying that...or memeing.\n\nEdit: I also agree with what some people have said in the comments...these comparisons or presumptions only really apply to one lap pace, this won't be the case for the race. However it's likely that is also something Liam will struggle more with race pace with the Red Bull than he possibly would in the junior car, due to a lack of confidence in pushing the car, as opposed to the car actually not having pace."", 'If he was in P7 I would say its just him not being used to the Red Bull twitchyness yet, considering how close Liam and Yuki were in the same car last year when Liam got thrown in mid season.\n\nMax and Liam are both wrestling the car around most of the corners it seems and the on boards for the both isaac and Yuki the car seems far more settled']",67,140,0.82,67,134,134,2,6,0.0,2
1jgzk2x,"F1 HOT or NOT - rate drivers, teams and the race for the 2025 Chinese Sprint!",https://www.reddit.com/r/formula1/comments/1jgzk2x/f1_hot_or_not_rate_drivers_teams_and_the_race_for/,2025-03-22, Statistics,,"['Holy shit lando wtf was that\n\n\nAlso holy shit Lewis wtf was that.\n\n\nWhat happened to the mythical pace of the McLaren. That shit dropped off for both drivers. Even Oscar was dropping a second a lap', 'HAM, TSU, STR hot.\n\nNOR and DOO not.', 'I know it won’t last because it never does but damn it’s nice when Lance is good', 'Hot: Lewis, Tsunoda, Stroll', 'Williams not :(\n\nLeft front, very', '#RED FUCKING HOT - HAMILTON AND STROLL', 'Not - The TV directing, genuinely did my head in how often they cut away from battles at the front', ""When Stroll is on he's ON. I hope this keeps up, it's nice to see Stroll's flashes of brilliance. Holding off Norris for half of the race was super impressive"", 'Hot: Hamilton, Piastri, Verstappen, Tsunoda, Stroll\n\nNot: Leclerc, Norris, Sainz, Sauber, Doohan']",66,77,0.85,66,73,73,-1,0,0.0,-1
1jh62oy,Lawson's Red Bull seat already at risk after disastrous start,https://www.reddit.com/r/formula1/comments/1jh62oy/lawsons_red_bull_seat_already_at_risk_after/,2025-03-22, News,,"[""I mean I am usually from the lenient people saying rookies need time. And usually think RB are too harsh on them. \n\nBut that's a hell of a disaster start. Firing him after 2 races would be stupid. But already doing some work to do it after 8/10 races if nothing changes honestly makes sense."", 'It will be a disaster for Yuki if they suddenly decided to promote him to the main team, I doubt they will have the time to fine tune the car to him in a few races.', 'Yuki: looks like I might finally get my chance to drive the red bu- wait why is ricciardo here?', 'It’s been a disasterclass, so yuki wins and hadjar goes to redbull?', 'If I were Hadjar or Yuki, I’d politely decline the promotion. This can be strategically the correct decision in many workplace situations.', 'And here we all were thinking Doohan was going to be the one cut before summer break.', 'he is not a rookie at all tbh…\n\nremember when all of us wanted to swap checo for another driver because we thought it couldnt get worse? well, here we go lol', ""On the one hand you feel for Liam (being under huge pressure, after the quick junior team promo), and feel he should be given chance to pickup form.\xa0\n\n\nOn the other hand this is championship team that won the drivers championship 🏆 last year & experimenting is weighing down WCC bonus. Anyone know if Liam is Dr Marko's or Horner's pick? The fact Christian didn't defend him much makes me wonder if it's Dr Marko's.\xa0"", 'Between Marko being one of the biggest pos in the sport and Horner asking his female coworkers if he can ‘blast’, I don’t see Max staying in this shit show much longer. \n\nI don’t blame Liam as I think the second car on this shit show of a team is a doomed situation for anyone. Yes Yuki earned the seat over Liam, but I don’t think Yuki would be earning points or getting out of Q2 if he was in the seat. Lawson is just another failed young second car red bull driver to add to the list. They should of never lost Sainz (originally and this off season).\n\nI think Max leaving would trigger a full rebuild of the staff which the team desperately needs.']",70,79,0.88,70,75,75,16,8,-0.010000000000000009,16
1jh5e7m,Red Bull Debutants: First Two Grand Prix Qualifying Results,https://www.reddit.com/r/formula1/comments/1jh5e7m/red_bull_debutants_first_two_grand_prix/,2025-03-22, Statistics,,"['Christian Klien mention🔥🔥', 'Lawson > Verstappen confirmed', ""Klien was woefully underrated / frustratingly never showed his true potential. \n\nAnd Webber's qualifying prowess in 2000s was insane. Wish he got to BMW Williams one year earlier."", ""Who's Max Vertstappen?"", 'It’s funny neither of Albon’s first 2 qualis were normal, first in Spa he took an engine penalty so was last anyway and in Monza was the infamous traffic jam where no one got to set a 2nd time', ""Such an unfortunate baseless stat. Will be interesting to see if engineers and Lawson will rise up to the challenge or it's only GP and Max show"", 'I have seen enough Red Bull should offer this guy Sebastian Vettel another contract, he will win as many as WDC as Max I bet.', 'Vertsappen p21 on his 2. Race lol hes never gonna do anything in f1 thats for sure', 'Babe, wake up. New version of Checo stats just dropped']",68,22,0.87,68,20,20,7,0,0.0,7
1jh0o3i,Will there be enough tires for tomorrow?,https://www.reddit.com/r/formula1/comments/1jh0o3i/will_there_be_enough_tires_for_tomorrow/,2025-03-22, Discussion,"Considering the mediums were dead after 12-14 laps for most drivers and there are only 2 sets of hards allocated I imagine tomorrow's going to be a major tire conservation race. Pirelli is forecasting the hards to be good for 23 laps so we're certain to see a 2 stopper but how many teams can actually make their tires last long enough?   
  
[https://press.pirelli.com/a-chinese-weekend-that-presents-many-challenges-as-well-as-something-new/](https://press.pirelli.com/a-chinese-weekend-that-presents-many-challenges-as-well-as-something-new/)","['To me that is a good thing. I love races where the tyres properly degrade and it forces teams to go for 2 or even more stops.', ""Nope. I think it's going to be a mess. I'm so excited."", 'The first 15 laps will look like the average Singapore race, drivers driving slow as fuck to preserve the hell out of their tyres.\n\nRace will develop in the second half after the pitstops, the first stint will be a snooze fest', 'It will be tyre management fiesta tomorrow. Drivers will not follow each other closely to preserve tyres. It might be pretty boring in terms of on track racing, but strategies and pit stops should be interesting.', 'VCARB be like ""We\'ll make Yuki do 40 laps on softs since there are only 2 sets of hards and no new mediums""', ""According to lap-by-lap everyone's tyres today were used, Verstappen had 3 laps ran and Hamilton had 8\n\nBased on tyre allocation teams should likely have 1 fresh medium and 2 hards left"", '56 laps so, if you could get 15 laps on mediums, in a full race you might actually be able to go two sets of mediums (15 laps each) and one hard, right? Inevitably as the track rubbers in tyre degradation will slow.\n\n\nMy question is if anyone will start on the hard compound hoping for a safety car to harvest that free stop. That I think is the ""Hail Mary"" mid-field strategy.', 'With extra fuel tomorrow adding more deg at the start, pitting for an undercut into fresh air will be a major advantage if someone pulls it off. Carlos was lapping 2 seconds faster than the leaders after his stop during the sprint', ""I just hope both Ferrari and Racing Bulls do not make stupid pit in time like the Aus race lol... Otherwise, I'm sure K1 won't save the Ferrari strategist from being hammered by Lewis and the ice latte won't save the Racing Bulls strategist from getting his Italian pizza with pineapple topping lol\\~""]",62,47,0.88,62,44,44,0,0,-0.020000000000000018,0
1jh3qwi,Oliver Bearman has been summoned to the stewards for alleged impeding of Lance Stroll,https://www.reddit.com/r/formula1/comments/1jh3qwi/oliver_bearman_has_been_summoned_to_the_stewards/,2025-03-22, News,,"['Lawson might move up to P19', 'Nothing for the VCARB release on the RB?', ""Seems like Ollie needs to become a little bit more aware when not on a flying lap, as its not the first time this season already that he's been flagged up for impeding."", 'No further action incoming', 'Document probably still getting prepared. Last I saw was a race control message saying to be investigated after the session. Unless I missed a no further review message, we should see the summons soon.', '[Hadjar summons is now online fyi](https://www.fia.com/system/files/decision-document/2025_chinese_grand_prix_-_summons_-_car_6_-_alleged_unsafe_release.pdf)']",55,7,0.95,55,6,6,-2,0,-0.010000000000000009,-2
1jggkkf,Sprint Qualifying and FP1 Analysis,https://www.reddit.com/r/formula1/comments/1jggkkf/sprint_qualifying_and_fp1_analysis/,2025-03-21, Statistics,,"['Is crazy how Lawson was usually regarded as great at adapting in the junior series, maybe not the peak fastest, but you knew he would take advantage of his pace earlier than many, but here, he seems like Sargeant 2.', 'this year', 'Important caveat is that both Alpines got screwed by traffic in SQ because the engineers sent them early and out of sync. Gasly lost 4 tenths in S1 alone due to this.\n\nTheir car performance is better than this graph suggests.', 'The Alpine one is not a true picture of their pace, Gawly got totally screwed by traffic,  lost 0.6s due to others cars', ""That Merc race pace gives me hope. \n\nMaybe George can do his thing and put the car higher for Sunday's race"", 'Race pace is crazy, hopefully not a picture of how the rest of the year will look like', 'This just shows what kind of driver Max is. Give him that McLaren and he wins +15 races again this year.', 'He hasnt crashed yet.', 'He already did that with a red bull until his ""magic"" brakes were banned']",56,18,0.88,56,113,113,2,0,0.010000000000000009,2
1jh2xm4,2025 - Chinese GP: S (3 pics),https://www.reddit.com/r/formula1/comments/1jh2xm4/2025_chinese_gp_s_3_pics/,2025-03-22, Statistics,,['That Red Bull treats its tyres like Jos treats Max'],55,2,0.97,55,1,1,-1,0,0.0,-1
1jgtq6a,Alex on the struggles of being RB's second driver while contrasting his driving style with that of Max,https://www.reddit.com/r/formula1/comments/1jgtq6a/alex_on_the_struggles_of_being_rbs_second_driver/,2025-03-21, Video,,"['He’s got a good head on his shoulders. I am really rooting for Williams this year. The driver lineup is one of the key reasons\xa0', ""Plenty of trauma bonding must have been had for all the ghosts of Red Bull's past. Really hope Albono goes far this season"", ""I like what Lawson said about this in the F1 podcast posted pre-season. It's up to the driver to drive the car you're given. If you're good enough then it's not an issue."", 'well, well, well']",50,5,0.91,50,4,4,2,0,0.010000000000000009,2
1jh1xy6,"Eddie Jordan was one of F1’s biggest characters, we’re all going to miss him | Formula One",https://www.reddit.com/r/formula1/comments/1jh1xy6/eddie_jordan_was_one_of_f1s_biggest_characters/,2025-03-22, News,,[],50,1,0.88,50,0,0,1,0,0.0,1
1jgpqq7,F1 drivers have held ‘fair discussion’ with FIA over swearing rules,https://www.reddit.com/r/formula1/comments/1jgpqq7/f1_drivers_have_held_fair_discussion_with_fia/,2025-03-21, News,,"['I wish Kimi was still here so they could ask him about this shit', 'This whole thing is so dumb.', ""I'd say something, but the FIA would just give me a $10,000 fine..."", '![gif](giphy|4vYksifnc7Sw)', '""It was a fair discussion: we were very careful with our words, and in return no fines or race bans were handed out""', 'no fucking way, you simply can’t have a “fair discussion” with those bastards', 'Bullshit.', 'Yeah, and Grizzly Adams had a beard /s', ""The more they're told not to swear, the more noticeable and tempting it'll be especially in the heat of the moment. Like trying not to eat the forbidden fruit. It's just even blown up than it should be and I would hate to sit in this kind of meeting and having a dialogue about it when it's clearly dictated by the FIA themselves.""]",46,32,0.83,46,211,211,-5,0,-0.010000000000000009,-5
1jh48sb,DOC 55 - Summons - Car 6 - Alleged unsafe release,https://www.reddit.com/r/formula1/comments/1jh48sb/doc_55_summons_car_6_alleged_unsafe_release/,2025-03-22, News,,"[""I'd expect it to be a 5000 Euro fine or something no? More team fault, than driver. The guy who ushered Hadjar out didn't even bat an eyelid or look back when Max had to swerve to avoid Hadjar. Cool cucumbers."", 'Hadjar is expected to receive the harsh but fair punishment of being the 2nd Red Bull driver', 'This is a slam dunk pen no?', 'It was slam dunk right', ""I mean, it's a pretty obvious one"", 'Please have mercy he is just a rookie let it go', '""Alleged""', 'Yeah this was pretty open and shut case. Sucks for Issack. \n\nHe knew he would be getting a grid drop nrvshse his post race interview he was downbeat despite putting it in the top 10.', 'Oooooh the humanity! Have you no heart?!? 😭']",49,20,0.94,49,19,19,3,0,0.0,3
1jgnmq5,What to Do With F1 Season Reviews on VHS?,https://www.reddit.com/r/formula1/comments/1jgnmq5/what_to_do_with_f1_season_reviews_on_vhs/,2025-03-21, Discussion,"TL;DR I have a collection of F1 season reviews on VHS that I don't want to just throw away. Not looking for any money. How can I get these to someone who would appreciate them?

I have years 1998-2001 on tape. Just dug them out of storage. I buy the season review every year and now have 1970-current on DVD.

Back in the day, pre-internet, you had to call Duke Video in England, talk to a live person, and make sure they convert the tape from PAL format to the US-friendly NTSC standard (an extra fee). With shipping they were quite expensive. 

I'd wait weeks for them to arrive, then gleefully pop them into the VCR to enjoy. 

And now I've got this mini collection and nothing to do with them. I have no desire to list them on eBay or make any money off them. I just really would like them to go to a fan. 

Any ideas?","[""Post this on r/datahoarder. They're a bunch who backs things up for the hell of it, maybe there's an F1 fan there who'd like to preserve what you got. What you got is a niche but valuable trove, it'll be awesome if the whole thing gets digitised by a peer to be shared among peers."", 'Convert them to digital and upload them....well somewhere. Internet Archive is always a solid bet. But also here would work', ""As some said... convert them or donate them to someone who will convert them. Plus they are an awesome part of any collection. I would put them right behind my f1 car collection, I have a capture device for VCRs. EDIT: don't have a VCR tho."", ""I do video digital capturing/restoration and AI upscaling/cleanup as a part time business. Happy to do it for you if you're down to cover the shipping or can give you a guide on how to do it yourself. DM me if interested."", 'Upload them to YouTube!', 'Vhs to dvd recorder and then upload', 'FWIW, many if not most of the Season Reviews are already available on YouTube. Maybe check and see if your copy has differences and if not then you likely don’t need to worry about backing them up for posterity. If you want your own back up, then that’s another story and you should just go for it!', 'I really appreciate all the comments! I don’t have the time or equipment to convert to digital, and I already own all of them on DVD. I just posted them for free on FB Marketplace. Hopefully someone will come pick them up. I’d even ship them if someone would cover postage.', 'I would check with a 49ers and/or Cowboys fan for help in this area.']",45,14,0.92,45,153,153,-2,0,-0.010000000000000009,-2
1jh42x9,Last 10 years in one graph,https://www.reddit.com/r/formula1/comments/1jh42x9/last_10_years_in_one_graph/,2025-03-22, Statistics,,"['Loreal', 'That Haas bottom out in 2021 lol', 'that brief period in 2018 when ferrari was fastest aahhhh.... it still hurts', 'What is the Y axis supposed to represent?', 'What the hell happened in 2020?', 'What does the Y axis represent', 'Sauber like a plane crash', ""It's based on best result in each GP. For this graph results are heavily averaged out over several GPs so it would be less chaotic."", ""Wonder if that's the perfectly legal totally not cheating engine being banned.""]",48,12,0.89,48,11,11,6,2,0.030000000000000027,6
1jh6lbc,Analysis: Why Lawson is so much slower than Verstappen,https://www.reddit.com/r/formula1/comments/1jh6lbc/analysis_why_lawson_is_so_much_slower_than/,2025-03-22, News,,"['_“In terms of driving styles, I don’t really know if I believe in it so much in terms of a driving style_\n\n_“I think you have certain things you like a car to do but I think also, for me, I spent a lot of time developing that car as well, as a junior and as a reserve for the last couple of years, and I feel like I understand quite well the way the car drives._\n\n_“But I also don’t fully believe in ‘This doesn’t suit your driving style’._\n\n_“I think as drivers, we’re professionals, we have to adapt to whatever we’re driving.”_\n\n\n-Lawson’s own preseason comments.', '30kph slower halfway through the first corner. Wow.', ""He doesn't seem confident at all in the car."", 'The problem isn’t that he’s slower than Verstappen. That’s going to be a given for the 2nd RB seat, Max is Max. The problem with Liam is that he’s so much slower than the rest of the grid.', 'Max gave us the answer to this conundrum years ago man.\n\nThe answer was always Hulkenberg.\n\n2020: [https://www.planetf1.com/news/max-verstappen-wants-nico-hulkenberg-as-team-mate](https://www.planetf1.com/news/max-verstappen-wants-nico-hulkenberg-as-team-mate)', 'Not a lawyer, but surely that cookie banner is illegal af.', ""Good read,. impressed that they've got a decent analysis of Lawson's struggles this quickly after qualy tbh. Yeah, he needs a private test or something to fundamentally build confidence in driving the car close to the limit because at the moment the pressure of the world watching and ridiculing him isn't doing him any favours."", ""From Liam 'I beat him in the junior series' Lawson to Liam 'it is just the time, unfortunately I don't really have time' Lawson. \n\nHe really needs to regain confidence, this is a speedrun for the almost obligatory 2nd RB driver annual topic discussion."", ""Well obviously he's underperforming, and having a difficult season start, but I think he's also had a lot of things stacked against him, aside from having Max as a teammate. Also the fact that Max has to drive the shit out of the car just to get into Top5 says enough about how difficult the car is.\n\nMajor one being he's really not comfortable with the car, but on top of that he had race pressure in Melbourne with missed practice, and only a week later added pressure in Shanghai with very tight laptime spread and gusting and changing winds whilst still trying to get to grips with the car, on unfamiliar tracks. \n\nBut no excuses, he needs to step it up and do so quickly before Helmut gets his boots out.""]",41,45,0.85,41,40,40,6,7,-0.020000000000000018,6
1jh69tl,Oscar Piastri's Pole Lap | 2025 Chinese Grand Prix,https://www.reddit.com/r/formula1/comments/1jh69tl/oscar_piastris_pole_lap_2025_chinese_grand_prix/,2025-03-22, Video,,"[""He wasn't kidding with the hairpin, that thing hooked up like crazy on the exit."", '(r/F1POVs)', 'Right about the hairpin, but that run through T13 was sublime', 'For the first time for the McLaren all weekend.']",49,5,0.96,49,4,4,14,2,-0.010000000000000009,14
