unique_id,post_heading,post_url,publish_time,tag,post_content,top_comments,upvotes,comments,upvote_ratio,score,total_upvotes_comments,total_score_comments,upvotes_growth_rate,comments_growth_rate,upvote_ratio_growth_rate,score_growth_rate
1p0wphm,Just a few world championships between them,https://www.reddit.com/r/formula1/comments/1p0wphm/just_a_few_world_championships_between_them/,2025-11-19, Social Media,,"[""Every WDC, except for 3, have been won by one of these 4 since 2005. Also, haven't seen Hamilton that happy all season."", 'All the time you have to leave da space!', ""Alonso: stays away from Seb while Lewis and Max doesn't.\n\n\nF1 fans: Does Vettel still hate Alonso, he's not giving the same respect as he did for others\n\n\nOr\n\n\nF1 fans: Does Alonso hate Vettel, is he still salty about 2012. No daddy drip Alonso"", ""It's strange to see Lewis's smiles actually reach his eyes. Seb should come to the races more often."", 'Damn look at the neck muscle atrophy after you retire!', 'I miss the Seb Lewis friendship on the grid. I also miss the Seb Lewis rivalry of 2017/2018', ""17 in total ain't bad."", 'Happiest Lewis has been all year', '23% of all F1 World Championships in history right here', ""Look at Lewis's smile. \n\nFirst time I remember seeing him happy while wearing red.""]",5423,112,0.97,5423,3968,3968,129,0,0.0,129
1p15wh1,[SkySportsF1] Jenson Button believes Ferrari chairman John Elkann should have talked to Charles Leclerc and Lewis Hamilton rather than criticising his drivers,https://www.reddit.com/r/formula1/comments/1p15wh1/skysportsf1_jenson_button_believes_ferrari/,2025-11-19, Social Media,,"[""Yeah, so he's got an issue with his drivers fronting the media and airing their problems so he..... fronts the media to complain about it?\n\nGrow up, the drivers own the hearts of the fans, how did you think this was going to go for you?"", '\nImage source: [SkySportsF1 on Instagram](https://www.instagram.com/p/DRPGiF3lzgi/?img_index=2)\n\n\n**Jenson\'s full quote to the question about Elkann and his statements:**\n\n\n>*""They have always had the pressure to perform, every F1 team does. But especially Ferrari. You\'ve got the whole of Italy wanting Ferrari to win races. So there\'s a lot of outside pressure and internally for the whole team, that\'s for everyone in that team. So, I get it. There\'s a lot of pressure. But, I mean, John only has two cars in the red garage. It\'s very easy to find your racing driver and go and talk to him and say* ***""You know what? That\'s not cool. That\'s not the way we do business. That\'s not the way we work as a team.\xa0 So let\'s talk about why you need to do that. Why do you feel the need to be sending so and so this and that.¹ I get it you are trying to help, but this is always been at Ferrari and yes, we might be willing to change but let\'s talk it over.""***""\xa0\n\n\n>*""Communication. Communication is the best thing in anything, but especially in a team when you have thousands of people working to develop a car and you\'ve got two drivers that are two of the best in the world. Just go and have a chat. They have alot of experience as well of racing for the best teams in the sport.""*\n\n\n¹ ^(this is regarding Lewis saying that he offered suggestions via documents to members of the team)\n\n\nSource: [The F1 Show podcast on Sky Sports F1](https://www.youtube.com/watch?v=lhwQWDb-cKA)', ' Ferrari has a history of having issues due to having egoistical  chairmen. Montezemolo decided to rock a steady boat with Schumacher, Todt and Brawn at helm because he was hurt and affraid due to him not being as revered as the aforementioned trio and because he started to lose the political power within the team. So he gave Schumacher an ultimatum to either drive alongside Kimi or to retire.  Afterwards he got rid of Kimi to get Alonso and there were also rumors of Ferrari wanting to get rid of both Massa and Kimi in 2008 due to them underperforming in the eyes of the team.\n\n\n\nAfter a certain amount of time, Alonso had enough of Ferrari\'s ""mishaps"" so he started to criticize the team and to flirt with RBR by openly wishing to get a RBR car as a Christmas gift.\n\nThat had ruffled Montezemolo\'s feathers so he opted to rehire Kimi as a sort of punishment for Alonso\'s missbehaviour and started to hold talks with Vettel to replace him.\n\nJust as Vettel had started to drive for Ferrari, Montezemolo gets pushed out and replaced by Marchionne.\n\nVettel being Montezemolo\'s signing  didn\'t really receive the love and support from Marchionne who even decided to hire Leclerc because he wasn\'t sure that Vettel was as good as he was perceived due to Kimi not being a proper benchmark. \n\nMarchionne dies, Elkann takes over. Elkann shifts the team dynamic over to Leclerc which resulted in Vettel not having his contract renewed and Sainz being Elkann\'s signing.\n\nSame Elkann gets rid of Sainz to sign Hamilton while offering him a fruitful deal so he could boast about how he had signed statistically the best F1 driver to ever grace the sport.  The team as a whole underdelivers and what does he do? Starts taking shots at his drivers by telling them to shut their mouth and to up their driving game.', ""Talking to employees???\n\nThere's like over 20 positions inbetween that have to deal with the menial tasks!\n\nThe CEO has more important things to worry about. Like working 24/7 by going to dinners and parties. That's where everything happens!"", ""Jenson my friend, you really don't how *Ferrari* operates, they will rather blame someone than fix the issue."", 'Just when everything was going so well for Ferrari, here come Leclerc and Hamilton to ruining it all with reality...', 'Silly Jenson trying to rationalize the weird shit that happens in Ferrari smh', ""I don't think John Elkann should even be bothering with the drivers. The drivers should be answerable to the team principal. I understand he's funding the team but if the team doesn't have any autonomy then nobody in the team they will have a feeling of ownership in the success of the team.\xa0"", 'That interview from Elkann was and is still disconnected from reality, under every aspect.', 'Get him Jenson']",2443,133,0.97,2443,120,120,106,3,0.0,106
1p160lm,"Zak Brown about Lando and Oscar not having a fallout: ""Even when they've touched each other [...] they've never done 'Lando did that, Oscar did that'. Any time they get grumpy, it's a little bit towards me and Andrea because we're trying to be fair and balanced.",https://www.reddit.com/r/formula1/comments/1p160lm/zak_brown_about_lando_and_oscar_not_having_a/,2025-11-19, Video,"[full vid ](https://www.youtube.com/watch?v=ySxrZbcTU_A) transcript:

Zak: ""There hasn't even been a fallout."" 

Q: ""Even after the little touch in Singapore?""

Zak: ""Not between them really. Yeah, not once. You know when you can walk into a room and you can kind of feel the tension? Not once. Not once. Even when they've touched each other, they may not have been totally aligned around what Andrea and I and the team have come up with, but they've never done 'Lando did that, Oscar did that'.  
  
Any time they get grumpy, it's a little bit actually towards me and Andrea because we're trying to be fair and balanced. And I think the fact that they've both been a little bit grumpy at times with us actually tells you things have been fair and balanced because we're trying to make sure they race clean, and they are.  
  
All the incidents that they've had, which isn't that many, have all just been, at the end of the day, racing incidents. But we want to make sure the championship's decided on the track and not through that. I think we're lucky that we have the two drivers that we have.  
  
I'm not sure that Andrea and I and the team would be able to manage other drivers the way we can Oscar and Lando. So I think a lot of credit is due to just who they are as individuals. And that's part of our recruiting process for drivers is character, and do they do they think like us? And we talk about the elephant in the room all the time. We have massive communication transparency; we talk about it all the time.""","['It feels like both Oscar and Lando are acutely aware of the sport’s history of having two #1 drivers at a time, and are actively trying to avoid letting things devolve in a similar manner', ""Much rather have Zak than Elkann that's for sure, shouldering the blame for things is what higher ups should do anyway. I think that partnership is fine and that will be the driver line up for a long time to come"", 'Do we need to tell HR about the touching?', 'just realized the first sentence can be taken out of context HAHAHA feel like the transcript really helps with this one', 'r/Fanf1ction writing that headline', 'Wild that running a billion dollar sports team with professionalism and maturity works.', ""McLaren gets shat on too much for their handling of the fight. I don't get it, this is the most fair treatment we have seen from a team when both its drivers are gunning for the title. Not perfect but there isnt a better example.\n\nAlso Lando and Oscar are both very respectful, I would have expected escalation/tension between them by now but glad that didn't happen."", 'I think what annoys most fans that want a 2021 style battle is that, in the end..Oscar and Lando are just nice dudes', ""For all the outside noise, McLaren's handling of things has (so far) produced a better result than we've seen from many teammate championship battles. Hamilton/Rosberg, Vettel/Webber, Hamilton/Alonso, going back further Senna/Prost - these are the teammate battles that come to mind, and without exception they all got pretty toxic. They have avoided that even though the battle has been close all season."", 'After watching the entire interview, i really got the impression that zach has built a culture where no one blames each other and everyone throws around tough questions about how we can improve or do something better the next time.\nHe got to be commend for this unlike teams like Ferrari and alpine where it seems like a us vs them.\nYou’re part of the them group if you are somewhat critical']",2054,275,0.96,2054,251,251,91,12,0.0,91
1p13gfx,"Helmut Marko when asked if there were any young drivers he wanted to sign but didn’t: “We had at a very early stage in negotiation with Lando Norris and in the end we didn't get him. I think he would have fitted very well to us but on the other hand, we can't have everybody.”",https://www.reddit.com/r/formula1/comments/1p13gfx/helmut_marko_when_asked_if_there_were_any_young/,2025-11-19, Video,,"['They also gave an opportunity to Vandoorne back in 2014, which he refused to stay loyal to McLaren. Maybe he should have accept the Toro Rosso contract.', 'I really don’t think Lando would have fitted in well in the Red Bull Junior Academy to be honest. Obviously we’re not in there to see it, but it seems that McLaren have a bit more of a gentle approach than what former RB Juniors have described and Lando seems to have thrived in that.', ""His loyalty to McLaren is one of the reasons I like him so much. Everytime he signed an extension, the question of if Lando was wasting his career got louder. Those first few races in 2023 especially. It's no secret horner wanted him( makes what he said about piastri last year even funnier knowing how many times he asked Lando)\n\nLando has also implied many times the environment at red bull isn't something he thinks highly off."", ""I remember in the start of 2023, when Mclaren was absolutely shit, there were a lot of people suggesting that Lando should sign for Red Bull. Good thing he didn't..."", 'Not to be dramatic but I think Lando’s loyalty to McLaren is very beautiful in a sporting sense. Reminds me of Son at Spurs, but with McLaren being in a worse position, which makes Lando’s dedication to them that more impressive.', 'Lando’s loyalty to McLaren is a major reason I back him as my favourite for the world title. Whatever people might think of him today, it was always obvious that he was a talented driver. He had every opportunity to walk away when McLaren were struggling, yet he chose to stay and build with the team.\nAs a sports fan, I have supported teams through long periods without success, and moments like these become far more meaningful when the breakthrough finally happens.\nI guess the same is true with Max but RB were never as bad as MCL.', 'Max is as complete a student of racing as has ever existed, if he is telling Lando that one day he will be world champion, it is because he sees the quality of his driving.', ""It's very funny to think that for Marko/Horner Lando was their equivalent to Toto's Max ambitions. They approached him multiple times when McLaren was struggling in early 2022 and 2023."", '""...we can\'t have everybody.""  \nWith four cars they can have more than most.', 'Lando dodged a bullet. Imagine him in that 2nd seat right now. Everyone would call for his retirement.']",1820,199,0.98,1820,183,183,48,4,0.0,48
1p194cc,'FIA discover illegal trick being used by multiple F1 teams',https://www.reddit.com/r/formula1/comments/1p194cc/fia_discover_illegal_trick_being_used_by_multiple/,2025-11-19, Rumour. Unreliable source,,"['""skid blocks that expand when heated, allegedly reducing wear on the undertray and allowing for a lower ride height""', '>It is believed that nearly all teams have, to varying extents, employed this method—with some gaining a substantial advantage on circuits where cars can run very low.  \n  \nWould be funny if a team like Williams or Haas would be the ones who would gain the most by not doing it.', ""MERCEDES, RED BULL AND MCLAREN DISQUALIFIED FROM WDC AND WCC, FERRARI DOUBLE SWEEP CHAMPIONSHIPS LET'S GOOOO CHARLES IS A CHAMPION WHILE DRIVING THE RED SHITBOX OF DOOM!\n\n  \nIf only"", '> Bauer is then reported to have ordered their removal prior to the start of qualifying, which may explain the noticeable performance differences seen between sprint races and qualifying sessions for some teams.\n\nSo…which teams suddenly lost pace…', ""Well, you know Ferrari isn't doing this because of their comments about being afraid of being investigated by the FIA every race. Their pace also makes the least sense of the front running teams.\n\nIt would be hilarious if Ferrari was actually the fastest, but everyone else was just taking advantage of this. Also, no one will be DSQ'd, this will just be outlawed for three whole races..."", 'Ferrari about to be lapped now.', 'gpfans.com reporting on something from Japanese outlet as-web.jp. Two probably equally reliable sources lol. You know a website is reliable when it as a hyphen in it.', 'Wasn’t Fernando saying something about other teams finding a lot of pace for the GP? Wonder if someone mentioned this to him', ""Please note that this isn't a 100% reliable source""]",876,187,0.96,876,183,183,309,44,0.0,309
1p12435,"Williams drivers visit the set of ""Battlebots"" in Las Vegas with Chris Rose",https://www.reddit.com/r/formula1/comments/1p12435/williams_drivers_visit_the_set_of_battlebots_in/,2025-11-19, News,,"['Jealous.\n\nIs battlebots still a thing even? Idk when was the last time I saw it on TV in Europe', 'Carlos looking like he about to shit his pants', ""Don't let this PR stunt fool you. Albon and Sainz are doing recon to make to the car ready for Combat™️this weekend."", 'How amazing would it be to have an F1 engineers special. Give each team a fixed budget and see what they come up with. This would be such a fun tie-in from an engineering pov.', ""They just need to beef up the front wing and add some forks to win the ground game. Then pop a vertical spinner on top and you've got a 4WD Vert that can hit 350 km/h."", ""That's not the Crossover i was expecting but i'm not disappointed"", ""Where's Kenny Florian?!"", 'It’ll never beat Robot Wars!', 'What is this, a crossover episode?', ""They're driving hypershock this weekend""]",745,57,0.98,745,53,53,26,0,0.0,26
1p0xlal,Lewis Hamilton and Charles Leclerc at a Puma event in Las Vegas. #LasVegasGP #F1,https://www.reddit.com/r/formula1/comments/1p0xlal/lewis_hamilton_and_charles_leclerc_at_a_puma/,2025-11-19, Social Media,,"['They look pleased to be there', 'Atleast they look somewhat happy.\nI am happy', ""All three look like they're being held hostage because they're smiling like the camera person has them on gunpoint"", 'CL has SO MUCH NECK.', ""Ngl the Vegas merch looks pretty good. Still prefer the Monza merch but this one's not so bad."", ' Wonder if they were allowed to talk', '""And perhaps some kind words from our Ferrari drivers!""\n\nLewis: ""Sorry. Not this time, guys.""', 'Short Kings stand up', 'Great to see Lewis blend in at Maranello, with the trademark kill-me-now-please death stare.', 'Those hoodies would look great with only the team logo on them. Or, like every other bit of their livery this year, without the awful HP logo.']",683,28,0.96,683,436,436,11,0,0.0,11
1p19m2z,Vegas under flood watch with severe weather expected through Friday.,https://www.reddit.com/r/formula1/comments/1p19m2z/vegas_under_flood_watch_with_severe_weather/,2025-11-19, yesterday's news,,"['No worries, Sainz can hoover up all the drain covers to help with drainage 🤙', 'Well Toto will be there, so it only makes sense that the Deserts Miss The Rain!', ""Don't worry boys,we'll probably hear about the rain all weekend and every session will be dry"", ""Im convinced if they raced in the Sahara this year it would be under flood warning or hurricane warning or something but there would be a warning that's for sure"", 'I’m seeing a lot of hysteria about this on social media as if the drivers will need Noah’s Ark to survive the weekend. Videos of certain Vegas streets that don’t drain well will be shown a lot but generally this is just like rain anywhere else. May cause wet conditions for FP or maybe even quali if the rain comes at right time but it is not a cataclysmic event\n\nSource: I used to live in Vegas and live in So Cal which is getting these storms half a day before Vegas', 'I mean, any decent rain out there triggers a flood watch', 'And THIS is why Alpine built a boat!!', 'Lets be real, its going to be bone dry on Sunday', 'Bone dry for the race it seems.\n\nQualy is not certain yet.', ""I live here in Las Vegas, there's only gonna be rain Thursday night and Friday morning""]",583,100,0.99,583,98,98,36,8,0.0,36
1p10s1g,Made an 3D animation F1 movie based video,https://www.reddit.com/r/formula1/comments/1p10s1g/made_an_3d_animation_f1_movie_based_video/,2025-11-19, Video,,"['Good efforts mate!', 'Played with blender only a little myself. This is fantastic!', ""That looks really nice. Only thing i'd reccomending is spending some time on composting, it'll make it look even better."", ""I've watched this movie 5 times, lol"", 'The strait reminds me of Fred Flintstone running through his house…', 'Simply Fucking Lovely\xa0', 'Thank you man']",100,8,0.88,100,7,7,4,0,0.010000000000000009,4
1p0xfg5,Press Conference Schedule - 2025 Las Vegas GP,https://www.reddit.com/r/formula1/comments/1p0xfg5/press_conference_schedule_2025_las_vegas_gp/,2025-11-19, News,,"['okay inject Nando, George, and Max presser straight into my veins', ""Apart from the obvious... That's a lot of Aston, Mercedes and Red Bull. \n\nAlso, where are Merc and RB's TPs?"", 'Norris finally couldn’t avoid the press conference lottery any longer', 'Nando with his adoptive grid sons. Spill the tea!', 'Are they shipping George and Max again', 'I can’t believe i get excited for press conferences xd', 'who up for gax + nando presser i know i am', ""I'm still not used to the couch they have them sit on"", 'I saw the post and for a second was wondering how the drivers are gonna do a press conference for 1800 hrs 😭', 'Do these air live anywhere?']",103,25,0.95,103,340,340,1,0,0.0,1
1p12wxg,Top 10: Most controversial penalty calls during a Formula 1 title fight,https://www.reddit.com/r/formula1/comments/1p12wxg/top_10_most_controversial_penalty_calls_during_a/,2025-11-19, News,,"[""There's actually quite a bit more to the Schumacher 1994 incident. Like the penalty being given after the deadline, making the penalty and all of the follow up illegal.\n\nThe funniest part however is from 4 years later when at the same track, the exact same stewards tried to do the exact same thing to Schumacher. Penalty being given once again after the deadline, etc. That time however FIA revoked the stewards' licenses for incompetence."", ""Back in the day the only penalties available were drive through, 10 second stop-go, and DSQ, so any penalty applied would've had massive consequences. Like Senna 1989 and Villeneuve 1997. And Montoya 2003 and Hamilton 2008."", ""The Senna 89 decision gets looked over a fair bit but it was extremely egregious and obvious, and honestly it's kinda forutnate for the FIA that Senna essentially got revenge on it a year later in far more explosive fashion (and that it didn't practically matter due to the vents of AUS). If Jean-Marie Balestre was stil around I can only imagine how ridiculous Abu Dhabi 21 would have been."", ""This list could've been entirely 2021 penalties. That year's stewarding was horrific and that's before we get to AD21."", 'That Valencia safety car was so fucking stupid.', '2025 Silverstone ranks up there as well..', 'Explains why Mansell decided to just crash into Senna when he saw he is given black flags for several laps.', 'Forgot the Villeneuve penalty. That’s essentially what put Schumacher in the lead for the finale.', 'totally, those penalties really shaped the outcome of races back then, so much drama', 'Definitely - Prost was far more at fault in 1989, because he knew exactly where Senna was and turned in far earlier than normal. The reaction by Balestre was just insanely corrupt beyond that. And it is clear that they realised that from Senna getting away with 1990.']",92,60,0.82,92,47,47,-3,1,0.0,-3
1p17iln,Going to my first f1 weekend,https://www.reddit.com/r/formula1/comments/1p17iln/going_to_my_first_f1_weekend/,2025-11-19, Discussion,"I just signed my first work contract and I’m spending my first salary by going to the Qatar GP next weekend. I’m not showing off but I’m so happy as a fan since I was 6 years old, as far as I can remember if not earlier. As accommodations was available through friends Qatar was surprisingly affordable for an f1 weekend. Hopefully you all will get this chance one day!","['Nice! Could/should be a title winning weekend for Norris too!', 'Always a good feeling to hear a lifelong fan getting to go to it’s first GP, don’t matter how or when. I always remember my first one. Congratulations and many more to come!', 'Enjoy it and soak in every minute, it truly is an awesome experience. I’ve been a long time fan and took my girlfriend to her first Grand Prix this year.', '....and it may be an unforgettable weekend seeing Lando clinching the title!', 'Congrats! I hope you have a great time \U0001faf6', 'My first is going to be Miami GP next year! Hope you have a ton of fun.', 'congrats and enjoy.   \ni still remember my first GP, the first time hearing and seeing an F1 car in person driving of the pits in FP1. Great feeling.', ""Same Qatar will be the first f1 race I'm going, definitely not the last. Surprisingly affordable. Enjoy!"", 'congratulations!!! i’ve been to several f1 races before and overall it’s a great experience. hope you have a lot of fun and also stay safe 🙌🏻🙌🏻🙌🏻']",68,34,0.8,68,28,28,1,-1,0.0,1
1p0zuvz,F1 and Mattel to launch UNO Elite Formula 1 decks,https://www.reddit.com/r/formula1/comments/1p0zuvz/f1_and_mattel_to_launch_uno_elite_formula_1_decks/,2025-11-19, News,,"['Formula Uno…it was right there!!\n\nI get it probable rights issue because, well, Formula one.', 'Formula 1 drivers do play a weirdly large amount of Uno.  \n  \nThe Uno Elite rules seem kind of complicated though.', '+10 if you draw Ocon', 'Hello scalper my old friend', 'Charlie Whiting should be on the +2', ""UNO booster packs? Collect all 1000 UNO cards?\n\nYeah, I'm out."", ""What's next? Hulken-Pils?\n\nToo many unrelated collabs."", 'Why\xa0', '""Win in a Ferrari or Draw 25""', 'Ocon+10']",67,16,0.88,67,178,178,-3,0,-0.020000000000000018,-3
