unique_id,post_heading,post_url,publish_time,tag,post_content,top_comments,upvotes,comments,upvote_ratio,score,total_upvotes_comments,total_score_comments,upvotes_growth_rate,comments_growth_rate,upvote_ratio_growth_rate,score_growth_rate
1lpceri,Hamiltons Silverstone record,https://www.reddit.com/r/formula1/comments/1lpceri/hamiltons_silverstone_record/,2025-07-01, Statistics,"Lewis Hamilton has not 11, but 12 consecutive (with the Anniversary GP) Silverstone Podiums, scoring 8 wins in that streak.","['This is gonna end in tears lol', 'and he is the driver with the most wins on 3 wheels', 'I am not ready to watch a legend fall. \n\nIt hits everyone. No superstar has avoided it. \n\nWe will always have 2024. The gods couldn’t have written a better story that day.', 'Such a shame it’s gonna end on Sunday', 'Ferrari, I swear to god...', ""As a Ferrari fan,  I'm saying I'll be pleasantly surprised if he ends up on the podium."", 'Ferrari better not screw his record. I’ll be devastated if it happens.', 'Lewis’s qualifying hasn’t been nearly as bad as people are making it out to be. If he qualifies in the top 5, I think a podium is on. If there’s weather I think it’s definitely on', 'All these posts about his Silverstone record & he’ll probably have engine failure lap 1 now']",2784,161,0.97,2784,6832,6832,79,2,0.0,79
1lpibfj,Rookie Championship After Austrian GP,https://www.reddit.com/r/formula1/comments/1lpibfj/rookie_championship_after_austrian_gp/,2025-07-02, Statistics,,"['Hadjar!', 'Everyone please stop celebrating Hadjar! They’ll demote him!', 'This is a Championship not a ranking, Rookie drivers get points for where they finish in each race.\n\n\n\nPoints added.\n\n  \nIsack 119 + 8 = 127\n\n\n\nKimi 122 + 0 = 122\n\n\n\nOliver 101 + 10 = 111\n\n\n\nLiam 76 + 15 = 91\n\n\n\nGabriel 52 + 12 = 64\n\n\n\nFranco 36 + 6 = 42\n\n\n\nJack 32\n\n\n\nIsack gets Kimi back! Only 5 points between them! \n\n\n\nGabriel highest placing in this championship 2nd place! Good work Gabriel!\n\n\n\nI hope you enjoy this championship\n\n\n\nPeace', 'Hadjaaaaaaar! He’s definitely my rookie of the year! He’s been very consistent.', 'Feel like Haas has been struggling a bit more the last couple of races, but Bearman has had some really good drives.', ""I'm loving Hadjar! I wish FC would get a better car and better opportunity"", 'Points kind of track with the eyeball test so far this season.\xa0', 'Hadjar is becoming a fav or mine! Finery attitude and talented driver', 'Hadjar is definitely a WDC material but something about Bortoleto is amazing. This kid definitely has a bright future in F1.']",2584,91,0.98,2584,2044,2044,136,1,0.0,136
1lpt83g,Sky Sports Italy's promotional piece for the British Grand Prix,https://www.reddit.com/r/formula1/comments/1lpt83g/sky_sports_italys_promotional_piece_for_the/,2025-07-02, Social Media,,"['I hate this stupid filter they use, it makes the drivers look horrendous', 'what the fuck is that', 'Graphic design is not their passion.', 'I have already seen more about Sky Italy today than ever', 'Oh my god', 'Why does Lewis look like he has a lazy eye, horrendous picture and emphasizes that ksi esque hairline', 'Wtf did they do to the faces of the drivers\n\n\nMiddle guy aint lewis, and charles looks like he got his face stung by bees', 'Is Oscar biting his lip??', 'Is everything okay over at Sky Sports Italy?', 'Hamilton: in the middle, centre of attention\n\nPiastri: signature look of superiority']",2331,213,0.94,2331,193,193,689,38,0.0,689
1lpcwuo,'I Want To Be the First Female F1 Driver in Over 30 Years',https://www.reddit.com/r/formula1/comments/1lpcwuo/i_want_to_be_the_first_female_f1_driver_in_over/,2025-07-01, Video,,"['I think the hard thing for all the current F1A girls is that they are starting so late.  Look at how young the guys are getting into f3 and even F2 and you realize these 17-20 year old girls just don’t stand a chance.   F1 rookies are younger than some of these f1A drivers', 'Every year perhaps more than 1000 boys start karting. Let’s say 50-100 for girls (im being generous here). Only 10% of them may or may not rise to feeder series. 5-10 girls at best, while there are 100 boys (and many of them drop even before their teens because of the huge economical burden) That’s why it is too hard to gather chances of talent, funding, future all at once for girls, compared to boys.\n\nWhat Abbi, Susie Wolff and other female drivers are doing is; paving the way for encouraging more girls for karting. Therefore more female drivers may have chance to prove themselves with equal opportunity, if they have the proper talent. It always starts with small steps. Even if Abbi can say that out loud, it is a small brick for that way, encouraging young girls and their families.', ""17th in British F3 at 22 ain't making it to F1, male or female."", ""Even rookies struggle to adapt to F1 cars, physically speaking. It'd be nice if F1 Academy used at least F2 equivalent cars"", ""She's currently 17th in GB3 whilst being the oldest driver in the field in the best team.\n\nI think that tells you everything you need to know about her chances of making it to F1."", 'This is a completely unremarkable statement. It would be a little silly for a formula driver not to aim for F1 or maybe Indy, no?', ""I think the current crop of rookies will have retired, or at the very least be in their 30s, before we see a woman who truly has a shot to enter F1. Whoever it might be, she needs to light up the field in mixed lower formulas, either early, in F4 and FRECA like Kimi, or higher up the ladder, in F3 and F2 like Bortoleto. \n\nThe former is more likely to happen in the short run, but I still think it'll take a couple more years of F1A for this to happen."", ""Only a Verstappen equivalent of a female driver would ever make it into F1. Innately talented rich girl groomed to be a driver since young age by a dad/mom trying to live their dreams through her.\n\nF1 is ridiculously too luck, money and chance based, that the unconventional driver should be WDC level talented to break in. There is a reason Lewis is the first/only black F1 driver and also went onto become an all time great. He wouldn't have made it if he were any less talented. He had to be generational talent to be selected.\n\nAnd same applies to female F1 driver too."", 'Will there ever be a female driver in F1? Maybe.\xa0\n\n\nWill it be her? Absolutely not.\xa0', ""22 years old and 17th in GB3? She'll be lucky if she reaches f2""]",983,545,0.86,983,10038,10038,13,7,0.0,13
1lp8wff,"[Motorsport.com] Mercedes To Finalize 2026 Driver Line-Up In F1’s Summer Break, Says Toto Wolff",https://www.reddit.com/r/formula1/comments/1lp8wff/motorsportcom_mercedes_to_finalize_2026_driver/,2025-07-01, News,,"['George is likely to be one of the press conference drivers on Thursday. He’s going to get grilled isn’t he?', 'he was pretty relaxed being bowled out of the last race, maybe he has decided', ""*Maybe*\n\n\nAlso, no Monza announcement for Kimi:(\n\n\nWonder if they'll go for neutral this time and won't do a home race announcement for George either"", ""I can't wait to know what Toto is scheming.\n\nCasting George aside would be brutal, because he's been their team leader for a long time now. He's grown into that role + he's had that longstanding relationship with Mercedes.\n\nCasting Kimi aside would be brutal, because he's a rookie and has been improving steadily. He's only 17 and has lots of potential. It's his first season, cut him some slack.\n\nWhat happens (or doesn't happen) all depends on Max's headspace. We're entering a new regs era, and he has to decide whether he trusts RBR to rebound from where they are now. Has he lost confidence in them? If he has, then no doubt he leaves."", ""I'd like to see Verstappen switching to Mercedes."", 'oh i tought it would be sorted before/at Silverstone...', 'George, get ready to decipher what if the Redbull has grip or slip.', 'Basically up to Max to decide by then. \n\nI still see a year out and then AM as very possible for him, rather than being rushed into a Merc contract with Merc offering George a 1+1 to keep options open.', 'I hope they stay with George + Kimi']",934,122,0.97,934,3242,3242,29,0,0.0,29
1lp3yoj,Driver points over the last 12 months,https://www.reddit.com/r/formula1/comments/1lp3yoj/driver_points_over_the_last_12_months/,2025-07-01, Statistics,"I was bored and curious so made a table of the points drivers have scored over the last 12 months. Interesting to see the points gap between 1, 2 & 3 hasn’t changed much, only the drivers! 

I’m going to expand this and plot a graph showing changes over time (yeah, I’m that cool)

What do you think?","['Hulkenberg, the shitbox whisperer.', 'The remarkable one to me is how close Charles is to max. How I wish Charles would get a WCC winning car for once and we would see him in his glory', 'This is interesting, thanks for making it!', 'Things that jumped out for me: Charles is very close in points to Max, and somehow the Hulk scored more points than Alonso.', 'Hulkenberg being in the top 10 while driving shit boxes 💪', 'Hulk the Goat', 'I kind of have built a habit of looking at the bottom when searching for second redbull drivers.', '2023 Alonso seems like a fever dream', 'Imo Charles has been consistently the second best driver behind max (obviously) since like 23. Please Ferrari learn how to make a car again']",899,99,0.95,899,1902,1902,9,0,0.0,9
1lp3ptp,Ferrari to bring updated rear suspension to Spa,https://www.reddit.com/r/formula1/comments/1lp3ptp/ferrari_to_bring_updated_rear_suspension_to_spa/,2025-07-01, News,,"['Major suspension upgrade on a sprint weekend? Yum...', 'I swear we’ve been hearing about this suspension change for ages at this point', 'My bet is this means the car will be perfect for silverstone and then the upgrades will Ferrari the car again.', 'Damn, but if Loic Serra says it won’t be ready in time for Silverstone then I will give him the benefit of the doubt if the upgrade transforms the car performance in Spa.', ""What's the objective for Ferrari? Cement themselves as clear P2 in WCC? Idk if they can experiment with this year suspension for next year, if that's the case it makes more sense but I would imagine they are switching to full 2026 focus in not too long."", 'Sux that Hamilton wont have a chance at home race.', 'Well, there goes next weekend. :(', 'Ferrari should pay for the therapy for their fans.']",856,71,0.99,856,1710,1710,9,0,0.0,9
1lpudeu,"[SkySportsF1] Max Verstappen is open to leaving Red Bull to join Mercedes for the 2026 F1 season, with talks intensifying ahead of this weekend's British Grand Prix, according to Sky in Ital",https://www.reddit.com/r/formula1/comments/1lpudeu/skysportsf1_max_verstappen_is_open_to_leaving_red/,2025-07-02, News,[https://x.com/SkySportsF1/status/1940381629375222025](https://x.com/SkySportsF1/status/1940381629375222025),"[""Remember folks, it's not real unless the BBC says so.\n\n\nbut oh shit the real sky sports..."", 'So this is still based on that one source?', 'Oh shit UK sky is reporting too', 'This seems they are only replicating what sky Italy reported, no? “According to sky in Italy”. It doesn’t seem they have other sources.', 'Auto Motor und Sport reports, that Verstappen is telling Red Bull to fire Horner or he will leave for Mercedes\nhttps://www.auto-motor-und-sport.de/formel-1/verstappen-wechsel-red-bull-bedingungen-ausstiegsklausel-horner/', '> sky sports news understands verstappen has not indicated he wants to leave red bull early, nor has there been an official approach from mercedes for the reigning F1 world champion', 'Let the silly season begin', 'Now is as good a time as any. Red Bull is getting a brand new unproven engine, car is undeliverable, and management is constantly going through a series of organizational crises. Mercedes may be slower the last 4 years but are a much more well-oiled machine and clearly give Max a solid shot at victory. \n\nTBH I’m kind of surprised McLaren and Ferrari don’t at least start a dialogue with Max. He’s good enough that surely it warrants 1/2 seats at any team', 'They just spoke to Craig Slater on Sky Sports News and he said it’s been reported by Sky Italy but that there’s no smoke without fire.']",1202,278,0.97,1202,263,263,1202,278,0.97,1202
1lpqjhe,What's really going on with the Verstappen-Mercedes talks,https://www.reddit.com/r/formula1/comments/1lpqjhe/whats_really_going_on_with_the_verstappenmercedes/,2025-07-02, News,,"['I\'m not believing anything til i see ""BREAKING: Verstappen to drive for Mercedes for 2026"" post on F1 social media lol', "">On the face of it then, that discussions have taken place now suggests the situation has changed and that Wolff has decided to move because he is seeking a driver change.\n\n>But things may not be quite like that, with one source suggesting that rather than these talks being about Wolff trying to lure a new driver on board, they were instead kicked off by an approach from the Verstappens wanting to have a chat about the future.\n\nNot too much new in here but it's a pretty comprehensive explanation of what's going on and all the possibilities and such."", 'I think it’s obvious you want a Mercedes engine for next season, Verstappen and his camp know this and will act accordingly. \n\nAs Toto said what are the chances of RBPT getting it right straight away…', '""In racing terms, the next couple of years could well dictate if he goes on to become the most successful driver in F1 history or not.\n\nWith the power units set to be so critical to success in the next rules set that kicks off in 2026, being on the wrong side of things with Red Bull could leave Verstappen becoming purely a supporting actor.""\n\nOkay this feels like the end of the Seb era again. Does anyone else remember feeling that Seb was unstoppable and going to take the records? And then 2014 happened.', ""Max still has several of his future plans tied up with Red Bull, so just jumping ship to Mercedes isn't that easy for him. The rumors are probably just negotiation tactics: it benefits Wolff because he can use them to lowball George, and it benefits Max because it gives them leverage to make changes within the Red Bull F1 team (e.g. firing Horner)."", 'God I hate the way The Race words things to make them seems like they know everything.\n\n""We have ALL the answers!""', 'TL;DR: The author doesn’t know what’s exactly going on and tries to speculate. From “Toto is just being polite” to “Max will take a break in 2026 and join Mercedes in 2027”.', 'My theory is much more about Verstappen.com racing team - he is testing GT3 cars in his spare time. I think it’s much more interesting game to see if he can partner with someone to eventually have sim racing and real world racing teams……potentially up to F1. Toto and Lawrence are the only big hitters that managed to get a share of a team.\n\nI think joining Aston with shares in the parent company regardless of the competitiveness of the car but with the right people around and merging it with his verstappen.com is super interesting', 'Mercedes engines are the safest bet for next year. If Verstappen wants to stay in F1 long term thats the way. \n\nRussel potentially losing his seat is just extra motivation']",879,353,0.93,879,330,330,142,23,0.0,142
1lp8jpf,McLaren collaborating with Sega (specifically Sonic and Knuckles) for London Live in Trafalgar Square on the 2nd and 3rd (tomorrow and Thursday),https://www.reddit.com/r/formula1/comments/1lp8jpf/mclaren_collaborating_with_sega_specifically/,2025-07-01, Social Media,,"['Tails is their mechanic', 'Does this mean Lando and Oscar will be in the new Sonic racing game? And since Sonic is coming to Magic the Gathering can we get a F1 set?', 'Do you think Sonic still has it? It has been over three decades since he drove for Williams... (And yet still a more believable comeback than Sonny Hayes.)', 'Gotta go fast, but traffic congestion is stopping me.', '*Source* – [Official *Sonic the Hedgehog* English Bluesky account](https://bsky.app/profile/sonic-official.bsky.social/post/3lsw32bnscs2d)\n\n*Related* – [Lando Norris and Oscar Piastri play *Sonic Racing: CrossWorlds*](https://old.reddit.com/r/formula1/comments/1lp7lxk/lando_norris_oscar_piastri_play_sonic_racing/), shared by /u/Aratho', ""Knuckles, feedback from Whitehall, the manoeuvre by the fourth plinth with the lock up was too marginal. We can't do that again."", ""Piastri is Sonic and Norris is Knuckles, and I don't know if I could explain why."", 'Peak', ""It's a surprise for me that Sega still manages to allocate a budget for F1 advertisement with McLaren. A far cry from the Sega trophy held by Senna.""]",412,24,0.97,412,203,203,-6,0,0.0,-6
1lp68ky,Ricciardo shares update on post-F1 plans,https://www.reddit.com/r/formula1/comments/1lp68ky/ricciardo_shares_update_on_postf1_plans/,2025-07-01, News,"Months on from his last F1 race at the 2024 Singapore Grand Prix, Daniel Ricciardo has given his take on how he is feeling about his current situation.","['> “All good!” said Ricciardo. “I’m just enjoying some life in the slow lane. I mean, it sounds weird saying like retirement when I’m 35 years old, but retirement from at least the world I was living in. It’s cool.\n\nRetirement official.', 'Oh to retire at 35', '*Ricciardo – who turns 36 today – has not raced since then but has continued to be involved in supporting youngsters in motorsport through the Daniel Ricciardo Series, in which young drivers compete at the wheel of a DRS Ricciardo Kart across events held in the United Kingdom.*', 'I just saw the F1 movie. I fully expect him to be back in 25 years.', ""I would be shocked if we don't see him in a netflix or commentary sort of thing at some point."", 'I would to have him and DC in the booth  for races.', 'Max/Danny/Seb: Team Redline Red Bull WEC. ^^^Please', ""I see dozens of sponsored ads on reddit for his new 'tailgate' business thing"", ""Sounds like he's genuinely having a great time.\n\nEver since 2022 , he didn't feel like the Old Prime Ricciardo. So now him saying he's feeling fine and having a joy being back at the karts , it's amazing.\n\nAlso, didn't know he has a whole karting series named after him. Him and Vettel could be the best mentors in helping shape young drivers in the sport""]",384,97,0.87,384,2658,2658,4,0,0.010000000000000009,4
1lpgzc6,F1 Drivers Take A U.S. Driver's Ed Test,https://www.reddit.com/r/formula1/comments/1lpgzc6/f1_drivers_take_a_us_drivers_ed_test/,2025-07-01, Video,,"['All of us furiously refreshing on the max > mercedes news and this is what comes up 😭😭', 'Gotta love how earnest Charles is. Also Lando actually took this test more seriously than he does with Grill the Grid.', 'Who is this Jack Doohan fellow', 'Not Charles almost passing.  Brother can’t park and hit a stopped car.  😂💀', 'My dyslexic brain thought it meant AUS as in Australian.', ""Estie's face when Lando said you should break test to claim insurance fraud 😂 was great to see a mix of drivers"", '""box for inters""...Ocon is hilarious\n\nAlso this test was a lot more difficult than anticipated. The wording is tricky.', 'Something to watch while waiting on max to merc news', 'I would honestly love to see a speed parallel parking event with a Ford F150 with no cameras. Make it worth like 3 WDC points or something in promotion for the Austin race.', '“Your’e a role model for the kids”']",350,49,0.92,350,943,943,6,0,0.0,6
1lppgrw,McLaren are doing a live event today at Trafalgar Square where many drivers from Lando to Mika Hakkinen will be present,https://www.reddit.com/r/formula1/comments/1lppgrw/mclaren_are_doing_a_live_event_today_at_trafalgar/,2025-07-02, Social Media,,"['Mika is about to announce his return from sabbatical.', 'NGL, im an Australian supporting Piastri, and yet the one person on that list i would like to meet and speak to the most would be Martin Brundle', ""'Come on Mark, you're going to be there with Oscar anyway. Just come on the stage'"", 'Man, they’re bringing the whole family', 'Will Sonic be there too?', 'Good luck to anyone who is going. It’s meant to be warm and there’s thunderstorms around. Unfortunately I am not going, I have work in the North of the country.', '""McLaren lego car""...would be so funny if it was the one that raced in Miami', 'I live like 10 miles from London and it is pouring here, so good luck to who ever is going', ""What's Mark Webber doing there, isn't he a Porsche ambassador?"", 'Seeing Domenicali’s name on there is weird haha. I know he’s representing Liberty but he was Ferrari TP not that long ago…\n\nAlso: where Martin Whitmarsh?']",257,58,0.94,257,57,57,13,0,0.0,13
1lp93re,[Formula 1] Why Alpine have enquired about Bottas' availability,https://www.reddit.com/r/formula1/comments/1lp93re/formula_1_why_alpine_have_enquired_about_bottas/,2025-07-01, News,,"[""I think he's going to Cadillac, but if he's not, why not go drive at alpine for the rest of the year and try to swing that into a full-time seat somewhere. If he is going to Cadillac, I wouldn't touch alpine with a ten foot pole. That place is cancer"", 'They want to make a nude calendar, duh.', ""Merc, Mclaren and now Alpine, he's trying his damn hardest to get a seat."", "">Why Alpine have enquired about Bottas' availability\n\nBecause they have no idea what they are doing and are just throwing everything at the wall in the hopes that something sticks?"", 'Bottas is not an engineer nor a miracle worker, Alpine needs to keep their grubby paws off Bottas.  Haven’t they done enough damage?', 'With the current state of affairs over there, Bottas is going to be the next team principal', 'Instead of having 1000 articles about the next driver, can we just ask to some journalists to find out why Enstone failed again?', 'Realistically what Briatore should be doing is exactly what he said in summer last year - that he’ll focus on picking the second driver when the car is working.\n\nThe reality is that the car is currently the slowest on the grid, Gasly’s able to qualify well in it somehow but there’s a huge lack of understanding of how to run a race in it - it eats tyres, it is extremely difficult to drive, and it’s not very fast so it doesn’t tick any box to be honest.\n\nLeave Colapinto in for now. The influx of sponsorship that Briatore expected has not arrived, and his performance hasn’t been stellar, but he’s not crashing right now and he’s got his head down and is working hard. The team currently doesn’t need the upheaval.\n\nEvaluate Aron and by all means evaluate Bottas. But leave them for 2026.', 'Tomorrow gonna be Mick again.... this is Boring...']",230,149,0.9,230,1602,1602,1,1,-0.010000000000000009,1
1lprfwe,"“Hill” is now out on Sky Documentaries & NowTV, would recommend a watch!",https://www.reddit.com/r/formula1/comments/1lprfwe/hill_is_now_out_on_sky_documentaries_nowtv_would/,2025-07-02, Video,,"['\\>Hill. One name. Two world champions\n\nTechnically three world champions, Phil Hill as well', 'I always loved Murray Walker’s “I’ve got to stop, because I’ve got a lump in my throat” [commentary](https://youtu.be/GrPqodZYQh0)\xa0when Hill won his title.\n\nAlso since I mention him it gives me an excuse to post [the greatest\xa0advert of all time](https://youtu.be/JwkU7dw-yWc)', 'Does it include the scotch egg from Bob Mortimer?', ""Heads up, Damon Hill will also be on today's episode of the Team Torque podcast with the Williams boys!"", 'That flavour text is just factually wrong lol. Phil Hill, Graham Hill, Damon Hill.', 'Looking forward to this. I got into F1 in 1995 and 1996 was my first full year. I was OBSESSED. I have very fond memories of Damon. \n\nYeah, 1995 and 1999 were crap, but he was so impressive in 1993, 1994 and 1996. Amazing how quickly he settled in to be a frontrunner and team leader, despite his lack of experience. \n\nNot sure I enjoyed his punditry in recent years, but mid 90s Damon will always hold a special part in my heart.', 'So how does one watch it outside of the UK?', 'Top driver with WDC potential losing his seat in a leading team mid season - sure glad that doesn’t happen anymore.\xa0', 'Gotta be honest, I struggle to come up with a world champion I’m less interested in than Damon Hill.', '""defying the odds"" by winning in the quickest car on the grid.']",217,119,0.84,217,109,109,28,5,0.0,28
