unique_id,post_heading,post_url,publish_time,tag,post_content,top_comments,upvotes,comments,upvote_ratio,score,total_upvotes_comments,total_score_comments,upvotes_growth_rate,comments_growth_rate,upvote_ratio_growth_rate,score_growth_rate
1jgrcz9,My First F1 Car: All Access with Isack Hadjar,https://www.reddit.com/r/formula1/comments/1jgrcz9/my_first_f1_car_all_access_with_isack_hadjar/,2025-03-21, Video,,"[""As a Brazilian dude I'm a big fan of Bortoleto and love him, but I'm very impressed with Hadjar's performance, the boy is mopping the floor amongst the rookies.""]",71,2,0.91,71,1,1,1,0,0.010000000000000009,1
1jh6lbc,Analysis: Why Lawson is so much slower than Verstappen,https://www.reddit.com/r/formula1/comments/1jh6lbc/analysis_why_lawson_is_so_much_slower_than/,2025-03-22, News,,"['_“In terms of driving styles, I don’t really know if I believe in it so much in terms of a driving style_\n\n_“I think you have certain things you like a car to do but I think also, for me, I spent a lot of time developing that car as well, as a junior and as a reserve for the last couple of years, and I feel like I understand quite well the way the car drives._\n\n_“But I also don’t fully believe in ‘This doesn’t suit your driving style’._\n\n_“I think as drivers, we’re professionals, we have to adapt to whatever we’re driving.”_\n\n\n-Lawson’s own preseason comments.', ""He doesn't seem confident at all in the car."", '30kph slower halfway through the first corner. Wow.', 'The problem isn’t that he’s slower than Verstappen. That’s going to be a given for the 2nd RB seat, Max is Max. The problem with Liam is that he’s so much slower than the rest of the grid.', ""Good read,. impressed that they've got a decent analysis of Lawson's struggles this quickly after qualy tbh. Yeah, he needs a private test or something to fundamentally build confidence in driving the car close to the limit because at the moment the pressure of the world watching and ridiculing him isn't doing him any favours."", 'Max gave us the answer to this conundrum years ago man.\n\nThe answer was always Hulkenberg.\n\n2020: [https://www.planetf1.com/news/max-verstappen-wants-nico-hulkenberg-as-team-mate](https://www.planetf1.com/news/max-verstappen-wants-nico-hulkenberg-as-team-mate)', ""From Liam 'I beat him in the junior series' Lawson to Liam 'it is just the time, unfortunately I don't really have time' Lawson. \n\nHe really needs to regain confidence, this is a speedrun for the almost obligatory 2nd RB driver annual topic discussion."", ""Honestly it's the simplest and most obvious solution but a lot of people refuse to admit it - The fact that Max has consistently had a 0.5-1 sec gap on teammates going back to Gasly, he's very likely on just an alien level like peak Valentino or Marquez in Motogp. \n\nThe teammates keep coming and going but the results are the same. For all we know RBR may be a midfield team."", ""Liam: finding confidence to go faster.\xa0\n\n\nDr Marko: find it, faster. Don't mess it up. Found it yet?""]",68,87,0.83,68,81,81,4,0,0.0,4
1jgzk2x,"F1 HOT or NOT - rate drivers, teams and the race for the 2025 Chinese Sprint!",https://www.reddit.com/r/formula1/comments/1jgzk2x/f1_hot_or_not_rate_drivers_teams_and_the_race_for/,2025-03-22, Statistics,,"['Holy shit lando wtf was that\n\n\nAlso holy shit Lewis wtf was that.\n\n\nWhat happened to the mythical pace of the McLaren. That shit dropped off for both drivers. Even Oscar was dropping a second a lap', 'HAM, TSU, STR hot.\n\nNOR and DOO not.', 'I know it won’t last because it never does but damn it’s nice when Lance is good', 'Hot: Lewis, Tsunoda, Stroll', 'Williams not :(\n\nLeft front, very', '#RED FUCKING HOT - HAMILTON AND STROLL', 'Not - The TV directing, genuinely did my head in how often they cut away from battles at the front', ""When Stroll is on he's ON. I hope this keeps up, it's nice to see Stroll's flashes of brilliance. Holding off Norris for half of the race was super impressive"", 'Hot: Hamilton, Piastri, Verstappen, Tsunoda, Stroll\n\nNot: Leclerc, Norris, Sainz, Sauber, Doohan']",65,77,0.84,65,1025,1025,-3,0,0.0,-3
1jh0o3i,Will there be enough tires for tomorrow?,https://www.reddit.com/r/formula1/comments/1jh0o3i/will_there_be_enough_tires_for_tomorrow/,2025-03-22, Discussion,"Considering the mediums were dead after 12-14 laps for most drivers and there are only 2 sets of hards allocated I imagine tomorrow's going to be a major tire conservation race. Pirelli is forecasting the hards to be good for 23 laps so we're certain to see a 2 stopper but how many teams can actually make their tires last long enough?   
  
[https://press.pirelli.com/a-chinese-weekend-that-presents-many-challenges-as-well-as-something-new/](https://press.pirelli.com/a-chinese-weekend-that-presents-many-challenges-as-well-as-something-new/)","['To me that is a good thing. I love races where the tyres properly degrade and it forces teams to go for 2 or even more stops.', ""Nope. I think it's going to be a mess. I'm so excited."", 'The first 15 laps will look like the average Singapore race, drivers driving slow as fuck to preserve the hell out of their tyres.\n\nRace will develop in the second half after the pitstops, the first stint will be a snooze fest', 'It will be tyre management fiesta tomorrow. Drivers will not follow each other closely to preserve tyres. It might be pretty boring in terms of on track racing, but strategies and pit stops should be interesting.', 'VCARB be like ""We\'ll make Yuki do 40 laps on softs since there are only 2 sets of hards and no new mediums""', ""According to lap-by-lap everyone's tyres today were used, Verstappen had 3 laps ran and Hamilton had 8\n\nBased on tyre allocation teams should likely have 1 fresh medium and 2 hards left"", '56 laps so, if you could get 15 laps on mediums, in a full race you might actually be able to go two sets of mediums (15 laps each) and one hard, right? Inevitably as the track rubbers in tyre degradation will slow.\n\n\nMy question is if anyone will start on the hard compound hoping for a safety car to harvest that free stop. That I think is the ""Hail Mary"" mid-field strategy.', 'With extra fuel tomorrow adding more deg at the start, pitting for an undercut into fresh air will be a major advantage if someone pulls it off. Carlos was lapping 2 seconds faster than the leaders after his stop during the sprint', ""I just hope both Ferrari and Racing Bulls do not make stupid pit in time like the Aus race lol... Otherwise, I'm sure K1 won't save the Ferrari strategist from being hammered by Lewis and the ice latte won't save the Racing Bulls strategist from getting his Italian pizza with pineapple topping lol\\~""]",65,47,0.88,65,597,597,0,0,0.0,0
1jh3qwi,Oliver Bearman has been summoned to the stewards for alleged impeding of Lance Stroll,https://www.reddit.com/r/formula1/comments/1jh3qwi/oliver_bearman_has_been_summoned_to_the_stewards/,2025-03-22, News,,"['Lawson might move up to P19', 'Nothing for the VCARB release on the RB?', ""Seems like Ollie needs to become a little bit more aware when not on a flying lap, as its not the first time this season already that he's been flagged up for impeding."", 'No further action incoming', 'Document probably still getting prepared. Last I saw was a race control message saying to be investigated after the session. Unless I missed a no further review message, we should see the summons soon.', '[Hadjar summons is now online fyi](https://www.fia.com/system/files/decision-document/2025_chinese_grand_prix_-_summons_-_car_6_-_alleged_unsafe_release.pdf)']",62,7,0.95,62,6,6,1,0,0.0,1
1jhawl3,[Pirelli] Possible race strategies for Chinese GP 2025,https://www.reddit.com/r/formula1/comments/1jhawl3/pirelli_possible_race_strategies_for_chinese_gp/,2025-03-22, Technical,,"['Front runners definitely going to start on mediums. I can see a H-H-M being a solid strategy for midfield/backmarkers', 'So with these potential optimal strat, Ferrari and Vcarb going with HMMS three stop.', 'Who in their right mind would start on sof... Wait a minute! 🇮🇹🤌', 'M-H-H, frontrunners get game theoried into boxing super early to undercut, others defend the undercut, first hard set dies so early that they need another hard set.', 'I really love two stop races', 'That soft will be slower than the medium after like 1 lap.\n\nPirelli has totally lost the speed offset vs wear between compounds for years now.', ""Ham: guys why are we pitted for intermediate? It's not raining.\xa0\n\n\nFerrari: we're checking."", 'How many tires do the front runners have ? All the same or not?', 'Is 1 stopper with medium then hard not possible? Or perhaps something a driver in the back might try?']",65,35,0.96,65,34,34,15,7,-0.010000000000000009,15
1jhay43,[Pirelli] Tyre sets available for Chinese GP 2025 race,https://www.reddit.com/r/formula1/comments/1jhay43/pirelli_tyre_sets_available_for_chinese_gp_2025/,2025-03-22, Technical,,"['The Lawson masterplan. M-S-S-S and lap everyone.', 'So Lawson will do 5 pitstops, race on softs and finish last?', 'Top 6 have the same sets of tyres. May the best tyre whisperer win!', '2 stop 100%, M-H-H\n\nMaybe some Haas or Sauber will try H-M-H', ""I wonder if Horner is going to be sitting in the RB garage with a kettle, steaming the labels off Lawson's fresh tyres to swap with labels on Max's used tyres."", 'I guess Stroll and Alonso will be starting on hards', 'Lawson 4 pit stop strat for the win, guy is playing formula chess', 'I miss the days where teams could choose their own tires.', 'Mediums did 19 laps for Lewis and he still had pace. My guess is that someone running in the top 4 tries for a 1 stop.']",60,29,0.97,60,27,27,12,6,0.0,12
1jh2xm4,2025 - Chinese GP: S (3 pics),https://www.reddit.com/r/formula1/comments/1jh2xm4/2025_chinese_gp_s_3_pics/,2025-03-22, Statistics,,['That Red Bull treats its tyres like Jos treats Max'],56,2,0.96,56,1,1,-1,0,-0.010000000000000009,-1
1jh48sb,DOC 55 - Summons - Car 6 - Alleged unsafe release,https://www.reddit.com/r/formula1/comments/1jh48sb/doc_55_summons_car_6_alleged_unsafe_release/,2025-03-22, News,,"[""I'd expect it to be a 5000 Euro fine or something no? More team fault, than driver. The guy who ushered Hadjar out didn't even bat an eyelid or look back when Max had to swerve to avoid Hadjar. Cool cucumbers."", 'Hadjar is expected to receive the harsh but fair punishment of being the 2nd Red Bull driver', 'This is a slam dunk pen no?', 'It was slam dunk right', ""I mean, it's a pretty obvious one"", 'Please have mercy he is just a rookie let it go', '""Alleged""', 'Yeah this was pretty open and shut case. Sucks for Issack. \n\nHe knew he would be getting a grid drop nrvshse his post race interview he was downbeat despite putting it in the top 10.', 'Oooooh the humanity! Have you no heart?!? 😭']",54,20,0.91,54,19,19,-2,0,-0.020000000000000018,-2
1jh1xy6,"Eddie Jordan was one of F1’s biggest characters, we’re all going to miss him | Formula One",https://www.reddit.com/r/formula1/comments/1jh1xy6/eddie_jordan_was_one_of_f1s_biggest_characters/,2025-03-22, News,,[],53,1,0.88,53,0,0,-3,0,-0.010000000000000009,-3
1jhaj1p,Should Yuki even want the Red Bull drive?,https://www.reddit.com/r/formula1/comments/1jhaj1p/should_yuki_even_want_the_red_bull_drive/,2025-03-22, Discussion,"At this point, that second Red Bull seat clearly has the ability to put careers on life support. Yuki was already passed over for the seat, so even if he is given the seat its unlikely that his leash would be that long either. What benefit is there to Tsunoda to try to tame that beast, potentially hurting his stock in the process, when opportunities at a team like Cadillac to secure a multi-year deal could position him better to be a long term midfield team leader like Albon and Gasly?","[""He seems very at peace with not being at Red Bull, and has great rapport with the VCARB team. I know he wants to move up but I hope it's with a different team. He's barely put a foot wrong so far this year, and emotionally he's matured a lot. \n\nSelfishly I want him to come to Indycar if he doesn't get a seat next year that'd be extremely fun"", ""Everyone who was given the seat failed. Maybe the guy who's not supposed to get the seat will get surprising results"", 'No', ""He definitely should want it. Being completely honest, is he ever going to get a seat in a Ferrari, McLaren or Merc? No chance.\n\nRed Bull is his only ticket to a top team. If he thinks he has what it takes, you take the opportunity. And if he doesn't, what is he doing here."", 'yes. he said today, the car is faster and he would be happy switching to it for Suzuka', 'He’s an experienced driver, the red bull car is capable of podiums. if he believes in himself, take it. Sink or swim. \n\nEither he takes the chance no regrets or he remains in midfield land scraping points for whatever time is left of his career.', 'I think if you put Yuki in the redbull right now, you’d get similar results as Liam Lawson and the other way around. Lawson would have better results in a vcarb\n\nSo he’d get the same treatment Lawson is receiving', 'Why not? It is realistically his only chance to accomplish anything more than a weird podium here or there.', 'Yes. His future in F1 is tenuous at best. If he can conquer what others couldn’t that would open a lot of doors for him. If not, well, he probably won’t have a seat next year anyway.']",61,60,0.81,61,56,56,14,8,0.010000000000000009,14
1jh42x9,Last 10 years in one graph,https://www.reddit.com/r/formula1/comments/1jh42x9/last_10_years_in_one_graph/,2025-03-22, Statistics,,"['Loreal', 'That Haas bottom out in 2021 lol', 'that brief period in 2018 when ferrari was fastest aahhhh.... it still hurts', 'What does the Y axis represent', 'What is the Y axis supposed to represent?', 'What the hell happened in 2020?', 'What is on the Y axis here? And the top X axis?', 'Ferrari, always the bridesmaid, never the bride', 'doesnt make any sense for 2022\n\nferrari was at red bull’s level for first half and easily better than merc for most of the season']",55,16,0.87,55,14,14,4,0,0.0,4
1jgtq6a,Alex on the struggles of being RB's second driver while contrasting his driving style with that of Max,https://www.reddit.com/r/formula1/comments/1jgtq6a/alex_on_the_struggles_of_being_rbs_second_driver/,2025-03-21, Video,,"['He’s got a good head on his shoulders. I am really rooting for Williams this year. The driver lineup is one of the key reasons\xa0', ""Plenty of trauma bonding must have been had for all the ghosts of Red Bull's past. Really hope Albono goes far this season"", ""I like what Lawson said about this in the F1 podcast posted pre-season. It's up to the driver to drive the car you're given. If you're good enough then it's not an issue."", ""Trauma bonding doesn't mean what you (and many other people to be fair) think it means. It's a bond that develops between a victim and their abuser through repeated abuse."", 'well, well, well']",53,6,0.91,53,42,42,0,0,0.0,0
1jgpqq7,F1 drivers have held ‘fair discussion’ with FIA over swearing rules,https://www.reddit.com/r/formula1/comments/1jgpqq7/f1_drivers_have_held_fair_discussion_with_fia/,2025-03-21, News,,"['I wish Kimi was still here so they could ask him about this shit', 'This whole thing is so dumb.', ""I'd say something, but the FIA would just give me a $10,000 fine..."", '![gif](giphy|4vYksifnc7Sw)', '""It was a fair discussion: we were very careful with our words, and in return no fines or race bans were handed out""', 'no fucking way, you simply can’t have a “fair discussion” with those bastards', 'Bullshit.', 'Yeah, and Grizzly Adams had a beard /s', ""The more they're told not to swear, the more noticeable and tempting it'll be especially in the heat of the moment. Like trying not to eat the forbidden fruit. It's just even blown up than it should be and I would hate to sit in this kind of meeting and having a dialogue about it when it's clearly dictated by the FIA themselves.""]",45,32,0.81,45,216,216,-6,0,-0.019999999999999907,-6
1jhbzkm,[AMuS] Now Mercedes is also getting involved,https://www.reddit.com/r/formula1/comments/1jhbzkm/amus_now_mercedes_is_also_getting_involved/,2025-03-22, News,,"['AMuS Mercedes hopium article. The season has well and truly started now', 'The car looks good but not great. Its just fallen away in the races from the front pack and Charles was quicker than George at the end of the sprint. \n\nThey might nail an upgrade and could be really in the hunt though, so if George keeps getting consistent top 5s and podiums and then the car becomes a race winner it could get spicy.', 'Translation:\n\n> George Russell will start the Chinese Grand Prix from the front row. The Mercedes driver is a prime example of the thin air at the top of Formula 1. The Silver Arrows are sensing a glimmer of hope.\n\n> Three sessions had already been completed on this Grand Prix weekend in China. Then it was George Russell\'s turn. In qualifying (March 22), the Mercedes driver conjured up a fabulous lap on the freshly laid asphalt of the Shanghai International Circuit, raising eyebrows among Formula 1 experts and fans alike.\n\n> Where did that come from? That was the question on everyone\'s mind. Mercedes had consistently finished in the top ten during the second Formula 1 weekend of the 2025 season, but based on previous impressions, few had expected a front-row start. In the sprint qualifying (March 21), Russell finished fifth, while his teammate Andrea Kimi Antonelli raced from P7 into the sprint on Saturday morning (March 22).\n\n> In the end, the Mercedes drivers finished fourth and seventh. Not bad, but nothing earth-shattering either. Until qualifying, the main topics were Lewis Hamilton (Ferrari), Lando Norris and his mistakes in the McLaren, and Max Verstappen\'s daring performances in the Red Bull. There was barely any room for the former Formula 1 dominators, until the final lap of qualifying.\n> George Russell himself was surprised by the stroke of genius he had achieved in the closing seconds. ""I don\'t think anyone expected to challenge the McLarens. Third place would have been a good result, so second place is a great result,"" the Mercedes spearhead rejoiced.\n\n> Toto Wolff optimistic for the China race. His team boss, Toto Wolff, was equally enthusiastic about his protégé\'s performance in a Sky interview: ""George is one of the absolute fastest drivers in the field – if you give him the right car."" Russell delivered when it counted. A trait necessary in this tight Formula 1 world to score big points.\n\n> Wolff also believes that despite the high tire wear in Shanghai, Mercedes has a lot in store. Last year, the Silver Arrows suffered in the high temperatures. However, the W16\'s operating window has expanded. The good starting position could therefore help Mercedes. Wolff explained: ""If you take Lewis (Hamilton) out of the sprint, almost all the cars were equally fast and had similar tire wear.""\n\n> Nevertheless, the McLarens of pole-sitter Oscar Piastri and Lando Norris, who will start from P3, are the favorites heading into the Chinese Grand Prix. Wolff agrees. ""We expect the McLarens to be strong, while the Ferraris had the edge in this morning\'s sprint. We\'ll start from P2 and try to assert ourselves at the beginning. Then we\'ll see where we end up.""\n\n> Antonelli dissatisfied with eighth place. George Russell performed brilliantly in qualifying. His rookie teammate Andrea Kimi Antonelli, on the other hand, was unhappy. ""I\'m a little disappointed. It was difficult to get the most out of the tires."" The 18-year-old was self-critical about his performance in the final qualifying segment. ""I had some good laps throughout the session, but my two attempts in Q3 weren\'t my strongest.""\n\n> Chief engineer Andrew Shovlin defended Antonelli. ""It was his first Q3 of his Formula 1 career. Of course, he\'ll be disappointed, but he can focus on tomorrow to attack in the race.""\n\n> There, it will be crucial to preserve the left front tire over the stints. Shovlin knows this too. ""In the sprint, we had more graining than expected. You have to be extremely careful: If you push, the tire will degrade immediately."" Qualifying champion Russell is aware of this. Nevertheless, the three-time Grand Prix winner wants to be part of the action on Sunday (March 23). ""Hopefully we can manage the tires well, utilize the car\'s pace, and achieve a strong result.""\n\n> If George Russell can confirm Saturday\'s performance and finish the Chinese GP in the top three, it would be the 300th podium finish in Mercedes\' Formula 1 history. Either way, Mercedes will be back at the front in Shanghai, making the premier class even more exciting.', 'George ""McLaren now more dominant than Red Bull ever was"" Russell', ""It's definitely too early to try make assumptions, but there is some data showing that Mercedes and Ferrari might have switched positions this year as far as you had the better car compared to last year."", 'The cars at the top all have the same characteristics. Very edgy with a narrow window to get the perfect output and it changes lap to lap on whether you’re in the top performance window. It’s going to be like this all season. One lap they are nowhere close then next lap they are on pole.', 'George will mind his business to a WDC', 'Always rooting for them ❤️', 'Imo they have the second fastest car.\xa0\n\nBest not get into what I think the rest of the pecking order is because I’ll get downvoted.']",51,43,0.9,51,41,41,22,7,0.010000000000000009,22
1jgnmq5,What to Do With F1 Season Reviews on VHS?,https://www.reddit.com/r/formula1/comments/1jgnmq5/what_to_do_with_f1_season_reviews_on_vhs/,2025-03-21, Discussion,"TL;DR I have a collection of F1 season reviews on VHS that I don't want to just throw away. Not looking for any money. How can I get these to someone who would appreciate them?

I have years 1998-2001 on tape. Just dug them out of storage. I buy the season review every year and now have 1970-current on DVD.

Back in the day, pre-internet, you had to call Duke Video in England, talk to a live person, and make sure they convert the tape from PAL format to the US-friendly NTSC standard (an extra fee). With shipping they were quite expensive. 

I'd wait weeks for them to arrive, then gleefully pop them into the VCR to enjoy. 

And now I've got this mini collection and nothing to do with them. I have no desire to list them on eBay or make any money off them. I just really would like them to go to a fan. 

Any ideas?","[""Post this on r/datahoarder. They're a bunch who backs things up for the hell of it, maybe there's an F1 fan there who'd like to preserve what you got. What you got is a niche but valuable trove, it'll be awesome if the whole thing gets digitised by a peer to be shared among peers."", 'Convert them to digital and upload them....well somewhere. Internet Archive is always a solid bet. But also here would work', ""As some said... convert them or donate them to someone who will convert them. Plus they are an awesome part of any collection. I would put them right behind my f1 car collection, I have a capture device for VCRs. EDIT: don't have a VCR tho."", ""I do video digital capturing/restoration and AI upscaling/cleanup as a part time business. Happy to do it for you if you're down to cover the shipping or can give you a guide on how to do it yourself. DM me if interested."", 'Upload them to YouTube!', 'Vhs to dvd recorder and then upload', 'FWIW, many if not most of the Season Reviews are already available on YouTube. Maybe check and see if your copy has differences and if not then you likely don’t need to worry about backing them up for posterity. If you want your own back up, then that’s another story and you should just go for it!', 'I really appreciate all the comments! I don’t have the time or equipment to convert to digital, and I already own all of them on DVD. I just posted them for free on FB Marketplace. Hopefully someone will come pick them up. I’d even ship them if someone would cover postage.', 'I would check with a 49ers and/or Cowboys fan for help in this area.']",40,14,0.89,40,160,160,-6,0,-0.030000000000000027,-6
