unique_id,post_heading,post_url,publish_time,tag,post_content,top_comments,upvotes,comments,upvote_ratio,score,total_upvotes_comments,total_score_comments,upvotes_growth_rate,comments_growth_rate,upvote_ratio_growth_rate,score_growth_rate
1jsnrlw,Max Verstappen wins the 2025 Japanese Grand Prix,https://www.reddit.com/r/formula1/comments/1jsnrlw/max_verstappen_wins_the_2025_japanese_grand_prix/,2025-04-06, Race,,"['""That\'s all the highlights? That\'s all that happened in this race?"" Oscar lmaooooo', 'Sainz and Hulkenberg the entire time:\n\nhttps://i.redd.it/7yi92guzr5te1.gif', 'https://preview.redd.it/t74cq6gbt5te1.jpeg?width=1125&format=pjpg&auto=webp&s=f97f5b1a7e1e750489f25612a07b68186ab78b44', 'The best moment of the weekend.\n\nhttps://i.redd.it/fcz4ddm9t5te1.gif', 'If Max walked into the post race room and was like ‘I think Oscar could have caught me’, it could literally ruin McLarens season.', 'Who put Monaco this early on the F1 calendar', 'Bringing the 3 hardest tires was a mistake.', 'This race could have been an email.', 'This might be the first time I enjoyed watching the free practices more than the race itself. I already miss the grass fires', 'Say the line Bart!\n\nhttps://preview.redd.it/hs2zy4mur5te1.jpeg?width=750&format=pjpg&auto=webp&s=7ad56ed2ee67cd221d8c71f20b593578ff4fec06']",18731,1530,0.94,18731,496,496,1081,46,0.0,1081
1jslmu8,[dazn_es] This is how Fernando Alonso and Carlos Sainz were amazed by Max Verstappen's pole position,https://www.reddit.com/r/formula1/comments/1jslmu8/dazn_es_this_is_how_fernando_alonso_and_carlos/,2025-04-06, Video,[Source](http://www.instagram.com/reel/DIFvwYOhFyP/),"['I swear I heard a ""Magic Alonso"" in the commentary there, Really3D lives on.', ""Pure joy on Nando's face ise just amazing haha. He's so proud."", 'This is like his Monaco 2023 pole where the drivers watching were just in awe. There’s really nothing you can say, he’s that good.', 'I love the exact same reaction of a single step forwards in shock', 'Sainz going forward without him realising should tell everything about that magic lap', ""One of my favorite show is Fool Us, where a magician perform their act in front of Penn & Teller and tries to 'fool' them.\n\nThe reason why is the same reason why I love to see this video.\n\nIt's always something, to watch a performance so so good, fellow professionals are in awe and obsessed with it."", ""Max is one of the best ever\n\nAnd Suzuka with fresh pavement looks so weird. I'm used to the faded grey not the fresh blacktop"", ""This is why post-race cooldown rooms are very interesting to watch, but it's not long enough, and they keep cutting it away..."", 'Proud uncle Fernando', ""Find yourself a woman that looks at you like Alonso looks at Max's racing highlights.""]",7836,87,0.98,7836,84,84,465,3,0.0,465
1js6l9c,[F1] Taking the lap record at Suzuka. What a lap it was from Max Verstappen in Q3!,https://www.reddit.com/r/formula1/comments/1js6l9c/f1_taking_the_lap_record_at_suzuka_what_a_lap_it/,2025-04-05, Social Media,,"['Without Max, red bull is probably midfield team. What a lap !', 'The perfect lap. This is what 2021 Jeddah was shaping up to be...', ""I've been watching F1 for the past 18 years now. I've seen Seb, Lewis and Alonso all at their peaks, and Max feels like an amalgamation of the three.\n\nHe's shown Seb's utter dominance and sheer pace, he's shown Lewis' consistency and ability to always make himself a threat at every race, and he's shown Alonso's giant-killing performances at two different points of his career: as a 20 year old newbie, and now as an accomplished champion and veteran of the sport. Just an absolute phenomenon."", 'Regardless of who you support, it shouldn’t be hard to respect the greatness of Max. I’ve never been an outright fan, clearly i support Lewis. But when Max does a Max, just as Lewis used to Lewis, i sit back and applaud him. Your favourite driver knows that Max is one of the greatest to ever do it.', ""I'm always in awe when regulations are designed to slow cars down, and the teams keep finding ways to actually make them quicker."", 'This guy is literally made in a science lab', '![gif](giphy|vCJrwYGBQlbdS|downsized)', ""A show of skill, pure and raw. That's a champion."", 'i went crazy last night watching this. good shit from the dutchman', 'It was honestly really nice to see Max happy again for once. When was the last time we heard him cheer that loudly and have a smile that large?']",5518,112,0.97,5518,5641,5641,19,0,0.0,19
1jsn5ok,Kimi Antonelli has broken Max Verstappen's record as the youngest driver in Formula 1 history to lead a race.,https://www.reddit.com/r/formula1/comments/1jsn5ok/kimi_antonelli_has_broken_max_verstappens_record/,2025-04-06, Statistics,,"['by just 4 days too 😭', 'Mercedes quietly having another good race lol.', 'Used up all the grass fires too early lol, short little red flag would have done nicely for a while there!', 'I fully expected his season to always be ""2nd youngest to do xy"" so nice to see he broke one record', 'Over 30 laps on mediums', ""What an important record that is too. Especially in the era of pit stops where of course a driver we all know isn't going to go on and win will briefly lead while pit stops play out.\n\nSeriously were this the seventies without pit stops one pretty much only leads on pure merit not on a simple rotation until one pits oneself.\n\nStats really can go too far I feel."", 'Kimi Antonelli is the future. He is proving it every race.', 'Imagine if we had a red flag for another grass fire right now.', 'kimi ant to win this race']",5172,88,0.99,5172,80,80,390,2,0.0,390
1js5rlm,McLaren admit Verstappen’s pole lap was “near-perfect”: Lap time data,https://www.reddit.com/r/formula1/comments/1js5rlm/mclaren_admit_verstappens_pole_lap_was/,2025-04-05, News,,"[""Horner admitted it too. He said their data the ideal McLaren lap was only about half a tenth faster than what Lando did, so Max's lap was just genuinely ridiculous.\n\nI think the consensus around the paddock is the McLaren drivers did a really good job, but Max just put in one of if not his greatest quali lap ever, because he's Max and doing great things is what he does."", ""Just a Lap of the gods from Max, he loves Suzuka, I remember when he destroyed everyone after they didn't win in Singapore in the previous race"", ""Honestly, Max needs to be perfect all the time to come close to battling the McLarens.  \n\nLando and Oscar have the advantage of not needing to push the car to its limit to comfortably win.  McLaren have a fantastic car that's clearly the fastest and with a strong operating window.  The only weakness I see is that it struggles in dirty air, but that isn't something unique to them.  \n\nThe Red Bull is clearly a difficult car to drive this year AND lacks pace.  Even Max is fighting the car hard in order to maximize it's capabilities.  He's clearly pushing the car to its limit and that is a risky thing to do over the course of a season.  It's very easy to go over the line when constantly pushing the car to the limit.  If Red Bull don't sort out their issues, they don't have much chance of WDC or WCC.\n\nI don't think Lando and Oscar have maximized the capabilities of the car.  However, I do think they've shown growth from last year so that does not bode well for the other teams.  They don't need to be perfect in that car, just good enough to beat the competition."", ""Reminded me of THAT Senna lap at Monaco.\n\nI don't have much higher a compliment."", 'I am still in awe of his lap', ""This is where the driver makes the difference and why Max is worth every penny, to get that result and squeeze out that lap that no one else can.\n\nMaybe he won't take the win tomorrow but he will have gotten the most out of it and given the team the best chances regardless.\n\nOver a season these little differences can really add up as we saw last year."", 'That lap from Max and Lewis’ Singapore lap in 2018 are two of the greatest qualifying laps I’ve ever seen.', 'Max is just an absolute legend. Pleasure to watch him drive', 'It is good that credit is given where it is due. Piastri nearly had a fantastic lap as well, but sector 1 blew those chances a little bit as well. Not to mention that Verstappen merely capitalized on the few seconds that he could find in the two final sectors as well\n\nIt is wickedly good and the cars in the first two rows would be very fun to watch tomorrow']",4115,173,0.98,4115,7830,7830,23,0,0.0,23
1jsnvgd,"Max: “Wow! Woah! Thank you guys, oh mate, what an unbelieveable weekend, what a turnaround after the difficult start, ah.. We never give up, we keep pushing together. Well done everyone.”

“We keep pushing. Unbelieveable.”",https://www.reddit.com/r/formula1/comments/1jsnvgd/max_wow_woah_thank_you_guys_oh_mate_what_an/,2025-04-06, Video,,"['Lewis is that you? Jokes aside, what a beautiful win for Max and an awesome farewell gift to Honda!', 'Max turning into Lewis', 'The crazy thing is that, Max seems to still have something left in his tank.\n\nWhenever Lando is nearly close to DRS, the gap immediately expands', ""Lando’s still waiting to get into Max's DRS"", 'Such an important weekend to keep the momentum going, it’s not even just “damage limitation before upgrades bring him back into the fight” anymore, he’s almost leading already.', '""Let\'s bring that Hadjar guy over to the seat next to me"". Absolutely happened', '![gif](giphy|vCJrwYGBQlbdS|downsized)', 'Oh god I missed the F1 outro', 'Never tought it would happen at the start of the weekend.\nEven yesterday after the quali I was ""yea sure after turn 1 norris is in front and verstappen is in a mclaren sandwich""\nBut im glad i was wrong.', 'Deserved win. Lovely drive']",4154,208,0.97,4154,199,199,386,9,0.0,386
1jso4f0,Max Verstappen is the fourth driver ever to win at least one Grand Prix in ten consecutive seasons.,https://www.reddit.com/r/formula1/comments/1jso4f0/max_verstappen_is_the_fourth_driver_ever_to_win/,2025-04-06, Statistics,,"['It’s interesting how Hamilton and Schumacher are tied both in this stat and championship', 'At age 27!! What an accomplishment', 'Further etching his place among the all time greats. The records Max will hold at the end of his career will be incredible.', 'Insane stat actually. From clever opportunistic wins in the Merc era to absolute domination like today. Max is truly one of the all time greats.', 'I know we all think this but the fact Max has already been in for 10 seasons is nuts and makes me feel old', 'Not a bad list to be in', 'That’s an elite list.', ""Genuinely hoping that the RBPT isn't shit, just to see how far can Max go ahead with a competitive car in hand in the future."", 'Masterclass']",3721,110,0.99,3721,100,100,442,10,0.0,442
1jsnwd5,This is the first time since 2017 that Williams got 3 consecutive points finishes,https://www.reddit.com/r/formula1/comments/1jsnwd5/this_is_the_first_time_since_2017_that_williams/,2025-04-06, Statistics,,"['https://preview.redd.it/zv2y89hrt5te1.jpeg?width=640&format=pjpg&auto=webp&s=e8f3a1a790df94b4df4420b60e7515f5ec717c73', 'My man Albon absolutely delivering every weekend!', 'James Vowles is very quietly doing good things at Williams', 'Albono has been an absolute unit this year.', 'Albono is cooking', 'Both of them pulled off some super clean overtakes!', 'Williams have more consecutive points finishes this year than Ferrari', 'ALBONO STONKS!', 'I used to pray for times like these']",3324,55,1.0,3324,47,47,326,2,0.0,326
1jsouh8,"Max Verstappen jokes about the moment with Lando Norris when exiting the pit lane: ""I think the grass was a bit… a bit not rightly cut on the right-hand side. Lando saw that as well, and he made sure it was nicely cut!""",https://www.reddit.com/r/formula1/comments/1jsouh8/max_verstappen_jokes_about_the_moment_with_lando/,2025-04-06, Video,,"['Contd. \n\nLando: ""I wasn\'t even trying to race Max, I was just trying to cut the grass like he said. I didn\'t even know he was there.""', 'As if they made a pact to not give the media any ammunition for BS headlines and made up stories, which is good :)', ""Not to take anything away from Max's superb weekend, but that was the most boring race I've seen in quite a while."", 'The grass catching fire because of Lando would have livened things up', 'F1 driver going off 🤝 landscaping', ""LMAO... Max is unhinged. Race hard when on track, and then he's totally on fun mood."", 'I am glad that Lando is more chilled in his comments about this.\n\nImagine if this happend with Russel, attempting murder charges.', 'Always love Max making jokes about the championship leader.', 'I love Max. He\'s so sassy. Not insulting anyone but the boring PR trained drivers don\'t do it for me. Also, I wasn\'t a fan of Hamilton and his ""humble"" style of interview.', 'Max is an absolute menace with the media. Lol']",2472,101,0.99,2472,95,95,362,11,0.0,362
1jsn3pn,Verstappen / Norris Pit Exit Incident,https://www.reddit.com/r/formula1/comments/1jsn3pn/verstappen_norris_pit_exit_incident/,2025-04-06, Video,,"['Finally a little bit of action lol.', 'Send the TV director straight to jail, wtf', 'Great job missing that one on the broadcast, F1', ""Looks like a move you'll do in the f1 game tbh"", 'A car didn’t fit in that gap Lando\n\nSo I wouldn’t try', 'That was on norris\n\nAnd did lando just call out a blatantly unsafe release by his crew', 'What was Lando expecting exactly? That’s on him.', 'https://preview.redd.it/xtv2zyb8l5te1.jpeg?width=1174&format=pjpg&auto=webp&s=9a2451af4e9f46e6f2acab875df86a52852d4960', '""I was alongside""\n\nSo Max is supposed to just stop and let him through?', 'Moronic attempt by Mclaren, made worse by Lando.']",2200,519,0.98,2200,452,452,101,23,0.0,101
1js8xig,"Max giving Nico a tow in Q1 | GP: Well done, Nico needed that tow. Just got out of the bottom 5. | Max: Ah, not bad!",https://www.reddit.com/r/formula1/comments/1js8xig/max_giving_nico_a_tow_in_q1_gp_well_done_nico/,2025-04-05, Video,,"['Nico gave max pole in Imola last year, It seems like they really are tow buddies😂', 'Max: 🙂\nNico: Hee, viespeuk!', 'Please try and tow him to the podium in return', 'Nico said he’s closet to max on the grid right? They’re dogs', 'Tow buddies for life', 'Traditions', 'Pretty sure that Hulk guy would be decent in the second seat\xa0', 'Future WEC teammates', '![gif](giphy|fDS2v18KbmekM|downsized)\n\nStake needing draft donations', 'Serious question: Why don’t teammates do this more often? Especially in longer sessions like Q1.']",1971,129,0.98,1971,6447,6447,5,0,0.0,5
1jsqzx0,"Max on Instagram; Thank you, Honda Grateful and proud of everything we’ve achieved together over the years.",https://www.reddit.com/r/formula1/comments/1jsqzx0/max_on_instagram_thank_you_honda_grateful_and/,2025-04-06, Social Media,,"['Max definitely honoured Honda efforts and made them proud. Just like Aryton.\n\nAlso fucking impressive what Honda did, from being humiliated by McLaren and Alonso to winning championships with Max and RedBull. \n\nIt just shows how important is for two companies to focus on solving issues together, during the McLaren times they got public blamed for everything when in reality McLaren also had a horrendous chassi but never owned their part.', 'Simpely Lovely, really enjoy the respect Max and Honda always show each other', 'Nice race result for Honda in their home country', 'Emojis aren\'t allowed on the title so here is the original one; ""Thank you, Honda 🇯🇵 Grateful and proud of everything we’ve achieved together over the years.""', 'Some say this simple gesture is the reason why Honda loves Max more\n\nhttps://preview.redd.it/g3y6epgqq7te1.jpeg?width=2000&format=pjpg&auto=webp&s=6df79d4c730d96c4cad51cea22e72468cac6a9e0', 'This is a heartwarming break up.', 'Hopefully this partnership between Max and Honda will continue', 'Watanabe san will rival Toto in being persistent at asking Max to join him at Aston. The man utterly adores him.', 'What an incredible journey for Max, RBR, and Honda from 2019 to 2025.', '“The power of dream” - this is a bit touching. It would not feel the same to have Honda with Aston next year']",1949,56,0.99,1949,54,54,534,6,0.0,534
1jsntfd,[Scuderia Ferrari via IG] The chequered flag falls in Japan,https://www.reddit.com/r/formula1/comments/1jsntfd/scuderia_ferrari_via_ig_the_chequered_flag_falls/,2025-04-06, Social Media,,"['Not horrible, not great', 'At least Charles has been great doing stand up comedy on the radio', 'Just show how qualifying matters most. If not for Charles qualified at P4 he can’t keep George behind. On point strategy and great pit stop to have Pierre between Charles and George out of the pit. \n\nLewis ended 10s behind Kimi. \n\nFerrari had no pace to the top two teams, and Lewis is behind Mercedes on pace.', ""P4 was the best we could do today, Mclaren was out of reach and Max is just Max. Very disappointing with Lewis, losing 10s on mediums is just crazy. Let's hope the update works well!"", 'This is going to be a long year huh.', ""Definitely the 4th fastest team now :(\n\nThere's no doubt about it. \n\n10 seconds + behind Kimi and Oscar for Lewis and Charles respectively."", ""Depressing but I'm used to it."", 'NextYear™\n\nhttps://preview.redd.it/zcq2kwfrs5te1.jpeg?width=688&format=pjpg&auto=webp&s=e393eca54b3aa03547315af1f25694a9135834bc', 'Always next year /s', 'Charles always squeezing the best he can. Lewis is a good man but the tempo his game needs a change. The strategy was here and there. Going on hards and pitting at 29 laps and then not being able to overtake on his medium. \n\nSame with Sainz, trying to make pace or I guess best lap with his soft on that car. \n\nSame thing, Lewis asking his team about data and the team making it a 3 step process instead of 0/1/2 steps.']",1610,176,0.99,1610,165,165,159,7,0.0,159
1jsogo3,"Kimi Antonelli, youngest driver to have a fastest lap in a F1 race",https://www.reddit.com/r/formula1/comments/1jsogo3/kimi_antonelli_youngest_driver_to_have_a_fastest/,2025-04-06, Statistics,After setting a record earlier in the race by becoming the youngest driver ever to lead a race,"[""Loved the radio where Bono was calmly telling him he's the fastest out there but kid sounded like he was hanging on for dear life"", 'I like that the picture makes him look very fast.', 'My eyes hurt', ""I'm gonna say it, hes gonna win a race this year if the circumstances allow it.\n\nVery impressed with both his speed and his attitude."", 'You know at first I was disappointed that Lewis and Bono would end their partnership. \xa0But now I’m so excited to see what him and Kimi can achieve!', 'This kid is gonna be the next big thing.', 'Kimi is going places!!!!', 'We thought those records from Max were save for a long time if not forever. Turns out records are still made to be broken, though Kimi can\'t break Max\' ""youngest winner"" anymore.', 'aKa Andrea Kimi Antonelli is on fire 🔥']",1464,32,0.98,1464,30,30,295,1,0.010000000000000009,295
1jsntx1,"[Redbull Racing via IG] Simply Suzuka! Max takes home an incredible win, and Yuki puts in a solid performance to finish in P12.",https://www.reddit.com/r/formula1/comments/1jsntx1/redbull_racing_via_ig_simply_suzuka_max_takes/,2025-04-06, Social Media,,"['Today is 6/4 and it is win number 64 for Max Verstappen.', 'Compared to Liam, the weekend was solid, compared to Max it is still shit', ""Yuki's car just didn't have the straight line pace. Bro was stuck behind Gasly for half the race and Alonso the other half, and despite being in DRS never gained any time in the DRS zones."", 'The Should Have Been Driver of the Day \n\nThe Driver of the Day???', 'Max domination how I missed you so much, I mean that race was so boring', 'I mean P12 is better than P18', ""When you can't have a 1 & 2, just go for 12"", ""honestly not too bad for yuki, if he qualified better he would've finished much much higher i think"", 'Qauli killed any chance of points for Yuki, but max showed why the team is built around his talent, the guy is insane', 'Max is god.']",1154,168,0.96,1154,160,160,52,7,0.0,52
1jsns0d,Charles Leclerc overtakes Sebastian Vettel as Ferrari's all-time leading points scorer,https://www.reddit.com/r/formula1/comments/1jsns0d/charles_leclerc_overtakes_sebastian_vettel_as/,2025-04-06, Statistics,"This time hopefully for good

","['In before disqualification again', 'I can’t wait for 15 minutes from now when for some reason Seb gets promoted to top scorer again', 'Must be frustrating for him...Seb was at least in championship contention twice. Charles just getting points but nowhere near a title.', 'Stewards have the chance to do the funniest thing of all time', ""I've seen this episode before"", 'This is such a silly stat, I hate when people or even F1 themselves brings it out. 😄\n\nPoints system obviously makes a huge difference, we all know that Michael would be miles ahead with an adjusted points distribution.', 'i have this weird sense of dejavu...', 'How reduced was the points system when Michael was driving?', 'For now']",1102,57,0.99,1102,54,54,66,0,0.010000000000000009,66
1jsnsie,"New Japan GP lap record for Antonelli, beating Hamilton's time from 2019 (1:30.983 s)",https://www.reddit.com/r/formula1/comments/1jsnsie/new_japan_gp_lap_record_for_antonelli_beating/,2025-04-06, Statistics,,"['Kimi continues to be impressive and only getting better.', 'Youngest ever Race Record maker?', 'Also the youngest driver to sign a fastest lap in F1', 'It took us only 3 years to gain back the time lost from these regs \n\nF1 development is ridiculous', 'Both lap records got broken this weekend', 'He might be the next generational talent after Schumacher, Hamilton and Verstappen. Only time will tell.', 'Good lad!', 'He’s replacing Lewis everywhere he can', 'Youngest driver to get a fastest lap and lead a race.']",1002,27,0.99,1002,25,25,35,0,0.0,35
1jsrcht,"Ferrari boss Fred Vasseur believes F1 is in danger of becoming a “qualifying world championship”, with overtaking at a premium in recent rounds",https://www.reddit.com/r/formula1/comments/1jsrcht/ferrari_boss_fred_vasseur_believes_f1_is_in/,2025-04-06, News,,"['dominecalli ""oh let\'s add more street circuits to help this situation""', ""This is what Japan will be like every year if the tyres last forever. It's a hard track to overtake on, the variety in strategy you get from the usual 2 stops creates overtakes"", 'Funny that these regs were designed to make following a car easier.', 'The main thing that needs changing is the cars and their size and width, otherwise we have to change most historic tracks on the calendar, only F1 has this issue btw with these historic tracks and I do not want to see a calendar without Suzuka or Spa for instance.', ""Genuine question, when was racing considered ''good''? Last gen was too difficult to follow, the schumi-Alonso era was also complicated with refueling etc..."", ""Happens when tyres have no degradation and the delta between cars is very small, you won't see any overtakes on a track like Suzuka"", 'It doesn’t help that Melbourne, Shanghaï and Suzuka are three tracks where overtaking is not easy. Bahreïn should be better.', 'It pretty much is for half the tracks', 'Suzuka is a very narrow track for modern F1 cars.']",1172,160,0.99,1172,150,150,567,39,0.010000000000000009,567
1jsq3kf,"[Max Verstappen via IG] This one means a lot. What a great weekend for us, we never give up",https://www.reddit.com/r/formula1/comments/1jsq3kf/max_verstappen_via_ig_this_one_means_a_lot_what_a/,2025-04-06, Social Media,[https://www.instagram.com/p/DIGXnjKou4Y/](https://www.instagram.com/p/DIGXnjKou4Y/),"['You could hear on the radio that this weekend meant a lot to him.', 'Is Redbull back, or is it Max+Suzuka effect?', ""Why don't redbull be with white always?"", ""Pretty awesome weekend for him. Again absolute maximisation of the results like he had been doing for years now. \n\nIf Red bull gets their act together just a little bit he might genuinely be able to content for the title. Let's hope the flexing TD from Barcelona on helps even further in leveling the playing field."", 'Goat performance. No other driver would pull off what he did in that car this weekend. \nHe does this kind of goat level stuff all the time. Simply the best', 'Good job for the win Verstappen racing!', ""Feels like if the car is within 2 tenths of McL most races he'll keep the title fight alive to the end."", 'That trophy is kinda classic yet ugly at the same time.', 'He made Honda so proud. \U0001f979', ""The best ever\n\nCan do it in a good car, can do it in a mediocre car.\n\nHes just flat out better than anyone we've ever seen.""]",979,30,0.96,979,29,29,146,5,0.010000000000000009,146
