unique_id,post_heading,post_url,publish_time,tag,post_content,top_comments,upvotes,comments,upvote_ratio,score,total_upvotes_comments,total_score_comments,upvotes_growth_rate,comments_growth_rate,upvote_ratio_growth_rate,score_growth_rate
1jh98nx,It’s Helmut Marko who should be under pressure - not Lawson,https://www.reddit.com/r/formula1/comments/1jh98nx/its_helmut_marko_who_should_be_under_pressure_not/,2025-03-22, Discussion,"As bad as Liam Lawson has been so far, he is the fourth driver in a row to be in that second Red Bull seat and not look up to scratch. 

Helmut Marko heads up the Red Bull young driver programme, and in recent years has overseen the decline of an academy that brought through Vettel, Ricciardo, Sainz and Verstappen into one that has produced one race win since 2018 (Gasly’s at Monza in 2020). Meanwhile, other academies have brought through Leclerc, Russell, Norris and Piastri with far greater success and this season has seen Antonelli, Bearman and Bortoleto all graduate to F1 through other teams as well. 

Where Red Bull were once the undisputed number ones at bringing through young talents, they’ve been usurped by Mercedes, Ferrari and McLaren and have reached a point where the only realistic alternatives for their second seat are to stick with Lawson or promote Tsunoda or Hadjar with the likely end result being another driver that gets taken to the cleaners by Max.

As much as people enjoy beating up on and memeing Max’s teammates, the truth is that if Marko had done his job and not spent the last few years failing to identify the better junior talents, or given them more time to develop before throwing them in at the deep end, they wouldn’t be in the position where their second seat has turned into a carousel of underperforming drivers. 

In a sport where we regularly see drivers, team principals, engineers and designers lose their jobs for failing to perform, it’s amazing that Marko hasn’t come under any scrutiny himself given that ultimately, he is the one responsible for finding and developing the drivers that are failing to deliver for Red Bull. Gasly, Albon and no doubt soon to be Lawson are merely collateral damage as a result of his failures.","['Marko used to be able to sign whoever he wanted because Red Bull used to entirely fund drivers juniors career - in exchange they had them on 5 year option contracts. \n\nThis is no longer the case, so they no longer have the pick of the litter, plus they still stick the 5 year option contracts on which make them more unattractive.', 'I’m not a fan of Marko because of his views and how he talks - but the RB young driver program has had a lot of good drivers come out of it. How many are flourishing in other teams right now? It just seems no one can stay close to Max.', 'Why? Helmut brought good drivers to the team: Yuki, Gasly, Albon are all great drivers and he promoted them to RB or rb seats. Lawson also a good driver, he already proved that in the Visa Rb. I dont think it is Marco’s fault that Red Bull is requiring something extra as well to be able to competitive in that second seat.', ""Verstappen, Sainz, Albon, Gasly, Tsunoda, Lawson, Hadjar.. I don't know why RB always gets shit for it when it gives far more opportunities than any other team on the grid."", 'What pressure?  He’s 180 years old. He’ll retire anytime. This is Horners problem. His leadership is obviously having a big impact on the teams performance.', 'Many might consider this to be a hot take: Yes, the car is hard to drive, Lawson has to improve a lot and Red Bull **was** quite ruthless with their drivers, BUT - Right now, the internet/commentators are the ones who put Lawson under this immense pressure, call for (or discuss) his immediate replacement and write him off, not Red Bull.\n\nAs far as it concerns me, almost anybody will struggle with this car.', ""Having a shitty car which seems incredible hard to drvie is not the responsibility of Helmut Marko. Firing him doesn't make the car better"", 'People really ignore how hard is it nowadays to get promising drivers to their academies, RedBull were the first to do a proper academy and it showed with Vettel,Kvyat,Albon,Gasly,Ricciardo,Sainz , even Buemi Hartley Vergne went on to have great careers outside F1 \n\nNowadays all drivers who go on to reach F1 from F3 are signed to a team, Antonelli got signed in Karting if I remember correctly, Norris, Russell, Piastri all did F3 as academy members of Mclaren Merc and Alpine \n\nIt’s impossible to hoard that much talent nowadays because there 5 other teams promising a better promotion scheme to every upcoming driver', 'I think this is more on the car building side. Even Max is struggling with it. Had they not made such a difficult car to drive, who knows how Lawson would perform. They need to get some updates in asap to fix the issues or they risk not only the championships but possibly ruining another drivers career. No one else can do what Max does. They need to accept that and make the car better.']",535,213,0.78,535,199,199,190,25,0.020000000000000018,190
1jh4xj3,[Oscar Piastri via Instagram] Pumped for tomorrow,https://www.reddit.com/r/formula1/comments/1jh4xj3/oscar_piastri_via_instagram_pumped_for_tomorrow/,2025-03-22, Social Media,[https://www.instagram.com/p/DHfyFrZiRhu/](https://www.instagram.com/p/DHfyFrZiRhu/),"[""Please don't pit Norris first, McLaren"", 'His hair looks so weird like this lol', 'I’m surprised they pump the tires that long in advance.', 'Oscar', 'He does actually look pumped for once. So excited for him', 'A great day for Australia, and therefore the world!', 'He can finally start his Tyre collection', 'Oscar honey that haircut is not doing you justice right now. I could do donuts on your forehead, someone please make him take another picture', 'We are checking', 'Oscar should do a buzz cut like Doohan']",436,21,0.96,436,20,20,33,1,0.0,33
1jh44fp,"Akex Albon's performance has been fantastic this start of the year, and I think he has silenced a lot of critics",https://www.reddit.com/r/formula1/comments/1jh44fp/akex_albons_performance_has_been_fantastic_this/,2025-03-22, Discussion,"As a spaniard, a lot of people were thinking that Alex Albon would be totally crushed since the beggining of the year due to Sainz being a veteran and having far better results, but for now the tables have turned in favor of the Thai driver, of course Sainz has less experience with the team but still it's not a great start for him, I think many people underrate Albon just because of his bad year with Red Bull and that his other teammates at Williams weren't as fast.","['He’s been very good since joining Williams, single handed got us P7 in 2023 and has demolished his teammates in recent years. Sainz is still new and I’ll give him another few weekends before properly assessing him.', 'Its been 2 races but he has been great', 'As a Thai, I am also rooting for Sainz! Albon has been excellent so far', ""Its early doors, with Sainz still getting used to the car. But Alex has definitely stepped up. He deserves credit for that. There's been clear progression since his RB days and he's become a very good and reliable driver"", 'Even Sainz said he won’t feel comfortable until at least 5 races in. The people who were critics of Albon are essentially clueless. Listen to how other drivers speak about him.', ""There was never any doubt in my mind that Alex would at least be the equal of Carlos. Equally there is no doubt in my mind that Carlos will improve as he gets to understand and set the car up better race by race. Another few races and I reckon they'll be trading blows."", 'I don’t think any less of Sainz, but am happy to see Albon getting credit.\n\nTo be honest they both seem like genuinely nice guys and I hope they do well together.', 'The good proverbial you might get what you wish for, just not exactly in that exact order. \n\nA lot of people were automatically discounting Albon saying he would get utterly humiliated. Thus far it’s going exactly the other way around.', 'Race 2']",417,118,0.93,417,111,111,28,5,0.0,28
1jh3nvq,[@scuderiaferrari via Instagram] We'll be on the third row of the grid tomorrow. Plenty of opportunities to be had!,https://www.reddit.com/r/formula1/comments/1jh3nvq/scuderiaferrari_via_instagram_well_be_on_the/,2025-03-22, Social Media,,"['Race pace was decent and Lewis is might in the middle sector so hopium for a podium', ""From starting on 4th row in Australia to 3rd row in Shanghai, it's an improvement."", 'Lewis could get a podium from here.', 'I feel good about the long term race pace. Especially with Lewis. Let’s go Ferrari!', 'Honestly speaking I’m not even worried about this result. When I heard the wind picked up from Alex Albon I knew pole from Ferrari would be hard since, they are not running that high of a downforce compared to McLarens so they lack the bite and efficiency for turn 1. I really hope people here are not being reactionary cus I feel we genuinely have a good car.', 'I think this is a good place to start and kick things off especially if Ferrari is more tuned to race pace. Tomorrow is all for the points and if we play it well we could do a really good race.', 'What has been fun this season and for a large part of last season is that I feel like if you’ve been able to qualify in the top 8-10, you have a chance at winning.', ""I'm holding out for that glorious late stint tyre wear to kick in for the other drivers. For both Lewis and Charles that seemed to be where things picked up in the sprint."", 'I feel like Sir Lewis has something extra in the tank this weekend and will threaten a podium, maybe even a win, just by being a tyre whisperer.', 'If Lewis has the pace of the sprint he could still fight for the win from p5']",376,141,0.97,376,134,134,0,4,0.0,0
1jh3vlu,"Lando when asked if the car is tricky to drive: “I've said that plenty of times, it is. It's still quick enough. we never doubted it was the quickest car, it can just be a bit feisty at times. Today it’s not so much that, it was just mistakes from my side that’s all”",https://www.reddit.com/r/formula1/comments/1jh3vlu/lando_when_asked_if_the_car_is_tricky_to_drive/,2025-03-22, Video,,"['It was big for Oscar to finally get his first pole after trailing Lando for the majority of their quali sessions so far. Great bounce back from last weekend and hopefully this willl be the start of a great championship battle.', 'i have a brilliant idea, let’s put lando in the red bull!', 'People were hating on him for saying that the car is a bit difficult to drive. But it can be tricky AND fast these are not mutually exclusive things 😭', 'He learned to answer what the fans want to hear', 'Bro needs to lock the fuck in for tomorrow. Hope the setup changes have helped', ""he also said that he's obviously disappointed not being on pole but oscar deserved it and he looks genuinely happy for him"", 'Watch him still get hate for this comment lol', 'Watch people hop in and jump him up for a mere statement', 'Lando can win tomorrow, hopefully he learned how to not start a race today.\n\nThe track looks tricky to overtake but I expect him to clear George and challenge for the win. Let’s see how Oscar behaves tomorrow, tyre management seems to be key', ""I think Lando is fast and might be faster than Oscar at the moment but he's a bit lacking in his mentality and toughness. I think he's also affected too much by outside comments about him. He should just focus on his driving and prove everything on the track.""]",354,78,0.94,354,73,73,21,0,0.009999999999999898,21
1jh6jfp,Marko refuses to rule out a new team-mate for Verstappen - 'We will analyse it',https://www.reddit.com/r/formula1/comments/1jh6jfp/marko_refuses_to_rule_out_a_new_teammate_for/,2025-03-22, News,,"['Liam Lawson is going to defeat Daniil Kvyat’s season record of 4 races.', ""God knows what's gonna happen to this team when max call it quits"", 'We all thought Doohan is the one at risk but now we talk about Lawson 😭', 'I like cars so hopefully he picks me', 'What’s the point of owning 2 teams if you don’t just switch around the drivers more to see which one sticks', 'Checo is coming back isn’t he?', 'Yuki: ""you can keep it...""', 'alternating roster between Checo and Daniel until Red Bull figure out which one of their juniors to put into that 2nd seat long term', 'If he sucks at sazuka which is basically a home race for him , considering he was in super formula and performed well there , he might actually be super cooked']",350,234,0.94,350,222,222,51,9,-0.010000000000000009,51
1jh4dkz,Lando and Oscar after the Chinese GP Qualifying,https://www.reddit.com/r/formula1/comments/1jh4dkz/lando_and_oscar_after_the_chinese_gp_qualifying/,2025-03-22, Video,,"['DTS; Norris clearly is provoking agression by keeping eye contact and showing teeth as is with most primates.', 'they clearly despise each other', 'u/FailedAccessMemory told me Lando was sulking 🤔', 'https://preview.redd.it/7s4wm1ari7qe1.jpeg?width=1169&format=pjpg&auto=webp&s=964df0315b55d2871ce3da199e840a285c66f901\n\n/j obviously', 'Norris genuinely looks happy for Piastri. How can you hate the guy', ""Everyone is all like it's going to be Hamilton and Rosberg v2, but it's more like Tom and Jerry. A bit of squabbling, then cuddles!"", 'bro is cheesing😭🧡 so glad to see oscar get his first pole and lando bounce back from his sprint mood', 'Giggling hopefully about how they’ll gap the field by 30+ seconds on Sunday.', 'Somehow DTS will make it look like the most vile team mate battle of all times', ""He's doing a bit of Landsplaining""]",306,59,0.94,306,57,57,16,2,-0.010000000000000009,16
1jh4vj3,2025 Chinese Grand Prix - Qualifying Classification,https://www.reddit.com/r/formula1/comments/1jh4vj3/2025_chinese_grand_prix_qualifying_classification/,2025-03-22, Statistics,,"['my takeaway from the past two qualis is that hajdar is apparently really good at qualifying 👍', 'Yuki’s gap to pole? lol', 'Kimi and Isack are in the front group and both are so easy to root for 👏👏👏', 'Yuki was 0.997', 'Oscar did a 1:30 though, not 1:31', 'Sadly it seems another rookie’s career is destroyed by the second red bull. I wonder if Lawson going to last longer than 5 races before he will be replaced', ""I feel like, looking at the performance of Lawson in quali the past 2 weeks combined with his words about Hadjar last week, Red Bull REALLY needs to start reconsidering Marko's influence on driver choices."", 'Look at Ocon and Hulk! Not too shabby considering their rookie teammates.', 'Look who’s at the bottom\xa0']",278,69,0.97,278,66,66,18,1,0.0,18
1jh3j3k,Oscar Piastri takes pole position for the 2025 Chinese Grand Prix,https://www.reddit.com/r/formula1/comments/1jh3j3k/oscar_piastri_takes_pole_position_for_the_2025/,2025-03-22, Video,,"['https://preview.redd.it/9ru6xita77qe1.jpeg?width=474&format=pjpg&auto=webp&s=6e841cb1455b7a6d5778466abf32055c54760df7', '""Just had a scream in my helmet... so I didn\'t burst your eardrums"" \n\nSo considerate from Oscar.', 'P1astri', 'Finally. It was about time he got pole on a proper race. Deserved.\n\nYellow sectors 1 and 2 and still improved. That must have been a monster of a sector 3.', 'INSANE third sector from the lad wow', 'COME ON OSCAR!!! \n\n1-3 BABY \n\nCOME ON!!!', 'Fantastic improvement from McLaren compared to the sprint. Also lol George just split them.', 'Oscar!!!', 'YESSSS!!!!!! OSCARRRR!!!!!\n\nBeautiful!!!', 'Finally! Papaya on top!']",273,46,0.97,273,43,43,5,0,0.0,5
1jh2b35,Drivers' Championship after Sprint,https://www.reddit.com/r/formula1/comments/1jh2b35/drivers_championship_after_sprint/,2025-03-22, Statistics,,"['Russell dark horse for WDC.', 'Kimi 4th 😭😭🙏🏽', 'Stroll above Leclerc, as is to be expected', 'How is Max 2 points behind in a shopping trolley', ""Crazy how Verstappen is competing for the WDC with what's looking like the 4th best car."", 'Max is the best driver.. no question about that. always MAXimises what he has', 'Albon is currently higher in the WDC than he finished at Red Bull.\n\nI don’t think it’ll hold, but surely with his performances at Williams to date, he’s earned himself a long-term seat, yeah? TommoF1 must be pleased.', 'Aston Martin would be so great if they could find a 2nd driver SMDH. \n\n  \n/s', 'Max is going to drag that tractor to another championship isnt he']",258,56,0.99,258,54,54,6,4,0.010000000000000009,6
1jgzslh,Lawson overtake on Doohan,https://www.reddit.com/r/formula1/comments/1jgzslh/lawson_overtake_on_doohan/,2025-03-22, Video,,"['""More of a mugging than an overtake""', 'If gap, car - Lawson, 2025', 'Not really a good way of making yourself popular in the paddock if you overtake like that.', ""Lawson can't make contact twice in the same corner and get away with it. He did the same to Bortoleto."", 'When he said he was learning from Max he wasn’t kidding.', 'Why wasn’t that a penalty? It seems he literally pushed Doohan off track. He then did the same thing to Bortoleto.', '""Bonk""\n\n\\+1 place', 'Stop playing bumper cars with the back markers dude', ""That's how I overtake on the PS5"", 'Lawson makes a huge overtake to gain P14']",253,183,0.92,253,4042,4042,-1,0,0.0,-1
1jgx69t,Nico Hülkenberg must start from pit-lane due to suspension set-up changes,https://www.reddit.com/r/formula1/comments/1jgx69t/nico_hülkenberg_must_start_from_pitlane_due_to/,2025-03-22, Technical,,"[""Sprints are basically glorified practice for teams down the grid anyway so there's no real problem changing stuff now"", 'https://preview.redd.it/cz1btxmib5qe1.jpeg?width=1382&format=pjpg&auto=webp&s=d8b86455d273b5185dcfcdac3e37c347861b0767', 'Was P19 otherwise.', 'I’m here before he finishes ahead of Lawson', 'Race ruined.  Poor guy.', 'Does this count for the race or the sprint race? I would assume sprint race but the document just says ‘race’.', 'God fucking dammit\n\nThere goes my bingo', 'Lawson starting 19th, massive.', 'Things are looking up for Lawson already lol']",255,28,0.97,255,316,316,2,0,0.0,2
1jh2aql,Jack Doohan handed 10-second penalty after Turn 14 collision with Bortoleto in Sprint,https://www.reddit.com/r/formula1/comments/1jh2aql/jack_doohan_handed_10second_penalty_after_turn_14/,2025-03-22, News,,"['Flavio: Well, Colapinto time!', '**Decision:**\n\n* 10\xa0second\xa0time\xa0penalty\xa0imposed\xa0after\xa0the\xa0Sprint.\n* 2\xa0penalty\xa0points\xa0(total\xa0of\xa02\xa0for\xa0the\xa012\xa0month\xa0period).\n\n[https://www.fia.com/system/files/decision-document/2025\\_chinese\\_grand\\_prix\\_-\\_infringement\\_-\\_car\\_7\\_-\\_incident\\_with\\_car\\_5.pdf](https://www.fia.com/system/files/decision-document/2025_chinese_grand_prix_-_infringement_-_car_7_-_incident_with_car_5.pdf)', '![gif](giphy|oaZk0WNSO7fXi)', 'Thats a bit harsh', ""Oh that's harsh"", ""Lawson did the same thing twice and didn't even get a penalty. Seems like the result matters more than the action itself."", ""Damn, one of the stewards was Pedro Lamy. Glad to see he's still kicking around."", 'Saving my bingo card for the weekend 🥳', 'Bruh, it was not his race.']",239,40,0.98,239,37,37,3,1,0.0,3
1jh34qd,(F1) Out in Q1,https://www.reddit.com/r/formula1/comments/1jh34qd/f1_out_in_q1/,2025-03-22, News,,"[""How do Alpine regress so badly. They had a decent car at the end of last year and Gasly was getting fantastic results in it. Seems like it's back to being a shitbox."", 'Lawson is a dead man driving', 'Meanwhile Yuki and Isack on VCARB 2nd and 3rd respectively.', 'Checo instagram has Liam comments all over it', 'they done my boy Bortoleto dirty, bro couldn’t open the last lap', 'Worse than Sauber and Haas lolol', 'So Checo was just a symptom and not the problem?', 'Another Liam Law20n banger.', 'Checo is Liam father']",236,41,0.97,236,38,38,1,0,0.0,1
1jh4zh3,[Daniel Valente] Here's a fun stat: Oscar Piastri is the 4th youngest McLaren polesitter in team history. Lando Norris: 21y 10m 13d (Russia 2021) Lewis Hamilton: 22y 5m 3d (Canada 2007) Kimi Raikkonen: 23y 8m 12d (Europe 2003) Oscar Piastri: 23y 11m 17d (China 2025),https://www.reddit.com/r/formula1/comments/1jh4zh3/daniel_valente_heres_a_fun_stat_oscar_piastri_is/,2025-03-22, Social Media,,"['Whos this Hamilton guy? Prolly a failed career, still loitering around the grid. i saw him hugging Hadjar on the broadcast for some reason', ""it's impressive how early Kimi and Lewis proved their mettle and earned their place considering how the grid back then wasn't that big on fast rookies."", 'Nicole Piastri is so proud with his son and second-son (Yuki).', 'Not that fun', 'Not really fun', '24 years old doesn’t seems very young but then I remember I’m in my mid 30s.', 'well, its not that funny lol', 'They had a unlimited testing at the time. It was much easier for rookies then.', ""The stat is specifically about McLaren polesitters, so it would have been weird if they weren't driving a McLaren at the time""]",236,11,0.96,236,10,10,14,0,0.0,14
1jh326h,[Q1] Gasly sneaks past Lawson in the queue to start their final hot lap,https://www.reddit.com/r/formula1/comments/1jh326h/q1_gasly_sneaks_past_lawson_in_the_queue_to_start/,2025-03-22, Video,,"['They’re all smelling blood.', 'Gasly ""Enjoying that Red Bull second seat?""', 'Lawson absolutely dawdling there, Gasly was practically parked before he overtook', ""well to be fair its a gentleman's agreement with the drivers not to do that but by this time next week will lawson be a driver?"", 'I thought he wasn’t there to make friends?', ""Pierre says if I'm going out in Q1, I'm taking you out with me Liam lmaooo"", 'They swallow Liam whole atm.', 'Gasly’s been caught before with someone dawdling in front of him meaning he doesn’t make the line. \n\nSeeeee ya Liam', ""F1Twt's been having a field day with his interviews and radios.\n\nThis would feed them for the next month lol"", ""Lawson can't take what he dishes out.""]",220,70,0.97,220,63,63,-1,1,0.0,-1
1jh0fti,Chinese GP Sprint Race: Average Driver Pace. Strong performance by Hamilton and Piastri,https://www.reddit.com/r/formula1/comments/1jh0fti/chinese_gp_sprint_race_average_driver_pace_strong/,2025-03-22, Statistics,,"['S T R O L L 1 8', 'Sains race pace: 😃\nHe made a pit stop: 💀', 'https://preview.redd.it/4nvgryyh76qe1.png?width=1840&format=png&auto=webp&s=9fe3352788354bd4bb8fa1caafc6ea5d497137f9\n\nTeam Average Pace comps highlighted here as well!', ""Yuki best of the rest I'm loving it."", 'Disappointed in Doohan, looked decent in quali and hope he learns what went wrong in the race', ""> Antonelli: Dirty air played an important role today, it's good learning to take.\n\nThis kid is going places."", 'Chat are we back?', ""I think Piastri's tyres were done by the time he passed Verstappen. Would be interesting to see how he would have gone against Hamilton if he was in second instead of third after the first lap."", 'Crazy that the guy with the fastest average pace ended up winning the sprint.']",212,58,0.96,212,718,718,-2,0,0.0,-2
1jh5omm,[George Russell via IG] YES!! P2. Front row in China. All to play for tomorrow. Let’s do this,https://www.reddit.com/r/formula1/comments/1jh5omm/george_russell_via_ig_yes_p2_front_row_in_china/,2025-03-22, Social Media,https://www.instagram.com/p/DHfw32HtArd/,"['Crazy session for him and Merc, but as always, he delivers at the end. So impressive.', 'That lap was phenomenal. He was a bit coy about what he did in prep to get it done hey?', 'My new best driver over one lap', ""Toto: that's great Lewis.\xa0\n\nRussell: Thanks Toto.\xa0"", 'If George wins the GP he will lead the championship, regardless of where anyone else finishes.', 'Russell stocks very high if he dominates Antonelli and Ham beats Charles. Seen as he edged Lewis over two seasons.', ""George stocks are going up in a situation many thought it might go down.\n\nHe's going up against the best prospect since Max and beating him handily whilst Kimi still looks pretty good and Hamilton doesn't look washed at all and out skirmishing LeClerc at the moment.\n\nThe Mercs race pace doesn't quite look like it's at the level of the Ferraris or McLaren but George could still get himself a podium if he drives well."", 'Split the McLarens and clapped both Ferraris and Red Bulls in the 4th quickest car. Phenomenal lap by George.', 'I hope he fucks with Toto to hopefully get a better contract for next year 😂', 'Forecasting a podium?']",217,55,0.91,217,54,54,17,0,0.010000000000000009,17
1jh06ig,Doohan incident with Bortoleto.,https://www.reddit.com/r/formula1/comments/1jh06ig/doohan_incident_with_bortoleto/,2025-03-22, Video,,"['I control your every millimeter.', 'How Carlos caught them after pitting? That shows you how slow everybody was running because of the tires. And Carlos was at normal pace', 'This is just silly. \xa0Last lap, pointless overtake, punts himself into p20', 'Clumsy move', ""It's an exciting incident for Argentines."", 'That was clumsy.', '**Alex**: *Doohan just divebombed, what he doing?*', 'Carlos was scrambling for crumbs', 'I know he lost some front wing but did Hulk let Gabriel finish ahead of him because it looks like from the replays he gets past the incident before Bortoleto corrects the car?', 'Bro thought he was Liam Lawson']",208,60,0.95,208,1169,1169,6,0,0.0,6
