unique_id,post_heading,post_url,publish_time,tag,post_content,top_comments,upvotes,comments,upvote_ratio,score,total_upvotes_comments,total_score_comments,upvotes_growth_rate,comments_growth_rate,upvote_ratio_growth_rate,score_growth_rate
1hc6piv,Valtteri Bottas got pulled over by the California Highway Patrol [via IG],https://www.reddit.com/r/formula1/comments/1hc6piv/valtteri_bottas_got_pulled_over_by_the_california/,2024-12-11, Social Media,https://www.instagram.com/reel/DDdDIBzTd_m/?igsh=MWx0eTlhYm0zMDV1ag==,"['“Who do you think you are? Nigel Mansell?”', 'They’re having him serve his penalty from his last race', '“Come on man, 160 mph isn’t even that fast!”', 'Cop: nice car, what do you do? \n\nVb: Currently unemployed...', ""License and registration please.\n\nSure, here's my super License."", '“Who do you think you are, Lewis Hamiltons teammate?!”', 'Familiar-looking Australian cyclist caught speeding', 'Yuki and Valtteri should bond over US law enforcement', '""Sorry, officer. This car is faster than the one I have at work.""', 'Hell of a stop-go penalty.']",16063,492,0.96,16063,30588,30588,298,10,0.0,298
1hbwyqk,[Lewis Hamilton via IG] Two legends. Bono and Tommy.,https://www.reddit.com/r/formula1/comments/1hbwyqk/lewis_hamilton_via_ig_two_legends_bono_and_tommy/,2024-12-11, Social Media,,"['Here’s a video of Lewis reacting to the same - https://imgur.com/DjAn2FZ', ""It's Hammer Time"", 'My Bono is gone 😭 - Lewis 2025', ""Lol, that's brilliant 😂\xa0\n\n\nI am gonna miss these two together. It just won't be the same... 😭"", 'aw man, gonna miss the two of them on the same side of the grid. Bono is lowkey slaying!\n\nAlso, the pout in the first slide lol', 'I like the double glasses, great look.', 'Bono my sleeves are gone', ""Bono, it's Tommy time"", 'Arnold ‘Bono’ Schwarzenegger', ""Merc is just collectively so attractive it's kind of insane.""]",7060,151,0.96,7060,5942,5942,47,0,0.0,47
1hci5j2,"In Las Vegas Grand Prix 2024, fans were asked to act like if a crash happened for the F1 movie",https://www.reddit.com/r/formula1/comments/1hci5j2/in_las_vegas_grand_prix_2024_fans_were_asked_to/,2024-12-12, Video,Source: https://twitter.com/MV1GOLD/status/1866888108089983433?t=EgBnqn1Cv06ldk8CSS3Kdw&s=19,"['It looks authentic because everyone’s grabbing for their phones.', 'People on the desktop, right click on the video and click ""show all controls"" \n\n[he made us do it like 5-6 times kept yelling at us to not smile too it was so funny](https://twitter.com/rottenellas/status/1867048293760430213?t=pTyIvdywLIT1fZsQdYgdNg&s=19)', ""https://preview.redd.it/wnplxss2be6e1.jpeg?width=318&format=pjpg&auto=webp&s=36c706c7e509958755e33011051e7aaf8ca0037b\n\nThat's some interesting behind the scenes footage. Some of them reminded me of this HAHAHAHA!"", 'They should have had two guys in dino suits running around on track, then bashing into each other. Would have got a less muted response!', 'Guy in Front Do Have Talent', 'Great way to save money on extras', 'And the oscar goes to ... The person on row 5 seat 18!', '""Don\'t stop, don\'t stop""\n\nEverything ik about this movie is against my will, now upload peoples\' reaction to sonny\'s fall lmao. Also, i love how they are trying hard not laugh out of loud lol', ""We'll see the whole movie by the time it will actually come out at this rate"", 'America was the right place to do this']",4524,192,0.97,4524,176,176,817,27,0.0,817
1hcgfed,FIA has approved an updated refined version of the 2026 F1 regulations and showcased latest show car,https://www.reddit.com/r/formula1/comments/1hcgfed/fia_has_approved_an_updated_refined_version_of/,2024-12-12, News,,"['Is this small enough for monaco?', 'Surprised the show car doesn’t have an MBS livery', 'Do they still follow the ground effect notion?', ""I'm glad they kept the 3 element rear wing, we haven't had one of those in a long, long time"", ""Yall didn't realize it, but Cadillac leaked the updated 2026 car lmao. The render already had the updated wing and wheel covers before the FIA released their updates today\n\nhttps://preview.redd.it/kth7w2r2qd6e1.jpeg?width=1000&format=pjpg&auto=webp&s=7c26032330074b879c7417d11eddfe2e4f24a405"", 'Remember guys, what you see now don’t mean jack shit. The cars will look completely different in 2026.', ""Why do I get the impression that we are slowly moving back to '21 era cars?"", 'If somebody told me this is F2 car, I wouldn’t have trouble believing it.', 'Front wing endplates look hella weird.']",4169,375,0.98,4169,363,363,296,22,0.0,296
1hbzjvd,Leclerc vs. Sainz,https://www.reddit.com/r/formula1/comments/1hbzjvd/leclerc_vs_sainz/,2024-12-11, Statistics,"As Sainz's stint at Ferrari comes to an end, here is how he stacked up against his teammate","['This just shows what most of us already knew - Charles is the better driver overall, but Carlos was really never that far behind him. Such a shame he couldn’t land a top seat.', 'It almost feels like Sainz gained speed after 2022 season', 'Think sainz did brilliantly up against Leclerc. Generally not quite at Leclerc’s level in either qualifying or the race but a very capable driver in his own right and held his own against, in my view, probably the second strongest driver on the grid as of right now.\n\nCan’t wait to see him against Albon at Williams - I am expecting Sainz’s performance gap relative to Albon to be similar to what Charles’ performance gap relative to Sainz has been.', 'Hats:\n\nLeclerc - 1\n\nSainz - 0', ""TL;DR: Sainz is a really good driver, but Leclerc is an amazing driver\n\nI think Sainz can be really proud of what he accomplished in Ferrari, especially this season. Just because he isn't on Leclerc's level doesn't mean he isn't fantastic driver in his own right."", 'In the end, the distance between the two is similar to Hamilton/Rosberg.\n\nAs I’ve said repeatedly, Sainz far exceeded what people thought he was capable of and likely pushed Leclerc to higher levels as well.\n\nIf they were given the same level of cars Vettel/Raikkonen were given, I think a WCC and possibly a WDC would been in fairly easy reach.', 'Carlos isn’t in as bad a place as people may lead you to believe. Williams has proven to be a great place to show off your stock, Carlos has the opportunity to loudly say “I am the best guy outside the top teams”. And if Alonso really is retiring at the end of 2026 there’s an opportunity to join what could be a front runner under the new regulations whilst other top drivers are tied down by contracts to established front runners.', 'That 0.5 never fails to take me out on a loop haha', 'I truly hope for Carlos that Williams does a 2023 Aston Martin and gets to shine again. Still slightly confused why Red Bull didn’t consider him.']",4066,492,0.98,4066,13873,13873,50,1,0.0,50
1hch88i,"2021 Abu Dhabi Grand Prix , 3 years ago today.",https://www.reddit.com/r/formula1/comments/1hch88i/2021_abu_dhabi_grand_prix_3_years_ago_today/,2024-12-12, Throwback,,"['https://preview.redd.it/3g7epax4ce6e1.jpeg?width=223&format=pjpg&auto=webp&s=64e06387156cb860de4717cd16802d7cd3420161', 'it is still echoing in my ear: „no michael! no!!! this is so not right!“', ""Kimi's final F1 race too. If understandable why that got overtaken by other events"", 'Hamilton was such a class act after the race.', 'Max looks so confused in that top right image.', 'The most controversial finale that had nothing to do with the drivers. \n\nIf they really wanted to make sure to get racing in and don’t mind bending the rules, call a red flag. \n\nIt also a reason why I love overtime’s in NASCAR and Fe because this kind of thing is rarer or can’t happen at all.', 'https://preview.redd.it/h2qvb0hp4e6e1.jpeg?width=619&format=pjpg&auto=webp&s=30b7a4e664794973c9c30077a31afa538f75657d', 'Is this the 9/11 of Formula 1 ???', 'https://preview.redd.it/ohfxnusq5e6e1.jpeg?width=957&format=pjpg&auto=webp&s=8a56dfb9a891cb17967388c2b2bf57de8b014d75']",3891,886,0.92,3891,432,432,482,74,0.0,482
1hc0ssg,"Takuma Sato's advisor, Koji Watanabe, CEO, comments on Yuki Tsunoda's test at Red Bull and 2025: ""All we can do now is pray""",https://www.reddit.com/r/formula1/comments/1hc0ssg/takuma_satos_advisor_koji_watanabe_ceo_comments/,2024-12-11, News,,"['RB needs 16m to tell Perez to get lost, so there is the answer to your prayers.', 'At this point Yuki’s management team best step the hell up and start finding other teams. Redbull has its lore and all, but they’re no longer the best on the grid and there’s too much politicking going on.', '# Takuma Sato\'s advisor, Koji Watanabe, CEO, comments on Yuki Tsunoda\'s test at Red Bull and 2025: ""All we can do now is pray""\n\nautosport web\n\n\u3000Honda/HRC held a press conference in Tokyo to announce their 2025 four-wheel racing structure, and in addition to announcing their domestic and international lineup, the Q&A session that followed touched on the future of Yuki Tsunoda, who took part in the F1 test held in Abu Dhabi the day before the conference in a Red Bull car, in 2025. HRC President Koji Watanabe and HRC Executive Advisor Takuma Sato spoke with high expectations about Tsunoda, as well as Ayumu Iwasa, who also took part in the test.\n\n**⚫︎ HRC President Koji Watanabe: ""We were able to realize his request to participate in the test. I have heard that he is very satisfied.""**\n\n  \n""I returned to Japan from Abu Dhabi yesterday afternoon (Tuesday, December 10th), and on Saturday I had various discussions with (Red Bull F1 Team Principal) Christian Horner about the drivers for next season and beyond. As I always say, the team has the right to decide on the driver, so our opinion is merely for reference, but from the HRC side, we believe that Tsunoda has the ability to be promoted to Red Bull and should be one of the candidates. I think that what we can do is to provide an opportunity for him to show his abilities to the world, so I asked him to participate in this test, and yesterday we were able to make it happen.""\n\n""I only met (Tsunoda) before the test, and he said, \'I want to achieve good results. I\'m going to enjoy myself.\' He said these two things, and since then, all I have is the report from the site by HRC, but he has very clearly analysed the differences between the RB car and the Red Bull car, and has given the team very useful advice and comments on that basis. I have confirmed from the report that Tsunoda himself is very satisfied.""\n\n""After that, I don\'t know what will happen, so we\'ll have to wait and see the results, but if it goes well, that\'ll be great. In any case, (even if he can\'t drive for Red Bull), he\'s already been booked to drive for RB next season, so I expect him to perform well next season no matter which team he drives for.""\n\n**⚫︎Takuma Sato HRC Executive Advisor ""All we can do now is pray.""**\n\n  \n""From what I\'ve seen, of course, with regards to Yuki, he showed amazing speed from Q1 (second place) at the Bahrain GP (2021) when he made his F1 debut, and I think his growth as a driver has been steadily increasing over the past four years. I met him at Imola (test held in August) for the first time in a while, and he seemed very relaxed, so I thought he\'s become a really good driver. Including race management and race craft, Yuki now has speed, and I think he has grown a lot with age and experience, including his own self-control to manage well.""\n\n""So, as I just said, we are hoping that he will drive for Red Bull, but I think it\'s up to the team. Yuki spoke to the media yesterday, saying that his driving style and the Red Bull car, with its sharp front end, suit him well, so I think he must have had a very good test. Now, all we can do is pray.""\n\n""Naturally, I went (to the Imola test) not only to support Yuki, but also to support Ayumu, and about half of the RB staff there, formerly Toro Rosso, who I tested with in 2008, were still there. So there were a lot of familiar faces.""\n\n""As we talked, it turned out that the engineers on-site really valued Ayumu\'s extremely sensitive abilities, and the feedback they were giving him in the simulator was extremely appropriate. During the actual test at Imola, (Liam) Lawson wanted to show his speed so he was pushing hard, and in a sense he was overdriving, but Ayumu was driving with great control, so the feedback from the engineers on-site was at a higher level for Ayumu.""\n\n""Looking at it like that, both Yuki and Ayumu are becoming really good drivers, so I really want them to get into F1 in a good way. As a driver, I have high expectations of both of them, so that\'s how I see it.""Takuma Sato\'s advisor, Koji Watanabe, CEO, comments on Yuki Tsunoda\'s test at Red Bull and 2025: ""All we can do now is pray""', 'its insane they are considering anyone but yuki', 'they must really not want Yuki in the red bull if the Higher ups of have to have talks personally with Horner to somehow convince him', 'One of us! One of us! We too can only pray lmao', 'Why did RedBull call in the option for Yuki? I never understood why they did that when they don’t give a shit about him and had a bunch of their jr drivers waiting for a seat. And highly doubt Honda forced them bc why would they care since they know the partnership is ending.', 'I feel u Koji... I feel u.', ""I truly want Yuki in that second Red Bull seat. I know he'll rise to the occasion if given the opportunity.""]",2132,242,0.98,2132,4796,4796,18,1,0.0,18
1hc09ne,Highest Paid F1 Drivers in 2024,https://www.reddit.com/r/formula1/comments/1hc09ne/highest_paid_f1_drivers_in_2024/,2024-12-11, Statistics,,"[""I have to work 1611 years for Max's salary"", ""Perez's bonus was paid by McLaren and Ferrari"", 'what Bonus is Perez earning??????\n\nalso Mclaren seems to be fond of the Bonus style structure, looks like Ricciardo payout has taught em things', 'Piastri hired a good manager and sainz need a new one.', 'Damn Lando with the nice bonus pay', ""I just want to remind people that driver contracts are private and very few people know all the details of each contract, and most of them likely aren't sharing that information with Forbes."", 'The Perez bonus is a fraud 😅', 'Why do they give us “highest paid” when it’s half the grid anyway.\n\nJust show us the other 10 as well', 'McLaren paying a Kings Ransom in bonuses…. Guess they had low expectations for ‘24😂']",1619,341,0.97,1619,7820,7820,13,2,0.0,13
1hchhg8,"[Thomas Maher] Eddie Jordan has revealed that he is battling cancer, prostate and bladder cancer that has spread to his pelvis and spine, with the spread being labelled “aggressive”.",https://www.reddit.com/r/formula1/comments/1hchhg8/thomas_maher_eddie_jordan_has_revealed_that_he_is/,2024-12-12, News,,"['>He has said he has had some “dark days” since being diagnosed in March/April, and has been undergoing chemotherapy.', 'That\'s not great. Prostate cancer can be absolutely vicious.\n\n\nThat said, medicine is fantastic these days. I know a guy who similarly had aggressive prostate cancer spread to his hips, femur and spine, but with intensive (and unpleasant) treatment they\'ve essentially suppressed it - the doctor told him he wants him ""to\xa0die with prostate cancer, not from prostate cancer"".\n\n\nIt\'s not entirely bleak, but it is a severe disease and every case is different.\n\n\nAll the best Eddie.', 'That’s awful news… I hope he can recover', ""Christ, that's terrible. Remarkable he's doing the podcast still, didn't look any different - suppose takes a lot to stop Eddie!\n\nThat's a pretty grim prognosis though, right? Though with treatment, you can live a few more years with it"", ""I lost my mentor to the same illnes. . Prostate cancer that spread to his bladder then to his pelvis and spine as welll.\n\nLaat few months were hell for him and all I could do was support him anyway I can. That mean bringing him for his chemotherapy sessions and changing his catheters as needed. He eventually passed and I sort of lost my passion for my then job. I quit eventually. \n\nI miss him to this day.\n\nI'm trying to be optimistic but after knowing what my mentor had to go through... This just makes me fucking sad..."", 'That’s awful news. \n\nHaving a pint with Eddie was pretty much number one on my F1 bucket list.', ""I hope he's alright. That's horrible"", 'Fuck cancer.', ""If ever there's a guy with a personality to tackle this it's Eddie.. Get well soon.. aaaaarrrrrrggggghhhhh!! (growl)"", ""EJ is going to charge cancer a bundle so that it doesn't even want to stay with him. He'll then start a fund to raise awareness among men to get checked.""]",1634,90,0.99,1634,84,84,187,7,0.0,187
1hcgiwx,[@skysportsf1] Did Ted call Lewis going red?,https://www.reddit.com/r/formula1/comments/1hcgiwx/skysportsf1_did_ted_call_lewis_going_red/,2024-12-12, Video,"YouTube video that was uploaded in 2017 https://youtu.be/ezxYTKklC8w?si=eBC0LlxFqC7WoTBB Ted was off with the time but was sure about the move

Source: https://www.instagram.com/p/DDceUh9pmNj/

People on the desktop, right click on the video and click ""show all controls""","['> ""He cares more about Ferrari than you think""\n\nHe even doubled down with absolute certainty. Very good call.', 'Hasn’t Lewis always said that tho? The other guy is a genius, “once he’s done with F1 I think he’ll leave F1” wow big prediction there', ""I don't think it's ever been a particularly big secret that Lewis (like 99.99% of drivers) always liked the idea of driving for Ferrari, but just needed the timing to be right.\n\n~~I think if Nico hadn't retired after the 2017 season, then Ted's timeline might have ended up being bang on.~~\n\nI thought wrong, got the 2016/2017 seasons mixed up."", 'Let me pop your bubble, there is not a single driver in the grid that would not like to drive for Ferrari. Even Max has mentioned it.', 'Huh since when can we embed videos', 'It sort of reflects the comment as Lewis heading to Ferrari didn’t come as a surprise from some Mercedes staff from the beyond the grid podcast', 'Retiring at Ferrari is an age old tradition, nothing clearvoiyant about calling that one', 'Ted knows a fucking lot about F1 and the people in F1.', ""I didn't watch during those years, but could Ted be referencing Ferrari trying to poach Ham from Merc?\n\nI seem to remember reading in here that during that time, Elkann(?) was very very interested to get Ham."", 'I mean he has been a pit lane reporter in F1 for over 20 years. \n\nTed has the inside track with everyone.']",1462,180,0.94,1462,160,160,126,9,0.0,126
1hcn8m7,Daniel Ricciardo named top candidate for Cadillac F1 venture,https://www.reddit.com/r/formula1/comments/1hcn8m7/daniel_ricciardo_named_top_candidate_for_cadillac/,2024-12-12, News,,"['Somehow Ricciardo returned...', ""dormammu i've come to bargain"", 'DR and Checo to Cadillac for the ultimate fanbase', 'Well, he’s an honorary Texan', ""It would make a lot of sense, even if I do feel like Danny Ric's moment is over. \n\nHe's an experienced driver who can help with car feel, who is also unattached so can spend the year in your sim working with the 2026 car, which all the teams have wanted their drivers to do this coming season by getting their line-up in place a year early. Plus the 2026 car is going to be a very different beast to the ground effect monstrosity we've had these last few years, so that might suit Danny Ric more.\n\nRealistically for an experienced driver, you are left with him or Bottas, unless you can somehow convince someone like Vettel or Button to make a grant return from retirement, but that would be outlandish."", 'Expected: More opportunities for rookies and great drivers\n\nReceived: Ricciardo', 'I wish people saw in me what teams keep seeing in Daniel.', ""Marketing. He's a great face for sponsorship"", ""Kinda meh but experienced driver for a new team\n\nTbh I don't see it happening, he is semi-retired I think \n\n\nBut then it's Danny you can't say anything for sure""]",2204,401,0.95,2204,375,375,2204,401,0.95,2204
1hch0o2,[Motorsport/Autosport: Jonathan Noble] Ben Sulayem open to F1 permanent stewards – but asks who pays for them,https://www.reddit.com/r/formula1/comments/1hch0o2/motorsportautosport_jonathan_noble_ben_sulayem/,2024-12-12, News,,"[""FIA is pulling 30 millions just from the team and driver fees. That's not enough to cover the salaries for 2-3 people working part time? Jee, I don't know. Maybe, you know, bribe less and avoid flying private to all the corners of the world? I'm sure there's some money to spare."", 'You’re handing out fines left, right and centre. Big fines! Even just a couple of those seems like enough to fund this.', ""Rich dude doesn't want to pay employees.\n\nChapter 4.754.000"", 'You?The FIA?\n\n\nUse those middle east bribes somewhere ig', ""Max has like a 1 million dollar super license \n\nCan't hurt"", ""Permanent stewards salaries to be paid by teams and drivers directly through contributions. Teams and drivers can nominate which steward they wish to contribute towards and which they don't ...\n\nShould work out well!"", 'I hate this smug kunt more and more each day', 'Perhaps use the funds from the super licences for something productive…', ""It is clearly that people here don't understand the difference between the FIA and the FOM. FOM is rich, FIA not so much. Also if the FIA is going to pay stewards in F1 they open themself up to other categories wanting the same. Everybody forgets that the FIA is the motorsportbody for a lot of different categories who will ask the same as F1.""]",1322,305,0.97,1322,283,283,106,13,0.0,106
1hchw1e,"TB to Jeddah '24 when Ayao said 1 point was like a win to them. After season, they finished 7th. Shy by 7 points from 6th, better than 2023 (10th). They made good leaps & gave themselves a better chance for a team with less resources. Strong team & drivers. Promising future as of now",https://www.reddit.com/r/formula1/comments/1hchw1e/tb_to_jeddah_24_when_ayao_said_1_point_was_like_a/,2024-12-12, Video,"Video is via SkySportsF1

With sound: https://i.imgur.com/n6QXgo6.mp4 

People on the desktop, right click on the video and click ""show all controls""

I apologise for the sped up version. It's because of imgur 1 minute limitation","['Ayao Approved.\n\nhttps://preview.redd.it/0whfhigsae6e1.jpeg?width=1080&format=pjpg&auto=webp&s=552a1ea611e58993b82964cc6344be0e953f5adb', 'throwback to the most glorious photo ever taken', 'The source of that meme', 'Karun was the other person in the photo this entire time??', 'Guenther was a colourful personality but Komatsu really brought this team up.', 'They only lost to Alpine because of their freak double podium in Brazil as well.', ""Haas doesn't feel like a meme team anymore. No more Haas episodes on DTS, I guess.\n\nAlso, I'm glad that u/FewCollar227 posted this!"", ""Man, they've come a long way since the meme days of Rich Energy/Russian Oligarch/Torpedo Grosjean & KMag/Fok Smash Mah Car days\n\nDo I actually like them now??"", 'i really like ayao. i hope he builds a great rapport with esteban and ollie as well.', 'Every year, I want to see a post that says “today in 2023, Ayao made his iconic interview with Karun Chandok, cementing his legacy forever” until he retires/move on from Haas.\n\nOur entire community clings on to this photo as a lifeline. Every racing weekend only ends when Komatsu\\_jeddah.png is observed.']",1139,76,0.97,1139,75,75,109,6,0.0,109
