unique_id,post_heading,post_url,publish_time,tag,post_content,top_comments,upvotes,comments,upvote_ratio,score,total_upvotes_comments,total_score_comments,upvotes_growth_rate,comments_growth_rate,upvote_ratio_growth_rate,score_growth_rate
1kgt8cf,Yuki Tsunoda is currently in a position where no one can accurately assess did he doing good anymore,https://www.reddit.com/r/formula1/comments/1kgt8cf/yuki_tsunoda_is_currently_in_a_position_where_no/,2025-05-07, Discussion,"Yuki Tsunoda is currently in a position where no one can accurately assess whether he is fast or slow anymore.

Yuki began 2025 with excellent pace. In Australia, he steadily maintained P5 and even overtook Ferrari for P4 after the restart, but VCARB's wrong pit stop decision destroyed everything. In China, Yuki continued to maintain good speed and secured P6 in the sprint race, with abundant opportunities to claim P8 in the main race, but once again, VCARB made an incorrect pit stop decision, and then the front wing of his car exploded...

Clearly, Yuki with VCARB raced well and proved himself as the best of the rest, even holding off some cars from the BIG 4. RB also positively evaluated that performance and promoted him to the main team.

Continuing with Red Bull, after 6 consecutive years of struggling with their second driver, they and everyone else understood that their car is undrivable for anyone except Max. Their approach with Yuki has also changed. RB has agreed to let Yuki use a setup that is ""slower but more stable.""

This also leads to some questions: how much slower is this ""slower but more stable"" setup compared to Max's setup in an ideal lap? Can Yuki with this ""slower but more stable"" setup achieve better speed than Yuki with the fastest possible setup? Yuki himself lacks experience with RB's car, so setup issues may continue throughout the season.

Anyway, Yuki's speed was immediately better than Liam's. Yuki made a mistake in Japan quali Q2, but in subsequent races, he consistently made it to Q3. Interestingly, the race where he was closest to Max's pace (Bahrain) was when RB's car completely lacked pace, and even Max had to compete with Alpine and Haas. I've also noticed that Yuki's Q3 qualifying lap times typically don't improve compared to Q2 - perhaps he's playing it safe and avoiding crashes? Maybe Yuki doesn't know how to improve his speed further when he can't adopt Max's driving style? It's very difficult to assess.","['at this point Yuki just exists', 'Yuki has been better than Lawson and miles off the mark from Max. At the end of the day that’s probably what RBR have come to terms with to accept. I reckon he’ll see the season out, because who else could they realistically throw in there at this stage? I don’t think they want to mess with Hadjar’s development.', 'I love the stat Ricciardo mentioned when they were teammates, that all Red Bull winners have double letters in their name: Vettel, Webber, Ricciardo, Verstappen. That’s where the curse started. I think there’s only one solution: bring in… Stroll.', 'He is significantly slower than Max but faster than Lawson. That’s all you can really say. Probably applies to the majority of the grid', 'I think his biggest Problem is the Performance convergence of the Field. \n\nLets say the slower setup costs the car 2-3 tenths. Combine that with him not always performing perfectly and you run into the realistic problem that you arent fighting with the top dogs, but are firmly in the midfield. \n\nFrom that perspective i think that he performed adequat.', 'For now getting points is clearing the bar and if he in a couple of races can fight with Ferrari/Kimi for places 5-8 he will be doing good.', 'I think Red Bull are content with Tsunoda’s performance for now because they have bigger problems in the shape of the car itself. Marko said they don’t remember when they had both cars finishing in the top 10, so the bar had been well and truly lowered at Red Bull for the moment, and Tsunoda is clearing it at least.\n\nTsunoda’s promotion came with the realisation within Red Bull that the car was the problem. Red Bull know they have to fix that first and then assess him again. They also know there’s very little for them to compete for this year as long as the car stays as it is. The Miami upgrades didn’t work as much as they expected and Marko has said that Imola will be the last chance saloon for them. \n\nIf those upgrades work and they’re able to cut the deficit by a decent chunk, then Tsunoda’s performance will be back under the microscope. If not, then he continues to merely exist as long as he’s finishing in the top 10.', 'He will be having upgrades in imola, let’s see how much a difference that makes.', '\\> after 6 consecutiveyears of struggling with their second driver\n\nnot  true for 2021 to  2023 perez was good enough.']",783,349,0.9,783,322,322,516,152,0.050000000000000044,516
1kgrdce,[Alpine] Colapinto to race for Alpine for the next 5 races,https://www.reddit.com/r/formula1/comments/1kgrdce/alpine_colapinto_to_race_for_alpine_for_the_next/,2025-05-07, News,,"['And then - Welcome Paul Arons', ""Flavio is just trying multiple drivers to find the correct one for next year's championship contending car /s\n\nCrazy thing is Flavio is Doohan's Manager"", 'Next 5 races?\n\nThis must be so confidence building for Alpine drivers.', ""With Doohan, wasn't it always only a rumour that his contract was only for 6 races? Wild for the team to come right out this time and say it's only locked in for 5."", '[How Alpine picks its drivers](https://youtu.be/b9VdamYKOzk?si=HxyPhNxChe4DQTSh)', 'fuck that toxic sacking culture', 'Like predicting 8:00 at 7:30', ""Flavio: 'you have five chances to win a race'"", 'This constant throwing spaghetti at the pitwall and seeing if it will stick, I honestly think Guenther would do a better job at the helm.']",249,74,0.9,249,71,71,33,5,-0.010000000000000009,33
1kgksy5,[Paul Aron on Instagram] Got to support @alpinef1team meet @patrickmahomes and see some palm trees. Till next time Miami,https://www.reddit.com/r/formula1/comments/1kgksy5/paul_aron_on_instagram_got_to_support/,2025-05-07, Social Media,,"[""So it's six races for Colapinto, then six for Aron and Briatore for the remaining ones. Perfecly balanced"", 'Nice to see Paulo Banchero constantly going to the races. True diehard fan', 'mahomes looks weird af', ""Can't wait to see him as the Alpine driver in 6 races 👀"", 'Estonian Joe shiesty', 'https://i.redd.it/nod7s1lrd9ze1.gif', '![gif](giphy|usALZW1G4aTde)', 'oh?... Anything else no?', 'So estonian of him to remark ""seeing some palm trees"" ha', 'Alpine actually has some cool shirts']",199,30,0.91,199,29,29,6,1,0.0,6
1kgs2gg,"Alpine F1 demotion is ""tough to take"", admits Doohan",https://www.reddit.com/r/formula1/comments/1kgs2gg/alpine_f1_demotion_is_tough_to_take_admits_doohan/,2025-05-07, News,,"[""Poor lad. He didn't have any standout performances but it's not like he was another Sargeant/Mazepin, and with the rumours circulating since before the season started there must've been so much extra pressure never mind just being a rookie"", 'It’s tough to take that one of the sport’s biggest cheaters ever is in control of one of its teams, old cheating relic', 'The demotion itself is not the worst thing here. What really is insane is that everyone, including Jack himself, had known that this would happen even before the season started, so he never got a real chance to stay in the team no matter what he did.\n\nAnd I totally understand why Alpine has no fans, as they have been making stupid decisions for years now.', 'I’m confused, was Briatore not banned for life, how is he even in the paddock, let alone in control of yet ANOTHER team?', 'Drop him as your manager man 😭\n\nIt’s not worth it Jack!', 'Glad Piastri avoided the omnishambles at Alpine.', 'And here I was thinking he would be happy about it...', ""Honestly, this demotion is FAR WORSE than Lawson's\n\nLawson will likely get a whole season (or at least until summer break) to rebuild at VCARB, which seems to be the 6th fastest car\n\nWhereas this is probably it for Doohan, unless Colapinto really struggles, Doohan probably won't get another F1 race"", 'Unpopular take: as ruthless as it is, at least Doohan had a shot at F1. There are many reserve and academy drivers out there who will never ever have a chance at F1']",173,53,0.96,173,51,51,47,6,0.0,47
1kgra9h,[F1] Alpine confirm Colapinto to replace Doohan for next five rounds as team opt to 'rotate' seat,https://www.reddit.com/r/formula1/comments/1kgra9h/f1_alpine_confirm_colapinto_to_replace_doohan_for/,2025-05-07, News,,"['The next 5 races?.....why 5 races? Who will replace Colapinto after that, Jack or Paul Aron? What is this decision?', '""Flavio, we need to recapture the magic of the Schumacher championship years""\n\n""Got it. Rotating second drivers just like back in the day""', 'After 5 races they’ll put Lilly Verstappen in, and after that maybe it’s Leo’s or Roscoe’s turn to drive', 'Just Flavio things', 'So Franco Alejandro Colapinto-Trofimczuk Ascends to Replace Jack Michael Doohan at the BWT Alpine F1 Team Powered by Renault in the 2025 Formula 1 AWS Gran Premio del Made in Italy e dell’Emilia-Romagna at the Autodromo Internazionale Enzo e Dino Ferrari?', 'If you went to f1 fan in 2021 and told them that aston martin and alpine would look far worse than williams and haas they would be shocked.', 'Imagine if he does even worse than Doohan and they have to put in Aron for Silverstone', 'Are there any precedents of ‘seat rotation’ in F1? \n\nHonestly, if there are, I don’t remember them. Of course there are multiple cases when there were several drivers to fill a seat throughout a year, but it was never announced as ‘seat rotation’ in advance.', 'This has to sound more egregious than Red Bull back in 2005, where they rotated seats between Klien and Liuzzi, and they were just starting out in that relatively new branding at that point! Alpine is Renault in that coat of pink and blue for years. \n\nI am truly speechless. Colapinto gets 5 races, 2 less than Doohan to *prove himself?* What happens, then? The lack of confidence in their own outfit and their own crew is staggering']",168,61,0.91,168,57,57,35,8,0.0,35
1kgt1xy,What in the galloping gargoyles is happening at Alpine?,https://www.reddit.com/r/formula1/comments/1kgt1xy/what_in_the_galloping_gargoyles_is_happening_at/,2025-05-07, Discussion,"First comes the news that Doohan is out. It’s a really short run for a rookie but the team has more data than we do on his performance and what we have seen is not particularly impressive. Fair enough.

Then Oakes, the Team Principal resigns. He was an open supporter of Doohan so it looks like there was a huge internal push to dump everyone associated with Jack.

Then Briatore, who is Doohan’s manager, fricking gets the role of interim Team Principal!!!! 

This looks very very shady and I won’t be surprised if it turns out later that Flavio engineered this whole situation for his own benefit.

We may joke about Toto looking like a Sith Lord but it’s Briatore who is actually one. ","[""Oscar Piastri's decision to leave has to be one of the smartest moves in recent memory."", 'Just Briatore things, the littlefinger of f1', '*""This looks very very shady and I won’t be surprised if it turns out later that Flavio engineered this whole situation for his own benefit.""*\n\nHe\'s Flavio Briatore, of course he did. At least it will be entertaining to see where he goes from here.', 'Did Briatore seriously get the role of Interim TP? I think i missed that. How in the flying fuck though...', 'Doohan staying as reserve driver isn’t he? Flavio probably using him as leverage to get more cash out of colapinto backers every 5 races.', 'Honest question; why do people asume that Oakes  resign due to him defending Doohan, and not because he lost the internal power struggle with Flavio of which driver was replacing Doohan? \n\nI know Flavio’s antics so no need to talk to me about his character. \n\nI honestly think he wanted Aron on the drivers seat  and he lost vs Flavio.', ""Simple, Renault is sick of the bad results of Alpine. They are supposed to be a top team, fighting for the win.\n\nSo they take radical decisions, but I don't have lot of faith in the fact that will change something."", 'This drama hides a bigger problem, I suspect. Flavio/Oakes/Doohan/Colapinto is the surface and below that it seems Renault wants to or has given up on their F1 team. It will be interesting to speculate on who the team might be sold to - perhaps as quickly as 2026 or maybe a year or so later.', 'Why is Briatore back in F1, Alpine 5 team principals in 5 years… someone check on Gasly, at this point, he must have Stockholm syndrome.']",124,110,0.84,124,101,101,73,37,0.07999999999999996,73
1kgsff2,"[Franco Colapinto via Instagram] Together again in this new adventure. Thanks MercadoLibre, the best is coming. (Imola Ad).",https://www.reddit.com/r/formula1/comments/1kgsff2/franco_colapinto_via_instagram_together_again_in/,2025-05-07, Video,,"['So they had this prepped?\n\n\nHow long has this been in the offing? Poor Jack', ""It comes as no surprise they had this ad ready for it, as even YPF(Argentina's own gas stations) have already been running their own ads about winning tickets to go support Franco starting in the European leg as early as the Chinese GP.\n\n They all just knew."", 'Even though the bar is low for ads here, this one is really funny.', 'It is harsh, but I can’t wait to see Franco back on the grid to see what sort of driver he can develop into (assuming of course Alpine allow a driver to develop)', 'He did win in F2 at Imola last year. I think he’ll be surprisingly good.', 'I kinda like Franco, maybe he talks a bit too much but he’s very open and refreshing. Too bad he’s coming back at the expenses of Doohan, some rookies are not given enough time to acclimatize, and with Flavio at the helm, who is really a terrible person. Let’s see how he stacks compared to Gasly, I wish him well!', 'Me, who has stock in MercadoLibre 📈📈📈', 'Would be funny if he bins it.', 'Already with the £££, gotta give it to them', 'According to Kym Illman, Franco replacing Doohan was decided before the season even started.']",99,27,0.81,99,26,26,26,5,-0.019999999999999907,26
1kgt2qo,"Ferrari Exclusive: SF-25 Doesn't Work, Serra is Working on a New Suspension!",https://www.reddit.com/r/formula1/comments/1kgt2qo/ferrari_exclusive_sf25_doesnt_work_serra_is/,2025-05-07, News,,"['Yeah thank god they changed it from last year.', 'Translation \n\nAt the sixth race, Ferrari hit the lowest point of this start to the season with a performance far from the top. Just to give an example, in qualifying the SF-25 was only 2 tenths better than the problematic SF-23 . Better tyres (softer), better aero after two years of work in the tunnel, good efficiency in terms of top speed and DRS, no sign of porpoising. Yet the car practically never came to life except in Jeddah. A series of performances never in line with expectations while the operation on the tyres remains unknown. The Maranello team had a bad weekend where only the sprint, thanks to the weather that mixed the cards, once again rewarded Hamilton after a desperation move. Leclerc did not even start due to the accident with the intermediates, a questionable move in terms of evaluating the conditions.\n\n\nMcLaren was untouchable, even Verstappen had to destroy his first stint to resist in vain . The Miami heat made the MCL39 more unbeatable than ever. The spectre of a summer domination that would wipe out the competition\'s motivation looms. Everything depends on the drivers\' ability to avoid making mistakes.\n\n\nFerrari\'s potential unusable, the simulator says it exists but the track doesn\'t, here\'s why Vasseur talks about it\n\n\nIt\'s not purely aerodynamic, the car is simply running with mechanical settings that are inefficient for the race, this is compromising the qualifying. For some reason the engineers can\'t get the rear suspension to work as it should. It could be a problem with the anchors or the travel. From what we understand there is a new suspension in the works that could be combined with the latest big package but the timing is unknown.\n\n\nIt is a very delicate and totally unexpected change during the season , not rapid, if nothing else it clearly indicates where the problem is and that it is not strictly aerodynamic in nature. The hope is that the corrections work as they did a year ago , after the technical direction was suddenly vacant due to the departure of Cardile (who will take up a position at Aston Martin next July). At that time Vasseur took the interim but was certainly caught off guard as we entered a delicate phase. This could be a delayed backlash, perhaps the cause of some assessments deemed insufficient on the courageous changes of the 677 project.\n\n\nHowever, Ferrari cannot endure a long season that risks seeing it at times even in fifth place.\n\nCurrently in Maranello there are already two teams, one dedicated 100% to the 678 project in the works . A phase where normally dozens of different designs are tested, some extreme, to establish where the areas of greatest profit are. DT Loic Serra was in Jeddah where things worked less badly, at least for Leclerc, he was not in Miami . On his shoulders the responsibility of a triple and burdensome commitment: thinking of a good car for next year, curing the SF-25\'s illness, implementing (a lot) the quality of the technical choices on the track.\n\n\nEveryone asks the same question and it\'s legitimate: couldn\'t the Ferrari SF-24 have been further refined instead of changing it ""99%""?\n\n\nChanging the aerodynamic balance to focus more on the front end required a completely different overall geometry. Tweaking the gearbox and reducing the overall dimensions of the rear suspension did not pay off . The trap was just around the corner but could not have been foreseen in the simulations that only gave gains without any drawbacks. For better or for worse, the Venturi cars will remain among the most unpredictable and unreadable in the history of F1.\n\n\nAfter the stormy (in every sense) American weekend, it is worth underlining the words of the seven-time world champion reported by the BBC which now perhaps seem clearer: ""I think this car has really good performance. Something is holding us back at the moment, it\'s there, we just can\'t use it . Until we have a solution for that, this is where we are"" signed Lewis Hamilton.', ""The only good takeaway from this is that Serra had nothing to do with the design of the SF25, so that gives me hope he may yet come good on the 2026. car. As for the SF25 it might end up scrapped as it's simply not worth it to invest too much time trying to catch a soon to be 200 point deficit when you have a regulations shift next season. They should have done this switch for last  year and then this year the car would be right up there to try and steal a title before the reg switches.\n\nEither way, it's easy to talk shit now, gonna be a long one boys, strap in and hope for some miracles :D"", 'https://preview.redd.it/xxxzywsvzbze1.jpeg?width=702&format=pjpg&auto=webp&s=9d9866ea85ee53e9a14cc654d6aaac6bd584888e', 'Someone let Fred “potential” Vasseur know that it’s more than a small balance issue.', 'I will keep praying for upgrades that make Ferrari two seconds faster than everyone else 🙏', 'didnt they decide to redesign the car for 2025 precisely because of the suspension?\n\nthe unintentional comedy of ferrari cannot be understated', 'If this new suspension comes in Silverstone or Spa then what’s the point? Does Fred have it in his contract for the team not to finish lower than P3 or something? \nThey couldn’t beat the Mclaren last year because of mechanical choices and they fucked up even harder this year, somehow.', 'Next year is our year...for sure this time']",100,36,0.96,100,35,35,39,10,0.010000000000000009,39
1kgrw9o,Just published by the official F1 channel.,https://www.reddit.com/r/formula1/comments/1kgrw9o/just_published_by_the_official_f1_channel/,2025-05-07, Video,,"['For the next 5 races. Not even for the rest of the season \n\nhttps://x.com/AlpineF1Team/status/1920010748731834545', ""If it wasn't for that (4?) driver limit, I very much believe Flavio would just make it pay to drive and earn millions personally."", 'like any of this matters in an alpine.', 'I feel like the number one reason for the majority of people to watch Imola now is *""How many laps will it take for new guy to crash out?""*', ""Every other sport has players behind those in the top teams waiting to take over given the chance.\n\nOnly in f1 is this deemed some sort of great crime by it's followers."", 'If he fail then chance for Paul Aron', ""Wonder what building work Alex is getting done. That's a good amount of scaffolding."", 'The shirt is trout', ""They just say that so they don't look stupid.\n\nI'm pretty sure he will be there until the end of the season""]",44,26,0.8,44,21,21,11,6,0.010000000000000009,11
1kg6ulp,Brady & Sainz,https://www.reddit.com/r/formula1/comments/1kg6ulp/brady_sainz/,2025-05-06, Video,,"['The GOAT and Tom Brady', 'How is Williams media game so much better than everyone else? I feel like they produce so much more fun content with their drivers than any other team. Particularly for a smaller operation they are killing it.', 'The son kisser and the sun kissed', 'Really enjoyed that. I want a full BTS series of Brady showing Sainz his nutrition and training secrets whilst they both train with different sports teams. I also want videos of Sainz playing sports in all the disciplines he says he follows with their greats.', 'That boat is in a dangerous place for my game.', 'Brady & Sainz tonight at 9 on CBS!', 'Right? Have you seen Albon’s app too? My mate has it and it’s actually really well done. I wonder why other teams aren’t as keen?']",42,8,0.69,42,89,89,0,0,0.0,0
1kgv4cy,"Leclerc also criticised Ferrari over ""stupid"" strategy on radio",https://www.reddit.com/r/formula1/comments/1kgv4cy/leclerc_also_criticised_ferrari_over_stupid/,2025-05-07, News,,"[""Really seems like there is no ham v lec drama and, as always, it's the drivers v wall. Ham + Lec v Ferrari bullshit"", 'Literally Charles and Lewis were shaking hands and patting each other when they were fresh out of the car.  There is zero drama between the two of them.\n\nIt’s drivers v pit wall v the car', ""It amazes me how long it takes Ferrari to make a decision \n\nlike Germany 2018 when it took them ages to decide to ask Kimi to let Vettel by, and even when they made their decision they weren't clear about it over the radio:  \n\n***JOCK:*** *So Kimi this is Jock. You are aware we need to look after tyres. Both cars need to look after tyres and you two are on different strategies. Your track strategies are slightly different and we’d like you not to hold up Seb. Thankyou.*\n\n***KIMI:*** *I’m not sure what you mean. What do you want me to do*\n\n***JOCK:*** *Losing as little time as possible, obviously, but when you can Seb is capable of going quicker but, er, he’s hurting his tyres and you are as well, we need to look after them*\n\n***KIMI:*** *So you want me to let him go? Just tell me.*\n\nif they let Hamilton past instantly then Hamilton wouldn't have wasted the best of his medium tyres in Charles dirty air and may have actually been able to pull away from Leclerc and Sainz meaning both Lewis and Leclerc would have had clean air."", ""Hamilton's engineer seems especially terrible at that team. He's like a robot."", 'I\'m so baffled by the fact that they say ""Lewis wasn\'t informed"" about making the swap back. Surely they\'re all just beside each other on the pit wall, how hard can it be to make sure they communicate these messages between each other, what are they actually doing that this isn\'t just straightforward to make happen!!', 'Fire everyone on the pit wall!', 'It really took them 3 laps to realize mediums were the faster race tire and degrade quicker, something the most casual fan could tell you.', 'Is there any facility for the drivers to talk to each other during the race? Or would that just cause too much chaos', 'It’s gonna be wild to see how Netflix spins this in upcoming seasons tho. \n\n“Leclerc and Lewis tore the team apart with their hate, now can they heal” type taglines. Didn’t they do it with him and Bottas?']",133,25,0.98,133,24,24,133,25,0.98,133
