unique_id,post_heading,post_url,publish_time,tag,post_content,top_comments,upvotes,comments,upvote_ratio,score,total_upvotes_comments,total_score_comments,upvotes_growth_rate,comments_growth_rate,upvote_ratio_growth_rate,score_growth_rate
1k31d5s,"Bortoleto, Ocon, Hulkenberg, Doohan & Stroll out of Q1",https://www.reddit.com/r/formula1/comments/1k31d5s/bortoleto_ocon_hulkenberg_doohan_stroll_out_of_q1/,2025-04-19, Video,,"['Ollie really likes this track. Outqualified Ocon by 6 tenths!', 'Lewis using a second set of softs will probably cost him, will see how', ""It's sad to see Hulk there. Hope Audi gives him a decent car next year"", 'did Brundle just said Doohan should have brake tested Alonso at +300km/h?', '“Verstappen to Aston Martin?”\n\nMax:\n\nhttps://preview.redd.it/evxjuw4hstve1.jpeg?width=660&format=pjpg&auto=webp&s=2b2d4c22698a8c233398485661576e2dd573087d', 'What happened to Ocon? Never had a final run on an improved track.', 'This Sauber must be really nasty to drive. Both Hulk and Bortoleto could not improve after their first lap, even though both had 2 attempts after that and a lot of track evolution', 'Tsunoway that was very good', 'Less than a tenth to Alonso, 4 places lower and out in Q1\n\nRuthlessly close', 'How is Max fastest on used tyres? Man is a racing android for real.']",217,97,0.98,217,93,93,217,97,0.98,217
1k2xzlm,[Scuderia Ferrari] Final session complete before qualifying,https://www.reddit.com/r/formula1/comments/1k2xzlm/scuderia_ferrari_final_session_complete_before/,2025-04-19, Social Media,,"['My charles pull a miracle in quali PLEAAASE or were doomed', 'See u guys next year!', 'https://preview.redd.it/ao6u7ktt4tve1.jpeg?width=563&format=pjpg&auto=webp&s=ec78d2ff78ef9ff71f098edb5bcbfd6262a3c311\n\nMamma mia', ""Charles on the radio saying he couldn't get much more out of it with sliding out of corners doesn't bode well. Hope updates will unlock more performance but it may be too late at that stage.\xa0\n\n\nIt's going to be slightly cooler come qualifying, plus fresh rubber. He looks good for P3-5 range.\xa0\n\n\nLewis isn't doing too hot and I honestly hope it's just adaptability and this generation of cars that hampers him. Settling at the team should be key this year if the regs for next year will do his driving style well. He held up ok against George come sunday, missing a bit in qualifying. He seems to start bleeding a lot now compared to Charles. Hope he picks it up soon, taking the sprint pole in China as inspiration."", 'Yep 4th fastest car', 'What happened with Hamilton? Traffic?', ""At least this weekend I know for sure, bad time, can't get me again like China at least."", 'https://preview.redd.it/xwrr7hkw2tve1.jpeg?width=1600&format=pjpg&auto=webp&s=d429ceac0603691b32c28bc01c2be2068e04e215', 'Hamilton is really struggling this weekend', 'Just run the car low, get a podium and hope they don’t check. \n\nEither way it’s 0 points if they dont']",182,46,0.94,182,42,42,22,2,0.0,22
1k31uwu,"Lawson, Alonso, Hadjar, Bearman & Albon out of Q2",https://www.reddit.com/r/formula1/comments/1k31uwu/lawson_alonso_hadjar_bearman_albon_out_of_q2/,2025-04-19, Video,,"['0.007s. Grazie Ragazzi', 'Gutted for my man Albon\n\nGood job, Carlos', 'Hamilton through barely', '""alonso beats off hadjar"" - crofty', ""Lmao Williams going out with Albon with 5 minutes to go to get the worst track conditions possible out of any 2nd runs in Q2. \n\nGood job. You've played yourself.\n\nThats a Q3 right there if he does a lap at the end."", ' Lewis cutting it fine jeez…', 'Not Albon! But still mighty impressive that he is so close to the Ferrari', 'Ahhh Albon :(', 'Tough luck for these guys. Albon very close to Lewis, and well done to Lawson too for putting a good lap together.', 'So close to Albon knocking out Hamilton']",214,83,0.98,214,78,78,214,83,0.98,214
1k2cmy0,TEAM TORQUE EP.3 - Really digging these conversations,https://www.reddit.com/r/formula1/comments/1k2cmy0/team_torque_ep3_really_digging_these_conversations/,2025-04-18, Video,I really like the vibe these two have the relaxed conversation and some good insights. Wish it was a longer podcast...,"['Alex not having gone ""home"" (I guess defined now as where he has a dresser of clothes) since pre-testing is wild.', ""I love watching them have these chilled out conversations. You can tell that in some ways they're still getting to know each other, and they do go unexpectedly deeper on some topics (like finding a home), but then in other ways you can tell they've had some of the same experiences (Helmut 💀) and they can find common ground so easily.\n\nAnd I also love how they're just vibing without either of them trying to one-up the other. These podcasts so far have only solidified my impression of both of them as all-around decent guys."", 'This is my favorite episode of this season. The questions were good and they gave very thoughtful answers.', 'Wholesome', ""I'm glad they highlighted the point about different cars making or breaking a career, or allowing them to do things they'd never try otherwise.\n\nI think F1 fans still think its easy to just step into another car and get to 100%, despite drivers continually saying otherwise."", 'Alex having no home saddens me. He’s a third culture kid on steroids.\n\nHe is Thai but he doesn’t have a super strong connection to the country, he is a brit but can’t acknowledge it because there are too many brits on the grid, he lives out of a suitcase for nearly half the year due to his job, lives in Monaco for tax purposes, and his girlfriend also lives out of a suitcase for her job and when she doesn’t she is in America! \n\nThailand, Britain, Monaco, America, all while traveling rest of the world….no wonder he feels adrift.', 'I really like this ep. Always good conversation between them.', ""[Like & Subscribe Carlos' Youtube](https://www.youtube.com/@carlossainz/videos)"", "">Alex: Different shafts, different balls, different everything\n\n\n\n>Carlos: And you can work on it\n\n\n\n>Alex: You can work on it\n\n>!They're talking about Golf; 20:52!<"", ""LMAO about the helmut reference.\n\nI loved the bit where they talked about a driver not being crap because he couldn't change driving methods for a new car - i.e. Daniel.""]",161,37,0.92,161,542,542,1,0,0.0,1
1k2epxs,[AMuS] Can Gasly upset the favorites?,https://www.reddit.com/r/formula1/comments/1k2epxs/amus_can_gasly_upset_the_favorites/,2025-04-18, News,,"[""I'm really interested in seeing how Alpine does next year when they have a Mercedes engine and gearbox instead of the Renault engine that every team agrees is the worst.\n\nI think Pierre will get a podium at some point this year though. Will it be this week? I don't know. Too much depends on how other people do. I don't think people should overreact to practice times though."", 'Translation and full article:\n\n> **McLaren is the team to beat, even on the second-fastest track on the calendar. Red Bull is back within one lap, Ferrari is better than its lap times suggest, and Mercedes is still searching for its form. The practice analysis.**\n\n> McLaren is playing with the competition in Jeddah. The lead of the day\'s fastest driver, Lando Norris, over Max Verstappen isn\'t huge at 0.280 seconds, but you always get the impression that the McLaren drivers still have something up their sleeve. Both drivers eased off the throttle shortly before the finish line. And neither had optimal laps.\n\n> But who had that in the evening hours of the first day of practice? The Ferrari drivers had to repeatedly abort their attempts. They\'re better than fourth and 13th place for Leclerc and Hamilton, respectively. George Russell in the Mercedes also didn\'t navigate the traffic optimally. Andrea Kimi Antonelli was slowed by a wall kiss. Pierre Gasly surprised everyone with a fastest time in the first practice session and lacked some grip in the second. In the long runs, however, the Alpine was the second strongest driver in the field.\n\n> Traffic on the Jeddah Corniche Circuit is just as big a problem as it is in Monte Carlo. The difference is that the cars are traveling much faster. Time and again, there were hair-raising evasive maneuvers. The section between Turns 4 and 8 is particularly dangerous. All blind corners, with hardly any room to maneuver. Q1, with 20 cars on the track, will be a challenge for everyone. Even one of the big drivers could get caught out, especially since warming up the tires is causing major problems for everyone.\n\n> Yuki Tsunoda\'s accident ended the long runs eight minutes before the checkered flag, leaving only short runs. Max Verstappen completed the longest distance with seven consecutive laps.\n\n> This was frustrating for the teams. The endurance runs in the afternoon heat were irrelevant, and the evening race simulations were too short to draw any definitive conclusions about tire durability. Since Pirelli supplied a level of softer tires this year, the teams are missing important information for their race strategy. McLaren boss Zak Brown, however, could still envision a one-stop race with medium tires at the start and hard tires at the finish.\n\n> **Who beats McLaren?**\nThe answer must be: none. Neither McLaren driver had optimal laps and were still in the lead. Lando Norris had to overtake two drivers in Turn 13 and managed to gain a tenth on his second attempt. By then, his tires had already lost grip. Oscar Piastri clipped the wall.\n\n> The two-time season winner demonstrated with his four-lap long run that McLaren will be in a class of its own in the race, even more so than in qualifying. His average time of 1:33.949 minutes remained unmatched.\n\n> Next best was Pierre Gasly with a time of 1:34.539 minutes. Even though Gasly only finished eighth in the second practice session, the Alpine driver could give McLaren\'s rivals Red Bull, Ferrari, and Mercedes a run for their money. And not just because of his strong long run. In the first practice session, with track temperatures reaching 50 degrees Celsius, Gasly set the fastest time. ""We were lacking a bit of grip in the evening,"" explained the Frenchman.\n\n> **Is Red Bull back on track?**\nThe track suits Red Bull, even though Max Verstappen again complained of understeer in slow corners and oversteer in fast corners in the first practice session. However, on the smooth asphalt, the tires don\'t suffer as much as they did in Bahrain. In the cool evening hours, the Red Bulls were almost back to normal. Verstappen lost almost three-tenths of a second on the fastest time and was best of the rest. Only in the race simulation does the situation continue to look bleak. McLaren is an average of 1.1 seconds faster.\n\n> Sporting Director Helmut Marko reveals: ""We made significant changes to the car between practice sessions and tried out a new setup. It worked very well on a single lap, even though we still lost two to three tenths to the McLarens. We were too slow in the long runs. That\'s where our old problem caught up with us: the tires overheat. We now have to find a compromise between maintaining the speed on a single lap and better protecting the tires in the race.""\n\n> Yuki Tsunoda is getting better and better at the Red Bull, finishing sixth, only four-tenths behind his team captain. His positive impression was dampened eight minutes before the finish line. Tsunoda\'s left front wheel touched the wall on the inside of the final corner and slid into the concrete wall on the opposite side. Marko nevertheless praised his number two: ""The speed is good, and the gap to Max is absolutely pleasing.""\n\n(1/2)', 'Is the answer to a headline that ends with a question mark typically ""no""?', 'Norris did say at the start of the year that at the rate these regs have closed the pack up, the midfield will be joining the top teams by the end of this year.\xa0', 'If the favorites are Haas or Sauber.', 'Sauber upgrades are doing something. Please just get a clean quali, Nico', ""They have a good chassis for sure, they were matching the McLarens in some corners in Bahrain.\n\nI'm more interested to see what they can do in Monaco."", 'Absolutely not.\n\nIs this season already so boring that journalists try to spin a narrative out of an FP2 session? That’s really rough', 'No']",156,49,0.86,156,734,734,-3,0,0.0,-3
1k2chja,F1 Bingo Round 5- Jeddah- Prediction Game Competition Link in Comments,https://www.reddit.com/r/formula1/comments/1k2chja/f1_bingo_round_5_jeddah_prediction_game/,2025-04-18, Statistics,,"['ATP might as well add a square for ""time chart breaks down mid race"" 😵\u200d💫', '[here is the link to the competition](https://docs.google.com/forms/d/e/1FAIpQLSfDKg2nUjelpLWT8rblSM-wg_fM3XMSk0clX8R1eFcRDDsnPA/viewform?usp=header)', 'It’s driving me weirdly nuts that spellcheck only has “Mclaren” highlighted once. WTF, Clippy?', 'I need to remember to play this from the first GP!', 'Two or fewer DNF*', 'I kinda expecting people hitting walls tomorrow and maybe someone beaching', 'Doohan and or Stroll sends it into a wall', 'Where do I see leaderboard. Or previous results', '""Max Verstappen wins the Saudi Arabian Grand Prix""\n\n\n\nDelulu is the solulu😭']",130,20,0.88,130,90,90,-1,0,0.0,-1
1k31bo8,Gasly released with tyre warmer still on wheel,https://www.reddit.com/r/formula1/comments/1k31bo8/gasly_released_with_tyre_warmer_still_on_wheel/,2025-04-19, Video,,"['Geez how fast are you guys with posting here', 'Straight to jail', 'I’ve had clothes caught under chair wheels before so yeah…I guess you could say I understand how an F1 driver feels.', 'looks like it got stuck on the side skirt', 'Does someone have a mirror? That page never works...', 'Alpine Moment ™', 'Like someone’s skirt getting caught in their underwear 😂', ""Wasn't on wheel, it was dragged by one of the sidepods - the commentators were just saying how narrow the pits are on this track."", 'I was actually very slow with this upload, as the host kept rejecting my video file for some reason. Had to re-encode the file before submitting it again.']",137,10,0.97,137,9,9,137,10,0.97,137
1k2wavj,[AMuS] Ferrari seeks consistency,https://www.reddit.com/r/formula1/comments/1k2wavj/amus_ferrari_seeks_consistency/,2025-04-19, News,,"['”Ferrari seeks consistency”. \n\nSo have we the last 20 years.', 'A consistent p5-p7', 'Translation:\n\n\n> **After four races, Ferrari is still waiting for its first podium finish. The new car is as good as a Mercedes or Red Bull under the best of circumstances. However, it lacks consistency.**\n\n> You have to look very closely for Ferrari\'s good moments this season. Lewis Hamilton\'s sprint victory in Shanghai. Charles Leclerc\'s second place on the grid in Bahrain. The two Ferrari drivers\' solid middle stints at the same race. ""A good stint or a highlight isn\'t enough to win. We need more consistency,"" demands team principal Frédéric Vasseur.\n\n> The bottom line is that the disappointments outweigh the disappointments. The poor performance of the red cars in the rain in Melbourne. The disqualification of both cars in Shanghai. The 16-second gap to the winning trio at the Japanese GP, in a race in which everyone was able to drive 53 laps at the limit because their tires barely wore down. The two to four-tenths gap to McLaren. Vasseur sees the Papaya racers as one step ahead of everyone else.\n\n> Although Ferrari had the best car in the second half of the 2024 season, the engineers changed the concept over the winter. The old SF-24 with its pushrod front axle was reaching its limits. The aerodynamicists saw no room to squeeze more out of the underbody.\n\n> **Old car was at its limit.**\nA pullrod front axle, on the other hand, allows the airflow towards the rear to be configured in such a way that, ultimately, more downforce can be produced. But that\'s precisely where Ferrari is currently struggling. ""We don\'t have a further development of last year\'s model, but rather a new car. It will take time until we find the right car balance for all conditions,"" the team principal apologizes.\n\n> Leclerc is on the right track. Last year\'s third-place finisher in the World Championship knows the team inside and out, and he has a reference point in mind with the old car. After Suzuka, Leclerc said with relief: ""I think I\'ve now found a way to get more out of the car with the setup."" The eight-time GP winner also made it clear: ""To beat McLaren, we need more upgrades.""\n\n> Lewis Hamilton isn\'t quite there yet. The team\'s newcomer is still experimenting too much. ""Charles is largely staying true to his setup over the weekend. I\'m still tweaking the car a lot to get a better feel for it. At the same time, I\'m trying to adapt my driving style.""\n\n> **New subfloor opens window.**\nFerrari already introduced a new underbody in Bahrain. It wasn\'t a response to the problems of the early races, but it did address a weak point of the SF-25 that the engineers had apparently already been aware of. Compared to its predecessor, the working window has been significantly narrowed. Ideally, Ferrari would have to run extremely low everywhere, but that\'s not possible because it would otherwise cause excessive wear on the underbody.\n\n> The new underbody is intended to open up this window somewhat and deliver the same downforce across a wider setup range. Bahrain was a small first step forward, according to Vasseur. But more such steps must follow. ""We have the ingredients for a good car, we just need to put them together correctly at the right time. I have the feeling that Mercedes and Red Bull, and usually one of the two McLarens, aren\'t doing any better.""\n\n> Vasseur is annoyed that defeats are often portrayed as major dramas. ""We\'re talking about a tenth of a second here, one way or the other. That made five starting positions in Bahrain. One tiny mistake is enough, and you either look good or bad. Red Bull wins in Suzuka and trails in Bahrain. But it\'s still the same car.""', ""We're consistently inconsistent. We're already there"", '""Next year"" has been pretty consistent theme for the past decade.', 'Same old Ferrari excuses. \n\nI feel sorry for Lewis and Charles. At least Lewis already has 7 titles and is a GOAT but Charles has no titles and with Max on the grid, he could end up retiring with no titles which will be one of the most terrible things of the sport.', 'The SF-25  has serious design flaws. Its the only top car that is struggling with ride height this year. Those were the kind of issues that teams solved back in 2023.\n\nThe 24 Ferrari was an extremely well balanced car. How the fuck did they mess this up so badly?\n\nEven Leclerc is complaining about the car being extremely tricky to drive. So Hamilton struggling is not really a surprise.\n\nIMO, Ferrari should write this season off and just focus on the new regs. The gap to Mclaren is just too big.', 'They are consistent. \n\nConsistently underwhelming.', 'And i seek happiness... not in life general but in Ferrari doing good in F1 .... both are so far away from reality...']",104,30,0.96,104,28,28,11,2,0.010000000000000009,11
1k2spf7,Aston Martin boss Cowell brushes off Verstappen future talk,https://www.reddit.com/r/formula1/comments/1k2spf7/aston_martin_boss_cowell_brushes_off_verstappen/,2025-04-19, News,,"['Peak journalism. Non news being the news.', ""Even if it's happening behind the scenes, Cowell won't give a hint of it. It only is told or announced by the main team's PR to make it official."", 'I just hope Fernando gets his 3rd title in AMR and happily retire.', 'That basically means shits going down....', 'so no news then', 'Is this so that Lawrence can see just how ~~bad~~ good Lance is?', ""These talks would be above his paygrade anyway. Stroll Sr would be AM point man on this. Doubt they would happen anyway though. I'm pretty convinced if he does become available this summer he goes to Merc."", ""He wouldn't admit it of course, but the way he grins and his face twitches I think he knows something. They probably indeed made him an offer""]",86,47,0.86,86,42,42,2,0,0.010000000000000009,2
1k30guq,2025 Saudi Arabian GP - Qualifying Discussion,https://www.reddit.com/r/formula1/comments/1k30guq/2025_saudi_arabian_gp_qualifying_discussion/,2025-04-19, Qualifying,"# ROUND 5 - SAUDI ARABIA

FORMULA 1 SAUDI ARABIAN GRAND PRIX 2025

# 🕒 SESSION TIMES

|Day|Session|Time (UTC)|
|:-|:-|:-|
|FRI|Free Practice 1|13:30|
|FRI|Free Practice 2|17:00|
|SAT|Free Practice 3|13:30|
|SAT|Qualifying|17:00|
|SUN|Race|17:00|

[Click here for start times in your area](http://f1calendar.com/)

# 🏁 RACE INFORMATION

* **Track**: Jeddah Corniche Circuit
* **Location**: Jeddah, Saudi Arabia
* **Race laps**: 50
* **Lap length**: 6.174km
* **Race distance**: 308.45km
* **Lap Record**: 1:30.734, Lewis Hamilton (Mercedes) 2021

# ⏪ LAST TIME AROUND

* **Pole position**: 1:27.472, Max Verstappen (Red Bull Racing)
* **Race winner**: Max Verstappen (Red Bull Racing)
* **Fastest lap**: 1:31.632, Charles Leclerc (Ferrari)

# 📺 WHERE TO WATCH?

F1 is broadcast on F1TV and through several local broadcasters. [Click here](https://www.formula1.com/en/toolbar/content_schedule.html) to find out if F1TV is offered in your region. [Click here](https://www.formula1.com/en/toolbar/broadcast-information.html) to go to the full list of broadcasters. Streams and downloads are not welcome on r/Formula1. Requesting and sharing streams and/or downloads will be met with immediate bans.

# ❤️ GOOD CAUSES

* 🇺🇦 [Want to support Ukraine? Here's a list of charities.](https://www.reddit.com/r/ukraine/comments/s6g5un/want_to_support_ukraine_heres_a_list_of_charities/?utm_source=reddit&utm_medium=usertext&utm_name=ukraine&utm_content=t3_t5okbs)
* 🏳️‍🌈 [Support Stonewall to help improve the lives of LGBTQ+ people.](https://donorbox.org/support-stonewall)","['https://preview.redd.it/1ecwsjja2uve1.jpeg?width=4032&format=pjpg&auto=webp&s=da12e74b64edfa9318da09c4b13c111c2cb05bdc\n\nLewis is reevaluating his life decisions 💀💀💀', 'https://preview.redd.it/aj6dh8a9wtve1.png?width=640&format=png&auto=webp&s=5dc86acb6a0ffe08ad0326c4cc7641e0fd651a46', 'Me: wow lando bottling \n\nMe: watching the driver onboards and I’d genuinely crash into these walls on a bicycle', 'https://preview.redd.it/6ukdvsvwstve1.jpeg?width=1170&format=pjpg&auto=webp&s=23e4b42f975684dd9fef163fbf9687d4fe74f994\n\n“Most q1 eliminations in F1 history.” What a trailblazer.', 'Tsunoda with 2 Q3s in consecutive appearances. If he keeps this up, he may have RBR wanting to stick with him through 2026 despite Honda leaving.', 'P13\n\n""Alonso beats off Hadjar.""\n\nOh ffs.', ""Yuki hype train, let's go 😁😁 Tsunodium"", 'Lewis looking at the time sheets with Carlos ahead thinking ""Damn should have considered Williams""', 'https://preview.redd.it/n3hp256nwtve1.png?width=623&format=png&auto=webp&s=2c4b0cd4f684c8d21b6a5eaa06e82bdb1ab73f89', 'Yea Yuki is gonna be alright.']",85,7473,0.96,85,497,497,55,6715,-0.010000000000000009,55
1k2jsyx,"""Race sim"" FP2 Jeddah GP 2025",https://www.reddit.com/r/formula1/comments/1k2jsyx/race_sim_fp2_jeddah_gp_2025/,2025-04-19, Statistics,"Raw: https://rakesh-i.github.io/stint-data/
Imgur: https://imgur.com/a/eNyjtUT","['GG', ""Due to red-flag very little long run data. I excluded less than 3 laps. You can see all other driver's stint here https://rakesh-i.github.io/stint-data/"", 'Nice analysis, but I wouldn’t consider any of it valuable…', ""Okay, umm... given the Red Flag I'd say only Verstappen has a more representative stint while the rest were too short thus tire deg hasn't kicked in yet!"", 'If this is RBs true pace they are fucked', 'Albon’s pace on the hard tire seems promising…', 'Hope Haas will get some updates soon that help with the stabilization on high-speed tracks, we duly need them.\n\nBut we still have fp3 and before quali to fix settings, I prayge', 'Hi Nan!', 'Engine modes are vastly different']",62,17,0.82,62,123,123,-1,0,0.0,-1
