unique_id,post_heading,post_url,publish_time,tag,post_content,top_comments,upvotes,comments,upvote_ratio,score,total_upvotes_comments,total_score_comments,upvotes_growth_rate,comments_growth_rate,upvote_ratio_growth_rate,score_growth_rate
1jspr9u,Race Highlights | 2025 Japanese Grand Prix. (8mins!),https://www.reddit.com/r/formula1/comments/1jspr9u/race_highlights_2025_japanese_grand_prix_8mins/,2025-04-06, Video,,"['So about 7.5 minutes too long.\n\n“It’s lights out and away we go and Max Verstappen wins the Japanese Grand Prix”', ""I've never seen a pitstop as the thumbnail lol"", '8 minutes of what?\xa0', ""You think that's long, Sky put a 16 minute cut on their YouTube page"", '8 minutes of watching pretty much nothing happen 😂', ""That's about 7 minutes too long"", 'So we got a few angles of the Max and Lando pitstop thing. What is in the other 6 minutes?', 'luckily I had it on DVR - bump 5 mins... no change... repeat', ""Snoozuka\n\nThat was the most boring race I've seen for a while..."", 'Someone needs a raise']",60,16,0.95,60,15,15,3,0,0.010000000000000009,3
1jsrt4q,2v1 strategy McLaren vs Verstappen would have obviously been better for the Papaya's,https://www.reddit.com/r/formula1/comments/1jsrt4q/2v1_strategy_mclaren_vs_verstappen_would_have/,2025-04-06, Discussion,"McLaren should have absolutely let Piastri go long and pitting Norris and Verstappen at the same time. We saw how close the gap was when Norris and Verstappen came out of the pits. 

Max would need to pick up the pace to defend both Norris from behind and the overcut from Piastri, significantly damaging his tyres during the earlier rounds of his 2nd stint.

Scenario 1: With the pace that Oscar had, he might have won the overcut over both frontrunners - resulting in more points for McLaren.

Scenarion 2: Piastri drops back behind both frontrunners after his pit. With the better tire management on the McLaren cars Norris would have been able to attack Verstappen in the later stages. Maybe even Piastri has a look, considering he was faster in the overtaking parts of the track. - again, more points

Scenario 3: Max Verstappen wins, but hey at least you tried something.","[""I actually think it was dammed if you do dammed if you don't. \n\nThe overcut definitely wasn't, we didn't see a single person do so. We can use both Hamilton and Kimi as examples. Both came out much further behind Russell than when the latter pit. Whilst the delta wasn't massive newer tyres were quicker. \n\nHad either McLaren run longer then they'd likely end up behind Leclerc & Russell at a minimum and maybe Kimi or Hamilton if they adjusted their strategy in response. \n\nWhilst the McLaren was a quicker car the overtake delta is massive and dirty air a large hindrance. The time loss in passing these cars would have been significant and Verstappen would be managing the gap accordingly. \n\nNorris would be unlikely to comply with moving over as well. \n\nFurthermore, there was zero evidence that any tyres were destroyed in this race. \n\nI don't see how McLaren could have done anything to affect the outcome. They lost it yesterday with two messy quali laps."", 'I think the team just want the safe team points', ""This is the reality.\n\nStella: yo bro do you think we'd be better off swapping them around?\n\nEngineer who has access to thousands of data points from hundreds of sensors that can literally tell if a grain of dust landed on the front wing: nah g\n\nStella: bet"", ""Yeah, but then they'd have at least 1 unhappy McLaren driver. They both see each other as another competitor in the WDC. This is why having a team with a clear #2 is preferred in these situations. If this was Red Bull, they'd sure as hell make use of this."", ""I think the Norris fakeout should've actually been the pit call to try an undercut. Then have piastry go a few laps all out in clear air after verstappen reacts, and see what happens."", 'Why don’t try to make longer Norris first stint instead of Piastri?', ""The overcut doesn't work because fresh hards were directly quicker than the used mediums. Letting one of the drivers wouldn't accomplish anything. We haven't seen any big tyre degradation so Lando would in no case be able to pass Max. Just look at the deltas. Lando was quicker in sector 1. With the quick s turns, that speed disappears as soon as he sniffs dirty air."", ""You honestly think Piastri could have made an overcut possible? I don't see it at all. He was faster but not that much faster.\n\nWorth a shot though."", ""I do agree but, to be fair, they were one wheel on the grass away from taking the lead after Lando's pit stop""]",59,45,0.83,59,39,39,7,4,0.0,7
1jso4lm,Race Pace Japan 2025,https://www.reddit.com/r/formula1/comments/1jso4lm/race_pace_japan_2025/,2025-04-06, Statistics,"Imgur: https://imgur.com/a/hWiTlQT
Raw: https://rakesh-i.github.io/stint-data/","['Max definitely losing without that pole.\xa0', 'Top 3 within 3 hundredths \n\nTop 6 within 3 tenths per lap \n\nAntonelli 2 tenths off at a brand new track\n\nVery boring race but performance-wise this was incredibly intriguing and close', ""That Antonelli stint was amazing, love how he's done so far in F1"", 'Hamilton getting slower despite putting on a quicker compound. Getting dropped by Antonelli within 2 laps despite Hamilton having DRS\n\nWell done Ferrari 👏🏻👏🏻👏🏻', 'Bortoleto quietly having a good start to the season, and Hamilton lacking 2 tenths. Smaller gap than I assumed this race. Tsunoda and especially Lawson were bad this race. Antonelli did amazing though, the hype is real.', 'Racepacierre Gasly.', 'I am once again asking Pirelli to make the Hard much slower than the Medium.', 'Hamilton’s race pace, his supposedly biggest strength has been shocking(for his standards).\n\nThis is also the 2nd time Norris is beat by Oscar on pace this year. If Oscan can start putting his laps together in Q3, it will be a very close battle, or a gift for Verstappen', 'which makes the pole even more amazing than it already is']",55,21,0.92,55,20,20,4,0,0.010000000000000009,4
1jsowh4,2025 - Japanese GP: R (3 Pics),https://www.reddit.com/r/formula1/comments/1jsowh4/2025_japanese_gp_r_3_pics/,2025-04-06, Statistics,,"[""Seems like Lawson didn't improve at all..If he didn't improve..Redbull for sure gonna chase Colapinto..."", 'You should make a graph showing starting vs finishing grid... but we all know what that graph would look like.', 'Tbf to Lawson - he got prime VCARB strategy experience where they put him on softs for some reasons.', ""He didn't have an amazing race but tbh most of it was poor strategy and fighting sainz for most of the race. Kinda shafted him in the end having to go around 20 laps on softs"", 'Colapinto is going to be driving Alpine soon.\n\nRed Bull have Lindblad waiting.', ""I'm more impressed that they actually managed to keep Hadjar in the points."", 'TBF to VCARB, both Lawson and Sainz had late stops when they both switched to softs. By that time it was clear that tyre management was not as issue. \n\nSuzuka was originally developed by Honda in the 50s explicitly to have little tyre degradation so they could better test the cars rather than the tyres. It is always funny that Pirelli keeps advertises the GP as “high impact on tyres” only to be proven a lie. Last year, Sainz even said how the whole GP could be done with just one pair of mediums and post-race the top teams had, again, almost zero degradation.\n\nToday, we had a resurfaced stage 1 and ideal temperatures. If the 1 stop was not required, Hamilton could have probably finished w/o any stops. In other words, ideal conditions even for the softs.', 'it kinda worked for sainz in a williams that is not stronger than them', 'TBH I think that they should receive a hefty fine for his seat moving….']",49,10,0.9,49,9,9,3,0,-0.020000000000000018,3
1jsig44,2025 Japanese GP - Pre Race Discussion,https://www.reddit.com/r/formula1/comments/1jsig44/2025_japanese_gp_pre_race_discussion/,2025-04-06, Pre-Race,"It's nearly time for the Japanese GP! How are you feeling? 

Remember, the race starts at 5AM UTC / 6AM BST / 2PM local time.","['""What tyres are you starting on Christian?""\n\n""Pirelli.""', 'If it rains, there is less chance of fire - Will Buxton', 'Pessimists see the race as semi-wet. Optimistists see it as semi-dry. Ferrari engineers see it as a chance to make an epically bad strategy call.', ""I'm actually in the circuit! My first grand prix!!"", 'I love seeing those ghost car comparisons', 'It is raining….Charles said his setup is very extreme and aggressive so he doesn’t hope a rainy race….💀', '""In theory, they could be on pole. In theory, I\'m an astronaut"", I\'m dead.', 'West coast cali checking in. 6 Gins deep, bring on the chaos', 'Can these people quit saying most drivers don’t get a home race?  The majority of the grid get a home Grand Prix.  The only ones without are just the three French men, Liam, Nico, and Albon.  So 14/20 drivers get a home race.', 'I unlocked a new problem.\n\nLmao. I feel a meme is born']",52,955,0.87,52,797,797,4,0,0.020000000000000018,4
1jss1y6,Mark Hughes: Where McLaren really lost a winnable Japanese GP,https://www.reddit.com/r/formula1/comments/1jss1y6/mark_hughes_where_mclaren_really_lost_a_winnable/,2025-04-06, News,,"['The speed with which these articles get churned out from *The Race* leads me to believe that they have sets of draft articles with outcomes that they just edit post-race.', "">a track which requires a laptime advantage of 1.4s to make an on-track overtake,\n\nYeah there's no way either McLaren was ever getting past Max with that pace difference required."", '>""First of all, they were obliged to bring Piastri in on the lap they did because fifth-place George Russell had just pitted from not very far behind. So long as Piastri was brought in the lap after, they would be set to remain ahead. If they\'d left it another lap he\'d have dropped behind the Mercedes ""\n\nAbsolute nonsense.\n\nThe gap between Piastri and Russell was 4.7s when Russell pitted with a car in between(Leclerc). That turned into 4.2s after Piastri stopped with 3 cars in between(Alonso, Gasly, Tsunoda)\n\nIn fact Leclerc pitted a lap latter than Piastri and still came out ahead of Russell even though he only had a 2.7s gap over Russell when the latter pitted.\n\nThis whole article is just weirdly trying to excuse Mclaren literally rolling over and accepting defeat from the start.', 'The answer is Saturday, they lost it in a qualifying where they should have been 1-2 but neither driver hooked the lap up fully.', 'In Suzuka.', 'They didn’t make the right calls but this was a track where it didn’t matter as much because of how much pace is needed to overtake the car ahead. The qualifying set the positions of the race. McLaren got away with it today but they probably won’t get away with it next time.', 'On Saturday.', 'McLaren seem to be extra stupid around Suzuka, they did this with Norris last year asw when they made him pit the same time as Charles who he was fighting for p4.', 'If Piastri couldn’t overtake Norris I don’t know what everyone is talking about overtaking Max.']",41,31,0.81,41,30,30,-1,3,-0.04999999999999993,-1
1jsuew9,"[Carlos Sainz via IG] Tough race stuck in traffic after a costly Saturday, but the pace was there. Felt good with the car and did some nice overtakes. Let's build from here. On to Bahrain.",https://www.reddit.com/r/formula1/comments/1jsuew9/carlos_sainz_via_ig_tough_race_stuck_in_traffic/,2025-04-06, Social Media,,"['You can feel the Williams in his eyes', 'I remember someone posting here after some FP result that Albon has always sucked and would get outclassed in every way by Sainz now that Albon had to compete against a real driver. That aged poorly.', 'It’s the 3rd race and people act like the guy is already on his way out of F1.\n\nHe received a new chassis this weekend and it clearly helped as he was only 0.05s from Albon in qualifying. The penalty and track didn’t help his final position, but he’s says the pace is there, I have no reason to doubt it.\n\nKnowing how his adaption usually goes, he’ll continue to improve as time goes on. His start at McLaren was very similar.', ""His first three races at Williams he was 0.325s, 0.245s, 0.053s off in qualifying. He's definitely improving, even if the standings don't necessarily show it."", 'To be fair, I also thought Carlos would beat Albon. It is still early of course, but I definitely have underrated Albon.', ""Albon's Red Bull stint has caused people to underrate him now"", 'this. if he had his qualy position hed be 11th. maybe 10th. only concerning thing is he didnt pass hulkenberg easily. not that the broadcast would show it….ugh.', ""There weren't that many overtakes in general.""]",56,8,1.0,56,8,8,56,8,1.0,56
1jsrat1,Standings after race week 3,https://www.reddit.com/r/formula1/comments/1jsrat1/standings_after_race_week_3/,2025-04-06, Statistics,,"[""Just realised:\n- Max scored ALL of Red Bull's points.\xa0\n- Russell is single handly outscoring Ferrari.\xa0\n- Stroll is beating Alonso currently.\xa0\n- Kimi is doing pretty well for a rookie.\xa0\n- Albon having a really good start & being 7th in standing.\xa0"", ""Sprint race is a bit odd isn't it. Can win in that but most regard it as not really a race win?"", 'Given there are 5 drivers with no points, I consider myself to be firmly placed in the bottom quartile of F1 drivers.', 'Kimi with twice the points of Hamilton lol', 'Do you have a copy of this document you work off?', 'Ferrari are just barely outscoring Antonelli (they also have less points than Russell)', 'I keep them separate because of the difference in points scored. I think the more seasons they’re around for, people will begin to see them as more important. Who knows though!', 'I think Kimi is actually turning into promising pick by Toto. Hope the Merc team can nurture him to grow. Clearly has speed.\xa0', ""It's sensible to keep them seperate, but show them. Still, I don't think people will see them as more important in the future than currently.""]",39,11,0.9,39,9,9,1,0,-0.010000000000000009,1
1jsthop,Lewis Hamilton admits rear-end issues held back Ferrari progress as no safety car killed strategy,https://www.reddit.com/r/formula1/comments/1jsthop/lewis_hamilton_admits_rearend_issues_held_back/,2025-04-06, News,,"['The suspension change really fucked them over. The are already losing ground in the championship. I know they are also looking into 2026. But damn, their car was fine last year. A evolution of it would have been better for sure', 'I hear checo has no issues with his rear end', 'Yeah, waiting for SC in a track with historically not a lot of SCs was brilliant.\n\nEven less now that the race isnt in rainy season.', 'Also Lewis mentioned \n\n“Through the first three races, there\'s been a bit of a deficit between both sides of the garage on the car.”\n\n""So, on my side, something’s underperforming, so it\'s good to know.”\n\nImo Lewis could take a look at Charles’ setup, cuz obviously two drivers use total different setups. It might give him some new ideas probably.', 'Remember where McLaren were at the start of last year. This race would be one of the most boring races behind Monaco as there isn’t much chance for overtaking and I think this is something the FIA need to keep looking at because it’s just not good to watch cars running around in succession, we need nose to tail action', 'So their strategy was hoping for a SC ???', 'I don’t care much for race plans from top teams that are reliant on safety cars', 'Vasseur needs to hire Bottas asap.', 'It was a gamble for them but sadly, it didnt work out for them. Best for them to salvage what they can for 2025 and prioritize their R&D for 2026.']",44,27,0.88,44,26,26,30,17,0.10999999999999999,30
1jss3ec,McLaren couldn’t risk alternate Japan strategy with Lando Norris in Max Verstappen chase,https://www.reddit.com/r/formula1/comments/1jss3ec/mclaren_couldnt_risk_alternate_japan_strategy/,2025-04-06, News,,"['All they had to do was try to undercut Max with Lando and extend with Piastri.', 'No risk, no rewards', 'In the f1 post race analysis one of the pundit summed it up perfectly : Mclaren dont want to prioritise a driver this early in the season making other unhappy and thats why they didnt ask lando to make way for oscar but they would have a problem with this at some point of season', ""Here's my take:\n\nMcLaren didn't want to risk undercutting Oscar past Lando and then have to handle the resulting situation afterwards, even if it meant handicapping themselves in the battle for the win.\n\nLando had a substantial gap to Charles and George, so he could've easily extended for multiple laps, and get some sort of tyre delta to Max.\n\nObviously getting the biggest possible delta to Max would mean Oscar undercutting Lando. Which can definitely result in a complicated situation later.\n\nIf the new tyre delta wasn't enough and Lando can't catch back up, he'd be annoyed at losing second due to being undercut by his own team. If Lando does catch back up at a time when Oscar is 1 second behind Max, Lando would want the position back and Oscar would be miffed at being asked to let Lando through when he himself is right behind the leader and pushing for the win.\n\nThey intentionally went extremely conservative in an attempt to keep both drivers happy, instead of making tough decisions later. That also gave Max an easier path to win this race."", 'I admit, in the moment I wanted them to swap so that Oscar could try and catch him. But it didn’t take much afterthought to realize that Norris was only 1.5 seconds off of him and that’s not nearly enough to tell him to swap places cause he isn’t fast enough. They kept up with Max, he wasn’t falling away. If Max had even the slightest change in his car, whether it was tire deg making him take a corner differently, changing brake bias or modes due to fuel getting lighter or maybe having to conserve fuel, or even a lock up almost anywhere on track, Norris would have been in position to take him. And with no team orders, Oscar was directly behind Norris so he’d be primed to take advantage, too. They made the right call, easily. They’re locking in the championship early with results like these.', 'They are literally just like Mercedes used to be. So conservative and risk averse because they think in the long run the car and drivers will get the results and points to win the title. So many times, they left Lewis out on a medium/hard and just hoped it would all work out. \n\nReality is, their car advantage is there but not as steep as we thought it was in testing. Their drivers are not as good as Max. And their execution is still like that of a team that doesn’t quite believe where they are in the order.', ""And that's the problem at Mclaren: the potential, rarely the balls."", 'Why should Mclaren gamble it all instead of just taking P2 and secure points? They know they have a rocket ship, take the free wins on the tracks you can actually overtake and hark in the championship money.', 'Piastri fans are just upset that McLaren let the qualifying results dictate the race']",37,133,0.73,37,126,126,9,29,0.020000000000000018,9
1jsnsfl,"F1 HOT or NOT - rate drivers, teams and the race for the 2025 Japanese GP!",https://www.reddit.com/r/formula1/comments/1jsnsfl/f1_hot_or_not_rate_drivers_teams_and_the_race_for/,2025-04-06, Statistics,,"['One DRS zone - not hot.', ""I don't think I've ever voted this much average in the rankings. Just not a lot happening and it felt like most drivers just drive their own races in the drs train. Qualifying was the big one this weekend."", 'Not - McLaren strategy\n\nNot Not Not - That race.', 'Hot: VER, HAD, ANT\n\nNot: STR, McLaren strategy department, the race (snooze)', 'McLaren shooting themselves in the foot time and time again. Strategy was questionable to say the least', 'Hot: Verstappen, Hadjar, Antonelli\n\nMost of the race was a DRS train where not much could happen so hard to criticise people I think. I guess the McLaren strategists were pretty bad?', 'Not cold: Vcarb strategy for once', 'mclaren - absolutely not', ""Not many standouts. Max, perhaps Hadjar and Antonelli?\n\nNOT: McLaren strategy, Hamilton's setup""]",30,47,0.84,30,46,46,-1,0,-0.010000000000000009,-1
1jstmh6,2025 Japanese Grand Prix - Race Strategy & Performance Recap,https://www.reddit.com/r/formula1/comments/1jstmh6/2025_japanese_grand_prix_race_strategy/,2025-04-06, Statistics,,"['Antonelli causaly driving more than 50% of the race on mediums. \n\nAnd it didnt look like the tires degraded even a bit.', ""Wtf were Sainz and Liam's Strategy \n\nThey really gave Liam that welcome back by giving him the strategy that they would have given to Yuki if he stayed there"", 'Check out the interactive version of these graphics and more at my [strategy dashboard](https://armchair-strategist.dev/).\n\nUpdates since last race:\n- Strategy plot now gets a legend for fresh/used tyres\n- Ensures lineplots are always properly annotated with driver annotations\n\nFuture Work:\n- By far the most popular request is for the position plot to incorporate the starting grid. I wrote a [post](https://www.reddit.com/user/FCBStar-of-the-South/comments/1jifcui/why_race_starting_positions_cannot_be_determined) to explain why this is not possible *at the moment*.\n\nWhat other graphics do you want to see and how can these existing graphics be improved, question.', 'If you look at the fuel-adjusted lap time graphic on the dashboard (I will include it starting next race), everyone was clearly on tyre preservation mode through the first stint as the times were remarkably consistent (all within 1s)', ""It worked didn't it? Sainz gained three places, all on the track.""]",26,6,0.96,26,5,5,16,2,-0.040000000000000036,16
