unique_id,post_heading,post_url,publish_time,tag,post_content,top_comments,upvotes,comments,upvote_ratio,score,total_upvotes_comments,total_score_comments,upvotes_growth_rate,comments_growth_rate,upvote_ratio_growth_rate,score_growth_rate
1gjhquu,2024 Brazilian Grand Prix - Day After Debrief,https://www.reddit.com/r/formula1/comments/1gjhquu/2024_brazilian_grand_prix_day_after_debrief/,2024-11-04, Day after Debrief,"Welcome to the Day after Debrief discussion thread!

Now that the dust has settled in Brazil, it's time to calmly discuss the events of the last race weekend. Hopefully, this will foster more detailed and thoughtful discussion than the immediate post-race thread now that people have had some time to digest and analyze the results.

Low-effort comments, such as memes, jokes, and complaints about broadcasters will be deleted. We also discourage superficial comments that contain no analysis or reasoning in this thread (e.g., 'Great race from X!', 'Another terrible weekend for Y!').

Thanks!","['Ocon taking 4 seconds out of Max in 1 lap when the rain was at its heaviest has flown under the radar. \n\nYes Max would’ve been playing it safe because of the championship \n\nHowever Ocon going full send while leading the race in the most treacherous conditions has to be applauded.', ""I'm still laughing about Stroll beaching himself. One of the stupidest things I've seen in my few years watching the sport"", ""Colapinto & Bearman learned some valuable lessons this weekend. \n\nIt's not always sunny in Formula 1."", ""Was a good race despite it being such a stop-start weekend. Nice to see Max show what he can do after not having the car or conditions to compete for a long time. Feels deserved and the definitive way for him to demonstrate why he's the deserving champion.\n\nOn another note, I really hope that things cool down here now the championship has been more-or-less wrapped up. It's reached almost 2021 levels of hysteria recently with all the squabbling, attacks on driver character, accusations of bias/conspiracy, nationalism etc. I try to tune it out but when its at the top of every thread it's unavoidable. \n\nHopefully it all calms down and we can just enjoy the end of what has been an absolutely fantastic season."", ""Is Interlagos ever boring? It's a special place, and, regardless of the facilities or the budgetary problems the circuit has (if I recall correctly, Abu Dhabi has actually slung some cash to help Interlagos), FOM need to recognise this circuit is a 'Crown Jewel' of F1 that should never face the axe.\n\nWhile there's been plenty of column inches dedicated to Alpine's double podium and three place jump up the WCC leaderboard, my takeaway is that this result is exactly why points for 11th and 12th would recognise the midfield and lower teams who consistently put in the effort. \n\nHaas (and in particular Hulk) have been very consistent - he finished 11th seven times this year - that would have been 14 extra points. Alpine would most likely still have jumped the inconsistent Williams and VCARB, but Haas' position earned through season-long consistency wouldn't have been wiped out by one freak result."", 'I think for all of the talk regarding the aborted start procedure and the ""potential"" for endangering marshals etc (very fair concerns), people are really understating how dangerous the move Carlos Sainz\' made was for which he got the exact same punishment. Reading the document and then seeing he didn\'t even get penalty points for it is just absurd', 'Gasly and Albon were dropped for much much less than the disaster of a season Perez is having. \n\nPerez needs to go, even one or two good races is not enough now.', 'I am still baffled that Norris wrongly starting another formation lap with a crane, marshals and Lance Stroll still near the track only resulted on a 5k fine ...', 'I thought it should be said, but my strongest kudos go out to all of the mechanics, especially those from Williams, Aston Martin and Ferrari for being able to repair those cars in such a limited timeframe to get them ready and running for the race \U0001fae1. \n\nSpeaking of Aston Martin, I commend Alonso as well. It was bad enough that their Sprint was just horrifying from the get go, and qualifying was shaping up to be hell from the two shunts, but he managed to save the car and made a recovery drive for the mechanics and the team, all with that back pain *(which I am guessing it is due to the car itself, or maybe the after-effects to his illness?)*. A silver lining to what looked like a nightmare', 'There are specific drives by verstappen that just feel so filled with this controlled rage and sheer determination they’re just damning and brutal. This race will be watched back for a long time but i hope people will remember the context behind it (the title battle, tough year and horrid weekend that led to this) because it just makes it so much more meaningful as u watch him go faster lap after lap to make a statement']",69,396,0.87,69,3341,3341,3,4,0.010000000000000009,3
1gjv0tv,Fun Fact: Pierre Gasly has achieved 3 out of his 5 F1 podiums starting from tenth place or lower.,https://www.reddit.com/r/formula1/comments/1gjv0tv/fun_fact_pierre_gasly_has_achieved_3_out_of_his_5/,2024-11-05, Statistics,,"[""Pierre's other two podiums not included here because he started within the top 10 on those times.\n\n* Brazil 2019, Toro Rosso, started P7 finished P2\n* Baku 2021, AlphaTauri, started P4, finished P3\n\nWhat I've learnt from this though is that when chaos emerges in F1, Pierre is there to pick up the pieces and nab those high points and podiums."", ""Amazing driver on his day, shame there haven't been more good days in his career so far"", 'Since his departure from Red Bull, he made it to the podium every year, except for 2022.\n\n- 2019 - Interlagos P2 (Toro Rosso)\n- 2020 - Monza P1 (Alpha Tauri)\n- 2021 - Baku P3 (Alpha Tauri)\n- 2023 - Zandzwoort P3 (Alpine)\n- 2024 - Interlagos P3 (Alpine)', 'Man just likes playing on hard mode.', 'He should just park it once he makes Q2', 'He’d have done better than Checo in the RB the last two years. Too bad he missed his chance', 'In Brazil we call him Monte Gasly(Mount Gasly) after he closed the Hamilton in Monaco 2021, but apparently the ""Mount"" is because he likes to climb', 'that italian gp was fantastic', 'Mr. Right Place Right Time']",2370,50,0.99,2370,47,47,550,9,0.0,550
1gjp3ot,Ollie bearman Radio during the heavy rain period of the GP yesterday ,https://www.reddit.com/r/formula1/comments/1gjp3ot/ollie_bearman_radio_during_the_heavy_rain_period/,2024-11-04, Social Media,,"['""Bruh I\'m gonna die over here""\n\n""Ok""', 'Meanwhile Alpine drivers: A’hoy 🏴\u200d☠️⛵️', 'Same comments were made by piastri colapinto said before he crashed he was on the wrong tyre and also extreme conditions \n\n[Piastri Radio ](https://x.com/OP81con/status/1853457366433607813?t=8G3vtl3bRaaxfWhmQaU5BQ&s=19)\n\n[Colapinto radio ](https://x.com/mdzol/status/1853217958933430577?t=d0e8W_pXQKD1l-co0kvbrg&s=19)', ""That was definitely the worst rain I've seen them drive through in a while.\n\nThere was one point you could just see the cars creating an actual wake into the standing water, I believe it was right before the red flag/Colapinto crash."", ""People have made a lot of mention recently of Bianchi, but people forget that Dilano van 't Hoff was killed in super wet conditions at Spa only a year ago. Drivers dying in bad conditions isn't ancient history."", 'To be fair it was really bad just before the SC/red came. Could barely see the circuit from the trackside camera, it would be way worse in the cockpit.', '"" Understood,  have a nice death ""', ""now that we have helmet cams .. you could actually see how little the drivers were able to see in those conditions !! I think it was Piastri’s helmet cam iirc where out of nowhere there was flashing red lights from the car ahead !! And I kept thinking to myself, damn these guys are next level.\n\nEdit: It was Norris, for those interested it check out Lando's cam from Lap 29 - Lap 32. It is insane, it was like they were driving blind"", 'The irony of the full wet tyre. Great at clearing water, no doubt. But where does that water go? Right into the FOV of the drivers behind. I’d bet that most if not all drivers would be okay to drive in heavy rain if they had some semblance of vision. At the moment, the spray makes it difficult to see what’s ahead and even behind.']",4428,330,0.99,4428,317,317,389,16,0.0,389
1gjk9iv,[@F1] Nine of @Max33Verstappen’s lap times in Brazil were good enough for fastest lap,https://www.reddit.com/r/formula1/comments/1gjk9iv/f1_nine_of_max33verstappens_lap_times_in_brazil/,2024-11-04, Social Media,,"['9/10 team principles recommend having Verstappen in the car when it rains.', 'Was so funny seeing GP almost begging him to slow down but he just kept going faster and increasing the gap', 'Hard to hate a man that goes from 17 to 6 without a red flag so fast, and then absolutely crushes the times while many others were struggling x\n\nMax for champion for 2024!', 'Every time Max saw ""VER"" on fastest lap, he thought it was for someone else, so he kept on driving faster. So every lap, he\'d see ""VER"" name show up, that pissed him off and he drove even faster.', 'Some truly incredible speed from him. Drove that car like a true champ', ""Nobody's perfect."", 'do you think he was pissed that 66 wasn’t a direct improvement', 'Why not all 69 ?      \nVerstappen slow. He got lucky.', 'Horrible lap by Verstappen on lap 68, tsk tsk.', 'Such luck.']",5022,249,0.98,5022,8691,8691,279,2,0.010000000000000009,279
1gjjddx,Lando Norris congratulates Max on the win,https://www.reddit.com/r/formula1/comments/1gjjddx/lando_norris_congratulates_max_on_the_win/,2024-11-04, Social Media,,"['>View 287 more replies', 'To quote Seb in 2018:\n\n“I think it’s not fair. I mean, I don’t know what Lewis did. We’ve all been in that situation, we fight someone, we go sometimes wheel-to-wheel, it’s close and you have a lot of adrenaline going. Do you think comparing to football, if you have a microphone on a football player’s mouth, that everything he says is something nice and is a nice message when the guy tackles him and maybe sometimes he fouls him or not? I don’t think it’s justified to give us these kind of s*** questions and making up a story out of nothing, if we are just racing and we are full of adrenaline and sometime we say these things.”', 'This sorta instagram discourse is a new low for our subreddit, truly embarrassing\xa0', 'Well that doesn’t fit my narrative. >:(', ""I'm a Max fan, but all this Norris hate is getting out of hand, just chill damn\n\nMax just had one of the best driver performances in the past few years, let's just focus on that"", 'The sad part is that the comments underneath Landos comment is full of hate. I hope Lando has the right people around him not too long ago he was the lovable twitch streamer that most people loved, the switch-up is insane.', '35% off the Simply Lovely collection', 'I always give drivers some grace for things they say during and immediately after the race.  \n\nDid he say something stupid? Yes. Is this completely blown out of proportion? Also, yes.', ""I don't expect nice comments under his comment there.."", '-My social media manager said nice things about your social media manager. \n\n-Fans fight it out in the comments\n\n- meanwhile in a private jet, Max and Lando playing cards.']",5252,630,0.94,5252,16321,16321,197,8,0.0,197
1gjee5w,[autosport] Charles on Max's magic drive in Brazil,https://www.reddit.com/r/formula1/comments/1gjee5w/autosport_charles_on_maxs_magic_drive_in_brazil/,2024-11-04, Social Media,,"['When Maxsplaining meets Leclairifying.', 'I really want to see a full season of Charles vs. Max, 2022 was a tease. Their wheel to wheel driving is hard but fair,  and you can see Max has more respect when they race together.  Hopefully 2025 Max vs. Charles and Lewis.', 'Given Perez didn’t even get into the points in the same car, he might be right', 'This weekend wasn’t about Ferrari or Charles. Heck they didn’t even get much tv coverage at all. Yet somehow the brief battle between Max and Charles at the middle of the race made to the highlights, and reminded me that this duo and their head to head driver battle is what I wanted the most. Clean, precise, pure race craft, and mutual respect. I hope Ferrari can deliver a fast car next year and be more relevant from the start.', 'It was a magnificent drive from Max, and  everyone acknowledged this', ""I just love Max's and Leclerc's bromance. I hope we get a stellar WDC battle between them next year."", ""I would genuinely be depressed if these two end up in a sour rivalry. Hopefully it won't ever happen because so far they have been class acts towards each other.\xa0"", 'Charles is arguably the closest to Max on the grid in terms of pace, consistency, overtaking ability etc. \n\nBut rain max is a different animal. In all my years of watching F1, I’ve seen some great drivers in the wet - namely Schumi and Lewis (wasn’t old enough to see Senna) - and I think max is on that level if not surpassing it. \n\nHe’s pure magic honestly. The way he’s able to find grip, adapt to the conditions, change his lines and braking points on the fly is mesmerizing. It’s like he just “knows” what to do instinctively. Barely makes a fucking mistake.', ""A full, season long battle between those two (if the cars have parity) would eclipse even 2021,in my opinion. They both have talent flowing out of their ears, and the battles between them on track seems to mostly be very respectful. Norris, well, doesn't have that last bit needed to be a superstar.""]",12452,432,0.97,12452,22489,22489,227,3,0.0,227
1gjefq9,"Lewis Hamilton thanking his pit crew for last time ""That was a disaster of a weekend guys. Thats the worst the car has ever been, but thank you for continuing to try. Great job to all the guys at the pitstop.""",https://www.reddit.com/r/formula1/comments/1gjefq9/lewis_hamilton_thanking_his_pit_crew_for_last/,2024-11-04, Video,More context- for next 3 races his pit crew will switch so he's thanking this group because it's their last time working on a gp together,"['""The car is a shitbox, but thanks for trying""', 'oh that makes so much more sense, it had me very confused as it sounded like he was saying goodbye in general and i was like... dude there is three more races!\n\nThanks for the context :D', '""The \\[car\\] feels good, much slower than before. Amazing.""', 'I was wondering why he thanked them. For a minute I was afraid that he wouldnt finish the season. So thank you for posting this.', 'I didnt know teams switched pit crews. What is the reason - just to avoid factions forming around each driver?', 'Don’t get me wrong I don’t believe the sabotage conspiracies, but not giving Hamilton a pit lane start after he supposedly asked for one is another thing to add to the list of things that merc have done that just make no sense this season', ""Yeah his car seems proper fucked. The onboards between Lewis and George seem to show completely different cars. I don't know if it's Lewis risking too much with different setups but it's not working."", 'I just hope his last race and the end of season is somewhat special and they do something at least at the level of the Bottas goodbye, when they made a party “back at the factory”, including Bottas being paraded around lol\n\nMercedes, please, try not to be like RB or RBR (Ric treatment)', 'Why are they switching his pit crew?', 'Thank you for providing the context. It looked to be a very odd message without it']",9512,370,0.98,9512,18428,18428,188,3,0.0,188
1gjnpe1,Utter domination from Max Verstappen at the 2024 São Paulo Grand Prix,https://www.reddit.com/r/formula1/comments/1gjnpe1/utter_domination_from_max_verstappen_at_the_2024/,2024-11-04, Statistics,,"['Think I just saw that on a top comment with that data.', 'What happened in lap 68. Verstappen is washed /s', ""I know all the focus is on Max and Lando, but honestly I have to wonder whether Ocon could have held Max off had he not made that move straight after the last restart. \n\nIt really seemed like the driver in first had a big advantage of not having the spray of a car in front. Before Sainz crashed, it honestly looked like Ocon was going to win the race, he'd pulled out a few seconds and seemed quite comfortable."", 'So what you’re saying is that only Lando Norris’ brilliance stood in the way of a Max sweep.', 'The rain races that will be remembered:\n\nSenna in Donnington 1993 (European GP)\n\nSchumacher in Spain 1996.\n\nVerstappen in São Paulo, 2024.', 'Crazy to think Lando along with Max had the 10 fastest laps this race.', 'Liking the Porsche 83 ad homage', 'There have been 1,121 F1 races in the history of the sport, only 5 times has a race been won from 17th - per Peter Windsor\n\nYeah Max Verstappen did that', 'How many posts with the same information are we going to see?']",2243,97,0.94,2243,1137,1137,219,5,0.0,219
1gjymyf,"[@F1] Max Verstappen deserves a lot of praise for his raise on Sunday... But so too does his race engineer, Gianpiero Lambiase. A master of calmness and communication in chaotic situations.",https://www.reddit.com/r/formula1/comments/1gjymyf/f1_max_verstappen_deserves_a_lot_of_praise_for/,2024-11-05, Social Media,,"['Meanwhile Lando\'s engineer in the radio using sentences long enough to somehow fit a ""therefore"" in them', 'Max/GP and Lewis/Bono are a tier above every other driver-engineer combo.  \n\nI would place Max/GP above Lewis/Bono. Max and GP understand each other perfectly. Their communication is clear. GP knows when to push Max, when to calm him, when to reprimand him, when to be playful. They also have immense trust in each other. Max knows when to listen to GP and GP knows when he needs to listen to Max.  \n\nLast year\'s Monaco GP was one of the best team play between them. GP kept Max calm even though he was on very old tires while they were waiting for rain. GP listened to Max when he insisted on Inters while Alonso went for slicks.    \n\nThey also have that big brother / little brother vibe going on. GP doesn\'t hesitate to be sassy with Max. Barcelona 23 fastest lap fiaso comes to mind. GP\'s exasperated ""Now can you bring it home within the white lines please"" and Max\'s cheeky ""yeah yeah"" is a radio for the ages.  \n\nMax even said that he wouldn\'t race without GP as his engineer. That shows how important and dependable GP is to Max.  \n\nThey are a dynamic duo and I find myself completely fond of their on-track and off-track shennanigans.', 'For his ‘raise’ on Sunday? \n\nAside from the typo, I love how GP’s messages are very succinct. Will, on the other hand, 🤦🏻\u200d♀️He makes Ferrari engineers look better tbh', 'i wish i had a GP in my life', 'GP can go toe to toe with Max rants but also understands his insane cut throat attitude. Match made in heaven tbh', 'Hope Max could also bring him if max leave to new team', 'From the start this Sunday I had the clear feeling that Max/GP/RBR were ready to *hustle*. Full focus, one goal only and confidence that they could pull it off. \n\nIt’s hard to communicate the feeling, it’s a little like you have a big task ahead of you like moving someone’s stuff between apartments but you think: “I’m just gonna start, work hard, don’t stop, don’t complain and just get this done”.', ""GP deserves so much credit for his years as Max's engineer. He's gone through deep lows and enormous highs with him, and always kept cool and collective. That in itself is an amazing talent, especially with someone who can be so explosive as Max can be sometimes."", 'GP gives a lot of Friday/Jarvis vibes', 'To the not so hardcore Aussie fans here, did anyone expect to wake up to a Verstappen p1?']",419,44,0.94,419,40,40,144,16,0.009999999999999898,144
1gjkcdg,"[@F1] ""I'm hurting right now"" James Vowles gives his honest assessment of a painful Sunday that saw Williams drop to P9 in the standings l",https://www.reddit.com/r/formula1/comments/1gjkcdg/f1_im_hurting_right_now_james_vowles_gives_his/,2024-11-04, Social Media,,"['Their season might genuinely be derailed from here. There’s rumours they’re lacking spare parts, they might need to revert to the old spec which is slow compared to what Alpine, RB and Haas have right now.\n\nHe also said a while back that damage was really hurting them on the cost cap…', 'Is not only the driver. The team is failing too and i would say even more than the drivers: the pitstops aren\\`t ever lower than 3 seconds, the strategy is shit (why they changed COL tyres twice in four laps to put the same inter tyre when the driver requesed over and over again the wets??!), the Singapur updates didn\\`t improve the car a lot (and one can say that they downgraded it), the qualys strategies have non sense (many times both drivers only do one flying lap when they have time for two), and the drivers aren\\`t feeling confortable (Albon has to switch to COL\\`S COTA setup, and COL is having problems with the setups since Mexico).', 'So tough for them. The amount of damage was crazy. The irony since Sargeant getting moved on is Albon has cost them a lot of money.', ""[Here's](https://www.williamsf1.com/posts/84903beb-f165-4c1a-8a63-c1206ed1d076/watch-james-honest-sao-paulo-assessment) the video version of Vowles comments on the weekend. He tries to stay calm but you can tell how angry he is. Terrible for everyone."", 'If the destructors’ championship is somewhat correct, between Logan, Alex and Franco you have 10M in parts this year approximately.', 'It was the worst weekend for Williams since i became a fan. It’s the hope that kills you as well. Albon was so quick in qualy until that moment, he made me dream. I think this says a lot about Alex, a very quick driver sometimes but so crash prone.', 'Albon never should have gone out again', ""Yeah it's a shame, but one also has to wonder just how much Williams themselves as a team had a play in this. \n\nBoth Albon and Colapinto binned it quite hard. Colapinto's race crash was extremely depressing end to the weekend. \n\nBut one has to wonder, again: has the car and setup Williams provided perhaps made a car that can very easily or abrubtly go south?\n\nIf we look at Strolls warmup incident, i think it's reasonable to believe there was a problem with the setup. If we look at how the Mercedes also had quite some issues and drivers have mentioned how it can suddenly 'go', suggests that cars can be suddenly over the edge.\n\nAnd the pace of Williams at Brazil was quite good, perhaps they simply went too far and had to back off a bit instead of go over the edge. \n\nAlpine clearly did everything right, and nobody is going to tell me that car belongs there at all. If we see how Mclaren had many offs too, this suggests they perhaps were pushing their boundaries too, when Alpine was perhaps just not pushing their boundaries for the sake of longevity and as such, benefit. \n\nGiven that Albon had a massively great qualification potential until the crash - and quite franly, Franco was getting well up to speed to, it might just have been Williams instead of Alpine on the podium.\n\nThat's one painful lesson, but perhaps because of the pain, a lesson that motivates them to actually learn from it."", 'It really was disaster for them.\n\nSo much damage from both drivers.\n\nEven before they were leading destructor championship but they basically double the cost this weekend.\n\nPretty much guaranteed they will be 9th in WCC.\nNo way they gain nearly 30 points and no way Sauber catches them', 'I think what makes this worse is there are only ever 2 maybe 3 points positions up for grabs most weekends, as the top 4 are so far ahead. it would take a miracle for Williams to beat VCARB at this point. but the saving graces are Alpine is still a boat, AMR is unpredictable, Sauber is Sauber, Liam gets his elbows out and is aggressive (fantastically mind you) and risks crashes, Haas would be their real challenge. \n\nI want Williams to succeed as they with Alpine are my local teams.']",2931,304,0.99,2931,10915,10915,157,6,0.0,157
