unique_id,post_heading,post_url,publish_time,tag,post_content,top_comments,upvotes,comments,upvote_ratio,score,total_upvotes_comments,total_score_comments,upvotes_growth_rate,comments_growth_rate,upvote_ratio_growth_rate,score_growth_rate
1k0ctkk,F1 drivers with no points after three races,https://www.reddit.com/r/formula1/comments/1k0ctkk/f1_drivers_with_no_points_after_three_races/,2025-04-16, Statistics,"1. Fernando Alonso 
2. Liam Lawson
3. Jack Doohan
4. Gabriel Bartoleto","[""Bortoleto could score 0 all year and I'm sure he's safe for next year.\n\nHe's driven well considering the shitter that he's in."", 'Poor Bortoleto driving a tractor and people don’t know his name 😭', ""Bortoleto's got a tractor. Hulk did a heroic job in a rain race with a lot of dnfs and strategy options. If Bortoleto doesn't get any points the whole year, that shouldn't reflect badly on him, unless the car has a large successful upgrade. But I imagine they are putting full attention on 2026 and it will remain a tractor."", ""It's four races (and a sprint). I know you can't change the title now. It's an unfortunate part of reddit."", ""It’s tough out there for rookies in midfield cars. Props to bearman and hadjar for what they've been able to do so far.\xa0"", 'Damn rookies.', ""These are bafflingly bad photos. They all look like they're being held at gunpoint."", ""If I see one more Alonso rookie comment I'm going to lose my shit"", 'They all drive shitters.']",6210,453,0.97,6210,17588,17588,91,6,0.0,91
1k0fwlr,A bad report from the future.,https://www.reddit.com/r/formula1/comments/1k0fwlr/a_bad_report_from_the_future/,2025-04-16, News,"Translation:

Let's not beat around the bush: everything points, and if no one changes it, that 2026 will be a carbon copy of 2014 , according to those involved.  Mercedes, and with it, the client teams  : Williams, Alpine, and McLaren, four out of ten will battle among themselves.

The Mercedes project may be more advanced than the rest, but they've encountered a curious circumstance that could be the general trend. Pay attention now:

They believe the electric section will require a lot of energy to recharge, and the energy generated during braking won't be enough. Mercedes has experienced something unexpected and very worrying in their simulations: the car runs out of all its electric energy in the middle of the Monza straight .","['Jeddah. Monza. Silverstone. Spa. Vegas.\n\nFully expecting cars to run out of power very early on the straights.', "">They believe the electric section will require a lot of energy to recharge, and the energy generated during braking won't be enough. Mercedes has experienced something unexpected and very worrying in their simulations: the car runs out of all its electric energy in the middle of the Monza straight .\n\nHow is this surprising? Didn't RBR already say this two years ago? I remember a ton of people clowning them that their engine must be shit when Horner said the concerns."", ""That issue has been known for years now, and they still haven't found a solution?\n\nMan next year is going to be wild."", 'Hear me out, we introduce a 4-cillinder diesel generator for the purpose of recharging the battery sufficiently. \n\nWe solve two problems - \n\n1) combined with a V6 engine, it makes a V10, so the people who want bigger engines are covered; \n\n2) talk about a hybrid: petrol-diesel-electric powered car. More hybrid-er than just petrol-electric.', 'Domenicali: “Can’t run out of power down the Monza straight if the circuit isn’t on the calendar”\n\n*taps nose*', ""> its electric energy in the middle of the Monza straight\n\nI mean this is known now for 2 years and has been topic of countless discussion. \n\nActive aero was introduced to counter it. Will it be enough? Nobody knows. \n\nWe see this with the current regs, just much more limited, where cars stop deployment and start collecting (flashing red back light in dry conditions) way before the break point. \n\nFunny enough this could solve the overtake issue. If you don't have enough deployment for a full lap, changing that deployment tactical to push the entire straight (and have less deployment next few shorter straights) will likely make you able to overtake."", ""Yeah, these cars are going to be ass. They are going to be SLOW AS SHIT in races. The qualifying fully charged laps vs in race 'efficiency' laps are going to be a joke. \n\nThey'll save 30% power by going 280kph on straights instead of 310kph so they don't lose laptime for the rest of the lap.\n\nOne of the issues right now is how bad tires are, the drivers aren't close to the limit of the cars. There are so few mistakes in recent years (outside of dumb drivers being bad at overtaking for the most part). Japan was basically everyone cruising around with few to no mistakes so nothing could happen. Back when the tires let the cars and drivers be the limit more, let them push hard, we had more mistakes which shook shit up more but at least was also more entertaining to watch.\n\nMonaco in qualifying where they are pushing hard vs race where they are cruising is just night and day in entertainment. Cars so slow in races that there is no difficulty, no mistakes, no excitement is dire for F1.\n\nThe cars can be made slower themselves, different regs, slower cars, different cars, but having a fast car go slow due to bad tires or no electrical power and no fuel available is just making races boring as shit.\n\n2026 has been looking to be absolutely dire since the regulations were announced. mgu-h was how they generated so much efficiency, removing it and wanting to use higher percentage electrical energy was moronic from day one."", 'What bs are you spinning. Horner talked about this 2 years ago and Wolff immediately said thats because RBPT is behind in development, and denying that there would be any such problem. Now, you want to credit Mercedes with discovering this problem?', 'All I want is trash reliability. White smoke, black smoke, tire punctures. Its what I live for watching F1. Pure joy.']",4680,608,0.95,4680,18920,18920,81,5,0.010000000000000009,81
1k0l5x9,Ollie Bearman is just 1 of 5 drivers that have an active streak of at least 3 consecutive points finishes in races :,https://www.reddit.com/r/formula1/comments/1k0l5x9/ollie_bearman_is_just_1_of_5_drivers_that_have_an/,2025-04-16, Statistics,"• Lando Norris  
• Oscar Piastri  
• Max Verstappen  
• George Russell  
• Ollie Bearman  
  
The only non-McLaren, Red Bull or Mercedes driver on that list too.","['So basically the four drivers in the championship fight are the others. Not bad company at all for Ollie.', ""I was really surprised that I didn't see both Ferrari's on here. And then I remembered China actually happened."", 'I was going to say aint no way the Ferrari drivers aint here then remembered the double disqualifcation\n\nhttps://preview.redd.it/8plmhs9bm7ve1.jpeg?width=640&format=pjpg&auto=webp&s=d9f04212c24ed3af1d5777bab90127786b043ea2', 'https://preview.redd.it/pqzpnntutave1.jpeg?width=1290&format=pjpg&auto=webp&s=566ca416a51b687a684cca49338c4a5480d26738', ""Bearman has been doing well. Honestly, all the rookies have decent pace. Doohan and Lawson may be the iffiest now, but they're not terrible either."", 'streaks are easy to overlook but there are some huge streaks in the turbo hybrid era:  \n[https://www.statsf1.com/en/statistiques/pilote/point/consecutif-sans-sprint.aspx](https://www.statsf1.com/en/statistiques/pilote/point/consecutif-sans-sprint.aspx)', ""Antonelli could've been in this list as well if not for a weird 3 stop race strategy in Bahrain."", 'Seems solid, got the dream subbed in drive last year and has continued to impress this year. Does he get the nod in the near future to one of the bigger teams I guess we’ll see.', ""He must be up there with some of the most positions gained this season?\n\nMelbourne: P20 > P14 (albeit because of DNF's... Not his fault though)\n\nChina: P17 > P8 (albeit because of two DSQ's... again not his fault)\n\n(He also went backwards in the Sprint)\n\nJapan: P10 > P10 (Such a disappointment, no places gained, terrible /s)\n\nBahrain: P20 > P10""]",2733,106,0.98,2733,2392,2392,92,5,0.0,92
1k0pkfp,Russell's transponder was 'frazzled and charred' after Bahrain Grand Prix DRS drama,https://www.reddit.com/r/formula1/comments/1k0pkfp/russells_transponder_was_frazzled_and_charred/,2025-04-16, News,,"[""Me too, it's not special."", '\xa0 \xa0“We started to have a separate but parallel problem with the brake-by-wire. That’s the electronics that determine the braking force between front and the rear brakes, but particularly on the rear brakes. There’s a chunk of braking that is done by the MGU-K – the electric motor on the engine – and then a chunk done by the hydraulic braking system.\n\n\n\xa0 \xa0“When we go into what we call passive mode you’re just relying on those hydraulic brakes. But it changes the car’s behaviour under braking and ultimately it’s very, very difficult to run the car like that because you’re losing a lot of braking force and you ultimately overheat those much smaller hydraulic rear brakes.\n\n\n\xa0 \xa0“So George was battling with that. We had to do what’s called a default change for him so that he could toggle in and out of that brake-by-wire when it went to passive and put it back in the active mode in those last 10 laps. I think over those last 10 laps he was making between 20 and 30 changes to that setting as he was also driving, hitting his braking points and keeping first Leclerc and then ultimately Lando behind him as well.”\n\n\nThat George was able to get second place in that condition shows just what an elite driver he is.\xa0', '> “frazzled and charred”\n\nSounds like something you’d expect to see on mom’s coffee mug.', 'Crikey!', 'Monster drive from George to get the car p2 while also fighting with the brakes issue. He is having a very strong and consistent start to the season. Just needs to stay in touch with Lando / Oscar and if Merc get their car together with an upgrade or 2 he might have a chance to win the title.', 'Casually doing tech support while defending against Norris/Leclerc. \n\nHe was just at another level this race.', ""It's baffling how teams have backup systems for every major functionalities and yet FIA/FOM has only one transponder and no backup other than start-finish timer.\xa0\nEdit: so rules say there are 2 transponders. And both got charred. Or my guess is one is active transponder which actively pickes up the ground loops across the track and send the position and another one is passive like NFC/RFID tag which is picked up only on the start finish line.\xa0"", 'So Russel had transmitter, breaks, and DRS issues and still got 2nd? Wow, that is an amazing drive. I don’t love him but he earned his money on that one.', 'I’ve never heard an object described as “frazzled” before, only people']",2215,121,0.99,2215,106,106,100,4,0.0,100
1k0hog7,"[redbullracing via IG] The lion vs the prancing horse, max and Charles served up a thrilling fight for the win in 2022 SAUDIARABIAN GP",https://www.reddit.com/r/formula1/comments/1k0hog7/redbullracing_via_ig_the_lion_vs_the_prancing/,2025-04-16, Social Media,"https://www.instagram.com/p/DIgCBO7MLsB/?igsh=OXZhcnd1NGpzcjA4
Throwback for the battle here  https://youtu.be/cD8O0YoWpqE?si=7uip-Rs6GpTtNXgJ ","['The first couple races of 2022, almost the entire first half of the season was amazing. Not just for the illusion of a title fight, but also the racing itself was stellar. Cars were actually able to follow each other unlike now', 'I do enjoy Max vs Charles more than Max vs Lando fights.', 'Red Bull admin is definitely a Lestappen fan. 😂❤️\n\nBefore Max retires,  please give us the WDC battle between these two.  We all deserve it.  😃\U0001f979', 'I especially enjoyed the battles to get DRS on the main straight lol', 'Surreal fight. Feels like a decade ago. The DRS games were some of the most iconic moments in F1 history', 'It was beautiful\n\nMay never see those two fighting for WDC like that :(', 'Gimme the return of the 2022 battle between Charles and Max.', ""It's a shame Stroll caused a yellow flag when Charles was close enough to attack and retake the lead.\n\nHopefully future battles between these 2 will come though."", 'Still sore about that yellow flag at the end. Kinda sad for Charles for all these near misses of wins.', 'The first half of 2022 was definitely looking promising and exciting']",1794,111,0.97,1794,3452,3452,56,0,0.0,56
1k0h2qu,Max back in 2023 talking about the 2026 regulations.,https://www.reddit.com/r/formula1/comments/1k0h2qu/max_back_in_2023_talking_about_the_2026/,2025-04-16, Video,,"['And a lot of people said he was just saying this because RBR made a bad engine. And now Leclerc is saying similar things so I guess its going to be Audi or Merc that will dominate 2026.', 'Technical question related to cars: 2 minute answer\n\nAny other question: 10 second answer\xa0', 'Another ICE formula would be terrible for the sport. I barely made it through 2014-2016 with Mercedes, Williams, and Force India running circles around their competition with relative ease.', 'I enjoy listening to Max discussing actual racing and the tech side of all this.', ""Tbf the sport should have listened back then but they've made their bed now. \n\nFeel like all the cars will be awful as far as F1 cars go."", 'Checo my sweet prince 😭', 'I like how it switches between “this team is just lobbying for changes” and “this is actually a legitimate concern” depending on whos talking.', ""Interesting what he says about the active aero not being in the driver's control. Seems he would like to be able to tune the front and rear down force as he goes.\n\nHas there been anything released explaining how it will work?\n\nAre there gonna be detection points going in and out of every corner?\n\nIs it just speed based? Aero slowly coming off the car as it speeds up?\n\nSteering angle based would be madness surely"", 'They changed the cars like 10 times since then. Shit the ones they revealed publicly last year got massively changed before the end of the year too.', ""Worth pointing out that what Max is describing here is based on a simulation using the 2026 engine but with 2023 drag levels. Most people agree this extreme scenario wont happen\n\n>This was something that world champion Max Verstappen famously highlighted after trying out an early iteration of the 2026 car on the simulator.\n\n>“If you go flat-out on the straight at Monza, and I don't know what it is, like 400m or 500m before the end of the straight, you have to downshift flat-out because that's faster,” he said.\n\n>“I think that's not the way forward. But of course, probably that's one of the worst tracks \\[for it\\].”...\n\n>.....What is important to understand about those findings though was that they came from a false picture - because the cars being run on the simulator to deliver that outcome were nothing like what we are going to get in the real world.......\n\n>Early simulations of the 2026 power units that were being run in 2022-23 were based on the drag and downforce levels of contemporary machinery - which are way higher than what the new cars are going to be like......\n\n>........And it has become pretty obvious that how teams choose to pitch the downforce/drag of the cars makes the difference between delivering some alarming findings in the simulator and actually looking in pretty decent shape.\n\n[\\-The Race](https://www.the-race.com/formula-1/f1-2026-engine-rules-fact-and-fiction/)\n\ndrag levels will be a lot less in 2026 and there are regulations in the new engine formula that prevent a falling off the cliff scenario with the battery power\n\n>Furthermore, two additional demands have been put in the regulations to ensure that drivers are not suddenly left with zero power halfway down the straights.\n\n>The first relates to car speed and demands that once the cars are up to a certain velocity, then the limit of electrical energy that can be used starts dropping away from the peak 350kW allowed with the 2026 power units.....\n\n>\n\n>.....Perhaps of more importance, however, to how things ultimately shake out is an article in the technical regulations that limits the rate at which power can be reduced - so there is no cliff edge potential.\n\n>This is known as the ‘turn down ramp rate’ and effectively prevents teams from burning all the power quickly to arrive at a point where drivers go from having maximum power to none in an instant.\n\n>There are two ramp rates laid down: one for tracks where power will be very limited, and then a different metric for everywhere else.\n\n>At those tracks where the FIA determines that the power-limited distance exceeds 3500m, the power can be reduced at no greater rate than 50kW in any one-second period.\n\n\\-[The Race ](https://www.the-race.com/formula-1/f1-2026-engine-rules-fact-and-fiction/)""]",979,106,0.95,979,4344,4344,25,0,0.0,25
1k0jmgp,[Haas on Ig] Our best start to a season since our Debut in 2016!,https://www.reddit.com/r/formula1/comments/1k0jmgp/haas_on_ig_our_best_start_to_a_season_since_our/,2025-04-16, Social Media,https://www.instagram.com/p/DIgeZoTMcH-,"['All of it off a dreadful Australia too, which makes it more impressive.', 'The car is much worse than it was in 2018, but they are much better operationally and have a considerably stronger driver lineup', 'https://preview.redd.it/ql4hq5tx17ve1.jpeg?width=1290&format=pjpg&auto=webp&s=28e67fe3fccc755ab01e1480957605348c02f2b6', 'I think 2018 car was stronger but Grosjean had an awful start to the year and that held them back. And KMag still made some mistakes like almost sending Gasly to Mars in Baku.\xa0', 'I really like this livery', 'Im so conflicted over who i want to be best of the rest this season, haas and ayao would be so good, but williams have been cooking and deserve it, as a big gasly fan alpine getting it would make it happen, and hadjar had made me think about rb in a more positive light. This may be one of my favorite f1.5 grids of all time', 'I hope now everyone sees how crappy of a leader Steiner was. I was amazed at the following he got because of some curse words. Dude had no idea how to lead or treat people properly. Hope he enjoyed his 5 minutes of fame from “fucking wankers”', 'keep on keeping on!', 'Yeah it’s incredible how terrible they looked in Australia; how the whole team thought they were going to be fucked for a few races, just to immediately have one of their best ever weekends the next race and score good points in the next two races after that. \n\nThis is the same team that had about 5 years in a row of either or off well and then completely falling apart after a few races, or just being terrible the whole year. \n\nEven if they still haven’t quite matched or beaten 2018, it feels like Haas are really getting somewhere and it’s great. I hope to god that they somehow get a podium this year.', 'I honestly get the impression that nobody is more surprised by how well they\'re doing than they are.\n\n\nThere\'s a certain ""How the hell did we do that?"" shock to many of their posts I find quite endearing.']",707,19,0.99,707,564,564,25,1,0.0,25
1k0ob1p,George Russell: Why Mercedes driver hasn't signed a new contract despite strong start to 2025 F1 season | F1 News,https://www.reddit.com/r/formula1/comments/1k0ob1p/george_russell_why_mercedes_driver_hasnt_signed_a/,2025-04-16, News,,"['Mercedes once signed Lewis for 2021 in February of the same year, they are known for not rushing contract extensions with their drivers.', 'only actual piece of info from the article imo: \n\n> “Autosport reported on Monday that the Brit is close to signing a two-year extension with an option for a further year in 2028, but Sky Sports understand that a new agreement, and its subsequent announcement, are not imminent”', 'I think people are looking too much into it. Probably his manager and Mercedes already know the answer and for whatever reason it hasn’t been communicated with us yet. Whatever that means.', ""Good grief, the media trying to drum up hysteria already.\n\n\nContracts take a while to hash out, they'll get to it eventually. Calm yourselves Sky, sheesh...."", ""He deserves a new contract, he's driving very well."", 'Just needs a few more noughts added to his contract', 'It’s been cool watching George’s first merc season here out from under the shadow of Hamilton, he’s grown up and doing well', 'I really hope he gets the Merc seat, I don’t want him in a Red Bull. I’ve grown to really like him this past year', 'George deserves a fat extension. I think he’s world champ material but is constantly underestimated. I’d rather Max go to Ferrari, but I have a weird feeling it’s gonna be Lewis retires, Kimi to Ferrari, Max to Merc, George at Merc, chaos to Merc.']",672,229,0.94,672,190,190,49,3,0.0,49
1k0mv3j,[Esteban Ocon via IG stories] thx for the warm welcome guys!,https://www.reddit.com/r/formula1/comments/1k0mv3j/esteban_ocon_via_ig_stories_thx_for_the_warm/,2025-04-16, Social Media,,"[""what's the backstory here?"", 'Every time I see Liam Lawson I think he is Troye Sivan.', 'I swear for a moment I saw Michael Reeves there', 'Lawson could have a back up career as a Troye Sivan impersonator', 'I can see these two becoming very good mates. \n\nBoth have an unhinged side on track but friendly off track.', 'liam may not have succeeded in the redbull, but the fit of those pants is strong', 'Dang, why does lawson keep getting demoted?????', 'https://preview.redd.it/wbyxi7eeu7ve1.jpeg?width=231&format=pjpg&auto=webp&s=be35ce19b9b2623c7dc4bb60d4ad362b8ccf2869', 'So this was posted 30 minutes ago and has 86 upvotes, and the exact same post that was uploaded 10 minutes ago now has 100...\n\n??????????', 'I wonder if they had a wager after Esteban binned it in Bahrain qualifying that he wouldn’t score any points?']",644,42,0.98,644,36,36,82,8,0.010000000000000009,82
