unique_id,post_heading,post_url,publish_time,tag,post_content,top_comments,upvotes,comments,upvote_ratio,score,total_upvotes_comments,total_score_comments,upvotes_growth_rate,comments_growth_rate,upvote_ratio_growth_rate,score_growth_rate
1k0ds0q,How F-ducts worked - and an aero detail not discussed previously,https://www.reddit.com/r/formula1/comments/1k0ds0q/how_fducts_worked_and_an_aero_detail_not/,2025-04-16, Technical,"As has been well covered in the past - the F-duct system was introduced in 2010 by McLaren (and later adopted in varying forms by other teams). It was a clever way of achieving drag reduction without movable aerodynamic devices - skirting the regulations by using driver input to trigger a ""fluidic"" switch hidden away inside the engine cover.

I thought I'd write up a post explaining how this system worked aerodynamically, having seen it's development, testing, and eventual deployment firsthand.

**Fluidics: a quick background**

Fluidics is a whole discipline of its own, similar to the fields of mechanics and electronics. Fluidic systems use the properties of fluids (i.e. liquids and gases) to create logical systems free from electronic or mechanical influence. Within the fluidic world we have devices like logic gates, amplifiers, oscillators, etc - the same things you'd find in the mechanical and electronic counterpart worlds. You can therefore build different systems and solve for many different use cases using these fluidic devices. Great little intro paper [here](https://ntrs.nasa.gov/api/citations/19730002533/downloads/19730002533.pdf) from NASA talks about many different use cases that fluidics have seen in the world of aerospace.

Now that we know that fluidics are essentially the aero counterpart to mechanical and/or electrical systems, it's easy to then connect the dots and see what sort of clever loopholes a fluidic system could open up in a set of rules and regulations that were written with mechanical and/or electrical devices in mind. It is also worth noting that it was exactly this sort of ""what is the X analogue of Y"" logic that led to the inerter (""J-damper""), another famous F1 innovation which is the mechanical equivalent of an electronic capacitor. No surprise to note that it was also McLaren that brought this innovation to F1 first, shortly after it's invention.

**Coming back to F-Ducts**

If moveable aero regulations banned *mechanical* switches to change the aero behaviour of the car, they didn't (initially) ban *aerodynamic* switches. And the lowest hanging fruit seem to be in shedding drag in straight line conditions - something where an on/off switch would be a perfect use case for fluidics.

At its core, the F-duct worked by stalling the rear wing - similar in outcome to the DRS. However, the F-Duct did this purely aerodynamically (no rotating flaps) by injecting ducted flow perpendicular to the normal airflow on the rear wing flap (and later at the mainplane, to have a larger stall effect) to trigger separation of the boundary layer, creating a stall and dump downforce and therefore the induced drag that comes with it.

**Basic function**

The system used internal ducting to channel air from an inlet (usually at the nose or via a slot at the top of the airbox) to the rear wing. When the system was activated - typically by the driver blocking or unblocking a duct with their hand or leg - the airflow would be directed to a slot in the rear wing's surface, triggering the stall.

Most F-duct systems had two possible outlet paths:

1. A default, low-energy path that always exited the ducted flow harmlessly out of what RBR called the ""donkey d\*ck"" - a long horizontal outlet at the back of the engine cover.
2. A stall path that redirected flow up through the rear wing and out the slot perpendicular to the rear wing surface when the duct was activated

https://preview.redd.it/5dmiy3gq45ve1.png?width=1482&format=png&auto=webp&s=398d21a33d2676999f8aab72551978aae3446610

**The need for a reliable switch**

Early testing showed that the system did not initially have a fully binary switching behaviour: even when a majority of the flow was going into the default outlet, some flow would end up in the stall outlet, negatively impacting rear wing performance when the wing should be operating at 'normal' load (e.g. in cornering). Similarly, switching the system on and off and back on again showed signs of aerodynamic hysteresis - a phenomenon that basically means that a sort of aerodynamic lag. If blocking the driver control duct caused a rear wing stall, simply unblocking the duct wouldn't be enough to cause the rear wing to recover. Not good.

**The vortex trap**

The solution to this, aside from a lot of fine-tuning, was the introduction of a small but crucial aerodynamic feature that was added to the switch, and was intentionally hidden via a vanity panel - though I'm sure others figured this out quickly too since this detail is present in a lot of fluidic research literature. This feature was the semi-circular vortex trap at the junction of the two outlet paths. Here sat a trapped vortex that would help stabilise the flow going to the default outlet when the stall switch was deactivated. It would reverse it's rotation when the stall switch was activated, thereby helping stabilise flow going to the stall path.

What this did was quite elegant:

* When the system wasn’t activated, the donkey d\*ck was the low-resistance path, and the vortex acted as a sort of buffer that prevented any significant bleed to the stall slot, keeping it aerodynamically “quiet"". The counter-clockwise rotation of the vortex encouraged all flow from the inlet duct to head down the non-stall pathway.

https://preview.redd.it/b8s7e46t45ve1.png?width=1516&format=png&auto=webp&s=f5115a0bfc409d03669048b05c3e60a7f1e2dfe6

* When the control duct was activated by the driver, there was upwards flow at the switch that caused the vortex to reverse its rotation, encouraging all the flow to head to the stall duct. The vortex would now stabilise this new flow path, again insulating it from the now dormant donkey d\*ck path.

https://preview.redd.it/qnl4uvtt45ve1.png?width=1438&format=png&auto=webp&s=fcdb094f9032f9d4aeab758689526e8206887819

This meant the system behaved like a bistable switch - very stable in both modes (stall on or stall off). There was very little dynamic pressure or cross-talk in the non-active duct, which was key for predictable and stable rear wing stall/unstall transitions.

It was a small detail - but a good example of how in F1, even a small change in duct geometry can make or break the whole system.","[""Wow, I didn't know how much I didn't know about F-ducts.\xa0 Thanks for this detailed and fascinating post!"", 'This is very cool, thank you for sharing your knowledge! Why did they ban it? It seems like this is the kind of innovation that makes F1 so unique and interesting', 'Interesting read, thank you very much!', 'Love it! We need more content like this', ""I didn't know about the vortex, very good knowledge - thanks."", 'Absolute wizardry, brilliant write up - will need to read more into this. Some incredible mind behind the scenes to dream up the finer details', 'I love the way it got it\'s name. The opening was on the F of the ""Vodafone"" branding, voila, F-Duct', 'Great writeup OP. In the last picture, is the air flow going to the switch normally blown out of the duct in the cockpit?', 'Bookmarked this for reading later. Hope that having it saved will transfer the knowledge to me via osmosis']",450,23,0.97,450,307,307,2,0,0.0,2
1k0f5vk,"Spanish engineering firm Acciona and French rival Eiffage won a contract to build Madrid's new Formula 1 circuit , Acciona said on Tuesday",https://www.reddit.com/r/formula1/comments/1k0f5vk/spanish_engineering_firm_acciona_and_french_rival/,2025-04-16, News,,"['What a great and inspiring story. Rivals working together to achieve a common goal which is bringing more street circuits to F1.', ""Fascinated by how the banked corner ends up playing out.\n\nIt's a 180 degree corner with 30 degrees of banking, which is the same as old Monza and I believe more than Indy."", 'Please no more street circuits please', 'They’ve only just won the contract and the race is in like 12/13 months. Gonna be Korean gp levels of pushing it to the limit', 'Unpopular take, but I would much rather have a ""street circuit"" (most of them are hybrids in reality) made for modern F1 cars, where it is possible to overtake, rather than old race circuits that aren\'t made for these cars and can\'t deliver exciting racing.\n\nSuzuka is a good example. Awesome crowd, vibe and look. But unless the race has some chaos it likely won\'t be interesting.', ""Is it really 30°? That sounds insane.\n\nThat's about the same as Daytona and nearly as steep as Talladega"", 'So the Michelin shod cars will all blow up', 'main problem this year were the tires, there was no lap time delta at all\n\n\nlast year had 48 overtakes', 'Speaking of the Spanish GP Catalunya right there is a good example. It generally doesn’t produce good races.']",397,53,0.97,397,763,763,2,2,0.0,2
1k0mztj,McLaren reveals how internal F1 title battle could alter its upgrade approach,https://www.reddit.com/r/formula1/comments/1k0mztj/mclaren_reveals_how_internal_f1_title_battle/,2025-04-16, News,,"[""Was curious when they were going to address this. They've given preference to Norris for upgrades since Oscar came on board, so it makes sense that they will want to seem more impartial going forward, given how close this title battle is shaping up between the two. It will be interesting to see what happens when the first major upgrade finally comes, Stella seems to be hinting that could be a ways away though."", ""In F1 Manager and Motorsport Manager I make two of everything. Of course in those games the drivers are divas in terms of car opinion, but Lando and Oscar aren't divas. But the fairest thing to do is to give them equal parts as much as can be possible.\xa0"", 'Multi 21, Oscar. Multi 21.', 'The only upgrade Oscar needs is maybe some cleaner mirrors, so he can get a better look at everyone behind him.', 'Papaya rules, something something', 'To me it\'s simple. The last paragraph in the article is most interesting to me...the bit about balance. Upgrade direction will be far more critical than ""who gets the upgrades first"". IMO you should just make the car faster. If only Oscar is comfortable with that then Oscar will run away with the championship.\n\nReverting to something more similar to 2024 to make Lando happy would be more likely to just make them slower, I don\'t think they\'re gonna do that.\n\nEdit - for clarity since it seems to not be clear enough to some, it\'s the end of the article that I\'m referring to.', 'i never thought about this going into the season, if mclaren are acc in a 2 horse race they have to give equal upgrades. My head cannon is the next upgrade makes lando comfy and we get a merc style battle between teammates', 'I mean i don’t think they’ve ever outright said, ‘Lando gets the upgrades  first because he’s Lando’,\n\nIt’s always been a case of, well we’ve got upgrades ready for one car and we’re going to give them to the driver who’s been performing the best most recently. \n\nAnd it’s pretty much always been pretty clear that Lando is the on form driver, there’s never been much debate.\n\nBut the issue is now it’s not so clear. If anyone’s the on form driver at the moment it’s Oscar but Lando is leading the championship for now. \n\nIf they don’t face any competition before the first upgrades come in and it really begins to look like it’ll come down to the two Mclaren drivers than to give one the upgrades over the other would definitely feel like Mclaren choosing a driver to back.\n\nIn a way that the third best team giving upgrades to the driver performing the best didn’t last year. It’s a much more significant decision this time', ""Let's be clearer with this. They have given preference to the driver who was leading in the standings.""]",329,41,0.96,329,34,34,32,0,0.010000000000000009,32
1k0w0dg,Sports Business Journal: Apple TV+ could be fit for F1 U.S. rights,https://www.reddit.com/r/formula1/comments/1k0w0dg/sports_business_journal_apple_tv_could_be_fit_for/,2025-04-16, News,,"['Aw man, that’s like the one streaming service I’m NOT currently paying for', 'I’d love for Apple to get the rights, but this article is a nothing burger. Basically someone just saying, *”well, Apple is releasing an F1 movie and they are a $3T company. They can afford it”*.', 'If F1 wants to keep the US market it needs to stay accessible to non-pirating consumers. ESPN is by far the most covered network on most streaming packages, so if it’s moved to a service like Apple TV I’d expect a decline in measurable viewership', ""Whatever they do, don't fuck with my F1TV."", 'If the US rights went to Apple TV+, then Apple TV+ would have to do something it rarely ever does: *promote Apple TV+*', 'F1 TV is the only way to go, or Netflix', ""I'm completely fine with this as long as they don't get exclusive rights and take away F1TV. I'll only pay for Apple+ when Severance is releasing.\xa0"", 'If they move to Apple TV then I don’t see myself being able to convince anyone who doesn’t already watch the sport to tune in. ESPN is on YTTV which most people will get as far as streaming services go. I don’t see many people paying however many dollars a month to watch a new sport they might not even end up liking.', 'Interesting how many people are not paying for AppleTV already. It has some of the best shows on any streaming service right now... What ARE you guys paying for.']",333,155,0.9,333,133,133,73,19,0.010000000000000009,73
1k0l9bz,Who are your favorite F1-related content creators?,https://www.reddit.com/r/formula1/comments/1k0l9bz/who_are_your_favorite_f1related_content_creators/,2025-04-16, Discussion,"F1 is a complex sport, and I often find really insightful videos shared here. 

So, who are your favorite content creators, or pieces of content? Technical, interview or shitposting, what help you to wait for a race weekend?

I usually follow P1 for entertainment, Driver61 for racing insights and yelistener for onboards analysis.","['Shoutout to Chainbear. That man is an F1 og, he literally covered everything from strategy to aero to electronics to race craft and whatever came in between. Helped beginner me a lot. The animations were also good, simple and understandable.', ""* F1Unchained:\nfirst creator that popped into my feeds when I got into F1 last season. Very easy to follow and direct to the point overview of races and general F1 info\n\n* Rick'sF1addiction:\nvery funny, witty and comedic way to present F1 content. Fairly new creator I think and also helped me pick a team to follow despite the unserious way of presenting. I always have a laugh with his stuff"", ""Mr V's garage. His content is very different from most F1 youtubers and often goes into unhinged hypothetical scenarios\n\nMy favorite video was him going through the history of formula 1 if the championship winner was banned after they won, like in F2"", 'There is this monaco based youtuber called nico rosberg, he used to drive racecars too', 'The Lollipopman!', ""David Coulthard's FFS podcast has been my favorite, but I don't know how the format will change now that Eddie Jordan has passed.  I hope he can find another partner to keep the show going."", ""Tommo for the pre- and post race talls and news, and Mr V's Garage for silliness"", 'J BONE!', 'Lolipopmancomics. Nuff said.']",157,449,0.82,157,2856,2856,3,9,0.0,3
1k0voi3,Let's finish this triple header... Welcome to Jeddah. [Williams racing on Instagram],https://www.reddit.com/r/formula1/comments/1k0voi3/lets_finish_this_triple_header_welcome_to_jeddah/,2025-04-16, Social Media,,"['This one looks really cool. Hope Carlos or Alex will make it to top 10 this time', 'this one is really cool especially putting the 2 dots under the S to make it look like the letter ""ي""', 'It’s a cool way to do the title but very funny to look at if you know Arabic haha the S looks like ي (an I/Y sound) and I’m guessing the side of A is imitating  ش (sh sound)', 'What do the 3 dots in the A mean', ""yeah but it also doesn't make sense."", ""nothing lol arabic only uses 1 or 2 dots and they're always above or under a letter, never next to it"", ""yeah but it's still cool""]",156,9,0.94,156,7,7,21,3,0.0,21
1k0h6ov,Saudi Arabian GP Schedule of Press Conferences,https://www.reddit.com/r/formula1/comments/1k0h6ov/saudi_arabian_gp_schedule_of_press_conferences/,2025-04-16, News,,"['So Max, Fernando, how does it feel being team mates next year?', 'Question for Oliver. Alex claimed that you tried to kill him last weekend. What do you have to say about that?', '1730 hours!', 'Is that local time?', 'Missed out the stoning with Lawson at 1900hrs on Thursday.', 'hmmm wonder why they didn’t want to talk to lewis…', 'Journalists better have some good questions for the no nonsense trio VER HAD ALO.', 'there can be only one long boi', 'Spicy']",139,15,0.93,139,136,136,1,2,0.0,1
1k0r3a8,Portuguese soccer team to honor Ayrton Senna with special one-off jersey,https://www.reddit.com/r/formula1/comments/1k0r3a8/portuguese_soccer_team_to_honor_ayrton_senna_with/,2025-04-16, News,,"[""To give some context: the team is Estoril Praia and Senna's first win was precisely at the Portuguese GP in Estoril"", 'It won’t go on public sale for anyone wondering', ""Article locked behind paywall. Here's the image from elsewhere:\n\nhttps://preview.redd.it/nxcehke1s9ve1.png?width=250&format=png&auto=webp&s=5026a6500d75695a4b04437b644fddd6459d69c3"", '[Somebody had to](https://imgur.com/a/G2PbQek)', 'Why?', 'wonder who has the jersey number 14.', 'Is any deceased person honored more often than Senna?', ""Ugggh. We get it. What is this the....oh...it's not McLaren? It's just a Portuguese soccer team? Carry on."", 'Im Portuguese and this is kinda weird']",138,26,0.85,138,20,20,13,0,0.010000000000000009,13
