unique_id,post_heading,post_url,publish_time,tag,post_content,top_comments,upvotes,comments,upvote_ratio,score,total_upvotes_comments,total_score_comments,upvotes_growth_rate,comments_growth_rate,upvote_ratio_growth_rate,score_growth_rate
1lscms2,[F1] The starting grid for the 2025 British Grand Prix,https://www.reddit.com/r/formula1/comments/1lscms2/f1_the_starting_grid_for_the_2025_british_grand/,2025-07-05, Social Media,,"['Antonelli has a +3 grid penalty from Austria and Bearman a +10 grid penalty for crashing under red flag in FP3.', 'A Haas not starting on the last row after a 10 place grid penalty is pretty impressive honestly.', 'The top three might kill each other by Copse ngl', 'Verstappen for sure is driving for combat.', 'Alonso just quietly doing his Q3 things again!', 'Ollie whyyyy we could have been P8', 'Those two penalties really helped Alonso, Gasly, and Sainz.', 'Would love to see Hamilton on the podium but it is going to be toighy', 'My prediction is Max moves to cut Oscar off, Lando sees his chance and  rejoins in 18th.', 'Vamos Carlos.']",551,132,0.98,551,127,127,185,13,0.0,185
1lscc48,Full Onboard: Max Verstappen’s Pole Lap at Silverstone (2025),https://www.reddit.com/r/formula1/comments/1lscc48/full_onboard_max_verstappens_pole_lap_at/,2025-07-05, Video,,"['It really is a pleasure watching Max in his element- despite everything, he always does his best to extract the car’s maximum potential. Such a great driver!', 'I fully expected a Piastri or Hamilton pole then I saw Max with two purple sectors holy shit', 'His ability to execute is incredible, metronomic precision when he has the tool to do what he wants.', ""Poetry in motion. Definitely one of Verstappen's best laps."", 'He is too good', 'That car is in god’s hands', ""It's interesting how wide he went on that fourth turn and still maintained speed."", 'Snatched pole lap on race setup', 'Did the car understeer in turn 4 or is that the preferred line?', ""Both made mistakes on the last run and that's where u can see the brilliance of max Verstappen \nDelivering when it matters the most""]",536,180,0.94,536,173,173,122,37,0.0,122
1lsdyfk,"Fernando Alonso when asked about Verstappen: ""He(Verstappen) is just the best, when he has a car similar to others, you can guarantee he will be on Pole, Hamilton has won here the most, but I believe he(Verstappen) is the best.""",https://www.reddit.com/r/formula1/comments/1lsdyfk/fernando_alonso_when_asked_about_verstappen/,2025-07-05, Video,,"['412 GPs of shit stirring.', 'Max definitely the best currently on the grid. Hamilton is no longer in his prime, and neither is Alonso. The rest don’t seem to be able to take 100% out of their cars, a lot of the time', 'Alonso rage bait.', 'What about Sonny Hayes?', 'He has to just say Hamilton\nMan can’t sleep if he doesn’t name him somehow', 'No way, Alonso not passing up a chance to take a shot at Hamilton? I am shocked.', ""Why even mention Hamilton? Doesn't even make sense"", 'Not that he is wrong but classic Alonso reply XD', 'Lewis catches so much shit for no reason whatsoever. Why not mention MSC, Senna, Prost, Mansel etc. Why is it always Lewis that catches the weird strays from other drivers and fans? Vettel gets it too, but everyone seems so dead set on Max having a greater legacy than Lewis. It’s so weird', 'No one glazes Max like Alonso does. I hope Max gave him a signed shirt or something']",721,170,0.92,721,143,143,721,170,0.92,721
1ls5ywl,[Rory Mitchell] Williams personnel broke the curfew last night. It’s their first of two exemptions for the season.,https://www.reddit.com/r/formula1/comments/1ls5ywl/rory_mitchell_williams_personnel_broke_the_curfew/,2025-07-05, Social Media,,"['*Why* they broke curfew is far more interesting than that they broke curfew. Hopefully we get some more info soon.', 'These reports/headlines about teams breaking curfew always read so dramatic because I always forget those exceptions are a thing until they clear that up afterwards.', ""That's good, get a couple drinks in and a nice dinner to release some stress."", 'What is if they do it 3 times? Hefty fine?', 'Tsk tsk... Daddy Vowles will be disappointed.', 'Rumors said they held an illegal rave party in the Haas garage', ""I happened to watch the Driver interviews, and Albon noted that the string of mechanical DNFs was due an issue. The exact issue hadn't been identified yet, but they knew where to look and would use FP1 for some tests.\n\n\nThey probably found something and needed more time in the garage, either to fix it or to get to the bottom of it."", 'New PU for both cars im pretty sure', '3 demerits will earn them a citation, which is pretty serious', 'The FIA tells them they can’t be on the cheerleading team anymore, have to come right after home school']",448,14,0.98,448,14,14,6,0,0.0,6
1lrxti2,2025 Silverstone GP: FP1 vs FP2 Fastest Lap Comparison,https://www.reddit.com/r/formula1/comments/1lrxti2/2025_silverstone_gp_fp1_vs_fp2_fastest_lap/,2025-07-05, Statistics,"https://preview.redd.it/ndm7976mdyaf1.png?width=1200&format=png&auto=webp&s=36edc6cdb3b1f2c8aac599a4dee14088a382ffb2

https://preview.redd.it/no901ftmdyaf1.png?width=1200&format=png&auto=webp&s=c65df67f75948d41823a6d77cf9339739322dc40

Here’s a quick visual of how much things changed between the first and second practice sessions at Silverstone.

The track really came alive for FP2, leading to a massive shuffle in the competitive order. It looks like it could be anyone's guess who has the upper hand for qualifying tomorrow.

What do you all make of the sudden shift in pace?","['I think it’s because most teams used Fp1 for medium and hard tyre tests', 'Thanks for your analysis. Next time consider using the same time scale on both so it’s easier to draw a visual comparison', 'fp2 was windy as hell. You had to get lucky through maggots and beckets with no gusts.', 'This visualisation makes it almost impossible to actually compare the two.', 'This looks dope', ""FP2s are almost always used for actual quali runs, since it'll take place at about the same time of day as the qualifying session. FP1 is basic setup, FP3 is fine-tuned long runs. That's the standard run plans, so FP2 will always have a quicker pace, besides the track rubbering in more from the support races quali sessions"", 'Looks fancy but you cant compare anything. A graph is only good if its easy to read. Doesnt matter the looks.', 'I cant believe i missed that. Thank you :)', 'Thank you']",402,12,0.96,402,207,207,-2,0,0.0,-2
1lsb1z8,Valtteri Bottas confirms Alpine negotiations – update from the Finn on the situation – SuomiF1,https://www.reddit.com/r/formula1/comments/1lsb1z8/valtteri_bottas_confirms_alpine_negotiations/,2025-07-05, News,,"['90% of failing f1 teams quit one mid season driver change before winning it big', 'He’ll be in the car next week at Franco’s rate', 'Bottas vs Gasly would be an interesting battle. Been a long time since Bottas competed against a driver close to the baseline.', '**Valtteri Bottas confirms Alpine negotiations – update from the Finn on the situation – SuomiF1**\n\nEetu Lehtonen 04.07.2025 14:13\n\nValtteri Bottas, who is looking to return to the F1 series, confirmed that he is in talks with Alpine.\n\nThis week, it was reported that Flavio Briatore, who recently became Alpine\'s team principal, had already inquired about the Finnish veteran. In an interview with Viaplay, Bottas said that talks are ongoing, but that they are more about next year.\n\n‘He first showed interest in Toto, but I think we\'re talking more about next year,’ Bottas commented on the situation.\n\nAlpine\'s driver lineup is tricky, as they have already tried Jack Doohan and Franco Colapinto alongside Pierre Gasly, but neither has been able to get the cars to perform. It would not make sense for Bottas or Alpine to take on another driver just for the sake of trying, but rather they need to find a better and more permanent solution for the second car. It goes without saying that Bottas is also looking further ahead.\n\n‘A short stint somewhere... does that help in any way? My main focus is entirely on 2026 and beyond, and what the best option is from there. What is the most interesting project, and of course I want to be competitive, that\'s what\'s most on my mind,’ Bottas continues.\n\nHowever, the Finnish veteran does not rule out the possibility if a place in racing were to open up immediately. Admittedly, that is also part of the role of a reserve driver.\n\n""Yes, I\'m ready to jump into the car at any stage. It\'s not going anywhere, and I\'ve had a chance to test it. There will be more test days coming up this summer, so we\'ll be ready if the call comes, Bottas said.\n\nIn addition to Alpine, Bottas is being lined up for Cadillac, which is joining the F1 series next season and could use an experienced driver.\n\n*Translated with* [*DeepL.com*](https://www.deepl.com/?utm_campaign=product&utm_source=web_translator&utm_medium=web&utm_content=copy_free_translation) *(free version)*', 'If you were Bottas would you choose Alpine or Cadillac for 2026?', 'Negotiation is a pretty strong word here. There have been ""talks"" with Briatore. Also he says there, that he is focused to finding permanent seat for 2026 (and beyond) rather than temp gig. That SuomiF1 is pretty horrible clickbait site. Below link to his original interview with Viaplay (in Finnish)\n\nhttps://www.is.fi/formula1/art-2000011346431.html', ""I wouldn't do it if I were him, but a shit car instead of no car is a risk I'll take."", ""Funny how Doohan widows were crying because of the Colapinto swap 2 months ago and now they're just asking for Bottas or anyone else as if it was a totally different situation.\n\nIn the end you're not that different from the Argentinian fanbase, aren't you?"", ""I don't know if I can take *seriously a finnish publication talking about a finnish driver.""]",404,95,0.97,404,88,88,33,7,0.0,33
1lrry5g,"[@christianhorner] Making the biggest memories with the littlest fans. It was great to meet Rebecca, a great fan of the Team and @MaxVerstappen1 at the fan forum today and then welcome her to meet her heroes in the garage for FP2!",https://www.reddit.com/r/formula1/comments/1lrry5g/christianhorner_making_the_biggest_memories_with/,2025-07-04, Social Media,https://www.instagram.com/reel/DLsg_5yMMbC/,"['The difference in Max’s eyes between meeting a fan vs the press.', 'When I was watching FP2 she was shown in the broadcast and I thought who she was supposed to be. Turns out, a little lucky fan', 'Excited children are one of the most addorable things on the earth.', 'To paraphrase the late, and exceptionally great Ronnie James Dio; ""when you meet a fan, it\'s two minutes of your time. But to them, it means the world.""\n\nI\'m sure The Rock, and others have expressed similar sentiments over time, but it\'s genuinely great to see someone meet their hero, and that their hero is equally cool with it.\n\nBrings warmth to this old cynic\'s heart.', 'This was adorable to see at the track. Anytime she was on screen I said to my dad “hey look it’s the kid!”', 'Say what you will about Max but the dude lights up when he gets to interact with kids.', ""It's nice to see him smile between the pain he seems to experience being asked the same question again and again and again"", 'Super cute! Max is so good with kids and always stops for young fans. [This interaction from last week](https://www.instagram.com/reel/DLeufAHsNUR) was cute as well.', 'Love to see it', 'That’s so sweet!']",392,23,0.94,392,880,880,5,0,0.0,5
1ls8l6q,Closeup of Bearman crash,https://www.reddit.com/r/formula1/comments/1ls8l6q/closeup_of_bearman_crash/,2025-07-05, Video,,"['damn, that is actual a closeup lol', 'Cool angle. This is one of those crashes that’s just so dumb it’s crazy lol. Idk what he was thinking trying to attack the pit under red flag. Just rolled around with cold tyres and brakes.  Yeah it’s probably not gonna work', 'OH SHI-\n\nSame bro same.', 'Great camera work!', '“Fucking nailed it.”- Bearman, probably.', 'You can hear Max laughing at the end', ""There's so much bandwidth being taken up on this 7 second clip that it took 2 minutes to load lol"", ' ""Fahck. Going to call Gene.""', 'Holy shit. I missed it, figured he just clipped a sign on the way in or something 😳']",353,26,0.98,353,24,24,12,1,0.010000000000000009,12
1lsc9d8,2025 British Grand Prix Qualifying Classification,https://www.reddit.com/r/formula1/comments/1lsc9d8/2025_british_grand_prix_qualifying_classification/,2025-07-05, Statistics,,"['Gasly went really under the radar that whole session.', 'I hope and pray for a good start for Ferrari. Hope that good race pace can kick in early.', 'Tomorrow will be one of the best races of the season.', 'Super lap by George!! Was hoping to see him next to Max but P4 is cool\n\nWhat more can he do...', '5th and 6th in q3 after topping q2, man... at least this track has a lot of overtakes, but I cant stop thinking of what couldve been', '2 tenths lost, so close. Sigh', 'Russell also pulled one out there would have been hilarious if Max and him were 1-2', 'George jumping over both Ferraris is being slept on', 'Absolutely incredible lap from George, to put this car P4, and so close to the top 3.\xa0']",358,118,0.99,358,112,112,66,13,0.010000000000000009,66
1ls806t,Bearman crash FP3,https://www.reddit.com/r/formula1/comments/1ls806t/bearman_crash_fp3/,2025-07-05, Video,,"['How has he even managed to do that', ""Fucked that one up, didn't he."", ""Well, at least he didn't have to travel far to get his car repaired"", 'He sounds SO much like Albon over the radio??', 'Oops', 'Under investigation for a red flag infringement now 😭', ""Well that's embarrassing."", 'OOOOOOOOOOHHHHHHH! Oliver Bearman!', 'He has decent pace but Bearman has been involved in far too many incidents. He is ridiculously crash prone.', 'I really like Ollie, but some people are just ridiculous. I can’t imagine how most would’ve reacted had this been Franco. Double standards I guess.']",330,53,0.98,330,50,50,5,0,0.0,5
1ls5v85,[OC] Formula 1 drivers who have finished in every position from P1-P20 at least once in their career,https://www.reddit.com/r/formula1/comments/1ls5v85/oc_formula_1_drivers_who_have_finished_in_every/,2025-07-05, Statistics,"Notable exceptions include Fernando Alonso, who has **finished in every position except for P20.**  
Meanwhile, drivers such as NIck Heidfeld and Andrea de Cesaris have **finished in every position except for P1.**

DNFs and DSQs not counted.","['1 champion on the whole list.\n\n\nAnd 3 Italians...', 'Given the years that Jenson drove for midfield teams, its crazy that his (equal) most consistent finish... \n\nIs 1st.', 'Jarno Trulli P7 merchant is so fitting. Also his only win being Monaco is crazy to me. Before the DRS train, there was the Trulli train', 'Yenson my hero ❤️', ""Barrichello has 68 podiums in his career, so those numbers don't add up."", ""These numbers are completely wrong.\n\nBarrichello should have 68 podiums, Button should have 50. I can't find a classified P20 for either of them."", 'Cool stats. If you add columns for DSQ, DNF, and DNS does the set drop to zero drivers?', ""What is your source for these stats? For example, Rubens has finished 3rd 28 times, not 21 as you state here. I compiled a list myself (can't show it because reddit is being difficult) but it appears the only driver of this 5 to appear in all positions at least once is Trulli. None of the rest of finished either P19 or P20.\n\n  \nEdit: Had another look, the real (afaik) list of drivers with at least one finish from P1-P20 is as follows: Jarno Trulli, Robert Kubica, Sergio Perez, Daniel Ricciardo and Valtteri Bottas. Do correct me if I am wrong though.""]",328,49,0.93,328,48,48,-1,1,-0.009999999999999898,-1
1lron54,McLaren singles out Ferrari as surprise threat to F1 British GP chances,https://www.reddit.com/r/formula1/comments/1lron54/mclaren_singles_out_ferrari_as_surprise_threat_to/,2025-07-04, News,,"['I swear if hear “LiCo” on the radio this weekend im going to go insane', ""If Ferrari can fix that's causing drivers to LiCo then it's close."", ""Let's just hope that with lower temps the tires from ferrari doesn't get destroyed and there could be a good battle in the front."", ""McLaren VS Ferrari let's go"", 'I just hope it is closer than Austria, then we are on for a good show.', 'Man I wished for this all season', ""Honestly I don't know how to feel. I want to see some battles, but Oscar gave me enough of a heart attack during the previous race, especially after locking up. \n\nIt'd be exciting but I don't think my heart could last that long. \n\nBut McLaren has said similar stuff before about other drivers or teams being a surprise threat and then it turned out McLaren pretty much had the race secure on the first couple of laps. They always tend to downplay their performance and talk about how strong some of the other drivers or teams will look over the weekend. We just have to wait and see."", 'I am probably wrong but Ferrari seems to be running quite closer to ground… \n\nThey ll have to raise the height or risk the disqualification… \n\nRaising car would put them back where they actually are. .2-.3 behind.', 'If there is ever a race where Lewis disobeys Ferrari, it’s this weekend. Went well for Carlos a few years back.\xa0']",298,47,0.96,298,853,853,1,0,0.0,1
1ls5hfx,Gasly doubts Alpine can avoid finishing last in the championship,https://www.reddit.com/r/formula1/comments/1ls5hfx/gasly_doubts_alpine_can_avoid_finishing_last_in/,2025-07-05, News,,"['1. Stop developing it\n2. move budgets to next year \n3. Insert Mercedes engine\n4. Profit', ""Wild to me that last in the WCC can be *alright* sometimes, and the odd Q3. They're last with 11 points where for many years generally the last team would have zero or generally way fewer points.\n\nThe worst F1 team is still not that bad in 2025, is my point."", ""Alpine becoming the new Haas is a twist I didn't expect but secretly wanted for a long time."", ""At the end of last season they were probably the 5th fastest car - seems like they've stood still while the others have surpassed them.\n\nIf this were any other team, I'd say the fact they're focusing on 2026 & have the Merc engine makes them a bit of a dark horse for next season. But this is Alpine. Therefore, they'll probably end up being a joke yet again."", ""Didn't they announce that they've stopped development for this year as of this race?"", ""> “But what we’re seeing is there is so much convergence between all the cars this year compared to last year that some of our weaknesses are magnified by an order of magnitude.”\n\nEnstone is turning everyone who works there into some Trumpian clowns who believes they can never do something wrong for some magical reason. We literally got both cars in the top 10 previous year at Monaco for example and this year we're absolute clowns on all tracks.\n\nIt's always someone else fault, no matter of it's the Alpine PU, driver(s) or the Merc PU and/or gearbox. It's never Enstone who fuck this team up for a long time now.\n\nThe biggest mistake Renault/Alpine had made is hiring Ghosn years ago and buying Enstone instead of being serious about F1 and build an all French F1 team HQ including aero, chassis and gearbox development.\n\nUsing the race on Sunday in Austria to test you tyre deg? My lord we got simulators for that, fix you fucking facility instead of ruining race after race."", 'Well they are going to win this championship as we just reached the end of the 100 race plan. (The first one)', 'Car is a bit strange though. Is it just really bad on the tyres? Gasly can throw it in Q3 and then it just dies horribly in the race.', 'There is still a chance for a heavy rain race']",293,60,0.99,293,56,56,5,1,0.0,5
1lro3vp,Helmut Marko unconvinced by Ferrari F1 pace after spotting Lewis Hamilton issue,https://www.reddit.com/r/formula1/comments/1lro3vp/helmut_marko_unconvinced_by_ferrari_f1_pace_after/,2025-07-04, News,,"['Given how unhappy Max was, it seems Red Bull completely fucked the balance to try and control the deg', 'Sorry for crashnet but I didnt see this anywhere else.\n\nTLDR if you dont wanna click: Marko thinks Ferrari had massive deg (specifically Lewis), and Mercedes had quite a bit too. He was happy with Red Bulls deg, on par with McLaren.', 'Why do I always hear the Star Wars Imperial March theme when I see a Helmut Marko quote', 'Is Ferrari thinking about Red Bull?', ""Maybe he should focus on his own team's pace"", ""Since it's coming from helmut I'm taking this very seriously, as he's really got an eye for these kind of things."", ""The problem with Lewis' pace is that Ferrari wanted to try two different strategies to see what happened to the tires:\n\n\\- Hamilton pushing a lot in the first laps\n\n\\- Leclerc with a more conservative strategy for the tires in the first laps of the stint.\n\n  \nBut I bet he didn't notice that."", 'A lot of effort to convince himself that his own team’s car isn’t so bad.', 'Helmet Marko is a senile tool.']",286,88,0.87,286,1537,1537,0,0,0.0,0
1ls4gyz,Awful trackside commentary at Silverstone,https://www.reddit.com/r/formula1/comments/1ls4gyz/awful_trackside_commentary_at_silverstone/,2025-07-05, Discussion,"I'm at Silverstone this weekend and the main trackside commentator, who Google tells me is likely to be Alan Hyde or Gary Champion on Silverstone Radio, keeps re-wetting his mouth into the mic, making lip-smacking and slurping sounds every other sentence. It's horrible and I've never heard any other sports commentator make so many wet mouth noises. I would have thought that they would be trained out of it. I can hardly bear to listen to the commentary, which is obviously pretty crucial to what's going on. Given that studies show that something between 5-20% of the population has misophonia, this must surely be pissing off tens of thousands of people at the track. Please, someone at the race, tell me I'm not the only one absolutely hating this!

And if you're reading this, Alan or Gary or whoever you are on Silverstone Radio, please for the love of god, STOP IT","[""He will only get worse, as someone who has been to 3 grand prix's I'd recommend some headphones and tuning into radio 5 live!\xa0\n\n\nAlso f1-dash(if you Google it) provides live timing which will enhance your trackside experience\xa0"", 'I bought a radio specifically to hear this commentary so now this post has worried me lol.\n\nSome people will buy ear radios on the day for £15 too.\n\nIs it really that bad? Can someone visiting today record it on their phone?', 'Also who kept saying Ferxxxxtapen during FP2? Reminded me of this [“Guess the F1 driver”](https://youtube.com/shorts/ojtP6HauEmA?si=0NkrkyUdKw8f5Aft)', 'Never noticed that before, but I abhor the Silverstone trackside commentary.\xa0Literally all they talk about in the race is who’s set the fastest sector or fastest lap, zero insight into what’s actually going on strategically.\n\nI was in the paddock last year and managed to tune into Sky’s production feed, so I had Brundle and Crofty in one ear and the producers in the other, super interesting and way more insight than you’d normally get.', 'Never read or heard the word ""re-wetting"" before and hope never to again.', ""I've been listening to it all day yesterday and this morning, and haven't noticed it once. Sounds perfectly fine to me. All I've noticed is them tapping their pens and squeaking chairs."", ""Is it not David Addison this year?\n\nHe's been lead trackside comms for F1 at Silverstone for a number of years and is one of the best around. Would be a real loss if he's not there."", ""Glad to hear that it's not just Montreal with brutal trackside commentary..."", '\\**WET SQUELCHING*\\*']",283,55,0.89,283,50,50,3,0,0.0,3
1lsectd,[@espnf1] Max wants to thank Kimi for the tow over dinner,https://www.reddit.com/r/formula1/comments/1lsectd/espnf1_max_wants_to_thank_kimi_for_the_tow_over/,2025-07-05, Social Media,https://www.instagram.com/p/DLu7TURvyrV/,"['kimi’s apology from last week 🙂\u200d↕️', 'Max is building a coalition with Sauber and Kimi', 'They are not hiding it anymore 😅', 'Kimi desperately trying to keep Max in the RBR to protect George', 'Already preparing for next year.', 'Welcome Kimi to the club of Max’s tow buddies on the grid, including Nico, Gabi, Alex and Fernando\n\n\n-----\n\nEdit to add previous examples of the Tow Club.\n\n- Nico Hulkenberg on giving Verstappen a tow: ""We\'ve been helping each other out this qualy. He helped me out a few times in Q2, and I returned the favour."" \n\n- Alex on trading tows with Max: I think Max actually gave me a little tow into turn six, which was perfect. And I think that was what got me through | Q: Did you thank him already? | Alex: I did actually. I did try to give him one into turn 14 and then got one back into turn six | [Video](https://imgur.com/a/rUyO5SN)\n\n- Gabi on being slipstream buddies with Max: Max always gives me tows, he\'s the best! He\'s always super kind. You know I tried to give him a tow as well from T8 to T9, but then there was a yellow flag. But I tried my best, I even took the charge off the car to boost the engine, but yeah, it happens. | [Video](https://imgur.com/a/9QP5xuW)\n\n- Max and Fernando giving each other a tow during Sprint Qualifying in Miami | [Video](https://imgur.com/a/bY8h0nZ)', 'future teammates helping each other', 'George: I am in danger', 'teambuilding exercises or what?', 'Thinking max is cool is way less painful than back in 21.']",898,64,0.98,898,59,59,898,64,0.98,898
