unique_id,post_heading,post_url,publish_time,tag,post_content,top_comments,upvotes,comments,upvote_ratio,score,total_upvotes_comments,total_score_comments,upvotes_growth_rate,comments_growth_rate,upvote_ratio_growth_rate,score_growth_rate
1mqsgwp,2025 Formula 1 mid-season driver rankings #12: Gabriel Bortoleto,https://www.reddit.com/r/formula1/comments/1mqsgwp/2025_formula_1_midseason_driver_rankings_12/,2025-08-15, News,,"[""Fair placement seeing the rest of the list. He's been good, especially recently and he wasn't all that bad at the start of the year either. \n\nSecond highest rookie and ahead of the drivers struggling all year is fair, i dont see why everyone is moaning about it."", ""12 is pretty high and driven by recency bias. He's only recently started to finish the car in places it should be in. Hulk was doing the heavy lifting for most of the season but that's to be expected as he's an experienced driver and Borto is a rookie. But in pure performance, 12th is really flattering him. If he can drive the next half season like he has for the last few GP then the 12th will be a lot more deserving."", 'Bit high imo and driven by recency bias. He spun out of three races this year by himself which is very poor. I don’t think Hulkenburg is as great a benchmark as everyone thinks because his team mates in the last few years have been some of the worst drivers on the grid. Last time he had a decent team mate he was soundly beaten in 2019.\xa0\n\nPersonally I can’t get behind putting him above Hamilton or even Sainz who both have much better team mates. I’d also rate Antonelli and Stroll above him.', ""After Barcelona, Sauber gave him a better car. He started performing more consistently. Before that, the car was very bad, and the points Hulk got before were purely due to experience, as is normal for a more experienced driver. I think no good driver can show anything with a bad car. Look at Hamilton and Verstappen, how much they're suffering with their cars. Now, imagine a Sauber."", ""frontrunner bias that he's not higher imo"", 'Way too high. People are just underrating the Sauber. Hulkenberg is ahead of Alonso in the championship and yet Bortoleto is behind Stroll!', '>i dont see why everyone is moaning about it\n\nProbably because he is a driver who was not really rated in the first place -- although unfairly so; if you watched Formula 2 last year, the commentators were surprised when he emerged as a title contender because they were so fixated on Antonelli and Bearman -- and he is placing higher than the likes of Hamilton.', ""I've noticed this as well. If you go back to older posts pre-Barcelona, there were a lot of comments about how Bortoleto wasn't doing anything (even if he was keeping up with Hulk). Even some on how he needed to show some ability or he might wash out.\n\nPost-Barcelona and suddenly he's the best rookie. I think it's very informative on how car performance can wildly skew opinion."", ""Who would you rate above him? Max/Charles/George/Lando/Oscar/Lewis are obviously better. Albon, Alonso, Ocon and Gasly are also better. Hulk has also had higher highs (podium vs. P6) and while Bortoleto has outqualified him, Sunday is where you get points. Until very recently, Hulk was beating him there.\n\nThat leaves at highest, P12 for him, and he's currently in the fastest midfield car. I'd argue that Bearman has an edge too, since he has a tougher teammate benchmark (Ocon is currently better than Hulk as a driver), plus a weaker car. Hadjar has also been pretty solid. You can make the argument that Sainz's abysmal performance isn't indicative of his level either (but IMO, it's fair to rate him lower taking this season in isolation).\n\nIf anything, P12 is more or less the best you can rate him without going full recency bias.""]",51,21,0.83,51,21,21,16,4,-0.010000000000000009,16
1mq19im,The History of F1: A Retrospective,https://www.reddit.com/r/formula1/comments/1mq19im/the_history_of_f1_a_retrospective/,2025-08-14, News,"Amid the exhilaration of team victories and the angst of driver rivalries, the rich history of Formula One (F1) racing is built on adrenaline, new technology, and the power of aerodynamics. 

Let’s explore 75 years of F1, including its creation 75 years ago, several milestone achievements in the sport, and how the past is shaping the future of Formula 1 for years to come. ",['Seb in his undies😅....safety has come a long way in F1'],30,1,0.89,30,1,1,-1,0,-0.010000000000000009,-1
1mqvj12,[ESPN] “State of the silly season: Who will drive where in F1 2026?”,https://www.reddit.com/r/formula1/comments/1mqvj12/espn_state_of_the_silly_season_who_will_drive/,2025-08-15, News,,"['Absolutely zero substance here beyond X driver could go to Y team which we all already know. Also:\n\n>Schumacher has been out of F1 since he was dropped by Haas at the end of 2023.\n\nIt was the end of 2022..', 'Not too many seats left to be honest.\n\n1 at Red Bull.\n\n2 at Racing Bulls.\n\n1 at Cadillac\n\n1 at Alpine.', 'Norris, Piastri \n\nVerstappen, Hadjar \n\nLeclerc, Hamilton \n\nRussell, Antonelli \n\nAlonso, Stroll \n\nSainz, Albon\n\nOcon, Bearman\n\nHulkenberg, Bortoleto  \n\nLawson, Lindblad \n\nGasly, Aron/Franco idk \n\nCheco, Bottas', 'Not much of a silly season, all good seats/drivers are locked\n\nOne alpine seat, whatever red bull wanna do with their drivers and two seats at a new probably backmarker team\n\nNot very silly', 'With Max in third, silly season is less silly than it could have been. It would have mirrored last year as a truly disruptive year for the grid.', 'Not many open seats', 'ESPN: “How Mark Shoemaker’s potential F1 return may affect LeBron and the Lakers”\n\nI’m now qualified to work for ESPN, the gold standard of sports journalism.', 'lol yeah, and it’s arguably wrong saying he has been out of F1 since leaving Haas anyways as he was a reserve driver at Merc for two years. \n\nBut espn gonna espn.', ""Who is confirmed at Cadillac? \n\nI've heard the Bottas and Perez chat (and lots of more outside chance names), but didn't notice someone being officially announced."", ""And realistically, one of the seats in the Red Bull family is already out of contention (Lindblad), and Hadjar is almost definitely going to be renewed, so it's Lawson versus Tsunoda for the final seat there.\n\nIn my opinion, it's really just the Cadillac seat and the Alpine seat left.""]",22,24,0.82,22,24,24,22,24,0.82,22
1mqqfum,Who holds Hulkenberg's F1 records in its primary feeder series? - Formula Scout,https://www.reddit.com/r/formula1/comments/1mqqfum/who_holds_hulkenbergs_f1_records_in_its_primary/,2025-08-15, Statistics,,"['What a convoluted title and article premise.', 'Quality Summer break filler.']",0,2,0.35,0,2,2,0,0,0.04999999999999999,0
1mq39x9,Palou gains massive momentum for F1 move after securing fourth Indycar title,https://www.reddit.com/r/formula1/comments/1mq39x9/palou_gains_massive_momentum_for_f1_move_after/,2025-08-14, News,,"[""He should stay in IndyCar imo. He's already on the way to being the goat, so might as well stay there instead of risking it in f1"", ""I don't see Alex Palou leaving IndyCar for F1 or another series unless he gets a contract offer from a top tier team"", 'gpblog? Yh thx, but no thx.', 'Honestly if I were him I’d stay in Indycar. He has a family and the schedule isn’t nearly as long as F1. Plus he’s dominating. Why leave a series you’re dominating to go to a mid team?\xa0', ""Why is sharing GPblog even allowed here? It breaks the tabloid rules. Also also, Álex Palou literally himself said he doesn't want to do F1 anymore."", 'I think he’d be an interesting pick for Caddy, way more interesting than Schumacher. F1 teams should consider him with all this success.\n\nThat said, he’ll be mid-grid. He might prefer to keep earning millions and live a great life in America at Ganassi.', 'Seems to me he’s built for the upcoming F1 regs. Extremely patient, smooth, an ace at managing tires and fuel in Indycar, should be just as good managing tires, battery and everything else they will have to balance in F1.', ""I think Palou's done with the F1 dream after Zak Brown's carrot dangling and subsequent contract shenanigans, and who can blame him? He's got a good thing going in the US.\n\nHe deserves it the most out of anyone in IndyCar right now and I get why Buxton would like to see it (I would, too) but he seems like he's just fine in IndyCar."", ""I'd personally choose getting GOAT status in IndyCar over losing (due to having a bad car) in F1."", 'Is Will Buxton saying something considered a massive momentum?']",0,99,0.45,0,688,688,0,0,-0.02999999999999997,0
