unique_id,post_heading,post_url,publish_time,tag,post_content,top_comments,upvotes,comments,upvote_ratio,score,total_upvotes_comments,total_score_comments,upvotes_growth_rate,comments_growth_rate,upvote_ratio_growth_rate,score_growth_rate
1hc1e5m,2024 had the highest diversity of race winners since 2012.,https://www.reddit.com/r/formula1/comments/1hc1e5m/2024_had_the_highest_diversity_of_race_winners/,2024-12-11, Statistics,,"['Rosberg really fell off after 2016.', 'Pretty remarkable that we ended up with such a competitive season after such a dreadful start. The general mood around F1 post Bahrain was probably the lowest it’s been since France 2019.', ""* Diversity is calculated 1-Σp^2, where p is the proportion of races that year won by each driver. This is equivalent to the probability of two randomly selected races having different winners. This statistic takes into account not just the number of race winners, but how evenly the race wins were distributed.\n* Norris' victory in Abu Dhabi pushes this year's diversity above that of 2010, meaning this is the second highest diversity in the past 20 years, behind 2012 which remains the only year since the 1980s to have a diversity over 0.8.\n* If the first 10 races of the year were ignored, this year would have had a diversity of 0.847, which would have been the second highest in history, behind 1982, with 0.898.\n* Last year had the lowest diversity of all time with 0.244, beating even 1952's 0.245.\n* The median diversity value is 0.694, from 1972. Between 2012 and 2024, 2017 was the only year above this.\n* Yes, I know Verstappen used VES in 2016, but I wanted to keep it consistent.\n* The 1950-60 Indy 500 are not counted. Races won by more than one driver in this period are counted as half a win each."", ""Thanks for this great statistic. What tends to be missed that underneath the surface of last year's season, this was boiling up. Besides the dominance of Verstappen, already in '23 there were many different podium compositions. I was also surprised that DTS missed this as it was the real subplot of last year."", '2012 was crazy... 7 different winners first 7 races', ""And honestly, I couldn't even be more glad for that. I think 2024 would be a season that will be looked back for the hijinks, insanity and thrill. I am not sure if it will be looked back exactly like 2012, but this has been one hell of a season"", '2012 had more teams do it though.\n\nOne day Williams will win again.....', 'This season was amazing actually. It was a mix of 2009 and 2012. If Lando and McLaren were just a bit more competitive we would have had a 2012 season. But If this, if that does not solve anything. I am happy with the season and happy with all the winners.', 'The world shall never forget Maldonado.']",858,63,0.98,858,1395,1395,4,1,0.0,4
1hciaz9,[landonorris] Before... After,https://www.reddit.com/r/formula1/comments/1hciaz9/landonorris_before_after/,2024-12-12, Social Media,,"[""Good for McLaren and Lando. He's been there since the lows and I do consider him a big part of bringing them to the highs.\n\nHe kept delivering podiums and good performances for years, not just this year. Many seem to forget that."", 'And… he did 👏👏👏🏆', 'Narrator: ""and he did do them proud next week""', ""I mean their work in Abu Dhabi was pretty straight-forward considering their points and pace advantage on Ferrari. With that said, Norris did well to deliver the win after Piastri's troubles."", 'Next time?\n\nI sure hope he will have another opportunity to get the best car on the grid.\n\nBut realistically if you can’t beat Max while he drives the 3rd fastes car, I doubt you can fight for the title with equally paced \xa0Ferrari, Mercedes and/or Red Bull.\xa0', 'I mean - he should be thanking them not the other way around.', ""Agreed there! He hasn't been flawless, but people overlook the fact he's stuck with McLaren since 2017 when they were in the midst of their worst ever performances.\xa0\xa0\n\n\nHe's no doubt had plenty of talks with other teams where he could've jumped out and into a race winning car sooner, but he really did stick it out.\xa0"", 'It’s baffling how many people seem to genuinely think that a driver having the weight of their entire team’s hopes and dreams solely on their shoulders after their teammate has been taken out of the picture, knowing that they have to execute a flawless race because their main competitor is close enough behind for most of the race that even one lock-up could have brought their competitor into play and put the WCC at risk, was driving under no pressure and it was all as easy as pie. It shows such a fundamental lack of understanding about both the sport and what was at stake.', 'What pace advantage on Ferrari?\xa0', 'The “next time” explicitly refers to Abu Dhabi. He posted the first picture after the penalty in Qatar saying he would do the team proud in the following race, which he did.']",802,60,0.91,802,50,50,107,3,0.0,107
1hckm5s,[@kymillman] More on Mclaren's Post-Race Celebration ,https://www.reddit.com/r/formula1/comments/1hckm5s/kymillman_more_on_mclarens_postrace_celebration/,2024-12-12, Social Media,https://www.instagram.com/p/DDdf3x_IX5_/,"['Mfs had a wild royal party and what made headlines were burger fries pizza smh', ""Well that's one advantage to middle eastern owner XD. Sounds like a wild party"", 'I will call everyone affiliated to McLaren ""McLareners"" from now on', '....\n\nA private flight to a palace to eat... Burgers, fries, and pizza?', ""You haven't partied until you've had burgers and fries in a Bahraini palace"", ""Pizza and fries? Where's steak and champagne?"", 'The hangover from a night fuelled by rosewater must be gnarly', 'Obviously not 26 years ago, that would make it sometime in the early 80s... Wait, how old am I?', ' Well deserved party by the boys and girls at McLaren', 'Lovely gesture, I hope the team at the factory got something similar...']",786,70,0.96,786,65,65,246,18,0.010000000000000009,246
1hbzr84,Fun fact: All 3 2-time Constructors' Champions won their 2 titles consecutively,https://www.reddit.com/r/formula1/comments/1hbzr84/fun_fact_all_3_2time_constructors_champions_won/,2024-12-11, Statistics,,"[""Sorry for the low-res Brabham logo, couldn't find a better one"", ""Brabham logo looks so sick!! I wish we could put mythical creatures and dragons in modern logos too\n\nNot everything has to look corporate, sterile and have a meaning, it's just an identity"", 'Brabham was a double Australian team car and engine Brabham-Repco. Repco still selling Australians car parts. I bet most didnt know they made F1 engines', 'Fun fact with in fun fact.\n\nSir Jack Brabham won the drivers championship in 3 of those years and his team mate Denny Hulme won it in 67. \n\nThe other drivers championships went to Alonso.\n\n@OP the logo during that period for brabham was much more boring. The logo you posted was the ecclestone era\n\n[link](https://logos.fandom.com/wiki/Brabham_(F1)?file=Repco-Brabham_20logo_large.png)', 'Sorry for my ignorance, but was Renault not just a name change for the same entry as Benetton? When the Enstone team was called Lotus later on, they ran 3 stars on their car to symbolize their 3 constructors’ championships.', ""I was today years old when i found out Renault have only ever won two constructors championships, wtf?\n\nliterally only occurred to me till now all those titles Renault loved to brag about they were only engine manufacturers and their famed turbo engined cars of the 80s didn't bag any championships.\n\nI mean i knew but it didn't add up in my brain until now."", 'Why not use the classic Brabham Repco logo they put on their cars?\xa0', ""Another quick maffs fun fact: If you are a aspiring constructor for F1 and you just so happen to hit a lucky 2-in-a-row win streak, you then have a 50% chance of going on a domination streak as of all constructors who've managed to make their first two constructors championships in succession, half have managed to dominate (red bull, merc & Williams) and the others well just look at the post. And in general, if you win in this manner, you have a 66% chance of being a constructor that wins more, whether thats in succession or spaced out. Another useless fact that could've been its own post, but in comment form, for your off-season viewing pleasure."", 'yeah makes sense']",645,54,0.96,645,863,863,12,0,0.0,12
1hbys08,"FIA introducing ""Operational Regulations"" and gender-neutral terms to F1 rules",https://www.reddit.com/r/formula1/comments/1hbys08/fia_introducing_operational_regulations_and/,2024-12-11, News,,"['Ignoring the side of this that most are focussed on, the FIA surely had to do this sooner or later to cover themselves legally.\n\nThere could have been an interesting legal appeal by some of the female drivers in the junior series that any rule that refers to ""him"" doesn\'t actually apply to them.', '>The FIA\xa0replaced masculine terminology with gender-neutral language in its rule books for Formula 2 and Formula 3 last year. For example, one passage which previously stated “the stewards may disqualify him from the race” now reads “the stewards may disqualify the driver from the race.” The WMSC confirmed it has now made the same change for F1’s rules.\n\nNo idea who would have an issue with this, but I assume the comments will be fireworks.', ""Pronouns shouldn't be used in regulations ever.\xa0 Be specific to avoid any confusion\xa0"", 'Literally a minor change that makes sense that will get blown out of proportion.', 'Most comments are acting like this is going to be an issue, but I really don’t think anyone cares. \n\nGender neutral terminology should be the norm in legal settings. Which these rules are essentially.', 'I wanna know what MBS thinks about this. /s', 'A good thing overall.', 'Yeah, I am sure the comment section will be civilised about this', ""Well at least the comment section isn't full of completely ridiculous overreactions""]",501,256,0.78,501,4126,4126,8,0,0.0,8
1hcgp3z,Insane Stat: The last time Max Verstappen finished a race outside the points was more than 8 years ago in Spa 2016*,https://www.reddit.com/r/formula1/comments/1hcgp3z/insane_stat_the_last_time_max_verstappen_finished/,2024-12-12, Statistics,"*with this caveat:
races where he didnt saw the finish line, but was still counted due to sufficient distance driven are counted for this statistic only when he still scored points.

https://en.wikipedia.org/wiki/Max_Verstappen#Complete_Formula_One_results

heard it in a youtube video but am afraid to link it due to fear of beeing accused of advertising.","['[https://www.reddit.com/r/formula1/comments/1gwdvq4/comment/ly8n2xk/](https://www.reddit.com/r/formula1/comments/1gwdvq4/comment/ly8n2xk/)\n\n21 days ago', 'Honestly, this kind of stats are getting out of hand. Every day someone comes up with crazy things.', 'It was also the only time he ever finished outside the points in a Red Bull.\n\nFor comparison, Lewis finished outside the top 10 four times in a Mercedes, three of them in a Turbo-hybrid era Mercedes. Also very low, but a bit more than one (and with a few years more experience when his Mercedes time started).\n\nAnother comparison, in that same period his teammates finished outside the points 12 times (Ricciardo 0, Gasly 1, Albon 4, Perez 7).', 'It’s getting to “did you know every 60 seconds in Africa, a minute passes??!” With the amount of obscure stats we get now.', '""if we count all the races where he scored points, the last time he finished outside points was 8 years ago"" warra stat.', 'This stat gets posted about one a month since a few years ago.', 'What about Lewis? I bet he has a similar stat.\n\nEdit: bro why the downvotes?', 'Wtf does this stat even mean. \n\nAnother fact Every driver who finished 1st this season got 25 points atleast.', 'uh. didnt see that.\nsaid youtube video did of course not link its source. so, sorry.']",332,24,0.84,332,22,22,48,2,0.010000000000000009,48
1hclw2u,Alpine insists Ocon is welcome for farewell factory visit,https://www.reddit.com/r/formula1/comments/1hclw2u/alpine_insists_ocon_is_welcome_for_farewell/,2024-12-12, News,,"['Should go in his Haas overalls.', 'There is a difference between saying ""we will organize a farewelll for ocon"" and ""he can have one if he wants""\n\nImagine dating someone and they say ""yea sure we can have a drink if you want..."" and "" lets have a drink :) :) ""', 'i.e. now he’s called them out on their shitty behaviour, they’re going to pretend he was always welcome.\n\nOakes’ media response to this whole saga has been incredibly disappointing. Seems he’s well suited to Alpine’s culture though.', '""Look, people say that \\[he was harshly treated\\], but I think it\'s not really right. I think at the end of the day, he had an option. He chose to start with his new team earlier. That\'s fine. I\'m cool with that.""\n\nDisingenuous much?  I mean Sainz ran for Ferrari on Sunday and drove for Williams in the test two days later.\n\nStop pretending you were not a complete ass about this Oakes.  Jeez.', ""wow, such a nice hospitality. /s \n\nI wonder why they are caring now tho, didn't even include him in final group picture and now are insisting. Clowns fr"", ""I wouldn't blame.him if he didn't really want to at this point. They forced him out of his final race with the team to be petty."", 'Fuck alpine. Utterly classless.', 'Alpine insists Ocon is welcome for farewell factory visit...\n\n... tickets for the alpine HQ tour start at 45 euros.', 'Yeah, nope! The way they tossed him aside, why would he want to go back? I get that it was team management that made that decision, but better to just walk away to Haas now.']",288,57,0.95,288,55,55,164,21,0.0,164
1hc49k1,Proposed FIA changes 'sadden' Austrian motorsport boss,https://www.reddit.com/r/formula1/comments/1hc49k1/proposed_fia_changes_sadden_austrian_motorsport/,2024-12-11, News,,"['""The head of Austria\'s motorsport federation says he is ""saddened"" by proposed changes that will reduce accountability at motorsport\'s governing body the FIA.\n\nOliver Schmerold, the chief executive officer of the OAMTC, says the new statutes would be ""not good governance"" and ""not good in terms of checks and balances""...\n\n... He said the changes, which limit the independence of the FIA\'s audit and ethics committees, would make it harder to recruit ""established and independent individuals"" to them.\n\n""The ethics and audit committees would lose that attractiveness so there would be maybe in future only individuals on those committees who are more or less in one way or another depending on the actual leadership,"" Schmerold said.\n\n""Which individual who is behind good governance and who has shown he has a good professional track record would be ready to take on a position on a committee which is completely controlled by two individuals?""', 'Calling the head of the ÖAMTC a ""motorsport boss"" is certainly a take. It\'s an automobile association, with some motorsport elements, yes, but it\'s only a tiny aspect of what it does.', 'In addition to the change that has been discussed recently:\n\n>Schmerold added that this was the second time in six months that he had expressed concerns about planned changes to the statutes that appear to affect accountability and governance.\n\n>The previous time, at the last general assembly in Samarkand in Uzbekistan in June, was over a statute that has come to be known as the ""urgency"" rule.\n\n>This grants the FIA president the power to impose changes through a group made up of the president of the FIA senate and one member of his choosing from each of the two world councils, for motorsport and mobility, ""in particular when circumstances do not permit a meeting of the senate, especially in the event of urgent and/or critical situations"".\n\n>Any decision made by this group would need only to be ""communicated"" to the senate rather than approved by it.\n\naccountability, transparency, democracy.', 'Oh thank God. I thought someone was gonna go on a tirade about gender neutral terms in rulebooks.....', 'Who is surprised?  I must be crazy, but I see a pattern here…', 'The FIA serves no purpose. Just fire them', 'At least some people might not vote for Ben Sulayem lol. Expected to win easily regardless though', 'The FIA is ostensibly an automobile association too. Motorsport is also only a portion of what its remit is.', 'Austria has 2 member organizations with the FIA right? Is this the bigger one?']",144,23,0.92,144,322,322,5,0,0.0,5
1hclqgn,Jordan reveals 'aggressive' cancer diagnosis,https://www.reddit.com/r/formula1/comments/1hclqgn/jordan_reveals_aggressive_cancer_diagnosis/,2024-12-12, News,,"['Hate to hear this. I’ve really enjoyed listening to his and DC’s podcast. Certainly a one of a kind character', 'Such a legend and it was a pleasure meeting him when he opened the factory up to fans for a party one year at the British GP, saw him on the drums, such a legendary character.\n\nEvery year you could guarantee his team would be the ones doing things for the fans and he was there for the love of the sport.', 'Dude is a fucking awesome, the podcast with him and David coulthard is amazing. To be honest, now knowing this it kinda makes sense because that man has no problem sharing his opinion. Long story short is that I hope he gets past this', 'That’s bad', 'Eddie has been one of the great characters of formula 1 since he first joined the sport, very sad to hear this :(', 'The colour Jordan brought to F1 is what attracted me to the sport way back in the dim and distant past of the 90s .\n\nThe team was often chaotic, but never, _ever_ boring.\n\nReally sorry to hear this, and I hope his prognosis is as good as possible.', ""Man thats rough. Seems he's been going through it for a while."", 'He was such a passionate team boss\n\nhttps://youtu.be/omxjC1nBOJ4', ""Given that God doesn't want him and the Devil doesn't want the competition, he'll be fine.  ARRAAWWAHH!""]",155,11,0.97,155,10,10,47,2,0.010000000000000009,47
1hc2kuv,"Russell/Verstappen sniping a good thing, says F1 and Indy legend Fittipaldi",https://www.reddit.com/r/formula1/comments/1hc2kuv/russellverstappen_sniping_a_good_thing_says_f1/,2024-12-11, News,,"['Racing enthusiasts love the racing. \n\nEveryone loves the drama.', 'F1 needs a hate cauldron', 'Good, it was getting a little chummy around here ~\n\n~~Ron Swanson~~ Fittipaldi.', 'They are PR robots nowadays.', ""I agree. F1 needs all the drama, on and off the track. I don't mind Max and George barking at each other 🍿\xa0"", '![gif](giphy|YHUZxlHvk4GIA5mT8N|downsized)', 'It’s fun but Max is so good at conflict resolution that this spat won’t make it through the winter break and I guarantee he will post a photo of him playing padel with George.', 'I think the author meant “snipping”, but I’m sure Max knows a thing or two about quickscopes.', ""Game's back.""]",92,25,0.85,92,331,331,-1,0,0.0,-1
1hby9vc,"[FIA] Introfuction of driver cooling kit under certain, extreme weather conditions in F1.",https://www.reddit.com/r/formula1/comments/1hby9vc/fia_introfuction_of_driver_cooling_kit_under/,2024-12-11, News,,"['Community service for that title, OP', 'This will come in the form of driver cooling thermals (Which have just started to be homologated by the FIA) which will attach to a system which will use the latent heat of vaporization, or of sublimation, of a substance.       \nThose parts will be stored in & around the cockpit.', 'Introwhatnow..?', 'The cooling and related components weigh 5kg', 'I prefer the days of tossing buckets of water on a driver', 'Go introfuct yourself', 'I think Leclerc was wearing something of this sort for the post season test!', 'Other than Singapore, I can’t think of any other race that would require the use of this kit every season. I’m sure the teams will come up with something creative.', ""A kit that isn't going to be used in any races other than those in the middle of the desert."", '👎🏻']",73,32,0.89,73,341,341,3,0,0.0,3
1hbx78u,2024 World Constructors' Championship Alternative Standings,https://www.reddit.com/r/formula1/comments/1hbx78u/2024_world_constructors_championship_alternative/,2024-12-11, Statistics,"  
From 1958 until 1978, the International Cup for F1 Constructors (as it was called at the time), only counted the points from the highest-scoring driver in each race for each constructor towards the Championship.

Using the same logic for the 2024 season, these are the standings (if I calculated them correctly, pardon any mistakes). The first table's results are the standings without counting sprints, as they didn't exist back in the day, or fastest laps, which not always awarded points:

https://preview.redd.it/9gv9sk3wu86e1.png?width=1080&format=png&auto=webp&s=d10da17ef4103eaa33d5f03a37a451da19b7d87e

The only major difference in the standings for this scenario is that Red Bull would finish ahead of Ferrari with McLaren only clinching the title on the finale in Abu Dhabi.

A funny tidbit, but Red Bull's points would actually be just Verstappen's points (no fastest lap points) + 10 (Checo's points in Australia, as Max DNFed and Pérez never finished ahead of him any other time).

This method almost punishes you for both drivers doing well, as Alpine's double podium in São Paulo wouldn't even ""help"" them as much, because only Ocon's 2nd place would count, and many other scenarios like these for the midfield and backmarker teams, as double points finishes wouldn't pay off as much as only 1 car finishing higher.

  
In the second table I've added sprint points using the same logic that only the highest scoring driver from each team counts:

https://preview.redd.it/e2s21au3v86e1.png?width=1080&format=png&auto=webp&s=930922410ac5aef16b132f84a4cf70333b0c705d

The only difference in position here from the previous table above is that Haas jumps Alpine for 6th as they scored more points in sprints (again, Alpine's double podium has less relevancy in this scenario).

Something which I hadn't noticed before doing this, but besides Williams and Sauber (which I guess is understandable), I found that Aston Martin also didn't score a single point in a sprint. You would think at least in the sprint races in the first half of the season they may have had the pace for it, but they never did. Maybe shows they struggled with setting up the car with only 1 practice session in sprint weekends.

Just made this for fun, hope I can be forgiven for any mistakes here and there.","['Mr. V? Is that you?', 'Nice nugget of knowledge. Thanks OP for sharing', 'Interesting. I was sure Max alone would win it for RBR, so very surprised to still see McLaren on top. Really shows how much they deserved it.', 'Now do one where you count the points of a driver only if they finished ahead of their teammate. For example if Norris finishes in P2 with Piastri in P4, you count 18 points for Norris, but not 12 for Piastri.', 'now do this for WDC i want to see where perez would end up', ""Just goes to show all the people that think if RB had a better second driver that they would've had the WCC locked down are overestimating the strength of the car. Any driver that they could've realistically gotten wouldn't have been enough to swing it imo\n\n\n\nMcLaren absolutely deserved the WCC this year"", ""that's what these standings are?"", ""Wouldn't that just be the same as the final standings in the WDC this year?"", 'Yes, but what would the drivers standings look like.']",69,12,0.85,69,41,41,-4,1,0.0,-4
