unique_id,post_heading,post_url,publish_time,tag,post_content,top_comments,upvotes,comments,upvote_ratio,score,total_upvotes_comments,total_score_comments,upvotes_growth_rate,comments_growth_rate,upvote_ratio_growth_rate,score_growth_rate
1nipqiw,Resources/cool shit for a kid who is apparently into F1 now,https://www.reddit.com/r/formula1/comments/1nipqiw/resourcescool_shit_for_a_kid_who_is_apparently/,2025-09-16, Discussion,"So, my kid who's in junior high has been getting into Formula 1 for the last six or seven months (thanks Netflix!). I enjoy it when it's on, but have never been an aficionado; it's definitely niche in the US, and I think most Americans still associate auto racing with NASCAR which I find objectively boring. 

Anyway, are there any cool documentaries, resources, books, etc that stats/gear obsessed kid could nerd out on? YouTube channel recs, age-appropriate neatness? 

Thanks in advance, fam

Edit: thanks for all the info! 

Edit 2: thanks for the legitimately educational, friendly, and helpful feedback. This sub wins the practical congeniality award. ","['The Brawn documentary with Keanu Reeves was really good. Wikipedia is full of stats and people often post the most random stats on here. \n\nYou can google for some books, of which there are quite a few. As of gear, maybe start him off with a hat or a shirt.', ""Sign up for F1 TV, it's not too expensive in the US. Lots of stuff there."", 'In terms of books I could say try Adrian Newey\'s ""How to build a car"", it\'s practically his autobiography, not really technical, and as one of the most important engineers of the last three decades of F1 he\'s an authority, and then follow with Ross Brawn\'s ""Lesson in strategy from Formula One"". The technical books I know are mostly MSc level and not specific to F1 (thinking about Milliken and Milliken\'s or Katz\'s, which are texts suggested in some of my university courses).\n\nThere are other narratives books like biographies which talk about major drivers which could interest him, I would try a Lauda or Senna biography as they\'re among the most liked even today and they\'re two very important figures in the sport.\n\nFor documentaries I\'d suggest series like Racing Through Time, which explores both Formula One and interwar racing ([Playlist 1](https://youtube.com/playlist?list=PL6Qe3ninV3VjI5ru0CoKqfx7cPZPX7SCs&si=X6QVxIYbKlz6OIaO), [Playlist 2](https://youtube.com/playlist?list=PLTOUyQcU3JG3iiSo7FXJueu1Nav603yIC&si=tDwG1_B6QbaC5Oed)), but there are many other well made ones, like 1 (2013) and McLaren (2017).\n\nSince Lauda is my sport hero, I\'ll leave this [playlist](https://youtube.com/playlist?list=PLW5qT4HIAd1a2dkXKmLcNtJ0u048nfUY-&si=1UKZxmhTEnTx5olo) here, it has a main interview and other videos with Niki talking about his career and contemporary (to his late life) F1.\n\nAs for fiction, Grand Prix (1966) is a technical spectacle, and Rush (2013) tells the story of one of the most interesting rivalries in F1.\n\nHave a look at [this](Racing/Motorsport https://boxd.it/1jmT6) Letterboxd playlist which has more than a thousand racing movies and documentaries.\n\nIn terms of stats there are several sites, although I contribute to Wikipedia and I find it to be the most diverse and complete.\n\nI have a [YouTube channel myself](https://youtube.com/@luca_salerno?si=q1xPXkYWWt55GEfM), but I\'ve uploaded only one video about the 1925 championship, so not really F1, it\'s more niche as an argument. I\'ll upload about F1 in the future too but I\'m not really a YouTuber so I don\'t have a schedule.\n\nI\'ve also recently created a [YouTube playlist](https://youtube.com/playlist?list=PLU0YfQ7fA5TonUyv5dV2-JdbTJqNyoDis&si=UJcSEYLTrVgEt4v2) in which I list (more like hoard but whatever) videos about motorsport, there\'s surely something interesting there from time to time too.', 'We pay for the F1TV package yearly and it’s freaking awesome during the season. Multiple views, even on replays, every race every year, it’s great.', 'If they want to learn about the history of the sport, and focus more on the smaller details and lesser shouted about parts then Aiden Millward on YouTube is a really good source for stuff. :)', ""Lots of podcasts. Try F1 Explains if he's interested in the technology."", 'The actual F1 youtube page is a great resource for some short documentaries on f1 legends past and present. I also really enjoy Josh Revell on youtube for documentaries for his tongue in cheek story telling style.', 'If you like podcasts, “And Colossally, that’s History!” Is a solid history podcast about f1.  The Senna documentary is also great.  F1TV has a ton of good shows on it, and there are a lot of f1 history videos out there.', ""F1TV is a great price if he wants to see every race - covers practice, quali, pre and post race shows etc. Also has an archive of previous seasons.\n\nAs for YouTube, there's a lot of crap, but the official Formula One channel has highlights, and some of their live shows and documentaries are posted. Kym Illman has a great channel covering mostly behind the scenes stuff (he's an F1 photographer), and some of the teams put out some great content - Williams and Red Bull are notable in this regard.""]",134,73,0.9,134,213,213,14,2,0.010000000000000009,14
1nijifg,Extended Highlights | 2021 Azerbaijan Grand Prix,https://www.reddit.com/r/formula1/comments/1nijifg/extended_highlights_2021_azerbaijan_grand_prix/,2025-09-16, Video,,"['*Wibbah intensifies*', 'When the season just started, Checo told the team that he would need 6 races to get upto speed & become competitive. By coincidence & also because of race borne factors, he won the 6th race of that season i.e. Baku.', ""if sunday is half as interesting as this one, i'd be more than happy."", 'One of the only two races that season which had neither Max nor Lewis in the podium.', ""Im still amazed at how lucky Verstappen got that his car did not snap to the same side as Stroll's did. He would have impacted the pitlane wall pretty hard, even with the barrier there."", '""Perez with a good start. Hamilton with wheelspin. Vettel having a look""\n\n\nNone of those things happened. Crofty just said whatever came into his head.', 'We were this close to a Sebastian Vettel win in an Aston Martin', ""Apparently Checo's car almost crapped out before the last restart. Something to do with the clutch."", ""If only that bloody tire didn't explode...\n\nAbu Dhabi wouldn't even have mattered."", '“He’s got the tow. He’s got the pace. Sebastian Vettel gets fourth place!”\n\n*crying in the clerb intensifies fam*']",95,68,0.86,95,712,712,5,4,0.010000000000000009,5
1nil5cs,F1: The Movie races to 4K and Blu-ray in October,https://www.reddit.com/r/formula1/comments/1nil5cs/f1_the_movie_races_to_4k_and_bluray_in_october/,2025-09-16, News,,"[""Oh fantastic, this was what I was gonna get my dad for Christmas but when I made my list couldn't find it anywhere and was worried it wouldn'tget a physical release, good to know it is!"", 'Was surprised Apple allowed a disc release of the movie. You would think they would use this as a way to get people on the platform (especially if the rumored US broadcasting deal is true) but they went out and allowed a physical release. That or it was FOM who wanted this we dunno. Not like they will gain a lot more revenue from a CD release though since everyone watches media on streaming services', ""This movie now has me hooked on F1! I go to the movies very often and it's the only film I've seen twice in theaters. Since then I'm watched every race and completed the Netflix series. I can't wait to rewatch when I get the 4K blu-ray and I actually know how the sport works! It'll be fun to see all the cameos of the racing drivers since I had no idea who they were when I first saw it.\xa0"", 'Sweet, was literally just looking up the 4k blu ray last night.', 'That steelbook feels bit like kimi movie with his number 7 on the car :D', 'This movie kind of sucked, not because it was unrealistic but because it was just bad. Brad Pitt was pretty wooden in the movie, some of the pop/edm music felt very out of place, the women characters were turned into love interests/non factors, and the camera angles were not great. \n\nI expected there to be some crazy onboard shots, just like Top gun Maverick. Instead, it was basically a race onboard for the most of the shots. Nothing new or innovating there. \n\nThe first five minutes of the movie at Daytona was the best part!', 'Thanks for the heads-up, just placed my preorder!\xa0', 'What’s a blu-ray?']",73,51,0.75,73,185,185,10,1,0.010000000000000009,10
1nim4jf,Catching Up With F1 Driver Yuki Tsunoda! | Talking Bull,https://www.reddit.com/r/formula1/comments/1nim4jf/catching_up_with_f1_driver_yuki_tsunoda_talking/,2025-09-16, Video,,"['Hilarious interview with a remarkable number of times that fart or food is mentioned.', 'Really hope he finds a way out of this ugly situation that he has currently at RB.', 'Sad that he is likely being removed from Red bull... he is not an amazing driver but his car is just holding his potential back', 'Drive faster?', 'Getting better results would be a start', ""That is Formula 1. Everyone looks at Max and wonders how the hell you're taking a bad car into the front row. That is how you can distinguish a good driver from a great driver. Yuki had 5 years of experience now under his belt and he has already raced more than half of the season. He was given a chance but he will be an ok driver but not a driver like Nico Hulkenberg level. His time is up unless he heads towards Alpine."", 'What Potential?', ""Why didn't he think of this? Is he stupid?!"", 'Nope that word is fine. Weird to make a big deal']",59,13,0.9,59,28,28,4,1,0.010000000000000009,4
1nj23tk,"I would like to become an f1 engineer/aerodynamicist, what is all that I need to do?",https://www.reddit.com/r/formula1/comments/1nj23tk/i_would_like_to_become_an_f1/,2025-09-17, Discussion,"I am an American high schooler and I am planning on going to a college for a degree in mechanical engineering with a minor in aero (should I change my minor and should I get a bachelor’s or masters degree?) I also plan on joining the universities formula student team. Then I was thinking about maybe doing a 1 year uk Motorsport academy. Then applying for f2/f1 positions. What do you think would be ideal if you have any idea? If I decided to go for something like pit crew what would I need to do to become a pit crew member, thanks!","[""There's a really excellent post over on r/F1Technical that should answer a lot of questions\n\nhttps://www.reddit.com/r/F1Technical/s/hGHIdpMWcH\n\nMy first piece of advice would be to do some reading and work out the type of jobs you're most interested in.\n\nTrackside Engineer, Aerodynamicist and Pit Crew are all quite different career paths."", 'bare in mind you are aiming for a ridiculously exclusive job, the standard of entrants is going to be elite.', 'losing the light in ur eyes first is how most people start with engineering, then the rest is hard work and connections', 'Wierd.\n\nThis topic pops up every few months. It’s always a young American schooler trying to join F1 through really far fetch, unconventional means. \n\nPosting history is highly sus too. lol', 'Read Adrian Neweys book. It goes through his path into that field in great detail', ""Since all types of jobs are quite different one of another, I'd suggest starting to sort out what you like the most. Someone in aero faces much different problems than someone in vehicle dynamics. I'd suggest to take courses in your undergraduate course about all kinds of topics if possible, and sort out the area you'd like to work in the most, on which you can focus more in your master.\n\nAlso yes, take part in a racing team from your university, it's considered. After the MSc, there are academies for race engineering for example and they're often key to being chosen for motorsport roles in GT/Touring, which are often the gateway to Formula racing.\n\nI've recently complied a [short list](https://www.reddit.com/r/formula1/s/7IDWHkHxxF) of race car engineering books, some are from my MSc courses, so a bit advanced for an high schooler, but keep them in mind and try to read them in the future."", ""If you're American, Lockheed/Boeing will snatch you up with an obscene salary to build weapons first. EU generally pays poverty wages, even for engineers and skilled professions. F1 is no different. Also that work experience will probably get you into F1 quicker than being a moral beatnik."", 'Start with a degree in Aerospace or Aeronautic Engineering. Get closer to UK to have better opportunities. While at school try applying to F1 related jobs to expand your contacts network.', 'And the pay is not going to be great.']",2,11,0.75,2,10,10,2,11,0.75,2
1niztpx,What's going so wrong with Sainz's first Williams season,https://www.reddit.com/r/formula1/comments/1niztpx/whats_going_so_wrong_with_sainzs_first_williams/,2025-09-17, News,,"[""Imo he's doing fine"", ""Nothing it's the answer to be honest"", 'More waffle from the-race', 'Albon’s been better than him but the point gap makes the gap look a lot bigger than it actually is. \n\nHe’s really beating him in quali by now and has gotten very unlucky in some races. Monza was a bad weekend but he’s been good recently', 'Sainz gets exposed outside top teams', ""Nothing, Williams is having a great season, he's just been extremely unlucky having to deal with a ton of car issues, on top of getting screwed over by team strategies."", 'Overhyoed and underdelivered', 'Sounds like you listed a few things wrong']",0,8,0.36,0,8,8,0,8,0.36,0
1nj426m,Romain Grosjean Involved in an Incident at the 2018 Azerbaijan Grand Prix,https://www.reddit.com/r/formula1/comments/1nj426m/romain_grosjean_involved_in_an_incident_at_the/,2025-09-17, Video,,"['For me the most remarkable Grosjean brainfart was Spain when he lost the rear in the opening corners, decided to floor it, doing a doughnut in the middle of track as the pack was passng, which took out a bunch of cars. \n\nhttps://www.youtube.com/watch?v=cPjf-jtXMQU']",0,1,0.4,0,1,1,0,1,0.4,0
