unique_id,post_heading,post_url,publish_time,tag,post_content,top_comments,upvotes,comments,upvote_ratio,score,total_upvotes_comments,total_score_comments,upvotes_growth_rate,comments_growth_rate,upvote_ratio_growth_rate,score_growth_rate
1ghy4na,[Chris Medland] Replays show Verstappen had pulled partly alongside Piastri with the VSC panels still showing before the restart,https://www.reddit.com/r/formula1/comments/1ghy4na/chris_medland_replays_show_verstappen_had_pulled/,2024-11-02, Social Media,,"['Well, that was obvious seeing the normal feed', 'Does that apply to VSC, though? Or just SC? Cause he might still have been within the delta', 'Replays also show Hulkenberg walking on track while there is no VSC', 'But the rule is worded for a full SC.\n\nArticle 55.15 “In order to avoid the likelihood of accidents before the safety car returns to the pits, from the point at which the lights on the car are turned out drivers must proceed at a pace which involves no erratic acceleration or braking nor any manoeuvre which is likely to endanger other drivers or impede the restart”.', 'For everyone debating the rule Bernie Collin’s explained it pretty well, the drivers have to be below their delta throughout the VSC so at no point t can they above it. Looking at the footage Max caught up to both McLarens not just Oscar while the VSC was still showing so if he passed his delta when he did that then he’s got a penalty coming', ""Honestly the overlap to me isn't necessarily a penalty. The wording of section 56 doesn't inherently prohibit it. And if it was a delta issue I imagine we would have know pretty quickly."", 'Yeah but as far as I’m aware the rule for pulling besides was implemented for a Safety car not a VSC', 'Pulling beside under VSC is not against the rules\n\nSC Rule:\n> 55.14 \n\n>When the clerk of the course decides it is safe to call in the safety car the message “SAFETY CAR\nIN THIS LAP” will be sent to all Competitors using the official messaging system and the car’s\norange lights will be extinguished. This will be the signal to the Competitors and drivers that it\nwill be entering the pit lane at the end of that lap.\nAt this point the first car in line behind the safety car may dictate the pace and, if necessary, fall\nmore than ten (10) car lengths behind it.\n\n>In order to avoid the likelihood of accidents before the safety car returns to the pits, from the\npoint at which the lights on the car are turned out drivers must proceed at a pace which involves\nno erratic acceleration or braking nor any other manoeuvre which is likely to endanger other\ndrivers or impede the restart.\n\n>As the safety car is approaching the pit entry the SC boards will be withdrawn and, other than\non the last lap of the sprint session or the race, as the leader approaches the Line the yellow\nflags will be withdrawn and a green flag and/or green light panel will be displayed at the Line\n\nVSC Rule:\n> 56.7 \n\n>When the clerk of the course decides it is safe to end the VSC procedure the message “VSC\nENDING” will be sent to all Competitors via the official messaging system and, at any time\nbetween 10 and 15 seconds later, “VSC” on the FIA light panels will change to green and drivers\nmay continue the session or continue racing immediately. After 30 seconds the green lights will\nbe extinguished.', 'Article 55.14:\n\n>""In order to avoid the likelihood of accidents before the safety car returns to the pits, from the point\nat which the lights on the car are turned out drivers must proceed at a pace which involves no erratic\nacceleration or braking nor any manoeuvre which is likely to endanger other drivers or impede the restart”.\n\nIt literally mentions ""before the safety car returns to the pits"", so they cannot argue it refers to both the safety car and VSC.', 'Stewards: DSQ and -8 points in the championship.']",799,264,0.93,799,3892,3892,0,0,0.0,0
1ghxur1,[ChrisMedlandF1] Verstappen noted for a Virtual Safety Car infringement...,https://www.reddit.com/r/formula1/comments/1ghxur1/chrismedlandf1_verstappen_noted_for_a_virtual/,2024-11-02, News,,"['It looked like he went early given how close he went. But without the deltas is hard to know.', 'I guess the pulling alongside?', '5 second incoming?', 'No idea how he managed to get so close to Piastri without going over his Delta time. \n\nThey were literally side by side going into T4. If Piastri had lifted into the corner he’d have been overtaken.', 'it did look like max jumped the gun a little bit', ""Didn't Max break the safety car rules again by driving alongside before the green flag? Isn't that the rule that was made because of him? I assume it applies to a VSC and a safety car."", '""If he goes too slow report it!"" \n\n\n\n""What do you mean I was going too fast?""', 'Hahahahahahaha of fucking course', 'Oh boy', ""he was closing the delta rather quickly - I'd wait for the investigation to see who was doing it, Piastri slowing down or verstappen speeding up""]",813,230,0.95,813,3082,3082,5,0,0.0,5
1gi7e7t,[@OscarPiastri via X] Nice lie-in tomorrow ,https://www.reddit.com/r/formula1/comments/1gi7e7t/oscarpiastri_via_x_nice_liein_tomorrow/,2024-11-02, Social Media,,"['I mean if you need to be ready for quali at 7:30am, what time are these guys gonna need to wake up to get to track and prepare ?\n\nI saw people today saying they spent 3-4 hours in the queue to get in, so I foresee that being a mess as well that early.', ""He's so quick with these lmao"", 'If I was an f1 driver I would be sacrificing qualifying and starting from the pit lane in this situation\xa0', '[Ocon has set his alarm to 04:31 AM](https://www.reddit.com/r/formula1/comments/1gi7sn4/esteban_ocons_ig_story_setting_an_alarm_for_431am/)', ""The local train to the track seems to run every 30 minutes tomorrow morning.  That's going to be a bunch of full trains. \nEdit: they're scheduled every 10 minutes now\n\nMy options appear to be..\n\nAn hours walk from the hotel at 5am sounds unsafe. \n\nAn uber at 5am sounds hard to get and also busy. \n\nA probably full train and waiting for many to pass before getting on. Or go too early to stand around (probably also unsafe).\n\nPick your poison. Ouch."", 'He’s F5ing like the rest of us', 'Why', ""It's not hard to get an Uber in sao paulo at 5 am. The thing is that it's not worth it. There are so much traffic jam that it is better to go by public transportation (if you are a normal people). The drivers and most of the crew go in vans and the police escort them. I know that because I saw it yesterday."", 'Do they have bicycles or electric scooters to hire? Or will that be unsafe as well?', 'How about taking the train towards the opposite direction, travel until it goes to the end and turns around to get to the track?']",200,15,0.96,200,339,339,-3,0,0.0,-3
1gibh6l,Bortoleto to Race for Sauber in 2025 - Source: Motorsport,https://www.reddit.com/r/formula1/comments/1gibh6l/bortoleto_to_race_for_sauber_in_2025_source/,2024-11-03, News,"Source: Motorsport

","[""That would make 5 drivers, a quarter of the grid, from the southern hemisphere. I don't know what that implies, but it's something.\n\nEdit: I forgot Franco doesn't have a seat next year. Yet."", 'The articule doesnt even mention a source lmao, complete nothingburger with a side fries and diet coke', 'I’ll believe it when Sauber announces it', ""We gonna run out of 'Bort' plaques very soon, I see"", ""This is the same journalist that a feel years ago promised that Andretti bought Sauber and Colton Herta would race for them. I'd wait"", 'Third or fourth post with the same Brazil source.', 'If this and Franco to Red Bull both turn out to be true, we would have 6 rookies next season', ""I really hope so, he's super talented. I will wait until sauber confirms to believe it tho"", 'No chance this is happening lmao']",107,27,0.81,107,273,273,-1,0,0.0,-1
1gi4cbp,[Chris Medland] Yet another 15-minute delay to 1700,https://www.reddit.com/r/formula1/comments/1gi4cbp/chris_medland_yet_another_15minute_delay_to_1700/,2024-11-02, News,,"['Basically how it feels like when you flight keeps getting delayed', 'The fun part is, the forecast for tomorrow afternoon doesnt look any better.', 'This isnt funny anymore', 'Every 15 mins we get another 15 min delay until the sun goes down and it gets cancelled.', ""Anyone else struggling to explain to their SO why it's taking double as long as previously promised?"", 'This is ridiculous. Make the call.', 'Surely', ""Fuck this, I'm off to sleep. I've learned my lesson from Spa '21"", 'Cancel it already']",273,162,0.94,273,1678,1678,3,0,0.0,3
1gi2mew,"[Ian Fergusson] 1810GMT: Albeit rain rates are currently falling, FIA forecasters have warned teams that re-intensification is possible from about 1540 local. That would be bad news if it occurs... but still time & potential for situation to change",https://www.reddit.com/r/formula1/comments/1gi2mew/ian_fergusson_1810gmt_albeit_rain_rates_are/,2024-11-02, News,,"['Would that be in ~25 minutes?', 'If quali doesnt happen today or tomorrow, is it P1 standings for grid or sprint results?', 'You fools… you asked for wet sessions so bad and forgot spa 2021… time for a repeat', 'using 2 different time zones for the time in 1 post is fucking crazy', 'I wish we could just do a one shot qualifying then, everyone gets one timed lap. Sure it’s not the most representative but better than using FP1 times', 'Does Pirelli not make wet tyres anymore?', ""So what happens if they can't qualify today? What do the rules allow? \nEarly quali tomorrow?\nUse Sprint race qualifying results?"", 'Why not just use the wet tyres for once and do a wet qualifying. Smdh', 'They should just throw away the wet tires and give the teams another set of slick compounds.  Good grief.  Wet tires were invented for a reason.']",323,131,0.98,323,1722,1722,4,0,0.0,4
1gi6fu3,[Estagiário da F1] Literal Curva do Lago (Lake turn - turn 4) ,https://www.reddit.com/r/formula1/comments/1gi6fu3/estagiário_da_f1_literal_curva_do_lago_lake_turn/,2024-11-02, Video,,"['Yeah no way it would have gone ahead lets hope tomorrow can happen somehow', ""I can see why it's was cancelled now. Damn"", 'They call it the “Lake Descent” corner because the lake has quite literally descended upon it.', 'Bit moist there innit?', 'If they drown, they drown', 'Yeah, even if the wets were good there was no chance they run today', 'Why dont they just drive around it, are they stupid?', 'weeee', 'Absolutely bewilders me why known areas on the track with poor pooling wouldn’t have better drainage? Resurfacing a track sounds like the perfect time to fix that', 'Is this really the best way to fix that lol?']",188,37,0.96,188,375,375,0,0,0.0,0
1ghp758,"Ollie Bearman on getting the call from Haas: ""Ayao woke me up this morning at like 6.30 with his call, but when I saw his name I wasn’t so mad, if it was my Mum or something not realising the time difference I’d have been a bit more angry!""",https://www.reddit.com/r/formula1/comments/1ghp758/ollie_bearman_on_getting_the_call_from_haas_ayao/,2024-11-02, Video,,"['The bear just wants to hibernate man', 'i wonder if he has that picture as his contact pic', 'finally a british thats not butchering Ayao into ayo', 'Yer mum calling you at an ungodly hour in the morning is never accidental. It’s revenge for the thousands of hours of sleep we denied them over the years. \n\nAnyone with a child knows this the first time they tell their mum about the early mornings and they give you that Gene Wilder/Willy Wonka “tell me more look”.', '""Commiserations to Kev 😅""', 'Poor Mama Bearman 😂', 'As a Spaniard I can relate. I hope it was 6.30 PM', ""How American. He'd rather be woken up by his boss for a shift at work rather than his own mother. \n\n/s\n\nEdit: sarcasm"", 'You supposed to be up cooking breakfast by then! -- Bubb Rubb', 'Don´t  be mad at you mum :(']",3630,68,0.99,3630,4828,4828,0,0,0.0,0
1gi7bci,Officially ,https://www.reddit.com/r/formula1/comments/1gi7bci/officially/,2024-11-02, News,N,"[""At least Lewis still gets to drive Senna's car (hopefully weather permitting)!"", 'All of those aristocrats with Paddock Club passes are going to be mad', ""All hail Porsche cup's sacrifice."", 'So, they also moved the race to an earlier time? Does the weather prediction look that bad? Yikes...', 'They wouldn’t dare cancel the drivers’ press conference though…', 'Busy day for the drivers! Finish post qualy press conference at 9. Parade 30 minutes later and 1h30 until race start after that.', 'I wonder what will happen to the schedule if there is a lengthy red flag in qualifying', ""Senna Tribute (High speed) gives me a chub hoping Lewis is going to wring it's neck rather than a putt around waving at people."", 'Gonna be fun watching this carefully crafted schedule get entirely washed out.']",162,28,0.98,162,271,271,0,0,0.0,0
1gi1wnz,"[Chris Medland] Confirmation from the FIA that the start of qualifying will be delayed, with a further update at 15:00 (when it was due to start)",https://www.reddit.com/r/formula1/comments/1gi1wnz/chris_medland_confirmation_from_the_fia_that_the/,2024-11-02, Social Media,,"['How long until they move it to tomorrow?', 'I kinda want them to delay it an hour until the WEC finale is done lol', ""I am taking a wild guess and I say this Is about the medical helicopter that can't take a flight and not about the racing conditions.\n\n I remember someone on reddit was telling me last year that every track needs to have a specific time limit they need to get within the nearest hospital and brazil can do It only with helicopter because of the heavy traffic on Sao Paulo can someone who knows more confirm that?"", 'Delay it until 20.30 so I can watch football in peace.', ""In a normal weekend if qualification was cancelled it goes to practice 3 times\n\nIn the unlikely situation that qualification doesn't happen here do we go with:\nPractice 1, sprint quali or sprint race to set the grid?\n\nWhat is the rule?"", 'How long is the delay in terms of hour, so I can understand without doing hard maths.', 'Understandable, looked like a river in the pitlane', ""I hope they don't wait until it's fully dry. Maybe until something like this year's Spa."", 'Can I ask what’s the point of wet weather tyres if they’re not being used in sessions like this? Or is it a case of it simply too wet/dangerous for the teams to go out?', ""Nice, I'll be able to watch Worlds and the qualy. Perfect""]",321,75,0.98,321,640,640,3,0,0.0,3
1ghxyad,"[Chris Medland] Unclear what the potential infringement is at the moment, but if there's a time penalty for Verstappen he finished 4.1s ahead of Leclerc so would be under threat of losing a place",https://www.reddit.com/r/formula1/comments/1ghxyad/chris_medland_unclear_what_the_potential/,2024-11-02, News,,"['Exceeding delta time i guess, when he was almost alongside VSC was still on', 'i like that we are all still acting like theres only a couple of points separating max and lando', ""Max did get alongside piastri while still under the VSC. I know the safety car regulations prohibit that but I'm unsure about the VSC. He was absolutely trying to race piastri into 4 but didn't compromise his line."", ""well it's still 3 points overall but it could be 3 crucial points"", ""Lmao, bit of a shitshow isn't it. Firstly the VSC being very late and now this after everyone already finished and done their interviews"", 'Why did vsc wait until mclaren swapped tho? It was constantly yellow flag until mclaren could swap and as soon as that happened, they turned to vsc', 'Say what?', ""FIA's really gonna crack down on everything Max does now after the last few races"", ""It's very hard for us to determine when it actually ended, we see ending, but we don't see the time that it ends. The times were changing a lot there at the end, Piastri was like 2s behind Norris when the message first came up(he was only 0.7 when it started). \n\nTo actually make a determination of what happened you'll need to check onboards and see when it actually ended. \n\nEither way it seems to me that Max may have been a little closer at certain points at the end there, and had the proper gap at some points, Piastri quickly went from 2s behind Norris, to 1.5, to 0.7.\n\nSeriously though, that VSC timing was REALLLY sus though.""]",525,126,0.95,525,1385,1385,3,0,0.0,3
1gi30dg,[Chris Medland] Estimated start of qualifying at 16:00 (so in half an hour) ,https://www.reddit.com/r/formula1/comments/1gi30dg/chris_medland_estimated_start_of_qualifying_at/,2024-11-02, News,,"['Ah perfect, just as WEC finishes', 'Feels like the light would be very low by the end. Any red flag would put it in the dark.', 'Emphasis on estimated. I don’t believe it but I’ll happily be wrong', ""I live on the west side of town, it's a monsoon right now and it will probably happen in Interlagos also, oof!"", 'Official?', 'At Suzuka 2019 there was a typhoon over Japan at the time so qualifying and the race took place on the same day. I assume a similar thing can happen here.', 'Great time to finish my breakfast with calm before Checo exits Q1', 'Yay I guess?', 'Damn no FP1 setting the grid, rip the max P20 dream']",259,44,0.96,259,378,378,1,0,0.0,1
1ghz2mz,"[Sky Sports F1] ""Our car does not like this track"" ""We definitely can't make it worse"" Lewis Hamilton was NOT happy with the car",https://www.reddit.com/r/formula1/comments/1ghz2mz/sky_sports_f1_our_car_does_not_like_this_track_we/,2024-11-02, Social Media,,"['AM: ""oh you can.. trust us..""', 'Mercedes making sure to drain all of this man’s joy before he leaves.', 'Imagine showing this quote to someone just after Brazil 2021', 'Mercedes: you underestimate my power!', 'Narrator: it was later found that Mercedes indeed could make the car worse as Lewis finished p10 after a p7 start', ""Russell also has been nowhere this sprint (at least his quali wasn't as bad as Lewis'). Merc really unable to make anything work since 2022 with the add few exceptions."", 'Lewis must be counting down the number of races with the W15', 'He said this before and i think they did make it worse.', ""Honestly it may be the most baffling season of the regulations. Start a mile away, win three of four races, then fade away again. \n\nWe will always have Silverstone '24 tho"", 'Go put the W13 out of the attic']",426,94,0.96,426,1157,1157,-2,0,0.0,-2
1ghu1fq,"[@F1] This is going to be special. Lewis Hamilton, driving his icon Ayrton Senna's 1990 title-winning machine at his home track of Interlagos! ",https://www.reddit.com/r/formula1/comments/1ghu1fq/f1_this_is_going_to_be_special_lewis_hamilton/,2024-11-02, Social Media,https://x.com/F1/status/1852667721906786750?t=aGa4hzBgLJZjBTbHu9jyqw&s=19,"['Will be a hard job getting him out of it…', 'Optimistic by Radiohead is gonna play in my head the entire time :D\n\nreference: [https://youtu.be/9U\\_K76vPGYo?si=ZTaw0s9X9E4p3rs3&t=770](https://youtu.be/9U_K76vPGYo?si=ZTaw0s9X9E4p3rs3&t=770)', ""Hope he doesn't bin it like when Leclerc crashed Lauda's Ferrari at Monaco"", 'It will be streamed on Youtube at 17:15 local / 20:15 GMT.\nI think it will also be streamed on X (Twitter) / Instagram', 'Can you actually watch it anywhere', 'So fucking buzzing for this!', 'I’m interested to see what helmet and racing suit he wears', 'They should have let him race it in the sprint 🧐', 'This will be very cool to see. \n\nEven cooler is that it is likely the car I sat in at the 2015 Goodwood FoS!']",900,39,0.92,900,772,772,-2,0,0.0,-2
1gi3dcw,[Phillip Horton] New estimated start time of 16:15 - so another 15-minute delay,https://www.reddit.com/r/formula1/comments/1gi3dcw/phillip_horton_new_estimated_start_time_of_1615/,2024-11-02, News,,"['What is the latest time they can start, with the sun going down and all', 'Here we go again, Spa 2021 flashbacks...', 'I am going to sleep\n\n\n3:50 AM rn', 'So guys have you seen Faker. Man what a player.', 'Slap on the wet tyres and let them have fun ffs', ""Nah we've been here before, I'm tapping out here. Call me if it starts."", ""Wet races are done for, FIA won't let them drive. It isn't even raining that much, remove wet tyres from Pirelli"", 'The reason is a few specific corners have a lot of standing water still, like Mergulho. Rain is very light now.', ""FIA and F1 management have decided years ago they don't want wet races anymore. \n\nFor every track they will find a separate reason. In some it will be the helicopter having no visibility, in others some particular turn, in others something else. \n\nThey de facto eliminate wet chaotic racing because nobody has the appetite to risk something going wrong. \n\nThe sport is ruled by the ghost of Bianchi.\n\nWe had plenty of wet weather races in the 90s and the 00s, which were usually very unpredictable and fun to watch. But nope, we re doing everything not to have them now.""]",200,67,0.96,200,744,744,2,0,0.0,2
1gi3p68,"[Chris Medland] Another 15-minute delay, with an estimated start at 16:30",https://www.reddit.com/r/formula1/comments/1gi3p68/chris_medland_another_15minute_delay_with_an/,2024-11-02, News,,"['They should just keep delaying it in 15 minute increments until tomorrow morning', 'Getting blueballed by F1 again', 'Maybe the real qualifying was the friends we made along the way.', ""Wet tires are a myth. It's a conspiracy, It doesn't really exist"", 'They’re cutting it close with sun down', 'Remember when we used to be able to race in the rain good times', 'Yeah, it’s getting cancelled. Even 4:30 is cutting it fine for sunlight.', 'I’m gonna sleep', 'Can they just cancel it so I’m not sat watching rain for 30 minutes']",184,116,0.94,184,917,917,-2,0,0.0,-2
1ghhv04,"Charles Leclerc is fined  €10,000 for saying “f*ck” in post-race press conference",https://www.reddit.com/r/formula1/comments/1ghhv04/charles_leclerc_is_fined_10000_for_saying_fck_in/,2024-11-01, News,,"['TL;DR: Leclerc hit them with the 🥺 face to get out of community service', 'Do the FIA take themselves still seriously? nobody else does', 'Fucking ridiculous', 'Max: ""Community service for me but not for thee?""', ""This is definitely one of Ben Sulayem's more bizarre moral crusades."", 'Where community service', ""I love the implication that Charles was apologetic because he's a nice boy and not because he knew that anything else would land him in community service. Just for saying fuck."", 'MBS can say shit like ""women who think they are smarter than men, for they are not in truth"" but drivers saying fuck is over the limit. what a joke honestly', 'The fia is dumb.']",9361,950,0.96,9361,33490,33490,0,0,0.0,0
1gi3hn3,"""Do it now"": How Norris called for position swap with Piastri to win sprint race - McLaren team radio transcript",https://www.reddit.com/r/formula1/comments/1gi3hn3/do_it_now_how_norris_called_for_position_swap/,2024-11-02, News,,"['The fact that he had to say it is shocking considering how McLaren decided not to leave it to the last lap in Hungary specifically to avoid vscs', 'It’s funny because they were very adamant to Lando in Hungary that if there was a safety car, they would need to swap positions before it happened. Today they dawdled and messed around until he told them to sort it out.', 'Do it now, do me good, swap this place like you should.', 'Let me just park this right here. From Hungary this past July:\n\nLap 51:\n\nTS: OK Oscar, so, once you get to Lando, we’ll swap positions. We’ll swap position, but we want to avoid Lando having to give up a lot of race time.”\n\nLap 56:\n\nWJ: “We need to save more tyres please, and we do want to let Oscar through.”\n\nLN: “Well you should have boxed him first then, surely no?”\n\nWJ: “Doesn’t matter.”\n\nLN: “I mean, it does. To me maybe.”\n\nLap 61:\n\nWJ: “OK Lando, 10 laps to go – we think both cars are using their tyres too much. Just remember every single Sunday morning meeting we’ve had.”\n\nLN: “Yeah, well tell him to catch up please.”\n\nLap 64:\n\nWJ: “Lando, he can’t catch you up. You’ve proved your point and it really doesn’t matter.”\n\nLN: “He’s on much quicker tyres. I mean, I would have tried to undercut anyway. If I did, I would have got more.”\n\nWJ: “Mate, we did the stop sequence in this order for the good of the team.”\n\nLap 66:\n\nWJ: “And Lando, there are five laps to go. The way to win a championship is not by yourself, it’s with the team. You’re going to need Oscar, and you’re going to need the team.”\n\nKarun and Crofty suggested Mark Webber, who likely has a lot of thoughts about team orders, should negotiate the bonus for Oscar. Hell yes', 'Why did they edit out most of Lando\'s conversation?\n\nJust has his engineer saying ""Yes Lando we hear you"" What was it he was saying?', 'Does anyone know if the transcripts in the article are complete? I thought there would be more chatter on the radio', ""Man if McLaren win the WCC it'll almost be by accident with all of the thumb twiddling they seem to do during important race decisions."", 'Mclaren need to sort themselves out in the off season, the driver calling the shots here is stupid', 'I can\'t see ""do it now"" anywhere in that transcript.']",168,124,0.77,168,1667,1667,-3,0,0.0,-3
