unique_id,post_heading,post_url,publish_time,tag,post_content,top_comments,upvotes,comments,upvote_ratio,score,total_upvotes_comments,total_score_comments,upvotes_growth_rate,comments_growth_rate,upvote_ratio_growth_rate,score_growth_rate
1lt4d57,"[@stakef1team_ks] A first ever podium for the Hulk p19 to p3, a mighty drive for Nico at the #BritishGP",https://www.reddit.com/r/formula1/comments/1lt4d57/stakef1team_ks_a_first_ever_podium_for_the_hulk/,2025-07-06, Social Media,,"['P19 to P3 is incredible for anyone, to do it in a Sauber is another level. What a fucking race Nico', ""Can't believe Hulk breaks that awkward record in a Sauber what a drive from the man"", 'Genuinely the most nervous I’ve been for a driver since Charles at Spa 2019.', 'HULKENGOAT', 'I have never been more stressed in my life watching that. It’s 1:50am in Australia and I was pacing around my room. Nico Hulkenberg. What a man, what a hero.', ""17 years ago a brit wins the british grand prix while a backmarker team gets a podium. And it's happened again this year. The conclusion of this is that someone is going to lose the championship on the last corner"", ""THIS WHAT WE'RE HERE FOR"", 'I told so!\nhttps://www.reddit.com/r/formula1/comments/1loi5mw/what_crazy_thing_will_happen_at_silverstone_this/n0rnwxi/', 'somewhere out there.. Daniel Ricciardo smiles and shouts Nico HÜÜÜÜÜÜÜLKENBERG', 'After 239 race appearance..finallyyyyy huuuullkkenberrrggggg is getting the podium\U0001f979']",34021,683,0.98,34021,471,471,2139,27,0.0,2139
1lt52lw,Bless the mods for this,https://www.reddit.com/r/formula1/comments/1lt52lw/bless_the_mods_for_this/,2025-07-06, HULK MEDIA,Love you mods.,"['Everyone loves Nico!', ""I can't imagine any other driver they could do this for that wouldn't anger a large part of the community hahaha. So happy for him."", 'Who up Hulking their Sauber rn?', 'We are all fans of Stake^^TM F1 Team Kick | Sauber on this blessed day', 'this is a historic event', 'NICO HÜÜÜÜÜL-KEN-BERG', 'Fun fact: Nico has outscored max by 2 points in the last three races. Is Nico the next goat? 😂😂 \n\nHappy for the Hulk, totally deserved.', '100% Justified\n\nL3TS GOOOOOO GOATENBERGGG!!!!!', 'All hail the hulk podium', 'Things like this tells us that the mods are alive']",30447,325,0.97,30447,302,302,2689,21,0.0,2689
1lt4aa9,"Lando Norris wins the 2025 British Grand Prix, Piastri 2nd, Hülkenberg 3rd!",https://www.reddit.com/r/formula1/comments/1lt4aa9/lando_norris_wins_the_2025_british_grand_prix/,2025-07-06, Race,,"[""If you were telling me Hulkenburg could end his podium drought in Sauber before today, I'd think you're daydreaming.  \n  \nSo glad for NICOOOO HUUUUUULKENBURG"", 'I never thought I’d see the day, what a drive from Hulk 😭', 'NICO MY GOAAAAAAT', 'And out of all cars\n\nHe did it in the Sauber\n\nInsane', 'Holy shit. I never thought today would be the day that it happened, but it did. I didn’t even think it was ever going to happen at this point. Nico Hülkenberg on the podium. In a Sauber. I might cry. Bravo, Nico, bravo.', '2025 the year where so many curses are broken in sports, well done hulk', 'I remember watching Germany 2019 and thinking it’d be Hulk’s last chance…\n\n6 YEARS LATER AND ITS YOURS NICO', 'It has been 5,593 days since the 2010 Bahrain GP, where Hulk made his first of 239 career F1 starts. \n\n3 P4s. \n\n1 Pole. \n\n0 podiums. An F1 record. \n\nAN F1 RECORD THAT GROWS NO MORE, NICO HÜLKENBERG FENDS OFF THE 7 TIME WDC AT HIS HOUSE TO FINISH ON THE PODIUM.', 'The prophecy has come true \n\nTHE HULK PODIUM', ""Hamilton's podium run broken by... Hulkenberg. From 19th""]",24837,2056,0.96,24837,499,499,825,19,0.0,825
1lt4rta,Hulkenberg’s pit crew after the chequered flag,https://www.reddit.com/r/formula1/comments/1lt4rta/hulkenbergs_pit_crew_after_the_chequered_flag/,2025-07-06, Video,,"['That mechanic had his 🇨🇭flag ready 😅', ""Environment at Sauber team is still so energetic after all these years, I'm happy for them. Keeping up with the name"", 'How long has that Swiss flag been waiting I wonder', 'Moments like this is why I love the sport so much. Unmatched.', 'no one expects the Swiss inquisition', ""I am very happy. The entire time he was 4th I had my heart in my mouth. Then when it seemed Hamilton would pass him I was going crazy. Rarely felt this kind of excitement and happiness in a race. Hope Hulk gets a few more podiums before he hangs up. I've always felt that the drivers in the mid tier are discriminated against as they seem to do such a good job(like Gasly is doing this year) and if they had a top car they too would be routinely getting podiums. But I guess that's F1 for you. \nVery happy for Hulk."", 'The worst part about Danny ric not being in F1 this year is not hearing him yell “huuullllllllkennnnberggggggg!” at this win', 'It’s almost easy to forget that this was also Sauber’s first podium in well over a decade. These guys have seen so much absolute shit for so long. Could not be happier for them.', 'My wife told me yesterday, that Niko would take the podium today, and I scoffed. :P  \nCongrats, Niko! ❤️', 'I’m so happy for them, what an amazing result ❤️']",12501,151,1.0,12501,144,144,1340,11,0.0,1340
1lt4c5i,Hülkenberg radio reaction to first ever podium in F1 after 239 starts (P19-P3),https://www.reddit.com/r/formula1/comments/1lt4c5i/hülkenberg_radio_reaction_to_first_ever_podium_in/,2025-07-06, Video,,"[""He's in tears\n\nI'm in tears\n\nWhat a drive"", ""I actually just have the biggest grin on my face, I'm so happy for Nico."", 'THE CURSE IS BROKEN', ""WHO KNEW HULK COULD'VE ONLY DONE IT IN A GREEN CAR???"", 'Hulk smashed it!', 'He really went and did it in a Sauber of all cars', 'LETS HULKENGOOOO', 'I never thought this day would come!', 'Hearing him cry sent me\n\n5500+ days\n\n15 years and 239 races\n\nSo much adversity. I am so so happy\n\nAlso first podium for Sauber in 13 years!!!!', 'Best thing that happened all season.']",10127,344,0.99,10127,320,320,267,8,0.0,267
1lt7spk,"[David Coulthard via Instagram] ""We got a Hulkenberg podium before GTA6""",https://www.reddit.com/r/formula1/comments/1lt7spk/david_coulthard_via_instagram_we_got_a_hulkenberg/,2025-07-06, Social Media,,"['Hip with the kids eh dc?', ""Did he actually post this? That's amazing."", 'I see you old man I see you', 'My bad DC… I was unfamiliar with your game…', 'There is a non-zero chance that coulthard spends his spare time on gta online, griefing with an oppressor\xa0', 'Unc to unc', 'This is amazing', 'ONE OF US!!!', 'Drunk uncle DC with the memes again', 'Unc still got it']",9216,73,0.99,9216,70,70,1842,3,0.0,1842
1lt47eg,Driver of the Day: Nico Hulkenberg,https://www.reddit.com/r/formula1/comments/1lt47eg/driver_of_the_day_nico_hulkenberg/,2025-07-06, Statistics,,"['From 19th. In the rain. After 239 race starts. What a story. What a driver.', 'WELL FUCKING DESERVED. ONE STREAK DIES, AND ANOTHER WAS BORN!!!', 'anyone else crying', 'Now we know what was holding back all these years: good qualifying', 'Man takes his helmet off after two hours of wet racing and has perfectly styled hair. Well done you beautiful bastard, finally', ""It's awesome how everyone is just happy for him. Even Crofty/Brundle were just blatantly biased for him the whole race"", 'From P19 to P3 in a fucking Sauber - unreal', 'Who else?? \n\nWHO ELSE??', 'Absolutely deserved', ""My face hurts from grinning those last few laps. finally did it.\n\n\nbut omg that podium SUCKED.  what the were those two orange wet rags doing. By tradition and especially because how long this was coming hulkenberg should've been SOAKED.\n\nthat was the most mild first podium i've ever seen.""]",7970,164,1.0,7970,145,145,452,5,0.0,452
1lt6eln,"[Chris Medland] Piastri raises his hand in the press conference:

""I have a question for Nico: How does it feel to wait 15 years for a podium in F1 and it's made out of Lego and you can just pull it apart?!""

Hulkenberg replies: ""I like Lego! My daughter can play with it too!""",https://www.reddit.com/r/formula1/comments/1lt6eln/chris_medland_piastri_raises_his_hand_in_the/,2025-07-06, Social Media,,"['This is gonna take a while to sink in.\xa0\n\nAnd it’s just crazy because the year he gets a podium is literally the least likely it’s ever been for him to get a podium goimg into the season.\xa0\n\nAudi mean business.', 'Man, he’s must be on cloud nine right now (and it’s very much deserved)!!', 'Surprised they also wouldn’t give them a real one', ""I'm so happy for Nico man, dude was out of F1 for 2 years in the middle and then completely by chance he comes back as a place holder \n\nHe's earned this. He's always been good in the rain. I remember when he came back for the force India pink mercedes team to fill in for a Covid stricken Stroll, he put that pink Mercedes to p3 on the grid. I thought that was it, his main chance for a podium. But it wasn't meant to be, not hen ..\n\nBut today \n\nDamn man"", 'That’s such a wholesome answer from Hulk actually. Again just unbelievable moment for him.', 'Trophy is trophy.', ""I'm so confused by these comments, this question is clearly meant as a joke. Oscar was obviously happy for Nico, how can anyone see this as shady or butthurt? Lmao"", 'Get enough bricks and he can make that trophy much bigger.', 'I mean this clearly seems like a joking question, dont take it so serious', 'This has to be the highlight of many people’s career. Not just Nico but everyone whose ever supported him and all the teams']",7928,280,1.0,7928,265,265,1102,14,0.0,1102
1lt5hsl,"Gabi: ""Nico, it's Gabi. You have no idea how happy I am for you, you're a legend, absolutely insane what you did today, I'll be waiting for you on the podium"" Nico: ""Thank you buddy. Thank you very much, appreciate that from you.""",https://www.reddit.com/r/formula1/comments/1lt5hsl/gabi_nico_its_gabi_you_have_no_idea_how_happy_i/,2025-07-06, Video,,"['And made a little more special having Magnussen in the garage as well.', ""Gabi's first points last week, Nico's first podium this week. \n\nGreat run for these guys"", 'Sauber really are the feel good team this year', ""People forget how good Binotto was at every job he ever had at Ferrari that wasn't Team Principal. And he's intelligently delegated that off to Wheatley, who clearly has exactly what it takes for the TP role. It's a fantastic leadership structure there. Really glad it's paying off for the team."", 'You could see Gabi run to him while they were showing McLaren cekrbrate with Lando', 'This team has serious Apex GP vibes all around', 'I can’t believe this team isn’t a complete disaster anymore. Starting to love what they are building & looking forward to Audi', 'I love how they get along with each other. Such a great pairing.', 'Hopefully Audi can continue this trajectory', 'Bortoleto seems like a great person from what little i have seen from him outside of the car']",7070,136,1.0,7070,127,127,666,1,0.0,666
1lt4n8i,Nico Hulkenberg has outscored Max Verstappen in the last four races.,https://www.reddit.com/r/formula1/comments/1lt4n8i/nico_hulkenberg_has_outscored_max_verstappen_in/,2025-07-06, Statistics,"Hulkenberg since Spain: 31 points

Verstappen since Spain: 29 points

Just an interesting stat.","['you could make it sound even crazier by saying he himself outscored the whole red bull team over the last 4 races', 'HULK DOMINANCE WILL NEVER BORE FANS', 'Really funny too, because Nico has scored 6 points in Race 1 in Australia. Then 0 points up until Spain. Then 31 points in the last 4 races.\n\nThe Sauber upgrades really did work, especially on race pace. Quali still is an issue.', 'The true GOAT obviously', 'N1CO', 'Goatenberg clears Washedstappen.', 'Toto Wolff you know who to sign now... Hulkenberg 2026, 2027, 2028, 2029 WDC', 'verstappen washed???? hulkenberg goat???? surely the statistics never lie', 'move over Max, its the Nico era', 'Sauber brought upgrades in Spain - legit impressive how the team has been turning it around!']",6563,102,0.99,6563,100,100,724,7,0.0,724
1lt66d2,"Nico: ""Max was the first guy who came (to congratulate me). We (Max and I) go way back, you know, from karting days when we were teens. I think we have a lot of respect... I mean, I have a lot of respect for him, you know — what he does, what he stands for. A great human being.""",https://www.reddit.com/r/formula1/comments/1lt66d2/nico_max_was_the_first_guy_who_came_to/,2025-07-06, Video,,"['Nico a teen, max 3 years old.', 'The math is not mathing on this one. He’s like a decade older than Max.', 'Nico lost a few years there 😂', 'Hmm, Max was 12 when Nico got to F1', ""I think that's Jos, Nico."", ""The guy's head is spinning from the experience, give him a break guys! They travelled in the same karting circles when they were younger despite their age gap which is why he mistakingly labelled them both as teens."", 'Were they teenagers at the same time? That doesn’t seem right lol', ""I know they were close when they were in there karting days but Hulk got his years mixed up cause he's like 10 years older than Max lmao"", 'Apparently Max is waiting for him before they fly back together on Air Max', ""For everyone confused, when Niko was karting in the Netherlands he sometimes slept in Max´ bedroom when he visited, so yes they've known each other for a while.\n\nEdit: No they didn’t sleep in the same room, Hulk would sleep in Max room and Max would sleep in his Dads room or in the living room.""]",5943,168,0.99,5943,166,166,616,10,0.0,616
1lt4eyf,"[Rory Mitchell] Piastri radio as he crossed the line... Engineer: ""Oscar, I know how you feel about that. Let's talk about it once we're out of the car. Piastri: ""Yep, I think I'll get myself banned for the year if I say anything here. Thanks for the effort.""",https://www.reddit.com/r/formula1/comments/1lt4eyf/rory_mitchell_piastri_radio_as_he_crossed_the/,2025-07-06, Social Media,,"['The interview was stone cold. Oscar is super pissed', 'If I speak I’m in trouble\xa0\n\n— Jose Mourinho', 'Hes furios,', '2nd half of this season we will see dark Oscar unleashed', 'does Oscar have another generational tweet in him?', 'And it was a double whammy for Oscar, because even with the 10 second penalty, if Max hadn’t spun as a result soon after and let Lando through, then Oscar could have built more of a gap up front while Lando was trying to pass Max - as we had seen the previous two restarts. But both together just lost him the race. \n\nI don’t even know why he did that. It seemed clear Max was no threat from the previous restarts. Was so unnecessary.', 'silly from Oscar at the restart, gave away a win and points to his closest championship rival.. the gap between Oscar and Lando now down to only 8 points', 'Piastri villain arc starts now', 'Pretty much everything went against him today.\n\nBuilt a huge gap in bad conditions - FIA safety car\xa0\n\nBrakes hard under the safety car - 10 second penalty\xa0\n\nVerstappen drops it - Norris now has no one challenging from behind so he can just drive clean\n\nHe deserved the penalty, it was dumb. \xa0But I understand his anger', ""I wonder what he's being told internally. This is a really strange penalty to get bent out of shape over, seemed pretty obvious""]",5878,899,0.99,5878,422,422,279,44,0.0,279
1lt4c8j,"For first time since 2021 Azerbaijan Grand Prix, we have another German driver on podium",https://www.reddit.com/r/formula1/comments/1lt4c8j/for_first_time_since_2021_azerbaijan_grand_prix/,2025-07-06, Statistics,"Sebastian Vettel was last time.

Well done, Hulk, finally","[""And in green too.\n\n\nI'm crying guys."", '239th race. Wow', 'Nico doesn’t even know I exist and he’s got me emotional at his podium lol', 'Hulk podium? I see this as an absolute win', 'The best podium of the season!', 'The team celebrating him is probably tge most wholesome moment of this year', 'Vettel was technically on the podium in Hungary that year too (he got DSQ, but he was standing on the podium xD )', 'Incredible drive by Hulk, Sauber have quietly improved by absolute leaps and bounds.', 'Vettel linked twice to this race! Max shares the same amount of pole positions with Vettel at Red Bull Racing and now Hulkenberg being the next German on the podium!', 'I can cry for the man']",5562,45,0.99,5562,44,44,263,2,0.0,263
1lt3lyo,Hülkenberg overtakes Stroll for P3,https://www.reddit.com/r/formula1/comments/1lt3lyo/hülkenberg_overtakes_stroll_for_p3/,2025-07-06, Video,,"['STOP THE COUNT', 'Stop the count!', 'Imagine if he actually manages to get a podium, after more than 200 races... and his first F1 trophy is lego bricks.', 'HULLLLLLKKKKKKKKK', 'COME ON NICO', 'I WANNA CRY I WANNA CRY I WANNA CRYY', 'THIS IS NOT A DRILL', 'Hamilton has the opportunity to do the least funny thing of all time...', 'Stop the race right this instant.', 'Stop the race']",4696,181,1.0,4696,172,172,132,1,0.0,132
1lsyehh,"[Kymillman] Magnificent Appearance, 
A welcome return to the paddock for Kevin Magnussen. This is the first race he's attended since he left the sport at the end of last year. Despite leaving the sport, he still works with Haas as the team's test driver.",https://www.reddit.com/r/formula1/comments/1lsyehh/kymillman_magnificent_appearance_a_welcome_return/,2025-07-06, Social Media,[https://www.instagram.com/p/DLw1nnPgg1h/?utm\_source=ig\_web\_copy\_link](https://www.instagram.com/p/DLw1nnPgg1h/?utm_source=ig_web_copy_link),"['Oh God, imagine if Ollie gets 12 pen points', 'he came when Nico got P3, nice timing', 'I miss this combat racer', 'My king 😭', ""He's here for payback to sonny hayes' plan c"", 'The first and real combat driver', 'Dude probably inspired 90% of Pitt’s racing in the F1 movie. Let the creator cook is what I say', ""I didn't know he was associated with Haas still."", 'He is still racing in WEC in Hypercars. And he raced at the 24 hours of Spa. Both in a BMW with WRT.', ""Kmag is Nico's good luck charm""]",4145,97,0.98,4145,94,94,57,1,0.0,57
1lt4dvl,Gabriel Bortoleto's radio message to Nico Hulkenberg,https://www.reddit.com/r/formula1/comments/1lt4dvl/gabriel_bortoletos_radio_message_to_nico/,2025-07-06, Quotes,,"['Everything Sauber is just wholesome as fuck today and I love that for them', 'I honestly feel Gabi is one of the most interesting rookies this season, and it rly pains me to see him and the whole of sauber get so little attention. The whole sauber team this year is SO interesting and fun to follow', 'Feel good moment of the season by far', 'I also saw him sprinting on the background to give Nico a hug after he got out of the car', ""Gabi doesn't get a lot of promo on Sky, but he's such a great kid, and always comes across as super likeable."", 'In the camera shot with lando celebrating at the end, you could see him running to hulkenberg', 'Gabi and Nico are so adorable!\n\nWho’s cutting onions?', 'Even Magnussen was there to witness it. Teammate goals.', 'You could see Gabriel run past Lando on the broadcast to get over to Nico. So cool and so pumped for Nico and the whole Sauber team.']",4215,43,1.0,4215,39,39,434,3,0.0,434
1lt4q7z,Verstappen driving up to Nico after the race,https://www.reddit.com/r/formula1/comments/1lt4q7z/verstappen_driving_up_to_nico_after_the_race/,2025-07-06, Video,,"['Max genuinely celebrates for Nico!', 'He was also the first to congratulate Nico outside the car. For sure Max is very happy for Hulk', 'Gave him a big hug when Nico was getting out of the car too. You can tell Max is thrilled for him.', 'Travesty that Nico wasn’t soaked in champagne on the podium.', 'I dont think anyone is unhappy that nico is on the podium. Long deserved', 'Goat recognizes goat', 'That’s gonna be a “simply lovely” flight home for both of them.', 'He’s so excited, and also went over to congratulate Nico first as soon as he got out of the car. I love their friendship, glad Max was able to celebrate him even after such a frustrating race.', 'Spun, just to get his buddy his first podium. What a hero', '""Gefeliciteerd ouwe pannekoek!"" \U0001f979']",3930,168,0.99,3930,161,161,304,7,0.0,304
1lt4jas,"After Hülkenberg's P3 at Silverstone, Yuki Tsunoda is now the active driver with the most Grand Prixs without a podium (99)",https://www.reddit.com/r/formula1/comments/1lt4jas/after_hülkenbergs_p3_at_silverstone_yuki_tsunoda/,2025-07-06, Statistics,,"['We just enter Hulk era. Grand prix win is next.', ""Not even half of Hulkenberg's curse, puts into perspective just how insane that 239 race stat was"", ""stop he's already dead"", 'Every stat is a Red Bull second driver stat, even when you think it’s not it is', 'He was almost lapped by Nico btw\n\nOr Nico actually lapped him', 'Don’t steal Adrian Sutil’s glory', 'It will be much more than 99 I’m thinking', 'Sidenote - next race he will become the first Japanese driver to start 100 races.', 'Bruh', ""It's Grands Prix, not Grand Prixs""]",3869,195,0.99,3869,188,188,355,9,0.0,355
1lt4xo9,Nico Hulkenberg steps onto the podium!,https://www.reddit.com/r/formula1/comments/1lt4xo9/nico_hulkenberg_steps_onto_the_podium/,2025-07-06, Video,,"['I dont think a single person is unhappy with a hulk podium', 'Just imagine you finally get a Podium and your Trophy is LEGO', 'Anyone else see Norris almost break the Lego trophy in half by lifting it sideways lmao', 'Image of the year', 'Insane that of all the times he could get a podium, he does it from starting p19 in a lime green “tractor”', 'This still feels like a fever dream. So happy for Nico and all his fans, just a shame about his piss-poor trophy to commemorate a heroic drive from P19 to the podium.', 'And McLaren pretty much ignored him :(', 'Nico with that cheeky ☝🏻 but fuck it, it does feel like a win! \U0001f979', 'beautiful sexy smart handsome hunky hulkenberg', 'Love how r/formula1 has updated its avatar... Lovely touch!!']",3790,96,1.0,3790,91,91,232,0,0.0,232
1lt5mq2,Sauber score their first podium since Kamui Kobayashi got 3rd place at the Japanese GP in 2012,https://www.reddit.com/r/formula1/comments/1lt5mq2/sauber_score_their_first_podium_since_kamui/,2025-07-06, Statistics,"What a turnaround for Sauber this year since the Barcelona updates. They were one of, if not the weakest team of this regulation but they finally made the jump back to the front of the midfield.

This is their first podium finish since Kobayashi at his home race in Suzuka 2012.

Also shoutout to Kamui, his career was too short. This 2012 Sauber with Kamui and Checo was magical sometimes. Happy to see the Sauber name back towards the front.","['Two Le Mans winners. Two podium sitters.', 'Cant believe its been so long, both of the podiums are absolutely legendary as well', 'Every team has gotten a podium since Haas’ debut besides Haas', 'One of the best highlights of this season', 'the weirdest thing about the 2012 Sauber was that Chelsea logo on the car.', 'Hulkenberg’s first F1 trophy is made of legos\n\nEdit: added F1 trophy', 'This was a long time coming; he has been a great talent and deserved it every bit!', 'A Sauber podium is always so unexpected and a day for celebrations.', ""I'm really happy Peter Sauber got to see his team get a big result before the handover."", 'Two very likeable underdogs. Grande Nico and Kamui 🏆']",2963,59,1.0,2963,59,59,205,4,0.0,205
1lt4i0x,Nico Hülkenberg celebrating his first podium with his team in parc fermé,https://www.reddit.com/r/formula1/comments/1lt4i0x/nico_hülkenberg_celebrating_his_first_podium_with/,2025-07-06, Video,,"['Wholesome as fuck.', 'Best thing from the race today by far', 'Long overdue. Well deserved.\n\nSo happy for Hulkenberg. Finally broke that podium curse.  \nIN A SAUBER!', 'And today, we were all Stake Sauber fans.', ""Nico not knowing that he's meant to take his helmet is so cute"", 'The most wholesome podium this year. No doubt\xa0', 'NICO NICO NICO 🗣️', 'I’ll always thought ‘19 German GP was his last chance, and now he did it with Sauber. That’s a life story that we all need so happy', 'The peoples winner today. Sans friends and family, no one cares about Lando winning today lmao. HÜÜÜÜÜÜLKENBEEEEERG', 'So insanely happy for Hulk. I thought he was retired for good a while back, and here he is with his first podium ❤️']",2918,66,1.0,2918,61,61,132,1,0.0,132
1lt49q5,"Most race starts without a podium (Adrian Sutil, 128)",https://www.reddit.com/r/formula1/comments/1lt49q5/most_race_starts_without_a_podium_adrian_sutil_128/,2025-07-06, Statistics,Got back on top,"[""That's a name I haven't heard in a long time."", 'the dark days are finally over', 'Why is it always the Germans?', ""It's a bit cruel but my first reaction was that this is a much more suitable holder of this particular record."", 'Another Sauber driver 😭', 'Next active driver on the list is Tsunoda, but I’m not sure he’ll make it 27 more entries…', ""Give him the Mercedes drive so this can go back to it's right holder: Pierluigi Martini"", 'Another force India guy', 'German leaves the top, now a german leads the stat', 'and his last race was for Sauber']",2739,131,1.0,2739,122,122,118,9,0.0,118
