unique_id,post_heading,post_url,publish_time,tag,post_content,top_comments,upvotes,comments,upvote_ratio,score,total_upvotes_comments,total_score_comments,upvotes_growth_rate,comments_growth_rate,upvote_ratio_growth_rate,score_growth_rate
1lt5yw7,Throwback to when Hülkenberg got his first pole in 2010,https://www.reddit.com/r/formula1/comments/1lt5yw7/throwback_to_when_hülkenberg_got_his_first_pole/,2025-07-06, Video,,"['Oh, so many expectations for him. Was really painful to follow his carrier since! So happy for the dude today!', 'Now all we need is a race win.', 'Today everyone in F1 is united as a Hulkenberg fan. Love it.', 'I remember watching this live.\n\n... what do you mean that was 15 years ago?', 'Until today, he was the only driver ever to be a polesitter but never score a podium.', 'Turns out all you had to do was put Hulk in green for him to get a podium. Plus a Lego trophy he can smash.', 'rare rubens appearance', 'It’s funny on the Channel 4 broadcast post-race\xa0Claire Williams mentioned she was Hulk’s press officer at the time and when he got pole both of them had no idea where to go or what the procedure was', 'I still remember that lap, he made 2 laps that day blog would have been good for pole, he was so insane on GP2', 'Next is the first win; no pressure!']",785,23,0.99,785,21,21,29,0,0.0,29
1lt2nwk,Leclerc complaining about water coming inside his visor,https://www.reddit.com/r/formula1/comments/1lt2nwk/leclerc_complaining_about_water_coming_inside_his/,2025-07-06, Video,,"['Him driving just straight on was so funny', 'Say the line, ~~Bart~~ Bryan!', 'Obligatory ""Must be the water"" comment', 'They write themselves', ""Charles' drink is broken, so Ferrari told him to drive over some water to get a drink"", 'Must be the water', 'Bryan chickened out.', 'Dude got a lap full of water earlier this year, now his visor is full of water. Dude is going to have a lot of words of wisdom regarding water soon', 'fuck track rules, charles is coming through!', 'Ferrari\n\nYou keep ruining my weekends']",766,52,0.99,766,46,46,17,1,0.0,17
1lt595f,Driver Standings post British GP,https://www.reddit.com/r/formula1/comments/1lt595f/driver_standings_post_british_gp/,2025-07-06, Statistics,,"['No way we’re going to get a Hülk best of the rest', 'Albon and Nico best of the rest is so satisfying', 'Russell’s wrong decision really stopped him capitalising on Verstappens mistakes', ""Didn't realize the gap between hamilton and leclerc was so close now. P3 looking like it could be a 4-man race depending on how the Red Bull holds up."", ""I've been surviving on quite a bit of copium these last few weeks but I do think after this weekend it's finally time to stop believing Verstappen can still pull off a miracle."", 'I hope the title decider goes down to the last race!', 'Crazy to think that Lawson was “demoted” at the beginning of the year and has more points than his replacement.', ""The fight betweeen piastri and norris is on after these two races. I'mma be expecting a whole lot different race between MCL39s by SPA"", '12 races down, 12 races to go\n\n8 points between Piastri and Norris\n\nPiastri - 5 wins (won 4 of the first 6 races), (2)2nds, (3)3rds, 1(4th), 1(9th)\n\nNorris - 4 wins (won 3 of the last 6 races), (4)2nds, (1)3rd, 1(4th), 1(18th)', 'Papaya war is heating up']",704,183,0.99,704,175,175,37,3,0.0,37
1lt4jww,Oscar Piastri post-race interview,https://www.reddit.com/r/formula1/comments/1lt4jww/oscar_piastri_postrace_interview/,2025-07-06, Video,,"['this man is angry af', ""Oh he's entirely chalant for once"", 'he’s going to murder a steward tonight', 'If I speak...', '""I\'m just here so I don\'t get fined""', ""The contrast between him and Lando looking the happiest I've ever seen him was hilarious"", "">Well done to Nico I think that's the highlight of the day.\n\nSomehow saying the Hulk podium was the highlight of the day was simultaneously completely true but also so petty at the same time, lol"", 'I am not sure, but he is not happy.', 'Piastri failed the quick time event', 'He is FURIOUS']",639,390,0.97,639,299,299,4,4,0.0,4
1lt4ynx,Mohammed Ben Sulayem removes Britain's FIA Senate representative,https://www.reddit.com/r/formula1/comments/1lt4ynx/mohammed_ben_sulayem_removes_britains_fia_senate/,2025-07-06, News,,"['""I am the Senate"" - Emperor MBS', 'Hulkenberg podium and some talk about Piastri.\n\nQuick release the news to hide it', 'Nothing dodgy about that. No sir', 'Palpatine making moves again', 'Classic move, announce a scumbag change while something is distracting the audience. This man has no shame', 'All my homies hate MBS', 'FUCK MBS', '>""As far as I am aware, I haven\'t fallen out with him...I have written to him for clarification and I haven\'t had a reply. I\'m a great believer in transparency and good governance.""\n\nDude you just answered the clarification yourself.', 'Power tripping shithead.', ""This will kill MBS. Once you start fucking over key support, it's knives out""]",582,111,0.96,582,92,92,20,4,0.0,20
1lt4mr7,Nico Hülkenberg has given Sauber their 11th podium after 13 years.,https://www.reddit.com/r/formula1/comments/1lt4mr7/nico_hülkenberg_has_given_sauber_their_11th/,2025-07-06, Statistics,,"['I miss 2012.', 'Incredible scenes and celebrations at Sauber! Love to see it', ""BMW Sauber podiums don't count?"", 'Malaysia 2012. Oh my, what it could have been...', 'Frentzen was elite, when driving mid table cars or pure shitboxes.', 'There seems to be quite a lot missing between 2003 and 2012', 'Frentzen from the first podium was there! (In the Williams box though)', 'I thought Kimi Raikkonen got give sauber podium', ""Can't believe 2012 was 13 years ago."", ""Bmw deserves only hate. They had a title contender in 2008 and they drop development after Kubica's win to focus on 2009 to then drop the ball and retires from the sport. Boo that brand! Boo them!""]",543,33,0.99,543,33,33,13,2,0.0,13
1lt4org,Cooldown room | 2025 British Grand Prix,https://www.reddit.com/r/formula1/comments/1lt4org/cooldown_room_2025_british_grand_prix/,2025-07-06, Video,,"[""Hulk didn't know the helmet procedure because he was never in the cool down room before lol"", 'When Hulk told Oscar his sudden braking made things sketchy further back, lol', 'Lando asking Nico “how’d this happen” is so funny', ""That awkward silence when Piastri's braking incident replayed on the screen..."", 'Lando bringing Nico’s helmet lol', 'The stone cold silence as they show Oscar braking behind the SC', ""Nico explaining the effect of Oscar's braking is pure 👌"", 'Nicos just happy to be there and piastri is fuming 😂', ""That moment Lando brought Nico's helmet in was so sweet"", ""Thank you - Channel 4 decided it'd be clever to play adverts instead.""]",532,156,0.98,532,152,152,14,2,0.0,14
1lt2i9t,Colapinto car breaks in the pits before the start of the Silverstone GP,https://www.reddit.com/r/formula1/comments/1lt2i9t/colapinto_car_breaks_in_the_pits_before_the_start/,2025-07-06, Video,,"['clutch failure, same as Barcelona, that car is cursed', 'What’s more cursed, Alpine or the second Red Bull seat?', ""Thanks! I was wondering why he was out, and the commentators didn't say anything, nor they showed it. Poor guy..."", 'Didn’t this happen to Gasly here last year?', 'Just Alpine things.', ""I really do feel for Franco - he had such an explosive start last year, and it just isn't working out this year. :("", 'Flavio has to go', 'Has there been an explanation released on what happened?', 'Alpine is so ass', ""they didn't mention it on tv, I was a bit worried because they don't show it when it's serious. I'm glad it was nothing.""]",522,109,0.99,522,62,62,3,3,0.010000000000000009,3
1lt8rcu,Mercedes brought champagne to the Sauber motorhome,https://www.reddit.com/r/formula1/comments/1lt8rcu/mercedes_brought_champagne_to_the_sauber_motorhome/,2025-07-06, Video,,"[""You can tell they haven't had much chance to spray champagne!"", '""We won\'t be needing this""', 'Wholesome F1 will always be my favorite F1.', 'These are the moments we watch for. Gotta love it.', ""Sauber didn't have any, so they ask other teams. Aston Martin's champagne was already at there at that time."", 'Binotto is cooking', 'Honestly every team not named McLaren should bring their champagne to Stake and join the celebration.', 'Should have been Ferrari, their engine supplier.', 'It’s a looong weekend, and most of the worker are probably a short drive away from their homes, for once.', 'Max told Toto to go send his friend some gifts\xa0']",539,26,0.98,539,25,25,106,8,0.0,106
1lt4feo,"[WilliamsRacing] That's a wrap on the British GP. A tough race in changing conditions, but we add another four points to the tally",https://www.reddit.com/r/formula1/comments/1lt4feo/williamsracing_thats_a_wrap_on_the_british_gp_a/,2025-07-06, Social Media,https://www.instagram.com/p/DLxZjdeuugq/?igsh=bXpjamp0dzRuZHV0,"['They both finished. ILL TAKE IT.', 'anyone see what happened to Sainz to be so low? He was ahead of Albon and the Haas when the two Haas crashed', 'Good race from Alex to take some points!', 'The only time they were shown on screen were being divebombed by Charles. Yet Charles helped by finish behind BOTH of them lol', ""Sorry Alex I'm German today"", 'Both cars got across the line. \n\nToday is a good day', 'Solid drive from Albon today! It’ll be rightfully overshadowed by the Hulk podium, but P8 after 3 dnfs feels like a win.', 'alex points are back in business baby yippee!', 'Albono overtaking alonso. Highlight of the williams weekend.']",501,57,0.99,501,53,53,0,3,0.0,0
1lt5v7p,Points gained by each team since the Spanish GP,https://www.reddit.com/r/formula1/comments/1lt5v7p/points_gained_by_each_team_since_the_spanish_gp/,2025-07-06, Statistics,,"[""People were hoping for the TD to nerf the McLaren and instead they've got 3 out of 4 possible 1-2's lmao"", '35 points for Sauber, amazing the progress they have made this season so far.', ""So, the speculated clause in Max's contract is about team position or driver position in the championship or both?"", ""Less than 2 years ago Red Bull were slapping the crap out of everyone. The collapse would be generational if they didn't have Max."", 'what happened to the last post?', 'Williams back to being Williams', 'From McHonda to this. Oh how good it feels', ""How did McLaren improve so much? Didn't watch for a longer time now but they usually were behind other Teams, they win against Red Bull which was the strongest Team back then"", 'Sauber on track to take 4th in the Constructors Championship']",494,53,0.98,494,49,49,23,0,0.0,23
1lt8jtz,Nico Hulkenberg's Emotional Podium Finish | 2025 British Grand Prix,https://www.reddit.com/r/formula1/comments/1lt8jtz/nico_hulkenbergs_emotional_podium_finish_2025/,2025-07-06, Video,,"[""This could be the most wholesome podium since Checo's first win"", 'He deserved it so much', 'Last time I was this happy was Baku 2021 when Vettel was on podium … congrats to him, he deserves it 100%! I bet he would have been a title contender if he had a better car', 'All it took was to finally put The Hulk in green.', 'Well done Nico! SO happy for you!\n\nMaybe now you’ve got a podium finish they’ll actually respect you enough to spell your name correctly. Seriously - how hard is it to type ü FFS?! 🤦\u200d♂️', ""I'll always remember where I was when the Hulkster smashed onto the podium in front of 160,000 screaming Hulkamaniacs at the ~~Pontiac~~ Silver~~dome~~stone"", 'Hulkengoat', '2min39 is a nice touch', 'I am so so so happy for him. His podium less run was one of the most painful things in nowadays F1. Hulk deserved that podium more than anyone. He is still operating at such a good level at the age of 38 and 15 years since his debut. Finished in the top 10 in the Haas last year and just recently - fifth place in Spain was already amazing, great runs in Canada and Austria, top 10 in WDC, it was already great but this is just unbelievable.\n\nAnd it was a podium in great style, coming from the back and eventually beating off improved Hamilton in a Ferrari on his home ground and everything just falling into place for once. Not some DSQ and penalties giving him post-race podium or even some controversial red flags/restarts giving him that podium like it could at Australia 2023.', 'As Danny Ric said, Huuuuul… kenberg!\n\nhttps://youtu.be/FfoUQvMRY94?si=rXwn8jbwyeRQugrt']",504,22,0.99,504,19,19,56,0,0.0,56
1ltab8y,[Alex Albon] Alboints! And congrats to Hulkenberg!,https://www.reddit.com/r/formula1/comments/1ltab8y/alex_albon_alboints_and_congrats_to_hulkenberg/,2025-07-06, Social Media,IG: https://www.instagram.com/p/DLx1CtkNGPA/?igsh=amVtMzR5YmE4em1m,"['Albon may not have won the race but clearly he’s already won in life.', 'Wow Alex and the second girl have the same face. Can definitely see the family resemblance', 'No amount of inept strategy calls can stop Alex Chadbon!', ""Quietly having an incredible season. 46 points to Sainz's 13"", 'My boy is thriving, brings a tear to the eye.', ""Zoe(2nd on the left) is the spitting image of him lmao. I can't unsee it."", 'If anything can happen this season, I hope Albon gets a podium this year 🤞', 'He did great work to get points amongst all the chaos in that race.', 'So happy for him to leave for the break on a high after that horrific dnf streak! Did a great clean drive with a lovely last minute overtake on Alonso to get 8th :)', 'Unironically the funniest driver on the grid!']",533,37,0.98,533,34,34,158,16,0.0,158
1lsw2nr,Track diagram of Silverstone Grand Prix Circuit in the UK showing evolution from 1949 to present.,https://www.reddit.com/r/formula1/comments/1lsw2nr/track_diagram_of_silverstone_grand_prix_circuit/,2025-07-06, Technical,"Made to scale from aerial photographs.

Credit to Wiki user McKayF1 (Tom McKay)","[""I still can't get used to not having the S/F line before Copse despite it's a long time ago it was adjusted."", ""It's interesting that it's sort of the same but actually none of the corners are the same as the original layout."", '1948 with just a few straw bales in the middle of the X', 'Bridge was a fearsome corner.', 'I prefer the 1997 version, trough Bridge', ""The pre-2010 layout was more exciting over one lap but I have to say, the new layout is much better for racing.\n\nEspecially now that Abbey and Copse are flat. It's pretty easy to follow around here now."", 'I miss Bridge', ""Dear people who criticize 'airfield tracks'... Well here's what you can do with airfield tracks."", 'For me 91 was peak. Still not sold on the new 2010 parts or the start/finish not being after Woodcote.', 'r/MapPorn/']",480,37,0.98,480,337,337,5,1,0.0,5
1lt2st9,"Alonso: Other people we have lose places, do they have worse tyres or do we lose places for fun?",https://www.reddit.com/r/formula1/comments/1lt2st9/alonso_other_people_we_have_lose_places_do_they/,2025-07-06, Video,,"['Father Nando is not mad just disappointed.', 'Mónaco 2023 pain still there', ""Why everyone is saying AM should've gave Alonso Stroll's strategy? Lance Stroll started 17th, Alonso started 7th, obviously it's the wise choice to gamble with Stroll than Alonso. It's just lucky that the gamble worked out and he gained position. Ocon is on 1st stint so Alonso is basically 8th anyway."", 'I mean they clearly gambled on a split strategy which worked spectacularly for Stroll, not much more to say. Fernando is sadly really unlucky.', 'It’s the same thing they did in the Miami sprint\n\nIgnored the conditions for Alonso while giving Stroll the prime strategy', 'Well he got what he wanted now. But you gotta be the rain goat Lance to drive slicks on the wet.', 'If they had done the stroll strategy with Alonso, he would easily be in P2, how eager to ruin everything', 'I dont think i hate my job as much as Fernando seems to hate being an F1 driver', 'Alonso getting the same strategy as all the people at the top but him and his fans complaining as if they were sandbagging him', ""Didn't alonso get same strat as mclarens and max? Why is he crying so much?""]",445,53,0.98,445,51,51,0,0,0.0,0
1lt40hj,Verstappen not happy with his car on the radio,https://www.reddit.com/r/formula1/comments/1lt40hj/verstappen_not_happy_with_his_car_on_the_radio/,2025-07-06, Video,,"['He’s so gone', 'Max to Haas confirmed', 'Just a tad pissed off.', 'I mean we kinda expected that as he made low drag setup for dry, thats why he was so quick on saturday but today he just has no grip with that setup', 'He is pissed off', 'Oh he’s gone', ""I've gotta wonder how much he actually complains, i imagine tv direction is more eager to show messages like this right now too"", 'The fact that he’s managed to even get pole is something special itself', 'Tsunoda just chilling at the back the entire race probably says more than anything', 'Max to front runner Stake Formula 1 Team Kick Sauber confirmed']",437,171,0.97,437,151,151,3,1,0.0,3
1lt4if5,"[visacashapprb] Tough race. Both boys retired from the British GP after separate incidents on track, but the important thing is they are both ok!",https://www.reddit.com/r/formula1/comments/1lt4if5/visacashapprb_tough_race_both_boys_retired_from/,2025-07-06, Social Media,,"['Could’ve posted this earlier', 'Disastrous race', 'This is a brilliant decision by Hadjar. Now Red Bull won’t consider him for promotion for atleast three more races', 'Intern even forgot to change the GP name. ""Austrian"" at the bottom there', 'Liam Lawson might be the unluckiest driver in the grid this year. 4 DNF with 3 being not his fault whatsoever', 'They’re a team with two rookie drivers, and it showed today.', 'It was that damn paint job', 'I was expecting them to embarrass Redbull after Friday. Usual vcarb things', ""Disasterclass. Two rookies in their team wasn't really good for this race"", 'vcarb waited til the end of the race for whatever reason']",429,28,0.98,429,27,27,1,0,0.0,1
1lt80pm,[Stake F1 Team via IG] NICOOOOO HUUUUULKENBERG! The warmest welcome back to the motorhome for our number 27!!,https://www.reddit.com/r/formula1/comments/1lt80pm/stake_f1_team_via_ig_nicooooo_huuuuulkenberg_the/,2025-07-06, Social Media,,"[""Disappointed Gabi didn't come out wearing just a towel!"", 'Find someone who hypes you up as much as Gabriel Bortoleto does Nico Hülkenberg', 'Nico our hero.   One of the most enjoyable P3 finishes I have seen as an F1 fan.', 'Man, I thought I would never see this Moment. I am so happy for him and the whole Sauber Crew.', 'I’m glad he got some proper champagne spray. Im so surprised that the McLaren boys didn’t absolutely drench him!', 'I’m glad his team made up for the disgraceful job McLaren did of spraying him on the podium. WTF was that.\xa0', 'Source : https://www.instagram.com/reel/DLxp3yBMrQq/?igsh=MW15eW0zczV0bDh5MA==', 'I don’t know if this link is working or not, here’s the updated link though- https://imgur.com/a/RDwqhBx', 'This is so wholesome', ""NIco's on fire, Hamilton is terrified""]",451,20,0.99,451,20,20,55,2,0.0,55
1lt0w0q,[Autoracer IT] Ferrari CEO Benedetto Vigna has told Sky Sports that the team is in contract renewal talks with Team Principal Fred Vassuer,https://www.reddit.com/r/formula1/comments/1lt0w0q/autoracer_it_ferrari_ceo_benedetto_vigna_has_told/,2025-07-06, News,,"['Just keep him. He’s not the problem. Others need scrutiny like Togninalli.', 'So they are swapping Vasseur with his evil brother', ""I'm sure Hamilton wants Fred to stay"", '[Fred hearing that he was under threat](https://www.youtube.com/watch?v=u536v8QppTI)', 'Binotto had 4 meh seasons with cherry on top being 2022. Vasseur brought better results in three. It would have been wild to get rid of him.', ""Won't be surprised if there is a repeat of Todt 1996 situation. Charles and Lewis may have told we leave if Fred leaves and Ferrari backed down. But Fred needs to improve communication from the team and be more open even if team makes mistakes."", ""Original article is in Italian. And headline doesn't comes to the point after translation. Tried to keep it brief, as much as I could"", 'Good. \n\nFred is not the issue. I really appreciate how hard charles & lewis backed him, and I imagine that made a difference.', 'I only trust this when the contract has been finalized.', 'Lewis and Charles both support Fred, so im finding it hard to see why they wouldn’t renew him. The issue with Ferrari the past few years has been the technical engineering aspect not really the morale']",435,29,0.99,435,28,28,6,0,0.0,6
1lt6jse,Driver Championship is Getting Very Close. Top 2 Differ by Just 8 Points,https://www.reddit.com/r/formula1/comments/1lt6jse/driver_championship_is_getting_very_close_top_2/,2025-07-06, Statistics,,"[""Let's go.  \nWe want fight"", ""Every season people are just calling championship decided way too early. This will be a close one. And it's gonna get nasty as we get closer to the end... and I'm here for it."", 'And exactly halfway. Going to be a fun second half.', 'Have Williams and Sauber ever been competitive upper midfield teams at the same time?', ""69 points... I'm getting the feeling Max isn't going to be the world champion this year."", 'I just want it to be a fight all the way. Oscar or Lando winning it with a few to go would be kind of anti-climatic. Plus more drama equals more chances for shock winners and podiums', 'That crash by Norris was costly. Would be ahead by 2 points.\xa0', 'This is what I signed up for. A close Papaya War. If a team has to be dominant, this is how you keep the season good.', 'I know half of you are waiting for a Rosberg/Hamilton styled rivalry, you evil people.', ""I much prefer these championships. I don't care if 1 team is dominating if both drivers are fighting it out. \n\nNot knowing the result after the 8th race is refreshing.""]",433,113,0.95,433,102,102,11,7,0.0,11
1lt2xj9,Safety Car deployed due to Hadjar crashing into the rear of Antonelli + replay of Hamilton overtaking 2 on safety car restart,https://www.reddit.com/r/formula1/comments/1lt2xj9/safety_car_deployed_due_to_hadjar_crashing_into/,2025-07-06, Video,,"['Great control from Antonelli to not end up in the wall', ""Rookie carnage today. \n\nYou couldn't even see the brake light of Antonelli until he hit him in all that spray."", 'Are we going to have anyone left by the end of this race', 'Will this race ever end in these conditions?\n\nAlso a through goes hamilton moment again', 'That was genuinely a jumpscare, he just appeared', 'rookies having a rough time in these conditions', 'Antonelli got a free prostate check from Hadjar', 'Another side effect of using a SC when it rains too much. At least before they were spread out, the SC puts them all together which just multiplies the level of spray.', 'Cannot blame Hadjar there. I was struggling to see Antonelli myself until the contact made', 'Who would have thought this could happen if you bunch up the entire field and heavily worsen the spray for the backmarkers? Instead of just using the VSC which has literally been invented because of an accident in wet conditions.']",432,144,0.99,432,140,140,5,1,0.0,5
1lt5dl2,Team Standings post British GP,https://www.reddit.com/r/formula1/comments/1lt5dl2/team_standings_post_british_gp/,2025-07-06, Statistics,Kick Sauber jumping from 26 points in 9th to 6th!,"['Bottom half fight is good this year. A lot of teams and drivers in amongst it every week. Good stuff.', '19 points is pretty high number for last placed team', 'Hulk single handled Sauber to six place', ""What's the earliest McLaren can win the constructor's?"", 'F1 - McLaren\n\nF1.25 - Ferrari vs Mercedes vs Max Verstappen\n\nF1.5 - Williams vs Nico Hulkenberg vs Racing Bulls vs Aston Martin vs Haas vs Pierre Gasly', 'Massive win for Sauber. Given them a massive gap to the bottom 2', 'Ferrari in a solid P2 is pretty surprising.', 'I’m just amazed by this. How do McLaren have such a huge advantage in year 4? of these regulations! Even if Red Bull double Max’s points they’re 80points behind.', ""So Sauber could beat Williams before end of the year.. that's crazy"", 'sauber in p6 is so funny good for them']",423,110,0.99,423,108,108,12,1,0.0,12
1lswb57,The amount of helicopters going to and from silverstone on race day always make me chuckle,https://www.reddit.com/r/formula1/comments/1lswb57/the_amount_of_helicopters_going_to_and_from/,2025-07-06, Discussion,,"[""It's OK because I'm drinking from a paper straw."", ""My first reaction was it can't be that funny but I decided to go on Flightradar 24 myself and actually did laugh when I zoomed out to see the wider air traffic in the country; [you don't even need to know where Silverstone is on the map too find out where it is based solely on that concentration of helicopters.](https://i.imgur.com/zIWxLgt.jpeg)"", '£1600 to park and fly if you fancy it\n\nhttps://www.silverstone.co.uk/events/formula-1-british-grand-prix/getting-here', ""Don't forget to switch off the lights whenever possible and to feel guilty every time you start your 1.4 litre car engine!"", 'Just remember who the real problem is with regards to climate change', ""Many years ago I heard the claim that on race day Silverstone becomes the busiest airport in the world.\n\nI've never verified that and it was a long time ago."", 'Mating season', 'I live in an area south of Silverstone and judging by the multiple helicopters I heard blaring away at 8-9am this morning, checks out', ""Yeah the helicopter noise is pretty full on. Even sitting at Stowe. They're constantly coming and going through all of the races. Not sure who still needs to arrive within the last 10 laps of the GP... well from last year's experience"", 'Yeah but let’s switch the engines to 50% electric for the environment…']",396,63,0.97,396,662,662,-4,0,0.0,-4
