unique_id,post_heading,post_url,publish_time,tag,post_content,top_comments,upvotes,comments,upvote_ratio,score,total_upvotes_comments,total_score_comments,upvotes_growth_rate,comments_growth_rate,upvote_ratio_growth_rate,score_growth_rate
1hcaaf6,Question for older fans about Vettel,https://www.reddit.com/r/formula1/comments/1hcaaf6/question_for_older_fans_about_vettel/,2024-12-12, Discussion,"I'm a new fan this year, so I don't have a ton of context about Vettel's career or previous eras of F1.

With Verstappen's 4th WDC, there's been a lot of conversations online about how important/rare that number of (+ run of consecutive) championships are and discourse about whether or not Verstappen should be added to the list of ""GOATs"" yet. I generally think the GOAT discourse is nonsense, but it made me curious this time because: Why is Vettel not generally included when people talk about the greatest drivers?

To the best of my understanding, his stats are pretty good (like, consecutive championships are rare, he held the consecutive win record before Verstappen, 4 titles is *very* rare). Is there some context I'm missing? Is it just nostalgia bias where people are reluctant to induct a ""new"" guy into the ""good old days"" club? Are his titles less impressive than other champions' titles for some reason?

Thanks! Always looking to learn more about F1 :)","['I saw Vettel race in 2004 in Formel BMW and he was already a class of his own there. In 2008 he jumped into the limelight with his superb win in Monza and he build from there. Now specifically in 2011 and 2013 there wasn’t much competition (like Max had last year), with Vettel in the best car and his teammate just not at his level. His 2010 and 2012 titles were fantastic. His ‘GOAT status’ however got a hit in the seasons after, a bit like Lewis the last couple of years. In all, a fantastic driver, and he matured into a very likable guy the last years.', ""Getting matched by Ricciardo in 14 and then beaten by Leclerc in 19-20 really did a number on Vettel's legacy. Plus, his incapability in mounting a full challenge to Hamilton in 17-18. Add to that the perception of being a one trick pony (i.e. master of Newey's blown diffuser design) and you get the picture."", ""It didn't help that when he was at his most successful, he was also at his least likeable."", ""Other things that impacted Vettel career:\n\n2014 Vettel became a father (same year Bianchi died), and becoming a father tends to make you risk averse. \n\nJoined Ferrari which was not as stable as under the Montezemolo, Todt, Brawn years. Remember Alonso was there previously and couldn't make it work. Nobody doubts Alonso driving skills. \n\nVettel did not have a manager, and while that works in certain situations, it can backfire in others. If he had a good manager during his time at Ferrari, it would have ended differently. Someone like Briatore or Willi Weber would have never allowed Vettel to be treated the way Ferrari publicly did. Teams like Ferrari have a lot of internal politics, and a driver in this case needs a manager to navigate the politics and do the dirty work."", 'He was simply much more error prone than Max. He was a fantastic driver otherwise but if you’re comparing him to the GOATs it’s a pretty fatal flaw. I would recommend an F1TV subscription where you can watch the entirety of Seb’s career in full. \n\nYou’ll see critical errors like how he took himself out in Turkey 2010 trying to pass his team-mate, throwing away an easy victory in Hungary by flouting the safety car rules and his absolute mare at Spa. \n\n2017 it was a big ask to win the championship but he let Lewis off the hook massively with his start line move in Singapore, a track where Mercedes were known to be weak. He had a great year otherwise but that was a basic, unforgivable error that wiped out any title hopes he had in an instant.\n\nIn 2018 his crash in Germany was huge and it felt like he unravelled mentally after that with the pressure Lewis put on him. Ferrari made huge gains with the PU from Spa onwards but he made an error at Monza understeering into the side of Lewis on the first lap, with Lewis going onto beat Kimi to the win. Lewis then had arguably the weekend of his life in Singapore and the mistakes kept flowing from Seb through 2019, which is arguably the main reason Leclerc beat him that year.\n\nSome people will point to Danny Ric beating him in 2014 as a reason why Seb isn’t one of the best but I think that was simply a down year for Seb. In his championship years he had this hyper aggressive counter intuitive driving style that the blown diffusers really helped him hone. When the 2014 reg changes took that away, he needed the time to adapt. He went on to (at times at least) thump Raikkonen almost as convincingly as Alonso had done and that tells me Seb had all the ability in the world, I just don’t see at all that Ricciardo was fundamentally better. It’s a shame we never got to see a rematch to prove this theory.', ""I did not go look up stats, nor did I fact check anything I'm about to say, and I haven't watched replays of his career so this is entirely my subjective perception, ripened in my mind all by itself.\n\nVettel was annoyingly good in the RB. I was really annoyed with it at least, and I think he suffered from Schumacher-backlash as well. Together these things made that people would grudgingly admit he was the best than openly admire and extoll his virtues. Vettel only really became well liked outside of Germany after his RB years. Maybe this is one way in which his legacy is subdued, the people who saw him at his best might have been emotionally invested in seeing him fail.\n\nBut he was winning so much because he had some really undeniable strengths. He was a great qualifier, great starter and generally executed brilliant first laps, in laps and out laps. Especially the latter, his ability to feel out a car that's not yet in its performance window, is a champion's skill. At the time, he also had an iron mind, always thinking and unwavering determination. I remember him being spun round in the first lap in one of the final races of the season (or possible THE final) and cheering massively because I was hoping Webber would win the championship as a result, but then seeing Vettel coasting backwards, constantly making steering adjustments to avoid further contact and gather it up on the tarmac. Mid-crash, he was already working on the recovery drive. Seeing Max vs. Norris this season has only cemented my memory of how unimpeachable Vettel was back then; no one was consistent enough to snatch it away from him even at times when RB wasn't on top, true back then and true this season.\n\nWhat Vettel could not do post-RB however, was consistently outdrive the car. Drag a shitbox into big points. And that is in my opinion the sole reason why a driver like Alonso is rated higher than Vettel, despite similarly only having undisputed supremacy in one particular car with kind of a niche setup. Vettel's Ferrari career was a spiral of overdriving, frustration and costly mistakes. Come to think of it, Vettel's Toro Rosso career (also a shitbox) was probably similar in this regard, he could be brilliant but also represented a Grosjean-level liability at times. I think a lot of it is probably psychological, he lost that sense of infallibility and became a (very well liked) human again, but this meant he could not find the last 1% and might spin out chasing it in vain.\n\nI wonder how Hamilton will do in the ferrari. He's a bit of an enigma: he definitely does not have that iron mind, but when the carrot is dangled, he does still find the 1%. He might be a Vettel or an Alonso at Ferrari. I can't wait!"", ""Vettel's not seen as a GOAT tier driver because he wasn't great when Ferrari had the car to challenge Mercedes in the hybrid era and then at Aston he was a shadow of his former self.\n\nHe was good in the V8 era with a good car, but he didn't show enough long term. He's like Ricciardo where he was fast when it suited him and then faded when it didn't. Drivers like Senna and Verstappen were always fast and that's why they're GOAT tier drivers."", 'He was regarded as a highly talented though flawed driver back in 2009-2010. Vettel\'s first title could have been a lot easier for him had the RB6 been reliable, but his own errors in Turkey, Hungary and Belgium showed there was room for improvement.\n\nThen, in 2011, his dominant streak still featured talk of weaknesses. Canada\'s slip-up (something that can happen to anyone, really) was often characterized as him cracking under pressure. Such chatter remained, although he silenced many critics through races like Abu Dhabi and Brazil 2012.\n\nThe ""Vettel era"" is something that you only really felt at times in 2011 and in the back half of 2013. It was never as much of a constant as Hamilton\'s dominance in 2015 and 2019-2020 displayed, irrespective of the points totals and such. Max\'s era is also different to Vettel\'s, as the ultra-dominance of 2023 and his many wins either side of that season have cemented it as an unprecedented walkover.\n\nVettel never got the legend status of Senna/Prost or what Hamilton/Verstappen will end up as. The reason ultimately is found in what happened after his titles. Beaten by Ricciardo in 2014 and exiting RBR, never getting his Ferrari WDC and being dropped in 2020 at a relatively early age.', 'Lack of longevity I would say', ""There was a time when Vettel and Hamilton were about equal, success-wise, and Seb kinda flatlined from that point, while Lewis pulled away, amassing many more great wins & three more championships. \n\nI'm sorry to say that Vettel got a touch of the checos towards the end, which damaged his reputation somewhat. \n\nI don't really get the thing about 'consecutive championships'. I'd've thought non-consecutive championships would be harder and more rare (and therefore considered the greater achievement?)""]",13,114,0.67,13,104,104,1,3,-0.010000000000000009,1
1hc4yap,Chris Piastri - 2024 Victorian Entrepreneur Award - 9News (27 Oct 24),https://www.reddit.com/r/formula1/comments/1hc4yap/chris_piastri_2024_victorian_entrepreneur_award/,2024-12-11, Video,,"['Wow, I didn’t know Piastri family was richer (cofounder of multibillion company, for what is worth) than Norris family (net worth about $205 million), interesting.\n\nAlso, interesting his father was honest about how much he invested in Piastri career up to F1 ($6.5 millions, per sources)\n\nAll in all, it’s again obvious you have it far far far easier to have a career in F1, if your family is at least multimillionaires', 'A Victorian Entrepreneur....get those children back to work!', ""Oscar's dad is a super smart dude."", ""They both have the same temperament it's funny."", 'F1 has always been a sport for the rich', '""yeh...cool dad 👍""\n\n\nAh yes that\'s how we know Oscar', 'This is a bit deflating.\n\nI thought Oscar was a normal kid - obviously not poor, but not a gazillionaire.', 'Slightly surprising that HP Tuners isn’t a Piastri sponsor, AFAIK.', ""The Piastri's seem like a quiet lot when it comes to anything outside of F1. You cannot find much on them, Like Chris Piastri is the co-founder of this company, and it seems to be a privately owned company as I couldn't find any share prices. Makes you wonder how much he still owns.""]",10,27,0.58,10,197,197,1,0,0.010000000000000009,1
1hcnf5b,F1 Owner Liberty Media’s $3.8 Billion MotoGP Deal Faces Full-Scale EU Probe,https://www.reddit.com/r/formula1/comments/1hcnf5b/f1_owner_liberty_medias_38_billion_motogp_deal/,2024-12-12, News,,"[""Article is Paywalled: here's full text. \n\n>Formula 1 owner Liberty Media Corp.’s $3.8 billion plan to buy motorcycle racing league MotoGP World Championship is set to be hit by an in-depth European Union probe, in the first escalation of a big merger case by new antitrust chief Teresa Ribera.\n\n>The Spaniard’s team is concerned the tie-up could hamper competition in broadcasting and streaming markets by drawing two giant motorsports brands under one banner, according to people familiar with the EU probe who spoke on condition of anonymity.\n\n>Officials are now readying a decision to start a so-called phase 2 probe by the current deadline of Dec. 19, they said, adding that the European Commission’s step was still in draft form and could still change.\n\n>A Liberty Media spokesperson said that the company is continuing to “work constructively” with EU regulators as part of the review and that it hopes they “will understand the dynamic nature of the market.” The Brussels-based commission declined to comment.\nLiberty Media is taking over Madrid-based MotoGP by buying its exclusive rights holder Dorna Sports with a combination of cash and shares of Series C Liberty Formula One common stock. The deal will bring one of the world’s biggest motor-racing brands and MotoGP — often described as the two-wheeled equivalent of Formula 1 — under a single roof.\n\n>In-depth EU probes typically add about 90 working days to deal reviews — but can drag on, for example if regulators stop the clock to demand further data. The EU’s antitrust arm usually demands remedies to solve competition concerns but sometimes also decide to give their unconditional approval if initial concerns are shown to be unfounded.\n\n>Heightened scrutiny can also lead to firms walking away from planned acquisitions. Under the terms of the deal, Liberty would have to pay Dorna €126 million if it ends up withdrawing from the takeover.\n\n>Regulators have previously raised concerns over drawing both sporting brands together. CVC Capital Partners Ltd. was forced to put MotoGP up for sale nearly two decades ago to gain antitrust approval from European regulators for its takeover of Formula 1 in 2005.\n\n>MotoGP is just the latest asset to be taken over by billionaire John Malone’s sprawling Liberty Media empire that already includes a wide range of media, communications and entertainment businesses such as concert promoter Live Nation Entertainment Inc.\n\n>Since buying F1 in 2016, Liberty Media has targeted key markets including the US, attempted to grow the sport’s popularity through digital streaming and struck gold with the show Drive to Survive."", ""Can't read. Could you add the text from the article?"", ""I mean, Formula cars and Motorcycles under the same roof, next thing you know Dogs and Cats will be living together - it'll be Mass Hysteria.  Gotta investigate.  (Of course, they also would investigate two snails merging their slime businesses)."", ""I hope they don't block it, sometimes competition hurts the consumer more rather than protect them.\n\nI have like 4 different subscriptions just to watch the things I used to be able to watch in the same channel."", 'You beauty! Love you for this! \n\nThis sounds like standard procedure but them hoping that the regulators will understand the dynamic nature of the market seems slightly suspect. Most likely they are able to pass the reviews, in all honesty', 'Just seems like typical EU things.', 'Whoops! I deleted my initial comment due to the article being made available in the comments section but yeah, it does seem standardised']",10,9,0.71,10,7,7,10,9,0.71,10
1hco4wd,2024 F1 Rankings by Skysports (instagram),https://www.reddit.com/r/formula1/comments/1hco4wd/2024_f1_rankings_by_skysports_instagram/,2024-12-12, Social Media,"IMO: 
Ferrari boys especially Sainz should have been rated higher
Sainz, Russell, Hamilton, and Piastri should have been rated on the same level
Tsunoda deserves at least 7
Perez doesn't deserve 3.5 though?! He was okay in the beginning of the season.
Ocon and Gasly are almost equal so the gap shouldn't be that much","[""Think Alonso and some others maybe deserve a little boost but of all the rankings I've seen, this feels like the least egregious. Obviously loads of people will still disagree but ranking drivers is hard unless they're really good or really bad"", 'Yeah Perez needs an adjustment 2.5', 'Feels like they played it pretty safe.', 'Stroll caption - ""meh""\n\nStroll photo - ""also meh""', 'Yuki 6.5 lol', ""Alonso did what he could with the car he had. No way he's only 6.5"", ""Yeah I think both Ferraris should be 0.5 higher, Leclerc was the second best driver this year imo. Maybe it's recency bias but I think Russell could be 0.5 higher as well.\n\nI think having Tsunoda only 0.5 higher than Lawson is a bit unfair, he's been quite a bit better. Also, I think Gasly and Ocon should be a bit closer together."", 'Sainz, Piastri and Hulk are all given a 7.5 rating. One of these scores is not like the other', 'Oscar and Sainz 7.5? Sainz should be at least 8. Pierre should be at least 7.5. George should be 8.5.', 'Piastri being rated the same as Sainz is obviously off... as is Alonso only getting a 6.5. What do they expect him to be able to do?']",61,59,0.86,61,54,54,61,59,0.86,61
1hcldk7,Good book about hybrid power units?,https://www.reddit.com/r/formula1/comments/1hcldk7/good_book_about_hybrid_power_units/,2024-12-12, Discussion,"My girlfriend mentioned she'd enjoy a book explaining how modern power units work. I'm not sure which one is the best pick. We're both engineers, but none of us is has done mechanical or automotive, so I'm thinking something mid-level that explains things in detail but doesn't take too much for granted would be ideal. Anyone has a good suggestion? Thanks!","[""[Heywood](https://www.amazon.com/Internal-Combustion-Engine-Fundamentals-2E/dp/1260116107/ref=sr_1_1?s=books&ie=UTF8&qid=1547249408&sr=1-1&keywords=heywood) was the standard when I went through school, but I don't know of any hybrid-specific material. \n\nFor what it's worth, I think your time would be best spent understanding the design compromises inherent in building a pure ICE power unit first, this will allow you to better understand why a hybrid approach can be beneficial. Hybrid system architecture is tightly-coupled to the ICE its being used with, so it's difficult to understand why it's implemented as-is without first understanding the shortcomings of the chose ICE architecture. I dunno if this helps."", '## Amazon Price History:\n\n**Internal Combustion Engine Fundamentals 2E**\n* Rating: ★★★★☆ 4.7\n\n* Current price: **$165.00** 👎\n* Lowest price: $112.71\n* Highest price: $165.00\n* Average price: $137.25\n\n| Month  | Low  | High | Chart             |\n|--------|------------|------------|------------------|\n| 08-2024 | $165.00     | $165.00     | ███████████████ |\n| 06-2024 | $145.61     | $145.61     | █████████████   |\n| 05-2024 | $123.59     | $123.59     | ███████████     |\n| 02-2024 | $114.76     | $121.84     | ██████████▒     |\n| 01-2024 | $112.71     | $123.10     | ██████████▒     |\n| 08-2023 | $123.37     | $127.73     | ███████████     |\n| 07-2023 | $138.21     | $138.21     | ████████████    |\n| 05-2023 | $143.08     | $165.00     | █████████████▒▒ |\n| 04-2023 | $145.60     | $165.00     | █████████████▒▒ |\n| 03-2023 | $147.53     | $165.00     | █████████████▒▒ |\n| 02-2023 | $132.00     | $165.00     | ████████████▒▒▒ |\n| 01-2023 | $145.50     | $150.00     | █████████████   |\n\nSource: [GOSH Price Tracker](https://gosh.app/?utm_source=redditbot&utm_medium=formula1&utm_campaign=2024-12-12)\n\n\n^(Bleep bleep boop. I am a bot here to serve by providing helpful price history data on products. I am not affiliated with Amazon. Upvote if this was helpful. PM to report issues or to opt-out.)']",3,2,0.71,3,2,2,3,2,0.71,3
1hcfi91,Ask r/Formula1 Anything - Daily Discussion Thread,https://www.reddit.com/r/formula1/comments/1hcfi91/ask_rformula1_anything_daily_discussion_thread/,2024-12-12,,"# Welcome to the [r/formula1](https://www.reddit.com/r/formula1/) Daily Discussion / Q&A thread.

This thread is a hub for general discussion and questions about Formula 1, that don't need threads of their own.

Are you new to Formula 1? This is the place for you. Ever wondered why it's called a lollipop man? Why the cars don't refuel during pitstops? Or when Mika will be back from his sabbatical? Ask any question you might have here, and the community will answer.

Also make sure you check out our [guide for new fans](https://www.reddit.com/r/formula1/wiki/newtof1), and our [FAQ for new fans](https://www.reddit.com/r/formula1/wiki/faq).

Are you a veteran fan, longing for the days of lollipop men, refueling during pitstops, and Mika Häkkinen? This is the place to introduce new fans to your passion and knowledge of the sport.

Remember to keep it civil and welcoming! Gatekeeping within the Daily Discussion will subject users to disciplinary action.

Have a meta question about the subreddit? Please [direct these to the moderators](https://www.reddit.com/message/compose/?to=/r/formula1) instead.","[""Inspired by the episode of Bring Back V10s which asked this - with a magic lamp, what piece of F1 memorabilia would you pick? Silly, meaningful, nonsensical, grandiose - whatever.\n\nCouple:\n\n1. The steering wheel Michael Schumacher bent when he won the 2000 driver's championship for me.\n2. the cap Rosberg flung at Hamilton, COTA 2015.\n3. In homage to The Simpsons, a photograph of Michael Schumacher signed by Ralf Schumacher.\n4. One of the now destroyed Mark Webber 2010 world champion t-shirts RBR brought to the final race of that year."", 'Anyone got a physical collection of F1 documentaries going? I just got started with the “Laps of the Gods” DVD I found on a yard sale. Really cool video showing onboards of old cars on old tracks.', ""Can you guys explain something to me regarding Norris and how F1 fans see him ?\n\nRicciardo was seen as an elite driver on the grid (at least top 5) before 2021.\n\nPiastri was/is seen as the next big thing in F1 due to his amazing junior career.\n\nNorris defeated those two drivers with a comfortable margin in each of the past 4 seasons, but I feel like he doesn't get much credit. When it comes to Ricciardo, a lot of people explained the car didn't suit his driving style or simply that he's washed. And now Piastri is being given a pass for only having 60 starts (including sprints) in F1, but you also have people saying he's not that special after all.\n\nWhy is it so hard to perhaps say that it might also have something to do with Norris being an extraordinarily quick driver ?"", 'If I remember correctly, alpine engine side blamed gearbox for a power deficit(to the wheels). Has anyone made any analysis about this statement?', 'A hypothetical question.\n\nIf Audi (and Porsche at the time) had not shown interest in F1 and, in Audi’s case, ultimately not joined, would we have had a front MGU-K?', 'This is my F1 noob question as someone who has only watched for 3 seasons now. Is it really so crazy that Lando didn’t win WDC in his first truly competitive year against the likes of Verstappen?\n\nIn other sports I watch when teams or athletes start performing on a higher level or acquire new stars there are high hopes but it wouldn’t be uncommon to not deliver that first year and I don’t think they’re so heavily criticized/considered incompetent. People expect growing pains.', 'So... um... when is Checo going to be cut by Red Bull? I have my navy blue Lawson jersey ready to go.', 'Been rewatching 2021 races since the break, it looks like the ride height was significantly higher back then, but it’s the same regs right? Maybe someone can explain to me what’s happened since.. I assume lower = more vacuum = faster', ""Okay, so here's a something I just realized.\n\nThe WDC winner (Verstappen) won 9 races this year, while the winning constructor (McLaren) won 6 races. Aside from 2021 (where WCC winner Mercedes won 9 races to Red Bull's 11, and Max's 10) how many other seasons were there where the WCC didn't win as many races as the WDC?"", 'I have improved upon my [CustomGPT](https://chatgpt.com/g/g-eaNLvlHI7-f1-regulations-assistant) I posted [at the beginning of this year](https://www.reddit.com/r/F1Technical/comments/1dtkgrz/ive_created_an_f1_regulations_assistant_using/?utm_source=share&utm_medium=web3x&utm_name=web3xcss&utm_term=1&utm_content=share_button), now it can call the api and analyse race incidents from ongoing races in real time. I hope to test it in the first race.']",2,42,0.56,2,41,41,-1,4,-0.039999999999999925,-1
1hbz8ag,The First Step to F1,https://www.reddit.com/r/formula1/comments/1hbz8ag/the_first_step_to_f1/,2024-12-11, News,Great article. Link should allow reading without subscription.,"['Just read this, really good story. Bonkers though that Schumacher or Hamilton couldn’t do this today.']",0,3,0.44,0,2,2,0,0,0.0,0
